,company_name,company_id,review_text
227,(주)프레인글로벌,10514,"대행사 특성상 진리의 팀바이팀은 어쩔 수 없는 상황이며, 물을 흐리는 일부 팀이 있어 보기 안좋음..."
228,(주)프레인글로벌,10514,그러나 팀바팀 케바케. 고인물의 매너리즘은 여전한 듯. 어쩌겠나 지분 갖고 있으면 떠나기도 쉽지 않은걸.
229,(주)프레인글로벌,10514,복지와 연봉이 최대 단점인 것 같음 성격이 다소 날카로운 분들이 많이 다닌다는 점
230,(주)프레인글로벌,10514,치킨 한마리 사먹기도 고민스러운 수준의 업계 최하위 연봉. 그래서 워라밸 안지켜지는 팀에 있으면 현타 제대로 옴. 현금보유율이랑 순매출 높은거 뻔히 아는데 매년 실적 핑계대면서 연봉 동결함. 중간관리자급이 되면 갑자기 실무를 안 하려고 하는 책임회피형 직원들의 향연. 미혼인 직원은 체감할 수 없는 사내 복지 시스템. 모든 복지가 애 딸린 유부들을 위해 존재함. 직장생활 얇고 길게 가고 싶다? 애 있는 유부다? 무조건 오세요.
231,(주)프레인글로벌,10514,연봉이 짜다. 인상률도 낮다. 한 몸 바쳐 일해도 연봉협상시 반영되지 않는다.
232,(주)프레인글로벌,10514,"디지털 대세인 요즘 흐름과 역행하는 언론 홍보 비중이 아직도 높음, 최근에는 디지털 사업 보다도 굿즈 위주의 사업 영역 확장 중, 디지털 홍보 보단 언론 홍보를 꿈꾸는 자에게만 유용한 경험이 될 수도 있음"
233,(주)프레인글로벌,10514,일이 많은 것 같았어요. 오래 다니는 분들이 많아보이지는 않았습니다.
234,(주)프레인글로벌,10514,"직급 체계가 불분명함, 연차 채우면 대다수 직급이 올라가는 경우 많아 실제 업무 능력은 아리송한 경우 많음 팀 성향에 따라"
235,(주)프레인글로벌,10514,고인물 그사세 몇몇만 신나는 조직 미치도록 일 집어넣음 인사이트없는 임원 가끔 의문드는 승진자 정치질?
236,(주)프레인글로벌,10514,복지가 없는 것 같음 사람은 많은데 편의시설도 없고 자리도 부족해 보임 그리고 야근 수당 없다고 들었음
237,(주)프레인글로벌,10514,기혼여성을 위한 약소한 복지 이외에는 아무것도 없음 성과급 없다고 봐도 무방 팀바이팀 개인주의 심함(누가 무슨 일을 어떻게 하는지 알지도 못함) 연봉 상승률 아예 기대조차 말아야함 수십명이 한층에서 일하는데 여자화장실 칸은 고작 2개임 미어터짐
238,(주)프레인글로벌,10514,홍보대행사가 그렇듯 여초회사 특유의 눈치보이는 것들이 있다.
239,(주)프레인글로벌,10514,대부분의 직원이 젊은 편인데 기혼자 중심의 복지가 아쉬움. 더불어 팀별로 클라이언트를 담당하게 되는 것은 어쩔 수 없지만 시너지가 날 수 있는 인력배치가 이뤄졌으면 하는 바람
240,(주)프레인글로벌,10514,능력도 없는데다 실무진 야근하든말든 나몰라라 퇴근하는 철면피 팀장들 다수. 그리고 그들을 멋지게 본받으며 일은 죄다 미루고 회사 편하게 다니는 과차장급이 환장의 콜라보를 펼치고 있으니 이거야말로 주니어갈며 얼른 나가라 등떠미는 격. 여기 오래있으면 다 저렇게되나 싶은 두려움에 서둘러 떠나는 사람들이 진정한 승자. 연봉과 반비례하며 하루하루 늘어가는 화병은 덤.
241,(주)프레인글로벌,10514,팀바팀이지만 팀별 격차가 있는편. 인정받는 팀에 소속되면 괜찮지만 그렿지 않다면 이직도 고민되어짐
242,(주)프레인글로벌,10514,"사내정치를 너무합니다 기획인턴이라고 뽑아놓고 디자인, 영상 다돌리기 팀바팀 야근, 주말출근.. 워라밸은없음"
243,(주)프레인글로벌,10514,연봉과 복지가 가장 큰 단점.일 못하는 직원들이 주구장창 남아있는 회사.
244,(주)프레인글로벌,10514,"중소기업의 복지: 추석선물, 법에 규정된 휴가 끝임. 떡값이나 상여금 등 주변 일반 기업다니는 친구들이 얘기하는 걸 우린 기대할 수 없음. 연봉 인상률 쥐꼬리임. 초봉도 적은데 맨날 높은줄 암. 엄청 잘해도 10프로 인상도 안됨. 평범하게 하면 3프로임. 그러면서 생색내서 이해할 수가 없음. 공채보다 경력직에게 연봉 우대가 심해서 황당함."
245,(주)프레인글로벌,10514,팀을 잘 만나야 근무 환경이 좋아짐. 잘못 만나면 매일 야근이 이어짐
246,(주)프레인글로벌,10514,경력직 검증이고 뭐고 급히 충원하느라 작은 회사에서 오신 함량미달 차부장급이 주니어를 맥빠지게 한다. 일안하고 감정에만 치중하는 아주머니들이 상당히 골때림. 똘똘한 주니어들을 붙잡아두는 수단은 오직 가스라이팅 뿐.
247,(주)프레인글로벌,10514,"업무/분위기 등 팀별 편차 큼, 공채 위주의 사내 분위기, 평균 수준의 복지 및 인프라"
248,(주)프레인글로벌,10514,"야근 식대 지원해주지만 야근 수당은 없음, 홍보 회사 특성 상 야근 많음, 명성 대비 임금은 적은 편, 특별한 복지는 없음, 휴가 소진 장려해 주었으면"
249,(주)프레인글로벌,10514,"인원에 비해 임원급이 기형적으로 많음 제일 큰 규모의 홍보대행사라고는 하지만 경험할 수 있는 업무는 한정됨 거의 언론 홍보에만 치중돼 있음 다양한 업무 스콥 경험 불가능 디지털, 매거진 피알은 거의 안한다고 해도 무방"
250,(주)프레인글로벌,10514,"업계 대비 연봉 낮음, 성과에 따른 인센티브 거의 없다고 보면 되고 이직률 높음. 인력관리나 대우가 좋지 않음"
251,(주)프레인글로벌,10514,파트너 팀바팀으로 워라벨 다름... 잘못걸리면 개고생함
252,(주)프레인글로벌,10514,급여가 낮은 듯하다 급여 인상폭도 타 기업대비.적은 듯 하다
253,(주)프레인글로벌,10514,요즘 트렌드에 맞는 복지가 없음 임원들이 무능력하고 본인 밥그릇에만 관심있는듯 함
254,(주)프레인글로벌,10514,연봉 적음. 인상률 적음. 기혼자에 치중된 복지. 팀바팀으로 맨날 야근하는 팀 있음. 팀에 따라 중간 다리급에 팀 매출 압박 주는 곳도 더러 있음.
255,(주)프레인글로벌,10514,줄타기 필요 경력직 입사자와 공채의 차이 제대로 일 배울 사람 없음
256,(주)프레인글로벌,10514,짧은 기간의 인턴십으로 전반적인 회사의 분위기를 파악하는데 어려움
257,(주)프레인글로벌,10514,"적은 연봉 상승폭. 부서 및 담당 클라이언트에 따라 업무 강도 및 조직 분위기가 매우 매우 다름. 따라서 사내 리뷰보다는 각각의 팀 정보를 파악하는 것이 더 중요할 듯. 그렇기 때문에 워라밸 150%실현하는 직원들과, 매일 야근하며 극한의 업무 강도를 맛보는 직원들이 공존하는 것임"
258,(주)프레인글로벌,10514,정체와 복지. 미혼자에 대한 복지가 너무 미비한 느낌. 기혼자들은 복지가 좋은데. 미혼자들은 그냥 1년 거쳐가는 곳 처럼 느껴지는 곳 팀바팀 분위기 다 다름
259,(주)프레인글로벌,10514,단순 보고를 위한 문서작업이 많아 비효율적. 복지 제도가 있긴 하나 실제로 쓰기에는 조금 힘듬. 팀바팀이지만 연차쓰는 거 눈치줌. 야근 당연시하게 생각
260,(주)프레인글로벌,10514,인턴 제외 사원급 이상 야근 굉장히 많은데 야근수당 전혀 없음. 집 갈때 택시비는 지원함.
261,(주)프레인글로벌,10514,주먹구구식 업무 진행이 잦음 지나치게 개개인의 케파에 기대는 기업문화 공채 중심 문화
262,(주)프레인글로벌,10514,기업 규모는 크지만 직원이 느끼는 체감은 팀바팀이 심함
263,(주)프레인글로벌,10514,"팀별로 업무 강도 차이가 심함. 공채 출신을 우대해주려고는 하나, 1-2년 안에 공채 절반 이상이 회사를 떠나는 아이러니."
264,(주)프레인글로벌,10514,매너리즘에 쩔어있는 월루들이 곳곳에 포진. 본인 업무 그럭저럭하는 사람들도 물론 있지만 대부분 전형적인 직장인 마인드. 연봉 짜고 및 복지랄게 없음.
265,(주)프레인글로벌,10514,"팀바팀으로 분위기가 완전다름, 다른PR회사에 비해 연봉이 다소 적음, 사무실이 비좁음"
266,(주)프레인글로벌,10514,"모든 여초 회사의 단점을 다 가지고 있는 곳. 팀 바이 팀이 너무 심하며, 이 부분이 연봉 등에도 영향을 준다. 파트너 및 팀장에 따라 일이 많이 결정되며, 팀원 개개인의 의사 반영도가 낮음"
267,(주)프레인글로벌,10514,"역시 진리의 팀바팀. 업무량이 팀마다 다르며, 팀 내에서도 크게 차이가 나는 듯. 회사 규모는 큰 편이나 작은 회사들이 모여 있는 느낌. 육아 관련 복지가 아닌 이상 회사 차원에서 내게 무얼 제공하는지 잘 모르겠다."
268,(주)프레인글로벌,10514,"비합리적인 인사 평가 제도, 복지라고 하기 어려운 복지제도, 조금만 리스크가 있어도 도전하지 않는 임원들, 문제점 파악 제대로 못하는 임원들... 임원들이 문제임"
269,(주)프레인글로벌,10514,-프로젝트&팀바이팀에 따라 야근 복불복에 걸릴 수 있음
270,(주)프레인글로벌,10514,클리핑실은 특성상 일찍 출근해야 한다는 점...? 오전 7시쯤 출근하는게 조금 힘들때도 있었음
271,(주)프레인글로벌,10514,연봉이 회사규모에 비해 너무 적다 부서에 따라 굉장히 일이 많은 곳도 있음
272,(주)프레인글로벌,10514,"대학신입기준 매우 낮은 연봉, 팀바이팀 업무의불균형, 팀에따라 야근을 당연시여기는 분위기, 쓸데없는 정치질을 하고 본인들만의 친목을 만드는 일부의 사람들.."
273,(주)프레인글로벌,10514,부바부겠고 또한 이런 것을 선호할 수 있겠지만 부서별로 묶여있어도 맡은 프로젝트가 다르면 소통의 기회가 적었음  가장 큰 단점은 신입을 많이 뽑고 또한 그분들이 많이 퇴사하심.. 아마 일이 빡세서 일듯 + 급여가 많이 낮음
274,(주)프레인글로벌,10514,쥐꼬리만한 월급. 이정도 강도 이정도 능력이면 다른 곳은 최소 1000만원 더 받을듯
275,(주)프레인글로벌,10514,"과거의 영광 속에서 순진한 업계 신입들과 3~4년차 애매한 경력직들의 환상으로 존립하고 있는 대행사. 아예 다른 회사라 해도 무방할 정도로 팀별 조직문화가 다르며, 구성원들의 성향과 업무역량도 천차만별임. 인사적체된 임원진들은 인력운영에 무관심하고 그들간의 반목과 불화, 정치질에 힘을 쏟기 때문에 직원들이 소속감을 느끼고 규합될리 만무.  10명 이하 대행사에서 하듯이 이곳 역시 사원, 대리에게 과도한 오너십을 부여한다. 반면 과차장급부터는 제 역할을 하던말던 수수방관. 상부에 아첨하고 자기과시욕이 매우 강한 전형적인 여우 스타일의 직원들이 인정받는 조직으로, 묵묵히 성실하게 일하는 사람들은 일을 하면 할수록 후려치기 당함. 개인주의로 둔갑된 무한이기주의가 팽배한 집단으로, 어느정도 무시못할 연차가 쌓인 기혼 경력직이 독고다이로 월루하며 다니기 좋은 기업."
276,(주)프레인글로벌,10514,"단점 1 연봉, 단점2 연봉, 단점 3 연봉 연봉 낮음, 직급수당, 상여, 인센 없음. 아 인센이라며 봉투 주긴 하는데 너무 적어서 인센이라 말하기 싫음.  고인물이 많음. 아래만 계속 바뀜 디지털 인력 부족"
277,(주)프레인글로벌,10514,"대행사라는 한계로, 실제 진행하는 업무가 클라이언트 실무자의 의사에 따라 좌지우지됨"
278,(주)프레인글로벌,10514,고인물 천지라 뭘 어찌하든 안바뀜. 절대 안바뀜. 그냥 고생고생해서 경력쌓고 이직하는게 답일 수도
279,(주)프레인글로벌,10514,"규모나 하는 일에 비해 월급이 많지 않음. 그에 비해 공채 시험은 어마무시한 깐깐함을 자랑.  야근이 많은 직종인데도 야근수당이 없어 보람이 크지 않음. 팀바이팀이지만 야근 하는 사람만 주구장창 야근.  미혼이 누릴 수 있는 복지가 적음. 아니, 거의 없다고 보면 될 듯."
280,(주)프레인글로벌,10514,연봉이 너무 낮고. 팀바팀으로 워라밸 측정할 수 있음.
281,(주)프레인글로벌,10514,"팀마다 격차가 큼. 일하는 스타일부터 클라이언트 종류나 규모까지 팀별 격차가 커서 누구는 행복한 회사 생활, 누구는 힘든 회사생활이 될 수 있음"
282,(주)프레인글로벌,10514,"전반적으로 자유롭고 활기찬 분위기 속에 은근 꼰대 마인드 경영진. 나의 5년 후, 10년 후가 저 모습일까 하는 고민에 이직률이 높음. 원년멤버에 대한 의존"
283,(주)프레인글로벌,10514,굳이 왜 프레인에서 일해야하는가에 대한 답이 없음. 급하게 경력을 쌓아야하는 케이스라면 인정하지만 오래 다니기 좋은 직장은 절대 아닌듯
284,(주)프레인글로벌,10514,노는 사람 너무 많다. 일도 하는 사람만 함. 조금더 직원들 신경써주시면 이직률이 낮지 않을까여
285,(주)프레인글로벌,10514,연봉이 업계의 비슷한 규모의 에이전시 대비 너무 낮았습니다. 그리고 설립자의 마인드가... 쿨한척 하지만 하나도 안쿨하고 합리적인척 하지만 하나도 안합리적인 면이 많아 스트레스 받을때가 많습니다....
286,(주)프레인글로벌,10514,내가 속한 회사에 대한 애정이 있는 직원이 안보임. 회사에 자부심을 가지고 일을 할 수 있는 분위기면 만족했을텐데 그런 분위기 전혀 아님. 다들 언제 튈까 고민중인 느낌. 단순히 중소기업이라서? 라고 할 문제가 아닌듯. 홍보 일을 좋아하는 사람이면 몰라도 회사 때문에 다닐 맘은 안들게 해주는 회사라는게 가장 큰 단점.
287,(주)프레인글로벌,10514,"명성에 못 미치는 연봉, 개인주의적인 분위기로 때로는 경력입사자들은 조직 적응하기 쉽지 않음"
288,(주)프레인글로벌,10514,일부 팀 제외하고 연봉이 높지 않음. 매출 대비해서도 낮은편
289,(주)프레인글로벌,10514,"무능력하고 게으른 과차장급 인력이 많다. 실무는 사원, 대리 중심으로 인력을 갈아 넣고 PM처럼 일하기를 요구하는 분위기. 연봉적은 실무자들에게는 오너십을 강조하면서 정작 PM역할을 해야할 사람은 무책임하거나 역량이 부족해 강건너 불구경."
290,(주)프레인글로벌,10514,"경직된 분위기, 업무량 많아 저녁약속 불가능, 기혼자가 아니면 체감할 수 없는 복지"
291,(주)프레인글로벌,10514,전반적인 복지가 좀 아쉽다고 느껴졌지만.. 큰 대기업 아닌 이상 이 정도면 준수한 편인 것 같긴 합니다. 다만 행정적인 면에서 주먹구구식인 것처럼 느껴질 수도 있어요.
292,(주)프레인글로벌,10514,회사 내 정치판이 있고 보여주기식 복지가 많음 위아래가 없고 잘보이기식 아부만 판을 침
293,(주)프레인글로벌,10514,대행사 특성일 수 있지만 같은 프레인 안에서도 팀 간 차이가 심함
294,(주)프레인글로벌,10514,홍보대행사들 특징이겠지만 클라이언트들이 요구하는 것들을 너무 다 들어준다. 팀원들이 죽어가는거는 신경안쓰고 클라이언트 요구만 다 맞춰주니 대외적인 이미지는 좋겠지만 내부 불만은 커진다.
295,(주)프레인글로벌,10514,"원하는 클라이언트를 담당하기 쉽지 않음. 비딩에 대한 압박 있음. 상사, 팀원들에 따라 팀 분위기나 커리어 개발에 있어서 지장이 있을수 있음. 회사 네임밸류 치고 연봉은 제각각."
296,(주)프레인글로벌,10514,"복지가 없다는 것이 문제였다. 트렌드 쫓는 직업이기에 도서 포인트라도 주려나 했는데 그런 소소한 즐거움 조차 없음. 추석, 설에도 상여금 없이 선물만 준다.(이마저도 자기가 집에 들고 가야함) 월급이 정말 적음. 대기업에서 어시스턴트로 일하는 친구랑 월급이 같은 수준... 돈을 많이 벌고 싶다면 이곳으로는 발도 들여서는 안됨. 한국에는 pr업체를 동등한 위치로 놓고 일하기보다 심부름업체처럼 부리는 기업들이 종종 있어서 현타를 맞을 수 있음."
297,(주)프레인글로벌,10514,다소 부족한 급여 및 복지제도. 야근 수당이 있었으면 좋겠음
298,(주)프레인글로벌,10514,탑 다운 형태의 업무가 많음. 팀이나 상사 잘못 만나면 진짜 고생함 (내가 그랬음) 원래 홍보 하고 싶었던 사람이면 괜찮을 수 있으나 본인은 원래 직종이 홍보가 아니라서 인턴만 하고 나옴.
299,(주)프레인글로벌,10514,이름에 비해 연봉이 높진 않음. 직원 복지라고 할만한게 많지 않음.
300,(주)프레인글로벌,10514,"생각보다 많이 조용했던 곳, 사원들 오피스가 너무 개방형이여서 살짝 부담스러운점"
301,(주)프레인글로벌,10514,들어오는 프로젝트 받아먹는데 만족. 그래도 프레인 네임밸류로 끊임없이 고객사는 유지되는 편. 낮은 급여.
302,(주)프레인글로벌,10514,"직원수 대비 임원수가 너무 많고, 여직원들이 많고 기혼여성들은 출산/육아휴직 및 육아보조금 등 혜택을 받지만 미혼 여성이 누릴 수 있는 복지가 너무 없다고 생각됨."
303,(주)프레인글로벌,10514,당시에는 급여 수준이 낮은 편으로 알고 있으나 개발과 운영이 현저히 나뉘어 있다는 점이 굳이 뽑자면 기업의 단점이라고 볼 수 있음.
304,(주)프레인글로벌,10514,에이전시는 에이전시 일 뿐. 낮은 연봉과 열정 페이 그리고 야근이 많음.
305,(주)프레인글로벌,10514,팀 바이 팀이다. 팀 잘 만나면 스케일 큰 플젝을 해볼 수 있다. 그렇지 못하면 짜치는 것만 계속 해서 경력에 크게 도움 안됌. 일하는 사람만 계속 일하고 아닌 사람은 워라밸이 철저하게 지켜진다.
306,(주)프레인글로벌,10514,"적은 연봉, 많은 야근, 오픈된 사무실이라 시끄러움, 노예가 될 뿐이다"
307,(주)프레인글로벌,10514,사내문화가 지극히 개인주의적이라서 경력사원들이 적응하기 힘든 분위기.
308,(주)프레인글로벌,10514,"인사평가 기준을 알 수 없다. 위에 얘기한 장점 말곤 더이상의 장점이 없다. 복지, 연봉 다 짜다, 매우 짜다"
309,(주)프레인글로벌,10514,팀바이팀이겠지만 전체적으로 프로젝트 진행에 체계성이 떨어져서 업무 진행 방식이 비효율적이라고 느끼는 경우가 꽤 많다.
310,(주)프레인글로벌,10514,부서별로 색깔이 너무 다름. 공채로 들어가지 않으면 홀로서기 같은 느낌도 있고
311,(주)프레인글로벌,10514,"출퇴근 시간이 정해져 있어도...야근을 밥먹듯이 해야함....워라벨이 힘들어, 힘들어."
312,(주)프레인글로벌,10514,워라밸은 팀운명에 따라 결정. 개인능력과 상관없는 동일 연봉체계
313,(주)프레인글로벌,10514,"연봉 최악. 협상률 최저 수준으로 과장이어도 다른 회사 대리 정도의 수준. 일하는 사람, 팀만 일하는 구조"
314,(주)프레인글로벌,10514,워라밸을 절대 지킬수 없음. 부서와 클라이언트에 따라 다르지만 업무 강도가 연봉대비 상당히 높음
315,(주)프레인글로벌,10514,고객사는 많으나 팀을 잘 배정받았을 경우. 팀을 잘 못 만나면 같은 연차에도 불구 그 갭이 커짐. 직원들의 고충에 관심없고 소모적으로 일 시키는 편
316,(주)프레인글로벌,10514,비효율적. 전문성을키우긴 힘든 업무내용. 주먹구구식이많고 분위기가 가족적이라던지 그러진않는듯..
317,(주)프레인글로벌,10514,팀바이팀 워라밸 극악인 곳이있고 워라밸이 좋은 곳도 있음 차이가 심함 팀에서 오래된 클라이언트를 갖고 있고 그걸 맡게된 경우 쭉 그것만 하게 될 수 있음
318,(주)프레인글로벌,10514,연봉 낮고 직급 수당 없음. 인센도 없음 결혼하고 돈 욕심 없이 어느정도 벌면 된다는 사람이 다니기 좋은 회사
319,(주)프레인글로벌,10514,팀별 분위기가 천차만별. 야근하는 팀은 맨날 야근함. 클라이언트 별 업무 강도가 매우 다름.
320,(주)프레인글로벌,10514,업무를 열심히 하려해도 위에서는 하는 업무에 차이를 심하게 보임 사람의욕을 바닥으로 만들고 일하기 싫게 안듬
321,(주)프레인글로벌,10514,"보고서 등 문서 작업이 많고 기자, 클라이언트 등의 까다로운 요구 사항을 잘 수용할 수 있어야 함. 업무 환경 상 야근이 많아 체력이 뒷받침 되어야 함."
322,(주)프레인글로벌,10514,경력과 공채로 은근 갈리는 느낌. 사람이 금방 나가고 금방 채워지는 회사
323,(주)프레인글로벌,10514,규모에 비해 연봉이 낮은 편? 업계 평균 수준으로 보이는데 규모와 명성에 맞지 않음. 경영진의 역할이 모호함... 저 분들은 무슨 일을 하실까? 궁금함
324,(주)프레인글로벌,10514,"연봉은 높지 않고, 클라이언트들이 주로 대기업이다보니 까다롭고 갑질이 심각해서 스트레스가 높은 편, 개인주의가 심해서 혼밥러들도 많음"
325,(주)프레인글로벌,10514,일정 규모 이상의 pr대행사 중 연봉 최하&인상률 최하에 특수한 팀 제외하고는 인센티브도 없다. 회사가 내실이나 사원 복지보다 외부로 보여지는 이미지에 더 치중하는 것 같음. 고객사별로 업무량 차이가 매우 크지만 조율 가능성은 적어 그냥 복불복.
326,(주)프레인글로벌,10514,클리핑 아르바이트 당시 새벽에 일찍 나오는 일이 힘들었음
327,(주)프레인글로벌,10514,"업무량은 적다고 할 수 없으나, 사람을 갉아먹을 정도로 이미 일이 많은 사람에게 일을 더 주지는 않음.  사내 인트라넷에 존재하는 이메일 시스템을 사용하는데, 상당히 불편.  사내 서버가 존재하지 않아 지식을 습득할 예전 자료가 없음."
328,(주)프레인글로벌,10514,"위의 장점을 제외한 모든 것. 복지는 전무하고, 업계 1위라면서 연봉은 낮다. 팀별로 편차가 커서 분위기도, 상사의 능력도, 업무의 내용도 천차만별. 고인물이 많아서 발전이 없다. 야근도 일상. 업계 자체가 붕괴되고 있는데 과거의 영광에 매인 윗사람들이 발전없이 인력만 갈아넣어서 회사를 굴러가게 하고 있다. 매년 퇴사자 수를 보면서 각성이 필요한데 전혀 그럴 생각이 없어 보임."
329,(주)프레인글로벌,10514,팀바이팀이지만 야근 하는 팀은 야근이 잦다. 장점이 많지만 장점을 크게 퇴색시키는 낮은 연봉
330,(주)프레인글로벌,10514,작업 처리에서 비효율적인 부분들이 많았음. 복지가 매우 적음.
331,(주)프레인글로벌,10514,팀바팀이 너무 심함. 팀별로 업무량이 달라 워라밸이 천차만별. 팀을 잘만나면 칼퇴근이지만 아니라면 야근은 당연함. 팀에서도 클라이언트에 따라 업무가 과중되어 있기 때문에 그저 운임.
332,(주)프레인글로벌,10514,보수가 적고 갑 기업의 횡포에 어쩔 수 없이 쭈구리되는 을.
333,(주)프레인글로벌,10514,사내 정치문화가 심각하다. 초기 멤버들이 그대로 고여 있기에 발전이 더디다.
334,(주)프레인글로벌,10514,"1. 높은 퇴사율 2. 높은 업무량 3. 직원을 소모품으로 여김, 4. 광고,PR쪽 1위 회사라고 생각하는 사장의 마인드인지는 모르겠지만 급여도 상상이상으로 낮고, 피부로 와닿는 복지는 하나도 없음. 있어도 탄력근무제? 5. 포괄연봉제임. 이건 아마 말을 안해줄텐데 포괄연봉제임!! 반드시 이 점 확인하고 입사여부 결정하세요. 6."
335,(주)프레인글로벌,10514,의외로 분위기가 수직적이다. 상사 잘 못 만나면... 노답이었다.
336,(주)프레인글로벌,10514,AE에게는 그게 그나마 장점인데 경영지원쪽은 장점이 없다. 그 무엇도 배울 수 없고 자신의 지식을 소모하면서 버티는 곳이다.
337,(주)프레인글로벌,10514,급여 인상폭이 평균적으로 높은 편은 아님. 업무가 몰리는 사람들에게만 몰림.
338,(주)프레인글로벌,10514,인턴이였지만 고스펙자들이 많아서 승진할때 경쟁률이 치열해보이고 몇몇은 명문대아니면 좀 안좋게보는 시선도 있었음. 가끔씩 야근할때는 새벽까지 할때도 있음
