,company_name,company_id,review_text
420,(주)프레인글로벌,10514,"대행사답게 최고 을에 위치해있으며, 복지 무, 급여 역시 짜다. 3년 이하까지 작은 연봉 참고 다닐 수 있다면 추천."
421,(주)프레인글로벌,10514,"이름만큼 엄청난 퍼포먼스를 보이기에는 임원진 등의 활약이 매우 미미하며, 가족기업이 아님에도 가장 오랜기간 임원진들이 변하지 않는 곳으로 새로운 사람들이 활약하기에 굉장히 폐쇄적인 분위기."
422,(주)프레인글로벌,10514,"팀별로 분위기가 다르고, 어떤 상사 만나느냐에 따라 일의 강도 달라짐 / 여준영 대표가 만들어 놓은 기업 이미지를 생각하고 오면 실망 할 수 있음 / 일반 PR회사와 비슷함 특별할 거 없음"
423,(주)프레인글로벌,10514,인턴직이라 칼퇴했지만 다른 사람들의 퇴근 시간은 알 수 없었다... 새벽 퇴근하는 분들도 있는 듯. 물론 매일 그렇지는 않다지만 업종 특성상 야근은 어쩔 수 없는 듯 하다.
424,(주)프레인글로벌,10514,"형편없는 복지와 급여. 부서간 이기주의 심함. 차부장급은 정말 이직못하는 사람들만 남아있는지, 심각하게 역량 떨어짐. 이미 업계서도 전문성 떨어져서 싼맛에 손과발 용 대행사 필요할때 쓰는용으로 굳어짐. 입찰할때도 실제로 가격 싸게써서 가격 경쟁력으로 승부수 띄우고, 내부인건비를 쥐어짜서 이윤 남기는 전략 쓰는 회사. 싸게 써서 팔고, 대신 원가 확 줄여서 이윤 남긴다고 보면됨."
425,(주)프레인글로벌,10514,팀을 잘못만나면 답이 없음 일이 밀리면 야근은 당연하고 특히 공채로 입사하면 잡다하게 해야할 일이 많음
426,(주)프레인글로벌,10514,프레인의 단점보다는 홍보 회사 자체의 굴레. 야근 또 야근. 클라이언트도 케바케. 아무리 좋아도 클라이언트는 클라이언트.
427,(주)프레인글로벌,10514,매년 운영방침이 바뀜. 앞으로는 이렇게 할거다- 그리고 나서 일년지나면 또 바뀜.
428,(주)프레인글로벌,10514,너무 작업량이 많고 갑자기 성장한 회사기 때문에 의외로 소통이 잘 안되고 있음을 느낄 때가 있음
429,(주)프레인글로벌,10514,초봉이 작지만 회사 사정이 좋으면 인상폭이 높음 성격 이상한 직원들이 꽤 많았음
430,(주)프레인글로벌,10514,"-터무니없이 비현실적으로 낮은 연봉(자취하는 사람들은 돈을 절대로 모을 수가 없음), 현직원중 한명이 모신문사 인터뷰에서 회사의 장점을 '높은 연봉인상률'로 꼽았던데 직원들이 모두 거품물 수준의 거짓말임.  -'대행사'이기에 무조건 을이 될수 밖에 없어서 서로 똘똘 뭉치는 분위기가 되어야하는데, 클라이언트에게 받은 갑질을 아랫사람에게 더심한 갑질로 물려주는 상사들이 많음.  -월급루팡자가 너무 많아서 셀수도 없음..특히 과장급이상"
431,(주)프레인글로벌,10514,"다만, 일의 배분에서는 운이 따라주어야할 정도로 어떤 쪽에 잘 못 걸리면 일이 몰아서 오는 경우가 생김. 복불복이 좀 있음"
432,(주)프레인글로벌,10514,1.불규칙한 업무 시간과 업무 강도 2.여자 비율이 많은 여초회사 특유의 개인주의적 분위기 3.낮은 연봉
433,(주)프레인글로벌,10514,팀이나 맡은 클라이언트에 따라 업무량 차이가 너무 큼. 인력 관리가 잘 되지 않음. 낮은 연봉 상승률
434,(주)프레인글로벌,10514,대행사 특성상 제안 준비할 때는 바쁜편 역에서 거리가 좀 있음
435,(주)프레인글로벌,10514,"업무 대비 낮은 연봉, 에이전시 특성상 이직률이 높아 조직의 불안정함이 존재"
436,(주)프레인글로벌,10514,정통PR에는 능하지만 다양한 매체에는 잘 대응하지 못하고 있는 듯. 가지를 뻗어나갈 필요가 있다고 생각된다.
437,(주)프레인글로벌,10514,"팀바팀, 사바사가 무척 커서 어떤 팀에서 어떤 사수나 사람을 만나느냐에 따라 늘 반복되는, 기계적인 업무를 담당할 수 있음"
438,(주)프레인글로벌,10514,"박봉에 복지제도랄것이 거의 없다. 야근이 잦지만 당연히 야근수당 따위는 없음. 업무강도 매우 셈. 그러나 이 또한 복불복. 어떠한 팀을 만나느냐에 따라서 달라지며, 팀장 성격에 따라 많이 좌우되는 분위기."
439,(주)프레인글로벌,10514,"다른 대형 대행사에 비해 보수가 낮은 편이고 직원복지가 없음, 공채와 경력직 간 차별 존재"
440,(주)프레인글로벌,10514,에이전시 특성 때문에 야근이 많고 팀 마다 편차가 심한 편
441,(주)프레인글로벌,10514,유동적인 근무가 가능하지 않아서 효율성이 떨어지는 측면이 있다. 이런 점이 개선된다면 더욱 좋을 것 같다.
442,(주)프레인글로벌,10514,홍보 회사라 그런지 회사 스스로 홍보를 잘한다. 홍보하는 내용에는 거짓은 없지만 참 잘 포장한다는 생각이 든다 ㅎㅎ (그만큼 클라이언트 홍보도 잘하지만 ㅎㅎ) 연봉은 짠 편.
443,(주)프레인글로벌,10514,공채 문화가 강하므로 일반 경력직은 적응하기 힘들수도 있습니다. 팀원이 많아 사원급이 프로젝트를 리드하기는 어렵습니다.
444,(주)프레인글로벌,10514,작은 규모 홍보대행사 대비 역동성이 떨어지는 느낌이다. 실력으로 인정받는 것보다 대기업과 같이 연차로 차근차근 올라가는 올라가는 느낌. 물론 이런 분위기가 타 홍보대행사 대비 안정감을 더 줄 수 있기 때문에 장단점이 있다. 연봉은 생각보다 낮은 편이다.
445,(주)프레인글로벌,10514,매체 경계선이 없어지는 시대에 경쟁피티에서 종합광고대행사 그리고 디지털 에이전시들과 겨루기 위해서는 기존 강점인 PR에 시너지를 더해줄수 있는 디지털 쪽의 다양한 역량강화가 필요하다.
446,(주)프레인글로벌,10514,"복지와 급여, 사내분위기 등의 이유로 만족하지 않는 사람들이 많은 것 같고 그 때문인지 직원들의 이직률이 높은 것 같습니다."
447,(주)프레인글로벌,10514,무엇보다 짠 연봉. 직원들만을 위한 복리후생이 거의 없다는게 함정. 그 흔한 명절 세트도 없음. 외부에 보여주기에 급급함
448,(주)프레인글로벌,10514,홍보업계가그럴듯업무가빡쎄고일이많음 다양한업무는해볼수있지만인원수가많아사람들과친해지기힘듬
449,(주)프레인글로벌,10514,이 곳만의 단점은 아니지만 업계 자체의 연봉이 낮은 편.
450,(주)프레인글로벌,10514,복지 제도 많지/좋지 않음. 특근 및 야근비 없음. (식대는 제공) 연봉이 낮음. 진상 클라이언트 응대. 체계적으로 일을 가르쳐주는 분위기는 아니며 스스로 개척해야 함. 임직원 역량 교육에 크게 신경쓰진 않는 듯.
451,(주)프레인글로벌,10514,"인사체계, 연봉체계가 시스템화 돼있지 않고 비합리적. 회사의 제도에 있어 직원들의 합의나 이해는 전혀 반영되지 않음. 야근이 많으나 야근 수당은 없음. 업무의 양이나 성과에 따른 인센티브가 없어 열심히 일할 동기를 찾기 어려움. 개방적인듯 보이나 사실은 매우 보수적인 집단. 창립자 한 사람의 영향력이 너무 막강해 그에 수반하는 다양한 부작용들이 있음. 공채들은 적응하기 쉽지만 경력직이 적응하기엔 제약이 많은곳."
452,(주)프레인글로벌,10514,개인의 관심이나 특장점을 딱히 고려하지 않은 업무 배치. 낮은 연봉과 거의 없다시피 한 복지 혜택. 불명확한 성과 보상 기준. 그리고 작은 회사일수록 정치가 중요하다는 것을 깨달을 수 있음.
453,(주)프레인글로벌,10514,"PR이 메인이기 때문에, PR외 부서는 한직이 될 수 있습니다. 야근 등 일이 터프하고 많을 수 있죠. 그러나 그만큼 성장할 수 있는 기회가 열려있습니다. 열정페이는 아니죠."
454,(주)프레인글로벌,10514,"하지만, 기존의 홍보에 강점이 있는 회사로, 디지털시대에 충분히 대비를 못하고 있는 듯 합니다. 디지털 마케팅 회사가 아니라 온라인 등 디지털 마케팅 등에는 약합니다."
455,(주)프레인글로벌,10514,과도한 여초현상으로 분위기가 색다름.... 큰 성장을 꿈꾸는 이들이 많지 않음 사내정치로 인한 인재손실
456,(주)프레인글로벌,10514,"급여가 아쉽다. 그런데 업계 전반적인 수준에 비하면 양호하다고 알고 있다. 개방적인 조직문화라고 했지만, 사실 조직이 커지면서 어쩔 수 없는 위계질서가 생기고 그에 대한 직원들의 불만 역시 없지는 않다. 사내 복지도 외부에 알려진만큼 대단하진 않다."
457,(주)프레인글로벌,10514,부서별로 분위기 천차만별. 공채 출신 우대 분위기가 강해 자칫 경력직은 외톨이가 될 수 있음.
458,(주)프레인글로벌,10514,"매년마다 각 담당자의 업무 성과에 따른 연봉 협상이 있기 때문에 스트레스가 심함 야근없이 다니기 힘든 회사 파트너 별로 만족도가 다름 PR 환경이 변화하면서 온라인 전문영역이 발생하나, 이에 따른 전문인력이 부족함"
459,(주)프레인글로벌,10514,팀에 따라 분위기가 아주 많이 다르다. 내가 선택한 팀도 아닌데 팀의 운영 원칙에 따라야한다는 점. 그래도 승진은 빨리 되는데 연봉은 그만큼 오르는지 의문. 새로운 트렌드를 받아들이는데 아주 많은 시간이 걸림.
460,(주)프레인글로벌,10514,연봉체계 없음 승진체계 있으나 기준이 모호함 어떨때는 공채라 어떨때는 경력직이라 이해해 달라는 식
461,(주)프레인글로벌,10514,그나마 PR 업계에서는 알아주는 네임 벨류는 빛좋은 개살구이고 잘 포장된 기업 이미지는 그야말로 포장이라는 사실. 믿을 수 없을만큼 높은 이직률 때문에 회사의 레퍼런스가 대부분 의미없음. 오로지 창립멤버라는 이유로 임원진을 꿰차고 있는 임원들은 젊고 똑똑한 직원들을 관리하고 멘토링 하기에는 역부족.
462,(주)프레인글로벌,10514,인사의 기준이 없음. 기업 매출 상황이나 담당 임원 파워에 의해 결정
463,(주)프레인글로벌,10514,"업무평가라는 게 있는건지 모를 정도로 후진적 인사평가,인사팀이 한두명 있음, 사내 전산망 담당도 1명. 아프면 올스톱. 복불복 팀배정에 죽을때까지 팀 못 바꿈. 대체휴가,야근 등을 눈치 팍팍 주면서 쓰게 함. 팀이 다르면 아예 다른 회사 느낌. (심지어 휴가, 점심시간 같은 내용까지)"
464,(주)프레인글로벌,10514,진리의 팀바팀. 맡고있는 클라이언트나 팀에 따라 천국을 맛볼수도 지옥을 맛볼수도. 급여는 네임밸류치고 적은편.
465,(주)프레인글로벌,10514,팀에 따라 복불복이 심하다. 팀제로 운영되어 기존의 PM제 만큼 다양한 분야의 업무를 경험하긴 어렵다.
466,(주)프레인글로벌,10514,일하지 않는 사람을 구분하지 못함.(인사관리시스템 존재 유무 모름) 어떤 팀을 만나는지에 따라 업무 능력 향상 여부가 천차만별. 빛 좋은 개살구 많음.
467,(주)프레인글로벌,10514,팀장과 클라이언트에 따라 인생이 복불복으로 나뉨. 윗선에서 팀간 업무량 조절을 안해줌. 일 하는 팀만 계속 함. (일 없는 팀으로 배정되면 난름 꿀회사)
468,(주)프레인글로벌,10514,인재 개발에 투자하지 않는다. 룰이 많다. 개인별로 업무량 편차가 있다.
469,(주)프레인글로벌,10514,특히 신입일수록 과중되는 과도한 업무량
470,(주)프레인글로벌,10514,"팀 별로 전문 분야가 달라 희망하지 않은 산업의 브랜드를 담당할 수 있으며, 업무 강도가 강한 반면 보상이 적음. 그에 따른 이직률이 높아."
471,(주)프레인글로벌,10514,홍보대행사라는 특성상 불시의 야근이나 잔업 등이 많았습니다.
472,(주)프레인글로벌,10514,"홍보 산업이 특별한 기술을 이용한다기보다 노동집약적 산업이기 때문에 노가다 느낌으로 업무강도가 높고, 시간이 지난다고 해서 전문적인 지식을 배운다는 느낌이 적습니다. 그리고 직원들을 위한 HR 관리가 약한 탓인지 중간관리자 급의 이직률이 높은 편입니다.  또한 외부에서 보는 것과 달리, 많은 업무가 사회 초년생들로부터 이뤄지는 경우가 많아 고객사가 지불하는 비용만큼 충분하고 전문적인 전략 안에서의 홍보가 이뤄지는지 의심스럽습니다."
473,(주)프레인글로벌,10514,"팀 따라 안정성과 업무 강도, 분위기, 삶의 질이 하늘과 땅 차이일 수 있고 팀 간 이동의 기회가 생각보다 자유롭지 않아 자칫 발목 잡힐 위험이 있음"
474,(주)프레인글로벌,10514,뼈를 빼먹을 정도로 일을 시킴 연봉과 시간외 노동이 재능기부 수준
475,(주)프레인글로벌,10514,중간관리자/윗사람들이 일하지 않는 이상한 회사 팀에 따라 일의 편차가 너무 큼
476,(주)프레인글로벌,10514,근무 강도에 비해 연봉이 너무 낮음. 인센티브나 상여금 제도도 문제인듯
477,(주)프레인글로벌,10514,"잦은 야근,높은 업무 강도가 쉽게 지치게 하는 단점과 많아진 직원수 때문에 공간 사용밀도가 높은점"
478,(주)프레인글로벌,10514,SNS나 미디어에 비춰지는 이미지와 많이다름.. 생각보다 유연하지 않은 분위기. 팀제로 운영되서 큰회사의 장점인 다양한 클라이언트 경험이 사실상 불가능. 팀 이동하려면 정치적으로 마찰겪게됨.
479,(주)프레인글로벌,10514,자유롭다고 할 수 있지만 그렇다고 수평적인 조직문화는 아님.
480,(주)프레인글로벌,10514,"업무 성향 및 분야 다양한 만큼 상사의 업무 스타일 복불복, 원하지 않는 업무에서 고정 될 경우 1대1 교대 희박."
481,(주)프레인글로벌,10514,팀 배치에 따라 회사생활과 커리어 개척 등 모든 것이 복불복이라 운이 나쁘면 경험을 쌓기도 전에 지쳐 나가 떨어질 수 있음.
482,(주)프레인글로벌,10514,기업의 단점이라기 보다 업무 자체가 고객사에 의해 결정된다는 점이 단점이라면 단점
483,(주)프레인글로벌,10514,"연봉이 낮은 편, 임원들이 일하지 않고 AE들이 가장 일을 많이 하는 힘든 회사"
484,(주)프레인글로벌,10514,상대적으로 연봉과 복지에 아쉬움이 큼. 그러다보니 5년차 정도 직급의 퇴사율이 높은 편. 회사 분위기가 상당히 개인주의가 만연돼 있어 이 분위기 적응 못하면 회사 다니기 힘들 정도
485,(주)프레인글로벌,10514,"업무강도도, 분위기도 팀바이팀. 라인바이라인. 야근하는게 당연시 되는 분위기. 효율성이 떨어질 때가 많음."
486,(주)프레인글로벌,10514,"지원자의 학력/소양에 비해 연봉이 낮은 편이며, 업계 특성상 야근이 잦습니다."
487,(주)프레인글로벌,10514,"팀에 따라 복불복이고, 업계 1위인 것에 비해 연봉은 최상위권은 아님"
488,(주)프레인글로벌,10514,장기 고객사가 많은 편이라 업무 순환이 안되는 편. 이런 부분은 때로는 경력 개발에 단점으로 작용할 수도 있음.
489,(주)프레인글로벌,10514,"개인 사업자들의 조합처럼 일해야 하는 구조. 낮은 임금에 매출 압박이 심한 편. 1위라는 타이틀 덕에, 열정페이를 조장하는 분위기."
490,(주)프레인글로벌,10514,"잦은 야근(물론 팀 및 클라이언트에 따라 복불복), 일하는 사람만 죽어라 일하는 광경을 자주 목격할 수 있음."
491,(주)프레인글로벌,10514,팀별로 업무강도의 편차도 크고 담당 업무의 차이도 많이 난다.
492,(주)프레인글로벌,10514,"□야근수당 팀마다 야근 빈도는 차이가 심하지만, 야근수당이 없음. 월급에 합쳐져서 나오는 듯하나 일하는 시간에 비해서 절대적으로 부족한 편. 주말에 일해도 특별휴가정도만 나옴.  □휴가 사용은 자유롭지만, 주말업무가 많은팀은 연차가 쌓이기만하고 사용을 다 못하는 경우가 많았음.  □직급별 능력차이 위로 갈수록 자기 발전이 멈춘 사람들이 많은편. 신입-과장-부장-임원 차이의 능력차가 심하며, 직원을 관리 및 다루는 부분에 있어서 문제가 많음. 위에서 사람을 끌어주지 못하는 편이므로 알아서 잘 커야함. (하지만 팀을 잘 만나면 승승장구 할 수 있음)  □운 팀을 선택할 수 있는 기회는 거의 없으며 있어도 이동할 수 있는 가능성이 거의 없다고 봄. 팀 잘못 만나면 무능력하고 저평가 되는 가능성이 매우 높음.  □연봉협상 연봉협상을 인사팀이 안함. 따라서 비합리적이고 인사평가에 대한 의미가 1%도 없음.  □경영지원 vs PR업무팀 경영지원인데 지원을 해주기보다 독립적으로만 일할려는 분위기.  □공채 VS 경력 공채는 그냥 5차 면접까지 본 사람들. 인턴출신은 2차정도에서 끝이지만 공채로 전환되면 똑같은 공채가 됨. 공채는 그냥 회사의 서포터즈라고 보면됨. 보기만해도 안타까운 일들을 많이 하는편. 경영지원에서 해야할 워크숍 기획마저도 했었음. 그시간에 업무를 해줬으면 좋겠다는 생각을 했음."
493,(주)프레인글로벌,10514,연봉이 넉넉치 않음 인센티브 없음 사내커뮤니케이션이 잘 안됨 사내 복지 시스템이 특별히 없음
494,(주)프레인글로벌,10514,비합리적인 경영진 마인드. 일 자체가 '을' 입장이기 때문에 클라이언트의 터무니없는 요구에 따른 야근이 많은편
495,(주)프레인글로벌,10514,"팀마다 다르고 상사마다 신입사원에게 바라는 점이 다르기 때문에 절대적은 것은 아니지만, 업무량이 상당히 많습니다. 처음에 신입사원으로서 교육과 시장조사, 아이디어 과제, 보도자료 작성 등 실무 업무를 빨리 익힐 수 있도록 트레이닝을 시켜주고 신입사원도 제안에 참여할 수 있는 기회가 주어집니다. 이에 따르는 야근과 밤샘정신, 스트레스가 따르기 때문에 그 부분은 어떤 이들에게는 단점이라고 할 수 있"
496,(주)프레인글로벌,10514,팀에 따라 복불복. 업무 배분이 잘 안되는거 같음. 자유로운 회사처럼 보이지만 의외로 보수적인 팀도 있음.
497,(주)프레인글로벌,10514,"가장 큰 단점인데 리소스 분배가 잘 안됨. 케이스바이 케이스가 너무 심함. 어떤 상사, 어떤 클라이언트를 만나느냐에 따라 내 삶의 질과 균형이 달라짐. 리소스 분배가 잘 안되는데 계속 밀고 나갑니다...외부 커뮤니케이션은 너~무 잘하는데 내부 커뮤니케이션은 진짜 못함. 일 많이하고 그만큼 역할을 하는 직원에게 그만큼에 보상을 해주지 못함."
498,(주)프레인글로벌,10514,좋은 회사지만 일하는 일부만 죽어라 일하고 부장급은 태반이 일하는 시늉만 한다. 월급도둑들에게도 해고가 없는 자애로운 회사이기도 하다. 임원진 중 일부는 무소불위의 권력을 휘두르기도.
499,(주)프레인글로벌,10514,담당 업무에 따라 노동 강도의 차이가 심한편 본인 적성에 따라 고객사를 선택하지 못함
500,(주)프레인글로벌,10514,업계 특성상 경기를 심하게 탐 의외로 사내 정치 성향이 좀 있음
501,(주)프레인글로벌,10514,- 객관적으로 다소 낮은 연봉 및 복지 수준: 동종 업계 수준에서는 좋은 편 - 높은 노동 강도
502,(주)프레인글로벌,10514,"- 사내정치. - 실무진의 기반이 매우 불안정함. - 리소스를 제대로 활용하지 못해 일을 안 하는 사람은 끝까지 안 하지만 하는 사람은 매일 야근, 주말출근까지하며 일함. 내부에서는 이런 현실을 매우 당연하게 인식함. - 회사라면 으레 갖추고 있어야 할 탕비실, 비품실의 부재."
503,(주)프레인글로벌,10514,연봉과 복지가 정말 안좋습니다. 동종업계 다른 피알회사들보다 훨씬 연봉 수준이 낮으며 복지라 할건 존재하지 않습니다. 거의 인력으로만 돌아가는 회사인데 자체적으로 인건비를 깎으려고 하여 직원들의 불만이 고조되고 있습니다. 회사 경영과 실제 의견 경정권자가 잘 구분되지 않아 직원들의 요구사항이 먹히지 않습니다.
504,(주)프레인글로벌,10514,여초라 사회생활이 어려울 수 있음. TOP 홍보대행사 중 연봉은 낮은 편.
505,(주)프레인글로벌,10514,"업무 효율성을 위해 야근을 줄이고, 업무시간을 최대한 활용할 수 있는 노력이 필요하다."
506,(주)프레인글로벌,10514,"경영진과 실무자들의 괴리감 / 바뀌지 않는 임원들, 성과 분배가 제한적"
507,(주)프레인글로벌,10514,차근차근 일을 배우기는 어려운 것 같습니다
508,(주)프레인글로벌,10514,"홍보회사 답게 대외 홍보에는 매우 신경써서 복지수준과 사내문화가 좋은 기업이라는 이미지를 유포하고 있지만, 정작 직원복지와 정당한 진급 기회를 은근하게 눙치는 경우가 많음. 특히 업무 분배이 AE급에만 몰려있는 비합리적인 구조."
509,(주)프레인글로벌,10514,낮은 연봉. 다양한 클라이언트가 있지만 그 혜택을 누릴 수 있는 것은 소수인듯
510,(주)프레인글로벌,10514,국내 1위이니 낮은 연봉은 각오하라는 이야기를 매년 연봉협상때 함  역량있는 글로벌 인재들에게 용돈 수준의 연봉
511,(주)프레인글로벌,10514,- 아무리 취업난이고 좋은 인재가 몰린다고 하지만 업무 강도에 비해 의욕이 전혀 일어나지 않는 급여로 몰아친다
512,(주)프레인글로벌,10514,기본적인 비품이 열악하다. 겉치레만 번드르르하고 정작 평사원이 필요한 것은 신경안쓰는 느낌
513,(주)프레인글로벌,10514,"내부직원으로서 느끼기에도 사내 정치같은게 있는 것 같았다. 어느 라인에 있느냐에 따라 회사에 대한 만족도, 업무에 대한 만족도가 차이가 있다고 느껴졌다. 경영진들 사이에서도 성골과 진골 같은 개념이 은연중에 있는 것 같다고 느껴진다. 설령 이것이 사실이 아니더라도, 직원들이 이렇게 느끼게끔 하는 상황들이 있다는 것 자체가 사기를 저하시키는 부분이라고 생각한다."
514,(주)프레인글로벌,10514,잦은 야근으로 자기계발 시간을 갖기가 어려움. 한편으로는 업무 배분이 잘 이뤄지지 않아 옆자리 사람과 비교해 상대적 박탈감이 느껴질 수도
515,(주)프레인글로벌,10514,"홍보대행사 특성대로 야근이 많음, 근무환경이 조금 불만"
516,(주)프레인글로벌,10514,"팀별로 업무량과 업무범위가 현저하게 차이가 난다. 일이 없는 팀은 배우는 게 없다고 불평하고, 일이 많은 팀은 밤샘야근으로 체력적,정신적으로 피곤하다고 불평한다. 1~2년 후 팀에 따라 같은 년차라도 업무능력이 현저하게 차이가 날 수 있다."
517,(주)프레인글로벌,10514,높은 근무강도에 비해 급여가 아쉬운 점이다. 팀별로 분위기도 다름.
518,(주)프레인글로벌,10514,회사가 업계에서 유명하지만 팀마다 실력차이도 있고 업무량의 차이도 많다. 광고주가 되어 업무 요청했는데 팀마다 퀄리티가 너무 다르다. 프레인이라고 해서 다 잘하는 건 아닌듯. 무엇보다 직급이 낮을 수록 연봉이 너무 낮다. 직급이 올라가면 연봉도 오른다고 하는데 비슷한 레벨의 다른 PR사보다 연봉이 낮은 편. 그리고 SNS에서의 이미지는 좋은데... 실제와의 갭이 많다.
519,(주)프레인글로벌,10514,"어떤 고객사를 맡게 되는지는 복불복. 말그대로 고객사 대행만 할수도, 건설적인 컨설팅을 할 수도 있으나 원한다고 할 수 있진 않다. 홍보와 영화, 엔터테인먼트는 완전 다른 회사나 마찬가지."
520,(주)프레인글로벌,10514,"야근, 업무량에 비해서 급여는 적은편. 어느 팀에 배정되느냐에 따라 회사 생활이 복불복일 수 있음. 일부 무능력한 중간관리자들에 대한 불만이 있을 수 있음."
521,(주)프레인글로벌,10514,대기업에서만 볼 수 있을거라 생각했던 '라인'을 잘 타야함
522,(주)프레인글로벌,10514,"조직 융화력이 좋아야 함. 자신이 포함된 조직에서 잘 버티지 못하면 누구도 챙겨주지 않음. 그리고 일을 열심히 한 만큼, 자신의 삶을 잃기 쉬움."
523,(주)프레인글로벌,10514,인력으로 돌아가는 회사임에도 불구하고 인재를 키우고 발전시키는 풀이 마련되어 있지 않다.
