,company_name,company_id,review_text
0,(주)인콘,3447,"보수적인 집단, 복리후생 없음 , 소통불가 경영진 ,"
1,(주)인콘,3447,월급이 너무 낮은데 복지도 없음 체계도 없음 너무 아날로그적인 회사...
2,(주)인콘,3447,매출이 심각하게 하락하고 있고 그에 따라 직원 처우나 복지도 축소되고 있음 급여가 매우 작음
3,(주)인콘,3447,"애사심을 갖기엔 뭔가 부족하고, 조직이 모두 따로 노는 듯하며 외부의 의견을 받아들이는데 인색하다고나 할까...내부에 있어도 Identity를 잘 몰랐던 느낌."
4,(주)인콘,3447,보여주기 야근을 해야할때도 있음. 연봉여 다른 회사 평균보다 낮음. 주말출근도 가능
5,(주)인콘,3447,미래가 있는 것 같지만 뭔가 발전성을 찾기 어려운 상태. 사내 정치가 발전을 막는 상황
6,(주)인콘,3447,기업의 방향성 잃고 복지도 잃고 사람도 잃는 회사 더 무슨 말이 필요할지..
7,(주)인콘,3447,"보상에 대한 기대를 가지기 힘듦 열심히 할 필요 없이, 주어진 일만 하는 성향은 편할 수 있음"
8,(주)인콘,3447,어수선한 분위기와 미래에대한 고찰이 큰순간이 많음 cctv말고 이것저것 잡다하게 많이하는듯
9,(주)인콘,3447,낮은 연봉.. 연봉이 일단 너무 낮고 성과급은 한번도 받아본적이 없음 연봉 인상률 또한 최악
10,(주)인콘,3447,고인물이 너무 많음 신입 직원들이 없음 일하는사람만 일하고 노는 사람은 잘 놈
11,(주)인콘,3447,연봉이 업계보다 낮았음 칼퇴는 하는데 약간 상사 눈치 보임
12,(주)인콘,3447,"관리팀이 타부서에 관심이 없어서 뒤로 주머니 챙기는 사람들이 다니기 편리할것 같음.  그런 사람들이 팀장이라 아랫직원들은 개고생하면서 많은 현타를 경험 함.  어느정도 근무태만은 그러려니 할 수 있지만 너무 티나게 근무지를 이탈하거나, 근태규정을 무시하는 팀장들이 있음.  일이 힘든것보다 배울것 없는 사람들 아래서 견디는게 힘들어서 퇴사하는 인원 다수로 생각됨.  본인들꺼만 챙기는게 눈에 보여서 아랫직원들이 다 퇴사하는겁니다."
13,(주)인콘,3447,재무팀이 회사의 권력자로 재림하는 이상한 모습이 있습니다. 월급이 적고 상여는 거의 없다고 보면 됩니다.
14,(주)인콘,3447,"미래의 비젼 없슴, 연봉인상률 동결이 많음, 인력투자 없슴, 직원들이 복지는 점차 감소 함"
15,(주)인콘,3447,"성장률이 거의 멈춰있거나 소폭 상승이며, 특정 부서를 제외한 타 부서는 거의 하향세라고 보는게 맞을 것 같다"
16,(주)인콘,3447,업계최하수준의 연봉과 복지 기업문화와 과도한 업무강도
17,(주)인콘,3447,급여가 낮고 고인물이 많다 바이오쪽에 투자를 하면서 회사가 이상해짐
18,(주)인콘,3447,다른부서랑은 사이가 그닥 좋지는 않았다.주위에 식당이 별로 없어서 먹는곳은 거의 정해져있다
19,(주)인콘,3447,"여기저기 인수합병 당하면서 물어 뜯기고 있는 회사, 재무쪽에 사장 코스프레 하는 인간 한명이 모두 좌지우지 하는 회사"
20,(주)인콘,3447,개인적으로 개발자가 회사에서 포지션이 애매한 상황임
21,(주)인콘,3447,팀바팀으로 문서작업이 많을 수도 있다. 연봉이 어어어어어엄청 낮은 편
22,(주)인콘,3447,"장점빼고 다 단점이라고 생각하시면 됩니다. 샌드위치 없음, 낮은 연봉에 비해 업무량 많고, 그로인해 업무 스트레스 향상되고, 복지부족으로 인하여 일할 의욕 떨어짐. 워라벨이 없다."
23,(주)인콘,3447,일을 안하려고 함. 진심 다들 일을 안하는게 정상인 회사..
24,(주)인콘,3447,일 많은 팀은 계속 일이 많음. 연봉이 오르지 않음. 야근 안하면 눈치 보임. 일이 있든 없든 야근하면 일 잘하는 사람.
25,(주)인콘,3447,"사내 프로세스, 프로그램, 체계 없으며 중소기업이다보니 성장의 한계가 보인다. 연령대가 높아 어린 사람들에게는 조금 부담스러울 수도 있다."
26,(주)인콘,3447,영업에 너무 휘둘려서 연구소에서는 아무것도 할수없었음..
27,(주)인콘,3447,이전 창업 대표때 부터 경영진들이 인력관리가 잘 안하고 회사
28,(주)인콘,3447,"전자 결재 없고, 대면 서류 결재. 최근 청담으로 이사. 배울건 없음. 연봉 짬."
29,(주)인콘,3447,"야근이 거의 없긴한데, 야근수당이 없음 대신 주말수당이 있긴함 급여가 같은 업종의 다른곳에 비하면 비교적 낮은 편"
30,(주)인콘,3447,최악의 연봉 인상률 점심값이 6천원 (요즘 어디가도 기본 7천원인데) 고인물 투성임 사원 주임 대리급이 진짜 없음 역피라미드 구조
31,(주)인콘,3447,역피라미드 구조로 승진 해도 의미 없음 연차 눈치주며 연차 사유를 캐물음 인사고과없이 전사 연봉인상률 동일하여 열심히 하는사람이 손해임
32,(주)인콘,3447,그외 전부다. 대리들 보다 부장 차장이 더 많음. 말그대로 고여가며 발전할 생각을 안함. 야근을 많이해야 일 잘하는 줄 암
33,(주)인콘,3447,개발자 경력대비해서 연봉이 낮음. 웹 개발 Java쪽 PM이 없어 자기계발 하면서 기술 터득해야함.
34,(주)인콘,3447,연봉이 너무 낮은게 흠임. 생활이 어려워 질수가 있음.
35,(주)인콘,3447,직장인에게 제일 중요한 연봉 인상률!!!!이 너무너무 짬..첫 연봉 협상(통보)때 너무너무 충격먹었음..그리고 경영팀 몇몇분들 좀 까칠하심..이건 개인적인 생각이 아니고 아마 다른 직원분들도 느낄거라 생각함
36,(주)인콘,3447,사업부서는 열심히 일하려고 해도 경영부서 쪽에서 감놔라 배놔라 함 그런데 경영부서가 성과급 잔치하고 연봉 제일 높음
37,(주)인콘,3447,"몇몇 분위기 흐리는 사람들이 존재, 나까지 멍청해지는 기분"
38,(주)인콘,3447,복지제도가 별로.. 경영진이 바뀐 이후로..구조조정 심각
39,(주)인콘,3447,"1.극단적인 역피라미드구조. 연령대가 너무 높음. 중간에 들어온 사람이 적응 하기 어려운 분위기인 것 같다. 2.부하직원에게 비속어 사용하는 사람도 있었음. 3.팀바팀이지만 퇴근 눈치보임. 4.사원,주임급이 책임져야 할 일이 너무 많음."
40,(주)인콘,3447,매년 연봉 동결에 사내정치질에 영업의 입김이 쎄서 영업 위주로 회사가 돌아가고 있고 요즘에는 사업을 하도 늘려놔서 내가 다니고 있는 회사가 무슨 일을 하는 회사인지 조차 헷갈립니다. 고인물 천지 정말 고인물들이 너무 많아서 역피라미드 구조
41,(주)인콘,3447,연차사용시 이유를 말해야 함 = 자유롭지 않음 영업팀 영향력이 아주 큼
42,(주)인콘,3447,팀 각각이 회사내의 중소기업 같이 돌아감. 여러가지를 병행하다보니 생긴 현상으로 보임...
43,(주)인콘,3447,기존에 구디에서 가까웠던 사람들이 집이 멀어져서 좀 아쉬움 그외에는 단점이 없음.
44,(주)인콘,3447,"역삼각형 구조를 지니고 있으며, 사원 주임 대리 급이 많이 부족 합니다. 과장 차장 부장 윗 사람들만 많아 고된 업무를 할 수 있습니다."
45,(주)인콘,3447,회사의 대표가 여러번 바뀌는 과정에서 메인 개발자들이 많이 퇴사함 연봉도 낮음
46,(주)인콘,3447,"정치력, 개인주의, 일에 치이는 삶, 인센티브 약속 안지킴"
47,(주)인콘,3447,복지도 크게 없고 그냥 발전할려는 직원들의 의지도 없어보임
48,(주)인콘,3447,연봉이 현격히 적음 연봉 인상률 없다고 봐야할 정도 영업의 파워가 누구보다 쌤 어린 친구들이 오래 있기에는 솔직히 힘듦
49,(주)인콘,3447,본업이 뭔지를 모르겠고 무슨 회사인지도 모르겠다 이상하게 주식에 집착해서 점점 미쳐돌아가는느낌
50,(주)인콘,3447,"모든 사람들이 재무팀 눈치를 엄청 보며, 업무시 내 개인핸드폰 사용 권장 및 카톡 단톡방 엄청 초대함 상사가 무능력 함 / 일하면서 배울게 하나도 없음"
51,(주)인콘,3447,답이 없다. 주위 사람들이 가려고 한다면 말리고 싶은 회사
52,(주)인콘,3447,연봉을 인상할 생각이 없다. 차장 이상의 인력이 변할 일은 절대 없을 것이다. 중간에 들어온 사람들이 버티기 힘들다.
53,(주)인콘,3447,성과가 없으면 인간취급을 받지 못함 이건 글쓴이 뿐만 아니라 후입도 함께 들은 얘기임 각 부서의 인원이 부족하여 신입 교육 및 능력을 키울 수 있는 여지가 없음
54,(주)인콘,3447,장점 빼고 다인듯 앞으로의 계획이 불투명 내가 잇는 부서에서는 발전 가능성이 보이지 않음 1년후 2년 후 제자리 걸음 할 듯하여 퇴사
55,(주)인콘,3447,"전반적으로 업무 협의라는게 없는 분위기 조직개편 및 인사는 통보식 편 가르기가 있어서 불이익을 받을 수 있음 야근 수당 없음 연봉 동결 사원, 주임급이 거의 없고 퇴사율 높은듯"
56,(주)인콘,3447,워라벨 불가능 하였으며 암묵적으로 야근이 많았었음 직원에 대한 복지도....
57,(주)인콘,3447,야근수당안줌 최악임 이런곳은 처음봄 교통비지원해주는데 야근수당 안줌
58,(주)인콘,3447,실제로 배울수있는건 많지는 않아요. 스스로 계속 공부해야합니다
59,(주)인콘,3447,"호봉제이다 보니, 능력이 좋아도 특진 등에 아무래도 어려움이 있으며 개개인에 따른 업무량 차이가 큰 느낌. 윗쪽이 능력이 만들어준 직급이 아닌 시간이 만들어준 직급이다 보니 다소 무능한 사람도 몇명있음"
60,(주)인콘,3447,"진급에 대해서는 병목 현상으로 인해, 아랫사람들의 진급이 생각보다는 어렵습니다."
61,(주)인콘,3447,회사의 사정에따라 간혹 연봉 동결되는 경우가 있음 팀별로 분위기가 상이
62,(주)인콘,3447,연봉이 낮음 사업운영을 위해 회사가 지원해주지 않으면서 매출이 잘나오기를 기대함 전체적으로 고인물이 많음
63,(주)인콘,3447,연봉 정말 지극히도 낮음. 경력직 이런 버프 존재하지 않음. 여기서 뭘 배우는지 뭘 하는지도 모르겠음
64,(주)인콘,3447,"박봉,,박봉박봉박봉 그냥 박봉 다녀본 결과 연봉 인상률 5프로 안넘는듯, 샌드위치 데이날 쉬지만 개인연차 소진 ,소진하기 싫으면 나와서 일해라임, 연차 자유로운데도 있고 눈치보고 쓰는데도 있음 부서마다 다름 부바케 , 군대식 구조로 진짜 지나친 꼰대들 많고 일 안하는 고인물 천지라고 몸소 느꼈음. 정말 저 사람이 어떻게 저 직급에 월급을 받고 있는지 의문인 사람들도 있었음... 아 참 휴가도 연차 소진임 잔여연차 수당 x"
65,(주)인콘,3447,"부서의 체계가 안 잡혀있고, 누가 뭘 하는지 관리가 전혀 되지않음, 책임을 서로 미루고 엉망. 연봉이 너무 짬, 인상률 또한 작음"
66,(주)인콘,3447,회사대표 바뀌고나서부터 방향을 잘못가고 있는것으로 판단이 되고 연봉이 낮음
67,(주)인콘,3447,너무많음. 야근을 안하면 눈치를 봐야함. 개발자가 개발일과 기술지원 업무까지 해야함.
68,(주)인콘,3447,"연봉 동결 자주남, 야근 수당 없음(포괄 임금제), 야근 많음, 주말도 출근 자주함, 인원에 비해 일이 많음, 대리 이하가 책임질 일이 너무 많음, 대리 이하가 의견 말하면 그 이상이 기분 나빠함."
69,(주)인콘,3447,급여가 매우 짬. 10년 이상 근속한 고인물 임원들이 너무 많음.
70,(주)인콘,3447,연봉 대비 많은 걸 요구 함 인사이동이 자주 있음 타사 대비 연봉이 짜다
71,(주)인콘,3447,"고인물들이 많아 변화를 굉장히 싫어함. 같은일을 두고도 어렵게 하는스타일임. 과장,부장급들이 많아서 실질적으로 대리,주임은 그냥 사원급임. 대리주임은 심지어 거의 없음. 교통편 불편함."
72,(주)인콘,3447,영업팀의 힘이 강해서 개발 업무 진행을 하다가 이것저것 수정하거나 대응 해주는것이 부담됨
73,(주)인콘,3447,"승진가능성도 거의 없고 발전 가능성도 거의 없음, 현재 매출이 좋지 않아 경영과 개인 발전은 거의 힘들다고 보여짐"
74,(주)인콘,3447,사내 정치가 너무 심하다. 친한 사람들끼리 그룹화 하는 경향이 많이 보인다.
75,(주)인콘,3447,"급이 피라미드 구조여서 아래 사원이 별로 없어 대부분 과장, 부장들이 대부분 , 과장이여도 막내가 될 수 있음. 하락세로 인한 미래 보장이 안됨. 팀마다 다르겠지만 본인 소속팀 야근강요. 상장사 회사라는 이름에 비하면 낮은 연봉."
76,(주)인콘,3447,급여급여급여 집에돈많으면다녀보기좋음 너무돈이적음 나머지는그냥저냥복지가 결국돈이니
77,(주)인콘,3447,"미래의 비전이 보이지 않음, 몇몇 사람들의 입김이 너무 강함"
78,(주)인콘,3447,연봉이 동종업계에 비해 다소 적은편인 것 같음. 정시 출퇴근 가능이나 간헐적으로 예상못한 야근 가끔 발생 각 부서 책임자끼리의 업무소통이 원활하지 않음
79,(주)인콘,3447,"투자외의 부분에는 관리차원. 내부성장은 말로만 기존 사업부분 구성원에는 혁신, 도전, 로열티 이런 건 없슴"
80,(주)인콘,3447,CCTV회사인지 바이오 회사인지...기업의 기준이 없는 회사 입니다.
81,(주)인콘,3447,본인빼고 타인은 다 문제인 회사. 사내 정치적인 분위기와 이타적인 분위기 줄을 잘 서야 됨.
82,(주)인콘,3447,상당히 정치적이고 다들 짤리지 않기위해 고군분투를 하고 일부 직원들이 일하는 척을 상당히 하고 동료들을 험담한다.
83,(주)인콘,3447,연봉 상당히 낮음. 급여애 비해 일 상당히 많이해야함. 희생을 해야함
84,(주)인콘,3447,업무 체계없음 라인 잘 타야 살아남을 수 밖에 없는 구조. 일하는 사람만 갈리는 구조
85,(주)인콘,3447,"복지가 한계가 있음, 언급한 것 이외에 없는 것 같음 또한 연봉이 픽스되어 있으며 적다고 느낌. 굉장히?"
86,(주)인콘,3447,"책임소재를 윗선에서 절대 지지않고, 잘못하면 직원탓, 잘하면 자기탓 직원을 소모품으로 생각하고, 너무 쉽게 정리"
87,(주)인콘,3447,연봉 인상률이 다른 곳과 비교해서 너무 적은것 같습니다. 회사가 신기술 개발이 아닌 항상 유지보수 사업만 하려는 경향도 있는것 같습니다.
88,(주)인콘,3447,M&A로 경영진이 바뀌어서 다들 각자 꿈꾸는 바가 다름
89,(주)인콘,3447,"윗 직급들이 많음, 그냥 저냥 무난한 회사 ... 경영진이 새로 들어왔는데 말햇던 복지가 지켜지지 않음 어디 투자한다는데 잘 모르겟음 소통 안됨...."
90,(주)인콘,3447,개발에 투자 하지 않는다 회사가 어려우면 사람부터 짜른다
91,(주)인콘,3447,박한 연봉 이직해온 사람들의 말을 들어보면 이직을해도 전 연봉 그대로 오거나 거의 올리지 못하고 오는경우가 많음 또 임시공휴일로 남들 다 쉬는날에도 연차가 깎임
92,(주)인콘,3447,"사내 정치가 있고, 정치를 할줄 알아야 편안하게 다닐 수 있음. 계속적인 인력유출로 경쟁력이 점점 떨어지고 있음. 코스닥 상장이전에는 분위기 좋았으나, 이후 정체 되어있고 분위기도 나빠짐."
93,(주)인콘,3447,회사 내에 높은 직급이 많음 팀마다 분위기가 크게 다름
94,(주)인콘,3447,"부장,과장이 너무 많다 야근수당이 없음 밑에 글에도 써 있지만 권고사직이 좀 있음"
95,(주)인콘,3447,리조트 이용권 신청하면 된다는데 신청해서 써본적 없고 입사시 오제이티도 따로 안해서 회사 복지에 관해 정확히 알 수 없음 따로 사규 찾아서 읽어 봐야함 무슨 일을 하긴 하는데 책임지는 사람이 없음
96,(주)인콘,3447,사원이 극 소수. 과장 부장이 이렇게 많은 회사 처음 봤다
97,(주)인콘,3447,5년뒤에는 없어질 회사 입니다. 회사에서 월급은 잘 지급되기 때문에 돈에 대한 고민은 미비하지만 5년뒤에도 생존할지는 미지수인 회사입니다.
98,(주)인콘,3447,"1. 어느회사나 마찬가지겠지민 주요 요직에는 초창기 창립맴버(꼰대들) 가 진을 치고있고, 인원도 몇 안되는데 직원들이 아닌 자기네 위치와 이익을 위해 정치를 한다는 부분이 문제점임. 2. 신입사원이 들어와도 자기네 입맛에 안맞으면 쉽게 자르는 문화가 존재함 3. 직원들에게 투자없이 직원의 능력을 최대한 빨아먹기만 함"
99,(주)인콘,3447,"연봉 인상은 포기해야 할 정도로 힘들다는 소리만 하면서 복지는 점점 줄고 있다. 회사내 정치가 심하며, 소리소문 없이 인원정리를 단행하고 정치에 밀린 사람먼저 정리하는등 파벌이 심함."
100,(주)인콘,3447,후반부에 지방출장을 자주가게 되어 그게 개인적으로 좀 스트레스 였다.
101,(주)인콘,3447,한마디로 적는 다면 노답. 실력있는 사람들 다 떠났고 대리급 이하는 병특빼고 거의 전멸 수준에 이직해서온 사람 중 연봉 올려서 온 사람 없음 오히려 깍아서 온 경우 많음. 당장 분유값 벌어야 하는 경우가 아니면 오지 않길 바람
102,(주)인콘,3447,야근이 빈번함 야근수당이 없고 주말수당이 있어 주말에 나와서 일을 하기 원함.
