,company_name,company_id,review_text
0,(주)야놀자,8540,"재택근무였다가 출근했다가 번복되는 출퇴근, 낮은 연봉,"
1,(주)야놀자,8540,영업조직은 그야말로 최악. 뒷단에서 서포트는 하나도 안되는데 성과만 가져오라고 난리치고 체계라고는 없음.
2,(주)야놀자,8540,젊지 않은 않은 회사가 젊은 느낌을 많이 내려고 한다!!
3,(주)야놀자,8540,비포괄임금제란 부분이 좀 아쉬운 부분이긴 합니다. 야근이 많지는 않지만
4,(주)야놀자,8540,야놀자라는 이름과 it기업이라는 명성과는 다르게 시스템이 너무 별로
5,(주)야놀자,8540,"회사 내 성장은 물론이고, 근무 기간이 길어 질 수록 외부 경쟁력도 떨어짐"
6,(주)야놀자,8540,기준이 없어서 일하기 힘들고 ㅠㅠ 직원들도 자주 바뀌는편이다.
7,(주)야놀자,8540,"경영진들의 능력과 직원을 생각하는 태도들이 조금 아쉬운 부분, 연봉 쥐꼬리만큼 올려줌"
8,(주)야놀자,8540,위의 2개 빼고 모든것 정확하지 않은 bm 그로인한 평가 부재
9,(주)야놀자,8540,인사이동이 너무 자주 일어난다. 근무 환경이 자주 바뀌다보니 좀 불편하다.
10,(주)야놀자,8540,목표가 명확하지 않고 자주 변경됨 업무 프로세스가 수시로 바뀌고 너무 복잡함 불확실한 인센티브 로직 너무 어려움
11,(주)야놀자,8540,부서별로 파트별로 업무가 세분화 되어있어서 다른 팀과 협업할 일이 많지 않고 자칫 고립될 수 있습니다
12,(주)야놀자,8540,"일이 많음. 나름대로 체계를 잡으려고 노력한 것은 알겠는데, 쓸데없는 잡무가 많아져서 30분이면 될 일을 이틀, 삼일씩 하는 상황임."
13,(주)야놀자,8540,조직이 수시로 바뀌어서 생각도 못한 부서에 발령날 수도 있음 딱히 선택권은 없음 성과지표 수치로 구체적으로 모으는데 평가 점수 겁나 짜게 주고 연봉 인상률도 모르겠음
14,(주)야놀자,8540,학력 차별주의 하는 사람 있음. 직책 있는 자리에 불구하고 꽤나 감정적인 직원이 있음
15,(주)야놀자,8540,"팀내 분위기가 매우 엉망이다 사내정치의 끝판왕, 팀마다 왕따가 있습니다"
16,(주)야놀자,8540,A일을 시키다가 갑자기 G업무를 시켜서 하나의 업무만 진득하게 하긴 힘들었음
17,(주)야놀자,8540,- 경영진의 직원에 대한 무관심 - 리더십 팔로우십의 결여
18,(주)야놀자,8540,비개발직종의 아쉬운 연봉과 주먹구구식 일하기가 참 아쉽다
19,(주)야놀자,8540,무능력한 조직장 / 공정하지 않은 업무평가 / 신입사원과 같은 연봉
20,(주)야놀자,8540,경영진의 선택? 직원들의 빠른 회전율..그로인한 마음의 불안정
21,(주)야놀자,8540,위에꺼 빼고 싹다 사람이 오래 재직할 수 없고 이런 스타트업은 한곳에 진득히 있던 분들 말고 이직률 짧은 분들이면 적응 쉬울듯 ㅎ 그리고 갑질 장난아임
22,(주)야놀자,8540,재직할 당시 풀 재택이다 보니 업무에 적응하는데 어려움이 있었음. 인수인계를 제대로 받지 못한 상태에서 업무를 진행하다 보니 불확실한게 많았고 업무 특성 상 팀워크 보다는 경쟁을 하게 되어 심적으로 많이 지쳤음.
23,(주)야놀자,8540,경영진에서부터 공포분위기를 형성하며 문화라고 할 것이 존재하지 않음. 언플을 많이 하지만 사실상 돈 버는 것 외에는 관심이 없는 회사.
24,(주)야놀자,8540,실적압박 / 개인주의 심하고 업무량이 많음 바쁘고 변경되는 사항이 많다
25,(주)야놀자,8540,알 수 없는 우선순위 누군가의 의지로 변경되는 과제.. 언제 어디로 이동될 지 모르는... 조직개편
26,(주)야놀자,8540,상사가 자주 바뀔 수 있음(팀마다 다름) 연봉협상이 아니라 연봉통보 팀마다 분위기나 업무방식의 차이가 큼
27,(주)야놀자,8540,전반적으로 프로세스 확립이 안되고 사람이 계속 바뀌어 혼돈
28,(주)야놀자,8540,복지 급여 직원에 대한 처우 상부의 지시에 의해 급하게 바뀌어버리는 업무 직원이 감당해야하는 인사적 부당함 무능력한 팀장급 이상 관리직들 생각보다 이기적인 동료들 (와복동도 옛말입니다)
29,(주)야놀자,8540,인원을 고려하면 사옥이 효율적일 것 같음. 너무 법인이 나뉘어져있다.
30,(주)야놀자,8540,경영진이 방향성도 없고 10배 여행을 싑게 만들겠다는 막연한 꿈만 있음
31,(주)야놀자,8540,너무 많음 경영진이 무능하고 사람을 쉽게 버리며 연봉이 잘 오르지않음
32,(주)야놀자,8540,"복지?차원의 제도가 줄고있다 (재택, 근무유연제등) 다양한 시도가 있지만 그로 인해 구체적인 방향성을 모르겠다"
33,(주)야놀자,8540,"포괄임금제, 잦은 조직 개편, 리더의 부재, 회사와 직원의 소통 부재"
34,(주)야놀자,8540,맡은 역할을 본인이 스스로 주도적으로 일을 이끌어 나가는 것에 대해 부정적이신 분이라면 처음에는 다소 방황할 수 있습니다.
35,(주)야놀자,8540,경영진들이 일방적으로 소통하는 것 같은 느낌이 들 때가 많다.
36,(주)야놀자,8540,오너 리스크를 알고싶다면 야놀자로 오시면 됩니다. 두고두고 후회하는 기업
37,(주)야놀자,8540,최근 임원감축으로 인한 내부 문화파괴 및 회사의 미숙한 조치 등
38,(주)야놀자,8540,경영진의 그릇된 방향성으로 갈피를 잃음 협업이 쉽지않은 구조
39,(주)야놀자,8540,갑자기 통보해서 장점들이 사라지고 있고 회사의 애사심을 사라지게 함
40,(주)야놀자,8540,"경영진이 직원을 소모품으로 생각하는 경향이 매우 강함. 철저한 정량평가를 추구하고 있으나, 실제 평가방식과 연봉상승의 기준을 공개하지 않으며 이해되지 않는 결과들이 많음. 수평이긴 하나 기존 인원들의 로열티는 분명 존재함."
41,(주)야놀자,8540,진척 없는 프로젝트와 자꾸만 떠나는 사람들. 정 붙이기 어려운 구조였음
42,(주)야놀자,8540,"대표가 자기말만 듣고 잘해주는 직원만 주변에 두기 때문에 회사와 직원들의 생각 격차가 엄청 큼 이게 별것 아닌것 같지만 크게 직원들에게 작용하고 있고, 사람들이 많이 빠져나가고 있음"
43,(주)야놀자,8540,무능하고 지만 생각하는 리더들 그리고 그 리더들의 리더인 오너
44,(주)야놀자,8540,다 좋으나 현재 경영 부진도 아닌데 직원들 외주로 돌리고 잘라내기식 경영
45,(주)야놀자,8540,언제든지 잘릴 수 있다는 생각으로 다녀야 하고 연봉처우 매우 낮음
46,(주)야놀자,8540,툭하면 조직 개편 희망 퇴직.. 정규직인데 고용 안정성이 비정규직 같다.
47,(주)야놀자,8540,회사 이름값에 비해 연봉이 매우 낮고 처우가 좋지 않음
48,(주)야놀자,8540,직원을 너무 쉽게 생각합니다. 회사 마음대로 내리는 결정이 너무 많습니다.
49,(주)야놀자,8540,"좋은 동료들은 희망퇴직 및 경영진의 독단적인 결정등으로 대부분 퇴사하였고, 조직문화에 좋은 영향을 주돈 컬쳐앤그로우 팀도 거의 해산상태이며, 개발팀은 구글과 아마존 리더가 구글과 아마존 출신이 아니면 다 수준이하라고 생각한다. 하지만, 그들이 결정과 확신을 준다면 충분히 이해할 수 있지만, 그들또한 어떠한 결정도 내리지못하고 직원들의 수준에 대한 비판만을 한다."
50,(주)야놀자,8540,사람 아까운줄울 모른다 사람이 없어서 정작 해야할일들을 못하고 이상한 것만한다
51,(주)야놀자,8540,통보식의 복지 운영이 큰 문제라고 봅니다. 원격은 취업사기수준으로 갑작스러운 폐지 통보 진행함.
52,(주)야놀자,8540,"수기 운영에 대한 자동화를 실패했고, 중요한 과제들을 지속적으로 미뤄와서 기술 부채가 아직도 많이 남아있다. 업무 협업을 하기가 많이 힘들고 일의 진행이 느리다. 구시대적인 미팅 방식이 계속해서 남아있다."
53,(주)야놀자,8540,젊은 꼰데가 왜 무서운지 보여주는 회사 .. 승진도 없음
54,(주)야놀자,8540,흑자인데도 희망퇴직으로 직원들 정리함 기존 부서 업무를 외주 외사에 주고 기존 부사 직원들에게 외주 외사로 이직 권유함 이직 거부한 인원들 대기발령 부서로 이동
55,(주)야놀자,8540,위 장점을 제외한 모든 부분이 단점이며 정직원으로 들어와도 언제 짤릴지모르는 회사
56,(주)야놀자,8540,"분기마다 바뀌는 경영 방침, 채용공고와 웰컴패키지에도 자랑스럽게 적었던 전면 재택을 철회한것만 봐도 짐작 가능하지 않을까요. 단점이 너무 많아 오히려 적기가 힘듭니다."
57,(주)야놀자,8540,"재택이 곧 없어짐, 복지도 점점 사라지고 있습니다. 낮은 연봉 인상률"
58,(주)야놀자,8540,오너들의 입김이 너무 강하여 관련하여 업무 진행이 드립니다. 의사결정이 다 그들의 선택에 달려 있으나 관련 충신들이 다 대거 떠나서 이대로 괜찮은가 싶어요
59,(주)야놀자,8540,"회사 성장보다 다른것에 관심이 많은 경영진, 직원들을 부품 다루듯 하는 문화"
60,(주)야놀자,8540,"위치가 강남 외진곳이여서 다니기 힘들다는 점, 사내에서 이사님을 보면 인사해야 된다는 점이 힘들었습니다."
61,(주)야놀자,8540,"신입에겐 현저히 낮은 연봉,인상률 매우적음, 부서이동 잦음"
62,(주)야놀자,8540,몇가지 복지를 제외하곤 너무 팍팍하게 움직이는 경향이 있습니다. 매출에 대한 압박이 상당했던거 같습니다.
63,(주)야놀자,8540,사내 문화 및 미래 성장성이 가장 어둡고 단점 입니다.
64,(주)야놀자,8540,보상의 부족.  개발 직군에 치우친 보상 재택 복지 사라짐
65,(주)야놀자,8540,오너 및 C레벨 리스크 상장을 위한 아메리칸 스타일로 직원을 날리고 있음
66,(주)야놀자,8540,무능한 경영진의 경영 적자는 권고사직으로 해결한다. 직원들을 소모품으로만 본다.
67,(주)야놀자,8540,임원진의 직원을 부품으로 여기는 마인드. 하루아침에 동료들과 생이별
68,(주)야놀자,8540,"수시로 이뤄지는 인사개편으로 늘 고용불안에 떨어야하며, 임원진은 그때마다 뒤에 숨음"
69,(주)야놀자,8540,썩은고인물들이 문제.연차가 쌓일수록 작아지고 있는 급여
70,(주)야놀자,8540,경영진들의 농락으로 인해 구성원들이 힘들어함. 이로인해 탈출시도가 많음.
71,(주)야놀자,8540,지속적으로 무리한 평가제도를 고집하며 형평성 및 투명성 확보가 안되어 있어 결국 부바부로 일 죽어라 하는 사람만 계속 함. 리더가 아무리 무능력해도 고치려하지 않고 결과만 고집함
72,(주)야놀자,8540,복지가 생각보다 별로였음 지금은 많이 나아졌릴 바래봅니다
73,(주)야놀자,8540,무능한 임원진 점점 줄어드는 복지 조직 간 이기주의 팽배
74,(주)야놀자,8540,"it 전반적으로 비슷하겠지만 시장흐름과 빠르게 변화하는데 익숙하지 않은 사람이라면 , 약간 힘들수있음"
75,(주)야놀자,8540,씨레벨들이 직원 알길 개처럼 알고 말이 자주 바뀌고 직원들은 일개 소모품일 뿐
76,(주)야놀자,8540,"MZ 문화이지만, 어딜가든 꼰대는 반드시 있고, 성격 뒤틀린 동료가 있다. 겉으로는 실실 쪼개지만, 속은 무시하고 싫어한다."
77,(주)야놀자,8540,목표가 불투명하고 인사팀이 자꾸 바뀜. 방향성이 없고 직원을 아낄 줄 모름.
78,(주)야놀자,8540,이 기업의 단점은 너무 많은데 일단 리더들이 개똥망이다. 폭언을 일삼는 윗사람들과 전 뒤집듯 맨날 뒤엎는 조직문화. 무 자르듯 날려버리는 많은 사람들
79,(주)야놀자,8540,"팀/프로덕트 별로 빈부(?)의 격차가 있음. 시니어 층이 두터운 쪽도 있으나 주니어만으로 구성된 곳도 있고, 개발보단 잡일에 치이는 경우도 있음."
80,(주)야놀자,8540,"경영진 3인방에 의해 많은 복지가 사라지고, 사람들의 일자리도 쉽게 결정내리는 것 같아 아쉽다"
81,(주)야놀자,8540,회사의 상황의 어려워져 규모를 축소하는 분위기입니다.
82,(주)야놀자,8540,더이상 스타트업이라고 할 수 없을정도로 경직되고 느려요
83,(주)야놀자,8540,회사는 M&A로만 성장해왔으며 내실은 다지지 않았음 구성원들을 챙기는 행동은 없으며 기업가치만 올릴려고 주력함
84,(주)야놀자,8540,너무 많아서 길게쓰기 어려움 무능한 경영진 분기마다 바뀌는 정책(갈아엎는 수준) 어떻게든 연봉인상을 막기위해 연간목표 항시변경 보고체계가 제대로 없어서 했던 보고를 최소 5번이상 반복해야함. 슬랙을 정말정말 최악으로 비효율적으로 사용중
85,(주)야놀자,8540,"나는 누구이고, 이곳은 어디이며, 우리는 무엇을 위해 있는가...에 대해서 깊은 고민을 해볼 수 있는 회사.업무이상으로 많은 생각에 사로잡히게 되는 회사"
86,(주)야놀자,8540,다들 뉴스를 봐서 알겠지먼 회사 통째로 날리면서 직원 다 짜름 근속년수 짧은 이유가 있음 직원들 다 나감 분위기 안 좋음
87,(주)야놀자,8540,발로 뛰는 영업의 한계점이 보임 / 점점 영업 사원을 줄이는 추세로 인한 불안감
88,(주)야놀자,8540,좋은 동료 외에 모든것들이 안좋은듯. 경영방식도 별로고 기술 부채를 전혀 생각하지 않음. 기술부채를 빠르게 해결해야할듯
89,(주)야놀자,8540,"- 사원에게 공유한 내용들을 절대 지키지 않고 수시로 변경하는 경영진들 (재택축소등) - 매년 바뀌는 평가 제도 - 퇴사자의 증가 및 신규 인력 채용의 부재로 개별적인 유지보수 업무 할당량이 증가하지만, 성과에 전혀 반영되지 않음."
90,(주)야놀자,8540,"실장, 임원급의 의사결정이나 업무 추진이 느려 병목이 발생한다. 특히 임원들이 직원의 사기를 많이 깎는다."
91,(주)야놀자,8540,영업파트였는데 그래서 그런지 꼰대스러운게 좀 있었습니다
92,(주)야놀자,8540,"새벽 1시 반에도 임원진메일에 답장해야 했음. 7분단위의 회의, 굴러들어온 산업전반에 대한 이해가 전혀 없는 경력직과 대우는 천지차이. 데이터드리븐을 지향하지만 정작 의사결정은 감으로 진행."
93,(주)야놀자,8540,경영진 리스크가 큰 회사. 재택근무 폐지. 히스토리 관리가 안되는듯
94,(주)야놀자,8540,이해관계자들에 의해 탑다운으로 떨어지는 업무들. 사라지는 동료
95,(주)야놀자,8540,"단점은 최근에 언론에 공개된것 처럼 권고사직 등 , 갑작스러운 재택근무 폐지 등에 대한 단점"
96,(주)야놀자,8540,"앞서 말했던 유일무이했던 유연근무제도들이 사라지면서, 거의 장점이라곤 찾아보기 어려움"
97,(주)야놀자,8540,고용이 불안하고 희망퇴직 권고사직으로 인원을 축소하고 있음
98,(주)야놀자,8540,잦은 입퇴사로 담당자가 자주 바뀌면서 업무의 혼선과 책임회피..
99,(주)야놀자,8540,단점이 많은 편 1. 조직변동이 너무 잦음 조직이 녹아들고 시너지가 나오려면 시간이 필요한데 그 시간을 절대 기다려주지않음 2. 지극히 top down 방식 님 문화를 사용하고 있으나 지극히 top down방식의 의사결정. 그 의사결정이 합리적이라고 생각들지 않으며 많은 사람들이 공감하는 부분
100,(주)야놀자,8540,야근이 필수일 정도로 업무가 주어지며 쓸데없는 보고와 회의가 너무 많습니다
101,(주)야놀자,8540,분위기가 요즘 안좋음. 일시적일거라고 생각하기는 함. 지켜봐야할 듯.
102,(주)야놀자,8540,"재택 사라질 가능성 높음, 성과평가 인색함, 연봉인상율 낮음, 부재시 동료의 업무 커버 거의 없음 (긴급한건 아니면 복귀후 본인이 모두 처리해야하거나 쉴때도 슬랙이나 이메일로 계속 처리해야함)"
103,(주)야놀자,8540,시스템이 잘 안갖춰짐 주먹구구식 운영 책임전가하는분위기
104,(주)야놀자,8540,"임원들에게서 시작되는 정치로 인하여 업무가 수시로 갈아엎어지며 진행이 되지를 않는다. 이때문에 개인들의 커리어가 박살이 나버린다. 이를 교통정리해줄 대표는 대체 무슨 생각인지 정리할 생각보다는 그저 임원들에게 휘둘려지고, 그러다 여기에 자격지심까지 발동되는지 칼을 휘두르는데 그 칼에 맞는건 일반 직원들이다. 결국 일을 못하고 정처없이 헤매다가 결국 칼맞고 나가는 직원들이다. 그리고 이런걸 이용하는 여러 직원들이 있는데, 이들은 그저 시간을 보내고만 있을뿐 업무에 대한 의욕은 없어보인다. 그저 의욕갖고 열심히 일하는 직원들만 불쌍한 꼴이며, 일을 열심히 할 때 권고사직까지 맞으면 정말 강한 현타가 온다."
105,(주)야놀자,8540,고인물의 텃세가 심하고 눈에 보이는 정치적 완력 다툼이 많이 보임.
106,(주)야놀자,8540,프로세스가 없고 매번 바뀌며 직원이 으쌰으쌰 하는 분위기가 아님
107,(주)야놀자,8540,"대표들, C레벨들은 정말 답이 없습니다 탑다운의 끝판왕을 경험함 이랬다가 저랬다가 동전 뒤집듯이 말바꿉니다 커리어 꼬이기 싫으면 입사하지 마세요…"
108,(주)야놀자,8540,"c레벨 이상의 임원 및 경영진, 창업자 리스크가 있음 경영잘못을 직원에게 떠넘김 대놓고 희망퇴직을 가장한 권고사직 모든 부정적인 카더라를 현실로 만드는 곳"
109,(주)야놀자,8540,- 상사는 별로였음 - 고여있던 초창기 멤버들이 대부분 C레벨 - 마구잡이식 사업 확장
110,(주)야놀자,8540,연봉이 안오름 극소수 몇명만 회사돈 가져가는 시스템 연봉을 올리기 위해선 이직만이 답이다..
111,(주)야놀자,8540,컴퓨터나 의자 등 사무시설이 매우 열악함. 사무용품도. 사무실 내부 환경도 매우 열악하여 직원들이 질병을 달고 삼. 병가 제대로 쓸 수 없음.
112,(주)야놀자,8540,사람이 너무 갈려나가는 느낌. 본인업무만하면된다지만 그 본인업무가 너무 많음
113,(주)야놀자,8540,별로 없음 모텔 영업이었던거 빼고 그닥 없음 크게 쓸 내용 없음
114,(주)야놀자,8540,너무 안 좋은 이야기가 많이 돌고 회사 자체적으로도 체계적이라는 생각이 안 든다. 그래서 얼마든지 더 좋은 회사에서 이직 제의가 오면 옮겨가게 된다.
115,(주)야놀자,8540,동료들이 너무 자주 바뀜. 그렇기 때문에 특정 부서에 일이 몰림 특정 경영진의 강한 피드백으로 상처받는 사람들도 더러 있음
116,(주)야놀자,8540,1. 주식을 소수에게만 부여하여 상장해도 일반 직원은 메리트가 없습니다. 2. 무상 주식을 나눠줬는데 그 수가 적기도 하고 만 3년 이상을 다녀야 하며 그마저도 가치가 반토막 나서 메리트가 없습니다. 3. 최근 고강도 구조조정을 하고 있는데 왜 하는지 아무런 설명이 없습니다. 회사가 돈이 없는 것도 아닌데...
117,(주)야놀자,8540,"-소통이 되지 않음(재택 폐지, 희망 퇴직 등 적절한 설명과 사과 없이 진행하고 대표는 해외 출장으로 자리 비움) -잘못된 사업 방향 및 실패에 대해 C레벨들은 책임지지 않음 -사업적 결정이 명확한 근거와 프로세스를 가지고 진행되지 않음 -평균 재직 기간이 2년. 히스토리 관리 전혀 되지 않고, 회사에서는 나가면 뽑으면 되지 하는 마인드인 것 같음 -비개발 직군은 찬밥"
118,(주)야놀자,8540,회사 규모에 비해 체계화 되지 않은 업무 많음(불필요 업무 리소스 소모) 팀바팀이겠지만 월급루팡들이 꽤 존재함 본인이 노력하는 것과 무관하게 반복적인 업무에 갇혀 도태될 수 있음 근속기간이 짧아 업무 히스토리 파악이 어려울 때가 많음
119,(주)야놀자,8540,이미 플랫폼으로서 망했음. 여행 서비스인척 하지만 실적 90%가 모텔 뿐인 영원한 모텔팔이 회사. 그 어떤걸 갖다 붙여도 안됨. 경영진이 놀랄 정도로 인성이 안좋고 무식하고 양심이 없으며 악하기까지 함. 비전펀드 투자도 모두 사기쳐서 뻥튀기한 사실이 드러나고 있으며 이미 구조조정 진행중. 하루빨리 망해서 업계에서 사라져야 할 기업.
120,(주)야놀자,8540,윗사람들 대체 뭘 원하는지 모르겠는 사람들. 투성이 정말 뭘 원하는지?
121,(주)야놀자,8540,복지가 다양하지 않다. 인센티브가 따로 없다. 인사팀이 바보같다.
122,(주)야놀자,8540,역량보다는 C레벨과의 정치질이 이곳저곳 많이 보임 특정 조직은 상위리더에게 의견조차 자유롭게 낼 수 없는 문화 임원들은 돈잔치 하며 구성원은 권고사직하는 선례를 만듬
123,(주)야놀자,8540,쉬운 일도 복잡하게 처리하게 만드는 프로세스 다들 2~3년이면 이직해버려서 이전 히스토리 알기 어려움 회사에 돈도 많으면서 조직 효율화를 위해 희만퇴직 실시
124,(주)야놀자,8540,미래와 비전 계획이 없는 회사 무엇을 하고 있는지 무엇을 할 것인지 아무도 모름
125,(주)야놀자,8540,놀기만합니다. 업무량이 너무 없어 회사의 부진으로까지 이어가는 기업이라고 생각해요
126,(주)야놀자,8540,파벌 형성 윗사람의 권력에 따라 부바부 복지 와 혜택
127,(주)야놀자,8540,흔히 있는 복지제도가 있으며 시그니쳐 야놀자포인트 100만이 끝이다.
128,(주)야놀자,8540,오너의 경영철학 없음 직원을 너무 가볍게 여김 낮은 연봉인상
129,(주)야놀자,8540,"갈수록 줄어드는 사업모델, 보고서 문서 작업이 비효율적"
130,(주)야놀자,8540,겉보이는 모습은 좋았지만 지금은 외부의 이미지도 좋지 않음
131,(주)야놀자,8540,"업무 체계, 보고 체계가 불투명함. 그룹장은 비전이 없어 보임. 신규 입사자들도 열심히 일하다 그냥 지쳐 퇴사"
132,(주)야놀자,8540,"""야놀자에서의 업무는 때로 급박한 상황과 압박이 있어 스트레스를 유발할 수 있으나 이를 관리하는 기회를 얻었습니다."""
133,(주)야놀자,8540,"체계가 아직도 없고, 새로 유입된 빅테크 인원들은 갈피를 못잡고 계속 이전직장 이야기만 할 뿐"
134,(주)야놀자,8540,상하복종을 강요하는 아주 군대적인 문화. 출근하자마자 허리를 50번이상 굽히는 경험을 한적있는가
135,(주)야놀자,8540,"1. 주40시간 근무제도 2. 시작 연봉 적음, 인상해도 원래 적어서 큰 차이 못 느낌 3. 영업직의 경우 인센티브 제도 변경으로 달성 어려움 (못받는 인원들 다수) 4. 영업직의 경우 말만 존댓말, 님자 사용 꼰대문화 강함 5. 영업직의 경우 초반 적응 매우 힘듦 6. 도서 구매가 한정적 (비지니스 관련 도서만 가능) 7. 자기계발 및 업무 관련 교육 지원 없음 8. 현재 권고사직 중 (현재 가장 큰 문제로 고용불안정 야기) 9. 경영진에 대한 믿음 0% (그들도 직원에 대한 신뢰도 0%) 10. 진행하는 근무가 굉장히 한정적으로 자기발전 0에 수렴 11. KPI 달성률 순서대로 공개 처형 12. 리더의 자질 편차가 굉장히 크고 변경이 잦음 13. 집중해야 하는 업무가 굉장히 자주 바뀜 14. 타부서와의 소통 부재 15. 영업직의 경우 13, 14번의 이유로 현장 몸빵 비율이 큼 16. 교육 및 OTJ 프로세스 부실 17. 산으로 가는 회사 방침 18. 파트장 부재, 리더가 되는 건 성과, 개인의 역량X, 오로지 짬순O 19. 사실상 자유롭지 못한 연차 사용 (월말~월초, 전체 회의날에는 거의 사용 불가)"
136,(주)야놀자,8540,연봉 인상이 거의 없는 상태이며 최근 많은 퇴사와 충원을 해주지 않은 상태로 힘든 상황
137,(주)야놀자,8540,기술적 성장이 많은 회사는 아니다. 편하게 즐기기는 좋지만 열정 넘치지는 않은 느낌.
138,(주)야놀자,8540,매우 자율적이라 스스로 책임져야 할게 많습니다. 구성원들이 동료보다 개인 프리랜서라는 느낌도 듭니다.
139,(주)야놀자,8540,오늘 확정 내일 바뀜의 무한 반복 업태를 모르고 도전정신만 아주 뛰어남 도구로 쓸 만큼 쓴다음 시원하게 버림
140,(주)야놀자,8540,"짜디짠 보상, 정치질이 난무하며 정치촉새들이 신바람나있는 곳"
141,(주)야놀자,8540,"정규직 전환을 하고는 있는 건지 의문, 영업팀과의 잦은 갈등 및 본사와 지사의 메뉴얼이 다름"
142,(주)야놀자,8540,내실이 엉망인데 대기업을 따라하려고 함 여기서 오는 아노미 현상은 직원들 몫
