,company_name,company_id,review_text
0,(주)종근당홀딩스,4538,수직적인 체계를 가지고 있어 사회 초년생이 일하기에는 다소 어렵고 불편한 분위기 일 수 있다. 딱히 업무에 대하여 물어 볼 사람이 없고 본인이 알아서 일을 찾아 해야한다
1,(주)종근당홀딩스,4538,"전체인원이 40명이 안되는데 임원의 수가 1/4 임. 평균의 함정으로 근속연수와 임금이 높음. 인원이 적기때문에 승진이 안되고 적체되어 있음. 종근당이 지주사이나 머든 종근당이 실시해야 홀딩스가 따라함. 지주사로서 의사결정이 없음, 90년대 사무실 문화 업무스타일 유지. 종근당이 직원 관리에 개선을 하지만 그런부분은 또 따라가지 않음."
2,(주)종근당홀딩스,4538,"신사업, 경영혁신 등의 직무를 갖고 뭔가를 해보려고 한다면 다른 곳을 가볼 것을 추천합니다. 사막에서 나무를 키우겠다는 것과 같으니 절대 이길로 들어서지 마시길.."
3,(주)종근당홀딩스,4538,직원에 대한 배려가 없으며 지금은 언론을 통해 노출이 되어 어떤지모르지만 오너의 갑마인드는 정말 최고임
4,(주)종근당홀딩스,4538,간 쓸개 다 내려 놓은 연식이 오래되고 한 물간 사람들로 임원진 구성....오너 비위 맞추는 것이 가장 큰 당면과제임.
