,company_name,company_id,review_text
0,(주)코스콤,3395,"복장이 너무 갑갑하고 재택근무가 불가능한게 넘싫어요,,,"
1,(주)코스콤,3395,업무에있어서 책임 회피 문화가 많음 조용히 하루 버티다 가려하고 가식적인 문화 자기일아니면 모른체함
2,(주)코스콤,3395,증권허브답게 인력대비 일이 다 너무 많아보입니다. 그거말고는 딱히 없어요.
3,(주)코스콤,3395,다소 연령대가 높은감이 있음. 변화에 민감하지 않고 늦음
4,(주)코스콤,3395,"어디에나 있겠지만 꼰대들이 아무래도 꽤 있음 라인, 정치.."
5,(주)코스콤,3395,보수적 분위기. 직원들이 애사심은 많지만 그만큼 일하진 않음. 경영진
6,(주)코스콤,3395,"장점에 적었지만 급여가 매우 적음, 자취생이라면 생활이 진짜 눈물날 정도,,"
7,(주)코스콤,3395,"기간제는 연봉 상관없이 똑같은 알바생 취급할 거면, 굳이 경력직 기간제를 뽑을 이유는 없지 않나... 신입 기간제와 경력 기간제와 내부에서 보는 기준은 똑같음.  1) 내부에서는 5천대 이상 기간제(대리,과장)나 3천대 기간제(사원)나 똑같은 신분으로 바라봄, 경력증명서 떼면 다 기간제일 뿐. 사원, 대리, 과장은 호칭일 뿐이다 2) 정규직이 하기 싫어서 휴직하거나 항의하는 일들을 기간제에게 줌. 메인은 절대 할 수 없음. 거절하면 부장의 협박 발언 - 내 말 대로 안하면 온갖 수단과 방법을 가리지 않고 hr에 조치 취할 것 등등 - 그럼 일을 하면 예뻐하는가? 아님. 죽어라 해도 뒷담화 작렬. 3) 정규직 비위 맞춰주며 자신을 비서로 생각하며 주제파악 잘하는 기간제에게는 매번 법카주면서 근무시간에 난임병원 택시타고 가라고 함. - 말만 잘듣고 알바생으로 자신을 생각하는 기간제에게는 법카도 주고, 일주일에 몇번이고 업무시간에 개인 병원가도 오케이함  결론) 1) 복지를 100프로 받지 못해도 꽤 좋은 레벨임. 1,2년간 알바생 취급 당해도 자존심 안상하면 이보다 좋은 회사는 없음.  2) 아무리 경력이 많고 고연봉이어도 기간제는 정규직 과장, 차장, 팀장의 비서역활임. - 대우받을 거라 착각하면 안됨  3) 정규직은 불합리한 처분에서 디펜스할 제도(대체휴가, 휴직, 팀 이동 등등)가 있으나, 기간제는 없음. 기간제에게는 조직 부적응자를 얹고 부장의 처분만 받을 뿐.  4) 정규직이 하기 싫거나 조직내에서 어렵다고 소문난 일 담당"
8,(주)코스콤,3395,야근이 많아 자기 계발 시간이 부족한거 빼고는 다 만족
9,(주)코스콤,3395,고인물들의 업무수행 능력을 보면 한숨 나오지만 억대연봉을 받아가는걸 보면 홧병난다 열외 당한 사람이 부서마다 존재하여 폭탄을 제거해도 다른 폭탄이 오기때문에 큰 의미가 없다 업무가 특정 인물들에게 몰려 불만이 쌓일수 밖에 없다 다른 회사들도 그렇지만 특히 더하다
10,(주)코스콤,3395,"사무실이 좀 낡았고, 사람들이 좀 투박합니다. 나쁘진 않습니다."
11,(주)코스콤,3395,"1. 개발/업무 환경 개후짐. 망분리, 도커 환경 없음(권한 부여해달라고 하니까 안된다고 함), 개발 서버 디버깅 메시지 복붙해서 스택오버플로우에 검색 절대 못 함, 객관적으로 직원들 프로그래밍 수준 낮음. 영어도 못하고 검색도 못 함. 도급업체 의존도가 엄청남. 2. 다 말뚝 박을 생각으로 입사해서 늙은 꼰대, 젊은 꼰대 많음. 늙꼰은 말해봤자 칸이 모자라고 G5 사원급 중에 옆 팀 후배가 업무시간에 양치질을 하녜, 휴게실을 너무 자주오녜 어쩌녜 하는 미래가 기대되는 젊꼰들 많음 3. 과장급 동 나이대 삼전, 하닉, 네카라쿠배 재직자들과 비교해서 원천 가장 후달렸음. 심지어 현금성 보상도 비중이 적음. 여기보다 못 주는곳이 훠얼씬 많겠지만 그건 관심 없음 5. 최근 이슈 보면 한국거래소도 문제 생겼을 때 나몰라라 하며 코스콤한테 책임 전가함. 정부, 금융위, 한국거래소한테 휘둘리기만 한다. 6. 복장 제한"
12,(주)코스콤,3395,"노인근로자들이 많고, 퇴직한 사람도 위탁용역으로 고용하기에 이들이 자신들의 30~40대 코스콤 재직시절 회상하면서 경력계약직을 잡부경리취급하며 하대한다. 여기에 반발하면 뒷담화 작렬하고 티나게 자신의 말에 복종하는 계약직과 차별시킴. 이들은 아직도 자신들이 코스콤 정직원이라고 떠벌리며 고객사에 잘난 척 해대는데, 뒤에서 고객사가 비웃어요.. 퇴직한 사람은 60대이기에 정말 노인 꼰대고, 계약직은 협력사 주니어보다 하찮다고 생각하고 3,4천 받는 경리로 취급하며 협력사 주니어에게 코스콤 계약직의 현실이라며 계속 꾸준히 뒷담화함. 물론 정규직 팀장급들은 자신들의 미래니까 적당히 맞춰주는 거 이해하는데, 왜 1,2년 근무하고 나가야 하는 처지에 퇴직한 전 코스콤 직원(현 소속은 중소)비위까지 맞춰줘야 하는지 몰랐음."
13,(주)코스콤,3395,부서 및 팀이 어떤곳이냐에 따라 업무강도 등 많은차이가 있는편이다.
14,(주)코스콤,3395,오래 근무하신 분들이 많았는데 그분들을 주로 회사 분위기가 형성되어 있습니다.
15,(주)코스콤,3395,1. 계약직이 정규직보다 일 많이 한다. 2. 정규직보다 계약직이 일 많이 한다.
16,(주)코스콤,3395,솔직히 눈에띄는 단점 나는 잘 모르겠다 굳이 뽑자면 정규와 비정규의 복지부분 차별이 있다
17,(주)코스콤,3395,"갑질이 심한 사람들이 좀 있고, 일과 책임을 모두 외주에게 전가하는 사람들이 좀있다."
18,(주)코스콤,3395,계약직은 걍 알바 취급. 나이 지긋한 분들이 퇴직때까지 있는곳
19,(주)코스콤,3395,"고인물들 잔치, 역피라미드 심각. 시간보내고 마실나온 사람들 정말 많음. 입만 놀리는 부장급들과 업무몰리는 그나마 젋은(?)실무자들....계급이 나눠진듯 공채>>>사채>>>>>>>>기간제>>>>계약및 파견직......지들끼지 급나누기 , 차별대우가 이런건가 싶은것이 많음"
20,(주)코스콤,3395,일하는사람이 너무많고 그런 사람과 함께 있다 보면 현타 올때가 있음
21,(주)코스콤,3395,공기업 특유의 경직된 조직문화. 보신주의 젊은 사람들은 답답할지도
22,(주)코스콤,3395,오래된 분들이 많다보니 옛날방식대로 업무처리하는 관행이 남아있어서 실무할때 가끔 어려운 점이 있습니다.
23,(주)코스콤,3395,회사가 정기적으로 게시판 글들을 통해 선언함. 기간제와 정규직은 다르다는 것을. 메신저에서부터 홍길동 기간제로 뜨고 부서 카톡에는 초대 안되며 명절 상품권 못받음. 그 외 암묵적으로 차별되는게 더 있겠지 차라리 파견직(비서)이 나은 것 같음. 메신저에 그들은 기간제로 뜨지 않음. 다른 회사 소속이므로. 너무 오피셜하게 차별함. 오래있을 생각도 없는데 계속 차별해서 정뚝떨이랄까.
24,(주)코스콤,3395,매년 연봉 인상률이 쥐꼬리임. 현재 네카라쿠배 등 주요 IT 기업에 연봉 전부 역전당함. 개발자 커리어 박살. 개발자로서는 절대 성장할 수 없음. 윗 사람들도 기술력 절대 없음.
25,(주)코스콤,3395,책임전가하기바쁨 역피라미드심화라서 신입은버티기힘들수도 부바부 사바사 엄청심함 잘못걸리면 오래다닐수 없음 개발적이야기보다 정치잘하면 잘맞을수도 망분리구조 새벽출근 적성에맞으면 잘맞을지도
26,(주)코스콤,3395,"일 없이 노는 사람 많음. 발전 없음, 고령층이 많음,"
27,(주)코스콤,3395,새로운 성장동력을 찾아야 하는 문제. 직원들 동기부여가 안되고 있음.
28,(주)코스콤,3395,회사가 발전이 없음 예전의 명성은 없음 평균 나이대 40이상임
29,(주)코스콤,3395,커리어 단절 / 급격한 연봉 인상 불가 / 다른 회사들은 많은 급여 인상이 이루어 진 것에 대비 현저하게 상승폭이 낮은 연봉
30,(주)코스콤,3395,스스로 능력이 없으면 뒤쳐지기 쉽고 끌어주는 회사는 다소 아닌듯하게 느껴짐 스스로 노력을 많이 해야함
31,(주)코스콤,3395,"복지와 급여가 앞으로 더 나아질 것 같지는 않다.(2022년 임금 상승률 0.4%) 야근비 지급 제한이 있어 사실상 포괄. 없는 것 같아도 꼰대 많고 뒤에서 말이 굉장히 많이 오간다. 재택, 복장 제한이 많음(재택 전무, 금요일만 청바지 데이 등)"
32,(주)코스콤,3395,치열한 경쟁. 경쟁하고 또 경쟁하여야만 살아남을 수 있다.
33,(주)코스콤,3395,공채로 들어가기 힘듬. 계약직인데 서류통과도 안됨 (왠지는 모름). 거래소 눈치봄.
34,(주)코스콤,3395,정직원들은 복지가 굉장히 좋으나 계약/파견직과의 차별이 너무 심함 많은걸 바라는게 아니라 웬만한 알바보다 복지가 없음 정직원 특히 고령자분둘 일 안하고 계약/외주업체에 다 미룸 오죽하면 타부서 정직원이 아무 관련 없는 파견직원한테 자기 일 시킴. 그리고 본인은 놀러나감. 회사를 놀고 먹고 자려고 오는 수준
35,(주)코스콤,3395,기업 구조상 의사 결정이 자유롭지 않다. 역피라미드 구조로 회사의 미래가 걱정이 된다. 다들 말하다시피 절간같은 조용한 분위기이다. 이 말인 즉슨 개인주의 성향이 다소 강한 곳. 장점이자 단점이 될수도 있다.
36,(주)코스콤,3395,IT회사들이 이미 코스콤을 넘어서고 있는데 아직 체감을 잘못하고 아직도 과거의 좋은시절만 생각함
37,(주)코스콤,3395,회사다니는 재미가 없음. 문화가 노후 및 낙후됨. 재미없는것 외엔 무탈함.
38,(주)코스콤,3395,문서 위주의 보고가 많아 사소한 알까지 문서화해야 합니다. 순환 보직이 많아 윗사람 이해시키는 것도 좀 어렵긴 합니다.
39,(주)코스콤,3395,쭉 다닐 수 있다보니 자기개발 없음/일 안하도 노는 사람들이 있음
40,(주)코스콤,3395,그들만의 리그라서 정치를 잘해야 합니다. 자기 라인이 없으면 일하기 쉽지 않아요.
41,(주)코스콤,3395,"일하는 사람만 일한다 , 직급은 나이만 있으면 주는 느낌 ..?"
42,(주)코스콤,3395,고인물들 절대 안나가는데 제발 눈치좀 있으면 좋겟고 미래 성장 가능성이 아에 없어요ㅡ. 세상 돌아가는 것 좀 보고 살았으면 좋갯어요
43,(주)코스콤,3395,시장에 검증된 기술을 주로 사용하기 때문에 신기술 사용 빈도는 바깥세상에 비해 변화가 느림
44,(주)코스콤,3395,직급이 낮은 사람이 일을 많이 하는 편인듯 하고 회식이 잦은 편
45,(주)코스콤,3395,파견직이라 인수인계가 6일밖에 없는게...신입인데 선임자의 인수인계 6일을 다 받을수있을지 ㅠ선임자 가면 실무진들은 이업무를 모른다는게 흠이고 선임자 가면 어떻게 해야할지 걱정임. .ㅠ
46,(주)코스콤,3395,어설픈 경영 어설픈 임원진  짜고치는 인사  혁신과는 정반대 그저 회사와 직원들 피빨아먹기
47,(주)코스콤,3395,남녀성비의 불균형. 남여사원 비율이 9:1 남성적이고 보수적인 분위기
48,(주)코스콤,3395,규모가 있는 조직이라서 업무의 결정사항이 느리게 진행될때도 있다. 개인주의적 성향이 많은듯하다.
49,(주)코스콤,3395,"-박봉박봉박봉염전염전염전ㅎ 연봉은 그냥 거의 업계최하위수준^^ -고이다못해 썩은물들..꼰머아재들천국 -위의 영향으로 도태되고 발전없는 사내분위기(까라면 까야하는 그런?) -사내 치사하고 더러운 파견 및 계약직 차별 ex. 사원증 디자인 다름, 명절 상여금X, 일부직원은 휴게실 안 열림 등(사람들끼리는 계약이라고 차별하고 그런 거 X)"
50,(주)코스콤,3395,평균 연령 매우 높아 꼰대률도 높음 그렇기 때문에 기본 문물을 못 쓰시는 분들도 많음 그렇기 때문에 매우 비효율적인 업무 가능
51,(주)코스콤,3395,"보고를 위한 보고가 많으며, 부서간 협업은 어렵다고 보면 됩니다."
52,(주)코스콤,3395,아는 사람들만 아는 회사. 체계적이지 못함. 소문이 빠름
53,(주)코스콤,3395,무능력하고 일 안 하려는 사람들이 많다. 배울 점들이 없다. 커리어의 무덤.
54,(주)코스콤,3395,연령대가 높은 편이며 모든 부바부이기 때문에 야근하는 부서도 있다.
55,(주)코스콤,3395,오래 다닌 사람들이 많아서 그런지 정치질이 좀 많은 편
56,(주)코스콤,3395,화장실 가는것도 눈치 보입니다. 다른 콜센터는 어떤지 모르겠네요.
57,(주)코스콤,3395,고령화. 하지만 고령화 타파를 위한 많은 신입 채용과 나이드신 분들이 곧 나갈 예정이라 참을만함!!
58,(주)코스콤,3395,"업무 범위가 넓고 거래소 눈치를 많이 봄, 인프라에서 업무적 통신 흐름을 파악하고 있어야됨 업무팀에서는 인프라입장은 잘 모르겠고 그냥 이거이거 되게 해달라는 식임, 고인물들이 사무실에서 자고 유튜브 보고 시시닥거림"
59,(주)코스콤,3395,IT 회사지만 도메인이 금융이고 연령대가 높아 젊은 웹 IT 회사 수준의 문화를 기대하기는 힘듬. 하지만 그런 것을 추진해볼 여건은 되는 듯. 시간 지나면 괜찮아질지도..?
60,(주)코스콤,3395,다 좋고 좋고 좋지만 딱딱한 분위기 들어가기 힘든기업인게 단점 ㅋㅋ
61,(주)코스콤,3395,"평균연령이 높은편이고, 자율성근무제와 같은 시스템이 원활하지 않음"
62,(주)코스콤,3395,안정적이지만 사업이나 문화가 정체되어있다. 노력하지 않고 안주하기 시작하면 끝없이 정체 될수 있는 커리어.
63,(주)코스콤,3395,"보수적이고 딱딱한 문화 때문에 결재 및 문서작업이 많았으며, 비효율적인 업무플로우가 있었다."
64,(주)코스콤,3395,연령대가 높은 편이라 살짝 고지식한 부분이 있다는 것 제외하고는 단점을 못 느끼겠음. 구내식당이 다른건물에 있어서 번거로운 점과 정규와 비정규의 차별이 살짝 있다는 정도?
65,(주)코스콤,3395,계약직과 파견직에 대한 업무 기대도가 매우 낮고 잘 안 시킴 그래샤 급여도 많이 적음
66,(주)코스콤,3395,영업 마케팅 분야가 오히려 제안서 등 작업으로 야근이 많음
67,(주)코스콤,3395,"재직중인 직원들의 나이대가 높고, 남성 비율이 아주 높음에 따라 보수적인 분위기가 좀 있습니다."
68,(주)코스콤,3395,금융 공기업의 모든 단점을 보유함. 연공서열 중심의 조직 구성. 능력과 성과에 정확히 연동되지 않는 인사 시스템. 느린 호흡의 의사 결정과 복잡한 보고 체계.
69,(주)코스콤,3395,근속연수가 높다는 것은 당신도 집에 안 가지만 당신 윗 사람도 집에 안 간다는 것. 저 아저씨 아줌마와 앞으로 10년 이상은 더 있어야 한다는 걸 생각하면 가끔 골아프다.
70,(주)코스콤,3395,"당신이 저년차라면 코딩이랑 전화질은 당신이 배는 더 많이 하는데 왠지 회의 때만 되면 차장, 부장이 주둥이로 이래라 저래라만 엄청 많이 해서 일은 내가 했는데 왜 말은 쟤가 다 하지라는 신세계를 맛보게 될 것. 그냥 현실을 받아들이고 이게 내 운명이구나 하고 살아가시기를 바람."
71,(주)코스콤,3395,"일을 하기 위해 무언가를 공부해야 한다는 사실을 잊은 자들이 너무 많다. 이들에게 자기 하고 싶은 것 말고 다른 거 하기 이유는 수천개이다. 가정, 나이, 업무 영역, 하던 것도 바쁜데 어쩌구 저쩌구 구태연한 이유로 기업은 계속해서 정체되어 간다. 우물 안 개구리."
72,(주)코스콤,3395,항상 같은 일만 하는 일부 직원들은 자기발전이 없는데 자기는 그 사실을 인지하지 못하고 다른 직원에게 일을 미루기만 함
73,(주)코스콤,3395,일잘하는사람만 쥐어짜는 형식 그러면서 일잘하는사람 얘긴 듣지않음 꼰대마인드가 팽배
74,(주)코스콤,3395,50넘은 아저씨들 뻔뻔함이 극에 달아있어서 고령화 사회가 되었을 때 젊은 사람들이 일 안하는 노인들 먹여 살리는 대한민국의 미래를 미리 시뮬레이션 가능함.
75,(주)코스콤,3395,고령화되어 있어서 노조 협의든 문화든 제도든 전부 나이 든 사람들에게 맞춰져 있음. 그래놓고 젊은 사람들에게는 열정을 강요함. 업무는손떼고 억대 연봉 받아가는 아저씨들 노답.
76,(주)코스콤,3395,"첫번째 단점이라면 나이드신 분들이 일 안 하고 공부도 안 하는 걸 당연하게 생각합니다. 정말 부끄러운 일인데 이 분들은 이런 문화를 너무 당연히 여겨서 뻔뻔함도 없습니다. 젊은 사람들보다 일 못하면 안 부끄러울까요?  두번째 단점이라면 조직 인사가 개판입니다. 보통 부서장 또는 팀장은 적어도 일을 아는 사람이 되어야 하는건데, 여기는 조직 개편때마다 부서장과 팀장들을 회사 전체에 랜덤 배치합니다. 부서 일과 상관없는 사람이 부서장과 팀장이 되더니 또 다음 조직 개편때는 또 부서 일과 상관없는 새로운 사람이 오고 이걸 무한 반복합니다. 부서장이 올 때마다 일의 이해도가 낮고 변죽만 때리다가 반 년만에 그냥 다시 다른 부서갑니다. 회사 전체가 총체적 난국이 아닐 수 없습니다.  세번째 단점이라면 글쎄요. 10년째 변하지 않는 채용 프로세스가 아닐까요? 채용을 왜 항상 다른 회사보다 늦게할까요? IT 회사에서 왜 IT 지식은 제쳐두고 NCS만으로 사람을 뽑을까요? (코딩 제대로 못하는 사람들 잘 들어옴.) 경력직 채용이라면 직무마다 봐야 하는 테스트가 다르지 않을까요?  네번째 단점은 아랫 사람에게 술 강요하는 것을 당연히 생각하는 한심한 ggondae들입니다. 이유는 적지 않겠습니다. 그 사람들말고 다 아니까요. 그리고 1년에 한 번이라지만 한심한 주말 워크샵도 제정신이라면 말도 안 꺼내는 게 어떨까요?  뛰어난 IT 회사들이 금융권에도 들어오고 있습니다. 언제까지 이런 문화와 답답한 프로세스를 고수해서 살아남을 수 있을까요."
77,(주)코스콤,3395,아무래도 기업 문화는 발전이 더딘 편이다. 보수적인 분위기가 강함
78,(주)코스콤,3395,고령화로 인해서 뭔가를 배워서 해야겠다는 생각보다는 기존에 하던대로 해야지란 생각을 가진 분들이 많아요. 그래서 젊은 분들은 자기 계발을 하고 싶다면 스스로 찾아서 해야해요. 그런 욕심이 없다면 뭐 ㅎㅎㅎ 그냥 회사 다니시면 되겠지만 ㅋㅋ
79,(주)코스콤,3395,"공기업 특유의 고직급들의 안주하는 태도가 매우 많음. 20년차, 30년차 되었으니 일을 손에 놓겠다는 마인드를 가지는 부장들이 있어 일이 젊은 사람들에게 몰림. 게다가 이분들 특징이 술을 좋아함. 많이 수평적으로 변했다고 하지만 심한 부바부로 아직도 수직적 문화가 존재함."
80,(주)코스콤,3395,"야근이 많음, 회사에 꼰대들이 많고 회식이 너무 잦음, 술을 강요함"
81,(주)코스콤,3395,체계적인 커리어개발 프로그램이 부재하다. 자신이 신경쓰지 않으면 한 포지션에서만 머무는 매너리즘에 빠질 수 있다. 본인이 신경쓰더라도 한 부서에서 빠져나와서 다른 포지션으로 가는 것이 쉽지만은 않다. 자신이 원하는 일을 하는데 있어서는 복불복이 작용한다.
82,(주)코스콤,3395,보수적이고 수직적인 의사결정이 있고 의사결정이 느려 팀원은 힘들수 있음
83,(주)코스콤,3395,조직의 노령화가 매우 심각. 짬차서 암것도 안하고 왕처럼 군림하는 한심한 윗선들이 수두룩. 상명하복 경직된 문화가 가히 일제시대 군대수준. 술잘먹으면 승진하는곳. 본인이 발버둥치지 않으면 커리어 무덤될수도.
84,(주)코스콤,3395,"고령화 수준이 경로당 수준. 최신기술을 공부할 의지도 필요도 없는 사람들이 회사의 90퍼센트이다. 공기업식 상명하복 군대문화가 잔존해 일을 안하더라도 짬높은 할아버지면 본부장급도 함부로 못건드린다. 젊은 직원들에게 당연하게도 일이 몰린다. 일이 몰리는것도 억울한데 할아버지들 비위 맞추고 잡다한 뒤치닥거리까지 해야한다. 연봉은 최상위지만 기술력은 중하위로, 도급업체 외주와 시장 독점에 가까운 시스템빨로 버티는곳. 기술력은 계속 떨어지는중. 기술적으로 리드해줄 선임개발자가 거의 없기에 개발자로서 성장은 매우 어려우며, 너무 어릴때 덜컥 들어오면 커리어는 아작날수도 있다는 사실을 알아야한다. 일부 부서는 개발회사가 아닌 인력 하청업체에 가깝다. IT회사라고 말하기 부끄러운 수준의 사내 인트라넷 사용중이다."
85,(주)코스콤,3395,"연령층이 높아 젊은이들이 별로 없으며, 계약직에게는 계약만료 후 다른 회사에 가면 힘들 수 있을 듯."
86,(주)코스콤,3395,철밥통이기 때문에 나태하고 안주하는 고직급의 포화. 문화를 바꾸려고 노력은 보이나 아직은 다른 IT 회사에 비해 보수적임. 신사업을 추진하고자 하지만 실력이 뛰어난 인재가 부족한 상태.
87,(주)코스콤,3395,나태하고 안정을 즐기는 분위기로 대체로 환경적인 안정감에서 오는 무기력함이 큰것으로 보임
88,(주)코스콤,3395,"나태하게 나이들어 가는 상사들, 비효율적인 업무 프로세스, 정규직/계약직/파견직 차별"
89,(주)코스콤,3395,직원들 나이가 많고 노는 직원이 꽤 있음 회식이 자주있고 개인적 성장기회가 낮음
90,(주)코스콤,3395,학습된 무기력함에서오는 낙담된 분위기. 당장의 성과와 수익을 바라는 임원들의 요구
91,(주)코스콤,3395,이것도 부서마다 다르지만 주말 출근이 잦았음 노사 가입이 필수 아닌 필수 같은 느낌 ??
92,(주)코스콤,3395,신규사업에 관심은 많으나 능력있는 인재가 없음. 일을 외주에 맡기고 관리위주라 개발 및 현장경험이 안쌓임. 기술적인 면과 적체인력이 많아 매너리즘에 빠질위험이 큼. 정작 일하는 사람은 외주 및 정직원의 10%. 출근이 빠름. 문제생기면 골치아파짐.
93,(주)코스콤,3395,1. 기간제 및 계약직들 대우는 좋지 않음. 2. 인력 적체.. 성과 중심의 승진이 아님 3. 부바부겠지만 일부 보수적인 조직이 존재(일명 ㄲㄷ) 4. 지배구조 상 거래소 사람들은 외주라고 생각한다는 불편함
94,(주)코스콤,3395,1. 기업의 고령화 평균 나이가 43  2. 8시 40분까지 출근 (주식시장이 열리는 시간을 감안해서 빠른 출근 5시 40분 퇴근)  3. 2015년 한국거래소와 함께 공공기관 해지로 인한 위기이자 기회
95,(주)코스콤,3395,"평균연령이 높은편, 그로인해 보수적인 분위기. 지주회사 체제로 변경에 대한 불안감"
96,(주)코스콤,3395,"일하는 사람들만 일함. 무능력자, 정치꾼, 아부꾼 들이 너무 많음. 실제 능력자는 아부나 정치를 못해서 승진을 하지 못함. 정말 뛰어는 엘리트는 정치나 아부 못해도 승진하기는 하지만 어중간한 일잘하는 사람들은 승진이 느림. 협력업체 직원인 제 3자가 보기에도 딱한 모습이 너무 보임"
97,(주)코스콤,3395,"업무능력과 인사평가는 별개, 해당 사람에 대한 평판이 업무와는 별개로. 회식 참석, 폴더 인사 등으로 평가되어 실제 일하는 것이 의미가 있는지 의문임, 커리어를 쌓고 싶다면 스스로 알아서 준비하고, 노력해야 함,"
98,(주)코스콤,3395,안정적인건 좋으나 시대에 맞춰 변화하는것도 중요 몸과 마음이 편해서 그런지 모르겠으나 업무외적인 이슈가 많이 발생하는듯
99,(주)코스콤,3395,"증시 개장시간 때문에 출근시간이 이른데에 비해 업무가 많아 퇴근시간은 늦은편. 과장, 차장급 직원들이 고지식한 편."
100,(주)코스콤,3395,직원들의 근거없는 자부심 이해할수 없다. 젊은 사람들이 다니기 정말 재미없는회사. 초고령화 집단.
101,(주)코스콤,3395,기업 자체의 경영 실적 악화. 향후 수익모델에 대한 고민. 지금껏 가져왔던 코스콤의 명성이 그대로 이어질지는 의문.
102,(주)코스콤,3395,공기업특성상 회사내 연령대가 높은연령층이 많다. 젊은층의 비율이 적은 편이다.
103,(주)코스콤,3395,"연봉이 많이 작고, 경험쌓기에는 좋지못해요. 업무를 더 배우고싶어도 많이 주어지지 않아요."
