,company_name,company_id,review_text
130,(주)조이시티,579,연봉이나 복지가 좋지는 않은편 사내정치도 많은편임 오래동안 성공한 게임이 별로 없음
131,(주)조이시티,579,관리자급 인데도 불구하고 무능력하고 책임전가 정치질 하는 사람들이 있음 게임 회사이다 보니 팀과 팀 끼리도 은근 갑을 관계가 존재함
132,(주)조이시티,579,"게임 회사는 다 그렇지만, 히트 상품이 안 나오는 시기가 길어지고 있어, 힘든 상황이었던 것 같습니다."
133,(주)조이시티,579,신규개발은 엔드림. 라이브서비스는 조이시티라고 보시면 됩니다. 안정적인 라이브서비스를 하며 오랫동안 회사를 다니고 싶으시다면 좋은 회사일수는 있으나 새로운 도전을 하고 싶다면 추천하지 않는 회사
134,(주)조이시티,579,엘레베이터 오래 기다림 달리 단점이라 궂이 꼽을것은 없는 편 신규 사업추진에 적극적이어야 할듯 하다
135,(주)조이시티,579,임원진의 결정에 따라 휘둘리는 경향이 있음. 주52시간 근무가 잘 안지켜지는 듯함. 강제적으로 압박 했으면 좋겠음.
136,(주)조이시티,579,"표면적으로는 수평적인 조직문화를 지향하는듯 하나, 젊은 꼰대들이 생각보다 많다. 야근을 지향하지 않는다고는 하지만 야근하는 사람을 좋아한다. (이건 팀바이팀인듯). 최근 야심차게 내놓는 게임마다 족족 망하고 있다."
137,(주)조이시티,579,"그래도 규모가 어느정도 있는 회사인데 업무 체계가 ?스러울정도로 없는 경우도 있다. 이전에 큰일없이 무난하게라는 표현을 사용했는데, 이는 그냥 말그대로 어떤 혁신이나 개선, 발전하자는 의지가 없다는 이유이기도 함..."
138,(주)조이시티,579,"지속되는 매출 및 경영악화, 모회사와의 공생관계가 발목을 잡을 것 같다."
139,(주)조이시티,579,복지제도가 다양하지만 실제로는 많이 필요가 없는것들이 대부분 신작들을 출시는 하고있지만 암담한 현실 빠르게 현실을 직시해야함
140,(주)조이시티,579,일정관리가 안되서 중간에 급하게 막 일을 끼워넣거나 수정해서 안해도 되는 야근이 좀 많습니다 프리스타일 시리즈에만 매달리고있구요 새로운 사업을 다시 시작하기도 어려운것같습니다
141,(주)조이시티,579,R&R이 없음. 다 자기일이 아니라고 함. 결국 위에서 강제로 시켜야만 일을 함.
142,(주)조이시티,579,"은근 사내정치가 존재, 직원들 연령대가 젊지만 젊은 꼰대도 상당히 존재"
143,(주)조이시티,579,모바일에서 성공작이 별로 없음 경영진 입김이 센편이라 회의가 길어지는 편 모회사가 따로 있는데 관계가 다소 명확할 필요가 있음
144,(주)조이시티,579,"1. 신입 교육 시스템의 부족 일련의 신입 교육 프로세스가 있는 것은 맞으나, 교육 전담 인력이 부족한 상황이었음. 즉, 사수나 팀장급도 너무 바빠서 신입들의 질의응답을 제대로 케어해주지 못함. 나중엔 신입들의 질문공세가 감당이 안 되어서, 사수급들이 매우 난감한 상황에 직면함. 결국 신입들은 최대한 인트라넷 자료를 뒤져가며, 질문 횟수를 줄이고 스스로 공부하는 시간을 늘려야 했음.  2. 사원들의 잦은 퇴사 개인적인 문제인지, 조직의 문제인지는 모르겠지만... 내가 들어가고 3개월 만에 팀에서 3명이 빠져나감.워낙 IT 업계가 퇴사나 이직이 잦다고는 하지만.. 7명뿐인 팀에서 3명이 나가버리면 어쩌라는 건지... 생각이 안들래야 안들수가 없음. 일할 맛도 안나고.. 아무리 이직이 잦은 업종이라지만, 솔직히 직원들 사기가 저하되는건 맞는 듯...  3. 애매한 부서관계 업무협조가 필요한 상황에서 굉장히 눈치가 많이 보임. 업무 바운더리가 겹치는 부분이 상당부분 존재함. 실제로 업무 협조를 구하는 상황에서, 자기네 밥그릇 뺏어간다고 마찰이 일어나는 상황도 보았음. 그러니 신입들이 얼마나 눈치를 봐야하는지는 말 안해도 뻔함."
145,(주)조이시티,579,퇴근할때 눈치가 보였음. 파트간의 갈등이 꽤 있어서 사이에서 눈치보고 어떻게 해야할지 몰라 곤란했던 기억이 남. 현재는 퇴사하셨을런지... 파트간의 소통을 하기 조금 힘든 부분도 있긴함.
146,(주)조이시티,579,야근은 팀바팀으로 야근 많이 하는 팀이 따로 있음. 아직 포괄임금제인점? 일을 편하게 다니고 싶은 사람은 추천하지않음 자유로우나 일에서는 전문성을 추구함 공무원 스타일인 사람에게는 추천하지 않음 회사 위치 특성상 점심값 많이듬
147,(주)조이시티,579,돈줄이 점점 줄어들기 때문에 개발위주의 회사에서 운영위주의 회사가 된 것 같습니다.
148,(주)조이시티,579,열심히는 하는데 결과가 따라 주지 않는다. 현재 주가를 보라.
149,(주)조이시티,579,성장가능성 및 발전이없음 환경도 구식이라 도태될수있음 나름 자유시간을 내발전가능성에 쓰겠다싶지만 잘되지않음
150,(주)조이시티,579,경영진이 원하면 좋던 안좋던 해야하는 것이 있음 근데 아닌걸 해서 성과가 안나옴 그건 실무 책임
151,(주)조이시티,579,게임회사인데 터지는 게임이 존재하지 않음 연봉과 복지가 아쉬움
152,(주)조이시티,579,경영진들의 주장이 모두다한 회사 그래서 출시하는 프로젝트마다 잘 안됨
153,(주)조이시티,579,사업의 경우 정치질이 만연하고 정치라인에 따른 계급이 뚜렷하여 천장 또한 매우 뚜렷함 능력보다는 정치질이 인정받음 중간임원이 사원들의 성과를 전부 가져가는 구조
154,(주)조이시티,579,턴오버 굉장히 심함. 맨날 새로운 사람 들어오고 맨날 퇴사. 왜 그런지는 들어가보면 알아요. 뭘해도 사장맘 사장이 이렇게 해 하면 단번에 모든것이 바뀌는 회사. 일이 돌아가는게 신기할정도
155,(주)조이시티,579,결정권자가 너무 많은 수직형. 이해가 안되는 결정사항이 많다
156,(주)조이시티,579,"매출과 영업이익이 불안하며, 프리스타일 위주의 매출과 기타 다른 게임의 흥행 부진,"
157,(주)조이시티,579,"윗선들의 정치와 비효율적인 의사결정, 결정은 아랫사람 말 안듣고 독단적으로 하면서 결과는 아랫사람 보고 책임지라고 함. 플랫을 빙자한 상명하복 문화."
158,(주)조이시티,579,침몰하는 배 발전가능성 전무 신규출시 게임 성ㄱㅇ 가능성 무 모기업 엔드림에 쪽쪽 빨리는 돈
159,(주)조이시티,579,재미없는 전쟁게임만 만들고 일이 너무너무 많다 개발보다는 라이브에 더 관심을가지고 사내정치가 좀있는편
160,(주)조이시티,579,인사평가가 매우 이상함. 상호평가라 칭하지만 친한사람 만들어 나눠먹기.
161,(주)조이시티,579,"메리트 없는 일들을 계속 하다보니, 매너리즘에 빠져 실력이 하락할 수 있음 개인의 발전이나 욕심을 채우기엔 회사자체의 일들은 그렇게 발전적이지 못함"
162,(주)조이시티,579,개발 수준은 학원에서 포폴만들던게 더 힘들었을 정도로 여유롭다보니 내가 개발자인지 학생인지 착각이들 정도로 배울것이 없으며 지금 남아있는 개발자들 수준 놀라울정도로 허접하며 엄청 대단한척 행동하고 다님
163,(주)조이시티,579,게임회사이다 보니 야근은 꾀 많은 편이였는데.. 주 40시간 도입된 거로 알고 있음
164,(주)조이시티,579,잦은 긴급 업무 있음 (팀장의 역량에 따라 커버해주는 영역이 다름)
165,(주)조이시티,579,"늦은 시기의 연봉 협상, 부족한 공간, 화장실 등, 낮은 연봉 인상률 등 특정 팀 우대 등"
166,(주)조이시티,579,경영진의 의사결정이 조금 보수적입니다. 주변 식대가 너무 비쌉니다.
167,(주)조이시티,579,연봉이 좀 짠편..  점심밥이 좀 맛이없다?  수면실??(조이마루)의 베드가 좀 더럽다 정도?
168,(주)조이시티,579,더 발전하고 잘할수있는부분도 그냥 일정라인까지도달하면 더이상은 하지 말라는 분위기..그냥저냥 공무원일하는 느낌이다..
169,(주)조이시티,579,"불합리한 의사 결정이 많고, 의사 결정 과정도 모호함 중간 관리자가 위의 눈치를 너무 많이 보거나 보고를 위해 답을 정해놓고 일을 하는 경향이 있음"
170,(주)조이시티,579,힘차게 으쌰으쌰 하는 느낌 보다는 별 무리 없이 일하면 정년이 보장되는 공무원 철밥통 같다고 해야할까... 이게 단점인지는 좀 헛갈리긴 한다.
171,(주)조이시티,579,게임을 못 만든다. 무능하고 게으른 사람도 역시 많다.
172,(주)조이시티,579,꼰대가 많다.. 거의 모든 의사결정은 꼰대들이 함. 급여가 적다.. 목소리 큰 사람이 이긴다.. 그냥 꼰대가 많은게 제일 스트레스. 꼰대한테 비비기 잘하면 괜찮을 거에요.
173,(주)조이시티,579,팀마다 분위기가 달라서 입사할 때 약간의 운도 필요한 듯. 대체적으로 좋은 사람들이 많은 편
174,(주)조이시티,579,나는 늦어도 넌 늦지마. 근태관리 나는 쉬어도 넌 쉬지마. 탄력근무제 나는 즐겨도 넌 긴장해. 회식 나는 받아도 넌 갖고와. 업체접대
175,(주)조이시티,579,"연봉이 그다지 높아 보이진 않고, 업무강도도 빡셈, 게임 좋아하시는분이 하면 재밌지만 게임 좋아하지 않는 사람에겐 게임용어 배우기 힘들었음"
176,(주)조이시티,579,초봉도 쎈편은 아니나 연봉상승률이 적어 어린친구들 비율이 많은 느낌.
177,(주)조이시티,579,출근시간은 9시까지인데 퇴근시간은 보장못함 너무 자기일에만 열중한나머지 신입들은 따라가기 힘듬 경우 가 많음
178,(주)조이시티,579,"윗사람들이 너무 마이크로하게 모든거에 관여함. 개발자에 대한 투자가 부족함. 모두가 실력있는 개발자 돈 한푼이라도 더 주면서 대려오려고 하는데, 그런게 없어 보임."
179,(주)조이시티,579,너무 자유롭다보니 한쪽이 열심히 일해도 다른 한쪽이 게으르게 일하는 경우가 발생. 당연히 성과도 내기 어려움
180,(주)조이시티,579,"능력이 있고 뭔가 해보려고 한다면 딱 이용당하기 좋음. 밥상 죽어라 차려놓으면 내가 뚜껑도 열기전에 여기저기서 듣도보도 못한 숟가락들이 꽂힘.  리더라고 자리 꿰차고 앉아서는 아무도 '책임'을 지지 않음. 수평적인 조직을 지향한다고 해놓고 세상 수직적. 직원 여럿의 스피커 보다 장급 하나의 스피커 비중이 큼. 일터지면 직원탓 잘되면 리더 덕분. 꽤 오래 다니면서 리더가 문제를 책임지는 모습을 단 한번도 본적이 없음  복지라고 뭐 주절 주절 써놨는데 최대한 쓰기 힘들게(귀찮게?) 허들이 존재함 근속 휴가 쓸때 해외여행을 가야만 돈을 준다던가(어린아이가 있어 힘들거나 추가 비용이 부담돼 못가면 포기해야함. 그 복지를 쓸만한 연차의 연령대가 대부분 어린아이가 있을 시기.) 경조가비가 있는데 한달이 지나면 안준다던가.(부모님이 음력 생신이라 환갑 생신잔치 하고 가면 주민등록번호 양력 기준 한달 지났다고 안주려고 함. 이건 담당 직원의 융통성에 따라 받을 수도 있음.) 이런식으로 복지마다 쓰기 힘들게 만드는 장치들이 있음. 그냥 시원하게 주는건 거의 없음.  세상에 저런애도 취직이 가능하구나.. 싶을정도로 능력없는 인원이 적지 않은데 그런 인원을 뽑아대는 인사 검증 시스템도 문제지만 아무도 아무런 조치를 취하지 않고 그의 무능력을 다 받아줘야함. 리더에게 문제 제기를 해도 어쩔 수 없다는 식의 반응.  위에 말한 저런애도 취직이 되는구나 월급이 아깝다 싶은 사람들이 꽤 높은 확률로 파트장, 팀장, 실장이 됨.  그에 반해 능력있는 작업자들을 가차없이 팀 째로 날려버린다던가 맘에 안든다고 짜른다던가 하는 일이 굉장히 자주 일어남.  특정 리더를 중심으로 무슨 조폭급 카르텔이 형성되어 아부 떨고 불합리를 참는데 소질이 없다면 빠른 시일내에 살기 힘들어질 수 있음. 실력적 성장이나 경제적 성장따위는 기대하기 힘들듯.. 오래 있을 수록 딴데 가기 힘들어짐.  있으면 있을수록 인생이 퇴보하는 느낌  엔드림이라는 회사를 설립해 조이시티 인력 조직단위로 빼감. 강제 이직.."
181,(주)조이시티,579,일이란걸 해보고 싶다던가. 개발욕심이 있는 사람들은 홧병걸릴듯.. 뭐 좀 해보려고 하면 중간 관리자가 다 막음. 점점 실력있는 사람들은 다 나가고 고인물들만 남아서 공무원화 되어있음. 여기 신입으로 왔다가 딴데 못가고 백수 되거나 다시 돌아오는 사람들 여럿 봄.(다시 돌아올 수 있으면 그나마 다행..)  설사 뭔가 능력을 발휘해서 개발이 어찌어찌 진행 된다해도 그 성과는 라인을 잘 탄 다른 사람이 가져갈 확률이 매우 높음  거의 무슨 조폭수준의 조직력으로 능력과 관계없이 자기 라인만 챙기는 리더들이 카르텔을 형성하고 있음.  따로 차린 엔드림으로 개발력을 수시로 빼감..강제 이직..
182,(주)조이시티,579,연협시 인상폭이 크게 좋지는 않았고 복지도 굉장히 좋은 수준이라고는 하기 힘듭니다. 일정에 따라 늦은 시간까지 일하는 경우도 종종 있는 편이긴 합니다.
183,(주)조이시티,579,신규팀만 이슈가 많습니다. 실력없는 장기근속자 공무원들이 꽤나 있습니다. 다수의 유들유들한 분위기속에 그들을를 주도하는 몇몇 성격이상자들이 있습니다. 인사팀은 이들을 가려내지못합니다. 업무가 아닌 감정적으로 지칠가능성이 큽니다 전체적으로 루즈한 분위기입니다. 발전해야하는 분들께는 비추입니다.
184,(주)조이시티,579,부서간 소통이 안됨 고객지원부서에서 요청한 사항 처리가 너무안되며 답신조차느림
185,(주)조이시티,579,연봉이 낮은편이고 여러가지 업무를 맡아볼수 있는 반면 한가지에 대해 깊이 배우기가 어려움.
186,(주)조이시티,579,업계에서 중견에 위치하다보니 실력있는 선배들이 꽤 3N으로 부터 스카웃되는 경우가 있어 아쉬움. 그런데 1~2년 후 돌아오시는 분들이 많긴 함.
187,(주)조이시티,579,"업무 시간이 긴 편이고 야근이 잦다. 개발 인력을 좀 험하게 쓰는 편. 또 개발의 기회는 잦으나 신중한 개발을 한다고 보긴 어려우며, 경영진이 개발에 개입하는 경우가 잦다. 반면 프로젝트 실패의 책임은 대부분 개발진이 지게 되며 팀의 해체 및 이동이 잦다. 잦은 팀의 해체 및 이동은 경영진의 의도 중 하나여서 쉽게 바뀌진 않을 것."
188,(주)조이시티,579,얼마나 큰 회사라고 정치질 개심함. 게임의 본질에 충실하기보단 돈만 벌면 되는 집단으로 변해가는 중에 퇴사. 지금은 대주주도 바뀌었고 해서 어떨지 잘 모르겠음.
189,(주)조이시티,579,"그냥 그렇다로 요약되는 무던함. 치사한 기타 제도들, 공무원 마인드로 다니게 되는 회사. 맨날 붐벼서 똥싸려면 회사밖을 나가야 하는 화장실"
190,(주)조이시티,579,다니면 동기부여가 부족해진다. 까딱하다간 진짜 아무데도못감.
191,(주)조이시티,579,썩 분위기가 좋지는 않다. 연봉인상률이 아주 낮다. 인센티브는 거의 없다시피 한다. 회사가 직원을 소중하게 생각한다고 느껴지지 않는다.
192,(주)조이시티,579,회의가 다소 많은 편이라 자료 준비로 야근하는 경우가 많음 경영진이 회사 밖으로 도는 경우가 많은 것 같음
193,(주)조이시티,579,"워라밸이 전혀 없음.. 밤샘근무는 당연하고, 복리후생에 대해 신경쓴다 하지만, 딱히 좋아보이진 않음. 다른 게임회사에 비하여"
194,(주)조이시티,579,매일 같은 것만 한다. 딱히 실력이 늘어날거 같지 않다. 열심히 하면 하는대로 안하면 안하는대로 흘러간다.
195,(주)조이시티,579,인사 평가에 대해 불투명 개발자로서 오래 다니면 발전하기 어려움 정치라인에 배제되면 열심히해도 대우를 받기 어려움 연봉 상승에 대한 기회 저조
196,(주)조이시티,579,나는 그냥 아르바이트생이여서 잘 모르겠지만 사내정치가 심하다고 들었고 그거에 힘들어하시는 분들이 계셨음.
197,(주)조이시티,579,연봉이 업계에서 높은 편은 아니고 일정 이상 근무 시 자신의 전문화된 영역 구축이 어려울 정도로 개인에게 주어진 담당 업무가 많음
198,(주)조이시티,579,업무 배분이 체계적이지 않고 주먹구구식 일 때가 많다. 부담스럽지 않은 업무강도는 월급루팡하기 좋은 환경일지도.. 욕심이 있는 사람들이 오기에는 좋지 않다. 조금 고여서... 새로운 시도를 하는 사람들을 좋게 보지 않기 때문. 안마의자. 마사지. 눈치.. 정말 안보일까..?
199,(주)조이시티,579,"퇴사 전 경영진의 발표로 신규 프로젝트는 신중하게 대신 큰 지원(개발비용)으로 시작하겠다 라고 하였는데, 너무 많이 신중한 것인지 새로운 프로젝트를 보지 못했습니다. 모회사 엔드림으로의 파견이 종종 발생하여 사원들의 불안감이 존재했습니다."
200,(주)조이시티,579,형편없는 연봉. 기준이 없는 인사평가제도. 해외여행을 가야지만 지원해주는 어이없는 복지정책. 직원들이 문제제기를 해도 전혀 듣지않음. 불통의 아이콘. 사내 문화 최악. 팀간에 협업을 할때 서로를 배려하는 마음 따윈 없으며 어떻게 하면 자기가 책임을 안질까? 어떻게 하면 내 실수가 뽀록안날까만 생각하는 문화
201,(주)조이시티,579,"연봉 인상률이 너무 낮고, 경영진의 실무 개입이 심합니다. 엔드림 설립 이후 자체 개발력은 점점 더 나락으로 떨어지고 있다고 생각합니다."
202,(주)조이시티,579,복지제도가 미흡하고 팀 간의 커뮤니케이션이 미흡하다. 임금이 높은 편은 아니다.
203,(주)조이시티,579,"업무 시간 이후에 임원진이 돌아다니면서 야근 인원 체크함. 복지가 별로임(예)야근 식대 7,000원). 필요 없는 직원 내침. 지원 부서 간 협력은 기대 ㄴㄴ"
204,(주)조이시티,579,안정적이지만 그만큼 혁신적이거나 발전적인 프로젝트를 진행하기는 어렵다.
205,(주)조이시티,579,경영진에서 까라는대로 까면 욕은 실무자가 다먹어서 짜증나는게 단점입니다 경영진만 아니면 딱히 단점이 없을수도?
206,(주)조이시티,579,개발진보다는 경영진 파워가 쌤 도전정신이 인재상인데 글썌...?
207,(주)조이시티,579,연봉 인상률이 거의 업계최저수준이라 상실감이 올 확률이 크다
208,(주)조이시티,579,체계가없음. 주먹구구일 일처리 왜 이게임을 만드는지 알수없음 망할거를 만들면서도 알거같음
209,(주)조이시티,579,하나의 결정이 내려지기 전까지의 과정에서 말이 바뀌는 일이 잦다. 경영진들의 프로젝트 개입이 너무 심함. 고생해서 일하는 사람 따로 입으로만 일하는 사람 따로...
210,(주)조이시티,579,분위기가 편한만큼 루즈한 면이 있어 단시간에 화려한 타이틀을 쌓고 싶다면 좀 비추.
211,(주)조이시티,579,정치가 심하고 관리자로 승진하는 상당수 사람들은 업무 능력보다는 역시 정치로 승진! 이직 할수 있는 능력자들은 많이 떠난 상태라서 업무적으로 성장이 불투명.
212,(주)조이시티,579,"정치가 심한편, 여성에 대한 차별이 있음 (실무진들이 여성이 많은데 비해 장급에는 거의 없음), 모바일 사업쪽은 프로세스가 없고 업무 R&R 분배가 제대로 되어있지 않음"
213,(주)조이시티,579,"말을 잘하는 사람이 빠르게 인정받고, 프로젝트 영향력이 큰 편이다. 대리 이후부터는 어느정도의 정치가 필요해진다."
214,(주)조이시티,579,연봉이 낮은편. 혁신의지가 없음. 신규 개발 의지 없음.
215,(주)조이시티,579,크게 실패도 없는듯 하나 크게 발전도 없는듯 앞으로도 비슷한 규모로 운영될 것 같다 생산성이 너무 떨어지는건 아닌지
216,(주)조이시티,579,"경영진에 의해 실무가 좌지우지됨, 사업에 전문성이 있는 경영진이 없음(겜알못), 프로젝트 계약이 전반적으로 이상함"
217,(주)조이시티,579,사람들간 능력차이가 많이난다. 양극화가 심한편. 채용이 쉽지않다
218,(주)조이시티,579,게약직은 너무 불쌍하다 ㅜㅜ 계약직 정규직으로 전환을 해주면 참 좋겠습니다.
219,(주)조이시티,579,자주 변경되는 의사결정 및 조직개편으로 부서 간 협의에 필요한 형식 및 절차 부족.
220,(주)조이시티,579,"메이저 게임 회사 중 하나 이지만, 아주 높은 연봉을 기대하기는 힘듭니다."
221,(주)조이시티,579,아무래도 높은 연봉을 기대하기는 힘들지만 기회를 발판으로 삼는다면 좋을것 같습니다.
222,(주)조이시티,579,정치가 너무 심함. 오픈시기에 따라 심각하게 업무량이 많음. 관리자에 따라 다르지만 오버워크에 대한 보상이 적절히 이루어지지 않음
223,(주)조이시티,579,신작이 잘 안나온다 윗선에서 프로젝트 드랍시키는 경우가 많음 연봉이 생각보다 짜다
224,(주)조이시티,579,각 부서간 정치질 유망 임원으로 인한 파벌 조장 및 정당한 보상 상실
225,(주)조이시티,579,사공이 많다. 정확히는 주도적인 사공의 방향성이 갈피를 못잡는다.
226,(주)조이시티,579,윗분들의 의견 한 마디에 팀 프로젝트의 근간이 흔들려 하고자 하는 바를 제대로 시행하기 어려운 적이 꽤 있음. 회의 시간이 너무 계획없이 갑자기 결정되는 경향이 있어 일정조율에 난감해 했던 적이 꽤 있음.
227,(주)조이시티,579,개발 쪽은 케바케로... 공무원 같은 곳도 있었고 하루종일 게임하거나 자다 퇴근하는 사람들도 있어서 불편. 비합리적인 인사평가제도
228,(주)조이시티,579,비합리적인 의사결정. 명확하지 않은 부서 간 RNR로 인한 서로 책임지지 않는 분위기.
229,(주)조이시티,579,인사팀이 연봉에 인색한 느낌이다. 사내정치가 은근 보였다.
230,(주)조이시티,579,"인기투표같은 인사평가, 잦은 구조조정으로 인한 고용 불안, 생각보다 직장인으로써 비 상식적인 생각을 갖고 있는 직원이 많음..( 일진 놀이, 근태 불량.. 등 )"
231,(주)조이시티,579,실적만을 올리기 위해 모바일 중국 사업으로만 박차를 가하는 모습이 보임.
232,(주)조이시티,579,체계적인 업무와 전문성을 갖추기에는 조금 부족합니다.
233,(주)조이시티,579,죽을만하면 게임 하나씩 갑툭튀로 떠줘서 생명연장하는 기술이 있는 회사. 사람들은 순수하고(?) 좋음. 소위 강남권에 있던 회사 다니다 여기 갔을때 느낌이 서울에서 그리 멀지않은 곳인데 되게 먼 시골에 있는 회사로 들어간 기분..?
234,(주)조이시티,579,"장점이 단점도 됨, 더불어 근무량에 비해 낮은 연봉이 최대 단점"
235,(주)조이시티,579,회사 역사에 비해 생각보다 업무체계나 히스토리 정리가 잘 안어되있다. 혼자 배우고 헤쳐나가면 좋겠지만 그러지 못하면 꽤나 스트레스
236,(주)조이시티,579,보상이 적절한지 의문 결정이 빠르지 않음
237,(주)조이시티,579,장기적인 투자가 용이한 편은 아닙니다. 방향이 자주 바뀐다. 또는 역동적으로 의사결정한다?
238,(주)조이시티,579,"프리스타일, 룰더스카이등 히트작이 있지만, 히트작이 좀더 나와야 발전할 수 있을듯"
239,(주)조이시티,579,개발 비용에 대한 투자가 인색. 최소한으로 필요한 인원만 유지되면 더 뽑지 않는 분위기. 이걸 나머지 인원들의 야근으로 커버해야 함. 시도하는 것이 많기도 하고 경영의 필요에 따라 조직 개편이 자주 있음. 코워커가 자주 바뀌다보니 업무 프로세스 정립이 안되는 부분도 많아 다소 개척자 정신이 필요.
240,(주)조이시티,579,업무가 많음. 현재는 모르겟지만 예전 기준에 상당히 많은 업무가 주어짐. 지금도 다시 또 하나의 서비스가 성공해야는 압박있을 것 으로보임. 어떤 기간 기준으로 나름 중박이상 게임 나옴. 프리스타일-프리스타일 풋볼 등등
