,company_name,company_id,review_text
524,(주)야놀자,8540,아직도 스타트업같이 일함. 정확한 일의 배분도 되지 않고 더 잘할 수 있는 능력이 있는 사람을 기계처럼 부리기만 함. 의사와 상관 없이 발령도 남.
525,(주)야놀자,8540,"직속 리더의 역량에 따라 조직의 분위기가 크게 좌지우지됨, 기업문화가 아닌 조직 리더의 문화가 기업문화가 되버림, 불평불만을 가진 직원이 타회사 보다 월등히 많은듯"
526,(주)야놀자,8540,보고를 위한 작업이 많아 실제 프로세스에 효율이 더딘 경우가 많았음
527,(주)야놀자,8540,회사에서 뭘 자꾸 해주지만 리더십 관리가 젤 시급함. 사사건건 지적질에 수시로 멘탈 털기는 문제임. 일주일만 일하면 자존감 바닥치고 손들고 나갑니다.
528,(주)야놀자,8540,"보고와 회의가 많아서 비효율적, 전형적인 탑다운 형식의 업무"
529,(주)야놀자,8540,부서끼리 소통도 잘 안되며 기본 가이드 무시하고 해달라는식의 요청이 많음 일 하는 사람은 하고 안하는 사람은 안해도 아무도 모름
530,(주)야놀자,8540,"모두가 개인주의를 지향한다 리더, 팀장등이 나의팀에 대한 으쌰으쌰가 적고 자기 살 길 찾기만 바쁨"
531,(주)야놀자,8540,리더평가 도입시급 팀 내 이끌어주는 으쌰으쌰 분위기보다 팀장급이 자기 살기만 바쁨 인사팀이 기본업무도 제대로 이행안함
532,(주)야놀자,8540,진상 고객들과 후처리 빨리 하라는 재촉. 업주와 고객 모두를 상대해야하고 분쟁이 일어날시 중간에 껴서 이리 까이고 저리 까임
533,(주)야놀자,8540,"평균 나이대가 20~30대가 주축이라 연봉도 낮고 어린애들 장난처럼 비교적 수평문화이다 하지만 이 어린애들도 벌써 4~50대가 하는 꼰대짓을 하고있어 놀랍다. 파벌 . 몇명이 독식구조 초창기멤버인 소수가 일명 고인물,썩은물로 불리면 끝까지 퇴사안하고 남아서 특유의 분위기조장 및 유도"
534,(주)야놀자,8540,팀장이 둘인데 그중 한명때문에 원래있던 팀원들 거의다나감.근데 본인은 지때문인거 모를거임.지가 편해하는 남자팀원들말고는 대화할 일이 거의 없기때문.가끔 말할때는 상대방 존중이라곤 찾아볼수 없음.얼떨결에 운좋게 팀장달아서 역량이 부족한느낌.사람이 못됐다기보다는 그냥 예의가 없음.말한마디한마디가 본인은 생각없이 내뱉는데 듣는사람한테는 상처로 꽂히는 스타일. 팀장바뀌고 팀 분위기바뀜.그리고 보상이라곤 눈씻고 찾아봐도 없는데 업무평가?직원평가?왜하는건지 알수가없음.회사의 문제는 개발자만 존중하는 분위기.비개발직군은 항상 우선순위가 뒤로 밀려나있는느낌.연봉인상률은 엄청낮고 통보방식.
535,(주)야놀자,8540,워낙 커져서 프로젝트 진행 시 부서간 조율하기가 어려움
536,(주)야놀자,8540,일부 실력 없는 리더들의 행진..연봉 대비 과도한 업무로 퇴사하는 직원들 너무 많음..부서간 이기주의 있음
537,(주)야놀자,8540,상장 관련 희망고문 직원들에게 쓸돈을 다른곳에 많이 쓴다. 1조 몇조 기업가치 이러지만 전혀 이해가 안 가는 가치 빨리 나가고 싶게 만드는 리더들. 말이 통하지 않는 통보식 연봉협상
538,(주)야놀자,8540,팀바팀과 비즈니스 중요도에 따른 특정팀에 힘이 실리는게 어쩔수 없이 있음. 개발 / 비개발 직군의 대우 차이가 좀 있는 편. 직원들에게 전체적으로 인색한 편. 탑다운으로 꽂히는 업무들은 압박이 좀 있는 편. 올라갈 수 있는 포지션에 한계가 있는 편. 극소수를 제외하면 직책자들은 대부분 외부 영입으로 이루어짐.
539,(주)야놀자,8540,"젊은 층이 다수여서, 경쟁 아닌 경쟁 의식이 있으며, 스타트업의 이미지로 젊은 층에게 열정 페이 강조하고 있음 전산이 체계화 되어 있지 않아 수동적인 작업이 많은편 임 결론적으로 대외적인 이미지에 비해 근무자들의 연봉이 낮음 편임."
540,(주)야놀자,8540,단순 보고 업무가 상당히 많으며 리더 바뀔때마다 보고 양식도 바뀜
541,(주)야놀자,8540,왜인지 모르겠는데 건물을 2개 나눠서 사용함. 대부분 회사가 그렇듯 회사가 같아도 사업분야랑 업무가 다르면 서로 업무적으로 마주치면 서로 당황해
542,(주)야놀자,8540,"아직 확실한 체계가 없음. 구글 드라이브와 엑셀에 의존, 파트마다 사용하는 프로그램이 너무 다름"
543,(주)야놀자,8540,"계약직 연봉이 너무 낮음,그 외에는 별다른 단점은 없었음"
544,(주)야놀자,8540,의사결정이 애매하고 고인물들의 기가쎈편 입니다. 고인물 천하
545,(주)야놀자,8540,"젊은 꼰대들의 집합소, 군대식 문화, 야근이 당연한 회사, 아부떠는 사람이 승자, 경쟁구도 심화시킴, 평일 저녁이 없음, 브랜드 이미지와 다른 꼰대 회사, 대부분이 1년차인 이유가 있다, 전부다 퇴사하기 때문이다, 정말 추천하지 않는다, 기업리뷰 안 좋은 이유가 있었다"
546,(주)야놀자,8540,이상한 사람들이 많음. 이상하다는 의미는 기업이 가진 '결'과 맞지 않지만 경력으로 포장되서 업무에 도움이 안되는 리소스가 꽤 많음
547,(주)야놀자,8540,분명한 평가 지표가 있지만 사람에 따라 유동성이 생기는 아이러니 팀장의 능력 부재 능력은 없지만 꼰대력은 만렙인 사람이 감투를 쓰니 내부 불만이 커지지만 관심 없는 회사
548,(주)야놀자,8540,체계적이지 않은 문화. 대기업으로 가는 방향에서 나오는 노이즈 있음
549,(주)야놀자,8540,가족같은 분위기를 바탕으로 직원들을 많이 굴렸음. 내부 승진은 거의 없고 외부 인력이 헤더로 들어가죠. 야놀자에서 인정받으며 일하고 싶으시면 다른 곳에서 커리어를 쌓으세요.
550,(주)야놀자,8540,재택 근무 실시로 팀 사람들 대면이 적음. 팀바팀이겠지만 개인주의 성향이 있음. 자회사는 연봉 테이블이 맞지 않음. r&r / okr 세팅 너무 힘듦.
551,(주)야놀자,8540,문서작업이 좀 많았습니다. 아직 프로세스구축이 필요한 부분도 있어 조금 힘든부분도 있었습니다.
552,(주)야놀자,8540,규모와 외부 인지도에 비해 내부 체계가 없다. 주먹구구식의 업무가 많다. 업무가 정리가 안 되어 있는 부분이 너무 많다.  본사 건물이 오래되어 화장실이 아쉬움
553,(주)야놀자,8540,고인물 리더급 정치질로 돌아가는 회사 부서간 갈등 심함 부문장/그룹당 한사람 독재와 컨펌으로 돌아가는 구조 수평문화 지향하는척하는 꼰대들 많음 IPO끝나고나면 더 엉망진창일 듯
554,(주)야놀자,8540,스타트업이라 잡혀있지 않은 부분도 좀 있었지만 이정도 단점은 스타트업 기업은 당연할거라 생각합니다 많이 지난 시기였지만 그래도 좋은 감정으로 일하다 나왔습니다
555,(주)야놀자,8540,"단순보고를 위한 문서작업이 많고, 특정부서의 지원이 미비한 편"
556,(주)야놀자,8540,너무 성과만 바라고 현재 상장 준비중이라 현시점의 직원들이 모두 고생이네요.
557,(주)야놀자,8540,중간 관리급이 너무 예민하고 정신없음 일분배의 기준이 감정적으로 보임
558,(주)야놀자,8540,프로세스가 자주 바뀌고 공유도 절 안 되고 고인물이거나 계속 바뀌거나
559,(주)야놀자,8540,체계없이 일이 진행되는 것들이 많음. 여러 팀이 협업해야할 때에도 프로젝트 리더가 없어 중구난방 난리도 아닐 때가 많음.
560,(주)야놀자,8540,솔직히 체계는 좀 많이 부족한 것 같다. 그래서 페이퍼워크나 중복으로 공유해야하는 일들이 은근 많다.
561,(주)야놀자,8540,부바부가 심하고 사람 차별 심하고 고인물(능력없는)장급들이 많음 사원에 대한 존중이 있는척 하지만 막상보면 1도없음
562,(주)야놀자,8540,부서이기주의 심해서 업무진행 잘 안됨. 일부 헤더급들의 마이크로매니징. 네쿠카라배에 못미치는 복지나 처우 있는사람 안챙기고 그냥 새로 뽑을생각하는게 눈에보임.
563,(주)야놀자,8540,개인플레이가 강해서 업무 떠넘기기가 심한듯 성장하는 회사이다 보니 여러가지 업무들이 주어지는데 처리하기 벅참
564,(주)야놀자,8540,"무능한 위급(고인물) 많음 그래서 불만이 이래저래 많이들림 그외에도 이러쿵저러쿵 소문 많은 회사 사람이 많으니깐 그럴수잇다 쳐도 그거에 비해 소문좋아하는 사람 개많음 그리고 회사가 중요한 부분을 잘 공유 안해주거나 숨김 그러다 어디선가 문의하거나 글올리면 공유해주거나 통보해줌 , 월급 오르는거?기대하지마셈"
565,(주)야놀자,8540,"복지가 다양하지만 파견직에게는 해당X 초특가 연봉 심심하면 회사 체계가 바뀜 (잦은 자리배치, 조직 변경) 파견직에 대한 제대로된 평가 체계X 로 죽도록 일해도 계약직,정규직 전환 희박 . 알아서 살길 찾아야함 사람들 퇴사하는 이유를 돌아보고 돌려막기식 채용은 시정해야할듯 싶습니다 제발..."
566,(주)야놀자,8540,"말 그대로 미래가 없다. 승진이나 직급상승은 따로 없고, 그냥 앉아서 고객 예약확인 , 고객응대. 끝!"
567,(주)야놀자,8540,열심히 일한만큼 주지않음 꼰대문화 존재. 술 강요하던 문화였음 지금은 어떤지... 뭔가 기업문화랍시고 보여주기식이 많았던것으로 기억함
568,(주)야놀자,8540,팀.실별로 아직 체계화 구축이 진행중이라 힘든부서는 힘등.
569,(주)야놀자,8540,"강당에 모두 집합후, 부사장이 훈계함;;; 직원 평균연령이 무척 젊어서 그런지 학교인줄알았음. 경영전략이 그당시 굉장이 유치한 거짓 설정 마케팅을 했었음."
570,(주)야놀자,8540,연봉 너무 짬. 그지같은 평가체계 들고와서 사람을 재단하기 바쁨.
571,(주)야놀자,8540,개발 부서 외 처우 불만 입사할 당시 느낌 동아리 현재 느낌 동아리 지만 정치가 존재함 수평문화를 추구하는 꼰대들이 많음
572,(주)야놀자,8540,회사의 성장과 직원의 성장간의 괴리가 있다. 조직간의 커뮤니케이션 비용이 상당하다.
573,(주)야놀자,8540,낮은 연봉 인상률 신입과 연봉 차이가 안난다 투자를 받아도 직원들한테 쓸 생각없다는 대표
574,(주)야놀자,8540,성과 압박이 좀 있고 업무 속도가 너무 빨라서 조금만 뒤쳐지면 따라가기 어려울수있음
575,(주)야놀자,8540,회의가 많다. 레거시가 많다. 부서마다 천지차이. 근속년수가 엄청 짧음.
576,(주)야놀자,8540,개인의 업무량이 과함 그래서 부득이한 연장근무를 할수밖에 없는건데 인원충원으로 업무분담을해주는게아니라 연장근무를 못하게 막아버려서 무료봉사중...
577,(주)야놀자,8540,꼰대가 생각보다 많습니다 라인이 있습니다 (라인 잘못타면 아래사람보다 진급이 밀림)
578,(주)야놀자,8540,성장과 확장 이면에 직원을 중요함을 잊음 비 기술회사라고 생각하면 이해되는 구조
579,(주)야놀자,8540,정치가 심함 / 정치로 인해 부서가 하나 날라감 현재 부문장 라인으로 모든 부서 장들이 배치되어 있음 장기 근속 처우 없음 잦은 업무 및 부서 변경 R&D 외 잡부
580,(주)야놀자,8540,리더의역량에 따라 편차가 너무 큰 곳. 의견은 많으나 수용되지 않음. 경우에 따라 한 그룹이 아예 없어지기도 함. 회사의 각종소식은 기사로 먼저 접한다
581,(주)야놀자,8540,장점 제외하고는 모두 단점이라고 볼수있음. 회사가 가고자하는 방향이 뭔지 이젠 도통 모르겠음.
582,(주)야놀자,8540,너무바쁘다?ㅋㅋ처음와바서그런지정신이 없긴했어요 처음입사해서
583,(주)야놀자,8540,개발직군과 비개발직군의 차별이 눈에 보일 정도. 개발 팀 간에 정치 관계가 있음. 그 외에는 사실 잘 모르겠음
584,(주)야놀자,8540,1.영업직을 노예로 본다 2.쪼기만하고 보상은 없다 3.윗 사람들 배부르기 위해 아래 직원들이 일한다 4.힘든 코로나 시기에 매출적인 부분을 엄청 벌어와도 영업직은 찬밥
585,(주)야놀자,8540,"직원들이 궁극적으로 원하는 부분에대한 것은 정작 외면하고 사탕하나 더주기 식으로 당장 달래놓고 눈만 가려놓으려 하는데 너무너무 훤히보인다. 젊은인원들이 많으나 젊은꼰대도 정말 많으며, 라인을 잘 타면 출세길로 갈 수 있는 확률이 높으나 그렇지 않다면 일만 고생고생하다 언젠간 팽당할듯"
586,(주)야놀자,8540,"빠른 성장이 있다보니 성장통이 따르기 마련이죠 그래서 정신적,육체적으로 많이 힘들었던것 같습니다."
587,(주)야놀자,8540,씨티오가 멍청하고 무능력해서 4명 개발파트장 수준이 400명 알앤디 조직을 이끌고 있음. 말 다했지 뭐.
588,(주)야놀자,8540,"애매한 커리어와 능력을 가진 중간관리자들이 있어 팀장급, 매니저급의 업무를 어렵게 만드는 경우가 있는 것 같고 여전히 퇴사자가 많은 것을 볼 때 평가나 보상, 교육 등 개선이 필요한 측면이 많다고 생각됨"
589,(주)야놀자,8540,다양한 경험을 할 수 있으나 발전 가능성이 없음. 이직을 생각하게됨
590,(주)야놀자,8540,"안보이지만 사내 정치가 있고, 경쟁이 있다. 인사평가 제도의 문제가 좀 있고, 새로 오는 직원들에 밀려 기존직원들이 눈치보는 경향이 있다."
591,(주)야놀자,8540,인수인계가 제대로 이루어지지 않은 팀이 대다수 체계가 없는듯
592,(주)야놀자,8540,무능한 상사들 천지라서 앞으로 발전가능성은 정말 없다고 봄. 과연 인수한 회사에서 성공시킨 사례가 있는지..
593,(주)야놀자,8540,Ceo에 너무 집중된 의사결정 구조 불투명한 평가와 보상 체계 다소 드라이한 사내 분위기 무능력한 일부 리더들
594,(주)야놀자,8540,"인지도가 낮다. 젊은꼰대 매우 많고, 업무 협조 안됨, IPO한방 노리고 온 루팡 들이 많다. 쿠팡 출신들이 주요 지위에 배치 되어있다."
595,(주)야놀자,8540,다양한 활동들이 실질적으로 영향가는 없음. 부서가 문제가아닌 경영진의 문제
596,(주)야놀자,8540,평가 보상 프로세스 최악 동기부여가 안되요 조직장도 소속 직원의 직무를 모르는듯
597,(주)야놀자,8540,목표가 터무니없이 높고 지역을 선정하는데 있어 기존직원들 이 대부분좋은지역을 선점해서 신입이 비집고들어가기가 쉽지않음
598,(주)야놀자,8540,"겉은 수평 문화, 속은 군대식 문화 눈 가리고 아웅식의 대처 방법이 난무 하는 회사 결정권자의 개인 감정이 난무하고 공정성이 없는 회사 R&D는 정직원, 이외의 부서는 아르바이트"
599,(주)야놀자,8540,"팀 / 부서 리더십 실력 없음, 괴롭힘 문화 있는 팀도 있음 (무관심, 비협조)"
600,(주)야놀자,8540,군대문화가 아직 있고 업무강도가 엄청나서 놀랬습니다 눈깜빡ㅎㅏ니 몇달이 지나가있고 제 삶이 없어진 기분입니다
601,(주)야놀자,8540,탑다운 찍어 누르기 많음. 무리한 kpi. 보고를위한 쓸데없는일이 많음.
602,(주)야놀자,8540,연령대가 너무 낮고 자유로워서 업무 협의 및 정리가 잘 안됨 이 문제로 잦은 퇴사
603,(주)야놀자,8540,스타트업을 못 벗어남 =체계 없음 젊은 꼰대 많음 다면평가 아님 상여 없음 (명절 상여 20만원) 직원을 도구처럼 생각
604,(주)야놀자,8540,어느정도 되면 사람 물갈이가 됩니다. 조심하셔서 생활하시길 바랍니다.
605,(주)야놀자,8540,업무의 프로세스가 정비되지 않은 채 주먹구구식으로 일하며 변화만 추구하는 듯 하다
606,(주)야놀자,8540,초창기 멤버들 중 일부는 여전히 남아서 높아진 인력 품질을 따라오지 못한다.
607,(주)야놀자,8540,연봉이 인상이 안된다........ 신입이 나보다 연봉이 높은 그지같은 상황 ㅠ
608,(주)야놀자,8540,초반에 자리잡기 힘듦 일이 갑자기 몰릴 때가 있음 주말에 갑자기 오류나면 일해야함
609,(주)야놀자,8540,경험을 쌓기에는 좋으나 미래비전이 크게 없다고 생각됌. 야근이 다소 있음. 직원에게 관심이 없으나 너무 없음
610,(주)야놀자,8540,"업무량이 어느정도 있으며, 야근하는 날도 어느정보 있습니다."
611,(주)야놀자,8540,인수인계 전혀 안됨. 업무 히스토리 없음. 다들 중간건너 뛰기로 생각하는듯. 근속년수 1.3년이 모든걸 말해주는듯
612,(주)야놀자,8540,입퇴사자 교육이 없어 각자도생해야하고 커뮤니티 들지 못하면 낙오되는 부족주의 시스템
613,(주)야놀자,8540,너무 개인주의적인 분위기여서 좀 삭막하게 느껴질 수 있다.
614,(주)야놀자,8540,"- 업무의 특성상 차량 이동이 많고, 관리지역이 모텔이 다수 다 보니 어려움이 있다. - 군대식 조직 문화가 약간 있다."
615,(주)야놀자,8540,단 죙일 일했음. 그냥 대기조였다고 생각됨. 팀장도 별로 그냥 다 별로
616,(주)야놀자,8540,"실력없는 거품 인사, 오래근무한 고인물에 잘못 걸리면 어려운 직장생활을 하게 됨, 그들보다 실력없는 본인을 탓해야 하겠지만 쉽지는 않음"
617,(주)야놀자,8540,업무를 하며 커리어의 성장을 크게 기대하기 어렵다. (부서마다 다르지만)
618,(주)야놀자,8540,신생회사라서 인지 체계가 부족하다는 것을 느낄 수 있었음. 팀제라서 인지 팀장이 최고직급인가 싶지만 팀장의 권한이 부족하기때문에 문제 해결능력이 다소 부족하다는 면이 있었음
619,(주)야놀자,8540,체계가 그렇게 많이 잡혀있진 않은 느낌. 주변 퇴사 많음
620,(주)야놀자,8540,전체적인 분위기가 딱딱하다. 그래서 일에만 집중할 수 있는 분위기라 만족스러움
621,(주)야놀자,8540,자잘한 야근이 잦음 업무 분담이 잘 안되어 있음 업무량이 주어진 시간에 비해 많음
622,(주)야놀자,8540,야근은 없지만 일의 강도와 상관없이 성의없이 업무성과 평가하는 내부 시스템 연봉협상하기엔 정말 좋지않은 회사케이스
623,(주)야놀자,8540,기회를 만들기가 어려움 주어진 일에서만 열심히 해야되고 시키는 일에서만 퍼포먼스를 내야함
624,(주)야놀자,8540,IT회사다 보니 개발자/비개발자 간 대우 차이가 있음 입사자 퇴사자가 많고(2-3년 채우고 이직하는 사람 많음) 통이 큰(?) 회사는 아님 회사는 성장하고 있지만 연봉은..
625,(주)야놀자,8540,업무에 대한 압박이 강할 수 있음. 부서별로 업무의 강도가 천차만별.
626,(주)야놀자,8540,업무가 너무 많고 야근이 허다함 서로 업무에 대한 책임을 떠넘기기에 바쁨
627,(주)야놀자,8540,그럼에도 숨막히는 분위기였는데 표정들이 안 좋았음 이후에 면접 볼때나 회사 분위기 체크하는 습관이 생김
628,(주)야놀자,8540,"한줄평에 쓴것 처럼 계속적인 인수 합병등을 통해 점점 이게 뭐하는 회사인지 모르게 되고 있다. 외부에서 사람들이 유입되면 회사 내부의 문화로 흡수되어야 하는데 거의 이민 난민촌 처럼 다 섞이고, 팀바팀 사바사로 분위기 실적이 극명하게 나눠지는 것  + 팀바팀이겠지만 12시까지 퇴근 못하는 특정 팀도 있다"
629,(주)야놀자,8540,항상떠들썩한 피파실과 예측이 불가능한 미칠듯한 업무량..
630,(주)야놀자,8540,사내 시스템이 좀 올드하고 비효율적인점. 연봉인상율이 낮은편
631,(주)야놀자,8540,"인사평가가 지맘대로임, 사내정치가 심함, 고인물이 많음"
632,(주)야놀자,8540,생각보다 지켜지지 않는 복지가 있음 너무 많은 변화가 빠르게있어 적응하면 변함
633,(주)야놀자,8540,출신에따라 대우가 천차만별이다 포괄임금제인데 야근을 하지말라고한다 야근을 안하게 일을 줄여주던가...
634,(주)야놀자,8540,"내외적으로 2년제라는 평가를 받는다. 스톡옵션과 싸이닝 보너스로 묶어두려는 경향이 있고, 이것이 기한만료되면 미련없이 떠난다. 사람이 많이 바뀌어서 히스토리 파악이 안된다."
635,(주)야놀자,8540,"구글 코리아 출신들도 드문 드문 있는 걸 보면 전직장 베이스로 연봉을 잘 맞춰주는 것 같습니다. 다만, 기존에 있던 인력들에 대한 처우(연봉상승률 애매, 성과금 제로)는 부족한 편이라 1년제, 2년제 회사란 말이 있을 정도로 이탈이 잦습니다."
636,(주)야놀자,8540,야근이 많으며 야근 횟수를 능력과 동일하게 생각하는 분위기
637,(주)야놀자,8540,"야근야근야근, 사람 갈아 만드는 회사, 연봉 매우 짬, 아무도 모르게 점점 없애는 복지"
638,(주)야놀자,8540,"수기업무가 너무 많음. 기본적인 CRM툴도 없어서 자료찾다가 허송세얼 시간 낭비, 했던거 맨날 반복이고 고객관리 하나도 안되고 기획을 하러왔는데 허구한날 바보짓한다는 생각이 많이 듬. 인사와 부서 간 밸런스도 개판이라서 같은 조직 내에서도 팽팽 노는 조직이랑 밤새는 조직 같이 있는데 이빨 잘터는 놈들이 언제나 일 잘한다는 인식. 조직장은 제 살길에 바쁘고."
639,(주)야놀자,8540,조직변경이 너무 잦아 업무가 계속 바뀌어 피로감이 있다 회의가 너무 많은 편 입사 후 온보딩이 잘 되지않아 적응하기 힘들다
640,(주)야놀자,8540,체계가 없었음 연봉이 낮았음 일이 많았음 사람이....
641,(주)야놀자,8540,연봉도 초특가 아닌사람도 적지 않게 있는겨 같긴 함 내부에서 보면 집단 이기주의가 많이 있다
642,(주)야놀자,8540,어느 회사가 그렇든 레거시가 발목을 잡음 레거시 규모가 너무 큼
643,(주)야놀자,8540,"아주 다양한 연령대가 ~님 문화로 수평구조라서 팀장이라도 책임을 크게 갖고 업무를 임하지 않는다. 찐 능력있는 사람이 승진하기보단 어쩌다가, 아님 말만 잘하면 올라가는 인사구조. 인사 이동이 굉장히 잦다. 입사 2년 안되어서 자리 이동이나 인사 이동 4번은 한듯? 회의, 업무 뭐든 다 공중분해가 잘 되고, 굉장히 이상하다고 여겨졌던 게.. 회의 미팅이라고 컴퓨터 들고 왔다 갔다 하는 사람들 진짜 미팅스러운, 진짜 회의스러운 회의 하는 거 못봤다... 미팅 회의 많으면 일 많이 하는 줄 아는 문화. (다소 젊은 연령대가 많아서 그런 듯) 다들 의지와 말만 있고 어떻게(how)하는 행동력은 없고, 평가와 평판에만 혈안되는 보여주기식 일만 함. 회사가 나름 큰 기업이지만 어디 계열 사이트 하나만 봐도 구조가 탄탄하지 않은,, 하다 만 느낌의 프로젝트가 참 많다."
644,(주)야놀자,8540,잦은 회식 및 출장으로 체력적으로 힘듬(코로나 때문에 안하겟지?)
645,(주)야놀자,8540,팀장들이 너무 젊어 산으로 감 어딜가든 정치 싸움이 많고 말이 많음
646,(주)야놀자,8540,"수평적 문화 추구하지만 현실은 탑다운밖에 없음 줄어드는 복지와 연봉 이해하기 어려운 평가제도 야근 수당 없음 발전 없는 분위기, 진국은 점차 나가고 익숙해서 다니는 경우 태반"
647,(주)야놀자,8540,"R&D 아니면 분위기나 대우 안좋을수 있고, 연봉상승률도 쏠려있음 성과금구경도못해봄"
648,(주)야놀자,8540,1. 잦은 업무 방식과 조직 변동 2. 개발과 비개발 직군의 차별 3. 연봉
649,(주)야놀자,8540,프리랜서 1000명이 다니는듯한 회사. 입사 초반엔 서러웠던 적도있음. 신규입사자 케어가 너무 부족함. 초반 셋팅하는데 어려움이 많음. 알앤알이 너무 쪼개져있어 뭐하나 알아보기가힘듬. 갠플 심함. 나쁜건 아니지만 너무 개인주의임. 불필요한 순간에선 팀플하려고함
650,(주)야놀자,8540,야근이 많고 가끔 주말 출근도 있었고 급여가 정말 짜다
651,(주)야놀자,8540,"회사의 규모가 커지고, 동시다발적으로 업무가 진행되다 보니, 역시 업무강도가 무척 쎕니다."
652,(주)야놀자,8540,비알앤디직종은 사람취급 안해줌 제도가 너무 자주 바뀜 평가제도 아무도 이해못함 퇴사율이 높아서 업무공유가 잘 안됨
653,(주)야놀자,8540,복지가 별로 없음. 타부서와 협업하기 힘이 듦. 업무량이 많아 스트레스가 많음.
654,(주)야놀자,8540,개인이 성장을 하기에는 부족한 부분이 있음 지속적인 성장미래가 보이지 않았음
