,company_name,company_id,review_text
0,(주)프레인글로벌,10514,수직적인 분위기에 당연히 팀바팀이겠지만 여성 리더들이 많은 회사이다보니 성격들이 너무 드세고 기분파들이 많음. 업무도 많아 죽겠는데 리더 눈치 보느라 더 힘듬
1,(주)프레인글로벌,10514,눈치보임. 자유로운데 막혀있음. 1년 흐름이 끊어지는 클라이언트들도 있음. 프로세스 없음. 좀 주먹구구 느낌...
2,(주)프레인글로벌,10514,높은 업무 강도로 야근이 잦습니다. 업무를 조금 더 나눠야 할 것 같은데 나눌 수 없습니다.
3,(주)프레인글로벌,10514,아직은 부족한 복지 연봉 부서와 계열사 간의 연계성 부족
4,(주)프레인글로벌,10514,"일을 정말 끊임없이 하는 곳.. 많이 하는 사람은 진짜 많이 하고, 노는 사람은 맨날 놀았음 하는 일에 비해 보상이 너무 적다고 느꼈음"
5,(주)프레인글로벌,10514,부바부긴 하지만 대다수의 사람들이 12시간 근무는 디폴트로 들어가는 듯 해요.. 밤늦게 자주 보이는 사람이 있어요....
6,(주)프레인글로벌,10514,토스처럼 3인이 동의하면 퇴출하는 기능 만들면 좋을거 같다
7,(주)프레인글로벌,10514,"직원을 부품으로 생각, 임원들의 의사소통 능력 최하, 미디어 관리 잘 안되서 애드버도 많이 씀"
8,(주)프레인글로벌,10514,"매우 아쉬운 복리후생.. 명절때마다 너무 실망스럽고, 동종업계 중에서도 연봉 짠 편이다. 그에 반해 한 사람이 소화해야 하는 일의 양이 많아 사기가 떨어질 때가 많다."
9,(주)프레인글로벌,10514,중간 관리자의 부재로 판단력이 흐려지는 시점이 옴. . 야근비 없음
10,(주)프레인글로벌,10514,어디에나 있듯이 빌런 한두명 정도 있긴해요ㅠ 근데 정도가 심한…
11,(주)프레인글로벌,10514,"연봉 후려치기, 입사후에도 극악의 인상률 승진해도 그렇게 안 오름..."
12,(주)프레인글로벌,10514,연봉인상률 낮음 때문에 다음 회사로 도약하기 위한 곳으로 생각하고 경험을 쌓는다는 마인드로 다녀야함
13,(주)프레인글로벌,10514,"다른 팀과 교류 부족, 자기계발 비용 지원 부족(대학원 등)"
14,(주)프레인글로벌,10514,임원진의 조직관리가 매우 부족하다고 생각듦 줄줄이 퇴사자가 한둘이 아님
15,(주)프레인글로벌,10514,"능력 없는 임원들로 인해 팀장, 팀원들이 고생하는 곳 전문 CEO가 있다고는 하지만 창업주 한 마디에 모든 것이 결정되는 회사"
16,(주)프레인글로벌,10514,에이전트와 함께하는 업무로 커뮤니케이션 스킬이 필요하며 에이전트에 상황에 맞춰 움직여야하기 때문에 시간적인 부분이 아쉬움
17,(주)프레인글로벌,10514,"안주하는 경향이 있고, 최상위 경영인들의 능력치가 높은지 잘 모르겠다."
18,(주)프레인글로벌,10514,"부바부 팀바팀이 심함 팀에 따라 야근이 많기도, 플젝 경험을 많이 못쌓기도.."
19,(주)프레인글로벌,10514,"연봉이 낮은 반면 업무강도가 상당히 높은편이라, 그에따라 조직문화도 안좋을 수 밖에 없음. 사람들이 여유가 없어보이는 것이 제일 안타까움. 워커홀릭처럼 바쁘게 일하는 것 자체에 만족하는 사람들이 많은 느낌인데, 거기에 매몰되면 일만하다가 시간도 없고 남는돈도 없을 수 있어서... 구조적인 변화가 필요해보임"
20,(주)프레인글로벌,10514,에이전시 특유의 주먹구구식 업무 치는건 어쩔 수가 없는 듯.. 디지털 PR에는 미흡한 부분이 많고 전문성이 높지 않음. 언론 쪽에 훨씬 강하고 pool도 넓음 10년 이상 된 임원들 정치싸움 눈에 다 보이고 고여버린 느낌.. 다니는 동안 팀원들은 대체로 좋았음
21,(주)프레인글로벌,10514,"임금이 상대적으로 타기업, 타분야에 비하여 적다. 클라이언트에 따라 업무량이 과도한 경향이 있다."
22,(주)프레인글로벌,10514,내부에서 밥먹을 자리 너무 부족함. 워라벨 없음. 임원진 너무 많고 팀바팀. 안 좋은 팀 들어가면 더 힘들어지는 회사
23,(주)프레인글로벌,10514,"기혼자들에게만 좋은 사내복지 지금도 그런지는 모르겠지만, 업 특성상 야근이 잦다."
24,(주)프레인글로벌,10514,사바사 팀바팀이 심하다는 점 업무의 강도부터 팀의 분위기 편차 큼
25,(주)프레인글로벌,10514,"공격적 혁신성이 부족한 플래닝의 아쉬움, 연봉과복지개선필요"
26,(주)프레인글로벌,10514,"외주기반으로 운영이 되기 때문에 클라이언트에 맞춰 업무를 볼 수밖에 없으며 기획자,마케러 외에 제작자에 대한 지원이 아쉽습니다"
27,(주)프레인글로벌,10514,고인물 임원들이 많아서 발전하기 어려운 회사...운 좋게 일찍 들어간 사람들 놀이터
28,(주)프레인글로벌,10514,마케팅 대행 사업 외의 사업과 시장에 대한 이해도가 낮은 채로 시스템 없이 저렴한 인력을 데려다 씀
29,(주)프레인글로벌,10514,일하는 사람만 일하고 이상한 사람도 많은데 임원급이 사람관리를 못함
30,(주)프레인글로벌,10514,대표가 바뀌고 실적 압박이 심해졌다 직원의 소중함을 모르시는 듯... 급여가 업계 최저라고 함
31,(주)프레인글로벌,10514,연봉이 너무 짜다 동일한 노동이면 다른 회사서 훨씬 많이주고 일도 쉽다
32,(주)프레인글로벌,10514,워라밸 0% 야근이 너무 많아 지칠때가 많고 매니저들도 그걸 케어할 여력이 없음
33,(주)프레인글로벌,10514,임원이 왜 많은건지? 그돈으로 코딱지만한 직원들 월급을 올려주세요.. 이 회사는 빛좋은 개살구. 윗분들이 '우리는 1위다'의 뽕에 심히 취해계심
34,(주)프레인글로벌,10514,개인의 역량에 모든 것을 걸고 있음. 관리자 역할을 하는 사람들이 적음.
35,(주)프레인글로벌,10514,"어떤 상사를 만나느냐에 따라 업무가 미친듯이 늘어날수도. 적절히 나뉠 수도 있다는 점... 일 안 하는 사람은 안 하고, 하는 사람은 미친듯이 하는 구조. 근데 일단 결과가 좋으니 위에서 별 말이 없다는 점이 문제인데 인지를 못하는 듯. 언젠가 그러다 좋은 사람 다 놓치고 후회할 것 같다. 주니어는 오래 못 버티고 나가는 구조(실제로 사원급이 별로 없음) 매주 금요일마다 4시에 퇴근하는 해피프라이데이 제도는 좋지만 실제로 4시에 퇴근하는 사람은 별로 없다(팀바이팀)"
36,(주)프레인글로벌,10514,"늘 하던대로 하던 것만 함. 제안서도 늘 복붙, 회사 이름만 위상만 믿음"
37,(주)프레인글로벌,10514,팀과 팀 소통이 안된다. 서로 굉장히 호전적이다. 회사는 알면서도 방치하고 그냥 돈만 잘 벌어오라고 닥달한다.
38,(주)프레인글로벌,10514,"모든 광고대행사가 똑같겠지만, 예상할 수 없는 급건이 많습니다."
39,(주)프레인글로벌,10514,클라이언트에 따라 업무 강도 미칠수 있음.. 이건 업계가 동일할듯
40,(주)프레인글로벌,10514,너무 수평적이고 딱딱한 분위기가 아쉽다 상사 눈치를 너무 많이 봐야하는 분위기
41,(주)프레인글로벌,10514,"타 탑티어 대행사보다 낮은 급여 및 부족한 복지, 어느 조직에도 있겠지만 일 안하는 체리피커들에게 별도 푸쉬가 없음, 진리의 팀바팀 등"
42,(주)프레인글로벌,10514,인턴입장에서는 잘 모르지만 대행사는 늘 박봉이 문제인듯합니다.
43,(주)프레인글로벌,10514,임원진들이 직원을 조선시대 노비 그 이상으로도 취급하지 않는 분위기. 반말 들어가며 박봉에 굴려지고 싶다면 입사하시길 팀바팀이지만 잘못만나면 신입드잡이 좋아하는 고인물들에 시달릴 가능성이 농후함 동네 못배운 애들처럼 신규인원에 텃세 부리고 소리지르는 사람이 이상하게 많음.  대행사다보니 여기에 고객사 갑질도 감내해야한다 웃긴 건 같이 갑질 감내해야하는 갑을병정 중 정인데 같은 정끼리 급나누고 정치질함. 갑에게 배운 갑질 그대로 카피하는게 군대가 따로없음  대체적으로 사고방식이 올드해서 비판 수용 못하고 과거에 취해있기만 함 국내 1위 기업이라고 광고하는데 어차피 이 사업 망해가는 사업이라 서울역 거지가 박스 자랑하는 격임 전반적으로 구성원들이 메타인지가 없는지 현실을 잘 못보는 듯
44,(주)프레인글로벌,10514,팀바팀 심해서 팀 잘못 걸리면 업무 외 스트레스가 많음
45,(주)프레인글로벌,10514,야근이 많았는데 수당은 없습니다. 보상에 대한 고민이 필요한 회사
46,(주)프레인글로벌,10514,연봉이 작다 매우 작다 인센티브 없다고 보면됨 일이 몰리면 너무 몰린다 주니어급 자주 그만두는게 이유가 있을듯
47,(주)프레인글로벌,10514,"연봉 낮은 업계에서도 더 연봉 낮음, 워라밸 대체로 괜찮은 편이나 팀바팀 클바클이 심함, 야근수당 없음, 디지털이 아직 약한 편"
48,(주)프레인글로벌,10514,아무래도 근무시간이 일반회사와 다른다 보니 애로사항이 있음
49,(주)프레인글로벌,10514,자유로워 보이지만 꼰대 문화 만연한 곳 세련된 느낌은 외부인의 시선으로만 느낄 수 있는 곳 본인들 라인이 아니라고 생각하면 가차없이 소모품 취급하는 임원 무능력한데 버티는 게 전부인 임원
50,(주)프레인글로벌,10514,"아직 기혼자/유자녀 중심 복지 팀바팀, 파트별 온도차 심함"
51,(주)프레인글로벌,10514,고인물의 감정 쓰레기통이 됨. 대략 5~7 명 정도가 한 포지션을 두고 입사 퇴사를 반복하는 동안 임직원은 해당 사안에 대해 귀막눈감 시전. 악순환의 반복.
52,(주)프레인글로벌,10514,"팀바팀이지만 개인주의(장점일수도?), 매우 섭섭한 복지…..(명절선물 진짜 맴상해)"
53,(주)프레인글로벌,10514,파트장에 따라서 클라이언트가 크게 차이남. 팀바팀 사바사. 좋은 팀 가면 좋고 성과 안 좋은 팀 가면 워라밸이 없는 거 같음
54,(주)프레인글로벌,10514,팀바팀으로 야근을 밥먹듯이 할 수 있음 야근을 안하고 워라밸을 챙긴다면 연봉이 적음 성과급 지급 체계 불투명(특히 대표 특별인센티브는 받은지도 모르는 사람 많아서 말 많았음) 자유로운 분위기인만큼 프리라이더가 종종 보임
55,(주)프레인글로벌,10514,일이 너무 많음. 야근 너무 많이 함. 점심 시간 제대로 채워서 밥 먹고 쉬어본 게 손에 꼽을 정도.
56,(주)프레인글로벌,10514,인력 관리 잘 안되고 일 하는 사람만 하게 됨. 연헙 같은거 기대도 못함. 일만 그냥 시킴.
57,(주)프레인글로벌,10514,"팀바이팀 분위기가 심함. 사장 새로 바뀌면서 대리과장급들에게 실적 압박 심하며, 개개인별 클라이언트 편차가 심한편"
58,(주)프레인글로벌,10514,"연봉이 짜고, 가끔 일 안하는데 도가 튼 인간들이 있음. 상사 중 은은한 꼰대력을 내뿜는 사람이 있는데, 본인은 꼰대 아닌줄 알아서 나의 오래된 지병인 저혈압이 자동치유되었다.팀별로 업무량이 들쭉날쭉한 것도 흠이다."
59,(주)프레인글로벌,10514,"전보다는 많이 좋아졌으나, 아직 연봉 등의 처우 부분은 아쉬운 점이 많습니다"
60,(주)프레인글로벌,10514,야근이 필요할 때가 잦았다. 인싸 문화가 있어서 소심이들은 노력해서 적응을 해야하는 편이었다. 캐릭터나 개성이 강한 사람이 존중받는 만큼 무색무취의 사람들은 감정노동을 좀 해야할 수 있다.
61,(주)프레인글로벌,10514,재택근무마저도 의미없어지는 업무량. 삶을 포기해야되는 최악의 극악무도 스케줄 무능력의 끝을 보여주는 팀장…어느팀은 퇴사가 매월 나옴. 평생의 실수라면 이곳에 온거….건강이 너무 악화됐다 ㅠㅠ
62,(주)프레인글로벌,10514,야근이 너무 많습니다. 해피프라이데이 제도를 실질적으로 쓰기 어렵습니다. 팀바팀이 심합니다. 개개인에게 매출 압박이 심한 편입니다. (때문에 업무량이 야근을 할 수밖에 없음) 그러나 팀의 책임자가 책임을 소홀히 합니다.
63,(주)프레인글로벌,10514,"직원수가 200명이다되지만, 팀바팀이며, 체계가없이 일하는 팀이 더 많다. 임원이 곧 팀의 사장이며, 각각의 팀이 회사인것같다. 규모와 네임벨류의 프로젝트가 너무 거품임."
64,(주)프레인글로벌,10514,팀바팀 심하고 팀에서 맡는 브랜드 규모나 특징 차이도 심함 약간 적은 보수
65,(주)프레인글로벌,10514,"팀마다 각기 다른 분위기, 고객사에 따라 천국과 지옥을 오가는 업무량 (대행사의 체질적인 문제가 아닐까)"
66,(주)프레인글로벌,10514,"1. 일이 많다. 대행사란 어쩔 수 없다지만 프로젝트 집중시기에는 9시-11시 퇴근이 디폴트고, 더 늦게 퇴근하면 새벽 1-2시까지도 종종 간다. 2. 개인당 고객사가 3-4개라, 일이 진짜 정말 진심 많다 (위랑 같은 말) 3. 최근 인센 제도가 신설되서, 1년 단위로 보상이 쏠쏠하지만, 그래도 평균 연봉 생각하면 동종 인하우스 마케팅 직원 대비 1천정도 낮은 거 같다. (내피셜)"
67,(주)프레인글로벌,10514,보고를 위한 보고가 없지 않은 편 정산 과정이 복잡했으나 최근 많이 개선됨 대부분 직원들간의 소통이 많지 않다 (개인플레이 가능/장점이자 단점)
68,(주)프레인글로벌,10514,짠 연봉...야근 포괄임금 인력 부족...기존 직원들도 나가고 신규 입사자도 나가고
69,(주)프레인글로벌,10514,고객사 수주 등은 그래도 윗선에서 해줘야하는데 갈수록 아래직원에게 그 롤이 전가되고 있는것 같아 아쉽습니다
70,(주)프레인글로벌,10514,위의 모든 장점이 심하게 팀바팀이라는 것. 팀장의 성향에 따라 분위기가 극과극. 네임벨류에 비해 연봉 낮음
71,(주)프레인글로벌,10514,"업무 분담이 터무니없음, 일하는 팀/ 일하는 사람들만 맨날 야근함 아닌 사람들은 적당히 루틴 업무만 하면서 워라밸 챙김 업무량에 못 따라오는 페이"
72,(주)프레인글로벌,10514,기업이고 싶지만 어쩔 수 없는 구멍가게임. 중소기업 그 이상 될 수 없는 애매함. 회사 이름 대면 사람들이 모르는데 정작 본인들은 본인이 최고인줄 안다.
73,(주)프레인글로벌,10514,"광고 관련 프로젝트를 맡게되는 팀이 있는데 전문적인 CD라든지 디자이너, 카피라이터 등의 직원이 없음. 그래서 결국 또 외주를 써야하고 외주 비용이 나가다보니 불필요한 돈을 쓰게 되는거같음."
74,(주)프레인글로벌,10514,"직원들을 위한 복지제도가 많이 없음, 타기업에 비해 연봉이 낮은 편"
75,(주)프레인글로벌,10514,국내 1위에 걸맞지 않은 처우. 초봉이 낮아 동년차 네임드 중견 대기업 연봉 맞춰가려면 이직 몇 번 해야한다
76,(주)프레인글로벌,10514,저연차 때는 그럭저럭 다닐만... 성장에 한계가 있는 듯
77,(주)프레인글로벌,10514,"팀바팀. 공채 기수 문화 강한 편, 경력직은 정보를 얻는 데 한계가 있음."
78,(주)프레인글로벌,10514,모든 대행사가 비슷하지만 인력 대비 업무량 과다. 사원급이 대리~과장 업무를 대신하는 등 저연차부터 해야할 업무가 많음.
79,(주)프레인글로벌,10514,"인력관리가 안됨. 직급이 높은 사람들이 많은 역삼각형 구조라, 오더를 내리는 사람은 있으나 직접 실행하는 사람이 부족해 일을 하는 사람만 하는 악순환의 반복. 상부는 문제라고 생각하지도 않는 것이 문제."
80,(주)프레인글로벌,10514,스케쥴 보고 및 시간별 보고가 너무 많음. 유연성 있는 휴가 필요.
81,(주)프레인글로벌,10514,- 업무 프로세스 비효율적(본인들은 일 잘하는 줄 앎) - 편가르기와 뒷담이 넘치는 팀 분위기 - 야근을 많이 하는 것을 일이 많아서라고만 생각하는 편(일을 효율적으로 하면 야근을 안해도 될텐데)
82,(주)프레인글로벌,10514,내부 또는 팀끼리도 자료나 내용이 공유되는 게 부족한 것 같습니다. 내부 커뮤니케이션이 조금 서툰 점이 있습니다.
83,(주)프레인글로벌,10514,다양한 클라이언트 경험을 기대하고 입사했으나 본인이 배치된 팀에 따라 커리어에 도움되지 않는 업무만 하고 나올 가능성 농후 낮은 급여 수준 개인주의 문화로 업무 협업을 기대하기 어렵고 신규 입사자들의 사내 적응이 어려운 편 주니어들이 줄줄이 퇴사하는 이유가 있음
84,(주)프레인글로벌,10514,사람들 개인적인 성향이 너무 강함 도와주는 사람이 없어서 적응 하기 어려울 수도 있음  재고떨이 수준 경악스러운 추석 선물..
85,(주)프레인글로벌,10514,매니저들의 도움을 받기 쉽지 않음…. 명확한 가이드와 실력있는 매니저들이 더 많았으면 좋겠다.
86,(주)프레인글로벌,10514,개인주의. 업무 전달 제대로 안해줌. 인수인걔도 제대로 안하고 퇴사해서 새로 온 사람은 난감하기도 함
87,(주)프레인글로벌,10514,당연하지만 대행사 특성상 모든 것이 고객사 위주로 돌아감 그래서 어떤 팀은 신규 온보딩에는 관심도 없고 존중도 없음 그저 일 시키기 바쁨
88,(주)프레인글로벌,10514,팀별로 업무나 분위기 차이 큼 팀 잘못 걸리면 아주 괴로운 구조
89,(주)프레인글로벌,10514,"팀바이팀으로 업무 난이도 및 분위기가 갈리며, 내가 잘해도 같은 라인에 묶여있는 다른 팀이 못하면 혜택이 제외될 수 있음 운없게 팀 잘못걸리면 매일 야근, 총알받이는 기본"
90,(주)프레인글로벌,10514,연봉이 짜고 미혼대 대한 복지가 아주 안좋은 편 연봉 쩌
91,(주)프레인글로벌,10514,퇴사율이 높은데 그만큼 입사자도 없어 인수인계가 제대로 되어지지 않음 파트바이파트겠지만 팀원의 의견 잘 받아들여지지 않음 복지가 없음. 올해 추석선물 최악 충격
92,(주)프레인글로벌,10514,연봉..최선입니까 진리의 팀바팀. (팀간 격차가 심한편) 오래 다닌 사람들이 많다는게 단점으로 작용하기도.
93,(주)프레인글로벌,10514,"일부 파트의 경우, 다양한 경험 쌓기가 쉽지 않아 고인물 될수도 있을 듯. 그리고 팀바팀...진리의 팀바팀.."
94,(주)프레인글로벌,10514,"야근수당 없음 사무실에 파티션이 전혀 없다, 뻥뚫린 대학교 도서관 같음 그리고 팀바팀이지만 팀자체 협업 보다는 혼자 알아서 일하는 분위기 강함, 이 부분에 답답함을 느낄 수도 있음 백업이 없는 편이라 휴가 시 업무 분장에 어려움이 있어서 결국 휴가 때 노트북 들고 가는 둣.."
95,(주)프레인글로벌,10514,연봉이짜다 올려줬다는데 그것도짜다 디지털은 약한느낌 회사차원에서 투자안하는 느낌
96,(주)프레인글로벌,10514,"기획자 밑에서 일하는데 일정이 많이 빡빡했고, 그냥 막 줘요! 이렇게 하는게 맞나?? 싶을 정도..!"
97,(주)프레인글로벌,10514,야근수당 없음 기혼자 위주의 복지가 많음 미혼 복지 부족
98,(주)프레인글로벌,10514,"팀바팀으로 팀 성과 역량에 따라 지급 개인 역량도 중요하나, 팀 배정도 어느정도 운이 적용해야 함"
99,(주)프레인글로벌,10514,최근 경영지원부서의 인원 이탈이 많음. 최고경영자가 회사운영보다는 다른 잿밥에 더 관심이 많음.
100,(주)프레인글로벌,10514,힘들고 일이 많아요 월급은 적어요 사람을 갈아서 하는 업이다 보니 어쩔 수 없는 걸까요
101,(주)프레인글로벌,10514,"1. 타 대행사 대비 연봉이 낮음 2. 창업주가 sns에서 유명하지만, 실제 사내에서는 얼굴 보기도 어려움 3. 그 누구도 회사의 비전을 제시하지 않음"
102,(주)프레인글로벌,10514,클리핑 그 이상의 경험을 하기는 어려움 공감이 다소 협소해 근무 시 불편할 수 있음
103,(주)프레인글로벌,10514,업계 특성상 고객사에 따라 업무강도가 매우 셈... 복불복처럼 고객사 잘못걸리면 일하기 너무 힘듦.
104,(주)프레인글로벌,10514,인력을 갈아서 회사가 돌아가는 느낌. 기혼자들을 위한 회사. 일 안하는 사람은 계속 안하고 하는 사람만 죽어나는 구조. 윗선에서도 이걸 알지만 전혀 개선되지 않음.
105,(주)프레인글로벌,10514,워라밸 존재하지 않음. 야근 뿐만 아니라 주말근무하는 날도 대다수
106,(주)프레인글로벌,10514,"쓸만한 복지가 별로 없고, 연봉이 업계대비 평균에 못미침. 어떻게 해서 최대 규모가 되었는지 신기할 정도로 업무 시스템이 별로임"
107,(주)프레인글로벌,10514,홍보 대행사가 다 그렇듯 바쁨. 규모가 크다고 해서 체계적이진 않음. 비용 아낀다고 헤드헌터 절대 안 쓰고 팀에 부담.
108,(주)프레인글로벌,10514,관리자들의 능력부재. 프리라이더 차부장들은 대리 과장들이 이뤄놓은 공에 숟가락 넣어서 편승하기 바쁨ㅎㅎ
109,(주)프레인글로벌,10514,"동종업계대비 연봉이 높은 편은 아님, 고인물들의 능력치가 편차가 있음"
110,(주)프레인글로벌,10514,복지 거의 없음 (결혼하거나 자녀가 있어야 받을수있음) 스마트시대에 영수증 종이에 풀칠하고 있음 오너 인스타에 라떼시전 오짐.강산이 두번이나 바뀐걸 모르는듯
111,(주)프레인글로벌,10514,워라밸을 기대할 수 없는 업무량 팀바팀이라는데 다른 팀은 모르겠음
112,(주)프레인글로벌,10514,"저연차의 경우 급여가 좀 아쉬울 수 있음. 물론 연차가 높다고 그렇지 않은 것은 아니나, 나름의 성과를 보이는 친구의 경우 연봉이나 인센티브가 다소 높을 수는 있음"
113,(주)프레인글로벌,10514,연봉 인상 기대하면 안되었었음 (지금 상황은 모르겠음) 퇴사한 이유도 고생하는 것과 비례하지 않는 연봉 연봉 인상률이 매우 낮았기 때문
114,(주)프레인글로벌,10514,연봉이 매우 낮은 수준에 속하기 때문에 해당 부분에서는 회의감을 얻을 수도 있음 팀바팀이 너무 명확함 장점이자 단점인듯
115,(주)프레인글로벌,10514,업무 강도가 매우 높았고 야근수당이 없는 점이 아쉬웠음 경력직은 적응하기 쉬운 문화는 아님 텃새가 있는편
116,(주)프레인글로벌,10514,복지제도 미약 여러 경험 할수있으나 일이 많아 야근많음 비율이 여성이 많음
117,(주)프레인글로벌,10514,"업무 : 동료가 없다고 봐도 무방하며, 여러분야를 다 할 줄 아는 올라운더를 원하는 느낌이 강합니다. 사람 : 파티션 없이 오픈된 공간이며, 일부는 디자이너가 ‘꿀’빤다고 생각합니다. 오픈된 공간이라 남이 혼나는 것도 다 구경가능하여 원치 않게 귀에서 피날 수 있습니다. 팀바팀 사바사겠지만 맘에안들면 쑥덕거리면서 여기저기 이상한 사람으로 만드는 사람들이 있었습니다. 워라밸 : 바쁠땐 점심먹으면서 작업하고 저녁먹으면서 작업하였고, 하루나 당일에 만들어 달라는 요청도 많았습니다. 건강 : 증상이 엄청 심하진 않았지만 스트레스성 위염, 식도염, 신장문제, 일로인한 손목염증, 원인모를 두드러기, 불면증, 허리 디스크 문제를 얻었습니다. // 손목은 아직 ^^… 당시 의사가 쉬랬었습니다 이런 사람에게 추천합니다 - 자신은 운이 좋아서 좋은 팀에 걸릴 수 있을거라 자부하는사람 혹은 완전 마이웨이로 혼자 다닐수 있는 사람"
118,(주)프레인글로벌,10514,"직원수, 기업 규모 대비 많은 임원 시스템이 없음 옛 명성에 취해 발전하려는 노력을 안함 복지가 없음(복지가 반반차랍니다ㅎㅎ)"
119,(주)프레인글로벌,10514,연봉이 업계 대비 낮은 편 자체 인프라 등 구축돼 있지만 불편함
120,(주)프레인글로벌,10514,"이 업계의 고질적 문제, 연봉이 매우 짜다. 근데 야근도 잦다. 능력없는 상사 걸리면 성장 가능성 별로 없음. 모든곳이 팀바팀이라지만 여긴 너무 심함. 높은 이직률이 이를 말해주는 듯. 예전보다 규모도 작아지는 듯. 여성의 비율이 너무 높아서 좋은 점도 있지만 안좋은 정치질도 분명 있음"
121,(주)프레인글로벌,10514,"에이전시 특성상 업무량 많고, 제안서 시즌에 야근 많음"
122,(주)프레인글로벌,10514,매출을 이끌어가는 팀원에 대한 아무런 보상이 없어서 열일하는 사람들이 억울함.
