,company_name,company_id,review_text
104,(주)동구바이오제약,5051,"매니저와 윗선의 경우 코로나임에도 불구하고 성장을 당연하게 생각하며, 그에 따른 보상 일절 없음. 코로나로 인해 수많은 제약사들이 매출 하락했는데, 오히려 성장을 했으나 인센티브 전혀 없고, 오히려 목표 달성 못했다고 성과급도 지급 안 함."
105,(주)동구바이오제약,5051,야근 및 주말근무가 많습니다. Ot수당은 나와 연세드신분들은 거의 출근합니다.
106,(주)동구바이오제약,5051,새로운 개발을 하지 않아서 항상 같은 자리에 머무는 느낌 피부과 처방 1위라지만 잘 모르는게 현실
107,(주)동구바이오제약,5051,특정고인물들이 물을 흐리는느낌 편애가 심하다는 느낌이 난다. 근데 뭐 사람이 하는일이니 내가 바꿀수있는 부분은 아닌듯 이러한것땜시 이직하나봄
108,(주)동구바이오제약,5051,작은 회사이기 때문에 체계가 덜 잡힌 느낌을 주기도 합니다.
109,(주)동구바이오제약,5051,커뮤니케이션이 잘안되는 느낌 모든 절차가 80년대 스타일
110,(주)동구바이오제약,5051,차 없으면 출퇴근 어려움. 회사내 주차하기 힘듦. 경영진이 회사 운영하는게 불투명하다. 임원이 회사 규모대비 너무 많음. 임금 상승률이 적다
111,(주)동구바이오제약,5051,모든 제약사가 그렇듯 영업위주로 회사가 운영되어 그외 부서는 특이사항 없음
112,(주)동구바이오제약,5051,부서끼리의 협업이 어려움. 같은 회사 안에서 해당 부서가 해야할일을 나몰라라 다른부서로 넘어감
113,(주)동구바이오제약,5051,우선 개구리들이 너무 많고 이직 고려해볼만 한데 절대 못한다 우리 회사가 최고라고 칭함. 자기개발 하지 않고 다들 현실에 만족하는 사람들 솔직히 답없다
114,(주)동구바이오제약,5051,수 년 전 국내 영업부서 재직한 경험으로는.. 당시 한국X나이티드 제약 출신 지점장의 회식 문화 횡포가 심했음 일례로 남양주 본인 집앞에 금요일 저녁 집결(회식 당일 통보) 새벽 1시까지 부마하고 파하면서 인천 사는 팀원들도 있는 상황에 알아서 집에 가라.. 어떤 팀원 분은 예비신랑이었는데 이런 회식 끌려가서 그 날 신부 분 드레스 혼자 보고 계시고 본인은 화장실에서 토하고 있고.. 난장판 자체였던 걸로 기억 그 외 한국X나이티드 제약 출신 소장들과 몇몇 팀원들의 군대식 기잡기 및 언어 폭력이 기본이었으며 강압적 분위기 조성으로 팀으로 내려오는 영업 지원금을 빼돌리기 위한 지점장의 금융적 불법 행위도 존재 당시 경영진 중 특정 인원은 그 지점장에게 놀아나는 느낌이 강했으며 팀원들과 면담도 형식적으로 진행했으나 팀의 문제점을 전혀 파악하질 못함(모두 분위기에 눌려 함구) 21년도인 지금은 어떨지 모르겠으나 그들이 만약 남아있다면 이 회사 영업팀은 추천하지 않습니다
115,(주)동구바이오제약,5051,연봉을 매년 높인다고는 하는데 타사나 회사 규모에 비해 낮은 것으로 알고있음
116,(주)동구바이오제약,5051,대기업 업무 프로세스를 모방하다보니 업무진행이 비효율적으로 일어난다. 급여나 복지가 아직까지는 아쉽다. 신입이 거의 없고 경력직들이 많다.
117,(주)동구바이오제약,5051,연봉적음 미꾸라지가 또 물흐리고있음 강압적 분위기 위아래없음 개판 주식시장 무책임
118,(주)동구바이오제약,5051,연봉은 아닌데 시스템만 대기업 따라 해 일하기 힘든 곳
119,(주)동구바이오제약,5051,매출욕심이 있는 담당자는 추천하지않는다. 공무원 마인드 CSO에 모든 포커스가 맞춰져있음
120,(주)동구바이오제약,5051,"동종 업계 낮은 연봉, 공채와 경력사이의 연봉갭차 큼, 회사의 방향성이 자주 바뀜, 워라밸은 좋지만 매출압박으로 인한 멘탈적인 부분이 힘들 수 있음,"
121,(주)동구바이오제약,5051,직원수가 늘어나며 가족같은 분위기가 줄어듬. 영업조직을 없에면서 직접 리스크관리를 함. 복지제도가 좋아질 필요가 있음.
122,(주)동구바이오제약,5051,단점이라면 생각의차이가 있었어요 젊은사람들은 이해하기 힘든 올드함 있어요
123,(주)동구바이오제약,5051,월급 적어요 무슨 제약회사 월급이 이렇게 적은지 모르겠습니다 직급자들 내로남불 심해요 꼰대들 많아요
124,(주)동구바이오제약,5051,"낮은 연봉. 제약업계 최하위 수준의 연봉 (영업직군 기준) 기수 문화 존재, 매우 보수적, 복지포인트 너무 적음 일비에 유류비,주차비가 모두 포함..차량감가상각은???ㅜㅜ"
125,(주)동구바이오제약,5051,일배우다가 그냥 돈받고 인생 짧아지는 느낌 받음 하루빨리 나와야하는곳. 공평하지 못한곳. 팀장이 제일 문제임. 팀장한테 잘못보이면 이것저것 짬처리 당하고 귀찮게 굼. 그리고 사람들하고 친해지면 손해. 욕이란 욕은 다들음 밑에 사람이 못하면 나랑 친하니까 나한테 꼽줌
126,(주)동구바이오제약,5051,몇몇 특정인들한테만 잘해주는 회사. 정치를 잘해야만 살아남는회사 그냥 일만하기에도 버거운데 이런저런 거들이 많이생긴다
127,(주)동구바이오제약,5051,초봉이 타 제약회사 대비 낮음. 단 일반 중견기업에 비교하면 평균. 그러나 초봉도 높일 가능성도 있어보임
128,(주)동구바이오제약,5051,매번 말로만 그럴듯한 계획을 가지고 있지만 정작 바뀌는건 없음. / 연봉은 업계 하위권.
129,(주)동구바이오제약,5051,연봉..연봉...연봉이 낮다 인상율은 최악 복지가 없다.. 아무것도 없다
130,(주)동구바이오제약,5051,적은 연봉. 라인잘타면 빠른승진. 그렇게 승진한사람은 일안해도 이쁨받고 잘 다님. 몇몇 꼰대같은 상사들이 물흐림
131,(주)동구바이오제약,5051,"제약회사 기준 낮은 연봉, 대기업적 시스템을 지향하나 기존 경영진,임원진 마인드와는 거리가 있음, 부서별로 분위기가 많이 다름, 특정 임원진의 파워가 강해서 비효율적 의사결정"
132,(주)동구바이오제약,5051,기존 사람들이 대우를 못받고 신입이 제일 좋은 기존사람들보다 신입이 장땡인게 잘못 꼬이면 기존에 몇년 일하던 사람이 신입보다 연봉이 적음 그래서 말이 많음
133,(주)동구바이오제약,5051,초기멤버가 없기때문에 근본없음. 이상한 업무가 많고 상명하복이 심함
134,(주)동구바이오제약,5051,연봉이 적습니다 아무이유 없습니다 그냥 연봉이 적습니다 타제약회사에 비해 적습니다
135,(주)동구바이오제약,5051,그야말로 피부과 업계를 제외하면 볼모지에 가깝다. 피부과를 제외한 타업계로 배치될경우 엄청난 고난이도의 영업을 경험할 수 있다. 그리고 제약업계치곤 낮은 연봉또한 흠이라면 흠
136,(주)동구바이오제약,5051,팀간 업무체계가 명확하지 않아 업무효율성을 키우기 어려움
137,(주)동구바이오제약,5051,"2020년초 최저시급보다 낮은급여(세후) 대학 4년제 초봉 2천만원 중반 부터 시작(정규직기준), 꼰대와 텃세가 많고 심하며 인간성이 바닥임 멘탈이 강해야됨, 인재가 수시로 나가고 새로 들어오며 나간사람들의 불만은 급여가 너무 낮고 또 대인관계로 다시 들어가고 싶어하지 않음"
138,(주)동구바이오제약,5051,"일을 밑도 끝도 없이 계속 미뤄주고, 자칫하면 집 제시간에 못가는게 태반. 그리고 야근은 그냥 무슨 일반적으로 당연항듯이 생각하는 태도가 맘에 안듬."
139,(주)동구바이오제약,5051,상사 라인타려고 하는는게 너무 보이는 특정직원이 있음. 특혜도 받는것 같으며 일을 잘하고 못하고를 떠나 같은 업무평가를 받는 평직원의 입장에서 그런 특혜를 받는 직원이 있는 조직은 더이상 발전 할 수 없다고 보여진다
140,(주)동구바이오제약,5051,"연차쓰는거 눈치보임, 조직분위기 별로, 일한만큼 못받음, 라인(=빽) 조직문화가 너무 심함"
141,(주)동구바이오제약,5051,업무능력이 떨어지고 인성이 나빠도 윗사람에게 샤바샤바가 최고. 사원보다 못한 과장급들이 많음. 관리가 안되는듯
142,(주)동구바이오제약,5051,복지 낮은급여 및 수시로 인원변동이 많다 사내 편의시설이 너무 없다
143,(주)동구바이오제약,5051,"업무강도 높음, 야근강요, 주52전후 바뀐게 있는지 모르겠음"
144,(주)동구바이오제약,5051,공장 리모델링을 하고 기계도 새로 사는 등 투자를 하는것 같지만 그전과는 다를게 없음.
145,(주)동구바이오제약,5051,낮은연봉? 연봉의기준은 사람마다 차이가있고 명확하게말씀드리긴어렵지만
146,(주)동구바이오제약,5051,제네릭회사라 영업이 쉽지 않음.클린하게 영업할 수 있으나 비슷한 규모의 회사와 경쟁력이 떨어짐
147,(주)동구바이오제약,5051,위의 기업 한줄평에 적은 거 외에도 생색내기 복지 및 임금대비 높은 강도의 업무
148,(주)동구바이오제약,5051,정당한 대우를 받길 원한다면 무조건 가지마세요. 그냥 싼 값에 사람 쓰는게 당연하게 생각함.
149,(주)동구바이오제약,5051,급여나 복지는 아직 부족한 느낌이 있다 많이 개선은 하고 있으나 동종업계에는 미치지 못하고 있다 리더십있는 리더의 부재..
150,(주)동구바이오제약,5051,회사자체에서는 인사평가가 합리적이라고 생각하고있는거 같지만 굉장히 비합리적인 인사평가제도임(항상 좋은평가를 받는사람은 정해져있음 항상항상 절대변하지않음). 남자들한테 잡다한거 많이 시킴 군대 두번온 기분 신입은 이등병이라고 생각하면됨. 차별은 기본이고 육아휴직이라도 하고 온 사람들 보면 복귀하면 진급이며 연봉인상도 포기해야하고 눈치줌(저출산이라고 나라에서 지원을 해준다고해도 실상은 둘째임신 시 퇴사) 팀장들이 친한사람한테는 점수잘주고 본인들이 싫어하면 일을 잘하던 못하던 주관적인평가(떠든다는? 본인들이나 친한사람들도 똑같이 떠들고 해도 인지를못함)로 평가함. 회사에도 몇번건의해도 공지몇개띄어주며 주의하라고하니까 본인들 얘기인줄 모르고 계속 반복됨 그냥 회사도 이제는 못믿겠음
151,(주)동구바이오제약,5051,부서별 파워게임이 심함 일부 특정부서는 업무가 많음 성과 뺏어가기가 존재
152,(주)동구바이오제약,5051,오래된 기업인지라 좀 마인드가 답답한 너무 안정추구파라 발전성은 낮음
153,(주)동구바이오제약,5051,"- 자사제품 비중이 없고 수탁사 제품위주로 생산하다보니 맨날 마감일정에 시달려 살아야 함, 야특근 시킬려고 할 수밖에 없는 구조로 조직을 편성해서 야특근 시킴, 할일은 개 많은데 사람이 부족함, 연구소 투자는 많이 하는데 생산은 그냥 좀비임"
154,(주)동구바이오제약,5051,신입사원에 대한 임금 은 현재시장에 어느정도 반영하여 임금이 측정 되지만 기존 직원들의 임금은 신입사원 과 비례해 임금이 측정되지 않아 동기부여가 떨어짐
155,(주)동구바이오제약,5051,비합리적인 평가제도 결과가 너무 폐쇄적 평가기준이 없음 아마 팀장팀원마다 기준 다르게 적용 남자 군경력인정 3년마다진급시험 평가결과로 진급제한 사바사바 필수 팀장 남녀차별 직급차별 인사고가 연봉상승률 차등 팀장들 책임감도열정도없음 꼰대 특히품질관리장난아님 여전히 그런듯 쯧
156,(주)동구바이오제약,5051,"연봉이 동일 업종, 유사한 매출 대비 작은것으로 생각 된다."
157,(주)동구바이오제약,5051,전반적으로 체계가 잡혀있지않으며 성과에 대한 보상이 미흡함..
158,(주)동구바이오제약,5051,포장 라인 아주머니들의 텃세 및 뒷담화로 인한 스트레스가 생각보다 큼. 연봉이 동종 업계에 비해서도 업무 강도에 비해서고 터무니없이 적음.
159,(주)동구바이오제약,5051,연봉이 적긴 적다.. 다른건 없다 그냥 연봉만이라도..
160,(주)동구바이오제약,5051,"기업문화를 바꾸려고 노력하는모습이 보이나, 직원들의 의견 수렴을 했다고 생각되는 모습들은 잘 보이지않음 동종업계 대비 연봉이 너무 낮음"
161,(주)동구바이오제약,5051,"꽉막힌경영진, 팀장들 아랫사람과 실무자말은 들으려고안하는 기업 도전과 변화를 하지않고 그대로 안정적으로만 가려는 팀장"
162,(주)동구바이오제약,5051,애사심응 갖도록 도모하는것 같으나 그 기준이나 방향성을 잘못잡고있는것 같고 연봉이 동종업계에 비해 낮은 수준이다.
163,(주)동구바이오제약,5051,제약회사고 개발부서와 연구소가 있지만 오랜시간 수탁제품에 의존하고 있음. 실제 돈을 벌게 하는 부서는 생산인데 오히려 개발부서와 연구소가 목소리는 제일 큼.
164,(주)동구바이오제약,5051,올드멤버가 여기저기 아직 남아 있다는게 단점. 빅브라더의 역할을 충실히 수행중.
165,(주)동구바이오제약,5051,영업직 특유의 군대문화 동종업계 대비 낮은 연봉 외부활동이 많음
166,(주)동구바이오제약,5051,"비교적 월급이 낮음, 수탁사로 여러 제형, 제품이 너무 많음"
167,(주)동구바이오제약,5051,"아직 급여,복지가 부족하지만 업계 최고로 향상시킬려는 오너 마인드가 있어 지금은 부족하지만 더 힘을내 일 하게 되는 회사"
168,(주)동구바이오제약,5051,대부분의 제약업계가 그러하듯 항상 고인물들의 정치질이 문제 가끔은 일에 대한 퍼포먼스 보다는 다른 거에 정신이 팔려 있는 사람이 있음
169,(주)동구바이오제약,5051,연봉이 아쉬운 점이 좀 있음 복리후생 노력중이라고 하는데 잘 됐으면 좋겠음
170,(주)동구바이오제약,5051,연봉이 신규입사자가 더 높음 급여테이블이 경력입사자들이 많이 다름
171,(주)동구바이오제약,5051,"복지나 급여가 작고 서울 본사, 공장 복지 차이가 있습니다. 매출액에 비해 직원들에게 투자가 너무 적고 회사 내에 체계가 잡혀있지 않다."
172,(주)동구바이오제약,5051,"제품력이 부족하고, 영업력이 약하다. 기존 직원과 새로입사한 직원에 대한 대우가 다르고 업무능력과 관계없이 줄을 잘 서는 정치능력이 필요하다."
173,(주)동구바이오제약,5051,단점: 대외적으로 보여주기 식 복지향상이 아닌 직원들에게 필요한 복지향상 필요
174,(주)동구바이오제약,5051,연봉 낮음 비전없음 야근수당 주말수당 없음 달리면서 우는 말에 채찍질만 해댐 능력없는 사람들 데리고 엄청난걸 만들어내려고함
175,(주)동구바이오제약,5051,업무의 문제를 이야기하면 들어주지 않음. 능력없는 상사가 너무 많음.(업무 이해력이 많이 부족함) 일 안하고 놀면서 월급받는 직원보면 일하고 있는 내가 한심스러움. 소문이 빠름(남얘기를 좋아함) 책임지기 싫어하는 상사 및 임원 말로만 직원들 챙겨주는 임원 회의가 많음. 비판비난이 난무함.(비판비난하지 말자고 하는 부서가 제일 난리) 업무에 따라 달라지는 소모품을 무조건 돈으로 따져 제한함. 임원가족이 예스맨을 좋아함
176,(주)동구바이오제약,5051,"1.중견기업이 되었지만 주변 제약기업 최하위수준의 연봉으로 거의 오르지않음.(어디가서 말하기 창피함) 2.성장을 목표로 하나 시스템 변화도없이 직원이 더 일해서 올리라는 근거없는 목표.(미친듯이 기계처럼) 3.어떠한말도 믿을수 없고 믿었다가 후회만 남는 회사.(대부분 공감) 4.직원이 성장하는걸 원치않아 교육이 서류적이고 실질적교육은 없음. (아무생각안하고 멍때리고 바보처럼 다니기 좋다) 5.부서차별,성별차별,외모차별 온갖 차별을 당하거나 볼수 있음. (외모,나이,성별 여자남자할거없이 느낄수 있음. 우월하면 입사추천) 6.뭐하나해주거나 좋은건 생색내고, 안좋은건 다 모르게하고 피해를 전직원이 당함.(투명을 강조하며 흙탕물처럼 뿌옇고 흐림)"
177,(주)동구바이오제약,5051,복지 제도는 거의 없다고 봐도 무방함 . 중소기업에 걸맞는 복지임 . 당연히 제공되야할것을 생색내면서 제공함
178,(주)동구바이오제약,5051,보고를 위한 보고서 작성이 많음 ... 직원들에 대한 복지는 1년에 15만점 포인트가 다임 .... 명절 선물도 거래처에서 보내준걸로 직원들 나눠줌 ....
179,(주)동구바이오제약,5051,부서간 이기주의 팽배. 논리보다는 감정에 따른 인사평가. 신약개발할 역량과 의지가 없음. 상장하려 갖은 애를 쓰지만 역부족. 임직원 수시 정리해고 문화 정착. 경력자에게 유독 배타적인 텃세 문화.
180,(주)동구바이오제약,5051,신입이 다니기에는 좋으나 위에서 키워줄려는 양성경영은 없어보임 그냥 본인 일만 열심히하고 임원들 자기들한테만 피해안가면 그만 그렇기에 자체적인 노력이 아니고선 업무적인 경험을 넓히기엔 제한이있다봄
181,(주)동구바이오제약,5051,"기존 장기 근무자 대비 경력 이직자 우대로 인한 기존 직원들의 사기저하, 동종업계 대비 현저히 낮은 연봉, 복지제도 전무, 몇년째 상장 추진하지만 번번이 미끄러지는 미흡한 기업 역량, 신약 R&D 투자 의지와 개발 역량 매우 미흡, 신규사업(의료기기, 화장품)으로 돌파구를 찾아보려 하지만 매출 기여도 미미."
182,(주)동구바이오제약,5051,감정의 기복이 무척 심한 실세 경영자 1명에게 잘 못 보이면(능력 및 의견차이) 며칠 후 해고를 각오해야함. 외부교육대상자로 선정되었다는 뜻은 교육 수료 후 나가라는 뜻임. 업무를 잘하고 못하고의 명확한 기준이 정량적 숫자가 아니라 경영자 개인의 판단으로 정성적으로 이루어짐.
183,(주)동구바이오제약,5051,"급여가 동종업계 대비 너무 떨어짐, 많이 올르고 있지만 현실적으로 많이 부족함, 급여 보고 이직하는 경우 많음"
184,(주)동구바이오제약,5051,"1인 다역 수행 필수, 세대교체를 위해 장기 근무자 보다 젊은 경력자를 선호하는 편. 부서간의 이기주의가 팽배하여 업무협조가 잘 안 이뤄지고 정보 공유가 거의 없음. 열심히 헌신해도 성과가 미흡하면 저성과자 외부교육 보낸 후 바로 해고 통보. 변화를 무척 두려워하는 조직문화. 예스맨을 무척 선호. 전산 시스템이 불안하고 잘 시정되지 않음. 의약품 R&D가 거의 없어 신약이 전무함."
185,(주)동구바이오제약,5051,아직까지 같은 업종에 비해 급여가 조금 낮음 회사가 발전하려고 노력하고 있으나 이기적인 구시대 마인드를 가지고 있는 인원들이 조금 있음
186,(주)동구바이오제약,5051,타 회사에 비해 다소 낮은 연봉 많이 개선해 주긴 하였지만 이제 평균에 조금 못미치는 듯...?
187,(주)동구바이오제약,5051,실험실 관리자들 차별이 너무심함. 마음에 들면 일도 잘하는줄 알고 모든편의를 봐줌. 야특근 하지말라고했다가 하라고했다가 일과상관없이 눈치 껏 야특근 하는 제도가 단점이라고 생각함.
188,(주)동구바이오제약,5051,"복리후생을 개선하고자 하나 아직 시작단계 급여도 동종업계 대비 작음, 언제나 정상화될지 의문이다"
189,(주)동구바이오제약,5051,"포괄연봉제에 따라, 야근이나 주말특근수당이 없다. 개선해야 할 문제인 것 같다."
190,(주)동구바이오제약,5051,실질적인 복지제도가 없음 새롭게 입사하는 사람들만 연봉이 높음
191,(주)동구바이오제약,5051,매출액에 비해 연봉이 너무 낮으며 품목수가 너무 많기 때문에 체계적인 관리가 어려운 듯함.
192,(주)동구바이오제약,5051,선후배질서가 철저하며 피부과 외 에서는 힘들다 더욱 발전이 필요할듯
193,(주)동구바이오제약,5051,팀장이 특정 인물에대한 편애가 매우 심해요 정말 너무 너무너무 심함 너무!!!!! 자사보다 수탁이 많은데 문서정리가 너무 안되있음 필수 사무용품을 너무 안사주려해서 매우 힘겨워요
194,(주)동구바이오제약,5051,비합리적인 인사평가제도로 인맥과 연줄이 있으면 승진도 업무도 편하며 체계가 전혀 잡혀있지 않아서 누군가에 의해 좌지우지되기 매우 쉬움
195,(주)동구바이오제약,5051,복지가 형편없음 연봉이낮은걸 알면서 올려주지를 않음 체계적이게 변하려고 시도하는거 같지만 하나도 변하는게 없는듯함
196,(주)동구바이오제약,5051,늦게 들어온 신입보다 경력 5년이상된 경력자의 월급수준이 비슷하거나 적음 업무능력을 키우는 것보다 상사에게 이쁨받는 것이 혜택이 더 많음. 직급이 높을수록 위의 눈치를 많이 봄 출근 통근버스시간이 수원역 6시 40분에 출발이라 아침 출근이 매우 힘듬
197,(주)동구바이오제약,5051,과장까지는 무난하게 진급가능. 급여 수준 바닥이고 연봉 체계 없음
198,(주)동구바이오제약,5051,기본적인 것 외에는 기대하기 힘듬. 초봉 인상률이 경력에 따른 임금 인상률 보다 커 신입사원 연봉이 웬만한 경력직 연봉과 비슷
199,(주)동구바이오제약,5051,급여는 제약중에 꼴지같음 기본급 자체가 너무작아 연장을 필수로해야 급여가 받을만해지며 따로 이상한이름붙여서 기본급에서 빠지는 수당이 너무많음 원가절감 한다고 볼펜도 안사줌 타사제품을 많이해 기업매출은 높으나 순이익은 별로없음
200,(주)동구바이오제약,5051,편애가 너무 심하며 차별적이다. 저출산시대에 두번 임신하면 짤리는회사. 연차를 다 쓰지 못 할경우 연차수당도 안주면서 연차쓰는거 눈치를 많이줌.
201,(주)동구바이오제약,5051,연봉이 너무적음 돈때문에 이직하는 이유가 대부분임. 돈만 많이주면 최고의 직장
202,(주)동구바이오제약,5051,연봉이 적은편임.동종업계 신입보다 이 회사의 경력직이 연봉이 적음 . 특정인물들에 대한 편애가 심하고 선입견이 한번생기면 좋은이미지 되기힘들다. 야근특근 강요 은근히있음.
203,(주)동구바이오제약,5051,야근 특근을 강요받음. 업무강도에비해 급여가 적음(신입이 연봉이더 높을때도 있다. 동종업계 하위권연봉수준). 특정인에 대한 특별우대가 있음. 외부교육지원에 인색함 (개인이 발전할기회가적다.)
204,(주)동구바이오제약,5051,"급여, 복지가 아쉬움. 내년 IPO 이후를 기대해야 하는 상황이지만 지금 당장 아쉬운 건 어쩔 수 없음. 회사 로고가 십자가를 상징하는 기독교 쪽의 회사이며 월1회 전직원 예배시간이 있어 불편한 사람들이 있을 수 있으나 크게 부담감은 없는 시간임. 타 부서 간 조화가 조금 더 필요함."
205,(주)동구바이오제약,5051,작은 중소제약사의 한계를 벗어나지 못해 R&D 투자율이 0에 가까움
206,(주)동구바이오제약,5051,"급여, 복지부분이 매출액 대비 타 제약회사들과의 격차가 있기 때문에 일정 경력 이후 이직이 많은 편임"
207,(주)동구바이오제약,5051,급여인상률이 적다 신입으로 입사하면 기존사원보다 연봉이높다 복리후생도 부족하다고 생각된다
208,(주)동구바이오제약,5051,권위의식을 가진 윗사람이 많음. 직원들의 불신을 너무도 가볍게 여김. 나가면 새로 뽑으면 된다는 생각이 큼.
209,(주)동구바이오제약,5051,일단 복지가 없다는것이 마음이 아프죠.. 복지부분만 개선이 된다면 좋겠습니다. 그리고 본사 건물도 지하철역에 좀 거리가 있어서 출퇴근이 조금 힘들다는 점이 있어요
210,(주)동구바이오제약,5051,"강도높은 업무에 비해 연봉이 매우낮음, 복지라고 할만한게없음."
211,(주)동구바이오제약,5051,야근 특근을 많이 요구함. 수당이없음. 식당이 다른건물에있어 날씨에따른 불편함이 있음. 합리적이고 효율적인 체계보다는 주먹구구식 방식이 많이 남아있음.
212,(주)동구바이오제약,5051,부서별 거리감이 있어 업무적인 협조시 눈치를 보게된다.
