,company_name,company_id,review_text
905,(주)야놀자,8540,문서작업이 많고 타부서와 커뮤니케이션에 어려움이 있다 보고라인이 많은편
906,(주)야놀자,8540,"연봉이 적음, 성장가능성이 없음, 성과압박이 큼, 경영진의 욕심이 지나침"
907,(주)야놀자,8540,직원과 인턴들과의 경계 또한 업주들을 대상으로해야하는 서비스업인만큼 정신적인스트레스가 동반함
908,(주)야놀자,8540,부서에 따라 다를 순 있겠으나 서비스가 365일 (거의)24시간 운영되기에 쉬는 날에도 긴장을 늦출수 없다.
909,(주)야놀자,8540,내부적으로 체계화 되어야하는 부분들이 많음. 조직개편이 잦은 분위기 같음. 신입보단 경력자가 그동안 쌓은 경험치를 발휘하기 좋은 곳.
910,(주)야놀자,8540,연봉도 그렇고 복지도 그렇고 의외로 짜다.성장하는 기업인 만큼 책임도 따르고 노력도 필요하다.
911,(주)야놀자,8540,바쁨 일이 바쁘고 급하게 돌아감 야근이 많음 퇴사자 많응
912,(주)야놀자,8540,회식이 잦을때도있으나 술을 그렇게 막 권하는 문화는 아닙니다. 사내문화는 융통성있습니다.
913,(주)야놀자,8540,마음편히 일할수가 없다. 협업이 전혀 안된다. 복지가 점점 사라지고 있다
914,(주)야놀자,8540,잦은 변화 및 복잡한 구조로 인해 불필요한 업무들이 많다
915,(주)야놀자,8540,군대식 문화가 좀 있고 야근이 있습니다. 그리고 좀 바빠요
916,(주)야놀자,8540,일하는데 체계가 부족한 느낌 저마다 방식대로 일하니 의사소통이 부족함 틀이 잡혀있으면 좋을것 같음
917,(주)야놀자,8540,"잦은 조직이동과 부서변동. 조직장의 지극히 주관적인 평가시스템. 무엇보다 산업에 대한 이해가 부족한 조직장이 외부에서 굴러들어오는 경우가 허다하고, 이는 이 회사의 근속률이 왜 떨어지는지에 대한 가장 명확한 해답임."
918,(주)야놀자,8540,야근수당안줌ㅋ.....ㅎ 새해명절 선물 안줌 근데 떡값주기는함. 완전 수직적 관계.....일<사회생활임 일잘해도 필요없음 ㅋㅋㅋㅋ!!!!!!!!!!!
919,(주)야놀자,8540,윗선의 결정에 따라 너무 휘둘리는 듯한 느낌 자유로운 분위기이지만 책임은 없고 자유만 찾는것같은 사람도 많아요
920,(주)야놀자,8540,군대식분위기 다나까 말투 언제끝날지모르는 야근 등등등 많다
921,(주)야놀자,8540,[단점] - 군대분위기 - 다나까.. - 영업직이기에 운전에 익숙해야하며 위험함 - 출근시간은 정해져있지만 퇴근시간은...
922,(주)야놀자,8540,효율적이지 못한 업무프로세스 팀바팀 등등 아직 사내문화 문제가 좀 있음
923,(주)야놀자,8540,"일부 계열사에 있는 장기재직자들이 이상한 사내문화(리뷰에도 많이 언급된 군대식문화, 모 익명SNS에 관련글 많음)를 강요한다고함. 다행인건 본사 R&D그룹은 해당하지 않는듯"
924,(주)야놀자,8540,"연봉은 그렇다치고, 업무 프로세스 노답임 답도없는 기업들 인수해서 그걸 가지고 세일즈 하라고 하고있으니 영업사원들 죽을맛. 제휴점과 상생이 전혀 없는 회사"
925,(주)야놀자,8540,말그래도 사람을 갈아 넣어서 일을 한다. 윗대가리들이 무조건 due day를 찍고 시작하니 매일 야근에 주말 출근을 밥먹듯이 함. 나아진다곤 하나 글쎄...
926,(주)야놀자,8540,실적위주 어디든 다 그렇겠지만 이런저런 스킬연마하여 실적올려야 가치인정받음
927,(주)야놀자,8540,스타트업 기업이라 사람들이 자주 바뀌고 정신사나움. 연봉이 작음
928,(주)야놀자,8540,오래다닌 사람만 살아남는 기업 . 입사후꾸준히 목소리 냈지만 결국은오래된 직원 의견만 반영. 경력증명서 한번 받으려면 진짜복잡함 경력증명 혹은 다른증명서 필요하면 미리받아서 퇴사하시길 그렇지않다면 담당자 직통번호라도 알고 퇴사하길 본사번호는 콜번호라서 연결도 잘 안해줌 참고로 본인은 몇일째 못받고 있음 퇴사시 도와준 직원에게 메일보내서 요청했는데 씹힘. 일을안하나 싶음  담당자에게 전달하겠다 이런소리 믿음 안됨 본인이근무한 부서는 전달조차안되는부서였음 의사소통 안됨
929,(주)야놀자,8540,너무많다. 지사와 본사는 완전 다르고 군대식/수직적 문화. 말만 님님하고 복장규제부터 이상한 부조리까지 셀수없음 야근을 밥먹듯이 하나 그게 당연하다고 생각함
930,(주)야놀자,8540,"소규모에서 서서히 커가던 시기에 근무했는데, 그럼에도 불구하고 차장이상급과 임원진의 군대식 마인드로 힘들어하는 사람이 많았습니다. 그리고... 사람을 너무 많이 뽑고 짜르는 경향이 있는 것 같습니다. 정보유출 등 많은 부분을 고려해가며 관리해야 회사가 더 오래갈 수 있을 것 같습니다."
931,(주)야놀자,8540,"리더중심의 의사결정이 잘 이뤄지지 않음. 실무자들끼리 협의해야만 의사결정이 되는 편이나, 이마저도 뒤집어지는 경우가 많음. 전문성이 부족하여 전체적인 로드맵이나 방향성을 지시하지 못함. 목표는 뚜렷하나 과정은 실무자가 헤쳐나가야 함."
932,(주)야놀자,8540,"상명하복, 눈치싸움, 본인이 꼰대인지 모르는 꼰대들, 퇴근시간이 늦음, 탁상공론, 편애"
933,(주)야놀자,8540,자유로워 업무의 담당자가 자주 바뀐다는 점 조직이 아닌 개인이라는 점 젊은 사람들이 많다는 점 무관심이 일관된다는 점
934,(주)야놀자,8540,"상장해서 크게 버는 스타트업 생각하고 들어온 직원들이 태반. 고졸, 초대졸 직원들은 최저임금 받고, 유학파 인원들은 수억 받는 개똥같은 급여체계. 모르고 일하면 상관 없지만 아는 순간 자괴감에 일할 맛 안남. 담배와 흡연은 기본이고 어차피 모텔업계 지저분한 건 하루 이틀 일도 아님. 얼마나 퇴사가 많으면 자기 부서 인원이 몇명인지도 모르는 부서장이 태반. 부하 직원 이름 다 외우는 팀장/부서장이 있기나 할까?"
935,(주)야놀자,8540,군대식 다나까 회식강요에 건배사 강요 야근 많음 야놀자 서비스에 강점이 크게 없어서 영업에 어려움 퇴사율 높음
936,(주)야놀자,8540,"팀별로 분위기 천차만별,, 팀별 상사들이 차이가 커서 문제임. 매일매일 매년매년 성장만을 외치고 말도 안되는 숫자를 목표로 내세운다."
937,(주)야놀자,8540,"복지가 별로없음, 군대분위기, 체계가 하나도 안잡혀있음"
938,(주)야놀자,8540,시간급이 형편없음. 체계가 없음. 신뢰할 수 있는 데이터가 없음
939,(주)야놀자,8540,"뒤처진 인원들을 끌고가, 합류한 인원들의 기대치를 낮추고 시작함. 스카웃된 인원들은 배울점이 많지만 아르바이트->정직원 등 기존 인원에서 직급만 올라간 경우 일에 대한 명확한 프로세스도 잘 모른다."
940,(주)야놀자,8540,다나까 말투 강요와 회식강요 술도 못마셔도 억지로 마셔야한다. 사원끼리 서로 헐뜯기 바쁨. 아부가 장난아니다. 주말에 일해도 수당없고 평일에 하루 쉬어야함. 평일 보통 9시 퇴근
941,(주)야놀자,8540,"일부 역량이 안되는 사람들이 실장, 본부장급에 있음. 그 사람들 때문에 퇴사도 많이 하고 조직이 발전이 안됨."
942,(주)야놀자,8540,"기업이 너무 단기간에 컸다는게 눈에 보임. 설립한지 10년이나 된 스타트업이라지만 아직도 스타트 준비 중. 야근과 주말까지 과중되는 업무에 비해 박봉은 물론, 이름뿐인 자율출퇴근제.. 딱히 무엇이 복지인지도 잘 모르겠음. 회사는 서립한지 10년이 넘었는데 매주 회의와 보고 조차 형식이 제대로 잡히지 않았음. 실질적 권력자라 할 수 있는 팀장급은 수평적 구조를 두려워함. 그렇다보니 팀장 얘기는 모두가 비판하지 않고 수용! 회의시간에 짬안되면 의견하나 내기 힘든 구조라 이럴거면 회의 왜 하는가 싶었음."
943,(주)야놀자,8540,비효율적인 시스템이 많으며 체계가 부족하여 업무 효율이 떨어짐
944,(주)야놀자,8540,진짜 사상최고로 체계없이 일함 이사람 저사람 보고할때마다 데이터가 틀림 이렇게 데이터관리가 이상해서 이익이 나는지나 모르겟음. 일을 체계없이 하니 일잘하는 사람 못하는사람 구분이 안됨
945,(주)야놀자,8540,"소위 창립멤버라는 과장들이 일을 안함... 회사가 단기간에 너무 컸음. 아이디어는 난립하는데 그것을 체계적으로 닦고 설계할 만한 상임고문이나 5,60대 경력자가 없다는 게 단점으로 작용할 줄은 꿈에도 몰랐음... 당연히 이직율도 높고 그 자리를 다른 경력자가 채움. 창립당시 블루오션 '모텔 사업' 으로 기회를 참 잘 잡았을 뿐이지 내실은 없음."
946,(주)야놀자,8540,혁신을 꿈꾸지만 피묻히긴 싫어. 실패는 있어선 안된다. 하지만 도전해라. 실패하면 다 니책임. 윗사람들은 소위 빅픽처 라는 뜬구름만 띄우고 형상화 못하는건 아랫사람 책임. 자기가 회의에 늦게 들어와서 못들어놓곤 보고한적 없다고 적반하장식으로 화내는곳. 대표는 세상의 행복을 만드는 야놀자인들이라지만 정작 조직원들은 세상의 행복을 위해 자신의 행복을 포기해야 하는 곳. 권한은 없지만 책임은 져야 하는 블쌍한 중간관리자들.
947,(주)야놀자,8540,엉터리 조직 체계와 맘대로인 인사발령! 특히 리더 자질 부족... 연줄로 채용된 능력없는 리더와 수준 이하 퀄리티의 아웃풋을 강요하는 C레벨
948,(주)야놀자,8540,"팀장이 좀 이상했음 소세지 사오라고 했었는데, 왜 마트에 소세지가 없냐며 내가 매장에 전화해보겠다며 한 직원을 닥달하던 모습을 잊을수가없다. 정말이지 컬쳐쇼크!"
949,(주)야놀자,8540,수직적 군대문화 야근이 많음. 눈치를 볼 수 밖에없음.
950,(주)야놀자,8540,자유와 수평을 이야기하지만 실질적으로 잘지켜지는지 의문점이 많이 남음
951,(주)야놀자,8540,"바빠서 연차 못씀, 체계가 없음, 고용형태 전환 어려움"
952,(주)야놀자,8540,"복지는 다양하지만 혜택을 누리려면 그만큼 눈치를 봐야하는 회사. 윗사람들이 자기 직원을 정말 쉽게 생각하고 쉽게 내치는 회사이다. 또한, 야근을 해야 좋은 인재라고 생각하는 회사 정시 퇴근을 해본 기억이 별로 없음."
953,(주)야놀자,8540,일당백으로 a부터 z까지 모두 다해야하는 부서가많음. 신입사원이라면 다양한 업무를 해볼수있지만 하나하나 코치하면서 가르치는것이 아니라 스스로 알아서 진행해야함 수동적은 성향이라면 비추
954,(주)야놀자,8540,단순 업무가 많고 아직은 수직 문화에서 버서나지 못함 좀더 클수있는 기업이라고 생각됩니다.
955,(주)야놀자,8540,사람이 자주 바뀌어 어떻게 지내야할지 잘 모르겠음 자주 사람이 바뀜.......
956,(주)야놀자,8540,"줄어드는 복지, 잦은 부서이동, 사원들의 불안정한 심리상태"
957,(주)야놀자,8540,미래가 없고 하는일이 비슷하다. 직급이 있지만 말만 있는 직급이라 오래 근무가 힘들듯. 최측근들은 오래 근무하지만 글쎄..
958,(주)야놀자,8540,자율 출퇴근제긴 하지만 퇴근이 좀 늦는 경우가 다소 있음 어떤 팀에 배정이 되냐에따라 분위기가 좀 다름 자취비를 지원해주나 광주에서 살다가 광주에서 자취하면 질원안하고 타지인력들만 지원해줌
959,(주)야놀자,8540,요새 기업인식이 달라졌다 하지만 아직도 남들에게 당당하게 소개할 수 없는 직장이름 적은 급여
960,(주)야놀자,8540,조직 변경 과정에서 개인의 의사는 중요하지 않음. 직원을 맨먼쓰로 직설적으로 표현하는 경영진.
961,(주)야놀자,8540,"성과주위가 아닌 똥꼬주위, 직원은 똥꼬를 못빨면 더 잘하는 사람을 뽑으면 된다는 주위, 야근 일상화, 스타트업이라는 이유로 체계가 1도 없음, 상위 직급들이 자기가 사장인줄 암"
962,(주)야놀자,8540,능력은 있지만 시스템이 다 갖춰진 대기업 출신 임원들과 아주 작은 회사 경험만 있는 초년생 그룹이 대부분. 실질적으로 일을 해야하는 중간관리자가 부족하지만 임원들만 챙긴다는 인상이 강했다. 그래서 막상 열심히 일해야 하는 실무자들은 박봉과 몰려드는 업무탓에 금방 나간다. 광고로 많은 돈을 지출하면서 회사 인지도가 올라가 사람이 나가는거에 신경을 쓰지 않는다. (크레딧잡 기준 퇴사율 50%) 그리고 가장 중요한건 회사가 돈을 못 번다.
963,(주)야놀자,8540,"복지는 많지 않음, 기존 인력 채용을 어떻게 했길래 기본 실력도 인성도 글러먹은 사람들이 많이 있었음. 지금은 나갔지만."
964,(주)야놀자,8540,단점은 똥군기가 난무하는 군대문화 똥군기문화가 업무에도 지장을준다..안타깝다
965,(주)야놀자,8540,일하는 방식이 답답한 편 꼰대들이 생각보다 여기저기 많이있다
966,(주)야놀자,8540,잦은 야근 극심한 군대문화 짧은 근속기간들 입사와 퇴사율이 높음 군대문화로 인해 사람들이 오래 버티질 못함
967,(주)야놀자,8540,소위 고인물들이 좀 있고 회사를 운영해나갈 수 있는 자본과 마케팅이 한계가 있다. 이건 끊임없는 숙제인듯.
968,(주)야놀자,8540,"군대식 문화가 강하다. 출퇴근시 큰소리로 인사하며 퇴근하며, 회식때 뛰어가 회식 장소 문을 열어 놓아야한다. 또 '다나까' 는 필수이며 다른 지사 직원 얼굴, 이름,기수까지 알고 있어야하며, 앞존법 틀릴시 회사 생활도 튀틀릴 가능성이있다. 주머니에 손넣었다간 크게 혼날것이다. 회사 야근이 많다. 많다라고 표현하기엔 거의 날마다 야근이다. 주 52시간 적용 후 어떻게 변했을지 모르겠으나 크게 변하지 않았을거라 생각한다. 노동착취를 직원의 열정으로 포장하며, 젊었을때 고생해야지 높은 위치까지 간다고 말한다. 개성이 강하면 안된다. 개성이 강하면 회사 분위기가 변할까바 두려워한다. 팀장들이 나이가 어려 자기 말 잘 따르는 순종적인 사람을 원한다. 회식이 잦으며, 회식시 무조건 건배사 준비해야한다. 골통대학교 술자리 모습을 보는거 같다. 야놀자라고 해서 다 같은 야놀자가 아니다. 영업 남부지부(대구,부산,광주) 본사와는 다른 분위기, 복지였다."
969,(주)야놀자,8540,급여가 적은 걸로 알고 있다. 언젠가 올려주겠다고 하는 것으로는 알고 있으나 정확히 모름..
970,(주)야놀자,8540,"이거 중요함 야놀자 본사에서 케어를 안함, 법인이 따로있고 복지도 야놀자 본사수준이 아님 그 수준에 맞게 따라가려고 하긴함. 지방은 무조건 영업이라고 생각해야함 발이 땀나도록 뛰고 또 뛰고..  상사가 여자냐 남자냐에 따라 완전 차이남 예전에 힘들게 고생했던거 누릴려는 심보같았음 복지가 발전돼가고 있어서 좋긴한데 아직 하~안참 멀었음 실적압박 장난없음 외근 나가기전 외근보고를 함 그리고 퇴근직전에 퇴근보고를 함 (뭐하자는건지) 야근이 생활이라고 생각하면 됨. 출퇴근 자율제 생긴지도 얼마안됐음 근데 내가 지금껏 봤을때 직원분들 퇴근시간 평균 저녁 9시  - 출산휴가x - 자잘한 제한사항이 너무 많음 - 여자복장 간섭 너무 많음 - 남자 셔츠 무늬 제한 있음 - 사내연애x, (관심도 없었음) 그냥 총괄팀장이 누구냐에 따라 하늘과 땅차이 - 휴게실이 있음 그럼뭐함? 눈치보여서 못씀 - 수직적인 조직문화 (님으로 호칭 바꾼지 얼마 안됨) - 남자는 100% 정장차림 생활 - 지금도 다나까 호칭 씀 (군대라고 보면 됨)"
971,(주)야놀자,8540,탁상공론. 정확히 무엇이 문제인지 아무리 말해도 고쳐지지 않음. 경영진들 마음대로 하루 아침에 바뀌는 경영 방식. 과정의 설명이 없는 통보식 일처리.
972,(주)야놀자,8540,"시대를 역행하는 수직적인 문화. 군대문화의 표본 열정페이 강요, 야근을 밥먹듯이함 주말 및 빨간날은 제휴점 전화받는라 정신없음 워크숍에서 조차 눈치보며 행동 끼리끼리 모임을 적극적으로 반대"
973,(주)야놀자,8540,직원에게 해주는게 없음 해주는거 없이 생색내고 피부에 와닿는 복지 하나도 없음 주변에 은행 병원 없음
974,(주)야놀자,8540,탑 다운 의사결정 및 매월 숫자에 쪼임 cmo가 감성적이라 예민+문구 소재 하나하나 영상 하나하나 컨펌해 콘텐츠가 산으로 감
975,(주)야놀자,8540,"야근 강요 (평균 23-24시 퇴근) 월화수목금토일 출근 강요 (주말수당, 대체휴무 제도는 있지만, 중간에서 보고를 묵살하여 혜택 받는 경우는 1%임) 사내 정치 심함 텃세 심함"
976,(주)야놀자,8540,직급체계가 단순해서 승진 기회가 많은지 모르겠음. (만년 매니저일 수 있음) 자사 포인트말고 현금으로 주시면 안 되나요? 팀 분위기에 따라 다르겠지만 출퇴근에 은근 눈치 줌.
977,(주)야놀자,8540,계약직 근무 비율이 많다. 그만큼 인력관리가 안되는 것 같다. 보완해야할 큰 단점인거같다.
978,(주)야놀자,8540,"회의가 비효율적으로 김, 기존 직원들의 승진이 어려움, 급한 일처리, 수동업무"
979,(주)야놀자,8540,"비효율적인 업무 방식, 업무강도가 높고 그에 비해 동기부여는 떨어짐"
980,(주)야놀자,8540,불필요한 회의가 많고 전문가아고 하기엔 전문성이 떨어짐
981,(주)야놀자,8540,"줄타기를 하지 않으면, 소외감을 들 정도. 말이 수시로 바뀌는 회사. 인사팀이 정말 인사팀인지 줄타기를 위한 꼰대의 짓인지 알수 없음"
982,(주)야놀자,8540,야근이 너무 많은 것 같고 체계가 아직 많이 부족해보임
983,(주)야놀자,8540,"영업 담당자들이 영업에만 집중할 수 있는 환경이 아님, 계약하고싶어도 야근생각때문에 계약생각 사라짐, 계약에 압박은 없다고 하나 알게모르게 눈치줌"
984,(주)야놀자,8540,"수평적인 문화를 표방하지만, 결국 수직적. 대표 눈에 잘 보이면 어떤 사고를 쳐도 퇴사당하지 않음. 부서 간 대우가 꽤 다름."
985,(주)야놀자,8540,현장중심 사고를 가지지 않아 내부커뮤니케이션 문제 발생하는 경우 왕왕 있음
986,(주)야놀자,8540,"영업실적압박, 인턴한테까지 부여되는 과중 멀리나가서 그 지역에서 자기를 수십번 쓸때없는 군대문화"
987,(주)야놀자,8540,수평적 구조를 추구하려하지만 부서장급 이상의 압박이 심했던것으로 기억함 업력이 10년이상이지만 업무에 대한 체계적인 부분이 조금 부족한것 같음. 사업 확장으로 영업직은 야근이 많고 회사가 하루하루 어떻게 진행될지 갈피가 잡히지 않았음. 정신없이 돌아가는 구조임.
988,(주)야놀자,8540,복지제도가 취약하며 군대식 문화가 뿌리깊게 박혀있다. 체계가 잡혀있지 않아 바뀌는게 정말 많다. 업무 외적인 일들을 많이 시킨다. 퇴사가작 많다.
989,(주)야놀자,8540,"단순보고 작업이 많고, 타부서와 교류가 적음 그래서 타부서와 부딪히는 일이 종종있음. 서버오류가 잦음. 후기 관련 이슈가 많음"
990,(주)야놀자,8540,직장상사들착하고 다들 착합니다 복지가 조금만더발전한다면 지속성 확보된ㅂ니다
991,(주)야놀자,8540,자율출퇴근제라지만 사실 출퇴근시간이 어느정도 정해져 있음. 낮은 연봉.
992,(주)야놀자,8540,늘 똑같은 방식으로 진행돼서 발전할 수가 없는 구조 자기의 생각과 맞지 않으면 이해하기보다 이상하게 치부할때가 많다
993,(주)야놀자,8540,"비개발부서, 사업부사의 힘이 너무 강함. 반대로 사업부서로 입사하면 좋을 것 같음."
994,(주)야놀자,8540,"부서별로 다르지만, 부서장의 성격에 따라 굉장히 엄격한 분위기 / 인턴 2개월 후 합격 기준은 공정하지 못한 부서장 마음대로 / 인턴에게 비윤리적 대우 및 군대식 문화 강요"
995,(주)야놀자,8540,"경쟁사 대비 낮은 연봉, 자주 터지는 이슈 등이 단점!!"
996,(주)야놀자,8540,업계 탑이지만 체계 미흡 급여인상이 필요할 것이라 생각됨
997,(주)야놀자,8540,연봉이 겁나짬 엑셀을 나보다 못하는 상사가 아이디어와 스킬을 가져가는 경우가 있음
998,(주)야놀자,8540,직원들간의 경쟁이 과도할정도로 있는게 단점??? 스타트업 기업이라 대기업에 비해 안정감이 떨어질수도 있음
999,(주)야놀자,8540,"새로운시대에 맞춰가려고 노력하지만, 임직원들이 거기에 맞춰가질 못함. 인사고과에 업무 외적으로 신경쓸 것이 많음"
1000,(주)야놀자,8540,"-개선사항 건의 하지마세요. 어차피 중간에서 커트당함  -전체 회식자리에서 상관들한테 서로 잘 보일라고 난리임 사이비 종교인줄  -잦은 회식문화 직원들 건배사좀 그만 시키세요 회식 한자리에서 건배사 10번함  -회의 시간마다 서로 깎아 내릴려고 머리굴림  -남녀 구분없이 다나까 사용  -상관들이 대접 받고 싶어하는게 눈에 보임 (능력보단 사내정치 잘해야함)  -사내 반강제 커피내기, 밥내기 많음 내기 걸리면 인턴도 짤없음(인턴급여 세후 160만원)  -밖에서 돈쓸때는 모두가 동등한 위치에서 더치페이  -세후 180만원 인데 점심값 지원 안해줌 하루 밥+커피 10000원 고정지출  -야근 많음  -결론: 10개월 정도 일해본 결과 냉정하게 본사 들어갈꺼 아니면 다른 회사 알아보세요. 지사는 비추천"
1001,(주)야놀자,8540,"수당없음, 직원을 너무 쉽게 생각함, 잦은 야근, 사생활없음"
1002,(주)야놀자,8540,칼퇴하려고 모닝타고 140밟는데도 8~9시 퇴근 인센X 야근수당X 복지X(퇴근하고 집가서 밥먹으면 9시10시)
1003,(주)야놀자,8540,야근이 잦음. 직원들이 정말 엄청고생하는데 그에 상응하는 대가가 없음. 사람 귀한줄 모름. 잦은 이직 및 퇴사. 직원에게 무언가를 해주는게 정말 짜다.
1004,(주)야놀자,8540,"다나까,압존법,출퇴근 식사전후로 큰소리로 멘트인사해야하는 등 군대식 문화가 굉장히 강함. 젊은 사람끼리 일하면서도 낡은 군대문화가 훨씬 더 심함;; 8시반에 출근해서 기본 7시 이후 퇴근. 야근수당없음. 형식적으로 하는 업무가 심함. 쓸모없는 보고를 너무 많이 하고 중요하지 않은 일에 상부에 허가를 받아야함.(업무시간 외의 일에도) 단순하게 까내리기 위한 피드백을 함. 수박 겉핥기식의 인턴 교육. 사내예절이나 교육. 5일 중 5일을 외근,출장. 운전하면서도 시간압박과 보고때문에 폰을 자주 보고 급하게 운전함."
1005,(주)야놀자,8540,"야근은 일상, 2015년 하반기부터 입사한 외부 경력직 중 근속 2년을 넘기는 경우를 못봄(대부분 1년미만 퇴사) / 계속 리스타트 진행중으로 체계적인 프로세스가 없음/ 다녀보시다보면 알겠지만 규모가 큰 거래처들은 대부분 임원 지인들...실력보다는 임원들과 친하기만 한다면 고연봉 획득가능^^"
1006,(주)야놀자,8540,야근이 상당히 많고 군대식 문화가 존재함으로 견뎌낼수있는자만 지원하시길
1007,(주)야놀자,8540,낮은 연봉 8시간이상근무 운전하는 시간이 거의 이긴 하지만 저녁 9시 10시 퇴근은 기본이다 . 군대도 안다녀온 여자들이 다나까를 쓰라고 강요하고 회사내에서 장난치는것도 분위기 봐가며 해야된다. 퇴사율이 1년 미만자가 많으며 이직을 했을경우 경력이 인정을 못받는다.
1008,(주)야놀자,8540,"한참 더 배워야할 어린직원들이 팀장직급을 달고 있어서 직원들을 관리하는 방법도 모르고 일도 정확히 모르면서 지시만 하고있음 간단하게 해결할 일은 쓸데없이 세부적으로, 중요하게 여겨야 할일은 너무 생각없이 진행하고 일이 터지면 그때 다시 중요한것을 깨닫는다. 이직률이 너무 잦다."
1009,(주)야놀자,8540,"비효율적인 업무 처리 방식, 상장 앞두고 매출에 혈안이 되어있음"
1010,(주)야놀자,8540,임원들이 고지식하고 꼰대 마인드가 있음. 업무량 어마어마람. 노는 꼴을 못봄. 잦은 야근. 업무량에 연봉이 낮은듯
