,company_name,company_id,review_text
123,(주)프레인글로벌,10514,"팀바팀이 심한듯.. 업무량, 분위기 전체적으로 급여 매우 짬.. 납득이 되지 않음 연봉 수준만 올려줘도 지금보다 다닐 맛 날 것 같음"
124,(주)프레인글로벌,10514,팀바팀 근무 방식이 달라서 복불복일 수 있다는 것이 단점
125,(주)프레인글로벌,10514,퇴사와 재입사가 너무 잦음. 재입사는 능력 없고 적응 못해서 돌아오는 거라 봄. 이곳 시스템에 있다보면 왜 그런지 이해 감. 고인물과 그들만의 리그의 짬뽕. 중소 특성상 입사 퇴사가 잦다보니 이 회사만 오래 다닌 사람들은 바깥세상 어떻게 돌아가는지 모르는듯. 옛스러움. 특히 아직도 영수증 붙여서 내는 지출결의 시스템은 최악. 성과의 기준이 모호하고 실제로 인정 받기 어려움.
126,(주)프레인글로벌,10514,업의 특성상 야근이 잦고 비딩 업무가 많아 힘들때가 많음
127,(주)프레인글로벌,10514,"1. 재무>>>>>>>>>>>>>>>>>>>이하 직무 2. 은퇴한 공무원들 모인것같음. 꼰대에 아랫사람의견 무시하는 경향 약간있음 이거때문에 야근하는데 위쪽 입장에선 쟤가 '못'따라오는거임 3. 자주 바뀌는 팀만 사람 자주 바뀜. 잘못걸리면 배우기 힘듬 4.정치질 있고 여초회사 특성 갖고 있음, 강약약강있음 5. 위치가 너무 극악임 어디서 내리든 버스 아닌이상 많이 걸음 6. 연차가 자유로운데 일이 많아서 쉬지 못함 7. 아래 사람들은 극악무도한 업무량에 치이기 좋음 8. 눈치보이는 경우 은근 많음 9. 과거의 명성에 취해있는 분들이 다수 있음 10. 연봉인상되는거보다 병원비가 더 많이 나감 공황장애 우울증 디스크 등 좋은대가 없음 다른직무도 비슷비슷한듯 11. 기혼자 위주의 복지 다른 대행사에서 볼 수 있는 복지 여기엔 없음. 그렇다고 여기만의 엄청난 복지가 있는것도아님 12. 후려치기랑 가스라이팅은 뺄 수 없음 - 나가면 다시 채우면 되고 어차피 위에는 월급만 받으면 됨 아래에서 뭐라해도 아쉬운놈이 나가는거임(뒷담 및 직급으로 후려치기 등 다양함) 13. 명절선물은 계열사거 아니면 광고주거. 떡값없음. 14. 팀바팀이긴하나 저렇게까지 해야하나? 싶을정도로 막말하는 사람 있음"
128,(주)프레인글로벌,10514,"팀, 파트마다 워라밸이 달라서 상대적 박탈감이 심하다 공채 출신들에겐 무한한 익스큐즈가 적용된다"
129,(주)프레인글로벌,10514,1. 업계1위라는데 연봉은 10위권에 들까? 2. 받아도 화만 나는 인센 금액. 누구 코에 붙이라고 이런돈을?? 연봉도 낮고 인센은 학생 용돈 수준. 업계에서 수임료는 제일 많이 받는데 그 돈으로 뭐해요??? 3. 그나마 애사심 있는 사람들이 목 터져라 얘기해도 바뀌지 않는 처우 및 제도. 4. 윗선 눈치를 너무 봐서 필요한 의견 개진못함 개선 안되고 제자리. 오너경영 회사의 단점 따라감
130,(주)프레인글로벌,10514,야근이 많고 성과달성 압박이 있음. 대리급까지 매출 압박을 받음 ㅠ
131,(주)프레인글로벌,10514,불명확한 보상과 진급 체계. 인사평가 제도는 있으나 마나. 무능한 고인물들 대잔치.
132,(주)프레인글로벌,10514,"복지제도 없음 식대 없음 팀장, 본부장 급에 이상한 사람들이 많음 다니는 동안 업무량이 감당할 수 없이 많아서 병 생김"
133,(주)프레인글로벌,10514,인센티브는 특정 팀 제외하고 전무 수준 연봉 테이블과 상승률이 너무 낮아 이직 시 연봉협상에 고전하게 됨
134,(주)프레인글로벌,10514,"퇴근 시간이 지나도 단톡으로 계속되는 업무 지시와 다소 폭력적인 상사의 태도, 기본적인 인성이 의심스러운 언행, 점심 식대 지원 안해줌 등등 죄다 단점"
135,(주)프레인글로벌,10514,"팀바팀, 어느 팀에 들어가서 어떤 상사/동료르 만나느냐에 따라 편차가 심함. 기본적으로 업무 실적 압박이 있음. 상사가 아랫사람에게 불합리하게 굴어도 아무도 제어할 수 없는 구조. 대기업 체계 같은 건 없고, 팀장의 권한이 많이 큰 편이라 소기업들 모여있는 것 같음. 겉으로 보기에만 대규모/대기업 같으나 체계가 잘 안 잡혀있음..  야근/업무 강도도 케바케.. 야근 정말 많음(운 좋으면 다행). 퇴사자도 정말 많음. 심지어 입사 한지 한달만에 옆팀 상사부터 사원까지 싹 다 퇴사하고 새롭게 갈아엎어지는 걸 목격함.. 밖에서 보기에는 좋은기업 이미지메이킹 잘 했는데.. 실상은 그렇지 않은듯.."
136,(주)프레인글로벌,10514,전체적으로 야근이 적고 다만 부서마다 맡는 프로젝트가 달라 편차가 있음 이직이 많음
137,(주)프레인글로벌,10514,"맨파워로 돌아가는 회사에서 맨파워 우대가 시원찮음. 인센티브/생일 상품권 열어보고 실소를 금치못함. 안 주느니만 못한 돈 주고 욕먹는… 지출결의 시스템이 시대착오적이고 비효율적. 업계 1위, 최고라는 틀에 갇혀 정작 업계 돌아가는 꼴 모르는 우물 안 개구리. 돈 벌자고 다니는 회사에 뭣이 중헌디요?"
138,(주)프레인글로벌,10514,고인물이 과거를 그대로 답습하고 경력이 되서 몸값이 되면 나가고 새로 뽑고 그런 과정을 무한 반복함. 현실적인 목표를 가지고 입사하시길 바랍니다.
139,(주)프레인글로벌,10514,낮은 초봉과 인상률. 초봉이 커야 이직을 하든 인상이 되든 처우가 나아지는데 유리한데 상대적으로 불리하다
140,(주)프레인글로벌,10514,"대행사다 곧 넘의 일 받아서 한다 / 내일이 아니다 고객사 일이다 / 내일처럼 하기에는 전문성을 존중받을 만한 돈을 주는게 맞다 / 100 해오라면 150해가는 걸 창업자는 원하던데 꼭 돈이 아니더라도 모티베이션은 어디에 있는가 / 안에 롤모델 여전히 없을 것, 있다면 사람 구하기 쉬울텐데"
141,(주)프레인글로벌,10514,신입사원 교육은 잘 되어있으나 여기서 신입으로 몇년 크면 다른 곳은 힘들어서 일 못할 듯
142,(주)프레인글로벌,10514,아직은 옛날 마인드 / 복지제도 전무 / 200명이나 되는데 수준이 중소기업
143,(주)프레인글로벌,10514,재무팀의 목소리만 강한 내부 프로세스 고인물들의 잘모르면서 하는 업무들
144,(주)프레인글로벌,10514,PR회사다 보니 AE외의 직책들이 프로세스가 온전히 정립되어 있지 않음. 프로세스가 완전히 체계적이지 않음.
145,(주)프레인글로벌,10514,"퇴근후에도 연락하는점, 칼퇴하는 부서도 있지만 야근하는 사람이 대부분임"
146,(주)프레인글로벌,10514,돈을 매우 아끼는 것 같음. 프리랜서 이렇게 많은기업 첨봄
147,(주)프레인글로벌,10514,"복지는 거의 없다고 봐야하고, 연봉이 규모 대비 적음. 고객사도 자기 선택권이 있는 건 아니니까 레퍼도 팀마다 사람마다 많이 달라짐"
148,(주)프레인글로벌,10514,PR전문가 포커싱되어 다양한 직군의 커리어 계발이 어려움
149,(주)프레인글로벌,10514,사업 확장은 하는데 그룹사로서 혜택이라곤 없다... 네임밸류에 비해 짜디짠 연봉까지..
150,(주)프레인글로벌,10514,타 대행사에 비해 연봉이 너무 낮은 편. 인센티브는 거의 없다고 보면 된다. 기존 직원들이 합리적인 보상 체계를 얻지 못해서 줄줄이 퇴사하고 그나마 요즘은 새로 뽑히는 사람도 없음.
151,(주)프레인글로벌,10514,제대로 설명도 안해주고 페이퍼만 줘놓고 왜 안되어 있냐고 할때는 황당했음 그렇지만 다른 담당자들은 좋은 기억이 많음
152,(주)프레인글로벌,10514,연봉은 쥐꼬리. 근데 사람 갈아 넣음. 이상한 사람 천지라 팀 바꾸고 퇴사하기가 부지기수인데 문제인 사람을 해결하려는 노력을 그 누구도 하지 않음. 대표는 프레인에 관심도 없고 SNS하기 바쁨.
153,(주)프레인글로벌,10514,위에 적은 내용말고는 대부분이 단점이라고 할수있는 회사 홍보회사답게 대외적 포장이 잘 되어있지만 실제는 그렇지 않은회사. 자기 잘난맛에 사는 사람들이 많이 다니는 회사.
154,(주)프레인글로벌,10514,"리더, 클라이언트에 따라 야근을 많이하거나 업무량이 몰리거나 할수있는데 이건 어쩔 수 없는 것 같음"
155,(주)프레인글로벌,10514,"연봉 개짬 연봉 인상률 조차도 짜디짬 연봉이 너무 낮아서 여기 있으면 자기 가치 자체가 낮아지는 느낌  팀바팀이 심한데 유독 심한 꼰대 리더들 있음. 직원들이 갈림. 기본적인 복지 하나도 없음.  이런 곳 또 없다, 여기가 1위다, 다른 곳 가봐라 더 고생한다 식의 가스라이팅과 정신승리로 이끌어가고 있음"
156,(주)프레인글로벌,10514,다양한 복지 제도가 있지만 대다수 기혼 여성을 위한 것이라 좀 더 폭넓아졌으면 함.
157,(주)프레인글로벌,10514,"1. 팀바팀 2. 팀에 따라 야근 및 일의 강도가 정해짐 3. 일하는 사람만 일하는 분위기, 사원/대리/(연차 낮은)과장 급들은 엄청 고생함 4. 혼자 살아남아야 함 5. 아쉬운 성과제도 6. 퇴사하는 직원이 많음 (자주 바뀌는 담당자) 7. 1인당 담당하는 클라이언트 수가 많음 (이것도 팀바팀)"
158,(주)프레인글로벌,10514,1. 비효율적인 재무시스템으로 달마다 스트레스 아닌 스트레스 2. 연봉이 정말 짜다 3. 야근수당 따로없다( 연봉협상 다해놓고 입사날에 연봉안에 식대 추가근무 수당 다 포함이라고 그제서야 설명) 4. 임원이 정말 많은데 ‘굳이’라는 생각이 듭니다
159,(주)프레인글로벌,10514,복지제도가 너무 구식이며 직원들을 위한 교육이나 지원이 부족
160,(주)프레인글로벌,10514,아무도 가르쳐 주지 않고 혼자 살아남아야한다??? 재택근무 출퇴근이 비교적 자유롭지만 퇴근은 항상 미정. 급여가 이게 맞나? 싶게 작음
161,(주)프레인글로벌,10514,팀 내부적으로 미래에 대한 그림이 구체적이지 않음. 대표에 대한 팀원들의 불신. 국내 pr대행사 중 연봉 인상률 최하. 직급이 올라가도 그에 따른 책임만 가중될뿐 인상률은 그대로임.
162,(주)프레인글로벌,10514,연봉 시작점이 낮아 매해 인상율이 잘 협의되더라도 한계가 있음. 복지 측면 직원 혜택 적고 인센 등 특별한 보상 체계적어 아쉬움.
163,(주)프레인글로벌,10514,"1.연차, 재택, 출퇴근 유연제 너무 좋은데 연차 낮으면 꿈 꾸지 마시길. 과차장급부터 가능한 복지. 위로 갈수록 루팡하기 딱 좋은 회사. 윗분들은 저연차에게 큰 관심이 없음. 성장은 다른 곳에서 찾으시길 바람. 2.임신, 출산, 복귀...하시는 분들에게는 좋지만 바꿔말하면 고연차의 복귀가 100프로에 이르기에...저연차는 계속 잡일, 짜치는 일만하다 끝남. 다른 가정의 행복, 국가의 출산율을 위해 나의 미래, 체력, 정신 건강이 파괴되는 경험 할 수 있음. 그분들의 백업을 맡는 다른 팀원 개인에게 보상은 아무것도 없음. 3.팀 잘못 만나면 ... 뒷말은 생략. 나중에 포트폴리오 만들 때 난감해지는 경험을 할 수 있다는 정도."
164,(주)프레인글로벌,10514,업무량 대비 낮은 연봉. 고과에 따라 인상률 편차가 존재하긴 하나..  내부에 일 잘하고 인성 좋은 분들이 남아있기는 하지만.. 어느 조직을 가도 이건 마찬가지 일거라 생각.  인력으로 돌아가는 회사에서 인력 관리가 ..
165,(주)프레인글로벌,10514,"업무량 대비 연봉이 낮은편, 임원급 인사에 변동이 없어 변화에 대한 기대감이 잘 생기지 않음"
166,(주)프레인글로벌,10514,연봉이 업계에 비해 낮음. 업무량은 팀바이팀이라 할 말 없음.
167,(주)프레인글로벌,10514,"위가 꽉 막혀 있습니다. 워라밸 좋으니까 아무도 안나가요 특히 기혼 여성분들은 나갈 이유가 없습니다. 죄다 차, 부장 입니다."
168,(주)프레인글로벌,10514,"비전이 없고, 소속감도 없음. 대기업이 아니기 때문에 매뉴얼도 없음."
169,(주)프레인글로벌,10514,성과금이라던지 직원들의 업무 사기를 복돋이줄만한 복지 시스템 부족. 업무 성과나 분위기 등이 팀간의 격차가 좀 있는 편. 다소 개인주의적인 문화. 현재 쓰고있는 공유오피스의 후진 시설
170,(주)프레인글로벌,10514,철저한 개인주의. 오로지 성과에만 관심있고 “인간”에 대한 관심 없음
171,(주)프레인글로벌,10514,팀바팀의 운이 단점에도 적용된다 전반적으로 신입 사원의 말을 경청하는 열린 문화와는 거리가 있어서 팀이나 사람이 안맞으면 빠르게 퇴사하는 것이 좋다
172,(주)프레인글로벌,10514,"한 글자로 표현할 수 있을 것 같은데, 고인물이다. 업무 뿐 아니라 최근 이야기 들어보니 문화도 고인물이었음"
173,(주)프레인글로벌,10514,복지라고 할 만한 복지가 별로 없음 업계 1위라고 하지만 연봉 수준은 그냥 업계 평균
174,(주)프레인글로벌,10514,"사내 정치질. 사내 서열이 눈에 고스란히 보이는 곳. 최상단의 임원급부터 각 팀 부장들까지 누가 예쁨받고 누가 예쁨받지 못하는지 알 수 있는 회사임. 그 정치질에 동조하거나, 무시해서 저평가받거나. 둘 중 하나임"
175,(주)프레인글로벌,10514,팀바팀이 너무 심한 게 단점이라면 단점. 그리고 다른 대형 대행사에 비해 인센티브 제도가 없어서 성과 보상이 조금 아쉬운 것 역시 단점 중 하나.계속해서 늘어나는 신사업에 대한 인력 투입도 잦아서 조금 혼란스러움
176,(주)프레인글로벌,10514,"직급 수당 없음, 타 대행사 대비 연봉이 낮아 현타옴."
177,(주)프레인글로벌,10514,"팀별 파트별 분위기가 달라 복불복 심하고, 규모 대비 낮은 연봉, 전용 서버 적응하는 데 시간 걸림"
178,(주)프레인글로벌,10514,"야근 많음, 팀바팀 분위기, 개개인이 맡아야할 업무량이 많음, 사원/대리들 미친듯이 굴려지는 곳(과장 이상 직급이 과하게 많음)"
179,(주)프레인글로벌,10514,팀에 따라 분위기와 제도와 업무가 많이 차이남. 회사 내부 체계에 대한 피드백과 보완이 활발하게 이루어지지는 않음.
180,(주)프레인글로벌,10514,업계대비 낮은 연봉이 가장 큰 단점인것 같음 그리고 팀바팀이 매우 심함
181,(주)프레인글로벌,10514,적은 연봉과 없다시피한 복지 높은 업무강도의 삼박자 물론 팀별로 많이 다르다
182,(주)프레인글로벌,10514,팀 간의 경쟁 관계가 매우 심함. 처음 들어간 사람이어도 느낄 수 있을 정도
183,(주)프레인글로벌,10514,"팀마다 다름, 신입이면 모를까 경력직 디자이너로써의 성장은 애매함(물론 대다수의 디자인 분야가 그렇겠지만), 에이전시/대행사의 공통적인 단점들 갖고있음, 야근 식대 주위 물가 대비해서 안습임"
184,(주)프레인글로벌,10514,업무가 많아서 그만큼 스트레스가 많음 여러 곳의 고객사 상대 해야 하고 암튼 그럼 월급 낮음
185,(주)프레인글로벌,10514,"말이 프리랜서지 알바쓰면서 일이 굉장히 많음, 프리랜서라서 야근만 안할뿐...?"
186,(주)프레인글로벌,10514,대행사다보니 업무 강도 쎈편. 강도쎈 업무에 대한 보상은 없음
187,(주)프레인글로벌,10514,연봉이 너무 낮아서 퇴사가 많은데 경영진은 그걸 모르는지 알고도 모른 체 하는 건지 도통 나아지질 않는다. 퇴사자의 대부분은 연봉 때문에 떠나는 것 같다. 대표라는 사람은 이상한 사업하고 sns에 감성팔이나 하고 있다
188,(주)프레인글로벌,10514,팀바이팀이 강함. 업무강도가 높은 팀에 들어가면 힘듦...연봉이 귀여움. 업계 1위라고 했는데 연봉은 왜 귀여운지 모르겠음...그만큼 복지도 너무 작고 귀엽다.
189,(주)프레인글로벌,10514,연봉이 너무 낮음. 주장하는대로 업계 1위?? 명성을 높이고 싶다면 직원 연봉부터 올리는 것이 좋을 것 같음
190,(주)프레인글로벌,10514,쓸데없는 이슈가 너무나도 많이 생긴다. 대표가 하고 싶은게 너무나도 많은 사람이다.
191,(주)프레인글로벌,10514,"연봉인상률이 낮은 편이라고 알고 있으며 팀마다 다른 분위기가 단점. 기본급여도 적은 편이며, 기혼자 위주 복지. 프로젝트 투입 선택권이 자유롭지만은 않은 듯."
192,(주)프레인글로벌,10514,"업계 최저 연봉, 항상 낮은 인상률, 고인물, 성과에 대한 보상 미미"
193,(주)프레인글로벌,10514,"오랫동안 일한 임원진분들 중에 열정적으로 일하고 크게 성취하는 분들도 있고, 아닌 분도 있음. 안정적인 회사 분위기 덕에 묻어 가는 분들이 있어 보임."
194,(주)프레인글로벌,10514,고인물...땡땡이들...진짜....경력직의 무덤....오지마세요 연봉 개짬 공채/임원들 이상한 근자감 있어서 경력직 후려치기 개쩖 우물안의 개구리라 자기들 말이 진리인줄 앎 진짜 힘들어요
195,(주)프레인글로벌,10514,사원 대리급 대비 과차장급이 많음 연봉이 높은 편은 아님
196,(주)프레인글로벌,10514,연봉협상이라고 하지만 사실상 통보임. 일하는 사람들은 죽어나는데 윗사람들은 사람을 안뽑아줌
197,(주)프레인글로벌,10514,"짠 연봉, 복지는 전무, 성장가능성도 보이질 않음 성장 필요 없고 돈 조금 받으면서 일 대강 하는거에 만족하는 사람들만 버티즌 곳"
198,(주)프레인글로벌,10514,식대 지원 없음 급여 낮음 업무의 체계가 부족함 (당일안에 기획해야하는 콘텐츠들이 많음)
199,(주)프레인글로벌,10514,일잘러들은 다 나가고 있는 추세 심각하게 연봉이 낮으나 사장 포함 임원들만 모름
200,(주)프레인글로벌,10514,팀바팀 사바사지만 모든 파트가 섬처럼 유리되어있는 느낌 사내 네트워킹이 어려운분위기.. 같은팀이더라도 평균인상률이라는 개념 거의없음 개인실적에 따라 연봉상승폭이 매우 다름
201,(주)프레인글로벌,10514,"- 꼰대임 엄청난 꼰대임 특히 꼰대짓 심한 팀장 있음 - 완전 수직 구조 - 대행사라 다양한 프로젝트 할 수 있다? 글쎄.. 선택권이 없음 시키면 해야함. - 연차 눈치보면서 써야함(팀바이팀에 따라 자유로운 곳이 있으려나? 모르겠음) 꼰대 팀장은 하나하나 관여함 - 임원이 많음 왜 이렇게 많은지 모르겠음 - 쓸데없는 자부심 아직도 PR은 우리가 1위야 하는데, 글쎄 디지털에 대응도 안되고 디지털 분야 자체에 전문성이 없고 약한 상황에서 앞으로도 유지가 가능할까? - 인사팀이 일을 안함. 일을 한다면 못함. 그래서 불편함 모든 영수증 처리 다 직원들이 하고 도움주는게 없음. 인사팀에 뭐 서류나 이런 절차 부탁해도 오래 걸림. - 기타 복지 없음"
202,(주)프레인글로벌,10514,개인사업자처럼 자기 고객사 업무 위주. 인하우스처럼 목적의식을 갖기는 어려움.
203,(주)프레인글로벌,10514,"업계 자체가 고보수를 받기가 힘든 구조이다보니,,, 인센티브제도 도입한 걸로 알고 있지만 더 적극적이고 확실한 보상체계가 필요해보읻다"
204,(주)프레인글로벌,10514,당시 AE님들의 업무량이 많았던거로 기억한다. 단점은 딱히 생각나지 않는다.
205,(주)프레인글로벌,10514,팀바이 팀이 매우 심함. 야근수당 없음. 인사팀이 일을 더럽게 못함.
206,(주)프레인글로벌,10514,PR담당자 이외 지원 부서에 대한 하대 경향 있음. PR이외 직군은 R&R도 애매하고 전문성을 쌓기도 쉽지 않음. 조직이 커지다보니 시장 변화에 따른 빠른 대응이 힘듬. 반복적으로 이야기되지만 고쳐지지 않는 몇몇 악습에 좋은 인력들이 금세 떠나는 일도 다수
207,(주)프레인글로벌,10514,"업계 특성상 워라밸 좋지 않음, 팀바이팀 문화/업무 등 상이함"
208,(주)프레인글로벌,10514,연봉이 동급 회사들에 비해 굉장히 낮은편. 팀 따라 천차만별인 업무 환경. 얼마 안되는 인센도 팀 따라 결정된다.
209,(주)프레인글로벌,10514,연봉이 짜다 잘 올려주지도 않음 인센티브 없다고 보면됨 디지털 온라인쪽에 투자 없다 언론홍보에 강하다고 강조하지만 정작 위기가 터졌을때 두발벗고 나서는 임원은.. 극소수
210,(주)프레인글로벌,10514,"너무 낮은 연봉과 너무 낮은 인상률 인사평가를 바탕으로 연봉협상하는데, 그 시스템부터 고쳐야 할듯 경영지원이 제대로 안됨(실무자들에겐 엄청난 애로사항) 제대로된 보상 문화가 없음 인센티브 현금으로 줌"
211,(주)프레인글로벌,10514,PR기업이 갖는 어쩔 수 없는 업무강도 신규 클라이언트 영업의 연속 PR업계 이름값 대비 높지않은 페이 은연중에 보이는 개인주의적 분위기(호불호있음)
212,(주)프레인글로벌,10514,"연봉과 상여금, 성과급.. 업계 1위라고 자부하지만 연봉은... 매출이 낮은 것도 아닌데 전반적으로 낮은 인상률과 연봉에 동료들이 떠나간다. (문화나 분위기 전반적으로 좋으나 팀바팀 사바사로 이상한 사람 한 명 때문에 후배 직원들 나가는 경우는 보았음)"
213,(주)프레인글로벌,10514,"연봉 적음. 프레인엔 관심없고 TPC나 스트롤, 그외 잡다한 사업에 관심 많은 대표때문에 화남. 보여주기식 자기 홍보에 능하고 또 거기에 열광하는 팬들이 있어 두번 화남"
214,(주)프레인글로벌,10514,공채와 경력직의 불균형. 그리고 본부별 업무 배분 차이 등이 심했다. 노력해도 안되는 팀은 안되더라.
215,(주)프레인글로벌,10514,업무 체계가 없고 인수인계도 당연히 제대로 되지 않는다. 인력도 턱없이 부족한데 실무를 하지 않는 중간관리자급이 너무 많다. 과거의 명성에 기대 관리자급은 안일하게 일하고 팀 돌아가는 상황에 무관심. 재수없으면 일년 내내 제안서만 써야할수도.
216,(주)프레인글로벌,10514,홍보에 대한 이해가 낮아 괴리감이 큽니다. 백업 압무 진행 시 커뮤니케이션 미스가 생길 때가 있습니다.
217,(주)프레인글로벌,10514,연봉 너무 안 오른다. 개인 성과에 따른 인센티브 없다시피. 팀 인센티브는 있지만...
218,(주)프레인글로벌,10514,인사평가 시 상사의 평가비중이 매우 높아서 상사의 스타일에 맞지 않으면 평가도 좋지 않을 가능성 큼. 어딜가나 문제이겠지만 일이 많은 사람은 많고 적은 사람은 적은듯
219,(주)프레인글로벌,10514,"연봉연봉연봉. 업계 1위라고 말하지만 연봉은 보잘 것 없어 현타옴. 회사에 돈이 없다는데 이 조그마한 회사에 임원은 왜이렇게 많은지..정말 없는게 아니라 너희 줄게 없다는 것으로밖엔 안보임.. 코로나시국에 최근 임원 한분 또 영입 이로써 내 생각에 확신을 불어넣어줌...승진해도 연봉 상승은 없고, 그냥 연차 싸이면 능력에 상관없이 자동 승진. 이게 사람 미치게함. 나태한 사람과 일 많은 사람을 동등하게 평가하니 누가 열심히 하려 할까.."
220,(주)프레인글로벌,10514,자유로운 것 같지는 않음. 중견기업. 야근은 거의 매일 조금씩 함.
221,(주)프레인글로벌,10514,"기업들이 원하는 피알회사, 즉 자신들이 하기 껄끄러운 일을 깔끔하고 확실히 처리한다는 기본으로 돌아갔으면 합니다."
222,(주)프레인글로벌,10514,"의사결정이나 업무 프로세스가 좀 주먹구구입니다. 견고한 제조업, 금융업은 아니지만 각 리더들이 프로세스를 좀 만들 필요가 있었다고 보입니다. 아 맨파워.. 왜 똘똘하게 들어와서 멍해져서 남아있죠??"
223,(주)프레인글로벌,10514,현실에는 존재하지 않을 법한 리소스 분배에 집착 좀 그만했으면. 그리고 보이는 것에만 너무 집중하지 않으면 좋을텐데.
224,(주)프레인글로벌,10514,"연봉이 낮고, 팀원들과의 교류는 클라이언트에 따라 언제든 바뀌기 때문에 그런것 이 좀 아쉽다."
225,(주)프레인글로벌,10514,고인물이 많다. 안전성이 있다는 말도 되지만 과거에 머물러 있는 사람도 많다는 의미...
226,(주)프레인글로벌,10514,1. 연봉 2. 연봉 3. 은근 경직된 조직문화 4. 비전 없음 5. 다시 연봉
