,company_name,company_id,review_text
104,(주)코스콤,3395,지방대완전 무시합니다. 지방대 나오면 밥도 같이 못먹습니다. 3년에 한번 입사할까 말까 할정도로 개무시당함. 그러면서 충북대 입사설명회는 왜오는지
105,(주)코스콤,3395,"부서마다 다르지만 시장 개장 전인 8시~8시30분 사이로 출근해야. 프로젝트 있거나 사고 터지면 새벽 야근 불사, 주말 반납 기본. 일이 편하다고는 말할 수 없음. 정부에서 공기업 까대는 바람에 연봉, 복지 약간 축소 당함.. 현재는 공기업 탈피했다고 하나 정부 입김이 아직도 회사에 영향을 끼치는 건 사실. 금보원으로 인원 떨어져 나간 것이 그 예. 금융 전산이기 때문에 비교적 전산 쪽에 집중하고 싶은 이들에게는 비추. 기본적으로 금융 관련 지식에 대한 꽤나 높은 이해도를 요구. 금융에 관심, 흥미 없다면 일이 재미없을 수도 있음. 수직, 경직된 문화. 타기업 대비 인사적체 심한 편."
106,(주)코스콤,3395,야근 주말출근 가리지않음 회식 많음 평일 낮에도 반주할 정도 상하관계 경직
107,(주)코스콤,3395,정체되어 있는 인력 첫직장으로 간다면 매너리즘에 빠질수도
108,(주)코스콤,3395,"호봉제로 운영되기 때문에 신입으로 들어올 경우, 아무리 능력있는 사람이라고 하더라도 층층시하 생활을 할 수 밖에 없음"
109,(주)코스콤,3395,업무의 진취의식 부족. 상하 위계질서의 강요. 고령화에 따른 분위기 정체
110,(주)코스콤,3395,"인사적체, 평균 근속연수가 많고, 군대문화가 있음"
111,(주)코스콤,3395,업무에 대한 책임감 및 스트레스가 높음
112,(주)코스콤,3395,일을 열심히 하는 직원이 많지 않음. 직원 20%가 회사 전체의 일을 하는 구조.
113,(주)코스콤,3395,직급이 있을수록 워낙 정치적이고 속내를 알 수 없음
114,(주)코스콤,3395,어떤 창의적이고 새로운업무를 생각한다면 No
115,(주)코스콤,3395,"차별이 없다 하지만 차별이 많은 회사 , 평균연봉 1억에 비해 직원들이 일을 너무 안함"
116,(주)코스콤,3395,정부의 공공기관 방만경영 정상화로 인해 줄어든 복리후생
117,(주)코스콤,3395,사내문화가 세련되지 못함. 핵심경쟁력은 점점 떨어지고 있는 상태. 회사의 미래가 불투명.
118,(주)코스콤,3395,"안정운용이 핵심이므로 개인의 도전적인 업무는 거의 없거나 받아들여지지 않는 편입니다. 업무 분위기 또한 보수적이며, 업무나 사업의 종류가 정체되어 있는 편입니다."
119,(주)코스콤,3395,승급이 쉽지 않아요 좋은 직장이다보니 퇴사하는 사람이 없어서..
120,(주)코스콤,3395,비효율적 프로세스. 경영진과 직원들간 생각 차이가 큼. 열심히 일하지 않거나 성과가 나지 않는 사람도 뒤섞여 있음.
121,(주)코스콤,3395,"주먹구구식 일처리, 비합리적인 시스템, 정부정책에 따라 시시때때로 변하는 회사정책, 도전의식 결여."
122,(주)코스콤,3395,인사적체가 매우심해 차장급도 코딩하는건 거의 당연
123,(주)코스콤,3395,"-증권시장과 전산지식을 모두 갖추신 엄청 뛰어난 분들도 많이 계시지만, 반대로 개발을 많이 해보지 않고 관리직으로 올라가신 분들도 많습니다. 이런 분들은 전산적 마인드없이 그냥 시키면 다 되는 줄 아십니다. -매너리즘에 빠지기 쉽습니다. 증권시장업무라는 것이 어느정도 업무적지식으로도 전문성이 요구되다보니 넓은 영역보다는 개개인에게 좁고 깊은 지식이 요구됩니다. 본인 외 타인이 하기는 어려운 좁은 영역의 일을 오래하다보니 매너리즘에 빠지게 됩니다."
124,(주)코스콤,3395,"인사적체가 심한 편이며, 신입사원을 거의 뽑지않은지 오래되어 연령이 높음"
125,(주)코스콤,3395,"평균연령이 높음, 그말은 보수적인 경향임. 팀마다 분위기가 다르지만 취중코딩을 할때가 있음"
