,company_name,company_id,review_text
0,(주)조이시티,579,"미래 먹거리의 부재, 시대에 뒤처지는 비전과 개발력, 코로나 이후 쪼그라드는 사세"
1,(주)조이시티,579,도전/변화보단 안정/보수적 회사. 물가가 많이 올라 낮은 식대. 포괄임금제.
2,(주)조이시티,579,대리과장급 레벨의 근무자들이 어느정도 경력이 쌓이면 대형 게임사로 이직하는 경우가 많음
3,(주)조이시티,579,slg 명가.... 너무 한가지 종류의 게임만 만들음...
4,(주)조이시티,579,자기 발전 하는 것에 있어서 한계가 명확함 상여가 거의 없도 복지도 아쉬움
5,(주)조이시티,579,게임의 혁신성을 추구하는 모습이 보이지 않았습니다. 요즘 유행하는 게임 조금 다르게 만들기 정도로 살아남을 수 있을까 하는 생각이 들었습니다.
6,(주)조이시티,579,"수시로 바뀌는 방향성, 발전성이 부족, 답답할 수 있는 개발 문화"
7,(주)조이시티,579,이사급 리더가 갓 업계에 입문한 신입들한테 가스라이팅이 심함.
8,(주)조이시티,579,"사업부, 게임개발, 지원부서간 여러 격차들이 존재하여 불균형을 야기"
9,(주)조이시티,579,첫 회사로만 좋음 고이기 쉬움 이직하기 애매함 간혹 찐내나는 직원 보임
10,(주)조이시티,579,"안정성이 곧 리스크입니다. 안정적이기에 더욱 최신 트렌드를 반영할 필요가 있습니다. 예시로 2023 지스타 전 임직원 출장 워크샵 진행, 매년 지스타 인사이트 보고서 작성과 같은 트렌드 트래킹이 필요합니다. 안정성은 과거의 업적을 현재에 누리는 것입니다. 미래의 영광은 현재가 아닌 미래에 있습니다. 미래는 현 10대 초~후반, 20대 초반 게임유저가 쥐고 있다고 봅니다. 10대 초~후반, 20대 초반 게임유저를 타게팅하기 위한 쇄신의 노력을 할 필요가 있다고 보여집니다."
11,(주)조이시티,579,"정치 끝판왕 일을 못해도 정치 잘하면 장급 도달 가능 3년 이내 퇴사율 매우 높은 회사 로봇이 타주는 음료 제외하고 간식, 음료 모두 돈내고 사야함 타 게임 업계 비교 복지 최악"
12,(주)조이시티,579,주차장 자리가 한정적이라 자차를 이용해서 출퇴근은 힘듦
13,(주)조이시티,579,매출을 견인하는 게임이 너무 오래된 게임이고 신규 게임 개발에 힘을 쏟지만 아직까지 이렇다 할만한 게임이 등장하지 못하고 있음
14,(주)조이시티,579,대부분 경영진 말에 휘둘리며 그에 따라 일해야 하는 일ㅇ 비일비재함 기업문화는 개선 여지 없음 워라밸도 개선 여지 없음
15,(주)조이시티,579,"회사의 미래를 이끌어갈 라이징 스타 타이틀의 부재, 돈이 많은 편도 아니면서 돈 안나오는 구멍만 계속 파고 있음."
16,(주)조이시티,579,"경영진에 말 한 마디에 바뀌는 경영 전략, 모기업과의 의사 소통 어려움"
17,(주)조이시티,579,"워라벨이 보장이 되지는 않습니다. 모든 게임회사들이 마찬가지겠지만, 정말 좋아하는 사람만 입사하는 것을 추천드립니다."
18,(주)조이시티,579,"대신 그만큼 처우 및 연봉 대우가 낮고, 성장할 수 있는 한계가 있음"
19,(주)조이시티,579,출시한 게임이 잘 안되어서 회사 전체가 성장을 못하는 느낌입니다.
20,(주)조이시티,579,"업무량이 적지는 않음, 체계가 확실하지 않아서 필요에 따라 야근 요구됨 포괄임금제"
21,(주)조이시티,579,복지 개선 없음 시대에 뒤떨어지는 선택들이 업무를 어렵게 하거나 회사를 어렵게 함
22,(주)조이시티,579,가난함 소통 않는 경영진 캐시카우 프리스타일 외에 희망을 걸만한 성공적인 모바일 게임 없음 자신있는 신작게임 없음 진짜 게임이 좋아서 좋은 게임을 함께 만들어 가고자 임하는 헤드급의 부재 모두가 책임 피하기 위해 결정을 미루고 누구 하나 앞장서지 않음 열심히 일한 사람과 그렇지 않은 사람 간이 업무 평가와 차등보상 제대로 이뤄지지 않아서 열심히 하는 사람들이 패배감 좌절감 느끼기 쉬움 최근 특히나 회사가 가난한 게 느껴질 때가 많음
23,(주)조이시티,579,너무 복잡한 업무 보고 형식과 윗사람들의 눈치를 많이 봐여 하고 줄을 잘 서야 하는 것 같습니다 윗사람들에게 이쁨 받으면 잘 다닐만한 곳입니다
24,(주)조이시티,579,위에서도 말햇지만 점심을 안주는게 생각보다 큼... 점심만 줘도 좋을거같아요
25,(주)조이시티,579,"부서에 따라 복불복인 업무 강도와 자율. 휴게실에서 자율적인 IT 기업처럼 업무시간에 담소를 자주 나누는 부서도 있는 반면, 휴식을 취하기 힘든 부서도 있어 부서간 양극화가 심한 느낌이 듬. 바쁜 사람만 계속 바쁨."
26,(주)조이시티,579,"작업 프로세스가 없는 수준, 식사 제공 없음, 신작을 만들려는 의지가 없음, 굉장히 비효율적인 팀을 운영하고 있음"
27,(주)조이시티,579,딱히 없음!!! 회사 사람들끼리 잘 안친한것..? 최근에 개발팀이 다 퍼스트타워에서 수내역 조이시티 타워로 이사가고 비개발직군만 퍼스트타워에 있음
28,(주)조이시티,579,"복지가 짠편, 부바부가 심함, 업무강도가 있어 야근하는 부사가 많지만 야근수당은 안 줌, 회의실이 항상 만석, 구내식당이 없으"
29,(주)조이시티,579,"포괄임금제, 경직된 조직문화, 업무가 부바부로 엄청 많을 수 있음"
30,(주)조이시티,579,"구내식당 없고, 연봉 포함임 야근수당 없음 팀바팀이지만 야근 가끔 많이 함"
31,(주)조이시티,579,"다양한 시도를 하기엔 어려운 곳, 게임들이 껍데기만 다르고 다 비슷비슷한 것 같음, 복지가 다소 아쉬움, 현금성 복지 없음, 중식 제공 없음, 개발 프로세스가 조금 정신없음"
32,(주)조이시티,579,경영진 보고를 위한 업무가 허다함 보고를 위한 보고 구내식당 없음
33,(주)조이시티,579,"전형적인 수직구조 회사. 회의 시간이 매우 길고, 쓸데없이 사람들 다 불러놓고 자기들 이야기만 주절주절 한다."
34,(주)조이시티,579,"정책이 시시각각 변할때가 많아, 잦은 수정작업이 있다. 매출지표가 중심이되는 작업을한다"
35,(주)조이시티,579,다른 게임 회사들에 비해 복지가 턱없이 부족하다 점심값도 주지 않는다
36,(주)조이시티,579,"개발자들 기술스택이 너무나 낮고, 프로세스도 비효율적이라 복붙만 겁나게 하는 개발 과정임. 당연히 개선할 의지가 없는 사람들과, 그로 인한 업무 과중이 심각한편. 그냥 배울것도 없고 경력 무덤인곳."
37,(주)조이시티,579,사내식당이 없어서 나가서 먹어야 해서 메뉴 고르는게 힘들었음.
38,(주)조이시티,579,심한 업무 강도가 너무 많아서 일하기가 힘들었음. 그리고 분당 쪽 회사 출퇴근이라 은근 심함
39,(주)조이시티,579,많이 배울 수 있는 대신 많이 일해야함. 하지만 그만큼 대우해주려고 회사에서도 노력하는 편
40,(주)조이시티,579,야근이 그냥 깔려있다. 유연 근무제지만 칼퇴하면 눈치보인다.
41,(주)조이시티,579,이렇다할 대단한 장점도 대단한 단점도 없는 회사 뭔가 대단한 커리어를 쌓고 싶은게 목적이라면 어울리지 않음. 전쟁 게임 아니면 스포츠 게임 뿐인게 단점이라면 단점
42,(주)조이시티,579,"포괄임금제...식사 제공 안함, 회사 이사가서 사옥 생기면 식사 하려나"
43,(주)조이시티,579,너~무 일이 많음 / 일이 많은데 it인재들 뽑기 힘들어서 그런가 공고 올려도 .. 사람이 안뽑힘.. / 하나의 조직이 너무 힘이 쎔 ..
44,(주)조이시티,579,"복지가 은근히 없음( 사내카페, 복지포인트 등) 사람들 잘 쳐냄"
45,(주)조이시티,579,연차쓸떄 눈치 준다. 야근이 너무 많다. 뭐만하면 대응 해야한다고 다같이 잠못잔다.
46,(주)조이시티,579,팀바팀 부바부이지만 야근 좀 함. 일정을 빠듯하게 준다. 워라밸은 적당히?
47,(주)조이시티,579,회의를 통해서만 결정하기 때문에 1사람이 다 결정하고 없으면 결정을 하나도 못함 그래서 1주를 기달려야함.
48,(주)조이시티,579,거의 없는 현금성 복지 명절 떡값 몇년째 동일 연봉협상 외 이벤트 전혀 없음 팀바팀의 분위기 야근
49,(주)조이시티,579,연봉이 많은 편이 아니고 워라벨은 보통입니다. 복지가 거의 없습니다
50,(주)조이시티,579,팀바팀. 팀 분위기 좋지 않습니다. 성과가 나오는 회의가 드뭅니다.
51,(주)조이시티,579,야근 꽤 많이 하는데 야근 수당은 없음(포괄 연봉제) 높은 곳에서 때려박아서 시시때때로 살인적으로 변하는 일정
52,(주)조이시티,579,할말하않. 특별히 모나지 않다고 하는데 내가 있던 팀은 특별히 모난 사람이 있었음 야근. 야근. 야근. (주 3일은 11시 넘어서 퇴근하는 듯?) 유연근무제라지만 일찍 퇴근하는 날은 손에 꼽음. 사람이 모자른데 일은 너무 많이 줌 (야근을 기본으로 해야하는 일을 줌) 재택근무는 있는데 눈치 때문에 못함
53,(주)조이시티,579,구내 식당이 없다는 것 정도?... 이사 이후엔 생길지 모르겠다. 그리고 개발 장르가 다소 한정적이라 특정 직군에게는 단점이 될 수도
54,(주)조이시티,579,옛날에 사용했던 작업물을 계속 사용했기에 성장하는데 한계가 있었으며 주말에도 출근하는등 고생한것에 비해 얻은게 없었다.
55,(주)조이시티,579,"주로 전쟁 게임만 하다 보니, 그 장르 안좋아하는 분들은 안 맞을 것 같기도 하네요. 야근은 진리의 팀바팀이지만 적지 않게 있는 듯."
56,(주)조이시티,579,"2016년 기준) 무능한 사람들, 고인물이 너무 많았음. 함부로 사람을 자르지못하는 분위기가 기업의 장점이자 단점이었음. 무능하고 시간만 때우려는 사람들 정말 많았고 성희롱 하는 미친놈들도 많았는데 지금은 어떨지 모르겠음"
57,(주)조이시티,579,워라밸이 별로 좋지는 않았고 바쁜 시기에는 새벽까지 일하거나 철야 주말출근도 있었다 팀바팀인것 같기는 하다
58,(주)조이시티,579,인력관리 정말 못함. 근.본.없.는. 그 팀장 때문에 스트레스 받는 사람들이 한둘이 아님. 오죽하면 퇴사할 때 실장님 면담하는데 '나갈 사람은 안나가고...' 라고까지 말씀하셨음. 직원들 면담이 필요함.
59,(주)조이시티,579,급여가 결코 높은편은 아니라고 생각 합니다. 개인차가 있겠지만욬
60,(주)조이시티,579,재밌는게임이 단 한개도 없음 실무진들 어떻게 들어왔는지 누가 뽑은건지 하나같이 이해 불가
61,(주)조이시티,579,게임이 더이상의 발전은 크게 없어보임. 단순 경영진 입맛 맞추기식의 또는 주먹구구식의 개선만 진행되면 어떻게 진보해나갈지…. 신작들 또한 기대가 안됌
62,(주)조이시티,579,회사가 안정화된 상태가 아님. 야근 밥먹듯이 함. 게임이 진짜 재미없는게 가장 큰 문제.. 그래서 결론적으로 회사가 더이상 성장하긴 어려울 것 같음.  무엇보다 꿀발린 말을 하며 좋은 회사인 ‘척’을 하는 경우가 많은데 속지 않길 바람
63,(주)조이시티,579,단순 보고를 위한 업무가 많음. 경영진의 말에 업무 방향이 계속 바뀜. 윗분들이 제일 신경 많이 쓰는게 경영진
64,(주)조이시티,579,눈치보는 일이나 사내 정치가 많은거 같음 텃세아닌 텃세
65,(주)조이시티,579,대표 입김이 쎄서 내가 뭘 하고 싶어도 못할 때가 제법 많음 개발자 입김도 쎈 편이지만 사실 상 플바플이긴 함
66,(주)조이시티,579,은근히 복지가 하나둘 줄어듬 수직구조의 업무방식 회의가 많음
67,(주)조이시티,579,일이 많을땐 야근이많음. 일과 개인의 생활을 함께 해야 됨. 의사결정시 상급자의 의도가 주로반영
68,(주)조이시티,579,"다른 회사 칭찬하는 장점들을 흉내만 내려하고, 실질적으로 해주는건 없는 회사. 기술력도 없어서 프로그래머를 단순 노가다만 시키는 노동직으로 밖에 부릴줄 모르는 곳. 외부 채용으로 들어올 때마다 사람을 융화시키게 노력하는게 아니라 그냥 내깔려둬놓고 뒤에서 평가질 후 맘에 안들면 쳐내거나, 해당 문제에 대해 뒤집어 씌움. 그렇게 지쳐서 나간 사람이 한둘이 아님."
69,(주)조이시티,579,근무 시간이 좀 긴편이다 주간 보고 회의가 긴 편이다 사내 카페에 메뉴가 별로 없다
70,(주)조이시티,579,IT 기업치고는 복지나 휴게 시설이 미약하다. 새로운 장르의 게임 개발에 도전하기보다는 오래된 게임을 라이브 서비스하면서 유지하거나 이미 개발해봤던 장르의 게임을 반복적으로 개발하는 방식을 하고 있어 창의성이나 도전정신 등의 열정이 생기기 어렵다.
71,(주)조이시티,579,"퇴근을 하지 못 함, 보너스는 이게 보너스라고 주는 건지 모르겠음, 삭막한 분위기"
72,(주)조이시티,579,9시 출근이 일반적이라 올빼미형 인간들은 힘들 수 있음
73,(주)조이시티,579,실질적인 복지가 없고 비효율적으로 일하는 케이스가 많음 다른 회사도 비슷할텐데 그만큼 돈을 주느냐 안주느냐의 차이같음
74,(주)조이시티,579,뭐 알바 주제에 단점이랄것도 딱히 없었음. 팀 내에서 잘 챙겨주셔서 딱히 단점이랄건 없었음. 다만 자율출퇴근제인거 같은데 업무해야하는데 담당자들이 출근이 늦어지는 경우가 많아서 좀 기다렸음. 근데 맨날 12시 2시 들어가는거 보니 이해도 됨.
75,(주)조이시티,579,허리어 위치하는 경력자가 없다보니 경영진과 실무자간 생각의 간극이 있다고 느껴졌습니다.
76,(주)조이시티,579,너무 사업적인 접근이 강하다보니 애착을 갖고 프로젝트에 임하기 힘들었음. 돈 버는 기계를 만드는 느낌.
77,(주)조이시티,579,프리스타일 외에 다른 아이피가 없다 퍼블리싱할때도 좀...게임을 골라서 가져오는 안목이 많이 부족한 듯함
78,(주)조이시티,579,야근은 피할수가 없다. 선택적근로가 도입되었지만.. 잘 모르겠다..
79,(주)조이시티,579,"신입에게 기회가 많은게 사람에 따라 좋을수도 안좋을수도 있음, 게임회사 특성상 야근이 없지는 않음"
80,(주)조이시티,579,"밥 주는 복지 없음, 탑 다운 형식의 업무 환경, 연봉 짬"
81,(주)조이시티,579,큰단점은 보이지않지만 각 프로젝트마다 목표선정이 매출로 한정 짓는듯
82,(주)조이시티,579,"컴퓨터를 두대 써야 해서 업무용 피씨와 인터넷 피씨가 따로 있는게 불편, 회사가 너무 덥고 게임회사의 느낌이 잘 안난다"
83,(주)조이시티,579,"신입, 초급 개발자라면 기술적인 업무보다는 단순 복사, 붙여넣기로 만드는 프로그램으로 대부분의 일을 하기 때문에 너무 오래 일하면 실력이 제자리일 수도 있다."
84,(주)조이시티,579,"비효율적인 업무 과정이 많아서 엄청 스트레스 받음, 버전관리 안되는 코드도 여럿 봤음 신입때는 배울일이 있지만 경력좀만 쌓이면 여러가지 단점이 보이기 시작함"
85,(주)조이시티,579,엘레베이터가 적다. 점심을 사먹어야하는데 먹을 곳이 한정적.
86,(주)조이시티,579,신입에게 많은 기회를 주는 만큼 사람에 따라 업무량이 조금 많다고 느낄 수도 있음. 하지만 그 만큼 배우는 것도 많고 업무량도 상황에 따라 조율 해줍니다. 그것말고는 딱히 생각나는게 없네요.
87,(주)조이시티,579,"직원 역량 평가에 대한 자세한 기준점이 무엇인지 알려주지 않고, 역량을 늘려야 하는 부분만 강조함. 타 직원들에 대한 업무 관심도가 있는 지 잘 모르겠습니다."
88,(주)조이시티,579,단점은.....부서 바이 부서답게 바쁜 조직 한가한 조직 여러개로 나눠져잇는 점
89,(주)조이시티,579,제가 근무시에는 타 회사들에 비해 조금 떨어지는 복지와 임금 수준이었습니다. 그거 말고는 괜츈.
90,(주)조이시티,579,야근이 많음(부서 바이 부서) 의견을 제안하더라도 자연스럽게 사라짐
91,(주)조이시티,579,일이 너무 즉흥적이고 리스크는 떠 앉지 않으려고 한다  즉흥적이라는 말은 반대로 얘기하면 신속한 대응이라고 볼 수도 있고  리스크를 낮게 가져간다는 것은 하이 리턴이 생기기 어렵다 라는 말이기도 하다  각자 성향에 맞으면 장점으로 볼 수 있을 수도 있겠다.
92,(주)조이시티,579,"뭔가 회사의 발전이 지지부진하며, 인센티브가 너무 미약하다"
93,(주)조이시티,579,복지가 별로인 것 같다. 노력하는 듯 하나 만족스러운 부분이 없다
94,(주)조이시티,579,"출퇴근 시간 자유롭고 업무 시간 이후에는 PC 오프제도 있어서 못하게 막아놨지만, 의미 없는 제도임. PC 오프되거나 최대 근무시간 다 채우면 집에가서 일함. 부서마다 다르겠지만 야근 매우 잦고 늦게까지 하는 경우도 많음. 재택 전환되면서 퇴근시간이라는 것이 없어짐.  실직적으로 와닿는 복지는 없음.  포괄임금제... 연봉 낮은편, 업계 최고 수준 대우 해준다고는 하나 신입 연봉 짠편.  수평적 문화 만든다고 '님'호칭 쓰지만 그냥 수직적 업무 문화에 '님'자만 쓰는 느낌.  겉으로는 중견기업 이미지 강조하지만, 실상 뜯어보면 허술한 부분이 굉장히 많다.  식대 지원되지만, 한달에 10만원 정도? 서현역 근방 밥값이 상당히 높은데 10만원 가지고는 택도 없음.  화장실 공간 협소해서 똥싸기도 힘듬. 200명 넘는 사람들이 있는데 화장실 칸은 한 층에 4칸이 전부. 화장실 안에서 대기하는 사람 많고 점심시간 이후에는 양치하는 사람까지 해서 화장실 꽉참... 심지어 변기 자주 막힘.  각자 개인 업무하느라 대화가 거의 없고 조용함. 사내 메신저로 대부분 소통하지만 팀 내 소통은 많지 않음.  자체 개발 게임보다는 퍼블리싱 위주로 방향을 돌리는 것 같은데 퍼블리싱하는 게임도 그닥 잘 안됨.  SLG 장르에 노하우가 있다고 SLG 장르만 줄창 출시함. IP 사와서 죄다 SLG로 만듬..."
95,(주)조이시티,579,고인물들이 회사를 망칩니다 누가 퇴사하면 왜 퇴사하는지 조사 좀 해라
96,(주)조이시티,579,야근이 너무 많아요.. 경영진들은 야근을 줄이겠다고 하시지만 일이 너무 몰리게 되네요 가끔은 칼퇴하고 싶어요 지금은 일이 좋아서 열심히 하지만 나중에는 몸이 버텨줄까 모르겠네요
97,(주)조이시티,579,1.야근이많다. 2.갑작스러운작업을 많이한다. 3.라인이 없으면 연협에 큰영향이있다.
98,(주)조이시티,579,확실히 게임 업계 특유의 야근이 있음 부서별로 케바케이긴 하겠으나 특정 부서는 늦은 시간에도 집에 안가더군요 자의인지 타의인지는 모르겠음 제가 있던 부서에서도 일주일에 이틀 정도는 야근했던듯 ??
99,(주)조이시티,579,친목질에 짜친 정치판... 타인에게 책임과 업무를 전가해대는 참 다이나믹한곳 일보단 친목질을 많이 배울 수 있는곳..  특정 잉여들이 쥐고 흔드는 꼴이란.. 참 가관임.. 솔직히 배울게 없음...
100,(주)조이시티,579,구내 식당이 없어서 점심 식대비가 생각보다 많이 나감. 그 외적으로는 크게 단점을 못 느껴봄
101,(주)조이시티,579,"잦은 그룹/팀간 인원 이동/변동 발생, 잦은 내부 기획/일정 변동"
102,(주)조이시티,579,"부서간의 연결고리가 없어 일하는데 답답합니다. 중소기업의 한계가 보이는 듯 하고, 여러 개발사로 자꾸 쪼개고 인력을 내보내다보니 규모있게 성장하지 못하는 듯 합니다."
103,(주)조이시티,579,"게임회사 특유의 갈아먹는 분위기. 돈도 많이 주지도 않고, 갈아먹히는 분위기에 복지도 안좋음. 좋아보이려고함"
104,(주)조이시티,579,야근이 많았고 연봉이 낮음 신규 개발이 없기 때문에 커리어를 쌓기에는 부적합한 기업입니다
105,(주)조이시티,579,"회사 사람들에게 비전을 심어주기엔 부족한 부분이 보인다. 연차가 낮은 사람일 수록, 이 회사에 오래 다녀야하나 라는 생각이 들게 한다. 몸과 마음이 편한 만큼, 나 자신의 발전을 위해 따로 노력해야한다."
106,(주)조이시티,579,고인분들 줄이 있는데 찍혔거나 별로 대면대면 하지않다면 팀이터졌을때 퇴출1순위입니다만 뭐 어차피 그전에 나갈분들은 다 나가지요
107,(주)조이시티,579,연봉이 같은 직군의 타회사들보다 많이 적습니다. 자잘한 행사같은것들이 있습니다.
108,(주)조이시티,579,고였음. 평가기준이 대인관계. 연협 시기가 늦음. 개인적으론 전문성 기르기 힘들었음.
109,(주)조이시티,579,의견을 내도 팀장 또는 그 이상 급에서 잘리는 경우가 많았는데 거기서 약간 보수적인 느낌을 받았다 또 게임회사 안에서도 연봉이 적다고 슬쩍 들었다
110,(주)조이시티,579,복지제도가 다양해 보이지만 체감되는 복지는 많이 없고 연봉에서 중식비가 포함됌 신규 산업 추진에 적극적인 투자 의지를 보여줬으면 좋겠고. 합리적인 복지 및 보상 체계를 마련해 줬으면 좋겠습니다.
111,(주)조이시티,579,가끔 체계가 없음 내가 다해야함 돈이 쪼들림 정기적으로 이 회사 재정상태가 걱정됨
112,(주)조이시티,579,공무원적인 느낌이고 기술도 보수적인? 편이라 자신이 노력하지 않으면 발전이 없을수도있다
113,(주)조이시티,579,팀에 따라 야근이 심한 팀이 있음. 내가 속한 팀은 아니었다. 딱히 기재할 부분이 없다.
114,(주)조이시티,579,"닥치는대로 시키면 다해야 하기 때문에 업무가 너무 많은 사람들이 많고, 무조건 경영진의 뜻대로 따라야하는 시스템"
115,(주)조이시티,579,적은 연봉. 보상 미미. 구내식당없음. 그 외 뭐 기타등
116,(주)조이시티,579,"어떻게든 연봉 후려치려는 회사, 진짜 말도 안되게 연봉이 낮음, 사람 안 구해주면서 일은 엄청 시킴"
117,(주)조이시티,579,어느 회사나 마찬가지 겠지만 인수인계를 친철히 해주지 않는다는 것..
118,(주)조이시티,579,출시 전 평가 허들이 높아 작업이 비효율적이고 열정을 많이 식게 함
119,(주)조이시티,579,서현역이라 식대가 조금 많이 나감 현금성 복지는 거의 없다고 보면됨 일 엄청 많음
120,(주)조이시티,579,비젼있는 좋은 게임들이 많지 않음. 사업위주의 의사결정들이 많아서 그런지 몰라도 좋은 게임을 개발 할 수 있는 사람들이 많지 않은 것 같음.
121,(주)조이시티,579,"교육과정이 굉장히 빡쎄며, 1달만에 번아웃 올수 있음 화장실이 적어서 늘 칸이 다 참. 똥냄새 오짐 점심은 사비로 먹어야하는데 서현역근처라 식대가 꽤 많이 꺄짐 업무도 야근수당 안주는데 오지게 많은듯 하다 TO는 없는데 인턴기간 엄청나게 뭐 시킴. 전환가르쳐 줄때 통수맞은 느낌"
122,(주)조이시티,579,회의가 많은 편 업무가 복합적인 경우가 많아 일정 관리가 어려움
123,(주)조이시티,579,"연봉이 짬, 연봉이 일단 너무 짬, 연봉을 너무 후려침. 입사때 연봉을 너무 후려쳐서 입사를 취소하려 했음. 일년 후 올려준다 했는데 결국"
124,(주)조이시티,579,예전에 게임개발을 하면서 투자자들에게 보여지기 위해서 게임개발이 완전하지도 않은데 오픈베타를 한 적이 있었습니다. 결국 그 게임은 망했습니다.
125,(주)조이시티,579,계약직이어서인지 몰라도 식당은 정직원들만 이용가능했는듯. 나가서 편의점밥사먹었섰습니다.팀원구성이 여성분이 많아서 약간 여성위주로 흘러간다는느낌. 제작게임이 트렌드에 맞지 않고 오래됬다는 느낌이 강함.
126,(주)조이시티,579,복지제도가생각보다없어요 중식지원이라든지이런부분은전혀없습니다
127,(주)조이시티,579,딱딱한 느낌이 조금 단점으로 느껴짐 다른회사는 어떨지 잘모르겠음
128,(주)조이시티,579,직원 복지제도 자체가 많지 않음 필요한 경우에는 야근이나 크런치도 잦은편
129,(주)조이시티,579,규모가 어중간하게 큰 느낌 대기업이라기엔 복지가 부족하고 새로운 시도를 하기에는 태클이 많은...
