,company_name,company_id,review_text
267,(주)야놀자,8540,위로 갈수록 고달픈 곳. 어느 한 분의 의사결정에 따라 휘청. 하루 아침에 조직이 바뀌고 방향이 바뀌고 수긍할 수 없는 변화들이 잦아서 고단함.
268,(주)야놀자,8540,체계라곤 찾아볼수 없음. 방치 수준의 환경.각자도생 알아서 살아남아야함. 영업 외 해야할 잡업무가 많음.짠 급여
269,(주)야놀자,8540,"오래된 회사임에도 불구하고 아직 체계가 없고, 스타트업에서 벗어나지 못한느낌"
270,(주)야놀자,8540,상대적으로 연령층이 낮은 조직구조로 배움과 성장하는데 한계가 있다고 당시에 느낌
271,(주)야놀자,8540,업무에대한 이해도가 부족한 개발자들이 일을 망치고 사내정치가 심각함
272,(주)야놀자,8540,"성장 과정에 있어, 팀이나 개인은 도구로 생각 함. 성장에 필요한 중요직은 외부 인사를 고집 함"
273,(주)야놀자,8540,포괄제이기 때문에 야근을 한다고 해서 따로 수당이 나오지 않음. 그리고 인센티브 없이 주식으로 주는데 이게 장점이자 단점임.
274,(주)야놀자,8540,"운이 좋았을 뿐인 창업주 사람볼 줄 몰라 입사한 경력만 화려한 문제많은 경영진 수시로 갈아엎어지는 HR 가면갈수록 수준 낮은 문제를 만들어가기 시작하는 개발조직 사실상 손놓은 CPO 에 의해 망가진 PO조직 이 모든 것의 시작인 총괄대표, VPE"
275,(주)야놀자,8540,하드케리한 점과 다른팀과의 정치적인 감정이나 분위기에 휩쓸릴 수도 있음
276,(주)야놀자,8540,- 워라밸 파괴 - 내부적으로 정비해야할 것들이 많은데 자꾸 몸집만 키우고 있음 - 체계적이지 않은 일들이 너무 많음 - 한사람이 독단적으로 결정하는 경우가 너무 많음
277,(주)야놀자,8540,부서마다 케바케지만 회사 전반적으로 젊은 꼰대들의 텃세가 심해 경력직으로 들어가서 얼마되지 않아 퇴사를 하는 경우를 많이봤다. 커져가는 회사의 규모에 비해 내부 체계가 제대로 잡혀있지 않다.
278,(주)야놀자,8540,자괴감이 들 정도로 수시로 바뀌는 의사결정. 책임이나 뒷수습은 왜 직원들이 해야하는 지 모르겠음. 심지어 그걸 꾸역꾸역해내도 성과인정이나 보람은 커녕 욕 안먹으면 다행임. 심지어 그나마도 언제 바뀔지 불안해해야함
279,(주)야놀자,8540,"계약직에서 정규직 전환 매우 어려움, 야근 수당 없음, 업무량이 많음, 잦은 퇴사"
280,(주)야놀자,8540,어디에나 있는 정치 존재하고 님문화이지만 상하문화 남아있음. 눈치 안보는 사람은 다니기 괜찮음.
281,(주)야놀자,8540,비전 공유가 되지 않음 이해되지 않는 조직개편과 방향성없는 업무
282,(주)야놀자,8540,인센이 없음. 복지가 별로. 인수합병이 문어발인데 시너지가 안남
283,(주)야놀자,8540,일에대한 성과도 중요할 뿐더러 스타트업 특성상 기본적인 성격의 텐션도 중요시하는게 힘들었다.
284,(주)야놀자,8540,내부 직원들은 별로 안챙기는 상황 : 너무 외부 사업 확장에만 신경쓰는것이 아닌가?
285,(주)야놀자,8540,"절대 달성할수없는 목표, 중간에 목표를 올려버림ㅋㅋ 항상 위에서 새로운일 벌려놓으면 탑다운으로 바로 내려옴, 결국 일하는데 안정감이 전혀 없음, 직원은 같이 가는 동반자가 아닌 언제든지 갈아넣을 수 있는 부속품임"
286,(주)야놀자,8540,복지가 부족하고 목표가 불명확하다. C레벨들이 직원을 소모품처럼 여기는 것이 많이 느껴진다.
287,(주)야놀자,8540,사람들 인성이 진짜... 스타트업이라서 윗사람과 아랫사람들이 서로 소통하려고 노력하는 척 하지만 사실 개꼰대 회사
288,(주)야놀자,8540,프로세스의 변화가 무쌍함 단순업무로 자기 개발이 힘듬
289,(주)야놀자,8540,쓸데없이 회의를 자주함 어느순간 내가 맡은 일이 잡탕이 되어있음
290,(주)야놀자,8540,부서마다 다르겠지만 업무량과 야근이 많은편이었고 입사하고 퇴사하는 사람들이 많아 적응이 쉽지 않았음
291,(주)야놀자,8540,"팀간 협업이 너무 안 되고 이 현상은 픽스 불가능함. 쬐끄만 회사에 변호사는 왜이렇게 많고 인사는 왜이렇게 많은지 모르겠음. 애매한 역할이 많아 밥그릇싸움이 심해 공격적이고, 사람을 단순 수단으로 대하는 것이 좀 심함."
292,(주)야놀자,8540,"경쟁사 대비 연봉 및 처우가 현저히 낮음. 성과급 또한 없음. 스톡옵션과 같은 부가적인 인센티브 조차 없는 무늬만 스타트업인 기업. 최고 경영진만 성과를 다 챙겨가고, 허리급 또는 주니어 직원에게는 현저히 박한 처우를 제공하면서 처우에 대한 컴플레인에 대해서는 짜증섞인 반응만 보이는 한심한 경영진들의 이기심에 지침."
293,(주)야놀자,8540,팀원이 너무 자주 바뀌게 되는 짧은 근속연수. 인수인계만 하다 프로젝트는 진행이 더딘느낌
294,(주)야놀자,8540,"단순 보고를 위한 문서 작업이 은근 있음, 흩뿌려진 자료와 정보를 알아서 잘 취합해야함 때문에 업무 처리에 쓸모없는 시간 소요가 발생 할 수 있음"
295,(주)야놀자,8540,퇴근후에도 슬랙 태그하는 경우는 일상이고 연봉 상승률도 정말.. 너무 작아서 동기부여가 안됩니다
296,(주)야놀자,8540,내부에 있으면 좀 짜다는 느낌이 듭니다. 네카라쿠배같진 않아요. 직원들을 소중히 여긴다는 기분은 좀 적게 듭니다. 사람이 많이 나가는 거 같아요.
297,(주)야놀자,8540,은근히 각각 부서의 단점이 한사람에게 임파워먼트가 강해서 사람들이 알아서 김 의외로 이런부분은 있음
298,(주)야놀자,8540,처음에 적응하기 힘들었습니다 아무래도 소규모였울땨다 보니 적응 하기가 싶지 않았습니다 기존에 있던 사람들은 많이 가족같은 분위기여서 그 분위기 속 가는데 좀 걸렸습니다
299,(주)야놀자,8540,"꼰대, 고인물들의 향연....상사 뒤로도 지나다니면 안됨^^ 저녁과 주말이 있는 삶 따위는 기대하면 안됨"
300,(주)야놀자,8540,"비개발 직군에 대한 한없이 부족한 급여, 기업 규모 대비 아쉬운 인센티브, 윗선의 사리사욕, 초심을 잃은 경영진 등"
301,(주)야놀자,8540,조직이 지나치게 자주 바뀜. 성과주의지만 명확한 기준과 가이드라인이 모호함
302,(주)야놀자,8540,회사가 구성원들에게 관심이 없음. 프로젝트는 엎어지기 부지기수. 리더급들도 방향 못잡고 우왕좌왕하다 시간 다감. 구성원들 방치 수준.
303,(주)야놀자,8540,원격근무가 가능하나 눈치봐야 함. 사람이 너무 자주 나가고 들어와서 인수인계 무한 반복으로 시니어가 없음.
304,(주)야놀자,8540,투자금은 많지만 어떻게 써야할지 고민이 굉장히 많아 보인다. 상당히 많은 기업은 인수합병하여 규모가 급격히 커졌지만 관리에 많은 어려움을 겪고 있어 대거 퇴사가 이어진다.
305,(주)야놀자,8540,직원들을 위한 혜택이나 복지가 전혀 없다. 있기는 한데 체감되지가 않고 미혼인 직원들은 누릴 수 있는게 거의 없다. 인센티브도 없다. 연봉이랑 야놀자 100만원 복지 포인트가 끝이다. 그리고 너무 빠르게 비즈니스 확장 중인데 정리된게 없다.
306,(주)야놀자,8540,심심하면 술을 마십니다. 좋은 일이 있어도 술이 있었고 힘들어도 술을 마셨습니다.
307,(주)야놀자,8540,부서끼리 소통이 잘 되지 않고 사업을 크게 확장하는 중
308,(주)야놀자,8540,퇴사자가 많아 본 업무보다 관련 히스토리 찾는 시간이 더 오래걸림. 모든 업무에 부서별 협조 안되고 떠넘기기 바쁨 리더들 퇴사가 잦아서 전반적으로 오래 근속할 수 있는 분위기 형성이 안됨 보상적인 측면에서도 근속할수록 연봉 후려쳐짐
309,(주)야놀자,8540,일방적 지시 빨리빨리 중독 > 뭐든지 갑자기 일 주고 지금당장 퇴사율 (눈앞에있는 사람들이 순식간에 반은 사라짐) 직원은 인간이 아니라 부품이고 소모품이다라는 인식 팽배 직원들이 다 회사를 싫어해서 협업 잘안됨 까라면 까! 군대도 이런 군대가 없음
310,(주)야놀자,8540,위에 작성한 장점 외 모두 다 단점 꼰대 해골물 천지..
311,(주)야놀자,8540,급여가 너무 적다 최저의 인건비로 최고의 효율을 원한다 외부적으로는 커보이지만 내부적으로는 너무 작다 5인미만 회사보다 못한 곳
312,(주)야놀자,8540,개발문화가 무슨 SI 수준임. 비즈니스에 맞춰가는게 아니라 고인물들 편한 위주로 일정 휘둘러대고 그나마도 퇴사자가 너무 많아 관리가 안되는 지경에 이르렀음.
313,(주)야놀자,8540,파견직에 대한 대우는 전혀 없음. 어찌보면 당연하다고 생각함. 나 스스로 하나의 소모품이라고 생각하면 맘이 편함.
314,(주)야놀자,8540,협의지옥 논의지옥. 사업방향성 맨날 바뀜. 조직 맨날 바뀜. 보고를 위한 보고가 많은 것 같고 각자 앞만보고 자기할일만 함 (협업이 협업같지 않달까..)
315,(주)야놀자,8540,한명에 의해 움직이는 조직으로 조직간 불화가 많음. 무능하고 오래 다닌 사람들이 박힌 돌 처럼 있음. 새로움 보다는 있던 사람들에 맞춰야 해서 오래된 업무 방식이 유지됨
316,(주)야놀자,8540,폭발적 확장으로 좀 정신이 없다. 점점 더 갠플이 심해지고있다.
317,(주)야놀자,8540,조직개편이 일년에 몇번 진행되는지 그거에따라 입맛 맞추고 업무 프로세스 정리하기 바쁨
318,(주)야놀자,8540,루즈함 감떨어진 경영진이 찍어누르는 업무가 많아서 현타옴
319,(주)야놀자,8540,"몇몇의 이기심이 보임 많은 사람들이 퇴사하고 입사함 어디 팀이냐 소속이냐에 따라 일의 강도가 달라짐 솔직히 연봉이 짜고, 인상률도 낮은편"
320,(주)야놀자,8540,"밥먹듯 바뀌는 조직장과 조직구조, 계속 재직하는 직원의 연봉은 오르지 않음"
321,(주)야놀자,8540,자율 없음.. 팀장은 자기말이 법인 사람으로 내가 이렇게 결정했으니 따라라.. 무슨 조선시대인줄.. 외주인원들에게 갑질하는 팀원에 팀장..
322,(주)야놀자,8540,빠른 성장으로 내부적으로 외형의 크기를 따라가지 못하는 느낌이다
323,(주)야놀자,8540,보고를 위한 보고가 너무 많고. 슬랙 지옥.- 너무 많은 채널들과 쓰레드.. 확인 하기 너무 빡세 구글 시트 지옥. 너무 많음 . 뭐가 뭔지 매번 헷갈림
324,(주)야놀자,8540,"스타트업이라고 하기엔 회사 규모가 크지만, 내부 업무와 프로젝트의 실속은 제 기준에서 내실이 있었다라고 생각하기 어려웠습니다. 말만 잘하는 사람들이 많았었고 실 업무를 하는 사람과 미팅, 회의, 보여주기식 회사원과의 경계선이 뚜렷했던 것 같아요. 중견, 대기업 만큼의 안정감은 없지만 알아서 보여주기식 일처리를 잘하는 사람이라면 젋게 다녀볼만한 회사인 것 같습니다."
325,(주)야놀자,8540,시니어층이 다 퇴사하는 중이라 업무 범위도 넓어지고 주체적으로 업무를 진행해야 합니다 ㅠ
326,(주)야놀자,8540,일하는 시간이 좀 많은것 같고 복지나 그런들이 많지는 않은듯.
327,(주)야놀자,8540,팀별로 복지나 우대가 달라서 자괴감이 들때가 있다. 다른 열심히 하는 직원들도 우대해주길. 그리고 큰 회사임에도 불구하고 연봉이 아직 좀 낮은 것 같다
328,(주)야놀자,8540,"일은 하는 사람들만 죽어라 고생하고, 나머지는 정치질 하느라 바쁨"
329,(주)야놀자,8540,퇴근 시간이 규칙적이지 않음. 회식이 잦았음. 현재는 잘 모르겠음
330,(주)야놀자,8540,실적압박 및 직원간의 유대 관계가 좋지 못한거 같습니다. 팀끼리는 으쌰으쌰하는게 좋을꺼 같은데.. 물론 어느정도의 경쟁은 필요하지만 너무 각자의 보험팔이 느낌이 강했습니다.
331,(주)야놀자,8540,"보안에 너무 치우처진 시스템, 경영진들의 마이크로 매니지먼트"
332,(주)야놀자,8540,보고를 위한 문서 작업이 늘어나는 추세 팀마다 업무스타일이나 체계가 다르다보니 업무 진행이 어려울 때가 있음
333,(주)야놀자,8540,스타트업이다 보니 체계가 덜 잡혀있고 부서별로 다르지만 야근 가능성이 있는 부서가 존재람
334,(주)야놀자,8540,누구나 목표가 있고 그 목표점을 향해 나아가고 있다고 생각한다. 그렇지만 이 곳은 성장이 아닌 그저 그렇게 편안하게 쭉 다닐 수 있는 곳이라 생각이 들어 아쉬움이 컸다. 성장 포인트가 없다는 점이 가장 큰 단점이 아닐까. 복지라고 생각하는 부분이 적다. 타 IT기업과 비교를 해봤을 때 확연하게 느껴졌다.
335,(주)야놀자,8540,야근이 많고 그에 대한 보상은 받을 수 없는 구조인 것이 단점
336,(주)야놀자,8540,사업의 진행성? 너무 더디게 진행되는 경향이 있음 막무가내도 좀 필요할 듯
337,(주)야놀자,8540,"비효율적 일방식, 텃세 심함 정치 싸움 사무실 출근자가 없으니 신규입사자 온보딩이 안되는 형태."
338,(주)야놀자,8540,퇴사율이 너무 높다. 같은 사람들이랑 1년 이상 같이 일하기도 쉽지가 않다.
339,(주)야놀자,8540,"기업문화, 일하는 방식을 공유하지 않고 구성원 모두가 실패를 반복하는 과정을 겪음"
340,(주)야놀자,8540,성장한 회사의 규모 치고 주먹구구식의 업무방식 잔존 정형화된 프로세스 부재 연봉인상율 할말하않 심각 수준 사람 귀한줄 모르는 경영진의 마인드
341,(주)야놀자,8540,"인센티브 없음, 우리사주 주기는 하지만 거의 행사할 수 없기 떄문에 없는거나 마찬가지, 근속연수가 짦음"
342,(주)야놀자,8540,"현재는 얼마나 나아졌는지 모르겠지만, 당시 법인이 두개로 나뉘어있어서 아래쪽 지사 중간 관리자들이 정치질에 뒷담에 일진놀이 하고 다님."
343,(주)야놀자,8540,사내 정치로 인해 두드러지는 사람만 두드러지고 놀자고 하는 사람은 놀고 등등
344,(주)야놀자,8540,주먹구구식 업무와 조직별 이기주의가 존재 새로운 리더들이 와서 변화를 시키려 하고 있지만 시간이 걸릴 듯함
345,(주)야놀자,8540,보고 및 회의가 많다. 무의미한..최대한 성과를 가져올수있는 분위기가 되길 바람 사내 정치질은 없는곳이 없겠죠?
346,(주)야놀자,8540,영업이뭔지 뼈져리게 깨닫고갑니다 사람 갈아일하는 대표적인 기업
347,(주)야놀자,8540,"수시로 바뀌는 커뮤니케이션 방식, 외부에서 보는 이미지와 내부에서 일어나는 일들이 너무 차이가 남, 연봉 인상률 극악, 자리싸움과 정치, 파벌로 난무함"
348,(주)야놀자,8540,성과급이 없음. 포괄 임금제 대부분은 인상률 안좋은편 능력 미달 사람들이 종종 있음 윗선에서 갈팡질팡. 잘 모르고 사업을 이끌고 있음
349,(주)야놀자,8540,복지가 거의 없고 업무 관리나 방향성에 대한 공유가 부족해 소속감을 느끼기 어렵습니다. 포괄근무제로 인해 야근에 대한 보상이 없습니다.
350,(주)야놀자,8540,"잦은 인원교체로 정리가 잘 안되어 있는 느낌, 직원에 대한 보상도 더 있으면 좋을듯"
351,(주)야놀자,8540,1. 녹음안하면 말바뀜 2. 어릴때 왕따 가해자들을 같은부서에서 만남 3. 못살아서 괴롭혔다고 회의시간에 말함 4. 그 후 해고시킴 5. 인터넷에 사건 알리고자 글쓰니 고소당함 6. 포괄임금제. 20년 기준 월78시간(휴일.야간포함) 7. 대표이사 친인척들 있음 8. 자살하라는 수준으로 괴롭혔고 멘탈 안좋으면 자살해야할 수준이었음 9. 왕따 가해자들이 전화로 해고시킨 뒤 우울증이 심해져 언제 자살할지 몰라 인터넷에 글남기는 중 10. 성희롱이 있었으나 본인들은 안했다고 함 11. 성희롱 교육 3년간 미이수. 기사화된 사건.
352,(주)야놀자,8540,나름 수평적이라고 느끼며 일했으나 몇 리더로 인해 점점 수직구조화 되어가는중
353,(주)야놀자,8540,"급여 .. ㅋ, 근무자들을 아낀다는 느낌 보단 언제든지 쓰고 버릴 수 있을 것 같음;;"
354,(주)야놀자,8540,주먹구구식으로 일하고 체계가 없음 내부에서 관리자가 된 사람이 많아서 체계가 안생김
355,(주)야놀자,8540,"커바케지만 야근 많고, 일 잘하는 사람에게 더 많은 일을 줌, 정상적인 업무 환경보다 어쩔수 없다는식의 희생을 요구함"
356,(주)야놀자,8540,일이 많은편인 것 같습니다. 사내 조직문화가 좋지 않은 편입니다.
357,(주)야놀자,8540,일이 너무 많음... 야근의 생활화.. 포괄임금제 폐지됐으면
358,(주)야놀자,8540,다소 딱딱한 조직문화 서로 자유롭게 의견을 개진하고 피드백하는 문화는 아닌거 같음
359,(주)야놀자,8540,불필요한 절차들이 너무 많고 여기저기 왔다갔다하는 것도 많았음.
360,(주)야놀자,8540,일이 너무 많아여. 그리고 사람들을 보지않아서 재택근무만해서 삭막해여
361,(주)야놀자,8540,근무외 시간도 많고 회식도 많고 오래된 회사가 아니라 기업문화가 좋게 형성되어 있지 않습니다
362,(주)야놀자,8540,잦은 퇴사자들과 무능한 리더들이 제일 문제로 보인다 나서면 내일이되다보니 가만히있어야할것같은 그런 분위기.. 으쌰으쌰는 없어진지오래
363,(주)야놀자,8540,기업문화 최악. 실행력 제로. 리더십들 성과 쉐어. 핵심인재 이탈 가속화 중.. 지금 조인하면 개인의 성장도 없고 고생만 예상됨
364,(주)야놀자,8540,수직적이고 군대문화가 아직도 있어서 아쉬웠습니다 또한 겉으로 보여지는 이미지와는 달랐어요
365,(주)야놀자,8540,계약직을 많이 뽑고 계약기간이 길며 정규직전환이 힘들다는점. 그래서 시간을 낭비할수도 있다. 퇴근 눈치가 보여서 상급자가 퇴근해야 퇴근할수있는 군대식 문화.
366,(주)야놀자,8540,"팀바팀이지만 동아리처럼 운영되는 환경, 업무 내용 파악이 안된채로 책임미루며 업무 처리"
367,(주)야놀자,8540,매출드라이브가 매우 심하다 1인당 할당 업무량이 감당하지 못할정도 퇴사율이 괜히 높은게 아님
368,(주)야놀자,8540,"부서마다 다르겠지만, 회사의 방향성이 영업직군들에 포커스를 맞추지 않아 힘든 부분 집단 퇴사자 속출, 고위 직군들만 외부에서 데려오는 둥 보여주기식이 강함"
369,(주)야놀자,8540,공유룰 위한 많은 작업들이 이루어지지만 정작 공유는 잘 이루어 지지 않은 단점이 았고 계약직으로 입사했다면 하나의 부품일 뿐이라는 느낌이 많이 들어요
370,(주)야놀자,8540,회사 내에서 성희롱 사건 터진걸 나도알고 너도알고 거래처도 안다. 징계받은거 모두가 안다. 하지만 뻔뻔하게 모두 잘 다닌다. 낯짝이 두꺼운데 그걸 지켜보는 동료들이 대신해서 쪽팔리다. 회사명 답게 행동하는 직원들이 매우 많다. 사내 로맨스가 상당한데 안걸릴거라 생각하지마라. 비도덕적 행위 눈감아주는데도 한계가 있다
371,(주)야놀자,8540,"비효율적인데 겁나 효율적인척, 팀이라는 느낌없이 일하게될수도....슬랙이랑 메일이 끊임없이....개선요청 사항 올리기 어려움.."
372,(주)야놀자,8540,외부인사들 그리고 다양하게 들어오는 경력직들 속에서 기존 직원들은 퇴사를하고 인수인계 과정이 평탄하지 않음
373,(주)야놀자,8540,멀리 출장을 갈때가 있습니다 1박을 하는 것도 때로는 좋지만 자택이 아닌 곳에서 자려고 하니 좋았습니다
374,(주)야놀자,8540,모든 것은 탑다운으로 일하게 되어 있음 경영진이 바뀌지 않는 이상 조직문화도 바뀌지 않을 예정이라....
375,(주)야놀자,8540,리더들의 비즈니스 이해도 부족으로 퇴사 결심 일부 동료들은 현실에 안주
376,(주)야놀자,8540,조직구조와 인사평가에 대한 체계와 기준이 없음 열심히 하는 사람에게 일이 몰리는 구조
377,(주)야놀자,8540,조직문화가 진짜진짜 안좋아요. 와서 경험해봐야 알아요ㅋㅋ
378,(주)야놀자,8540,체계를 더 잡아 나가야 한다. 부서 구조에 따른 비효율이 존재한다.
379,(주)야놀자,8540,조직구조가 아직 체계적이지 못한것 같습니다. 개별적으로 보면 모두 훌륭하신 분들이나 조화가 되지 못한것 같아요
380,(주)야놀자,8540,생각보다 문서 쓰는게 중복적이고 많고 큰기업이 이렇게 사람 일일이 갈아쓰는지 조금 의외였음..그리고 연봉이 좀 낮아요
381,(주)야놀자,8540,업무량 및 업무 강도 매우 빡셈 이 정도 업무 강도면 연봉 훨씬 많이 올려줘야 함. 다만 수많은 직원 유입으로 인해 기존 직원들은 찬밥신세
382,(주)야놀자,8540,외부에서 보면 매우 자유로워 보이나 은근한 꼰대 문화가 깔려있음. 추진력은 좋으나 너무 성급히 진행하다 보니 디자인 하다가 엎어지는 프로젝트가 많음. 그래서 헛시간을 많이 보냄.
383,(주)야놀자,8540,"삐르게 성장해야해서 너무 빠르게 돌린다. 기업이 안정화되어있지않아서 혼자 알아서 해야한다. 그렇지만 빨리 업무에 투입되어야하니까 빨리 적응해야함. 모든 것이 공유되어야하며 쓸데없는 컨플작성이 많다. 누군가 실수하면 바로 공격당함.. 실수하면 같이 봐주거나 책임져줄 사람 1도없음 절대 실수하면 안된다. 물론 실수하면 안되지만 뭔가 여긴 얄짤없다. (공개적으로 저격이라던지, 나한테 왜 묻냐라는 등등) 재택도 사업부 나름이다. 실장이 재택 안좋아하면 눈치보임. 선택적출근제×. 위에서 정한대로. ex) 10-19시/9-18시 어차피 야근해서 출근시간은 상관없긴함ㅠ"
384,(주)야놀자,8540,리더느낌이 아니고 따라쟁이입니다 따라하니까 어설프고 애매합니다 전문가가 필요합니다
385,(주)야놀자,8540,텃새 심함. oo님 호칭으로 평등한 지위인거처럼 보이지만 강압적이고 수직적인 문화가 있음. 부르기만 존칭으로 부르지...
386,(주)야놀자,8540,짧은 재직기간 문서로 업무를 파악해야 하는 경우가 많아요.
387,(주)야놀자,8540,여러 사업을 추진하기위한 무리한 기업비젼을 가지고 있는 부분이 안타깝다.
388,(주)야놀자,8540,"윗대가리가 연차승인 안해주면 못씀 연차쓰는데 꼬치꼬치 물으며 연차 못쓰게함 연봉이 작음 군대문화가 엄청쌤 야근잦음, 퇴근보고 일일히해야 하며 블박 인아웃도 확인함"
389,(주)야놀자,8540,야근이 많음. 쓸데없는 군대식 문화가 존재해서 mz세대들 난감할 수 있음.
390,(주)야놀자,8540,몸집 불리기에만 급급해서 채용에 대한 계획도 딱히 없는것 같고 그냥 벌려놓은 일만 많음.
391,(주)야놀자,8540,"업무 범위가 좁고, 빠르게 진행되는 프로젝트가 많아 퀄리티 유지가 어려움"
392,(주)야놀자,8540,회사는 잘 되고 있지만 직원으로서 얻는 건 없음 퇴사자 많아서 업무에 어려움 있음
393,(주)야놀자,8540,너무 자유로움 체계가 없음 모든 일이 주먹구구식으로 진행됨
394,(주)야놀자,8540,연봉이 안오른다... 이직하는게 빨라요 정말..연봉 올려줄 의지도 없으니 이부분은 기대 안하고 오시는게 ㅠ
395,(주)야놀자,8540,"불필요한 회의가 많음, 시스템 불편, 리더 역량 부재, 보상 관련 불만 등"
396,(주)야놀자,8540,들어오는 사람도 많지만 그만큼 나가는 사람도 많~~다 2년차면 꽤 경력자로 취급받는듯. 그래서 히스토리를 아는 사람이 없는 경우도 있고.. 겉보기엔 화려하지만 글쎄.. 언제 행사할 수 있을지 모르는 스톡옵션으로 해줄거 다 해줬다는 마인드? 복지 요것저것 많지만 실속있게 크게 챙겨주는건 없는듯 ㅠ
397,(주)야놀자,8540,문서화 잘 되어있는게 장점이자 단점 실제로 일을 하는 시간보다 문서 정리하는 시간이 많다
398,(주)야놀자,8540,좋은복지를 다 뛰어넘는 최악의 기업문화가 있습니다. 뭐하나라도 꼬투리잡으려고 날이 세워져있습니다. 자기들이 다 최고인줄 압니다.
