,company_name,company_id,review_text
241,(주)조이시티,579,"복지 별루, 연봉도 적고. 점심 먹으러 맨날 나가서 헤메는 것도 은근 스트레스"
242,(주)조이시티,579,"각 직군 및 직무간에 인정받는 수준이 차이가 있으며, 인사평가에 대한 반영 기준이 애매한점. 그리고 연봉수준이 높지 않은편 같다 직급을 없애고 매니저로 직함을 통일했으나, 효과는 별로 좋지 않은 편 같다."
243,(주)조이시티,579,수익이 크게 나는 신규 빅타이틀이 없어 점점 경영진의 개발팀에 대한 입김이 살짝씩 강해지고 있다는 느낌. 그리고 본래 2차면접 때 사장님이 들어오신 적이 없었는데 최근에 제도가 바뀌어 사장님이 참여하게 되었다고. (보다 좋은 직원을 뽑으려는 의도는 알겠으나 바쁜 사장님의 스케줄에 맞추어야 해서 회사규모에 비해 빠른 입사가 가능하다는 큰 장점이 좀 떨어지게 되는 것 같아 아쉽기도 함. 물론 그렇다해도 다른 큰 회사들보다 합격통보 및 입사절차가 상당히 빠른 편이긴 함)
244,(주)조이시티,579,"인력과 인프라에 대한 투자가 너무나 부족하다. 제품 경쟁력이 없어지고 그래서 만년 삼류이고, 그러다 보니 돈을 못 벌고, 그래서 제품에 투자를 못 하는 악순환"
245,(주)조이시티,579,프로젝트가 대부분 모바일로 바뀌면서 디자이너의 성향이 중요해졌습니다. 각각의 파트가 있다하더라두 제네럴리스트로서의 역량을 회사에서는 원하고 있습니다.
246,(주)조이시티,579,"잦은조직개편, 낮은연봉테이블. 비교적떨어지는복지."
247,(주)조이시티,579,동일업계 낮은 연봉수준 잦은 조직개편 본인이 스스로 노력하지 않으면 도태되기 쉽다.
248,(주)조이시티,579,모바일이 아니면 대부분 온라인 유지보수를 한다. 실력향상따위가 없다. 따로 공부해야 도태되지 않을듯. 모바일 프로젝트 성과가 안좋아서 팀뽀개기가 성행. 온라인 유지보수팀인데도 상황에 따라 야근 크리가 터진다. 경영진이 야근하는 것을 좋아한다. 쌍팔년도 마인드.
249,(주)조이시티,579,갑작스런 인사이동과 자리이동 업무에 집중할 수가 없음.
250,(주)조이시티,579,"인센티브 제도는 있으나 혜택받는 사람이 거의 없음 갑작스러운 인사이동, 의미없는 자리 재배치등..."
251,(주)조이시티,579,약간 루즈한 느낌? 안주하는느낌이 있어서 치열하고 열정적인 느낌은 좀 적다.
252,(주)조이시티,579,"낮은 연봉수준. 회사가 내부 개발력을 강화하기보단 외부에 돈을 더 투자하는 느낌이다. 도전적이지 않고, 윗선의 관여가 심하다. 개발보단 사업적 마인드가 강함."
253,(주)조이시티,579,"업계최저 수준의 연봉, 잦은 야근. 제대로 된 신작이 나오지 않아 커리어에 도움이 안됨."
254,(주)조이시티,579,"서현으로 이사하면서 복지도줄고, 올해 연봉인상폭도 그리높지않았던 것 같음. 사람마다 차이는 있겠지만 연봉이 업계에서도 평균이하라는 통계가 틀리지는않은 듯."
255,(주)조이시티,579,"개발 중심에서 경영중심의 회사로 바뀌어버려, 게임 개발 이외에 눈치 볼 것들이 많음. 또한 오래된 능력 있는 개발자들은 대다수 나감."
256,(주)조이시티,579,"경영진이 교체되고 나서 경영진의 프로젝트 개입이 심한 편. 잦은 조직 개편이 직원들에게 스트레스를 준다. 회사의 규모가 아주 대기업도 아니고 소규모도 아니다 보니 프로젝트 성패에 상당히 민감해 하며, 점점 적극적인 도전과는 거리가 멀어지고 있다. 또한 연봉 수준이 좋지 않다."
257,(주)조이시티,579,"여러번 인수와 경영진 교체, 조직개편을 거치면서 혼란기. 1년새 1/3이상이 이직. 그럼에도 총 인원이 늘어남. 매일 보이는 얼굴이 달라짐."
258,(주)조이시티,579,오래전 다녔던 회사라 지금의 단점은 어떠한지 모르겠음 당시에는 회사규모에 걸맞지 않은 여러 시스템의 부재가 단점임
259,(주)조이시티,579,자유분방함과 보수적인 관료제의 모습이 뒤섞여있다.
260,(주)조이시티,579,어느 순간부터 정체되어 있는 자신을 발견하게됨. 스스로 채찍질 하지 않으면 공무원 마인드가 되기 쉽상.
261,(주)조이시티,579,"잘하는 사람들이 모두 떠남, 남아있는 사람들은 말 그대로 고인물. 이미 회사에 오랜기간동안 뿌리를 내린자들이"
262,(주)조이시티,579,급여가 업계 최하위권.
263,(주)조이시티,579,분당에있다
264,(주)조이시티,579,낮은연븅과 성과긎의 부재
265,(주)조이시티,579,업무의 일정이 빠듯하다
