,company_name,company_id,review_text
0,(주)서광양행,8271,직원 복지가 아쉬움 연령대가 높아서 젊은 직원이 근무하기에 쉽지않음. 옛날방식의 업무 프로세스
1,(주)서광양행,8271,가족기업의형태이다보니 부조리가심함 퇴근시간도 지켜주지않을정도로 워라벨제로
2,(주)서광양행,8271,"무능한 이사가 영업, 생산 등 전 분야에 간섭하나 생산적인 방향이 아님 창업주 2세 역시 근무하나 유능함에도 정치적 사유로 벗어나있음 상기 이유로 유능한 인력이 장기 근속이 힘들 것 같음"
3,(주)서광양행,8271,"퇴근시간을 지켜주지 않으며, 꼰대문화가 정착되어 있다."
4,(주)서광양행,8271,"일단 회사 일을 하면서 디자인 관련 일을 배울 기회조차 없으며, 막상 들어가면 다른 일을 하게 되는 경우가 많다 그리고 비정규직과 정규직을 차별을 한다 명절선물이라고 정규직은 갈비를 비정규직은 김을 준 경우가 있었다"
5,(주)서광양행,8271,퇴근시간 절대 안지켜짐. 가족경영 회사. 기업 규모가 작음. 내근직은 네명 미만. 나머지는 다 공장조립노동자. 체계 없음. 가스라이팅 너무 심함. 사업 아이템의 확장 가능성 없음.
