,company_name,company_id,review_text
0,(주)동구바이오제약,5051,직원은 부속품이고 언제든 대체 가능한 존재로 생각하는 회사
1,(주)동구바이오제약,5051,내실이 전혀 없다 그래서 언제 무너져도 이상하지 않은 조직이다
2,(주)동구바이오제약,5051,매출에 비해 급여나 복지는 좀 아쉬움. 기업의 인지도가 규모에 비해 좀 부족한 편
3,(주)동구바이오제약,5051,임원진들이 고인물임. 매출 성장에만 관심있고 직원들에 대한 배려 부족
4,(주)동구바이오제약,5051,날이 갈수록 높아지는 GMP 문턱에 비해 턱없이 부족한 인력 겨우겨우 턱걸이로 따라잡고 있으나 직원들 덕분이라고 생각하지는 않는다. 야근을 많이 하면 야근 많이한다고 본사에서 뭐라고 하고 야근 안하면 일 없냐고 한가하냐고 공장장이 뭐라고 한다.(어쩌라는건지 모르겠다) 회사 자체에 메뉴얼이 없다. 회의하고 나면 항상 구두 전달. 회의록 같은건 없어서 나중에는 구전동화처럼 이야기가 살이 붙어서 팀마다 일하는 모습이 다 달라진다. 아무래도 GMP가 타격이 크다보니 못하면 니탓 잘되면 내탓이 된다.
5,(주)동구바이오제약,5051,다니면서 단점이라고 느낀건 딱히 없음. 명절에 선물세트도 지급안함.
6,(주)동구바이오제약,5051,1. 중소기업보다 못한 창피한 연봉 2. 내보내야할 사람을 못 내보내니 붙잡아야 할 인재들이 나감 3. 툭하면 말이 바뀌는 윗사람들 4. 바꿔야할 임원들은 안 바꾸고 밑에 사람들이 문제인줄 앎 5. 생산 관련 총체적 난국
7,(주)동구바이오제약,5051,제약업계에서 낮은 편에 속하는 연봉 많은 업무량 잦은 야근이라고 생각합니다 안 돼도 되게하라는 마인드를 가지신 분이 계십니다.
8,(주)동구바이오제약,5051,제가 다니던 시절에는 영업부서가 막 새롭게 개편되어서 정확한 룰이나 규칙이 없었습니다.
9,(주)동구바이오제약,5051,기본적으로 승진하는데 오래걸림 그리고 차량 강제 렌트해야함
10,(주)동구바이오제약,5051,잦은 야근과 야간 특근 하지않을시 많은눈치받습니다. 강제로해야하는 분위기입니다
11,(주)동구바이오제약,5051,업계 연봉 짬 특정된 임원 몇몇이 입맛대로 굴리면서 경영
12,(주)동구바이오제약,5051,일반 직원 복지가 없음(임원만을 위한 복지) 점심 식대 1끼에 7000원... 보고를 위한 보고 업무진행 너무 느림 성과금 지급도 매우 쪼잔한수준...
13,(주)동구바이오제약,5051,설비를 늘리는만큼 인력 충원이 안 되는 느낌입니다 일을 해도해도 바쁩니다
14,(주)동구바이오제약,5051,1. 눈치주는사람들이너무많음 2. 직급자들도 실험밖에 못해서 아는게 별로없음
15,(주)동구바이오제약,5051,회사 모든게 좀 구식적 상식적으로 이해안되는 부분이 많음
16,(주)동구바이오제약,5051,영업환경이 점점 어려워지고 있음. 우리회사만의 경쟁력있는 제품을 보유하지 않음
17,(주)동구바이오제약,5051,크게 투자하려기보다는 어떻게든 덧대서 땜질하려는 느낌이 있다
18,(주)동구바이오제약,5051,연차 쓸때 좀 쓰라고 하면서 눈치줌.. 약간 텃세있음.. 자기들끼리 몰려다니기 심함
19,(주)동구바이오제약,5051,단점- 복지가 없다 뭐가 복지인지 모르겠음 건의사항에 요구하면 그냥 소문나서 얼굴 못들고 다닐정도임 주차장 없다고 보면됨
20,(주)동구바이오제약,5051,단순보고를 위한 문서작업이 쓸데없이많음 직원들간에 알력이있음
21,(주)동구바이오제약,5051,타 기업보다 연봉이 적어 이직하는 사람이 많고 나이든 사람들이 많다보니 업무처리 속도가 느리며 뭘 바꿀려고 하지 않음
22,(주)동구바이오제약,5051,"제약회사중에 연봉이 너무 낮음, 군대문화가 있는데 점점 없어지는중, 필드에서 인지도가 낮음, 명절떡값 이런거 1년에 복지몰 20만원 끝"
23,(주)동구바이오제약,5051,일의 양에 비해 인원 수가 너무 적고 보충해달라고 요청해도 이미 티오를 너무 적게 설정해둬서 생산량이 높아질수록 직원은 점점 더 힘들 수밖에 없는 구조입니다.
24,(주)동구바이오제약,5051,연봉이 낮은편이며 복지도 딱히 없습니다. 회사가 성장하는 과정이라 성장통이 있다.
25,(주)동구바이오제약,5051,밑에 직원들에게 일이 몰려있고. 퇴사자들이 많아 기존 재직자들에게 일이 몰린다. 분야에 맞지않게 잡부(?) 처럼 일을한다. 생산팀 보루같이 잡다한걸 공무팀에서 구매를 하여 전달하는데 이해가 되질 않는다.
26,(주)동구바이오제약,5051,부바부이긴 하지만 팀장급 이상 사람 잘못만나면 고생할 수 있음. 매출 대비 동종 업계 타 회사에 비해 연봉 적음. 직원들의 불만 반영 잘 안됨.
27,(주)동구바이오제약,5051,"부서간 알력 다툼이 많고 윗선에서 조율되지 않아서 업무에 혼선이 생기는 경우가 많으며, 서로 책임 떠넘기기에 바빠 부서장 파워가 없는 부서는 업무에 갈려나가는 케이스가 태반 / 실질적인 교육시스템이 갖춰져야 한다고 본다."
28,(주)동구바이오제약,5051,"복지가 없음 규모에비에적은연봉 신입이 2,3년차보다 연봉이 많기도함"
29,(주)동구바이오제약,5051,"박봉, 심한 텃세, 젊은 꼰대 많음, 야근시 통근버스 없음"
30,(주)동구바이오제약,5051,가족경영의 페해가 문제입니다. 어떻게 세무조사도 다 피해가고 신기해요..
31,(주)동구바이오제약,5051,"복지가 제대로 되어있는게 없음, 제약회사치고 연봉이 박봉임"
32,(주)동구바이오제약,5051,회사 키우기에 바쁘며 기존 직원들의 불만이고 직원 대우가 좋지는 않음
33,(주)동구바이오제약,5051,업무처리에 대한 피드백이 늦으며 .처리에 대한 절차상이 복잡하다
34,(주)동구바이오제약,5051,급여가 다른제약보단 적음 업무강도가 있음 있다고하는 복지는 형편없음
35,(주)동구바이오제약,5051,기획력이 부재하여 실행력이 없다. 오너는 이것 저것 하겠다하는데 그 밑에 대표이사는 그걸 실행할 능력이 없다.
36,(주)동구바이오제약,5051,"다른 중견 제약사에 비해 연봉이 적다. 한 인원이 1.5인분 이상 하길 바래서 매우 바쁘고, 야근이 빈번하다. 팀, 직무 로테이션, 여러 시스템 도입, 리모델링 등으로 인해 체계가 잡히지 않고 어수선하다. 워라밸이 거의 없다. 명절에 복지 포인트로 5만원이 끝이다."
37,(주)동구바이오제약,5051,높은 매출액 목표로 일이 많아 사람들이 힘들어하는 것 같음 가끔 타 부서 인원 부족으로 지원 가는 일이 종종 있으나 사람들이 착해서 할만함
38,(주)동구바이오제약,5051,"하는 사람만 죽어라 하는 것 같고, 여유있는 사람은 여유가 넘침 성과에 대한 보상이 없었음"
39,(주)동구바이오제약,5051,"확실한 강점을 가진 제품군이 없고, 윗선이 굉장히 무능력함 특히 영업을 총괄하는 직책에 있는 사람은 뭐하는 사람인지 모르겠음 회사 망치는 주범 중 하나  매니저급 직원들도 실무능력이 매우 떨어지고 현장 이해도가 낮음 인센티브 구조가 팀원들이 잘한거를 팀장급들이 날로 먹는 날먹 구조라 개선이 필요"
40,(주)동구바이오제약,5051,중견 기업이지만 회사 마인드가 중소임 체계도 존재하지 않음
41,(주)동구바이오제약,5051,"식당 출입구가 외부에 있어서 춥고, 덥고, 비맞아요. 화장실도 밖에 있어서 갈 때마다 춥고, 덥고, 비맞아요. 흡연장도 따로 없어서 정문 밖으로 나가서 길거리에서 피워야되요. 주차장이 있긴한데 너무 좁디 좁아서 주차가 힘들어요. 회사가 성장하는거 같긴한데 그렇다고 나한테 돌아오는건 없어요. 신입사원 교육 프로그램이 없는거 같아요. 이직해도 연봉 후려칩니다. 생각보다 텃새 꽤 있습니다. 공장 증축하는 기간동안 쉬어야 되서 돈 안 나온다고 쿠팡가서 알바뛰어야 된다는 소리듣고 무슨 이런 회사가 있나 했는데 그 분들 알바 잘 뛰고 계실지 모르겠네요. 또 뭐 있을까. 수 없이 많아서 다 적으면 날 샐거같은데"
42,(주)동구바이오제약,5051,"1.공장 증축한다고 자리도 없어서 남의 자리 빌려서 일하고, 텃새는 더럽게 많고 사무실도 임시 사무실이라고 해놨는데 창고에 컴퓨터 갖다둔거나 다름없어요. 2.요즘 시대에 아직도 화장실이 밖에 있다니 새삼 놀랍습니다. 비오면 우산쓰고 화장실가요. 3.회사에 무슨 주차공간이 없냐. 8시 출근인데 주차공간 때문에 7시10분에 오는건 많이 문제 있어 요. 4.가라가 만무합니다. 크린룸인데 방진복 안 입고 들어가는건 기본이고 실사나오면 어쩌시려구요 5.다음부터는 신입이 들어오거든 연차 조정해서 신입끼리만 덩그러니 남지않게 해주세요. 6.한시적으로 교대근무 합니다. 1주 단위 주간 야간 변경되는 로테이션이 아니라 주구장창 야간이 에요. 중소기업의 한계같아요. 왜 중소로 밖에 못 남는건지 깨닫고 갑니다."
43,(주)동구바이오제약,5051,힘들고 일많고 텃새있고 고인물많고 돈주기 아까워 하는 회사
44,(주)동구바이오제약,5051,월급이 적다. 연장이 반강제적이다. 주차장이 좁다. 줄이 뚜렷해서 기싸움이 심하다
45,(주)동구바이오제약,5051,팀장을 잘 만나야할듯 위에다가는 MZ처럼 밑에는 꼰대처럼 이런 팀장만나면 개피곤 함
46,(주)동구바이오제약,5051,성과제를 중요시 하기 때문에 기타 근본적으로 성과를 낼 수 없는 부서한테는 메뉴얼에 맞는 처우만 해주는 경우가 종종 있습니다.
47,(주)동구바이오제약,5051,신입사원이 적응 하기 힘들 수 있음 부바부 이나 말을 험하게 하는 사람들이 있어서 배우는 입장에서는 많이 까다로움 그 외로는 딱히 다니면서힘든점은 없었음
48,(주)동구바이오제약,5051,형식적인 절차와 보고가 많이 잡스러운 업무에 시간을 많이 뺏김. 회사에 월급루팡들이 꽤 많은데 관리가 안됨
49,(주)동구바이오제약,5051,신입연봉이 매우 낮아 직원들 뽑기가 매우 어렵고 이직이 많음
50,(주)동구바이오제약,5051,"연봉이 낮은편, 신입과 경력자의 연봉차이도 거의 없음. 매출액 상승을 위한 인력충원이 자주 이루어져 분위기가 어수선한 편."
51,(주)동구바이오제약,5051,"- 화장품 사업을 코스닥 상장에 이용해먹고 상장 후엔 마케팅 투자 제로로 인해 사실상 정리 수순. - 술 강요하고 야근 및 휴일 근무 좋아하던 화장품 사업부 사장 때문에 아래 직원들 고생 너무 많았음.(다행히 다른 계열사 대표로 이동) - 신규사업이라고 밀던 화장품과 지방줄기세포 추출기 사업 정체 중 - 기업만의 독보적인 기술은 없으며, OEM과 CSO 영업이 주임 - 제약 및 바이오 업계 최저 복지와 연봉 수준"
52,(주)동구바이오제약,5051,부서별로 생산강도차이가 심함 이쪽은 편하고 저쪽은 힘든데 연봉은같음
53,(주)동구바이오제약,5051,"연봉, 복지 업계 최하 수준. 최근 워라밸이 사라졌으며 구시대적 시스템으로 버티기 위하여 직원을 굴림. 항상 인력이 부족하고 부서간 커뮤니케이션이 잘 안됨."
54,(주)동구바이오제약,5051,복지라고 할만한게 없게 없습니다. 명절 창립기념일 본인생일에 복지포인트 5만원씩 지급해주는게 다인것같아요.
55,(주)동구바이오제약,5051,공무원 처럼 정년이 있는 것처럼 절대 잘릴 수 없음. 본인이 직접 사직서 내지 않는 이상 주구장창 다닐 수 있음 한명 땜에 사람 나가는 회사 이젠칼퇴도 못함~
56,(주)동구바이오제약,5051,라인이라 중간에 화장실 잘 못감 아무래도 눈치를 좀 보게 되는 것이 있어서 불편했습니다
57,(주)동구바이오제약,5051,경영진 하나가 들어와서 물흐리기 시작하여 회사 부서 하나 날아갔다고 들음
58,(주)동구바이오제약,5051,"1. 신규입사자일수록 기존 직원들과 차이가 없음. 2. 기존직원알기를 옆집개만도 못한취급을 함. 3. 꼴랑 월급의 50%인센티브 주면서 온갖 생각은 오지게냄. 4. 3번의 인센티브도 몇년의 한번임. 5. 이건 뭐 제약회사인지 투자회사인지, 매출액이 잘나오면 그게 오로지 윗대가리들 지들이 잘나서 매출이좋은줄 알고있음. 등등 너무 많은데 아 일단 다녀보면 느낄거임"
59,(주)동구바이오제약,5051,팀장급들이 텃세 심하고 일을 안하고 뒷담화타임 너무 길어 맞장구 쳐주기 지침
60,(주)동구바이오제약,5051,"회사 사정상 팀장도 실무를 한다지만 간혹 팀원과 구분되지 않게 똑같이 일하려는 모습이 매우 실망스럽다. 회사 분위기를 흐리는 것에 대하여 제제를 가하여 주길 원하지만 껄끄러운 것을 지적하기 싫은지 매우 무기력한 것 같고, 변화를 원하는 직원들도 조용히 근무하다 지쳐서 퇴사하는 듯 하다."
61,(주)동구바이오제약,5051,이상보다 현실적인 목표를 세우고 그에 맞게 전사적으로 노력해야.. 신규사업 투자도 신중하게 했으면..근무환경은 좋아졌으나 잦은 교육 조기출근 등 업무와 직접적으로 상관없는 일이 많다.
62,(주)동구바이오제약,5051,해야하는 일은 많은것애 비해 팀 인원이 적어서 힘들때가 있다
63,(주)동구바이오제약,5051,"향남공장은 출, 퇴근 버스가 있으나 자차 아니면 출퇴근이 힘들며 주차장이 좁아 주변 도로에 주차해야한다. 연봉은 주변 회사 중간 수준이다. 아무 생각없이 일만 할수있어 시간이 어떻게 가는지 모르겠다."
64,(주)동구바이오제약,5051,주위 회사에비해 낮은연봉(퇴사후통상임금되서높아졌다는소식있음)말고는 딱히
65,(주)동구바이오제약,5051,직영조직외 도매 외주를 통한 영업으로 매출구조 다소 취약
66,(주)동구바이오제약,5051,복지가 없다 성과금도 지급이 안되고 인사팀에서 복지에대해 신경을 써줬으면 한다
67,(주)동구바이오제약,5051,"전통적인 제약사이며, 고인물들이 자리잡고 변화를 주기를 싫어함. 사내 정치가 있음"
68,(주)동구바이오제약,5051,연봉이 짜고 복지도 별로고 연봉협상따위 없음.그냥 통보임 노조가 있는데 하는거 없이 회사말 고분고분 듣기만함.그래서 복지가 나아질 기미가 안보임. 직원들이 퇴사를 하고 남아있는 사람들이 고생하는거 뻔히 보이는데 사람안뽑고 일 급하다고 재촉만함.
69,(주)동구바이오제약,5051,복집한 영업구조 모든 일은 영업팀 위주로 다른 부서는 백업
70,(주)동구바이오제약,5051,사람 바뀌기 전에는 나름 보람있고 재미 있었는데 사람 우루루 바뀌고 완젼 볼거 없는 회사 임원들은 오로지 대표이사 눈치 아부 좋은 직원들 다 나가고 퇴사율 엄청 높은 회사 갈곳 없는 직원들만 남아 있음
71,(주)동구바이오제약,5051,"복지제도가 부가적으로 느껴지지 않습니다. 급여가 업계 대비 낮은편입니다. 회사에 대한 투자는 많지만, 직원에 대한 투자는 실질적으로 없습니다."
72,(주)동구바이오제약,5051,"사업에 투자를 안하는 회사 방향성이 없은 회사 인센, 상여 없는 회사"
73,(주)동구바이오제약,5051,꼰마력이 옅어지다가 작년 하반기부터 점점 상승곡선타는중
74,(주)동구바이오제약,5051,학자금 인센등 금전과 관련된 복지 모두 축소 or 삭제 극도로 직원에게 주는 돈을 아까워하며 성과연동형보상이라는 감언이설로 한해한해 직원을 쥐어짬 성과는 내고 보상은 x상황 수년째 반복
75,(주)동구바이오제약,5051,"연봉자체가 매출이나 이익에 비해 적다, 부서마다 고인물들이 물을 좀 흐리는것 같다."
76,(주)동구바이오제약,5051,들어고 싶은 회사 나가기 싫은 회사 라는 문구에 안맞음. 매출이 올라가면 성과금이라도 있어야하는데 터무니없는 매출목표를 잡고 달성 못했다고 성과금 없음. 이번 코로나사태로 백신 맞으면 백신휴가를 주는 회사가 대부분인데 백신휴가 전혀없음. 돈에 미친회사
77,(주)동구바이오제약,5051,"연봉 낮음, 생산직 여자들 진급 안되고 보수적임, 사내정치나 라인있음, 사람은 좋으나 꼰대들 많음, 팀별로 팀장 인성에 따라 분위기 많이 다름, 생산직 아줌마들 텃새 있음"
78,(주)동구바이오제약,5051,직원들의 얘기는 들어주려고 하지만 정작 실행되는것은 없었던 것 같음
79,(주)동구바이오제약,5051,"연봉 이외에 성과나 상여 같은 부분이 전혀 없고, 복지 부분도 부족합니다 (복지 포인트 있으나 적습니다)"
80,(주)동구바이오제약,5051,본사는 아니고.. 공장에서 높은 사람에게 시달리다 견디지 못해 나가기는 했지만 그거말고는 괜찮았나..
81,(주)동구바이오제약,5051,연봉과 복지가 비슷한 규모의 제약회사보다 좋은편은 아니다.
82,(주)동구바이오제약,5051,"높지 않은 연봉, 복지등을 위에 적은 장점으로 상쇄 가능했으나 최근 이에 역행하려는 상부 움직임 있음. 중간직급 중 이런 분위기 캐치한 사람들 대거 이직. 사업구조 상 최근 강화되고 있는 제약업 관련 규제에 제일 먼저 타격받을 듯"
83,(주)동구바이오제약,5051,실무자들 의견 듣지 않음 복지 아예없는 급 상여를 지꼴리는대로 기준설정해서 주는데 그나마주는액수도 적음 급여 업계 하위권 내연봉이 오르는만큼 신입연봉도 동일하게 오르는회사
84,(주)동구바이오제약,5051,"대량 생산 품목이 없고, 소량으로 많은 종류의 제품을 생산하기 때문에 힘들어 보이기도 함"
85,(주)동구바이오제약,5051,"우루루 몰려 들어와 회사 망치고 있슴 그러나 오너는 전혀 모르고 있는 답답한 현실 현실에 맞지도 않는 이상한거 만들어 놓고 직원들 복지라고 하는 이상한 회사, 중간 관리자 다 퇴사시켜놓고 누가 일할까요?"
86,(주)동구바이오제약,5051,"기사 한번만 검색해봐도 100대 상장제약사중에 연봉이 100위인데 연봉이 낮으면 워라밸이라도 명확히 유지가 되어야 한다. 그러나 이제 그것마저 없어지려한다. 그럼 도대체 이 회사를 누가 왜 다닐까..젊은 직원들 다 나가거나 능력있는 직원들은 나가겠지..연봉을 다른회사만큼 맞춰주던지, 워라밸을 확실하게 보장하던지 하나만이라도 제대로 해야될 것 같다."
87,(주)동구바이오제약,5051,"업무강도에 비해 형편없는 연봉 , 야근 상당히 잦음 , 매출액은 올라가지만 연봉은 잘안오름"
88,(주)동구바이오제약,5051,"휴가는 있지만, 쓸때 눈치 받고 쓰게됨. 휴가 쓰고 싶을때 못씀. 보통 금요일에 쓰는데 대부분 다 그때 써서 쓰게되면 아랫 사람은 눈치 받고 쓰게됨. 엄청 눈치줌 연달아 쓰는거 상상도 못함. (퇴사 할때 가능) 월말에 쓰는 사람 많아서 이제는 월말에 되도록 쓰지 말라고 하심. 쓰지 말라는건 아니나 이말은 즉 쓰게 되면 눈치 엄청 받고 주위사람의 따가운 눈초리 받음. 개인사정 있어서 쓰게 되면 나 개인사정 있어서 쓰게 된다고 설명해야 할듯  즉 휴가를 못쓰므로 결국 남음. 연말에 휴가 많이 남아있어도 안됨. 돈으로 안줌 결국 휴가 쓰는건 월초나 중순에 그냥 다써야함 어쩔 수 없이 휴가쓰면 하나하나 다 말해줘야함. 치사해서 휴가 안쓰고 돈으로 받는게 훨씬 이득 정신건강에 좋음 하지만 불가능  휴가는 쓰라고 있는건데 쓰고 싶을때 못쓰는게 별로임"
89,(주)동구바이오제약,5051,"퇴사 하는 사람 많아짐. 일, 잡일 많음. 해야할 일이 계속 쌓임 자부심 가지고 열심히 일하는 사람있는 반면. 부정하고 투덜대는 사람, 사소한 걸로 장난치고 기분 나쁘게 하는 사람 많음. 그리고 짜증내고 밑에 사람 갈구는 사람 많이 있음. (방해요인)  명품으로 둘러매고 혹은 패션에 대한 자부심 돈부심이 강한 사람 많음(과시에 가까움) 그래서 그런지 남이 어떤 차 타고 집은 있는지 재산은 얼마나 있는지 비교 분석 하는 사람 있음. 사람 잘 안 꾸미고 다니는 사람 한테 뭐라 하고 비하 하는 사람도 종종 있음. 패션지적도 했던걸로 기억함. 지금도 있는지는 모름  자주 인상쓰고 화를 다스리지 못 한 사람은 회사에서 인정 받을 수 있다 한들 혹은 돈이 있을지 모르나 주변에는 사람이 없다는걸 기억좀 하시길 자신의 화도 못 다스리는 사람들, 나라욕 하는 사람, 남 어떻게 사는지 비교 분석 하는 등 이런건 본인 살아왔던 버릇에서 나온겁니다. 찔리면 반성하세요. 공든탑은 한번에 무너지기 마련입니다. 설상 공든탑이 없더라도 주변에 남아 있는것이 없을 겁니다. 열심히 사는건 좋은데, 못 나게좀 살지 맙시다."
90,(주)동구바이오제약,5051,워라벨 보장 안됍니다. 일이 많습니다. 스트레스를 많이 받아요. 직원들끼리 사이는 좋은편 입니다.
91,(주)동구바이오제약,5051,시골이라 거리상 멀었던점 빼고는 식당밥도맛있었고 사람들도 좋았어요
92,(주)동구바이오제약,5051,체계가 명확하지 않아 업무가 이리저리 돌음 인력충원 필요함 복리후생 부족함
93,(주)동구바이오제약,5051,최근조직 바껴서 야근특근 강요심해짐 야근 특근 상대적으로 적은사람 불러다가 야근특근 하라고 압박줌 사람들앞에서 실명언급하면서 지속적으로 망신줌 인격존중없음 사람들 앞에서 소리지르고 윽박지름 협박 막말 행사참여자없다고 부하직원들 모아놓고 정떨어진다 분위기 험악해지기전에 알아서들 지원하라고 협박함 선입견 심함
94,(주)동구바이오제약,5051,단점은 복지가 없는거 같은 느낌이 드네요 이거 말고는 괜찮게 다님
95,(주)동구바이오제약,5051,일의 능력보다는 정치나 줄 잘 타면 오래 살아 남을 수 있고 그러지 못하면 오래 못감
96,(주)동구바이오제약,5051,연봉이 아쉬웠으나 퇴사 후 많이 오름 신입 보다는 경력이 많이 쌓이고 노후를 위해 다시 가고싶군요(알아서 이해 하시길ㅎ) 개인 발전이 없음
97,(주)동구바이오제약,5051,너무 자기 개발에 힘쓰게끔 업무의 연장을 강요당하고 워라벨의 균형을 유지할 수 없음
98,(주)동구바이오제약,5051,"여러 회사로 제품을 수탁생산해줘서 귀찮고 번거로운일 많습니다. 무엇보다 학창시절에 놀아봤다는 사람들 다모아놓은듯 일찐들이 꾀나 있습니다. 말로 비하하고 업무외로 카톡방 만들어서 따돌림?이 있었다고 들었습니다. 입만열면 허언증, 말로 사람 괴롭히고 말장난 하는 사람, 특히 품질 실험실에 이상한 사람 많습니다. 듣기로는 어떤 한사람이 SNS 다 뒤지고 다닌다는 말도 들었습니다. 그리고 이상한 소문 다 퍼트리고 다니고요. 글 올린거 사진 올린거 카톡 사진등 하나하나 확인해서 그사람 뭐하는지 조사하거나 뭐했는지 감시? 하는게 있다고 합니다. 아무튼 이상한 사람 있으니 조심하세요."
99,(주)동구바이오제약,5051,일거리가 많았지만 이건 어느 회사나 다 그런것 같다. 아르바이트 형태로 근무했던 터라 자세한 사항은 모르겠다
100,(주)동구바이오제약,5051,보고를 해도 나아지는것이 없음 해마다 연봉 상승률이 차이가있음
101,(주)동구바이오제약,5051,사장이 기독교라서 조회때 예배를 드렸었음 그리고 사장이 이상한 거에 꽂혀서 헛짓거리 할때가 있음 연봉이 가른 제약사에 비해서 낮음
102,(주)동구바이오제약,5051,"꼰대중에 꼰대있음 사람들 이직 준비 많이하는중 관심있는 분들 눈여겨보다 지원하시기바람  야근 특근 압박 끊임없음 정신적인 스트레스, 압박에 노이로제 사람들 보는 앞에서 윽박지르고 인신공격  세상이 변하고 회사도 변하는데 혼자서만 십여년전 라떼 드시지마시고  제발 사람들좀 괴롭히지말고 언어폭행도 좀 그만하고 부드러운 리더가되길"
103,(주)동구바이오제약,5051,사람이많다. 개량신약없고대부분제네릭임 재택근무 유연근무 절대없음. 비효율적임.
