,company_name,company_id,review_text
0,㈜링크프라이스,1184,"영업위주로 신입은 전화 및 업무량 패널티가 있슴 , 모르는게 있어도 물어보기 힘든 분위기"
1,㈜링크프라이스,1184,전문성이 부족한 관리직 및 직원 대다수로 심히 우려되는 미래
2,㈜링크프라이스,1184,사무실 안에 흡연실이 있어서 담배냄새가 가끔 났다 서로 뭐하는지 감시해서 이르는듯
3,㈜링크프라이스,1184,키워드사업부의 경우 콜영업으로 거의 하루를 보내기 때문에 정신적인 피로가 상당하며 첫 직장으로 선택하기엔 매우 힘들다.
4,㈜링크프라이스,1184,"영업은 기본이지만 광고관리를 해야하는데 초반에 아는 지식으로 광고관리를 하는데 어려움을 느낌, 질문을 계속 해라고 하지만 당연히 다들 본인일 +a이고 여러명이 있기 때문에 어려움을 다 해소할수 없음. 그리고 광고 자체가 계속 수정 지속 확인 알고리즘 변화로 결과가 변해서 결과를 보장하는게 어려움 거기에 따르는 스트레스관리 등 여러면으로 무던한게 좋음"
5,㈜링크프라이스,1184,"직급제가 없어졌는데 상품권 지급할 때는 다시 부활함, 직원들한테 뭐 챙겨줘야할 때 '사원급' 이런식으로 다시 복귀되는게 아주 웃김, 반대로 직급제가 없어졌으니 승진 기회는 없음"
6,㈜링크프라이스,1184,"성과위주이긴함, 개인업무외로 취합및 해야하는 것들이항상있음, 콜에 자신이 없다면 들어오지마시길, 대부분의 콜(아웃바운드)로 먹고 삶,급여가 동일 순이익기준 다른 타사대비적음, 영업직이니까 푸시가 있을 수 있다는것 고려하시길"
7,㈜링크프라이스,1184,광고영업직이다. 극 I는 좀 어렵다. 그래도 광고만 잘돌리면
8,㈜링크프라이스,1184,"많이 못하면 돈을 못번다. 압박 심함, 텔레마케팅? 전화영업이다."
9,㈜링크프라이스,1184,"1. 고인물들이 너무 많은데 정치가 심함, 라인 못타면 승진이나 발전 가능성 매우 낮음 2. 콜압박이 너무 심함, 영업+관리를 둘 다 해야하는데 업무시간에는 콜압박만 하면서 관리는 업무시간 외에 해야되고 사실상 무언의 야근 강요, 야근하지 않으면 관리가 불가능하고 결국 광고주 떠나감"
10,㈜링크프라이스,1184,초반 전화영업이 주를 이르다 보니 매출의 발전보단 콜에 대한 압박을 받음
11,㈜링크프라이스,1184,압박감과 스트레스로 인해 사회경험이 없다면 힘들 수 있음
12,㈜링크프라이스,1184,영업 비중이 높다보니 압박이나 그런 부분에서 부담이 될 수 있음
13,㈜링크프라이스,1184,"일단 영업직들은 여러가지 압박에 있고 이상한걸로 스트레스 줌 ㅎㅎ 급여 테이블이 다른 동종업계에 비해 낮음,,, 이게 제일 단점"
14,㈜링크프라이스,1184,무조건 계약을 따내야하는 압박감과 전화영업의 스트레스가 심함
15,㈜링크프라이스,1184,우선 인센티브를 제외하면 급여가 좀 낮은편이라 본인이 얼마나 달리느냐에 따라 다르겠지요
16,㈜링크프라이스,1184,뭐부터 적어야할지 모르겠음.. 영업 실적에 따라 바뀌는 근무 기준과 텃세 부터 시작해서 욕하고 소리지르는 근무환경이 너무 힘들었음
17,㈜링크프라이스,1184,영업 위주라 급여가 측정되서 실적에 따라서 급여가 낮을 수 있습니다
18,㈜링크프라이스,1184,일이 안 맞는다면 하루 영업 할당량을 채우는 것이 매우 힘들 수 있음. 또한 팀배정이 잘 못 되면 회사생활이 꽤 힘들어짐.
19,㈜링크프라이스,1184,오직 콜영업으로만 할 수있음 영업 직군 일해본사람도 손사레치고 나감
20,㈜링크프라이스,1184,잘해야 좋은 회사 실적없으면 힘듬 월급은 실적에 따라 달라짐
21,㈜링크프라이스,1184,무시해야할 사람도 있는곳 배울 사람도 있는곳 꼰대도 있는곳
22,㈜링크프라이스,1184,많고 많은 대행사들중에 회사만의 강점이 없음 추가로 아직도 구시대적인 영업에 의존
23,㈜링크프라이스,1184,"주위 동료의 스마트함, 다수 팀과 팀장, SK 특정 팀"
24,㈜링크프라이스,1184,실적 압박이 있음 회식 너무 자주함 야근 연차 눈치보임 팀을 잘만나야됨
25,㈜링크프라이스,1184,한 만큼 벌수있다해도 사실 너무 힘든 것도 사실.. 기본급이 낮음
26,㈜링크프라이스,1184,"엄청난 수직 문화, 찍어누르는 실적 압박. 무언가 일이 잘못되면 실무자가 책임을 지는 이상한 구조. 상급자들은 권위는 있는데 책임은 없음. 회사의 매출 자체가 각 개인의 매출의 합이어서, 무언가 잘못되면 그건 개인의 잘못임. 영업 직군 이외의 업무는 좋은 성과를 내면 이사, 부장들의 성과로 가로채기 당함. 잘못되면 그건 네 탓. 가스라이팅이 매우 심함."
27,㈜링크프라이스,1184,교육이 있지만 업무에 투입되기엔 부족함이 있다고 판단됨 영업이 주된 회사
28,㈜링크프라이스,1184,마케팅 업무 생각하고 오면 안됨 하루종일 전화돌리고 업무량 못채우면 야근해야함
29,㈜링크프라이스,1184,영업에서 막히면 실무를 아무리 잘한다한들 발휘할 수없음
30,㈜링크프라이스,1184,"인격적인 모독을 많이 함, 업무 시간에 담배 냄새 나고(방에서 피우고 베란다에서 피워서~ㅎ) 소리지르고 욕하는 사람 천지"
31,㈜링크프라이스,1184,"대신 기본급이 박하며, 연봉인상률이 높지 않음(연봉직 기준), 영업직군의 경우 인센티브제도로 타 공식대행사 대비 인센티브가 낮으나 위에 말한 장점으로 어느정도 상쇄 가능 제일 문제는 일부 상급 관리자 밀어주기와 그 관리자들의 무능함이 문제"
32,㈜링크프라이스,1184,같은 회사의 사람이 매핑한 건은 영업 불가능 하지만 회사가 크고 사람도 많아서 대부분 같은 회사 사람 영업
33,㈜링크프라이스,1184,영상하는 사람이라면 굳이 이 회사를 갈 필요 없음. 그저 영업하는 회사
34,㈜링크프라이스,1184,아무래도 초반에는 광고주 수주 위주라 영업이 자신이 없다면 추천하지 않음
35,㈜링크프라이스,1184,"사람,사람,실적,압박,그 모든게 전부 다. 정상인이라면 규모만 보고 가면 안됨"
36,㈜링크프라이스,1184,인센티브가 적고 콜센터마냥 전화해대고 피이관 당할까 아침마다 노심초사하는게 하루의시작
37,㈜링크프라이스,1184,업무 스트레스가 장난아니다 매일 아침에 전 직원 매출량 순위 보내주고 업무 압박함
38,㈜링크프라이스,1184,사내정치심하고 서로 말이 많고 헛소문이돌음 흡연자가 많음
39,㈜링크프라이스,1184,네이버 오픈마켓을 주로 하는데 오픈마켓 요새 하는 사람이 솔직히 없어서 비전이 있는지는 모르겠음
40,㈜링크프라이스,1184,제일 직급이 높은 상사를 보고 배운게 있어서 그런지 주임급 쯤 되면 자동으로 동기화가 되는 것 같다. 똑같이 그 행동을 보고 배워 사람을 핍박한다. 짬때리기는 기본이고 애초에 아는게 없어서 매일 아래 직급들한테 물어보고 또 물어보고 반복하는듯.
41,㈜링크프라이스,1184,"낮은 급여, 정체된 복지, 사내정치질 심함, 지속적인 영업콜"
42,㈜링크프라이스,1184,광고영업이라는 것이 안맞으면 굉장히 힘듦. 엄청 쪼아됨
43,㈜링크프라이스,1184,퍼포먼스 마케터라곤 하지만 전화영업이 주된 업무임. 하루 정해진 영업량이 있음.
44,㈜링크프라이스,1184,업청난 야근과 압박 매출을 내지못하면 당하는 부당대우 등
45,㈜링크프라이스,1184,"콜에대한 압박, 전화하는 회사, 직원이 자주바뀌며 젊은 인력을 쓰고 나가면 그냥 나가라는식. 애사심과는 조금 거리가 먼 회사"
46,㈜링크프라이스,1184,실적압박이 있음. 야근수당이 없음. 업무량과 실적은 하는만큼.
47,㈜링크프라이스,1184,"실적에 대한 압박이 심한 편, 영업 위주라 실무를 배우는 것보다 콜에 대한 부분이 우선시 됨"
48,㈜링크프라이스,1184,영업회사가 다 그렇지만 실적 관리 오지게 함 전화도 오지게 함
49,㈜링크프라이스,1184,"다니는 행위 자체가 단점입니다 고인물을 위한 회사라, 뉴비는 입사 후 적응이 힘들어요 열심히 일해서 고인물에게 싸다 바치게 됩니다 퇴사할거니깐요"
50,㈜링크프라이스,1184,업무용폰 미지급과 전담 흡연실이 내부에 있는게 좀 힘들었음
51,㈜링크프라이스,1184,업무 스트레스가 심함. 텔레마케팅 잘 하는 사람이라면 괜찮음
52,㈜링크프라이스,1184,"1. 하루종일 콜 하면서 개인 광고주를 계속 모집해야 하는데 금방 지침 2. 야근을 강제로 시키지는 않지만, 나중되면 야근을 할 수 밖에 없음"
53,㈜링크프라이스,1184,인센티브 복잡하게 해놓고 사실상 쥐똥만큼이고 어쨋던 기본급은 보장이니 알아서.. 판단..
54,㈜링크프라이스,1184,100%운빨 광고주 운빨이 좋아야지 오래 살아남는다 업무량에 대한 강요가 세다
55,㈜링크프라이스,1184,성과에 대한 압박이 있어 성과를 내지 못한 날은 부담이 큽니다
56,㈜링크프라이스,1184,초기에는 적응하는데 힘들수있음 절대 만만하게 보고 지원하면 안됨
57,㈜링크프라이스,1184,"텔레마케팅으로 영업하여 실적을 채워야 하므로 아웃바운드가 주업무인데 이 과정에서 판매자들한테 안 좋은 말을 들을 수 있다 실적을 못채우면 매출 압박도 받고 월급도 많이 못 받는다 기본 업무, 새 프로젝트 등으로 야근일수가 많다"
58,㈜링크프라이스,1184,1. 연차 눈치줌 2. 고인물들 파티 신입직원 영업이 어려움 3. 적은 가까이 있다 4. 정치질이 심함 5. 경력에 도움이 안됨(물경력) 6. 뭣도 아닌 젊꼰들이 많음
59,㈜링크프라이스,1184,"경영진이 일단 돈무새고 그 밑의 부장, 차장급은 싫은 소리 1도 못 하는 앵무새 수준이라 직원들 쥐어짜기만 함. 아무나 받아서 물량으로 승부하는 회사기 때문에, 그렇게 쥐어짜이다가 나가면 이득이라고 생각함."
60,㈜링크프라이스,1184,업무량이 지나치게 많고 급여 부분에서 아쉬운 부분이 많습니다
61,㈜링크프라이스,1184,영업에 대한 압박이 심하다 하루에 전화로 영업하는 횟수가 매일 나오며 팀장님이 확인하신다
62,㈜링크프라이스,1184,텔레마케팅으로 전화압박이 많음 하루에 전화를 수십통 하고 그것에 오는 스트레스가 매우 컸음
63,㈜링크프라이스,1184,아무래도 전화를 많이 해야되는 업무이다보니 내가 cs업무가 주인지 햇갈리는 부분도 있다. 또한 업무량이 많은 편이다.
64,㈜링크프라이스,1184,매일매일 성과에 대한 보고나 성과에 따른 조임?이 심했다. 광고주와 회사 사이에서 눈치 아닌 눈치를 보며 성과를 올려야 하는 점이 힘들었다.
65,㈜링크프라이스,1184,자리 잡기 전 영업의 어려움과 스트레스를 어떻게 극복하느냐의 문제에 직면하게 됩니다
66,㈜링크프라이스,1184,환경이 최악이었음 사무실 내에 흡연실 있었어서 소방 관리 나올 때만 잠시 입 닫고 있으라고 주의시키고 평소엔 그냥 사무실이 흡연실 그 자체였었음 불법인데 그거
67,㈜링크프라이스,1184,모니터가 한개다 신입 6개월 지나면 거의 혼자서 다해야한다 영업량이 타이트해서 광고관리는 업무외 시간에 해야한다
68,㈜링크프라이스,1184,하는 일과 스트레스에 비해 보상이 적다 스트레스가 너무 심하다
69,㈜링크프라이스,1184,영업과 광고운영이 동시에 이루어지다보니 업무에 효율이 떨어지는편 매체별 래퍼런스는 많은 편이나 운영 방안이나 전략적인 방법들은 혼자 해결해나가야함
70,㈜링크프라이스,1184,고인물이 많아 텃세랑 서열질 심함. 신규 매출만 매출로 취급한다. 정규직 되기까지의 텀을 너무 타이트하게 잡았다.
71,㈜링크프라이스,1184,정치질+. 낮은 인센티브 퇴근시간 늦음 관리자들의 무능 도태함
72,㈜링크프라이스,1184,"단순 보고를 위한 보고 너무 많음, 말도 안되는 영업 푸쉬 너무 많음"
73,㈜링크프라이스,1184,업무시간이 다른업체에 비해 긴편 중간쉬는시간 때문에도 그렇게 느껴짐
74,㈜링크프라이스,1184,링크프라이스는 프로세스의 복잡성 때문에 개발 속도가 느릴 수 있습니다.
75,㈜링크프라이스,1184,연차를 이틀연속으로 쓰려면 컨펌받아야하고 주말이랑 같이 쓰는건 휴가시즌빼고는 좀 어려움
76,㈜링크프라이스,1184,보고를 위한 보고를 진행하는 일이 많아 바쁜 개인업무의 비효율을 더하는 느낌입니다.
77,㈜링크프라이스,1184,딱히 젊은 사람들이 너무 많은 것 빼고 잘 모르겠다 좀 더 다녀봐야 알 것 같음
78,㈜링크프라이스,1184,연차쓰기 조금 눈치보임. 손이 좀 빨라야함. 전화업무많읗ㅁ
79,㈜링크프라이스,1184,사람이 많기에 회사 분위기 자체가 사내 정치 느낌이 강했다.
80,㈜링크프라이스,1184,쓸데없는 보고서가 너무 많고 취합까지 아랫직급이 다~~한다 윗급들이 너무 고여있어 일을 자기들끼리 하지 말자고 작당모의한듯함
81,㈜링크프라이스,1184,그냥 주구장창 영업만 하는 곳 영업 못하면 압박심하고 그마저도 고인물들이 다 채가서 인센못받고 그냥 기본급여만 받는다고 생각하면 됨
82,㈜링크프라이스,1184,영업만 주로 하고 초반 교육을 제외하면 알려주는 사람 없이 혼자 터득해나가야함 초반 교육도 실질적으로 도움이 되는지는 모르겠음 매출이 어느정도 쌓여도 영업은 계속 해야함
83,㈜링크프라이스,1184,영업못하면 돈도 적게주고 위에서 압박심하고 친목 다져다져 그냥 영업못하면 애초에 입사안하는게 나을정도
84,㈜링크프라이스,1184,"고인물들 때문에 승진 어려움,식대가 적은 편이라 아쉽다,잦은 회의,사무실이 절간임"
85,㈜링크프라이스,1184,"콜수에 대한 압박감이 심함, 인센티브 낮게 책정되는 편, 야근 혹은 휴일에도 광고주에 대한 관리가 필요함"
86,㈜링크프라이스,1184,복지라고 할만한게 없음 연차 눈치보고 써야함 일못하는 고인물들이 담배만 피다 감
87,㈜링크프라이스,1184,식대 5000원 포함이지만 식대 비용을 늘려줬으면 좋겠음 비정규직 차별하는게 느껴짐 오래 일하고 싶지는 않음
88,㈜링크프라이스,1184,사업자의 광고 계정을 가져오지 못하면 회사에서는 계속적인 압박 야근 등등 시달리게됨
89,㈜링크프라이스,1184,일이 생각보다 많다고 상각하는데 그건 어딜가나 다 비슷핮 않은가 싱각되기도 하지만 영업이라 더 힘들게 느껴짐
90,㈜링크프라이스,1184,기계식 공장형임 연차 쓰는데 눈치보임 전부다 기계식 키보드라서 시끄러움 자유복장 그짓말
91,㈜링크프라이스,1184,알바로써 단점은 딱히 없었고 직원분들이 야근을 많이 하신다는 소문이
92,㈜링크프라이스,1184,고함을 지르시는 상사님들이 계시고 가끔가다 갑자기 소리지르시는 분도 계시고 웹디자인 사원 뒤에서 슬금 뭐 하시는지 지켜보시고.. 조금 무섭습니다
93,㈜링크프라이스,1184,마케팅 업무는 극극극극 소수고 거의 모든 업무가 영업임. 영업직이라고 생각하고 들어가면 마음편함. 그리고 팀 바이 팀이라 초반엔 자주 야근을 해야 할 수도 있고 아예 안할수도 있음 이건 복불복이라 단점이라고 하기엔 그렇지만 초반엔 거의 야근한다 생각하고 들어가면 될 듯.
94,㈜링크프라이스,1184,점심비 안나옴. 팀따라서 안좋을수 있음. 콜센터 이미지가 강해서 마케팅쪽 부서가 따로 있는데 기업평가가 하나로 묶여 아쉬움
95,㈜링크프라이스,1184,사원수만 많지 대부분 마케터인 뻥튀기회사 마케터들도 다 노베이스에서 시작가능하며 전문성이라곤 찾아볼 수 없는 회사
96,㈜링크프라이스,1184,승진이 힘들어요 경험쌓긴 좋지만 이직 준비도 많이 한답니다
97,㈜링크프라이스,1184,합리적인 척 하는 상사들이 많아서 힘듦 일을 잘하지 못하고 열심히만 하는 경우는 인정받기 힘든 곳
98,㈜링크프라이스,1184,야근을 하지말라고 하지만 야근을 할 수 밖에 없게 만듦 젊은 꼰대가 너무 많음
99,㈜링크프라이스,1184,미래를 생각한다면 다른일을 구하는것이 좋음. 이건 텔레마케팅에 대해서임.
100,㈜링크프라이스,1184,배울게 마케팅이라면 그것뿐이다. 자기가 열심히 해야 배울 수 있다. 관계라기보단 개인플레이 위주의 분위기 이다.
101,㈜링크프라이스,1184,"업무 과중, 개인주의 문화 일 하면서 소속감을 잘 못느끼겠음"
102,㈜링크프라이스,1184,"개인 실적이 낮을 경우 사람 취급 안함, 주에 1명씩 무단퇴사자 나옴"
103,㈜링크프라이스,1184,"경력, 학력 어떤 것도 입사에 필요치 않지만, 아무것도 모르는 사회초년생이 버텨내기 힘듬. 멘토링 제도가 있지만 정말 배울만한 것이 크게 없음(멘토의 능력에 따라 차이는 있겠지만)  업계에서 거의 가장 낮은 인센테이블이라 생각함. 여기보다 더 많은 인센을 지급하는 회사는 정말 많이 봤지만, 더 적게주는 회사는 본적이 없음  팀장급 이상 고인물이 많음. 그래서 정치질이 잦고, 결국 신입사원을 갈아넣어 회사만 배불리는 경우가 허다하게 생김."
104,㈜링크프라이스,1184,매출이 크게 오르지 않는이상 하루종일 콜 해야됨 돈 욕심이 많지 않으면 버티기 힘듦
105,㈜링크프라이스,1184,일처리 매우 비효율적 길게이야기하기도 싫다 단점이란 단점은 다가짐. 면접보기 전 후로 이 리뷰 보시고 런하세요.
106,㈜링크프라이스,1184,매번 물갈이가 심하게 되어 고인물 체제가 형성됨. 밑에 사람들만 개고생
107,㈜링크프라이스,1184,앞서 말한 자유복장 뺴고는 모든 게 단점임!! 특히 영업 콜 실적 내야 해서 이거 못 채우면 야근 시키고 그러니 사람들 다 퇴사함..
108,㈜링크프라이스,1184,"업무가 안맞으면 버티기 힘들다. 최저 기본급이라 연봉 낮음, 초반에 영업직 업무를 버텨야함"
109,㈜링크프라이스,1184,"월급이 짜고 생각보다 경직된 문화가 있음. 휴가는 하루 이상 쓰기 어려움. 윗 사람의 눈치를 많이보며, 회사 규칙에 무조건적으로 따라야함."
110,㈜링크프라이스,1184,하루에 꼭 해야하는 영업량이 정해져있고 달성 못한다면 야근 등 패널티가 존재해요 이건 몇년차든간에 다 기준이 있어서 아에 안할순 없다
111,㈜링크프라이스,1184,업계에서 그다지 높지않은 대우 대행사 특성상 을의입장이다보니 업무 과중이 피라미드식
112,㈜링크프라이스,1184,점점사양되는 기술로 다른사업으로 변경되어가는중으로 알고있다. 텔레마케팅으로는 더이상 광고쥬들이 꼬셔지지않을듯하다.
113,㈜링크프라이스,1184,"업무 특성상 고객관리를 위해서,, 잘못하면 퇴근하고도 밤낮 주말 없을 수 있음."
114,㈜링크프라이스,1184,영업 강요 너무 심함 회사 체계가 별로 없음 그냥 대학교 느낌
115,㈜링크프라이스,1184,"야근 많음, 야근에 대한 거리감 없으며, 그냥 해야되는 상황"
116,㈜링크프라이스,1184,단순 영업 위주라 발전성이 없는 것 같고 월급이 안정정이지 않은편이다
117,㈜링크프라이스,1184,복지제도가 다양하지만 해당이 안되는 복지가 많아 시용하기 힘듦. 승진이 어렵고 업무상 정해진 답이 있는것이 아니라 내가 도출해낸 결과를 정답으러 만들어야 하는데 거기에서 오는 스트레스가 상당함
118,㈜링크프라이스,1184,영업을 하는 광고대행사이기 때문에 그만큼 심적으로 힘들 수 있음 지난 달에 잘했어도 이번달에 성과가 저조하면 급여에 타격이 생기고 그만큼 심적으로 고통스러울 수있음
119,㈜링크프라이스,1184,중요 사항 공지가 이루어지지 않음. 공지를 해도 아무도 모르게함. 실무자는 전혀 생각해주지 않는 우두머리들의 태도.
120,㈜링크프라이스,1184,"좋은 사람들 사이에 선배빌런이 껴있음(어디나 그렇지만), 교육보다 전화 돌리는 것 너무 강요, 광고 세팅을 가르쳐주는 이가 너무 없음(남의 소중한 광고비가 한번해보자 라는 식으로 소진될수밖에 없음=기껏 힘들게 데려온 광고주 화내고 나가리)"
121,㈜링크프라이스,1184,파벌이 있음 ㅡㅡ 이득을 위한 파벌이아닌 또래들의 모임
122,㈜링크프라이스,1184,급여도 별로고 복지 많은척하지만 아니에요ㅠㅠ 영업직군은 걍…목아프게 텔레마케팅 콜영업하다 집감
123,㈜링크프라이스,1184,실적이 안나오면 돈 못벌고 시간낭비하다가 나옵니다 실적쌓기가 쉽지 않습니다
124,㈜링크프라이스,1184,실적에 따라 평가되기 때문에 지속적인 압박이 있을 수 밖에
125,㈜링크프라이스,1184,칼퇴는 못하는듯했음. 월차쓸 때 수기로 작성했었는데 지금은 모르겠지만 기안 올리는 등 결재 시스템은 구식인듯
126,㈜링크프라이스,1184,야근 강요시키고 신입직원을 갈아놓고 신규영업하고 신입이 잘못하면 기존사원이 가로채기도함 영업사원이 실적이 다인데 그걸 뺏으면 어쩌자는건지
127,㈜링크프라이스,1184,"야근, 주말에 일해야함 ( 자율적이라 수당도 안 나옴) 컴퓨터 너무 느림 바꿔달라고 하면 거의 안되고 신입들은 자기가 컴퓨터 사서 사용"
128,㈜링크프라이스,1184,상사 눈치가 보인다는 단점?.. 흡연을 안하는데 사무실쪽이 흡연실이 있다는점?
129,㈜링크프라이스,1184,성과제기 때문에 광고주나 빅 클라이언트를 물어오지 못하면 심리적 압박감이 있음
130,㈜링크프라이스,1184,업무푸싱이 상당함 주말동안 광고주 전화 상당히 많이옴 소액 광고주가 더함
131,㈜링크프라이스,1184,"자유롭지 못한 연차, 비효율적인 업무 , 회사가 너무 회사의 이익만을 추구함"
132,㈜링크프라이스,1184,"자유로운분위기로 사내분위기가 잘 형성되어있지만, 대표 및 이사님들의 지속적인 영업 실적 강요가 심합니다."
133,㈜링크프라이스,1184,콜 강요 및 사실상 실적만 중요시함 관리도 마케터가 해야하는데 어떻게 해야하는지 제대로 알려주지 않으면서 영업만 강요함 추후 피이관 발생시 마케터에게 책임전가
134,㈜링크프라이스,1184,영업직대우가 아주 안좋음 영업직이없으면 다른 부서들도 존재할 이유가없는데 마치 자기들이 갑이라는 마인드에 윗선은 꼰대마인드 절정 그저 말도안되는 업계최저 수수료율 . 1년차이상부터는 친목질 잘하는사람이 살아남는 형태
135,㈜링크프라이스,1184,영업을 못하면 눈치주고 정규직이 힘든 회사라고 생각합니다
136,㈜링크프라이스,1184,여느 직장들처럼 정치질있음. 영업본부 관리자들 무슨 기준으로 됐는지 잘 모르겠음 (거의 이런사람이 팀장이라고?급) 업무량에 비해 박봉이라 느껴짐. 필요할땐 단물 쪽쪽 빨아제껴 갖다쓰고 본인들한테 도움 안된다 느껴지면 가스라이팅(니 없어도 잘돌아간다 겨우 이런거만 할거냐 등)
137,㈜링크프라이스,1184,영업을 강제적으로 시키고 정해진 목표를 채우지 못하면 야근해서 일을 더 해야 함 그리고 회사 분위기가 약간 꼰대 마인드여서 눈치 잘 살피면서 생활해야됨
138,㈜링크프라이스,1184,인원 충원의 느낌이 강함 전화 영업 업무 다수 반복적인 업무가 많음
139,㈜링크프라이스,1184,연봉이 높다고 하지만 기본급여가 낮음 / 퇴근시간이 7시라서 저녁시간이 많이 없음 / 업무가 콜영업이 대다수임 실적이 낮으면 눈치 줌
140,㈜링크프라이스,1184,신입이 들어오면 아웃바운드 기계처럼 일하는 콜센터. 언변도 노하우도 없는 사람이라면 매일 의미없는 콜수만 채우고 퇴근하게 됨. 퇴사율 굉장히 높음
141,㈜링크프라이스,1184,아무래도 단점은 영업인 거 같음 전화로 계속 리뷰를 해야되다보니까 거절 당하고 까이면 상처 받고 광고주들 모을 때 까지 멘탈이 좀 흔들릴 거 같음
