,company_name,company_id,review_text
142,㈜링크프라이스,1184,"낮은 임금과 인센티브율, 매달 지속적인 실적 강요, 영업 콜 압박, 운영비 몇 년째 동결, 성과에 따른 보상이 낮음, 복지개선 없음"
143,㈜링크프라이스,1184,아웃바운드가 적성에 안 맞는 경우 업무가 힘들 수 있음. 식대가 없어 식대비용이 적지않게 나감.
144,㈜링크프라이스,1184,위의 장점 빼고 모두 단점. 그중 가장은 팀장 이상급의 수준이 매우 떨어짐. 회사 규모에 비해 체계도 너무 없고.. 팀장이상급은 이 회사 오래다녔다면서 그동안 뭘 했는지 의문
145,㈜링크프라이스,1184,능력제이기 때문에 실적에 대해 생각해보아야 합니다. 일정하지 않은 일이기 때문에 스트레스를 받기 쉽고 사내 정치 및 말들이 많이 오갑니다.
146,㈜링크프라이스,1184,초반야근이 필수인곳 야근지향을 안한다고 하는데 영업을 한개하면 야근이 없으면 일유지못함.
147,㈜링크프라이스,1184,온라인 마케팅부터 시작으로 알고 입사하지만 첫 시작은 텔레 마케팅 부터 시작
148,㈜링크프라이스,1184,연차 팀장권한이라고 쉽게 쓸 수 없음. 연차촉진제도를 이행한다고는하지만 별 의미없음 영업회사인데 영업지원팀 눈치를 봐야함ㅋㅋ 영업회사에서 영업직보다 지원팀 힘이 막강함 낙하산은 거의 공수부대 급
149,㈜링크프라이스,1184,"팀별, 그룹별로 활동을 좋아하는 저는 다들 개인적으로 업무를 보는게 막막했다"
150,㈜링크프라이스,1184,"정치, 파벌, 줄타기, 인터넷에서만 봐오던 모습들의 다양함을 질리지 않게 볼 수 있음. 남의 연차 사유에 관심이 많은 편. 왜 내가 내 연차사용에 눈치를 보고 핑계를 대야하는 지 모르겠음. 회사 영업에 규율이 있지만 다 필요없음. 안 지키고 매출만 하면 장땡. 유명무실한 규율뿐들. 회사 규율을 지키는 사람만 바보되고 규율무시하고 내부 영업해서 가져오는 사람만 돈을 많이 받는 가해자들이 판치는 구조. 말로만 주의하고 끝. 나이가 어린 사람들이 관리자가 되는 경우가 있는데 어디서 꼰대문화를 배운건지 경외심이 들 정도. 상대방에 대한 배려? 존중? 그딴 거 없음. 내가 관리자인데 까라면 까야지 왜 말대꾸하냐, 자기쪽팔리게 남들 앞에서 왜 대드냐(대드는 게 아니고 부당한 지시에 대해 반박을 했었던 상황이었음) 이런 사고방식을 가진 사람이 관리자임. 윗물 썩을대로 썩었고 아래에서 영업하다 부당한 지시에 지쳐 퇴사한 사람들 수익은 다시 윗물로 들어감. 남자예비군? 연차나 반차 쓰고 가야됨. 할 말이 더 많긴 하지만 더 길어질 거 같아서 생략함."
151,㈜링크프라이스,1184,직원이 아니었기 때문에 단점은 딱히 없다. 사람이 많아서 정신 사나운 면? 전체적으로 만족
152,㈜링크프라이스,1184,"업무량 대비 현저히 적은 급여, 위에서 시키는 일이 많음, 아직도 옛날 스타일식 영업 방식을 고집, 변화하겠다고하고, 변화하는 척 하지만 3주도 못가서 다시 원래 방식으로 돌아옴. 매번 내세울만한 복지는 그 놈의 4시 퇴근 금요일과 다른 회사들도 분명 마찬가지로 있을텐데, 다양하게 구비된 라면과 과자, 음료."
153,㈜링크프라이스,1184,발전가능성이 많이 없는거 같고 사내 문화가 다소 아쉬운 점이 였습니다.
154,㈜링크프라이스,1184,업무의 시작이 영업 영업이 힘들다면 교육부터 많이 힘들 듯
155,㈜링크프라이스,1184,다양한 업무를 해내야하며 한가지 업무를 비효율적으로 여러번 해야하는 경우가 많음. 주먹구구식 의사결정. 정치질 심함.
156,㈜링크프라이스,1184,다 좋았지만 한가지 아쉬운건 상사의 기분대로 업무 분위기가 형성됌 인격을 깎는 말은 좀 안했으면 좋겠다
157,㈜링크프라이스,1184,"동종직보다 낮은 인센, 기본급 120만원, 경영진의 무관심, 구시대적인 프로세스"
158,㈜링크프라이스,1184,실적에 대한 압박이 있음. 기본급이 적고 실적이 없으면 돈을 못버는 구조
159,㈜링크프라이스,1184,2주일 교육 후 바로 현장으로 들어가서 마케팅은 빡센것같다. 신입들에게 너무 많은걸 바란다
160,㈜링크프라이스,1184,인센으로 월급을 올리는 구조기 때문에 콜영업이 필수.
161,㈜링크프라이스,1184,"인센 테이블 몇년째 그대로, 타대행사에 비해 나은점이 하나도 없음(근무시간, 인센, 복지 등등) 무능한 관리자가 너무 많고, 주먹구구식 의사결정 및 정치질에 지침"
162,㈜링크프라이스,1184,상사들에게 보고 배울게 없다 다 알아서 찾아내고 해결해야하고 그 후 상사들이 자신의 것인 마냥 가져감 알려주는게 없는 회사인 만큼 물경력되기 쉬움
163,㈜링크프라이스,1184,- 사리사욕을 장황하게 주입시키고 가스라이팅시킴 - 본인만의 확고한 뜻이 있다면 절대 오지말것 - 정치질 심함
164,㈜링크프라이스,1184,성과가 없으면 급여가 너무적어서 멘탈적으로 버티기 힘들 수 있음
165,㈜링크프라이스,1184,처음에 교육할때 이론 설명 후 바로 실전에 투입하는데 제대로 이해가 안 된 상태에서 일을 시작해야해서 막막함 무조건 콜만 많이 해야하고 그날 당겨온거 없으면 꽤나 눈치보게함
166,㈜링크프라이스,1184,체계성 부족. 개념없는 사람들이 많습니다. 기본적인 예의는 갖추길
167,㈜링크프라이스,1184,"일의 진행이 두서 없고, 비전도 없습니다 갑자기 오더 내리면 우격다짐으로 끝내는 느낌"
168,㈜링크프라이스,1184,사람이 많아서 헛소문 퍼치기 제격임. 경영팀 쪽에서 뭐 하라마라 엄청 눈치 줌.
169,㈜링크프라이스,1184,"틈만 나면 커피 쏘는 내기 해대서 남아도는 돈이 없음; 직속 상사가 뭐 알려주는 것도 없이, 폄하만 해댔음."
170,㈜링크프라이스,1184,지금은 모르겠지만 휴가를 한달에 한번만 쓸수있고 엄청 눈치보면서 쓸 수 있었음
171,㈜링크프라이스,1184,"사내정치 심함. 특히 전문성을 토대로된 관리직군들은 연봉이 매우 짬, 디자인,영상,개발 등등 이런 전문 분야에 연봉을 사무직과 동일하게 측정하는 부분 연차 자유롭게 못씀 2틀 붙혀서 못씀. 매년 kpi작성하는데 본인들이 원하는거 아니면 성과는 0"
172,㈜링크프라이스,1184,영업이라 아무래도 감정소모 있음 업무적인 스트레스가 강한데 사람에 대한 스트레스도 높음
173,㈜링크프라이스,1184,상사 잘못 만나면 연차 쓰는데 눈치줌 영업만 잘한다면 딱히 없는듯
174,㈜링크프라이스,1184,체계가 잡혀잇는것 처럼 보이나 체계란것이 존재하지 않음
175,㈜링크프라이스,1184,본인이 영업을 해서 일정 매출이 될 때까지 영업 자체가 매우 힘듬. 전화 영업이 주업무이기 때문에 그걸 견디거나 버티거나 잘 해내기 매우 어려움
176,㈜링크프라이스,1184,영업강요로인해 마케팅 관리에 집중이 불가능함. 기업구조상 비용을 쓰지 않는 업체는 사실상 관리가 불가능함
177,㈜링크프라이스,1184,"최고의 성과를 내는 직원들에게 그만한 대우가 따라오지만 점차 비교되어지는 자신을 감당해야함 처음엔 요령도 없고 힘듬 다만, 영업 관련해서는 당연하다 생각되는 단점"
178,㈜링크프라이스,1184,말이 마케터아고 그냥 콜센터라고 보셔야 할 것 같아요. 계속 전화돌리고 전화로 영업하고 해야하는데 이미 검색마케터가 판을 치고 있어서 영업하기 정말 힘듭니다. 그리고 교육도 제대로 안해주고 실전에 바로 투입해버려서 상당히 난감할때가 많습니다.
179,㈜링크프라이스,1184,"7시 퇴근이라는 점과, 영업 특성 상 성격에 맞지 않으면 업무를 계속하기에 힘들다."
180,㈜링크프라이스,1184,팀장이 퇴근을 하라고 지시하기 전까지는 다들 눈치 보면서 못가요.
181,㈜링크프라이스,1184,"기계 같은 업무, 업무에 대한 지식을 이해를 시키고 영업을 시켜야 하는데 무작정 전화만 돌라게 시킴"
182,㈜링크프라이스,1184,야근 없다고하면서 야근안하면 눈치줌. 직원보단 알바의 느낌이 아주 강했음. 퇴사하면 새로 뽑으면 되기때문에 크게 직원인느낌을 못받음
183,㈜링크프라이스,1184,갸인적으노 팀끼리 돈독하다는 느낌이 안들고 가끔 동떨어진 느낌이 들고 경쟁하는게 별로였다
184,㈜링크프라이스,1184,일을 배울 사람이 부족 신입사원들 연봉이 다소 적음 모바일 개발자 부족
185,㈜링크프라이스,1184,사내정치 고인물 많음 젊꼰 많음 리더들의 전문성 부족 잦은 퇴사
186,㈜링크프라이스,1184,"야근이 매우 잦은데 추가 수당 없음, 밤 늦게 퇴근해도 반드시 정상 출근, 연차 마음대로 붙여서 못 씀, 제작 조직에 제공되는 장비들이 너무 구림, 연봉에 대한 불만이나 수당에 대한 불만이 인센티브로 해결되는 마인드, 제작 인력의 부족으로 인한 한계점"
187,㈜링크프라이스,1184,"오직 영업 성과만으로 사람이 평가되는 회사, 압박이 심함"
188,㈜링크프라이스,1184,개인의 성장을 위해선 워라밸 신경 쓰지않고 갈아넣어야함 워라밸 중요시 하는 사람은 큰 단점이 될 수 있음
189,㈜링크프라이스,1184,사내정치질/ 지들 이쁜사람 편애 분위기 안좋음 살벌함 배울 점도 없고 시간만 죽이기 좋음
190,㈜링크프라이스,1184,매출에 따라서 휴가 못쓰게함 ㅋㅋ 코미디 밥값을 안줌... 인센 테이블 업계 최악
191,㈜링크프라이스,1184,"19시에 퇴근하는 회사가 거의 없는데 아직도 유지 중 술 좋아하는 팀장만나면 회식은 무조건 한달에 한번 참여해야함 SNS, 카카오, 영상제작 등 담당해주는 직원 한명 퇴사하면 팀이 공중분해 되는 주먹구구 운영 영업은 하라고 하지만, 다른 대행사에 비해 장점은 없음"
192,㈜링크프라이스,1184,"연차 일주일 전에 결재받아야함, 업무 루틴이있어 연차 쓰기 힘들 때도 있음, 음료수 간식이 다양하지 않음 매번 비슷함"
193,㈜링크프라이스,1184,누군가의 눈치를 지나치게 봐야만 함 흡연실;; 냄새 너무 많이 남
194,㈜링크프라이스,1184,영업 못하면 노비 취급 받음. 야근 많음. 젊은 꼰대 많음.
195,㈜링크프라이스,1184,거절당하는 영업전화만 하루에 30통씩 해야함 계속 실적에 연연하게만듬
196,㈜링크프라이스,1184,가만히 앉아서 콜센터처럼 영업해야함 업무 압박감 심함 편안한 분위기지만 항상 경쟁하는 분위기
197,㈜링크프라이스,1184,원래 비즈니스 모델은 없어졌고 키워드 광고 대행으로만 매출이 확대됨
198,㈜링크프라이스,1184,단점은 잘 모르겠으나 신입 초반엔 텔레마케팅 영업 콜 수나 계약성사에 대한 푸쉬가 있는거 같음
199,㈜링크프라이스,1184,"영업직군 대비 관리직군 처우가 좋지 않음. 1.보이지 않는 사내정치 존재, 2. 영업직군의 경우 초반에는 광고주 수주 영업이 필요하므로 콜 업무 다수 3. 콜압박 스트레스 받을 수 있음 4. 검색광고 위주 마케팅이라 다양한 방면으로 경력 쌓기 어려움"
200,㈜링크프라이스,1184,같은 일을 상대만 바꿔서 반복적으로 일을 해야되는 거 같고 뭔가 정신적 에너지 소모를 많이 하게 된다는... 구인을 자주 하는 경향이 있는듯
201,㈜링크프라이스,1184,성과급이라 내가 노력하지않으면 월마다 월급차이 심함. 젊은사람많아서 편가르기 심함. 영업자체가 힘든사람한텐 최악의직장임
202,㈜링크프라이스,1184,이상하리만큼 꼰대문화가 있는데 적응하다보면 괜찮기는 할것 같습니다.
203,㈜링크프라이스,1184,"월급이 너무 적다, 그만두는 사람이 많다, 평생직장으로 하기에는 인생이..."
204,㈜링크프라이스,1184,단순 보고를 위한 문서작업이 많아 비효율적 사내 정치 심하고 신입 퇴사율이 상당히높음
205,㈜링크프라이스,1184,"보고를 위한 보고가 많음, 사내정치, 이해안되는 인사가 있음"
206,㈜링크프라이스,1184,"처음 거래처 생기기전엔 무조건 콜만함. 콜센터 취직한 줄 알았음. 젊으려고 하는 분위기, 연차사용 눈치보임. 팀바이팅 본부바이본부 조금 심한듯."
207,㈜링크프라이스,1184,누군가에게 묻는것 보다 내가 직접 구글링 하는게 더 빨리 업무에 익숙해 질수 있는 지름길. 같은걸 물어도 사람마다 다른 답변이 옴. 계정이 생겨서 일이 바빠져도 무조건 영업하라고 강요해서 야근을 피할수가 없음. 그리고 야근 하면 업무시간에 일 끝내고 야근은 되도록 하지 말라함. 참고로 야근 수당은 없음.
208,㈜링크프라이스,1184,"여기서 2년동안 일하면서 온갖 질병이 다생김 사내정치가 매우 심함 간혹 나도 잘보여서 그들과 함께 할수있다 라는 생각은 버리시길 영업.관리 통틀어서 사내정치가 심하며 관리직은 연봉이 매우 짬 기존경력이 있음에도 도데체 언제적 연봉금액을 내미는건지 팀장급에서 관리직 직군 연봉을 후려치는데 성과급을 1년에 2번이나 준다고 하면서 절대 속지 마시길 지금은 2022년도예요 팀장님이 20대 일하던 연봉금액이 아니라고요... 디자인을 숫자화 시켜야 하는회사 윗대가리들이 실무를 전혀 모름 디자인을 어떻게 숫자화 시킴? 진짜 말도 안되는...건수밖에 더있음? 실무자들한테는 건수에 신경쓰지말라 하지만 나중에 또 말바뀜 성과급 줄때 되면 너희들은 마이너스 조직이야 그말 하기 전에 제작팀에 있는 월급 루팡 팀장이나 자르세여 그사람 줄 연봉으로 실무자 2명더 뽑아서 일이라도 원할하게 돌아가야져 내가 만약 디자인,영상,라이브쪽으로 취직 하고 싶다? 거기있는 팀장에 감정 쓰레기통 될 준비가되어 있으며 멘탈이 강하다 싶으면 지원하세요"
209,㈜링크프라이스,1184,열정이 사그러듬 답답함 비효율적 발전 없음 쓸데 없는 일 많이 시킴
210,㈜링크프라이스,1184,영업으로 시작해서 영업으로 마치는 점이 아쉬움. 광고마케팅적으로 입문하기는 좋으나 전문적으로 돌입하기엔 한계가 있다
211,㈜링크프라이스,1184,타이트하다 대신 업무적으로 배울 수 있는 부분이 많다.
212,㈜링크프라이스,1184,상여금이 장점이나 연봉협상때 상여금도 연봉에 포함이라는 말을 함 => 상여금은 나올수도있고 안나올수도있는건데 연봉이 오락가락 하는건가???
213,㈜링크프라이스,1184,직원들의 말에 귀를 잘 기울여 주시요!!!! 의견반영도 잘 해주시면 좋을것 같습니다 중간 휴식시간은 없애주십시요
214,㈜링크프라이스,1184,검색광고에만 몰두하는 경향이 종종있으며 새로운 플렛폼에 대한 이해도가 부족합니다
215,㈜링크프라이스,1184,전화영업이 주 업무인데 매출이 안나올경우 압박을 줍니다.
216,㈜링크프라이스,1184,협업 프로젝트를 진행해도 무조건 마케터중심으로 성과가 돌아감 충분히 알아보고 안된다고 하는데 하게 만들라고 하는 윗머가리 충분히 알아보고 서류올리면 나몰라라 하는 윗머가리
217,㈜링크프라이스,1184,"단순텔레마케팅으로 얻어걸리면 매출이고 쉽게 피이관당함, 신입들은 업무량 채우는 전화돌리기에 급급하게 만듦"
218,㈜링크프라이스,1184,초반에 영업 압박이 좀 있고 콜 영업이 주로 이기 때문에 적응하기 힘들 수 있습니다
219,㈜링크프라이스,1184,단순 보고를 위한 문서 작업이 너무 많음 업무 분야가 너무 좁아서 이직할때 난감할수도 있음
220,㈜링크프라이스,1184,본부장에 따라서 복지가 달라짐. 어느 본부장은 연차 프리패스지만 어느 본부장은 월금 연차 시에 눈치 겁나 줌
221,㈜링크프라이스,1184,보고해야 할 내용이 다양하고 그것을 다 하기까지 준비해야 할 과정들이 많습니다
222,㈜링크프라이스,1184,반대로 영업을 잘 못하면 몇안되는 고객관리에 야근에..이것저것 힘듬
223,㈜링크프라이스,1184,지순실 아래에 고통받는 회사임 다른것은 표현 불가 지순실로 하여금 좌지우지 되는 회사 사내 쉬는 시간이 있으나 쉬지도 못함
224,㈜링크프라이스,1184,일자체가 힘듭니다. 운도좋아야하고 본인이 하고자하는 의지가있어야함
225,㈜링크프라이스,1184,"업계 인센율 최하위, 사내 정치 심하고 무능력한 상사들이 관리직을 하고 있음"
226,㈜링크프라이스,1184,무조건 콜영업만 시키고 쓸대 없는 일을 너무 시켜서 그냥 기계 같다는 생각? 너무 많음
227,㈜링크프라이스,1184,못하면 급여가 200밖에 못 받아 힘들다 그리고 영업 압박이 있다
228,㈜링크프라이스,1184,반복 업무 및 내가 하고 있는 업무가 어떤건지 잘 모르겠음
229,㈜링크프라이스,1184,"광고주 영업자체가 힘들고 업무시간엔 영업, 그후에 관리해야한다는게 현실적으로 힘들음 타회사 대비 돈 적게벌음"
230,㈜링크프라이스,1184,연봉은 낮은 편입니다 그래서 좋은 환경 커리어 쌓기도 좋고 눈치없는 연차가 있지만 이게 제일 크게 다가옵니다.
231,㈜링크프라이스,1184,영업말고 특별히 뭘 하는지 모르겠음 영업만으로 굴러가는 회사 ?
232,㈜링크프라이스,1184,"회사에서 업무에 대한 지원이 없음, 광고주에 대한 스트레스, 업무 프로세스 취약"
233,㈜링크프라이스,1184,"그냥 광고관리, 마케팅 이란 단어만 보고 가시면, 크게 실망하실겁니다. 매출이 1억이상은 되어야 광고관리가 의미가 있고, 그 이전까지는 대부분 그냥 텔레마케터랑 다를 바가 없습니다."
234,㈜링크프라이스,1184,대표님 얼굴을 한 번을 못 본다는 거...? 연말까지 버텼다면 볼 수 있었을까요...아쉽네요.
235,㈜링크프라이스,1184,"- 발전성이 없는 고인물 회사, 회사 개선의 의지가 없어보임 - 2030이 모여있는 회사치고 너무 올드함. 휴가 전자결재를 올해부터 시행함 - 오직 검색광고 검색광고 검색광고"
236,㈜링크프라이스,1184,인센율이 너무 짜서 의욕이 생기지 않음. 그걸 경영진이 모름.
237,㈜링크프라이스,1184,"내부적으로 실적압박 스트레스, 웃으면서 압박하기, 개인 전화기는 이미 엄청난 스팸처리로 인한 업무 어려움"
238,㈜링크프라이스,1184,"1. 친구 한명쯤은 만들어갈수있지만 우선적으로 상대적으로 연차들이 다 어려서, 남녀가 밥만먹어도 사내에 소문이 쫙퍼짐. 이것들을 관리직들이 먼저 주도함. 2. 동종업계 경쟁사에 비해 발전 및 비전이 느리며 과거 쌓아두었던 영광들에 아직도 취해있는 회사 3. 워라밸이 절대 있을수가없음(돈을 많이 받으려면) 야근강요는 안한다지만 안하면 살아남을수없는 회사 4. 관리직눈에 찍힌다면 그 자체로 관리직들사이에서 소문이 쫙퍼지며, 굉장한 눈치를 볼수밖에없음 5. 사람을 사람으로 보지않고 기계로 봄. 무슨 말이냐면 사람마다 업무 능력 및 업무 도달률이 다를수밖에없는데 그런건 신경쓰지않고 지속되는 빡센 강도로 사람을 몰아붙임 6. 관리직이 왜 있는지 모르겠음. 신입때부터 업무는 대부분 2~3개월 위의 선배가 알려주는 편이며 관리직들은 본인의 업무로 바쁘다며 알려달라고하면 신경질까지 냄(관리직들은 후배연차를 도와주기 위해 뽑히는 시스템이다) 7. 교육때와는 너무 다른 실무. 교육때는 쓸데없는 희망(대부분 연봉이 높다. 대부분 정규직 된다 등)을 얘기하지만 신입들의 퇴사율은 120%. 그리고 교육때 배우는 영업스킬은 대부분 도움이안되는 경우가 많음 8. 복지시스템 매우 부족."
239,㈜링크프라이스,1184,"영업을 퇴근 전인 6시반까지 시키는데 관리는 언제하라는건지,,,, 야근 필수인 회사"
240,㈜링크프라이스,1184,"특정 인물 몇 명의 업적 밀어주기 및 상하간의 의사소통 부재, 특정 인물 몇명 밀어주기의 경우 이 리뷰 참고하는 재직자들은 다 알것이고, 수직적 업무전달 분위기로 영업회사 치고는 경직되어있음. 영업직이든 관리직이든 사내 브레인들이라 일컬여지는 소수 사람들이 개고생하는 분위기(정치질의 문제일수도 있음)"
241,㈜링크프라이스,1184,광고 영업/관리 모두 해야하므로 업무강도가 높은편 영업직군이다보니 입퇴사율이 높음
242,㈜링크프라이스,1184,아무래도 전화영업이 많다보니 전화공포증이 있는 사람들은 다소 이겨내야 하는 것들이 있습니다. 식대가 나왔으면 더 좋았을 거 같습니다.
243,㈜링크프라이스,1184,광고 영업 및클라이언트 수주에 대한 압박이 심해보이는 것
244,㈜링크프라이스,1184,영업업무가 주다보니 일안할때 직원들 진짜 조용하고 분위기가 다운 쉬는 시간은 정말 각자 보냄
245,㈜링크프라이스,1184,"영업으로 먹고 사는 회사라, 자기계발 따윈 없으며 그럴 기회도 없이 영업전선에 계속 내몰림. 그 외의 업무는 영업을 위한 들러리같은 포지션임. 운이 좋아서 영업이 잘 되면 꿈도 못 꾸던 고액연봉을 어느정도 받을 수 있지만, 운이 나쁘면 원점으로 돌아갈 것이며 영업 이외의 포지션이라면 입사를 만류하고 싶음. (발전가능성이 없음)"
246,㈜링크프라이스,1184,단점은 다양하다 전형적인 영업 회사 매출의 압박 당대 꼰대 마인드의 임직원
247,㈜링크프라이스,1184,조직문화가 답이 없다. 끝도 없는 라인타기를 경험해볼 수 있는 곳.
248,㈜링크프라이스,1184,연차는 최소 일주일 전 신청해야하며 이틀 이상 연차 사용 불가. 담배냄새 심함. 정치정치정치정치정치정치.................
249,㈜링크프라이스,1184,매출 압박 심하고 돈 짭니다. 팀장 그룹장들의 갑질이 심해 보임. 욕설을 주고 받는것도 보았네요
250,㈜링크프라이스,1184,솔직히 사람대 사람으로 부딪히는 거는 있었으나 기업의 단점은 딱히 없었음 내가 하는 만큼 벌어가고 야근 안하고 하는 거 같음
251,㈜링크프라이스,1184,영업만을 가르치기에 온라인광고에 대해서 아는데 한계가 있어 광고주에세 어필할 수 있는 것이 매우 제한적임
252,㈜링크프라이스,1184,그만큼 압박이 심함 영업직 대우가 별로임 라인타는게 심함
253,㈜링크프라이스,1184,마케팅 업무보단 콜 업무가 많은편 늦은 퇴근시간. 복지가 조금 부족하다고 생각
254,㈜링크프라이스,1184,영업에 대한 압박. 광고 회사인지는 조금 의문점이 드는건 사실
255,㈜링크프라이스,1184,"교육과정이있으나 막상 실무에 들어가면 그냥 맨땅에 헤딩식으로 배우면서 해야함, 인센제다보니 급여인상률의 확률이 높은만큼 하락률의 가능성도 언제나 있음,업무초기 6개월-1년 혹은 그 이상 전화영업을 해야함. 늘 불안함을 달고 사는 업임."
256,㈜링크프라이스,1184,퇴근시간 7시. 전문 경영인의 부재가 느껴짐. 회사의 체계가 없이 라인따라 성장 여부 달라짐.
257,㈜링크프라이스,1184,연차사용도 자유롭고 뭐든 다좋으나 모든 장점은 매출이 좋은사람에게 적용됨 비교도 심하고 야근은 뭐 일상임
258,㈜링크프라이스,1184,영업 압박이 너무 심함 영업에도 종류가 많은데 콜수에만 집착하는 경향이 있음
259,㈜링크프라이스,1184,"복지제도가 많은 것 같지만 실제로 크게 없음, 영업회사, 따로 쉬는시간이 없어서 불편함"
260,㈜링크프라이스,1184,영업이기 때문에 전화로 말을 잘 못하시는 분들은 어려움이 많다
261,㈜링크프라이스,1184,온라인마케팅이라하고 전화영업을 진행하게 됨으로써 100%인센티브제도
262,㈜링크프라이스,1184,"회사 매출 지키려고 상식 벗어난 행동을 많이함 , 텔레마케팅 영업 외엔 배울 수 있는게 없음 비전이 없음"
263,㈜링크프라이스,1184,장점 빼고 모든게 단점. 마케팅이라 쓰고 영업이라고 읽는 회사. 현 시대에 뒤떨어짐. 매일 매일 압박에 시달려야함.
