,company_name,company_id,review_text
377,㈜링크프라이스,1184,온라인마케팅을 배우러 가려는 사람은 정말 비추 배울게 없음  그냥 말로 전화영업잘해서 광고주 데려오면 만사 오케이인곳 실력 이런거 필요 없고 정말 운임. 그냥 100통 걸어서 한명 걸려라 식으로 내가 얼마나 운이 좋은가 테스트해볼수 있음 운좋게 대형 광고주 걸리면 신입이여도 월급 많아질수 있으나 광고주가 떠나면 연차가 아무리 많이 되도 갑자기 월급이 신입 수준으로 떨어짐   영업 성과 안나면 퇴사 압박들어옴 거의 90프로가 흡연자여서 비흡연자는 따로 쉴시간도 없으며 나이대가 어려서인지 친목다지고 가십거리가 끊이지 않고 기빨림
378,㈜링크프라이스,1184,팀마다 케이스바이 케이스로 연차쓰는게 눈치보이는 팀이 있음
379,㈜링크프라이스,1184,매출잘나오다가 타업체에 뺏기거나 못나오면 핀잔심함. 더가져오라고 압박줌 뒤처지는순간 1분1초가 숨막히고 헤드폰붙잡고 내가뭘하고잇나생각됨
380,㈜링크프라이스,1184,형편없는 월급 일단 기본급이 없기 때문에 내가 영업에 성공하지 못한다면 받아가는 돈은 일절 없다 고정적인 월급을 원한다면 이 회사는 그 기준에 걸맞지 않는다
381,㈜링크프라이스,1184,사람을 부품으로 보는 회사 일하면서 존중받는다는 느낌은 절대 가질수 없음
382,㈜링크프라이스,1184,회사이기 때문에 상하체계가 잡혀있긴 합니다. 퇴근 시간이 일정하지는 않습니다.(30분 내외 변동가능) 영업직이라서 불편한 사항은 있기는 합니다.
383,㈜링크프라이스,1184,"처음 입사하고 대부분은 계속해서 전화 영업을 하기 때문에 마케터로 생각하지 않고, 영업이 맞지 않는다면 힘들 수 있다."
384,㈜링크프라이스,1184,"업무 시간 동안은 터치가 별로 없지만 각 타임 마감이 되면 압박이 심해짐. 특히 신입들은 TM업무가 80% 이상은 된다고 할 수 있는데, 이 TM에 대한 업무량이 미달되면 그 때 부터 사람을 압박하기 시작함. 어차피 다 나에게 득이 되고 필요한 일들이라고 생각할 수 있지만 이런 압박이 시작되는 순간부터 1분 1초가 스트레스가 될 것임. 그리고 성과로 사람을 판단하는 직종이기 때문에 성과가 좋은 사람과 저조한 사람의 대우가 너무 차이남. 똑같은 신입이라도 2주 정도만 지나면 성과의 차이가 날 수 밖에 없는데 좋은 사람에게 하나 더 챙겨주고 알려주려는 반면, 저주한 사람은 약간의 칭찬은 커녕 핀잔을 줌. 이게 들어온 지 일주일 된 사원이 겪는 일들임. 아무리 사회생활 이라고는 하지만 냉정해도 너무 냉정함. 솔직히 영업 자신 없고 돈에 대한 욕심 없으면 절대 추천하지 않음. 아무리 TM이라지만 영업이 만만한게 아니라는 걸 이번 기회에 뼈저리게 느낄 수 있었음."
385,㈜링크프라이스,1184,실상은 답이 없음. 채용할땐 영업도 중요하지만 관리도 중요하다 하지만 실상은 관리를 왜 해? 영업이나 해라고 하고 광고주가 계약 해지하면 뭐라하고 퇴사하면 이것 저것 간섭하며 회사 광고주 빼간다 의심되면 고소함
386,㈜링크프라이스,1184,하루 종일 전화 영업이라 실적 압박이 있다. 영업 못하면 월급도 적음.
387,㈜링크프라이스,1184,"업무 특성상 칼퇴 어려움, 임원들 기분파 , 자기들 멋대로 직급줫다가 뺏고 회사내 서로 뒷담화도 심함"
388,㈜링크프라이스,1184,사람에 따라 가치관이 확고 해야하는 직업이라 그런지 배움에 있어서 혼선이 많고 전화영업 스트레스가 심함
389,㈜링크프라이스,1184,라면이 공짜인만큼 야근하는 분들이 많습니다 아무래도 자기가 하는 만큼 벌어가는 곳이라
390,㈜링크프라이스,1184,분위기가 조금은 적응이 안됩니다 사이좋게 잘 지내려고해서 좋아요
391,㈜링크프라이스,1184,영업압박. 하루에 콜수 채워야함. 매출1500안넘으면 퇴사시킴. 힘들다.
392,㈜링크프라이스,1184,부서간 업무 협조가 원활하게 이루어지지 않음 어느 부서장이 더 파워가 쎈가에 따라 달림 업무 역량이 부족한 직원들이 제법 많음
393,㈜링크프라이스,1184,수많은 시행착오를 겪어야 하며 직원들에 대한 대우가 학교 같은 곳. 대표가 원하면 다 하는 곳.
394,㈜링크프라이스,1184,"20대들이 대부분이라 말이 너무많아요~그리고 공장처럼 콜수 콜타임 쪼으고, 잘하는 선배에게 모든 계정이 돌아가는 회사입니다."
395,㈜링크프라이스,1184,중소기업으로서의 그냥그런 단점을 가지고 있다 야근강요는없지만 야근이 많다
396,㈜링크프라이스,1184,아무래도 영업직이고 바로 실전에 투입되다 보니 멘탈이 나가는 부분이 많은데 팀원들을 잘만나야 이러한 스트레스가 없이 멘탈케어가 가능한것 같다 아무래도 개인 영업이다보니 신경을 덜 받는것도 사실
397,㈜링크프라이스,1184,자신이 해야하고 처음에 장벽이 너무 높다고 생각합니다. 너무 힘들거 같아서 나왔습니다.
398,㈜링크프라이스,1184,업무 특성상 초반엔 영업을 해야하는데 압박이 심하다 그래서 퇴사율도 높은듯 그리고 연령대는 젊지만 은근 눈치줌
399,㈜링크프라이스,1184,영업직 너무 힘들다 군대식이다 엄청 쪼아댄다 인센티브율이 낮다 다른회사에비해
400,㈜링크프라이스,1184,나쁘지않은게 단점입니다 업무가 힘들고 스트레스 좀 받습니다 멘탈좋으신분 오십쇼
401,㈜링크프라이스,1184,"신입들은 야근을 할수밖에 없는 업무구조, 불필요한 업무를 억지로 시키는 일이 종종 있음"
402,㈜링크프라이스,1184,텔레마케터같이 변질될수있는느낌 회사에선 그걸 최대한 막으려함
403,㈜링크프라이스,1184,하루 콜수 채우는 게 있는데 상당히 어렵고 영업 따느라 기존 고객 관리가 힘에 부침
404,㈜링크프라이스,1184,"출근시간은 9시이지만...야근 도 자주 있고, 야근수당은 미지급이며, 연차수당에 냉정하고 냉철합니다."
405,㈜링크프라이스,1184,텔레마케팅이라서 전화를 지속적으로함. 하루 100통이상 채워야함
406,㈜링크프라이스,1184,텔레마케터 느낌이 강하여 마케터 느낌보다는 영업 및 전화업무가 많음
407,㈜링크프라이스,1184,신규 업체 컨택부터 관리까지 모든 업무를 혼자 해야되는 부분이 있기 때문에 주말 및 야근 할 수 밖에 없는 업무
408,㈜링크프라이스,1184,곳곳에 빌런이 있어 업무 진행 방해 담당 (반복적인 비효율) 경영 마인드는 좋지만 지원하는 부서 서포트가 부실해 다깎아먹음
409,㈜링크프라이스,1184,업무압박심함 정해진 콜수못채우면 압박함 3개월내에 매출 1500못찍으면 정규직전환불가
410,㈜링크프라이스,1184,"연봉보다 인센티브에 의존하기에 월급이 매월 바뀌는 불안정성이 있다. 전화업무가 많아서 맞지 않는 사람들이 퇴사를 많이하고, 그만큼 신입도 많다."
411,㈜링크프라이스,1184,전화영업 시스템이 정해진 콜수랑 콜시간을 맞춰야했는데 이런 업무 스타일이 나와는 맞지 않아서 스트레스를 받음
412,㈜링크프라이스,1184,기본급여 엄청작고 나머진 인센티브제라서 많이버는 사람은 잘 벌음. 단 영업을 잘해야 하고 야근 잦음
413,㈜링크프라이스,1184,말했다시피 일한만틈 벌어가는곳 일이 많음 이것저것 뭐가 되게많음 콜 영업이라 콜 많이해야됨
414,㈜링크프라이스,1184,사내문화와 인사관리에 대한 지적이 제일 많을것 같은데 견디기 힘든정도는 아님
415,㈜링크프라이스,1184,"젊은 연령으로 이루어진 조직이지만 일하는 방식은 전혀 젊지 않음(꼰대문화) 회사에서 기본적으로 제공해야만 하는 것들을 우리회사가 좋은회사니 제공하는것이다라고 말하는 그 어느 회사에서도 보고,들어보지 못한 무지함과 오만함이 있는 곳"
416,㈜링크프라이스,1184,영업을 잘해야함 콜 채워야하고 신입들의 정착률이 낮음 1년 버티기가 쉽지않고 잘하는사람들만 잘함
417,㈜링크프라이스,1184,업무를 다방면으로 모두 해야 해서 일의 우선 순위를 정하기 쉽지 않다. 성과제라 스트레스가 크다.
418,㈜링크프라이스,1184,"영업의 압박, 마케터인데 직무는 영업직군? ,회사규모가 작지 않은거같은데 인력이 영업직군에만 몰빵되어있고, 서로가 서로의 급여를 알게하는 것 또한 문제라고 생각"
419,㈜링크프라이스,1184,꼰대문화가 아주 깊어서 지나갈때마다 마주치는 모든 사원과 인사해야합니다
420,㈜링크프라이스,1184,어마어마하게 아무런 장점이 없다는게 단점 업무는 퇴근후에 해야되고 주말에 일은 당연한거 휴가또한 존재하지만 휴가에도 일을해야되는 워라벨
421,㈜링크프라이스,1184,승진 맘대로임 남자들 특히 마음에 들면 승진 시킴 군대문화 심하고 술 회식 많음 회사 사람들끼리 서로 말이 많고 편가르기 함
422,㈜링크프라이스,1184,"외근 압박 심함, 위에서 편가르기함, 회식 너무 많음, 회의 너무 많음,"
423,㈜링크프라이스,1184,첫 사회생활로 크게 나쁜점이 없다 뿐이지 그 외에 나머지도 별로인듯싶음
424,㈜링크프라이스,1184,전화영업이고 실적압박이 있음.한달매출1500만원이상안되면 정규직 못된다
425,㈜링크프라이스,1184,우물안 개구리처럼 광고주대하는 태도가 글러먹은 관리직들로 정말 마땅한 관리체계 프로그램도 없음
426,㈜링크프라이스,1184,아무래도 영업관련해서 텔레마케팅 하는 것이기 때문에 실적이 없으면 급여가 높지 않다. 영업쪽에 재능이 없다 생각이 들면 비추천.
427,㈜링크프라이스,1184,단순 콜영업 이기 때문에 처음에 힘들 수 있고 관리직 대부분이 꼰대들이 많아서 저사람이 어떻게 관리자가 됬지 라고 생각이 드는 사람들이 많다 회사 분위기도 그들때문에 최악이다
428,㈜링크프라이스,1184,어딜가나 회사가 그렇겠지만 단점은 딱히 없음 업무에대한 책임감이 강해야되는정도?
429,㈜링크프라이스,1184,연봉이 그렇게 높지 않은 수준에다가 야근을 매우 많이 시킨다는 것을 알수 있으며 일의 강도가 매우 높은편에 속한다
430,㈜링크프라이스,1184,케이스바이케이스이긴하지만 업무가 과중할때가 많은편. 체계가 좀 더 잡혔으면 함.
431,㈜링크프라이스,1184,"같은 일을 계속적으로 반복하는데 있어서 받는 스트레스가 존재하고, 담당 업체와의 관계 속에서 받는 스트레스도 큰편."
432,㈜링크프라이스,1184,"야근이 필수적임. 평소 시간에는 영업을 해야해서 관리를 못하기때문에 야근, 점심시간, 쉬는시간에 밀린 업무를 해야함. 하지만 야근수당은 없으며, 일을 미리해놓아서 칼퇴를 자주하니 팀장이 눈치를 줌. 영업을 굉장히 빡쎄게시킴."
433,㈜링크프라이스,1184,팀장급 본부장급 들이 굉장히 간섭이 심함 일을 못할정도 매출에대한 압박감을 굉장히 심어주고 퇴사요구를 돌려서 말하기까지함 엄청나게 많은 지원을 해주지않음
434,㈜링크프라이스,1184,쓸데없는 보고 체계가 있음. 영업직이다 보니 안정성은 떨어짐. 관리자 직군에 대한 배려가 아쉬운 감이 있음
435,㈜링크프라이스,1184,화장실 소음이 복도에서 다 들려서 민망한것같다.. 면접대기실 환경이 엄청 좋진 않은것 같고 퇴사율이 높다.
436,㈜링크프라이스,1184,유도리가 1도 없음 신규 가지고 오라해서 영업 집중 하면 왜 영업에만 집중하냐며 관리는 안하냐고 뭐라하고 참...
437,㈜링크프라이스,1184,야근눈치 매출 압박감등등 머리아플수도 잇을거같음. 못벌면 기본급만 받아가며 야근하며 전전긍긍 할수도 있을거같다는 생각이듬.
438,㈜링크프라이스,1184,"점심을 제공하지 않음, 매 주 새로운 사람들이 면접을 보러옴, 영업을 기반으로 이루어지는 업무"
439,㈜링크프라이스,1184,채용이 주기적으로 이루어지며 인원이 계속 바뀌는 부분이 있습니다.
440,㈜링크프라이스,1184,광고 관리만 하고 싶어 하는 사람이 하면 비추천! 일의 90은 영업
441,㈜링크프라이스,1184,어쩔수없는 야근이 많고 전화업무다보니 감정노동임 하루하루 힘듬 전화량이 업무량임 어느정도 자리 잡힐때까지 고생을 해야함
442,㈜링크프라이스,1184,업무량 과부하걸림 월급이 짬 불필요한 곳도 청소도 해야됨 텃세있음 일적으로 상관없는 부분까지 신경써야함 꼰대있음 초면에 인사팀 직원의 언행이 무례함 장난합니까? 맘에 안들면 애초에 채용하지 마세요.
443,㈜링크프라이스,1184,"비효율적인 업무체계가 불만입니다. 경영진이 비전을 잘 제시해주어야 할 것 같습니다. 실무진들에게 도움이 되지 않는, 쓸데없는데 시간을 쓰는 경우가 많습니다."
444,㈜링크프라이스,1184,관리직 팀장들 멍청한 수준의 일머리로 일만 벌려서 아랫사람겁나 힘듬 특히 제작쪽은 절대 들어오지 마시길
445,㈜링크프라이스,1184,"단점은 영업전화로 인해 스트레스가 높음, 멘탈이 강하지않다면 입사 안하는걸 추천 욕 많이 먹는 편이며, 키워드광고 외 없음, 업무외 자기개발을 통해 공부해야함"
446,㈜링크프라이스,1184,젊은 층이 많은것. ㅎ_ㅎ .. 그리고 TR로 시작해서 팀으로 배정되는데.. 팀에서 날 채택하지 않으면 한달 ..두달.. 계속 TR팀에 남음.. ㅋㅋ.. 그것도 한두달이지 계속 신입 들어와서 눈치봄... 팀으로 자율배정 아님.. 팀에서 날 픽해야 팀으로 갈 수 있어용.(외모도 실력에 포함^^)
447,㈜링크프라이스,1184,"영업하는 회사는 분위기가 매우 중요하다 생각함(나뿐만 아니라 영업조직에 몸담아본 사람은 모두 공감할것임) 젊은층이 주를 이룸에도(20대 팀장다수) 깊게 박힌 군대식문화(형, 오빠 호칭시 갈굼먹음) 광고영업은 전화수단으로 영업을 함에도 불구하고 사무직보다 더 조용한 사내 분위기. 영업조직은 텐션자체가 높고 그래야만 하는데 분위기 자체가 굉장히 퇴폐적임. 과연 이곳이 영업을 하는 곳인지 일반사무를 보는 곳인지 구분이 힘듬. 영업은 자기 feel대로 하는것이지 주입식 교육으로 가르치는것이 아님(이점을 회사에서 모르는것 같아서 안타까움...)"
448,㈜링크프라이스,1184,"사람이 우선되진 않음, 영업회사이기에 매출이 최우선 마케팅? 크게 의미 없음. 영업 능력만 중요"
449,㈜링크프라이스,1184,광고나 홍보업무를 한다기 보다는 텔레마케팅 업무입니다. 처음 갔을 때 좀 당황할 수 있습니다. 그리고 영업 일이 맞지 않으면 생활이 되지 않을 급여이며 영업이기때문에 실적에 대한 압박과 스트레스가 있을 수 있습니다.
450,㈜링크프라이스,1184,월평균 연봉 3000천 이상은 다들가져가는거 처럼 얘기하지만 3천 미만으로 가져가는 사람들도 많이 있어요 기본급이 좀 낮아서 실적이 없으면 월급진짜 적게 가져가요
451,㈜링크프라이스,1184,"상사로부터 업무스트레스를 많이 받는 직장 중 하나이며, 회사 또는 팀내에서 매일 정해진 업무(call)를 완료하지 못하면 광고관리 및 기존 광고주들과의 소통이 어렵기 때문에 야근이 필수이다."
452,㈜링크프라이스,1184,본인이 영업한걸 관리하는게 주 업무. 초반 연봉이 낮고 본인이 따온 영업과 DB가 쌓이기 전까지 연봉 기대가 힘들다. 오랫동안 남고 운이 좋으면 높은 연봉을 기대할 수 있음.
453,㈜링크프라이스,1184,마케팅 광고를 관리해주는 회사로서 고액 광고주만 우선하며 500만원 짜리 광고주가 떠나가면 천만원 짜리 광고주를 영업하라는 식의 영업에만 집중을 하고 광고관리 측면에는 전혀 관심을 가지지않음.
454,㈜링크프라이스,1184,정직원이 되기전에 교육기간이 다소 길다고 느껴졌음. 온라인 영업을 하기위해 하루종일 전화만 붙잡음
455,㈜링크프라이스,1184,"주 업무가 전화 업무라는 점.. 전화 받고,하기가 힘든 사람이라면 오래 못다닐거같다,"
456,㈜링크프라이스,1184,거의 대부분 팀장급들이 로직을 모르는 경우도 많음 그냥 영업만 잘하면 장땡
457,㈜링크프라이스,1184,콜수. 영업숫자와 매출에 대한 압박이 종종들어올수도있다.
458,㈜링크프라이스,1184,"영업의 특성이 짙고 퇴근 후나 주말에도 업무 있음,영업능력이 부족한 경우 일정기간 이후에는 고정급이없으므로 월급이 왔다갔다하며 하는업무가 주로 고정됨"
459,㈜링크프라이스,1184,"복지는 나름 잘 되어있으나 자격이 되어야 얻을수 있음, 마케팅, 광고, 영업 여러가지를 배울수 있으나 처음에는 광고주를 얻기위해서 수많은 전화영업을 해야한다는 것."
460,㈜링크프라이스,1184,오후 시간에 30분 휴식시간이 있지만 그만큼 30분 일찍 출근해야함
461,㈜링크프라이스,1184,전화영업으로 매출관련 눈치주는게 많음. 많은 사람이 입사하고 교육받으나 아웃바운드 전화영업으로 맞지 않는 사람이 빨리 나가는 등 버티는 사람이 많지 못함
462,㈜링크프라이스,1184,"사원끼리 경쟁붙이는 데 능하고 목줄잡고 흔듦, 밤새서 일해 받는 보상은 본전이라는 느낌, 경력에 도움이 안 될 것 같음, 사원이 엄청 자주 바뀜, 동기 여러 명 중에 일년 반 이상 다닌 사람이 한 명 뿐, 체계 없고 말 없이 갑자기 일정 진행해서 짜증남, 젊은 사람들이 많아 다들 사이 좋아보이지만 일진놀이 하고있음, 성희롱 쩌름"
463,㈜링크프라이스,1184,업무 적응 시간이 조금 걸림 신규 채용 시 키워드 사업팀과 본사를 혼동하는 경우가 많음 키워드 사업팀은 말그대로 키워드 영업팀이고 본사는 흔히 아는 브랜드들과 커뮤니케이션을 통해 업무를 진행하고 있음
464,㈜링크프라이스,1184,단순 보고를 위한 보고 미팅을 위한 미팅 등 불필요한 미팅이나 보고가 많은 편
465,㈜링크프라이스,1184,본인과 맞지 않으면 모든게 다 단점으로 보임. TM특성상 동료들과 자주 비교가 됨. 본인이 결국 지쳐 떨어짐
466,㈜링크프라이스,1184,바이럴 마케팅의 경우 제휴된 회사의 존재 유무가 중요한데 주로 이용하던 제휴사가 갑자기 없어져 경력이 어느정도 있다면 직접 제휴 맺으시는걸 권함
467,㈜링크프라이스,1184,매출을 많이 할수록 일이 많아짐. 개인시간이 많이 사라짐. 다만 주 5일제
468,㈜링크프라이스,1184,문화가 너무 낮고.. 영업 압박 있습니다ㅠㅠㅠㅠㅠㅠ 그냥 전화받고 면접본 것이 잘못이네요 ㅠㅠㅠㅠ
469,㈜링크프라이스,1184,업무량과 성과 미달 시 안정성 불안 TM 업무 적성에 맞지 않으면 업무 적응도 현저히 떨어짐
470,㈜링크프라이스,1184,몇개월 지나면 기본급+인센티브라서 버는사람만 돈을 범 인센률 적어서 130만원으러 생활해야함
471,㈜링크프라이스,1184,온라인마케팅 특성상 영업과 관리를 같이 합니다. 또한 영업과 관리를 같이해야되기때문에 생각보다 해야되는 업무들도 많으며 하루업무시간안에 다끝내지못하는경우도 발생하여 야근도해야도는경우도 있으며 개인적으로 연락을 하며 처리해야되는경우도 있어서 회사일이 퇴근후에도 이어지는 느낌이 강합니다.
472,㈜링크프라이스,1184,업무량이엄청남 압박도엄청나게줌 하루에 콜수못채우면 불려가서 혼남
473,㈜링크프라이스,1184,철저히 실적위주로 이루어짐. 면접 때 업무이 대해 상세한 안내가 필요
474,㈜링크프라이스,1184,모든것이 단점이라고 생각되는 회사 사람이 모두 기계로보고 여기는 회사
475,㈜링크프라이스,1184,영업을 잘하는 사람만 대우받고 인정 받음. 열심히하고 성실한건 필요없음. 무조건 영업만 잘하면 됨.
476,㈜링크프라이스,1184,능률이오르는게 더딘사람은 아무리 초반에 평가를좋게받아도 안좋은평가를받음
477,㈜링크프라이스,1184,아무래도 영업이라는게 큰 단점. 실적 눈치도 봐야할수 잇음
478,㈜링크프라이스,1184,흡연실이 있는데 비흡연자여서 그런지 밖에서 피고 왔으면..했다.. 담배냄새 괴로운데 흡연자가 많아서 ... ㅠㅠ 그리고 제일 충격받았던게 교육일주일하고 사무실에 들어가는데 거기서 이력서보면서 전화돌리는거 충격먹음...
479,㈜링크프라이스,1184,"콜수, 콜시간에 시달려야 하고 윗분들이 엄청 쪼아댐. 퇴근 절대 못하고 비전이 없음. 2012년 다음 네이트 한군데 기억안남. 무튼 3사포털사이트에서 스폰서박스&스폰서링크 광고주들한테 계약하게 하고 마진띄어먹음 개개인이 개노력해서 해야하고 본인한테 떨어지는 마진은 0.3%엿나? 무튼 노답.."
480,㈜링크프라이스,1184,"회사말로는 텔레마케터가 아니라고 하지만 실제적으로는 텔레마케터 하루 업무량있음(업무량 못체울시 패널티, ex)야근, 자리이동 등등), 매출 압박이 심함. 업무시간에는 무조건 영업만 해야하고 그외 관리는 퇴근후 -> 무조건 야근을 강요하는 회사"
481,㈜링크프라이스,1184,콜수제한 있고 못채우면 되게 쪼아댄다고 해야하나.. 무튼 굉장히 억압적이었음
482,㈜링크프라이스,1184,급여가 많지않습니다. 아무래도 인센제이기때문에 급수를 체우기가 여간힘든 것이 아닙니다. 기본급의 인상도 대폭 늘어난다면 좀더 원활환 근무환경이 될것같습니다.
483,㈜링크프라이스,1184,콜수못채우고 광고주 못따오면 사람대우 못받음 8시간 초과근무하는 회사 야근강요는 없지만 야근을 해야 그날하루의 일을 끝낼수있는 회사
484,㈜링크프라이스,1184,"회사가 갑자기 성장해서그런지 별 시덥잖은 취합, 쓸대없는일은 많이시킴 어차피 내 인센티브가 줄어드는데 왜케 시키는게많고 뭐라고하는지 모르겠음"
485,㈜링크프라이스,1184,"장점으로 성장하고 있는 회사라 했지만, 그렇기 때문에 유동성이 굉장히 심하며 틀이 안 잡혀 있다. 따라서 업무에 비효율적인 부분이 상당하며, 개개인에 할당된 업무량이 많기 때문에 압박이 심한 편."
486,㈜링크프라이스,1184,"하루종일 콜 해야함. 콜 수 콜 타임 따지고, 성과제라 개인 업무량과 성과가지고 압박을 조금 심하게 줌"
487,㈜링크프라이스,1184,사람이 너무 많고 그래서 부딪히는 일이 왕왕있어 피곤할 수 있으나 다 본인하기 나름
488,㈜링크프라이스,1184,업무가 간혹 너무 힘들다고 생각이 들때가 있다 그리고 하는 일에 비해 급여가 작다는 생각이 든다...
489,㈜링크프라이스,1184,열정만있으면 되지만 반대로 열정이 없으면 그냥 다닐 필요가 없는 회사 열정없는 사람은 퇴사강요 느낌을 받을수도 있다
490,㈜링크프라이스,1184,"사원들을 더 생각해주시고 프로세스를 명확하게 해주셨으면 합니다, 명확한 체계도 없고 가끔식은 대학교같음"
491,㈜링크프라이스,1184,"말도안되는 트집잡으며 꼰대짓하고 술먹이는 윗선 한두명 때문에 일 외적으로 힘듭니다. 그리고 사람이 빨리 들어오고 빨리 나가서 업무 인수인계가 너무 잦구요, 업무 인수인계라고 해봤자 그만두는 사람 광고주 몇명 더 추가되는 것 밖에는 없지만.. 일단 무조건 매출이 중요합니다. 영업, 영업, 매출, 매출.. 특히 아웃바운드 텔레마케팅으로 영업을 진행하기 때문에 하루종일 전화 돌려야하고 갖은 싫은 소리 다 들어야하고 어렵게 잡은 광고주 진심을 다해 관리해주고 싶어도 그럴 시간이 없습니다. 왜냐면 잡은 물고기는 나의 매출을 올려주는 물고기일뿐 하루에 콜 수량, 콜 시간, 매출을 체크해서 매출에만 사력을 다하는데 잡은 광고주 관리를 할 수 있을까요?"
492,㈜링크프라이스,1184,"매출, 숫자 로 사람을 판단하는 경우가 있음, 쓸데없이 취합하는 일들이 많고 일부 관리자들이 융통성이 없음."
