,company_name,company_id,review_text
264,㈜링크프라이스,1184,"회사 규정상으로는 내부 영업 금지를 원칙으로 내세우고 있지만 현실은? 그런 거 없다. 그냥 가져오면 자기꺼 된다. 내부 영업한 사람에 대한 패널티,벌점,제재 하나도 없다. 억울함을 호소해도 해결이 되지 않는다. 선빵필승이다. 돈으로 엮인 관계들 밖에 없다. 팀워크에 대한 환상을 가질 수 없는 곳이다."
265,㈜링크프라이스,1184,라면을 좋아하는 사람이라도 도망가는 회사입니다 열심히 하면 된다고 하는데 접시에 코박고 일하라는 소리에요
266,㈜링크프라이스,1184,실무를 모르는 상사 때문에 일을 빙글빙글 돌려서 함. 경력직들은 성과금으로 많이 챙겨주겠다고 하면서 연봉을 최대한 깍음. 성과를 측정하는 기준이 없음
267,㈜링크프라이스,1184,"수직적 구조. 90년대 영업회사 분위기, 실적이 없으면 연차도 못쓰는 회사. 기본급이 법적 기본급으로 안나오고 언더로 나오면서 겉으로만 포장되는 회사. 영업직들은 일회용품 같은 대우를 함. 쓸데 없이 돈 안주고 중간에 휴식시간을 줘서 퇴근시간 늦음. 야근 수당 없음."
268,㈜링크프라이스,1184,사수 잘못 만나면 고민없이 탈출해야함. 윗선에서 정치질 오지게 함. 사내에 라인이 형성되있음. 경관부에서 눈치 주는 게 있어서 연차쓸때나 퇴사할때 사유 이런식으로 쓰라고 권유함. 콜 하라고 압박줌. 신입부서는 재택근무 없음.
269,㈜링크프라이스,1184,콜압박이 매우 심함. 매출 안나오면 퇴사압박이 있음. 면담해야 함. 직업 특성상 기본급은 매우 낮고 인센의 비중이 큼. 내가 한만큼 벌 수 있고 그렇지 못하면 적은 월급을 받아야 함.
270,㈜링크프라이스,1184,영업 잘하시는 분들은 오래오래 성장할수있지만 이외 다른 팀들은 스트레스에 살아있음. 한달도 안된 신입이 퇴사하고싶다고 얘기할 정도? 높으신분 한분은 하루종일 사람 붙잡고 욕하는게 업무로 봐도 될 정도고 아주 아주 큰소리로 사무실 전체가 다 들리게 욕을 찰지게 박아줌
271,㈜링크프라이스,1184,"관리직의 무능. 발전 없이 덩어리만 커지는 중 사람 갈아치우는걸 너무 쉽게 생각함 독재정권 같은 관리본부 회사의 인원, 덩치는 점점 커지지만 그에 맞는 기준 없음, 주먹구구식 업무 처리 개인의 발전도, 회사의 발전도 볼 수 없는 회사 이 회사에 머물러 있기에는 내 인생이 너무 아까움"
272,㈜링크프라이스,1184,영업에 필요한 업무능력향상지원이 전무함 시장에서 도태된 반복영업 무한루틴
273,㈜링크프라이스,1184,기계적으로 일하지 말라 하지만 기계적으로 할 수 밖에 없는 곳
274,㈜링크프라이스,1184,장점이 단점이 되는 순간이다. 라면과 햇반을 왜 제공하는가. 야근은 필수에 주말에도 출근하면 밥을 먹어야하기 때문이다. 그뿐이다..
275,㈜링크프라이스,1184,"쉽게 고용이 되기때문에 어리거나 잘 모르시는 분들이 많이들 입사하고 또 그만큼 많이들 퇴사하십니다 말로 꼬드겨서 하는 영업이라 딱히 그럴싸한 체계도 없었고 하루에 몇콜, 몇분이상 콜 갯수도 정해져있습니다 그냥 다른회사 콜센터 다니세요"
276,㈜링크프라이스,1184,체계가 없음. 아무때나 수시로 기분에 따라 업무와 보고체계가 바뀜. 야근수당이 성과급으로 둔갑하기도 함.
277,㈜링크프라이스,1184,체계가 없음. 그때 그때 기분에 따라 조직배치도부터 업무분장도 수시로 바뀜. 기본적인 경영지식조차 없는 상사에게 보고하기 위해 단어풀이부터 시작해야 함. 야근수당은 졸지에 성과급으로 둔갑하기도 함.
278,㈜링크프라이스,1184,마케팅 직무의 커리어를 쌓고 싶어서 입사했는데 많은걸 배울 수 있는 곳은 아니었다
279,㈜링크프라이스,1184,불필요한 회의가 너무 많음 많아도 너무 많음. 계속 회의함. 발전되는 것은 없음. 늘 회의 회의 회의가 진행됨. 업무는 언제 해야할지 모르겠음
280,㈜링크프라이스,1184,직원복지가 너무없다. 업종자체가 미래전망이 좋은것같진않음
281,㈜링크프라이스,1184,업계내에서 인센율 최저 사내정치 심함 무능력한 윗대가리들 때문에 회사 발전을 못함
282,㈜링크프라이스,1184,자잘한 비효율적 보고체계 왜하는지 모르겠음 회사가 과도기라고 하나 그걸 모두 사원들에게 압박을 줘 단기적인 이익만 바라봄. 개인을 그냥 영업 머신으로 보는 느낌
283,㈜링크프라이스,1184,단순보고를 위한 보고가 너무 많아서 업무 비효율적임. 조직환경 메우 경직됨 회사 운영방식 자체가 올드함
284,㈜링크프라이스,1184,콜수 채우라고 압박을 많이주고 때문에 정작 해야할일에 시간을 쏟기 어렵고 사람들이 담배를 너무 많이 퍄서 안피는 사람에게는 냄새때문에 머리가 아플수잏늠
285,㈜링크프라이스,1184,전화을 엄청한다 어렵다 영업 어렵다 매출표 붙여놓는 등 공개적으로 나의 실적 오픈
286,㈜링크프라이스,1184,야근이 많은 것 같은데 회사에서 제공해주는 간식같은 경우는 라면이랑 과자 뿐
287,㈜링크프라이스,1184,매출액지상주의 아직 어린 친구들이 인생 다 산 것처럼 처놀면서 회사다님. 직원들은 배울 생각도 없고 돈벌어서 다 술값에 쓰니 점점 멍청해짐. 어설픈 기업혁신 하려고 애를 써봤지만 다 소용없었다. 여기 점수 낮게 준 애들 대다수도 다 똑같은 x들임.
288,㈜링크프라이스,1184,연봉 최저 수준. 이직 면접때 이전 연봉 얘기할때마다 극심한 창피함을 겪게해줌. 회사 수준은 구멍가게인데 정치질을 국회 저리감. 퇴사자가 끊이지않아 일년 내내 구직 전화 돌리는게 주요 업무임. 어쩌다 낚여서 면접보러 오는 사람 다 뽑아도 모자를 정도로 사람 안뽑힘.
289,㈜링크프라이스,1184,진짜 매출영업으로 땡기지 못하면 계속 스트레스 받고 야근 압박받으면서 다녀야함 매출 없으면 그만두게 눈치 겁나중
290,㈜링크프라이스,1184,처음 시작하면 하루에 100통 가까이 전화를 돌려야함. 우리가 일반 스팸전화 받으면 통화종료시키듯이 말할때 통화 종료시킴
291,㈜링크프라이스,1184,실적 스트레스가 심하고 눈치를 좀 봐야하는 상황이 많아요
292,㈜링크프라이스,1184,점심 사먹어야했음 월급도 작은데..인센구조도 이상했음
293,㈜링크프라이스,1184,초봉 200이라는데 기본급 120 + 성과금 80으로 지급해준다는데 말그대로 성과 없으면 그럼 120 받고 일하는 거냐고 하니까 1년차 이후부터는 그렇다고 함. 근로기준법은 지키는지...
294,㈜링크프라이스,1184,1) 일이 항상 많음 (업무강도가 쎈편) 2) 개발자가 아닌 관리직과 동급으로 연봉 계산을함 3) 연봉 수준이 현저히 낮음 4) 대우가 좋지 않음 (거의 밑바닥 수준) 5) 라인이 존재함 6) 인력을 중요하게 여기지 않음 7) 업무 프로세스가 없음 ( 업무가 들어오면 일단 개발 함)
295,㈜링크프라이스,1184,콜수 못채우면 정규직 전환 안돼요. 영업 압박이 좀 심함
296,㈜링크프라이스,1184,뭐 본부장이 6개월 단위로 바꾸는거 개별로 진짜 별로 왜 그러는지 모르겠음 효용성 없어보임
297,㈜링크프라이스,1184,연차 쓸때도 눈치 봄 실적 안되면 연차 휴가 쓸때도 눈치 엄청 줌. 사람을 소모품으로 봄. 관리자 직군은 규율을 어겨도 넘어가지만 일반 사원은 엄청 혼남. 라인 타는거 엄청 심함. 관리직군 눈에 잘 들면 떡 하나라도 더 맥여주려고 함. 영업 잘하면 괜찮은데 영업 못하면 억지로 야근 시키고 수당도 안줌. 일년 차 지나서 매출 일정 부분 안 도달하면 200만원 최저도 안준다고 협박함.
298,㈜링크프라이스,1184,영업과 관리를 같이해야해서 필요시 스스로 야근하게 되는거 같음. 개인이 영업/관리하고 있는 업체와의 관계가 있어 스트레스를 받을 때도 많음 이건 복불복인듯
299,㈜링크프라이스,1184,퇴근시간이 보장되지않음 실적에 굉장히 민감함 사내 분위기가 고등학교 같음
300,㈜링크프라이스,1184,사무보조 아르바이트로 근무할때 보조하게 될 사수님에 따라 업무량은 차이가 꽤 있을 수 있습니다.
301,㈜링크프라이스,1184,그냥 마케팅 공부하시려는분들은 여기보다 유튜브로 바우는게 훨나음 마케팅 보다는 영업을 배우게 되는곳이고 SA광고 위주라 다른 광고들은 배우기도힘듬. 마케팅 기획이나 브랜딩 관련 공부도 따로해야함. 영세업자들 타겟
302,㈜링크프라이스,1184,중소기업인데 라인이 존재 팀 별 언쟁이 심함 성차별이 있음
303,㈜링크프라이스,1184,정글에 나무칼과 막대기 하나 던져놓고 알아서 살라고 한다
304,㈜링크프라이스,1184,"실적 강요는 당연함, 팀끼리 경쟁도 치열함, 분위기가 자유롭다보니 대학교?같음 업무 인수인계는 잘 안되는 느낌임, 영업이다보니 일하면서 감정소모 심함"
305,㈜링크프라이스,1184,"그렇게 체계적인 회사도 아니고 알바 수준의 일자리인데 구시대적 사고방식 가진 임원들로 인해서 입사 한달정도 차이에 선배님에 다나까 쓰는 인원이 많음 영업 실무 진행하는 인원들은 대부분 20대임에도 불구하고 타 사에서는 느껴보지 못했던 젊은 꼰대들을 제일 많이 느낀 회사, 마케팅 광고관리 회사지만 업무시간은 영업에만 할애해야 하는 압박이 심해 대다수 직원들이 광고주상품 , 업체 광고관리보다는 신규 영업만 진행하고 있고 광고주들에게 전화했을때 링크프라이스라는 이름만 듣고도 거부감 크게 느끼는데는 다 이런 업무 방식에 있다고 봄, 장기적인 비전보다는 당장의 실리만 챙기려고 하는 업무 방식 오래가지는 못할 회사라고 생각듬"
306,㈜링크프라이스,1184,적자생존 개인주의 범위 내에서만 움직여야하고 다른 것들을 알고 싶어도 누구한테 물어야할지 팀장님들도 영업하거나 관리하기 바쁘기 때문에 새로운 것에 대해서 궁금해하거나 문제가 생겨서 말을 해도 잘 해결되지 않음
307,㈜링크프라이스,1184,끊임없는 매출성장을 위해 기존 클라이언트의 대한 관리는 뒷전인 느낌
308,㈜링크프라이스,1184,승진이 어려운편임 회사내부에 관리자들이 거의 꽉 차있음
309,㈜링크프라이스,1184,매출 압박이 너무 심하고 인센티브 비율이 동종업계에 비해 너무 짬
310,㈜링크프라이스,1184,성과제라 기본급도 적으며 성과가 적으면 그냥 답없음....
311,㈜링크프라이스,1184,무한 콜영업. 내가 전화하려고 회사에 온건가? 전화하는 기계가 된것 같은 현실. 선임 옆에 신입 앉힌 이유가 모르면 물어보라는거 아닌가? 몰라서 물어보면 물어보지 말라고 하는 답없는 선임. 신입임에도 불구하고 광고주 확보했음에도 더 돈 많은 광고주 물어와라. 돈없는 광고주 할꺼면 아예 하지말라고 면박주던 회사. 신입이 최선을 다하고 있지만 팀장은 열정이 없어 보인다며 그렇게 할꺼면 빨리 나가라고 하는 답없는 팀장.
312,㈜링크프라이스,1184,1. 점심식사 미지원 딱히 이곳을 다니면서 나쁘다고 확실하게 느껴지는 부분은 없었음.
313,㈜링크프라이스,1184,실적이 너무 중요한것 같습니다. 마케팅광고회사인데 거의 초기에는 영업회사같은 느낌을 받았습니다.
314,㈜링크프라이스,1184,어림 진짜 많이 어려서 술자리 회식 다수 이며 약간 생각없는 사람도 많음
315,㈜링크프라이스,1184,아니뗀굴뚝에 연기나는회사. 입도 가볍고 과장도 둘째가라면 서러울 사람이 많음. 가십좋아하는 사람들은 일부러 담배피우러 가서 별의별 소문 다 모아옴.
316,㈜링크프라이스,1184,영업에 취중된 회사. 인센구조만 보면 흡사 다단계 느낌도...
317,㈜링크프라이스,1184,카드 보험회사처럼 온종일 전화로 영업하는게 메인임 커리어 절대 ㄴ 이바닥에 발들이면 이 일만 해야함
318,㈜링크프라이스,1184,헬야근과 헬영업. 솔직히 나는 영업이 이렇게 빡신지 몰랐음 두번다신 안하고 싶은 영업임
319,㈜링크프라이스,1184,무능한 리더가 있다. 그리고 그런 사람들이 승승장구 한다. 다녀본 사람은 알겠지만 이 하나가 이 회사의 모든 단점을 파생시킨다.
320,㈜링크프라이스,1184,정치적인 성향이 있고 보수적인 마인드가 강합니다. 업무 보다는 정신적인 스트레스가 있었습니다.
321,㈜링크프라이스,1184,생소 할 수 있기 때문에 많은 공부를해야하는부분에서 딜레마가오고 수지타산이 안맞을수있음
322,㈜링크프라이스,1184,텔레마케팅을위한 끝없는전화를 해야하며 성과가 없을경우 그만큼 밀려나게됨
323,㈜링크프라이스,1184,야근수당없음 영업에 대한 압박 점심식사 제공없음 점심값 제공X
324,㈜링크프라이스,1184,야근 강요는 아니지만 필수적으로 해야 높아질수 있으며 콜에 대한 쫌있어서 압박이 있어서 이부분은 단점이지만 어딜가도 이정도는 있을거라봄
325,㈜링크프라이스,1184,고인물들이 자기들끼리 짝짝꿍하고 신입들은 도망가서 고질적인 문제 해결이 안되는 회사
326,㈜링크프라이스,1184,"영업직. 하루에 콜수와 얼마짜리를 잡아왔냐가 가장 큰 포인트. 당연히 아무리 열심히 해도 30만원짜리 광고주 가져왔으면 그냥 욕먹음. 업무 특성상 전화상으로 욕도 많이 먹고 빨리 빨리 알아서 해야하는 것도 많고, 그냥 우연히 월 몇 천 쓰는 광고주 가져왔으면 다행인데 그걸 또 유지하려고 엄청 애써야함. 일이 정말 고됨. 팀원 서로 소개고 뭐고 없고 그냥 매출 위주임. 나는 곧 얼마짜리인지로 평가되는 곳 .. 욕설도 난무하고 시끄럽고 반말 찍찍하고. 한마디로 정병 걸리기 딱 좋고, 매일 퇴사하는 사람 부지기수임. 먼저 전화와서 오라고 한거면 꼭 생각해보세요.. 아니면 2주짜리 교육만 듣고 교육비만 챙기든가 .."
327,㈜링크프라이스,1184,사람을 소모품마냥 여김 퇴사자가많은 이유가있음 전화하는 기계가 되는느낌
328,㈜링크프라이스,1184,체계적인 업무처리가 아닌 주먹구구식 일처리방식이 좀 있어 주는일 마다 않고 한다는 분이면 괜찮을거 같음
329,㈜링크프라이스,1184,1. 영업잘하면 돈 많이 벌수있지만 그 영업이 조금 힘듬  2. 영업 후 관리를 해야되는데 짬밥차기전까지는 관리 30% 영업70%를 해야되서 관리부족으로 영업한 업체가 떠남
330,㈜링크프라이스,1184,"영업직은 영업이나, 화술에 능하지 않은 사람은 영업에 부담을 느낄 수 있음"
331,㈜링크프라이스,1184,"급격한 성장 과정에서 발생하는 성장통, 접근의 용이성에 따른 높은 퇴사율"
332,㈜링크프라이스,1184,급여적인 부분에 불만인 경우 많고 업무강도가 나름 센편이라 근속자가 많이 없음
333,㈜링크프라이스,1184,내가 생각했던 마케팅은 기획 및 제작을 하고 컨설팅을 해주는건데 그러한 마케팅적인 요소보다 사람들을 끌어모으고 전화하는 영업적인 요소가 생각보다 더 큼
334,㈜링크프라이스,1184,위에썼듯 프로세스나 기준등이 불명확하고 신입을 위한 교육은 많이 하면서 기존 사원들 발전하게 하는 교육은 거의 없는..
335,㈜링크프라이스,1184,"이미 레드오션 이라 힘들고, 전화 수를 채워야하는 비효율이 심함."
336,㈜링크프라이스,1184,업무상 사실 일을하면서도 내가뭘하는가 싶은적이많음. 윗선에서도 시키긴하는데 교육하는것과 실제는 너무나도 괴리감이 있어서 업무상 차질이많음.
337,㈜링크프라이스,1184,"성과제라 힘들지만, 노력에 따라 대우 받을 수 있고 전문적 지식 습득 및 경험을 배울 수 있음"
338,㈜링크프라이스,1184,콜수 압박이 있고 영업압박이 있다 3개월동안 매출 못 달성하면 반강제로 퇴사
339,㈜링크프라이스,1184,"조직적이지 않은 문화, 정치질이 있을수 있음, 조금만 마인드가 삐뚤어지면 좋게 볼수있는게 없음"
340,㈜링크프라이스,1184,"전화 업무가 조금 많지만, 크게 귀찮은 정도는 아닙니다. 다른 부서들 같은 경우에는 조금 대우가 안 좋고, 급여도 적다는 것 같은데 솔직히 알바하기엔 좋습니다. 다른 힘든 알바들보다 편합니다"
341,㈜링크프라이스,1184,연차 눈치보며 사용 / 직원을 일회용품 정도로 생각 / 상사가 너무 까다로움 / 가면 진심 후회
342,㈜링크프라이스,1184,콜업무가 거의 다임 영업회사라서 영업압박이 심함 사내 정치가 매우 심하고 특히 한 사람에 의해 회사가 많이 돌아감
343,㈜링크프라이스,1184,커리어가 걱정됨. 할당된 컨텍량(업무량) 채우지 않으면 많이 까임. 사람상대하는 일이 태반. 감정소모 스트레스 개많음. 시키는 업무량 채우다 자기가 광고주 일처리 못해서 피이관 터지면 개박살남. 시키는거 개 많음. 알려주고 하라고 하는게 아니라 일단 시켜보고 깨지면 버리는 회사임. 하다보면 전문성이 떨어지는 게 느껴짐. 승진심사 기준이 블라인드임. 감정적으로 스트레스 발산하는 상사 밑으로 들어가면 감당 안됨. 멘탈관리 안된다? 오지 않는게 좋음.
344,㈜링크프라이스,1184,"말이 안된다면 살아남기 굉장히 힘든회사, 신입들만 따로 모아두는 4팀이있는데 영업압박이 굉장히 심함 또한 전화영업을 주로하는데 전화를 자신없어한다면 절대로 살아남기 힘듬 보통 온라인 광고시장을 노리는 영업인데 G마켓 옥션 등 광고대행업을 함 하지만 2020년 현재 G마켓과 옥션을 사용하는 사람들이 얼마나 될까? 쿠팡을 이용하는 고객이 훨씬많은 2020년에 저런 쓸데없는 시장을 공략하여 과연 미래에 살아남을 수 있을까 생각이 됨 지금 당신을 생각해봐라 G마켓에서 구매를 많이하는가 쿠팡에서 구매를 많이하는가"
345,㈜링크프라이스,1184,업무난이도 힘듬. 동기들 다퇴사. 영업이라 힘들다 광고 전문 지식필요.
346,㈜링크프라이스,1184,실적에 따라 살아남고 말고가 결정되고 개인 성과가 중요함 스펙은 거의 중요하게생각안하는거 같음
347,㈜링크프라이스,1184,일정기간동안 광고주들을 모으지 않는 이상 돈이 없고 벌수도 없음
348,㈜링크프라이스,1184,사내 정치가 있음. 리더의 역량에 따라 타팀에서 진행해야 하는 업무까지 이일 저일 다 떠맡게 되는 수 있음. 월요일 연차를 눈치 많이 줌. 당일에 아파서 연차(반차는 가능)내는 것도 불편해하며 눈치 줌.
349,㈜링크프라이스,1184,- 영업하는 곳인데 영업에 대해 제대로 알려주질 않음 - 신입 많이 뽑아서 영업 잘하는 애 남는 구조 - 영업 못하면 그냥 나가라 식 - 회사관련 사항이 공유가 잘 안되고 알필요 없단 식
350,㈜링크프라이스,1184,퇴사자가 많음 야근이 많아보인다 눈치를 많이 봐야하는것같다
351,㈜링크프라이스,1184,출근 시간은 9시인데 퇴근은 6시인데 기본 더 하는 게 있어서 퇴근이 조금 늦어 질 때가 있다. 슬프다
352,㈜링크프라이스,1184,야근많고 여성직에 눈 돌아간 상사들 많고 성과올리기가 무척 힘듬. 꼰대다수. 눈치밥먹음 급여가 짜다
353,㈜링크프라이스,1184,"매출에만 신경을 쓰고, 인정이 없음 매출이 안나오는 사람은 인간취급이하..."
354,㈜링크프라이스,1184,고인물들의 비위맞추기가 어려움. 2020년엔 상상할 수 없는 꼰머력. 개인발전이 어려움. 무조건 상사한테만 잘하면 업무실력 상관없음
355,㈜링크프라이스,1184,부서 간 커뮤니케이션 부족 꼰대문화 위에서 까라면 까야하는 식
356,㈜링크프라이스,1184,멘탈관리 못하면 많이 힘이 든다 실적 압박은 당연히 있다 임직원들의 동의 없이 이상한걸 계속 바꾼다 더이상 적을거 없어
357,㈜링크프라이스,1184,나만 잘하면 되는 회사 영업 못하면 살아남기 힘듬 링크프라이스생존기
358,㈜링크프라이스,1184,정규직 전환되기 위한 커트라인이 다소 높은 점. 상사의 언행이 다소 거친 직원이 있다는 점.
359,㈜링크프라이스,1184,대신 의무 휴식 시간이 있는만큼 퇴근은 다른 기업보다 늦은 7시임
360,㈜링크프라이스,1184,"매출 압박이 생각보다 심해요 직접적으로 압박을 하는게 아니라, 매월 성과표를 회의실앞에 노티하는데 따로 말하지않아도 노티되는 순간 압박감이 상당합니다."
361,㈜링크프라이스,1184,3개월하고 실적 못채우거나 그러면 정직원이 될수없음 교육 계속 받아야댐
362,㈜링크프라이스,1184,"체계가 없음. 신입사원이 20명 입사하면 1명 살아남기 힘든 구조. 여기서 못살아 남으면 더이상 나에게 삶은 없다는 배수진 치고 들어갈 생각 아니라면 비추. 즉, 생존하기 위해 스스로 부단히 노력하지 않는다면 그 누구도 도움이 되는 사람이 없음. 왜냐? 업무가 100% 개인플레이임. 팀업무 같은건 관리직 아닌이상 없음. 그런데, 개인플레이처럼 일하는걸 진짜 일다운 일을 하는사람들은 정보공유를 잘 안함. 초기에 멘토라고 붙여주는 인원들? 그냥 영업 본인보다 오래한 사람일 뿐, 광고나 마케팅에 대한 이해도가 높은 사람이라고 착각하면 안됨. 단순히 본인보다 이 일을 몇 몇달, 혹은 몇년 오래했을 뿐. 딱 그뿐. 신입을 위한 프로세스? 없음. 단순 영업에 목표를 가지는게 아니라면 일찌감치 포기하는게 좋다고 생각함. 살아남고자 한다면 스스로 업무와 관련된 공부 정말 열심히 해야함."
363,㈜링크프라이스,1184,"영업콜로 업무량체크하는데 3분이상 전화가 적을경우, 광고주 컨텍못할 경우 위에서 하나라도 떨어지면 압박들어올수 있음. 주말에도 광고주 비딩업무 보고해야됨. 온오프가안됨 퇴근하고도 일 연장선이 많음."
364,㈜링크프라이스,1184,전화로 계~속 기계처럼 영업해야함. 전화영업잘하는사람 추천
365,㈜링크프라이스,1184,경직된분위기가 있음 철저히 성과주의라 스트레스가 심할수 있고 좌절감 느낄수도 있음 직원들에 복지가 다양하지 않은 느낌
366,㈜링크프라이스,1184,연령층이 낮다보니 우선 체계가 없고 약간 고등학교 분위기 느낌이 난다. 흡연실이 내부에 위치해 있어 근무중에 담배냄새 남
367,㈜링크프라이스,1184,영업직이다보니 실적에 따라 급여가 유동적이다보니 스스로 실적에 대한 압박이 있습니다.
368,㈜링크프라이스,1184,라인서는거 심함. 경영진들 마인드가 너무 호랑이 담배피던 시절. 업무압박이 도가지나칭
369,㈜링크프라이스,1184,타임마다 보여지는 업무량과 누구나 볼수 있는 실적과 직원들간의 비교.
370,㈜링크프라이스,1184,위에서 오는 압박이 심함 처음에는 못 느꼈지만 갈수록 심해지는 압박
371,㈜링크프라이스,1184,"관리직이 좀 깐깐합니다. 아르바이트생 좀 눈치주기, 생색내기?"
372,㈜링크프라이스,1184,사원들의 의견은 존중하지 않음 그냥 윗사람들이 시키면 무조건 해야 함. 광고주 관리하는 것도 중요하다고 강조하지만 입사 후는 관리하다가 영업 안하면 욕 먹고 업무시간에 뭐했는데 콜이 이런지 다 보고 해야함 학교체계 수준
373,㈜링크프라이스,1184,광고회사인척 오게 하는데 전화영업하는 회사 사람이 자주 바뀜 직원들이 일진놀이함
374,㈜링크프라이스,1184,쓸데없이 시간도 자율적이지 않아 공고글에 다 정확히 이루어지지도 않음 밥먹을때나 쉬는시간에도 영업애기 정신적 스트레스 육체적 스트레스 몸과 마음이 지침
375,㈜링크프라이스,1184,같은 일을 하는 타 대행사들에 비해 턱없이 부족한 인센티브
376,㈜링크프라이스,1184,콜 업무에 대한 압박이 있다. 새롭고 혁신적인 영업방식이 필요하다. 다른 대행사에 치이는 느낌?
