,company_name,company_id,review_text
0,㈜아이스크림에듀,8822,여초 특징인가 남의 말 진짜 좋아함. 회사에서 일만 하고 싶은데 다들 소문을 어디서 듣는 건지 궁금하지도 않는데 자꾸 흘려서 소문을 듣게됨. 제발 그럴 시간에 본인이나 돌아보길 ㅎ 입흥입망 -팀바팀이겠지만 변화나 무언가를 하려고 하는 시도 자체를 안 좋아함. 극한의 효율만 찾는데 장기적으로 봤을 때 과연 좋을지를 당사자는 생각을 안 함 -가끔 이 일을 왜 우리가? 할 때가 있다.
1,㈜아이스크림에듀,8822,팀과 팀간의 의사소통 및 협력이 어려움 하나의 결과를 내는데 절차 회의가 너무 많음
2,㈜아이스크림에듀,8822,"사무실 위치, 소통이 없음, 일방적인 통보, 무능력한 경영진"
3,㈜아이스크림에듀,8822,정말로 조금 오르는 연봉. 승진을 하는게 연봉을 제일 많이 받을 수 있을 것이다
4,㈜아이스크림에듀,8822,"선두주자였는데 지금은 교육 대기업에 밀려서 많이 후발주자로 떨어진 느낌이라 아쉬움, 이렇다 할 특장점이 없어 콘텐츠에서도 뭘 내세워야 할 지 애매함."
5,㈜아이스크림에듀,8822,워라벨 빼고는전체다다 정치질 밎 연봉 올리기 어려우며 진급하기 어려움
6,㈜아이스크림에듀,8822,끼리끼리의 문화가 강해도 너~~~~무 강함 연봉과 진급기준이 천차만별임 누구는 떼안써서 진급못하고 누구는 떼써서 진급하는 식임
7,㈜아이스크림에듀,8822,그나마 있는 복지 다 줄이고 위치도 이상한 곳으로 이동해서 불편함
8,㈜아이스크림에듀,8822,직원들에 대한 처우가 많이 부족합니다. 직원들에 대한 대우가 개선될 필요가 있습니다.
9,㈜아이스크림에듀,8822,"회사 이전으로 인해 접근성이 좋지 않고, 생각지못한 정치질로 인한 이슈가 있음"
10,㈜아이스크림에듀,8822,경영진 리스크가 너무 큼 능력없는 경영진 때문에 말그대로 곤두박질 치고 있음 정말 그들이 C레벨이 맞을까 하는 의문.  복지는 나날이 줄어들고 그나마 좋았던 삼성역이라는 위치도 바뀐지 오래. 연봉테이블은 한없이 낮고 인상률은 짜며 미래가 불투명한 회사  업계 1위였던 그 영광을 다시 되찾을 수 있을까? 묻는다면 다신 그 자리에 오를 수 없음을 확신하게 만드는 회사
11,㈜아이스크림에듀,8822,"성장동력을 찾지 못하고 있으며, 돈안들고 광팔 재료만 언론에 적당히 뿌려서 향후 성과가 기대되지 않음"
12,㈜아이스크림에듀,8822,면접 본 후 출근하라고 하기도 전에 신분증을 핸드폰 문자로 보내 달라고 하고..  인수인계가 제대로 이뤄지지 않고 이후 일을 할 때는 피드백 주지 않다가 본인들끼리 이미 의견 공유해서 다음 달 부터는 안 나와도 된다고 한 후 그 때부터는 계속 눈치주고 다른데 가서도 일 이딴식으로 하지 말라는 둥 면박 줌 어차피 짜른 사람 무슨 볼일이 있다고 피드백을 그렇게 주는지.. 일할 때 업무에 대해서 제대로나 알려주지 짜른 후에 나갈 사람이라고 그렇게 함부로 대하나 ;;?
13,㈜아이스크림에듀,8822,신사업이라고 만들어놨는데 아무것도 실제 매출이 그렇다하는게 없다. 새로 상품을 츌시하는데 실무를 모르는 사람이 만들어놓고 팔리기를 기다린다. 그리고 책임을 떠넘긴다 돈을 마구써대서 적자가 100억이 넘는다.
14,㈜아이스크림에듀,8822,모든점 일단 이사를 계획없이 진행했던거부터 말도 안되는 일들이 무수히 벌어지고 있음
15,㈜아이스크림에듀,8822,탑다운형식의 업무처리가 이루어짐. 리더의 무능... 자기가 좋아하는 사람들만 챙기고 중심을 잡지 못함
16,㈜아이스크림에듀,8822,납득되지 않는 임원진의 선택과 잘ㅇ솟된 결과에 책임지지 않는 태도
17,㈜아이스크림에듀,8822,직원들을 위한 복지도 없고 회사 위치도 별로고 직원들이 요청하는걸 잘 안들어줌
18,㈜아이스크림에듀,8822,"조직 문화가 사업실마다 차이가 큼, 여전히 남아있는 꼰대 문화, 고인물 천국"
19,㈜아이스크림에듀,8822,"팀바팀 업무 과중이 심함, 이사간 위치, 연봉, 연봉 상승률"
20,㈜아이스크림에듀,8822,"팀마다 존재하는 빌런, 인원 축소를 하려는 회사의 의도가 보였습니다"
21,㈜아이스크림에듀,8822,업무에 집중하지못하고 마이 웨이 하는사람은 어디가도 있다
22,㈜아이스크림에듀,8822,"임원들의 자기 배불리기. 2년 연속 평사원들 동결수준의 인상율, 원래 많이 받는 임원들 주식 받고 연봉올리고, 연봉 올릴 이유없으면 진급시켜서 진급수당 주는 회사. 실무자 없어도 실무자 TO는 없애고, 1팀1사원인 실장 만들어 배불려주는 회사."
23,㈜아이스크림에듀,8822,"위치가 역과 멀고 과천 근접지로 셔틀 없으면 출퇴근 번거로움, 주2회 재택 있으나 사용 못함, 사내카페 사라짐, 매우 보수적인 분위기, 부서간 협업이 힘들고 결재 느림, 연봉 적음"
24,㈜아이스크림에듀,8822,임원들 바뀌고 나서 돈을 많이 아끼는 느낌이 물씬남. 화장실 변기 맨날 막힘
25,㈜아이스크림에듀,8822,"- 위치: 양재 하이브랜드 말이 양재이지, 과천임. 도로 한개 건너면 과천 바로 옆에 양재 이럴거면 차라리 지역벨류가 있는 판교로 가버리지 - 사무실: 닭장이라고 하자, 여자 화장실은 막히고 무엇보다 인테리어를 2달동안 한걸로 아는데 이 모양? - 인프라: 이사 후 식당은 없다고 보면 된다. 무슨 80~90년대의 홍콩 스타일의 식당가들뿐 코스트코 바로 옆, 이마트 바로 아래 끝."
26,㈜아이스크림에듀,8822,경영진과 관리자의 능력 부족 낮은 연봉 성장하기 어려움 복지 안좋음
27,㈜아이스크림에듀,8822,"기업의 적자지속, 성장가능성이 없고 하락하는 분위기 양재로 사옥이전"
28,㈜아이스크림에듀,8822,기획자의 결정권이 적고 부서마다 분위기가 너무 다름. 잘못가면 일 잘하고 욕 먹을 수도 있으니 조심
29,㈜아이스크림에듀,8822,실무자들은 계속 나가는데 충원 해주지 않음. 고로 남은 사람들의 업무가 계속 과중되는 중.
30,㈜아이스크림에듀,8822,"프리랜서로 자영업자와 같은 근무 시스템이라 사대보험 등의 적용 받지 못함으로써 근무의 불안정성이 항상 수반됩니다. 업무는 끊임없는 교육을 통해 본사의 지침대로 수행을 하고, 재택 근무라 편한 점도 많지만, 메신저 등의 업무 지시 등을 통해 교사도 지속적으로 상급자의 관리를 받고 있습니다. 학습지 시장 대부분이 프리랜서로 계약을 하나, 홈런만은 관리 교사도 경력이 어느 정도가 되면 정직원으로 전환할 수 있는 시스템으로 발전 해 관리,상담 교사 등 홈런을 위해 일하는 직원들에게도 자아계발과 더불어 정직원으로 채용될 수 있는 시스템으로 변화할 수 있는 시기가 하루 바삐 도래하기를 간절히 바랍니다."
31,㈜아이스크림에듀,8822,"연봉 인상률이 적고, 교통이 불편할 예정(10월 말 양재 시민의 숲으로 이사)"
32,㈜아이스크림에듀,8822,"정치적인 요소가 매 업무마다 등장하며, 처리기준 및 근거에의한 업무수행이 아닌 즉흥적임이 난무하는 곳"
33,㈜아이스크림에듀,8822,좋은 복지라고 느껴질만한 것이 딱히 없습니다.. 소박한 명절상여금과 선물 정도.. 소정의 회식비..?
34,㈜아이스크림에듀,8822,"회사 발전을 명목으로 잡무의 강요가 있는 편이다. 그리고 업무 전반적으로 진행 방식, 환경 등을 봤을 때 전문성을 키우는 데 도움이 된다고 생각하기 어렵다. 몇몇 사람이 정말 힘들게 할 수 있다. (부바부)"
35,㈜아이스크림에듀,8822,크게 말은 하지 않겠음. 회사가 안 맞으면 중이 절이 싫으면 떠나라는 말처럼 나가는게 맞다고 생각함. 하지만 인사적으로 봤을때 투명성있게 결과를 공유해주었으면 좋겠음. 인력대비 인사체계가 약하다고 생각하는 편
36,㈜아이스크림에듀,8822,꼰대문화 업무 집중 강요 인사팀의 선도부 활동 이상한거 투성이 연봉일단 미치게짬
37,㈜아이스크림에듀,8822,문서 작업이 많음 인력이 더 필요함 사무실 공기의 질 나쁨
38,㈜아이스크림에듀,8822,정직원과 프리랜서 사이에 차별을 너무 두고 사람을 부린다는 느낌으로 일을 줬던기억이 있습니다.
39,㈜아이스크림에듀,8822,영업 이익 적자로 인해 모든 개발들을 최대한으로 줄여서 커리어를 쌓는데 한계가 있어요
40,㈜아이스크림에듀,8822,정치가 상당히 심하다 대표 라인의 모두가 급 인사이동 및 임원이 되는 진귀한 풍경을 볼 수 있음
41,㈜아이스크림에듀,8822,시간에 비해 업무가 과도할때가 있어 야근이 잦았고 인력감축이나 조직개편이 많은편
42,㈜아이스크림에듀,8822,"보고를 위한 보고를 하는 회사 못난이 대표가 연줄 다 끌어와서 학교생활 하는 회사 주식, 사업자금 등 다양한 방법으로 주머니 터지게 챙기는 회사 그러나 회사가 어렵다고^^ 기존 직원들은 나몰라라 하는 멋쟁이 회사"
43,㈜아이스크림에듀,8822,급여가 낮은편이고 잦은 인사이동으로 정체성의 혼란이 생긴다
44,㈜아이스크림에듀,8822,비교적 딱딱한 조직문화와 분위기. 수평적이기 보단 수직적인 느낌을 많이 받음 상황에 따라 워라벨을 지키기 힘들 수 있음.
45,㈜아이스크림에듀,8822,어디로 가는지 모르겠음 복지가 점점 줄어듦 연봉..적음
46,㈜아이스크림에듀,8822,눈치를 많이 주어서 윗분들이 어떻게 판단하는지 잘모르겠어요 경영진 마인드도 잘 모르겠어요 어떤 부서에 있는지에 따라서 다른거같아요
47,㈜아이스크림에듀,8822,"이사 예정지가인프라, 교통 열악. 현재 돈 벌어다주는 직원들을 간과하는 느낌"
48,㈜아이스크림에듀,8822,회사가 업계 2위인 이유가 자기때문인지 모르는 사람이 있음. 어디서 부터 적어야 될지 모를정도로 히스테릭함..... 사사건건 간섭하고 밥만 같이 안먹으면 좋은 팀장인줄 아는건지 그사람때문에 다 나가고 있는데 본사는 알지 모르겠음... 일을 성장형으로 하지 않고 공장처럼 물량처내기에 바쁨. 대화도 되지않고 너무 불편한 사람이라 난 포기하고 퇴사함. 진짜 열의를 갖고 잘해보고 싶어서 들어왔는데 면접때와는 완전 다른 이야기와 상황들 조금 고생하더라도 번거롭더라도 맞는방향으로 가고 싶은데 실적을 쪼임 당하는건지 그냥 들들들 ...
49,㈜아이스크림에듀,8822,부서 간 업무 조율이 쉽지 않아 업무를 서로 떠넘기는 경향이 있음
50,㈜아이스크림에듀,8822,"잦은 경영진의 변경 및 갈대 같은 조직장들, 모든 조건이 별로인...."
51,㈜아이스크림에듀,8822,업무 과중이 심한 편인데 인력난에도 회사는 나몰라라하고 직원들이 알아서 하길 바라는 듯
52,㈜아이스크림에듀,8822,결정이 늦고 허리띠를 졸라맴. 은근 고인 루팡들 천지.
53,㈜아이스크림에듀,8822,급여 및 복지가 중소기업수준이고 발전가능성에 대해 확신이 없음
54,㈜아이스크림에듀,8822,새로운 경영진이 오면서 더더욱 막장으로 치닫는 회사. 자기들끼리 성과 파티를 벌이지만 정작 실무 하며 열심히 일한 직원들의 연봉은 동결 승진은 누락
55,㈜아이스크림에듀,8822,사람을 일부러 내보내고 있음 이상한 사업을 벌이고 있는데 그거에 따른 타당한 근거는 전혀 없음
56,㈜아이스크림에듀,8822,업무 진행을 위한 단계/절차가 어려움 다른 부서간 협업이 생각보다 어려움
57,㈜아이스크림에듀,8822,"에듀테크 경쟁이 심화되고 있고, 이쪽에 강하긴 한데 후발 주자에 점점 잡히는 느낌이다. 홈런 이외에 별다른 상품이 없다는게 단점"
58,㈜아이스크림에듀,8822,방향성 잃음 경쟁력 잃음 소통이 안됌 소통이 안되는걸 임원도 알고있는데 임원도 소통이 안됨 회사에 돈이없는것이 아니라 회사에 도둑이 많은것이다
59,㈜아이스크림에듀,8822,전형적인 정치질만 우선시 하는 사람들을 무작위로 승진시키고 감당 못할 신규 사업만 계속 시도하다가 지금은 정말 어디로 가는지 모르겠는 상황
60,㈜아이스크림에듀,8822,동기부여 요소가 없음 내가 왜 열심히 해야하지? 잘될것 같은 희망이 없는것이 최대의 단점
61,㈜아이스크림에듀,8822,"임원들은 오만데 헛돈쓰고 다니고 자기들끼리 전무, 상무 승진 파티함 나머지는 주임, 대리 승진도 밥먹듯이 누락시킴(대상자 50%는 누락) 연봉인상률은 2%로 고정된듯^^(동결도 많다고 들음..) 새로운 시도들이 하나같이 전망 어두움"
62,㈜아이스크림에듀,8822,신입이 들어와서 위로 올라가기엔 너무 많은 시간이 걸림 계약직부터 시작해야해서 계약직 후 정규직 주임 달기 까지 최소 3년은 걸려보임 연봉도 동종업계 낮은편
63,㈜아이스크림에듀,8822,1. 경영진의 짙은 정치질 2. 부서 바이 부서? 노노 라인 바이 라인 3. 체계없는 HR과 과거보다 현저히 무너진 기업문화 4. 업계 1위 놓친 이유를 스스로 증명하는 경영진
64,㈜아이스크림에듀,8822,오래일한 사람일수록 대우 받기 힘들다.자기가 노력해서 더 진급하지않는이상 기대로있을수밖에없다.
65,㈜아이스크림에듀,8822,제대로 된 관리자가 없어 실무자는 실무와 책임을 다 짐.. 윗분들은 정치놀음과 성과 잔치…………
66,㈜아이스크림에듀,8822,"의사결정 느리고, 부서장이 능력없는 사람이 많아 억지가 많고 답답한 결정이 많다"
67,㈜아이스크림에듀,8822,개인의 역량을 펼치거나 꿈을 이루기에는 부족했지만 알바라면 당연한 것
68,㈜아이스크림에듀,8822,"방향성을 찾아가는 중이겠으나, 현재로서는 악화되는 경영난에 위험성 높아지는 중. 합리적인 인사평가 및 기준이 없음."
69,㈜아이스크림에듀,8822,"발전이 더딤, 효율적인 성과를 못내고 있음, 윗사람들의 마인드가 진취적이지 못함"
70,㈜아이스크림에듀,8822,"학습기 서비스가 예전에는 독보적인 수준이었으나 현재는 경쟁사 상품들이 좋게 나와서 차별화가 어려운 상황. 종이 출판물보다 개발할 때 재미있는 점도 많지만 의외로 업무가 루틴하게 흘러가서 발전이 없는 느낌, 새로운 틀을 시도하기 어려워서 다양한 업무 경험을 하기가 생각보다 어려움."
71,㈜아이스크림에듀,8822,연봉인상률이 높지 않다. 연봉통보. HR제도를 바꾸려고 노력중이나 한창 과도기 단계라 체계가 없다.
72,㈜아이스크림에듀,8822,일부 빌런같은 부서들이 난장판 만들어놔도 칭찬하고있으며 연봉인상율 너무 짬.
73,㈜아이스크림에듀,8822,"회장님, 대표님이 직접 조직 개편을 주도 하여 그때 마다 본인에게 잘 맞는 부서는 절차 상관없이 밀어주시고 또 별로네? 싶으면 바로 조직 개편을 해버리는 편"
74,㈜아이스크림에듀,8822,성장이 더디고 꼰대문화가 있다. 회장님이 독단적이고 그 밑에 싸바싸바하는 분들이 많다.
75,㈜아이스크림에듀,8822,단점은 딱히 없었던 것 같다. 다만 지금은 다시 자리를 잡는 중이라 부서명이 자주 바뀌는 점이 조금은 아쉬웠다.
76,㈜아이스크림에듀,8822,인사이동이 잦고 항상이슈가 있다 잘살펴보면 능력없이 꿀빨고있는 사람이 많다
77,㈜아이스크림에듀,8822,실마다 뭘 하는지 모름. 뭘 하나 하려면 책임자가 누군지 몰라 다 찔러봐야함.
78,㈜아이스크림에듀,8822,가끔 비효율적인 일처리가 있음. 사람이 몰리면 기업 쪽에 전화 연결이 잘 안 될 때 내가 할 수 있는 게 없어서 가끔 답답함
79,㈜아이스크림에듀,8822,"2019년 상장을 전후로 사람, 조직에 많은 변화가 있었는데 성장도 정체되고 직원들의 변동도 많고 사내 문화나 분위기가 상장 이전 사업 초기의 어려웠던 시기보다 나빠진 것 같아요."
80,㈜아이스크림에듀,8822,교육받고 네달째 급여 80 돈이급하면 입사 비추천 학습계획반영도 좋지만 7일이내 학습계획종료있다면 따로 볼수있는 메뉴를만들면좋겠음 업무생각보다 힘듬 짧고 굵게일한다
81,㈜아이스크림에듀,8822,전체적인 분위기가 가라앉아 있어 자유로운 분들은 힘들 수도!
82,㈜아이스크림에듀,8822,"일을 잘하거나 애사심 있는 직원들이 인정 받는 회사가 아닌, 입으로만 일해도 되는 부분"
83,㈜아이스크림에듀,8822,가끔 비효율적인 업무 프로세스가 있음. 연봉협상 시 성과나 평가결과에 차등이 없음.
84,㈜아이스크림에듀,8822,초등 중등 교육이다보니 저출산 시대에 미래가 안보여서 걱정
85,㈜아이스크림에듀,8822,"무능력한 상사. 경직된 분위기. 부바부로 무능한 상사 밑에서는 괴롭습니다. 업무 자동화를 위한 시스템 개발이 없어 엑셀, 수기 업무가 만연화.."
86,㈜아이스크림에듀,8822,복지가 점점 줄어듭니다 회장님의 의사결정에 따라 결정되는 사업들.. 윗사람들이 전부 회장님 비위 맞추기만 급급해요
87,㈜아이스크림에듀,8822,"많은 학생들을 관리해야 하는 입장이므로 에너지 소모가 좀 있어요. 재택에서 일할 수 있다는 것이 장점이 될 수도 있지만, 때로는 예기치 못한 상황도 생깁니다. 혼자서 일을 잘해내야 한다는 부담감이 있어요."
88,㈜아이스크림에듀,8822,업무 분할이 단순하지 않고 복잡하여 비효율적으로 느껴질 수 있는 부분이 있음
89,㈜아이스크림에듀,8822,"무능한 사람을 내보냈더니, 더한 무능한 사람이 나타나 자기라인에게 엄청난 연봉을 주고 줄세운기를 하는 모습이 참 보기 불편해진것 같다."
90,㈜아이스크림에듀,8822,사용자 측의 의견에 많이 휘둘리고 그때 그때 즉흥적인 결정이 개발에 반영되는 느낌이여서 일정이 촉박한 편이였고 인원의 공백 있음에도 인원의 공백 없애려고 하기 보다는 문제가 발생하지 않으면 계속 그 인원으로 진행하려고 하는 점을 느꼈습니다. 팀 별로 다르지만 프리랜서의 경우 철저하게 따로 취급하는 느낌을 받았습니다.
91,㈜아이스크림에듀,8822,"지금은 모르겠지만, 구조 조정이 너무 심하게 되어서 퇴사하게 되었는데 이부분하고 연봉이 조금 낮은편이라는 부분은 단점이네요"
92,㈜아이스크림에듀,8822,퇴근할때 인사하고 가는 문화 야근 안해도 상사따라 저녁먹고 퇴근해야 되는 문화 프로세스가 자주 바뀌어 대다수 모른다 실바실 무능한 실장 분위기상 그 실만 5명 줄 퇴사 능력있는 인재들 최근 우르르 퇴사 중
93,㈜아이스크림에듀,8822,경영진의 내로남불이 매우 심각했음. 남 탓으로 돌리거나 자신의 지시하의 업무들에 문제가 생기면 모르는 척 하는 경우가 많았음.
94,㈜아이스크림에듀,8822,건물이 좁다 사무실이 답답해요 코엑스쪽에 있다보니꺼 식대가 비싸다
95,㈜아이스크림에듀,8822,"최근들어 물경력 쌓기 쉬움, 역량 발전 가능성 없음,오래다닌 직원들은 퇴사 많이 하고 있어 불안감 있음"
96,㈜아이스크림에듀,8822,실마다 분위기 격차가 너무 심하고 경영진보다 사실 실장천하인 회사
97,㈜아이스크림에듀,8822,수수료가 인상되기는 했으나 만족할만한 수준의 페이는 어려움. 해지로 인한 스트레스가 있음
98,㈜아이스크림에듀,8822,재택 마려운데 재택 잘 안함 탑다운 회사 신규보다 과장이상급 인원이 더 많음
99,㈜아이스크림에듀,8822,연봉이 낮음. 개편이 너무 잦음. 인력이 출입이 많음.
100,㈜아이스크림에듀,8822,"홈런 학습기의 경쟁력이 많이 떨어져 관련 신사업마다 제대로 추진되는게 드뭄. 미디어에서 번돈 열심히 까먹는 느낌. 임원들 정치싸움이 볼만함. 고령의 회장이 모든 인사,의사결정에 직접관여."
101,㈜아이스크림에듀,8822,구내식당 없음. 층마다 너무 다른 환경 (엄청 보수적인 층이 있고 실장 재량에 따라 자유로운 층이있음 - 같은 실장급인데 왜그럴까요) 인사팀이 일을 못함 (우천시 재택근무 공지 그당일에 해줌 - 이미 출근다했는데요) 돈아끼는 티가남 22년 퇴사자가 너무많음 퇴사자는 많은데 입사자가 없음 (남은사람들 갈아넣기)
102,㈜아이스크림에듀,8822,1. 조직개편 - 주단위 개편 2. 어마무시 입퇴사율 - 문제를 인식하긴하나 고치질 못함 3. 임직원 능력 4. 레드오션 - 미래가치 불투명 5. 기타 다수의 문제 - 재직자만 알수있는 민감한부분
103,㈜아이스크림에듀,8822,- 무엇을 얻기 위해 공감하기 힘든 미사어구로 포장을 하여 지난 시간 최선을 다해 함께한 직원들을 저버린 것인가 - 사람을 중요하게 생각하지 않는 것 같은 여러 부분들
104,㈜아이스크림에듀,8822,단점이 넘쳐나는 곳 각 실의 실장 눈 밖에 나면 아무도 모르게 사라질 수 있는 곳
105,㈜아이스크림에듀,8822,복지가 별로.. 유용한 복지가 없음 커리어 관련한 성장은 기대하기가 쉽지 않음
106,㈜아이스크림에듀,8822,뭔가 확장은 계속 하려곤 하는데 기본을 무시하며 하는 게 아닌가 싶다. 조직적으로 안정화가 우선돼야할 것같은데...
107,㈜아이스크림에듀,8822,"브랜드는 스마트한데 회사 체계나 문화는 구식 복지가 부족했음 사무실이 너무 허름했음 특히, 화장실"
108,㈜아이스크림에듀,8822,케바케로 어떤 팀을 잘 만나느냐에 따라 더 다니고싶은지 아닌지 결정된다
109,㈜아이스크림에듀,8822,개발인력의 부족 기획을 아무리해도 개발이 안되는 경우가 많다
110,㈜아이스크림에듀,8822,복지가 다양하지 않음 잦은 조직개편 퇴사율 높은 편이라 사람이 자주 바뀌메
111,㈜아이스크림에듀,8822,작년부터 매출과 현재 회사의 주가를 보면 불안불안함. 때문인지 기존 인력들이 밥그릇 지키려고 예민
112,㈜아이스크림에듀,8822,개발자 수가 적어 한사람당 업무량이 많음. 같이 성장하는 느낌없음.
113,㈜아이스크림에듀,8822,프로세스가 복잡함 연봉 상승률 고인물들의 주인 행세 구내식당 없음
114,㈜아이스크림에듀,8822,"지금은 많이 바뀌었다고 알고 있으나, 과거에는 마케팅적으로 새로운 시도를 하지 않고 기존 해왓던 방식의 소극적인 마케팅만 진행해 마케팅이 아닌 영업 지원 부서 같았음 브랜드 마케팅이나, 마케팅적 이해가 없었음 이에 장기적 관점이 아닌 단기적 관점에서만 마케팅이 운영됨, 당장의 매출, 전환률만을 고려한 마케팅방향을 설정해 마케팅 에셋에 대한 관리 부재  내외부 임원들에게 많이 휘둘리는 부서"
115,㈜아이스크림에듀,8822,ㅋㅋㅋ탑다운 장난아님. 고인물 아니면 신입임…… 2-3년전에 다 떠남
116,㈜아이스크림에듀,8822,연봉…연봉…연봉…연봉… 쥐꼬리 연봉… 교육업계 인상률 최저 체감 가능
117,㈜아이스크림에듀,8822,의외로 자주 터지는 서버 / 홈런 학습기에 대한 상담이 많은데 프로그램 문제에 대하여 개발부서에 문제 개선을 요청해도 3~4달이 넘도록 개선을 해주지 않음 / 있으나 마나한 고객 건의 VOC 시스템 / 고인물들이 많아 일을 배우기는 좋지만 사람들 성향도 천차만별이라 신입으로써 상대하기 어려운 선임들이 꽤 있음 / 일을 잘 하지 못한다면 겉으로는 웃고 있어도 뒤로는 욕하는 사람들 많음 / 급여 낮음 / 호봉제지만 연차가 올라도 연봉은 크게 오르지 않음 / 오래 다니면 직급도 오르긴 하는데 거의 기대할 수 없음 / 중구난방으로 이리저리 프로젝트를 펼치면서 다수의 학습 프로그램을 도입하지만 도입할때마다 각종 오류가 발생하여 정작 사용하지 못하고 고객 불만만 불러오는 경우가 매우 많음
118,㈜아이스크림에듀,8822,윗 사람들이 회사를 망치고 있음 신규 프로젝트들이 다 망하고 있음
