,company_name,company_id,review_text
0,㈜아름다운프로,6449,회사일로 3000원을 결제해야되도 눈치를 엄청 줘서 내가 죄지은 기분임
1,㈜아름다운프로,6449,같은 문서를 몇번이나 옮겨 적어야함 비효율의 극치 으레 작은 회사들이 그렇듯 이곳도 마찬가지
2,㈜아름다운프로,6449,-전화 업무 많음 -비품이 넉넉치 않음 -야근은 선택이지만 야근을 한다고 해서 별도의 수당 없음 -식대 및 특별한 복지 없음 -근태 안좋은 직원들에게 인사고과가 없어 지각이 많았음
3,㈜아름다운프로,6449,"복지없음, 체계없음, 임원 기분따라 돌아가는 회사임. 본인들 입맛에 맞지 않으면 괴롭히고, 짜르고 배울게 없음. 퇴사율도 너무 높음. 처음에 면접때 얘기한것 지켜지지 않고 업무 막시킴."
4,㈜아름다운프로,6449,경영진 소통이 안되며 연봉 협상시 아주 힘들수있습니다. 직원들 피드백에 아무 반응이 없ㄱㅇ므
5,㈜아름다운프로,6449,첫날 첫출근 하는사람 있는데 전원이랑 컴퓨터 셋팅 안되있음ㅡㅡ CS로 들어갔는데 자리는 2미터 정도 혼자 떨어져 있었음 가르쳐 주기 싫은지 시간이 없는건지 각자일 하기바쁨 알려준다고 해도 직접 이론만 급하게... 알려준 사람 옆에 있는 사람이나 먼저 들어온 사람도 배운거 없다함 알려주는게 큰일 한거마냥 말함
6,㈜아름다운프로,6449,체계가 전혀 없음. cs가 많은 것에 비해 사람을 뽑지 않아 많은 일을 적은 사람이 감당해야 함.
