,company_name,company_id,review_text
0,㈜제이엘케이,3903,임원들이 기업의 성장보다는 자신의 수익을 먼저 생각하는게 눈에 보일 정도라 직원들의 사기가 없고 기업에 대한 정도 없다
1,㈜제이엘케이,3903,1. 직원을 부품처럼 뽑았다 자른다. 2. 경영진이 능력이 없는것을 직원탓한다 3. 경영진이 속이 좁다. 4. 이력서만 더러워진다 5. 여기 평점보고도 지원하면 답없다.
2,㈜제이엘케이,3903,경영진이 가장 큰 단점. 그냥 단점 그 자체. 아무 능력도 없고 화내거나 협박만 할 줄 안다
3,㈜제이엘케이,3903,지각에 민감한 편임. 딱히 뭐 그럭저럭 다니기 괜찮음.
4,㈜제이엘케이,3903,1. 일 못하는 사람들이 꼭 있음. 일도 못하고 말만 많이 하고 회사 불만만 떠들어대서 분위기는 안좋음 못난 인간들 빨리 정리 좀 해주면 좋겠다 2. 야근이 좀 있음. 임원들이 퇴근을 안함
5,㈜제이엘케이,3903,1. 대표는 아래의 불만을 들으려고 하지 않음. 2. 수석부사장은 어떤일을 하는지 알수가 없음. 3. 뇌전문 기업으로 거듭나겠다고 하는데 도대체 알수 없음
6,㈜제이엘케이,3903,실 사업보다 투자사 보여주기용 액션이 활발하고 실무진만 갈려나감
7,㈜제이엘케이,3903,- 회사 상태가 인력 측면에서 보면 사상누각 - 발전하려는 방식이 인원 충원이 아닌 남은 인원을 갈아 넣는 방식 - 알 수 없는 이유로 인한 정기적인 자리 이동 - 외근 인원들에 대한 지원 미흡
8,㈜제이엘케이,3903,너무 경직되어 있음  의사체계 무시  지각에 너무나 민감  감시 심함  사람 내보내기 많음  퇴사율만 봐도 보임  최소한 일은 잘해야 서바이벌함
9,㈜제이엘케이,3903,장점이 없다. 개발자가 가면 커리어가 꼬이기 띡 좋다. 배울점이라곤 1도 없다. 배울 사람마저도 없다.
10,㈜제이엘케이,3903,경영진. 진짜 다른 모임이라도 나가보세요 이렇게 주먹구구식으로 운영하는데있나
11,㈜제이엘케이,3903,방만한 경영 아이템은 좋은데 재대로 활용을 못함 매출이 없어 정부 바우처 사업에 매달림 직원들을 하찮게 여김
12,㈜제이엘케이,3903,"뭐하냐고 물어보면 답하기가 조금 곤란함, 방향성이 뭐냐고 물어보면 답하기가 조금 곤란함"
13,㈜제이엘케이,3903,"아쉬운 연봉, 주먹구구식 운영, 역에서 거리가 먼 사옥"
14,㈜제이엘케이,3903,"1. 몇 없는 시니어 인력. 하지만 있어도 있으나 마나. 2. 연구직, 개발직 신입만 가득. 혼자 모든걸 감당해야 합니다. (물론 책임도) 3. 체계야 당연히 두말할것도 없고 4. 전문연구요원 갈아넣는 곳(이런 대우 받으려고 힘들게 공부한거 아닙니다.) 5. 감시 6. 근속년수와 퇴사율이 이 회사의 모든것을 증명 기술보다는 말 잘하고, 적당히 가늘고 짧게 회사를 다니고 싶다면 이 회사를 추천합니다."
15,㈜제이엘케이,3903,1. 경영진의 경영 수준 2. 자율출퇴근? 없음! 3. 업무체계? 없음! 4. 어마무시한 퇴사율!
16,㈜제이엘케이,3903,"체계적인 것이 없으며, 직원을 괴롭히는 사람도 있고 직원들을 해고하는데 거리낌이 없음"
17,㈜제이엘케이,3903,1. 실력이 좋은 시니어가 존재하지 않음. 2. 복지가 부족함
18,㈜제이엘케이,3903,"1. 대표님 파워가 없다. 전/현직원은 이유를 알 것 2. IT회사가 IT스럽지가 않다. 재택, 유연근무 일절 없음. 생각해보니 채용공고에 조식제공이니 뭐니 쓰인 게 다 현재 없는 일인데 이거 공고 문제 안 되나 봄. 한 수 배웠습니다. 3. 이미 이 바닥에 직원들 대우 안 좋다고 소문 났는데 개선의지 1도 없고 사람이 안 뽑힌다 함. 아 개선의지는 잘못 된 표현이고 개선 자각을 못함. 4. 전문연구요원이라는 특혜로 정보가 없어 뭣 모르고 입사했던 시절 운 좋게 유수의 대학 인재들 싼 돈에 쓰던 과거 영광을 못 잊음 5. 복지=사내카페 6. 커리어 망가지기 좋은 구조 7. confluence jira notion .etc 안 씀 사랑해요 G DRIVE 8. “””””” G drive G drive G drive”””””” 9. “””””” MS word MS word MS word”””” 10. 계속 쓰라면 100번까지 기술 가능. 잡플래닛 단점에 언급 된 공통사항 눈이 있다면 객관적으로 뭐가 문제인지 알 수 있음 이직 염두자는 그걸 보고 판단이 될 거고 경영진은 그걸 보고 개선할 수 있음. 근데 이렇게 적는 건 경영진 보라고 쓰는 게 아니라 이직할 곳 찾느라 서칭에 소중한 시간 쓰는 당신들 보라고 써주는 거임"
19,㈜제이엘케이,3903,"체계가 없다. 능력있는 직원들 대 탈출 러쉬로 이상한 업무가 막 날라오기도 하고, 직원감시도 하는 사람있다."
20,㈜제이엘케이,3903,공들여 만들면 뭐하나. 누가 사용하지도 않을 서비스. 하나하나 말해봐야 입만 아프다.
21,㈜제이엘케이,3903,- 퇴사자가 많아서 업무 인수인계가 매끄럽지 않고 임원들도 직원을 소모품 취급함
22,㈜제이엘케이,3903,강압적인 경영진 회사의 방향성이 없다 직원들을 위하지 않는다.
23,㈜제이엘케이,3903,점점 줄어드는 복지와 유연근무제가 아니라 아쉬운데 회사 사정이 나아지면 다시 좋아지리라 기대합니다.
24,㈜제이엘케이,3903,직원들 근태관리를 잘 하지않아 출근시간이 모호한 친구들이 많으며 보여주기식 업무가 많다보니 실제 무언가 일이 끝까지 성사되지 않는 경우가 많아 동기부여가 크게 되지않음
25,㈜제이엘케이,3903,"물론 사측과 임직원간의 의견 차이가 있을 수는 았지만, 독불장군 같은 한 사람이 직원들을 애 취급하면서 찍어 누름. 쓸데 없는 서류 작업이 너무 많음 (진짜 일회성 서류 작성)"
26,㈜제이엘케이,3903,회계 담당자가 왜 이사까지 올라갔을까? 등기이사외 임원들이 왜 그리 많이 있을까? 매출이 30억인데 임원들 그외 인원이 15억 이상을 가져갈까? 과연 이게 정상적인 회사인가?
27,㈜제이엘케이,3903,복지 제도가 다양하지만 실제로 쓸만한게 없음. 직급 체계가 역삼각형이라 실무자는 적고 위의 직급은 많아 불편함.
28,㈜제이엘케이,3903,체계성이 없습니다 퇴직율이 1년안에 90%가까이 됩니다. 실제 솔루션이 제대로 된게 많이 없습니다. 직원들 실업급여를 절대로 안 해주고 퇴직시킵니다. 부당해고 시켰다가 악덕기업으로 뉴스기사에 나왔습니다.
29,㈜제이엘케이,3903,적자가 너무 심하다보니 직원들이 고용불안에 떱니다. 언제 짤릴지 회사가 언제 없어질지...
30,㈜제이엘케이,3903,경력을 살릴수도 없고 남의 집 귀한 자식들 갈아서 본인들 주머니 채우기 바쁜 사람들 위해 일하는 스트레스
31,㈜제이엘케이,3903,"말도 안되는 일정, 주먹구구식 업무, 겉보기엔 좋은 스타트업업체로 보이지만, 들어가면 글쎄요... 잘생각해보고 들어가세요."
32,㈜제이엘케이,3903,굴러들어온 돌이 해당본부 임원없다고 부서안팍으로 이간질을 너무 많이함 같은부서사람들 불쌍한데 다들 버티는거보면 한통속일지도. 본인 지식도 능력도 없는건지 이간질외에 올라갈방법을 못찾은건지 남을 후려치지 않으면 안 되는 성격인 듯
33,㈜제이엘케이,3903,"-포괄임금제(한달 식대14, 야근수당x) -6월 이후 입사시 연봉 협상 없음(다음년도 연봉 동결or최저상승) -연봉협상이 아닌 연봉통보 -주말 추가근무시 미리 허락받아야함 -필요없어지면 사람 피말려서 퇴사시킴 -복지포인트로 사먹을 수 있는 사내 카페 가격 올림 -지각하면 사유고뭐고 복지포인트 삭감+반차 써야함 -지정된 휴게시간 존재. 이외에 휴게할 경우 찍힘 -엘베 하나이고 자주 고장남. (홀수달엔 홀수층만 사용) -의료 인공지능에 대한 지식이 1도 없는 경영진"
34,㈜제이엘케이,3903,사업을 위한 최소한의 준비인 제품과 서비스가 없습니다. 모래성위에 지어진 멋진 궁전
35,㈜제이엘케이,3903,1. 직원에 대한 대우 역시 돌같이 한다. 2. 업무능력 외에 사회생활로 평가받을 수 있어 불합리함을 느낄 수 있다. 3. 회사 매출에 기여 하더라도 성과금을 못받을 수 있다.
36,㈜제이엘케이,3903,"단순 보고를 위한 문서 작업이 많아서 비효율적이며, 복지 제도가 부족합니다. 과장 차장이 많아서 승진 기회가 힘듭니다."
37,㈜제이엘케이,3903,정확히 무슨 일을 하는 회사인지 잘 모르겠다. 기업의 원래 모토와 크게 관련없는 부서에서 일을 해서 더더욱 잘 모르겠다.
38,㈜제이엘케이,3903,사람들이 무능하다. 좋은 사람이 들어와도 회사가 답이 없으니 금방 나간다. 80명 남짓한 회사에 1년 퇴사자가 80명 ㅋㅋ 그렇게 못 나가는 사람들과 곧 나갈 사람들로 구성되어 있다. 그래서 딱히 일할 의지도 없다. 2주면 끝날 일을 한달을 끌어도 아무도 뭐라고 못함.
39,㈜제이엘케이,3903,프로젝트 진행에 대한 이해도가 부족해 보임 팀 구성이 갖춰지지 않음
40,㈜제이엘케이,3903,"너무 많아서 모부터 써야 할지 감이 오질 않네.. 일단, 시스템이라는 것이 없음. 제품이 로드맵이 있어야 하는데 그냥 주먹구구식으로 진행하는 데 관리하는 사람도 없음. 여기서 일하면 진짜 일 못 배운다."
41,㈜제이엘케이,3903,경영진의 과도한 업무 푸쉬로 인한 스트레스 발생가능하며 이를 잘 매니지 해야함
42,㈜제이엘케이,3903,"- 체계가 없다. - 어떤걸 하고 싶어하는지 잘 모르겠다. - 회사에 놀면서 급여받는 루팡이 많은거 같다. 어떤 삼인방은 맨날 카페에와서 1시간 이상 웃고 떠들다가 간다. 그것도 매일 매일... 진짜 대단함 하루도 빠짐없이, 그 시간대에는 늘 있는거 같다. 남자들끼리 무슨 할말이 많은지.. 나 루팡이다라고 광고하는건가...?"
43,㈜제이엘케이,3903,자율성이 떨어지고 답답함 연차사용이 어려움 내세울만한 제품이 없음 경쟁사와 비교우위에서도 떨어짐
44,㈜제이엘케이,3903,단순 보고를 위한 업무들이 좀 있음. 서류상 작업들이 꽤 있음.
45,㈜제이엘케이,3903,야근이 그래도 좀 어느정도 있는편이지만 자기 할 일 다 끝내면 어느정도 일찍 퇴근은 가능하긴함. 연봉은 생각보다 그렇게 높지는 않는 편.
46,㈜제이엘케이,3903,단순 보고를 위한 서류업무가 많다. 그외에도 비효율적인 업무가 너무 많다.
47,㈜제이엘케이,3903,연차를 사용하려면 회사 높은분들의 승인이 모두 필요하다.
48,㈜제이엘케이,3903,"헷갈리지 마세요. 제대로 서비스 되고 있는 제품 없는 회사입니다. 계속 빈껍데기만 만들어서 정부지원금 타먹어서 운영하는 느낌. 진득하게 하는거없음. 여기 경력으로는 이력서에 적어낼게 없음. 좀더 작더라도 서비스 회사 가는게 낫습니다. 상상도 못해본 꼰대질 경험해볼수있음. 직원들도 하나같이 노답인게, 둘이상 모이면 회사 욕하고 남 뒷담깜."
49,㈜제이엘케이,3903,- 시차 출근 폐지 - 연차 사용 5일 전에 미리 기안 - 재택근무 없음 - 조식 제공 중단
50,㈜제이엘케이,3903,기업의 방향성이 없다. 임원진이 오락가락 한다. 기준이없다. 사람귀한줄 모른다. 쓰다버리면 그만.  도대체 투자를 어떻게 받은건지 의문이다.  여기 후기 보고 악평만 있어서 나가는 사람이 뭐 좋은이야기 쓰겠냐 하면서 입사했는데. 아.. 정말 노답.
51,㈜제이엘케이,3903,회사 비전과 방향성을 직원들과 소통했으면 좋겠음 카톡으로 보고하는 부분이 불편함 회사 메신저가 활성화 되었음 함
52,㈜제이엘케이,3903,단순 보고가 진짜 많음 뭐가 그렇게 많은지 계단식으로 보고해야함
53,㈜제이엘케이,3903,"하고자 하는게 너무 많다. 정확하게 뭘 하고 싶어 하는지 모르겠다. 1주일에 이것도 해야하고, 저것도 해야하고 내려오는 프로젝트가 정말많다. 이 프로젝트들이 다 체계가 있는지, 방향성이 있는지 모르겠다. 비전??은 당연히 없다. 야근을 하는데 야근수당은 없다. 주말수당은 존재하지만 주말근무를 하기위해선 미리3일전에 주말근무계획서를 올려, 승인이 떨어져야 주말근무를 할 수 있다. 실속보다 보이는걸 중요시 하는거 같다. 사내에 코로나 확진자가 나와도, 근무하는 층이 다르면 알려주지 않고, 같은층에 확진자가 나와도 재택근무를 하지 않는다. 개인 연차는 5일이전에 미리 올려야 휴가를 갈 수 있다. 5일 이전에 안 올렸을경우, 사유를 세세하게 적어야 휴가를 갈 수 있다. 업무집중근무시간이란걸 해서 오전에 휴계시간 15분, 오후에 휴계시간 15분을 주고 그외의 시간에 밖으로 나가면 근무지 이탈로 징계를 먹을 수 있다. 당연히 담배피러 나가는것도 안된다. 흡연자한테는 최악의 회사이다. 시차 출퇴근이라는게 존재하는데, 8 to5, 9 to 6 이건 누구를 위한건가?? 누구는 시차출퇴근이 되고, 누군 안되고 할려면 다 같이 신청받고 선택하게 해야 하는거 아닌가? 8시 출근 5시 퇴근은 아침 8시에 와서 카페테리아에서 커피받고, 수다 떨고 1시간 특혜를 받고 9시부터 일하는거 같다."
54,㈜제이엘케이,3903,너무 많아서 이게 진짜 뭐하는 회사인가 싶다. 그래서 뭘 하고싶고 뭘로 매출을 내고싶은지 방향성도 없고 체계도 없고 비전도 없다. 대외적으로는 젊은 이미지를 표방하지만 속지 마라. 새벽이든 자정이든 주말이든 아주 그냥 시도때도없이 업무 카톡이 온다. 야근해봤자 포괄임금제라 야근수당도 없다. 경영진들의 말이 앞뒤가 다르고 지시사항은 어제 오늘이 다른데다 뭔놈의 보고서는 2중 3중 4중으로 쓰라하고 경력직을 뽑아놓고 신입처럼 굴린다. 코비드19 확진자가 발생해도 전사 공지는 커녕 쉬쉬한다. 휴가를 빙자해 개인 연차를 강제로 쓰게한다. 일과중 개인 휴식 시간을 강제한다. 근로자를 노예로 생각하는게 분명하다. 여기서 TIP~♡ 8 to 5 또는 9 to 6 선택 가능한데 굳이 선택한다면 8시 출근을 하면 한 시간 꿀빨고 놀 수 있다. 그럼 20000
55,㈜제이엘케이,3903,아직은 부족한 복지혜택. 상장을 하긴 하였지만 아직 스타트업이라 어느정도는 이해하지만 조금 부족한 수준. 연차는 5일전 기안 올려야 하는게 조금 불편
56,㈜제이엘케이,3903,"경영진 마음대로 모든 것이 진행 됨 (보상도 마찬가지임). 경쟁사에 비해 박사급 인공지능 연구원 매우매우매우 부족함에도 연구 중심 회사라고 함. 구조적인 문제가 심각함 (쌍방향 소통 불가능 + 사원들 불러놓고 PM함). 장기적인 목표는 대표이사만 가지고 있고, 부사장이나 임원들은 그런거 관심 없고 자기 배만 불림. 깃허브 복붙해도 모름..."
57,㈜제이엘케이,3903,"야근수당 한 번 받기위해 신청하고 제출해야하는 서류 많음 기업규모를 늘려나갈 수록 정치하는 사람들이 많아져서 직원들이 고생 경영부서에서는 재무팀이 모든 힘을 다 가지려고 함 인사팀,총무팀과 분배하지 않음 사람을 귀하게 여기지 않음 일 못하는 각 팀의 몇 몇 우두머리들 때문에 직원들이 고생 전문경영인이 없는 임원들 사이에서 직원들이 완전 맘고생"
58,㈜제이엘케이,3903,"사내 정치, 구조조정 등으로 직원들 간 사이가 좋지 않고 고소를 당해서 뉴스에 나오는 등 기업 분위기가 좋지 않음."
59,㈜제이엘케이,3903,"1. 경영진이 일개 직원들 모아 놓고 pm함 2. 제품 자체의 퀄리티 보단 껍데기 만들어 놓고 주가 상승을 기대함 3. 팀장급 이상의 시니어 직원들이 부재하며, 모든 일이 아마추어 경영진의 지시로 진행됨."
60,㈜제이엘케이,3903,"- 사원, 일반 연구원에게는 지옥 - 껍데기만 잘 만들어서 일단 할수 있다 말하고 공시 때리고 이후에는 다 나몰라라 결국 책임은 개발 이상하게 했다면서 연구원, 사원책임. - 무한 책임제"
61,㈜제이엘케이,3903,문서 작업량이 많습니다. 때때로 잦은 미팅이 있을 수 있습니다.
62,㈜제이엘케이,3903,재직당시 소규모 인원으로 운영되어서 조직체계 미흡하였으며 현재는 다를 것으로 예상
63,㈜제이엘케이,3903,스스로 모든 일을 다 해야하는데 스타트업처럼 자율권이 주어져있고 수평적인 구조이거나 성과에 대한 보상이 확실히 주어지지 않음. 조직화 및 체계를 잡으려고 하는데 임원진 중에 해당 실무를 봤던 경험이 있는 사람이 없어서 실무 중심으로 조직 개편이 되지 않음. 주먹구구식으로 해결하는 편.
64,㈜제이엘케이,3903,개발 영업 연구원들을 그야말로 공장에서 벽돌을 나르는 수준으로 취급
65,㈜제이엘케이,3903,"단순 보고를 위한 보고서 작업, 매우 빈번한 새벽까지의 근무, 임원진/팀장들의 일단위의 성과 압박.."
66,㈜제이엘케이,3903,- 사업을 하는것이지 사리사욕을 채우는지 모르겠다. - 임원 경영지원만 가족같은 회사_과연 투자금이 어디로 흘러가는지 궁금하다. - 상장사라고 하지만 이런 회사가 상장한다니.... - 영화에서 볼듯한 비자금이 조성될듯한 회사 심증은 있는데 물증이 없다.
67,㈜제이엘케이,3903,비효율적인 의사결정과 뚝심있게 일이 진행되지 않는다. 회사의 비전이 나의 동기로 귀결되지 못한다.
68,㈜제이엘케이,3903,유독 한 부서가 모든 권한을 다 쥐고 있다(들어가서 한달만 있어도 다 들릴듯) 본인들 입맛대로 쥐락펴락 하더이다 변할 곳이 아니어서 나옴 변했다면 진작에 변했을 것 풍문으로 들은 얘기를 경영과 인사관리에 참고함..
69,㈜제이엘케이,3903,젊고 어린 직원들로만 이루어져 문서체계 부족 시스템적으로 누구는 너무 편하게 일하고 누구는 이유없이 일이많아질수도있다
70,㈜제이엘케이,3903,타이트한 업무 일정에 비해 터무니없는 인력과 주먹구구식의 업무 진행으로 과로가 일상인 직원이 태반
71,㈜제이엘케이,3903,의료인공지능 회사인데 관련 업무를 했던 사람이 없음. 남들이 이미 해놓은것을 따라가기만 하고 그 이후가 없음. 기술특례로 상장했으나 연구에 투자가 없어 미래가 어두운 회사. 처음엔 앞서 나간거 같았으나 진득하니 비전을 가지고 연구중심으로 깊이를 더해 커가는 인공지능 회사들에게 추월당하는중. 가능할지는 모르겠으나 지금부터라도 방향전환을 한다면 실날같은 희망이 싹틀수도 있음. 그러나 매출의 거대한 압박이 상황을 더 악화시키는 중. 거대한 오너리스크.
72,㈜제이엘케이,3903,직원들과 주주들의 동상이몽 나누지않으려는 사람과 기회노리는 사람 희생안하려는 사람과 희생당하는 사람 착취자가 되려는 사람과 착취당하는 사람 이기적인 사람과 이타적인 사람 가면 쓴 사람과 가식없는 사람 외부와 싸우려는 사람과 내부와 싸우려는 사람 법을 직원 통치 수단으로 활용하려는 독재자적 발상
73,㈜제이엘케이,3903,자신이 맡게 되는 일이 사람에 따라 만족스럽지 않을 수 있음 때로 듀가 다소 촉박한 느낌이 있음
74,㈜제이엘케이,3903,"경영진이 개발 영업등에 대해 이론적으로만 알고 경험이 없어 회사가 산으로 가는중 특허는 많으나 팔 수 있는 제품이 없어 정부 바우처 사업에 전사가 올인하고 있음 비전 제시가 없음 퇴근전, 퇴근후, 주말 쉴새없는 카톡과 메일 전략과 전술없는 전사 매출 압박. 눈앞에 바우처만 보고 있고 지인도 동원해야 함 위에 찍히면 보직변경으로 퇴사 유도 실업급여 안해주려고 함 젊은 팀장들이 일은 안하고 정치질만 하고 있음"
75,㈜제이엘케이,3903,노트북이 느려서 디자인 업무가 힘들었음 개발자분들과 영업팀이 싸움 임원들과 직원들 사이 분위기 안좋음
76,㈜제이엘케이,3903,"카페를 제외한 모든 것이 단점. 체계도 없고, 개념도 없고, 기본적으로 갖춰야 하는 알맹이가 없음. 병역특례 인원들 없으면 돌아갈 수 없는 회사. (1년 반 이후 병특도 떠나는걸 보면 이유가 있겠죠)"
77,㈜제이엘케이,3903,연차사용이 자유롭지는 않습니다 빌딩이 면접이 작아서 부서가 서로 떨어져 있습니다 지하 카페는 무제한 사용이 아닙니다 회사 목표를 알기 어렵습니다 선배가 될 만한 시니어 개발자가 없습니다 1년 6개월 병특기간 와서 스스로 후회를 많이 합니다 루닛과 뷰노에 비해 자부심이 떨어집니다
78,㈜제이엘케이,3903,세상을 잘 모르는 친구들이 불만을 많이 이야기하여서 진짜 나쁜 것 같다는 착각을 가지게 함 빨리 정리하고 입맛에 맞는 친구들로 구성해야 할듯
79,㈜제이엘케이,3903,아직 초기라고 볼수있다보니 변화무쌍하게 회사가 돌아가서 가끔 교통정리가 안되어서 어지러움
80,㈜제이엘케이,3903,근태 관리가 많이 요구되고 근무에 있어 자율성이 떨어짐
81,㈜제이엘케이,3903,놀게 안함. 구조조정으로 12월 힘들었음. 2021년 매출을 위해 더 열심히 뛰어야 함.
82,㈜제이엘케이,3903,인원은 계속 뽑고 있으나 퇴사율이 높은편임 아직 영업이익을 뽑고 있지않음
83,㈜제이엘케이,3903,경쟁사 대비 평균 연봉 많이 적습니다. 야근 있습니다. 야근수당 없습니다. 퇴사자가 너무 많습니다. CCTV 있습니다.
84,㈜제이엘케이,3903,"크레딧잡 기준 퇴사율 112%. 블라인드 기준 평점 1.6 (블라인드는 제이엘케이인스펙션 으로 검색해야 나옴). 잡플래닛은 인사팀에서 지속적으로 삭제요청해서 평점 관리한게 이 정도. 사내메신저는 안쓰고 카카오톡 단톡방 여러개 사용. 전문연구요원은 인사팀의 겁주기식 강요에 못이겨서 바로 편입신청하지 마시고, 꼭 한달 정도 다녀보고 결정한다고 말하세요. 편입신청하는 순간 일년반은 잡혀있는거라서 회사에서 입사하자마자 편입신청 강요합니다."
85,㈜제이엘케이,3903,업무가 너무 주먹구구식. 지속적인 개발을 할 수 있는 환경이 아님
86,㈜제이엘케이,3903,퇴사자가 이렇게 많은데 기업이 얼마나 버틸 수 있을지 의문입니다. 내부 직원들 표정도 좋지 않습니다. 스타트업에서 내부 동력이 중요한데 전체적으로 침체된 느낌에 걱정이 앞섭니다. 개발자 연구원들 정신교육이 필요해보입니다
87,㈜제이엘케이,3903,직원들이 서로 말을 잘 안하고 밥도 각자 먹는다. 업무를 같이 하는 분위기가 아니라 혼자 한다.
88,㈜제이엘케이,3903,과도한 일량. 스타트업 답게 많은 일을 커버함. 병특이 많아서 사회생활 경험이 없어서 임원진이 고생함. 다른데 가면 더 개 고생할텐데 ^^
89,㈜제이엘케이,3903,"잡무가 좀 많음. 칼퇴 가능하긴한데, 좀 눈치가 많이 보임."
90,㈜제이엘케이,3903,"체계가 아직 없음 부족하다느껴짐 업무의 편중이 심한 편 발언의 자유도, 연차의 자유도가 높지 않음"
91,㈜제이엘케이,3903,회의를 위한 회의. 생각이 없는 지시. 실력없는 리더들.
92,㈜제이엘케이,3903,- 아직 회사의 시스템이 과도기적이다. - 일에 대한 책임제로 부담스러울수 있다. 그러나 보상은 확실하다. - 아침 9시 출근이다. - 편의점에 탄산수가 많다. ㅜㅜ
93,㈜제이엘케이,3903,기업에서 추구하는 업무를 온전히 하기위한 인력이 부족함에도 다양한 일을 벌이기때무에 업무량이 과다함.
