,company_name,company_id,review_text
119,㈜아이스크림에듀,8822,"휴가를 맘대로 쓰지못하는것, 사대보험 없는것 일반직장보다는 일하는 시간이 작지만 꽉채워 근무하는것"
120,㈜아이스크림에듀,8822,비효율적 / 월급 13개월 / 이상향은 있으나 현실적으로 나아가기 위해 필요한 지원 부족 /복지 약함
121,㈜아이스크림에듀,8822,학습관리교사는 영업이 없다고 안내받고 입사했지만 팀장도 윗부서에서 압박이 오는지 팀장으로부터의 회원 친구소개 등을 유치하라는 압박이 있었음 팀장도 10~20명의 교사를 관리하는지라 친절함까지는 바라지 않으나 결론적으로 팀장과의 갈등이 퇴사의 원인으로 작용함 회원과의 상담내용 녹취를 듣고 피드백을 하는 팀장님의 업무를 이해하나 너무 스트레스가 컸음. 가장 강력한 퇴사의 원인 120명 정도의 회원을 일주일동안 나눠서 상담하는데 2주에 한 번 학부모상담이 있음. 118명은 정말 친절하고 좋은 어머님들이심. 꼭 2~3명이 사람을 미친듯이 괴롭힘. 억지를 쓰고 공부를 하지 않고 편법으로 시스템을 악용해서 쓰는 아이의 학습태도등에 대해 이야기하면 우리애는 그렇지 않다며 소리지르고 쌍욕까지 하는 부모님도 있었음 이건 어떤 cs 상담업무를 해도 꼭 있는 부류인듯.. 정도가 심해지면 팀장에게 넘어가고 억지부리는 회원은 회사측에서 차단해주긴 하지만 트라우마 상당함 마지막 단점은 오후 4시부터 밤 10시까지가 업무시간이라 젊은층에게는 다소 힘들 수 있음
122,㈜아이스크림에듀,8822,연봉이 좀...아쉬운 수준. 회사 내에 휴게공간이 마땅치 않음. 재택근무에 소극적. 딱 최소한만하는느낌
123,㈜아이스크림에듀,8822,"순위에서 밀리면 계속 업무가 늘어지게 되고, 연봉은 언제나 통보."
124,㈜아이스크림에듀,8822,"실질적으로 실무 뛰는 직급이 없음 >> 고인물 위주, 동종업계에서 밀리는 중"
125,㈜아이스크림에듀,8822,비효율적 업무시스템과 능력없는 사수들 / 배울게 하나 있다면 저 사람처럼은 하지 말아야지 느끼는 부분 / 회장 주식 팔아 떼 돈 벌음 (직원들은 두 세배 이상으로 삼)
126,㈜아이스크림에듀,8822,"인력이 부족해도 인력보충 안해줌, 신규사업으로 삽질할때가 많음,"
127,㈜아이스크림에듀,8822,텃세가 정말 대단하다 얼마 안된 기업인데 젊은 텃세 젊은 꼰대 많다
128,㈜아이스크림에듀,8822,업무강도 부터 복지제도 활용까지 팀바팀이 너무 심함. 퇴사자가 있어도 사람을 안뽑아줌.
129,㈜아이스크림에듀,8822,"표방하는 에듀테크 기업이라기에는 인적, 조직적 지원이 낮음. 회장님 이하 CEO 등 임원급들의 독단과 핸들링이 적정선을 넘었음. 월급루팡들 산재."
130,㈜아이스크림에듀,8822,"회사분위기는 부드러운 편이나 팀, 파트 별 분위기 차이가있어고 그에 따른 업무환경 차이도 큰편임 일하는 사람은 업무량 초과인데 루팡에대한 패널티가 없어서 열심히 일하는 직원들에게는 불합리하다고 느껴지는 부분이 많음"
131,㈜아이스크림에듀,8822,인하우스 디자인의 커리어로 적절하지않음 개인커리어 욕심있으면 힘들다
132,㈜아이스크림에듀,8822,조직개편이 지속적으로 일어나는 곳. 최고의 복지인 월급은 상대적으로 높지 않음. 현재 건물이 좁아서 사람에 비해 화장실 개수가 적어 가끔 화장실을 가기 위해 몇개층을 돌아다녀야 함.
133,㈜아이스크림에듀,8822,회장님 근처에서 말 전하는 간신배들 때문에 회사가 난장판임.
134,㈜아이스크림에듀,8822,프로젝트를 할때 책임자 리더의 부재로 늦어지는 업무일정
135,㈜아이스크림에듀,8822,"개발팀은 자율출퇴근 불가능, 개발자 인력 부족으로 인해서 일정이 부족함, 기획팀과 교과팀 조율이 힘듬, 너무 잦은 조직개편으로 부서이동이 많음, 인사과는 직접 찾아가서 말하지 않으면 절대 확인불가."
136,㈜아이스크림에듀,8822,"음,,, 급여가 좀 짜다는 점? 좀 더 보상이 되었으면 좋겠다"
137,㈜아이스크림에듀,8822,"부바부 인것 같습니다. 즉 조직관리가 안되니 부서장에 따른 차별이 많습니다. 정규직보다는 계약직, 아르바이트가 많습니다. 그리고 1년 시용평가 후 전환되는 케이스도 많지않습니다. 사람을 도구로 아는 회사"
138,㈜아이스크림에듀,8822,주먹구구식 운영 말도 안되는 일정으로 프로젝트 시작하여 죽을힘으로 오픈 해두면 바로 외면 무능한 대표의 포폴 쌓기식 사업 구상
139,㈜아이스크림에듀,8822,역성장중 윗급들의 무능 업무가 아닌 정치에 바쁜 윗분들 적재적소에 적합한 인력배치가 안됨 구성원 개개인의 역량차이가 심함
140,㈜아이스크림에듀,8822,"신사업을 추구하지만 부딪히는 타부서에 협의와 해결점을 모색하지 못하고, 급급한 보여주기 식의 윗선으로 인하여 매년 소리 소문 없이 사라지는 많은 부서들"
141,㈜아이스크림에듀,8822,"발전이 없는 서비스와 정체된 성장으로 인한 도태, 적당히만 일하는 동료들 사이에서 업무적 성장은 이루기 힘든 분위기"
142,㈜아이스크림에듀,8822,"체계가 정말 너무 없음. 하나하나 만들어가는 느낌. 불편한 사람이 이의제기하고 만들어가야 하는 구조임. 야근 눈치 많이 보임. 해도해도 일이 너무 많음. 업무 요청하는 툴과 회사 그룹웨어, 회계 프로그램의 단순화가 요구됨. + 사옥 엘레베이터가 한 대뿐이라 출근 시간엔 굉장히 오래 기다려야 함."
143,㈜아이스크림에듀,8822,일을 제대로 할 수 있는 사람이 거의 없음. 업계에서 이상하기로 유명한 사람들이 모두 모이는 쓰레기통 같은 곳이기도 함. 그냥 생각없이 다녀야만 하는 곳.
144,㈜아이스크림에듀,8822,"회장님 말에 따라 우당탕탕 일이 굴러감. 다들 회장님 눈밖에 날까봐 노심초사. 부서들이 점점 이기적으로 일하고, 책임안지려고 하기 바쁨. 책임질 일 만들었다가 언제 잘릴지 모르니까."
145,㈜아이스크림에듀,8822,과거의 영광에만 묶여 현재를 보지 못하는 회사 진짜 문제점을 파악조차 못하는 임원들 윗선의 마이크로매니징이 너무 심함 일하는 사람만 일하는 회사 정치질 끝판왕 교육업계는 정치로 살아남는가 싶은 정도 어디서 이런 외주를 갖고 왔나 싶을 정도의 수준인데 알고보니 임원들의 손길이 뻗은 것들....ㅎ 잦은 조직개편 안정성? 별로 없음
146,㈜아이스크림에듀,8822,"기업 문화가 뭔가 없음. 부서바이부서, 팀바팀 사업계획과 상관없이 계속 일이 내려옴"
147,㈜아이스크림에듀,8822,방향을 잃고 돈만 쓰고 있다는 느낌. 회사를 이끌 인재가 다 떠남
148,㈜아이스크림에듀,8822,현재 타사에 비해 발전속도 더딤 현재에 안주하고 보수적임
149,㈜아이스크림에듀,8822,"그러나 최근 콘텐츠에 대한 비용을 줄이고 있어, 어려움이 있다."
150,㈜아이스크림에듀,8822,단점은 아르바이트이여서 식비가 안나온다는 점 이말고는 단점이 별로 없었습니다
151,㈜아이스크림에듀,8822,부서 혹은 팀 이동이 잦다 신입은 잘 안 뽑는다 사업이 이리갔다 저리갔다
152,㈜아이스크림에듀,8822,"회의가 많고, 서로 하지 않으려고 하는 문화 책임을 넘기는 문화 좋지 않다"
153,㈜아이스크림에듀,8822,인사이동이 많고 분위기가 가끔 살벌하다. 업무적으로 성장하기는 힘들다.
154,㈜아이스크림에듀,8822,"최근들어 엄청난 퇴사율, 연봉 기본 인상율이 점점 낮아지며 타 기업과 비슷한 수준으로 복지가 한두개씩 사라짐"
155,㈜아이스크림에듀,8822,확실한 의사결정이 필요함 집중과 선택이 필요 합니다 직원들을아껴 주세요 정치
156,㈜아이스크림에듀,8822,"대표이사가 경영을 모름, 회장의 사람보는 눈 없음, 대표이사, 회장이 사람을 신뢰하지 않아 쉽게 사람을 정리함, 체계를 본인들 스스로 망가트리고 있음 (기존에도 체계는 없었으나 경영진 때문에 더 없어지고 있음)"
157,㈜아이스크림에듀,8822,정치질이 심하다 부서간 싸움도좀 있고 희한한 일들이 자주 발생한다
158,㈜아이스크림에듀,8822,연봉 높지않음 체계가 없음 다들 오래 버티지 못함 퇴사율 높은데는 회사에 이유가 있다고 봄
159,㈜아이스크림에듀,8822,프로젝트는 운영처럼 운영은 프로젝트처럼 체계가 없습니다
160,㈜아이스크림에듀,8822,아직 커지는 중이라 기업문화 등의 정착이 필요..성장통의 해결이 중요
161,㈜아이스크림에듀,8822,경영진이 방향을 못잡고 교육업에 대한 이해가 부족해보임. 이제 교통편이 아주 안좋은 곳으로 이사
162,㈜아이스크림에듀,8822,사람은 늘어나지만 본인일 외에는 관심없음 어디나있는 정치판
163,㈜아이스크림에듀,8822,"회의가 너무 많고, 조직개편이 너무 잦음. 입퇴사자가 많으므로 회사사람들 얼굴 익히기가 힘들어요."
164,㈜아이스크림에듀,8822,연차 쓰려면 눈치보임. 자기개발이 쉽지 않음. 경영진의 기싸움이 굉장히 불편함
165,㈜아이스크림에듀,8822,"본사 사옥이 크지 않고, 사무공간이 넓지 않음. 휴게 공간이 적음"
166,㈜아이스크림에듀,8822,"실무자가 모든 책임을 다져야 하는 구조, 입으로만 일하는 사람 많음, 지속된 신사업 실패로 과도기에 있음"
167,㈜아이스크림에듀,8822,"연봉이 적고, 연봉 상승률이 아주 낮다. 하지만 타당한 사유가 있다면 조금은 반영 해주는 듯"
168,㈜아이스크림에듀,8822,"주먹구구식으로 일하는 인사팀이 최대 단점으로 보이며, 능력없이 자리만 차지하고 월급루팡하는 팀장들이 수두룩 함."
169,㈜아이스크림에듀,8822,"비효율적인 일처리와 관성적으로 일하는 사람들,,, 분위기도 그냥 그렇다"
170,㈜아이스크림에듀,8822,줄어드는 복지 이걸 한다고?? 이걸 이렇게 한다고?? 이렇게 해도 돼?? 멘트만 나옴
171,㈜아이스크림에듀,8822,정치를 잘 해야만 살 수 있는 곳. 정치 안하고 일만 하면 살 수 없는 곳. 기업의 미래를 생각하고 걱정하는 직원이 없는 곳.
172,㈜아이스크림에듀,8822,회사가 직원들 복지에 관심없어보임/오래된 직원들이 계속 뜨는중
173,㈜아이스크림에듀,8822,요즘 들어 이상한 사업을 많이 벌리는 것 같음..후발주자들에게 자꾸 뒤쳐지는 느낌.
174,㈜아이스크림에듀,8822,프리랜서여 기업의 큰단점은 딱히 없었던것 같습니다. 삼성역에서 걸어서 9분?정도
175,㈜아이스크림에듀,8822,복지가 많이 없어져서 아쉬워요. 어느순간부터 어수선해짐....
176,㈜아이스크림에듀,8822,"삼성동의 비슷한 규모 회사들 중 여기가 인상률이나 초봉 제일 낮지 않을까? 부바부 실바실이겠지만. 회장님 꽂히는 부서는 죽어나고 아닌 부서는 (당연히 사바사겠으나) 저녁시간에 퇴근 안 하고 가방만 걸어놓고 외출했다가 들어와서 야근비 타감. 정기야근자들 정말 야근하나 업무내용 보셔야되지 않을지. 전 죽어나는 부서에 있었는데 건강이 상해서 퇴사했습니다. 퇴사하니까 신속하게 낫더군요. 교육회사답게(IT회사 아님^^) 연봉인상률이 정말 별로고 보상도 계속 줄어드는 편. 승진이나 개인의 성장가능성, 워라벨 다 실바실 부바부로 극과 극임."
177,㈜아이스크림에듀,8822,직원에 대한 불신을 가득히 가지고 있고 자신의 구미에 맞지 않거나 외부에서 주워들은 정보로 현 상황을 평가한다.
178,㈜아이스크림에듀,8822,대표가 나가서 길거리 노점상이라도 해보고 와서 사업했으면 좋겠음. 사업을 하는 사람이 아니라 그냥 공부만 잘하는 사람 데려와서 있어보이는거 하려다가 회사 말아먹는 중.  회사 내에 수동적이고 나태한 사람들이 많아 윗사람이 그나마 일할 의지가 있는 사람한테 일을 겁나 몰아줘서 일할 의지를 역으로 꺾어버림. 야근하란 말은 안하지만 어쩔수 없이 야근을 하는 상황을 만듬.  사업 부서는 본인들이 결정을 하고 이끌어가야하는데 뭐 진행하면 책임져야될까봐 넋놓고 멍때리는 중인 듯.  암튼. 일을 합리적으로 하고자하는 사람은 이 회사에 안맞음.
179,㈜아이스크림에듀,8822,아직 체계가 덜 잡혀있고 일부 인원들이 수동적 개선중임
180,㈜아이스크림에듀,8822,이곳이야 말로 팀바팀 부바부 실바실에 끝을 보여주는 곳.
181,㈜아이스크림에듀,8822,경직된 조직 문화/관리자급 전문성 부재/부지런히 삽질하는 환경
182,㈜아이스크림에듀,8822,기존 고인물들의 변화를 거부하는 배타적 문화가 인재들을 막고있다. 개발업무 쉴세없이 던져주는 회사의 배려로 개발업무는 많이 해볼 수 있다.
183,㈜아이스크림에듀,8822,케바케이긴 하지만 회장님의 압박수비가 있는 부서는 거진 죽어남. 마케팅 영업부서는 성과 압박으로 계속 시달리고 기획과 제작부서는 난 몰라 내길 간다 분위기. 골고루 책임 분배 필요함
184,㈜아이스크림에듀,8822,아이티인력의 천대받는회사 회사는 아이티로 움직이지만 인력자체는 천대당함
185,㈜아이스크림에듀,8822,텃세가 정말 정말 심함 ㅎㅎ 직접 겪지않으면 모름 나도 내가 이런 글을 쓰고있을줄은 몰랐다 ㅎㅎ 경력직을 뽑았으면 새로 온 사람들의 경력도 활용해야하는건데 기존의 종잡을수없는 프로세스(??라고쓰고 없다고 읽으면됨)대로 하라고 강요함.. 이럴거면 그냥 신입 뽑지왜... 회사 규모에 비해 체계가 없음
186,㈜아이스크림에듀,8822,경영진들 및 어느회사나 있는 정치질. 실무진들 의견 무시
187,㈜아이스크림에듀,8822,팀바팀이라 어디가서 누구를 만나느냐에 따라 너무 편차가 큼 좋은 곳은 다 같이 잘해보자 분위기인데 안좋은 곳은 정말 안좋아 보임
188,㈜아이스크림에듀,8822,그나마 있었던 복지가 점점 안좋아짐/ 갈수록 진급하기 어려워짐
189,㈜아이스크림에듀,8822,"인사이동이 너무 자주 일어나고, 성장기에서 정체기로 간 느낌이다"
190,㈜아이스크림에듀,8822,날짜를 찍어놓고 수시로 프로젝트를 한다. 개발자가 회사를 나가도 신경쓰지 않음
191,㈜아이스크림에듀,8822,월급루팡이 많다. 정말 한가해도 이렇게 한가해도 되나 싶은 사람들이 보인다.
192,㈜아이스크림에듀,8822,"HR, 몇몇 실(실장), 멍청하고 체계없는 업무 프로레스, 너도 나도 하려고 하지 않고 서로에게 일 떠넘기기"
193,㈜아이스크림에듀,8822,변화하려고 시도하지만 고인물들이 진행하다보니 정작 큰 변화가 없이 수박 겉핥기식으로 진행된다
194,㈜아이스크림에듀,8822,"업무 밀어내기 끝판왕. 책임전가, 방어, 눈치싸움. 명분만들기 업무 방향성 없음. 단기 성과 중심."
195,㈜아이스크림에듀,8822,"줄어드는 복지 실체도 모르겠는 프로젝트 무능력 팀장, 관심 없는 실장 사내 정치의 신세계 형식적인 인사평가"
196,㈜아이스크림에듀,8822,그이외에 업무 프로세스부터 상사부터 아주 지옥같다 빨리한시라도 빠르게 탈출해야한다
197,㈜아이스크림에듀,8822,인사 평가가 끝나지 않았는데 승진자 발표 HR 대책없음
198,㈜아이스크림에듀,8822,부서별 분위기나 업무 강도 진짜 레알 차이 많음. 사람들이 전반적으로 애사심이 없는 분위기. 조직개편 심히 잦음.
199,㈜아이스크림에듀,8822,야근을 좀 하는것같았음 팀장님이 회의때 딴지걸어서 좀 힘들때가 있는데 그냥저냥 살아짐.변명하다가끝나는듯
200,㈜아이스크림에듀,8822,연봉상승률이 쥐꼬리만하다. 그나마 있었던 좋은 복지들이 어느 새 조금씩 사라져간다. 회의실이 너무 부족하다. 인사팀 소통 부족. 계속 말이 바뀌는 윗선들..
201,㈜아이스크림에듀,8822,"위의 장점의 반대인 점이 단점입니다... 자유로운 문화와 분위기 속에서 본인이 속한 곳만 반대인 문화가 있는게 오히려, 더욱 상대적 박탈감을 느끼게 됩니다. 또한 많은 분들이 말씀해주셨는데, 월급 루팡이 많으며, 꼭 하는 사람만 일을 하게 되어있습니다. 열심히 하는 사람은 결국 열심히만 하게 됩니다. 보상은 거의 일률적이니 참고하시길...."
202,㈜아이스크림에듀,8822,본사 사옥 22년에 다른 곳으로 이전 가능 부바부지만 꼰대 세력이 쎈 곳은 정치질에 질려서 퇴사한 사람도 많음
203,㈜아이스크림에듀,8822,일많음 보고 많음 평가 많음 비효율 관리자 케바케 회의 많음 재택 안함 연봉인상율 낮음 진급 안됨
204,㈜아이스크림에듀,8822,프리가 아니라 직원이라면..팀바팀이겠지만 야근 많고 구내식당 없고..
205,㈜아이스크림에듀,8822,식대가 안나오고 야근을 마니하는거같아여 ㅠㅠ 그냥 그냥 그런회사
206,㈜아이스크림에듀,8822,지배적인 탑다운 방식 업무체계와 절대권력자 오너로 인해 구성원의 무기력함 팽배 / 직원들의 고충을 들어 주지 않는 인사 조직 / 뭘 하는지 모르겠는 월급루팡들 넘쳐남
207,㈜아이스크림에듀,8822,"눈치 야근 압박이 심했고, 당연한 거겠지만 오래일해야만.. 업적으로 능력받는 회사"
208,㈜아이스크림에듀,8822,인수인계 받으라면서 메뉴얼 없는 경우도 허다함. 능력없고 체계 없는데 자기가 일 잘하는 줄 아는 윗선이 많음. 체계 좀 만들었으면. 회사 규모에 비해 인력관리가 아쉽다
209,㈜아이스크림에듀,8822,직원이 많은것에비해 체계가없는데 대기업이하는건 따라함 복지나 일할때 느끼는 부분은 치사하게 느껴지는 수준
210,㈜아이스크림에듀,8822,경쟁사에 많이 밀리고 있는데 돌파구를 찾지 못하는 모습
211,㈜아이스크림에듀,8822,밥먹듯이 하는 조직개편 용두사미의 신사업.. 돈은 잘버는데 다 어디로 가는지
212,㈜아이스크림에듀,8822,"짧게 근무해서 단점을 느낄 시간이 적었지만, 반복되는 업무 때문에 개인적인 커리어 성장에 의미가 큰 사람은 지루함을 느낄수도 있을거 같음."
213,㈜아이스크림에듀,8822,능력없는 윗선들로 갈길을 잃고 있는 것 같다. 올라오는 타사에 밀려 하락중
214,㈜아이스크림에듀,8822,회의가 많고 외주 개발 비율이 높다. 잦은 조직 변경이나 입/퇴사 비율이 높다.
215,㈜아이스크림에듀,8822,맨날 조직개편 함 무능력한 관리자 때문에 실무진 속터지는 소리 때문에 일 못함
216,㈜아이스크림에듀,8822,선장이 없는 배로 업무에 대한 보람을 찾기는 어려움 급여가 목적인 플렉스한 직장생활에는 맞으나.. 일에서 만족감을 느끼기는 어려움
217,㈜아이스크림에듀,8822,꼰대지만 꼰대 아닌척하는 임원들. 일을 제대로 하는 사람이 별로 없다. 다들 눈치보느라 산으로감.
218,㈜아이스크림에듀,8822,"기업 비전에 비해 사람이 너무 많아 월급루팡이 많음. 회사는 점점 어렵고, 사람은 많으니 상여 복지가 점점 안좋아짐"
219,㈜아이스크림에듀,8822,"조직변동이 너무 잦음 실세들에 따른 편파적인 사내분위기 사내정치에 휩쓸리지않게 조심해야함. 그러나.. 윗사람들의 사내정치판에 아랫사람들은 그저 따라갈수밖에 없음 으싸으싸 하기엔 출신별, 직무별 이해관계가 너무 다르고 나름 여러갈래의 조직을 보유하고 있어서 찰흙이 되기는 어려워보임. 뭉쳐지지않는 모래 같은 조직분위기.."
220,㈜아이스크림에듀,8822,경쟁업체들에 많이 따라잡힌 것 같고 사내복지는 점점 줄어드는 느낌
221,㈜아이스크림에듀,8822,"이직률 높음, 영업많음, 멀티플레이, 회사프로그램 문제 많음,홈런기기 에러잦음,야근많음"
222,㈜아이스크림에듀,8822,직원수는 계속 늘어나는데 다 머하는 사람들인지 모르겠음 돈벌어서 핵심사업에 투자해야하는데 신사업 몇년동안 준비하는데 돈먹는 하마인듯 회사 망하는 테크는 제대로 타고 있는듯함 홈런말곤 제대로 성공한 사업이 하나도 없음 일잘한다는 평가 받던사람들 대부분 나감 직원들이 게을러도 윗분들이 정치질 안하고 리더쉽있게 잘 끌고가면 되는데 회장님한테 아부나 떨줄알지 위부터 고이다 못해 썩었는데 나도 이직 준비 심각하게 고민중
223,㈜아이스크림에듀,8822,"부서간의 업무협력도가 낮고, 각 사업부별로 단합이 잘 안되는 경향이 있음.부서이기주의 비슷한 것으로 기억되나, 나름대로 다닐만한 회사임"
224,㈜아이스크림에듀,8822,그냥 하나라도 신규 서비스 오픈 하기 위해서 무리한 일정 요구 그로 인해서 발생하는 스트레스
225,㈜아이스크림에듀,8822,외부에서 계속 사람들을 끌어오다보니 기업의 색깔이 없음. 특히 임원들 중 무능하고 보신만 하는 부서에 소속되면 스트레스가 장난아님.
226,㈜아이스크림에듀,8822,"열심히 일하는 사람을 엄청 긍정적으로 보는 분위기는 아니었음. 워라벨을 추구하는 것이 마치 정상이고, 열심히 더 하려는 사람은 튀는 사람처럼 느껴지는 분위기였음."
227,㈜아이스크림에듀,8822,"- 경영진과 일부 부서의 입김이 강하여 업무에 자율성을 발휘할 기회가 부족함 - IT에 대한 이해가 없는 사람들을 설득해야 하는데, 이 사람들이 서비스 기획과 개발을 주도함. 근데 책임감도 딱히 없는 것 같음. - 실무자를 안 거치고 경영진 멋대로 대외 메시지를 결정하는 경향이 있음. 이 부분 때문에 쓸데 없는 업무가 발생함"
228,㈜아이스크림에듀,8822,1. 비합리적인 인사평가 제도 2. 실력으로 팀장이 되지 않음(타 업무 실무자가 팀장으로) 3. 비합리적인 조직 개편 4. 무능한 조직장(리더 및 관리자로써)
229,㈜아이스크림에듀,8822,"부서간 협업이 안되서 업무하기힘듬 잘되면 우리부서가 한 일, 안되면 어느부서땜에 안되는지 칼같이 회장한테 이름.. 전반전인 사내분위기가 정치판.."
230,㈜아이스크림에듀,8822,뒷담화를 하는 사람들은 어디에나 있다. 강도가 다를 뿐.
231,㈜아이스크림에듀,8822,나 때는 팀장이 ㄷㄹㅇ 엿는데 이제 퇴사한듯?? 고인물들이 많음
232,㈜아이스크림에듀,8822,자리에 맞는 사람을 채용해야 하는데 뽑아놓고 다른 일을 시키는 경우가 다반사. 이해가 안되는 조직운영
233,㈜아이스크림에듀,8822,"연봉이 적고 복지 제도가 약한 점이 아쉬움, 연봉 협상은 좀 더 수평적이었으면 하는 바람"
234,㈜아이스크림에듀,8822,진급 체계가 이랬다 저랬다 매년 바뀜. 연봉인상률도 매년 엉망진창으로 바뀜. 되지도 않는 사업들을 시도하느라 돈과 유능한 직원을 모두 날려버림.
235,㈜아이스크림에듀,8822,자율출퇴근이 선택이라 팀장이 안한다 그러면 못함 포괄임금제라 야근비 거의 없다고 보면 됨 연봉이 적음 이쁨받는 고인물때문에 업무의 비효율을 고칠수가 없음
236,㈜아이스크림에듀,8822,일 하는 사람보다 일 안하는 사람이 많음. 직책자 중 일 잘하는 사람 보기 어려움. 연봉 체계 없음. 직원은 부품취급(고용불안정 조심) 그 외 쓰고싶은게 많지만 말 줄입니다..
237,㈜아이스크림에듀,8822,본인들 이득에만 관심있는 사람들이 점점 늘고 있고 사내 정치가 심함.
238,㈜아이스크림에듀,8822,전문적인 실력을 갖추지 않아도 잘만다닐수 있음. 프로세스 개판.협업 개판.소통 개판.업무능력향상 개판.
239,㈜아이스크림에듀,8822,초봉이 조금 적다. 물론 연차가 쌓이면서 올라가는 연봉의 폭은 높지만 도달하기는 힘들다
240,㈜아이스크림에듀,8822,전략없는 확장으로 구성원들이 힘들다. 대부분 용역으로 제작되는 바람에 관리직들만 많음
241,㈜아이스크림에듀,8822,고인물이많음 인사평가있지만 제대로평가하는지?일안하고못하는직원 잘도버팀
