,company_name,company_id,review_text
0,㈜에스엠투네트웍스,3741,특정 부서의 경우 주말 순번제 근무가 있음 커리어에 대한 고민을 한다면 좋지 않음
1,㈜에스엠투네트웍스,3741,역량을 계속 키우지 못하면 뒤쳐지는 기업이므로 이 부분이 어려우면 적응하기 힘든 곳
2,㈜에스엠투네트웍스,3741,모회사 눈치를 엄청나게 봅니다. 1차 제조업 계열사의 한계인 것 같음.
3,㈜에스엠투네트웍스,3741,삼화에 종속될수 밖에 없는 현실이 있습니다. 그게 장점이자 단점이죠
4,㈜에스엠투네트웍스,3741,업무적으로 발전할 수 있는지 모르겠고 의사결정하는데 다양한 관문이 있어서 아쉬움
5,㈜에스엠투네트웍스,3741,"보수적인 회사, 임원진의 인사능력, 기타 역량 부족, 사내 정치 등"
6,㈜에스엠투네트웍스,3741,현실은 중소기업이지만 대기업 자회사라고 똑같이 따라하고싶어함. 하지만 껍데기일 뿐이고 체계가 없고 수평적이라곤 하지만 승인받는 절차도 너무 복잡하며 보수적임
7,㈜에스엠투네트웍스,3741,"문화가 문제다. 1. 부장 한 명이 온갖 분위기를 다 흐린다. 2. 윗사람들은 그 문제의 부장만 감싸고 돈다. 3. 결국 문화도 망하고, 일도 망하고, 일부 비즈니스는 망해서 통폐합 4. 기존 잘 되던 비즈니스에서도 능력자들 이직 스타트"
8,㈜에스엠투네트웍스,3741,온보딩이 없음 연봉협상 없음 고인물들은 고이다 못해 썩음 정치 등등
9,㈜에스엠투네트웍스,3741,It기업이지만 본사 정책에 영향을 받음...
10,㈜에스엠투네트웍스,3741,파견근무를 나가면 출퇴근이 멀어질 수 있다. 딱히 단점은 없습니다.
11,㈜에스엠투네트웍스,3741,임원진의 무책임 직원이 실수를 하게되면 임원은 책임지지 않음 부서간 이기주의가 무척 팽배함 IT기업의 생명인 기술발전의 의지가 부족함
12,㈜에스엠투네트웍스,3741,삼화 전산실 업무가 주 사업이라고 할지라도 오래되고 판단력 떨어지는 사람들이 아직도 일선에서 설쳐댐 알아서 뒤로빠지던지 해야되는데 발전이 없는이유임
13,㈜에스엠투네트웍스,3741,1.자체개발 보다는 솔루션으로 다 때울려고 한다. 개발하고 싶으면 오지말아야할 회사 2.출근은 빠른데 퇴근시 항상 오버타임 30분에서 1시간 생긴다 3.내가 엔지니어 인지 콜센터 직원인지 헷갈림 4.개발도 있긴한데 주로 5-10년된 레거시 유지보수 막상 잡일이 많아 개발할 시간도 없을듯 5.평일 및 휴일당직있음
14,㈜에스엠투네트웍스,3741,부서별로 분위기 편차가 매우 심함. 장기적으로 봤을 때 좋아보이진 않는다
15,㈜에스엠투네트웍스,3741,위에 장점외 모든게 단점  평촌역이랑 인덕원역 가운데 있어 어디서 내려도 애매함(si)  왕고인물에 일안하는 농땡이에 어설프게 깨어있는척 변화 강조하며 보여주기식정책으로 직원들 더 괴롭게만드는 상사에 그 몇명이 부서를 이끌어가면서 회사가 점점 산으로 감(si부서)  옆부서 코로나로전원재택 할때 60-80프로 출근함.이부서는 코로나 걸려도 된단 소리인지... 안하려면 다같이 안하든지..(si)  순환으로 안산공장출근에 평일 당직에 주말당직. 재수 없으면 명절당직도 걸림(si)  위에말한사람들때문에 직원들 퇴사하는데도 본인들은 전혀 모름 (si)  일할사람은 다나가고 없고 정작에 일해야 될 사람들이 정치질에 관리질만 할라고해서 개판 오분전임(si)  인센은 뭔소리? 삼화페인트 실적 안조으면 안조타고 안나오고 삼화 실적 조으면 삼화아니라서 안나오고 (si)   근태 개판쳐도 어떤놈은 진급하고 어떤놈은 누락이유도 없이 누락됨 그래놓고 표면적으로는 아무리 일잘해도 근태 안좋으면 누락이라고 말함 ㅋ(si)  모회사에 몇몇 빌런들이 매우 괴롭게함(si)
16,㈜에스엠투네트웍스,3741,처우대비 회사네임밸류가 높지않아서 입사초반 주변에는 삼화페인트 계열사임을 강조해야함...
17,㈜에스엠투네트웍스,3741,1인당 담당해야 하는 프로젝트가 동시에 겹치는 부분이 있어 가끔 너무 힘에 부친다.
18,㈜에스엠투네트웍스,3741,딱딱한 업무 방식을 고치고 복지 부분을 늘렸으면 합니다
19,㈜에스엠투네트웍스,3741,출근시간 8시까진데 집 먼사람은 안좋다고 생각할수도? 어떤부서는 빨리가고 어떤부서는 야근좀 함.
20,㈜에스엠투네트웍스,3741,"본사가 경기도 안양에 소재 (단, 마케팅인텔리전스팀은 서울 강남에 소재함)"
21,㈜에스엠투네트웍스,3741,사회생활에서의 비교와 차별을 겪을 수 있음. 월급이 안밀리는게 장점이라는게 단점. 눈치보지않으면 칼퇴가능.
22,㈜에스엠투네트웍스,3741,약간 부서 바이 부서처럼 보였습니다 칼퇴하고 자유로운 부서와 야근하고 꼰대 있는 부서 이런 식으로
23,㈜에스엠투네트웍스,3741,고인물이 많다. 직원의 말을 귀담아 듣는 척만 하고 반영은 안됌.
24,㈜에스엠투네트웍스,3741,직원수에 비해 다소 과다한 업무량. 직원들의 의견을 자주 묻지만 듣는건 불편해한다.
25,㈜에스엠투네트웍스,3741,꼰대 회사가 갖고 있는 이 세상의 모든 단점 보유. 불필요한 문서 작업이 너무 많음.
26,㈜에스엠투네트웍스,3741,소통을 중요시 한다고 하지만 실질적으로 바뀌는 것이 별로 없다
27,㈜에스엠투네트웍스,3741,1) 출근시간 7시 50분에 퇴근시간 5시이나 5시에는 눈치보여 퇴근못함 2) 꼰대임원들을 대하면 스트레스가 엄청남 3) 위에선 의사소통을 원하지만 일방적인 수직적관계
28,㈜에스엠투네트웍스,3741,삼화페인트관련부서가아니면 직급별 연봉차이가 최소600정도 차이남. 새로운 것을 하지 않음. 발전이 없음. 솔루션 구축시 무조건 외주로 줌. 아이디어 내면 무시함. 뭔가 새로운걸 하고싶은 사람에게 비추천 개발자로 일하고 싶으면 다른회사 추천
