,company_name,company_id,review_text
242,㈜아이스크림에듀,8822,야근수당이나 기타 복지에 대한 처우가 부좀함. 경영진의 마인드가 매우 구시대적임. 직원들을 갈아 넣는 것 같음.
243,㈜아이스크림에듀,8822,보수가 제일 문제지 않을까 싶음. 구내 식당 없어서 도시락 싸오거나 밖에서 해결해야함.(삼성역 근처라 물가 높음) 다른 교육출판사에서 스마트 러닝에 뛰어들고 있는 시점이라 갈수록 경쟁력이 밀리지 않을까 싶음.
244,㈜아이스크림에듀,8822,"- 아직 개선되어야 할 것들이 많이 있다. (시스템, 인력자원)"
245,㈜아이스크림에듀,8822,"인사팀자체, 사람들 불만 겁나 많음. 특히 기준없는 인사평가 팀장에 따라 분위기나 일처리 방식이 너무 다른데 조직개편을 자주 해서 분기별로 새롭게 적응해야하는 듯.피곤"
246,㈜아이스크림에듀,8822,사기업계의 공무원같은 느낌이라 일 하는 사람만 하는 느낌이 든다. 열심히 하는 사람과 안 하는 사람들이 눈에 보인다. 사람들은 매우 좋음.
247,㈜아이스크림에듀,8822,"위의 장점을 뺀 나머지가 단점인 회사. 사람 귀한줄 모르고, 우루루 사람 뽑았다 버리는 회사."
248,㈜아이스크림에듀,8822,계속되는 시스템오류와 정책변경으로 소비자와 사원들이 힘들어 지게함 그 피해는 고스란히 직원들에게만 쏠리게됨.
249,㈜아이스크림에듀,8822,어떤 부서는 죽어라 야근해서 기한맞추는데 어떤 부서는 배째라~ 해서 기한 못?안맞춤 그럼 그냥 그 업무기한이 연장됨 즉 부서마다 일하는 사람만 일함  윗사람은 많은데 실제 일할 사람은 적고 시스템개선이 필요한데 거기에는 돈 안쓰고 자꾸 연봉높은 윗사람들만 영입함  스마트함을 내세우는 기업인데 정작 내부 시스템은.. 486컴퓨터 수준 도스가 아닌게 다행인가? 아니.. 도스 수준일지도
250,㈜아이스크림에듀,8822,매출에 비해 경영관리가 안되어 직원이 너무 많아 놀고 있는 인력이 넘쳐남.
251,㈜아이스크림에듀,8822,그룹사 오너에게 과도한 권력이 집중되어 있음. 그래서 모든 임직원들이 오너의 눈치를 보기 바쁨.
252,㈜아이스크림에듀,8822,능력은 별로이나 타이밍으로 인해 살아남아 일은 안하면서 정치질만 하고 있는 사람이 많이 있음
253,㈜아이스크림에듀,8822,아직 성장을 더 해야하는 회사임 굳건히 자리 잡힌 콘텐츠가 아님
254,㈜아이스크림에듀,8822,삼성동 한복판이라 식대포함 주변물가 높음.교육 이외 분야에서 이직하시는 분들 적응 어려워함. 교육도메인이 어렵나봄ㅜㅜ 스마트학습기 기반이다보니 엮여있는 내부 서비스 파악이 어렵나봄
255,㈜아이스크림에듀,8822,복지가 조금 있었는데 있던 복지마저 사라지고있음 HR팀이 메신저 접속을 안해서 문의사항이 있으면 직접 찾아가야함
256,㈜아이스크림에듀,8822,돈을 제대로 사용하지 못함. 외주 개발사의 호구 역할을 잘함. 신규 프로젝트를 시도하지만 프로젝트마다 실패함. 교육 회사이지만 이젠 더이상 교육 전문가가 없음. 일반 직원은 잘 안자르지만 임원급은 수시로 바뀜
257,㈜아이스크림에듀,8822,업무의 내용이 정확히 전달되지 않을 때가 있어 알아서 잘 해야 한다
258,㈜아이스크림에듀,8822,연봉이 매우 적음. 개인의 성장에 대한 고민이 없음””
259,㈜아이스크림에듀,8822,"1)학습에 장애가 생기거나 기계에 문제 생기는 경우 등 여러 문제가 생길 경우 교사 탓이 아닌데도 불구하고 교사는 모든 총알받이. 2)분명 교사는 영업을 안 한다고 하였는데 어느 순간 영업을 뛰고 있다. 3)학습비 미납이 될 경우도 교사가 재촉전화나 문자를 해야 하고 아쉬운 소리를 교사가 해야 됨. 매주 빚쟁이가 된 기분 느낄 수 있다. 4)저녁을 제때 먹을 시간은 없다고 보면 됨. 거의 10시 넘어서 겨우 밥을 먹을 수 있다. 아이들 밥도 차려줄 수 없을 정도라 남의 아이는 성심성의껏 가르치는데 내 아이는 소홀하게 될 수 밖에 없는 구조. 5)교사한테 주는 수수료를 더 주고 싶지 않아서 근무시간을 줄이는 파격적 개선안 시급이 아니라 별 상관도 없는데 아직도 이해가 가지 않음. 6)교사 탓이 아닌데도 불구하고 회원교체가 생기거나 중도해지가 생길 경우에도 월급에서 인당 만원 차감. 어떻게든 돈을 안 주겠다는 의지. 7)수수료가 아주 짜다. 8)교사 복지는 그냥 없다고 보면 된다. 예를 들면 연차는 2년차 때까지 상반기 하반기 한 번씩이다. 그마저도 못 쓰는 날이 있다. 9)설선물, 추석선물, 스승의 날 이렇게 선물이 오는데 정말 돈을 아끼겠다는 의지가 보이고, 이번 스승의 날에는 선물센스에 기함했다. 이 일을 하는 사람들의 98퍼센트는 주부인데 주방 3종세트를 보냈다. 앞치마 주방장갑 행주. 이 일만으로도 벅찬데 집안일까지 더 하라는 것인지."
260,㈜아이스크림에듀,8822,엄청 짠 월급 / 말도 안되는 계약서 / 알바로 돈을 벌어도 이거 보다 많이 받겠다 싶은 환경 / 왜 고인물만 버티는지 알겠음
261,㈜아이스크림에듀,8822,쓸데없이 회의 많음. 직원 휴게실 없애고 회의실 만들정도로 회의 많음.
262,㈜아이스크림에듀,8822,굉장히 올드하다. 일을 배울 수 없다. 사람이 자주 바뀐다
263,㈜아이스크림에듀,8822,너무 바쁨 윗사람들 맨날 야근에 미친듯이 바빠서 하루종일 일만일만 하다 오는 느낌
264,㈜아이스크림에듀,8822,윗 상사가 누구냐에 따라 달라진다 그리고 팀별로 분위기가 다르다 성장하는 회사이다보니 일을 많이 준다 여자가 많다
265,㈜아이스크림에듀,8822,"사내 정치, 야근 부바부 심함, 구내식당 없음, 일을 비효율적으로 할 수밖에 없는 구조.....전사적프로그램 없음 일하다 잘못된거 없는거 발견하는게 일임 부서 전반 일이 체계적으로 안되고 그때그때 기준없이 함 웬만큼 야근해서는 야근수당받기 어려움 연봉상승폭 적음"
266,㈜아이스크림에듀,8822,서버가 자주터지고 그들만의 리그이며 잘보여야 승진가능함.
267,㈜아이스크림에듀,8822,시스템이 없어 인력으로 모든걸 대체한다. 시스템 구축한다고는 하지만 될지 미지수이고 사람을 그만큼 갈아넣어야 한다. 윗사람 경영진이 일을 하나도 몰라 실무자가 너무 고생한다. 윗사람 공부좀 하길.. 시스템도 없고 윗사람도 잘몰라 일을 하면서도 무서웠다. 정치가 정말중요한 회사며 눈밖에 나면 직원앞에서도 쪽을 준다. 교육업계 경쟁자도 많이 생기고있어 고전을 면치 못하며 앞으로의 성장가능성은 낮다.
268,㈜아이스크림에듀,8822,"1. 임원들 간의 정치싸움이 심한편임(가장 높은 분이 자꾸 편애하는 사람이 바뀌어서 그런 걸로 판단됨) 2. 신규 사업을 위해 적극적으로 투자를 하며, 기업의 규모나 직원들의 숫자가 늘어나고 있음에도 불구하고, 신규 사업으로 돈을 벌지 못하고 기존의 사업 구조로만 돈을 벌고 있음(이 상태면 적자 전환되지 않을지...) 3. 갈수록 직원들에게 주는 혜택을 줄이고 있음. 직원들의 연봉가지고 장난질하기 시작함 4. 능력없는 팀장들이 정치질을 통해 너무 쉽게 자리를 유지하고 있고, 실제 실무를 잘하고 능력이 뛰어난 사람들은 이미 이러한 사내 분위기에 더 목소리를 내기를 포기하고 대충 업무를 진행하며 버티고 있음 5. 갈수록 회사가 더 안 좋아지는 것 같고 너무 단점이 많아서 더 나열하기가 어려움(별점 1점도 아깝다고 생각)"
269,㈜아이스크림에듀,8822,각 현업부서별 단합이 잘 안돠는듯 함. 아직 주먹구구식 업무처리가 좀 있는듯
270,㈜아이스크림에듀,8822,연봉 적음. 최근 들어온 사람들이 분위기 흐리는 중인 것 같다.
271,㈜아이스크림에듀,8822,교육계가 다 그렇지만 낮은 연봉 복지가 줄어드는 중 위에서 삽질 중
272,㈜아이스크림에듀,8822,"너무 많아 다 기술하기는 힘들지만.. 2019년에 최악의 리더들은 어느정도 해고되었고 그래도 아직 해당 부서장에 따라 팀별 만족도가 천차만별임 (승진 및 평가 부분도 객관적인 잣대가 아니라 해당 부서장 의견으로 결정되는것이 현실임- 업무평가 기준도 매년 바뀌었지만 결국 직속 부서장의 의견으로 결정됨)  특히 기획/개발파트 입사를 고려하시는분들은 다시 생각해보시길 권유하고 싶네요 저도 이분야에서 15년 이상 적지 않은 경험을 해 왔지만.. 이 회사 다니면서..그동안 느낀 팩트만 말하자만 IT부서 리더들의 마인드 및 리더쉽이 지금까지 경함한 꼰대중의 꼰대~중 최악입니다.  그리고 여기서는 기획/개발부서는 사내에서 영원히 ""을""취급받고있는것이 사실이고 그 리더라는 분은 그게 당연한듯 타팀에는 허허실실~ 내부에서는 쪼아대니 ㅋㅋㅋㅋ"
273,㈜아이스크림에듀,8822,"일이 너무 많다. 복지도 없고,,,그리고 이사 라인, 부사장 라인 등 보이지 않는 세력이 있었다."
274,㈜아이스크림에듀,8822,에듀테크 기업을 표방하지만 이게 진짜 에듀테크인지 그냥 이름만 에듀테크인지 모르겠음. 위에서 똥 싸지르면 아랫사람들이 치우고 윗사람들은 그게 자기 능력인줄암
275,㈜아이스크림에듀,8822,일이 많음 부서별로 칼퇴가 아닌 경우도 있어요 점점 일이 많아질 것 같아요
276,㈜아이스크림에듀,8822,복지가 문화쪽 말고는 별로인 것 같다. 교육 콘텐츠 시장에서 고전하는 편. 혁신적인 대책이 필요함. 직원들이 앞으로의 회사를 자주 걱정함.
277,㈜아이스크림에듀,8822,외부에서 온 사람들로 기존 다른 회사들과 구분을 없애감
278,㈜아이스크림에듀,8822,적은 급여와 장기근무는 불가능해보임. 경쟁이 치열한 업종
279,㈜아이스크림에듀,8822,능력이 부족할 경우 믿고 끌어주는 힘이 부족한 것 같습니다. 또한 협업내용들이 많아 기획자의 결정권이 약해 기획업무가 번거롭고 사소한 경우라도 불필요한 시간이 많이 소모됩니다.
280,㈜아이스크림에듀,8822,작업의 효율성을 높일 수가 없는 개발 구조. 야근이 너무나 일싱화되어있어서 힘들엇음.
281,㈜아이스크림에듀,8822,팀장이하 지루한 사무직 같은 느낌 마케팅팀이지만 제품의 타겟층이 아이들을 둔 부모님들이라 cs+마케팅팀 같은 느낌
282,㈜아이스크림에듀,8822,개발자에 대한 무시와 멸시 타 조직에서 개발자를 보는 시선이 좋지않음. 왜냐면 말하는데로 안만들어준다고. 기획은 제대로 온것도 아닌데 말이야...
283,㈜아이스크림에듀,8822,쓸데없는 회의가 너무많음 쓸데없는 인력도 많음 쓸데없이 쓰는 비용도 많음 발전가능성이 없음 근처 식당 비쌈 회장님 한마디에 이랬다 저랬다 함
284,㈜아이스크림에듀,8822,"아침8시반 출근, 퇴근 시간 없음, 9-6 근무시간 내내 회의하고 퇴근시간부터 내 일 시작"
285,㈜아이스크림에듀,8822,야근비 52시간제라 22시간 제외하고 줌 식대없음 건물 답답함
286,㈜아이스크림에듀,8822,일 못하는 사람들 투성이 이 회사 일 잘 하는 사람들은 입사 했다가도 몇개월 만에 다른 곳으로 넘어간다 남아 있는 사람들은 다른 곳으로 갈 능력이 안되는 사람들 뿐 하다못해 기초 지식도 없는 사람이 대리란다 한심하다 나이는 많고 지식도 없고 경력도 동일 직무 관련 경력도 아닌데 대리를 준다
287,㈜아이스크림에듀,8822,"회의가 많고 길다, 시설이 그닥 좋지않다. 특히 화장실의 경우 너무 좁다. 야근을 하는 부서는 끝도 없이 야근을 한다. 마감일은 정해져 있는데 기획서가 나오지않아 한 번에 일이 몰리곤 했다."
288,㈜아이스크림에듀,8822,시대에 뒤떨어지는 포괄임금제. 기본적으로 연봉이 적은 편.
289,㈜아이스크림에듀,8822,"파벌, 비전 부재, 발전성이 없음, 노후한 인력, 입퇴사가 잦음, 부서 별 분위기 제각각"
290,㈜아이스크림에듀,8822,좋은 시절은 지나갔음-성장 정체기. 동일 직군내 여러팀이 있으며 어느팀에 배속되느냐에 따라 불지옥을 경험 할 수 있음. 고이다 못해 썩은 조직이 있으며 이 조직에 수시로 통수맞음.
291,㈜아이스크림에듀,8822,수평적인 문화를 기대했으나 수직적인 문화를 가진 회사 팀바팀이겠지만
292,㈜아이스크림에듀,8822,"급여가 적고, 복리후생이 좋지 않은거 같습니다.다소 답답하고 말이 안통하는 상사가 많은거 같습니다."
293,㈜아이스크림에듀,8822,회사 분위기 자체와 팀장 이상의 마인드가 80년대식 쥐어짜기를 벗어나지 못한다 한번도 가능한 일정이나 작업량을 받아본 적이 없다
294,㈜아이스크림에듀,8822,팀장님들의 능력이 과연 팀을 이끌 수 있는 수준인지 의심됨.
295,㈜아이스크림에듀,8822,소문이나 말을 옮기기 좋아하는 사람들 조직이 비대해지면서 안주하는 마음
296,㈜아이스크림에듀,8822,"자기 발전을 목표로 하는 인력들에게는 어려운 회사 본인에게 할당 된 업무만 잘 처리 한다면 무난하게 다닐 수 있음 연차/휴가 자유롭게 활용 가능, 칼퇴 가능"
297,㈜아이스크림에듀,8822,"비합리적인 인사이동, 되도않는복지, 쓸대없는데신경쓰고정작필요한데는비용줄이라고함"
298,㈜아이스크림에듀,8822,연봉은 나쁘지 않으나 시간제로 지급하는 것이 아니라 100% 실적제임.
299,㈜아이스크림에듀,8822,사람 굴리는거 좋아하는거 같은 월급쟁이들 끼리 그 월급 받으면 받은만큼 일 하라고 하는곳 ㅎ
300,㈜아이스크림에듀,8822,ㅡ 꼰대들 장난아님(전 교육출판부 부장) ㅡ 월급작음 ㅡ 직원복지 별로
301,㈜아이스크림에듀,8822,부서들마다 케바케지만 우리팀은 그렇게 나쁜 편은 아니어서 괜찮았음. 회장님 말씀에 하던 업무가 뒤집히고 갑자기 생기는 일 비일비재
302,㈜아이스크림에듀,8822,"50명으로 시작해 500명이 되면서 경력직 위주로 뽑아놨지만, 경력직을 위한 게 하나도 없고 알아서 배워라 식. 거의 다 경력직이면 서로 위해줄줄 알아야지, 적응한 경력직들은 자기들이 배운 텃세를 새로 들어온 경력직한테 그대로 함. 업무 및 다른 모든 프로세스가 스타트업 수준. 하지만 그 복잡하고 비효율적인 프로세스를 잘 안가르쳐줌. 물어보면 안 가르쳐주고 경쟁하면서 텃세부리기 바쁨. 이거 못 견뎌서 나간 사람 많다고 함. 텃세부리는 사람 중 최악은 그 회사를 첫 회사로 다닌 사람들... 밖에선 커보이지만 실제로 다녀보면 프로세스 이상함, 직원들 업무 능력 떨어짐."
303,㈜아이스크림에듀,8822,업무는 못해도 정치만 잘하면 된다. 업무는 못해도 말만 잘하면 된다. 업무는 못해도 있어보이는 단어만 써서 말하면 된다.
304,㈜아이스크림에듀,8822,새로운걸 싫어하는 고인물들이 지배하고 있어 튀는 싹은 자르고 협력하여 태업하려함
305,㈜아이스크림에듀,8822,"장점외 모든것이 단점, 개미들도 여기만 들어오면 배짱이가 되는 시스템"
306,㈜아이스크림에듀,8822,기업 성장에 따라 영입된 외부 인력에 대한 리텐션이 상당히 미흡함. 지나치게 오너 눈치를 보는 기업.
307,㈜아이스크림에듀,8822,급여가 적고 시설지원이 없으며 연차가 오래되도 특수고용직이라 퇴직금도 없음.
308,㈜아이스크림에듀,8822,프로젝트하나마나 회장님 의견이 매우 강하게 좌지우지 됨 바로바로 업무 성과가 나와야 함 화장님 눈치를 너무 많이 보
309,㈜아이스크림에듀,8822,"1. 하는 일에 비해서 월급이 짬(직급에 관계없이 일을 시킴) 2. 의사결정 시 논리적 판단이나 합리적 근거가 부족함(그냥 까라면 까야함) 3. 업무분장이 제대로 이루어지지 않음(아무거나 시키면 다 해야함) 4. 부서 내 분위기가 매우 어수선하고 정돈되어 있지 않음(업무 프로세스를 배울 수 있는 기회가 없음) 5. 진행중인 프로젝트가 마무리가 되지 않았음에도 신규 프로젝트를 시작함(이거했다가 저거했다를 반복함) 6. 직책있는 사람들(특히 임원들) 중에 꼰대들이 많음(기존부서, 신규부서 관계없이 많음) 7. 조용히 성실하게 일하는 사람들 때문에 회사가 돌아감(말만 앞세우고 목소리 크고 눈에 띄는 사람들은 실제로 일 열심히 안해도 일 하는 것처럼 보이고 성과는 없음)"
310,㈜아이스크림에듀,8822,효율적이지 않은 업무체계때문에 일을 두번 반복하게 만든다. 손과 발이 고생한다.
311,㈜아이스크림에듀,8822,"이상한 조직 구조, 엉성한 마케팅, 체계 없음, 시스템 없음."
312,㈜아이스크림에듀,8822,여자들이 매우 많으며 특유의 문화가 존재한다. 실력과 무관하게 아부를 잘하면 좋은 평가과 높은 자리를 얻을수 있다. 과거의 방식을 고수하려고 한다. 공무원 마인드를 갖고 있는 직원이 너무 많다. 서비스를 잘 만들고자 하는 생각보다는 자신의 일이 많아지지 않는것에 관심이 많다. 자신의 업무에 대해서 잘 모르면서 매우 당당하게 다른 직종의 사람에게 그럼 어떻게 하는지 알려달라고 요구한다. 인력이 부족하나 놀고 있는 인력이 매우 많다. 프로젝트 진행시 끝나는 날짜를 정해놓고 시작하며 기획하는데 대부분의 시간을 소비하고 시간이 없으니 야근하길 바라며 외주를 투입하면 해결할수 있다고 말한다. 좋은것이 있으면 같이 하자가 아니라 난 힘든데 왜 저기는 좋은걸하지 라는 생각으로 모두 할수 없게 만든다. 급여를 모두 적게 주는 방향으로 하려고 하며 외주 비용은 잘 사용한다. 외주 관리를 못하여 외주가 배째라고 나와도 아무말 못한다.
313,㈜아이스크림에듀,8822,공포 위화감조성 군대문화. 실무자의 의견따위는 전혀 듣지않음. 자율출퇴근제 빼곤 다 안좋음. 뭐든 진행하고 있는 모든일들이 이해가 안되는상황으로 직원들 줄줄이 퇴사중.
314,㈜아이스크림에듀,8822,"앞으로 발전 가능성이 없음 점점 복지도 사라져, 연봉 인상률도 기대 안함.."
315,㈜아이스크림에듀,8822,"부서 이동이 잦음, 사내 운영진 라인을 잘타야 함, 회사보다는 부서나 개인위주."
316,㈜아이스크림에듀,8822,출근 시간 8시이지만 퇴근 시간은 보장할 수 없음(야근비 없음 식대 없음) 팀장이 인사권을 가진 이상한 회사 능력 없는 팀장 밑에서 일해야 하는 부서가 많음 자기들만의 리그가 존재함 책임 회피하려는 상사가 많고 그 책임을 사원에게 따져 물으려 하는 상사가 많음 임원급은 이러한 현상을 알고 있으면서도 애써 외면함
317,㈜아이스크림에듀,8822,제가 일했던 부서 분위기만 그랬는지 모르겠는지 텃세가 심했습니다. 성격 진짜 진짜 밝은 분 아닌이상 적응하기 힘들었어요 . 혜택 많은것처럼 그러지만 정작 정규직한테만 해당되는 얘기였습니다.
318,㈜아이스크림에듀,8822,"일일이 나열하기에도 입 아프다. ㅈㄷㅅㅇㅌ에 있었는데 그곳을 총괄하시는 분은... 자기 전공하지 않은 분야는 전혀 몰라 총괄을 한다는 감투는 의미가 없는 것 같고, 일을 정말 못한다.. 답답할 정도로. 자기가 좋아하는 ㅇㄹ 분을 늘 옆에 두셔서 기승전 그 분의 말에 쉽게 동요하고 흔들린다. 며칠 밤을 새워 만들어도 그 분 옆에 계신 분 맘에 안들면 땡이다. 야근? 정말 밥 먹듯 한다. 근데 굳이 안해도 되는 야근을 윗분들이 일을 못하셔서 밑의 사람들이 야근을 할 수 밖에 없는 구조로 만든다. 여기서는 워라밸은 개나줘야 한다."
319,㈜아이스크림에듀,8822,야근수당은 없어졌는데 야근은 아직 안 사라짐 저녁식대 없어짐 야근을 안하면 될 일이지만 그게 내 맘대로 되나 포괄임금제임
320,㈜아이스크림에듀,8822,"1.비효율적인 시스템으로 항상 야근이다.(야근주말수당,식대 ,택시비 없음) 기본 업무 시간 외에 22시간 이상을 업무를 해야 대휴를 받을수 있음. 2.기존에 오래다닌 사람들에 텃새가 심하다. (인사고과에 바로 적용된다.) 3.새로운 사업을 시도하고 있지만 시도하는 사업마다 악재다.(중등사업을 하고 있지만 앞으로 지켜봐야 할것 같다...) 4.항상 일하는 사람만 일하는 이상한 시스템(어딘가에 월급 루팡이 있다.) 5.건물이 매우 오래 되었다. (쥐가 나오기도 하고 화장실이 좁아서 두세명만 있어도 꽉차 보인다.)"
321,㈜아이스크림에듀,8822,비즈니스모델및 서비스가 많아 닥치는데로 일한다 깊이는 없다
322,㈜아이스크림에듀,8822,"급여 박봉, 복지 없음, 체계 없음, 이상한 뭣도아닌 정치질 과 편가르기. 직원 관리가 전혀 안됨. 업무시간에 두시간씩 놀러다녀도 부서장들이 모르고 관리도안함. 업무를 비효율적으로 하고 쓸데없이 야근함. 건물 최악!"
323,㈜아이스크림에듀,8822,무능한 윗선들의 사내정치가 심하고 직원 교육이없이 일을 막시키고 개인이 책임지게하는 구조 꼰대가되야 살아남는구조 기업의 부당함을 느껴보고 싶다면 추천합니다
324,㈜아이스크림에듀,8822,직무 전공자 아닌 팀장들이 너무많음 그래서 전문가 팀원들이 고통을 견디고 팀을 이끌어야하는 상황
325,㈜아이스크림에듀,8822,비효율적 업무 주먹구구식 업무처리가 되는 경우가 많음.
326,㈜아이스크림에듀,8822,"위의 장점과 관련된 것인데, 시간을 들여 공부해야 하기 때문에 업무와 병행하기에 힘이 들 수 있다."
327,㈜아이스크림에듀,8822,어떻게 해야 직원이 행복한지 모름 윗 사람들은 몽상가 하란대로 했는데 그 몽상을 구현 해 내지 못한 개인의 잘못.
328,㈜아이스크림에듀,8822,상사 및 타 팀과의 소통도 원활하지 않으며 개개인의 경력보다는 이 회사의 근속연수에 따른 혜택과 권위가 주어지는 분위기이다. 오래된 사람들이 이직하지 않는 이유이기도 하며 본인의 부족함을 느끼지 못하고 전문성보다는 잡다한 스킬만 늘어 기계처럼 반복적이고 편한 일만 추구함에도 불구하고 좋은 평가를 받을 수 있는 점이 아이러니하다.
329,㈜아이스크림에듀,8822,"암묵적 야근 압박 있음.(정시퇴근 권장 소리를 들어본적이 없음) 사내 중요 프로젝트는 죄다 외주가 제작. 개발팀 업무는 내부직원 콜 받아서 데이터 고쳐주는 걸로 시작해서 끝남. 개발에 있어서 결정권자는 개발팀이 아닌 현업.(파워게임의 희생양.) 개발팀 의견은 들어보는 척 하지만 결국 무시됨. 임원진은 기술개발/조직문화 개선을 말로만 함. 비전/세부계획 따위는 없으며, 개개인의 능력으로 커버해야함. 각종 메신저를 통한 업무지시가 일상.  인사적체의 정점. 대리 이하는 천연기념물. 인사평가의 명확한 기준 없음. 입사시 경력불인정, 직급꺽기 등 후려치기 있음. 조직개편이 분기 행사."
330,㈜아이스크림에듀,8822,월급에 비해 일이 너무 많다. 기획이 핵심인데 제일 을이다.
331,㈜아이스크림에듀,8822,"안정화나 기능적인 측면에서 업무 시스템이 미흡한 부분이 있어 비효율적입니다. CS 부서는 2교대 업무 특성 상, 야근이 없지만 많은 부서에서 과도한 업무량에 대한 불만이 있는 것으로 알고 있습니다."
332,㈜아이스크림에듀,8822,"이리 치이고 저리 치이는 고객센터, 대부분이 비정규직이며 퇴사율도 높은 편. 윗선에서는 잘 하려고 노력하는 것들이 보이나 웃음 뒤에 삭막한 분위기가 있음. 잦은 에러로 비상사태 발생 빈도가 잦음. 문제가 생겨도 빠른 대처 하지 않음. 타 부서 이관 시 정형화 된 양식이 부서별로 통일되어있지 않고 바라는 것들이 많음."
