,company_name,company_id,review_text
333,㈜아이스크림에듀,8822,"기획자에게 주어지는 업무량이 과도하게 많아 야근과 주말 출근이 불가피함. 일은 일대로 하고 디자이너, 제작자,개발자 사이에 끼여 죄송하다는 말만 연발하다 보면 내가 뭐하고 있나 싶음. 낮은 연봉과 생색뿐인 복지 혜택으로 이 모든 걸 감내해야 함. 체계 없는 시스템 속에서 고생 체험하고 싶은 분 아니라면 비추."
334,㈜아이스크림에듀,8822,회장님 마음대로인 회사. 사장님의 의견은 무시되고 회장님이 하라는대로 무조건 실행한다.
335,㈜아이스크림에듀,8822,"1. 업무에 체계가 없음. 업무롤이 불분명하여 온갖 잡일은 다함. 경력직 직원들은 자괴감을 느낄 수 있으며, 신입직원들은 고생만 하다가 나가떨어짐. 2. 일부 팀장이나 임원들은 전혀 소통이 안됨. 실무적인 지식이나 담당자의 의견에 대한 고려없이 무조건 지르고 봄. (위에서 얘기가 나오면 옳던 그르던 무조건 하려고 함.)"
336,㈜아이스크림에듀,8822,2~3달에 한번씩 토요 근무가 있음. 이것저것 새로운 사업에 시도를 여러번 함.
337,㈜아이스크림에듀,8822,개발 업무 외의 잡다한 일이 많음. 회의 많음. 타 부서는 야근도 많이 함.
338,㈜아이스크림에듀,8822,회의가 너무 많음. 특정 부서는 야근도 많은편. 내세울만한 복지는 딱히 없는편. 급여가 많지는 않음.
339,㈜아이스크림에듀,8822,건물이 노후해서 불편하지만 다른 곳으로 이전한다는 이야기가 있다. 그렇게 된다면 시설은 편리해져도 출퇴근이 힘든 사람들이 생길 것도 같다.
340,㈜아이스크림에듀,8822,연봉은 많지도 적지도 않은 중간수준 / 단점이 많아서 나열하기 힘들
341,㈜아이스크림에듀,8822,내부 구조가 복잡하고 변화의지가 없기 때문에 지속적인 성장은 미지수. 업무가 과도하게 많고 비정규직 인력도 많은편이라 근속년수가 모두 짧다.
342,㈜아이스크림에듀,8822,기존 멤버들을 매우 대우해주는데 신생회사다 보니 기존 멤버들의 경력이 너무 짧음. 기존 멤버들이 개척한 업무 스타일이 너무 특이한데 거기 적응 못하면 이상한 사람이 됨 야근이 대접받는 회사
343,㈜아이스크림에듀,8822,회사가 건물이 너무너무 낡앗습니다 그리고 화장실...정말 생각하기도 싫습니다 안기도 버거운 크기에 굉장히..불쾌감을 주는 화장실.. 그리고 바쁜거 빤히 알면서 종무식같은거 준비하고 이런것좀 안시켯으면...
344,㈜아이스크림에듀,8822,야근 많음. 팀장들이 너무 바쁨. 팀원관리 전혀 안됨. 괴랄한 프로세스.
345,㈜아이스크림에듀,8822,부서별로 다르지만 7시까지는 야근을 하는 분위기. 아직 성장하는 회사여서 그런지 체계가 제대로 잡혀있지 않음. 노력하는 모습은 보임
346,㈜아이스크림에듀,8822,야근 강요는 안하지만 눈치줌. 이직 생각하는 사람이 많다. 연봉 짜게 준다.
347,㈜아이스크림에듀,8822,"- 상장한다는 유난 때문에 재경 관련 부서에서 지나치게 비협조적이라 직원들의 정신적 피해가 상당했다. 재경 쪽이라는 이유로 직급 높지도 않은, 대리-과장급들이 심한 꼰대질 하는 것은 부당하다. (나아가 이를 알면서 묵인하는 상위 직책자도 문제) - 남자고 여자고 할 것 없이 뒷말이 심하고, 소문의 왜곡도 심각한 편. 피해자는 따돌림이라고 느낄 수도 있음. 한 번 찍히면 쭉 욕하는 몇몇 직원들 있음. - 협력 부서들이 그나지 협조적이지 않다. 특히 인사 파트 직원들은 별 것 아닌 질문에도 대답을 쉽게 해주지 않는다. - 리더십 부재의 팀장들이 많아 팀원들이 소속감/안정감을 느끼기 힘들다."
348,㈜아이스크림에듀,8822,발전 가능성이 없다. 자기 계발의 기회는 거의 없고 자기 분야의 업무가 아닌 일도 해야한다.
349,㈜아이스크림에듀,8822,뜬금없는 인사이동과 기존에 오래된 인력이 너무 무지함 신규 사업이 크지 못하는 이유는 기존 인력들이 그들만의 세계에 갇혀 새로 들어 온 경력자들을 배척하기 때문임. 새로 들어 온 능력있는 사람은 다 나가고 결국 기존 세력만 계속 남아있음
350,㈜아이스크림에듀,8822,정치와 줄 세우기 몰아세우기 등이 심하다. 업무의 효율성이 많이 떨어진다. 사업 확장을 너무 많이 해 직원들만 죽어난다.
351,㈜아이스크림에듀,8822,"임원에게 잘보이는 직원은 일 잘하는 직원임 저녁시간에 놀고들어오는 남직원 퇴근시간 늦으면 열심히 하는 것임 팀간 일 구분이 없고 일떠넘기는경우 많음 팀장파워없으면 이런저런일 다 떠안게됨 12시다되서까지 야근해도 무조건 8시반까지 출근해야되는 비효율적인 운영, 영상팀 일정지연으로인해 기획자가 야근및주말근무하는걸 당연시여김 기획자의 의견은 중요하지않음"
352,㈜아이스크림에듀,8822,업무 강도나 분위기는 대기업을 따라가려 하는데 실제 처우는 중소기업 마인드 그대로이고 높은 업무 강도로 직원들의 열정을 강요함
353,㈜아이스크림에듀,8822,퇴근시간에 퇴근하면 눈치. 그만두지 않고 버티는 사람이 일 잘하는사람이라는 이상한 평가를 내리는 회사.
354,㈜아이스크림에듀,8822,초창기 멤버들의 특유의 업무 스타일이 있어 그 스타일에 맞추지 못하면 무능력자로 찍히고 퇴사하게 된다.
355,㈜아이스크림에듀,8822,교육 시스템이 갖춰져있지 않음. 그로 인해 사내교육이 제대로 이루어지지 않아 주먹구구식으로 대처하는 일이 많음. 관리프로그램도 좋지 않은 편. 메뉴얼이 없어 직원 개개인의 역량에 따라 일해야 될때가 있음. 퇴근시간이 잘 지켜지지 않음. 칼퇴근같은건 없는 분위기. 팀장 대리 등은 그런걸 자랑스럽게 여김.(꼰대문화) 팀장 대리 등이 사원들에게 반말을 사용함. 새로운 이슈(에러 또는 시스템변화)를 공지해서 알리기보다 되는대로 알려주다보니 모르는 사람은 나중에 멍해짐. 알아야될 사람들 조차도 모르는 경우가 허다함.
356,㈜아이스크림에듀,8822,주먹구구식으로 일하는 곳. 처음엔 초기라 시스템이 없구나 했지만 아직도 업무 시스템없음. 가장 힘든점.
357,㈜아이스크림에듀,8822,일단 오래 있었던 인력들의 파워가 너무 쎄다. 그래서 아무리 경력직으로 입사를 해도 신입과 같은 취급을 받으며 업무를 해야 한다. 오래 있었던 사람들이 그닥 상식적인 사람들은 많지 않아서 일단 대화가 잘 안 통한다. A를 설명해도 알파벳을 모르니 못 알아듣는 수준. 무능력한 사람이 금방금방 승진하는 것을 보면 미래가 암담해져서 나올 수 밖에... 매월 인사이동이 있는데 간단한 이동 정도가 아닌 팀 단위 개편이며 Role도 매우 자주 바뀌고 있어서 전문 경력을 쌓아 업무 능력을 향상시키고 싶은 사람이라면 안 가는 것이 좋을 것 같다.
358,㈜아이스크림에듀,8822,업무량이 매우 많다. 기존 업무 외에 할 일이 많아지더라도 사람을 더 뽑지 않고 직원들을 굴려서 일을 시킴. 사내복지가 거의 없음.
359,㈜아이스크림에듀,8822,열정민큼이나 야근과 업무강도가 샙니다
360,㈜아이스크림에듀,8822,직원들에게 희생을 강요한다 팀마다 마감이 다르기때문에 서로를 이해못한다
361,㈜아이스크림에듀,8822,마감 기간이 짧고 업무량이 많음. 일이 세분화 되어있지 않아서 전문성이 떨어짐.
362,㈜아이스크림에듀,8822,업무강도가 너무 높다. 일부 부서의 잦은 인력교체(주로 계약직)로 인수인계도 부족해 타 부서의 업무에 영향을 준다. 부서에 따라 차이가 있지만 다소 딱딱한? 조용한? 분위기.
363,㈜아이스크림에듀,8822,직급이 올라갈 수록 업무강도가 더 높아지고 그에 맞는 능력을 계속해서 높여가야해서 정신력이 아주 강해야합니다. 어떤 한 분야에 속해서 생각하면 안되고 다각도로 공동의 목표를 향해 사업 전반을 고민해야하고 실제 주인의식이 없는 사람이라면 다니기 힘듭니다. 업무를 제대로 하기 위해서는 야근이 생길 수 밖에 없는 부분이 있어 개인 생활과의 밸런스를 잘 맞추는게 안되면 힘들 수 있습니다.
364,㈜아이스크림에듀,8822,"일이 좀 많죠... ㅠㅠ 해야 할게 많습니다. 하지만 그걸 받아들이는 사람이 즐겁게 받아들인다면 단점은 아니겠죠.. 아무튼 일을 열심히 하고자 하는 의지가 없거나, 그냥 월급쟁이 수준에서 만족하고 싶은 사람에게는 조금 벅찰 수 있고 인정받기 어려움."
365,㈜아이스크림에듀,8822,"성장하는 회사 특성상 업무 강도가 매우 높음. 직급, 직책이 높아 질 수록 일은 더욱 늘어남. 끊임없는 자기 계발과 노력이 필요함. 편한 회사 생활을 원하는 사람들에게는 비추."
366,㈜아이스크림에듀,8822,사원 때도 일이 많아요. 승진하면 일이 더 많아집니다.
367,㈜아이스크림에듀,8822,좋은 평가를 받기 힘들다. 다 너무 열심히 일한다.
368,㈜아이스크림에듀,8822,"동종업계와 달리 야근, 추가근무가 당연시되고 있으나 그에 따른 보수가 매우 미미함"
