,company_name,company_id,review_text
0,㈜탑보이,6062,"아무래도 데이터기반으로 움직이다 보니, 새로운 경험을 하기 힘들었는데, 지금 생각해보면 이건 어느회사나 똑같은것같습니다."
1,㈜탑보이,6062,점심시간 1시간 외에 쉬는시간 주는데 이것도 돈 깍음. 주변에 밥집이 많지 않음
2,㈜탑보이,6062,"저 장점 말고는 없음 회사놀이 하는거같은 소통 벌주는건 대기업 따라가면서 상 주는건 스타트업보다 못한 회사 돈아끼는게 눈에 보이고 생색이란 생색은 엄청나게 냄 책임회피 및 일반 말단 직원들의 탓을함 일의 능률이 굉장히 비효율적 타팀 지원이 엄청나게 많음 내가 그 업무하려고 지원했나 싶을정도 사무실 직원에 대한 어긋낫 편애가 심함 누구는 실수하면 대놓고 크게 혼내고 그 직원은 조용히 다음부터 조심해라 정도로 끝남 다른사람이 그 사람을 혼내면 혼낸사람만 꼰대,속좁은 사람으로 인식 시즌별 지원으로 인해 본업무를 못하면서 지원도 이거밖에 못하냐 뭐하느라 꾸물대냐 등등 빠리빨리 안한다고 뭐라함 무식한 사람이 신념을 가지면 무섭다는게 무슨 말인지 뼈져리게 느낌"
3,㈜탑보이,6062,지하1층 / 거의다 동대문꺼라 경쟁력아쉬움 / 밥안줌 / 좀조용함 / 말안해본꽤 있음 / 운나쁘면 자리가 잘보임 / 연차한달전에 미리말해야함
4,㈜탑보이,6062,직원구매말고는 모든게 단점인 회사 직원들 보면 월급날도 안 행복해보인다
5,㈜탑보이,6062,단순업무 반복 업무를 개선해야 할듯. 대부분 노가다성 사이클 반복이 많은편
6,㈜탑보이,6062,전형적인 꼰대 문화로 회식에서 건배사를 시키는 문화를 당연시 여김.
7,㈜탑보이,6062,왜 사람이 많이 나가는지 모르는거같음. 도망가는사람이나 이직하는사람이나 내보내는사람이나... 어떤날은 직원앞에서 뒷담도함 급여도딱히 높은편은아니면서 주말출근요구할때도 있고 체계가 제데로 안잡혀있으며 급여는 동종업계치고 시간대비 너무낮음
