,company_name,company_id,review_text
247,건일제약(주),4632,신공장 설립으로 잡무가많아져 사람이 필요함에도 인원을 늘려주지않음.
248,건일제약(주),4632,"내근직이 영업직을 무시하는 태도를 보임. 보면 영업직에 학벌 좋은 사람이 수두룩하고 내근직에는 고졸이 있는데, 그런거 염두 없이 내근직 자리에 앉으면 갑질이 많은편. 내근직이랑 특히 여직원이 다니기 좋은 회사."
249,건일제약(주),4632,비효율적인 보고가 많고 체계적인듯 체계적이지 않은 시스템이며 복지가 거의 없다고 보아도 무방하다.
250,건일제약(주),4632,"과도한 업무량과 불균등한 업무배분, 임진원간 소통불가 퇴사 이직자 많음 회사규모에 비해 사원 복지부족 보수적 분위기"
251,건일제약(주),4632,"아모크라와 오마코가 잘 나갈깨는 업계 20위까지도 바라보면 중견제약사였으나 그 이후 신약출시에 대한 투자가 소홀하면서 현재는 외형이 줄어들고 있음. R&D 및 메디칼 부서만 잘 대우해주는 경향이 있으며 경영관리, 생산, 영업 쪽은 부속품 취급함. 오너 옆에 오너의 대학 선배가 간신처럼 붙어서 오너의 눈과 귀를 다 막아버림. 이 부분을 개선하지 않는 한 회사의 미래는 불투명."
252,건일제약(주),4632,"상사의 그날 기분에 따라 기안 통과와 거절이 좌지우지되는 심각한 조직 문화. 주업무 이외 잡무가 많아서 집중이 힘듬. 급여에 비해 인사평가제도가 지나치게 요구하는게 많음. 신입사원 연봉은 관리하는 편이나, 연봉 인상률이 낮고 상여금이 없어 실질적인 연봉 증대가 지나치게 미약함. 타 회사 동일 직급이랑 비교해보면 처참한 수준."
253,건일제약(주),4632,서류가 많음 분석 했으면 일을해야하는데 분석만 1년내내 함
254,건일제약(주),4632,"결재 서류 하나 맡기힘든편. (몇시간 혹은 몇일걸림) 물건하나 사려면 2가지업체 이상 비교견적을 통해서 구매해야함.(구매팀X) 바쁜경우 교대근무 시행( 주간 교대) 서로 팀과의 의사소통 이 잘안되서 사고가 종종남. 한사람이 맡은엄무가 좀 많은편 연봉:고졸은 좋은 환경,복지 생각하면 나쁘지않음.(타회사 비해 적음) 대졸: 타 회사비해 적은편이지만 평타는침."
255,건일제약(주),4632,본인의 주업무 시간보다 보고 및 회의가 많음 구매팀이 없어 본인이 비교견적까지 준비하여 구매하여야 함 신공장 증축으로 돈이 없어 투자든 구매든 쉽지않음 개인의 성과가 연봉과 직결되지만 여기서 성과는 본인의 업무 충실도가 아닌 개선제안을 더 중요하게 생각함 인원이 너무 부족하고 인원을 증원하려면 절차가 너무 까다로움 그래서 남은 인원이 더 힘듬 복지정책이 점점 사라짐 목표 매출액 높게 잡아 성과급이 없음 여름휴가가 3일임(한주를 다 쉴수 없음)
256,건일제약(주),4632,통근버스가있기는하나 자차거의필수이다 연봉제이며 임금이 짜다
257,건일제약(주),4632,기업 성장의 과도기로 현재 성장이 주춤거리는 시기임 하지만 향후 성장가능성이 큼
258,건일제약(주),4632,보고 업무가 많아 일을 진행하는데 시간이 오래 걸림. 구매팀이 따로 없어서 각팀마다 구매하여 일이 많이 늘어남. 개인업무 뿐만 아니라 프로젝트 업무도 같이 진행하는데 개인업무 뿐만 아니라 프로젝트 업무도 같이 진행하려고 하니 시간만 부족함.
259,건일제약(주),4632,"1. 보고 체계가 최악. 중소기업도 전자 결재 시대인데, 아직도 종이결재를 진행중. 결재 하나 받으려면 윗 사람 일 끝날때 까지 기다리는건 다반사. 결재 처리 자체가 늦어져 전체적인 일이 늦어짐. 2. 월급은 연봉 나누기 12, 상여금, 보너스 없음 연봉 상승폭 낮음. 3. 퇴근할때 붙잡는게 특기. 4. 회사 위치가 차가 없으면 다니기 불편함 5. 차가없으면 셔틀이라도 타야되는데 절대 셔틀 시간에 못탐"
260,건일제약(주),4632,"소통을 중시 하지만 실질적으론 소통이 없는 회사, 본사 관리직이 갑인 회사"
261,건일제약(주),4632,"쓸데없는 문서작업 많고, 좋은 아이템을 갖고있어도 제대로 활용못함. 미래에대한 목표는 있으나 비젼이 없음. 현재에 안주하는 기업."
262,건일제약(주),4632,복지제도가 다양하지만 실제로 사용가능한 것은 별로없음. 인센티브가 있지만 금액이 너무 적음. 서류작업이 많음.
263,건일제약(주),4632,작은 회사 규모에 비해 시스템을 갖추려 노력하나 시스템이 없음 직원을 소모품으로 여김 업무보고가 너무 디테일하게 이뤄짐(delegation과 empowerment가 없음) 직급체계가 단순화되어 승진 가능성이 적음
264,건일제약(주),4632,영업 쪽 서류작업이 많아 다소 불필요한 시간낭비 똑같은 내용을 세가지로 나눠 계속 반복하여 야근이 많음
265,건일제약(주),4632,오마코제네릭은 너무나도 큰 타격 망테크. 매출도 적은 정신 신경계 약팔라 함. 그 시간에 딴거하는게 백배 나음. 보여주기식 구라100프로 보고서 작성하느라 힘듬.
266,건일제약(주),4632,군대식 문화..... 복지가 점점줄어든다.......연차가 쌓일수록 연봉이 비슷해짐
267,건일제약(주),4632,연봉인상이 낮으며 성과금없음 복지에대한 부분이 미약하다고 생각됨
268,건일제약(주),4632,연봉이 적은편이라고 생각합니다. 연구소에서 개량신약을 위해 많은 노력을 하고 있는것으로 알고 있지만 결과적으로 발매되는 신약이 많지 않습니다.
269,건일제약(주),4632,"비효율적인 업무체계, 잡다한 일이 많음, 업무분해가 체계적이지 못함"
270,건일제약(주),4632,제약영업치고는 상대적으로 적은 연봉과 연봉인상. 유류비 100%지원 안됨
271,건일제약(주),4632,오마코 제네릭 출시 이후 기업 특색을 잃었다. 유일한 무기마저 뺏긴 상황에서 경쟁에서 밀리고있다 물론 그 책임은 영업사원만 가진다 이와 같은 상황에서 무기라고 가져온 의미없는 제네릭들이 건일=작아도 오리지널 회사 이미지마저 무너트렸다.
272,건일제약(주),4632,단순 보고를 위한 문서작업 또는 회의가 너무 많다는 점. 생산성 있는 일을 할 수 있는 시간에 문서작업이 배로 든다는 단점
273,건일제약(주),4632,충성도가 많은 직원이 이탈하여 많은 인원이 외부 인원으로 채워져 있어 여러 가지로 어수선
274,건일제약(주),4632,보고체계에 문제가 많습니다. 연차를 개인의것으로 생각하면 안됩니다. 회사내에 불필요한 말들이 많습니다.
275,건일제약(주),4632,탭으로 콜 찍음 거래처 100미터 안으로. 탭 무거움. 그래서 가벼운걸로 바꿔줌.
276,건일제약(주),4632,연봉이 매우작음. 예산 또한 매우 작음. 이런상황에서도 어쩔수 없이 예산을 써야하는 주사제 sales를 강요함 po제보다 주사제를 강조 하기때문에 담당자가 매일매일 실적 압박을 느낄수 있움.복지수준은 하위 수준이라 보면됨. 모든게 예산과 연결되었으며 매우 적음
277,건일제약(주),4632,"1. 동종업계 대비 낮은연봉 2. 야근수당 제한적 지급 3. 월, 금요일 연차 제한 4. 이직 횟수가 잦음 5. 잡무가 많음. 물품 구매도 까다로움 6. 인지도가 낮음"
278,건일제약(주),4632,"회의가 많고 잔업이많은편임, 연차낼때 사유가있어야하며 주말 전후사용은 자제해야함."
279,건일제약(주),4632,보고 업무가 많아 실제 작업 시간보다 보고 하는 시간이 많음 잡무가 많음(구매팀 따로 없어 자기가 필요한거 자기가 기안 구매 계산서 처리) 업무 대비 인력이 늘부족. 누가 연차라도 쓰면 남은사람이 후덜덜 힘든 하루가 됨. 연차 잘 쓰지 못함. 주말 앞뒤로는 사유가 명확한 사유 없이 잘 안 내줌.(개인 연차지만 맘대로 못쓰기때문에 개인의 것은 아님) 경력이 쌓일 수록 신입하고 연봉 격차가 줄어듬(신입연봉은 노출값이라 그런지 관리하지만 경력연봉은 노출되지 않기 때문인지 매우 소폭 상승) 일정을 타이트하게 잡아 피곤하게 함. TFT결성 하는 등 프로젝트가 많은데 TFT인원은 프로젝트만 하는게 아님 본인 직무도 당연히 해야함. 성과 달성이 없으면 명절 선물 사라짐
280,건일제약(주),4632,연봉이 기본급 / 12로 성과급 및 보너스가 없음 명절선물이 안나옴. 공장이 낙후되고 노후되었음 팀장 및 관리자들이 젊은편으로 경험이 부족함
281,건일제약(주),4632,이직률이 높다 열심히 가르키고 키워놓으면 다른 메이져 제약회사로 이직하는 경우가 많음
282,건일제약(주),4632,능력보다는 연줄이 우선되는 것으로 판단 동종업계 대비 적은연봉
283,건일제약(주),4632,야근 100%인정 안됨. 책임전가와 개인주의 강함 절대적인 성과위주의 평가. 비슷한 규모의 제약사 대비 낮은 연봉 본사와 공장의 분위기 전혀 다름. 목표달성 못하면 명절 선물도 없음
284,건일제약(주),4632,현 오너가 창업주 2세인데 직원들에 대해 제왕적 사고방식을 좀 가지고 있습니다. 모험을 하려 하지 않으므로 혁신적인 성과가 발생할 여지가 적고 그렇기때문에 직원들에 대한 처우도 딱 거기까지 뿐 입니다
285,건일제약(주),4632,건일인데 펜믹스 주사제 공장일까지 같이함. 일이 많으나 누구하나 주도적으로 나서서 하려하지 않고 야근 많으나 야근수당 모두 지급하지 않음. 팀장이 팀원들에게 무관심. 동종 업계 연봉 대비 심하게 적은 연봉수준. 계약직이나 경력직의 경우 연봉차이가 심함. 입사할때 협상하지만 통보수준이고 자꾸 문의하면 화냄.갑질함. 연속근무년수가 짧고 경력1~2년이면 다들 나감. 본사와 복지는 같으나 생산본부는 누릴수 없는것이 함정
286,건일제약(주),4632,통근버스 노선이 단조롭다 약사나 연줄없이 인정받기 어렵다
287,건일제약(주),4632,체계화되지 않은 비전 보수적이고 약간은 수직적인 사내문화(눈치)
288,건일제약(주),4632,야근이 잦은편인데 부서마다 더 일을 많이 하는 부서가 있음 야근이 잦은 부서와 작은 부서가 차이가 남
289,건일제약(주),4632,출근시간이 빠름. 휴식시간이 짧음. 팀마다 분위기가 많이 다름.
290,건일제약(주),4632,제품력이 아쉽고 경영진의 운영방침이 자주 바뀌어서 직원들이 혼란스러움
291,건일제약(주),4632,"간부들의 보수적인 태도, 지나치게 타이트한 일정관리, 예산사용에 깐깐, 시설에 투자하기 보다는 인력으로 해결, 잡일이 너무 많아 야근, 휴가 통제 심함"
292,건일제약(주),4632,잔업이 많고 수당없100%인정 안됨. 수당없이 오랜시간 일하는걸 좋아함
293,건일제약(주),4632,"소모품 구매 프로세스가 복잡하고, 직원의 사기를 떨어뜨림. 구매사이트를 만들어 연간계약식으로 진행하면 좋을 듯"
294,건일제약(주),4632,"연봉 인상율이 낮음, 업무량이 많으며 인원 충원이 까다롭고 시간이 오래 걸림, 인센티브 없음"
295,건일제약(주),4632,연봉 불균형 . 주업무 외에 기타 잡무가 많고 투자대비 효율이 없음 야근수당 100프로 인정이 안됨. 평가가 공평하지 않음
296,건일제약(주),4632,리베이트로 인한 타격이 좀 큰편이라 경 연난이 잇음
297,건일제약(주),4632,업무강도가높음 야근도많도 하지만 발전을 위해 투자할만한 가치가 있음
298,건일제약(주),4632,매출액에 비해 인지도가 높지않음. 노조가 없음. 주식상장을 안해서 인지 경영진 마음대로인듯. 공장은 야근 생활화. 복지가 별로. 인센티브나 성과금 제로. 딱 연봉만 받음.
