,company_name,company_id,review_text
130,건일제약(주),4632,제품 : 경쟁력 없음. 코로나 타격 큼. 타사 대비 보유품목 많지 않음 영업 : 제네릭 영업력 없음. 코로나 타격으로 분위기 안좋음. 총알지원 인색함. 감성영업? 강조에 따른 업무의 어려움 존재. 선배들이 닦아놓은 영업력으로 버팀. 미래먹거리 없어보임 HR : 직원에 대한 시각이 매우 인색. 전적으로 회사 입장 반영. 크레디잡 퇴사율 팩트를 체그해보면 퇴사율 매우 높음. 평균근속년수 낮음. 평가 : 매우 주관적인 견해로 평가가 이뤄지는것으로 보여짐. 조금 오버하면 윗사람에게 정말 간이고 쓸개고 다 내어줄것같이 하고 업무 빵꾸만 안나면 이곳에서 잘 생활할 수 있다고 보여짐. 경영진은 밑에 관리자들 말만 듣고 그게 진실인거처럼 모든걸 판단하는 듯 함. 일방향 소통임. 정작 제일 밑에 직원들은... 조직 : 회사생활 하다보면 이상한 사람들 한둘 있기 마련인데 이곳은 정반대인 듯 함. 정상적인 한두사람 찾아보기 힘듦. 대부분 자기만의 생각이 강하고 개인주의적 분위기인데 능력있는 리더들은 거의 없다고 판단 됨. 리더쉽 없고 업무도 잘 모르는것 같고 직책이 권력으로 잘 못 인지하고 있는 사람들이 있음. 커뮤니케이션 원활하지 않음. 상호간의 대화가 아님. 젊은 팀장들이 많은데 대기업 기준으로 보면 조금 오버해서 대리급들이 팀장하는 부서도 있고 그런 부족한 경력으로 팀장이라는 타이틀로 무식하게 팀원을 대하거나 일을 하는 곳이 있어보임 경영진 : 신뢰가 가지 않음. 회사는 어려워지고 있는데 제품의 다양성이나 사업의 다각화 또는 신규사업에 대한 탐색 또는 영업력 강화 와 같은 경영에 대한 추진력 없어 보임. 무엇보다 매우 소극적으로 경영을 하는것으로 보여지고 상장에 대한 의지 없음 커리어 : 신입이 들어온다면 제대로 된 업무를 배우기 어려움. 경력직 들어온다면 인수인계도 제대로 되지 않기에 업무를 파악하는데 시간이 걸리고 이곳에서 그동안 경험해보지 못했던 업무적 인간적 생태계를 느끼게 될 것임. 신입과 경력 모두 이곳에서의 커리어는 도움이 되지 못한다고 판단 됨.
131,건일제약(주),4632,단순 보고용으로 문서가 많아서 조금 비효율적인 면이 있다.
132,건일제약(주),4632,이런 사이트에서마저 별점5점짜리 거짓후기를 작성하여 평점관리와 검열을 하는 회사 여러모로 부족한 인력이 라인으로 승부보는 회사 더 좋은 회사에서 이직해온 사람들은 힘들어함 국내중소 수준의 마인드 장착해야 오히려 적응하기 쉬움
133,건일제약(주),4632,업무시스템은 대기업따라가싶어서 노력하는데 그에맞는 팀원수가 아님..사람이 너무 부족 인원없어 뽑아달라하는판국에 위에서는 인원 줄일려고 난리.. 돈을 너무안씀.. 자질구레한 소모품비도 아낄려고 난리침 돈 아끼는것때문에 GMP퇴행 수준..갑작스런 팀장교체로 팀원 멘붕 이로인해 능력있는 인재들은 퇴사
134,건일제약(주),4632,"정규시간은 8:30부터 시작인데 15분까지 들어와서 작업준비 하기를 원함. 정규 쉬는시간, 점심시간이 전혀 지켜지지 않음. 교대회사로 변하면서 임금체계도 바뀌어야하는데 대표라는 사람은 절대 돈 안주려고함. 오래 일한 사람들 내치기 바쁨. 눈오면 아침마다 남자사원들 밖에서 눈 쓸기 바쁨. 쉬는날에 일터지면 불러내서 잔업시간 안채워줌."
135,건일제약(주),4632,연봉을 안올리기 위해 직급을 없애는 후진적인 문화임. 인사가 지멋대로임.
136,건일제약(주),4632,"연봉이 적음, 위치가 좋지 않음, 한사람에게 과중한 업무"
137,건일제약(주),4632,연봉에 성과금 포함 투자를 하지 않고 결과를 바람 절약을 너무 강조
138,건일제약(주),4632,과거 안정적인 분위기였으나 많이 바뀌었으며 연봉도 경쟁사 대비 부족
139,건일제약(주),4632,"상여금이 전혀없음, 복지가 엄청나게 좋진 않음, 티오가 나기 힘들다."
140,건일제약(주),4632,갈곳없는 사람들이 모여있어 발전이 어려운 고인물회사. 그래서 더더욱 일을 안하고 월급루팡하는 회사 친한사람 감싸느라 능력있는 직원들 다 나가는 회사
141,건일제약(주),4632,보고절차가 많음. 연차 쓸때 눈치줌. 수직적인 조직문화. 안되면 되게하라고 함.
142,건일제약(주),4632,단순 보고를 위한 업무작업이 많아 시간이 많이 걸립니다. 개선되었으면 좋겠습니다
143,건일제약(주),4632,"코로나로 위축되어있는 구매, 예산 사용이 힘든 상황, 품목수가 적어 사회적 영향(코로나등)을 많이 받음"
144,건일제약(주),4632,비합리적인 인사제도
145,건일제약(주),4632,아무래도 지방이라는 것? 네임벨류가 많이 알려져있지 않아 주변에 말해도 잘 모른다는 것? 그래서 자부심을 잘 못느낄때가 가끔 있음
146,건일제약(주),4632,단점은 너무 많아서 하나하나 나열하기 힘들고 저 한달에 한번 밥주는거 말고 전부 단점
147,건일제약(주),4632,주먹구구식 느낌이었습니다. 인력배치에 대한 판단 능력이 부족하며 상당히 비전문적임 큰회사 다니다오신 분들은 전반적인 불통 마인드와 낙후된 느낌을 느낄수 있음  인력관리 능력이 떨어져 입퇴사율을 높여가고 있으며 이를 개선할 의지도 역량도 부족합니다. 중간관리자 엑스맨같은 인력들이 다량 포진되어 회사 발전 속도를 더디게 합니다.
148,건일제약(주),4632,인사평가의 종합적이라는 측면을 이해하지못하는 사람이 많음
149,건일제약(주),4632,승진이힘들고 오래된사람들이 많아서 적응이쉼ㅅ지는 않은편임 눈치륵많이봐야함
150,건일제약(주),4632,잔업이 너무 많고 사람들을 쉽게 대한다는 생각이 들어요
151,건일제약(주),4632,"직원 사기 진작에 필요한 돈을 많이 아끼는 느낌, 보상이 타사 대비 떨어지는 편, 영업환경이 어려움"
152,건일제약(주),4632,CP철저. 당연한 얘기지만 ㅋㅋ 콜 찍음 예산 적은 편
153,건일제약(주),4632,"부서마다 분위기 차이남, 군대식 문화가 남아있음(지역마다 다름)"
154,건일제약(주),4632,미생물 파트라그럼지 몸으로 하는일이고 야근도 많아요....ㅠㅠ
155,건일제약(주),4632,업무마다 일의 강도가 다르나 특정 업무의 경우 교대까지 해야함 최소 인원으로 하기때문에 휴일근무가 불가피함 직급이 없는게 장점이자 단점이다
156,건일제약(주),4632,"연차쓸때, 연차사유를 적어내야 함, 사람을 너무 안뽑는다"
157,건일제약(주),4632,승진 기회가 희박하고 급여 인상이 미미함. 업무외에 반강제적인 목표설정이 많아 힘듬
158,건일제약(주),4632,오래된 고인물 출신의 뒤떨어진 업무태도 실력보다는 아부로 승부보려는 마인드
159,건일제약(주),4632,기계가 노후된건 고장이 너무 많이 나서 근무시간이 배로 연장됨. 기계을 새거로 교체좀 해주시길
160,건일제약(주),4632,단점은 딱히 없으나 요즘 이직하는 사람들이 많아 커버리지가 넓어졌다는점입니다
161,건일제약(주),4632,직원들을 다소 소모품 취급하듯 대우함. 이직률이 심하며 애사심이 많이 부족해 지고 있음.
162,건일제약(주),4632,높은 연봉을 바란다면 아쉬울수 있다는 점 고인물 중에 문제있는 자들이 조금 있다는 점
163,건일제약(주),4632,공장업무를 사무직 타입으로 강요함에 공장 운영이 효율적이지 못함
164,건일제약(주),4632,서류가 많으며 많은 것을 요구하며 급여와 직원 복지가 낮음
165,건일제약(주),4632,"사람마다 다른거라 딱히 단정짓기 힘들지만 연봉제라서 매년 협상테이블에 앉아야 한다. 업무에 따라, 시기에 따라, 각자 노력보단 운에 따라 좌지우지되는 경향이 있어 처우는 공정하지 못한 부분이 다소 있는케이스가 발생된다."
166,건일제약(주),4632,급여가 높은 편이 아니고 이 회사 다니면서 사람 스트레스를 너무 많이 받았다. 부서별 차별도 좀 심한것 같고.
167,건일제약(주),4632,설비가 안될경우 조치가 안된다면 작업자의 숙련도 부족으로 작업자가 손해를 봄
168,건일제약(주),4632,마케팅 지원등 활동성이 약하다못해 미비한수준으로 일할맛이 안남
169,건일제약(주),4632,"일에 대한 체계가 부족해서 업무가 비효율적임, 경계가 모호해서 타팀의 업무가 내려올수도 있음, 경력자에 대한 대우 부족으로 이탈발생"
170,건일제약(주),4632,사람 맨날 부족함. 안그래도 없어서 힘든데 하라는거 많음
171,건일제약(주),4632,"그 오리지널리티의 장점은 끝난지가 백만년전인데 제형변경해서 신제품이라고 내는 약을 4번이나 출시 날짜 변경하며 영업사원들 양치기소년으로 만듬. 그마저도 이젠 다른회사도 팔라고 다 나눠줘버려서 수량부족이 발생. 품절되서 신규도 어려운 상황. 회사의 이익을 위해서라면 영업사원은 그냥 갈아마심. 오리지날의 의미가 전혀 없음. 우리가 우리약으로 싸워야되는 황당한 상황. 내근직 갑질, 무시 참아가며 일하는데 서류는 몇배는 늘어난거같고 팀예산/마케팅예산은 줄이고 그나마 부족한 연봉 커버했던 인센은 없애버리고 약은 품절내면서 성장을 바라는 어이없는 회사. 실적 잘하든 못하든 한번 찍히면 무조건 나가야 되는 회사. 시장성같은건 생각안하고 이상한 품목 들여와서 팔라고 하다가 어느새인가 보면 그 품목 사라질 위기에 처한 회사. 멀티이온? 이지듀는 또 얼마나 갈지? 서카딘은 지킬 생각은 있나요? 어쩌다가 이렇게 됐습니까? 그래도 정많고 사람좋다는 이야기 듣던 회사였는데... 이젠 말안해도 하루하루 사람이 나가더군요. 너무 많이 나가서 누가 누군지도 모르겠어요."
172,건일제약(주),4632,야근을 기본으로 생각하고 예산이 충분치 않으며 인원이 충분하지 않음
173,건일제약(주),4632,"갈수록 늘어나는 서류, 팀장의 꼰대 성향이 본부장보다 더 심함 pm들이 못버티고 모두 나감"
174,건일제약(주),4632,업무량이 누구는 많고 누구는 꿀빨고 비효율적임 분명 누군가 해야되는 일이생기게 되면 그것을 말하늗순간 내 일이 됨. 자신의 직무도 아닌데 남에꺼 해줘야하 허나 알아주는 사람없음
175,건일제약(주),4632,"단점은 나열하자니 너무 기네요. 낮은 연봉, 과거에 얽매인 제품 라인업, 내근직의 갑질, 말도 안되는 상사의 지시 등등 그냥 제약업계 최악의 회사"
176,건일제약(주),4632,1. 매출액 목표 따라가느라 정신없음 생산맨날 밀림 그냥 다밀림 야근특근 개꿀 2. 비상장 그냥 대표독식 배터져죽으시길 3. 복지없음 떡값없음 그냥 상여금 자체가 없음 월급이 끝임 명절에 뭔 필요도없는거 어디서 대량으로 뗀건가 그런거줌 믹스커피 먹을구잇음에 감사함 4. 커피
177,건일제약(주),4632,복지 자체가 없음 믹스커피는줌 연차 자유롭게 쓰라는데 상사만 자유롭게씀 아주 젊은회사라서 개인주의 강함 상사도 개인주의임 내가 뭐하는지도 모름 그래서 업무량 맨날 적은줄 분명 젊은데 꼰대임
178,건일제약(주),4632,"정체 모를 실적 시스템, 마케팅 역할의 부재, 직원들의 애사심 부족"
179,건일제약(주),4632,"실제로 공장에서 생산하는 제품의 수가 적어 제조 기술은 쌓긴 어려웠다 허나, 그 외적은 부분(문서작성, 전체적인 회사 시스템, GMP) 은 많이 배울 수 있다"
180,건일제약(주),4632,연봉 상승률 낮음 장기 근속 적음 대리직급정도 되면 이직 준비함
181,건일제약(주),4632,경영진의 직원에 대한 애정이 부족함 오너의 직원과의 대화가 부족.소통이 안됨. 오너의 독단(열린 마음 부족) 직원이 자주 들고난다
182,건일제약(주),4632,고립되어있다는 거? 점심에 카페 못가고 탕비실이 따로 없움 ㅜ
183,건일제약(주),4632,"내 연차를 쓸 때 마다 눈치봐야함. 30분 잔업은 올려주지도 않음. 잔업을 한다해도 퇴근시간이 정해져 있어도 작업이 안 끝나면 퇴근 할 수 없음. 잔업 잘 안 올려주로 심지어 그 시간 마저 팀장 마음대로 깎음. 고인물 꼰대들이 많다. 까라면 까야함. 군대냐? 잔업특근 강요 심하다. 타팀 지원 많이 보낸다. 신입사원 및 계약직, 알바 뺑뺑이 돌림. 매출액 달성해도 인센브 없음. 직급제 없음."
184,건일제약(주),4632,"꾸준히 성장하다보니 고인물들이 많다. 근무 시간 및 야근, 특근 등에 있어서 보여주기식으로 일하고 실질적으로는 떠넘기는 사람들이 있다."
185,건일제약(주),4632,쓸데없는 취합 많고 필요없는 내근이 많아서 불필요함 영업직 직원들이 경력직이 많음 그리고 내근직사람들이 영업직 엄청 무시함 영업회사에서 이렇게 무시당한다는 느낌 들기 힘든데 이런 곳은 처음임
186,건일제약(주),4632,개인주의 알아서 적응하고 업무 배워야하는 분위기라 신입으로 들어가면 힘든 분위기
187,건일제약(주),4632,연봉이 동종업계보다 낮은건 사실이다. 그만큼 근로의욕이 낮음
188,건일제약(주),4632,화사가 클꺼같지 않아요 상장도 안하려하고요 개인주의입니다 이건 장점이자 단점이에요
189,건일제약(주),4632,줄어드는 복지와 눈치주기 적은급여 노예취급 등 단점이 엄청나다 잦은 야근 조선시대 노예도 이보단 나음 ㅇㅇ
190,건일제약(주),4632,능력을 중시한다 하지만 결국은 오너의 입맛에 맞는 과정과 결과를 보여줘야한다. 중간관리자들의 마인드와 업무역량은 글쎄..
191,건일제약(주),4632,"오너의 맘대로, 본인 사촌 변호사를 영업자리에 두고, 사람도 잘 자르는편입니다. 기본적으로 영업조직과는 신뢰관계가 깨져 있어서 영업으로 지원은 절대비추입니다."
192,건일제약(주),4632,상여금이 없다. 명절에는 돈은지급해주지않고 선물로 대체(7만원상당) 승진제도가 없다. (본인 업무역량에 따라 연봉인상이고 2019년부로 주임대리급으로 연봉을 쳐주지는 않음)
193,건일제약(주),4632,"아껴야 인정 받고, 외부 영업은 머 없어도 잘 해야하고. 내부 영업은 원래 잘 해야함. 잘못된거 이야기하고 퇴사한 직원이 잘못한거임."
194,건일제약(주),4632,끌어주는 사람은 끌어주지만 나머지는 나가라는것같은 느낌이듭니다.
195,건일제약(주),4632,"쓸떼없는 보고,서류 많음 딸랑이 하나때문에 최근 서류가 또많아짐,, 이해되지않는 임원진의 인사이동,,전문성이 없다 연봉적다 gps콜있음 예산이 없다고 보면됨"
196,건일제약(주),4632,일단 회사가 발전이 없음. 성장하는 회사가 아님. 차라리 펜믹스가 성장하는 회사고 투자도 많고 하는 편이지만 건일은 투자도 없고 예산도...사람도 계속 줄이는 중.
197,건일제약(주),4632,"야근 시간이 안정해져있음 일 못끝내면 바로 야근! (일이 안끝나면 퇴근 못함 그게 새벽일지라도 ) 체계따위 볼수 없는곳 연봉도 적음 (1년에 5만원?정도 올려줌, 협상도 협상이 아님 서류 작성해와서 싸인하라고함) 최소의 인원으로 최대를 뽑아내려함"
198,건일제약(주),4632,제약회사이며 설립된지 오래되었다~여초회사이다~인센티브는 없다. 월급이 짜당
199,건일제약(주),4632,서류업무가 너무많아 다른 본 업무에 지장을 줄정도이며 인원 충원이 늦거나 적어 개인의 업무양이 많은 편
200,건일제약(주),4632,"연차를 눈치껏 쓰라는데 연차쓰겠다고 하면 눈치줌. 무슨 사유인지도 자세히 써야함. 다른팀 바쁘면 지원가야하고, 반교대 돌리면서 교대수당은 안줌.연봉 협상 하나마나"
201,건일제약(주),4632,휴가쓰는데 개인 사유 일일히 말해야함 말하기 싫어도 물어봄 주말 붙여서 쓰거나 공휴일 붙여서 쓰면 눈치줌 책임전가하기 바쁨 한사람당 담당하고 있는 일이 너무 많아 효율성이 떨어짐 사람은 안뽑는데 사업은 계속해서 확장시켜 나감 사람을 사람으로 안보고 일하는 기계로 생각함 직원복지가 하나도 없음
202,건일제약(주),4632,중소기업의 단점인 업무의 분담이 없어 한사람당 일하는게 많음
203,건일제약(주),4632,영업활동이 매우힘들게변하여 매출성장이 어려운구조. 하지만 본사에서는 매출하락을 허용하지않음
204,건일제약(주),4632,대표이사를 비롯한 임원진들의 문제가 많습니다. 특히 실적 압박 때문에 심리적으로 편하게 근무하기 힘듬 구내식당이 없어 바깥에 나가서 사먹어야 함
205,건일제약(주),4632,"실적평가 불투명, 사내 정치 위주로 마냥 yes해야 살아남는 회사."
206,건일제약(주),4632,실적에 대한 보상 적음. 많이 준다고는 하나 실질적으로 고성장하는 사람에게는 많지가 않음. 위사람에게 바른소리 절대 못하는 기업문화.
207,건일제약(주),4632,1. 예산 감소로 인해 영업 활동이 어려움. 2. 연봉 매우 낮음. 3. 잘못된 인원 감축. 4. 실적 시스템 체계적이지 못함.
208,건일제약(주),4632,2세경영으로 오너리스크 높음. 예전엔 좋은 회사였으나 현재는 위험한 회사임. 치졸한 내부정치로 인해 주요인력이 거의 빠져나간 상황. 오너가 독불장군으로 타인의 의견을 듣지 않음
209,건일제약(주),4632,회사가 너무 촌구석에 있어서 출퇴근이 불편하다......
210,건일제약(주),4632,스파르타식으로 도전정신이 강해야함 강한의지력으로 대응하면 가능성있음
211,건일제약(주),4632,있던 애사심 마저 사라지게 함 영업부 직원들을 소모품 취급함 최근 기업 횡포로 건일제약만 검색해도 안좋은 기사가 수두룩 함
212,건일제약(주),4632,부서마다 다르겠지만 꼰대 마인드가 강하고 군대식 마인드 윗선에 복종하는걸 좋아함
213,건일제약(주),4632,최소인원으로 최대효과를 보려한다 투자나 기기 수리에 위한 과정이 힘들다
214,건일제약(주),4632,"낮은 연봉, 인지도 있는 제품을 보유하고 있다는 장점 외에는 전부 단점"
215,건일제약(주),4632,발전 가능성 낮고 오래다닐수록 연봉적다. 인센티브도 거의없어 돈벌기 어려움.
216,건일제약(주),4632,회사의 위치가 도심에서 멀고 자차가 없을경우 출퇴근이 힘듦
217,건일제약(주),4632,업무담당이라는 제도의 장점이 단점으로 나타나는 경우가 있음
218,건일제약(주),4632,직급이 없으니 승진 자체가 없음. 업무에 대한 대우가 갈수록 줄어드는 추세. 회사 품목이 좋아서 알아서 매출이 늘고 있다는 큰 착각.
219,건일제약(주),4632,구매팀 없어 직접 물건 사서 계산서 처리 노후화된 기계 공정별로 담당자 한명씩 둬서 담당자 휴가 쓰면 다른 공정사람이 대체 그 과정에서 휴가자한테 계속 전화해서 물어봄 진짜 짜증나고 환장함 애초에 공정별로 2명을 두면 휴가 편리하게 쓸수있음 QC직원들만 불어나고 생산직 인원은 늘어날 생각 없음 무조건 QC만 직원 늘어나고 QC만 생각하는 공장 생산팀보다 QC직원이 더 많음 생산경력 2년 많은 직원보다 아무경력없는 고졸 QC직원이 연봉이 더 높다 이 점은 정말 이해할수없다 기계 소모품 필요시 항상 예산이 없이지고 사라져서 구매 힘듬
220,건일제약(주),4632,올드한 제품이 많으며 제품수가 많지 않음. 프로모션 예산이 높지가 않아서 공격적인 영업활동이 이루어 지지 않음
221,건일제약(주),4632,복지 다 깎아내리고 연봉 매우 적음 협상때는 거의 통보식 연봉임 현 생산본부지만 기획본부에서 연봉협상하는데 생산본부 본부장과 같이 협상?함... 사실상 통보와 협박
222,건일제약(주),4632,- 고용에 대한 불안전성 - 타사 대비 매우 낮은 연봉과 인상률 - 영업 활동에 대한 지원이 매우 적음 - 그 밖에도 너무 많지만.. 전형적인 중소기업이라고 생각 됩니다.
223,건일제약(주),4632,비합리적인 인사평가 및 직원을 믿지못하는 경영진 오너회사의 한계 및 고용불안정
224,건일제약(주),4632,동료들이 갑자기 사라져 감. 예산도 같이 사라져감. .....
225,건일제약(주),4632,신입때부터 수습지나면 사원이든 과장이든 실적가지고 평가받는다. 해고는 없지만 실적 안나오면 윗선에서 퇴사 압박이심함.
226,건일제약(주),4632,여러가지 배운다는 것이 장점이나 본 업무에 대한 깊이는 낮을 수 있습니다 혼자 많은 것을 해야합니다
227,건일제약(주),4632,연봉상승율이 거의 없으며 올해부터 마이너스 연봉인상율이 도입됨 이대로 마이너스 평가받으며 오래다니다보면 편의점 아르바이트보다 저임금될 가능성 농후함
228,건일제약(주),4632,"현 상황과 맞지 않는 높은 결과만 뜬구름 잡듯이 말함 단기내 성과가 없는 경우, 기다려주지 않음"
229,건일제약(주),4632,직급이 없어지면서 진급의 개념 없어짐. 연봉이 업계 평균보다 적고 활동비 유류비 등 기타 지출비용 지원이 부족함. 작은규모로 시스템이 잘 갖추어지지않은 편임
230,건일제약(주),4632,희생양만들어 직원 해고 (관리자의 책임 전가) 낮은 연봉 및 협상과정 불투명 통보 신규의약품 없음 비용을 아끼려는 처절한 몸부림 예스맨만 남아 대책이 없음
231,건일제약(주),4632,타 제약회사보다 연봉 수준히 확연히 떨어짐 상여 보너스 1도없음
232,건일제약(주),4632,비합리적인 평가제도 털면 먼지많이나는 윗선들 직원 구조조정 진행중
233,건일제약(주),4632,"공장 인원이 적으나, 규정이나 업무 다양성이 존재함. 인원부족으로 실행이 불가한 상황이 빈번함. 사람들이 자주 바뀌어서 업무 연속성의 어려움"
234,건일제약(주),4632,발전하기보다는 정체되어잇는회사임 품목이제한적이므로 영업활동에 제한적
235,건일제약(주),4632,연봉이 너무 짜..연봉 업계 최저 같은 회사인데도 본부별 다르게 적용되는 룰
236,건일제약(주),4632,월라벨를 얘기하지만 현장 생산하고 맞지 않게 경영진 원칙만 얘기함. 진짜 월라벨이 이루어지도록 인원보강을 해주던가 아님 시스템을 구축해주던가....
237,건일제약(주),4632,대부분의 사람들이 좋지만 팀장 잘못만나면 견디기 힘듬
238,건일제약(주),4632,복지전무. 대표 및 내근직들 마인드가 영업을 물로봄. 나가면 새로운 사람 뽑으면 된다고 생각하며 영업을 막대함. 이년전부터 일 잘하는 사람들 오래있던 사람들 다 나감. 애사심을 갖게하는 그 어떤 점도 없음
239,건일제약(주),4632,"수평적 분위기라 의사결정이 힘든 부분이 있음, 서류작업이 많음, 부서간 협의가 어려움."
240,건일제약(주),4632,앞날이 안보임 발전 가능성이 적다고 생각됨. 제약회사에 약사가 크게 필요없을 수 있는데 너무 없음
241,건일제약(주),4632,연차사용이 힘듬. 타기업에 비하여 낮은연봉이 단점. 콜 시스템으로인한 업무적부분에 스트레스를지님
242,건일제약(주),4632,쓰잘데기없고 하등 도움안되는 취합으로 인해 스트레스 증가. 오리지널 품목의 적음 및 타회사에 비해 경쟁력 떨어짐. 예산이 적어 활동하기 어려움
243,건일제약(주),4632,"야근 요구 많이 있음 부정확 불투명한 지시, 회식 술잔돌리기 등 옛날식 문화 잔재"
244,건일제약(주),4632,팀장에 따라 인사평가 및 복지제도 사용 여부가 다르기 때문에 어느팀이냐가 중요하고 고인물이 너무 많다. 팀장들이 돌아가며 팀을 맡기도 하여 특정 팀장을 제외하고 아무 좋지 않다.
245,건일제약(주),4632,체계없고 직원 월급을 쥐고 흔들려는 썩은 마인드 가졌음. 실상은 중소기업이나 마치 대기업인냥 행동함. 단 대기업 월급을 준다는 것은 아님. 팀장 나가면 아무나 팀장자리에 앉힘. 그마저도 금방 교체됨.
246,건일제약(주),4632,업력에 비해서 회사 운영시스템이 매우 후진적임. ERP 엉망임.
