,company_name,company_id,review_text
0,건일제약(주),4632,제약 산업을 이끌만한 도전적인 마인드와 기업 성장 가능성이 적음
1,건일제약(주),4632,"불필요한 서류가 많고, 알아서 혼자해야함 금연 강요하고 소변검사까지 진행하며, 벌금 및 봉사활동을 강제시킴"
2,건일제약(주),4632,의심이 팽배한 경영진과 쓸 수 없는 복리후생 예산으로 직원 소모품으로 생각하는회사
3,건일제약(주),4632,급여 및 경영진 발전 의지 없음 후속 투자 소홀 직원 관리 부족
4,건일제약(주),4632,너무 많다 기안 작성 어렵고 툭하면 반송 후 심지어 혼냄 연봉 상승률 극악 인사팀이 경력직으로 들어오면 연봉 너무 후려침
5,건일제약(주),4632,투자가 없다 인적 투자 성장 및 복지 경영에서 아무런 관심이 느껴지지 않는다
6,건일제약(주),4632,낮은 연봉이고 인상률도 낮은편이다. 입퇴사자가 많아 업무 공백이 많이 생긴다.
7,건일제약(주),4632,급여수준 경영진 마인드가 구식이고 일을하는 사람만한다
8,건일제약(주),4632,급여가 그냥 그렇고 흡연자들은 거의 강제로 금연해야되요
9,건일제약(주),4632,영업사원은 필드에서의 시작을 많이 보내야 하는데 서류를 위한 서류가 너무 많음
10,건일제약(주),4632,1. 단점이 안보일 정도로 문제파악이 안됨 2. 고인물인지 구정물인지 구분이 안됨 3. 월급루팡이 많음 4. 복지다운 복지가 없는 좋게 말해서는 전통적인 직설적으로는 옛날 분위기 회사
11,건일제약(주),4632,사람이 자주 바뀜 복지가 거의 없음 연봉인상이 잘 안됨 GMP 엉망 잡무가 많음
12,건일제약(주),4632,회사의 방향성 영업직들을 천대하는 문화 지원이 없는 회사
13,건일제약(주),4632,공격적으로 영업하고 싶은 사람에게 어울리지 않는 회사 신제품이 나오긴 하는데 경쟁 회사에 비해 한 발 늦게 나와서 매번 선점을 하지 못한다
14,건일제약(주),4632,"급여를 동종업계 수준보다낮음, 독단적인 업무체계가 있어 힘듬"
15,건일제약(주),4632,하는것만 하고 신제품은 없는듯 제품의 외주 연봉인상율 최저
16,건일제약(주),4632,급여가 생각보다 낮습니다. 인센티브도 연말로 갈수록 약속 금액보다 적어지는..
17,건일제약(주),4632,직원들을 업무 외적으로 옭아맴 금연검사하는 회사는 처음들어봄
18,건일제약(주),4632,"개선사항을 매달 물어봄 , 텃세아닌텃세가 있음 지금은 어떤지모르겠지만 연차사용시 이유를 적었음"
19,건일제약(주),4632,단순 보고를 위한 서류작업이 많았으며 제품군이 다양하지않다. 오래다닐수있는반면에 오래된 분들이 많이계셔서 기업문화는 유연하지 않은 편
20,건일제약(주),4632,경영진이 최고의 문제 제약업 자체를 이해 못하고 배울 의지도 없음
21,건일제약(주),4632,프로젝트 진행에 있어 우선 순위없이 동시 진행해 업무 로드가 많이 걸렸음
22,건일제약(주),4632,장점 빼고 모든것이 단점 사람을 귀찮게 하는 시스템 뭘 사려면 3전에 생각해야함
23,건일제약(주),4632,업무를 많이 배우기에는 회사 다변화가 없는 편입니다.
24,건일제약(주),4632,"야근을 다 인정 받진 못합니다 연봉 협상이 아닌 통보형태 입니다 야근이 많습니다 연차 사용이 쉽진 않습니다 수평적 구조로 직급은 없습니다(팀장, 팀원)"
25,건일제약(주),4632,"연봉이 타사대비 최악이고, 일보다는 정치를 잘해야 성장하는 회사"
26,건일제약(주),4632,전문성이 있는 사람이 없음 유능한 직원 다 나감 복지 없음 업계 최저 연봉
27,건일제약(주),4632,보고를 위한 보고. 주요 팀이 없어 모든 것을 각팀에서 처리함. 순환보직을 통해 전문 지식이 없는 사람들이 윗사람으로 와서 골치가 아픔.
28,건일제약(주),4632,주력 제품이 없어서 영업 하기엔 그닥 좋은 환경은 아니었음
29,건일제약(주),4632,업무강도가높음. 사람채용이 안되다보니 기존근무자가 힘들지만 충원되면 ㄱㅊ
30,건일제약(주),4632,전문의약품을 만드는 회사여서 한번도 먹어본적이 없다는 거 빼고는 단점이라고 할 것이 없습니다! 아 굳이 하나 뽑자면 시내 외각에 있다? 그정도일 것 같습니다!
31,건일제약(주),4632,단순보고 너무 많아요(팀장구두보고 이메일보고 일 두번하기) 개인연차 사유 집착해요. 실무를 모르는 리더. 팀원들 업무분장 모르는 리더. 문서검토(빠르면 3일) 업무지사방향 못내려줌. 본인이 알아서 일처리 해야합니다. 유관부서 타사 업무 협의안됨 일받아오기. 자기선에서 일처리 못함. 실무자 탓. 실무자만 고생합니다. 사무실에서 업무얘기하면 시끄럽다고 주의줍니다.
32,건일제약(주),4632,"문서 작성만 하다 끝남, 관리부서의 파워가 왜 센지 모르겠음. 능력있는 사람이 그닥 없음"
33,건일제약(주),4632,문서작업이 많아 비효율적임 엑셀지옥 쓸데없는 보여주기식이많음
34,건일제약(주),4632,여러 단점이 있긴 했지만 어느 훌륭하신 분의 활약으로 회사가 판도라의 상자를 열어버림. 그물에 낚이던 낚이지 않았던간에 구성원들이 회사에 대한 신뢰가 완전 박살나버렸음. 그동안 암행뛰고 사람 뒤 캐고 이러는거 다 참아왔고 적어도 이전 사건은 내부에서도 다 알고 있으면서도 마지막까지 건드리지 않던 부분이었는데 이제 어떻게 수습할련지....
35,건일제약(주),4632,연봉이 저렴함. 평가기준이 모호하고 상사의 스타일에따라 주관적이며 괙관적인 평가가 잘 이루어지지않음
36,건일제약(주),4632,"필요한 업무 외에 시간을 허비하는 잡무가 많음, 업무에 쓰이는 예산에 관해 야박한 편"
37,건일제약(주),4632,제약회사 치고 연봉이 작고 가족회사라서 인센 주유비 상여금등 없음
38,건일제약(주),4632,일단 너무 많아요 일단 제가 근무중인 곳은 야근이 너무 많아요
39,건일제약(주),4632,"아무래도 업계 평균에 비해 낮은 연봉이 제일 큰 문제이고, 연봉이 인상될 기미가 안 보이는 게 두 번째 문제. 인간관계에 따른 스트레스도 큰 편이지만, 이건 사실 어느 회사나 마찬가지라."
40,건일제약(주),4632,"특정인 1-2인을 제외한 들러리 회사, 밑에서도 보이는 경영진의 알력다툼. 현실판 심즈"
41,건일제약(주),4632,제약회사라는 본연의 정체성이 약하다 스스로 연구개발하는것은 전무하다 그렇다보니 약들이 의사들에게 임팩트를 주지못하고 건강식품 같은 약들뿐이다 제약회사 중에서 영업력도 상당히 약한편에 속한다
42,건일제약(주),4632,그냥 저냥 버티면 다닐만하지만 내 커리어에 큰 도움은 안될 것 같음. 근로자들 평균연령이 어림. 사람들이 너무 자주 바뀜. 회사가 크게 발전하지는 않고 그냥 흘러감.
43,건일제약(주),4632,"연봉이 낮고, 오리지널 품목이 많지는 않음, 쓸때없는 서류가 너무많음, 보고절차가 너무많음."
44,건일제약(주),4632,쓸데없는 보고가 많다. 예산 사용에 제한적이다. 월급이 적다
45,건일제약(주),4632,1.서류가 너무 많고 해야할일들도 많아서 영업활동에 집중하기가 어려움 2.낮은 급여 3.쓸데없는 제품개발
46,건일제약(주),4632,실질적으로 동종 업계에 있어 낮은 연봉 gps콜 준법에서 감시
47,건일제약(주),4632,지하철 역세권은 아니고 걸어야한다 박봉으로 하층민의삶을 경험해볼수있다 커리어의 무덤이다
48,건일제약(주),4632,"쓸데없는 문서작업이 아주 많으며, 품절은 잦으나 공지를 잘 안해줌 다들 나가려고 함 한달에 한번씩 디테일 해야함"
49,건일제약(주),4632,리딩품목이 있고 나름 인지도가 있지만 인지도 만큼의 급여는 아니었음
50,건일제약(주),4632,보고를위한 보고용 서류업무과다 GPS콜있음 위치에 맞지않는사람들을 본부장 팀장으로 배치하여 횡령과 부조리가 난무함. 회사를 곤두박칠치게만듦.
51,건일제약(주),4632,"어느회사나 다 있지만 실력없는 정치세력들이 좀 많습니다, 밑보이면 다들 힘모아서 나쁜 사람 만드는 일이 비일비재, 영업의 힘이 많이 없습니다"
52,건일제약(주),4632,성장성이 없으며 비전도 없고 연봉인상도 없음 많은 것은 징계자와 퇴사자 뿐임
53,건일제약(주),4632,"팀마다 다르지만 전체적으로 연차 사용 시 눈치 보임, 연봉 인상의 폭이 큰 편은 아님"
54,건일제약(주),4632,"직급체계가 없지만 의미없는 제도, 사람들이 다 나가는 이유가 너무 분명한데 윗사람들은 모름"
55,건일제약(주),4632,투자 안함 전혀 안함 발전 의지 없음 현실 안주 가성비 지나치게 추구
56,건일제약(주),4632,"퇴직자가 많다, 항상 쫓기듯이 일한다, 회사에서 바라는게 많으며 희생을 당연시한다"
57,건일제약(주),4632,타사 대비 연봉이 매우 적음 타사 대비 복지가 비교적 적음 타사 대비 수평적 문화 조직이긴 하나 아직 자리 잡히려면 상당히 오래 걸릴 듯함
58,건일제약(주),4632,"가십거리에 오르기 쉬움, 근처 물가 비쌈(점심값), 회사가 발전하는 모습이 전혀 없음"
59,건일제약(주),4632,1. 인센 따윈 없다 2. 부업무가 많다 3. 회의가 많다 4. 회의를 위한 회의가 많다 5. 담당자 생각보다 많은 것을 결정하고 행한다 6. 예산에 대한 압박이 심하다 7. 유관팀에 젊꼰 보다 심한 빌런이 존재한다
60,건일제약(주),4632,1. 이/퇴직이 엄청 많음 2. 제약업계 하위권 연봉수준. 향후 목표도 중하위권수준 연봉(사장피셜) 3. 모든 부서가 빠듯하게 돌아감. 강소기업을 목표라고 하여 인원확충 전에 업무부터 늘리라고 함. 4. 야근해야 열심히 한다고 평가함
61,건일제약(주),4632,고인물들끼리 똘똘뭉쳐있음 이게 무슨말인지 알거임 GPS 콜 있음 매달 찍는 영상 인터뷰있음 매달 시험있음
62,건일제약(주),4632,"사내정치가 매우 심해 윗사람 바뀌면 전반적으로 물갈이되는 분위기, 임금과 인상률이 너무 낮아 입퇴사자가 매우 많음"
63,건일제약(주),4632,"1.식당이 없고, 주변 맛집들이 비싸다. 2. 특별한 복리후생은 없는 것 같다. (자기개발 비용 지원, 독특한 지원들들..)"
64,건일제약(주),4632,팀 별 근무량이 상당히 차이남. 관리자가 관리를 제대로 못하고 있다고 느낌.(팀별 케바케) 계약직 차별
65,건일제약(주),4632,사람이갑자기 너무많이바뀜 혼란의 도가니임 팀장님도 갑자기 하루아침에 바뀌는회사.. 오래근무하기엔 어려울듯
66,건일제약(주),4632,생산성이나 이익 개선등 실질적인 효과를 기대하기 어려움 나이 먹으면 퇴사해야하는 분위기
67,건일제약(주),4632,집에 못감 정치질 이간질 하는 사람 존재 비전이 너무 없음
68,건일제약(주),4632,"업계 대비 매우 낮은 연봉, 불가능한 목표로 인센티브 제로, 쓸모없는 쿼터리, 디테일 영상"
69,건일제약(주),4632,문서작업 많고 쓸데 없는것들이 많음 또한 직원들 소모폼으로 취급
70,건일제약(주),4632,시스템 비효율적이에요 잡일이 많아요 사람이 자꾸 바뀌어요
71,건일제약(주),4632,쉴곳이 부족함 주변에 카페나 편의점은 찾아볼수가 없다 체계적이지 못한점이 있다
72,건일제약(주),4632,한명당 하는일의 범주가 넓다. 매출부진으로 연봉이 팍팍안오른다.
73,건일제약(주),4632,별다른 복지가 없음 연봉은 낮은데 인상률은 더 낮음 퇴사율이 높은 회사
74,건일제약(주),4632,복지 제도가 있지만 여자에게만 적용 연봉 상승 적고 타 제약에 비해 연봉도 적다
75,건일제약(주),4632,연봉 상승이 형편 없으며 경력이 나가면 신입을 뽑는 회사
76,건일제약(주),4632,위에서 말도안되는 양의 작업을 요구해도 잔업이며 특근이며 어떻게 해서든 완료해야 하고 완료될시 다음번에는 더많은 작업량을 요구함 나아지는 것 하나없이 계속 반복적인 상황이 일어남
77,건일제약(주),4632,사내정치 심하고 윗사람들 마인드가 재활용조차도 안될정도임
78,건일제약(주),4632,오너문제가크지만 아부잘하면 고속승진가능함 평범하면 최악이됨
79,건일제약(주),4632,"Eu-gmp 승인이 났지만 지금 당장 eu-gmp 재심사를 받으면 탈락할것이다 통근버스가 운영되고 자체적인 식당이 있지만, 통근버스가 많다고 하지 않았고 식당이 맛있다고 하지 않았다 야근시 수당이 나오지만 많이 나온다고 하지 않았다 능력없는 팀장들이 득세하여 눈에 띄게 gmp수준이 후퇴하고 있다 새로 온 본부장부터가 본사 눈치보기 급급하여 예산 줄이기에만 혈안이 되어 있다(gmp를 지킬 생각이 있는지조차 의문이 든다) 고졸 사원이고 대졸 사원이고 신입이고 경력직이고 오래다녔고 적게다녔고 상관없이 연봉은 매 년 일괄적으로 100만원씩 오른다 내가 아는 개인적인 원수가 이 기업으로 간다고 해도 진지하게 말려볼 생각이다"
80,건일제약(주),4632,바쁠때는 점심시간이 좀 보장 안되긴 한다 혜택이 별로 없다
81,건일제약(주),4632,"상여, 성과급 없음 주식상장의 의지가 없으며, 예산으로 장난을 많이치고 연봉인상률이 낮음 성과에 따라 연봉이 달라질수있으나 큰 의미없음"
82,건일제약(주),4632,연봉 인상률이 낮음 고인물이 많아서 꼰대들이 많음 팀장은 그냥 오래 눌러 앉아 있으면 시켜주는듯 회사에 싫은 소리 하면 나가라는 식의 제스처 취함 퇴직금 주기 싫어서 일년 못채우게 하고 빨리 나가라함
83,건일제약(주),4632,기본적인 GMP이념에부합되는지 의문이가고 회사 주력제품이 외부에서만들어와서 외부에서주지않으면 생산진행이안되는상황
84,건일제약(주),4632,자질구레한 일들이 많아 주요 업무를 하는데 부담이 됩니다.
85,건일제약(주),4632,직급이 나눠져있지 않아서 결제라인을 타는 것이 아니라 직접 결제 받으러 다녀야 함.
86,건일제약(주),4632,"고졸이나 대졸이나 일하는건 똑같은데 연봉은 7~800만원 차이남, 공장 가동시간은 늘어나는데 예산은 줄어드는 이상한 기업"
87,건일제약(주),4632,"연봉 외엔 기대하지 말 것, 성과급 인센티브 없음..."
88,건일제약(주),4632,한번 위에 찍히면 벗어날 수 없음. 내부 영업 필요함.
89,건일제약(주),4632,너무젋어 체계가없고 책임감이없으며 부지가넓으나 제대로이용못하고 한 부서로일이몰려있어 일을하면할수록힘든회사
90,건일제약(주),4632,너무 많타 사내 정치질 인원 보충 x 그냥 모든 것이 최악이다
91,건일제약(주),4632,제약치고는 매우 박봉.  언론통제가 심함. 별점 알바 하나씩 해야됨. 오래다닌 모자란 사람한테 찍히면 큰 원한을 사게됨 기울어가는 회사 보면서도 반성을 안함.
92,건일제약(주),4632,"연봉이 너무 적으며, 연차가 쌓여도 큰차이가 나지 않음. 선배, 팀장을 봐도 큰 차이가 없는 연봉으로 인해 일에 대한 욕구가 생기지 않음."
93,건일제약(주),4632,특정부서만 지원해주고 다른 부서에 대한 지원은 적습니다. 그래서 그런지 약간 압박도 있고 부담스럽습니다.
94,건일제약(주),4632,"단순 보고를 위한 서류작성업무 매우 많음, 거래처 갈 시간도 없게끔 제출기한을 주고 매출 달성하라는 말같지도 않은 행태를 보여줌, 꼰대문화(응꼬 잘빨고 줄 잘서는 사람은 똥을 싸도 칭찬하기 바쁨)"
95,건일제약(주),4632,사람은 좋고 회사 분위기도 좋으나 일은 점점 많아지고 사람은 안뽑아주고 ㅜㅜ
96,건일제약(주),4632,복지가 좋은것처럼 말하지만 정작 아무것도 없엇음 그나마 적은 연차도 샌드위치 휴무때 강제로 사용하고 연봉인상율 너무 낮고 중소기업 보다 낮은 연봉 때문에 직원들이 애사심이 없고 주는 만큼 일함  현저히 낮음
97,건일제약(주),4632,"평가때 실적 기반이 아니라 관리본부에서 떠드는 헛소문, 뒷말, 자기네들 평가 수준에 따라 연봉이 삭감된다 결국 자기네들 마음에 안들면 나가라는 소리다 19년도 부당해고도 다 사실이다"
98,건일제약(주),4632,"후진국과 비슷한 내근시스템, 탁상공론화, 예산도 없으면서 현장에서 해오라는 말도 안되는 구조"
99,건일제약(주),4632,"1. 특정본부(H)의 갑질, 기준같은거 없음, 내로남불, 공화국임 2. 평가가 실적 기반이 아닌 그냥 특정본부에 잘보였느나 안보였느나임, 정치판임 3. 연봉인상율이 낮아도 너무 낮음(일부로 직급체계 없앰)"
100,건일제약(주),4632,특정본부 (굳이 말 안해도 전직원이 다 암)의 갑질과 진짜 해도해도 너무한다 싶을 정도로 특정본부 특정사람들 인성이 글러먹엇음
101,건일제약(주),4632,"*인사이동이 빈번하고 비체계적 : 이것이 기업의 성장을 방해한다고 생각함 *인재 부족 : 일부 글에는 젊다고 칭찬일색. 젊을수록 변화와 발전의 기회가 되긴 하나 전문성이 부족하다는 단점이 있음. 젊은 팀장급의 경우 타 회사 기준, 대리 말년차 정도의 업무능력으로 보임. 또한 윗 사람들이 변화를 받아들일 의지 및 마인드 부족 *뒷 말, 남 욕, 남 탓 즐비 : 해당 부서를 거론하고 싶으나, 분명 삭제 당할테니 안하겠음. H로 시작하는 부서. 그래서 더 황당무계"
102,건일제약(주),4632,연봉이 너무 터무니 없이 낮다. 오래 근속한 직원이 많이 받는게 아니라 타 회사에서 이직한 직원이 직전 연봉 기준으로 받기 때문에 오래 다닐수록 손해보는 느낌
103,건일제약(주),4632,고인물이 많은것이 단점이며 예산이 매우 적고 연봉 또한 높지 않습니다.
104,건일제약(주),4632,"몇몇 꼰대 있음, 일이 많음, 주변에 아무것도 없음...."
105,건일제약(주),4632,"얇은 경력층으로 능력있는 사람만 업무가 치중되어있음 급여 인상률이 아무리 열심히해도 많이 안오름 상여금,성과금 없음. 순이익이 올라도 돌아오는건 없고 윗사람이 하라면 해야함. 퇴직자는 많이 빠져나가는데 입사자는 너무 적게 들어옴"
106,건일제약(주),4632,보고체계가 너무 대기업 코스프레 하는거 같음 뭐 일간 주간 월간 분기 독후감 등등 보고를 너무많이함
107,건일제약(주),4632,연봉이 많은편은 아니다. 연봉인상도 잘해주는 편은 아니다. 회사주변이 논밭이다.
108,건일제약(주),4632,복지는 전혀 찾을 수 없다. 경영진의 경영방식을 이해할 수 없다. 인원부족에 항상 시달리지만 더 뽑을 생각도 없다.
109,건일제약(주),4632,성장하지 않는 회사 하던 일 계속 반복적으로만 하면 되는 회사이기 때문에 성장하길 원한다면 아쉬움 복지 혜택 없음
110,건일제약(주),4632,사회성 부족한 2세경영인 잘삐지는 2세경영인 부당해고 하고있으면서 사랑뽑는 이유는 무엇?
111,건일제약(주),4632,영업사원이 해야할일이 너무 많습니다 영업지원팀이 없어요
112,건일제약(주),4632,완제회사치고 연봉이 그다지 높지 않은편. 올려주는 수준도 .. 평가철저히 해서 서로 눈치보기 바쁨
113,건일제약(주),4632,생산량이 늘어 실험도 늘고 당연히 시약 및 소모품 사용량이 늘었지만 예산이 없어 구매가 어렵고 새로 공장도 만들고 코로나 터지고 힘든건 알지만 그 전부터 인센티브 지급이 없었다길래 알아보니 단 한번도 매출 목표금액은 항상 20프로씩 올렸으며 예산은 절감하지만 직원들 월급은 평균 이하로 오른다 말은 미래를 지향하지만 현실은 지금 눈앞에 돈만 쫒는다 경력이 나가면 신입을 뽑는다 선순환이라고 생각할 수 있지만 그건 여유가 있을때 이야기!! 10년차가 나가도 5년차가 나가도 신입만 뽑는다 최소 인원으로 돌아가는데 신입만 뽑는다 너무 욕만 한거 같아 그만 적는다
114,건일제약(주),4632,연차 거의 못 씀. 사람 없어서 자리 못 채움. 눈치 극강 잔업 및 교대 강요
115,건일제약(주),4632,능력있는 사람들이 점점 퇴사하는 분위기임. 열심히 하면 열심히 할수록 몸이 축나고 어려움이 있음. 모두 퇴사 준비하는 분위기임. 대표님이 일개 직원들까지 감시함.
116,건일제약(주),4632,"단순 보고가 많아 업무가 비효율적이고, 업무가 너무 많음"
117,건일제약(주),4632,있는거 부터 잘 해야하는데...있는거 관리도 힘든데 사람은 부족하고...
118,건일제약(주),4632,급여가 평균 또는 이하임 오너의 평이 좋지 않음 그에 따라 이하 관리자도 평이 좋지 않음
119,건일제약(주),4632,승진 대리까지는 어케든 가지만 그 이상은 자기계발 및 업무능력에 차등적 승진기회가 생김
120,건일제약(주),4632,"군대문화가 상당히 많이남아있고, 능력없는 선배들이 자리를 차지하고, 공무원 마인드로인해 발전이없는회사, 상사들은 자리보전에만 집중하고, 팀장들은 하는일없이 월급만 받아가는 경우가많음."
121,건일제약(주),4632,"단순보고를 위한 문서 작업이 많음 투자받을라면 엄청 피곤함 성과금 상여금 일절없음, 연봉 상승률 더 낮아짐, 팀내 업무 전달이 잘 안됨 체계가 잡힌듯 안잡힘"
122,건일제약(주),4632,연봉이 동종업계에 비해 낮음. 연봉 상승률도 낮음. 일정에 항상 쫓김. 예산 삭감.
123,건일제약(주),4632,"일이 바쁘면 연장,특근을 좀 많이 함 나이가 어리면 나이 많은 사람들이 부려먹음"
124,건일제약(주),4632,투자를 하지않고 보수적이며 돈 사용에 관하여 민감한 부분이 많아 작업자로서 힘듬
125,건일제약(주),4632,"오너회사이다 보니 다 본인 마음대로 결정. 직원들에게 비전과 목표, 목적의식에 대한 공유가 전혀없음. 능력에 대해 인정과 보상없음"
126,건일제약(주),4632,"너무 젊은 조직과 잔업을 당현시 하는 마인드, 사람을 소모품을 아는 듯하면 경영진의 생각과 정책이 많음"
127,건일제약(주),4632,"잘못된 인사발령, 팀장을 잘 못 세움, 정말 황당함 팀장 자격이 없는 거 알면서도 그만 둠, 매우 바보 같음"
128,건일제약(주),4632,"좀 작업중에 이것하라 ,저것하라 계획이 바뀌는 경우가 잦음"
129,건일제약(주),4632,대표가 영업을 못 믿음 영업은 힘이 없고 감시나 관리를 해야하는 대상으로 인식 내근직의 갑질이 너무 함 ... 일을 못할 정도로 심함 잡다한 서류 너무 많음 예산 없음
