,company_name,company_id,review_text
0,경북대학교 첨단정보통신융합산업기술원,1347,성과급 지급에 대한 형평성 논란 연봉 협상 및 인사 평가 관련 문제 기관이라고 하지만 체계 하나도 없음 고인물들의 잔치 다녀본 회사들 중 최악에 꼽힘
1,경북대학교 첨단정보통신융합산업기술원,1347,지금은 모르겠지만 주말출근도 있고 대부분 계약직이라 고용의 불안성이 있습니다.
2,경북대학교 첨단정보통신융합산업기술원,1347,상사의 말에 무조건 복종복종복종!! 그게 안되면 눈밖에 벗어나버림 그것은 마치 조직에서 떨어져나간다는 얘기
3,경북대학교 첨단정보통신융합산업기술원,1347,어느조직이나 마찬가지겠지만 부서간의 갈등이 종종 있는 것 처럼 보여짐.
4,경북대학교 첨단정보통신융합산업기술원,1347,일 못해도 오래 앉아있으면 연봉 높여주는곳 인사 평가 시스템이 아주 엉망이란 뜻
5,경북대학교 첨단정보통신융합산업기술원,1347,이직률이 높은데는 이유가 있다. 힘든 일에 비해 그만한 보상이 주어지지 않는다. 아래 직원들이 목적을 위해 갈리는 느낌이다.
6,경북대학교 첨단정보통신융합산업기술원,1347,"부서마다 분위기 차이가 심하고, 초과 수당이 존재하지 않음. 인풋은 적지만 아웃풋이 크기를 바람. 각 부서의 관리자의 성향에 따라 업무 환경의 편차가 큼"
7,경북대학교 첨단정보통신융합산업기술원,1347,1.복지제도 없습니다. 2.월급이 전부 하지만 업계최저 수준입니다. 3.야근 수당 없습니다.
8,경북대학교 첨단정보통신융합산업기술원,1347,"1. 연봉 매우 낮다. 2. 팀/부서장 등 고착화된 사고, 개념, 행동 3. 눈치보고 움직여야 밉보이지 않는다. 4. 엉망진창 성과금 5. 신입들의 릴레이식 퇴사(2주~4개월) 6 체계없는 업무방식 7. 대구시내와 동떨어진 위치 (자차필수) 8. 주말행사 9. 무소불위 운영기획부"
9,경북대학교 첨단정보통신융합산업기술원,1347,장비운영이나 기업지원 연구개발 등이 주요 사업임에도 전혀 상관없는 부서가 가장 영향력을 행사함 개인의 발전은 없고 오로지 과제중심. 급여 연차외엔 아무것도 기대할 수 없으며 특정 라인이 좌지우지함. 과제비로 해외출장을 가는데 업무와 아무상관없는 사람들이 가는경우가 많음
10,경북대학교 첨단정보통신융합산업기술원,1347,특성상 연봉이 살짝 낮을 수 있음 연차 남아도 연차수당이 없음 점심 제공으 없지만.. 자주 사줘서 부담은 안됨
11,경북대학교 첨단정보통신융합산업기술원,1347,1. 공공기관도 회사도 아니고 학교 연구소임 2. 연구소 특성 상 사업 종료 후 협약 전까지 급여 연체 문제 3. 급여 공제 시 비과세 항목 없음 4. 일 하는 사람만 일 함.
12,경북대학교 첨단정보통신융합산업기술원,1347,주변에 대부분 공공기관이라 착각할 수 있는데 별도 공공기관 아님. 그렇다고 학교 소속도 아니라 교직원도 아님. 주변에서 소속을 물으면 정확히 어디라고 설명하기 어려움
13,경북대학교 첨단정보통신융합산업기술원,1347,아무리 날고기어도 눈치오지게 봐야됨 숨도 못쉼 할일이 없어도 하는척해야함 컴퓨터에 한순간도 눈을 못땜 안그럼 연봉 얼마못받음 근무시간에 조금이라도 웃는 모습보이면 무조건 노는걸로 간주 무조건 까라면 까야됨 자기 의사 존중 없음
14,경북대학교 첨단정보통신융합산업기술원,1347,"복지 없음, 연봉 업계최저, 수당없음, 명절 보너스없음 일은 하는사람만 하고 노는 사람은 편안하게 회사다님 일하든 놀든 연봉에 영향이없음 부서에따라 업무량의 차이가많음"
15,경북대학교 첨단정보통신융합산업기술원,1347,전원 계약직이니 불안정한 고용형태. 수직군대문화. 낮은 연봉. 복지 없음. 휴가 없음. 높은 퇴사율로 탈출은 지능순을 보여줌.
16,경북대학교 첨단정보통신융합산업기술원,1347,1. 군대문화 2. 수직문화 3. 업무체계없다 4. 업무 매뉴얼 없다 5. 월급 밀림 6. 개인주의 8. 통보식 부서이동
17,경북대학교 첨단정보통신융합산업기술원,1347,연봉이 낮고 직원 복지는 없습니다. 또한 경북대에 속한 기관으로 분류되어 여러 혜택들을 받기가 힘듭니다. 하계휴가도 없습니다.
18,경북대학교 첨단정보통신융합산업기술원,1347,복지제도가 없다. 명절휴가비 없다. 복지가 많이 아쉽다…
19,경북대학교 첨단정보통신융합산업기술원,1347,사내 식당이 없음 시에서 하는 행사가 많아 준비할게 많을 때가 있음
20,경북대학교 첨단정보통신융합산업기술원,1347,"연봉이 낮음, 수직적인 조직 관계, 상사 눈치를 많이 봐야 함, 구내 식당이 없음 다 사먹어야 함, 꼰대가 많음"
21,경북대학교 첨단정보통신융합산업기술원,1347,열심히 한다고 해서 그만큼 보상해주지 않는다. 체계가 없다. 특정부서에 힘이 크다.
22,경북대학교 첨단정보통신융합산업기술원,1347,"야근 수당 없음, 식대 없음, 업무 배분이 이상함 일 잘하는 사람한테만 일이 몰리고 못하는 사람한테는 일이 없음 그래서 노는 사람들이 많음, 그만큼 혜택도 없음, 고인물들이 많음"
23,경북대학교 첨단정보통신융합산업기술원,1347,연봉이 짜고 계약직인데 기관으로 분류돼서 중소기업 혜택을 못받는다. 장점에 쓴 것들 말고는 복지가 아예 없다.
24,경북대학교 첨단정보통신융합산업기술원,1347,18시에 자 이제 일해 볼까 라고 하며 그 전에는 무엇을 하는지 알 수 없음 사랑방이라고 보면 됨
25,경북대학교 첨단정보통신융합산업기술원,1347,전원이 계약직 신분이어서 아무래도 고용안전성이 좋지 않고 정권의 흐름에 따라 업무가 이리저리 흔들리는 느낌이 강함
26,경북대학교 첨단정보통신융합산업기술원,1347,대학교 내부 기술원 특성상 급여가 적었습니다. 계약직형태의 근로 조건이 불안했습니다.
27,경북대학교 첨단정보통신융합산업기술원,1347,규모 대비 체계가 별로에요 사업비가늦게 지급되면 월급도 늦어져요 고인물이 문제에요 자기개발에 뚜렷한 장점이없어요
28,경북대학교 첨단정보통신융합산업기술원,1347,"과제수행을 잘 하는 지 의문임. 과제가 끝나가는 부서가 많고, 다시 새로운 과제를 따야 운영이 가능하다."
29,경북대학교 첨단정보통신융합산업기술원,1347,"월급 밀림. 부서에 따라 연차 사용 눈치 줌. 전날 통보식 인사이동. 근데 웃긴건 부장들은 계속 그 자리에 있고, 부서원들만 인사이동 함. 고로 부서원들은 다양한 업무를 접하고 할 수 있지만. 부장은 자기 업무 외는 모름."
30,경북대학교 첨단정보통신융합산업기술원,1347,주먹구구식 운영. 제대로된 인수인계를 못받음. 사내 따돌림이 은연중에 만연. 군대문화. 월급이 밀림. 여직원 남직원 할거없이 뒷담화를 많이함. 사내정치가 심함. 같은팀원들끼리 서로 뒷담화함. 텃세심함. 업무분담이 제대로 이뤄지지않아 니일내일 따지면서 싸움의발단이됨. 연차도 눈치보면서 써야함.
31,경북대학교 첨단정보통신융합산업기술원,1347,"단순 업무만 맡을 가능성이 높음, 단순 보고를 위한 문서 작업이 많으며 까다로움, 복지가 없음, 추가수당, 시간외근무수당, 주말수당, 연차수당 없음 직급별 인원은 역피라미드 구조 생산, 현장, 제조 직군 대우가 낮음"
32,경북대학교 첨단정보통신융합산업기술원,1347,급여가 상당히 짜고 복지와 관련된 것은 거의 제로에 가까움. 부서가 갑자기 사라질 경우가 있음.
33,경북대학교 첨단정보통신융합산업기술원,1347,복지도 없는데 연봉도 낮으며 정말 사회주의 체제와 다름이 없음
34,경북대학교 첨단정보통신융합산업기술원,1347,"1. 동원되는 행사, 보여주기식, 외부 이미지만 좋다 2. 퇴사인원이 많다. 특히 연봉협상 시기 이후 3. 내부 경영진쪽 갑갑하다 4. 늘 가는 사람이 해외출장가는?(과제비로 가지만 관련없는 사람이 간다) 5. 연봉낮다."
35,경북대학교 첨단정보통신융합산업기술원,1347,월급이 조금 낮은 경향이 있음 조금 보수적인 느낌도 있음
36,경북대학교 첨단정보통신융합산업기술원,1347,행사에 동원됨. 보여주기식 업무 많음. 업무 체계는 없음.
37,경북대학교 첨단정보통신융합산업기술원,1347,"단순 보고를 위한 문서 작업이 많아 비효율적, 복지 제도가 없음. 연봉이....한숨임 등등"
38,경북대학교 첨단정보통신융합산업기술원,1347,"1. 성과급제가 적용되지만, 과연 공평하고 정당하게 평가되고 있는 지 의문 원장과 특정계층 라인에만 잘 보이면 월급이 잘 오르고, 실제로 수행한 성과로 평가해준 다는 느낌이 매년 없음 이럴 거면 성과급제가 아니라 차라리 호봉제가 나을지도? 2. 해외출장도 과제와 관련없더라도 라인만 잘 타면 갈 수 있음 3. 원장과 특정계층 라인의 내로남불식 업무 처리에, 어느 장단에 맞춰야 할 지 모르겠음 4. 다른 평들처럼 직원은 보여주기식 행사에 동원되는 존재"
39,경북대학교 첨단정보통신융합산업기술원,1347,"야근수당없고, 창립기념일 휴무도없고, 여름휴가도 따로 없음.. 물론 명정선물비 등 없음"
40,경북대학교 첨단정보통신융합산업기술원,1347,"낮은 연봉, 수당없음, 승진 기회적음, 대구시내와 거리가 멈, 기숙사없음, 복지없음, 낮은 연봉 인상률, 공기관의 탈을 쓴 중소기업"
41,경북대학교 첨단정보통신융합산업기술원,1347,주먹구구식으로 일을 배워 해내야 한다. 복지가 거의 없다. 연봉이 짜다. 야근을 자주하는 분위기이다.
42,경북대학교 첨단정보통신융합산업기술원,1347,퇴근 시간이 잘 지켜지지 않았습니다. 야근하는 경우가 정말 많았습니다.
43,경북대학교 첨단정보통신융합산업기술원,1347,원리 원칙도 없고 원장 및 운영팀이 모든 걸 결정하는 곳임
44,경북대학교 첨단정보통신융합산업기술원,1347,식대비가 없고 회사 식당이 없고 야근비 없음 하계휴가 연차로 사용
45,경북대학교 첨단정보통신융합산업기술원,1347,"계약직, 발전이 없는 상사, 동료의 잦은 퇴직, 업무 불균형"
46,경북대학교 첨단정보통신융합산업기술원,1347,조직의 깊이가 부족합니다. 대표와 사원과의 연결고리 역할을 부장/팀장들이 수행할 수 있는 능력이 부족합니다.
47,경북대학교 첨단정보통신융합산업기술원,1347,"경영/운영, 조직개편이 반드시 필요합니다. 급여가 굉장히 낮으며, 인상폭도 아주 낮습니다. 소득세와 건보료 상승으로 인해 실수령 급여 인상이 몇 만원 밖에 안되는 진귀한 경험을 가질 수 있습니다. 나이가 적거나 경력이 낮은 분들에게는 낮은 급여로 인해 추천해드리고 싶지 않습니다. 직원 복지가 없습니다."
48,경북대학교 첨단정보통신융합산업기술원,1347,"새로운 것을 찾지만 노력에 비해 얻는게 많이 없음. 규정이 경영진 생각의 변화에 따라 변화 할 수 있음. 소수에 의한 꼰대 문화가 있을 수 있음.(직급, 나이 등)"
49,경북대학교 첨단정보통신융합산업기술원,1347,사업이 너무 많아 해야할일이 많음 업무에 대한 체계가 없음
50,경북대학교 첨단정보통신융합산업기술원,1347,"직원 모두가 계약직 고용의 안정성이 불확실, 젊은직원들이 많다는것이 장점이자 단점"
51,경북대학교 첨단정보통신융합산업기술원,1347,국가 사업 바탕이기 때문에 사업이 없으면 힘들어질 수 있음
52,경북대학교 첨단정보통신융합산업기술원,1347,아무래도 공공기관이다보니 성과에 비중을 둘 수 밖에 없는 구조입니다. 하지만 열심히하면 모든 부분에서 만족하실겁니다.
53,경북대학교 첨단정보통신융합산업기술원,1347,"국가에서 요구하는 지침이 변경되면 그에 맞게 준비하고 수정해야 하는 부분이 있음, 계약직"
54,경북대학교 첨단정보통신융합산업기술원,1347,전박적으로 직원들의 전문성이 결여. 비전문가들이 전문가 행세?
