,company_name,company_id,review_text
0,나눔커뮤니케이션,12446,대표마음대로 움직이는 전형적인 중소 연봉 사회초년생 데려다가 갈아쓰기
1,나눔커뮤니케이션,12446,"단순 반복적인 작업으로 하다보면 지루함을 느낄수도 있음 기획, 성과의 몫도 본인임"
2,나눔커뮤니케이션,12446,"자체적으로 생산하는 컨텐츠가 없음,사업만 벌여놓고 수습을 안함.경력직보다 초년생만 원함"
3,나눔커뮤니케이션,12446,칼퇴는 하지만 퇴근해도 퇴근이 아님. 다음날 작업할 자료 안찾아가면 일할 수가 없음.
4,나눔커뮤니케이션,12446,능력을향상시키기에 부족한 업무. 약간의 꼰대문화 칼퇴못함
5,나눔커뮤니케이션,12446,커뮤니케이션하는데 문제가 있다 속도가 느려서 답답할 때가 있다. 팀장급들은 워낙 바빠서 금방 처리될 일을 기다려야할 때가 있다.  그리고 일이 많다... 마감 직전엔 죽음이다.
6,나눔커뮤니케이션,12446,위 장점을 제외한 많은 부분. 여러가지로 운영이나 의사결정에 있어 황당한 경우가 많이 발생.
7,나눔커뮤니케이션,12446,"1년중 6개월정도 토요일 출근, 토요일 근무시 퇴근이 일요일 새벽에 끝나는 경우가 많았음 건의를 많이 하라고는 하나 직원들의 복지나 야근에 대한 건의보다 클라이언트를 위해서 어떻게 더 잘해야될까하는 그런 건의를 좋아하고 수용했던 기억, 야근금지라고는 하나 일이 많아서 하지 않을 수가 없었음"
8,나눔커뮤니케이션,12446,마케팅의 부족함과 비슷한 커뮤니티 사이트의 난립으로 정체성과 규모를 잃어가고 있음.
