,company_name,company_id,review_text
0,뉴이십일커뮤니티,5704,연봉 인상률 거의 제로 사업이 산으로 가는 느낌 고용 안전의 불안감
1,뉴이십일커뮤니티,5704,"신입은 월차 없으면 휴가는 무급으로, 공휴일은 출근하거나 무급. (휴가를 무급으로 가라는건 충격이었음) 월급 자주 밀림. 월급 밀리는거 초반에는 좀 미안해하면서 직접 말하더니 좀 지나면 아래 직원한테 통보, 심지어 주기로 한날 못준적도 있음. 월급도 밀리는데 업체 대금이 밀리는건 당연....점점 산처럼 불어나서 결국 감당 불가 업체 물품 팔아서 돈이 들어오면 나중에 어떻게 줄지 걱정부터 든다."
2,뉴이십일커뮤니티,5704,"사업계획 방향, 재무관리 및 분야는 글쎄.... 업무 분담이 제대로 되어있지 않음. 점심 식사는 도청 구내식당, 도시락배달."
3,뉴이십일커뮤니티,5704,의미없는 사업으로 직원들만 불려놓고 30명 가까이 되는 직원들 중 자기의 맡은 업무를 정확히 알고 일하는 사람은 없다. 모두 단기계약직이라 6개월도 못채우고 나가는 경우가 대부분이라 그냥 다 알바처럼 일하는 듯. 월급이 제 날짜에 나온적이 단 한번도 없다. 기약이 없다.
4,뉴이십일커뮤니티,5704,회의 중에 대표가 자꾸 이상한 말해서 회의 시간 기본 한시간 이상 사무실 문열림 보고 등 쓸모없는 보고를 시킴( 퇴근 눈치게임도 함) 직원들을 절대로 믿지 않음. 직원들 월급을 제대로 준적이 없음. 정말 주먹구구식 일처리 그 상황만 모면하면 끝남(대표성격) 직원들을 욕받이로 만듦 회사 재무구조가 불투명함 인터넷 회선 조차 늘려주지 않음 직원들 연봉 다 구라임 내로남불의 정석(대표)
5,뉴이십일커뮤니티,5704,눈치 안보고 쉴수 있다. 물론 무급으로. 끝나지않는 무의미한 회의 매번 월급밀리는데 당당함
6,뉴이십일커뮤니티,5704,마케팅에 모든 직원이 투입됨. 자신의 파트는 상관없음. 의미없고 긴 회의
7,뉴이십일커뮤니티,5704,쓸데없는 회으를 많이 해서 업무 시간을 많이 빼았겨서 야근을 할 수 밖에 없는 경우가ㅜ생기고 칼퇴가 눈치보이는 회사
