,company_name,company_id,review_text
0,뉴젠씨앤아이,7294,소통이 잘 안됨. 그래서 일 처리가 비효율적임. 빨리 이직 ㄱ
1,뉴젠씨앤아이,7294,"급여가 불안정함, 비전만 제시하지 실질적으로 진행 되는 것이 없음"
2,뉴젠씨앤아이,7294,"1. 임금체불. (3~4개월씩 지급되지않는 경우가 비일비재) 2. 사장은 직원들 관리에 소홀하여 직원들이 퇴사하던 말던 관심이 없음, 프로젝트매니져는 정치질에만 관심이 있고 실무는 하나도 모름, 개발직원은 스킬이 부족하여 제품마다 버그를 안고있음."
3,뉴젠씨앤아이,7294,"임금체불 비일비재, 개발스킬이 미흡한 개발인력, 영업력 부족, 가족경영, 복지 전무, 가지고있던 솔루션도 팔아버리는 성장가능성이 없는 회사. 입사후 대출받기 싫다면 타회사를 추천."
4,뉴젠씨앤아이,7294,월급이 밀린다. 퇴직해도 퇴직금 안준다. 퇴직금 관련 소송하면 동종업계 이직 관련으로 맞고소 한다. 그 어떤 복지도 없다.
5,뉴젠씨앤아이,7294,회의 때 한번의 실수는 용서하지만 두번이상 실수하면 좀 혼남 그래도 그정도는 당연한것같음
6,뉴젠씨앤아이,7294,월급을 안준다. 복지라는 것은 전혀 없다. 업무 평가조차 하지 않는다.
7,뉴젠씨앤아이,7294,"일의 강도가 높음, 급여가 밀림, 연봉현상이 정상적으로 진행되지않음, 각종 야근 주맣 출근도 종종 있음, 제품을 판매하는 회사지만 매번 타사 프로그램과 연동작업이 있기때문에 si성 작업이 많다. 개발자가 개발 , 구축 ,유지보수를 전부 다한다."
