,company_name,company_id,review_text
0,더핑크퐁컴퍼니㈜,8544,1시간~2시간이고 답장이 없어 늦어지는 일처리. 내가 일 안해도 모르지만 상대가 일 안해도 모름. 헤드들이 전문성이 부족하여 부하직원들의 능력평가가 거의 불가능할정도임. 신입 때는 이력서 한줄 쓰기 좋으나 연차가 쌓일 수록 전문성 없고 고여버린 회사에서 얻는 시너지는 없다. 작업자들을 존중하지 않고 아이디어를 구체화하는 하청 수준으로 생각함. 속이 시꺼멈.
1,더핑크퐁컴퍼니㈜,8544,"부바부 팀바팀, 능력없이 정치질로 꿰찬 리더 포지션,"
2,더핑크퐁컴퍼니㈜,8544,인턴을 자주 뽑아서 사람 로테이션이 많은 편이었음. 키즈 컨텐츠라고 쉽게 생각하면 안될듯
3,더핑크퐁컴퍼니㈜,8544,특정 팀에 인원이 많은 경우가 있음. 이해가 어려운 상황들이 자주 생김.
4,더핑크퐁컴퍼니㈜,8544,업무롤이 정확하지 않고 허리급 인력이 없어서 레거시라는게 없다... 그냥 어떻게든 알아서 일해야됨
5,더핑크퐁컴퍼니㈜,8544,돈 쓰는게 짜다 회사에 돈이 없는건 아닌 거 같은데 너무 아낀다 그렇다할 복지가 없음 챙겨줄때 된 거 같은데 안챙겨줌
6,더핑크퐁컴퍼니㈜,8544,현재 생각나는 단점은 없음. 프로젝트의 짧은 마감이 창의성에 제한을 두고 있다고는 생각함.
7,더핑크퐁컴퍼니㈜,8544,회사 성장세에 비해 연봉이 너무 적고 상상이상으로 인상률이 낮음
8,더핑크퐁컴퍼니㈜,8544,바쁠 땐 오지게 바쁘고 안 바쁠 땐 오지게 논다. 일을 찾아서 억지로 만들어 RnD하며 성과를 찾아야 하는 상황이 자주 발생함.  어떤 프로젝트를 할 때 컨펌인이 너무 많아서 배가 사공으로 간다. 안목이 좀 올드함. 젊음을 추구하면서 막상 하는 건 젊어보이고 싶은 사람들의 발악 같을 때가 있음.  회사에 쓸데없는 이벤트가 너무 많음. 다들 MBTI 검사하면 EEEE 나오나? 자꾸 뭘 자기를 소개하라그러고 자기 어필할 수 있는 피피티나 영상 찍어오라고 해서 좀 고역.
9,더핑크퐁컴퍼니㈜,8544,"- 1,2호점 나뉘어있음 - 팀바이팀이 심함 (재택, 유연근무제) - 여초 분위기"
10,더핑크퐁컴퍼니㈜,8544,겉으로만 수평적 체계인척 여초회사 포괄임금제 부바부지만 일많음
11,더핑크퐁컴퍼니㈜,8544,"직원들 연령대는 젊은데 꼰대가 너무 많고, 정치질이 아주 난무함. 리더라고 있는 사람들이 과연 능력이 있어서 올라갔을지 의문임.업무적으로 윗사람에게 배울 점이 전혀 없고, 그 모습이 내 미래라 생각하면 암담함.. 물경력 싫으면 도망치길.. 현금성 복지 전혀 없고, 연봉협상은 뭐 할많하않"
12,더핑크퐁컴퍼니㈜,8544,다른 부서와의 원활한 교류나 공유가 된다면 더 나은 의사결정을 위해 좋을 것
13,더핑크퐁컴퍼니㈜,8544,명확하지 않은 방향성 (프로젝트와 회사 운영방침 등등에서의) 주먹구구식 일처리 전문분야가 아닌 다양한 일을 맡김(좋은 사람은 좋을 수도)
14,더핑크퐁컴퍼니㈜,8544,"비전 및 방향성이 없어서 스스로 만들어야 합니다. 재택, 사내 카페(유료) 빼고 복지는 많지 않습니다. 부바부지만 바쁜 부서는 늘 바쁨니다."
15,더핑크퐁컴퍼니㈜,8544,성장을 할 수 있으나 알아서 찾아나서야 되는 단점은 있습니다.
16,더핑크퐁컴퍼니㈜,8544,생각보다 많은 젊은 꼰대 비밀이 많은 회사 끝없는 야근
17,더핑크퐁컴퍼니㈜,8544,"리더들 연령대가 낮아서 보고 배울 수 있는 사람들도 많지만, 체계가 없거나 동아리같은 분위기도 많음. 성과 위주라고 하는데 결국 그 성과를 얻을 수 있는 업무/프로젝트 분배도 형평성에 맞지 않는 느낌. 성과가 많아도 결국 자기 리더나 더 윗사람에게 자기어필 잘하는 사람들만 살아남음. 여기서 노력이나 성실은 말로만 잘한다 칭찬듣지, 그냥 바보되는 기분. 역시 회사는 좀 이기적이고 여우처럼 일해야 됨. 사람바이사람인데 어떤 팀은 업무량 과다. 자정까지 함."
18,더핑크퐁컴퍼니㈜,8544,체계와 기준 없는 시스템과 아무도 부서간의 인사이트 공유가 없음
19,더핑크퐁컴퍼니㈜,8544,말많는 여초문화. 들락날락하는 인재풀. 정체된 성장. 특정잉들만 누리는 재택근무 휴가
20,더핑크퐁컴퍼니㈜,8544,장점이 주로 정규직한테만 적용되는 점. 야근이 대체로 많다.
21,더핑크퐁컴퍼니㈜,8544,명확한 비전이 없어서 작업에 혼란이 있고 결정이 많이 바뀐다.
22,더핑크퐁컴퍼니㈜,8544,체계 아직은 덜 잡힌 느낌 일을 위한 일이 많음 - 결국 회의를 통해 결정된 바를 실천할 시간이 부족함
23,더핑크퐁컴퍼니㈜,8544,"회사 정책은 제한 없는 연차 사용, 재택 권장 회사이나 팀바이팀이라 팀 분위기에 따라 눈치봐야하는 것이 이상함. 그룹장들의 나이가 어려서 어떻게 팀, 그룹을 이끌어가야할지 잘 몰라 납득이 안가는 의사결정이 많음. 복지 없음."
24,더핑크퐁컴퍼니㈜,8544,기획자 뽑을때 신중해야 할듯 입사후 자기소개 전사발표 보는데 거짓말 대회인줄 알았음 옆에서 겪어보니 겉핥기식 문외한인데 다 자기가 했다는 식으로 어필함 경력자일수록 틀에 박힌 사고를 가진자들이 많음 그래서 인턴을 많이 뽑아 굴리는거 같은데 진짜 퍼포먼스를 가진 경력자를 뽑는게 인사팀의 능력이 아닐지
25,더핑크퐁컴퍼니㈜,8544,"자유로운 만큼 일 안하려고 작정한 인간들이 있고, 그걸 보고도 모르는 건지 볼 줄 모르는 건지 지도 노느라 바쁜 건지 무능력한 상사들은 관리자의 능력을 상실함, 새로 들어오는 인재들은 열정이 넘치고 능력이 있는 사람이 많은 반면 헤더들은 고리타분하고 체계가 없어서 환멸감을 많이 느끼게 됨."
26,더핑크퐁컴퍼니㈜,8544,"그때그때 인기있는 콘텐츠만 쫓기바빠 잦은 조직개편, 프로젝트 엎어지는 일이 부지기수 그렇다보니 업무 의욕 사라짐. 중요한 일도 항상 갑자기 통보하는 식의 소통."
27,더핑크퐁컴퍼니㈜,8544,딱히 나를 가르쳐줄 선배 사수가 많이 않다는 점. 한마디로 체계가 부족할수도 있고 프로세스를 직접 만들어 나가야하기 때문에 맞지 않는 사람들은 금방 퇴사하는듯
28,더핑크퐁컴퍼니㈜,8544,회의가 진짜 많고 미팅 때문에 제 시간에 일을 못할 수도 있음
29,더핑크퐁컴퍼니㈜,8544,기획경력 부풀리기를 걸러내는 능력은 없어보인다. 모르는데아는척 하고 기싸움하는 유형들 꽤있음 특히 교육출판쪽 출신들은 풀이 좁아서 생각도 막혀있는데 정치질을 오지게도 한다
30,더핑크퐁컴퍼니㈜,8544,많은 스타트업들이 그러하지만 업무 비효율 심함. 무질서. 과도한 능력주의.
31,더핑크퐁컴퍼니㈜,8544,"- 성과에 맞는 성과금이 안 나옴. - 팀바팀으로 겁나 부려먹는 팀들이 더러 있는데, 야근 겁나 하는 팀 야근수당 물론 없음(자율출퇴근제때문이라는 얘기가 있긴 함) - 연협도 엄청 짜다 못해 거의 없음.(윗사람들끼리 다 해먹나봄!) - 복지가 점점 줄어서 보이지 않음."
32,더핑크퐁컴퍼니㈜,8544,비교적 자유로운 기업이나 그 룰을 싫어하는 딱딱한 리더 만나면 회사의 룰 그 위에 리더의 룰이 존재하는 구조임. 극악 워라벨. 언제 어디서나 일이 가능한 회사라 주말이고 휴일이고 소환당할 수 있음. 야근수당 없음. 보수적인 기업에서 넘어와서 없는 룰을 만들며 일 잘한다고 착각하는 젊은 꼰대와 아무것도 모르는데 아는척은 하고 싶은 애매한 경력의 늙은주니어들. 그 사이에 껴서 갈려나가는 진짜 주니어들. 도전적이고 크리에이티브한 기획이 나오는 시기는 이제 지난거 같다.
33,더핑크퐁컴퍼니㈜,8544,"팀바팀 사바사가 있고, 뭐가 자주 바뀜 간혹 엄청 활발한 팀들이 있어서 여기는 회사가 아닌가 싶은 생각도 들음"
34,더핑크퐁컴퍼니㈜,8544,연봉이 많은 것 같진 않다. 내가 스스로 성장해야만 하고 시키는 일만 하면 성장하는 것 같지 않다.
35,더핑크퐁컴퍼니㈜,8544,"창립 초기부터 있던 사람들끼리 뭉쳐다니는 모습 굉장히 심했음. 특히 리더(파트장, 팀장 등등등)들이 자기 팀 챙겨서 사기 올려줄 생각 안하고 지들끼리 뭉쳐다니면서 정치질하기 바쁘고 점약잡기 바쁨. 이러니 공채가 아닌 중간에 애매한 시기에 들어온 경력직이나 주니어들은 하다못해 같이 밥먹을 사람 찾기도 어려워짐. 일에 있어서 딱히 프로페셔널한 느낌 받지 못함. 유튜브로 뜬 회사라서 대부분의 일들이 유튜브 & 그 채널들을 운영하는 팀 위주로 돌아가는데 문제는 이 운영팀들도 유튜브의 알고리즘을 명확히 아는게 아니어서 기획단에서 자주 제작/기획팀과 충돌함. 여초 특유의 무리짓는 문화, 끼리끼리 뒷담 문화 심함."
36,더핑크퐁컴퍼니㈜,8544,상사가 너무 무능력해서 이 정글에서 혼자 살아남아야함 일 잘하는 사람한테 업무가 과중됨
37,더핑크퐁컴퍼니㈜,8544,체계적인 업무 시스템을 아직 갖추지 못하였습니다. 너무 자유로운 분위기이 때문에 그것도 문제가 되는것 같습니다. 역에서 가깝지가 않아 마을버스 타야됩니다. 큰 단점은 임원직들이 모두 설립 초반때부터 있던 사람들인거 그 분들 위주로 돌아가는데 그게 맞는지는 모르겠습니다..
38,더핑크퐁컴퍼니㈜,8544,인턴 갈아서 굴림 인턴 전환 안되면 수습 연장함 경력직도 계약직으로 뽑음 이상
39,더핑크퐁컴퍼니㈜,8544,야근을 당연히 생각하고 사람이 늘어나면 일이 배로 늘어서 근무 환경이 나아지기는커녕 더 힘들어짐. 조직개편과 팀 이동이 너무 자주 일어나 혼란스러움. 취업사기 수준으로 본 직무와 상관없는 직무로 배치가 됨.
40,더핑크퐁컴퍼니㈜,8544,"포괄임금제, 팀바팀이 꽤 많음, 업무장비 지원이 좀 더 잘 됐으면 좋겠음. 자유로운 분위기를 원한다면, 좋지만, 체계가 확실하게 잡혀 있는 느낌은 아님"
41,더핑크퐁컴퍼니㈜,8544,아직까지도 잡히지 않은 업무 체계. 갓 만들어진 회사도 아닌 곳이 아직도 업무 체계가 잡히지 않아 이랬다 저랬다. 가장 큰 단점은 젊은 꼰대 때문에 몇 명이 피곤해 지는건지.
42,더핑크퐁컴퍼니㈜,8544,방법을 아는 사람이 없으니 대학 팀플 회의처럼 진행 그리고 젊은 꼰대 진짜 심각..
43,더핑크퐁컴퍼니㈜,8544,"우연으로 히트를 쳤기 때문에 매번 그렇게 얻어걸리는 히트를 원함. (적은 돈으로 대박을 만들어주길 바라고 있음) 상시 회사의 비전이 바뀜, 사람을 아끼지 않음 - 언제나 더 좋은 사람이 들어올 것이라는 확신 가득한 마인드"
44,더핑크퐁컴퍼니㈜,8544,무제한 휴가가 거의 유일한 복지인데 업무가 많아 사용하기 힘듬. 팀장급들의 전문성이 떨어져서 배울점이 많지 않음.
45,더핑크퐁컴퍼니㈜,8544,"문서 작업 많은 편, 신입 교육에 대해 체계적이지 않은 편 그냥 던져주고 해보라는 식. 하지만 그만큼 신입에게도 기회가 많기도 함. 잘 이겨낸다면 엄청 성장할듯"
46,더핑크퐁컴퍼니㈜,8544,위에 쓴 것처럼 성과 압박이 좀 있음 상반기 하반기 평가 진행되고 하반기 1년 평가 기준으로 인센과 연봉 상승률이 결정되는데 문제는 명확한 평가 기준을 모르겠음
47,더핑크퐁컴퍼니㈜,8544,성과주의. 신입이라도 알아서 척척. 잘 해내야함. 스트레스 받기 쉬움
48,더핑크퐁컴퍼니㈜,8544,"신입이 많고, 능동적으로 업무를 해야해서 그렇지 못한 사람들 때문에 피해를 입음. 신입이 대다수인 기업"
49,더핑크퐁컴퍼니㈜,8544,영업이익 대비 복지 부족. 알 수 없는 인사팀의 갑질..?
50,더핑크퐁컴퍼니㈜,8544,야근 많음 부서마다 다르겠지만 어린 꼰대 많음 정규직 전환 잘 안 시켜줌 인턴들 많이 오고 간다 인턴한테 정규직 만큼 바라는 회사다 인턴 급여 짜다
51,더핑크퐁컴퍼니㈜,8544,체계가 없고 어수선함 디렉터급 등이 업무를 회피한다는 인상을 매우 강하게 받았으며 위에 쓴대로 학교 동아리같고 어수선한 느낌이 강합니다
52,더핑크퐁컴퍼니㈜,8544,시스템은 아직 만들어가는 중. 그래도 자리잡힘. 수직적인 구조는 있으나 업무 배분이나 진행은 수평적이어서 일이 진행이 잘 안될때도 있음.
53,더핑크퐁컴퍼니㈜,8544,아이들을 위한 콘텐츠 제작이 주 업무이기 때문에. 그런 스타일에 맞춰 획일적인 디자인 작업을 할 수 밖에 없다. 계속 사용하는 ip를 벗어나기 어려운 느낌.
54,더핑크퐁컴퍼니㈜,8544,보고를 위한 보고가 많음 복지가 없음 복지라고 써둔거보면 쥐어짜내는 느낌이라 눈물이 앞을가림 팀바팀이 굉장히 강함 윗선이 무능력한 부서가 많음
55,더핑크퐁컴퍼니㈜,8544,주변에 식당이 없음 재택이 부바부임 복지라고는 없음 재택이지만 워라밸은....
56,더핑크퐁컴퍼니㈜,8544,고인 리더들 무능함에 깜짝깜짝 놀라지만 결국엔 고인물들 의견대로 흘러감 신입들은 현타 굉장히 많이 느낄 수 있을듯 중간급이 없어서 체계랄게 없음 복지 없다고 생각하면 됨
57,더핑크퐁컴퍼니㈜,8544,"업무 역량이 어느정도 쌓이고 난 후 이직하는 사람이 많아 남아 있는 사람들에게 업무가 편중되고, 사원들의 이직을 막을만한 메리트가 약한 편.부서에 따라 야근도 잦고, 단발성 협업이 잦아 정신이 없는 편"
58,더핑크퐁컴퍼니㈜,8544,급성장한 회사라서 그런지 운좋게 입사한 3040세대들 중 실력없는 인간들이 나가 떨어지지 않으려고 정치질 엄청나게 함. 그나이에 열정은 떨어지고 배운건 정치질이니… 네임벨류에 비해 복지가 없음 제로에 가까움. 야근수당 주말수당없음. 명절떡값 없음. 사내카페 안저렴함. 카페로 돈 많이 벌듯
59,더핑크퐁컴퍼니㈜,8544,"팀바팀이지만, 회의를 위한 회의가 너무 많아서 업무 효율 떨어짐. (팀장이 그걸 통제를 하거나, 효율을 늘리려는 생각을 해야하는데, 그냥 냅다 다 회의를 잡아버림. 진짜 일은 야근하면서 해야하는 수준) 주말에도 근무하는 경우가 있음. 이제 야근 수당이 없는게 당연하게 생각됨. 열정페이라는걸 강요하고 그걸 세뇌하는 회사. 퇴근한다고 해도 다 문서키고 일하는 회사."
60,더핑크퐁컴퍼니㈜,8544,"복지가 너무 없어요ㅠㅠ 중간급이 없어서, 업무를 체계적으로 배우지 못합니다. 업무 강도가 높아서 워라벨이 좋지 않았습니다."
61,더핑크퐁컴퍼니㈜,8544,"업무량 팀 바이 팀으로 많음, 야근 수당 없음, 식대지원없음 이러한 복지가 전무한 상태"
62,더핑크퐁컴퍼니㈜,8544,신입교육에 대한 내용이 부족하고 본인이 다 알아서 스스로 해야함 기본적으로 이정도 정보제공을 하고 업무에 투입하는게 좋을 것 같은데 그런 부분이 부족함  매달 입퇴사자가 많아서 히스토리 파악이 어렵고 인수인계가 잘 안되는 듯함
63,더핑크퐁컴퍼니㈜,8544,수평적인만큼 인턴으로서 대우 받기 보다 정규직의 업무강도와 업무처리 수준을 기대함
64,더핑크퐁컴퍼니㈜,8544,워라밸 붕괴 수준으로 엄청난 업무량. 야근은 밥먹듯 하고 주말에도 일하는 사람들이 대다수인데 이게 이상한걸 회사만 모름. 사람 갈아넣고 만드는 수준. 이 와중에도 다른 사람들 대비해서 편하게 일하는 사람들이 있는걸 보면 업무량 불합리 결정권한이 있는 윗분들의 '픽' 을 받는 사람들만 승승장구. 성과위주라고 하면서 다른 사람들보다 성과 적어도 윗분들 눈에 띄고 사회생활 잘하면 연봉도 오르고 승진도 함. 결국 일개미같이 갈린 사람들은 그냥 현타만 옴.  시니어 부족.. 인력 부족..
65,더핑크퐁컴퍼니㈜,8544,"1) 어린 여성 꼰대들의 집합소, 동아리하는 느낌 2) 정치질이 심함, 높으신 분들께 잘 보이기 위해 회의에서는 수긍만 있을뿐 반대나 논쟁, 토론은 존재하지 않음 3) 탑다운 평가만 존재 , 평가 기준 모름 4) 애사심을 가진 동료를 찾아볼 수 없는 회사 5) 다들 잠깐 머무는 발판 삼아서 이직 기회 보다가 조용히 이직한다 6) 그래서 히스토리가 끊기고 새 인력 비용이 크게 소모됨 7) 프로젝트들이 갑작스럽고 산발적이라 정신 없고 워라밸 없음 8) 젊은 꼰대 고인물들만 천국으로 다니고 다른 팀원들만 고생하는 구조 9) 타 ip를 레퍼런스 이상으로 삼음 ㅎ..   10) 복지가 전무후무하다.. 기본적인 식대라던가 현금성 복지, 야근 보상 등 전혀 아예 찾아볼 수가 없다.. 팀원들끼리도 “그나마 있는 복지” 라는 워딩으로 포장하며 이야기함. 소속원을 생각하는 복지만 더 있었어도 더 버텼을듯…"
66,더핑크퐁컴퍼니㈜,8544,복지가 부족함. 팀바이팀이라 팀 마다 분위가 많이 다름. 정치가 있는편임. 경력있는 시니어가 없음. 거의다 주니어… 그래서 주니어들끼리 지지고 볶고 함
67,더핑크퐁컴퍼니㈜,8544,"회사의 전체적인 방향성이나 목표가 없음, ip 개발은 하지만 어떻게 발전 시킬지 계획은 없음"
68,더핑크퐁컴퍼니㈜,8544,"잦은 조직개편과 그로인한 업무 변화, 체계가 잘 안잡힘. 업무가 바뀌다보니 경력에 대한 고민이 생기는 회사."
69,더핑크퐁컴퍼니㈜,8544,리더급들 매우 무능력함. 버는 거에 비해 복지가 안 좋은 편. 너무 자유로워서 알아서 다 해야 함.
70,더핑크퐁컴퍼니㈜,8544,"창립 초기부터 있던 사람들간의 친목질, 정치질이 심했음. 직원들 대부분이 첫 회사로 이 회사에 입사해 쭉 다니고 있는 경우가 많아서 기본적인 사회생활 매너나 프로세스등을 이해하지 못했음(나쁘게 말하자면 어디 동아리 활동같다고 해야하나)"
71,더핑크퐁컴퍼니㈜,8544,사내 식당은 있지만 식대지원이 안되었음 어떤 팀은 여초 느낌이 있었음
72,더핑크퐁컴퍼니㈜,8544,"시니어의 부재, 체계가 잡히지 않은 점, 보고가 많다, 여초, 수평구조=책임은 서로 미룸"
73,더핑크퐁컴퍼니㈜,8544,하나의 IP에 너무 심하게 의존함 구성원들을 쉽게 교체 가능한 부품으로 여기는 점이 큰 단점
74,더핑크퐁컴퍼니㈜,8544,기업이 성장이 꺾이는 과정에 있어서 새로운 동력이 필요하다. 하지만 그것을 해낼 수 있는 리더가 있을지는 모르겠다.
75,더핑크퐁컴퍼니㈜,8544,"저연차들에겐 보고 배울 선배가 없어서 힘들고, 적어도 3년차 정도는 하고 와야 이 회사가 좋은 회사인지 알것 같음"
76,더핑크퐁컴퍼니㈜,8544,끼리끼리 & 정치적. 라인을 타지 못한 실력있는 경력직들은 도망간다. 경력직이 필요한 자리에 인턴을 뽑아두면 인턴 케어와 현업까지 기존 직원들이 갈려나가는 구조. 다들 지쳐서 각자 도생의 길을 선택함. 팀이 자주 없어지고 생기고 적이 바뀐다.
77,더핑크퐁컴퍼니㈜,8544,"팀장의 역량에 따라 팀 분위기가 매우 달라서 부바부가 심하다. 자기 PR하기 바쁘고, 부서 잘못 만나면 워라벨 없음."
78,더핑크퐁컴퍼니㈜,8544,리더가 곧 사장이라서 리더 잘못 만나면 헬임. 직원들이 뒤로 속닥거리는 대외비가 매우 난무함. 정치질이 일반적 기준보다 훨씬 심함. 체계없음을 장점으로 밀고있지만 회사 규모가 커져서 무체계가 단점이 되고있는듯
79,더핑크퐁컴퍼니㈜,8544,"복지가 별로 없다, 체계적이지 않기 때문에 업무를 탄탄하게 배우기는 어렵다는 점, 서초역에서 걷기에도 버스타기에도 애매한 위치에 있음,"
80,더핑크퐁컴퍼니㈜,8544,업무 성과에 대한 보상이 적다. 그러다보니 월급 루팡 동료들이 많고 일부 직원에게 일감 몰아주기가 있음
81,더핑크퐁컴퍼니㈜,8544,역에서 거리가 좀 있어서 불편하다. 수당이 따로 없다. 직원들이 먹을 수 있는 식당이 있기는 한데 일부 지원이라 좀... 전액 지원해줬으면 좋겟다.
82,더핑크퐁컴퍼니㈜,8544,장점으로 적은거 제외하고 모두 다. 재택 = 퇴근 없음. 본부장 실장 팀장 겸겸겸겸겸 팀장 없으면 팀장업무가 일반 사원한테 넘어감. 그래도 오래 버티면 승진기회도 좋고 편하게 다니기 좋은듯. 커리어에 욕심 없이 그냥 물경력 원할 경우엔...그리고 인사팀이 너무 편협해요
83,더핑크퐁컴퍼니㈜,8544,"휴가를 자유롭게 무한개 사용가능하다고 하지만, 팀바팀임, 팀장인 본인보다 많이 쓰면 눈치주고 회의시 연차 몇일 사용했다는 통계표를 보여줌"
84,더핑크퐁컴퍼니㈜,8544,업무가 과도하다. 인턴인데도 매일 야근을 했었던 기억이 있다.
85,더핑크퐁컴퍼니㈜,8544,경쟁하는 분위기 복지 X 연봉 상승 및 상여 등 부족 사람들이 기업에 애정이 없고 날마다 느는 퇴사자로 인수인계가 익숙한 회사 주니어급 젊은 여성들이 대부분이라 다양한 경험 부족
86,더핑크퐁컴퍼니㈜,8544,"1) 연차가 무제한인 이유는 '언제 어디서나 업무를 할수 있다' 라는 사실인데, 그 내용에 공감하지 못하는 직원들이 정말 많아진듯함. 2) 진짜 열심히 하는 직원들은 다 나가버리고, 단순히 상급자의 이쁨을 받으면 무한 승진(?)하는데, 정작 그 사람들은 너무 일을 못함.. 3) 신입으로 들어오면 누구도 일을 가르쳐 주지 않아서 힘들어하는게 느껴졌음"
87,더핑크퐁컴퍼니㈜,8544,체계가 없다 비전이 없다 개인의 성장을 개인의 몫으로만 돌린다 성장을 위한 회사 그리고 상사의 서포트는 바라면 안된다
88,더핑크퐁컴퍼니㈜,8544,"중간급 관리자가 부족함, 체계가 두루뭉실한 편, 점심 식대가 없음"
89,더핑크퐁컴퍼니㈜,8544,연차가 무제한이지만 아무때나 쓸 수 있는 분위기는 아님. 연봉인상률이 너무 낮음.
90,더핑크퐁컴퍼니㈜,8544,인턴을 너무 많이뽑는다..경력직이 필요한 자리에도 인턴을 뽑아서 업무 히스토리가 끊기는 경우가 종종 있음
91,더핑크퐁컴퍼니㈜,8544,경영진들에 대한 신뢰가 가지 않음 공정하고 투명한 곳이라고 생각이 들진 않음
92,더핑크퐁컴퍼니㈜,8544,업무 분위기는 팀바이팀. 하나에 집중하기보단 멀티 능력이 필요함
93,더핑크퐁컴퍼니㈜,8544,복지가 거의 없다 무제한 연차도 딱히 복지라 볼 수 없음.. 프로젝트가 산발적으로 진행되는지라 정신 없을 때가 많음
94,더핑크퐁컴퍼니㈜,8544,야근수당이 없음 사내식당/사내카페 모두 유료 (저렴하지만) 업무강도가 쎈 편
95,더핑크퐁컴퍼니㈜,8544,전문성이 떨어지고 대학 동아리 느낌이 듭니다 뭘 만들고 있는지 제대로 방향을 제시하는 사람이 없으니까 모든 컨펌 구조가 체계없이 구멍이 뻥뻥 뚫려있습니다
96,더핑크퐁컴퍼니㈜,8544,팀별 분위기에 따라 재택이나 업무환경이 많이 달랐어요.
97,더핑크퐁컴퍼니㈜,8544,"다양한 경험을 할 수 있다고 포장하지만 전문성을 쌓거나 성장하는데 도움안되는 잡무 위주. 신입, 인턴들이 많아 사회생활 개념 없는 경우가 많음"
98,더핑크퐁컴퍼니㈜,8544,오래된 시니어와 경력 없는 주니어만 많음 중간 2~4년차 실무자 부족 일 좀 적응되었다 할만하면 이직해버림
99,더핑크퐁컴퍼니㈜,8544,3%의 고인물과 90%의 신입으로 이루어진 곳. 허리는 매번 퇴사함
100,더핑크퐁컴퍼니㈜,8544,인턴이 많아서 인턴 들어오고 인턴 나가고 이런식으로 사람만 들어왔다가 나가는 경우가 많음
