,company_name,company_id,review_text
239,더핑크퐁컴퍼니㈜,8544,회사 성장 속도에 비하여 인력이 너무 부족함. 그 어떤 회사보다도 1인분 보다 최소 2인분 이상을 할 수 있는 인력을 원함.
240,더핑크퐁컴퍼니㈜,8544,딱히 알려주지 않고 스스로 알아서 성장하기를 바라는 곳. 사람을 중요하게 여겼으면 좋겠다는 생각이 드는 곳. 회사의 규모나 인지도에 비하여 업무처리가 스마트하지 않거나 체계적이지 않다고 느낌.
241,더핑크퐁컴퍼니㈜,8544,반면에 그렇지 못한 팀에 들어간다면 더없이 고통스럽다. 업무 분담에 매번 혼란을 겪고 제대로된 체계가 없음. 기본적으로 일이 많고 야근이 잦은데 야근 수당은 안 준다.
242,더핑크퐁컴퍼니㈜,8544,업무 분담이 명확하지 않기 때문에 전문성을 위해 스스로 노력해야 한다.
243,더핑크퐁컴퍼니㈜,8544,다른 평에도 나와있지만 직원 평가에 대한 기준이 미흡해도 너무 미흡하다. 3개월 쓰고 버리는 경우 다반사... 겉으로 보여주기에 급급한 복지체계 실질적인 복지는 거의 없다. 다른 회사도 그렇지만 강약약강 분위기 만연
244,더핑크퐁컴퍼니㈜,8544,정치력이 뛰어나거나 회사에 오래도록 충성한 사람이 아니면 쓰다버릴 부품처럼 여겨짐
245,더핑크퐁컴퍼니㈜,8544,수평 문화는 팀바팀. 수평문화라고 느낀다면 행운아거나 눈치 없거나 둘 중 하나. 신입들 혼란스러울 수 있다. 개인 문화라고 하는게 더 맞는듯.
246,더핑크퐁컴퍼니㈜,8544,뭐든지 스스로 알아서 해야하기에 인턴이나 신입은 일 배우기 어려운 구조.
247,더핑크퐁컴퍼니㈜,8544,"주어진 업무 이외에도 요구되는 업무능력이 빡세다. 개발, 디자인, 영상... 다 할수있는걸 좋아하는편. 사회초년생이 한 분야에서 전문성을 키우기엔 혼란스러울수도. 자기가 나서서 무엇을 하겠다고 강하게 주장해야하는데 어필에 약하다면 적응이 힘들수도 있다."
248,더핑크퐁컴퍼니㈜,8544,하지만 퇴근은 눈치 보면서해야함... 야근은 팀바팀 그리고 자기가 만드는 컨텐츠가 뭔지도 모르는 무능력한 기획자들이 많음.. 영상에대한 이해도가 매우 없고 좋은학력으로 기획자라는 이름을 달고있는 느낌 디자이너들이랑 소통이 안된다
249,더핑크퐁컴퍼니㈜,8544,"1. 팀에 따라 야근이 정말정말정말 많은 팀들이 있다. 콘텐츠 제작하시는 분들은 워라밸이 지켜지기 힘든듯하다. 야근이 없는 팀들도 눈치안보고 칼퇴하는 분위기는 아니라서, 워라밸과 칼퇴 중시하는 분들은 안맞을듯.. 참고로 야근수당 같은거 없다. 나는 팀장님이... 팀원들끼리 각자 업무가 다르긴 하지만 누구는 야근하고 누구는 안하면 화합이 깨질 수 있으니... 야근을 해달라고 한 적이 있음. 그래서 10시 넘어서까지 야근하고 간 적이 있다.  2. *지원하실 분들은 중요* 정규직 전환형이란 말은 믿지 말자!! 스쳐지나가는 분들이 너무 많다. 신입은 거의 다 ‘정규직 전환형 인턴’으로 뽑는데, 전환율은 20퍼.... 정말 많으면 50퍼 정도일까......??ㅎㅎ 전환은 그중 1명 시켜줄 거면서 5명 이상 뽑는 팀도 있고, 10명 이상의 팀원 중 정직원은 3~4명 뿐인 팀도 있다. 회사 톡방에 며칠에 한번씩 사람들이 들어오고, 며칠에 한번씩 그만큼 나간다..... 지인 중 이 회사 인턴으로 몇 명이 스쳐지나갔는데, 그중 그 누구도 정규직 전환이 되지 않았다.!!!!!!!!!!!!!!!! (3개월 인턴이었는데 연장해서 6개월 다니게 만들고 팽 당한 지인도 있다~^^) 전환이 되더라도 그때부터는 진짜 정직원!이 아니라 수습기간 3개월의 시작이다. (인턴을 했는데 왜때무네 수습을 또...?) 암튼 다닌지 반년이 되어야 정직원이 될 수 있다는 게 실화.  3. 물론 팀바팀이긴 하지만, 체계가 덜 잡혀서 힘들다. 책임 소재가 불분명해 공동의 잘못이 당신의 잘못이 될 수도 있고, 인턴끼리의 경쟁 속..... 다른 사람의 실수는 눈감아줬는데 당신의 잘못은 드러날 수도 있다.  결론은 당신이 정직원이 될 수만 있다면, 괜찮은 회사!"
250,더핑크퐁컴퍼니㈜,8544,다양한 업무 기회가 적다. 제대로 평가가 이루어 지기엔 체계가 덜 잡혀있는듯 하다.
251,더핑크퐁컴퍼니㈜,8544,기업이 커지면서 효율적이지 못한 절차들이 생겨나는 것 같다.
252,더핑크퐁컴퍼니㈜,8544,너무 자유로운 분위기이다보니 가끔 여기가 회사인지 학교인지 헷갈립니다. 신입에게는 체계적으로 배우는 것에 한계가 있을 수 있음
253,더핑크퐁컴퍼니㈜,8544,아직 작은 회사라는 것이 느껴질 정도로 체계적이지는 않음
254,더핑크퐁컴퍼니㈜,8544,"말그대로 스타트업 정글. 체계, 보고 체계, 성과 KPI 등 정해진것이 많지 않아 불분명한 요소들이 곳곳에 존재함. 개발자들에게는 좋은 환경이라고들 하지만 사업이나 영업, 마케팅 분야에 분들은 잦은 야근이 필수적으로 요구될때가 많음."
255,더핑크퐁컴퍼니㈜,8544,팀 바이 팀으로 분위기도 다르고 추구하는 방향성도 다르다
256,더핑크퐁컴퍼니㈜,8544,솔직히 없다고 적고싶지만 굳이 뽑자면 저희팀은 100프로 칼퇴 팀은 아닙니다. (팀마다다름) 자율을 추구하지만 자유는 아니기때문에 자율안에서 자신의 역량을 발휘해야합니다.
257,더핑크퐁컴퍼니㈜,8544,"알아서 배우고, 스스로 일을 만들어가며 성장해야 하는 환경이 누군가에게는 어렵게 느껴질 수 있음."
258,더핑크퐁컴퍼니㈜,8544,"최고의 복지는 출퇴근자유와 휴가라지만 이외의 복지는 전무하다고 보는게 맞음. 하지만 일하는데 딱히 지장은 없고, 워라벨이 지켜지니 큰 문제가 되지는 않음"
259,더핑크퐁컴퍼니㈜,8544,"무제한 휴가지만 실제로 쓰긴 눈치보임. 자유로운 분위기를 만드려고 하나, 팀장 스타일 대로 팀 분위기가 달라짐"
260,더핑크퐁컴퍼니㈜,8544,자율적인 출퇴근이 꼭 효율적이고 좋은 제도가 아닐 수도 있단 생각이 들었으며 많은 행사와 프로젝트로 인하여 바로 정글같은 실무로 덤벼야한다
261,더핑크퐁컴퍼니㈜,8544,출퇴근이 자유. 장점일 수도 있는 점이지만 출퇴근 자유를 눈치게임으로 만들지 않기위한 체계적인 업무관리는 부족해보인다.일단 할일이 많아서 자연스레 야근을 많이하게되고 다음날 늦게오고 그게 악순환인 면이있다. 이것이 진정한 자유인가. 모두가 그런건 절대 아니지만 눈치보며 적당히 늦게와서 적당히 늦게가는 나름의 출퇴근 루틴이 있다.
262,더핑크퐁컴퍼니㈜,8544,자유로운만큼 책임이 따르기때문에 막상 복지를 활용하지 못하는 경우가 많다. 일에있어서 수동적인 사람은 맞지않을 수 있음.
263,더핑크퐁컴퍼니㈜,8544,심한 개인주의. 알게모르게 서로 눈치경쟁이 심한듯. 사내 팀들끼리 혹은 팀원들 끼리 정보 공유가 안됨. 사내 커뮤니케이션 툴을 슬랙과 라인으로 쓰는데 분리되서 오히려 혼란. 콘플루언스 같은 이슈 관리 시스템을 도입하지 않는게 이상할따름.
264,더핑크퐁컴퍼니㈜,8544,"출근시간이 자유로운 만큼 퇴근 시간이 정해져 있지 않다는 점. 사무실이 개방형이여서 업무 집중에 가끔 방해가 될 수 있음. 사내식당이 있지만, 식비를 주지 않아서 인턴이거나 신입일 경우 부담이 될 수 있음. 아무래도 스타트업이다보니, 일을 배우기에는 좋지만 양이 방대함...!"
265,더핑크퐁컴퍼니㈜,8544,조직 개편이 잦다. 퇴출인지 퇴사인지 애매한 퇴사자가 많다.
266,더핑크퐁컴퍼니㈜,8544,체계가없음. 잦은 조직개편. 대표는아니라고함. 뭣모르는 신입은 이게 잘돌아가는지 아닌지 잘몰라서 그냥저냥 다니는데 경력들은 들어왔다가 빠른탈출하는 경우가많음. 사내 정치라인이 입사 일주일만 되어도 다보인다. 복지는 없다시피함. 저녁은 줌.
267,더핑크퐁컴퍼니㈜,8544,"외부에 광고된 긍정적인 이미지와 다른 형태로 운영됨(휴가 무제한 같은 것). 대표의 관심사에 따라 회사에서 중요하게 생각하는 사업이나 프로젝트가 달라지는데 관심 받았을 때 2~3개월 안에 성공시키지 못하면 바로 관심이 떠나고 일 못한다는 소리를 듣게 됨. 내부 개편이 너무 빈번해서 프로젝트의 성공이나 실패를 경험하기 전에 부서가 바뀐다든지 프로젝트가 중단되는 경우가 많음. 3~6개월이면 또 개편될텐데 하는 생각으로 일하는 사람도 있음. 대표 눈치를 보고 정치를 하는 세력이 많이 늘어남. 직원 개개인을 키워서 함께 성장하기 보다는 각자 알아서 생존하기를 바라는 분위기. 팀간, 부서간 경쟁을 부추기는 분위기를 만드는 경우도 있음. 사람을 소중하게 여긴다고 하나 소중하게 생각하지 않음."
268,더핑크퐁컴퍼니㈜,8544,"1. 10년차 임에도 여전히 체계가 없음 2. 관종끼 넘치는 비전문가들이 설치고 다님. 3. 대표의 말만 앵무새처럼 따라하는 리더들. 4. 장기 목표없이 즉흥적인 프로젝트에 리더책임감 부재. 5. 업무 분장 안되는 걸 리더가 사원 탓함. 6. 인턴 출신, 신입이 많은 팀은 분위기가 어수선하고 대학 동아리 수준 7. 그마저도 인턴 전환율이 낮고 퇴사율도 높아 무한 인수인계 반복 8. 경영진이 사원들에게 관심이 없다. 사람에 관심이 없다. 9. 직원 복지가 없다. 지인들이 자꾸 물어봐 쪽팔리는데 직원할인 당연히 없다. 10. 성과주의지만 성과부진의 원인 제공이 관리자인 걸 모른다."
269,더핑크퐁컴퍼니㈜,8544,-장점이자 단점이지만 업무량이 많습니다. -야근비가 없다고 들었습니다. -야근이 많다고들 하는데 제가 짧게나마 봤을 때에는 늦게 출근해서 그만큼 늦게까지 일하는 경우가 대부분이었고 이 외에 많은 업무량탓에 30분~한 시간정도 야근을 하더군요. -점심식사를 싼 가격에 사먹을 수 있게 회사 1층 레스토랑을 빌려 제공해줍니다. 하지만 식사가 너무 맛이 없어 밖에 나가서 먹는 게 좋습니다... 너무 맛이 없어서 일을 할 힘이 안납니다 -마냥 수평적인 분위기는 아닌 것 같습니다. 사회초년생이어서 '수평적 분위기'에 대한 환상이 있었는데 역시 회사를 운영하는 데에 있어서 완전한 수평이란 기대하기 힘들어 보입니다.
270,더핑크퐁컴퍼니㈜,8544,워라벨이 붕괴되어있다. 일과 삶의 벨런스는 존재하지 않는다고 생각하면 된다. 애초에 대표가 바라는 것도 그런 것.
271,더핑크퐁컴퍼니㈜,8544,"수평적인 구조, 자유로운 분위기라 하지만 어떤 팀에 가느냐가 관건인듯"
272,더핑크퐁컴퍼니㈜,8544,"회사가 이전했는데, 전자렌지와 정수기가 하나씩 밖에 없어 점심시간때 불편 ㅎㅎ"
273,더핑크퐁컴퍼니㈜,8544,"실력이나 가지고있는 지식이 어떻든, 회사 오래다닌 사람이 장땡. 여기 리뷰들이 말하는거랑 똑같이 어떻게든 본인 업적으로 만드려고 갖은 애를쓰는 여우들 천지. 여자들이 많아 그런지 눈치싸움도 비일비재하고 친한사람들끼리 몰려다니는것도 다반수. 회사 오래 안다녔어도 나대는 사람들이 은근 많아서 눈살 찌푸려질정도."
274,더핑크퐁컴퍼니㈜,8544,잦은 기업 조직도 변화가 있어서 좀 불안정하다고 느낄 수 있고 눈에 보이는 성과를 내지 않으면 밀려날 수 가 있어보인다
275,더핑크퐁컴퍼니㈜,8544,"SNS를 통해 이슈 되는것으로 회사홍보를 과하게 노림 (사진 찍고 올릴것 가지고 노는듯 하지만 일부는 그게 업무인듯, 구체적으로 디텍팅 함)  따라서 실제보다 과평가되어 기대를 크게 갖게되면 실망이 큼  무제한 휴가 쓰는 사람은 거의 없음, 1,2명 있지만 예전부터 오랫동안 야근, 철야로 일했던 사람 극히 소수에 불과하고 sns 이슈에 불과하지 않는다.  사내 정치가 상당히 심함. 편가르기가 심하고 텃세가 어마어마하다.  팀마다 분위기가 많이 다른데 a팀은 개인의 의지와 상관없이 야근 위주로 돌아가고 b팀은 정치하는 여우소굴만 득실하다. 아주 세세하기 갈라져서 편가르기에 정신없다.  연봉은 업계 보통 수준, (회사에서는 평균보다 높다고 생각함)"
276,더핑크퐁컴퍼니㈜,8544,업계에서 성적이 좋은 편이라고하지만 급여나 복지가 다른 중소기업과 다를바 없음. 회사내 분위기는 좋을지언정 개인적인 걱정은 나날이 늘어감.
277,더핑크퐁컴퍼니㈜,8544,"아닌척, 나은척 하면서 사실은 똑같음. 박봉에 일 많이 시킴"
278,더핑크퐁컴퍼니㈜,8544,무제한휴가라곤 하지만 평균 20일 정도 쓰는 듯 하고 한번에 한두달 이상으로 길게 가는 사람은 없음. 이게 무제한인건가?
279,더핑크퐁컴퍼니㈜,8544,[규칙이 없음] 원칙과 규칙이 없어 상황마다 다르고 혼란스러울 수 있음
280,더핑크퐁컴퍼니㈜,8544,"단점은 넘치게 많다. 우선 신입은 들어가서 뭣도 모르는 새에 배우는 것도 없이 인생을 낭비할 수 있다. 외부이미지에 속지 말 것. 1. 연차 상관없이 먼저 회사에 자리잡은 사람이 갑이 되는 분위기. 연차가 더 높은 경력도 회사에 오래 있었던 사람 밑에서 눈치를 봐야한다. 결과적으로 비합리적인 수직적 구조를 가지고 잇음. 직급없이 별명을 부른다고는 하나 적당히 눈치보며 상사 비위를 맞춰야 함. 사람을 미치게 만듦. 2. 사람을 '괜찮네' 싶으면 뽑았다가 '별로네'싶으면 이유도 없이 버림. 왜냐면 또 다른 사람 뽑으면 되니까...ㅋ 3. 기업의 체계가 없고, 새로운 사업을 많이 진행하나 전문가가 적음. 따라서 전문성을 키울 수 있는 기회가 없이 상사의 손발이 될 뿐. 자기계발의 기회는.. 당연히 없음. 4. 동기가 없다. 상시로 채용을 하기 때문에. 같은 날 들어온 사람들과도 연결될 기회가 없으며 혹여 누군가와 친해졌다고 해도 같이 점심먹기가 눈치보이는 곳."
281,더핑크퐁컴퍼니㈜,8544,"사내 정치가 없다고 경영진은 믿는 듯 하나 실제로는 있을거 다 있음. 직원들의 상황을 파악하지 않고 일을 진행 한 후, 부정적인 의견은 들으려 하지 않음. 연봉협상이 아니라 통보이며, 성과가 없다며 자존감을 낮추는 식으로 진행됨. 겉으로는 아니라고 말하지만 야근이 평가 지표에 포함된게 아닐까 싶을 정도로 야근하는 사람과 아닌 사람을 경영진이 차별대우함. 겉으로 이런 이야기를 안했으면 실망하지 않았을 일도 실망하게 되는거 같다. 경력자에게 낮은 연봉을 많이 주는 것으로 포장하며 생색냄. 팀별로 야근 수준이 매우 다른데 어떤 팀은 야근에 묻혀서 야근 수당 없이 갈린다. 신입에게 경력 이상의 과도한 기대를 자주 건다."
282,더핑크퐁컴퍼니㈜,8544,구내식당 밥 맛없음. 보여주기식 허울이었다는게 입사 몇일안에 간파될 정도로 외부 홍보이미지와 다름. 수평적인 구조 전혀 아님. 직원을 위한 복지가 없고 (무제한 휴가라지만 이건 철판깔고 다니는 극소수에게만 적용된 룰) 직원들도 목표의식 있는 사람이 없어보임. 뽑아놓고 케어하는 사람이 없고 최근 사람들이 많이 들락날락이 심해짐. 출판사 출신 직원들이 디자이너들을 수족으로 부리는 듯한 느낌이 많고 디자이너 스스로도 소신가지고 일하는 사람 없어보임. 경영진들과 실무진들간 의사소통이 안 돼서 엄한 사람들이 고생을 다하는 구조. 텃세 부리는 여자직원들 많고 페북하면서 노는 직원들도 많음. 게임팀은 강제 야근 많이하는 분위기임.
283,더핑크퐁컴퍼니㈜,8544,"신입 연봉 삼천임. 대기업 신입연봉이처 라고 홍보하면서 야근해도 야근비없고 팀마다 야근이 다르지만 팀장들이 팀장 경험이 없어서 팀원관리를 못함. 스타트업인데 잘된 외부포장으로 사람들이 많이 지원하니 사람 쓰고버리기를 반복. 정규직과 인턴 계약직 수습으로 장난을 많이 침. 신입사원에게 경력직같은 능력을 요구하며 신입에게 가르치려는 의도가 없고 자기일만 하기 바쁨. 업무 매뉴얼이 없고 맨땅에 헤딩. 회의의 연속이고 신입이 알아서 업무를 처리해야 하며 가르쳐주는 사람 1도 없음. 업무의 진행방향이 팀장맘대로 바뀌며 혁신을 추구하는듯 포장하지만 자기 의견 내는 사람 싫어하고, 경영진 아이디어에 맞지 않으면 아이디어 다 잘라버림. 야근비 1도 안줌. 야근많음. 휴가 무제한이라규 하나 거의 못씀"
284,더핑크퐁컴퍼니㈜,8544,"무제한 휴가 절대 아님. 팀마다 다르지만 눈치봐야하는 부서도 많음. 정치질이 심하며 수평적인 문화를 강요하지만 팀장, 실장 직급있음. 다만 그렇게 부르지 않고 닉네임을 부를뿐. 기획서 전달은 제대로 되지않으며, 담당자가 알아서 하라고 하지만 막판에 윗상사가 관여해서 다시 해야하는 일이 많음. 개발자에겐 천국이나 그외 직종은 지옥임. 내부 임원들의 관심인원에게만 편애와 관심이 쏠리는 편."
285,더핑크퐁컴퍼니㈜,8544,명확한 비전도 없이 누가 생각하는 재미하나로 팀이 꾸려졌다가도 왜 그래야 하는지도 모른채 뒤집히는 일 반복 직원들 나가도 유명세 탔고 돈 있으니 새로 뽑음 된다고 생각하며 사람 중요한지 모름 페북 만능주의 때문에 관심종자들 맞장구 쳐주고 그들 페북에 올릴꺼리 만드는게 업무가 되어버리는 곳 정치질하는 사람들때문에 열심히 일하는 직원들만 지치고 무기력해짐 잘한것만 서로 자랑하느라 바쁘고 못한건 개선의지 1도 없이 쉬쉬하며 잊혀지길 바라는 곳
286,더핑크퐁컴퍼니㈜,8544,"사내정치, 불분명한 목적성 그리고 한사람의 독단으로 팀이 개편되었다 또 새로생겼다 하는 말도안되는 인사. 일하는 사람만 하고 안하는 사람은 페북에 친목질만 잘하면 월급 나오고 그럭저럭 다니는 사람이 많아 힘듬. 야근 눈치 대박이구요 박쥐들이 많아요"
287,더핑크퐁컴퍼니㈜,8544,"결국은 수평이 아닌 수직적 조직 운영은 어쩔 수 없는 일. 보여지는 외관은 화려한데, 결국 안을 드려다보면 중소기업 시스템. 고액 연봉을 원하시는 분과 자기 PR이 잘되시는 분들에겐 추천. 일의 체계도 없으며, 일의 진행에 있어서 비효율적."
288,더핑크퐁컴퍼니㈜,8544,"우리나라에서 다니기엔 충분히 좋은 회사다. 하지만 '회사'라는 것을 잊지 말자. 최근 입사자들이 다 실망하고 퇴사하는 이유가 바로 이 것. 여느 회사와 같이 묵묵히 일하는 사람도 있고 정치질하는 사람, 친목질하는 사람, 야근 강요하는 사람 등등 다른 회사에도 있는 좋고 나쁜 사람들 다~ 있다. 체계가 없다. 알아서 업무 방향잡고 잘 챙겨갈 수 있는 자기 PR이 능한 사람이 다니기 좋은 회사다. 적극적인 PR을 하지않으면 어느 순간 도태되어있는 자신을 발견하게 된다. 이건 다른 회사들보다 유독 심하다. 위와 같은 이유로 신입에게는 추천하지않는다. 경력직에게는 추천."
289,더핑크퐁컴퍼니㈜,8544,"1. 스타트업 - 아직 체계가 덜 다듬어진 구석이 존재한다. 2. 정글 - 알아서 잘 해야한다. 신입사원에게 업무적으로 터프한 편. 3. 직급 없음 - 대리, 과장, 부장 승진의 기쁨은 없다. 남과 비교보다는 나의 성장과 회사의 성장만이 있을 뿐."
290,더핑크퐁컴퍼니㈜,8544,효율성부분에 있어서는 약간의 의구심도.. 정형화된 틀이 있지않아 효율성 측정이 어렵지만 다다들 열심히 하고있는것 같아 보입니다.
