,company_name,company_id,review_text
172,더핑크퐁컴퍼니㈜,8544,"일이 많은 편이며 규모에 비해 생각보다 체계가 잡혀있지 않음, 매분기 인턴을 뽑고 채용하지 않는편, 홍보했던 것보단 직원복지가 아쉬움. 인사이동이 갑작스러운 통보식...."
173,더핑크퐁컴퍼니㈜,8544,일 제대로 하는 사람이 없음. 가르쳐줄 사람도 없음. 신입으로 들어오면 정말 비추인 회사. 3-4년차가 들어와서 몇년 일하고 이직하기 나쁘지 않은 회사. 인사와 조직개편은 그냥 대표마음. 귀엽고 작은 회사니까 그것도 이해되긴함.
174,더핑크퐁컴퍼니㈜,8544,"팀이 적게는 2~3명부터 많게는 몇십명 단위로 쪼개져서 많은 팀이 존재/ 팀마다 분위기가 천차만별/ (회사에서 기본적으로 수평구조를 추구해도 수직적 관계를 종용하는 일부 팀장도 존재한다.) / 팀 이동이 자유롭다는 회사의 말은 '팀에 문제가 생기거나 팀이 없어지면' 이라는 전제가 빠진 말/ 컨텐츠는 거의 내부제작이 아닌 외주제작이라 일을 벌리는 사람은 많은데 실제 실무를 잘 아는 사람이 드물어서 우왕좌왕/ 외주를 엄청 내보내면서 컨텐츠 퀄리티와 기술 유출을 걱정하는 모순/ 매출경쟁이 심해서 팀간 협업이 매끄럽지 못함/ 빠른 퇴사가 많기 때문에 3년 정도만 다니면 고인물/ 정규직 전환이 굉장히 소수라서 인턴 물갈이 심함 인턴이 인턴에게 인수인계하는 경우도 있음/ 회사를 키운 인재들 대부분 퇴사함/ 일부 박힌돌과 다수의 주니어로 이루어진 모래시계 구조의 '허리'가 없는 회사/ 많은 인턴들과 계약직들, 다수의 외주회사로 운영되는 회사"
175,더핑크퐁컴퍼니㈜,8544,"무제한 휴가나 택시비 지원, 자유로운 출퇴근 시간은 결국 칼퇴근이 불가능하다는 것을 뜻합니다"
176,더핑크퐁컴퍼니㈜,8544,"매우 비효율적인 업무 프로세스. 열정을 강조하지만 실제로는 매출만을 매우 강조하는 오너. 성과에 비해 복지와 보상은 빈약. 구성원 대다수가 사회 초년생이거나 첫직장이다보니, 경험 부족으로 프로젝트가 산으로 가는 경우가 자주 발생. 기존 직원과 신규 입사자 간의 묘한 심리전과 텃세, 소위말하는 '태움' 등으로 정신적 고통을 호소하다 퇴사하는 경우 다수. 글로벌 기업을 표방하면서도 점점 빈약해지는 콘텐츠 구성."
177,더핑크퐁컴퍼니㈜,8544,업무체계가 없다... 연봉 넘 적게줌...휴가 무제한이라는데 솔까 눈치보임. 1년에 15개 다 쓸수 있을까?
178,더핑크퐁컴퍼니㈜,8544,실력 없는 팀장 팀에 있는 경우 답이 없다 개인플레이의 경우가 많음
179,더핑크퐁컴퍼니㈜,8544,"체계가 없어서 신입에게 비추, 이끌어줄 리더가 없어서 닥치는 대로 일해야 함"
180,더핑크퐁컴퍼니㈜,8544,"업무 뿐만 아니라 기업 문화 이해, 정리 체계 방식 등 배워야 할 부분을 가르쳐 줄 사수가 없다. 이 점이 일을 처음 시작한 쥬니어들에게는 큰 단점이 될 것 같다."
181,더핑크퐁컴퍼니㈜,8544,조금 몸집이 커지다 보니 보이지 않는 정치가 존재함. 매니저에 따라서 업무 환경이 매우 다름. 따라서 사람을 누구를 만나냐에 따라서 장기적으로 다닐수 있을지 없을지 와꾸가 나옴.
182,더핑크퐁컴퍼니㈜,8544,부바부 심한데 꿀부서 몇 없음 / 아니 꿀부서 많은데 사바사가 더 정확 / 일하는 사람만 일한다 / 제작팀 사무직 모두 힘내세요... 회사가 제작팀 야근 케어 노력중이라는거 알고 있을 법한 일반 사원분이 계시다면...사무직 야근도 알아주세요 / 휴가 자유로운데 휴가와 업무의 경계가 없습니다 / 쥬니어들은 여러 업무에 참여해볼 수 있으나 체계가 없는만큼 정말이지 다양한 업무라 당장 급하다는 일들 쳐내다보면 내가 뭘하고 있지 싶고 커리어가 캄캄하다 / 하지만 알아서 자율적으로 성장하는 문화이기때문에 커리어 캄캄해하면 자기 밥그릇 챙기는 능력 없다고 생각함 (회사에 배우러 오셨어요? 신입인데 경력이 없으시네요?) / 2-3년차 퇴직자가 많은 회사 / 상사들이 밑에 일떠넘기기 급급 / 인턴이 인턴에게 인수인계 받는 문화 / 면접 합불 여부 알리는 프로세스에 논란이 많았다. 상처받을 수 있으니 주의
183,더핑크퐁컴퍼니㈜,8544,"업무 체계, 의사결정자가 명확하지 않아서 혼란이 생길때가 있다. 회사의 비전과 부서의 비전이 명확하지 않는다는 느낌."
184,더핑크퐁컴퍼니㈜,8544,부서 바이 부서가 심함 / 제작팀분들은 힘내세요... 회사에서 제작팀분들 야근 심한거 알아서 어떻게 관리하려고 하지만 어찌 될 수 없는 부분이라 ㅠ 아마도 여기에 써있는 안좋은 후기는 거의 제작팀 분들이 쓰신게 아닌가 추정 ㅠㅠ  2호점 같은 경우는 점심값이 많이 깨짐 ㅠ 1호점에는 구내식당 있는데  제작팀 분들 더 뽑아주세요 ㅠㅠ
185,더핑크퐁컴퍼니㈜,8544,"수평문화는 대외적으로 티나는 부분만. 보여지지 않는 부분에 갈굼 있음. 사원들의 양극화가 심하여 서로 불신도 심한 편. 계약 관련 문제 많음. (정규직 공고내놓고 채용은 계약직 형태, 인턴 무한 연장 등) 입구도 크고 출구도 커서 스쳐가는 사람이 많음. 10년이 지나도 체계 없음. 이미지만 믿고 들어오면 환자될 확률 높음."
186,더핑크퐁컴퍼니㈜,8544,1. 자율적=유도리있게 행동하는것=눈치껏행동해라 이기때문에 눈치없으면 살아남기 힘듦 2. 보여주기식 인싸력을 남발하길 원해서 피곤함 3. 신입만 주구장창뽑고 주구장창 떨어져 나감
187,더핑크퐁컴퍼니㈜,8544,여기 HR 일 너무 못함. 공채 인턴 미션주는데 팀 장들 한테 공유도 안되서 야근하면서 미션 하던 친구들도 있었음. 말도안되는 계약 연장 제안이 파다하다함.
188,더핑크퐁컴퍼니㈜,8544,정직원이 되기 위한 끝없는 평가들.. 바쁠때 인턴들 넉넉하게 많이 뽑아서 싸게 쓰고 프로젝트 끝나면 버린다.처음에 설명해준거랑 말이 계속바뀜. 인턴끝나면 수습시작. 그리고 인턴과제가 있는데 근무시간에 하지말라고해서 퇴근하고 만들고 들고 주말에 만들어야함. 바쁜팀들은 이거땜에 더능률떨어짐
189,더핑크퐁컴퍼니㈜,8544,"쓰다가 버리는 마인드가 매우 쉬운 곳. 그러려니 함 말로만 수평적인 구조. 스타트업이라 커리어에 도움 안됌. 분위기는 팀바이팀, 어느 팀은 엄청 조용하고 윗사람 눈치보면서 사리기 바쁨. 사내 식당 맛없음"
190,더핑크퐁컴퍼니㈜,8544,공기가 탁해서 사무실에 들어오는 순간 숨이 막히는 느낌이 들고 조명 또한 두통을 유발함. 덕분에 업무 효율이 너무 떨어지고 결국 야근을 하게 돼서 힘듦.
191,더핑크퐁컴퍼니㈜,8544,수평적 문화를 추구한다고 하지만 직급은 엄청많음 파트장 팀장 실장 본부장 랩장 대표한테 아양떨고 우쭈쭈 해주면 승진되는것같음
192,더핑크퐁컴퍼니㈜,8544,복지는 sns로만 존재한다. 아부와 사내정치에 집중하고 책임은 떠넘기기 급급한 시니어가 다수. 나머지는 좋게 말해 멀티플레이어지 닥치는대로 일하다 팽당한다.
193,더핑크퐁컴퍼니㈜,8544,인턴에게도 정직원과 같은 레벨의 업무강도를 강요 / 급작스러운 프로젝트 전달 및 빠듯한 마감 / 정직원 채용의 정확한 기준이나 근거를 모르겠음 / 팀의 성과를 위해 직무와 관련되지 않은 다른 일이 주업무가 되는 경우가 많음. 체계가 부족함. 그에 따른 직무 성취감 하락 / 같은 회사아래 팀이지만 팀끼리의 경쟁도 만만치 않음. 협업이 어려울 때가 많음 / 일을 잘하고 빨리하면 일을 더 시키는 편
194,더핑크퐁컴퍼니㈜,8544,"일을 잘 가르쳐 주고 책임져줄 선임이 없음, 팀장들 역시 경험이 적음, 일정 기간이 지나면 개인의 성장이 어려울 수있음."
195,더핑크퐁컴퍼니㈜,8544,너무 많다. 팀바이팀으로 분위기도 너무 다르고 체계라는 것은 정말 하나도 없다
196,더핑크퐁컴퍼니㈜,8544,유아동 교육 회사임애도 불구하고 문제가 많으며 뭐가 문제인지조차 모르는 회사
197,더핑크퐁컴퍼니㈜,8544,"대부분을 계약직으로 뽑는 부분도 그렇고, 직원들을 소중하게 생각하는지 의문이 듭니다."
198,더핑크퐁컴퍼니㈜,8544,유연근무제라고 하지만 그렇지는 않음 경쟁이 심함 윗선의 정치질이 있음
199,더핑크퐁컴퍼니㈜,8544,외주사는 협업이지 하청이 아니다 체계없음 .... ...상도의 부족 갑질을 사원이 하게 만드는 문화 .... .
200,더핑크퐁컴퍼니㈜,8544,"다양한 사업을 벌려놓았지만 해당 사업의 경력자, 전문가가 심각하게 부재함. 결국 실무자가 맨땅에 해딩하고 삽질하면서 제로부터 시작해야함. 욕심없고 시간 잘 떼우는 사람에게는 좋은 직장일 듯.. 그러나 옆에서 같은 월급받는 사람들은 지속적으로 현타 옴. 위에서는 별로 바로잡을 생각도 없고 일부 사원들만 챙기므로, 결국 일하는 사람만 일하는 구조. 실무적인 역량보다는 무논리여도 목소리 크고 작은 성과도 크게 부풀릴 줄 아는 인재가 살아남는다. 제대로 아는게 없어도 정치 잘하면 고공승진 가능. 공용 드라이브에 있는 타인의 아이디어, 디자인, 기획서 마음껏 사용하고도 결국 내가 했다고 큰소리 칠 수 있고 그래야 인정받는 곳."
201,더핑크퐁컴퍼니㈜,8544,"- ""정규직 전환형"" 인턴이지만 인턴하면서 경력직 정도의 업무를 달성해야함. - 가르쳐주지 않기 때문에 스스로 업무를 배워야 함. - 블로그/SNS에 기업의 좋은 이미지가 부각되지만 실제로 와보면 별거 없다는 것을 깨닫게 됨. - 퇴사율이 높음 (2년 이상 근무한 사람이 별로 없음) - 정규직 뽑는 기준이 정해져 있지 않고 같이 일하는 사람들, 팀장 마음대로임 - 여초"
202,더핑크퐁컴퍼니㈜,8544,구조조정이 굉장히 많은것같다 수평적인구조라서 좋기는한데 그래서 계급이나뉘는게딱보임
203,더핑크퐁컴퍼니㈜,8544,"1. 체계가 없음 2. 워라벨없음 -팀바이팀 3. 인턴이 정규직처럼일함 4. 인턴한테 꼰대짓함 5. 문제가 많은데, 윗사람들은 문제를 전혀 모름 6. 사람을 부품처럼 여김 7. 인턴이 인턴한테 인수인계 받는 이상한기업 인턴이 사수에게 물어봐도 지는 모름.근데 실수하면 공개적으로 혼남 8. 미래가 없음, 아기상어 하나로 뜬 기업 9. 근속연수 짧음 - 회사의 미래가 안보인다는 거"
204,더핑크퐁컴퍼니㈜,8544,"1. 사람을 쓰고 버리는 부품으로 본다. 인턴은 1년도 못 채우고, 과반수 이상 불합격 된다. 정규직을 뽑는다고 채용 공고를 내지만 면접자리에서 사실은 계약직을 뽑는다고 통보한다. 계약직 직원도 능력에 관계없이 정규직 전환이 쉽지않다. 매달 입사자와 퇴사자가 많기 때문에 사내 분위기가 뒤숭숭하며 안정감이 없다.  2. 회사의 조직끼리 협력하지 않고, 경계한다. 각 조직이 서로를 돕지 않기 때문에 업무의 효율이 매우 떨어지는 구조. 조직체계가 하나도 없다.  3. HR팀이 직원들의 효율적 업무를 방해한다. HR팀은 겉만 번지르르한 sns용 이벤트말고, 직원업무에 실제로 도움이 되는 작업환경을 만들어야한다. 차라리 컴퓨터 사양을 올려줘라.  4. 기업 홍보 기사, 인터뷰에 꼭 등장하는 무제한연차제도는 상급자에게만 해당된다. 일반 직원들은 법정휴가사용을 강요받는다.  5. 소통이 단절된 사내 분위기. 홍보자료를 보고 커뮤니케이션이 활발한 회사로 오해하면 안된다. 상급자들이 정한 것을 아래 직원들은 그대로 따라야한다. 회사측은 직원들에게 크레이티브를 기대하지 않는다."
205,더핑크퐁컴퍼니㈜,8544,"체계라는 것은 존재 하지 않는다. 비 전문가, 대리급 연차가 관리자로 앉아 있다. 스스로 잘하는 인재를 바란다며 계약직, 인턴에게 말도 안되는 업무량을 요구한다. 그리고 기간 종료되면 내보낸다."
206,더핑크퐁컴퍼니㈜,8544,"1. 대표 2. HR = 만남이 있으면 이별은 뒤따르는 법. 다만 이곳에서 개인적 사유 등 모든 퇴사에 대해 고생했다며 격려하고 나가는 모습을 보지 못함. 근속년수 1년이며 대표는 콘텐츠, 교육에 대한 뚜렷한 비전과 전문성 없이 우연히 구성원이 만든 콘텐츠 하나로 성장하였고 조직의 성장도 모두 구성원의 덕이나 그 구성원들 모두 퇴사함."
207,더핑크퐁컴퍼니㈜,8544,"출퇴근 시간이 자율이지만, 출근 시간은 대체로 정해져 있고, 퇴근시간이 정해져있지 않아 아주 늦은 시간까지 일하는 직원들이 많습니다. 야근 수당은 없습니다. 하나의 회사이지만 부서마다 분위기는 전혀 다릅니다."
208,더핑크퐁컴퍼니㈜,8544,은근히 복지가 없다. 사람을 쉽게 뽑고 버린다는 말이 무엇인지 알 수 있었다.
209,더핑크퐁컴퍼니㈜,8544,체계적이지 않은 업무 시스템으로 인해 소통이 잘 안됨. 답답함. 인턴에게 정직원만큼의 능력을 원함.
210,더핑크퐁컴퍼니㈜,8544,휴가나 출퇴근 시간 조정 말고는 다른 복지 찾기 힘듬. 팀장급에서 정치나 친목에 빠져있는 사람 더러 있음.
211,더핑크퐁컴퍼니㈜,8544,야근 수당이 없다. 야근을 강요하진 않지만 일이 많다.
212,더핑크퐁컴퍼니㈜,8544,"부서마다 다를 테지만 전반적으로 직원 한 명당 맡은 업무의 양이 다른 회사에 비해 다소 많은 편입니다. 부서에 따라서 밤 늦게까지 야근을 하는 경우가 상당히 있습니다. 체계가 없는 편이며, 일반적인 도덕이 지켜지지 않는 경우가 많습니다. 규모는 커지고 대외 이미지는 좋지만, 내부에서 직원을 다루는 방식은 흔히들 말하는 한국 블랙기업, 소규모 중소기업과 별 다를 바가 없습니다. 잘 일하고 있다가도 언젠가는 그 부조리가 자기 자신에게 닥칠 수 있으니 이직 준비를 항상 해놓는 것이 좋습니다."
213,더핑크퐁컴퍼니㈜,8544,"무제한 연차: 눈치가 아예 안 보이는 것은 아닙니다. 조직개편으로 일부 팀은 해당 제도가 사라진 것으로 알고 있으니 참고바랍니다. 자율 출퇴근: 지각제도/야근수당/주말근무수당이 없다는 뜻으로, 야근이 많은 팀은 진짜 많이 합니다. 기본적으로 단체생활이다 보니 팀원끼리 맞춰가야 되는 부분 같습니다. 그 외: 업무체계가 거의 없다시피 합니다. 인사팀이 일을 못합니다. 구내식당 맛없습니다."
214,더핑크퐁컴퍼니㈜,8544,그 애씀의 과정에 있어 직원들에게 돌아오는 혜택은 없음 sns나 겉보기식에만 있어 신경쓰는 기업 체계가 없고 대거 퇴사와 대거 입사가 자주 이어진다 불안한 구조이고 상사는 프로젝트에 대한 책임감은 다른 이에게 부여하고 나몰라라 한다 무제한 연차를 가장 큰 장점으로 홍보해놓고 대놓고 눈치준다 대표격인 사람에게 일일히 컨펌받으라니 일반 기업보다 못한 무제한 연차제도였음
215,더핑크퐁컴퍼니㈜,8544,자리에 맞는 책임감 가진 사람이 소수이고 일을 체계적으로 배운 사람이 드물어 회사체계 없음
216,더핑크퐁컴퍼니㈜,8544,트렌디한 척 하며 결국에는 전부의 목에 칼을 대고 있다. 누군가 잘 나가면 모두가 달려들어 어떻게든 끌어내린다. 새로운 왕자가 끊임없이 등장하고 계속 죽어나가며 직원들은 전쟁 나온 보병마냥 나가떨어져 죽어도 신경쓰지 않는다.
217,더핑크퐁컴퍼니㈜,8544,"사람. 본인 업무에 대한 전문성,일에 대해 고민하는 사람이 없다. 그러니 자연스럽게 편갈라먹기 누구하나 병신만들기 이런식의 인간관계에만 집중한다. 남의 성과 가로채기 뽑아먹기하는게 사내문화인줄 알았다 회사에서 권장하는 문화인줄. 보통은 그런 사람 한 두명이 다인데 여긴 다 그러던데. 소위 말하는 개국공신 또는 나름 결정권자라고 앉아 있는 사람들 태도를 보다보면 겁은 많아 허세만 가득한 온실속의 화초라는 생각 뿐. 본인들이 들인 노력에 비해 너무 큰 성공과 관심을 받으니 자기가 잘나서라는 착각을 한다. 근데 현장에 나가면 티가 나니 허세뿐이다. 빛 좋은 개살구. 인사팀? 포장하기 급급. 힙한 느낌 주면서 직원들 지갑 열려하는 사내 매점. 그 이상도 이하도 아님."
218,더핑크퐁컴퍼니㈜,8544,분야 불문 저렇게 되지 말아야지..라는 생각이 드는 사람이 많다. 디자이너에게는 딱히 추천하고싶지 않음
219,더핑크퐁컴퍼니㈜,8544,"주도적으로 프로젝트를 기획하는 사람 좋아함. 적극적이고 스스로 일하는 인재를 찾고 있는 것 같음. 즉 신입한테 너무 많은 걸 바람. 나가는 사람, 들어오는 사람 매우 많음. 이유는 잘 모르겠음 자율출퇴근이긴 하지만 다들 야근 엄청 많이 함. 계약직이 많음. 정규직 계약직 차별은 없음"
220,더핑크퐁컴퍼니㈜,8544,"아무래도 스타트업이고 콘텐츠 회사이다보니 해야할 프로젝트들이 많이 있고, 업무적 부담감이나 타임라인들이 꽤 있는편입니다."
221,더핑크퐁컴퍼니㈜,8544,전문성있는 리더의 부재 체계가 전혀 없는 것은 아니지만 어수선 빈번한 조직개편&퇴사로 경험 많은 실무자가 몇 없음 인사 평가 기준을 알 수 없음
222,더핑크퐁컴퍼니㈜,8544,전형적인 스타트업 이미지 메이킹을 잘한 회사로 보시면 됩니다. 회사 경영에 기초적인 것들도 갖춰 놓지 않고선 꽤나 스마트하게 일한다 생각합니다. 그곳에선 별 이유 없이 거대한 자아를 가진 사람들을 많이 볼 수 있었는데 그걸 지켜보는게 꽤나 고역이었습니다. 한때 캐릭터가 잘 나갔을 뿐이었는데 자신이 잘나가는줄 착각하고 이런저런 실수 하시는 분들이 있더군요. 진짜로 일하는 사람은 별로 없는 것 같아요. 전반적으로 기본이 부족한 회사였습니다.
223,더핑크퐁컴퍼니㈜,8544,관리자들이 대부분 꼰대임 왜 관리자들이 SNS하는지 모르겠음. 오글 맥스 교육쪽 여자들 텃세 심함
224,더핑크퐁컴퍼니㈜,8544,쓸데 없는 절차가 없는 만큼 체계도 부족 배울 수 있는 사수가 없어 스스로 적응하고 발전 해 나가야 하므로 초반에 어려움을 겪을 수 있다. 야근이 없진 않은 편이며 야근 수당을 지급하지 않는다.
225,더핑크퐁컴퍼니㈜,8544,입사하자마자 이런 것도 한다고? 싶은 일까지 시킴. 난생 처음 접하는 일 어떻게 하는지 물어보고 싶어도 그러기 어려운 분위기 (다들 너무 바쁘고 뭐든 알아서 하기에.) 본인 경우 이 곳에 다닌 후 성격이 완전 바뀌어버렸음. (부정적으로..) 야근은 많지만 수당은 1도 없었음. 인사팀에서 가끔 사내이벤트를 하는데 그거 준비할 시간에 사원들 멘탈관리나 고충해결에 신경썼으면.
226,더핑크퐁컴퍼니㈜,8544,"1. 정해진 프로세스 없음. 그냥 OO한 일 부탁드릴게요~하면 말하는 시점부터 그 일이 나의 업무가 됨. 대외적으로 보내는 이메일 양식부터 시작해서 기획안 작성/캐릭터 디자인/외주업체 선별/배우 및 성우 섭외까지 프로세스 일절 없음. (쓸데없는 문서 놀이 안해도 된다는 점에서는 장점일 수 있음)  2. 업무시간을 초과해서 일해도 야근 수당 없음. 특히 아동콘텐츠에 주력하는 회사로서 분기별로 엄청 바쁜 시즌이 있는데, 야근을 할 수 밖에 없는 구조. 그냥 회사에 있는 시간동안은 어떻게든 자기 일 다하고 빨리 나오는게 답.(야근시 저녁식사비 지원, 11시 퇴근 시 택시비 지원)  3. 개인당 담당하는 프로젝트의 양이 많음. 끝날라치면 다른 새로운 일이 휘몰아 침(×무한반복) 이를 직시하지 못하는 헤더의 문제인건지, 알면서도 어쩔 수 없으니 그냥 시키는 것인지는 모르겠으나 일이 너------무 많아서 인턴 외에 정시퇴근 하는 사람 아무도 없다고 봐도 무방. 다른 말로 워라벨이 전.혀. 지켜지지 않는다는 소리.  4. 고용 전환에 대한 전권이 한사람에게 몰려있음. 일하면서 항상 잊지 말아야 할 것은, 헤더는 항상 '시켜놓고 아무것도 모른다'는 것. 팀 내에 어떤 포지션이 더 필요한지, 어떤 콘텐츠를 밀고 나가야 하는지 인사이트가 없어서 헤더랑 일하는 방식이 맞지 않는다고 판단되면 잘림. 정규직 전환 여부는 진행한 프로젝트의 숫자/질과의 연관이 없음."
227,더핑크퐁컴퍼니㈜,8544,아직 안정화되지 않았고 체계가 명확하지 않다는 단점이 있다.
228,더핑크퐁컴퍼니㈜,8544,체계적인건 아닌 것 같다. 식대 없음. 직원 할인 없음.
229,더핑크퐁컴퍼니㈜,8544,"인턴으로 입사할 경우는 정규직 전환율 0에 수렴함. 가끔 아주 가끔 전환 되는 경우 있으나 기대안하고 다니는게 마음 편할것. 대학생 방학기간, 취업 전 알바 느낌으로 다닐 곳으로 경험 쌓기는 좋음 신입에겐 누구보다 가혹한곳. 경력직 이상의 실무를 바라며 자유로운 분위기로 자신의 아이디어를 내뽐낼수있을것으로 보이나 실상은 답정너, 윗사람이 생각하는 답을 찾아내야되는데 찾아 가는 방법은 아무도 안알려주고 사람 주눅 들게 만드는 최적의 꼰대들만 모여 있음 출근하는순간부터 감옥에 갇힌 느낌"
230,더핑크퐁컴퍼니㈜,8544,기억으로는 그 당시 근처에 먹을 곳이 많이 없었던 것이 좀 아쉬웠다. 그리고 직원분들이 인턴들에게 크게 관심이 많이 없었던 것 같다.
231,더핑크퐁컴퍼니㈜,8544,"수평적 기업 문화의 단점은 무임승차를 한다면 그 업무가 다른 사람, 또는 한 사람에게 몰리는 것이다. 직무간 경계 없이 다양한 경험을 할 수 있다는 게 때로는 양날의 검이 되기도 한다."
232,더핑크퐁컴퍼니㈜,8544,너무 많아서 쓰기도 힘들지만. 결국 최애들만 살아남아서 입만 터는게 회사의 목적인듯. 서비스에 대한 고민조차 하는시간이 없는것같음.  할말이 너무많다..
233,더핑크퐁컴퍼니㈜,8544,"단점은 많아서 번호순 나열이 필요함 1. 급여가 매우 적은데 야근수당, 식대지원 없음(구내식당 천원지원이 전부) 2. 팀바이팀이지만 야근 많은곳은 정말 많다 3. 인턴 정규직전환율 낮다. 전환해준다는 말믿고 속아서 지원하지 않길 4. 신입에겐 일을 배우기 힘든 환경, 왜냐면 여느 중소기업과 다를바없이 체계가 없기 때문, 또한 조직개편이 매우 잦다 5. 신입에게 요구되는 치열한 경쟁, 체계도 없고 교육도 제대로 안시키면서 입사후 얼마되지도 않았는데 성과 압박이 심함. 왜 그런지 의문이다 6. 회사에 맞는 관종력 가득한 인재가 아니라면 적응이 힘들다. sns에 집착하는 회사내 팀원이 대다수를 이룸"
234,더핑크퐁컴퍼니㈜,8544,일을 진행하는데 체계적이지 않음. 그래서 의사가 자꾸 번복됨. 윗사람은 별로 단점이라 생각하지 않지만 실무자는 죽어남. 가르쳐주는 시스템이 없어서 신입에겐 생존게임.
235,더핑크퐁컴퍼니㈜,8544,피해자에게만 깐깐한 인사제도 운영. 2018년도 사건에서 알 수 있듯이 피해자에게만 적용하는 깐깐하고 꼼꼼한 인사제도. 신입에게 세웠던 높은 기준을 자기들끼리 똘똘 뭉쳐 숨어 있는 오래된 직원에게도 적용하길 바란다. 피해자 뿐만 아니라 남아서 모든 것을 지켜본 임직원들의 정신적 스트레스와 박탈감도 상당하다.
236,더핑크퐁컴퍼니㈜,8544,"체계 없음, 업무 분장 잘 안됨, 안정적이지 않음, 잦은 조직개편, 복지가 적음"
237,더핑크퐁컴퍼니㈜,8544,"출퇴근이 자유롭다지만 늦게 오면 늦게 가는 분위기, 야근 수당 없음, 인턴을 많이 뽑는데 정규직 전환은 거의 안된다고 보면 됨. 정치질이 심함"
238,더핑크퐁컴퍼니㈜,8544,체계가 없다.. 대표의 마음대로 회사 전체가 왓다갔다 하는게 심한 느낌이 있음. 조직개편이 너무 자주 있어서 자리 이동도 자주 있다. 인턴을 너무 많이 뽑고 자르거나 계약직으로 돌리려는 경향이 있다.
