,company_name,company_id,review_text
101,더핑크퐁컴퍼니㈜,8544,"성공한 큰 IP가 있다는 것이 장점이자 단점이 되기도 하는 것 같다. 업무분담이 체계적이지 않아 본인이 맡은 업무만 계속해가다간 이직에 어려움이 생길 수 있음. 본인이 하기 나름이지만 안일한 생각으로 가만히 있다간 독이 될 수 있음. 사원들은 몰라도 각 장들의 정치질, 시기질투는 어마어마함. 그런거 신경 안쓰고 다니면 괜찮지만 한 번 그런 모습이 거슬리면 끝도 없이 혐오감이 들 수 있다. 그 사람들은 이제 이직할 생각도 없고 이직할 능력도 없어 그 안에서 먹고 놀자판. 나가려는 사람을 뒤에서 캐고 먼저 알고있을 앉아있을 시간에 사람들이 왜 나가려고 하는지 이유를 분석해보는게 더 낫지 않을까싶음. 인턴들을 대하는 태도가 저질이라는 얘기가 떠돌아 귀에 들어왔음."
102,더핑크퐁컴퍼니㈜,8544,"높은 퇴사율, 체계가 없음, 정규직 전환율이 낮음, 업무 범위가 명확하지 않아 서로 일이 미루는 분위기"
103,더핑크퐁컴퍼니㈜,8544,회사의 방향성이나 비젼이 잘 공유가 안됨. 일을 하는사람만 하고 안하는 사람은 안함.
104,더핑크퐁컴퍼니㈜,8544,복지제도 많지 않다. 회사가 벌어도 직원들과 나누질 않는다. 동아리 같다
105,더핑크퐁컴퍼니㈜,8544,"직원식당 밥이 맛이 없다. 한쪽 건물엔 직원식당도 없어서 식비가 많이 든다. 자유에 책임 못지는 사람이 많고 책임은 인턴들과 계약직들 물갈이 되는걸로 끝난다. 정직원 월급루팡들을 보면서 회사가 자본이 든든하다는걸 느꼈다. 회사오너가 질보다 영업에만 관심이 있는 편이며, 그런 자신의 경영마인드를 자랑스러워하는 듯 하다. 아동컨텐츠에 소명의식이 있는 사람이라면 이 회사에서 버티기 힘들거같다. 인사평가가 투명하지 못하고 비밀스럽게 진행되고 누가 어떤 평가를 받았는지 몰라서 뒷말도 많았다. 최근 블라인드에 카카오의 최악기업평이 올라와서 화제였는데 읽어보니 이 회사랑 많이 비슷했다"
106,더핑크퐁컴퍼니㈜,8544,주니어가 많다 보니 업무의 권한과 책임이 애매하며 체계가 없는 경우가 종종 있다
107,더핑크퐁컴퍼니㈜,8544,"야근수당 없음, 사내 정치질 심함(인턴/신입/고인물 할 거 없이 심함), 정규직 전환비율 적음(인턴으로 들어와서 정규직 되는 경우 매우 드물다), 경력직들도 퇴사율 높음, 서로서로 뒷담화/편가르기 엄청남, 업무 매너 거의 없음 등등등..."
108,더핑크퐁컴퍼니㈜,8544,본인이 하고자 하는 일이 명확하지 않다면 방황할 수 있다.
109,더핑크퐁컴퍼니㈜,8544,계약직으로 들어가기 때문에 안정적이지 못하다. 은근 꼰대같은 면들도 있다.
110,더핑크퐁컴퍼니㈜,8544,체계가 없음. 대외적으로만 열심히 기사쓰고 노력하는 느낌. 조직개편이 일년에 분기마다 하는 듯;
111,더핑크퐁컴퍼니㈜,8544,"면접보고 인턴되면 면접을 거쳐 수습이되고, 또 몇 개월 후 면접을 봐서 정규직이 되고, 정규직 수습을 거쳐 또 정규직 면접을 봅니다. 또한 정규직 전환보다는 계약직 연장을 은근히 권유하며 함께할 동료가 아닌 뽑아쓰는 휴지 정도로 생각하는 것 같습니다."
112,더핑크퐁컴퍼니㈜,8544,"면접보고 인턴되면 면접을 거쳐 수습이되고, 또 몇 개월 후 면접을 봐서 정규직이 되고, 정규직 수습을 거쳐 또 정규직 면접을 봅니다. 또한 정규직 전환보다는 계약직 연장을 은근히 권유하며 함께할 동료가 아닌 뽑아쓰는 휴지 정도로 생각하는 것 같습니다."
113,더핑크퐁컴퍼니㈜,8544,불안정한 고용 가시적인 성과를 내는 부서와 그렇지 않은 부서와의 차별 내향인의 무덤
114,더핑크퐁컴퍼니㈜,8544,팀별로 다르겠지만 사람들 소중히 생각하지 않는 팀장도 있는거 같애요
115,더핑크퐁컴퍼니㈜,8544,이끌어갈 시니어들이 부족합니다. 일의 프로세스가 규격화되어 있지 않고 전혀 모르시는분들이 컨펌하시는 경우가 많아 비효율적이게 일을 할 수도 있습니다. 물론 이도 팀바팀입니다.
116,더핑크퐁컴퍼니㈜,8544,"따라서 제대로 할 수 있는 일이 없다 평소 아부나 정치, 줄서기 달인이면 평생직장으로 손색없을지도"
117,더핑크퐁컴퍼니㈜,8544,일이 너무 몰린다 그리고 인센티브 많이 준다는 말에 속지말자 복지가 생각보다 너무 없다
118,더핑크퐁컴퍼니㈜,8544,체계가 진짜 없음. 자율출퇴근이라고 써있는거 출퇴근시간이 없다는거임. 야근하는게 너무 당연함. 매일매일 야근. 열심히해도 알아주지않음. 야근수당 당연히없음. 휴가무제한이지만 일이 너무많아서 쓸수가없음. 사람을 부품취급함. 인턴이랑 수습으로 사람 갖고놈. 이걸로 사람 쓰다버려진거 진짜 많이봄. 인턴연장했는데 설마 짜르겠어? 짜릅니다. 수습연장했는데 설마짜르겠어? 짜릅니다. 평 안좋은거 다 이유있습니다.
119,더핑크퐁컴퍼니㈜,8544,몇년이 지나도 체계가 안 생긴다. 사람 좀 뽑지 퇴사자 생기면 아무것도 모르는 저연차한테 인수인계 하고 돌려막기 하는식. 업무 로드 많이 발생함. 고인물화 심각함. 몇 고인물들은 밑에 직원들만 죽어라 일 시키고 지들은 일 너무 안함 (특히 경영지원쪽)
120,더핑크퐁컴퍼니㈜,8544,"뭔가 잘못되어도 책임지는 사람이 없고, 뭔가 잘 되어도 랩업하는 사람이 없다. 어떤 캠페인도 보고서가 필수가 아니라 프로젝트를 담당했던 사람이 나가면 모든 레거시가 그 사람과 함께 사라지는 경향이 있음. 신입들을 왕창 뽑지만, 멘토는 가르칠 리소스가 전혀 없어서 신입들은 무작정 헤맴. 센스 있는 사람들은 적당히 알아서 빠르게 배우는데, 센스 없는 사람들은 본인들이 일을 잘 못하고 있다는 것조차 몰라서 여기저기서 욕을 먹는다. 하지만 무엇보다 가장 문제는 인센이든 연봉이든 윗선만 챙기느라 아래에 있는 유능한 사람들은 말도 안되는 처우에 많이들 퇴사한다. 결국 남은건 일을 한번도 제대로 배워본적 없는 신입들과 실장급들... 전형적 모래시계 형태의 조직인데, 허리가 부러지면 결국 모래시계 무너질듯.."
121,더핑크퐁컴퍼니㈜,8544,야근에 대한 정당한 보상 없음. 문제가 있으면 프로세스 개선할 생각은 안하고 ‘인턴 뽑아서 시키자’고 결정하고 적당히 굴리다 짜름. 여초 텃세 엄청 심함. 롤모델이라고는 눈씻고 찾아봐도 없음.
122,더핑크퐁컴퍼니㈜,8544,연차가 무제한 이지만 눈치보임/성과압박 있음/ 연봉 상승률이 박함
123,더핑크퐁컴퍼니㈜,8544,"재택근무랑 유연근무제 빼면 좋은게 없다. 1.매년 연봉협상 기간을 앞두고 자소서보다도 더 많은 항목을 써서 개인리뷰를 내게하는데 평가하는 리더들이 읽어보는지?조차 모르겠다 열심히 쓴 사람이랑 대충 쓴 사람이랑 같은 등급 받았다고함 2.사원급은 리더를 평가할 수 없다. 대부분은 정치질하고 팀원 갈아서 자기 성과로 올리는 사람들인데 얘기할데가 없어서 답답하고 속상한일이 많이 생긴다. 3.아무도 맡은 프로젝트를 책임지려고 안한다. 심지어 팀장,실장,본부장조차도 총대매는 사람이없어서 엎어지는 일들이 많다. 4.프로페셔널한 전문가나 경력직을 찾아보기가 힘들다. 일하면서 물어볼데도 없고 실수하거나 제대로 못했어도 아무도 아는 사람이 없어서 그냥 넘어가는경우도 많다. 그러다 나중에 문제터지면 수습하는일이 많다 5.일열심히 하고 성과를 내는 직원들 보상해주지 않는다. 보면 일하는 사람만 일하는데 한명씩 다 탈출하는 분위기인 거 같다. 대충 남꺼 따라하거나 일 안해도 팀장이나 실장이 실무를 잘모르고 관심도 없어서 평가나 보상은 크게 다르지가 않다"
124,더핑크퐁컴퍼니㈜,8544,도망가세요. 멀리멀리멀리멀리 도망가세요. 여기서는 성장이 없습니다. 갈리다가 버려질뿐
125,더핑크퐁컴퍼니㈜,8544,"철저히 개인 플레이, 타부서 텃세 많음, 어린 친구들이 많아 기본적인 업무 개념이 없음, 상어가족 노래로 급성장하여 업무 무질서, 부서마다 부족한 리더들이 있음."
126,더핑크퐁컴퍼니㈜,8544,자율적이고 능동적인 기회가 많은 만큼 책임감이 많이 따르는 곳. 맡은 프로젝트에 대해 확실하게 열심히 임해야 함.
127,더핑크퐁컴퍼니㈜,8544,"썩은물에 빠진 대표와 그의 픽들. 픽된 부하들은 직원들 부려먹고 공은 지들아 다 챙겨감ㅋ 결국 그들만 챙겨받고 보상받는 신기한 구조ㅋㅋㅋ 조직장이라고 있는 인간들에게 배울게 전혀 없음. 능력없고 아부떨기만 배운 어린상사에게 당하지 말고 조금이라도 일찍 떠나는게 답... 일다운 일 배우고 싶으면 절대 걸러야할 곳...인턴들 특히 다 뽑아먹고 전환 안하기 일쑤.. 생각보다 썩은 정도가 아주 심함. 야근 은근 많이하고, 휴가 무제한도 완전 팀바팀인데, 자유출퇴근과 휴가무제한을 포장하여 주는 수당도 전혀 없는 양아치들.. 인사팀도 직원입장 생각 따윈 없고, 그저 대표의 꼭두각시라 인정사정 없음."
128,더핑크퐁컴퍼니㈜,8544,"회의가 너무 잦음, 휴가 무제한이라는 말은 좋지만 오히려 평균 연차만큼 못 쉬는 것같다"
129,더핑크퐁컴퍼니㈜,8544,배울 수 있는 기회가 적고 직원들끼리 경쟁이 더 급급한 느낌
130,더핑크퐁컴퍼니㈜,8544,"부족한 소통, 본부나 팀마다 다르겠지만 기준이 모호한 평가 제도"
131,더핑크퐁컴퍼니㈜,8544,대표를 비롯한 임원진이 일을 할 의지가 아예 없는 듯 함. 대표랑 친목질하고 스쿠버다이빙 같이 다니고 티타임하면 승진하고 아니면 일이나 열심히 해야함.
132,더핑크퐁컴퍼니㈜,8544,잘 모르겠네요.. 무언가 하나가 딱 단점이라기보다는 전체적으로 업무 탓에 과로하고.. 실적으로 눈치가 보이기도 합니다 이게 좀 많이 힘든 것같아요 영업직이 된 느낌 ^^..
133,더핑크퐁컴퍼니㈜,8544,상어가족은 단물이 언제 빠지려나 아직 유지는 되고있지만 새로운 ip를 내놓아야 할때가 된듯. 야망있는 분들한테 묻히지않게 열심히 어필하며 살아남아야 한다
134,더핑크퐁컴퍼니㈜,8544,"좋은사람들을 잘쓰지 못하는 구조, 사내 정치가 너무심하고 모두들 책임을 회피하고, 미루기만한다. 더이상의 새로움은 없는 회사."
135,더핑크퐁컴퍼니㈜,8544,쓸데없는 정치질이 난무함. 일부 여초 팀에서는 뒷말 작렬 소문 일파만파. 자율출퇴근이라지만 눈치주는 상사. 무제한 휴가정책은 일부에게만 한정된 보여주기식 복지.
136,더핑크퐁컴퍼니㈜,8544,"장점 빼고 전부라 뭐부터 얘기해야 할지 모르겠다... 우선 경영진의 무능. 운좋아서 뜬 회사라 능력있는 사람은 없고 대표한테 잘보인 사람은 편하게 다닌다. 편애도 그만큼 심하다. 인사 정말 별로다. 사람 쓰고 버리는거 심하다. 어린 인턴들 와서 희생당하고 버려지는거 보면 마음아프다. 업무 분위기며 회사 분위기 자체가 그냥 되게 별로인데, 외부에 홍보는 좋은척 포장이 너무 심하다. 출퇴근 자유, 휴가는 무제한이라지만 라인과 메일은 상시 대기상태라 워라벨이 잘된다고 하기는 어렵다."
137,더핑크퐁컴퍼니㈜,8544,"-위 내용 빼고 모두 다. 전문 인력이 없고, 경력직들이 입사 하더라도 회사 분위기 적응 못하고 많이 퇴사함. -사회생활 안해본 젊은 꼰대들 천지. (이런 태도로 다른회사 들어갔다면 영혼까지 털렸을텐데...) -인턴 채용하고 자르기의 무한 반복. -승진체계, 인센체계 전무. 승진하거나 이 회사에서 잘나가고 싶다면 매너따위 집어 치우고 무조건 동료든 선배든 후배든 짓밟아야 함. -텃새 심함. 입사동기있는 신입들은 그나마 모여서 이야기할 그룹이라도 형성되는데 애매한 시기에 입사한 신입/경력들은 그런거 없음. 새로 들어온 사람들 배척하는 분위기 심한편. -서로서로 경쟁을 미친듯이 붙임. 도와서 으쌰으쌰 하는 분위기가 아니라 서로 어떻게든 자기 실적으로 만드려고 물어뜯는 분위기라 앞에서는 서로서로 하하호호 웃지만 실제론 분위기 상당히 살벌함."
138,더핑크퐁컴퍼니㈜,8544,내부적으로 고인물들이 많고 일에 침체될 가능성이 있다.
139,더핑크퐁컴퍼니㈜,8544,시니어가 없어 주니어가 경력을 쌓기 어려우며 회전율이 빠르다.
140,더핑크퐁컴퍼니㈜,8544,진짜 단점 요목 조목 쓰는것도 귀찮다 체계가 없다 직원을 뭘로 보는지 퇴사자 주에 1-3명은 꼭 나오는듯
141,더핑크퐁컴퍼니㈜,8544,"알아서 해야 하는 분위기, 사수가 따로 없음(팀바이팀이지만 대부분 없음), 1년차에는 업무 외 시간에 할애해서 신입 발표(ppt)와 신입 영상을 준비해야하고 이벤트가 좀 많음(즐기면 괜찮지만 퇴근하면 쉬고싶음), 인사팀의 업무가 좀 느리신듯"
142,더핑크퐁컴퍼니㈜,8544,인턴들은 그냥 쓰고 버려진다고 생각하시면 됩니다. 만약 본인이 그 팀에서 다른 인턴과 함께 일하고 있다. 이는 둘 중에 한 명은 무조건 잘립니다. 인턴이라는건 직무 경험이 없는 갓 대학을 졸업하거나 다니고 있는 학생들인데 이 들에게는 본업을 바로 시킵니다. 본인들의 본 업을 인턴에게 서포트 해달라 요청 하는것이 아니라 인턴들에게 먹이를 찾아와! 하고 등을 떠미는 격이죠. 본인은 약육강식의 세계에서 잘 살아남는 편이다. 기가 세다. 뭐라고 아무리 주변에서 후려쳐도 괜찮다! 하시는 분들은 잘 맞을거예여. 다만 그 반대 성향의 분들이라면 그냥 좋은 경험 했다 하고 인턴 수료에만 집중하세요.
143,더핑크퐁컴퍼니㈜,8544,체계 없이 산만하다 복지가 거의 없다 이벤트를 위한 이벤트가 많지만 소속감을 주는 이벤트이기 보다는 소외감을 느끼게 한다
144,더핑크퐁컴퍼니㈜,8544,체계화가 덜 된 과정에서 변동성이 잦고 이슈가 빈번히 발생하여 적응하고 후반 처리해야 할 일이 자주 생김. 한사람이 a부터 z까지 맡아야하는 경우가 많아(예-타사 인턴급 업무) 업무량 많은편.
145,더핑크퐁컴퍼니㈜,8544,정치질. 실제로 열심히 하는 것보단 열심히하는 것처럼 보이는 게 더 중요한 곳
146,더핑크퐁컴퍼니㈜,8544,"고인물과 정치질이 난무함 실무경험없거나 짧은 사람, 관련지식도 없는데 아는척하는 사람들이 관리와 컨펌을 함 ."
147,더핑크퐁컴퍼니㈜,8544,"주먹구구식으로 이루어지는 업무가 많습니다. 위에서 끌어주는 사람이 매우 부족하고, 일을 직접 하면서 배워야 합니다. -님 문화로 직급이 존재하지 않으나 그렇기에 신입이라도 신입답지 않게 일을 해야합니다. 사람을 뽑는 과정에서 처음에 공지되지 않았던 인턴,수습 연장 을 제안하기도 합니다. 뭐 제안이지만 그냥 강제로 해야겠죠. 인력 관리 측면에서 문제가 많아 보입니다.  사내 정치가 극심하고, 경영진이 갈대같습니다. 이랬다 저랬다 갈팡질팡하면서 회사의 방향성을 제대로 잡지 못해서 아래에서는 헛수고하는 일이 많습니다."
148,더핑크퐁컴퍼니㈜,8544,"하루에 한 번씩 퇴사 문자가 와서 내가 제대로된 회사에서 일하는게 맞는지 현타올 때가 있음 정규직 전환이 아니라 '연장' 으로 될 확률도 높기 때문에 정규직 전환문제로 사람 진빠지게함 4. 겉모습은 즐거워 보이지만, 속으론 다른곳으로 탈출을 꿈꾸는 이상한 회사 5. 채용 및 인사평가가 주관적이고 제한적인 구조 6. 팀에 따라 업무 강도가 매우 차이남 (어떤 팀은 하루에 15시간씩일하고 어떤 팀은 대부분 칼퇴) 7. 소통을 중시한다면서 서로 눈치보느라 소통을 하기 힘든 구조, 이에 대해 팀장은 관심이 없거나 나몰라라함.."
149,더핑크퐁컴퍼니㈜,8544,"팀 간 소통 안됨, 인사 기준 주관적(내 사람들 만들고 챙기기), 잦은 조직개편, 경력직들의 무덤"
150,더핑크퐁컴퍼니㈜,8544,"1.점심식사에 애로사항이 많다. 일단 식대 지원이 없다시피 하다. 구사옥 1층에 위치한 이탈리안 레스토랑에서 점심을 제공하는데, 딱 1000원 할인해준다. 게다가 밥이 너무 맛이 없어서 매일 먹기는 힘들고, 인근에 괜찮은 식당도 없다. 그리고 신사옥에는 그런 식당마저도 아예 없기 때문에 밖에서 사먹어야 하는데, 주변 식당들이 하나같이 비싸서 매일 이용하기에는 심히 부담스럽다. 그래서 많은 분들이 직접 도시락을 싸들고 다닌다.  2.마땅한 휴식공간이 없다. 건물 자체가 크기가 작아서 쉴 곳이 좁은 옥상과 사무실 내 공용테이블 뿐이다. 본인이 비흡연자라면 옥상마저 피하게 될 것이다. 그리고 사내카페 메뉴 가격이 저렴하지 않다. 그냥 중형 프렌차이즈 가격이다.  3.부서별로 차이가 있겠지만 인간관계 스트레스가 특히 큰 부서가 있다. 나는 내가 있던 부서에서 인간적인 스트레스는 겪지 않았지만 특정 부서에서는 인간관계에서 오는 스트레스가 큰듯하다. 사적인 자리에서 만난 타부서의 동료직원들이 해당 문제로 눈물 흘리는 것을 봤다.  4.아기상어는 이 회사의 알파이자 오메가이다. 아기상어라는 콘텐츠와 이를 전담하는 특정 부서가 올리는 성과에 대한 의존도가 매우 큰 것으로 보인다. 즉, 아기상어가 휘청하면 회사도 휘청한다. 후속 콘텐츠를 계속 만들어내고는 있지만 솔직히 아기상어만큼의 파급력을 불러오는 콘텐츠는 없다시피하기 때문에 장래가 마냥 밝지만은 않아보인다.  5.의외로 야근하기 좋은 환경. 유연출퇴근제+연 2회의 인사평가에서 비롯되는 성과 관리에 대한 암묵적인 압박으로 인해 자발적 야근이 잦다. 그러다보니 늦은 출근, 늦은 퇴근을 반복하는 올빼미족이 돼버린 사람들이 많다.  6.복지들이 효용성 없게 느껴진다. 예를 들면 아홉수 결혼 보너스 지급... (29,39세에 결혼하면 보너스 지급;;), 회사에 단 한 대뿐인 미니버스 대절 등."
151,더핑크퐁컴퍼니㈜,8544,"프로젝트를 보고하는 1인에게 모든 공이 돌아가므로 모두가 단기적인 성과에 목 메고, 서로의 밥 그릇을 탐하게 된다. 불투명한 소통 구조로 소수의 특정인 사이에서 결정된 내용을 모두가 알고 있길 바람."
152,더핑크퐁컴퍼니㈜,8544,야근 많음 당연 야간수당 없음 그냥 일 엄청 많음 그래놓고 야근하면 야근 왜 하냐고 ㅋㅋ 전문성을 기르려고 하지마세요 온갖 잡일은 당신 몫 디자인을 하고 싶다면 다른 회사 가세요 유아 타겟이라는 명목 하에 완성도 개나 줘버린 디자인 모든 회사가 그렇겠지만 높은 분들이 뒤에 모여서 평가를 핑계로 뒷얘기 마니함^^ 들키지나 마시길 밥 먹듯이 하는 조직개편
153,더핑크퐁컴퍼니㈜,8544,무제한 휴가라 하지만 무제한으로 쓸수 없다 정말 다양한 일을 해야한다... 일을 배울 만할 사수가 없다
154,더핑크퐁컴퍼니㈜,8544,"전체적으로 소통이 안됨, 무슨 일이 생기면 서로 떠넘기거나 욕하기 바쁨, 전체적인 업무 효율이 떨어지는 느낌"
155,더핑크퐁컴퍼니㈜,8544,조직개편이 너무 많다. 물론 필요에 의해서겠지만 적응하기 힘들수도. 조직개편+프로젝트에 참여하면서 신입은 많은 일을 해볼수 있어서 좋겠지만 경력직한테는 별로 어필되지 않을 부분인듯. 팀바팀이 상당함.
156,더핑크퐁컴퍼니㈜,8544,스타트업이기에 체계적인 온보딩 교육은 없으나 의지 및 커리어 욕심이 있다면 물어보고 배울 수 있음
157,더핑크퐁컴퍼니㈜,8544,"전문 인력이 전무하며 이곳에서 사회생활을 시작해 연차가 쌓인 젊은 리더들과 신입, 그외 일부 생존한 경력직이 있음 일부 팀들을 보면 소꿉장난하는 느낌을 받을수있음. 조직개편이 잦고 대부분 납득하기 힘든 인사이동/ 승진이 많음. 공공연한 사모임에서 조직개편이 이루어지며 성과와 관계없이 마음에 드는 사람은 없는 자리도 만들어서줌. 외부에 비춰진 이미지와 달리 눈에보이지않는 신분제. 성실하게 성과를 만들어가면 바보되는 회사"
158,더핑크퐁컴퍼니㈜,8544,1. 팀 내의 협업보단 서로간의 경쟁을 원하고 경쟁해서 살아남는 구조다. 성과를 지나치게 언급하며 경쟁을 부추긴다. 2.결국 제작하는 사람들이 제일 힘든 구조 3. 타 팀과 협업하려면 커뮤니케이션으로 인해 일을 거듭해서 해야하는 경우가 많다.
159,더핑크퐁컴퍼니㈜,8544,"일하는 사람 회사 전체에서 한손에 꼽을 정도고 나머지는 싹다 정치질만 하기 바쁨. 인터넷에 있는 악덕기업이 한다는짓 전부 다 겪을수있음(야근 눈치, 내가 완료한 일감 가로채기, 일보다 정치 우선, 연차 눈치(본인들은 맘껏 씀), 특정 팀만 오구오구하기(일을 잘하는팀 아님), 사바사바 잘하면 연협 좋고 일만하면 연협 최하 등등) 내가 여기서 겪은거의 절반도 안쓴거임. 핑크퐁 아이피랑 기사에서 보이는 언플에 속지마라."
160,더핑크퐁컴퍼니㈜,8544,회사에 돈은 많지만 그게 직원들한테 돌아오진 않는듯. 사내 정치질이 많은 것 같고 휩쓸리기 쉬워보인다. 휴가 무제한이라고는 하지만 눈치보며 잘 써야하고 직급에 따라 사용빈도 차이가 커보임.
161,더핑크퐁컴퍼니㈜,8544,개발중인 콘텐츠가 많고 해외로 진출하려다 보니 업무가 생각보다 매우 많음
162,더핑크퐁컴퍼니㈜,8544,1. 부서 간 업무가 주먹구구식이며 업무 프로세스가 문서화 되어 있지 않다.  2. 대표에게 잘 보이면서 소위 정치질하는 사람이 몇몇 있다.  3. 사람을 쉽게 뽑고 쉽게 내보낸다. 퇴사율이 높아서 새로 채용하고 업무 교육하는 데에 너무 많은 리소스가 낭비된다.
163,더핑크퐁컴퍼니㈜,8544,중요한 업무도 신입이 책임져야 하는 상황 아무것도 모르는 사원한테 회사에 큰 영향을 끼칠 수 있는 일까지 시킴 사람을 쓰고 버린다는 이야기가 많음
164,더핑크퐁컴퍼니㈜,8544,유일한 복지인 무제한 휴가는 팀바팀으로 사용할수있는 분위기
165,더핑크퐁컴퍼니㈜,8544,Npc와 각 팀 소통 부재로 인턴들만 억울했던 경험이 있음
166,더핑크퐁컴퍼니㈜,8544,장점일 수도 있지만 확실하게 내려진 지시사항이 없으면 다소 혼란스러울 수 있겠다는 생각이 들었습니다.
167,더핑크퐁컴퍼니㈜,8544,열정페이. 두서없고 체계없음. 인력 턴오버 매우 심함. CEO가 모든걸 다 결정함. 사내정치
168,더핑크퐁컴퍼니㈜,8544,너무 자율적임 ? 일부 직군과는 소통이 어려움 (해당 부서가 업무가 많고 복잡할 때 요청사항 대응이 느림)
169,더핑크퐁컴퍼니㈜,8544,"인턴을 뽑는 이유가 회사에 쓰임있는 인재로 키우려기보다 그냥 뽑고 나서 뒤에서 지네끼리 얘기하고 결과로 뒤통수 침. 핵심인재라고 몇명을 치켜세우는 모습. 대표 자체가 인기 있는 ip에만 집중하는 듯한 모습이 보임.  정직원 전환의 기준이 매우 모호함 여초 특성상 비위를 잘맞춰야함  일하는 사람, 부서만 일하고 꿀 빠는 부서 들어가면 정치질만 잘하면 됩니다. 정치질 오지게 함 ㅋㅋ 여러 회사 다녔는데 여기 진짜 부바부지만 정치질 너무 심함 (특히 여자만 있거나 그 수가 압도적인 부서)"
170,더핑크퐁컴퍼니㈜,8544,구성원들이 일관된 기업 문화를 가지고 있지 않다. 팀마다 분위기가 너무 다르다. 정치질이 심하다. 조금만 일하다 보면 인간관계에 실증이 나서 회사에 대한 자부심이 사라진다. 주니어만 가득해서 일을 체계적으로 끌고갈 사람이 없다. 중간관리자 부족
171,더핑크퐁컴퍼니㈜,8544,탈출만이 답... 이 회사 망하길 두 눈 시퍼렇게 뜨고 보고 있는 사람들이 많다 그 이유는 제발 반성 좀 하시길
