,company_name,company_id,review_text
0,데이타메이션,5453,"직원들 월급을 계속 밀리고 결국 파산함, 사무실 환경이 매우 안좋음"
1,데이타메이션,5453,체계가 전혀 없는 중소기업 그것을 보완하려는 의지도 없는듯함 놀고 있는 직원도 있음 커리어를 위해선 모르겠음
2,데이타메이션,5453,1. 체계가 많이 부족합니다. 2. 회사 재정상황이 좋지 않습니다. 그래서 임금문제가 자주 발생했습니다. 3. 직원들이 서로에게 관심이 너무 없어서 장점이라기보단 단점같습니다. 4. 사무실의 환경이 다른 회사에비해서 부족합니다. 5. 미래에 대한 안정성이 부족합니다.
3,데이타메이션,5453,1. 체계가 없음 2. 임금체불이 빈번하게 일어남 3. 직원들끼리 교류가 없음
4,데이타메이션,5453,"직장 내 괴롭힘, 권위의식, 사내 분위기 안좋음, 하는 일이 없으니 본사에서 밥이나 축내고 자기 라인 사람들 모아다가 편가르기하고 담배 핀 다고 매번 자리를 비움. 사무실 내 윽박지르기, 전화 문자 안받음"
5,데이타메이션,5453,"1. 제일 중요한 월급이 밀림 2. 회사 안에서의 분위기, 환경이 별로 좋지 않음 3. 부서별로 환경이 다르니까 친해질 일도 별로 없음 4. 연봉에 식대 포함되서 작성하게끔 함 5. 점심시간이 1시간 30분이라고 했지만 잘 지켜지지 않음 6. 재정이 그리 좋지 않음->월급이 밀림->재정이 좋지 않으니 회사 관리도 잘 안됨 7. 외주인력이 너무 많음"
6,데이타메이션,5453,"자체 인력 보다는 외부 인력 수급이 많고, 솔루션에 대한 이해가 높은 개발자가 적음. 회사 재무상황이 좋지 않아 급여가 밀리는 경우가 있음. 솔루션이 있다해도 결국 각 금융사 특성에 맞춰 SI성 개발로 진행됨."
7,데이타메이션,5453,파견근무가 많다. 지방으로 장 단기 파견도 있으며 거부권이 없다보면된다. 나아니면 할사람없다
8,데이타메이션,5453,"개발쪽 인원이 홀대받는 느끼며, 전체 인원중 필수라 여기는 사람들만 대우 받으며, 그 이외의 직원들은 보통이거나 약간 처우를 제대로 받지 못하는것 같다."
9,데이타메이션,5453,퇴근 후나 주말에 오는 연락. 업무 시간에 할 이야기를 평일이고 주말이고 밤 9시 10시에 함. 주말 밤 10시에 줌 키고 비효율적으로 한 얘기 또하고 또 하고 문서나 메신저로 필요한 내용만 전달하면 되는걸 퇴근 후 줌으로 함.
10,데이타메이션,5453,보너스 전혀 없음. 본사 사무실 관리 안 된 느낌. 주말에 업무지시함. 굳이 주말에 말할 필요 없는 월요일에 할 업무지시를 주말에 연락함. 이게 모든걸 상쇄할정도로 가장 큰 단점인듯.
11,데이타메이션,5453,신입을 경력이라고 속이고 파견보내는 회사. 그러다 문제 생기면 나몰라라. 신입 돌려막기의 악순환
12,데이타메이션,5453,체계적이지 못하고 관리가 안됨 급여가 밀리는 경우가 있음
13,데이타메이션,5453,개발회사인지 컨설팅회사인지 개발자인지 컨설턴트인지 도무지 전문성이 없음 사업 수행능력 부족
14,데이타메이션,5453,휴식 시간이 적고 일한 만큼의 충분한 보상이 이루어지지 않는다.
15,데이타메이션,5453,야근 많음. 제안서 작성 많음. 프로젝트 땜빵이 많음. 내가 하지않은 업무를 책임져야하는 경우도 있음 월급이 밀림!!
16,데이타메이션,5453,경영악화에 따른 문제밖에 안떠오르네요. 인력관리를 잘못해서 그런거 같은데 지금은 개편이 좀 됬으려나 모르겠네요.
17,데이타메이션,5453,개발을 하기위해 각자 맡은일을 하고있으나 그로인해 서로간의 교류점이 좀 적다
18,데이타메이션,5453,가장 큰 문제는 무리하게 사업을 너무 많이 벌리고 수습을 못해서 임금체불이 생긴부분인것 같습니다.
19,데이타메이션,5453,"회사 경영 악화로 인한 월급 미지급, 아무리 말해도 듣지않는 대표님 경영방식"
20,데이타메이션,5453,급여가 잘 안 나옴. 운영진이 IT를 잘 몰라서 IT에 대한 방향설정을 못 함.
21,데이타메이션,5453,"월급이 너무 밀립니다. 실력없는 인간이 말로만 때우고 지가 한거마냥 떠들어 대고 다닙니다. 회사에선 이빨 잘까는 인간 대우해 줍니다. 인사같은 기본 사회생활 매너도 없는 사람들이 있으며 대표가 편애하는 무리들이 있습니다. 프리의,프리에 의한, 프리를 위한 회사입니다. 프리는 월급 안밀려도 정직원들은 밀립니다."
22,데이타메이션,5453,입이 아프다. 안좋은건 다 갖추고 있으며 하지말아야할짓은 다 한다. 최우선적으로 급여 미지급이 가장 크다.
23,데이타메이션,5453,"경영이 악화가 지속되었지만, 많이 개선됨. 하지만 더 개선되었으면 한다."
24,데이타메이션,5453,내가 이 회사 소속이 맞는지 의문이 들며 수월하게 프로젝트 수행만함 정규직이지만 프리랜서 같은 느낌 회사 경영을 어떻게 운영하는지 모르겠지만 월급 밀리는 일이 잦은 편이며 이 때문에 퇴사하는 사람의 수가 많음
25,데이타메이션,5453,월급이 나와야 일을 하죠 기존 인력도 일 못하고 관리자도 엉망이고...
26,데이타메이션,5453,프리랜서에게 돈을 더 많이주며 정규직보다는 프리렌서를 위한회사임
27,데이타메이션,5453,인사상 남녀차별있었습니다 또한 월급받기가 진짜 힘들었습니다.
28,데이타메이션,5453,프로젝트에 프리랜서만 잔뜩 투입 후 문제 발생하는 경우가 많음. 그런 경우 정규직 투입해서 땜빵처리...
29,데이타메이션,5453,뒷말이 많으며 서로 까기 바쁘고 실력보다는 이빨 잘까는 사람이 대접받음 대표가 편애하는 직원들이 있어 그들끼리 사적인 모임이 있음 도저히 상식이 안통하는 회사
30,데이타메이션,5453,월급안나오고 개발자 무시하는 회사 솔루션을 스캐너로 복사하고 코딩을 위드처럼 입력하는걸로 착각하는 경영자 영업들이 있어서 개발자로 가는것은 매우 비추입니다
31,데이타메이션,5453,대표가 SI 사업에 대한 이해가 전혀 없으며 프리랜서와 무능한 PM으로 사업을 수행함으로써 회사는 항상 어려운 상황임
32,데이타메이션,5453,급여가 도대체 왜 밀리는지 어떻게 관리하는지 어떻게 관리할 것인지 파악 하는게 필요 할 것 같습니다.
33,데이타메이션,5453,비효율적인 업무처리와 프리랜서를 통해 프로젝트 진행되어 사업자체가 어려워지는 경우가 많음
34,데이타메이션,5453,"정산이 느림, 돈을 늦게줌, 몇달씩밀림, 나눠서주기도함.."
35,데이타메이션,5453,구축 프로젝트를 욕심내서 수주하고 AML은 1도 모르는 외주 PM 데려다가 역시 AML 잘 모르는 프리랜서 개발자들 데려다가 AML 조금 아는 정규직 개발자와 컨설턴트를 갈아서 프로젝트를 진행합니다. 제 때 안 끝납니다. 4개월 짜리 프로젝트가 1년 가기도 부지기수.
36,데이타메이션,5453,2018년도부터 급여가 밀리기 시작하더니 올해 초부터는 아예 지급이 안됨 나는 진정서 넣고 몇개월만에 밀린급여를 받긴했지만 이제는 고용노동부에 임금체불을 신청해도 임금 및 퇴직급을 받기 어려운 상황인 듯 밀린 임금을 달라고 한게 회사 입장에서는 괘씸하께 느껴졌을지도 모르나 업무 상 쓴 개인경비를 몇번이나 달라고 했음에도 떼먹는 건 좀 아닌듯
37,데이타메이션,5453,밤샘이 일상입니다. 건강이 나빠집니다. 직원복지가 좋지 않습니다. 사장님이 소리지르는 걸 볼 수 있습니다. 체계가 없어 일을 배우기 어렵습니다.
38,데이타메이션,5453,차부장급들이 가성비가 떨어져 과장 대리급보다 못하고 연봉만 축내는 사람들이 많음.
39,데이타메이션,5453,"대표/임원진의 구식 마인드. ""뭐? 대리하나 빵꾸났다고? 주임 둘 넣으면 돼 ㅎㅎㅎ"" 라는 주먹구구방식의 경영. 게다가 프리랜서들 뒤치닥거리 하느라 본사 정직원들은 하나둘씩 죽어남. 이윽고 프리들이 사고치고 빤스런하면 본사직원들이 그대로 이어받음 -> 무한반복  아참, 급여 몇달동안 안나와도 일상생활 가능하신분만 입사하세요^^"
40,데이타메이션,5453,월급밀림 많이밀림 정규직보다 프리랜서 인력을 더 우선시 함
41,데이타메이션,5453,월급이 너무 밀리고 회사에 팀장이라 할사람이 없음 오래다닌 사람들은 다 그만둠
42,데이타메이션,5453,"- 연차 자유롭게 사용가능하나 프로젝트 투입시에는 사용이 어려움 (그런데 프로젝트를 시작하면 계솓 지연되어 언제 끝날지 알수없음.. 고객사에서 엄청 눈치가 보이고 욕을 잔뜩 먹음) - 회사 분위기가 자유로우나 체계가 없음 (내 팀장님은 누구고 나는 어느 부서 소속인지.. 팀장이 없는 팀, 팀장이 관련도 없는 부서의 사람으로 막 배정되는 팀 등 알 수 없는 조직체계로 부서가 잘 돌아갈리가 없음) - 월급이 밀림 (작년 중반기를 넘어선 순간부터 급여가 계속 밀리기 시작함. 처음엔 한달 두달 지연되더니 세달이 넘도록 지연되기도 하고 이젠 하도 지연이 되니까 언제 준다는 공고도 하지 않고, 언제 나오는지 경영관리부에 물어봐도 연락을 받지않거나 답도 제대로 안해줌. 재직자한테도 이런데 퇴사한 사람들한테는 더 함..) - 회사를 신뢰할 수 없음 (회사에서 하는 얘기중에 지켜지는 것이 거의 없음. 급여를 언제 준다 언제 준다 회사가 언제쯤 정상화 될거다 이런 얘기들이 자꾸 번복됨. 사장님의 말을 믿을 수 없음. 프로젝트와 기술적인 면에서도 회사를 신뢰하기 어려움)"
43,데이타메이션,5453,월급이 자주 밀리는 듯 하며 저녁식대는 제공이 되지만 점심식대는 제공되지 않음
44,데이타메이션,5453,월급밀림...* 100 과장급이상 부터 업무 폭탄 일이 몰리는 사람만 몰림 일없는 사람은 놀다가 퇴근 프리랜서가 갑 정규직 평가 오지게 함 체계가 없어 똥치우는데 급급하다
45,데이타메이션,5453,"임금체불, 퇴직금 체불, 상여금X, 개발 체계 엉망 등."
46,데이타메이션,5453,제 때 프로젝트를 끝내지 못해 미수금 및 새는 돈이 상당히 많아 직원 및 하청업체에 미지급금이 상당합니다.
47,데이타메이션,5453,급여가 밀린다. 프로젝트 인력만 투입시켜놓고 신경 안쓴다.
48,데이타메이션,5453,보수적인 업무 태도 발전이 없음 뭐하는지도 모르겠음 회의만하고 나아지는게 없음
49,데이타메이션,5453,월급 지연 별다른 개발자 교육 시스템 없음 알아서 성장해야 함
50,데이타메이션,5453,"급여 밀리는 것이 가장 크다. 고정으로 일하는 프리랜서들이 있는데, 이 사람들이 업무경험은 많다고 하지만 정말 잘 해서 여기 있는 것인지 의심스러움. 그나마 큰 사고는 안 치기에 다행이라고 해야 하나. 아무튼 이 사람들이 정규직에게 극도의 박탈감을 느끼게 해줌. 급여도 정규직의 두 배 이상은 받을텐데, 월급은 정규직이 더 밀림. 그나마 이 고정프리들은 나은 편인데, 왜냐하면 일 못하는 프리 데려다가 플젝 망치고 정규직으로 때우는 것이 일상기 때문. 사고친 사람 다시 데려다가 또 사고치게 하는 것이 이 회사 고유패턴임."
51,데이타메이션,5453,"작년 하반기부터 회사 경영악화가 계속되서 월급이 지속적으로 밀리고있다. 월급이 밀림으로써 직원들의 사기가 저하되고 기존에 일하던 사람들이 많이 나가 일 할 사람이 부족하여 프로젝트를 수주해 와도 더 높은 임금의 프리를 고용하거나 타 회사와 컨소를 하기때문에 얻는 수익이 적어져 월급이 또 밀리는 악순환이 반복된다. 프로젝트를 제대로 완료하지 못하고 기간내에도 끝내지 못해 연장되는 경우가 많다. 회사에 기본적으로 교육체계가 부족하고 들어온지 얼마 되지 않는 사람을 아무것도 모르는 상태로 프로젝트에 투입시켜 책임을 지게하기때문에 일을 제대로 배우는 것이 힘들다. 솔루션 업체라고 하지만 솔루션에 대해 제대로 알고있는 사람이 드물어 어떤식으로 진행해야되는지 아는 사람이 드물다. 프리가 투입되어 수행되는 프로젝트가 연장이 되거나 제대로 되어있지 않으면 그 처리가 프로젝트를 수행한 프리가 아니라 정직원에게 돌아오기때문에 정직원은 충분하지 않은 시간안에 처리해야되는 일과 책임만 많아지게 된다(그렇다고 정직원에 대한 대우가 좋다고는 하지 못함) 개발 프로젝트에 컨설팅이 들어가 배우지도 않는 일이나 컨설팅이 수행하지 못하는 일을 하게 하고, 직급이 낮은 직원을 넣어 말도안되는 책임을 지게 한다. 타 부서에서 인력이 부족하거나 미루는 일을 컨설팅부에서 수행하고 그게 당연하다고 생각한다."
52,데이타메이션,5453,"대표가 매일 업무 대면보고 받음. 상당히 비효율적인 구조. 체계라고는 찾아볼수 없으며, 직원을 소모품 취급함 대표 말한마디에 너무 많은 의사결정이 바뀌는 정말 이상한 회사"
53,데이타메이션,5453,월급이 밀려서 생활이 불가능합니다. 최악의 단점입니다.
54,데이타메이션,5453,"월급 밀림, 컨설팅부서 꼰대마인드, 직원관리 부실, 배울 사람 없음"
55,데이타메이션,5453,팀원 팀장 부장 이사 상무가 AML에 대해 모르고 구축 경험이 없는데 프로젝트를 수주하는데 정상적으로 종료 안되는게 당연함 회사가 전문성이 없는게 문제인데 대표는 고객사가 문제라고 생각함 대표가 회사를 망하게 하고 있고 직원들 월급 퇴직금도 못주고 실정임 월급을 안주니 직원들이 1년을 못버티고 퇴사를 하는데 개인적인 욕심이 많타고 판단 연봉인상이 크다라는 말로 월급 못받아도 조금만 버티라고 설득함 정작 아무것도 없는회사임
56,데이타메이션,5453,"1. 관리 및 조직체계 부족 - 전 조직이 구먹구구식으로 일을 처리함 - 우리팀이 해결할 업무가 아닌데도 대신 처리하는 경우가 많음, 이 것이 잘못됬다고 느끼는 윗선이 없고 하나같이 당연하게 생각함  2. 경영악화에 따른 임금 지연 및 체불이슈 - 작년 상반기부터 계속 악화된 자금현황으로 급여가 1년 넘게 지연되고 있으며 현재 2~3개월치 급여 미지급 상태(퇴직금은 말할 것도 없음) - 경영관리부 잘못은 아니나 급여 관련해서 직원들이 물어보면 '모르겠다' 또는 답을 하지 않음. 오히려 떼먹을 것도 아니고 좀 늦게 줄뿐인데 왜이렇게 자꾸 물어보냐는 마인드를 가지고 있음 - 퇴사를 하는 순간 지급 순위는 최하위로 떨어짐 - 급여가 수차례 지연될 경우 안내 공지는 빠르면 지급일 전날 저녁 8-12시, 평균 당일 오후에 안내함 최소한 점심값, 교통비는 지급하면서 일을 시켜야되는데 그럴만한 형편도 못되서 직원들이 알아서 대출받고, 지인에게 빌려서 생활함 - 개인경비는 아예 지연공지도 하지않음 - 급여명세서를 못받은게 몇개월째인지도 모르겠음, 급여는 제때 못줘도 명세서는 주는게 맞는데 그런 기본적인것도 안챙겨주면서 직원들에게 희생만 강요함  3. 새 프로젝트 수주율 낮아 신규 자금 확보에 어려움이 있음, 곧 급여 지연으로 이어짐 - 고객사에 평이 좋지않아 수주율이 낮음 - 기존 사이트의 중도금, 잔금으로만 자금 이슈를 해결하기엔 턱없이 부족하나 대표이사는 상반기안으로 안정화가 될 것이라는 말만하고 궁극적으로 이 문제를 해결할 능력과 마음이 없음, 결국 급여 지연 안내 횟수만 증가 중  이 외 수많은 단점이 있으나 전부 기입하기 어려움"
57,데이타메이션,5453,계획을 벗어난 실천력... 언행불일지... 다른듯 아닌듯
58,데이타메이션,5453,"급여가 밀림. 퇴직금도 아직 못받음 실무를 할 수 있는 중간급의 관리자를 뽑는게 아닌, 입으로만 일하는 이사, 상무급의 인사들을 채용함. 실질적으로 하는것도 없음. 프로젝트를 하청주는 업체들도 일을 못함. 프로젝트 끝나면 이슈가 많고 이럴꺼면 뭐하러 하청을 줬는지가 의문임. 하청업체가 유지보수를 하지도 않음. 프리랜서들도 검증되지 않은 사람들을 계속해서 쓰다보니 프로젝트가 망함"
59,데이타메이션,5453,승진이 힘들고 급여가 밀릴 수 있음 또한 대표님 위주의 운영으로 회사 경영 약화가 지속됨
60,데이타메이션,5453,월급이 밀리는게 가장 큼 체계가 잡혀있지 않음 신입들은 알아서 스스로 배워야함
61,데이타메이션,5453,수많은 단점이 있지만 무엇보다 단점이 있다는 것을 스스로 모르는 회사예요. 또한 분위기가 상막합니다. 직장인으로서 가질 기본 자세가 안된 사람들이 좀 있어 직장생활하기 불편해요
62,데이타메이션,5453,"솔루션이라는 단어는 기업과 임직원이 충분한 역량을 가지고 있을 때 프로젝트에서 활용이되고 기업적 가치를 보유할수 있습니다. 데이터메이션은 여러 솔루션을 보유하고 있고 AI 시장에서 선두하고 있다고 하지만 실제 구축 경험 부족, 개발 인력 부족, 사업 관리 인력 부족 문제등이 있습니다. 무분별한 사업 수주 후 영업과 프리랜서로 풀어가겠다는 생각으로사업 수행을 하고 문제가 있으면 고객이 해결해야된다고 협박과 버티기로 해결하시는 일은 그만 하시기를 권고 드립니다. 내부적인 리스크를 먼저 해결하시고 사업을 하시기 바랍니다. 솔루션은 제품이 아닌 기업의 역량입니다."
63,데이타메이션,5453,내부팀들이 전문지식이 없음 절차?규칙? 이란게 없음 월급이 밀림 퇴직금이 무진장 늦게 나온다고함
64,데이타메이션,5453,내부팀들이 전문지식이 없음 절차? 규칙? 이란게 없음 월급이 맨날 밀림 (주임 50%씩 과장 1~2달정도 밀림 퇴직금이 무진장 늦게 나옴
65,데이타메이션,5453,월급너무 많이 밀려서 유지가 가능한건지 궁금합니다. 프로젝트가 너무 오래 지연 됩니다.
66,데이타메이션,5453,급여가 낮은편. 직원들이 거의 사회 초년생들이라 업무를 잘 모름. 외부 파견이 많아서 본사 직원들을 잘 모름. 프로젝트구성이 거의 외부인력들임. 같이가는 정규직은 많아봐야 2~3명. 가끔 혼자가는 프로젝트도 있음. 다양한 지식을 습득할 수 있는데 가르켜주는 사람이 없고 혼자 터득해야함. 가르켜주는 사람이 없는 이유는 업무 아는 사람이 거의 전무함. 심지어 프로젝트 관리자도 본인이 이끌어야 하는 프로젝트가 정확히 뭔지 모름. 가장 중요한 급여가 밀림. 안들어오는건 아니지만 계속 밀림. 밀리는 이유가 프로젝트 진행이 잘 안되서 고객사에게 돈을 못받아서인데 프로젝트가 잘 안되는 이유는 다음과 같음. 1.솔루션 패키지라고 있는데 운영진이 검증도 안해본 모양인지 오류투성이에 소스는 개판이라 모디파이도 어렵고(새로 개빌하는게 빠를정도) 기능도 구림. 이거믿고 프로젝트기간을 너무 짧게 잡음. 매일 야근에 주말근무. 2.프로젝트 인력 구성이 엉망임. Pm과 PL이 외부인력들인데 업무도 모르는 사람들을 앉혀놓고 진행을 함. Pm은 그냥 사업관리만 하는 사람만 뽑아 놓고 적어도 PL이나 PM둘 중 하나는 업무에 빠삭한 사람이 있어야 하는데 둘 다 모르쇠니 진행이 잘 될수가 없음. 외부인력이 주인 이유는 정직원중에 관리자급이 없음. 왜 없냐면 일잘하는 사람들은 하도 시달려서 나가거나(업무과중) 몸망가져서 나가거나 하기 때문. 3.본사 지원이 잘안됨. 수습도 못하는데 무분별하게 벌려놓은 프로젝트가 너무 많음. 지연되는 프로젝트에는 직원 하나 딸랑 던져놓고 나몰라라함. 연봉이 경력에 비해 너무 짠데 대표는 그런걸 모르고 형평성 얘기만함. 경력 낮을때는 연봉 괜찮은 편임.
67,데이타메이션,5453,"프리랜서인데 월급이 밀림. 점점 월급 밀려가는 현상이 심해짐. 2주 50퍼.. 2주 100퍼.. 이젠 한달이 통으로 밀림.. 일을 할줄 모르는 사람들만 데려다가 프로젝트 투입시키니 안되는 프로젝트가 많고, 업계에 소문이 안좋음. 솔루션이 있는데, 이게 솔루션인게 의심되고, 프로젝트 투입하면 새로 전부 다시 개발하는게 차라리 나을 수준임. 솔루션 소스를 아는 개발자 우대할 생각 1도 없음. 솔루션을 알고 열심히하는 개발자나 솔루션을 모르고 널널히 일하는 개발자나 똑같은 취급함. 프리랜서에게 다음 계약을 협상없이 통보하고 계약하자는 이상한 회사. (금액, 개월 통보하고 아님 말란 식임)"
68,데이타메이션,5453,동종업계내 평판도 좋은편이 아니며 계약직은 높은 월급을 받고 일은 안함 프리랜서만 일하기 좋은 회사
69,데이타메이션,5453,일이 몰리고 수습이 잘 안됨 급여가 한달까진 아니어도 이주 삼주씩 밀림 체계가 없음 프로젝트가 거의 프리라서 정직원이 일하기 힘듬
70,데이타메이션,5453,"프로젝트 운영 방식의 변화가 필요 하며, 관리 방식의 개선이 필요하다고 생각함."
71,데이타메이션,5453,월급이 밀립니다. 당일통보로 밀리기 때문에 알아서 대비해야 합니다.
72,데이타메이션,5453,육아휴직 이외에 특별한 복지제도는 없습니닷. 아무래도 회사특성상 외부일이 많은데 본사 있으면 일안한다고 여겨지는 분위기가 있습니다. 행정일 하시는 분들이 좀 까칠한 편이라 당황스러울 때가 종종 있고요.
73,데이타메이션,5453,회사가 성장하는 단계라 신입직원이 많음. 개발직과 컨설팅/영업팀의 의사소통에 한계가 있음.
74,데이타메이션,5453,"오래다닌 직원이 거의 없음. 70퍼 이상이 사회 초년생들임. 업무를 아는사람이 거의 없어서 스스로 터득해야함. 좀 다녀서 대충 알겠다 싶은 사람들은 죽기직전 상태되어 다 퇴사. Si로 먹고 사는 회사인데 이끌고 나가야하는 영업이나 사업관리등 경영진들이 si지식이 거의 없음. 프로젝트 인력 면접 보는 사람들이 본인들이 하는 업무도 잘 모르고 개발 지식도 없으니 싼 개발자 있으면 막 뽑아다가 그냥 집어넣음. 그런 사람들만 모아놓아서 일을 하니 프로젝트가 재대로 끝나는데가 없음. 10여년 넘게 버티고 있는게 정말 신기함. 부서가 컨설팅,영업,개발 로 나눌 수 있는데 철저하게 독립적임. 같은 회사 직원들인지 의구심이 들 정도로 독립적임. 연봉이 짠 편."
75,데이타메이션,5453,"스스로에게 맞는 직무가 아니라 퇴사하였지만, 체계를 잡아가고 있고 각자 스스로의 마인드만 잘 가다듬고 남탓하지 않고 직면한 문제해결을 위해 노력한다면 어떤 단점도 극복가능해 보임."
76,데이타메이션,5453,퇴근 시간 없이 매일 야근에 주말 근무 출근 당연히 해야함 조직체계 전혀 없고 무늬만 솔루션 회사 sI사업을 위한 인력 공급소 솔루션은 없고 외부 프리랜서 개발자가 만들고 유지보스 함 직원들 이용만 하는 회사 같음
77,데이타메이션,5453,"프로젝트가 종료가 안되고, 그래서 잔금을 못받고, 그래서 직원급여가 밀리고..."
78,데이타메이션,5453,"솔루션이라고 하고 신규개발 해야하고 프로젝트 투입되면 야근,주말 출근해야됨"
79,데이타메이션,5453,"매일 아침마다 사장에게 서면보고 해야함 파트장 혹은 팀장의 권한이란 것은 존재하지 않으며, 모두 사장의 지시에 따라 움직이는 회사 제안서를 반나절만에 쓰는 회사 제안서 쓰느라 재직기간 동안 제대로 못자는 회사 보유중인 솔루션 운영도 제대로 못함, AI 개발중이긴 한데 글쎄... 프로젝트 인원구성중 80프로 이상을 아웃소싱업체에서 쓰는 회사 (물론 PM은 대부분 본사 외 직원) 권고사직이 흔하게 일어남(사장에게 잘보여야 안짤리고 다닐 수 있음) 실제 사수급 인원이 부족한 관계로 운영이 제대로 이루어지지 않음"
