,company_name,company_id,review_text
129,동아제약(주),4533,영업직군의 경우 3~5년 단위 발령(전국대상 발령)의 리스크가 존재하기때문에 주말부부를 해야할수도 있는 상황이 발생. 물론 집근처로 배려를 많이 해주는 편이지만 상황이 안되면 멀리갈수도 있음.. 때문에 회식이 많음(팀장급 관리자도 전국단위 발령). 팀장님도 퇴근하면 혼자 숙소에서 자취하시기에...저녁 약속이 많을 수도...^^
130,동아제약(주),4533,윗물이 많아 아랫직원의 발전가능성이 낮음. 군대식 문화.
131,동아제약(주),4533,오래된 회사라 다소 수직적인 관계만 개선하면 좋을것 같음
132,동아제약(주),4533,"오래된 제약사이다 보니 직원들 중에 나이 많은 선배들이 꽤 있고(특히 영업/생산; 사실 다른 회사도 다 비슷하겠지만) 공채 선발을 영업 위주(단, 연구/개발은 별도 채용)로 해서 전환 배치를 하다 보니 전문성이 떨어지는 직군도 있음"
133,동아제약(주),4533,공채입사자가 대부분 지들끼리 끈끈해서 경력입사자는 적응이 쉽지 않음 몇명에 의해 모두가 움직이는 집단
134,동아제약(주),4533,"불필요한 페이퍼웤, 박카스가 거의 회사의 존폐를 좌우.... 수직적문화"
135,동아제약(주),4533,"복지제도가 조금 높은 연령대에 초첨이 맞춰져있어 젊은 직원들이 활용 가능한 제도는 실제 적은편, 비효율적인 보고성 업무가 조금 있는편"
136,동아제약(주),4533,국내 제약 대기업 타이틀에 부합하지 않는 굉장히 수직적이고 비효율적인 업무 방식을 가지고 있습니다.
137,동아제약(주),4533,동종업계 연구직에 비해 연봉이 적은편이고 성과금 및 연봉인상이 짜다
138,동아제약(주),4533,열정페이심함. 설비가 중요해서 설비가 안되면 밥교대로 막고 못먹을때도 있음 남녀차별 있음
139,동아제약(주),4533,새로운 도전에 대해 부정적인 편이라서 새롭게 발굴되는 것이 적음.
140,동아제약(주),4533,무언가 각 팀과 팀사이에 커뮤니케이션이 안되는 느낌. 그래서 각각의 팀이 서로 시너지효과를 보여줘야 되는데 그러지를 못하는 느낌임.
141,동아제약(주),4533,올드한 기업문화 조금씩 변화는 된다 워라벨 워라벨 하지말 발령이나 진급보면 그닥
142,동아제약(주),4533,회식부담있음  보수적이고 군대문화 강함  역과의 거리감 있음  칼퇴없음(부서마다 다를듯)
143,동아제약(주),4533,기수문화 아직 남아있기는 함 회사 근처에 정말 별게 없긴 한데 큰 단점은 아님. 박카스 외 매출 끌어올릴 수 있는 다른 상품을 개발해야 하는데 그럴 역량과 의지가 있는지는 잘 모르겠음
144,동아제약(주),4533,돈을 많이 주는 이유가 있다. 일 강도가 쌔고 남녀 차별이 있음
145,동아제약(주),4533,생산업무는 2조2교대여서 휴가를 쓰는데 눈치가 보임. 상여금이 너무 들쑥날쑥함
146,동아제약(주),4533,업무 및 능력보다는 윗선에 잘보이는 능력이 더 높게 평가됨. 특히 현장직과 사무직에 대한 괴리감이 큼
147,동아제약(주),4533,단점 1. 너무 친해서 소문이 빨리 퍼짐 2. 노는 사람은 하루종일 놀고있다. 근데도 많이받음 3. 연봉 인상률이 낮음 4. 고졸 초대졸 학사 약사 계급 차이가 나뉨 (고졸은 승진이 좀 힘들다.. 대우가..)
148,동아제약(주),4533,공채 비공채 출신 차별이 심하며 경력직입사의 경우 겉으로는 티내지않지만 불안정함
149,동아제약(주),4533,저런사람이 왜 안짤리는지 의문 꼰대문화가 사라졋다지만 대리이상은 아님 남사원에게는 열정페이 많고 설비터지면 퇴근못함 생산량 압박으로 밥을 교대로 먹고 제대로 못쉼 쓸건 많지만 와서 느껴보면 하루종일 채용사이트 보고 있음
150,동아제약(주),4533,설비 또는 박카스병 때문에 소음이 심함 쉬는시간이 정해져있지 않음
151,동아제약(주),4533,발전하고자 노력하는 사람보다는 윗사람한테 잘보이면 장땡인 회사
152,동아제약(주),4533,연봉인상률이 낮다 밥이 맛없다 주말에도 근무 및 열정페이 존재 식비는 월급에서 빠져나감 소음이 크다 생산직군은 비전이 없다
153,동아제약(주),4533,제조팀은 점심시간 1시간이 지켜지지않음 복지는 거의 없다보면되고 연차사용시 다른곳으로 이직하는지 의심부터함
154,동아제약(주),4533,"생산현장의 소음, 생산량에 너무 목을 매달음, 직원복지가 부족"
155,동아제약(주),4533,상사분과 나이차이가 좀 있기에 초반에 적응하기 힘들었습니다.
156,동아제약(주),4533,수직적인 보고체계와 대학생들이 왜 가고싶은 제약회사 1위인지 모르겟는 듯한 사내 분위기
157,동아제약(주),4533,성수기땐 야근이 많을수도 있고 보수적인 체계로 어느정도의 꼰대문화가 존재한다. 그 외에 업무 몰빵 등 부조리가 있지만 그것만 버티면 평생 회사로 다닐만 한것 같다
158,동아제약(주),4533,90년대 기업문화 바꾼다고하는데 뭐 바꾸는지도 모르겠고 그냥 옷 바꿔입으면 기업문화 바뀌는줄 아는 곳
159,동아제약(주),4533,보수적이다. 그것 외엔 단점이 없는거 같음 실적이 안 좋을데 추가적인 보너스가 없을 정도?
160,동아제약(주),4533,연봉상승률이 낮고 고인물들이 많은편이다 부서마다 업무의 차이가 큰편이고 힘들때는 많이 힘들고 여유있을때는 여유있는편이다 군대식 문화가 남아있고 힘든일로 인하여 이직율이 높은편이다
161,동아제약(주),4533,군대문화가 심하고 부서마다 다르지만 술 좋아하는 상사만나면 오지게 마심. 부서이동이 은근 많음. 일단
162,동아제약(주),4533,부서들간에 업무조율이 별로 안되는것같고 수직으로 찍어누르는 거같음
163,동아제약(주),4533,상여금x 성과금 나오면 100% 나올때도 있고 안나올 때도 있고 대체로 젊은 사람들이 많음(장점이자 단점)
164,동아제약(주),4533,기업 자체에서 제너럴리스트를 지향하는 느낌을 받았습니다. 스페셜리스트가 되고싶다면 본인이 스페셜리스트가 되고싶다고 어필해야 할 것 같습니다.
165,동아제약(주),4533,남녀차별 심해요 여자는 진급 어려움 남자는 금방금방 꼰대문화 회식! 다행히 지금은 코로나로 못 하고 있어요 정시에 퇴근 힘들어요 작업이 멈추면 같이 일하는 공정도 18시 가는 경우 많아요 동아st랑 밥 같이 먹는데 자율배식도 아니고 회사가 돈 없다고 배식해주는데 그 만은 돈은 대체 어디로 ㅎㅎ
166,동아제약(주),4533,미래 비전을 봤을때 일반의약품 산업 자체가 전망이 밝지는 않다고 보는데 그에 발맞춰 변화하는 회사의 모습이 뚜렷하게 보이지는 않다. 박카스에 의존도가 너무 높은데 이게 몇십년째 이어지고 있다. 영업부서만 고생하고 영업 실적에 대한 보상이 적절한지 의문이다. 역사가 오래된 회사답게 보수적인 조직 문화가 저변에 깔려있다.
167,동아제약(주),4533,회사의 위치가 서울 중심에서 조금 떨어져있다. 돌아다니며 영업하기에는 조금 안좋은 위치임
168,동아제약(주),4533,주/야간 교대가 많아서 처음에는 많이 힘들고 적응이 안됩니다.
169,동아제약(주),4533,수직적 조직문화는 바뀌질 않음 생산부서는 개인 시간이 없음 요즘같은 때에도 식사시간 1시간이 보장 안되고 설비를 교대로 돌리는 경우가 많음 남자사원은 고충을 말해도 지켜보자는 입장을 고수하나 여사원의 경우 빠른피드백을해줌
170,동아제약(주),4533,제약회사 영업직 단점은 뭐 이미 다들 알고있는데 언급안하셔도 다들 아실거라고 생각합니다 하지만 단점을 커버할만한 장점도있고 단점을 장점으로 바꿀 수 있는 역량이 있다면 굿
171,동아제약(주),4533,잡무가 너무 많다. 엑셀로 하는것도 많고 워드로 하는일도 많다. 자유롭지 못한 분위기 때문에 답답함이 존재한다. 부서에서 회식이 많은 곳도 있다. 이것도 케바케인것 같다.
172,동아제약(주),4533,수직적인 분위기. 보수적인 분위기. 하라면 해라라는 분위기
173,동아제약(주),4533,비효율적인 교대근무를 한다. 밥이 맛이 없다. 상사와 원활한 관계를 유지하는것은 어려워 보임
174,동아제약(주),4533,기업 자체가 좀 보수적인 편이라 큰 혁신이나 변화는 어려울 것으로 보여짐.
175,동아제약(주),4533,고인물. 아무도 자기일이라고 생각하지 않음. 박카스 하나 믿고 임직원들이 일을 안함. 연차 차고 공채 출신 동아인들은 고여서 뭐가 문제인지 모름. 아무리 문제 제기를 해도 개선되지 않음. 능력 위주가 아닌 인맥 중심의 인사 제도. 변화를 거부하는 조직. 70년대 마인드를 고수함.
176,동아제약(주),4533,"눈치 보며 퇴근해야함 생산부서만 매우 힘들어 퇴사율이 매우 높고 타 부서 퇴사율은 거의 제로에 가까울정도로 부바부가 심각함,,생산부서의 힘든점을 개선하려고 하지 않음"
177,동아제약(주),4533,직원의 복지 혜택이 적다. 주차 공간이 직원 수에 비해 좁다.
178,동아제약(주),4533,"불안정한 체계, 주야 2교대 근무, 엄청난 소음, 육체적 노동 제안 압박"
179,동아제약(주),4533,"경력직을 뽑은게 최근들어서인지 경력직과 신입공채에 완벽한 벽이있고 절대 섞일수없는 분위기다. 본인들끼리 성골, 진골, 기수따지는 지독하게 보수적이며 배타적인 조직이다. 급여체계나 계약 조건또한 공채와 경력입사자는 다르다. (대부분의 경력직들이 입사후 이 사실을 안다) 오래다닐수 있다 알려져있으나 신입공채 출신에게만 해당되고 경력직은 하루아침에 짤리기도 하는 총알받이같은 존재다."
180,동아제약(주),4533,"나이많은 직급 일 안하고 아랫사람 다 시킴, 보수적인 문화"
181,동아제약(주),4533,1. 짬밥 쌓이기 전까지는 다니기 싫게 만듬 2. 진급하고 오르는 연봉이 적어요 3. 성과/평가 문제 많습니다
182,동아제약(주),4533,술문화와 꼰대가 많음 여자가 다니기엔 가부장적인 분위기에서 힘든직장
183,동아제약(주),4533,오래된 기업 문화와 그 문화에서 파생되는 높은 업무 강도
184,동아제약(주),4533,수직적인 군대식 기업문화. 성희롱적인 발언을 들었었음. 그 때 당시에는 젠더이슈가 심하지 않았던 때였기 때문에 넘어갔지만 지금 들었으면 신고감.
185,동아제약(주),4533,"회사 자체에서도 분야 직군 차별이 뚜렷. 고 학력 스펙의 사람들이 회사가 박카스로 좌지우지 된다는걸 대부분 인정하지 않으려고 함. 실적에 상관없이, 업무 역량에 상관없이 그냥 자기들이 못해도 더 대우받는게 마땅하다고 생각. 그렇다고 열심히 하진 않음. 몸사림. (박카스 판매실적에 기댄) 안일주의라 크게 발전이 없음. 그 괴리감 때문에 회사간의 그리고 직군간의 갈등이 심함. 그래서 외부 사람 들어오면 적응 잘 못함."
186,동아제약(주),4533,경력사원을 모집하지 않고 정년이 보장되다보니 업무 성과없는 고인물이 많음. 전공이 시험실 이라도 현장직으로 발령나서 현장에서 일할가능성이 큼. 그만큼 시험실 능력치는 타사대비 떨어질수 있음.
187,동아제약(주),4533,연차가 쌓이면 다른 기업에 비해 연봉이 높지는 않음 제품생산량이 많다보니 근무시간이 많음. 그래도 급여로 지급되니 큰 문제는 없음.
188,동아제약(주),4533,"대기업치고 체계가 없음. 팀장 로테이션이 너무 자주 이루어짐, 2년제 여자만 직무사원(2년제 남자는 승진이 됨) 그리고 능력 없는 고인물들이 너무 너무 많음."
189,동아제약(주),4533,사람을 제대로 알아보지못하고 구시대적인생각으로 운영 및 평가가 진행됨. 구축효과가 발생하는 회사임.
190,동아제약(주),4533,"남성 중심적의 수직적이고 경직된 문화, 젊고 늙은 꼰대가 많다"
191,동아제약(주),4533,오래된 뿌리박힌 낡은 문화들이 은근 사라지지않음. 임원들에 대한 의전과 대접이 너무 심함. 수평문화는 절대아님
192,동아제약(주),4533,"밥 먹을 시간 없이 일함 눈치보느라 12시간 넘게 근무하고도 칼퇴 못함 야간수당,야근수당, 어떻게든 안챙겨주려는곳 쓸데없는 위계질서가 있음"
193,동아제약(주),4533,"기수문화, 영업이 힘이없음 목표에 대한 부담이 굉장히 큼,니돈이까지던지말던지 목표는 해라..책임은 영업사원이..."
194,동아제약(주),4533,자기계발의 어려움 주야 교대라서 아침저녁 시간이 계속 변해서 적응하기 어렵고 피곤하고 건강에 이롭지 않은거같아요
195,동아제약(주),4533,박카스 단일제품으류 인해 미래가 불투명. 2조2교대로인해서 너무너무 힘듬
196,동아제약(주),4533,승진의 기회가 여자에게 너무 야박함. 남자는 위로 올라갈 수 있는 기회가 훨씬 높음.
197,동아제약(주),4533,사람들은 최신을 따라가려고하는데 회사가 구식이라는 느낌을 받음
198,동아제약(주),4533,"사정이 있어 퇴사를 하여 솔직하게 말하자면 생산쪽 같은 경우, 여직원 대비 남직원이 너무 고생한다는 느낌이 강하다. 그리고 동아제약 자체가 워낙 보수적인 회사라 군대 문화가 베이스로 깔려있어 직장이 아닌 군대 재입대 했다고 생각하면 맘 편하다."
199,동아제약(주),4533,보고 과정이 복잡함 중간에 의사결정많이 바뀜. 잔돌리기 등 보수적인 회식문화가 있음
200,동아제약(주),4533,거의 고 초대졸 출신들은 노예로 생각하는거 같음 근무환경이나 조건을 개선 하는것보다 그냥 새로 뽑고 말지라는 생각임 주말 쉬는 2조2교대 이나 주말 중 하루는 무조건 출근 주 6일 근무
201,동아제약(주),4533,딱히 없는 것 같음. 대기업은 복지가 잘되어 있어서 확실히 매우 매우 좋으 것 ㄷ같음 체계적인 업무 분담과 높은 연봉
202,동아제약(주),4533,성장가능성이 좀 보여야되는데 잘되는 사업을 찾기가 힘듭니다 다만 스테디셀러들이 있어 좋습니다
203,동아제약(주),4533,보수적이며 진급이 정해진인원이 있어 년차가 찬다고 올라가지 않습니다. 경직되있는 분위기가 알게모르게 있어 짜증납니다. 눈치가 은근히 보임
204,동아제약(주),4533,남자가 할일이 많음 여자는 잡일함 흔히보는제약회사가 아닌거같음 교대인데 교대자가오면 바로퇴근을못함
205,동아제약(주),4533,"명절보너스 없음. 출퇴근시간 미준수,업무 짬때리기,갈굼 너무 심함"
206,동아제약(주),4533,술자리가 꽤 있는 편이나 강압적인 술자리는 아니라서 괜찮다.
207,동아제약(주),4533,임원이 너무많음. 보고의 연속. 낮은 연봉상승률. 우리가 남이가 마인드의 사람이많음.
208,동아제약(주),4533,윗물이 맑아야 아랫물이 맑다라는 말이 너무 잘 와닿는 곳
209,동아제약(주),4533,다소 강직된 문화로 인해 갑갑함을 느낄 수 있습니다 업무처리 과정이나 사내 분위기 자체도 자유로움보다는 어느정도 형식이 있는 것을 요구하는 것 같다
210,동아제약(주),4533,연봉이 많다고 다 좋을거같은건아니다 시간은 정말 힘든 곳
211,동아제약(주),4533,부서마다 업무강도가 천차만별이며 직원들의 뒷담화가 심합니다
212,동아제약(주),4533,"과거의 영광에 취해있고, 대기업이라고 착각하나 싶을 정도"
213,동아제약(주),4533,본인이 자유로운 성향이면 버티기 힘든 회사 조금 프리한 성향이면 다른 기업 알아보는 것을 추천 성향 차이가 가장 크다.
214,동아제약(주),4533,약사만 사람 취급하고 다른 사람들은 그냥 소모품일 뿐. 잔돌리기 문화가 아직도 존재. 문제가 무엇인지 알면서도 고치려고 하지 않는 굉장히 보수적인 회사. 다름을 인정 못하고 본인과 다르면 틀리다고 하는 회사. 내로남불이 대단한 윗 분들은 그냥 본인들의 귀찮음과 책임을 전가할 있는 수발이 필요한 것일 뿐 경력 개발 안됨.
215,동아제약(주),4533,1.설비운영이라고 입사했는데 타기업 생산이랑 똑같다 2.정해져있는 쉬는시간이없다 밥못먹고일하는 사람들 태반 3.위에 계시는분들 마인드가 꼰대 4.휴가도 눈치보고써야된다 5.흡연자들은 힘들다 6.선배들 웃고 논다고 밑에있는직원을 퇴근시간 늦어진다
216,동아제약(주),4533,부장급 이상부터 노답 루팡들 많음. 대리급까지는 소통이 가능하지만 과장급부터는 벽화됨. 박카스가 잠재적인 단점임.
217,동아제약(주),4533,저게 다임 워라벨 챙기는척 하면서 워라벨 1도없고 사람들은 죄다 꼰대에 자격지심 두른애들 관리자들은 바꿔보려 하는데 절대 안바뀜 돈때문에 어쩔 수 없이 다니는 사람들이 많음
218,동아제약(주),4533,근무를 하다보면 1주는 주간 1주는 심야근무로 교대근무가 조금 힘이 들곤 합니다.
219,동아제약(주),4533,"칼출퇴가없음,윗사람눈치를봄,쉬는시간허락맡고가야함,퇴근시 모두에게 인사하고 허락맡아야감,시간외수당을 주지않음,주말대체근무가많음,생산일정표가그전주에나와서 개인적인 계획을못잡음,젊은사람이많는데젊은꼰대가수두룩,인사변태들많음,텃세많이부림,기본급이쎈대신 상여가 하나도없음,휴가비 성날추석 이런거없음,문서쓸께많음 여기가생산직인지 사무직인지..,남성우월주의,일을 못해도 위사람들 기분잘맞춰주면 회사가편함 진급잘됨,윗사람들이 뒷담화 앞담화를하여 직원들간에 불화를 일으킴,소문이빠름,비밀이없음,일은 밑에사람이다함,등등 많은데 기억이안남"
220,동아제약(주),4533,야근시간 많은것같다 업무의 강도 밸런스가 맞지 않음 상사가 고지식하고 무능력한 사람이 존재함
221,동아제약(주),4533,잘못된 선후배 문화와 음주 문화. 딱딱하다 분위기가. 맞는 사람이 있을 수는 있음.
222,동아제약(주),4533,"비교적 노후된 설비와 잦은 야근,근무계획표가 비교적 늦게나옴, 생산직 부서 마다 일의 강도가 높고 낮음이 존재"
223,동아제약(주),4533,혁신한다는데 그냥 그런말 안하고 지금 하는거나 제대로 했으면 좋겠고 영업이나 마케팅 팀장이나 임원의 개인의 감에 따라 제품을 개발해 체계적으로 시장에 대응하는게 아님
224,동아제약(주),4533,근래 많이 나아졋다고는 하나 여전히 보수적인 마인드. 악질 팀장들의 횡포가 심함.
225,동아제약(주),4533,한자를 추구해서 이력서부터 서류들 대부분 한자 작성이 필요하다 신약 출시가 더뎌 판매 제품이 그렇게 많지 않고 판매 대행 제품에 의존하는 경향이 좀 있다고 생각한다
226,동아제약(주),4533,영업 예산을 불합리하게 줄일려고하며 마케팅의 업무 전문성 및 현장배려가 없음. 정년이 보장되니 고인물들이 너무 많음.
227,동아제약(주),4533,출근이 좀 빡쎌수도ㅠ있는데 이쪽사람들은 다 그런듯 정년기대가 높은만큼 불필요인력도 회사 끝까지다닌다
228,동아제약(주),4533,야근도 많고 수직적 구조에 보수적인 회사는 분명한것같다 타기업도 아마 비슷하지 않을까 싶지만 그래도 단점이기에 적는다
229,동아제약(주),4533,사람을 강아지 같이 굴린다는 표현이 맞는것 같다 자기계발 시간이 부족하고 여러가지 복지혜택의 부족
230,동아제약(주),4533,고인물의 절정에 도달한 회사 연차 쓸때 눈치 보이고 윗사람들은 능력 없이 그냥 오래 다녀서..올라간 사람들 다녀보면 알음...윗사람 말은 똥으로 된장을 만든다 해도 믿어야함...그만큼 보수적이고..눈치보기 바쁘고 근무강도 최상임...기숙사 못들어가고..들어가도 상태 않좋음....출근시간보다 30분 일찍와서 일해야하고 점심먹고 쉬는시간 없이 바로 일함...
231,동아제약(주),4533,복지라곤 통근버스 기숙사 밖에없는데 이용하지를 못함 통근버스타고오면 출근늦게한다고 눈치보이고 퇴근은 안보내줘서 못타고 신입때 차사라고 함 기숙사도 통근없이는 갈수없는 위치 오래된 아파트 2조2교대(주말X) 2교대인데 출퇴근시간이 지켜지지않아 12시간이 넘게 있음 워라벨X 설비운영직인데 생산직임 둘다해야함 많이 이직하려는 것같음
232,동아제약(주),4533,"퇴근시간이 유동적임, 보수적인회사라 그런지 정장만 입어야함, 매 달 캐주얼데이가 있지만 잘 시행이 되지않는듯, 나이가 많으신 분들은 꼰대같이 행동하는 경우가 종종있었음."
233,동아제약(주),4533,수직적 조직문화라 답답한 면이 있으나 제약업계 자체가 보수적인 곳
234,동아제약(주),4533,나이가 대부분 많으셔서 금방 고참이 됨 But 일에대한 책임감은 막대함.
235,동아제약(주),4533,"군대문화, 일안하고 자기 앞가림만 신경쓰는 임원이 수두룩 술 못마시면 힘듬, 한 발 늦는 상품출시"
236,동아제약(주),4533,사내 분위기. 사내 분위기 정말 최악 어느회사나 뒷말쩔고 하긴하겠으나...여기는 정말 최악임. 윗급도 같이 나서서하고있음.........
237,동아제약(주),4533,보수적인 기업문화. 스페셜리스트가 아닌 제너럴리스트를 키우는 회사. 회식문화
238,동아제약(주),4533,단점은 그외 모든것 복지? 첫번째 기숙사 가보면 깜짝놀랍니다 외노자들 거주하는 아파트 빌려서 거기서 한방에4명씩 사는데 그냥 차라리월세 내면서 자취하자라는 생각이 절로듭니다 두번쨰 유일하게 있는 복지 통근버스가 있는데 8시30출근이면 기본 7시30에서 8시까지 와야합니다 심지어 제가 있던파트는 8시10분에왓다고 다음부터는 8시에와라 빨리 차를 사라 통근버스타지마라 이런소리까지 들었습니다 마지막 여자들이 사원수에 1/3 정도인데 소문이 진짜ㅈ빠르고 완전이됩니다 예를들어 저 사람이 밖에서 운동을했다 라고소문이나면 그 소문이 뭔 대회나갓다 뭔 상을 받앗다 커지는 참 신기한회사
239,동아제약(주),4533,무서운 사람들이 딱버티고 있어서 코스모스처럼 여린마음을 가진사람은 적응하기 힘들어서 금방 관둠.
240,동아제약(주),4533,"약간은 보수적인 느낌을 지울래야 지울 수가 없으나, 어딜가나 다 있을 정도임"
241,동아제약(주),4533,"불필요한 문서작업, 잡일이 많음.... 복지가 많다고 하지만 들어본적도 사용한적도 사용한 사람도 없음, 수직관계"
242,동아제약(주),4533,업무 로테이션이 필요하다 느껴짐. 업무적 특성때문에..라는 이유도 있지만 배우면 충분히 할 수 있는 일을 굳이 같은 자리에 배치하는 것을 지켜보기에는 업무를 할당해주는 담당 직원의 생각이 짧다고 느껴짐.
243,동아제약(주),4533,비합리적인 인사평가제조와 큰 비젼이 없음 교통편이 좋지 않음
244,동아제약(주),4533,출퇴근시간이 칼 같지 않음 1시간 일찍 조기출근해야 할 상황에도 수당을 챙겨주거나 그러진 않는다. 남자에겐 복지도 적다
245,동아제약(주),4533,우선 기숙사가 없고 출근 시간이 아침 6시 50분쯤까지이기에 멀리 사시는 분들이 힘들어하셨습니다. 또한 기계들이 오래돼서 자주 멈추고 고장이 나는데 본사에서는 조만간 바꿔준다는 말만 되풀이하고 차일피일 미뤘기에 담당자는 죽어나고 생산시간이 계속 늦어져 잔업과 주말생산이 굉장히 잦았습니다. 또한 업무담당자를 상당히 자주 바꾸는데 전혀 관계없는 분을 파견하는 경우가 종종 있습니다.
246,동아제약(주),4533,휴가비 및 추석 설날 보너스가 없다
247,동아제약(주),4533,현실에 안주하려는 성향이 강하고 공정한 인사가 이뤄지지 않음으로 인하여 구성원의 능력 활용도가 떨어짐.
248,동아제약(주),4533,"비합리적인 인사배치 및 처우, 업무 R&R 비체계적, 과도한 사람 중시 문화"
249,동아제약(주),4533,"연차를 윗사참 눈치 보고 써야함, 집이 회사같고 회사가 집같음, 회사에 큰 복지가 별로 없음."
