,company_name,company_id,review_text
250,동아제약(주),4533,"보수적인 기업. (출근 7시반까지했음.)  거래처와의 술자리가 아닌 회사사람들과의 술자리. (일주일에 4번도 경험해봤음, 술자리 이유? 타부서사람이 오면 무조건 회식, 팀장이 회식하고싶으면 회식 일찍 퇴근해도 회식해야하면 바로 복귀해야함)  전국적으로 부진하면 모두 영업을 못해서니 영업팀탓이다. (품절이 몇개월째 있는 제품이 있는데 이거 안들어와서 힘들다 하면 품절되기전에 팔면 니 실적은 좋을꺼 아니냐.. 라는데 이게 뭔 말이여)  영업직에있다가 마케팅, 지원팀에 인사가 날 수 도 있는데 그러면 그사람은 성공햇네 승진햇네..라고함. (영업직이 인센티브도 있고 퇴근도 자유롭게 할수 있어서 좋다..라고 주위에서 하지만 내근직으로 가는 순간 성공했네라고 하면 내근직>>>>영업직 이라는말 아닌가?)  인센티브는 대부분 영업하는데 돈쓴다. (도매에서 나오는 동아제약제품이 더 싼 것이 많다.... 그 단가는 모조리 나의몫^^)"
251,동아제약(주),4533,"입사 기준 (고졸, 초대졸, 대졸) 간의 승진 가능성의 차별이 심하다. 직군별로 업무의 강도 차이가 크다."
252,동아제약(주),4533,"1. 사람을 안짜르니 무능한 사람들이 많이 있다. 능력 있고 좋은 사람이 있는 만큼 무능하고 약삭 빠른 사람이 많다.  2. 얼척 없는 인사 배치. 전공??? 상관 없음. 동아제약은 당신의 전공 따윈 신경 안쓰고 부서 배치를 과감하게 돌린다. 빵꾸난 부서 인원 메우기식. 운이 없다면 엉뚱한 곳으로 간다. 이게 다양한 경험을 쌓아 뛰어난 인재를 발굴한다는 취지인데 가끔 말도 안되는 경우도 있어 문제 있어 보인다.  3. 발전이 없는 제품성. 박카스, 판피린, 가그린 말고는... 다른 무언가가 안나온다. 가그린도 거의 시장 뺏겨가는 추세이며, 박카스가 없다면 바로 망해도 이상하지 않을 정도로 박카스에 의존한다.  4. 글로벌 시대에 한자는 아닌것 같음. 진급 시험에 영어 시험도 아닌 한자 시험 봐야함.  5. 신공장 무산 되면서 오래된 설비 붙잡고 있어야 함. 그 말은 현장 일이 빡세다는 뜻."
253,동아제약(주),4533,실제 근무시간이 8시30분 부터인데도 불구하고 너무 이른 출근시간을 요구함.
254,동아제약(주),4533,사원들이 공장에 불만 말해도 안들어주고 윗사람한테 말하게 되서 갈구는 회사 진짜 고인물은 썩는회사 식사 시간 근무시간 쳐주지도 않고 8시반 까지 출근인대 7시 30까지 오라고 눈치주는 회사 7시30분에 와서 저녁 9시 반에 퇴근하는 회사 ㅋㅋㅋ 말 다한거임 내시간 전혀없고 야간근무를 그냥 필수 적으로 하는회사 직원들 복지 머가 있는지도 모르겟슴 그리고 산재 잘안해주려고함 제약회사가 아니라 그냥 박카스 회사임 진짜 고인물이 썩고 토나옴 여기 남아잇는사람은 스펙 없고 돈을 벌어야기 때문에 남아있음
255,동아제약(주),4533,일에대해 배우려고 들어오시는분들이있는데 비추합니당ㅎㅎㅎ
256,동아제약(주),4533,특근수당빼면 기보급이짜다 일이 많고 특근이 잦음.나이들어서다니기는체력이있어야될듯하다 아쉬운 기본급개인적인생각
257,동아제약(주),4533,"고인물은 썩는 법이다. 고리타분한 사람들의 사고방식. 과장님이 동네 아저씨 같은 곳. 업무시간에 제대로 집중하지 않은 사람들이 많음. 남여차별, 학력차별 최고로 심함."
258,동아제약(주),4533,이해할 수 없는 인사시스템 파이프라인 약함 신사업 투자에 인색
259,동아제약(주),4533,보수적인 기업문화. 상명하달식의 군대문화가 짙음. 오너기업이기 때문에 경영진의 결정에 팀 업무가 변화하는 경우가 많음.
260,동아제약(주),4533,지극히 보수적임...근속년수가 길다보니 회사 느낌자체가 나이들었다는 느낌이 강하고 실제로도 오래되고 늙은사람들이 많음. 입사는 쉽지만 진급에있어서 학벌 따짐
261,동아제약(주),4533,의약영업이기 때문에 의사와 접촉하는 시간이 많다. 잘못 만나면 본연의 업무를 할 수 없는 경우가 많다. 리베이트 유혹도 생긴다.
262,동아제약(주),4533,"업무가 효율적이지않음 군대문화, 인사이동 기준없이 이루어지는 회사 규모에 비해 복지가 좋지않음"
263,동아제약(주),4533,다소 보수적인 분위기로 업무강도가 쌥니다. 그리고 영업은 군대식문화 갖추고있습니다
264,동아제약(주),4533,제약업계자체가 메리트가없습니다. 이미과포화상태로 발전가능성 전무
265,동아제약(주),4533,단점이 너무 많음 사람간의 관계들 너무 안좋음 왕따만들기에 동조적인 문화 서로뒤에서 까고있음 회사분위기 뭐같음
266,동아제약(주),4533,아무래도 제약영업이라는 것이 평판이 좋지 못하고 사람들의 시선이 곱지는 않다지만 동아라는 이름은 무시할 수 없음
267,동아제약(주),4533,보수적인편이라 고인물이 많다는 느낌이 강합니다. 너무 짬으로 일처리 하려고 함
268,동아제약(주),4533,썩은물이많음. 회식은 공장마다 다르지만 술많이 하는곳은 장난아님! 그리고 보수적
269,동아제약(주),4533,힘들어요 열심히 잘 끈기있게 자세가되어있는 분만 도전하세요
270,동아제약(주),4533,직장상사와 사원간의 의사소통은 군대선임과 후임같음. 신약개발안함
271,동아제약(주),4533,진보적인 업무 체계 시스템이 필요하다. 트렌드에 뒤처진다.
272,동아제약(주),4533,타부서로의 이동기회가 적고 임원진들이 직원을 생각하는 마음을 느낄수가 없었다
273,동아제약(주),4533,"매우 보수적이고 술자리가 굉장히 많은 회사. 사업부의 보고체계가 굉장히 구태적이고 술못하면 인정받기 힘듦. OTC영업은 잘하면 잘할수록 마케팅, 정책, 인사 등의 부서로 진출하기 힘듦(잘하는 사람을 사업부에서 놔주지않음)"
274,동아제약(주),4533,모든 OTC 영업사원이 마찬가지지만 차액이 생긴다. 의외로 전혀 팔 품목이 없다. 경영진이 말을 듣지 않는다. 제품개발도 소홀하다. 시장가격이 무너져 영업이 힘들다. 현장 엽업사원들의 의견을 전혀 듣지 않는다.
275,동아제약(주),4533,동아제약뿐만 아니라 otc 영업사원은 차액이 생길 수 밖에 없다는 것을 명심해야함 겉으로 보여지는 동아제약은 팔 품목이 많아 보이지만 막상 그렇지않다는걸 느낄 수 있음
276,동아제약(주),4533,군대식 문화 전통에 얽메인 보수적인 회사 분위기.........
277,동아제약(주),4533,상하 수직적이고 소통이 되지않으며 성장할수록 실력보다는 윅분들과의 관계에 의해 미래가 결정. 아직 까지는 조직이 작은편이며 지주사의 눈치 보느라 의사결정 늦음.
278,동아제약(주),4533,상사르부터 술자리가많고 너무 이끌려다니는게 심하다고 생각
279,동아제약(주),4533,상사들의 정치질 뒤통수가 난무하며 선배랍시고 갑질해대는 고인물이 즐비함
280,동아제약(주),4533,가-족같은회사라 과장급일도 사원들이 도맡아서해야됨 모든거를 인내해야하는회사
281,동아제약(주),4533,인사제도의 불투명함 한자 시험 등의 구식 제도 고집 체계없는 급여 시스템 본사 위치가 열악함 등등 끝도 없음 책임회피와 눈치보기에 급급한 전형적인 오너회사
282,동아제약(주),4533,"연구개발 기반 위축. 건설적인 대안 보다 비판적, 비합리적 시각이 공존"
283,동아제약(주),4533,단점은 딱히 모르겠고 다른회사도 그렇듯이 바쁠때는 잔업이 많다는점이외에는 다른 단점은 없는것같다.
284,동아제약(주),4533,보수적인 업무환경과 비효율성이 정상이 되어버림 가족같은분위기라 소문이빨리퍼짐
285,동아제약(주),4533,연봉이 높은만큼 야근 특근 근무가 쎄며 생산같은 경우는 여자가 많아서 소문이 무서움 여자는 승진이힘듬
286,동아제약(주),4533,팀에 따라 다르지만 내가 소속된 팀은 유독 더 보수적임.
287,동아제약(주),4533,수직화된 업무구조 및 보수적인 상하관계
288,동아제약(주),4533,최근 신사업 관련 경력직 대거 유입 문제는 기존인력과 경력 대비 연봉역전이 발생하여 분위기 꽝 특히 신사업이 성과를 못내며 회사 분위기 엉망임
289,동아제약(주),4533,공채와 비공채의 차별 및 보수적인 기업문화
290,동아제약(주),4533,"아직까지도 존재하는 오래된 기업의 특징인 상명하복의 문화, 누구나 어디서든 타인의 실적 조회가 가능하고 거래처에 어떤 제품을 판매했는지 까지 확인이 가능함"
291,동아제약(주),4533,"단가차액이 많음, 내부영업이 절실히 필요함"
292,동아제약(주),4533,"한자사용등, 시스템적인 부분이 구시대적임. 군대문화가 남아있음"
293,동아제약(주),4533,보수적 분위기 5시퇴근기업이많아지는 가운데 퇴근시간 눈치보며..
294,동아제약(주),4533,약간 일이 빡세긴 하다. 그래도 그에 상응하는 연봉을 주기 때문에..참을만함.
295,동아제약(주),4533,부서 분위기에 따라 비난하는 분위기가 있음
296,동아제약(주),4533,한자 공부를 많이 해야 한다. 급여가 높지 않다.
297,동아제약(주),4533,군대문화. 수직적 직급의 잔재가 많이 있다
298,동아제약(주),4533,가족(?)같은 회사와 문화로 경영진의 가족이 두루두루 포진해 있다.
299,동아제약(주),4533,"출근은 8시반 부터인데, 7시반 넘어서 도착 안하면 전화가 옴.. 뭐하자는건지.. 일부 라인 직원이라는 사람들이 회사를 좌지우지 하는데, 모두가 직원인데도 고용주처럼 구는 갑질은 무엇.."
300,동아제약(주),4533,"사내정치 심각. 정말 능력있는 사람들이 핵심부서를 맡고 있지 않고, 단순히 영업실적 좋고 목소리 큰 사람들이 회사를 좌지우지 하는 경향이 큼. 따라서 회사의 발전 가능성이 낮음. 영업직군의 경우 회사 공급가와 도매상 공급가의 큰 차이로 인해 영업활동에 어려움이 따름. 심한 경우 월급을 제대로 못가져가는 수도 있음."
301,동아제약(주),4533,잦은 술자리
302,동아제약(주),4533,이따금씩 무리한 야근
303,동아제약(주),4533,보수적인 성향
