,company_name,company_id,review_text
0,동아제약(주),4533,"정시퇴근은 어렵습니다. 제약회사 특성 상 술문화가 아직 남아있고, 군대 같아요. 모든 적자를 박카스로 매우고 있으니 발전보다는 기존방식에 안주하는 성향인데 그러면서 또 위에서는 획기적인 것을 주문하고 결국 보여주기로 끝나죠..."
1,동아제약(주),4533,아무래도 오래된 기업이다보니 보수적인 면이 없지않게 있어요
2,동아제약(주),4533,부서마다 일 강도가 다르다 . 내 부서는 힘들었음 야근 주 4회 했음 어떨때는 주말까지 출근
3,동아제약(주),4533,개인의 역량으로 회사 내에서 기여하는 정도의 차이가 크기 때문에 스스로 업무계획과 활동을 잘 세우지 않으면 내부에서 자리지키기 쉽지 않음
4,동아제약(주),4533,원가 절감을 위한 열정페이가 존재 수직적인 문화 잦은 일정 변경(휴일 및 당일에도 일정이 자주 바뀜) 연차 사용이 비교적 자유롭지 못함 어용노조 박카스 의존도가 매우 높음
5,동아제약(주),4533,지역적 위치가 안좋으며 성과제도가 팀원끼리 분열내기 좋게 만들어놨다.
6,동아제약(주),4533,본사가 지리적으로 좀 멀다..용두동 회식이 잦아서 술 안좋아하는 사람은 힘들듯
7,동아제약(주),4533,수직적인 문화가 수평적인 문화를 방해하는 점이 있음.
8,동아제약(주),4533,"위에 적은 것 빼고 모두 다 단점.... 사람들이 단점, 술 문화 단점, 회사 위치 단점(회사 옆 하천에 오리 떠다님..) 스트레스 주는 문화 또한 단점"
9,동아제약(주),4533,오래된 회사라 더 외부 환경에 대한 대응이 느리다 제약회사라고 해도 업무 진행에 제약되는 부분이 많다
10,동아제약(주),4533,성과제도 아닌데 특정다수에게만 영업을하는방식이라 담당하는 사람마다 워라밸이 천차만별이다.
11,동아제약(주),4533,홀딩스와 계열사간의 대우 차이. 예를 들면 홀딩스는 월 1회 패밀리데이에 아예 쉼. 일은 계열사가 다 해오는데..
12,동아제약(주),4533,"월급루팡들이 많으며, 윗사람이 따라 정책이 이리 저리 휘둘림"
13,동아제약(주),4533,"네임드가 다임, 낡아 빠진 근무환경,공채와 경력 차별,신사업 마인드 빈약"
14,동아제약(주),4533,발전할 수 있는 가능성이 없음 위치도 좋은 편은 아니다 박카스에 의존하는 회사
15,동아제약(주),4533,1. 교대근무는 통근버스 타기가 힘들다 2. 출퇴근 할 때 차가 막혀 힘들다 3. 서류업무가 힘든 곳이 존재한다
16,동아제약(주),4533,발전이 있다곤 하는데 없는느낌... 성과급많이안줌 ㅠㅠ
17,동아제약(주),4533,꼰대들이 많습니다. 일안하고 경력으로 승진하는 사람이 있어 조금 힘들 수도 있습니다.
18,동아제약(주),4533,제약사답게 약간 보수적인 문화 타 제약사 대비 심한 편은 아님 업무 진행 및 의사결정에 관여자가 많아 느림 일 잘하면 그 사람에게 몰아주니 적당히 ………..
19,동아제약(주),4533,제약사 평균 초봉보다는 낮은 편이지만 성과급과 인센티브로 매꾸면 됨 하는대로 잘 벌듯
20,동아제약(주),4533,1. 밥이 맛있지는 않음. 2. 장점이자 단점인데 단체휴가가 많음 (개인연차에서 깎이는 단체휴가) 3. 20-30대에는 괜찮은 급여이지만 40-50가면 높은 급여는 아님
21,동아제약(주),4533,박카스라는 캐시 카우 외 오소몰 비타빈 잠깐 반짝 였지만 미래를 보자면 글쎄? 의문이 많이 드는 회사이다
22,동아제약(주),4533,1. 당신이 약사도 아니고 보통 정도의 사람이나 진취적이라면 오지 마세요. 2. 경력개발이 안될 수 있어요. 물경력 될 수 있으니 참고하세요. 3. 일부 복지 - 사내대출 금액이 작고 받으려면 5년이나 다녀야 합니다.
23,동아제약(주),4533,내부 체계가 잘 안 잡혀 있는 느낌이 들고 안정적이기는 하나 회사도 직원도 다들 발전하려고 하지 않는 것 같음.
24,동아제약(주),4533,너무 많다 가장 큰건 생산직인지 사무직인지 설비보전팀인지 모를정도로 생산직 직원에게 너무 많은걸 바라고 시킨다
25,동아제약(주),4533,현장의 노후화된 설비. 늦은 일처리.. 좋지 못한 환경. 쉽지 않은 업무강도. 신입을 잘 챙기지는 않는다. 강하게 키우는 느낌?
26,동아제약(주),4533,"체계가 없으나, 체계가 없기때문에 직원을 많이고용할수있다고 생각했음. 큰 일이든 작은 일이든 내가 할수있는 범위에서 체계를 만들어나가는것도 내 일이라고생각함."
27,동아제약(주),4533,통근x 시간외 수당을 어떻게든 안줄려고 함 2조2교대 근무
28,동아제약(주),4533,보수적이고 페이퍼워크 많다. 갑자기 직급체계 변화해서 승진욕구 하락
29,동아제약(주),4533,수직적이규 보수적인 문화.공채 위주의 조직문화.변화와 혁신을 외치지만 고인물들이 그대로니 변화가 쉽지않음
30,동아제약(주),4533,페이가 예전에ㅜ비해 많이 줄었다는 점과 박카스의 앞으로 향후 미래?
31,동아제약(주),4533,"비효율적 체계, 그나마 체계 잘 없음, 부바부 갈려나가는 곳 많음"
32,동아제약(주),4533,업무강도가 우수하지 않다보니 업무 능력 향상은 본인의 노력하에 결정되며 스스로 주도하여 업무 역량을 키워가야함
33,동아제약(주),4533,야근을 포함한 퇴근시간이 명확하지 않아 일정을 크게 짤 수 없음
34,동아제약(주),4533,오래되었다보니 서류작업 사람관계 모든게 옛날 스타일 힘들다 힘들어..
35,동아제약(주),4533,문서 작업이 많음 일을 하는 사람과 노는 사람이 따로 있음 삼성 웰스토리인데 전혀 아닌 듯한 음식
36,동아제약(주),4533,고초대졸로 들어가면 요즘은 진급도 떨어짐 제조팀은 걍 노예
37,동아제약(주),4533,"군대 문화이고, 아직도 잔 돌리는 문화가 남아있습니다. 70~80년대 시대의 사내문화가 분위기가 짙게 남아있고, 그런 문화에 잘 적응하는 사람이 승진도 빨리합니다."
38,동아제약(주),4533,현재에 안주하는 형태가 큼 적잖은 꼰대 문화지만 어느 회사에나 존재 할 법함
39,동아제약(주),4533,"오랜기간 공채운영으로 곳곳에 꼰대들과 똥멍청이들이 포진. 차라리 연세가 좀 있으시면 그러려니 이해나 가는데, 30대말~40대중의 과차장급들에 꼰대집중되어있음에 깜놀. 시대와 역행하는 문화가 놀랍다."
40,동아제약(주),4533,"교대형태 맞교대 힘듬. 어딜가든 이상한 사람은 있지만 젊꼰 존재, 기본급만 쌤 다른거 없음 상여 성과 떡값 x"
41,동아제약(주),4533,고연차 임직원이 많고 일은 하는사람에게 몰리는 경형이 있어 일하는사람은 계속하고 안하는 사람은 계속 안한다
42,동아제약(주),4533,눈치보이는 자율출퇴근 패밀리데이 휴가도 눈치 보임 한달에 한번 쉬어도 많이 쉰다고 뭐라 함
43,동아제약(주),4533,"고여버린 팀장, 부장들.. 짱박히기 바쁜 팀원들..."
44,동아제약(주),4533,지배구조상 지주회사의 영향을 받게됨 독자적인 사업결정이나 파격적인 직원에 대한 보상은 이루어질 수 없음 일부 고인물의 형편없는 퍼포먼스
45,동아제약(주),4533,소음이 심하고 안전문제가 은근 많음 간단한 베임등 사고가 있지만 절단 같은 사고도 종종 있음
46,동아제약(주),4533,"2022년... 지금 2023년인 시대에도 여전한 술문화 평일 밤이면 동아제약 근처 음식점, 술집에 온통 동아제약 직원들임... 과연 그들이 모두 그 자리가 즐거울까 80%는 어쩔수 없이 앉아있다고 본다."
47,동아제약(주),4533,"좋은게 좋은거라고 두리뭉실 넘어가는게 다반사며, 능력없고 타인에게 책임전가하는 인원이 적지않게 많음"
48,동아제약(주),4533,회사 자체보다는 GMP의 특징이지만 비효율적인 업무가 상당히 많고 계속 일하다보면 그런 환경에 적응해서 창의력이나 아이디어와는 거리가 멀어짐
49,동아제약(주),4533,"큰 단점은 없고, 임직원 복지에 큰 신경을 쓰지 않는다"
50,동아제약(주),4533,오래된 제약 영업 답게 꼰대문화가 뼛속까지 퍼져있으며 특히 회식에 있어선 정말 체력적인 부담이 많이 됩니다. 개인적인 시간을 갖기 힘듬니다.
51,동아제약(주),4533,고지식한 상사들이 많음 제약 업계 특징이겠지만 답답한 면이 있으나 깨어있는 사람도 종종 있음 문화를 개선하려고 하는건 있으나 윗물이 바뀌지 않으니 의미가 없음
52,동아제약(주),4533,도덕 관념 없는 관리자가 일을 못하고 팀 관리에 소홀하더라도 능력 요구를 바라면 오히려 욕 먹는다 주니어들은 닥치고 상명하복해야함 해당 분야에 전혀 지식 없는 관리자여도 한번 그 자리 꿰차면 고인물들 정년까지 보장된다 그들보다 더 이상한 인간들도 그랬기에. 그걸 지켜보는 주니어는 한숨이 나온다 박카스 하나 가지고 얼마나 갈런지 인사팀은 경력들 입사할 때 제발 래퍼 체크하세요
53,동아제약(주),4533,너무 힘들었어요.. 시간도 없고. 체력 약한사람은 못버틸것같아요
54,동아제약(주),4533,젊은꼰대 다수 포진하고있음 주인의식이 부족하여 일하는사람만 함
55,동아제약(주),4533,일하는곳 직원분들 나이대가 많으신편이여서 업무를 스스로 찾게되요...
56,동아제약(주),4533,닳고 닳은 고리타분한 문화 고인물 파티 젊은층과 기성세대가 융화되지 않음
57,동아제약(주),4533,출근시간퇴근시간 안지킴 일찍가면 열정없고 일찍오면 당연한거임 선임들은 놀기만하고 밑에 사람이 일다함 일도 체계적이지않아 다 겉햛기로 배워서 지식이 없음
58,동아제약(주),4533,"보수적인 문화가 적지 않은 곳에 산재해 있고, 변화에 대한 대응에 수동적인 부분이 있음."
59,동아제약(주),4533,꼰대가 많으며 복지 또한 많이 없다 연차가 쌓이면 쌓일수록 더 힘들다 부바부가 너무 심하다
60,동아제약(주),4533,"'서로 좋은게 좋은 거'라는 문화가 지배적이어서 잘못된 부분을 이야기하거나, 상대방이 불편한 이야기를 하는 것을 극도로 꺼려하는 문화가 있음.(특히 공채가 많은 생산이나 영업부문) 인간적인 부분일 수도 있고 좋은 점도 있으나, 그래서 더 뭔가 개선이 안되고 정체되는 느낌. 일부 능력자들이 사업의 성과를 끌어가고 문화도 바꾸려고 하나, 끈끈한 공채문화에서 막히는 느낌도 있음."
61,동아제약(주),4533,2조 2교대 지옥을 맛 볼 수 있으며 꼰대문화 최고다. 월긎체계는 많이 바뀌어서 모르겠지만 고졸에겐 미래가 없다. 초대졸는 지원해볼만하다
62,동아제약(주),4533,햐향평준화 되는 느낌이에요. 좋은 선배가 많이 없고 일부 부서 같이 하향평준화하자는 분위기입니다. 여자가 휴가도 많고 유리해요. 징징되면 다 들어줘요.
63,동아제약(주),4533,고인물이 많아서 라떼찾는 사람들이 많고 어디나 그렇듯 지켜보고 뒷말하는 사람들이 많음 회사가 조용해서 심심한지..
64,동아제약(주),4533,"일 못하면 편하고 일 잘하면 몰아주는 회사, 자기편에게는 노골적으로 편애를 봐주는 회사"
65,동아제약(주),4533,생산직 열정페이 존재 지켜지지 않는 페밀리데이 회사에 젊은 꼰대들이 엄청 많음 2교대 근무
66,동아제약(주),4533,규모에 비해 체계가 없다. 새로운 시도를 하려는 주도성이 떨어진다.
67,동아제약(주),4533,시스템에 제발 투자좀 하세요 SCM특히나 제대로좀 하세요 재고관리 안됨
68,동아제약(주),4533,무능한 사람들이 많음. 부서간 견제 심해서 맨날 서로 욕하고 싸움.
69,동아제약(주),4533,많이 일하는 만큼 주말 빼고는 쉬는 날이 없음. 꼰대들이 많이 사라지긴 했는데 젊은꼰대들 비유맞추기 힘듬.
70,동아제약(주),4533,"일이 너무 많음, 업무분담이 제대로 되어 있지 않아 혼동. 퇴근시간에 다들 바로 집을 안감."
71,동아제약(주),4533,생각이 너무 늙음. 꼰대 다수. 공휴일 못쉼. 연장의 기준이 애매함.
72,동아제약(주),4533,"안정적이기는 하지만, 일을 잘하는 사람에 대한 보상, 프리라이더들에 대한 평가가 분명하지 않은게 단점임"
73,동아제약(주),4533,부바부가 심한회사임 otc 생활건강 박카스 부서마다 완전다름 박카스는진짜힘듬
74,동아제약(주),4533,아주 보수적이고 몇몇 주요 부서 위주로 회사가 세팅됨. 규모에 비해 프로세스가 없음.
75,동아제약(주),4533,"변하지 않는다, 두돈탠탠하지만 그대로인 그게 장점이자 단점인거같은 회사"
76,동아제약(주),4533,꼰대가 많음. 다들 업무능력이 낮다고 생각함. 회식이 많고 사회적인 눈치를 많이줌.. 스트레스받음 ^^ 약사 >>>> 대졸 >> 초대졸 >>>> 고졸
77,동아제약(주),4533,"사업부간의 이기심은 없을수가 없는 구조로 되어있고, 영업직원 <<< 마케팅 영업본부의 파워가 타 회사보다 낮게 느껴지는 회사. 마케팅이 주도적으로 모든 부분을 운영하는 곳"
78,동아제약(주),4533,"회사가 오래되어서 그런지 복지가 너무 옛날 기준이다. 그리고 영업, 마케팅, 생산 부서간 알력이 있다"
79,동아제약(주),4533,젊은 사람이 많아서 의견 충돌이 쉽게 일어남. 제조팀을 너무 개처럼 부려먹음. 밥교대는 진짜 노답..
80,동아제약(주),4533,반대로 박카스 말곤 스타 제품이 없음 다음 먹거리를 찾아야하는데 아직 찾지 못한 회사
81,동아제약(주),4533,"아랫사람의 의견따윈 들으려하지 않음. 업무방식이 통보뿐임 본인맘에 안들면 그냥 끝임.  꽉막힌 군대문화, 주니어 계급은 시중정도로 생각하는듯함  코로나인데 몰래 회식함. 안가면 눈치줌  연봉인상이 쥐꼬리임. 중소 반도 안됨  떡값없음. 점점 복지 없어짐. 개인시간(점심시간)인데 휴식하면 눈치줌  일하는 팀만 뼈갈아 일하고 월급루팡, 담배타임러들 많음."
82,동아제약(주),4533,"일은 엄청 시켜놓고 대우는 안해줌 멍청한 사람 엄청 많음 일 안하고 노는 사람, 줄만 잘타면 승진 가능함"
83,동아제약(주),4533,"기본적으로 업무R&R이 명확하지 않음 그런데 단순히 그것만이 문제는 아닌 듯함 니일인지 내일이지 구분도 못하지만, 일단 내 일도 네 일이라고 떠넘기면 된다라는 생각이 지배적임 전반적으로 업무에 대한 기본적인 지식이 부족하고, 이게 동아스타일이야 어쩌라고?의 마인드가 느껴져서 불편함. 개선이 시급하다고 느꼈지만, 개선보다 이직이 빠르겠다는 생각이 드는 지점"
84,동아제약(주),4533,고인물도 확실히 많고 아첨꾼들이 요직에 있는 경우가 있음
85,동아제약(주),4533,공채출신아니면 적응어려워요 승진이나 여러가지 불합리합니다. 경력진은 알고오셔야될듯
86,동아제약(주),4533,St 위주의 통근버스 운영 제조팀은 열정페이 합니다. 연차도 회사 마음대로 쓰게합니다..
87,동아제약(주),4533,"사내분위기 보수적, 서로 험담 많이함, 고졸, 초대졸 생산파트 근무 여성 승진 거의 불가"
88,동아제약(주),4533,사람 잘 만나야하고 성장하기 힘듬. 라인 잘타야되는 회사
89,동아제약(주),4533,신약개발을 적극적으로 해야합니다. 블록버스터 제품에 의지하다가 골로 감..
90,동아제약(주),4533,인사체계가 다소 엉망이고 아무 협의도 없이(물론 윗 관리자들끼린 함) 인사 발령이 통보로 내려오는게 아주 별로다. 인사와 마찬가지로 평가도 치밀하게 하는척하지만 개판이다. 평가의 기준도 애매하고 비젼도 없으니 앞으로 신입 사원들이 믿고 이 회사를 다닐지 걱정이다.
91,동아제약(주),4533,"잦은 인사발령, 불투명한 승진 기준, 무능한 관리직, 업무분담의 불균형, 사내 정치 팽만, 일 잘하는 사람보다 술 잘먹고 아부하는 사람들이 더 잘 나가는 기업문화"
92,동아제약(주),4533,퇴근 시간...? 일단 기본적으로 의무로 정해진 근로시간 8시간은 거의 지켜진 적이 없음.
93,동아제약(주),4533,박카스에 너무 의존한 나머지 다른 사업에 대한 예산 집행이 잘되지않타보니 부바부. 평생 직장으로하기엔..
94,동아제약(주),4533,직원을 쓰다버리는 소모품 정도로 생각함. 코로나임에도 불구하고 회식이 잦음. 매출 이익이 어디로 가는지 모르겠다. 경력을 이어갈수 없다. 배울 수 있을만한게 많이 없다.
95,동아제약(주),4533,"아쉬운 복지포인트, 떡값이 복지포인트, 한정된 사업아이템, 현장에 연장자가 30대"
96,동아제약(주),4533,옛날식 업무처리. 혁신이 부족한 느낌. 고인물들이 많다.
97,동아제약(주),4533,"본인이 다닐 때는 매우 보수적인 분위기의 회사였음. 복장에 대한 제재도 있고, 출근도 빨리 해야하는 분위기. 그걸 견딜 수 있다면 다니시길…"
98,동아제약(주),4533,사내식당음식 쓰레기임 직원들끼리 따돌리는 문화 식당음식이 제일 기억에 남네요
99,동아제약(주),4533,상당히 보수적인 분위기의 사내 문화. 출근시간도 상당히 빠른편.
100,동아제약(주),4533,부바부가 심해서 힘든파트는 정말 불쌍해 보일정도로 힘듦 딱히 발전가능성이 보이지않음
101,동아제약(주),4533,문서작업이 많으며 열정페이가 존재함 이런 체계가 잡혀 버린것인지 열정페이가 당연하다고 느끼는 분위기 부바부 이겠지만 생산직군은 그런편인거 같음
102,동아제약(주),4533,워라벨만좋다 그게다인듯 연봉이 오르는게....좀짜다짜 사실 좋다..회사 만족
103,동아제약(주),4533,"여직원들 성추문 문제가 굉장히 많은데, 직원들 사이에서 쉬쉬하고 넘어갈 수 있는 정도에 가벼운 사안 아니냐는듯 회사 전체가 분위기가 이상함;"
104,동아제약(주),4533,다른 제약사에 비해 연봉이 낮음. 성과가 객관적이지 않음
105,동아제약(주),4533,"속은 썩어있다. 경력직이 적응하기에 힘든 그들만의 공채 문화가 있다. 제약업계 특성상 보수적인건 당연하고 경직되어있으며, 뭔가를 새롭게 받아들이는 데 시간이 걸린다. 역 피라미드 구조. 모든게 다 올드하다."
106,동아제약(주),4533,제약회사가 아니라 음료수회사라고 하면 적절함 GMP 규제 수준은 점점 올라가는데 팀장들이나 고인물들이 발전할생각없음. 그냥 생산만 쭉쭉 하면 장땡이라는 마인드. 박카스 먹고 큰 문제생길일은 없겠지만 다니는 직원들 입장에서는 발전이없음. 팀장들이 가장 문제라고 생각함 아는게 많이 없으면서 조질줄만암
107,동아제약(주),4533,"상여금 한 번 나옴, 떡값 없음, 휴가 쯤 임금 인상 소급분으로 휴가비 주는 척"
108,동아제약(주),4533,와서 직접 느끼면 안다. 어디를 가도 마찬가지겠지만 월급날 제외하고는 무기력하다.
109,동아제약(주),4533,"지하철역과의 거리, 주차시설의 부족이 큰 단점으로 꼽을 수 있음. 주차타워를 만들어주었으면 좋겠음."
110,동아제약(주),4533,회사 복지가 좋은 것은 크게 모르겠습니다. 회사 위치가 애매하고 별로 좋지 않습니다. 꼰대와 꽉 막힌 사람들이 일부 있을 수 있습니다.
111,동아제약(주),4533,사람을 자르지를 않는듯. 고인물들이 엄청 많고 역피라미드 구조
112,동아제약(주),4533,영업직무와 잘맞지않으면 오래다니기힘들것임. 보수적이고 상하 수직관계의 분위기임
113,동아제약(주),4533,"비현실적인 실적 목표와, 그에 따른 실적 압박이 매우 큽니다."
114,동아제약(주),4533,젊은 사람들로 구성되어 젊은 꼰대 및 꼰대 많음 근본적인 문제점을 해결하는게 아닌 문제 발생 시에만 대처
115,동아제약(주),4533,"소품종 대량생산으로 다른 제제를 다양하게 배우기는 어려움 (단, 이천공장은 가능함)"
116,동아제약(주),4533,"새로운 시도에 많이 인색한 편, 그래서 신사업에 대한 전망은 거의 전무함"
117,동아제약(주),4533,단체 휴무로 연차는 소진되지만 일이 많은 업무는 쉴 수 없음. 집에서도 일하고 출근을 하게 되는 경우도 많음.팀마다 그런 인력들이 많은데 회사에서는 모름.모르는 척을 하는 지 아님 모르고 싶은 지 알 수는 없는데 몰랐다고 함.말해서 알게 되어도 해결되는 부분 없음.박카스 템포 가그린 모닝케어 등등 소비자들에게 확실한 눈도장을 찍은 히트상품 위주로 돌아가야 하는 회사.다른 사업에는 도전하지 말아야 하는 회사.동아 공채가 아닌 다른 업계 경력 입사자들의 커리어는 철저히 무시되는 회사 이므로.(커리어와 다르게 다른 사업부로 팀으로 회사의 방침에 따라 어느 날 갑자기 보내지는 경우가 꽤 많음) 회사가 직원 개개인의 업무 파악을 못함.회사가 자기들이 지금 새로 하고 있는 사업이 뭔지 어떻게 시장이 흘러가는지 관심없고 하던 제약 방식 그대로 하길 원함.대체 여기를 어떻게 들어왔나 싶은 사람들도 있음.더 큰 문제는 그런 사람들보다 조용히 열심히 일하는 사람들이 저평가되는 일도 많다는 것.이건 동아 자체의 고질적인 문제.해결될 가능성 전혀 없음.
118,동아제약(주),4533,"보수적이고 위에서 내려오는 지시는 시대를 역행하고, 이치에 맞지 않는 것이라도 따라야 하는 곳. 성과 기준이 능력이 아닌 곳. 술자리를 많이 하면 살아 남을 수 있다. 새로운 사업은 하지 마라. 경력직 채용하지 마라. 조금이라도 양심이 있다면. 대체 kpi는 왜 하는 건가? 친분으로 평가하면서?"
119,동아제약(주),4533,"권력적입니다/폐쇄적입니다/보수적입니다/기업문화가 극심합니다/ 주임-대리는 못버티고 나가고 과장-차장이 가장 많은 다이아몬드형 기업인데, 그런 이유가 있습니다."
120,동아제약(주),4533,포괄임금으로 수당이 없어 급여가 아쉽다 직무적으로 발전할 기회가 적다고 생각됨
121,동아제약(주),4533,인사제도는 소통이 없어요. 성과평가제도가 엉망이에요. 포상 진급이 없음
122,동아제약(주),4533,발전 가능성이 없음. 대형 제약사라는 자만에 빠져 수렁에 빠져들고 있음
123,동아제약(주),4533,"낮에 노느라 자리 비우고 대체 어디갔는 지 모르다가 저녁에 야근하는 사람 말고.. 낮에도 치열하게 일하다 야근하는 사람을 제발 좀 챙겨주길. 일을 열심히 해도 정확한 평가를 받을 수 없음. 왜냐면 팀장이 팀원들 일을 이해못함. 이해도 낮음. 그런 사람을 채용한 건 인사팀 문제. 인사팀이 직무에 대한 이해, 능력 부족. 전문성이나 신뢰도 떨어짐. 성차별 이슈로 인해 근로감독받는 와중에 사람들 내침. 머리 써가며 교묘히 내침. 내부에서는 성차별보다 다른 차별이 많고 사장 한마디에 우수수수 사람들 인사이동되고 조직 개편이라는 미명하에 다른 팀, 공장으로 발령냄 ^ ^ 이런 기업이 아직까지 있다니.. 2021년에.. 태어나 처음 겪어보는 일들 많이 겪는 중."
124,동아제약(주),4533,다이나믹하고 뭔가 배우고 싶은 분들은 지원하지말것. 배울만한 사람이 적고 경력직이 입사해서 학을떼고 퇴사가 다분함
125,동아제약(주),4533,오래근무를안해서 잘모르겠습니다 매출압박때문에힘들어하는것같긴하던데 어딜가던지 다그러니깐요ㅜㅜ 영업직원들또한 힘을 내야겠죠
126,동아제약(주),4533,성장이　정체되고　보수적이다　가슴뛰는　마음을　가지기　쉽지않다
127,동아제약(주),4533,마케팅 총괄과 중간관리자 의견이 일하지 않아 실무자가 일을 두번함. 팀장급은 업무만 주고 디렉션은 없음. 경력자니까 다 알아서 하는건 좋은데 업무경계가 확실하지 않아서 가르마타는 중
128,동아제약(주),4533,"보고서 많고, 보수적인 회사라서 하기 싫은 업무가 많아요"
