,company_name,company_id,review_text
0,두비스,4786,"1. 기본급 및 연봉 인상률이 타 업체에 비하여 낮다.  - 최근 기본급을 전체적으로 올렸다. 하지만 그래도 낮다. 또한 매년 정해진 고정 금액이 오르기 때문에 연봉 협상은 없다.  2. 중소기업이 대부분 비슷하지만 큰 복지는 없다.  - 명절 상여금 30  3. 청년내일채움공제를 연봉 인상 금액에 포함 된 것처럼 말한다.  - 기가 차서 말이 안 나온다. 전에는 연봉도 퇴직금 포함이였지만 직원들의 항의로 사라짐  4. 경영진이 직원을 돈으로 생각 하고 있다.  - 회사의 분위기를 나타낸다.  5. 퇴사 예정 직원에게 '이 바닥 좁다', '소문이 안 좋게 날 수 있다' 내용의 반 협박을 한다.  - 정작 고객사 및 프리랜서들 사이에서 회사 소문이 안 좋게 나고 있는 것을 모르는 것 같다.  6. 전체적인 프로젝트 운영 방식이 굉장히 비효율적이다.  - 제대로 된 협의를 하지 못하고 들어오는 고객사의 요청을 다 받아주느라 시간을 낭비하며 이로 인하여 개발 스케줄이 지체 되고 야근과 주말 출근이 매 프로젝트 마다 반복 된다.  7. 인력관리가 되지 않는다.  - 프리랜서가 본인 개발이 끝나지 않았는데 계약 기간이 끝나서 가버리면 정규직이 야근과 주말 출근을 하며 부족한 부분을 채워야 한다. 개발자의 특성 상 내 할 일이 끝나지 않아 야근과 주말 출근을 하면 이해 하겠지만 내가 맡은 파트는 마무리 했는데 남의 일을 하느라 야근과 주말 출근을 해야 한다.  8. 초반 교육 및 사수 개념이 없다.  9. 업무를 열심히 해도 그렇지 못한 직원과 똑같거나 더 못한 대우를 받는다.  10. 파견직  - 본인의 현재 상황에 따라 장점이 될 수도 단점이 될 수도 있다.  11. 가족 회사  총 정리  퇴사자들이 잡플래닛에 소중한 시간 들여가며 리뷰를 적는 곳은 이유가 다 있다."
1,두비스,4786,1.급여가 매우 짭니다 동종업계에서 탑안에 들정도로 짭니다.2.복지가 없으며 직원들의 불만이나 요구사항을 들어주지도 않습니다 3.야근이 매우 잦고 주말에도 전화해서 시키며 야근 주말출근이 당연한것도 아닌데 시키면 해야된다는 마인드가 깔려있고 직원들을 노예로생각하는지 그에따른 보상이 전혀 없습니다 4.케어해주는사람도 없어서 자기가 혼자 살아남아야됩니다
2,두비스,4786,"1. 기본 연봉이 너무 짜다(동종업계보다 현저히 낮음) 2. 급여 인상률이 현저히 적다. 3. 복지라고는 하나도 없음( 월급 안밀리는게 복지라 생각함) 4. 고객사 니즈 커트 없음(경영진 마인드에 을의 생각 장착) 5. 연말에 들어오면 다음해 연초에 들어오는 직원들보다 연봉이 적어진다.( 물가상승률로 인한 차이라는데 그렇게 따질거면 연초에 모든 직원을 재산정해야 맞는건데 생각이 단순한건지 사람을 호구로보는건지 모르겠다?) 6. 프리들이 제대로 마무리 안하고 나가면 정규직이 그 부분 땜빵( 정규직은 그냥 인부임) 7. 퇴직금 포함연봉이라는 기괴한 말장난(이건 없어짐) 8. 소개를 받아서 계약할때도 이미 단가가 얘기된후에 왔음에도 후려침 9. 운이 안좋은 신입들은 몇달간 방치당함(문서작업, 테스트) 10. SI업체들이 뻥튀기 하는건 알지만 여기는 그 차익이 어마어마함 11. 야근, 주말 출근이 당연한거라 생각( 이건 어느정도 이해) 12. 신입들은 얼마든지 대체가능한 소모품이라 생각함 13. 대표가 직원을 돈으로 봄"
3,두비스,4786,"1. 급여는 밀리지 않지만 기본 급여가 짜다( 급여가 짠데 밀리지않는게 본인들 회사 유일한 장점이라 생각) 2. 급여 인상률이 현저히 적다. (동종업계 반에도 못미침) 3. 복지라고는 하나가 없다. (1번처럼 급여 안밀리는게 복지라 생각) 4. 고객사 니즈 커트 없음( 경영진들 마인드에 을의 생각 장착) 5. 연말에 들어오면 다음해 연초에 들어오는 직원들보다 연봉이 적어진다.( 물가상승률을 고려해서 연초에 입사한 직원들을 더 올려줬다 하는데 내 물가는 안올랐나? 그렇게 따질거면 연초에 모든 직원을 재산정해야하는게 맞지않나 싶다) 6. 프리들이 제대로 안하고 나가면 정규직이 그 부분을 땜빵한다. ( 정규직은 그냥 인부임) 7. 퇴직금 포함 연봉이라는 기괴한 말장난(지금은 없어짐) 8. 소개를 받고 계약할때 이미 페이 얘기를 오케이 하고 왔음에도 다시 후려침 9. 운이 안좋은 신입들은 몇달간 방치당함(문서작업, 테스터 등) 10. SI업체들이 경력뻥튀기하는건 알지만 여기는 그 차익이 어마무시함 11. 야근, 주말출근이 당연한거라 생각( 이건 어느정도 이해) 12. 신입들은 얼마든지 대체가능한 소모품이라 생각 13. 대표가 직원을 돈으로 봄 14. 업무를 배우고 알려줄 사수 없음 15. 임원진들 사이에서도 커뮤니케이션이 안됨 16. 당연한거를 바라면 머리가 컸다고 생각 17. 주 100시간 이상 근무를 2달정도 해도 돌아오는 인센은 100만원( 신안 염전인가 착각함 ) 18. 대표가 직원을 함부로 대한다.( 부장급에게도 이름 띡띡 부름)"
4,두비스,4786,급여가 너무 적고 물가상승 고려를 한쪽에만 치우쳐있음
5,두비스,4786,"돈.. 복지.. 비전 말고는 하나도 없는 회사 참고로 연봉도 퇴포임 나 빼고 다 부장, 이사"
6,두비스,4786,야근 철야 필수 고객사에서 원하는것 필터링 없이 전부 개발자에게 옴 전직원의 노예화
7,두비스,4786,SI프로젝트를 주로 하다보니 휴일근무가 많은 편입니다 이건 회사문제라기 보다는 업계 전반의 문제니 넘어가도 본사에 교육시스템이 따로 없습니다 영업이사나 대표이사가 다음 프로젝트를 어디로 가라고 지시해 주는 주먹구구식
