,company_name,company_id,review_text
0,마음정보,2657,낮은 임금... 회사는 돈땜에 다니는건데 임금이 너무 짜다
1,마음정보,2657,SI 잘못걸리면 몇달동안 야근만합니다. 연봉이 불평등합니다.
2,마음정보,2657,대기업들 상대로 일해볼수 있는점은 좋지만 디자이너는 딱히 크게 프레임이바뀌는 디자인을 하는게 아니라서 포폴로 쓸수없는 디자인을 할때도 많음
3,마음정보,2657,요즘 시대에 뒤처진 구닥다리 기업 문화와. 형평성이란것 없는 정글
4,마음정보,2657,프로젝트 수주를 많이 받지 못하여 개발자로서 성장하기 힘듬. 무조건 야근을 해야하는 꼰대 마인드. SM팀을 3명으로 운영하여 SM팀만 업무 과부하 걸림.
5,마음정보,2657,"일을 배우고싶어도, 일이 없어서 못배운다. 본사에서는 너무 일이없어서 놀고, 출장가서는 일은 있으나 야근할 정도는 아니지만, 이유없이 야근했다."
6,마음정보,2657,노츠의 춘추 전국시대는끝이나고 모바일의 바람 마져 끝이나고 후발 주자들의 가격 경쟁력까지 있으니 주력사업에서의 이익이 적으니 직원들의 이익또한 적다. 그리하여 실력좋은 직장 동려를 만나기 힘든점 영업력의 부진
7,마음정보,2657,쥐꼬리 같은 연봉에 프로젝트나가면 야근을 마니하지만 그에 대한 보상은 하나도 없음
8,마음정보,2657,야근이 잦고 연봉의 인상폭이 적은 편입니다. 서비스사업부(SI 부서)의경우 notes라는 기술의 폐쇄성. SM과 SI의 영역이 모호하여 자기가 나갔던 프로젝트의 유지보수를 해야하는 경우가 잦았는데 업무가 과중하게 겹치기도하다. SM을 전담하는 사람이 존재하긴 하지만 부족하다.
