,company_name,company_id,review_text
0,메이커스앤파트너스,11503,"맡은 클라이언트는 나름 업계 난다긴다하는 대형이 있었지만 그에 걸맞지 않은 내부 퀄리티. 뭔가 급조하는 느낌이 없지 않았고 당시엔 팀이 제대로 꾸려지지 않아 일당백을 원했음. 기획자는 A부터 Z까지, 심지어 디자인도 해야했음."
1,메이커스앤파트너스,11503,체계가 없음 인수인계가 부족 신입에게 과도한 업무 할당 책임도 신입에게 그러나 연봉은 신입 연봉
2,메이커스앤파트너스,11503,"회사 분위기 조용하고, 적은 인원이 많은 브랜드 운영 중이다보니 야근 많음 사수, 상사에게 배울 수 있는 분위기는 아님. 치열함"
3,메이커스앤파트너스,11503,엄청난 야근에 시달릴 수 있음 그리고 회사가 그냥 회사 건물이 아니라 아파트 같은곳에서 일한다고 생각하면 됩니다 월급이 너무 적습니다
4,메이커스앤파트너스,11503,퇴근을 일찍 하기에는 눈치보임. 자신의 일이 모두 끝나고 다른 분야가 바쁘다면 그쪽 일을 도와줘야 함
5,메이커스앤파트너스,11503,중간급이 없어서 벅차게 돌아가는 구조여서 길게버티기 힘들다
6,메이커스앤파트너스,11503,클라이언트 제안서 비딩 들어가면 야근이 너무 빡셈 잘하는 팀은 계속 제안서 쓰면서 실무도 겸함
7,메이커스앤파트너스,11503,여초회사인데 분위기 기싸움이 오져서 새우등 터짐 출근한지 이틀도 되지 않아 인턴에게 반말하고 본인은 뒤끝 없는 사람이라 이렇게 솔직하게 말하는 거라고 하며 막말을 정당화함. 진짜 본인을 위해서 해준 말인 양 사람 후려치는 재주가 치가 떨림
8,메이커스앤파트너스,11503,체계가 없음 사람들 인성이 별로임 연차 눈치보면서 써야함 신입한테 일 다 시킴
9,메이커스앤파트너스,11503,잦은 팀원 교체로 파트너쉽을 느낄 즈음이면 다시 뉴 페이스가 등장.
10,메이커스앤파트너스,11503,회사에 크게 단점을 느낀 건 없었습니다. 하지만 회사 근처 문제로 가까운 식당들 중에 점심을 제대로 먹을만한 곳이 많이 없습니다.
11,메이커스앤파트너스,11503,나쁜점을 뽑자면 눈치를 좀 많이 보게되며 상위 위 개념의 기업과 일을 하기때문에 생각할게 굉장히 많습니다
12,메이커스앤파트너스,11503,"전체적으로 나이 어리고 경력 그다지 오래지도 않고 해서 롤모델로 삼거나 체계적으로 일 가르쳐 줄 사람도 없음. 다들 제 배만 채우기 급급함. 여기서 배우는게 있다면 그냥 본인이 직접 몸 부딪혀가며 개고생해서 배우는건데, 다른데 연봉 괜찮고 어느정도 체계잡힌 에이전시도 있는데 왜 여기서 굳이?"
13,메이커스앤파트너스,11503,"작은 회사라 숨을 곳이 없다. 신입도 일당백을 해야하고, 알아서 눈치 빠르게 행동하고 자기 자리를 찾아가야 하는 곳. 보통만 하려다가 아무것도 못하고 나가는 사람있다. 큰 대행사라면 안해도 되는 일도 하게 될 수 있다."
14,메이커스앤파트너스,11503,제안서 작업이 들어가면 미친듯한 새벽 야근을 하고 커뮤니케이션이 잘 되지 않는 느낌.
15,메이커스앤파트너스,11503,야근이 많다. 제안서 작업이 많다. 비딩 성공시에 딱히 혜택이 없다. 일만 조금 더 늘어난다. 딱히 특별한 직원 복지가 없다.
16,메이커스앤파트너스,11503,급하다고 또는 아는 사람이라고 노답 인력을 뽑아서기존 인원을 힘들게함 기본급 적음 운영 및 수익 분배 구조가 투명하지 못했었음
17,메이커스앤파트너스,11503,제안작업을 할때나 클라이언트가 보고서를 요구할때는 야근하는 경우가 있다. 일이 급박하게 흘러가는 경우가 있어 정신 바짝차리지 않으면 큰 실수로 이어지는 경우가 있어서 정신 단디 챙겨야 한다는 거. 물론 모든 기업들이 다 그렇겠지만.
18,메이커스앤파트너스,11503,"업무 R&R이 명확하지 않아서 일이 한 명에게 몰릴 때가 있다, 업무 강도가 센 편으로 종종 야근하곤 한다 (칼퇴할 때도 있지만)"
19,메이커스앤파트너스,11503,"탕비실 간식 빼고 모든 것이 단점인 회사 낮은 연봉에 요즘도 걷는진 모르겠는데 한 때 지각비를 걷었음 학교냐? 야근하면 야근수당 주냐? 대표 리얼 꼰대 대답 '네, 알겠습니다.'로 하라 그럼"
20,메이커스앤파트너스,11503,"1. 질문을 하지말라고함 이유는 질문많이한사람은 능력이 없다고함 2.일이 그냥 너무 많음 디자이너 안뽑고 마케팅부채용 해놓고 포토샵실력 늘려야 살아 남는다, 디자인 보는 눈이 심각하다 등등 사람기죽이기 일등 3. 인턴 왕창 뽑아놓고 거의 서바이벌 게임처럼 떨굼 정규직 전환원하는 분들은 줄 잘타보세요 3개월 박봉 4. 잔 심부름꾼,텃세ㅇㅇ 당연히 있음 5. 여초 회사 6. 눈치게임 파이팅"
21,메이커스앤파트너스,11503,"인턴의 재량을 강조하면서, 물어보지 않고 스스로 일처리하기를 원하지만 자신이 원하는 방향이 아니거나 잔실수가 있으면 용납되지 않는 이상한 분위기. 같은 실수도 어떤 사람이 했느냐에 따라 다른 반응. 남자분들에게 관대. 사무실에서 화내며 소리지르는 소리가 자주 들려오며, 업무외적인 뒷담화가 많이 오가는 전쟁터. 클라이언트가 주는 스트레스보다 회사 내부에서 생기는 스트레스가 더 큰 이상한 구조"
22,메이커스앤파트너스,11503,체계적인 교육 시스템이 없어 신입에게 추천하지 않음. 승진 어려움. 야근수당을 챙겨주나 야근을 하지 못하도록 눈치를 줘서 되도록 집에서 잔업하는 경우가 많음. 근속 연수가 짧은 데에는 이유가 있다고 생각함. 부서 체계에 중간급이 아무도 없고 팀장 차장 바로 인턴으로만 구성되어 팀이 주먹구구 식으로 돌아감. 차장급이 본인 취향에 안맞는다는 이유로 막말하며 애꿎은 인턴들을 갈궈대니 인턴들이 버텨낼 수 있을리가. 애초에 포토샵 하는 사람을 뽑고 일을 시키던가 할줄 모르는 사람 뽑아놓고선 바라는 게 많음. 디자이너 한명으로 어찌어찌 회사가 돌아가고 있으나 업무에 구분은 딱히 없고 모든 걸 다 하고 있음.
23,메이커스앤파트너스,11503,고작 인턴한테 너무 많은 걸 요구함. 말그대로 인턴 갈아쓰면서 버티는 애만 데리고감. 근데 그마저도 빡세고 힘들게 일함. 체계적으로 신입을 가르치는게 아니라 일단 맡겨놓고 안되면 뭐라하고 수습하는 식. 일하는 체계가 없이 정신없음.
24,메이커스앤파트너스,11503,"말 그대로 인턴들 갈아서 돌아감. 일반 사원과 직급 있는 상사들 전부 합쳐도 인턴들 수가 훨씬 더 많음. 반 이상이 인턴. 온갖 잡무부터 중요한 일까지 인턴들에게 맡기고, 배우러 오는 곳이 아니라고 몇 번씩 강조. 인턴이 뭔지 제대로 모르는 듯함. 인턴이라는 단어를 사용하고, 최저 급여 지급하면서 그런 말은 좀... 사람들 좋다고 하는데 그것도 잘 모르겠음. 윗사람이 아랫사람한테 무조건 반말함. 좋게 할 말도 악을 쓰면서 함. 공간이 좁아 공장처럼 붙어 앉아 있는데, 분위기가 살벌해 인턴들 모두 군기 바짝 들어가 어깨에 힘주고 있음. 벨소리 한 번 이상 울리면 여기저기 째려보고 난리 남. 남들 혼나는 것 보면서 실수 안 한 사람까지 스트레스받을 수밖에 없는 구조. 그렇게 고래고래 소리까지 질러가면서 혼내실 거면 따로 불러서 하시지. 무슨 군대인 줄 알았어요. 갓 졸업해서 아무것도 모르는 애들 데리고 뼈와 살 갈아서 돌아갑니다. 디자이너는 거의 없다고 생각하시면 돼요. 덕분에 기획이 아무리 좋아도 제작하고 보면 콘텐츠 퀄리티가 평균 이하임. 여러 가지 업무를 도맡아 이것저것 많이 배울 수 있다고는 하지만 전문성 기르기는 어려워요. 이곳에서 익힌 것들이 추후 이직 시에 큰 도움이 될지는 잘 모르겠네요. 이곳 1년차 경력과 다른 곳 1년차 경력의 능력치는 아주 많이 다를 듯합니다."
25,메이커스앤파트너스,11503,"디자이너 한 명, 일은 많음. 가성비가 장점인 회사라 고객사는 좋겠지만 직원은 일이 많다."
26,메이커스앤파트너스,11503,"1. 프로세스가 체계적이지 않아서 승진 시스템이나 정규직 전환이 어떤 식으로 돌아가는지 모르겠음. 인사권을 쥐고 있는 팀장급과 차장급 마음에 안들면 바로 짤림. 2. 인력은 필요로 하면서 돈은 없어 인턴을 소모품처럼 사용한다. 정규직 전환이 매우 어려운 편. 3. 일을 제대로 알려주지도 않고 업무를 떠넘기며 잘못했을 시 모든 것이 내 탓이 된다. 4. 야근식대, 야근수당 주기 싫어서 야근도 못하게 한다. 일은 많이 주면서 야근 못하게 하는 건 무슨 심보인지... 5. 콘텐츠 만드는 데 필요한 용품을 사오라고 먼 곳까지 심부름 시키면서 교통비 지원 안해줌. 개인 사비로 다녀와야한다.  인턴이든 정규직으로든 들어와서 일주일도 못버티고 나가는 사람이 태반."
27,메이커스앤파트너스,11503,"단, 제안서를 쓸때는 야근을 일주일이상 해야하는 날이 있어 피곤함. 기존에 하던일도 하고 제안서도 쓰고 하면 많이 힘듬. 20명정도 되는 작은 회사회사이다 보니 복지는 별루임. 팀간 교류도 별로 없는 편. 인센티브 많을때는 좋지만 그만큼 일도 많음."
28,메이커스앤파트너스,11503,"기본 복지만 있어서 (생일날 상품권, 경조사비 등) 아쉽고, 가끔은 일이 너무 많아 야근이 잦아지는 시기가 있다. 회사 내부 규모가 작아 촬영 콘텐츠를 제작할땐 불편하다."
29,메이커스앤파트너스,11503,"다른 에이전시에 비해 규모가 작으나 그에 비해 일이 많고 끊이지 않아 야근 잦아질 때 있음 팀장이 인센티브 배분하기 때문에 역량에 따라 평사원도 많은 액수의 월급 가져갈 수 있으나 팀장도, 팀원도 인센에 대한 스트레스가 은근 있음 딱 기본 복지만 있음(생일에 문화상품권, 명절선물, 경조사..)"
30,메이커스앤파트너스,11503,"인센티브제를 하는 이유를 모르겠음, 기존 연봉제보다 팀별로 남는 이익이 많을 것이다라는 전제하여 시작된 월급체계이나, 반드시 그렇지는 않고, 각 팀원과 상사와 부하직원별로 월급 차이가 상당히 큼. 자신의 재량하에 월급을 분배할 수 있는 팀장에게는 정말 좋은 월급체계. 인센티브제의 장점을 부각해 시작된 월급체계이나, 빛좋은 개살구. 인센티브제를 악용하여, 월급만 독식하고 자신의 직급에 맞지 않게 일을 제대로 하지 않는 팀장도 존재."
31,메이커스앤파트너스,11503,팀 마다 다르겠지만 우리 팀장은 진짜 일을 안했음. 잘되면 자기 탓. 문제가 생기면 사원 탓. 팀장이 월급을 나누는 독식 시스템과 입사 2년만에 과장이 되는 이상한 승진 시스템.
32,메이커스앤파트너스,11503,프로젝트 안되면 내탓(심지어 내잘못도 아닌데 기준이 없음 - 채용도 퇴사도 상황에 따라 달라짐 프로젝트 수가 중요함 - 정작 사원의 삶의질은 후퇴중 대표님의 마인드는 좋으나 말뿐인 직원복지 -월급분배 팀장권한 정당히 일하고 돈받는데 팀장이 자기돈 주는것처럼 생색냄
33,메이커스앤파트너스,11503,오래 머물기보다는 스쳐가는곳이라 생각하길. 사내 분위기는 뒷얘기가 많은편. 진정한 내 편 없으면 버티기 힘듬. 돈 없다고 이해안가는 이유로 사람 자름. 월급체계가 분명하지 않고 인센티브 제도 이긴 하나 명확하게 명시된 비율은 없음. 월급 팀장 독식 가능.
34,메이커스앤파트너스,11503,체계화 되있지 않은 팀 구성. 많은 야근과 낮은 급여. 걍 생초짜 신입 아니면 경력직이어서 업무적 조화가 없음
