,company_name,company_id,review_text
0,메이데이파트너스,11507,"구성원들의 잦은 퇴사, 고인물들의 정치, 팀장급들의 디렉션이 명확하지 않아 갈려나가는 직원들, 무리한 업무 확장 등.. 구성원들이 노력을 하기 위해서는 걸맞는 보상이 필요하지만 그에 대한 대우가 전무하다고 생각함 (인센티브 제도 X, 현재는 모르겠지만..)  오래 다니는 분들..존경합니다 어떻게 그렇게까지 근성이 대단하신지.. 탈출은 지능순입니다."
1,메이데이파트너스,11507,야근을 정말 너어어어어무 많이 한다 어느정도냐면 9시 30분에 출근해서 다음날 9시 30분에 퇴근한다 그리고 대표님이 기분파라 기분이 안 좋은 날은 사원들한테 괜히 승질내고 다닌다
2,메이데이파트너스,11507,야근하고 철야한다고 알아주지 않음. 고생해봤자 아부떠는 직원만 인정해주는 기업
3,메이데이파트너스,11507,"대표가 가장문제, 대표의 기분대로 하루가 가고 직원을 대체가능한 부속품으로 생각"
4,메이데이파트너스,11507,"자본금 없음, 체계 없음, 경영진들이 무슨 생각을 하고있는지 모르겠음, 회사를 키울 생각이 있는지 헛된 꿈만 꾸고 현실은 시궁창임"
5,메이데이파트너스,11507,자금문제와 밥값 못하는 사람들을 잔뜩 데리고 있다는 것
6,메이데이파트너스,11507,상급자들도 서로 의견이 달라 눈치보이게 만들었다. 일방적인 의견을 내세우는 편
7,메이데이파트너스,11507,능력없는 사람들이 너무 많음(특히 임원들) 제안서를 쓰는 사람만 씀 윗선에서는 영업한다고 하나 거의 허당 갑자기 임원이 막 생겨남 제대로된 내규가 없고 금새 바뀜 서로서로 시기와 질투의 장 헛된꿈만 꾸는 기업
8,메이데이파트너스,11507,"대행사의 특성상 어쩔 수 없게 존재하는 야근이지만 재직 당시 너무 심하게 존재했음  상여금이 있다고 듣고 입사했지만 제대로 된 공지 없이 조용히 없어짐 회사의 복지가 없어지는 걸 공지가 아닌 소문으로 들으면서 알아가야 했던 점이 아쉬움  입사 초반엔 비전이 있다는 걸 인지하고 열심히 달렸으나, 달린 만큼의 보상이 없었던 것 같음 상여금은 그렇다 쳐도 야근이 많고 야근 수당이 따로 존재하지 않으면서 물가반영도 안된 금액인 인당 만원으로 제한 두는 것도 아쉬웠음  회사에 대해 알아둬야 할 정보는 대외비로 알리지 않으시면서 굳이 몰라도 될 정보는 알게 되었던 이상한 분위기  야근을 하지 않으면 일을 열심히 하지 않는다라고 생각하는 분위기가 강했음  마케터들의 컴퓨터는 포토샵 하나 열리지 않을 정도의 옛날 스펙 장비 업그레이드가 필요해보임"
9,메이데이파트너스,11507,"다양한 온라인 마케팅을 배우기 때문에 어느 하나에 집중하기 힘들 수 있으며 결재 승인이 오래 걸려 급한 일이라면 결재 올리고 바로 상급자에게 보고하는 편이 좋음, 지금은 어떨지 모르겠음"
10,메이데이파트너스,11507,"사무실이 뚤려있어 팀분위기를 다 알수있음. 어쩔땐 여기저기서 노래를 틀고 어쩔땐 숨막힐정도로 조용해서 멀리있는 팀에서 큰소리나면 다들림. 그래서 팀원들이 팀장눈치, 본부장눈치 엄청봄.  팀 이름이 계속바뀌고 나가려고하면 다양한 이유들로 붙잡음. 정작 나가려는 이유에 대한 해결책은 없음. 야근하는걸 당연시하며 야근하면 윗사람들이 좋아함. 일열심히하는줄알음. 대체휴무가 있지만 써야하는만큼 쓸수없을 정도의 업무량으로 쓸수도없고 눈치보임.  윗사람들은 자기들딴엔 장난식으로 얘기한다지만 도넘을때가 종종잇고 자기 스스로는 굉장히 쿨하다고 생각하는것 같음.  한사람으로인해 팀이 아작나는 경우와 퇴사를 줄줄이하는경우가 많음. 괜찬다고 할만한 팀이 전혀 없음."
11,메이데이파트너스,11507,"본부별 업무처리량 차이 심하며, 능력없는 자리만 차지하는 리더들이 몇 있음 인격모독을 주로 일삼는경우가 있음 광고회사라 근무 외 시간 추가근무는 어쩔수없지만, 당연시하는 분위기며 칼퇴를 하는것을 본적이없음. 능력은 잘 모르겠고 꼰대 수두룩, 권위적인 리더 다수 포진 돈 벌어오는 사업 잘 진행하는 본부의 리더는 한명정도? 대표 2명의 기분에 따라 회사분위기가 매번 달라짐"
12,메이데이파트너스,11507,팀마다 다르지만 연차 쓸 때 살짝 눈치주며 야근을 당연하게 생각함 그에 대한 야근수당이나 복지 없음
13,메이데이파트너스,11507,장점과 비슷하지만 정시퇴근할 수 있는 업무량을 안줘서 퇴근을 못해요. 사수도 없이 신입직원 혼자서 야근할때도 많습니다.
14,메이데이파트너스,11507,생각보다 야근이 많습니다. 눈치보지 않고 퇴근할 수 있는 분위기 조성이 필요합니다.
15,메이데이파트너스,11507,야근이 너무 많음 (새벽 2-3시는 기본) 대표가 너무 기분파라서 기분 안좋은 날은 휴.. 야근이 정말 많음 (다음날 9시에도 퇴근한 적 있음) 야근이 상상을 초월함
16,메이데이파트너스,11507,야근이 많아도 너무 많다 신입이어도 야근합니다 몇몇 예의 안지키시는 분들 존재
17,메이데이파트너스,11507,1. 광고회사답게 야근이 많음 2. 사실 직원복지가 좋은건지... 모르겠음
18,메이데이파트너스,11507,적은 인원과 많은 일 야근이 많지만 함께 하는 동료들이 있어 버틸 수 있는 곳
19,메이데이파트너스,11507,팀바팀이지만 업무시 소통 잘 안돼서 일처리 비효율적임 야근 굉장히 많음
20,메이데이파트너스,11507,야근이 너무 많기도 하고 경영진은 무슨 뽕에 취해있는데 아래 사원들은 자잘한 업무도 너무 많고 어느정도 경력이 쌓이면 이직을 하는 것을 추천한다. 체계가 너무 없기도 하고 남자들의 뒷담화 여자들의 뒷담화 다양하게 많은 곳이다
21,메이데이파트너스,11507,야근이 정말 많다. 많은 프로젝트를 적은 인원으로 운영한다.
22,메이데이파트너스,11507,"야근이 많고, 회사 직원들이 젊은데 꼰대가 많음 꼰대가 많은데 회사가 작아서 그런지 체계가 다소 없음"
23,메이데이파트너스,11507,워라밸 없는거 정말 심하고 인생갈아 넣어야함 계쏙 다니고싶다면
24,메이데이파트너스,11507,야근 많음. 바쁠 땐 진짜 바쁨. 야근의 기준이 달라지는 느낌 줄 수 있음.
25,메이데이파트너스,11507,프로젝트나 제안일정이 겹치게 되면 야근이 많은 편. 회사가 성장하며 신규 확장 되는 사업들도 많아서 빠른 적응이 필요함.
26,메이데이파트너스,11507,일이 너무너무 많아 워라밸을 지키는 것에 어려움이 있다
27,메이데이파트너스,11507,"그들만의 리그. 특정 팀장들의 업무 기피화, 이렇게 일을 해야 너희들의 실력이 향상된다는 말..흠 글쎄요? 고인 물들의 정치, 신입에게 업무 지시 진행 시 날카로운 언행 등.. 팀장들의 방치, 몇몇 실무진들의 정치, 신입들의 매우 잦은 퇴사.. 왜일까요? 많은 양의 업무 지시, 그리고 동시에 업무를 다 해내지 못할 시 맷집이 없다는 이유로 요즘 MZ세대는 안된다.. 모두들 그러시면 안됩니다. 느끼는 바가 있으시길."
28,메이데이파트너스,11507,야근이 너무 많고 윗사람들만 버티고 밑에 신입들은 다 나감
29,메이데이파트너스,11507,다양한 업무가 들어오는데 항상 일정이 겹치고 많아서 너무 힘들다. 복지는 좋으나 업무가 너무 많음.. 모든 직원들이 거의 야근하는것같다
30,메이데이파트너스,11507,옛날에 다녔던 기억으로는 야근 많이 하면 일 잘하는 줄 아는 곳. 담배 피러 가는 시간에 일 하면 정시퇴근 할 것 같은 몇몇 직원들. 심지어 수습기간중인 직원이나 인턴들도 야근하더라ㅎㅎ
31,메이데이파트너스,11507,야근이 좀 많습니다. 비딩 시즌에는 집에 잘 못들어가요
32,메이데이파트너스,11507,"저녁이 있다는건 매일매일 야근이 있다는 것이고, 마케팅 회사의 특성상 너무나 치열한 곳. 내가 노력하고 열심히 해도 결과론이기에 결과가 좋지 않으면 그에 따른 쓴소리도 오롯이 내 몫. 멘탈 강한분들에게는 추천."
33,메이데이파트너스,11507,빠르게 성장하는만큼 일도 많다 기업문화를 여러 관점에서 만드려 하는데 과도기인점은 분명하다
34,메이데이파트너스,11507,신입이 적응하기에는 다소 힘들때도 있을 것 같다는 생각
35,메이데이파트너스,11507,야근이 많아도 너무 많다 진짜 일상 생활을 포기해야할 만큼 야근이 많은건 사실이다
36,메이데이파트너스,11507,팀내 비효율적인 업무 분담 팀바팀이지만 사람이 갈아지는걸 직접 목격할 수 있다 일하는 사람만 하는 눈에 다 보이는게 현실
37,메이데이파트너스,11507,체계가 없음 일을 이렇게 한다고???? 하는데 다 됨 되게 가족같은 분위기.......
38,메이데이파트너스,11507,여타 광고대행사와 같이 야근이 많음 대행사가 야근이 없는날이 흔하지 않은것도 이상할정도 몸이 많이 피곤하다는게 느껴짐
39,메이데이파트너스,11507,아주 구식으로 돌아감 멘땅에 헤딩 건강에 좋지않음 비흡연자에겐 정말 비추천합니다..
40,메이데이파트너스,11507,"1. 말도 안 되는 야근량으로 평일 생활이 완전 불가능 (기본 밤 11시 퇴근 / 다음날 아침 9시 퇴근한 적도 있음) 2. 대표님 기분 안 좋으면 직원들에게 완전 승질 (그날은 대표님 마주치면 안 됨) 3. 팀 업무하기도 바쁜데 대표님이 시키는 업무까지 추가 (심부름, 개인적인 업무 등)"
41,메이데이파트너스,11507,출근시간이 비교적 자유롭다는건 퇴근이 일정치 못하다는 뜻. 대표의 의지에 많은것이 달려있따. 야근이 많다
42,메이데이파트너스,11507,회사에 건의사항들이 받아지지않음. 야근이 너무 많음. 직원 나이대가 낮은편이지만 문화 및 구조는 수직적.
43,메이데이파트너스,11507,어느 광고대행사나 머..다 마찬가지지만 빡시다. 머 이게 싫으면 광고회사 못다니지만..
44,메이데이파트너스,11507,"성장하는 회사들의 공통점이며, 해당 업종들에게 취약한 점인 야근이 많음."
45,메이데이파트너스,11507,"다소 기분파적인 대표를 맞춰야 하며, 눈치 보이는 휴가 일정과 삭막한 업무 분위기. 소위 꼰대 밭."
46,메이데이파트너스,11507,"업무가 체계적이지 않고, 다들 짬을 너무 많이 때림. (짬 때린 뒤 자신이 한 것처럼 보고) 직원들의 연령대가 젊으나 다들 꼰대 기질이 있어서 무조건 막내가 해야 한다는 군대 마인드. 자기가 맡은 업무를 다 해도 퇴근할 수 없고, 상상 이상으로 야근을 많이 함."
47,메이데이파트너스,11507,너무 빠르게 배울 수 밖에 없는 환경이 문제라면 문제. 일에 대한 빠르게 돌아가는 루트를 따라 갈 수 있는 사람이라면 괜찮은 곳.
48,메이데이파트너스,11507,연차를 세달에 한번쓸까 말까. 퇴근하는데 눈치보임. 삭막함. 회식에서 선택권을 준다고 하지만 안가면 안됨. 문제가 생기면 팀끼리 같이 해결해나갈 생각 보다 담당인 사람에게 다 해결하게 둠. 정말 빠르게 성장하느 회사이지만 그만큼 직원들의 희생이 따름.
49,메이데이파트너스,11507,일이 너무 많음. 야근이 생활화 또한 신입들의 연봉이 낮아서 오래 못 버티고 나감
50,메이데이파트너스,11507,업무 범위가 넓어서 힘든 부분이 있다. 다양한 상황에 대한 대처가 많이 필요하다
51,메이데이파트너스,11507,다양한 업무를 동시에 배움에 있어 멘탈 붕괴가 일어날수 있음
52,메이데이파트너스,11507,"기업 평점도 최소 별 1개를 줘야하기 때문에 준 거지 0.5점도 안됩니다. 대표가 직원을 소중하게 생각하지 않습니다. 소모품으로 그냥 굴려서 업무진행과 성과만 보고 갑니다. 대표 마인드가 그러니 회사가 잘 돌아갈리가. 어마어마하게 높은 퇴사율이 이를 말해 줍니다. 사원은 진짜 댕댕이처럼 굴리는데 처음이라 잘 몰라 참습니다. 경력자들은 다 아니까 들어온지 얼마안돼서 다 나갑니다. 체계도 없고 지금이 어느 시댄데 '까라면 까'로 통합니다. 상식이 안 통하는 곳이고, 일한 세월이 아깝습니다. 오지마세요. 야근 더럽게 시키고 야근수당 편법으로 당연히 안줍니다. 심지어 할 일 모두 끝내고 가도 눈치 엄청 줍니다. 제 시간 내에 할 일 다 끝내는 직원을 능력있다고 생각안하고, 오히려 그 직원에게 일 더 몰아 줍니다. 저도 아랫분과 마찬가지로 퇴사일이틀전에 생소한 업무 시켜서 했습니다. 그리고 대표가 늘 꼰대없는회사라고 자부하는데 자기가 꼰대임."
53,메이데이파트너스,11507,"이 회사의 대표의 기분에 좌지우지되는 비정상적인 구조를 가진 특이한 회사. 늘 말이 앞서는 대표때문에 직원들이 매우 힘들어하며 인센티브 및 연말 상여에 대해서 항상 말이 달라지기에 직원들이 혼란을 겪은 적이 많습니다. 한달에 퇴사자가 3명이상이 생길정도로 정말 악조건의 근무환경과 정시퇴근 또는 퇴근시간 1시간 이후에 퇴근을 해도 대표에게 찍혀서 일감몰아주기, 도움안되는직원, 의지박약인 나약한 직원으로 뒷담화 대상이 되며 퇴사의사를 밝혔을때 더욱 일감을 몰아주어서 나가는 날까지 야근했습니다.  정말 특이한 점은 퇴근할때 카톡으로 대표에게 보고를 하며 팀장에게 보고를 하고 퇴근하였으나, 다음날 대표가 몰랐다는 이유로 팀장이 아닌 담당자를 아침부터 소리지르고 인격모독적인 발언을 합니다. 여직원들은 울면서 퇴사한 직원도 한둘이 아닙니다.  반차나 월차를 사용하는것은 불가능에 가까우며 모든 직원들이 퇴근을 할때 집에 무슨일이 있다고 말을 하고 가야 할 정도로 퇴근 후 자기 개인시간은 절대 없습니다.  퇴근 후 같은 팀 팀장이 자신이 인수인계를 받아놓고도 저녁,새벽,주말 할것 없이 전화해서 일을 시키며 휴가기간에도 업무를 보는일도 있습니다."
54,메이데이파트너스,11507,"야근이 매우 많다 칼퇴는 절대 불가능 하며 칼퇴도 아니지만 다른 직원보다 좀 일찍가는 직원은 찍힘 뒤에서 뒷담 함 야근 많이 하는 직원이 일을 잘 하는 직원이라고 생각함 등등 많지만 길게 적지 않겠습니다 직원이 15명 정도 되는 작은 회사이나 매일 같이 사람이 들어오고 나갑니다. 한 달에 평균 1-2명이 퇴사를 합니다. 하루, 일주일, 한 달, 세 달 등 기간이 다양함. 이렇게 많은 이들이 왜 퇴사를 하는 것 일까요. 이 글을 보는 당신이 그 퇴사자가 되지를 않길 바랄뿐입니다."
55,메이데이파트너스,11507,일반 사무직들은 어려울 수 있는 회사이다. 여러 포지션을 원하며 멀티를 하는 직원들을 선호한다.
