,company_name,company_id,review_text
0,모람씨앤티,5199,흠 단점이 워낙 많아서.. 일단 연봉은 다른곳에 비해 적습니다. 그리고 들어가시면 짜증나게 하는 사람이 있을 껍니다. 들어가시면 딱 아실꺼에요
1,모람씨앤티,5199,"프로젝트가 다양하지 않은편, 많은 것을 배우기는 힘든 구조. 프로젝트 릴리즈가 종종 일그러져서 성취감이 떨어짐."
2,모람씨앤티,5199,"SI 프로젝트를 진행하며 성공적으로 release 한 프로젝트가 드뭄, 예전 마인드를 가지고 있는 상사들 덕분에 새로운 기술 도입을 하기 어려움"
3,모람씨앤티,5199,"회사프레임워크 사용과 기존의 소스를 활용하여 프로젝트 진행이 대부분 되다보니, 새로운 기술을 배우기가 힘들었음."
4,모람씨앤티,5199,"기존의 고객사랑들만 프로젝트를 진행하기 때문에 새로운 프로젝트를 경험하기 힘들다. 항상 비슷한 프로젝트, 활성화 되지않은 프로젝트 들로 인해 개발에 대한 동기부여를 얻기 어렵다."
5,모람씨앤티,5199,"중소기업인지라 대기업에 준하는 복지는 없습니다. 또한, 대기업 수준의 연봉을 기대하기 어렵습니다. 그리고, 개개인의 기술 수준에 대해 정확히 판단합니다. 첫 연봉 계약시에는 본인이 생각했던 연봉을 못받을 수도 있습니다."
