,company_name,company_id,review_text
309,부산국제영화제,3758,팀별로 업무 강도가 다를 수는 있지만 영화제가 다가올수록 퇴근이 없다.
310,부산국제영화제,3758,"일단 정규직 전환이 매우 어려운 곳. 단기간 행사를 위해 1년을 쏟아 붓는 곳이다 보니 정규직 수도 많지 않고, 행사일이 가까워 질 수록 일이 빡세져 야근 등도 거의 매일 해야 한다."
311,부산국제영화제,3758,"퇴근을 늦게 하는 것을 당연시하며, 업무강도와 능력에 비해 월급은 형편없다. 후자는 모두가 공감할 것. 휴가는 다 쓰기도 전에 퇴사해야 한다"
312,부산국제영화제,3758,"업무 분담 체계가 확실치 않음, 매년 새로운 스탭 사원들로 대체, 때문에 사업기반이 불안정적"
313,부산국제영화제,3758,야근이 많고 체력적 정신적으로 힘든일이 많고 영화제 특성상 정말 예측불가능한 일들이 너무 많아서 위기대청 능력은 필수임
314,부산국제영화제,3758,조직위원 및 실장 몇몇에 의해 전반적인 사항이 결정되어 진행됨으로 실무적인 일만을 주로 하게 됨
315,부산국제영화제,3758,"직원 대다수가 단기 계약직으로 인수인계가 잘안되고 업무처리 미숙으로 인해 매년 내부적으로 사고가 발생, 조직 내에서는 성장 기회는 없다고 생각하는 것이 좋음, 시즌중엔 부서마다 차이는 있지만 새벽 퇴근이 기본이고 그에 비해 급여는..."
316,부산국제영화제,3758,"적은 연봉, 매년 전임자를 기준으로 할 정도로 어떤 부분에서는 체계가 없음. 영화제 특성상 야근이 많고, 그 강도가 다른 회사에 비해 굉장히 심함. 추석을 제대로 쉴 수 없음"
317,부산국제영화제,3758,영화제의 특성상 단기 스태프와 자원 봉사자를 뽑는 경우가 대부분이라 장기적인 직업으로 바라봤을때는 세분화된 직무를 조사하는 것이 좋을것
318,부산국제영화제,3758,"정규직을 많이 안 뽑고, 프로그래머로 승진? 이 사실상 불가능."
319,부산국제영화제,3758,"대부분 단기스탭으로 일할 수 밖에 없으며, 정규직으로 일할 기회가 매우 적습니다. 정규직으로 채용된다고 해도 급여가 낮습니다. 또 영화제 기간 전후로 업무강도가 매우 높아집니다. 그외에는 업무가 거의 없구요. 균형 맞추기가 어렵습니다. 또한 윗선 (프로그래머, 실장급) 의 시다바리에 그치는 일들이 대부분이죠."
320,부산국제영화제,3758,"예산의 절반을 지원하는 지자체로부터 많은 제약을 받고 있음, 행사 치르기에 급급해 체계적인 업무 시스템이 미흡함"
321,부산국제영화제,3758,"단기 계약직이 대부분이라 교육이 제대로 안 이뤄지고, 장기 근무의 가능성이 적음."
322,부산국제영화제,3758,"비효율적인 야근, 주말 근무와 업무 분배를 비효율적으로 하는 실장급 경영진. 월급이나 수당이 매우 낮으며 개인 시간은 무조건 포기해야하는 경우가 비일비재합니다."
323,부산국제영화제,3758,많은 일에 비해 보수가 적고 의외로 내부 구성원들간에 소통이 원활하지 않는 경우가 많습니다.
324,부산국제영화제,3758,업무가 급여에 비해 매우 많은 편 이다.
325,부산국제영화제,3758,업무의 효율성이 극드로 낮고 계약직이 정직원 되기는 하늘의 별따기만큼 어려움
326,부산국제영화제,3758,"한철 장사(?)이다보니 다소 체계가 없고 대우나 복지가 열악함. 영화제의 전반적 문제. 국가적 차원, 혹은 관련 기관 차원에서의 개선이 시급해보임."
327,부산국제영화제,3758,적은 사원 수 때문에 영화제 시작 몇 주 전부터 과다 업무가 할당된다.
