,company_name,company_id,review_text
108,부산국제영화제,3758,"-2년전인가 시간외수당 안 준 것 때문에 호되게 벌금 문걸로 아는데, 또다시 올해부터 스탭들 월급 가지고 장난질함. 계약서 작성 당시 내용과 다르게 추가수당 산정방식을 사측에서 임의로 지들 유리한 방향으로 바꾼 걸 적용 하루 전에 모두가 퇴근한 후 쪽지로 알림. 꼼수 써서 최대한 돈 안주려고 산정방식 바꾼 것도 괘씸한데, 그걸 고지하는 방식이 너무 양아치 같았음. 그 외에도 계약직 스탭들에게 어떻게 하면 돈을 덜 줄 수 있는지 고민하는 게 빤히 보임. 기본급도 최저 수준인데 추가 수당까지 안 챙겨주려고 기를 쓰니 어처구니 없음. -고인물들 때문에 업무 프로세스가 지진부진함. 말로는 세상 진보적인척은 다하는데 실제 일처리 과정은 십수년전에 머물러 있음. 인터넷 익스플로러에서만 작동되는 사내 프로그램 아직까지도 쓰고 있는 게 코미디. 그외에도 기안/정산 등 내부 결재 과정이 공무원급으로 쓸데없이 복잡함. -영화제 전과 기간동안은 야근과 주말근무가 지속되는 등 업무강도가 굉장하다. 그만큼 업무량에 비해 스탭 인원이 턱없이 부족. 이는 모든 부서에서 공통적인 문제로 보였다."
109,부산국제영화제,3758,문서 작업이 너무 많아 비효율적임. 모든 일을 보고한 후 처리해야하는데 상관들이 너무 바빠 소통이 원활하지 않음. 한 사람에게 너무 여러 과업이 쏠림.
110,부산국제영화제,3758,매년 바뀌는 담당자 (계약직 지원들)로 인해 인수인계가 그저 문서로 진행되며 홍보팀에 몰리는 일이 굉장히 많음. 이에 비해 적은 월급
111,부산국제영화제,3758,"페스티벌 특성상 영화제 개막일에 가까울 수록 야근 및 초과 근무가 많음, 업무 프로세스가 비효율적임."
112,부산국제영화제,3758,영화제 기간이 다가오면 몰아치는 엄청난 업무량 ㄹ 과 스트레스
113,부산국제영화제,3758,"스탭 갈아서 영화제 하는 건 당연하고, 게스트만 중요하게 생각하는게 너무 눈에 잘 드러나서 화가 남. 게스트가 있어야 영화제가 돌아간다는데..스태프 없으면 돌아갈 것 같은지?"
114,부산국제영화제,3758,다소 낮은 임금과 불안정한 고용환경 그럼에도 불구하고...!!!
115,부산국제영화제,3758,단기계약직으로 일하는 사람들이 대부분이기에 매년 달라지는 인원들이 많아 전문성은 떨어지는 것 같습니다
116,부산국제영화제,3758,안 좋은 관료주의만 지원해주는 부산시로부터 배워온 것 같음. 창의적인 일을 원한다면 당신에게 적합한 자리는 아닙니다. 이것도 팀바팀이겠지만 상사와 소통이 잘 안됐음..
117,부산국제영화제,3758,행사가 다가오면 어쩔수 없는 야근(이마저도 최근엔 탄력근무제로 없어지고 있는 중) 단기이다보니 먼 미래를 내다볼 수 없음 일을 쳐내는데 급급함 / 협업하는 경우가 많은데 본인들의 이익만 챙길려고하는 이기주의가 있음
118,부산국제영화제,3758,출 퇴근 시간이 프로그램에 따라 유동적이라 다소 워라벨을 추구하기에 어려운 환경이긴합니다.
119,부산국제영화제,3758,"야근, 초과근무가 당연한 것이 되지 않았으면 좋겠습니다."
120,부산국제영화제,3758,젊은 꼰대가 있다 실력은 없으면서 자기가 그 분야에 최고라 생각하며 사람 괴롭히기도 함 그리고 계약직에서 정규직되기는 하늘의별따기. 그렇다고 정규직도 딱히 메리트없음 박봉에 고인물투성이 바쁠땐 영혼갈아야함
121,부산국제영화제,3758,연봉이 정말정말정말 짜다. 특히 영화제가 다가오면 주말근무는 거의 필수적이고 노동강도가 정마라 쎈데도 불구하고 몇년째 연봉이 최저시급급이다. 그리고 반이 계약직이며 연봉이 오르는 것도 거의 없다.
122,부산국제영화제,3758,업무의 진행방향이 자주 바뀜 단기 계약직이 대부분이라 업무 진행시 전년도 담당자가 남긴 자료에만 의존해야 함
123,부산국제영화제,3758,"업무 분장 비효율적, 상사의 일방적 통보, 부산에 가서 일해야 함, 힘들다."
124,부산국제영화제,3758,"내부 커뮤니케이션 비효율적임, 결정이 너무 오래 걸림."
125,부산국제영화제,3758,계약직 밖에 없다는점. 국내 최대 영화제임에도 불구하고.
126,부산국제영화제,3758,"이 업계의 다른 곳과 같이 낮은 연봉, 그리고 체계없는 시스템. 정규직이나 윗분들은 고인물이 대부분이기때문에 전체적으로 책임지기 싫어하며 발전이 없음"
127,부산국제영화제,3758,인사적체 심각. 한정된 정규직 자리로 인한 고용불안정성과 재계약 희망고문. 발전 가능성 보이지 않음. 심각한 정치질.
128,부산국제영화제,3758,"계약직으로 굴러가는 곳이기 때문에, 전임자가 누구냐에 따라 복불복이 심함. 서울이 본가인 분들은 숙소를 제공해주는데, 혼자 살아도 좁은 복층 구조에 3명이 살아야해서 매우 불편함."
129,부산국제영화제,3758,"큰 규모에 비해 적은 인원, 많은 업무량, 그러나 최근엔 많이 달라졌다고 들음"
130,부산국제영화제,3758,급여가 소금임 그냥 경험을 위해 자원했는데 심지어 생활비를 지원해주네? 라고 바꿔 생각하면 행복함
131,부산국제영화제,3758,"축제 특성상 축제 기간이 다가오면 야근이 많아지고, 축제 기간중에는 어떤 직무라도 거의 새벽 퇴근이라고 생각하시면 됩니다. 윗선들 정치질도 심해서 봐주기 힘들었습니다."
132,부산국제영화제,3758,행사가있으며뉴대 동원되서일을해야한다는것이 단점이라고 할 수있습니다
133,부산국제영화제,3758,야근 비율 높고 단기 계약직이기에 이후 미래를 보장할 수 없음 대학 졸업 전이나 후 한번쯤 경험해 보는 업무 정도
134,부산국제영화제,3758,"정규직 채용은 매우 드물게 진행하는데, 사실상 누구의 아는 사람 누구의 지인 누구의 제자 이런 사람이 낙하산처럼 자리를 차지함. 축제진행 외에 관리자들의 행정적인 부분이나 기본적인 인사업무에 대한 이해도가 매우 낮음. 실무진만 고생함."
135,부산국제영화제,3758,내부 노하우나 시스템이 전혀 구축되어 있지 않아 무에서 유를 창조하는 수준  20년 이상의 전통이 무색할만큼 주먹구구식 운영으로 정규직직원은 물론 단기계약직 직원들의 피와 땀을 희생해야함  팀바이팀이고 통솔하는 헤드의 역량에 따라 노동 강도+ 팀 분위기 천차만별  잡플래닛 후기를 보고 설마 그 정도야 하겠어? 했지만 다녀와보니 그 정도와는 비교도 안되는 처우와 진행 준비 과정에 혀를 내두름
136,부산국제영화제,3758,"매년 스태프가 바뀌다 보니 체계 질서가 부족하고, 초반엔 우왕좌앙하는 일이 많다. 과거보다는 급여가 오르긴 했지만 근무시간 대비 적은 연봉임"
137,부산국제영화제,3758,영화제 기간이 점점 다가올수록 퇴근 시간이 늦어집니다. 야근 필수.. 사내 정치 심하고 일하는사람만 일함
138,부산국제영화제,3758,해마다 계약직만 뽑아서 단기로 치고 빠지는 구조 정규직은 고인물 계약직은 교체가능한 부품이라는 인식 애정도 없고 그냥 올해도 무사히 지나가기만 하면 된다는 생각으로 일하는 느낌임
139,부산국제영화제,3758,업계 특성상 쉽게 변하지 않는 낮은 임금과 많은 업무량 일부 정규직 (및 상근) 중간 관리자들의 미숙한 역량과 관리 시스템 체계적인 업무 시스템의 부재로 인한 불필요한 커뮤니케이션 발생
140,부산국제영화제,3758,철저한 계급제도. 줄 잘못 탔다간 팽 당하기 쉬움. 계약직이고 한번 하고 말 사람들이라 생각하기 때문에 그냥 굴려먹다 버리면 되는 줄 아는 윗선들.
141,부산국제영화제,3758,업무의 양이 많음 부서별에 따른 차이점이 큼 밤낮이없음
142,부산국제영화제,3758,생각나는것은 없습니다. 다만 숙소를 직접해결해야되서 그 점은 힘들었습니다
143,부산국제영화제,3758,가장 큰 영화제인데도 시스템이 매우 비효율적. 많게는 몇백명이 되는 게스트들에게 개별적으로 연락드려야됨. 뭘 물어봐도 누구는 이렇게 누구는 저렇게 하라고 해서 당황스러움. 완전 쌩신입이 가면 약간 벅찰 수도 있다. 영화업답게 야근은 기본이고 업무량도 엄청 많다.
144,부산국제영화제,3758,업무 결정을 내리는데에 아주 많은 시간이 걸린다. 부산시와 관련하여 업무처리하는 부분도 있다보니 효율적이지 못한 시스템이다. 시간에 쫓겨 행사준비업무를 주먹구구식으로 배운다는 느낌도 있다.
145,부산국제영화제,3758,박봉이다. 발전이 조금 힘들수도 있다. 매년 환경이 바뀌기 때문에 유연한 자세가 필요하다
146,부산국제영화제,3758,"대다수 계약직이라 주먹구구식 운영. 인수인계는 전년도 담당자의 페이퍼로 이루어지고 마땅한 사수도 없이 홀로 해당 업무의 모든 것을 담당, 책임져야함"
147,부산국제영화제,3758,유연근무제 도입했으나 이로 인한 혼선이 잦다. 지나칠 정도의 업무량과 야근은 큰 문제.
148,부산국제영화제,3758,극도로 낮은 임금 (열정페이라 해도 과언은 아니지만 장점이 훨 많아서 커버 가능)
149,부산국제영화제,3758,"영화제 시작 전 한달은 잠 못잠, 체계 없음 매년 지옥같은 루틴을 반복함"
150,부산국제영화제,3758,근속이 오래된 직원이 많아 승진기회가 쉽지않고 외부에서 보는 긍정인식과는 별개로 보수와 복지수준은 높지않음
151,부산국제영화제,3758,"모든 결정권을 가진 임원진에게 원칙도 상식도 없어서, 걸핏하면 말이 바뀌고 윽박지르듯 일을 요구하는 바람에 실무진들만 일에 치인다 + 더불어 능력 없는 월급 루팡들이 득실득실"
152,부산국제영화제,3758,배움이 느리거나 빠른 환경에 적응이 느리면 힘들다. 결재 시안이 넘 길다
153,부산국제영화제,3758,야근이 많았음. 하지만 행사 특성상 언젠가 끝나기 때문에 짧고 굵음
154,부산국제영화제,3758,당연하게 업무 강도가 높아 돈에 비해 일을 더 하는 느낌이 있음
155,부산국제영화제,3758,단기 계약과 좋은 경력거리는 되지 않는 것 같습니다. 하지만 경험해보는 것을 추천드리고 싶습니다.
156,부산국제영화제,3758,매년 같은 프로세스일텐데 업무 체계가 갖춰져 있지 않다. 그래서 한 번에 할 수 있는 일을 여러 번 확인해야 한다거나 촉박하게 마감기한이나 전달사항이 공유될 때가 잦다. 업무량이 많다.
157,부산국제영화제,3758,"불안정한 고용형태, 업무에 비해 적다고 느껴지는 수당, 단기간에 여러가지 일을 해야하므로 몸이 힘듦"
158,부산국제영화제,3758,"자원봉사라 하지만 휴게시설, 식사같은 문제들의 대처(?)가 조금 부실하다는점..?"
159,부산국제영화제,3758,예산이 부족하여 계약직이 많은 구조라 고용이 아주 불안정한 조직이다. 정규직 인원을 화가대할 수 있는 기회가 만들어지길 바란다
160,부산국제영화제,3758,52시간 근무제를 지키지 않는 것은 아니지만 영화제 기간에는 불가피하게 야근이 잦아 몸을 갈아넣어야함. 조직 구조가 체계적이지 못하다보니 일을 차근히 배울 수 없고 혼자서 전년도 결과보고서를 참고하면서 헤쳐나가야함.
161,부산국제영화제,3758,영화제 스케일에 비해 인력이 적은 것이 아닌가 생각됨 업무과다?
162,부산국제영화제,3758,"체계가 너무 없음. 회사가 노력하는 모습이 10% 정도 보이긴 하는데, 턱 없이 어지러움. 운영 결정 사항에 있어 안내가 너무 늦어 통보 수준임."
163,부산국제영화제,3758,피크 기간에는 정말 문자그대로 몸이 갈려나가는 것을 느낄 수 있음. 그에 따른 금전적 보상이 크지도 않음. 정치질하는 사람들이 좀 있다.
164,부산국제영화제,3758,가끔 체계가 부족하다는 느낌을 받았습니다. 그 외에는 딱히 생각이 안나네요.
165,부산국제영화제,3758,유동적인 일들이 많아서 야근이 있는 날이 필수. 정해지지 않은 사안이 많아 일을 급하게 처리하는 경우가 다수
166,부산국제영화제,3758,다만 관련 기업에서 전문적인 경험을 얻고자 한다면... 다른 곳에서 일을 시작하는 것도 괜춘.
167,부산국제영화제,3758,감정 노동과 육체노동의 콜라보레이션. 극한 직업이 바로 여기.
168,부산국제영화제,3758,해마다 단기 계약 사원들로 이뤄지는 행사다 보니 두서가 좀 없습니다.
169,부산국제영화제,3758,월급이 적음. 일이 너무 많아서 야근을 밥 먹듯이 해야 함. 맨날 막차 타고 가거나 택시 타고 집에 가는 일이 일상. 너무 바빠서 밥 먹을 시간도 없음. 정해진 시간까지 일해야 야근비를 조금 줌.
170,부산국제영화제,3758,영화제 임박해서 업무량이 많음 - 당연한 일이라 딱히 단점이라 할 수 없음
171,부산국제영화제,3758,딱히 없는 것 같음... 부산지역에 살지 않는 사람들은 숙소를 이용해야 하는 불편함 정도? 아무래도 봉사활동은 대학생들 위주로 리쿠르팅을 하기에 끝나고 술자리가 많았음. 불참을 자주하면 팀원들 사이에서 겉돌수도 ..
172,부산국제영화제,3758,단기 스태프이기에 복지면은 기대안하는 것이 좋음 구내식당 등이 없기에 식비가 비쌈(센텀 물가가 높음) 체계가 잡힌 느낌이 없이 굴러가는 느낌의 업무들
173,부산국제영화제,3758,"당연한 소리지만 행사가 다가올수록 야근이 필수다. 12시를 넘어서 들어간 적도 있다. 다행인 건 야근 수당을 다 챙겨주긴 하지만 인력을 보강할 생각은 없고, 있는 인력을 갈아서 운영하는 느낌."
174,부산국제영화제,3758,"지금은 개선이 됐는지 모르겠으나, 야근하는 시간에 비해 지급수당이 크게 모자람. 이른바 포괄임금제? 그리고 '열정페이'."
175,부산국제영화제,3758,호미로 막을거 가래로 막는 식의 일처리 및 업무. 부서 간의 커뮤니케이션이 원활하지 않다. 부서마다 조율하고 상의해야 될 것을 쌍방소통없이 진행 시켜 영화제 기간 중에 변수가 생기거나 한적이 종종 있음. 영화제라는 일시적 기간의 특수사항으로 계약직이 다수라는 점에서 인수인계 개념이 없이 전년도 결과 보고서만 참고 하라는 식이라 한계가 있음.
176,부산국제영화제,3758,팀을 운영하는 부분에 있어 비합리적이며 비효율적인 부분이 많아 개선이 필요했음
177,부산국제영화제,3758,열정페이 이제 끜냇으려나.. 지도부가 불안정하지만 축제를 마무리하고 나면 오는 어마어마한 성취감르로 야근도 견딜 수 잇음
178,부산국제영화제,3758,2020년 초 행정직1명 뽑는 자리 지각한 면접대상자에게 친히 전화해 언제 오냐고 담당자가 전화함 그 사람이 합격
179,부산국제영화제,3758,"상근직들부터도 의견조율이 잘 안 되고, 일을 해결 못하고 무작정 쥐고만 있다가 스태프에게 뒤늦게 던져주고 빨리 진행하란 식. 사람은 일단 뽑는데 정작 잘 못부림. 계획 없이 우왕좌왕하는데 보고 있으면 속이 터짐. 바쁘다는 말은 지겹도록 하는데, 정말 바쁠 일이어서 바쁜 건지 아니면 일을 효율적으로 못해서 남들까지 정신없게 하는 건지 돌아볼 필요가 있다. 이런 식으로 불필요한 야근이 많고, 뭐 그런 건 영화제 특성상 당연히 감안하고 지원한 거라곤 하지만 스태프를 늦게까지 붙잡아두는 것에 대해 제대로 된 앞뒤 설명이나 양해의 말을 들은 기억이 없으니 인간적인 기대는 아예 버리면 편함. 의미 없이 기다리느라 늦게 퇴근하면 돈 주는 영화제 입장에서도 손핸데 이런 시간이나 줄이려고 하면 좋겠음. 업무 체계는 기대에 못 미치고 누가 제대로 설명해주지 않음. 거의 전적으로 결과보고서에 의존. 작년에 해왔던 그대로 답습하는 업무=업무적으로 성장할 건덕지 없고 그냥 해왔던 일을 하는 부품이 교체되는 것. 시간 아까운 술자리. 타 팀과의 소통 원활하지 않은 편. 우리나라에 영화제가 많고 많은데 꼭 부국제를 해봐야 할까? 전혀 그럴 필요 없다."
180,부산국제영화제,3758,"실제 업계에 관련된 업무는 없다. 행사 주최와 관리 일 정도이기 때문에, 전시 업무에 더 가깝다."
181,부산국제영화제,3758,1. 단기계약직 (페스티벌 업무 특성상 그렇다고 하지만...수두룩 뽑았다가 나중에 10월말 되면 우르르 빠져나가는..) 이제 20년 넘었는데...아직도 단기스태프 채용 볼때마다 아직은 멀었다 싶은..   2. 진짜 이런식으로 굴러가나 싶을 정도로 업무의 빈틈이 많음...업무 인수인계는 작년 전임자가 써놓은 메뉴얼(?)이 다임...  3.야근 수당 지금은 있는지 모르겠으나...예전엔 없었음..
182,부산국제영화제,3758,"영화제의 특성상 매년 새로운 단기스탭으로 구성되다보니, 인수인계가 제대로 되지 않음. 영화제 시즌이 다가오면 강제 야근...."
183,부산국제영화제,3758,"기사도 나왔듯이 열젱페이 등으로 말이 많았습니다. 현재는 어떻게 되었는지는 잘 모르겠습니다, 주변 스태프들을 보았을 때 야근도 잦았고 영화제 기간에는 당연히 주말 출근 했었습니다."
184,부산국제영화제,3758,"채용 대부분이 계약직으로 고용 기간이 짧은 것에 비해, 업무 강도가 높고, 업무 실적에 대한 보상 체계 부족하다"
185,부산국제영화제,3758,영화제 특성 상 근태관련 불만사항이 많은편. 최근 2년 동안은 개선하려고 많이 노력하는 중
186,부산국제영화제,3758,"개인적으로 근무하면서 크게 불만을 느끼지 않았다. 영화제 기간이 다가올 수록 근무 시간이 늘어날 수 있으며, 영화제 기간에는 밤샐 수도 있다. 체력으로 많이 힘들 수도 있고, 체력소모가 크다는 점을 염두해두면 좋겠다."
187,부산국제영화제,3758,단기계약직이 대다수여서 주먹구구식으로 운영됨. 행사 특성상 불가피한듯.
188,부산국제영화제,3758,"기간이 정해진 행사라 영화제 개최 1달전에는 야근 필수와 감당안되는 엄청난 업무량. 대부분이 계약직이며, 그렇다보니 매년 같은 문제 반복과 개선 없음 체계가 있는듯 하지만, 급하게 변동되는 사항들이 많음."
189,부산국제영화제,3758,업무시간이 길고 영화제 전에 과도하게 업무가 쏠림 영화제 기간 근무시간이 상당히 길다
190,부산국제영화제,3758,1.체계화 되어있지 않은 시스템과 급한불 끄는식의 유연하지 못한 업무처리 2. 단기근무 특성상 업무전달이 힘들어 지난 행사 경력자가 자주 참여한다. 문제는 자주 참여하는 단기스태프들의 역량이 현저히 부족한대도 불구하고 경력자라는 이유로 근무를 하고 중책을 맞는다. 그래서 일머리 없는 사람들이 넘친다. 3. 관리자급의 정규직 스태프들 또한 잦은 인사이동으로 인해 뭐 하나 제대로 영화제 업무에 대해 파악하고 진행하는 것을 못봤다. 4. 빈수레가 요란하다 5. 셀럽만 밝힌다
191,부산국제영화제,3758,오래 다닐 곳은 아님. 앞에서도 말했지만 단 한번이면 족합니다.
192,부산국제영화제,3758,업무시스템이 덜 갖춰졌고 장기 근속이 어려움 사람 스트레스도 받을 수 있음
193,부산국제영화제,3758,"영화제에 지원하는 사람들이라면 예상하고 오는 부분이겠지만, 기간이 가까워질 수록 심해지는 야근. 특히 홍보팀은 다른 팀들에 비해 업무의 강도가 세고, 기간 중에는 모든 일정이 끝난 밤에서야 다 식은 햄버거나 라면 등으로 첫 끼를 먹는 날이 허다하다. 그래도 근무 초기에는 워라밸을 누릴 수 있다."
194,부산국제영화제,3758,"근무 시간을 지키려고 노력은 하지만 그냥 형식적이고 방법이 비효율적임 야근, 휴일근무, 업무량이 매우 많다는 점을 모두가 인지하고 있지만, 업무를 잘 해내지 못하면 해내지 못한 담당자를 깎아내리는 분위기 인수인계 제대로 안됨, 업무 체계 없음, 능력이 있어도 발휘하기 어려운 구조"
195,부산국제영화제,3758,"장점이 그것뿐이라는게...단점. 수당 제대로 안챙겨주고, 부서 간 차별도 존재함."
196,부산국제영화제,3758,"단기 계약직들에게 왜 불필요한 야근을 강요하는지... 머리를 빻았다고 하죠.. 그런 직원들이 너무 많아요 특히 자기 맘에 안들면 사무실에서 소래고래 소리 지르고 신문 던지고 욕 남발하던 그 여자 팀장,,,, 몇 년 지난 지금까지도 생생합니다. 근데 저희 팀장 뿐 아니라 대부분 팀장이 그렇다는..... ㅎㅎ... 영화 좋아해서 하기엔 너무 리스크가 큰 듯 합니다."
197,부산국제영화제,3758,비효율적인 근무 및 오래된 연차의 직원들이 많지 않아 주먹구구식 일처리
198,부산국제영화제,3758,안정화가 되기 어려운 고용관계.(계약직이 대다수)가 최대 단점이나 경험을 쌓기 위해서라면 추천 재밌습니다^^
199,부산국제영화제,3758,일이 한번에 몰려버리는 현상이 발생하는거같음 그 것만 해결하면 이후엔 또 조용해지는듯함
200,부산국제영화제,3758,"영화제가 다가올 수록 업무 강도 극악임. 기초 체력 없으면 살아남기 힘듦. 출,퇴근의 경계가 없어질 지경임. 영화제 열흘 내내 지옥을 맛볼 수도 있음. 제일 오래된 영화제이면서 계속 시스템이 바뀌고 제대로 된 체계가 없음. 작은 영화제 하다가 뭔가 다를거라고 기대하고 온다면 엄청나게 실망하게 될 것."
201,부산국제영화제,3758,"영화제가 가까워질 수록 잦은 야근과 철야 어린시절 혈기로 한 번 쯤 해볼 수 있으나, 업무 강도 대비 급여가 매우 낮음 시스템을 세우려고 하지만 영화제라는 특성을 파악하지 못한 채 이루어지는 경우 다시 도돌이표 국제행사 치고 시스템이 미약함(매년 새로운 단기직이 왔을때 간단한 오티는 있지만 대부분 이 전 스탭이 만들어놓은 인수인계 문서만 가지고 본인이 파악해야함. 덕분에 이 전 직원이 대충 써놓고 가는경우.. 폭망) 팀원 중 심신이 지쳐 중도 포기하는 경우(많지는 않지만) 새로운 직원을 뽑기보다는 나머지 팀원들이 그 짐까지 짊어져야하는 경우가 있음. 오랜기간 이 업무를 지속해온 상근직들의 대단함은 신규시스템이 생겼다 없어졌다를 반복하는 와중에 매년 새로운 단기직들을 데리고 이 큰 행사를 만들어간다는 거임"
202,부산국제영화제,3758,야근수당 제대로 쳐주지 않음. 계약 기간이 짧아 일 하는 동안 거의 모든 날을 야근해야 함.
203,부산국제영화제,3758,명성에 비해 체계적이진 않음. 영화제가 다가오면 (당연하지만) 업무강도가 세진다.
204,부산국제영화제,3758,영화제가 다가올 수록 끊임없는 야근 야근 야근 야근. 계속되는 변경이 힘들다
205,부산국제영화제,3758,"소모품으로 쓰이는 기분, 물론 윗사람들도 나를 그렇게 대함"
206,부산국제영화제,3758,영화제 특성상 야근. 그 외엔 모르겠다. 수당을 다 주기 때문에 그 단점은 사라진 것 같음
207,부산국제영화제,3758,생각보다 조금 체계가 없는 점 월급이 조금 적고 식대 지원이 안됐던점이 아쉬움 그외 빠쁜시즌시 며칠정도 빡신 야근이 있을 수있음
208,부산국제영화제,3758,업무에 비해 부족한 인력과 예산으로 인하여 실무자들의 업무량 및 업무 결과물이 다소 만족스럽지 않은 경우가 있음
209,부산국제영화제,3758,주 52시간 도입했는데 주어진 시간 초과해버리면 컴퓨터 셧다운됨 후에 컴퓨터 다 풀어주긴했으나 막바지에 풀어줌 행사직에는 맞지않다고 생각 국내 영화제 중에 가장 큰 영화제임에도 불구하고 스태프 갈아서 만들면서 영화제 중에서도 스태프 대우 제일 최악 경력없으면 최저임금 줌 8월에 일한 야근수당은 11월말에 준다 좋은 사람들 만난 거 빼면 장점 없음
