,company_name,company_id,review_text
210,부산국제영화제,3758,영화제의 고질적인 문제로 사람들이 매번 바뀌다보니 매해 새로 배워서 시작해야하는 경우가 부지기수.
211,부산국제영화제,3758,"업무환경이 자유롭다고 후기가 많이 올라왔는데, 자유로운 것이 아닌 체계가 없는 걸 우회해서 한 말이었다. 영화제 전후로 몰려있는 업무로 인해 철야근무를 피할 수 없다. 어느 팀이건 거의 야근을 하며 이에 대한 체계적 시스템이 구현되어있지 않다. 입사 지원 시 임금이 명시되어있지 않았는데 어느 기업, 회사 건 임금을 정확히 명시하지 않으면 가지 않기를 바란다. 식비 포함하여 최저를 겨우 맞추는 임금이다. 짧은 경력이지만 다른 회사에서 일한 것과 비교할 수 없을 정도로 엉망인 조직이라고 생각한다. 인수인계가 되지 않는 업무 환경, 당연시 되는 야근과 업무과중, 여타 다른 후기에도 올라 와 있는 꼰대문화. 업무는 크게 어렵지 않지만 그렇다고 가르쳐주지도 않는다. 스스로 하길 바란다. 어느 팀이건 마찬가지 일 듯. 계약직을 위한 복지는 전혀 존재하지 않으며 어떻게 하면 임금을 덜 줄 수 있을지에 심혈을 기울이고 있는 것 같다. 나라를 대표하는 국제적 행사라고 하면서 임금과 관련한 문제가 불거진 게 겨우 1년 밖에 되지 않았다는 것이 21세기 시대와 맞는지 의문이다. 언론사를 바로 앞에두고도 치명적 문제가 쉬쉬 되고 있다는 게 20년 동안 넘게 이어진 잘못된 문화가 뿌리깊게 자리하고 있어서가 아닐까싶다. 한국에서 가장 큰 영화제의 민낯이 이렇다면 한국 영화제 산업의 끝이 어떨지 눈에 보인다. 별점은 1점이 아닌 마이너스를 주고싶지만 마이너스가 없어서 1점이다."
212,부산국제영화제,3758,"일단 일하는 직원에 대한 생각과 배려 자체가 없음. 계약직들에게 단기간 동안 영화제를 위한 엄청난 업무를 떠맡김. 이 일을 떠맡기기전에 제대로 업무를 알려줘야 하는데 몇 안되는 정직원들은 바빠서 일을 알려줄 시간이 없음. 혼자서 어떻게 일을 하는지 작년 계약직이 써놓고 간 업무 일지를 보고 모든것을 혼자 파악해야됨. 실수가 발생하면 이에 대한 책임은 계약직이 모두 감당함. 영화제 끝날때까지 담당하는 업무는 한사람이 할 일의 업무량이 아님. 그냥 상상 그 이상의 수준. 영화제 시작 한달전부터 영화제 기간까지 퇴근 절대 불가능. 야근으로 발생하는 식대, 택시비 등등은 모두 본인의 몫. 아무도 신경써주지 않음. 오히려 새벽에 퇴근하려는데 스태프끼리도 눈치를 줌. 작년에 발생한 임금 관련 문제로 개선한다고 마련한 근무시스템은 모두에게 혼란만 초래함. 그래서 수많은 계약직들의 야근수당, 초과근무, 주말근무 수당을 챙겨줄지도 의문임. 열정페이도 이정도는 아닐듯. 영화관련 산업에 종사하고 싶은 사람 아니라면 여기 지원 한다는 사람 있으면 뜯어 말릴거임."
213,부산국제영화제,3758,최저도 지키지않는 여전히 해결되지않은 임금 부조리. 추가 근무에 대한 수당을 지급하지않고 지정 휴무일에 강제로 쉬게 하여 대체하는 등 근로법을 악용함. 과중한 업무로 스태프의 건강이 악화되면 그만두라고 권고하는 등 단기계약직을 기계 부품처럼 사용함.
214,부산국제영화제,3758,영화제기간에는 힘듭니다. 준비할 것도 많고 정말 영화를 사랑하고 문화를 좋아하시는 분들이라면 좋은 기업입니다. 영화제에서 일하는 그 자체가 뿌듯하고 의미있습니다.
215,부산국제영화제,3758,"가끔 합리적이지 못한 의사 결정을 할 때가 있음, 야근 수당 없음(최근에는 바뀌었다고 합니다)"
216,부산국제영화제,3758,팀바팀이겠지만 일이 한 번에 몰아쳐서 건강이 급격하게 안 좋아짐.
217,부산국제영화제,3758,일에 비해서 월급이 적은 편이다. 모든 사원이 계약직으로 일을 처음부터 배워야한다.
218,부산국제영화제,3758,상주하는 직원을 매우 적고 매해 약 100명 이상의 사람이 새롭게 계약직으로 채용되는 시스템. 따라서 업무를 업무를 자세히 설명해주거나 인수인계의 개념이 없음. 업무량에 비해 채용되는 인원이 부족하여 업무 분담이 모호함. 영화제 시작 2달 전(부서마다 다름)쯤에는 주말 출근 필수 및 엄청난 강도의 업무 및 야근. 야근 추가 수당은 저녁 식대 및 차비로 1~2만원이 전부. 영화제 직전 및 행사 기간에는 점심 저녁을 먹을 시간이 없을 정도로 바쁨. 엄청난 정신력과 체력을 요함. 업무량 대비 월급이 현저히 낮음. 따라서 영화산업을 좋아하는 사람은 이러한 대우에도 불구하고 일할 수 있겠지만(실제로 그런사람이 많았음) 그렇지 않은 사람은 회의감이 들 수 있음.
219,부산국제영화제,3758,"영화제 기간이 임박해 올 수록 야근이 많아지고, 다들 예민해져 있기 때문에 스트레스가 많이 쌓이는 편"
220,부산국제영화제,3758,영화제기간중 퇴근시간 불명확하기 때문에 워라벨 하락. 모든 직무에서 거의 처음 하는 사람들이기 때문에 팀장급(요새는 팀장급도 계약직이던데;) 이상이 아닌경우 물어볼 사람이 없음.
221,부산국제영화제,3758,"열정페이, 야근 특근 주말구분없이 일하나 페이가 정말 적다.. 몸이 남아나지 않음. 체계가 정비되어있지 않고 단기직 스탶들을 돌려서 쓰는지라 처음 경험해보는 이들이 하려면 좀 어려울 수도 있음"
222,부산국제영화제,3758,"4개월정도 계약기간중 약1달정도는 야근을 함. 팀 소속이 중요해서, 내가 일을 다 해도 다른팀원이 야근을 하면 같이 남아서 해야하는 분위기임."
223,부산국제영화제,3758,하는 일과 열정에 비해서 보수가 적음. 그러나 영화계열이라면 적은 보수를 당연하게 생각함. 영화제 기간이 다가옴에 따라 야근이 매우 잦음
224,부산국제영화제,3758,"일이 너무 많아 야근을 많이 함. 사람을 더 뽑았으면. 정해진 매뉴얼이 없는 편. 이건 내 일, 저건 니 일, 구분이 모호하지 않음. 단기 스태프로 이루어지니 인수인계도 없으며 일을 하면서 배워 가야 함. 돈도 적음."
225,부산국제영화제,3758,팀장이 어떤 사람이냐에 따라 근무 환경이나 업무 만족도가 갈릴 수 있음.
226,부산국제영화제,3758,"연봉이 적음. 대다수의 사원이 단기 계약직으로, 보장되지 않은 불안정한 고용 환경. 영화제 전후로 한달이 넘는 기간동안 매일 야근이 있음. 부서간 커뮤니케이션이 원활하지 못함"
227,부산국제영화제,3758,영화제가 사용하고 있는 데이터시스템이 비효율적이라고 느낄 수도 있음. 팀에 따라 엄청난 야근. 당연히 짠 월급. 여성 사원이라면 대리/팀장급 남성 직원들의 아주 친밀한 태도가 가끔 불편하게 느껴질 수 있음
228,부산국제영화제,3758,업무의 인수인계를 보고서에만 의존해야 하며 영화제 기간이 가까울 때 채용하므로 상사의 체크도 받기가 힘들다. 소위 사람을 갈아넣는다고 볼 수 있을정도로 단기간에 필요인원만 쏙 뽑아 근무하게 된다.
229,부산국제영화제,3758,어딜가나 그렇듯 동료와 선임을 잘 만나야 하는 것 같다.
230,부산국제영화제,3758,"대부분의 직원들을 단기 계약직으로 고용하기 때문에 지속성이 없음, 영화제 준비 기간과 영화제 기간동안은 연차 사용 불가, 정해진 퇴근 시간없이 야근이 생활화 되어있음, 초심자보다 경력자에게 더 많은 업무가 주어짐"
231,부산국제영화제,3758,"계약직으로 매년 계약해야하고, 계약기간이 짧고 정직원 채용을 거의 하지 않아 회사같은 느낌은 들지 않음"
232,부산국제영화제,3758,주먹구구식 일처리를 한번씩 경험함. 영화제 임박한 기간에 매일 철야.
233,부산국제영화제,3758,상사들의 보수적인 업무태도 축제기간에 일이 많은 것은 사실이나 불필요하게 업무를 기다려야 하는 경우도 많음
234,부산국제영화제,3758,영화제 특성상 야근이 많아 체력적으로 약하신 분은 많이 힘드실 수 있습니다. 또한 계약직을 자신의 아래로 보고 존중하지 않는 수직적인 문화가 만연해있는 듯 싶습니다.
235,부산국제영화제,3758,"프리랜서들이 제 기간내에 완료하지 못한 작업들 때문에 단기스태프들이 영화제 직전 계속 풀야근을 했음, 어쩔 수 없지만 이런부분을 조금 더 강화했으면 좋았을 듯!"
236,부산국제영화제,3758,최저시급에도 맞지 않는 급여 수준 및 주말 출근 및 야근에 대한 수당은 근로법이 정하는 수준에 미치지 못함.
237,부산국제영화제,3758,"거지같은 출퇴근시스템. 대체 출근과 퇴근, 야근과 철야를 왜 근로자가 증명해내야하는지 모르겠다. 정보화사업팀과 기획팀은 대체 컨트롤도 못할 시스템 왜 쓰는지 모르겠음. 그거 증명못하면 수당 못준다고 한거에서 기함을 토할뻔함"
238,부산국제영화제,3758,1) 영화제 시작 한 달전 거의 매일 철야 2) 여러가지 이슈로 인해 예전 명성보다 떨어짐 3) 영화제 특성상 계약직 위주로 움직이는 인력 때문에 체계적이지 못함.
239,부산국제영화제,3758,많은 기회가 주어지는 만큼 책임도 따름. 신입인데 막중한 임무에 처해짐. 그리고 몇개월간 업무에 익숙해지고 애정이 생기려고 할 즈음에 떠나야 할 시간이 됨. 수많은 계약직들이 책상을 빼는 그 시기가 참 허무.
240,부산국제영화제,3758,"확실한 가이드 라인이 정해져 있지 않고 윗사람들의 동의 여부에 따라 결정되는 일이 대다수. 계약직(이라 쓰고, 쓰고 버려지는) 사원들이 온갖 실무를 맡게 되지만 그에대한 격려는 없음. 업무량이 어마어마하게 많음(팀바팀). 바쁠 때 너무 바쁨"
241,부산국제영화제,3758,급여가 적다. 바쁠때는 체계가 무너지기 쉽다. 기본적으로 열정페이가 심하다. 갈수록 체계가 없어진다.
242,부산국제영화제,3758,"적은 임금 (논란이 되어 아마 개선될 것으로 보인다.), 단기 계약직이기에... (정규직이라면 신의 직장이자 꿀의 직장)"
243,부산국제영화제,3758,"유명하듯, 야근이 엄청 많음. 다들 야근수당 없는거 알면서도 (이제 생김) 맡은 일에 책임감을 가지고 서로 노력하는 분위기임."
244,부산국제영화제,3758,"이번에도 그래서 난리 났지만 야근 수당에 대한 이슈가 컸음. 부서 간 분위기나 주업무, 상사와의 관계가 아주 극명하다고 들음. 업무 스트레스때문에 도중에 그만두는 사람도 있음. 그러나 그에 대한 노력을 하려고 하고 있다고는 생각 됨. 더 힘내주길."
245,부산국제영화제,3758,"- 23년이나 된 영화제 치고는 업무 매뉴얼이 없으며, 본인이 알아서 업무 진행 뿐 아니라 문제가 발생할 경우 본인이 해결해야 함 - 업무마다 다르긴 하지만 영화제 2개월 전부터 영화제 폐막까지 야근은 기본으로 생각할 수 있으며 그에 비해 적절한 보상이 없음 - 업무 진행시 발생하는 문제점들을 단기 계약직의 책임으로 돌림"
246,부산국제영화제,3758,영화제 기간이 되면 극도로 예민해 질 수 밖에 없는 환경 쌓여있는 업무를 처리하려면 제대로 잠을 자면 안됨 팀과 팀 개인과 개인 사이의 불화가 매우 잦아져 힘듬
247,부산국제영화제,3758,하지만 계약직이 대부분이다. 정규직이 정말 작고 매번 계약직을 뽑아서 영화제 기간에 빡세게 굴리고 끝낸다. 그리고 영화제 기간엔 야근이 많고 주말에는 일을 해야한다. 그러나 이건 영화제라는 특수 업무 상 어쩔수 없기에 감안하고 들어와야하는 거긴 하다
248,부산국제영화제,3758,비효율적 업무. 무능한 경영진(애초에 경영진이라는게 존재하긴 하는지?). 오랫동안 근무했던 정규직 스태프 분들이 변화에 대한 두려움이 매우 큼. 업무 량에 비해 미친듯이 낮은 급여. 2019년에는 재발되지 않기를 바란다.
249,부산국제영화제,3758,- 영화제라서 비교적 자유롭고 효율적일줄 알았는데 결재 라인이 비효율적 - 월급이 지나치게 짬
250,부산국제영화제,3758,기업 자체는 크나 그 안에 나눠진 부서는 좁기 때문에 부서간의 갈등은 사실 기업체에서 해결해 줄 수 없다고 봄. 부서간의 갈등과 부서간의 마찰이 큼.
251,부산국제영화제,3758,계약서 설명없이 사인만 한다. 밤12시까지 일하지만 야근수당 없다. 그렇다고 기본급에서 추가되지도 않는다. 최저임금도 못받음.
252,부산국제영화제,3758,"단기간에 많은 인원을 고용해서 근무하다보니 전문화가 되어있지않고, 인수인계를 따로 받을 곳이 없다. 본인이 담당한 업무는 본인이 끝내야하기에 영화제 기간이 임박해서는 무조건 야근을 할 수밖에 없다."
253,부산국제영화제,3758,영화제 시작하기 약 한두달 전부터는 거의 잠을 못자고 일할 수 있다는 것을 각오해야함. 이에 따른 추가급여는 없음
254,부산국제영화제,3758,업무시간에 비교할 수 없을 만큼 작은 월급과 오후 8시 이후까지 일해야 나오는 식비는 생각보다 배꼽이 커져서 돈을 절대 모을 수 없다 업무가 너무 많은데 교육이 제대로 이루어지지 않아서 주먹구구식으로 대충대충 물어서 업무를 해나가야 한다
255,부산국제영화제,3758,행사 기간중에는 야근이 많은 편이고 단순 반복 업무가 많은 경우도 있다
256,부산국제영화제,3758,"자원봉사자가 으레 그렇듯, 크게 책임질 만한 일은 시키지 아니함. 반대로, 경력을 쌓고자 하여 일하는 것이라면 차라리 따로 선발하는 인턴으로 들어가는 것이 더 중요할 것임."
257,부산국제영화제,3758,단순보고를 위한 업무작업이 많아 비효율적이며 비효과적임
258,부산국제영화제,3758,다른 영화제와 비교하면 사정이 나은 편이긴 하지만 급여는 기대하지 마세요. 내부와 외부의 잡음이 많아 아직은 안정되지 않은 듯 합니다. 정규직이 아닌 이상 오래 일 하는 것은 별로인 것 같아요.
259,부산국제영화제,3758,"직무가 단순 작업이 많음, 영화제라는 특성 상 행사 날짜가 다가올 수록 자연스레 야근이 늘어남, 매년 일하는 스탭들이 바뀌어서 업무의 인수인계라고 할 것이 없어 자연스레 혼자 일을 배우고 터득해야함."
260,부산국제영화제,3758,열정도 페이가 지급돼야 뜨거워진다 페이가 짜고 자원봉사자들 엄청 굴림 스태프도 굴림 영사자막 쪽 아니면 영화보긴 힘듦
261,부산국제영화제,3758,장점이 하나라는것. 낮은 연봉 근데 일하는건 많고 영화제가 점점 축소가되는 상황
262,부산국제영화제,3758,단기 계약직이라서 무언가를 배울만하면 끝나는게 아쉽고 영화제 특성상 야근이 많음.
263,부산국제영화제,3758,급여가 작습니다. 매년 열리는 행사지만 1년에 한번 열리는 행사로 계약직이 많고 행사가 끝나면 모든것이 끝납니다.
264,부산국제영화제,3758,이미 알려졌다 시피 조직 문제로 인해 내부 동력이 떨어진 상태 아무리 단기직이라 하더라도 급여가 너무 떨어져서 힘듦
265,부산국제영화제,3758,저에건 딱히 없었지만 영화제준비기간과 영화제기간엔 제 시간없이 정말 바빠요.
266,부산국제영화제,3758,감정노동이 심하다. 홍보팀은 서비스직이므로 언론사와 부딪치는 일이 생길 시 굉장히 스트레스받는다. 다른팀과의 협업이 잘 되지 않는다. 팀장이나 실장들끼리 이야기를 잘 하지 않는가보다. 인수인계를 작년 파일을 보고 하기때문에 매년 같은 실수를 반복하고 같은 일을 반복한다. 그러면서 정정될 기미는 보이지 않음.
267,부산국제영화제,3758,계약직. 보장되지 않은 미래. 낮은 월급. 정말 열정만으로 일해야함
268,부산국제영화제,3758,짧은 기간동안 과다한 업무. 대부분 단기스태프들로 운영되므로 업무상 미숙하거나 사소한 문제 발생 시 피드백이 잘 안됨. (큰 문제는 개선되지만 내부적인 업무처리상의 사소한 부분은 매년 같은 문제가 반복적으로 발생)
269,부산국제영화제,3758,행사조직이라 매년 새로운 사람들이 들어와 서로 시행착오를 겪는 것 같음
270,부산국제영화제,3758,업무의 인수인계가 전 년도 결과보고서만 보고 알아가야하기 때문에 업무에 익숙해 질때쯤 영화제가 끝남.
271,부산국제영화제,3758,매번 새로 뽑는 계약직들로 일의 체계가 없으며 작년에 어떻게 일이 이뤄졌는지 알려줄 수 있는 사람 전무. 스스로 해결해야함. 영화제 기간이 코앞으로 다가오면 밤샘 야근도 잦음.
272,부산국제영화제,3758,"스텝을 존중하지 않고, 마치 노예처럼 부려먹는다. 체계적이지 않으며, 일이 잘하는 사람에게만 몰린다. 하지만 서로 일을 많이 했다고 우기기..."
273,부산국제영화제,3758,영화제 기간에는 야근이 너무 많다. 그 전 준비기간에도 많긴 하다. 재원이 부족해서 뭘해도 가난하다
274,부산국제영화제,3758,예산이 없고 텃세가 심하고 월급이 최저임금도 안될것같음 인수인계도 보고서 딱 하나고 최소한의 돈으로 최대한 굴림
275,부산국제영화제,3758,매년 일하는 사람이 달라져 팀장이나 상사가 꼰대라면 일하는 내내 고통스러움. 보수적인 문화. 직원들이 고쳐야할 점을 매년 이야기해도 달라지는게 없다.
276,부산국제영화제,3758,1. 시간이 지나도 체계화 되지 않은 주먹구구식 행정 시스템 2. 대부분이 계약직이라 새로 들어온 사람들의 적응이 힘듦 3. 영화제 시작 전까지 무지막지한 야근
277,부산국제영화제,3758,일은 나쁘지 않으나 업무량이 절대적으로 너무 많음. 도저히 하루 안에 끝낼 수 없어 야근을 할 수밖에 없는 업무량. 야근비도 많지 않음.
278,부산국제영화제,3758,보수가 적고 영화제 기간 동안은 야근이 많아 체력적으로 힘들다
279,부산국제영화제,3758,모두 계약직인 만큼 업무적인 측면에서 체계적이지 못한 면이 있음. 잘못이 생기면 서로 책임을 떠넘기기 바쁨. 보수적인 영화판 특성 상 변화를 싫어함.
280,부산국제영화제,3758,단기 신입직인데 대해 비교적 과중한 업무 책임감이 따름
281,부산국제영화제,3758,영화제가 다가오면 몰아치는 야근 때문에 힘들고 그에 따른 업무환경도 받쳐주질 않으니 고생한다.
282,부산국제영화제,3758,단기 스태프가 대부분이기 때문에 일의 효율이 매우 떨어짐. 1년마다 사람이 변하기 때문에 시스템에 알아서 적응해야함. 축제기간이 다가오면 엄청난 야근과 스트레스는 각오해야함. 토요일도 출근해야함. 정규직이 아니라면 정말 딱 한번만 일하는 것을 추천.
283,부산국제영화제,3758,"야근, 식대가 지원이 되긴하나 미미해서 ""돈""을 모으겠다고 생각하고 지원하면 안됨 영화제 기간 두달전부터는 칼퇴 불가능, 야근과 주말근무가 거의 필수 퇴근했다가도 사무실 들어오라는 전화가 오면 바로 다시 돌아가야함"
284,부산국제영화제,3758,"부서별로 상이하지만, 영화제가 다가오면 거의 모든 부서가 야근이 심하다. 소정의 야근 식대, 교통비는 나오지만 야근수당은 없기 때문에 다소 아쉬운 부분. 어느 회사나 다 그렇겠지만 팀장을 잘 못 만나면 고생한다. 거의 모든 부서가 팀장 한명, 한두명의 정직원, 다수의 단기스탭이 일하기 때문에 팀원이 매년 바뀐다."
285,부산국제영화제,3758,업무량이 많음. 영화제 기간이 다가올수록 더욱 바빠지게됨 단기 계약이라 직장은 되지 않음
286,부산국제영화제,3758,"영화제 시작 두 달 전까지는 업무량이 많지 않았지만, 준비가 시작된 후에는 출근,야근 시간의 개념이 사라지고, 새벽 두세시 퇴근은 일상이 되었음. 또한, 야근 수당, 식비를 챙겨주지 않기때문에 적은 월급으로 생활하기 힘듬. 매년 나아지는 월급상황이라고는 하지만 택시, 식비를 생각할 떄, 돈을 모은다고 생각하고 일을 할 사람이라면 추천하지 않음. 또한 계약직이 맡기에는 너무나 많은 업무량과 체계적이지 않은 교육시스템때문에 새로 입사한 사람들끼리 서로서로 물어가며 하기때문에 실수 발생률이 높음."
287,부산국제영화제,3758,"미디어와 영화업계의 고질적인 열정페이 문제, 그리고 기간 내 각 팀별로 커뮤니케이션 부재"
288,부산국제영화제,3758,단기 계약직이기 때문에 사람을 최대한 쓸 수 있을때 까지 씀. 업무량 과다지만 결국엔 다 해냄
289,부산국제영화제,3758,영화제가 임박하면 야근과 주말 출근이 당연해진다. 매년 스태프가 바뀌다보니 매년 가르치며 하는 게 벅차 보인다.
290,부산국제영화제,3758,계약직은 야근수당이 없음. 새벽2시에도 눈치보고 퇴근하는 분위기
291,부산국제영화제,3758,일의 특성상 업무와 개인 시간의 구분이 따로 없는듯하다
292,부산국제영화제,3758,업무 강도가 무척 쎄고 업무량이 방대하다 그로 인해 야근이 잦고 스트레스가 심하다
293,부산국제영화제,3758,매년 스텝이 계약직으로 바꾸다보니 인수인계가 체계적이지 않다.
294,부산국제영화제,3758,올 계약직.. 스탭 모두가 계약직으로 이루어져 있다는게 아쉽다.
295,부산국제영화제,3758,단점은 그닥 없었던거 같습니다. 식사하는게 불편(?)하긴 했다 정도..
296,부산국제영화제,3758,업무안정성이 낮음. 축제기간이 다가올수록 업무강도가 세짐
297,부산국제영화제,3758,"영화제 기간에 야근은 필수(3,4시 귀가도 많다) 게다가 매년 담당이 바뀌므로 그 전 담당에게 인수인계를 받을 수 없다. 알아서 공부해야함."
298,부산국제영화제,3758,영화제 기간이 다가 올수록 야근이 잦다. 다들 예민한 시기라 함부로 건드리면 안됨... 그리고 월급이 좀 적다...
299,부산국제영화제,3758,어쩔 수 없는 구조지만 연봉이 매우 적고 영화제 기간 다가오면 새벽까지 야근.
300,부산국제영화제,3758,영화제 전체적으로 제대로 된 매뉴얼은 없어 처음 왔을 때 혼란스러울 수 있다.단기 스태프로 오는 사람이 대부분이기 때문에 소통이 중요하다.
301,부산국제영화제,3758,업무 교육을 글로 배워야함. 매년 팀장 외에는 다 바뀌는 구조로 처음보는 사람과도 업무적으로 커뮤니케이션 가능해야함. 영화제 기간 및 전날 바쁜 팀만 미친듯이 바쁨. 새벽 5시까지 일한적 많음.
302,부산국제영화제,3758,"영화제 임박하면 야근뿐만 아니라 철야, 주말특근 각오. 계약끝나면 끝인데 막상 급하면 연락와서 일해달라고 하는 경우도 많음. 너무 소모적임. 건전지된 기분."
303,부산국제영화제,3758,특정 기간 야근/특근/휴일출근 감안해야 함 특정 기간 외에 업무량 많지 않음/계약직 과반수
304,부산국제영화제,3758,비합리적인 인사제도 언제바뀔지모르는 임원들 불안한고용이 있다
305,부산국제영화제,3758,한 번 일을 해보았다면 쉬울수 있겠지만.. 처음 시작한 사람은 결과보고서를 읽고 업무 파악을 해서 바로 현장 투입하여야 하기때문에 힘들수도있음
306,부산국제영화제,3758,- 영화제가 다가올수록 정시 퇴근을 못함 - 영화제 끝나고 더 바쁨 - 계약직이라 업무를 완벽하게 익히거나 다 이해할 수 없는 구조
307,부산국제영화제,3758,대우가 열악하다 팀장직급이 되어서도 많은 보수를 바라기가 어렵고 업무량이 많으며 보수는 적은편이다
308,부산국제영화제,3758,"축제를 만드는 사람들이 신나있지가 않음, 20년이나 됐다보니 정체돼있는 경향이 없지않아 있음, 급여가 심각하게 적음, 이돈으로 못 먹고 삼. 대부분의 직원이 계약직임(이점은 이해함.. 축제 준비기간아니면 매우 널널하기 때문에)"
