,company_name,company_id,review_text
0,부산국제영화제,3758,"팀장을 제외한 나머지 직원은 계약직이기 때문에, 전임자가 별도로 없습니다. 오직 전임자가 작성한 매뉴얼을 보고 일을 진행할 수 밖에 없습니다."
1,부산국제영화제,3758,"지나치게 젊고 자유로운 느낌이 있다. 몇몇 자부심 넘치는 n년차 고인물들도 있다. 팀마다 분위기, 업무강도의 차이가 크다."
2,부산국제영화제,3758,월급이 너무 작고 업무량이 월급에 비해서 많다. 그리고 각종 루머가 빨리 퍼진다
3,부산국제영화제,3758,"정규직 되기 힘듬, 집행위원장과 이사회의 의견에 따라 업무의 방향이 자주 바뀐다."
4,부산국제영화제,3758,영화제/페스티벌 특성이겠지만 야근이 너무 많음. 밤새는 직원도 허다함
5,부산국제영화제,3758,정규직이 아니라 급여도 적고 불안할 수 있어서 젊은 나이에 영화제 운영을 경험해보고 싶은 사람이 아니라면 비추
6,부산국제영화제,3758,업무 처리를 제대로 못하는 사람의 일까지 제대로 하는 사람이 커버해야 함
7,부산국제영화제,3758,"미래에 대해서 조직적으로 고민하지 않고, 내부 정치로 인한 임원들의 좌지우지가 많음"
8,부산국제영화제,3758,"의외로 비체계적인 업무 방식, 윗선의 결정 사항이 성역화 되어있어서 타 영화제 업무에 비해 자신의 재량을 펼치기 어려움. 영화제가 가까워지면 야근도 많아지고 다들 민감해져서 육체적, 정신적으로 피로해짐. 사회 초년생이라면 영화제 경력이 추후 정규직 입사에 '경력'이 아닌 '대외활동' 수준으로 고려된다는 것을 염두.(동종 업계 제외)"
9,부산국제영화제,3758,영화제 특성상 행사 전에는 야근이 많고 급박한 업무환경이 안맞는 사람한테는 버거울 수 있음. 소수의 정규직과 다수의 계약직으로 굴러가기 땜에 이쪽 일을 계속 하고 싶은 사람들도 정규직으로 취직하기는 어려운듯 함
10,부산국제영화제,3758,인수인계가 잘 되지 않고 업무에 대한 정당한 평가가 잘 내려지지 않는다는 점
11,부산국제영화제,3758,단기 스태프들 중심으로 구성되어 전문성은 떨어지는 편.
12,부산국제영화제,3758,특성상 영화제 2달 전부터는 야근과 주말 출근을 슬슬 준비해야 하고 1달 전부터는 달에 휴일이 설날 포함 5일 정도 있었음 이해는 하나 굉장히 피로하고··· 피곤함 다만 업무는 재밌음
13,부산국제영화제,3758,"팀에 따라 다르겠지만, 정치질이 난무하고 팀장급 이상의 정규직 직원들의 입김이 과도함 고인물들이 꽉 잡고 있는 보수적인 시스템"
14,부산국제영화제,3758,영화제 특성 상 야간과 주말에 일할 가능성이 많았던 점. 유연한 업무 환경이지만 불가피하게 일해야 하는 시간도 존재함.
15,부산국제영화제,3758,승진 기회는 거의 없음 정직원 되기는 하늘의 별따기 기간 중에는 일이 너무 몰림
16,부산국제영화제,3758,영화제가 다가오면 반복되는 야근과 주말출근으로 인해 워라밸 보장이 안 된다
17,부산국제영화제,3758,업무분장이 잘 안되어있다. 고객들을 응대하면서 스트레스 받을 때가 있다.
18,부산국제영화제,3758,"-장점이자 단점. 계약직 대다수 -팀마다 업무량/분위기 차이 -부산에 살지 않으면 숙소 생활해야 하는데 2인 1실이 기본, 3인 1실 쓰기도. (물론.. 업무량 많으면 숙소에서는 말 그대로 잠밖에 안 자지만) -오래된 영화제인 것 같지만 막상 사람들이 매번 바뀌기 때문에 다들 처음 해보는 업무로 시작되어서 정규직이 있다고 해도 전반적으로 체계성이나 전문성은 떨어짐 -다른 영화제 출신에게는 텃세가 있기도 -영화제 내내 1일 1사고 당연하다고 생각하면 마음 편해집니다 (이건 진짜 어쩔 수 없음) -사실 영화제는.. 관객으로서가 제일 행복합니다^^"
19,부산국제영화제,3758,해가 갈수록 주먹구구식으로 돌아감 / 한국에서 제일 큰 영화제가 이런 식으로 여전히 운영되고 있다는 것이 놀라움 / 예산 부족으로 향후 미래가 불투명함
20,부산국제영화제,3758,"1.과도한 야근-저녁식사비, 택시비 지원 안됨 2. 계약직 직원으로서의 한계"
21,부산국제영화제,3758,일을 몰아 한다는 점.. 윗분들이 결정이 너무 늦어 일주일 이주일 전 미친듯이 밤을 새며 일을 했음
22,부산국제영화제,3758,영화제라는 특수성으로 인해 보통 기업에서의 이윤추구 성과 등이 중요시 되는 것과 달리 비영리단체로서의 한계로 노력과 성과에 대한 보답이 없음
23,부산국제영화제,3758,"세세하게 분업해야 하므로 나의 권한이 적고, 기계적인 일을 반복하는 것이 많다. 그리고 계약직이 많아 매년 스태프들의 고용 상태가 불안정하다."
24,부산국제영화제,3758,계약직으로 불안정한 고용 관계 및 업무의 비일관적인 구조
25,부산국제영화제,3758,행사기간 잦은 야근 업무강도 행사기간 쎈편 낮은예산으로 복지 없는편
26,부산국제영화제,3758,어찌저찌 해결되는 영화제의 업무들과 제대로 업무를 파악하고 있는 사람이 몇 안되는 운영체제
27,부산국제영화제,3758,팀마다 업무량 차이가 상당함. 업무도 없는데 업무교육 제대로 안된 팀이 많아 업무량이 많은 팀이 두배로 고생해야하는 구조
28,부산국제영화제,3758,체력적으로 힘들 수 있음. 특히 영화제 기간동안에는 무조건 야근.. 팀별로 교류가 적음. 체계가 있는 듯 없는 뭔가 허술한 느낌? 집행위원장이 없어서 좀 뒤숭숭한 분위기
29,부산국제영화제,3758,"영화제 특성상 업무시간이 불규칙하다. 특히, 야간근무가 많았다."
30,부산국제영화제,3758,가장 필요한 엑기스 기간 동안 모든 일을 몰아서 빠르게 사용하고 버려지는 느낌
31,부산국제영화제,3758,돈 안주려고 발악하는 곳. 영화제 준비하다보면 야근/초근이 필수인데 돈안주려고 정말 발악한다는 느낌밖에 안듦. 열정있는 스태프들에 비해 고이다 못해 썩은 윗분들.
32,부산국제영화제,3758,업무특성 상 야근이 많다. 하지만 야근수당을 받을 수 있음.
33,부산국제영화제,3758,박봉. 영화제가 대부분 박봉이라고 하지만 일하는 대비 경력인정되는 부분이 매우 낮다
34,부산국제영화제,3758,전문성이 없으며 고인물이 많음. 정규직으로 있는 팀장들도 업계 출신이 드물어서 배울 수 있는 사람은 거의 없음.
35,부산국제영화제,3758,영화제 기간에 바빠진다. 단기간 근무자가 대다수다 보니 소통이 힘들다
36,부산국제영화제,3758,일이 없던 초반에 비해 부국제 기간에는 미친듯이 바쁨 잘 시간도 없고 밥 먹을 때도 일하면서 먹어야 함 부국제 기간이 다가올수록 워라밸 그런거 없음
37,부산국제영화제,3758,행사 기간에는 업무량이 많고 밤늦게 퇴근한 적도 많았음.
38,부산국제영화제,3758,"체계가 없는 업무로 인한 비효율적인 업무량 증가, 비효율적 업무량에 어울리지 않는 페이"
39,부산국제영화제,3758,"행사 전에는 널널한데 행사 기간에는 정말 눈코뜰새없이 바쁘다, 초과 근무를 해도 대체 휴무를 할 수가 없다, 식비가 적다(한 끼당 8천원)."
40,부산국제영화제,3758,낡은 시스템 팀장 제외 일반 스태프는 대부분 계약직 규모가 크다 보니 비효율적인 프로세스 보고의 보고의 보고의 보고가 많음 국제 행사에 걸맞지 않게 주먹구구식 일처리
41,부산국제영화제,3758,영화에 대한 애정이나 관심으로 입사하는 경우 생각보다 영화 산업에 대한 심도깊은 인사이트를 갖춘인력을 찾기 힘듦. 계약직 스태프가 대부분이며 영화제 이후 업무를 후다닥 마무리하고 방빼서 나가야해서 쫓겨나는 기분임. 따라서 인수인계나 문제점 개선이 매우 느린 편.
42,부산국제영화제,3758,행사의 특징이라 단점이라 말하기는 힘들지만 변동이 많다
43,부산국제영화제,3758,대부분 계약직으로만 운영되다 보니 체계가 잡혀있지 않은것 같습니다. 이 부분만 보완한다면 좋을것 같습니다.
44,부산국제영화제,3758,"낮은 급여 복지 없음(커피 간식 제공 없음, 필요도 없는 남는 협찬품 제공) 수당 또한 이전에 제대로 지키지 않아 사건으로 난리 후 재지급하였으나 현재 역시 야근은 많이 시키면서 수당에 대한 제대로 된 언급없음. 일 자체가 너무 많아서 야근결재를 올리는데 인사팀 눈치보며 일함… 최대 근무 가능한 야근시간 넘겼을 시 퇴근하라고 하는데 그러기에 일이 너무 많아 야근을 피할 수가 없다. 또한 영화제 했던 사람들로 뽑기 때문에 정규직 가능성도 매우 희박하다. 이외에 인맥으로 구성된 정규직 인원이 매우 많아 실무능력이 부족한 리더가 많다."
45,부산국제영화제,3758,사수가 별도로 없기 때문에 업무를 익혀나가는데 초반에 좀 비효율적인 면이 있음. 상사마다 다르겠으나 늦게까지 근무하는 걸 바라는 경우도 많음
46,부산국제영화제,3758,어느 영화제나 그렇듯 계약직 비중이 높다는 것. 그외 없다.
47,부산국제영화제,3758,계약직들이 대부분이라 인수인계가 어렵다. 매년 다른 사람들이 근무하기 때문에 행사 시스템 설명하고 교육하는 게 좀 소모적일 것 같다. 초과근무 많은 편. 행사 특성 상 10월에는 집에 못간다... 월급이 정말 적음 ㅠ
48,부산국제영화제,3758,매년 계약직 직원으로 인력을 충당하다보니 업무 지속성 효율성 제로 어영부영 이게 되네?
49,부산국제영화제,3758,영화제특성상 정규직 티오가 적은것이 단점이고 정권에따라 분위기가 조금씩 바뀌는점도 단점이라고 볼 수 있습니다.
50,부산국제영화제,3758,"출퇴근 시스템 제도를 악용하여 근무 시간을 늘리려는 사람들이 꽤 있다. 은근히 눈치 주는 야근, 실장 팀장 그리고 계약직 다수여서 계약직은 결과보고서에 의지하여 업무를 진행해야함."
51,부산국제영화제,3758,"어느 영화제나 그렇다시피 짧은 계약기간 채우고 계속 사람이 바뀌기 때문에 업무의 통일성이 딱히 없음, 전임자가 기록해놓은 자료를 보고 알아서 인수인계 해야함, 콘텐츠 업계임에도 불구 창의적인 시도보단 이미 닦아놓은 안전한 길을 택하는 경향이 있음"
52,부산국제영화제,3758,업무 시스템이 애매하게 존재합니다. 업무 시간에 맞춰 급여가 주어지는데 설명을 들은 모두가 다르게 이해해서 혼란이 있었음
53,부산국제영화제,3758,업무 강도가 높아서 야근 주말 출근을 자주 한다. 영화제 기간 동안은 거의 풀근무
54,부산국제영화제,3758,영화제 앞두고 끝나지 않는 야근이 시작됨 팀별로 다를 수 있으나 기본적으로 영화제를 앞두곤 워라밸은 없음
55,부산국제영화제,3758,외적인 것에 돈을 많이 투자 함. 특히 스타들 영입에 그 것 말곤 장점이 없는 듯 관객들은 좋아할 듯
56,부산국제영화제,3758,업계라고 보기에는 어려움. 영화 업계라기보다는 mice 산업에 가까운 느낌임.
57,부산국제영화제,3758,일 특성상 행사 기간이 다가오면 점점 야근이 빡셈 한번쯤은 할만한데 다음에도 할지는..?
58,부산국제영화제,3758,"규모가 크다 보니 내부적 소통이 안되는 경우가 종종있음. 생각보다 매뉴얼과 체계없는 부분이 많음. 인수인계가 제대로 되지 않으면서 물어보면 원래 그렇게 한다거나 작년에도 그렇게 했다는 등의 대답이 돌아옴. 그렇다면 그걸 남겨놓고 인수인계 했어야한다고 생각함. 이건 계약직으로의 운영에 대한 한계이며, 영화제 기간이 아닐때 상근 직원들이 충분히 준비해야하는 부분이라고 생각함."
59,부산국제영화제,3758,상사/전임자에게 일을 체계적으로 배울 수 없는 구조. 업무에 대해서 이해하게 될 정도에는 계약기간이 끝남.
60,부산국제영화제,3758,신기한 곳이다. 정말 똑똑하고 밝은 사람들이 세상 비효율적이고 구시대적인 업무 시스템에 굴려지고 있다.  이 곳에선 늦게까지 앉아있는 사람이 일 제일 잘하는 사람이다. 내 업무가 끝이나도 팀원들의 일이 끝이 나지 않았으면 같이 남아있으라는 무언의 압박이 들어온다. 일 실컷 시켜놓고 결국은 팀장 마음대로 해서 일을 두번하게 만든다. 신규 입사자 교육이고 뭐고 없는데 모르는 걸 물어보면 모른다고 뭐라한다. 이 회사에 사회 생활을 처음 경험하는 사회초년생들이 많은지 알 것 같았다. 이 시스템에 의문을 품지 않고 일회성으로 쓰기 좋아서 그런 것이 아닐까.
61,부산국제영화제,3758,"과도한 업무량, 매년 인력이 교체되는 시스템으로 인해 업무 전반에 대한 교육이 매년 이루어져 오히려 시간낭비를 하게 됨."
62,부산국제영화제,3758,야근은 당연하고 연차도 제대로 못쓰는건 영화제 특성상 어쩔 수 없다 치지만 실무를 봐야하는 팀인데 팀장이 실무에 대해 전혀 모름
63,부산국제영화제,3758,정말 솔직하게 오해가 생기지 않도록 작성해보겠습니다. 제일 큰 단점은.. 진짜 너무 많은 인원이 계약직으로 이루어져있고 또 많은 인원이 자원봉사단으로 도움을 주고 있다보니 인수인계가 제대로 되지 않아 많은 회차를 진행한 축제지만 주먹구구식이 조금 있습니다. 그리고 그 주먹구구가 문제가 생겼을 때 크게 작용하여 영향을 받는 것들을 자주 볼 수 있었습니다. 그리고 계약직이지만 짧은 시간 동안 기업을 위해 일해야하는 사람들에 대해 존중이 조금 부족해보였습니다. 모든 계약직들이 중요한 업무들을 맡고 있으며 하나도 안 중요한 스태프는 없다고 생각합니다. 하지만 이 부분에서 조금 부족함이 있었다고 생각합니다.
64,부산국제영화제,3758,"1. 워라밸이, 그냥 없다. 인생에 일 말고 다른 걸 끼울 수가 없다. 2. 계약직 스태프로 굴러가는 행사. 해마다 어떤 사람이 들어오냐가 중요한 곳. 3. 2번에 이어, 갈수록 스태프의 역량이 떨어진다. 더 최악이 있을까? 그 의문을 매년 갱신해준다."
65,부산국제영화제,3758,"계약직이 대부분이라 업무체계없음, 퇴근시간 없음, 체력 좋아야함, 워라벨 없음, 급여 작음, 정규직전환가능성 낮음, 내실없음, 센텀에 위치해 밥값 비쌈, 예산 없음"
66,부산국제영화제,3758,계약직의 비율이 80% 정도이기 때문에 업무의 연결성과 심화도가 낮다. 오랫동안 영화제를 해온 스탭들의 아는 척이 독이 되는지 모르는거 같다.
67,부산국제영화제,3758,"영화제가 다가오면 어느 팀이든 대부분 못해도 밤까지, 심하면 새벽(아니면 밤을 새기도 한다)까지 야근을 한다. 노동강도가 심하다. 지금은 얼마나 달라졌는지 모르겠지만 별로 안 달라졌을 거라는 예상이 든다,"
68,부산국제영화제,3758,"급여가 심각함. 이름있는 영화제중 가장 급여가 낮은 곳.. 2년전이라 지금은 어떨지 모르겠지만,, 그리고 기존 영화제 고인물들이 한 팀에 많이 있다면 친목질이 심한 팀들이 꽤 있음 뉴비가 들어가서 어울리기에 힘듬"
69,부산국제영화제,3758,업무메뉴얼이 정립되지 않은 직무가 더러 있다(담당하는 계약직이 매번 바뀌면서 운영되기 때문에)
70,부산국제영화제,3758,아무래도 단기직이기때문에 멀리 내다보고 일을 하는 것이 아니라 쳐내기에 바쁜 업무들이 단점
71,부산국제영화제,3758,복지가 거의 없음. 업무의 체계가 갖춰져있지 않고 모든 것을 이전 년도 결과보고서에 의지하기때문에 새로운 일을 하기 어려움. 모든 것은 발전없이 이전 것을 그대로 진행하는 형태이며 새로운 상황이 생겼을 때는 경력없는 신입일지라도 혼자 알아서 해라 주의. 특성 상 영화제 기간에는 야근이 필수적이고 법정공휴일(한글날)에도 일을 해야함
72,부산국제영화제,3758,"짧은 시간이고 코로나 시국이었던 만큼 팀원들과의 유대감을 형성하기에 다소 어려움 업무가 너무 분리되어 있어 전년도 결과보고서만 보고 업무를 진행해야했으며, 도움을 받기 어려움"
73,부산국제영화제,3758,눈치 텃세 부리는 사람들 너무 꼴보기 싫음 이미 소문난 사람이라 경험해보면 알듯
74,부산국제영화제,3758,"몸이 조금 힘들 수 있고, 많은 사람들과 함께 협업하는 것을 좋아하지 않는 사람들은 조금 힘들스도 있음"
75,부산국제영화제,3758,행사 조직이니까 행사 앞뒤로 너무 바쁘고 연간으로 계약하기는 쉽지 않음
76,부산국제영화제,3758,칼퇴는 힘들다고 봐야합니다. 일하는사람이 많은데 일의양에 비하면 부족합니다.
77,부산국제영화제,3758,영화제와 같은 축제나 행사성 기업이나 기관이 가진 한계일수 있는데 체계적인 운영시스템이 아닌 직원의 단순한 노동력만을 갈아넣어야 하는 일들이 많음. 많은 수의 기간제 직원으로 운영되어 업무연속성 결여에 따른 문제가 자주 발생함.
78,부산국제영화제,3758,"돈 안주려고함, 체계가 전혀 없음 어떻게 지금까지 굴러왔는지 모를정도, 팀장이 멍청해서 스태프가 개고생"
79,부산국제영화제,3758,"돈을 이상한 방식으로 산정하여 지급, 시간 계산 이상해요"
80,부산국제영화제,3758,연장근무 기안을 올려야 한다. 근무시간 계산이 이상하고 복잡하다. 예를들어 160시간 일한 사람과 168시간 일한사람이 같은 월급을 받는다. 175시간 이상 일한 것이 아니라면.
81,부산국제영화제,3758,"짧은 행사 기간의 특징으로 대다수의 스태프는 계약직으로 채용합니다. 따라서 업무의 인수인계가 잘 이루어지지 않는 편이고, 내가 좋은 성과를 냈다 하더라도 계약 연장은 없으니 업무의 연속성도 보장되지 않습니다."
82,부산국제영화제,3758,"짧은 기간 내에 과도하게 집중된 업무, 치열하게 업무를 해내어도 끝나고 나면 허무하다."
83,부산국제영화제,3758,복지가 조금 부족합니다 계약직이라서 그런 것도 있겠지만 정규직분들도 조금 약한 것 같습니다.
84,부산국제영화제,3758,과도하게 많은 업무가 짧은 기간에 집중됩니다. 업무의 특성상 경력을 살리기가 힘듭니다.
85,부산국제영화제,3758,흡사 구전동화식의 인수인계. 업무 매뉴얼화가 부족함. 월급이 짜다.
86,부산국제영화제,3758,근무시간이 김. 야근이 거의 매일 있는 곳. 야근 못참는다면 비추.
87,부산국제영화제,3758,나름대로의 시스템을 뿐 체계 없음.계약직 위주로 뽑아서 돌리기에 비효율적인 업무. (특히 홍보실장 성격이 진짜 이상함)
88,부산국제영화제,3758,대부분의 인력이 계약직과 자봉으로 운영되기 때문에 큰 발전이 불가한 것 같다. 한 해 한 해 겨우 쳐내고 있는 느낌. 그리고 행사를 위해 달리는 업무들인만큼 행사가 가까워지면 시간의 압박을 정말 많이 받는다....... 또 연차나 수당 지급에 있어서 눈치를 많이 주는 것도 문제. 최저 지급하며 인력을 그렇게 갈아 쓰는데 그것마저 아까워하는 듯한 모습이 좋게 보이진 않는다.
89,부산국제영화제,3758,계약직으로 대부분 구성이 된다. 트렌드를 따라가려고 여러 시도를 하지만 결국엔 기존의 방식대로 가는 경우가 많다.
90,부산국제영화제,3758,"영화 업계와는 실제로 거리가 있고, MICE 사업에 가까운 일을 한다는 것이 단점. 내부 직원들 또한 업계 경력을 가진 사람들이 많지는 않다는 것이 맹점이기도 하다."
91,부산국제영화제,3758,"회사를 이끌어나가는 사람들이 굉장히 보수적이며, 관성적으로 일함. 발전이 없음. 새로운걸 도전을 안함. 답답함. 책임소재를 미루기 일쑤임. 성공적인 영화제 개최를 위하여 하나로 똘똘 뭉치는게 아니고 본인 또는 본인의 팀이 피해를 입지않기위해 급급해하는 모습을 많이보임. 본인일이 아니면 거들떠보지를 않음. 몇년만 버티면 정직원을 시켜주겠다는 말로 젊은 인재들의 고혈을 빨아먹으며 부려먹다가 필요가 없어지면 잘라버림."
92,부산국제영화제,3758,인수인계가 제대로 될수 없는 시스템. 주먹구구식 운영. 그래도 어떻게 굴러가는게 다행.
93,부산국제영화제,3758,겉으로 보기엔 유연해 보이지만 이렇게 꽉 막힌 조직이 없음
94,부산국제영화제,3758,"시간외 근무를 하면 추가 수당이 나오게 되어있는데, 너무 바쁜 와중에 추가 수당을 아끼려는 관련 부서의 입김이 들려오면 업무 사기 저하."
95,부산국제영화제,3758,"대부분의 인력이 계약직으로 운용된다는 점, 급여 인상폭이 미비하다는 점 등 구성원의 모티베이션을 끌어내기 힘든 조직구조"
96,부산국제영화제,3758,"매년 단기계약직을 일회성으로 뽑다보니 업무연속성 없음, 업무지시나 공지가 늦어서 비효율적, 영화제 3주 전부터는 새벽근무 주말근무가 필연적으로 이뤄지는데 팀 내에서도 업무분장이 제대로 안될 경우 총 업무시간의 사바사가 심함"
97,부산국제영화제,3758,모든 영화제의 특징인 근무시간이 단점아닐까. 행사 기간에 임박할수록 야근을 할 수 밖에 없는 구조다. 일을 마치려면 해야만하는 야근이기에 하지만 아쉬운 감이 있다.
98,부산국제영화제,3758,"매년 새로운 스태프(계약작)들이 손발을 맞추면서 아수라장을 방불케함 영화제가 임박하면 일이 끝없이 몰려 퇴근을 할 수가 없음. 프로그래머와 소수 정규직 직원들의 입김에 좌우되며 업무 자동화, 데이터 분석, 크리에이티브 창출 등을 할수도 없도 해서도 안됨."
99,부산국제영화제,3758,"마찬가지로 영화제 기간 집중된 근무가 비정상적이다. 매니징하는 파트도 결국 초보들이나 마찬가지인 경우들이 있어서, 그런 상황이 걸린다면 참담하다."
100,부산국제영화제,3758,계약직이라서 힘이 없어서 소리를 내지 못했는데 일하면서 힘들었습니다. 약간 회사에 발이 묶인 느낌
101,부산국제영화제,3758,어떤 팀 어떤 사람인지에 따라 분위기가 다름 야근많음
102,부산국제영화제,3758,계약직이 아니라 파트타이머 정도의 페이를 주면서 일은 정규직 처럼
103,부산국제영화제,3758,근무 시간 대비 급여가 적습니다. 계약직 직원에 대한 복지는 없습니다.
104,부산국제영화제,3758,행사 기간 안에 모든 것을 시작하고 끝내야 해서 신속하면서도 합리적이고 효율적인 의사결정을 그때그때 내려야 하는 점이 어려웠다.
105,부산국제영화제,3758,최저시급에 달하는 임금이지만 바라는건 야근에 주말출근 필수 수평적인척하나 실상은 수직적 보수적 분위기 매년 계약직만 200명 넘게 채용하니 책임감 없음
106,부산국제영화제,3758,회사에서 어떻게든 직원들 월급 안주려고 노력하는게 보임. 진짜 양아치... 또 고소 당해봐야 정신차릴 듯. 행사 다가올 수록 바빠서 한 달 내내 새벽 퇴근은 당연한건데 그마저도 돈 안주려고 하다니. 사회 초년생들 데려다가 단물 쫙 빨아먹음. 그 외에 할많하않.
107,부산국제영화제,3758,워라밸. 물론 이건 업계 전체가 비슷한거라 기업의 단점이라고 하기도 뭐하다. 매해 내부적으로 같은 문제로 고생함. 새로운 대안을 찾을 필요가 있다.
