,company_name,company_id,review_text
0,비즈웰,2443,자체 프레임워크로 인한 개인 기량 성장률이 낮다는점이었습니다.
1,비즈웰,2443,"기술 및 장비노후화 앱 테스트 경우 회사기기가 없어 본인 기기로 해야하며, 옛날에 머물러 있는 기술 듣기론 최근 새로운 기술들 도입하는 노력한다고함"
2,비즈웰,2443,그래도 스프링 안쓰는게 좀 문제고 PM 개발자 간의 갈등...?
3,비즈웰,2443,복지가 별로 없음 인덕원 위치가 별로임 꼰대가 많음 의미없는 야근 많음 워크샵 의무적으로 가야함
4,비즈웰,2443,2년전 쯤에는 연봉 때문에 퇴사했는데 지금은 모르겠음..
5,비즈웰,2443,자체개발 프로그램이다보니 적응해나가기 어려울수있음 연봉 상승율이 낮음
6,비즈웰,2443,있는 듯 없는 듯 한 꼰대 마인드가 경영진들에게 남아있음.
7,비즈웰,2443,자기계발에 능동적이지 못 한 사원에 대한 냉정하지 못 한 대응. 독자적인 프레임워크로 인한 신규 개발 인력의 수급 문제.
8,비즈웰,2443,"1. 특정 시기에 퇴사자가 몰려서 업무가 한꺼번에 몰리는 시기가 많음 2. 대리, 과장, 차장, 부장 직급에 비해 사원이 너무 과다하게 많음 (윗직급 퇴사자는 많은데 신입으로 자리를 계속 채움) 3. 연구소 제외하고는 반복되는 업무가 지속됨 4. 솔루션에 고질적인 문제들이 해결이 안됨"
9,비즈웰,2443,다소 많이 낮았던 연봉과 복지..(지금은 좋아졌다고 들었습니다)
10,비즈웰,2443,중소기업의 대표적인 단점으로 연봉이 적으머 인센티브나 성과급이 없다고 봐도 무방했다
11,비즈웰,2443,임원의 인식이 개선 될 필요가 있음. 운영팀을 보면 한 사람당 맡고있는 사이트가 너무 많음. 업무 과부하.
12,비즈웰,2443,"야근, 주말 수당이 특정 시간이 초과해야 받을 수 있는 특이한 방식으로 운영됩니다. 복지 포인트가 있는데 업무에 관계없는 곳에는 사용하지 말라고 강요합니다. 개발사업부서는 파견근무가 많습니다. 대리, 과장이 많지 않아 업무를 배우기 쉽지 않습니다."
13,비즈웰,2443,체계적으로 문서화가 되어 있는 기술문서 등이 없다. 개발자가 알아야 되는게 너무 많다.
14,비즈웰,2443,"개발자 출신의 프로젝트 PM이 많이 부족해 업무 지시의 디테일 함이 부족하다. 케이스 바이 케이스로 프로젝트의 어려움이 있다. (PM, 선배들의 무능함과 사수 부족) 낡은 개발 방식이 남아있고 트렌디 하지 못한 개발 코드들이 꾀 있다."
15,비즈웰,2443,교육의 기회는 점차 넓히고 있으나 체계적인 교육이 필요함. 재직자들의 기술 능력 향상을 도모해야 함. 보수적인 성향이 있으며 양질의 프로젝트를 취사 선택하여 프로젝트를 진행해야 함.
16,비즈웰,2443,"빠르게 변화하는 IT 트렌드를 잘 읽지 못하는 것 같음. CEO가 회사에 관심이 있는지 잘 모르겠음. 보수적인 임원진으로 인해 뭔가 바뀌려면 상당한 시간이 필요함. 소프트웨어 개발회사란 자원이 곧 인재인데, 경영진의 자원관리능력이 상당히 떨어지는 것 같음."
17,비즈웰,2443,꾸준히 신입을 채용하지만 오래된 기술과 업무 불만족으로 커리어가 쌓이지 않기 때문에 막상 몇년뒤 남아있는 직원은 극히 드뭅니다. 소잃고 외양간 고치는것도 아니고 안고칩니다.낮은 연봉때문에 경력직이 거의 입사하지않습니다.
18,비즈웰,2443,조직 구조가 수직적인데 임원들이 수직적이라고 생각 안하는게 제일 큰 문제입니다. 00년대생이 입사할텐데 받아들일 마음가짐은 있어야 할 것 같습니다. 전반적으로 회사 체계가 너무 안잡혀있습니다..스타트업도 이러진 않습니다 임원들이 별의 별일을 다해서 업무의 집중이 안되어있습니다. 임원들 뿐만 아니라 개발자들도 별반 차이 없다 생각합니다. 개발자로서 배울 수 있는게 전혀 없고 이정도면 규모있는 사프로 커버할 수준인것 같습니다. 비전공자가 국비학원 이수하고 바로 취업한 경우라면 실무적인 부분만 배울 수 있을거같아요. 사내정치도 은은하게 존재합니다. 연봉은 기대하지마세요 요즘 물가를 생각해야지 90년도 물가 생각하고 연봉 통보합니다
19,비즈웰,2443,"프로젝트 수행 PM에 대한 능력 부재로 그 아래 PL 또는 개발자들이 PM역할을 같이 수행하는 경우가 많다. (바지PM이 여럿 있음...) 프로젝트가 바쁘거나 업무가 많은 경우 퇴근이 늦어지는 경우가 많고 일을 하는 사람과 그렇지 않은 사람이 명확히 구분되는 부분도 있다. 간혹 몇몇 직원은 자리를 비워 거의 사무실에 없는 경우도 있다. PM 부족으로 중간 직급(개발자 출신의 차장, 과장)들이 PM을 수행함으로써 고객협의, 개발, 프로젝트 관리 등 복합적인 업무를 수행함으로 업무 강도에 무게감을 느껴 스트레스를 받는 경우나 이직 하는 경우가 있다. 트렌디 하지 못한 코딩이나 형상 관리 툴을 사용 중이다. (JSP에 자바소스가 많아 디자인부서에서 JSP를 직접적으로 다루지 못하는 경우, 서비스 어플리케이션에 일관성이 부족한 프로그램 코드, GIT이 아닌 SVN 사용 등등)"
20,비즈웰,2443,제가 재직하던당시에는 워라밸이 좋은편은 아니었고 급여도 아쉬운부분이 많았음
21,비즈웰,2443,"노후화 된 개발 장비, 프로젝트 투입은 거리를 전혀 따지지 않으니 편도 두 시간 거리도 할당 시킴, 프로젝트 진행 시 연차 마음대로 못 씀, 윗 사람과의 대화는 벽과 대화하는 것 같음."
22,비즈웰,2443,다소 폐쇄적이다.(코로나 이후로 더 심해진 듯함..) 복지나 급여가 평균에 못 미친다. 편안함에 안주하다 보면 고인물이 될 수 있다. 조언을 구할 선배님들도 거의 다 이 회사만 다녀보신 분들임. 심지어 대부분 바쁘셔서 대면할 기회도 마땅찮음. 솔루션이 많이 노후화 되었는데 버전을 올린다고 올려도 실상 유의미한 내부적 변화는 없는 것으로 알고 있음. 여튼 일 잘하는 사원대리 다 나감. 안 우는 사람한텐 젖 안 주는 편.
23,비즈웰,2443,일반적인 중소기업의 단점으로 복지가 별로 없어서 안 좋음
24,비즈웰,2443,너무 수직구조가 단점. 요즘 MZ세대를 신입사원으로 받으려면 이런 구조는 이제 없어져야 한다고 생각함.
25,비즈웰,2443,"복지제도들이 막이제 시작하는 부분이 많아 미숙한게 많음, 일이 많음.. 다양한 환경을 접하려 하다보니 신입으로 가면 처음에 많이 힘들가능성이 높음"
26,비즈웰,2443,PM이 일을 안함 피엠따라 다르다는데 그냥 다른 PM도 그럴꺼같음 다른 회사면 PM이 할 일들을 개발자가 다 해야함 복지 없음 당연히 직원들한태 해줘야하는걸 엄청 생색내면서 해줌 프로젝트 끝나면 리프레시 휴가 이런거 없음 윗사람들이 너무 많아서 수직적임
27,비즈웰,2443,야근수당이 있으나 재대로 활용할순없음 최근 매출 감소로 약간의 압박이 있음 계속 그룹웨어만 함
28,비즈웰,2443,그외에 SI 업체가 가지고 있는 단점들을 거의 다 가지고 있음
