,company_name,company_id,review_text
0,비스텔,2709,승진이나 연봉이… 좋지는 않습니다 분할하고나서는 어떻게 변했는지는모르겠어요
1,비스텔,2709,회사 주변 인프라 부족 회사의 대우가 부서별로 상이함
2,비스텔,2709,연봉을 더럽게 안 올려주고 사내 정치문화가 깊숙히 박혀 있음
3,비스텔,2709,1. 설립연도에 비해 체계가 없음 2. 독단적인 의사결정권자 존재
4,비스텔,2709,연봉 상승률이 적고 전사원 평등하게 직급별로 연봉이 상승하는 정도인것같음.
5,비스텔,2709,연봉이 너무낮음 연봉동결도 존재 연봉만아니면 괜찮아요..
6,비스텔,2709,연봉수준이 타 기업과 차이가 납니다 연봉수준을 맞춰주셨으면 합니다
7,비스텔,2709,"분사 후 어수선한 분위기, OJT 교육은 없음, 위치가 애매해서 출퇴근시 불편함"
8,비스텔,2709,잦은 연봉 동결. 연봉 소폭 인상도 대단한듯이 이야기함.
9,비스텔,2709,연봉이 짠 편입니다 위치가 애매해서 출퇴근이 쉽진 않았어요
10,비스텔,2709,"회사가 항상 어렵다고 한다. 경영난을 겪다가 회사 매각으로 상당한 자본이 생겼을텐데 직원에게 돌아오는 것은 없고 내부 인테리어, 신규 법인으로 돌리는 중"
11,비스텔,2709,기본적인 물품도 제공되지 않았음. 티슈조차 직원 스스로 구매해서 쓰는 구조라 황당했음.
12,비스텔,2709,연봉이 낮은 편. 인상률도 낮은 편. 매년 기업 위기임. 매년 조직도 변경하고 자리 변경함.
13,비스텔,2709,너무 개인주의라 공동체 의식이 결여됨 이미 많은 사람들이 자기들 끼리 오래되서 친해지지못함
14,비스텔,2709,시스템이 다소 어떤 체계에서 어떤 것을 찾아야하는지 미흡하고 답답한 경험을 많이 하였음
15,비스텔,2709,연봉 안올려줌 개발자 아니면 거의 대우없음 시다바리 인줄암
16,비스텔,2709,너무 방목하는 경영에 실력이 늘지 않음. 개인의 노력이 없으면 나락으로 떨어질 수도....
17,비스텔,2709,"연봉 인상률 연속으로 실망 중,,, 잘 챙겨주지만 직급 별 차이가 큼"
18,비스텔,2709,비용감축으로 실제로 복지제도 못누림. 부서간 협업이 어려움. 양재역에서 멀어서 버스 타야함.
19,비스텔,2709,연봉인상률이 좋지 않음. 비전 제시가 뚜렷하지 않음. 직원들의 의견을 묻지 않고 사장님의 마음대로 회사를 운영하시는 방식이 다소 보임.
20,비스텔,2709,연봉 인상율이 높지 않아 오래 다니기에는 힘든 것 같음 다른 기업에 비해 너무 짬
21,비스텔,2709,급여가 너무 적음. 대표가 너무 특정 부서만 좋아하고 챙김. 밑에 임원들이 대표의 눈과 귀를 가리고 있음. SI & SM 인력을 너무 대우해주지 않음.
22,비스텔,2709,연봉이 정말 심각하게 짜다 비슷한 회사대비 천만원 이상이 작다....
23,비스텔,2709,회사가 커지면서 부서간의 유연한 역할 조정의 어려움을 겪고 있음
24,비스텔,2709,- 자칫 너무 자유로운 문화에 빠지면 매너리즘 올 수도 있음 - 개인의 책임감이 더욱 중요해 짐 - 자유로움에 너무 빠지다 보면 기술적으로 도태될 수 있음
25,비스텔,2709,새로운 도전의식이 약한것 같아요 더 노력이 필요해보여요
26,비스텔,2709,돈이 좀 작습니다 개인간의 교류가 거의 없습니다 알아서 커야합니다
27,비스텔,2709,경영진이 삽질한다 나오는 신제품마다 대차게 말아먹는다 나아질 기미는 안 보인다
28,비스텔,2709,중식지원 안됨 복지가 생각보다 없음 중식지원 안되는게 아쉽
29,비스텔,2709,미국 법인과의 이른 아침 회의 사용하기 불편한 전산시스템
30,비스텔,2709,고인물들이 많은 것이 문제라면 문제인 것이 새롭게 변화되는 모습은 그닥
31,비스텔,2709,"너무 혁신에 집착하는 것 같고, 기술을 선도 하려고 하는것은 좋지만 기술이 빠르게 변하는 상황에는 대처를 잘 하지 못하는것 같음. 업무 환경이 자유로워서 좋았는데, 윗사람이 새롭게 올때마다 그 자유로운 환경이 박탈 당하고 있음. 돈이 문제가 되어서 개발환경(서버, 네트웍, 기타 전산기기 등)에 제약이 발생 함."
32,비스텔,2709,점심식사 곤란... 커피 무제한 제공이라는데 기계말고 근처 카페 할인이나 월별 10잔 이런식으로 지급해주셨우면 좋겠습니다
33,비스텔,2709,비스텔은 본사와 고객사 근무가 나뉘어져 있습니다. 외부 고객사의 경우 담당자에 따라 근무 환경이 달라지는데요. 대체로 불편한 환경이고 솔루션이 있지만 SI와 다를게 없습니다. SI 프로젝트가 안맞는 분들에게는 정말 큰 단점이예요.
34,비스텔,2709,체계없고 무능력한 팀장 만나면 고생길 열립니다 대표님은 좋음
35,비스텔,2709,상황도 모르는 윗선에서 정치질이 문제. 실무자들이 진행하면서
36,비스텔,2709,일하는사람은 일하고 노는사람은 노는... 자유와 방임의 한끗차이..
37,비스텔,2709,"신제품이 컨셉은 좋지만 실효성이 떨어진다. 제품 개발에서 시장성, 실효성을 더 따지면서 투자를 진행해야 할것이다."
38,비스텔,2709,돈안줌..ㅋㅋㅋㅋㅋㅋㅋ 개발자가 다니기엔 고인물이 꿈이면 추천
39,비스텔,2709,너무 자유로운 탓에 그림자 밑에 놀아나는 사람들이 있음에도 표가 잘 안납니다.
40,비스텔,2709,1. 불평 불만이 많은 임직원 2. 일에 드라이브를 걸어도 발목을 잡는 임직원 3. 작은 규모의 중소기업이나 대기업 같은 씀씀이
41,비스텔,2709,낮은 연봉과 고인물들이 많고 생각이 굳은채로 고착화되어 있음
42,비스텔,2709,회사 직원 대부분의 사람이 직급이 높고 오래 다닌 사람들이 많음. 제품특성상 맨땅에 헤딩 하는식으로 업무를 능력껏 발휘해야 할때가 있는데 가끔 막막하게 다가오기도함
43,비스텔,2709,"제품의 완성도가 많이 떨어지는 제품이 판매되어 어려움이 큼, 급여 수준이 별로다."
44,비스텔,2709,크게 단점으로 보여지는건 없는것 같아요. 업계에 비해 비교적 낮은 급여입니다
45,비스텔,2709,"복지가 빈약함, 직원들에 대한 대우가 좋지 않음 기업의 성장이 정체되어있음"
46,비스텔,2709,- 너무 자유롭다 보니 악용하는 직원이 있는듯 - 자유로운 업무 진행으로 인한 책임과 권한에 대한 과도한 부담을 가질수도 있음 - 개인이 노력하지 않으면 현실에 안주하기 쉬울 수 있음
47,비스텔,2709,회사 경영이 코로나로 인해 좀 어려워진 탓에 복리후생이 이전보다 많이 줄어들었습니다.
48,비스텔,2709,1. 파견을 나오면 가족과 떨어져 있어야 하는 단점이 있음 2. 연봉 수준이 그저그럼
49,비스텔,2709,신입직원이 적음. 회사규모에 비해 연봉은 쏘쏘~ 복지는 한번씩 막힘...회사 사정에 따라
50,비스텔,2709,부서마다 케바케다. 어떤부서는 IT 회사의 전형적인 수평적 구조에 자율출퇴근 칼퇴가 가능하지만 모든 부서가 그런 것은 아니다..
51,비스텔,2709,경영진이 보다 적극적인 확장 마인드를 갖춰야 하지 않을까 싶습니다. 이것도 아니고 저것도 아닌 듯한 분위기는 직원들이 일을 하는데 어렵게 만듭니다.
52,비스텔,2709,"불필요한 회의가 많으며, 업무시에 보고 해야할 중간 Leader 가 많아 보고에 혼선이 온다."
53,비스텔,2709,식사 할곳이 부족하고 교통편도 불편 조용한 회사임 그래서 성장가능성이 크지 않음 본인이 노력해야함 최대 단점은 고인물 인사과
54,비스텔,2709,연봉이 크게 증가하지 않는 회사이다. 고연봉을 원한다면 다른회사를 알아봐라
55,비스텔,2709,고인물들이 너무 많아서 중간은 없고 신입과 오래된 경력 사이에 중간관리/개발자 사람이 없음.
56,비스텔,2709,"1. 도태된 조직 윗사람은 많고 주기적으로 입퇴사하는 신입, 대리직 인원을 채우기에 급급함. 승진체계도 아직 제대로 잡혀있지 않고 매우 불투명함. 승진을 빌미로 업무를 더 할당하거나 회사에 붙어있게 하려고 승진을 쉽게 해주는 듯한 느낌을 받음. 이로 인해 직원 간 이간질도 쉽게 생기는 상황이 발생함. 아쉽게도 연봉협상은 이루어지지 않고 임금 동결만 존재함.   2. 개인 성장은 뒷받침해 주지 않는 복지 복지 매우 약함. 시간외근무수당 없음. 개인의 성장을 위한 어떠한 복지도 없음.  3. 특정 팀은 회식이 잦은 편 술을 습관적으로 마시는 사람들 있음. 강요하지 않는 분들도 있고 좋은 회식자리도 있지만 끼지 않으면 힘든 회식문화가 특정 부서에 존재함. 개중에 새벽까지 술 마시고 알코올 냄새 풍기며 오후 출근하는 것은 다반사고 언행을 주의하지 않고 직원 간 지켜야 할 기본예절조차 모르는 알코올 중독자도 있음. 술이 덜 들어가거나 필요 이상으로 들어가면 감정조절을 못 하기도 하니 주의 요함.   4. 양성평등을 우습게 보는 남성 직원들의 인식  직원의 과반수가 남성 직원인데 성 평등 교육 내용을 우습게 생각하는 사람들 더러 보았음. 미투 게시판은 유령 게시판임.   5. 기업 마케팅과 제품 영업의 고수  보도자료로 회사의 현재를 비추는 게 아닌 과거를 비추는 듯한 인상이 강함. 회사 품평과 관련된 회사의 외부 이미지만을 좋게 하려고 마케팅과 영업을 매우 잘하고 있음. 실상 판매되는 제품은 문제가 많음. 제품 특성상 개개인이 아닌 기업에 제품을 판매하기에 제품 개발이나 개선이 매출액이나 수익률에 직접적으로 미치는 영향이 크지 않아 미래 가치나 비전이 현저히 떨어짐. "
57,비스텔,2709,본인이 자기개발 하지않으면 도태됨 아직 체계가 필요하다
58,비스텔,2709,복지 제도가 있지만 사용시 눈치가 보임. 휴가 한번 사용하려면 팀장 눈치도 많이 봐야함.
59,비스텔,2709,수평적 조직을 지향한다고 하지만 실제 업무를 해보면 대부분 결정권자의 결정에 따라 움직임. 혁신을 슬로건으로 내세우나 기본적으로 고여있음. 대부분의 새로운 기술은 해외인력과 국내의 아주 소수 인력에 의존적이며 국내에서 새로운 기술을 시도하기 어려움. 그렇다고 새로운 기술을 시도해서 제대로 성공한 케이스가 없음. 따라서 대부분의 매출이 레거시에서 발생하기 때문에 고객입장에서 반드시 구매해야할 이유가 없으므로 기존 제품을 싸게 후려쳐서 판매하려는 경향이 강함. 연봉이 매년 시장 평균을 반영하지 못하고 연봉 동결이 자주 있거나 올라도 매우 미미하므로 시장에 뒤쳐짐.
60,비스텔,2709,"현실적으로 잘 시행되지 않는 복지들, 회사 규모에 맞지 않은 적은 월급"
61,비스텔,2709,구성원들의 안일함 나태함에 제품의 완성도가 상당히 떨어짐
62,비스텔,2709,조직개편이 매년 있음 쓸데없는 행사가 많음 고인물이 많은편 혁신을 원하지만 잘 되지 않는 이유
63,비스텔,2709,지원비가 맨날 회사가 어렵다면서 주질않는다. 회사 직원들의 니즈를 들어줄 생각안하고 개인들의 위치에 대해 걱정만한다.
64,비스텔,2709,"굳이 적으라면 it치고는 워라밸이 괜찮은 편, 중견급이라 기대했지만 It는 어딜가든 초임이 짜다"
65,비스텔,2709,"월급이 너무 안오르고, 본사와의 컨택이 너무 없어서 정규직으로 입사해도 프리랜서 같은 느낌.."
66,비스텔,2709,능력보다는 사내정치 및 사람들과의 관계가 그사람 평가에 중요하게 적용함. 즉 시키는거 군말없이 잘하는 사람이 대우 받음. 대부분의 일에 책임지는 사람이 없어 책임감 없이 일을 함. 그래도 서로서로 좋은거라고 잘못해도 일정을 못맞춰도 좋게좋게 넘어감.
67,비스텔,2709,매년 시행되는 조직개편과 프로세스 변화로 인한 업무 생산성 감소. 적응될만하면 조직개편이니 프로세스를 바꿔버린다. 잦은 연봉 동결과 내년엔 이렇게 변화할 거다라는 희망고문이 직원들을 힘들게 한다.
68,비스텔,2709,정치적인 관례가 윗분들 사이에 많이 존재하며 선택과 집중 보다는 겉보여주기 식의 방식이 많음.
69,비스텔,2709,저녁식대 결제가 한달 뒤에 입금된다. 경영지원과 hr쪽에 잉여 인력이 너무 많다.
70,비스텔,2709,"단점이라면, 어느 부서나 마찬가지입니다만, 중복 작업입니다. 그리고 연말에 일이 조금 많습니다. 분위기나 다른 점은 좋습니다. 연봉이 같은 업종 타회사에 비해 조금 작은편인것 같습니다."
71,비스텔,2709,프로젝트를 진행할 때 업무가 잘하는 사람들에게 과다하게 집중이 되는 현상이 자주 발생합니다.
72,비스텔,2709,역세권은 아니라 역에서 내리면 버스 타야합니다/부서마다 상이하지만 수평적이지 않은 부서도 있긴 합니다 이건 부서 바이 부서인 듯 싶습니다/주변에 식당이 별로 없어서 점심이나 저녁 식사가 한정적입니다
73,비스텔,2709,"연봉인상률이 낮음, 무능한 경영진, 신규 사업의 연속적인 실패"
74,비스텔,2709,"점심식대 없고, 일하는 사람만 일하는 분위기 연봉은 뭐 기대안하는게 좋을듯"
75,비스텔,2709,"연봉이 너무 낮은편. 인상률도 크지 않고, 인센티브는 없다고 생각해야함"
76,비스텔,2709,"라인을 잘타야 승진이 이로움 , 일을 잘할 수록 더 힘들어짐 , 역 피라미드 형 구조"
77,비스텔,2709,사원들 급여가 너무 적습니다 직급 높른사람들이 너무많아요 그사람들 몇명내보내면 사원들 평균급여 확올라갈듯
78,비스텔,2709,직원들의 미래를 생각하지 않아보임. 자기개발비 중단됨.
79,비스텔,2709,연봉 인상폭이 낮다. 일하는 사람만 일이 몰린다 직원 식당이 없음
80,비스텔,2709,중소에서 대기업으로 가기 위한 조건인 안정된 조직 운영이 아직 부족한듯 하다. 이쪽만 되면 더 좋은 기업이 될듯
81,비스텔,2709,대리는 별로 없고 부장급들이 많아 분위기 적응에 어려울 수 있음.
82,비스텔,2709,"급여가 많지 않은 점이 있고, 배움에 있어서는 많은 도움이 되는 회사입니다."
83,비스텔,2709,동종 업계 대비 부족한 연봉. 고인물이 많음. 야근 수당 없음 (포괄 임금제)
84,비스텔,2709,"한단계 더 기업 성장을 위해, 최근 회사 운영 관련 여러 시스템을 도입하고 변경하였으나, 안정화 되기까지는 시간이 좀 걸리고 있음"
85,비스텔,2709,시장의 변화에 대응하기 위해서 조직 변경이 잦음 영어로 진행되는 회의가 종종 있음
86,비스텔,2709,"저연봉, 복지가 좋지도 않은데 심지어 계속 바뀜. 멀리 보지 못하는 운영. Enterprise 소프트웨어를 개발하고 판매하는 IT 회사라고 하지만 POC/SI/Customize가 비율이 80%가 넘는다."
87,비스텔,2709,업무 성과에 대한 정확한 보상이 이뤄지지 않는다 오래된 고인물이 팀마다 포진돼 있음
88,비스텔,2709,"연봉이 동종업계에 연차에 비해 많이 낮은 편이고, 복지는 1년에 자기계발비 30~40만원 말고는 크게 기대할 것이 없음."
89,비스텔,2709,꼰대들이 많다 자기들은꼰대가 아니라고하지만 꼰대들이 상당수이다
90,비스텔,2709,"표면적으로는 수평적이나 아직도 보수적 인 관리조직, 팀간 조율의 어려움, 개발 외의 조직에 힘이 약함"
91,비스텔,2709,개인 스스로 제품을 이해하고 노력하기에는 상당한 시간이 필요하고 전문적인 교육 프로그램 및 전문강사가 없음
92,비스텔,2709,"단점 부분에서 제대로 말해야 할 것 같습니다. 현재 올라와 있는 낮은 평점이 틀린 얘기는 아닙니다. 단, 전체의 이야기는 아닙니다. 현재 말이 나오는 곳이 있는 곳으로 알고 있고 곧 고쳐지리라 믿습니다. 경영진 역시 이것에 대해 인지는 하고 있는 듯 합니다.  또한 체계가 없는 것 역시 사실입니다. 회사가 중소기업인데도 불구하고 인원이 급격하게 늘어 체계가 안잡혀 있습니다. 이 부분에서 많은 분들이 불만 또는 불평등을 느끼는 것 같습니다. 이 역시 시간이 지나면 해결되리라 생각 합니다.  현 먹거리로는 급격한 확장 추세를 지탱하기 어려울 듯 합니다. 중소기업으로 남고 적절한 매출을 유지하는데는 충분한 기술력이나 더욱 큰 도약을 위한다면 전체적인 구조조정 및 체질 개선이 반드시 필요합니다."
93,비스텔,2709,업무의 양 배분이 비효율적 부서마다 약간의 차별이 있음
94,비스텔,2709,탄력적 근무제이지만 부서마다 안그런곳도 있음. 직원들의 의견을 많이 듣지만 본질적인 문제를 해결하려고 하지않음.
95,비스텔,2709,EES의 선두기업이다 보니 항상 일이 끊이지 않는 회사입니다. 업무가 패러럴하게 진행되다 보니 개발자와 메니져간에 지속적인 의사소통 및 일정을 확인해야 불만이 나오지 않습니다.  사람 중심의 기업이기때문에 개혁은 없고 불만만 가지고 있는 직원에 대해서는 개인적으로 잘 들어주지 않습니다. 단점이라면 단점이겠지요.
96,비스텔,2709,World best No.1을 위해 끊임 없는 공격적인 투자를 해 인센티브 및 복지 정책 중 일부가 유명무실해 졌다는 것이 단점이다.
97,비스텔,2709,낮은 연봉 인상률. 사원과 대리 직급의 직원들이 부족함.
98,비스텔,2709,일이 분배나 일정이 너무 몰려있어서 바쁠때는 엄청바쁨 한가할때 많이 한가함
99,비스텔,2709,"상당수의 관리자가 개발자 출신으로써 전문적인 관리 능력이 부족한 듯 하다. 입사 이래 몇년간 빠른 시간에 회사의 조직이 커지게 되면서, 매년 조직 개편이 이루어지고 제대로 자리잡지 못하는 느낌이다. 최근에 와서는 전문적인 관리자를 채용하고, 비교적 안정적인 조직 체계를 갖추게 된 것 같다."
100,비스텔,2709,탄력적이고 유연한 조직문화때문에 일하는 사람만 일하고 일안하는 사람은 일 안함 고성과자들만 업무가 쏠리는 경우가 많음
101,비스텔,2709,인원이 많아 공간이 좀 빡빡함 창립기념일에 출근해야 함 사내행사가 좀 많은편임(모이는거 좋아하면 장점일수도)
102,비스텔,2709,"남 이야기를 하기 좋아하는 정치적인 직원들이 회사 전체 물을 흐림. 어쩔수 없겠지만, 회사 사정이 좋지 않을 때는 거의 모든 복지비용이 동결됨. 수평적이고 자유로운 분위기를 추구하지만 사실은 그 반대임. 타 부서 업무에 비협조적이고 공격적인 사람들이 많음. 정치적임."
103,비스텔,2709,업무가 많을땐 엄청 많고 없을 땐 너무 없다. 연봉이 잘 안오른다.
104,비스텔,2709,"1. 제조업특유의 문화가 묻어남, 까라면 까는 상명하복 있음 2. 기술력의 부재.... 솔루션 회사의 탈을 쓴 SI 회사 3. 근속년수가 길어 고인물이 많음 4. 을이라는 한계점이 있어 사장 조차도 몇몇 임원의 눈치를 봄 5. 연봉 자체가 적고 열심히 일해도 보상없음 6. 일보다 정치 잘하면 더 인정받음, 일 열심히 하면 바보 되는 기분이 듬 7. 일을 하는 것이 아닌 보고를 위한 일을 하는 문화"
105,비스텔,2709,회사 점심은 외부에서 사먹어야함 그밖에는 단점이 없습니다
106,비스텔,2709,일부의 의사가 회사 의사결정에 절대적 영향(대표 이사조차도 어쩔 수 없는 듯). 벤처 기업 내의 카스트 제도로 보면 됨. 기타 직원들은 육두품을 넘어서기 위해 사내 정치에 집중함. (사내 정치에 서투른 직원들의 주된 퇴사 사유) 역시 벤처 기업이라 연말 평가 시즌이 되면 성과의 과대 포장이 있음.
107,비스텔,2709,긴축재정의 장기화와 이에따른 복지비 감소 사내식당 없음 - 본사 근무시 점심은 개인지출 처음 입사시 특별휴가 3일 팀에 따라 단기 장기 출장 및 파견이 필요(수당은 지급)
108,비스텔,2709,너무 자유로운데 체계성이 부족하니 관리가 안되고 경영진이든 사원들이든 주먹구구식 일처리를 한다. 그러다 보니 대충 일하는 사람들은 널럴하고 제대로 책임감 있게 사람은 일이 엄청 힘들고 많아진다.
109,비스텔,2709,비상경영체제가 너무 잦음. 식비 및 기타 비용절감을 항상 요청
110,비스텔,2709,1. 부서별 업무 강도 차이가 너무 심함 2. 근속년수가 긴 직원들이 많아 일을 안하고 월급만 가져가는 사람들이 많음 3. 일 잘하는 사람들에게 일이 몰림 4. 연봉상승은 꿈꾸지 마세요.
111,비스텔,2709,과장이 많다. 타기업에 비해 연봉이 조금 작은것같다. 팀분위기가 회식분위기로 직결. 술많이먹는 팀들도 있다.
112,비스텔,2709,사내 식당이 없음. 회사 홍보가 잘 안되어 있음. 타사에 비해 수습기간이 길다.
113,비스텔,2709,비스텔은 회사 내 구내식당이 없다는 것이 아쉬운 점이다.
114,비스텔,2709,해외 여러 지역에 지사들이 있어 업무 진행시 커뮤니케이션이 어렵다.
115,비스텔,2709,"회사는 계속 커가는데, 그에 따른 제반 사항들이 조속히 갖춰졌으면 좋겠음."
116,비스텔,2709,"사옥임에도 불구하고, 사내에 식당이 없다. 역에서 조금 떨어져 있어 교통이 불편함. 연봉 상승폭이 작다."
117,비스텔,2709,"부서마다 다르겠지만 야근이 적다. 하지만 야근수당이 별도로 없음. 사옥임에도 불구하고, 사내식당이 없음. 본사에만 근무시 중식비 지원 없음."
118,비스텔,2709,-복리후생이 부족하다 (모든 직원이 혜택을 누릴 수 있는 조금 더 다양한 복리후생 제도를 운영했으면 좋겠다) -사내 식당이 없어 불편하다 (사내 식당이 있었으면 좋겠다)
119,비스텔,2709,"아직 체계가 덜 잡힌 부분이 있음, 하지만 진행하고 있는 평가시스템이 도입되면 보다 나아질듯함."
120,비스텔,2709,성과평가에 대한 불만이 커 체계화된 성과평가가 필요함. 최근에 도입된 성과평가 제도가 이런 부분들을 개선해 주었으면 함.
121,비스텔,2709,"SI 사업부가 대다수를 차지하는데... SI를 해본 사람들은 알겠지만, 고객사 눈치에 휴가도 제대로 못쓰고 야근에 주말 출근등등... 자신의 생활을 포기해야 할만큼 힘들수 있음."
122,비스텔,2709,회사가 갑자기 커지면서 제도들이 미흡한 부분이 있음. 고객사에서 근무하는 직원들에 대한 관심이 낮은 것 같아 개선이 필요함.
123,비스텔,2709,많은 업무량에 비해 낮은 연봉이 단점이라고 할 수 있음.
124,비스텔,2709,"0. (최대 단점) 업무 대비 연봉이 적고, 인센티브는 그저 전설로만 전해지는 중. 1. 차장, 부장이 차고 넘침. 능력도 차장 부장급인 사람들이 차고 넘친다면 좋겠지만... 2. 체계적인 교육 구조가 없어서 업무 관련 지식들이 정확히 축적된 직원이 별로 없음. 보통 단편적으로 이것 저것 간단히 알고 있는 정도. 3. 2번의 이유로, 업무는 대개 소수의 워커 홀릭들에 의존하여 수행됨. 4. 보통 일을 잘하면 일이 몰리는데, 덕분에 일 잘하는 사람들이 야근 및 주말근무를 많이 하게 됨. 물론 야근 수당은 없음. 5. 연차 사용이 자유로운 편이지만, 3번의 이유로 일 잘하는 사람들은 연차를 제대로 사용하지 못하는 경우가 허다함. 6. 일 잘하는 사람들은 못하는 사람보다 대우가 좋은가? 극소수의 워커홀릭을 제외하면 연봉은 비슷비슷."
125,비스텔,2709,"맡은 업무에 따른 업무 강도의 차이가 큽니다 재수 좋으면 정말 편하고 재수 없으면 정말 어려울 수 있습니다 하지만, 좋은 평가가 나오리라 기대는 마세요 그래서 팀 변경 때 좋은 팀으로 이동하려는 사람이 많습니다 대리급 이하 연봉 만족, 과장급 이상 연봉 불만족"
126,비스텔,2709,경영진들의 실적눈치 때문에 아무것도안됌 매년 되도않는 프로그램 신설해서 쓰잘데기없는짓거리 생산
127,비스텔,2709,"업무 분산이 안되서 일이 많은 사람은 거의 매일 야근함. 연봉이 높은 편은 아님.. 연봉 인상률도 좀 그러하다...직급의 사람 수를 보면 부장, 차장, 과장은 엄청 많은데 비해 사원, 대리의 수는 적다."
128,비스텔,2709,연봉이 타 회사에 비해 적다. 업무가 한 쪽으로 몰리는 경향이 있다.
