,company_name,company_id,review_text
0,비젠소프트,6958,대부분의 부서에서 이끌어줄 팀장의 부재 시간에 항상 쫒겨 말도 안되는 일정을 강행하기위해 야근을 강요
1,비젠소프트,6958,사람 갈아 넣어서 겨우겨우 먹고사는 회사 대표가 비전도 없고 악덕 마인드에 제대로 업무할 줄 아는 경력자도 없는 우울한 회사
2,비젠소프트,6958,- 복지가 X - 야근을 밥먹듯이 - 연봉이 정말 너무 짜요 - 개인주의가 될 수 밖에 없는 업무 구조
3,비젠소프트,6958,1. 비효율적으로 일함 2. 단순 업무 보고를 왜 퇴근 후에 하는지 모르겠음 3. 사무실 내에서 서로 욕을 거리낌없이 함
4,비젠소프트,6958,"체계화된 업무 시스템이 없고 바쁜 프로젝트부터 빨리 마무리하는 중구난방식 시스템 , 유급휴가로 장난치는 회사"
5,비젠소프트,6958,다수의 프로젝트가 있어서 커뮤니케이션을 동시에 진행 하는 단점이 있지만.. 무리가 되는 수준은 아님
6,비젠소프트,6958,막내한테 유지보수를 몰아주고 기획자들은 디자이너 개발자 눈치를 엄청 봤던 것 같다.
7,비젠소프트,6958,평범하게 잇는 기존 가지고있는 템플릿으로 작업을 해나가는데 그 방향이 올바른지는 모르겟다
8,비젠소프트,6958,에이전시 특성상 업무가 많다. 유지보수와 프로젝트를 같이 병행해서 진행하다 보니 야근이 많고 정신 없을때가 많다.
9,비젠소프트,6958,체계적이지 않고 업무도 잘 안알려주는 느낌 책임 떠넘기기 식
10,비젠소프트,6958,하루단위로 업무가 짜져있었는데.. 신입사원이 감당할양이 아니였음. 매일매일 야근함….
11,비젠소프트,6958,완전 비효율적으로 일하고 사람을 소모품으로 생각함. 일안하면 엄청 뭐라하고
12,비젠소프트,6958,중간 관리자가 적어서 신입으로 업무를 수행하면서 모르는 부분에 대한 질문을 하기 어렵습니다. 때문에 혼자 해결해야 할 때도 있습니다.
13,비젠소프트,6958,지각1분단위로 월급에서 뺍니다. 야근해도 뭐없고 철야하고 다음날 퇴근하면 결근처리입니다.  하루종일 전화 울려서 정신없고 하루종일 소리지릅니다. 중앙 시장이 더 마음 편안할껍니다.  흡연자들은 몰래피세요 담배피는거 걸리면 한시간에 한번씩 대려가서 30분동안 담배피고옵니다. 물론 재미는 없습니다.  또한 저는 할일이 많아서 담배를 1시간마다 30분씩 피면 저만 집에 늦게 갑니다. 본인은 집갑니다.  야근도 안하면서 힘들단 소리는 맨날 합니다. 본인은 칼퇴하고 저는 10시에 퇴근했는데 본인이 힘들답니다  체계 없습니다 가서 아는척하시면서 이렇게 하는거다 하면 그렇게 할껍니다.  1년마다 승진시켜줍니다. 뭐 아무것도 모르는 사람들이 직급달고 있습니다. (다른회사 신입으로도 못갈사람들 입니다)  기획팀에 아는척 하는 사람 한명있는데 그사람 아무것도 모르면서 이회사 장점이 있다 하는데 제발 다른 에이전시 인턴 이라도 해보고 오면 좋겠습니다.
14,비젠소프트,6958,"하단 리뷰 보고 어이없어서 리뷰작성 하는데 기획자들이 디스크립션 안만들고 대충하고 싶어서 안하나요??  같이 회사 다니면 아실텐데 본인 구축 프로젝트도 10개 씩 있어서 정신없는데 뭔지도 모르는 상담전화 견적 문의 등등 모든 부서에서 기획팀에 전화 돌려주고 하루종일 전화 받고 견적서 쓰고  자료없는 상태에서 레이아웃만 그려서 디자인 들어가라 하는 경우가 많고 쇼핑몰이면 이 쇼핑몰이 뭘 파는지도 모르고 기업은 엄던 회사인지 모르고 디자인 들어가는 경우도 많습니다. 견적 비용 넘어가서 다시 디자인은 못하고 업체랑 싸워야하고  다들 신입이라 본인들 포폴 생각하면 요구사항정의서, 기능정의서, 와이어 프레임 ,IA , 정보구조도 ,스토리보드, 플로우차트 , 유스케이스 시나리오 등등 몰라서 안하나요? 어차피 퇴사하고 포폴 쓰려면 집에서 다 작성해야하는데 업무시간에 미리 만들면 좋죠? 맘같아선 사용성 테스트도 하고 제안서도 만들고 싶어요 이회사에서 여건이 있나요? 물어보고싶네요  누가 작성하신지 모르겠는데 아래 후기 두개 다른 부서 이야기 전에 본인은 잘하는지 생각좀 부탁합니다."
15,비젠소프트,6958,"영업에서 계약을 체결하면 일정이나 비용 등의 문제가 발생할 수 있습니다. 영업을 우선하여, 고객사가 요청한 사항이 큰 공수가 생기는 부분이 발생할 수 있습니다."
16,비젠소프트,6958,"영업팀, 기획팀이 웹 개발에 대한 이해도가 낮음. 실무자가 아닌 다른 부서 사람들이 팀장임. 경력자의 퇴사를 신입으로 대체함. 신입 돌려막기 그래서 점점 경력자가 없어짐. 특정 부서 직원들을 소모품으로 여김. 복지가 없음. 그나마 석식비 제공?"
17,비젠소프트,6958,"영업팀 기획팀이 공부가 부족함. 웹에 대한 이해도가 낮고 아직 반응형이나 웹표준, 접근성 등 구체적으로 뭔지 모름. 그러니 단가가 낮고 구축기간이 짧으며 기획팀은 자기 롤이 뭔지를 모르고 타 팀에게 기대기 일쑤. 검수파일은 당연히 안만들고 말로 때우며 화면설계에 디스크립션은 늘 생략. 그러니 늘 시간은 없고 업무 범위는 넓어 실무자들이 일하기 힘든 부분이 많음. 여기서부터 모든 밸런스가 무너짐  이걸 뒷바침 하는게 복지나 연봉인데 이게 너무 박하다보니 아무리 돈보고 오지않는게 에이전시라지만 서러움"
18,비젠소프트,6958,일정이 분단위로 관리해서 매우 타이트함 그래서 그런지 매일 압박감이 심함 여유롭게 일하지 못함 템플릿형 홈페이지라서 실력상승이 없음 수직적 관계
19,비젠소프트,6958,팀장이있지만 실무자가아닌사람이 팀장임... 퍼블 개발 디자인에대해 아무것도모르지만 직급으로 팀장에앉아있음 상황 개선에대해 얘기해도 회사입장좀 생각해달라하면서 무시함
20,비젠소프트,6958,왜 리뷰에 신고가 된 댓글이 많은지 대표는 확인할 필요가 있음 엣조직문화 남아있음 업무를 혼자 헤처나가야하는 일이 종종 발생함 업무에 대한 시간이 촉박함
21,비젠소프트,6958,"분단위의 업무분장, 사수없음, 옛스러운 조직문화, 복지없음"
22,비젠소프트,6958,단순 보고를 위한 문서 작업이 많고 비효율적인 업무 보고와 잡다한 일거리가 많음
23,비젠소프트,6958,업무에 엄청난 시간을 투자해야 하는 회사 업무 프로세스 중에 개발 업무가 제일 마지막이라 모든 회사가 동일한 환경일 테지만 유난히 돋으라 지게 책임을 많이 강요하는 회사 최신 기술을 많이 접할 수 없고 공부하기 어려운 회사
24,비젠소프트,6958,전형적인 수직적인 기업 개발자의 의견은 묵살되고 오로지 영업의 입김만으로 굴러가는곳
