,company_name,company_id,review_text
129,비스텔,2709,SI로 프로젝트하는 부서는 헬게이트고 본사 내근직은 대다수가 편하게 칼퇴함. 잉여자원들이 넘 많아서 효율이 떨어짐.
130,비스텔,2709,"본사 근무자들은 다양한 연령대와 여직원이 있지만, 지방 출장 근무자들은 보통 나이대가 많은 편이며 기업전체적인 문화가 세련되지는 않다."
131,비스텔,2709,회사가 갑자기 커져서 인사 평가 제도가 애매함 저렴한 연봉과 인력풀을 통해서 사람을 돌려쓰느라 전문가가 부족 . 정치 인들이 많이있음
132,비스텔,2709,개발 프로세스가 정립 단계에 있어 부족한 점이 많이 있음. 반도체 산업이 주력이이서 사용하는 용어 등 초기 진입 장벽이 있음.
133,비스텔,2709,연봉 협상시 평가에 대한 부분 보다는 주먹구구로 되는 경우가 많습니다. 조직 개편이 적응할 시간도 없이 계속? 되는 느낌입니다.
134,비스텔,2709,"비합리적 인사 평가, 연봉 동종 업게 보다 낮음. 잦은 계획 변경 및 조직개편이 너무 빈번함."
135,비스텔,2709,인력 관리가 제대로 안 됨. 인력을 효율적으로 사용하지 못함(일 하는 사람만 하고 안하는 사람은 안하는데 연봉은 똑같음. 사회주의 국가 같음)
136,비스텔,2709,간부급 인력이 많음 인력대비 저매출 거의 없는 직원 복지
137,비스텔,2709,본사 근무하려면 정치 잘해야함 지방출장 근무는 근무지마다 특색이 다 다름 운나쁘면 엄청 힘듬
138,비스텔,2709,"개발자로서는 si 팀과 본사 개발팀이 있는데 si 는 여타 업체와 비슷함..(딱히 장점이 없음) 본사 개발팀은 영어,개발,정치 잘하고 열심히 하면 꽤 대우 받는데 워낙 워크홀릭러들이 많아 어중간해서는 티도 안남. 연봉,복리후생은 최악은 아니지만 중하 수준.. 하지만 장기근속자들 보면 적당히 받음.."
139,비스텔,2709,"일을 잘하는 직원에게 너무 업무가 몰리는 경향이 있고, 한 곳에 오래 근무하지 못해 자기 생활을 갖기 어려움"
140,비스텔,2709,"적은 연봉, 업무가 잘하는 사람에게 너무 몰림"
141,비스텔,2709,"체계적인 인사시스템이 없고, 인력관리가 제대로 되지 않음."
142,비스텔,2709,부서에 따라 야근과 출장이 잦음 급여가 조금 약하다고 느낄 수 있음
143,비스텔,2709,국내.외 많은 고객사에 파견되어 일해야 할 가능성이 많음.
144,비스텔,2709,"기업이 커지며 발생하는 문제점들, 경영및 의사결정에 약점이 보인다."
145,비스텔,2709,갑 업체로 파견 갈 경우 주말 출근도 하여야 함 능력이 부족한 사람들이 매니저 급으로 일하고 있음
146,비스텔,2709,편하게 다니면 다니는데 자기발전의 시간을 남에게 기대하면 안되는회사. 신기술도입에 인색하다 회사 제품개발보다 사이트 적용 후 유지보수에 신경을 더쓰는 회사.
