,company_name,company_id,review_text
0,뿔미디어,12230,시대착오적인 느낌이 강함. 여성은 승진하기 어려운 환경.
1,뿔미디어,12230,기본적인 연봉 협상이 없고 1-2주에 한 번 직원들이 사무실을 청소합니다 그러나 실내에서 간접흡연을 당해 청소를해도 냄새가 빠지지 않습니다. 그리고 제일 중요한 남녀차별이 있습니다.
2,뿔미디어,12230,"연봉 협상 없음 부서별 업무 강도 차이 있음(편집부에 간다면 야근 필수) 남녀차별 있음(남직원 회식, 워크숍 등) 모든 팀장 제 역할을 안함 상부는 실무 안함 실내에서 간접흡연 가능 1~2주에 한 번 사무실 청소 직접"
3,뿔미디어,12230,대표와 상사의 가스라이팅과 일하는 사람을 더 못살게 굼
4,뿔미디어,12230,여러모로 일을 많이 배울 수 있음 성과가 좋고 열심히 할수록 손해 보는 구조 가구든 PC든 무엇이든 다 중고로 제공
5,뿔미디어,12230,편집자에게 실적 압박이 있는 편. 그러나 다른 출판사에 비해 월등히 떨어지는 계약조건으로 좋은 계약을 따내길 원하는 게 양심이 없음
6,뿔미디어,12230,복지제도가 없어도 너무 없고 임금이 너무 박함. 재택도 힘들고
7,뿔미디어,12230,"매출로 스트레스를 너무 많이 줌, 판무팀이 너무 약함.. 연차 안 쓰면 소멸되는 회사는 처음 봤음, 연봉이 너무 짜다"
8,뿔미디어,12230,"최저 임금, 성별 차별, 상부의 기분에 따라 바뀌는 업무 체계."
9,뿔미디어,12230,장점 빼고 전부 다 이미 외부에서 소문이 좋지 않아 계약도 잘 안 됨 단점이 너무 많아서 다 쓰려면 3박 4일 걸릴듯
10,뿔미디어,12230,열심히 하는 직원 아낄 줄 모름. 모든 걸 눈치껏 알아서 해야 하는 각개전투. 사원? 그저 부속품 같은 것. 상부의 성차별적인 승진과 회식 자리 제공. 영입력 부족. 영업력은 그나마 명관 취급해 주는 플랫폼들 덕분임.
11,뿔미디어,12230,체계가 없다. 엉망진창 수준이 아니라 없다 그냥. 투자에 소극적이다. 그런 상황에서 작가를 어떻게 영입하지..
12,뿔미디어,12230,1. 이 업계가 박봉이라지만 매우 적은 연봉.식대 지원 없음. 2. 윗사람 눈치만 살펴야 하는 살얼음판 분위기. 감시는 덤. 3. 누구도 강요하진 않지만 업무량 때문에 필수가 된 야근. 4. 잦은 퇴사로 중간 직급 부족. 신입 뽑거나 기존 직원한테 다 떠넘김.
13,뿔미디어,12230,문서작업과 매일링 카톡 잡다한 업무가 많음 글도 계속 봐야하고 교정도해야하고 힘든점이 많음
14,뿔미디어,12230,1. 일하는 사람과 노는 사람이 명확하게 보임. 하지만 혼나는 건 일하는 사람인 아이러니함 2. 그나마 사람이 착해서 버틴다는 것도 옛말. 좋은 사람들 다 나가고 없음 3. 기싸움하려 드는 사람 너무 많아서 피곤함 4. 신입도 2인분 이상을 하길 바라는 회사 5. 돈이 다라고 하지만 돈 벌어와도 어떻게든 꼬투리잡아서 욕하는 회사
15,뿔미디어,12230,"작가에게 투자를 안 한다. 직원한테도 투자를 안 하지. 월급값을 하기 위해선 작가를 데려와야 하는데, 그 작가들은 죄다 되도 않는 돈을 원한다. 물론 터무니없는 글에 돈을 줄 순 없지만, 그런 출판사도 있다는 걸 생각하면..."
16,뿔미디어,12230,야근을 정말 많이 하게 되고... 강요는 아니어도 할 수밖에 없는 시스템이었네요. 직원 개인개인에게 요구되는 니즈가 매우 많은 편. 덕분에 살이 쪘어요.
17,뿔미디어,12230,"모든 일을 본인이 스스로 만들어내서 해야 하고, 모자르고 실적이 안 좋으면 압박이 들어오며 너무 열심히 하면 그 뒷처리 또한 온전히 본인 몫이기에 무척 힘이 든다. 연차도 일주일 전, 내는 날짜 등이 정해져 있으며 일만 자유롭게 할 수 있을 뿐 편안한 분위기는 아니다."
18,뿔미디어,12230,다니다 보면 어느 순간 업계의 한계가 느껴집니다. 새로운 방안 모색이 필요하다고 생각됩니다.
19,뿔미디어,12230,연차 내기 어려우며 수직적인 기업으로 의견을 내기 어려움. 윗선의 기분에 따라 업무가 달라짐. 가스라이팅 심함.
20,뿔미디어,12230,분위기를 빠릿빠릿 읽지 않으면 힘들 수 있음. 업무량이 많고 몸을 갈아 넣지 않으면 건사하기 힘들어서 건강 문제로 퇴사할 수도 있음.
21,뿔미디어,12230,단순사무작업이 너무 많음...개선되었으면 좋겠음..특정인물 한명빼면 대체적으로 다 좋음 가장 큰 단점은 급여가 너무 적음!!!!
22,뿔미디어,12230,"경영진 기분에 따라 좌지우지되는 회사 분위기, 수직적, 경영진의 뼈 있는 농담, 작가나 표지에 들이는 비용이 현저히 적음"
23,뿔미디어,12230,연봉이 매우 짜다. 이바닥이 그렇긴 한데 연봉 협상도 매우 짜다
24,뿔미디어,12230,복지 거의 없음 연봉 짬 수많은 회의 임원 및 대표가 예뻐하는 팀이 있음
25,뿔미디어,12230,일이 너무 많아서 주말에도 집에서 원고를 봐야할 지경...
26,뿔미디어,12230,정말 사람을 갈아넣어 돌아가는 회사. 워라벨이 전혀 지켜지지 않는 회사. 상사의 기분을 매일 체크해야하는 회사.
27,뿔미디어,12230,변화가 너무 많음. 사람도 자주 바뀌니 그에 대한 스트레스도 있음. 팀 바이 팀이지만 철저한 군대 문화가 있는 팀도 있음.
28,뿔미디어,12230,윗분의 성희롱성 발언 제발 고치자!! 여직원들과는 악수고 뭐고 하지 말고 항상 거리를 두고!! 술 마시고서 악수하자면 기분 나쁘다. 여직원 외모는 아예 언급을 말고!! 왜 잘해줬다가 이런 걸로 점수 다 까먹는지!! 뭐가 성희롱인지 모르겠으면 세미나든 강연이든 다녀와서 고치세요!
29,뿔미디어,12230,임원진과 데스크의 극강 꼰대력. 노예수준의 임금. 임원 그날 기분 눈치게임.
30,뿔미디어,12230,"막내급 직원이 매일 아침 탕비실 컵 설거지 하는데, 이를 여자만 담당함. 남자는 막내여도 설거지 면제. 임원진이 기분파라 눈치를 잘 봐야 함. 사내 전체 분위기를 흐리는 중간관리자를 방치함. 연차 쓸 때 일주일 전에 미리 신청 안 하면 대역죄인 됨."
31,뿔미디어,12230,공무원 마인드로 다니는 고인물들이 문제다 일부 몇몇의 수직적인 분위기는 개선이 필요하다
32,뿔미디어,12230,"라인을 잘 타는 것이 업무 능력보다 중요함, 강압적인 수직관계, 직원을 도구처럼 생각함."
33,뿔미디어,12230,보수적인 업무태도와 상하 수직적인 구조. 작가와 편집자간의 의사소통이 잘 안되는 것처럼 상사와의 의사소통이 잘 안 되고 업무량이 많음. 사원들의 복지가 부족함.
34,뿔미디어,12230,"젊은 직원들이 많아 겉보기에는 분위기가 좋아보이지만 파벌, 편가르기 심함 회사 복지는 기대할것도 없고 적은 연봉으로 딱히 다닐만한 메리트가 없음"
35,뿔미디어,12230,단순 보고를 해도 쉽게 끝나지 않고. 위에서 윗선으로 올라가는 느린 업무처리를 보여준다. 위계질서가 심각할 수준이고 부장급도 권한이 적다.
36,뿔미디어,12230,체계가 잡히기에는 계속해서 시장의 판도가 바뀌어서 맞추느라 힘이 들었음. 그래도 할만했음.
37,뿔미디어,12230,복지가 좋지 않고 박봉임 신입 때는 교정교열등 잡일의 업무량이 많아 힘든데 알아주지 않음 상사들이 별로 소통이 안됐음
38,뿔미디어,12230,"월급 최저시급, 점심수당X, 야근수당 6-8000원, 연차 연달아 사용X, 복지 최하  특정 부서를 꼽지 않겠지만 여직원에게 성희롱 있습니다. 위에 보고를 해도 개선할 생각은 하지 않습니다.  회식은 꼭 참석해야 하는 강제 회식입니다. 회식을 아주 좋아해서 자주해요. 참석 안 하면 눈치줘요.  주말/연휴에도 당연하다는 듯이 일 시킵니다. 집에서도 일하라고 하네요. 추가 수당 당연히 없어요. 이것 역시 개선할 여지 없습니다.  꼰대 마인드, 강제성이 많습니다.(워크샵, 회식 등)(일정 겹쳐서 못 갈 것 같다고 하면 가족여행이 중요하니? 워크샵을 가야지 라는 말도 들음) 마음에 안 들면 이 새끼, 저 새끼(본 것만 해도 수두룩이네요)  우편만 주고 받는 계약이 아니라 무조건 직접 미팅 계약(부산이면 부산 갔다 와야 함"
39,뿔미디어,12230,단점이랄게 있나요. 긍정적으로만 바라본다면 정말 완벽한회사입니다. 꼭 추천드립니다.
40,뿔미디어,12230,............ㅋ 장르 소설에 정말 열정이 넘치는 사람이라도 기운 빠지는 데 뭔가 있음.
41,뿔미디어,12230,위의 장점을 제외한 모든 것이 단점. 꽉 막힌 기업 문화를 고스란히 보여 주고 있음. 큰 회사를 흉내내고 싶어 하지만 정작 연봉과 복지는 큰 회사를 절대 따라갈 마음이 없음. 수직적인 분위기 또한 유구하게 지켜 오고 있음. 정작 사측은 이 회사가 아주 진보적이고 열려 있는 기업이라고 믿는 점이 최악임. 개선 가능성이 그만큼 희박함. 연차는 무조건 한 달에 한 번만 눈치 보면서 써야 하고 붙여서 쓰는 건 꿈도 못 꿈. 관리자들이 형편없는데 그걸 알면서도 짬밥으로 존중하는 경영진.
42,뿔미디어,12230,"실무진과 경영진의 역량이 극도로 차이가 많이 남. 경영진은 업계의 동향 자체를 잘 모르고 있단 인상을 받음. 경영진의 생각이 아직도 창업 초창기에 머물러 있음. 성과에 대한 보상은 인색하고 실수에 대한 질책이 과함. 일이 익숙해지기 시작하면 가족들은 꿈에서나 볼 수 있음. 아무도 야근하라고 강요하는 사람은 없는데 야근을 안 할 수가 없는 구조. 일이 특정한 몇몇 사람에게만 굉장히 몰려 있고 그 사람들 덕분에 회사가 굴러감. 대부분의 상사에게서 배울 점이 없음. 보여 주기식 복지(그마저도 바빠서 사원들은 혐오하는)밖에 없음. 일이 힘들고 사람이 빨리 나가서 승진 가능성이 있을 뿐이고 급여 차원에서는 좀처럼 크게 나아지지는 않음. 워라밸과 멀기로는 한국과 멕시코 거리인 회사. 복지부터 급여, 투자까지 최저 비용 최대 효율을 너무 좋아함."
43,뿔미디어,12230,적은 급여. 경영진의 구시대적 마인드. 굴합리한 경영진 기분맞추기 강요. 부적절한 투자.
44,뿔미디어,12230,"기업 운영 마인드가 아직도 구시대에서 벗어나지 못함. 아래 직원들은 상사에게 알아서 비위를 맞춰주길 바라고, 회식(술자리) 참여 하지 않거나 참여 하더라도 시간이 늦어져서 먼저 자리를 뜰 경우 눈치, 구박 엄청 주고 마음에 안들어 함. 설, 추석등 연휴가 있는 달에는 연차 쓰기도 어려움. 징검다리 연휴 있을 경우 유연성 X, 연차 붙여쓰는건 특별한 사유 없으면 거의 불가능. 기본적으로 연봉이 최저시급 급. 점심 식사 제공 X(알아서 사먹어야 함), 야근 수당 X, 장르문학 편집이 아니면 다른 일은 쳐다도 보지 않겠다 싶지 않은 한 비추천."
45,뿔미디어,12230,"연봉이 형편없음. 처음 들어가면 연차, 월차, 유급휴가 당연히 없음. 야근수당 없음. 야근식대 8000원. 야근 많이 하면 또 뭐라 함. 신입을 뽑지만 경력직 정도의 능력을 원하는 사람이 대부분. 회사 내 성차별도 조금 있지만 그래도 무난한 편."
46,뿔미디어,12230,"최악의 박봉, 야근수당은 6천원, 일도 많고 점심수당도 없다. 장르문학을 좋아하지 않으면 정말 버틸 수 없는 곳"
47,뿔미디어,12230,"야근수당 6천원, 연봉 최저임금, 최저인원에서 최고의 책을 원하는 곳. 다 퇴근하면 집가서 일한다. 야근해봤자 인정안해준다고 위에서 떵떵 거려 모두가 불만을 가지고 있는 곳. 전자책 사업부가 존재하지만 편집부가 영업,마케팅을 모두 한다."
48,뿔미디어,12230,"연차를 쓰기 위해 야근을 해야 함. 연차 쓴다고 일의 양이 줄지 않아서 눈치 안 보고 쓰는 상황. 장르문학 초창기의 '많이 내서 많이 팔자 하나는 건지겠지' 시스템이고, 임원진들 마인드도 구시대에 머물러 있어서 최소 비용으로 나올 수 없는 수준의 결과를 기대함."
49,뿔미디어,12230,"일이 너무 많음. 사람당 3인분은 해야 할 정도. 개인시간이 하나도 없음. 야근, 밤샘 근무도 강요. 연차도 눈치 보면서 써야 함"
