,company_name,company_id,review_text
0,세종서적㈜,12975,팀간 소통이 부족하여 약간의 트러블이 발생하였으며 경영진의 관리가 미흡
1,세종서적㈜,12975,건물이 낡고 오래되었으며 엘리베이터가 없습니다. 사무실이 80~90년대 회사 사무실 같습니다. 인원이 굉장히 적은데 월급루팡들까지 있어서 성장 욕구가 강할수록 본인이 힘들 것 같습니다. 시스템이 거의 없고 개개인의 열정에만 기대어 굴러가는 것 같아 저연차라면 추천하지 않습니다.
2,세종서적㈜,12975,"중심부에서 먼 위치. 마케팅 약함, 올드한 브랜드, 체계적인 관리와 동기부여 부족"
3,세종서적㈜,12975,"복지가 조금 부족합니다 명절, 보너스 상여금 등 외에는 괜찮습니다."
4,세종서적㈜,12975,"인원이 많지 않고 체계가 잘 정비되어 있지 않다, 업무구분이 뚜렷하지 않다"
5,세종서적㈜,12975,체계적으로 시스템이 잡혀있는 느낌이 아니라서 직원들 간의 마찰이 일어날 수 있습니다
6,세종서적㈜,12975,성과에 따른 보상이 조금 부족합니다. 명확한 동기부여 부족
7,세종서적㈜,12975,시대의 빠른 흐름에 좀더 님블하고 애자일하게 대응해야 하는 순발력은 부족한 점
8,세종서적㈜,12975,담당 업무 외의 잡다한 업무가 많은 것 같다고 생각합니다.
