,company_name,company_id,review_text
0,셀론텍,7416,"고립되어있는 아날로그 회사 꼰대, 꽉막혀있음 사람들이 발전 의지가 없고, 하던일만 하고 새로운것은 불평불만 책임전가,똑같은 명절선물, 일하는 사람만 일함, 감정적인 업무형태 융통성없음"
1,셀론텍,7416,회사의 발전성이랑 성장성이 불투명해요 소통은 수직으로 주로 되고 정보 공유가 잘 되지 않습니다 여기 있다가 머리가 굳어 커리어 망할 것 같아요 오래된 사람들이 다니기엔 좋을듯요
2,셀론텍,7416,방진복 답답함 주말출근 조금높은 업무강도 동종업계 조금낮은임금
3,셀론텍,7416,페이퍼 워크가 너무 많음 업무 진행함에 있어서 모두 다 자기 일이 아니라고 미룸
4,셀론텍,7416,"1. 앞뒤가 다른 대표 - 힘든일 있으면 언제든 찾아오라고 하면서 막상 찾아가서 도움 요청하면 이런거까지 들어줘야 하냐면서 뒷담화함(입조심하세요 다 귀에 들어옵니다.) - 인재들이 나가든 말든 신경 안씀, 사람 귀한줄 모름 2. 꼰대와 고이다 못해 썩은 물 파티 - 일잘하는 사람들이 다 나가니 뺀질대는 고인물, 꼰대들만 남음 - 20년 다닌 사람이 자긴 제품도 모르고 보고서 쓸줄도 모른다며 개논리 시전하며 신입한테 일넘김 - 부서장 중에 본인 맘에 안드는 사람 끝까지 괴롭히는 사람 있음 그러면서 아래 직원한테는 폭언, 성차별 하지 말라함 자기소개하고있어서 그런말 할때마다 웃김 아는것도 없어서 책임지거나 중간에서 중재가 필요할 때 갖은 핑계대면서 빠져나감 부서간 이간질시킴, 스파이 꽂아놓고 서로 감시하게 함 등등 온갖 유치하고 질떨어지는 짓 혼자 다 함 개방적인거 좋아한다면서 사무실 다 리모델링시켜놓고 정작 본인은 방에 쳐박혀 있음 아래직원한테 커피, 김밥, 사무용품 구매 등등 심부름 시킴 3. 능력없는 부서들 - 시키는일만 함(시키는것도 못함) - 불평불만, 일떠넘기기, 문제 생기면 서로 회피하기 바쁨 - 부서간 업무 협조 전혀 안됨 - 특히 어느 한 부서가 너무 멍청해서 속터짐 (본인들이 무슨시험을 왜 하고 있는지 궁금하지도 않으세요?)  어짜피 안바뀔거 퇴사할때 인터뷰는 왜하는건지 ㅋ 퇴사 후에 회사가 더 안좋아진거 같음 23년에 제일 잘한 일이 셀론텍 퇴사인줄 알았는데 인생에서 제일 잘한 일이었음 이런 저급 회사에서 시스템은 남들 하는거 다할라고 하는게 너무 웃김 사람들 수준이 너무 낮아요;;;"
5,셀론텍,7416,식대 올려달라고 몇년전부터 얘기했는데 아직도.. 노조가 있으면 뭐하나요 아무것도 안들어주면서.. 일하는 팀 따로있고 딱봐도 노는 사람은 계속 노는데 그래도 때되면 승진은 시켜주는 신기한 인사평가 체계.. 고인물들은 만족도 높아보임
6,셀론텍,7416,꼰대가 있음 딱보면 티남 (개조심) 사람으로 존중받길 기대해선 안됨 고인물 많아서 정체됨 리뷰에 같은 내용 반복언급되는데는 이유가 있음
7,셀론텍,7416,생산 시스템이 이해가 안가는 점이 좀 있음 휴게 공간에 부족
8,셀론텍,7416,2000년대 바이오 기업에 머무르는 느낌이었음. 더 이상 발전을 기대하기 힘든 회사로 보였음
9,셀론텍,7416,회사가 좀 어지럽고 뭔가 급박하게 여러가지 일들이 일어나는 것 같다. 안정적으로 오래 다닐 기업으로 보이지 않는다.
10,셀론텍,7416,"개인의 성장이 어려운 구조, 허나 업무의 효율 및 생산성은 개인의 역량에 절대적으로 의존합니다.  군대식 조직 문화를 보유한 부서 , 해당 부서의 분위기는 생산 직무에서 QA 직무로 옮긴 후 그 차이가 가장 크게 체감될 정도로 인상깊었습니다. 부서 내부 분위기가 그리 밝지만은 않았습니다. 수평적인척하는 수직적 문화에 가까웠습니다.  물가 인상률 대비 비교적 낮은 연봉과 복리후생 대다수 팀원이 편의점 도시락으로 끼니 해결하는 분위기가 당황스러웠습니다. 연봉, 해당 부분이 비교적 최근에 크게 오른 편이라고 들었으나, 직무 전환 이직 후 30%이상 차이가 나, 지금 돌이켜보면 동종업계 바이오 타 회사대비 크게 낮은 편이라고 생각합니다.  회사의 방향성이 일방적 통보였으며, 직원들을 신경써주는 분위기가 되기를 바랍니다."
11,셀론텍,7416,"세척,청소를 기계로 안하고 다 수동으로 해서 좀 번거롭습니다. 조만간 세척은 따로 인원이 온다고는하는데 확정되지는 않았고 평일에 나눠서 쉬고 주말에 출근 해야하는점"
12,셀론텍,7416,"개짠 연봉인상률 식대 8년간 6,000원- 매번 돈 없다 핑계 될게 아니라 놀고먹기만하는 임원진만 짤라도 충분이 올려줄 수 있을거같음 새로온 임원- 성차별, 내로남불심함, 남의 의견따위 필요없고 본인말이 다 맞다고 생각하는 꼰대 그자체(당사자는 쿨한줄 앎), 잔심부름 시킴, 사소한것까지 관여해서 일을 꼬이게 하고 크게 만듦, 직접 실무 안해봤으면서 불평불만 많음 업무효율 극악(예산 미리 안잡으면 추가 기안올리고 이것저것 신청해야함 미리 다 예측해서 1년 예산짜야됨) 프로젝트가 손바닥 뒤집듯 엎어져서 도대체 뭘하고싶은건지 모르겠음 임원진들끼리 얘기하고 회사소식에 대해서 공유안됨. 부서간 협업이 전혀 안됨 이 일을 왜 우리가 해야하냐하면서 아무것도 안하려고 함. 업무개선을 하려고 해도 여태껏 문제 없었는데 굳이 왜 바꾸려고 하냐는 고인물이 많음. 그렇다고 일을 잘하는것도 아님 매번 같은 실수해서 똑같은 말 여러번하게 함. 쓰다보니 복장이 터지네요"
13,셀론텍,7416,"가장 큰 단점, 모든게 고여있음 회사가 무엇을하고자하는지 모르겠음"
14,셀론텍,7416,미래 비전에 대한 공유는 없음. 회사업무가 커리어에 도움되는지는 미지수
15,셀론텍,7416,요즘 밥값이 얼만데 아직도 6천원인지.. 이상한 복지를 하지말고 현실성 있는 복지가 필요 개발 프로젝트가 어느 팀이 못팔겠다고 해서 나가리되는 경우가 많으니 열심히 개발하고 결과물은 0이되는 신기한 현상을 겪게 됨
16,셀론텍,7416,군대식 문화가 존재함 회사의 방향성을 모르겠음 의사소통이 안됨 직원간 및 직원 및 임원간
17,셀론텍,7416,생산직으로 모든업무를 맡아서 업무강도가 강한편이고 앞으로 업무가 더많아질 것으로 고강도와 주말출근까지 하게됨
18,셀론텍,7416,"윗선이 자주 바뀌고 그로인해 경영 흐름이 매번 바뀌어 비효율적, 특히 뉴커머에게 약간의 텃세가 존재해 적응하기 어려울 수 있음"
19,셀론텍,7416,"임원들이 많고 실무인력이 없음, 복지 혜텍은 임원들이 누림. 시스템이 없고 업무분장도 안되어있음, 복지혜텍이 없음. 서로 일미루기 함. 군대식문화, 고인물들 다수, 이전 대표 고인물들 친인척들 빨데꽃고 꿀빨고 있음."
20,셀론텍,7416,밥값이 경제상승률에 턱없이 미치지못함. 중요도를 보지않고 업무를 하는 느낌 강함.
21,셀론텍,7416,야근 시 식사만 제공하고 별도 야근 수당 없음. 승진한다고 해도 직급만 변경되고 실제 수령 받는 월급이 오르지 않는 신기한 회사.
22,셀론텍,7416,"이에 해당하는 것 외에 대부분. 부서마다 업무 강도가 다른데, 특정 부서에 지나치게 업무가 몰리는데 이에 적절한 보상을 하는 느낌을 받지 못해서 아쉬움."
23,셀론텍,7416,"식비 지원이지만 금액이 적고 복지 제도가 부족함, 일 잘하는 사람에게 더 일이 많아질 수 있음"
24,셀론텍,7416,미래의 먹거리를 찾으려고 하지 않음. 경영진의 생각이 무었인지 알수 없음.
25,셀론텍,7416,경영진 교체로 인해 사공들이 많아 점점 배가 산으로 가는 기업.
26,셀론텍,7416,"건물이 너무 오래되었고, 사무실 환경도 노후화 경력직이 오기에는 체계도 없고 만족스럽지 않을 것 같음 자기계발비 지원 같은게 없음, 카페테리아?탕비실?같은거 없음 연봉이 낮았고 잘 안올라서 많이들 나갔음.... 중간 직급의 이직이 많아서 사원 그 다음으로 차장급들이 많음. 한때 회사가 어려워서 사람들 권고사직으로 막 짜르기도 했었음.. 근데 지금은 대표가 바뀌고 연봉제도도 바뀌었다고 들어서 개선이 되었을지는 모르겠음"
27,셀론텍,7416,매우 잦은 회식 꼰대스타일의 윗선. 커리어도움도 크게 도우이 되지않는듯
28,셀론텍,7416,단순 업무가 많고 연봉이 별로라고 생각합니다. 시설이 좋은편은 아닌거 같습니다. 미래가능성은 잘 모르겠습니다.
29,셀론텍,7416,사람이 문제임 끼리끼리 마인드 윗선은 진짜 정말 꼰대 그 자체 일하는 사람만 일하는곳
30,셀론텍,7416,제품이 언제까지 갈지 모르니 안정적이진 않음. 회사 방향성도 잘 모르겠음. 동종업계에 비해 낮은 연봉. 오르지 않는 연봉
31,셀론텍,7416,나이대가 있는 임원진들이 많다보니 그들만의 리그가 형성이되서 밑에 사람들의 의견이 반영되지 않음
32,셀론텍,7416,상기한것처럼 매우 수직적입니다 군대보다 한술 더뜨는것 같네요 그리고 월급이 짭니다
33,셀론텍,7416,고인물이 많고 의사결정체계가 이상함 적절한 보상이 없음
34,셀론텍,7416,제일 큰 단점은 몇년간 계속 건의를 해도 오르지 않는 연봉. 회사가 어렵다는 그런 경영문제를 떠나 사람들 퇴사하면 또 뽑으면 그만 이라는 생각이 팽배한것 같았음 어떻게든 개선을 해주려는 의지라도 보였으면 퇴사자들이 그렇게 나가지도 않았을거임
35,셀론텍,7416,"연봉이 안 오름, 인재가 한 명도 없음, 좋은 사람들이 적음, 사람이 안 뽑혀서 아무나 뽑음,"
36,셀론텍,7416,최근에 추진하는 사업들이 바뀌었습니다. 어떻게 될진 아무도 모릅니다.
