,company_name,company_id,review_text
0,소리샵,6187,"2019년 5월자 다른 분이 적은 후기 (영업 제휴)의 일을 저도 비슷하게 겪었습니다. 같은 점장인진 모르겠다만. 사람이 고인다는 건 그만큼 그들만의 유대감이 끈끈할 수 밖에 없다는 건 압니다. 새로운 사람에 대해 경계심이 많을 수 밖에 없지요. 그래도 홈페이지만 켜놓고 알아서 음향기기를 익히라고 하고 나가라는건 참 흥미로운 경험이었습니다. 몇시간 후, 다시 오셔서 확인할때는 왜 이 순서대로 익혔냐고 하시더군요. 본인 입맛에 맞게 직원을 교육시킬거면 메뉴얼을 주시던가 적어도 순서라도 말해주고 나가셔야한다고 생각합니다. 당시 매장 직원이 부족하여 일손이 많이 부족했던 건 압니다만, 사회 초년생으로서 굉장히 아쉬웠었습니다. 계약서 작성을 본사에서 문서가 내려와야된다는 식으로 계속 미루다가 결국 잘리게 되었는데 솔직히 상황상 저라는 사람에 대해서 알아서 결론 내리고 나가라는 식이더군요. ""누구씨는 우리 회사와 맞지 않는 것 같네요"" 네, 전형적인 멘트죠. 음향기기에 관심있던 사람으로서 정말 아쉬웠고, 두번 다시 이 쪽 업계에 눈도 안 주기로 했습니다. 아무튼 이렇게 길게 적어봤자 개선을 하지도 않을 것 같습니다. 꾸준히 같은 매장직 자리만 사람 구하는 것만 해도 뭐 대충 그렇게 보이네요. 이직하는데 계속 여기 공고만 보여서 참.. 방해됩니다. 제발 직원 잘 구하시고, 그분이 오래 일하셨으면 좋겠네요"
1,소리샵,6187,비젼이 없다 희망도 없다 경영진은 생각도 없다.
2,소리샵,6187,출근이 1초라도 늦어지면 연차가 깎일 수 있습니다 눈치를 많이 보아야하며 눈치가 없다면 미운털이 박혀 승진 및 매 해 협상에 문제가 생길 수 있습니다 그래서 업무 따라 실적에 따라 주어지는 것이 아닌 조금은 오너의 마음에 따라 편차가 주어지는 문제가 있습니다.. 어느 오너나 다 비슷하지만 유독 속이 좁은편에 속해서 야박한 편이기 때문에 경영 상황에 따라 편차가 상당히 있는 편입니다
3,소리샵,6187,별로 업무상의 발전은 없을 것 같다. 별 다른 기획이나 생각 없이 그냥 반복적으로 하는 일만 하면 되는 느낌. 물경력 되기 딱 좋지만 이 회사 안에서만 적은 월급 유지하면서 가늘고 길게 다닐거면 다닐만하다. 직원에게 업무에 대한 기대치가 별로 없는 것 같다. 업무적 능력이나 가능성이 아닌 외적인 요소를 봤다는 면접 후일담 듣고 퇴사를 결정했다.
4,소리샵,6187,회사가 작아서 시스템이 아직 체계가 없었어요 좀 시골이라고해야하니 구석에있어서 주위에 병원 등 아무것도 없어요
5,소리샵,6187,직장 내 괴롭힘 분명히 존재. 모두 그 사람의 존재를 알지만 쉬쉬 합니다. 이 글만 읽어도 모두 알 것. 소시오패스는 가까이 있습니다.
6,소리샵,6187,적으려면 너무나도 많은데 특정인물 2명이 여초회사의 분위기로 만들어가면서 꼰대의 끝판왕을 보여주는 회사 쓸데없는 회의의 연속 공장처럼 돌아가는 업무 실무자들의 말을 전혀듣지않는 경영진들 바뀌었으면 좋겠는 프로세스를 이야기해도 전혀 들어주는이 없음
7,소리샵,6187,진상손님때문에 스트레스받을일이 너무많음 모든 사단은 진상손님때문에 이루어짐
8,소리샵,6187,"고인물의 기분대로만, 정확히 고인물의 의도대로만 흘러가는 회사"
9,소리샵,6187,관찰해본 결과 그냥 모르겠다 오래 있던 직원이라면 그냥 냅두는 듯 실제로 하는 일이 많겠다만 누가봐도 처음 온 고객인데도 먼저 물어볼 때까지 무선 제품 연결을 도와주지 않는 모습을 목격함 뭐 이게 컨셉인 것도 알긴 알다지만 글쎄 나같으면 먼저 조심스래 말을 걸 것 같다 예를들어 도와드릴까요? 라고. 아무튼 내가 봤을때는 사람이 적고 일이 많았으나 몇 직원들이 나태해보임 근데 그 사람들을 자르지 않음 그래서 더 고여가는 느낌임 겉으로는 스타트업같은 넓은 마인드처럼 보이지만 그냥 그냥 .. 고였음 . 보이지 않는 사내정치가 존재하며 앞에서는 하하호호 웃어도 뒤에서는 나에대해 나쁜 말을 했을 것이 다분한 상황 . 그런데 불만을 직접 말해주지도 않는다 어쩌라는 건가 싶고 중간 관계자만 힘들어보임
10,소리샵,6187,"직원들의 개인주의가 심하고, 사원/대리급 직원들이 윗사람들 욕을 매우 많이 함. 실상 아래 직원들은 하는 일도 별로 없고 일도 쉽다. 일은 편하게 하고 싶고, 인정은 받고 싶은 그런 사람들이 많다. 해달라는대로 해주니까 직원들이 회사를 흑우로 아는것 같기도.."
11,소리샵,6187,커리어를 쌓기에는 무리입니다. 다른 곳으로 이직을 생각하기엔 시장이 작아 다른 대체가 없는 편입니다.
12,소리샵,6187,앞서 말했듯이 몇몇이 문제. 그 몇몇때문에 분위기가 이랬다가 저랬다가.. 그리고 회사 경영에 있어서 왜 굳이 이렇게 하나 싶은 것들이 조금씩 있긴 한데 그걸 아무도 태클안검. 왜지?
13,소리샵,6187,"1. 586세대들의 자기발전 없는 오만함 : 트랜드는 바뀌었고, 각 분야엔 전문가들이 포진해있음에도 불구하고, 실무자들의 의견따윈 듣지 않는다. 오롯이 그들의 말이 법이다. 실무자가 의견을 낸다면, 가차없이 잘라내는 자신감. 그렇게 하나하나 꼼꼼하게 신경써서 진행한 프로젝트는 똥이 됐다고 한다. 2. 오너리스크 : 사장이 정말 하나부터 열까지 모든 것에 관여를 한다. 직원이 60명인 회사에서 직원들의 자리까지 배정해주는 다정함을 보여주기도 한다. 심지어 조명위치까지 신경쓰는 스윗함을 보여준다. 사장의 말이 곧 법이며, 사장이 예뻐하는 사람이 예뻐하는 사람들의 말이 진리다. 하지만 그 중 능력있는 실무자는 없다. (쇼생크탈출) 3. 아부 아부 아부 아부 아부 아부 아부 아부 : 를 못한다면 지원하지 말자. 4. 업무가 편하다 : 바보가 될 정도로 편하다. 시키는 것만 하면 된다. 5. 뛰어난 인재풀 : 정말 각 분야에서 실력있는 능력자들이 부서별로 포진해있다. 그들에게 선택지는 두 가지다. 도태될 것인가 탈출할 것인가.."
14,소리샵,6187,"1.사용 못한 연차수당 못받음 2.꼰대 집단 경력이 많고 적고를 떠나 가장 큰 꼰대가 예뻐하는 순으로 꼰대인 곳 덕분에 직급, 경력 상관 없이 그냥 본인 기분에 따라 맘에 안 들어도 퇴짜 맞을 수 있는 곳 3.오른팔,왼팔 자신의 오른팔,왼팔이 있다고 늘 말함 그래서 팀 별로 차별을 주며, 가장 큰 차별은 업무적인 차별과 지원금이 다름 본인이 예뻐하는 직원들이 뭘 한다하면 아깝지 않고 회사의 발전을 위해 쓴다 생각하는 듯 근데 오른팔은 남의 아이디어 베끼기 바쁨 4.회의지옥 요즘 회의 많이 하면 욕많이 먹는 것을 모르시는 듯 회의는 일주일에 3-4번은 함 (전체회의, 임원진 회의, 팀회의, 개인적인 상담 및 회의 기타등) 회의도 짧게가 아닌 기본 1시간이상 휴게 시간 운운하며 말하는거 치곤 안지키고 회의를 강행 업무적으로 상당히 시간을 차지하며 너무 방해됨 5.임원진의 관여 매장 응대, 마케팅, 영상, 디자인 등 모든 업무 파트에 대한 지나친 관심으로 업무 참여를 직접함. 참여 하는 건 좋지만? 참여를 하고 본인들의 원하는 방향으로만! 원함 (허나 직원들이 원하는 대로 다 해준다고 생각함 전혀 그렇지 않은데) 6.공장 말 그대로 정해진 플랜에 따라 모든 업무가 진행이 되어야하며, 예를 들어 업무를 하는 것을 보고 5일 출근해 하루정도 걸린다 하면 일주일에 4개 정도를 할 수 있는거 아니냐 말하며 못하면 이해하지 못하며 충분한 시간을 줬다고 생각함.(휴가따위도 고려안함) 단순 기계처럼 하는 업무가 아님에도 창작하는 사람들은 비추. 고인물 아니고 썩은물임 7.비교왕 다른 팀들과의 비교, 직원들과의 비교, 비교란 끝도 없는 법인데 다른 타 회사와 비교하고 발전해도 모자란 판에 같은 회사 본인의 눈이 가장 옳기에 보고싶은 대로 보고 비교함 8.% 제일 황당한 일은 모든 것을 %로 보는 것 업무에 대한 비중, 시간, 매주 방문하는 손님의 수 등.. 매주 보고를 위한 %를 계산함 그래서 조금만 떨어진 %를 보면 견딜 수 없어 바로 회의"
15,소리샵,6187,다니다 보면 하는 없무 반복에 발전이 없고 메너리즘에 빠짐. 평생 다닐만큼 이 회사가 오래 남아있지도 않을 것 같은데 여기서만 일하는데 익숙해지면 나중에 다른데 가서 일 못할 것 같다.
16,소리샵,6187,일 처리 과정이 좀 답답함. 의사소통이 잘 안되고 회의 시간이 너무 김.
17,소리샵,6187,"업무 분장이 제대로 이루어져 있지 않았었음, 직원들간의 보이지 않는 격차"
18,소리샵,6187,1.업무프로세스의 부재 2.관리자의 부재 3.실무자간 커뮤니케이션 부재 4.군대문화 5.예의와 인성부족 6.하면 된다는 구식 마인드 7.성과에 따른 보상이없는 역차별 8.직장내 괴롭힘 존재. 감정적으로 일함 9.경쟁구도 형성 근데 보상은없음 군대문화. 차라리 군대가 낫다 규율이라도 있기때문. 무능력한 직원의 일이 능력있는 직원에게 가중된다. 직원 소모품 취급. 신입만 끊임없이 갈구고 지쳐서 나가면 새로운 소모품으로 대체.  일부 사장과 가까운 직원만 혜택을 보는 균등하지않은 기회와 보상제도. 투명성이 전혀 없어 기업의 정보를 전혀 알수없다  업무 프로세스가 갖춰지지않아 업력 20년임에도 스타트업같은 부실한 운영방식  아무 기반이없고 자료 없이 업무에 투입되는 비효율적인 환경을 업무자의 능력과 창의력이라는 말로 포장한다.
19,소리샵,6187,시스템이 확실하지 않아 불편한 점이 있다. 위에서 아래로 내려오는 형식이라 일의 자유도가 높지 않음.
20,소리샵,6187,팀으로서 파트가 나누어져 있지만 업무 분배가 효율적이지 않음. 입 닫고 지켜본 결과 한사람 눈치를 많이 봄. 어딜가나 장급이 문제지만... 큰 틀만 정해주고 파트 담당들이 으쌰으쌰할 수있는 분위기가 되어야하는데 결정적으로 으쌰으쌰하면 누르려고 하는 전형 적인 상명하복의 기질이 있고 자유롭게 토론하는 분위기의 회사는 아니다. 사장이하 이사급이 까라면 까라는 성향이 강한 회사임. 겉으로 보기에는 전혀 안그랬는데 곧곧에서 고인물의 눈치를 보는 상황들이 목격됨. 결정적으로 이 팀은 소비자에 충실한아이템이 주가 돼야하는데 헤드가 하고싶은 아이템이 주가 됨. 결론적으로 좋은 구성원을 가지고 있지만 고루한 회사 분위기 및 참견으로 포텐이 터지지 못함. 팀 구성원 대부분이 여성이라 일장일단이 있음
21,소리샵,6187,"그 외에 단점이 너무 많은데, 대표적으로 1) 진상고객의 말한마디에 좌지우지 되는 회사 방침 2) 너무 군대같은 회사 분위기 3) 시장파악 못하는 경영진 4) 어렵게 적응한 사람들을 쳐내버리는 경영마인드 5) 다른사람들이 일할때 쉬어야하고 다른사람들이 쉴때 일해야 할 수도 있다.(고객들 전화받느라) 물론 이런 건 인정받지 못하는 짓거리이지만 그렇게 하지 않는다면 욕먹을 수 있다. 등이 있다. 대표적인 것이기 때문에 이 외에도 수많은 단점이 있다."
22,소리샵,6187,너무 한적한 위치에 본사가 위치하고 있어서 회사에 찾아가기 어려움
23,소리샵,6187,말단 직원일수록 허드렛일을 포함한 업무가 너무 많다. 젊은 과장이 많아서 승진 기회가 없다. 워라밸이 좋지않아서 힘든 업무 이후에 본인 삶이 없다.
24,소리샵,6187,"비효율적인 업무처리, 잘못된 엘리트주의에 물들은 상사의 끝없는 세뇌교육. 그 외 모두."
25,소리샵,6187,정치질이 너무 심하고 뒤에서 욕하는게 너무 심함. 사장의 가까운 여직원이 다 지배하는 회사 사장이 앞에선 착한척 뒤에선 욕이 심함
26,소리샵,6187,"업무 시스템이 아직 전문화 되지 않은 느낌이라, 전문성을 가지지는 못하는 느낌이 듭니다."
27,소리샵,6187,"10시 출근 8시 퇴근이 기본, 매장일이기 때문에 주말 및 공휴일에 쉬지 못함"
28,소리샵,6187,"오디오가 너무 복잡해서 잘 모르고 시작하면 매우 어렵다. 신입으로 시작했는데 아주 기본적인 암기 부분을 알려주고, 나머지는 알아서 익히라고 한다. 명확한 업무적 지시가 없다. 직원이 뭔가 부족한게 있으면 바로 고치게끔 하고 제 역할을 다할 수 있도록 키워주는게 맞다고 생각한다. 그런데 이 가게는 그런 분위기는 아니고 직원이 좀 이상하다 싶으면 뒤에서 수군거리다가 자기네들끼리 결론을 내고 나가게끔 한다."
