,company_name,company_id,review_text
0,솔리데오시스템즈,5038,대표적인게 퇴근후 기독교 예배 필수참석. 업무외시간은 지켜주셨으면 좋겠습니다
1,솔리데오시스템즈,5038,운영방식이나 고인물들이 답답함 팀장에 능력에 따라 업무가 힘들 수 있음
2,솔리데오시스템즈,5038,장점 언급한 내용빼고 모든게 단점.. 급여 너무 낮고 복지는 없음
3,솔리데오시스템즈,5038,공공사업을 위주로 사업이 진행돼 매출액 증가에 한계가 있음
4,솔리데오시스템즈,5038,잘못을 쉬쉬 덮는 좋은 게 좋은거지 문화 = 발전이 없음
5,솔리데오시스템즈,5038,부서바이부서가 심하며 어느 한 부서가 좋다 안좋다 하기보다 부서마다 장단점이 극심하게 갈립니다
6,솔리데오시스템즈,5038,종교를 강요하지 않지만 강요하는 듯한 느낌임. 연말마다 연말파티 모임을 하는데 전직원이 저녁 6시 맞춰서 서울로 가야함. 설교는 목사가 하고 회사내에 찬양팀도 있음..ㅋ.. 그냥 교회행사간 느낌.
7,솔리데오시스템즈,5038,인센 없음 주기적인 모임 행사 필참.. 연봉 상승률이 적다
8,솔리데오시스템즈,5038,가끔 야근 및 주말출근을 해야되는데 연장근무 수당을 따로 받을 수 없다.
9,솔리데오시스템즈,5038,"프로젝트 by 프로젝트, 팀 by 팀 리더에 따라서 달라지는 난이도"
10,솔리데오시스템즈,5038,종교.... 복지 없음 일 안하는 직원도 자르지 않고 연차 차면 승진.
11,솔리데오시스템즈,5038,"급여가 쎄지않다 큰 복지는 없다 중간 대리,과장이 적다"
12,솔리데오시스템즈,5038,세세한 복지가 적은 것 같습니다. 직원들을 위해 조금 더 다양했으면 합니다.
13,솔리데오시스템즈,5038,중고신입으로 들어갔지만 연봉이 개인적으로는 적다고 생각함 / IT로서 당연하지만 네트워크 때문에 재택근무는 꿈에도 못꿈.. 주말출근 있을 수 있음
14,솔리데오시스템즈,5038,체계적으로 잡혀있는게 없어서 일을 하는데 정신이 없다.
15,솔리데오시스템즈,5038,업력에 비해 빈약한 복지와 휴식공간 담점은 누구나 생각하는 종교적인 부분이지만 1년에 1번정도하는 강제 행사 빼곤 딱히 무리될게 없어서 뭐 왠만한 직장 가기싫은 회식강요 같은건 일절 없어서 그런거 감안하면 긍정적
16,솔리데오시스템즈,5038,신기술을 습득하고 공유하는 특유의 으쌰으쌰 분위기는 없음.. 공공SI 계의 공무원. 얇고 길게 커리어를 유지하게 됨
17,솔리데오시스템즈,5038,기독교회사라 강제적인 홈커밍데이라는 분기별 행사가 있는데 행사가면 나는 누구 여긴 어디 라는 느낌을 받음 그들만의 행사
18,솔리데오시스템즈,5038,인센티브가 적고 급여가 높진않음 승진체계가 약함 아직 발전해야할게 많음
19,솔리데오시스템즈,5038,"한 달에 한 번씩 모이던 종교행사가 있었습니다. 하지만 이제는 분기별 한 번에서 반기별 한번 정도로 축소되고 있는 추세입니다. 점심식대, 야근 추가수당 등을 지급하지 않습니다. 야근 식대는 1만원 내에서 지급합니다."
20,솔리데오시스템즈,5038,"복지 부분이 약간 아쉽다. 문서작업이 많다(공공 및 정부 관련 프로젝트는 문서작업이 많을 수 밖에 없긴함) 기독교 문화가 나쁜건 아니지만, 업무 끝나고 모이는 게 조금 아쉽다."
21,솔리데오시스템즈,5038,"1. 연봉인상률은 낮은편 2. 포괄,식대 포함 3. 세부적으로 보면 체계없음 4. 도태되기 딱 좋은환경이라 스스로 공부 열심히 해야함 5. 중간직급 없고 부장이 너무 많음 6. 입사할때 원하던 직종의 부서를 못갈 수 있음"
22,솔리데오시스템즈,5038,코로나가 어느정도 지나간 후 분기별로 있는 행사에 대해 강요하는 점이 조금 아쉬운 것 같습니다.
23,솔리데오시스템즈,5038,"업무가 비효율적임, 연봉 통보가 이루어짐, 꼰대가 많음, 암튼 별로임"
24,솔리데오시스템즈,5038,"꼰대 문화, 배울 게 없는 수준을 넘어서 실력이 0이라 더 떨어질 개발 실력이 없는 사람도 -500이 될 수 있음"
25,솔리데오시스템즈,5038,연봉협상을 기대하기 힘들고 정직원에대한 대우가 좋지 않습니다 흔히 말하는 꼰대기업
26,솔리데오시스템즈,5038,꼰대들이 너무 많아서 신입들이 버틸 수 있을까...싶음/일안하고 능력없는 부장들 깔려있어서 아랫사람들이 고생함/최근 2년간 신입연봉 연상이 있었지만 그래도 부족/복지 없음/스틱커피도 돈아낀다고 회사지원x
27,솔리데오시스템즈,5038,적은 연봉 많은 고인물 사내 정치 복지제도없음 일잘러들에게 몰리는 일 대충 막 던져주고 다 너 잘되라고 하는거다라며 라떼도~ 이랬다며...
28,솔리데오시스템즈,5038,회사의 다수가 아닌 소수를 위한 행사에 전체 인원이 참석해야 하며 이는 큰 거부감이 들수 있음
29,솔리데오시스템즈,5038,"비효율적, 종교의식 강요, 공산주의, 원칙 부재와 내로남불, 집단적 모럴 해저드"
30,솔리데오시스템즈,5038,개발자로서 성장하기 위해서는 스스로 노력하지 않는 이상 동료나 선배로 부터 배우기는 어려운 환경이고 회사 규모에 비해 복지가 너무 없는 편입니다.
31,솔리데오시스템즈,5038,공공 사업을 오래한 회사이다 보니 공공 사업을 진행하는 프로세스에 맞춰줘 있어 다소 유연함이 부족해 보일 수 있고 중간급 직원들이 많이 부족합니다.
32,솔리데오시스템즈,5038,공공기관이다보니 문서처리 할 내용이많음. 그외엔 딱히..?
33,솔리데오시스템즈,5038,"1. 다른회사 직원한테 좋은회사 2. 회사차원에 주기적 홈커밍이란 좋은 모임이 있다(일과시간 끝난후 3시간정도) but 더 힘든건 사이비종교같아서 무섭.. 3. 신입을 뽑고 알아서하길 바람. 4. 탓 돌리기 너무심함.(잘하면 내탓, 못하면 네탓) 5. 윗사람들이 군대다녀온 남자를 선호한다(잘버텨서..) 6. 공무원 한명도 없는데 공무원 체계.. 7."
34,솔리데오시스템즈,5038,"- 고인물들이 많음(일 안하거나 능력 없는 사람들 너무 많음, 특히 위로 갈수록) - └ 타 pm보다 짬 낮으면 일 폭탄맞음 - └ 인수인계 중요하지 않다면서 인수인계서 남기라는 말을 들을 수 있음 - 성과급 없음(복지포인트 꼴랑 10~20만원 쯤) - 주기적 홈커밍데이 행사(금요일도 아닌 평일 하루 저녁 6시부터 9시), 기독교인조차 치를 떨게 만드는 사이비같은 행사 - 뒤떨어진 기술스택(MSA 하나 사용했다고 다른 SI 사업단 무시, 그놈의 jQuery) - 유지보수팀 가면 월루 가능, 물경력 쌓기 좋음 - 신입보단 연차 쌓고 오는게 제일 좋은 회사 - 아는게 없는, 능력 없는 경영지원팀 - 체계있는 척 함 - 비싼 광화문 물가, 저렴한 연봉 - └ 연봉 상승률도 높지 않음 - 어떻게 해서든 직원들한테 덜 주려 함 돈이든 뭐든 - 잘하면 내탓, 못하면 네탓 - 협업툴? 그딴거없음 업무 공유때문에 몇명만 쓰던 협업툴도 엑셀로 바꾸라함 - 부바부 대부분의 부서가 여자 선호하지 않음(여자가 몰려있는 팀이 있음, 다른 부서 pm들이 안데려가서) - 부바부 자회사 인력관리가 안됨, 타 회사 인원들이 더 많은 팀이 있음 - 부바부 9 to 6"
35,솔리데오시스템즈,5038,"- 너무 안정적임 - 안정적이라 고인물들이 많음 - 공무원보다 좀 더 받는편이지 많이 더 받지 않음 - 성과급 없음, 복지포인트도 거의 없다보면 됨(영끌해도연봉이전부) - 국책과제라서 회사가 남는게 많이 없기 때문 - SI업체가 가지는 한계점 - 현실에 안주하기 쉽상 - 몇명빼고는 SI가 그렇듯 다들 하던것들만 해서 실력이 고만고만 - 주기적으로 홈커밍데이라고 전사원 필참인 행사를 실시 - 홈커밍데이는 퇴근 후 실시...... 두세시간정도 - 사업장 화장실이 매우 후짐"
36,솔리데오시스템즈,5038,겉으로는 아닌척하지만 내부적으로 꼰대들이 너무 많기 때문에 앞으로 입사할 신입사원들이 걱정됩니다. 특히 경영진에 있어서 그렇습니다.
37,솔리데오시스템즈,5038,장점 외 전부 회사 내부 인력보다 외부 인력이 더 많은 듯 한 느낌 물이 흐르지 않으니 고였음 홈커밍데이라는 사이비 행사(기독교인도 반감드는)
38,솔리데오시스템즈,5038,"- 공공사업 특성상 연봉이 비교적 적음 - 부바부 개인 역량에 도움 안 됨(근데 이건 어느 회사나 마찬가지일듯, 결국 어느 부서에 있느냐가 중요)"
39,솔리데오시스템즈,5038,남는게 없는 SI사업의 한계를 뛰어넘기에는 어쩔수 없는 현실이 안타깝다
40,솔리데오시스템즈,5038,"급여가 적은편이다. 중간층(대리,과장)이 거의 없어 사원과 부장 사이의 그 괴리감이 크다.."
41,솔리데오시스템즈,5038,"이슈관리, 문서작성을 안해서 모든 히스토리는 오래 다닌 사람 머릿속에 존재함. 분기별로 필참해야하는 종교행사가 있음. 사원 대리보다 부장급이 더 많음."
42,솔리데오시스템즈,5038,"연봉 인상 폭이 좁다.. 업계 표준에 맞춰 주려 노력하지만, 인센티브 등이 전무하다 싶으므로 상대적으로 연봉이 높다는 생각이 들지 않음."
43,솔리데오시스템즈,5038,연봉이 낮고 포괄임금제 저녁식대 지원금액이 낮음 정규직이 손해인것 같음
44,솔리데오시스템즈,5038,"홈커밍데이, 정기적으로 모여서 인사하고 기도하는 자리가 있다"
45,솔리데오시스템즈,5038,뚜렷한 회사 복지가 없음 / 분기별 홈커밍데이 퇴근 후 진행
46,솔리데오시스템즈,5038,꼰대들이 너무 많아 신입은 버티기 힘들수도. 복지 없음. 홈커밍데이라는 반강제적인 모임
47,솔리데오시스템즈,5038,공공사업을 하기에 혁신 창의와는 다소 거리가 있습니다 무언가를 치열하게 스터디하고 디밸롭하기 보다는 하던거 하는 느낌 기독교 회사 한분기에 한번 전 사원이 모여 예배하는 행사를 합니다
48,솔리데오시스템즈,5038,전체적으로 엄숙한 분위기가 있어 사무실이 매우 조용하여 끝날때까지 일만 하였음
49,솔리데오시스템즈,5038,입사 7년 이후 10일간 유급휴가를 보내주는 안식휴가 외 에 이렇다 할 큰 복지는 없음
50,솔리데오시스템즈,5038,커리어 성장에 한계가 있고 복리후생이 회사규모에 비해 빈약
51,솔리데오시스템즈,5038,"급여 : 업계 최저 연봉. 연봉 퇴직금 포함. 협상 및 인상 없음.  종교 : 퇴근 후 19~21시까지 종교활동 및 친목활동 함. 도시락 공짜로 줌. 전원 강제 참석.  반말 : 정규직 사원들한테는 동의 없이 그냥 반말하고 가끔 욕도 함. 반면에 프리랜서들한테는 예의를 잘 지킴.  업무 : 아무도 일을 안하려고 함. 원론적인 얘기만 하고 서로 업무 떠 넘기기 바쁨. 그래서 업무를 다 잘 모름. 프리랜서들 18시 모두 칼퇴근. 정직원들한테 야근 눈치 줌. 회식도 일부로 일 없는데 야근하다가 감. 부장들이 개발을 아예 할 줄 모름.  관리 : 관리를 아예 안함. 단점이자 장점일 듯, 술 먹고 다음날 아침에 일어나서 몸 안좋다고 얘기하고 다 안나옴. 백신휴가 2일 주는데 아프다고 하면 1일 더 쉼. 다 3일 쉼.  연차 : 정규 직원들은 바쁘다고 연차 통제 함. 그러나 다른 회사 직원이나 프리랜서들은 다 쉼. 정규직 직원들은 반차 못 쓰게 함.  내로남불 & 위선: 부장들이 하면 괜찮고 사원들이 하면 모든 게 용서가 안됨. 앞뒤가 너무 다름. 앞에서 칭찬하고 뒤에서 다 욕함.  위계질서 없음 : 부장들 끼리 다 친구라 서로 반말함. 관리자고 PM이고 그냥 서로 위아래 없이 반말함.  절도 : 사원들 없으면 책이고 과자고 부장들이 다 훔쳐감  인성 : 솔리데오 외 회사 소속 직원에게 갑질이 엄청 심함. 인신공격, 무시, 언성을 높이는 등 기독교 회사에서 가능한 일인지 이해할 수 없음."
52,솔리데오시스템즈,5038,"1) 지들 불리한 건 쏙 빠져나가고 유리한 건 으름장 놓는 얼척없는 꼰대문화가 만연. 경험해보지 않으면 모른다. 의자 뒤에 옷을 걸면 사장님이 싫어하신다느니, 원래 실내화는 허용 안 해 주지만 특별히 허용해주는 거니까 나갈 땐 신발을 갈아신으라느니 정말 별의 별 종류가 다 존재. 막상 병가, 공가, 연봉협상, 연차나 휴가 등 아쉬운 소리 나오면 난 잘 모르니 위에 물어보라고 함. 꼰대짓 할 땐 능력있고 멋있는 관리자로 군림하면서, 부하직원이 어려움 당하면 모르쇠 힘없는 회사 부품임. 2) 공공사업 특성상 아무도 일을 하려 들지 않음. 회사만을 말하는게 아님. 공무원들은 수주맡긴 회사가 지들 할 일까지 해 주길 바라면서 손가락 빨고, 부장들은 이런 건 내가 할 일이 아니라고 생각하며 핸드폰 게임 돌림. 하루 종일 네이버 쇼핑하다 집 가는 사람도 있음. 소수 책임감 있는 프리랜서가 사업단을 돌릴 지경. 일 좀 하면서 배우고 싶은 사람한텐 미쳐죽을 노릇. 3) 반강제적인 종교 행사가 존재. 분기별이지만 특별한 일(송/신년회 등)이 있으면 모여서 목사님 불러서 밥먹고 설교 듣고 찬양곡 부름(부르는 영상 찍자고 반강요 할 때도 있음). 방역수칙 위반? 그런 거 없음. “기독교 정신 위에 세워진 사내 문화”라며 “너도 취업할 때 동의하지 않았냐. 절대 개선의지 없다”를 완곡히 피력함. 다른 종교다, 사정이 있다 안 통함. 불참이면 왜 불참인지 적어 내라고 함. 좋은 말씀 듣는 건 좋은데, 왜 행사의 형식과 찬송가를 강요하는지? 그리고 사내 문화를 위한 행사라면 당연히 근무시간에 해야 하는 것 아닌가? 난 천주교인입니다. 하나님 말씀은 서로 생각 다른 사람들을 [퇴근 후] [반강제로 징집]해야만 가치있게 빛나십니까?"
53,솔리데오시스템즈,5038,정규직들은 21년도에도 기업의 종교행사에 강제 참여당함. 사적모임 금지에도 회사공간안에서 업무 외시간의 사내행사는 필수로 이행함. 철수하는 날까지 화면한쪽 개발 안된 사람도 그냥 보냄. 에어컨 선풍기 옷걸이 등등 비품 제때주지도 않을거면서 주고서 싫은소리 엄청 함.
54,솔리데오시스템즈,5038,핵심 기술이 없고 정부사업 위주라 개발자로서 성장하기는 힘들다
55,솔리데오시스템즈,5038,프리랜서와 함께 일하기 때문에 회사 내부 사람들과 친해질 기회 적음
56,솔리데오시스템즈,5038,쓸데없는 회사 행사가 있음 코로나닌깐 좀 자제했으면 좋겠음
57,솔리데오시스템즈,5038,"주먹구구 땜질식으로 이뤄지는 개발, 수직적인 꼰대문화, 야근, 개발자로서 커리어에 도움되지 않는 부분의 업무 난이도가 높다."
58,솔리데오시스템즈,5038,일잊 빡세고 꼰대문화가 있어요 그다짖바람직 하짗않앙ㆍ
59,솔리데오시스템즈,5038,"공공SW사업이 다 그렇듯, 고객위주로 돌아간다. 사업 자체 예산으로 진행을 하다보니 계속 돈돈거린다. 보너스? 당연히 없다. 복지포인트? 그것 또한 없다."
60,솔리데오시스템즈,5038,수직적인구조. 배포시 모두가남아야하는 비효율적인 기업문화
61,솔리데오시스템즈,5038,너무 무료할수 있다. 시간이 느리게 느껴진다면 그것은 누구나 그렇게 느끼는 일일 것이다. 시간과 공간의 방으로 초대한다
62,솔리데오시스템즈,5038,꼰대들이 너무 많아요. 꼰대들은 일도안하고 다 아랫사람만 시키죠.
63,솔리데오시스템즈,5038,기업의 단점으로는 복지나 강제적인 모임이 있는 부분이 있음
64,솔리데오시스템즈,5038,수직적인 조직문화가 가장 큰 단점이며 제대로 이뤄지지 않는 인력관리
65,솔리데오시스템즈,5038,연봉이 13분에 1이다 퇴직금을 연봉으로 내는회사 꼰대들이 많아서 눈치주고 윗사람의 말은 곧 법인회사.
66,솔리데오시스템즈,5038,"Pm따라 분위기랑 근무요건이 너무다름. 고인물인 윗분들이 많고, 퇴근후 회사모임이 많은편."
67,솔리데오시스템즈,5038,기독교회사라 종교색을 띌수밖에없고 강제 예배모임을한다 업계규모치고 승진도느리고 연봉도 높진않다
68,솔리데오시스템즈,5038,능력이 없는데 직급만 높은 사람들때문에 밑에사람들이 고생함
69,솔리데오시스템즈,5038,고객 중심이라 어려운 것도 고객이 당장 하라고 하면 해야함 사장이 기독교라서 4분기로 분기마다 예배드림 목사님이 사우회비 가져감;; 기부라는 명목하에 직원들 동의한적도 없는데 많이 남는다고 가져감
70,솔리데오시스템즈,5038,월급 루팡들이 대거 포진되어있으며 일 못하는 사람이 너무 많음. 자신의 퍼포먼스를 부정하고 현실에 안주하기 적합함.
71,솔리데오시스템즈,5038,업무의 특성상 야근이 조금 있네요. 그리고 타 회사에 비해 복지가 약합니다.
72,솔리데오시스템즈,5038,반복되는 업무가 많고 전화응대할일이 많음 몸은 편한데 머리가 점점 굳어가는걸 느낌
73,솔리데오시스템즈,5038,설립된지 꽤 되었음에도 불구하고 체계적이지 못한 것들이 많음. 개인연차갯수 확인 불가(경영팀에 직접 연락하는 방법뿐) 인센티브 제도 없음.
74,솔리데오시스템즈,5038,개발자 커리어를 쌓기 힘든 회사 분위기에 배울 수 있는 시니어 엔지니어가 없음. 차부장들이 최신 트렌드에 뒤쳐진 능력에 전혀 개선의지가 없고 어린 개발자들에게 모범을 보이지 못하고 있음.
75,솔리데오시스템즈,5038,서울외곽지역 발령이 있을 수 있음. 13분의 1 연봉제도. 연봉상승률이 적음. 인센티브 없음.
76,솔리데오시스템즈,5038,"더이상 상승할 의지가 없어 여력 또한 남기지 않는다. IT 서비스 업체이나 비개발자 출신으로 경영진, 관리자가 구성되어있고 개발자 출신이라 하더라도 개발자에 대한 인식이 좋지 못하여 아웃소싱 대체 등도 고려했었을 정도이다. 기술 경력을 생각하는 개발자라면 다른 회사를 권유"
77,솔리데오시스템즈,5038,"개발자가 제안을 해서 설계변경을 합니다. 파워포인트, 워드, 엑셀 등의 문서작업을 즐겨하시는 분은 적성에 맞겠지만 단순 개발, 구현업무만 하셨던 분은 조금 힘드실수도 있습니다. 그렇지만 sm, si 모든 면에서 커뮤니케이션이 잘 이뤄지기때문에 걱정하실 필요는 없습니다."
78,솔리데오시스템즈,5038,공공사업이 뭐든 그렇겠지만 연봉이 만족스러운 수준은 아님
79,솔리데오시스템즈,5038,"기독교 회사, 일못하고 일거저하는 사람 개많음, 줄타기"
80,솔리데오시스템즈,5038,팀장에 따라 달라지는 분위기로 기피하는 사람들이 한두명씩 있다는 점...
81,솔리데오시스템즈,5038,개인주의가 있고 동기들끼리 친하며 유지보수의 경우 사무직같다는 생각을 하게 되었다 공무원들이 일하는 시간에 일해야하기때문에 회사 행사가 퇴근후 혹은 주말에 있다고 한다
82,솔리데오시스템즈,5038,기독교 기반 회사입니다. 한달에 한번 직원 전체 모임 불편한 놀이 자리 있습니다. 퇴직금을 중간 정산 형식으로 줍니다. 퇴직금 연봉에 포함되어 계산됩니다. 어떤 프로젝트에 나가느냐에 따라 근무 환경이 많이 다릅니다. 연봉협상 때 자기 소개서 같은걸 쓰도록 합니다. 연봉협상에 객관적 기준이 없습니다. 꼰대 많습니다. 직원보다 고객사를 더 소중하게 생각합니다.
83,솔리데오시스템즈,5038,인사관리 상당히 미흡 / 관리자의 능력부족 / 때워맞추기식 업무진행
84,솔리데오시스템즈,5038,단점을 찾아보기 어려움 회사이다. 조직문화에 깊이 젖어보지 못한 사람들은 피상적으로만 이야기 하곤 한다.
85,솔리데오시스템즈,5038,"무능력한 차부장들이 넘쳐나 분위기가 매우 보수적임. 그런데 본인들은 아닌줄 알고있어 부끄러운줄 모르는 분들이 대부분임. 그들에게 배울게 없음. 20년 또는 10년전에 배운 기술과 지식으로 최신 기술, 지식, 문화 트렌드에 전혀 못따라가고 있는 월급도둑들이 넘쳐남"
86,솔리데오시스템즈,5038,"공공 SI, SM 사업을 하다보니 파견을 가는 경우가 있음."
87,솔리데오시스템즈,5038,경력과 실력을 쌓기에는 본인의 노력이 많이 필요할거 같다
88,솔리데오시스템즈,5038,당연히 연봉관련 부분이 큰걸림돌 자세한 사항은 100프로 알지 못하나 매년 인상폭이 좁은편이지 않나 생각이 든다
89,솔리데오시스템즈,5038,연봉외에 복지가 없어서 좀 아쉽다. 명절 스팸 정도... 경조사비가 지급되나 매년 있는거도 아니고.. 월급만으로 사는데... 뭐 보통 월급은 입금일날 싹다 이체되지 않나? 비상금 챙길 여유가 있었으면 좋겠다.
90,솔리데오시스템즈,5038,"야근이 잦으며, 배포시엔 모두 남아 테스트를 진행하였습니다. 또한 개발자임에도 불구하고, 업무를 익혀야 해서 콜센터 업무를 1달가량 했습니다."
91,솔리데오시스템즈,5038,"육아휴직 제도는 잘되어 있으나, 다른 복지는 별로인것 같습니다. 제가 다닐 당시만 해도, 개발자여도 업무를 익히기 위해 콜센터 업무를 했습니다."
92,솔리데오시스템즈,5038,"공공사업인 만큼 보안에 신경을 많이 써야하고, 문서작업이 많은편"
93,솔리데오시스템즈,5038,제가 다닐당시만 해도 복지가 별로였다. 커피믹스 같은걸 개인이 구비해서 먹었던거 같다....진상고객이 전화가 걸려오면.. 힘들었다.
94,솔리데오시스템즈,5038,전형적인 꼰대회사. 윗선은 전부 사장님 비위 맞추느라 바쁘고 뒷담화도 심하다. 회식자리에서 술강요도 있는 편. 일없이 야근하면서 시간때우는 걸 좋아한다. 일단 야근을 해야 일을 열심히 한다고 생각해서인지.. 직원들을 위한 복지에는 전혀 관심이 없다.
95,솔리데오시스템즈,5038,부장급 이상이 너무 많음. 근데 책임감 없고 일 떠넘기고 눈치 많이봄. 프로젝트마다 꼰대짓 하는 사람들도 있고 이상한 인간들도 있음. 끼리끼리 노는 분위기라 적응 어려울 수도 있음.
96,솔리데오시스템즈,5038,복지혜택이 거의 없음. 대기업처럼 인센티브제도가 없음. 직장내 여성인권을 존중하고 여성분들을 더 우대함. 분기단위 한번씩 전직원이 한자리에 모여 감사예배를 드림(기독교에 거부감이 있으면 생각해봐야함)
97,솔리데오시스템즈,5038,프로젝트의 성향에 따라 업무난이도가 다름. 같은 월급이지만 업무 밸런스 차이가있는거같아요.
98,솔리데오시스템즈,5038,자신이 노력하지않는다면 자신에게 있어서 발전이 없다. 원치 않는 부서로 발령 나거나 의사없이 부서가 이동될수도 있음
99,솔리데오시스템즈,5038,미래가없다. 기술 개발이나 투자도 없고 직원들의 미래를 고려안하고 단기적인 이익에 급급한 회사
100,솔리데오시스템즈,5038,갑회사의 갑질이 심함 개발을 하는건지 다른일들을 하는지 주체를 모르겠음. 사장의 독단적마인드와 말뿐인 복지가 큰 단점 복지 전혀없음. 종교행사에 참여하지 않으면 불이익을 주는 90년대적인 방침과 직원들에게 투자는 하지 않으면서 전문성만 바라는 이기적인 회사.
101,솔리데오시스템즈,5038,"1. 연봉을 1/13 (퇴직금 1) 으로 나눠서 지급 2. 복지가 경조사비(직원들의 월급에서 차감), 설날/추석 때 선물세트 3. 한달에 한번 전직원이 본사로 모여 행사를 하는데 (반)강제적인 종교 행사를 함."
