,company_name,company_id,review_text
102,솔리데오시스템즈,5038,"1. 부장급 인력이 대리/과장보다 많아서 프로젝트 진행 시 특정인에게 일이 많이 몰림. (그만큼 장기근속자가 많아서 새로운 의견이 잘 안 통함) 2. 솔리데오문화라는 것이 있음(회사 창립시절 소규모 였을 때 내 일, 네 일 안가리고 으쌰으쌰했던 것) 이 문화에 적응 못하면(자기일만 하면) 스트레스 많이 받음. 3. 전사차원의 관리체계가 부실함(주로 프로젝트 단위로 근무해서 그런 것 같음) 4. 복리후생이 부실함(요즘회사들에 비해 직원 복지가 전무하다고 보면 됨) 5. 야근 엄청 많이 함(SM사업은 그나마 덜 함, 야근수당 없음, 저녁식비 7천원 지원, 차/부장급이 장기근속자들이 많아서 서로 눈치보며 의리 야근함) 6. 휴말 출근해도 수당없음. 차비도 자비로 내야함. 7. 일 잘하면 보상은 없고, 일이 더 생김 (그래서 대충 일하는 사람들도 많음) 8. 수직적인/남성중심의 조직문화에 따른 반말, 성차별이 심함"
103,솔리데오시스템즈,5038,일 못해도 오래다니면 차장 부장 단 사람들이 많아 일이 개차반임. 주말에 체육대회 전직원 필참. 기독교 예배 거의 한달에 한번 전직원 필참. 조별 모임이있어 퇴근 후 억지로 만나야 함.
104,솔리데오시스템즈,5038,개발자들은 야근이 많다. 아랫사람이 많은 일을 한다. 한달에 한번 홈커밍데이라고 전체 직원들이 모이는 모임을 한다.
105,솔리데오시스템즈,5038,이 기업은 사장이 기독교를 믿기 때문에 1년에 4번 정도 본사에서 단체로 예배를 드린다. 만약 불참하게 된다면 엄청난 패널티를 받게 될거같다.
106,솔리데오시스템즈,5038,사내문화 강제적인 참여.. CEO가 기독교인이라 단체로 예배를 본다. 이게 싫어서 퇴사하는 사람이 많음. 기업의 성장가능성이 불투명하다.
107,솔리데오시스템즈,5038,"연봉이 낮음, 업무의 전문성이 없고 단순하여 경력을 키울수 있는 자리가 아님"
108,솔리데오시스템즈,5038,역시나 사업장에 따라 달라지는 분위기로 인해 좋지 않은 분위기의 사업장에 속할 경우 근무 환경에 불만을 가질 수 있다.
109,솔리데오시스템즈,5038,"연봉이 다소 작은 편이며, 복지 제도는 전무함 캐리어를 고려한 업무 배정은 기대할 수 없음 하고 싶은 일을 손들면 시켜주기는 하지만 체계적인 지원이 없음"
110,솔리데오시스템즈,5038,휴가는 거의 못가는 분위기에 심지어 여름휴가도 대부분 못가거나 몇일 잘리는 경우가 허다함! 개발자들이 배울게 없음! 사내복지는 아예 없음!
111,솔리데오시스템즈,5038,"송년회, 체육대회 등 기업문화가 상당히 강제적임"
112,솔리데오시스템즈,5038,개발자를 콜센터로 보내서 전화만 받게 합니다 내부정치가 치열하며 차장쯤 되면 파워싸움하면서 직원들을 피곤하게 합니다
113,솔리데오시스템즈,5038,정치적인 문제와 회사내부에서의 갑질이 존재한다
