,company_name,company_id,review_text
0,스피덴트,4654,"1. 직원들을 소중하게 생각안하고, 다른 부서의 책임까지 떠안게 한다. 2. 잘해도 인정 안 해준다. 3. 쓸데없는 임원이 너무 많아지고 있으며, 좋은 사람들은 다 퇴사 러시 중. 4. 팀내 불화를 팀장들이랑 CEO 중 한 명이 조장하고 있다. 5. 미국에 계신 사장님 윗동서는.. 할말하않."
1,스피덴트,4654,"제자리 걸음, 개인 발전이 크게 없음, 삶이 무료해짐."
2,스피덴트,4654,딱히없음 건물이 오래됫다 키워놓을사람 정해놓고 키워놓는다
3,스피덴트,4654,영업부는 따로 나와있어서 동떨어진 느낌이 있어서 그렇다
4,스피덴트,4654,책임을 피하려는 고인물들 모든 건 사장님이 선택하고 결정함 알바만 있어도 돌아 갈 것 같음
5,스피덴트,4654,낮은 연봉 바쁜 팀만 바쁘게 일하고 월급루팡하는 사람 있음 식당 밥이 너무 맛없음 건물이 너무 노후되었음 회의가 너무 많음
6,스피덴트,4654,대기업 따라가기가 너무심함. 이거저거 도전하는거 알겠는데 지쳐서 나가떨어짐
7,스피덴트,4654,상장 및 더 좋은 근무환경이 좋은 것으로 이전을 계획하고는 있지만 언제 가능할지 미지수..
8,스피덴트,4654,다른 회사에 비해 조금 아쉽게 느껴지는 연봉. 역시 돈이 가장 중요하죠
9,스피덴트,4654,비효율적 업무 주먹구구씩한 일처리 좁은 공간 쉴 공간이 없음 대중교통 불편 산업단지 연차 자유롭지 않다
10,스피덴트,4654,"퇴근을 6시5분에 시킴, 그렇기에 복도에서 의미없이 기다리다가 퇴근하는 경우가 생김…"
11,스피덴트,4654,임원의 평가가 무조건적임. 폐급이여도 임원진의 눈에 들면 초고속 승진 가능함. 나름 시스템을 갖추려고 갖은 애를 쓰지만 매번 실패했고 앞으로도 그럴 가능성 농후함. 왜냐면 항상 시스템 열외자가 있기때문에.. 그 예로 과장이 부장으로 1년만에 승진한 케이스가 있었음 ㅋ 이유는 아무도 모름
12,스피덴트,4654,1. 남동공단 구석에 있다보니 주위에 아무것도 없다. 2. 회사의 문제라기보단 입주건물이 있는 식당이 독점이다보니 식사가 영.. 3. 한동 한동 공장동을 임차하다보니 떨어져있는 곳이 많음
13,스피덴트,4654,"연차가 엄청 적음. 성장하고자 하는 열정은 있지만 문제점을 해결하지 않고 윗선에서 바라는 것만 많음. 복지가 좋은 편은 아님. 도서 구입비, 건강, 문화비 뭐 이런건 당연히 없고, 사장님들이 아직 꼰대 마인드가 있어서 코시국 내내 단한번도 재택근무 해본적 없는 매우 독한 회사임."
14,스피덴트,4654,아파트형 공장이라 밥이나 근무 환경은 그다지 좋디 못하다
15,스피덴트,4654,"굳이 6시 2분에 퇴근 하게하기, 쓸데없이 과한 핸드폰 통제, 과장 차장 라인의 이상한 생산 과정 요구"
16,스피덴트,4654,복지가 더 많아졌으면 좋겟음 식당밥이 너~~무 맛없고 개선안됨
17,스피덴트,4654,직원을 소모품으로 생각함. 직원 관리가 전혀 안 됨. 파벌이 있음 자신의 마음에 안 들면 단칼에 내침. 위에서 의견 합일이 전혀 안되서 아랫사람 피곤함. 실력이 없는데 있는 척 하는 사람도 있고 일은 안 하는데 일 한척 포장하는 사람도 있음. 오래된 사람은 오래된대로 일을 안 하고 처음 온 사람들은 몰라서 일을 못함. 위 마음에 들면 규정외로 승진 가능. 서로 존중하는 마인드가 없음 막말하는 사람도 있음. CEO 자녀가 다니는데 상사 존중 안 하고 자기 멋대로 진행
18,스피덴트,4654,"제품이 문제가 많이 발생함, 승진을 하기에는 임원들이 바라는 목표가 너무 큼, 목표가 크지만 제품이 따라가지를 못 함, 연차를 사용함에 있어 눈치를 보고 버리는 경우가 있음,"
19,스피덴트,4654,장점을 제외한 모든것을 단점이라 말할수 있음 많지않은 연봉 공무원과 비슷한 호봉제로 열심히하는사람은 없음 성과를 위해 일하기보단 까이지않기위해 일하는 모습 열심히하면 바보가 되는 시스템을 아주 잘만들어놓았음
20,스피덴트,4654,"임원이 많고 입사자, 퇴사자가 많음 부서간에 협업이 잘 이루어지지않음 회의가 많고 결과도출이 오래걸림"
21,스피덴트,4654,회사 자체가 조금 생각이 없고 너무 비효율적으로 일을한다 너무 무리해서 일을 시킨다
22,스피덴트,4654,잔업이 매주2번이상있음 일은 쉬운데 높은사람들이 많이어려움
23,스피덴트,4654,1) 낙후된 시설 2) 낮은 급여 3) 아직 갖춰지지 않은 회사 체계 4) 일부인원에 한에 부족한 리더쉽
24,스피덴트,4654,"체계가 없음 사람들은 좋은데, 다만 몇몇 물 흐리는 사람들이 존재 뒤에서 안좋은 얘기가 많이 돔, 작은 회사에 정치질도 엄청 심함"
25,스피덴트,4654,"고인물 직원들의 텃세 ㅎ.. 직원이 줄퇴사 해도 적응못하는 직원들탓이라 생각하는 상사분 ㅎ.. 정작 텃세부리는 직원의 성격이 원래 그러하다고 아무뜻 없으니 적응하라던 개념없는 상사와, 면접 보는것이 권력이라도 되는줄 아는 직원부터가 답이 없음 유행하는 엠비티아이로 사람 궁예하고 평가하는.. 레전드 평가방식"
26,스피덴트,4654,생산하는 제품이 너무 많아서 복잡하고 제조시 신경 쓸 일이 많이 있습니다.
27,스피덴트,4654,사장이 이뻐하는 부서는 진짜 이쁨받고 잘나감 아파트형 공장 오래돼서 무너질거같음 비가 센다 이사 긴다고 한지 10년 넘었는데 아직도 못감 월급루팡들 많음
28,스피덴트,4654,박봉임 / 개개인의 성장가능성이 낮음 / 업무수행능력이 낮은 직원을 다른 직원이 이끌고 가야함
29,스피덴트,4654,과도기에서 흔히 보이는 몇몇 부서의 업무 정확도 부재가 있음.
30,스피덴트,4654,업무 간 일감 몰아주기가 많음 특히 못하는 부서를 교육 시키지 않고 가능한 부서에게 책임을 넘김 이상한 관리자들이 많이 들어오는 곳 그리고 결정을 내리지 못 하고 시간이 미뤄지다가 남에게 책임을 떠넘김 그리고 자신은 회식 가기 좋아함 무능한 경영진이 많다는 아랫사람 리뷰가 맞음 신입으로는 와서 워라밸 챙기기 좋지만 경력직은 오면 후회하는 곳
31,스피덴트,4654,대체로 업무 분위기가 좋지만 부서별로 천차 만별임. 부서별로 선긋기가 난무함. 영업부서에 딴 부서가 너무 끌려다님. 일하는 사람과 안하는사람이 눈에 띄게 보임. 직급자가 너무많은데다 기싸움으로 이슈가 있을때 최종적으로 결정을 못하고 결론도 안남. 회의가 너무 많고 회의를 했다하면 1-2시간은 기본으로 깔고감. 무능력한 경영진이 많음.
32,스피덴트,4654,고인물이 정말 많고 인재경영을 하겠다고 하는데 현재 직원들을 계발시켜 인재를 만들지 않고 외부에서 인재를 영입함. 그러나 그 사람들도 오래 못버팀
33,스피덴트,4654,쓸데없는 보고 일 때문에 인력낭비가 쓸데없이 많은점이 단점
34,스피덴트,4654,"회사가 바뀌지 않음 실적 압박 조금 있음 아니라고는 하지만 가족회사로 변질되는 중 임원 자녀 영입 중이고 그 자녀들은 남들 눈치 안 보고 일함 먼저 입사한 직원 및 상급자에게 마치 자신이 상급자인양 대함 공수표가 많음 (회사 이전, 상장)"
35,스피덴트,4654,여기가 교통이 좀 별로임. 바로 앞에 전철이 다니는 것이 아니라서 조금 그럼. 야근 3번이 기본 이지만 4번 할때도 있고 특근도 있음. 그리고 밑에 서술 했듯이 충진실 가지마라.
36,스피덴트,4654,제품이 문제가 많음. 일 안하는 사람들은 계속 안하고 자르지 않음. 이전에는 아니였는데 점점 정치질 하고 라인 만들기 있음
37,스피덴트,4654,낙후된 시설. 일부 팀에 한해 부족한 리더. 전문연구요원이나 주변에 사는 사람이 아니라면 굳이 올 필요없는 회사
38,스피덴트,4654,업무 분담이 되있긴 하나 교통정리가 안되면  다양한 업무를 맡을 확률이 있다  직원평가가 잦은 편이라 부담으로 작용 될 수 있다
39,스피덴트,4654,기업 치고 야매가 많음 / 평균 업계연봉보다 낮음 / 체계가 부족함
40,스피덴트,4654,하는일에 비해 연봉 너무 열정페이. 열심히 노력하는 사람들에 대한 정당한 대가가 이루어지지 않고 더 잘하라고 압박이 들어는데 정작 열심히 하지 않고 편하게 회사 다니는 사람들은 회사에서 눈치를 보는건지.... 터치를 안함.
41,스피덴트,4654,인사를 너무너무 좋아함 같이 일하는 사람들이 인사를 안받으면 약간 눈치를 주는듯 아침에 인사를 해도 볼때마다 인사를 시킴 점심먹는곳이 조금 지저분함
42,스피덴트,4654,"어느곳이나 똑같겠지만 본인의 성장을 위해선 본인이 많이 노력해야함, 이미 키울 사람을 점 찍어놓은듯한 느낌, 경력이나 능력보단 학력을 중요시 하는 느낌이 강함"
43,스피덴트,4654,부서내에 일부사람들에 의해 텃새와 편가르기가 있다 자신이 발전할려 노력하지 않고 연차가 차니 승진하길 바란다. 좀 더 엄격한 잣대로 평가해야 할 것 같고 그분야에 제대로 된 인재가 들어와야 회사의 발전에 기여할 수 있을것 같다. 정작 본인의 문제점을 파악해서 전문적으로 지식을 습득하길 바란다.
44,스피덴트,4654,윗 직급들이 너무 많다 제대로 일이 안돌아간다 일하는 부서만 하고 아직도 비효율적인 수기결재를 하다니.. 인사담당자도 체계도 엄망.. 신입사원 입사시 대응체계도 엉망 능력이 있는 사람들이 승진하지 않는듯 년수 채워서 승진하는 구조인것 같다 무리한 성장 가속도로 직원들만 힘이든다.
45,스피덴트,4654,부장급 임원이 너무 많다.그들만의 리그 답 없는 회의만 하고 바뀌지 않는다. 회의가 아니라 남탓하기 바쁜듯 인사시스템을 받아들였다지만 복지가 변하는게 없고 근속년수만 채우고 능력도 없는 사람들이 많다. 한번 세운 계획은 바꾸지 말길. 텃새도 난무하다
46,스피덴트,4654,인사가 타기업처럼 전문적이지않아 체계가 없고 답답하다 복지 개선에 힘써주길
47,스피덴트,4654,인사시스템이 좀 엉망임. 통근버스가 있긴 하지만 회사위치를 볼때 교통수단이 그닥 좋은편이 아니다. 회사 위치와 시설 구림.. 사옥으로 이전 필요
48,스피덴트,4654,경영진과 실무진과의 소통 후 반영 부재 가만히 있으면 진급 어려움 불필요한 사내 정치질
49,스피덴트,4654,장점이자 단점인데 일이 진짜 할짓없고 경력 절대 안됨 그냥 알바?
50,스피덴트,4654,1. 급여가 낮다. 2. 편한 부서 힘든 부서에 걸맞게 평가해 주지 않는다.
51,스피덴트,4654,정직원이 없음 산업요원이 절반이상임 사람들이 빡시다고 생각하고 안오는건지 회사이득으로 요원을 뽑는건지 모르겠음 산업요원들은 그만둘 회사라고 일을 깊게 파악을 안함
52,스피덴트,4654,밥이 그저그럼 아파트형 공장 딱히 뭐 없는거 같습니다 복지 부족
53,스피덴트,4654,페이퍼 작업과 회의가 많음 기업이 20년 정도 되었지만 제품을 알고 있는 팀장이 없어서 모든 걸 각자 공부해서 처리해야함. 20년에 부장이 들어오고 나서 더 제대로 안 가고 있음 하지만 윗사람들은 그걸 모르는 듯
54,스피덴트,4654,단순 반복 노동이 많고 정신적 스트레스가 많음 운영진들의 직원 편애가 심한편 조금이라도 밉보이면 진급 누락이심함 퇴사자가 많아 물갈이가 심한편이다. 다쳐도 산재처리 불가. 병원비만 지급 상장에 문제가 생겨서고 그렇다고함. 절때 자르지 않지만 퇴사하게끔 만듬.(실제로한말) 특정 임원진 성적 농담이 지니침 .
55,스피덴트,4654,가장 중요한 연봉인상률이 낮고 회사 위치가 외져서 퇴근하고 어디 가기 불편해요
56,스피덴트,4654,"대리 과장 차장보다 부장부터 임원진이 더많음, 회의는 매일하는데 결론나는게 없음, 부서별 소통 안됨, 일하는사람만 일함"
57,스피덴트,4654,연차가 있지만 쓰기에 조금 눈치가 보임 영업사무소에 비해 뭔가 본사가 더 허름해보임
58,스피덴트,4654,사무실이 오래된 산업단지공단내에 있다. 건물이 너무 오래되었다. 창고가 너무 많다. 오래된 재 정리가 안된다.
59,스피덴트,4654,복리후생이 적다. 직원들에대한 혜택이 너무 적다. 연봉도 높지않다.
60,스피덴트,4654,"1. 어딜 가나 그렇지만, 열심히 일하는 사람만 죽어라 열심히 일하고 나머지 사람들은 제대로 일도 안하는 월급루팡이 꽤 있음. 2. 아파트형 공장에 있다보니, 사무실과 각 창고 및 현장간 거리가 제법 되기 때문에 한번 이동할때 좀 번거로움이 있음. 3. 부서간 책임 떠넘기기가 좀 많음. 4. 타부서 직원들끼리 친해질 수 있는 기회가 잘 없음(사내동호회나 행사 등이 전무) 5. 신입사원을 위한 체계적인 교육 시스템이 많이 부족함."
61,스피덴트,4654,전체적인 시설의 노후화로 인해 업무환경이 좋지 않은 편. 적은 연봉
62,스피덴트,4654,영업 매출 증가율에 비해 연구소가 못따라옴. 10년 이상 근속하는 사람들 있는데 위기의식 전혀 없이 나태한 태도
63,스피덴트,4654,기업 역사는 오래되었으나 시스템은 부족 중간 관리자 부족
64,스피덴트,4654,자기개발 비용 없음. 절차는 폼임. 즉흥적으로 매일 무언가가 바뀌고 일관성이 없음. 복지 딱히 없음. 경력직이 물 흐리는건 많음.
65,스피덴트,4654,밥이 생각보다 맛있지는 않다. 야근이 주마다 있지만 그만큼 돈을 더 벌어가기 때문에 할만하다.
66,스피덴트,4654,타부서간의 협력이 잘 안되는것 같습니다 좀 더 효율적으로 일했으면 합니다
67,스피덴트,4654,비효율적으로 일하며 연봉이 엄청 낮습니다. 같은 직급이여도 연봉차이가 엄청 큽니다.
68,스피덴트,4654,"체계가 잘 잡혀있지는 않음, 갑작스럽게 변화가 있음, 회사가 칙칙함 창문이없음..."
69,스피덴트,4654,단점은 그다지 많지 않습니다. 다만 문제점들이 개선되지 않다는게 단점입니다.
70,스피덴트,4654,무능력한 사람과 오래오래오래 같이 일하는게 신기함.....
71,스피덴트,4654,"급여와 복지혜택이 적음, 임금 상승률도 낮으며 연봉협상 자체가 없음. 부서간의 갈등이 심함(소통이 어려움)"
72,스피덴트,4654,급여가 많지는 않음. 라인을 잘타야함. 부서마다 분위기가 너무 다름.
73,스피덴트,4654,회의가 아주아주아주 많다. 그러나 결론은 쉽게 나지 않는다. 회의하다가 지침. 고인물들이 몇몇 있다. 복지가 많이 생기고 있지만 직원입장에서 뭔가 확 와닿는 복지나 혜택이 아직 없다.
74,스피덴트,4654,옛날 사고방식을 가진.. 쉽게말해 꼰대가 너무많음. 그러나 본인들은 본인이 꼰대라는걸 절대 몰라서 아래사람들이 못버팀. 휴가도 눈치보고 써야함. 최고의 단점은 회사의 복지가 하나도 없음.
75,스피덴트,4654,"다른치과 업체들도 마찬가지지만 급여가 낮은편 , 연차쓸때 눈치보고 써야됨"
76,스피덴트,4654,주말에도 전시회로 인해 출근해야함. 생산량이 몰릴때는.야근이많음
77,스피덴트,4654,"일부 부서 및 인원의 공무원주의, 레임덕이 심함. 답답하면 답답한 사람이 우물 파야지????"
78,스피덴트,4654,"타 회사에 비해서 복지혜택이 크게 없음, 체계적으로 업무 관리가 되어 있지 않음, 승지 기회가 적음, 단순 업무가 많음"
79,스피덴트,4654,장점은 자유롭지만 단점은 그래서 일 안하는 사람이 많음
80,스피덴트,4654,"연차 사용 시 눈치가 꽤 많이 보임, 복지는 오직 떡값 하나뿐."
81,스피덴트,4654,"비효율적인 야근. 성장 가능성은 있지만 성장은 하지 않음. 혹여 성장을 했더라도 그로 인한 성과는 없음. 규모에 비해 상여, 복지가 없음. 연차가 있지만 눈치를 줘서 거의 못 씀. 정말 아프거나 일이 있어야 하고 그마저도 무슨 일인지 하나하나 다 보고 해야 함. 근속기간이 긴 이유는 회사 분위기가 진짜 일 하는 사람 그것도 몇명 그뿐임. 나머지는 그냥 물 흐르듯이 있음. 그러니 일 안하는 사람들은 퇴사를 할 필요가 없음. 가만히 있다가 월급날 월급 받아가면 됨."
82,스피덴트,4654,직원들끼리 친함이 지나쳐 구설수에 오르내림 남녀비율이 적당해 대학생활같은 가벼운 분위기.
83,스피덴트,4654,"의견이 많지만 철저한 사전 계획이 없기 때문에 회의에 많은 시간을 할애해야 하면, 비효율적인 작업을 하거나 두번 일하는 경우가 종종 있음. 직원들 사이에 도는 소문들이 많음"
84,스피덴트,4654,연봉이나 복지 부분이 적다. 낙하산이 많아 전체적인 체계가 불균형이 심함. 승진은 근속년수 무의미하며 불합리적이다. 직원 근속년수가 짧다. 직원을 소홀히 생각한다.
85,스피덴트,4654,일이 힘들고 어디든지 이상한 사람 하나씩은 있음 그리고 야근이 있으며 하는 일에 비해 짬
86,스피덴트,4654,"전혀 높지 않은 연봉. 4년제 대졸 신입 연봉은 2,500만원 / 전문대는 훨씬 낮고, 고졸은 더 낮음.(업체정보에 평균연금 2,500보다 낮은 이유는 전문대생들이 입력해서 그런 듯) 일 열심히 하는사람이 더 피해보는 곳. 요리저리 머리 굴리며 일 안하고 바쁜 척만 하는 사람들이 이득. 어차피 일은 하는 사람만 시키기 때문에.. 일년에 성과금 60만원(설에 30만원 / 추석에 30만원) 그 마져도 입사기간 4개월 미만은 20만원. 연초에 하는 건강검진은 입사 1년이상인 직원들만 시행. 명절이나 공휴일 같은 날은 업무를 쉬지만, 연차를 차감함. 선거일에는 한시간 늦게 출근. 선거라고 출근 빼주지 않음. 대졸 사무직은 관리자들이라는 명분하에, 야근수당 미 지급. 하지만 야근은 일주일에 2번 이상은 있음. 정말 월급 외에는 보너스가 없다고 보는게 맞음. 팀장들간 온도차이가 심한 편. 중소기업이나 대기업이나 뭐 어때라고 생각하고 입사희망한다면 큰 오산. 명절이며 공휴일이며 연차 다 차감하고 나면, 실제 남는 연차는 5일정도. 그 마저도 사용할 땐 눈치보이게 만듬."
87,스피덴트,4654,전산 시스템의 비효율성이 간혹 보임. 사옥이 완전하지 않아 서울역/인천으로 분할되어있고 아파트형 공장 내 다수 사무실을 보유하고 있기 때문에 사무실 간 거리가 멈. 팀장별 분위기 온도차가 심함.
88,스피덴트,4654,"경영방식에 옛날 방식이 고수. 경영진 및 주요 외주업체 들이 모두 친분관계의 지인들로 구성되어 있습니다. 구조가 상당히 폐쇄 적인편. 호봉제이기 때문에, 연차수에 맞춰 월급 인상률이 고정적인편, 연봉협상이 매년 이루어 지지 않음. 사무직은 야근 수당이 없음"
89,스피덴트,4654,업무처리에 있어서 옛방식을 고수하며 융통성이 없다. 점차 개선되는 것 같긴하다.
90,스피덴트,4654,회사 시스템이 잘 갖추어져 있지는 않음. 장기적인 발전 가능성이 낮음.
91,스피덴트,4654,수당다쳐줘도 월급이 180정도됩니다 생산 1팀 2팀 차별있어요
