,company_name,company_id,review_text
0,씨디컴,11066,"제작팀의 디자인팀 무시 디자인팀에서 갑자기 제작팀으로 발령날 수 있음_반박 안통함 디자진 팀이었을 당시 사수가 본인에게 한 이야기_위에서 일 주지 말랬다고 들음 [제작팀 들어가게 할려고] 제작팀 들어가자마자 매일 먹는 욕과 디자인으로 입사했는데 건드리지도 못하는 컴퓨터 제작팀의 하대 및 무시, 인격모독"
1,씨디컴,11066,"1. 제작데이터 만드는 업무가 주인데 택배,퀵, 이카운트등 온갖 잡무가 많다 2. 다량의 급발주 업무가 많은데 이랜드 매장에 당일에 배송까지 해야하는 기염을 토하는 스케줄을 소화해야한다. 3. 위의 스케줄에 대한 압박감이 엄청나다. 4. 제작회사인만큼 사고와 납품기일 스트레스가 엄청나다"
2,씨디컴,11066,너무 조용하고 다들 각자 할 일이 바빠 많이 도와주지 못한다는 점이 단점이라고 볼 수 있다.
3,씨디컴,11066,"터치를 안하다보니 일이 없으면 없는대로 배우고싶어도 일 하던분들은 일을 해야하니 바빠서 배우지도 못합니다. 인수인계를 받지를 않아 할수가없는데.. 어떻게든 일을 안하면 대표한테 까입니다. 입사전엔 분명 배울만한 환경이고 다들 잘 알려준다고 했는데 들어가니 그런 환경도 안되고 알려줄 사람도 없었습니다. 오래되신분은 팀장 한명있는데 알려줄 시간이 없을 뿐더러 알려줄 시간에 자신이 처리하는게 덜 귀찮다고 생각하시는 것 같습니다. 그래서 신입은 배우기 힘든곳이라 생각합니다. 굴리는건 다 굴리고 야근도 자주합니다. 디자인이라고 하지만 디자이너라고 말하고 다니기 뭐할정도의 업무이며 자잘한 택배관련 일, 직접 물건보내고 받아오기 등.. 잡다한일 다 합니다. 제작팀이랑은 사이가 굉장히 안좋고 다들 항상 화가나있으며 대꾸도 잘 안합니다. 첫날 가장 충격적이였던것은 인사조차 안한다는거.. 신입이 들어왔는데 아무도 신경 안씁니다. 밥은 어디서 먹는지 식당이있는지 뭐 하나 알려주지 않습니다. 다 개인주의입니다. 터치를 안하는게 어떤 부분은 장점이지만 제가 느끼기로는 이것도 단점 같았습니다. 물갈이 굉장히 심하고 제가 들어갈때도 나가는사람있었고 제가 나갈때 또 물갈이하고 난리였습니다. 업무적으로도 정말 체계적이지 못해서 답답하고 복잡하거나 노가다인 부분을 고칠 생각을 안합니다. 택배보내는것도 직접 전화로 소통하는데 그쪽도 굉장히 무시합니다. 환경도 좋지 않습니다. 컴퓨터도 굉장히 구식인지 포토샵, 일러스트 작동이 굉장히 느리며 자주 튕깁니다. 심지어 정품을 사용하지도 않습니다. 에어컨은 여름내내 고장났는데 고쳐주지도 않았습니다. 밖이 더 시원한경우가 많았고 에어컨이 시원하지않은데 선풍기가 4~6명이서 한개 사용했습니다. 야근수당은 없으며 돈대신 휴가로 쓸수 있다고 들었습니다. 야근할때 설명도 바로안해줘서 밥도 사비로 먹었습니다. 전체적으로 엄청 부족한 회사입니다. 부족한 부분들을 개선하려고 하지 않습니다."
4,씨디컴,11066,가족경영진 회사에 직원들은 어린애들만있고 복지 아무것도 없었음 지금은 좋아졌길
5,씨디컴,11066,모든 절차를 배울수있으나 모든걸 해내야하는 잡부가 되버릴수있습니다.
6,씨디컴,11066,분류가 잘 되어있지 않아서 큰일이 한번에 몰려오면 굉장히 바쁠 수 있습니다.
7,씨디컴,11066,"딱히 디자이너라고 하기엔 인쇄소 디자이너급 업무 디자인 업무가 끝나면 포장, 재단 일까지 해야함"
8,씨디컴,11066,위에거 하나말고는 다 단점인 것 같네요. 그나마 디자인한 제작물 바로 확인 가능하다는 점
9,씨디컴,11066,"과도한 업무량, 디자인 기회 거의 없음, 고객의 무리한 요구에 대한 소통 스트레스"
10,씨디컴,11066,"경력을 얼마나 쌓든 월급은 무조건 최저고정, 수습 3개월 꽉채움, 창작이 아닌 누끼따고 편집만 하는 디자인팀 디자인적 능력성장 없음. 초과근무나 야근시 수당대신 휴무시간을 지급해줌, 대표님이 월급 인상에 인색하심, 얼마나 일을 잘해내든 성과비 없음, 대표님이 작업 상황을 이해못함 (무조건적 업무수행요구)"
11,씨디컴,11066,우선 사장 이사 둘이 부부고 이랜드 일이 대부분인데 택배 부터 포장까지 다양한 일을 시킴 택배 송장도 출력하고 어쩔땐 재단도 함 디자이너들에게 별걸 다 시킴
12,씨디컴,11066,"지금은 잘 모르겠으나, 그때 당시 매우 낮은 연봉에, 실질적 사장은 실장이었지만 사장으로 올라가 있는 사람이 너무 실력이 없었음. 주먹구구식 운영"
13,씨디컴,11066,출근시간은 있지만 퇴근시간이 없다 한사람이 너무나 많은 격무를 해야 한다 사이에서 중재자가 없어서 양쪽에서 스트레스를 받는다
14,씨디컴,11066,"일단 회사가 하청업체이다 보니, 디자이너가 아니라 편집하는 로봇이다. 디자인에 생각이 들어갈 수가 없는 위치이다. 그래서 내가 여기서 뭘 하는 거지라는 생각이 다니면 다닐수록 느껴진다. 차라리 실패 하더라도 독립적인 광고 회사로 나아갔으면 한다."
15,씨디컴,11066,"단순업무위주, 가족회사, 대표갑질이 장난아님, 직원으 소모품취급"
16,씨디컴,11066,연봉 적음  야근 수당 없음  업무가 바쁠 경우 늦은 퇴근도 많음
17,씨디컴,11066,낮은 연봉/대부분의 일이 급박하게 돌아감/신생회사가 아님에도 관리자급 직원들의 역량부족으로 체계가 안잡힘/대표가 거의 모든 업무에 직접 개입
18,씨디컴,11066,사장이 직원에 대한 배려가 조금도 없다. 정직원 채용으로 해줘서 근처 집을 구했는데 코로나 터지자마자 짤랐다. 일하는 직원한다 강아지 똥치우게 한다.
19,씨디컴,11066,일단 사람뽑고 아무대나 일을 시켜 효율이 떨어지고 야근시 야근비없고 택시타고 퇴근하면 안됨 야식도 정해진금액 이상 시키면안됨 택시타고 퇴근하면 불러서 뭐라고 하면서 일안끝났는데 퇴근한다고 불러서 뭐라고 하는 곳 회사 업무와 관계없은 일도 시킴(개똥치우기 사료주기...등) 집에서 키우는 개 사무실 구석에 묶여있음 (피부병걸려 털도빠짐) 일이없어서 쉬지못함 청소하는 척이라도 하면서 계속 움직이셔야함 cctv보면서 계속 직원들 지적만함 (듣기만한내용-주말에 일나와서 일다끝나갈때 청소도 거이 끝나고 마무리 정리할것도 거이없는상태에 주머니에 손 넣고있는걸 cctv보고 전화해서 월요일날 사표써서 출근하라는 회사)
20,씨디컴,11066,"연봉이 최저수준, 근태에 민감하지만 야근수당은없음 야근시에도 교통비지급안됨"
21,씨디컴,11066,"출근시간은 9시 퇴근시간은 6시인데, 오후 4시에 퇴근시간이 바뀌는 적도 비일비재함. 20시간 넘게 근무를 한적이 많음. 이사가 제작부장과 말을 할때도 일이 너무 직원 수에 비해 많다고 어필하면 그럼 철야하면 되잖아요? 라고 이야기함.(매번) 철야라는 단어를 밥먹듯이 함. 목요일 오후즈음 갑자기 주말에 출근을 하라고 강요 시간이 안된다고 하면 나가 이 새끼야는 기본."
22,씨디컴,11066,공장 온직원이 제작일 가담해야됨 공고에 그냥겸업이라고 명시하길
23,씨디컴,11066,매일같이 눈치보는 일상. 체계가없어 그때그때 상황도 회사규칙도 달라짐 야근 밥먹듯이 있지만 야근수당은없음
24,씨디컴,11066,"이직, 퇴사율이 높아서 주변 환경이 계속 변하니까 조금 정리가 안되는 느낌이 있습니다."
25,씨디컴,11066,승진여부가 불분명하고 체계가 조금 덜 잡혀있다. 디자인적인 일을 기대하고 들어오면 실망이 크다 여러가지일을 다 해야해서 업무에대한 회의감이나 애사심이 부족해진다.
26,씨디컴,11066,"열정페이, 야근을 해도 1분이라도 지각하면 혼남, 전형적인 공장형 사무실"
27,씨디컴,11066,"일이 너무많음. 9시간 근무에 주말출근도 있고, 연차가없음 포토스튜디오가있지만 직접 찍어야됨. 야근은 일상생활 그런데 지각하면 혼남 업무중간에 휴식시간이 없고 일이 너무 많아서 점심시간에 대부분 잠"
28,씨디컴,11066,"직원을 돈으로만 봄 쉬는모습을 보면 큰일남 직원들간 잡담, 친목 을 불쾌하게 생각함  출근시간은 칼같음 어쩌다 한 번 5분 지각시 모욕적인 언행의 고성을 들을 수 있음 퇴근시간 칼같이하면 뒤에서 모욕적인 언행 들림  근무시간에 병원,은행 그 외 모든 개인 행동 불가  화장실 자주간다, 화장실에 오래있는다고 지적받은 직원도 있었음"
29,씨디컴,11066,잡무가 많다 사람을 귀하게 여기지 않는다 보고 체계가 없다
30,씨디컴,11066,"칼퇴는 꿈에도 없고, 윗사람이라고 자기가 맞은 일을 해주지도 않음. 실수를 내가 하지 않아도 책임은 내가 지어야만 하고 모든 고통은 자신에게 따르는 법. 첫 직장이라면 수사도 없는 회사여서 혼자 터득하고 혼자 익혀야함."
31,씨디컴,11066,"1. 부부가 운영- 사장이 남편, 아내가 이사 2. 디자인 회사가 아니고 출력 제작 회사인데 자꾸 디자인 회사라고 함. 3. 입사하면 사람 간보고 맘에 안들면 디자이너로 들어오건 지원팀이건 직급에 상관없이 제작팀(공장)으로 보내서 자진 퇴사하게 만듬. (제작팀은 맘에 안들면 그 밑에 직원에게 업무지시하고 타겟 직원은 일을 안시키고 눈치 보게 만듬) 4. 사장실에 CCTV모니터로 제작실의 업무 상황을 체크. 5. 면접때는 세상 좋은 사람의 표정을 짓고 연봉 급여도 다 정해놓고 출근하면 연봉도 깍고 직급도 변경시킴. (더 있으나 단점을 알고 싶음 가서 몸소 체험)"
32,씨디컴,11066,클라이언트회사의 갑질이 너무 심한곳 그래서 야근을 밥먹듯이함. 하루에 카톡 수백통을받으며 일해야함 디자이너라고하기엔 너무 잡일이 많음 다른부서들이 서로 일을 디자이너에게 미루고 짜증이많아 디자이너가 너무 힘든곳
33,씨디컴,11066,"전문적인 디자인 실력을 키우고 싶다면 다른 곳을 추천, 여기는 바레이션치고 편집하고 출력넘기는게 대부분이라 따분함, 실력을 키우기엔 역부족"
34,씨디컴,11066,"가족회사(겉으로는 친절한듯 하나 까만 속), 주먹구구식 운영, 복지제로"
35,씨디컴,11066,복지제도 없고 월급이 매우 짬/ 야근이 많은 편 아파서 병원가는것도 눈치봐야하고 퇴사한다 하니까 사장이 안좋은 소리함
36,씨디컴,11066,전형적 가족회사. 인간적인 대우를 바랍니다. 식대 안나옴. 야근수당 없음. 내가 디자이너가 맞긴 한지 회의감이듬. 오로지 돈만 생각하는 회사.
37,씨디컴,11066,"식대제공없음 가족기업-돈에혈안 휴일,주말에도5분대기조 연차없다고생각해야한다 디자이너에대한현장근로자의욕설 출근있어도퇴근없음 일분배엉망 가끔노가다도뛰어야 강아지똥오줌수발해야 가끔동물병원도갔다와야 에어컨,히타안틀음-더우면더운대로추우면추운대로 일많은데사람심각히부족 야근수당없음 인수인계없음 주먹구구식운영 정신적스트레스 폭언과욕설,막말,사람을하찮게생각 책임떠넘기기,말바꾸기 땜빵의연속,싸게부리고직무교육없이막나가다위태로워질듯"
38,씨디컴,11066,경영진의 마인드가 진짜 구림. 직원을 노예부리듯 사람취급 안해줌. 겉으론 생각해주는척 말하지만 행동은 전혀 안함. 중간관리자들은 자기살기 바쁘고 아랫사람 신경 안써줌.
39,씨디컴,11066,개인번호 카톡으로 소통. 아침이든 밤이든 새벽이든 언제든지 거래처 연락 받아야함. 복지는 1도 없음. 사람 소중한줄 모름. 디자인뿐만 아니라 잡노동 다 경험할 수 있으며 주말에 나오라면 나와야함. 체계가 1도 없어서 다 윗사람들 기분에 따라 결정에따라 그때그때 달라짐. 어느장단에 맞춰야할지..? 여러모로 최악의 경험.
40,씨디컴,11066,돈에 혈안이 되어있음 오직 돈만 많이 벌면됨. 직원에대한 복지는 기대할 수 없음. 체계도 없고 주먹구구식 업무로 디자이너로써 성장할수 없음. 다닐수록 회의감만 드는 회사
41,씨디컴,11066,"지금은 모르겠는데 당시 9 to 7 근무였고, 급여는 9 to 6만큼의 급여였네요. 식대 지원이 안됨."
42,씨디컴,11066,가족같지 않은 분위기에 업무량이 많은것 같다 힘들것 같다
43,씨디컴,11066,무리한 일정으로 일 받아놓고 직원들이 밤을 새던 상관안하면서 야근하면 왜 했냐고하고 일정미루면 상의안했다고 뭐라함 주말에도 업체연락 받아야함 토요일근무있음 경영진들이 직원앞에서 사적인 전화함 회사에 어린 아들 데려와서 물흐림 누구는 일하고 누구는 일안하는 회사
44,씨디컴,11066,출력도 하는곳이라 작업마치면 작업지시서들고 뛰어가 출력맡기고 마치면 콜불러서 보낸다. 이곳에선 포트폴리오 못만든다.
45,씨디컴,11066,배울수있는 제대로된 선임이 없음. 회사업무의 체계가 절대없음. 디자이너가 왜 이런일을 해야하는가??????라는 의문이 점점점점 더해짐. 실수가 생기면 빨리 처리하는게 문제가 아니라 누구탓인지를 먼저 찾아내려함 대표조차 디자인회사라고 생각안하는데 왜 디자이너를 뽑는지의문 포폴에 쓸수있는게 절대없음
