,company_name,company_id,review_text
0,씨앤토트,17,결재 체계가 너무 옛날스러움. 아직까지 종이로 업무를 보는게 좀 놀라울 정도임. 평균 연령이 좀 높아서 그만큼 틀에 박힌 사고방식이 많은 것 같음.
1,씨앤토트,17,IT 기업인데 그룹웨어 등 자사 IT 환경이 조금 낙후되어 있음. 사무 환경이 넓지만 올드함.
2,씨앤토트,17,임원들의 약간 경직된 분위기가 단점이라고 생각함 다른 회사도 그렇겠지만 자신들의 생각이 확고하기에 변화할 의지가 없음니다
3,씨앤토트,17,"그룹웨어 등 전자 시스템이 없는 것, 체계가 없는 것 등"
4,씨앤토트,17,솔루션 위주에 기술이기 때문에 엔지니어가 다니면서 성장 한계가 있음
5,씨앤토트,17,신입들이 첫 경험 쌓고 적절한 시기에 나가야 한다.. 잘못하면 매너리즘에 빠질 수 있다. 임원분들이 여러 방면으로 노력이 필요한 회사
6,씨앤토트,17,연봉협상이라는걸 해본적이 없고 그냥 통보식이다. 여기에 오래 다니고 퇴사한 사람들 보면 결국 연봉을 너무 안올려줘서 퇴사한다고 함
7,씨앤토트,17,"그룹웨어가 없어 수동으로 처리, 페이퍼 작업이 있음.. 일을 하는 사람만 하는게 심함, 중간직급이 거의 없음"
8,씨앤토트,17,글보면 알다시피 여기서 모든걸 알 수 있다. 홍보용으로 직원들한테 리뷰 좋게 쓰라고 강요한거같은데 그냥 그때그때 손바닥으로 하늘가리기 식이에요 그만해요. 임원이 너무많은 구조이고 내부적으로 대화가안된다.자기네 마음대로 컨트롤이 안되면 퇴사하도록 유도합니다. 규모는 커지나 사업적으로 미래가 있는지는 물음표다.
9,씨앤토트,17,"올드한 기업문화, 전자결재시스템 없는 결재구조, 소통이 어려운 경영진, 답답한 사무실 인테리어, 통화 가능한 휴게공간 없음, 회의실 부족, 필터청소 한번도 안 한 정수기, 사용 안하는 커피머신 매달 청소강요, 직급의 불균형"
10,씨앤토트,17,회사 급여가 낮은 편이고 상승폭도 크지 않습니다.
11,씨앤토트,17,출근 시간에 엘베 줄이 길어 걸어 올라오는 경우가 많은 것 같습니다... 그래도 5층이라 걸어서 올라갈 만 합니다..
12,씨앤토트,17,"""IT 회사 같지 않다"", ""쉽게 바뀔 것 같지 않다"" 는 느낌을 지울 수 없다."
13,씨앤토트,17,"다소 보수적이며, 직원 복지가 부족함"
14,씨앤토트,17,"올드한 기업문화, 전자결재시스템 없는 결재구조, 소통이 어려운 경영진, 답답한 사무실 인테리어, 통화 가능한 휴게공간 없음, 회의실 부족, 필터청소 한번도 안 한 정수기, 사용 안하는 커피머신 매달 청소강요, 직급의 불균형"
15,씨앤토트,17,"매출 규모나 성장하는 규모에 비해 시스템이 없다. 경영지원팀이 80년대 일처리 스타일임. 디지털 업무를 제안하고 판매하는데.. 아직도 하드카피 문서가 비효율적으로 많다. 전체적으로 시스템이 통합되어 있지 않고, 올드한 방식이 가장 큰 걸림돌임."
16,씨앤토트,17,출근 시간에 엘베 줄이 길어 걸어 올라오는 경우가 많은 것 같습니다... 그래도 5층이라 걸어서 올라갈 만 합니다..
17,씨앤토트,17,"다소 보수적이며, 직원 복지가 부족함"
18,씨앤토트,17,"""IT 회사 같지 않다"", ""쉽게 바뀔 것 같지 않다"" 는 느낌을 지울 수 없다."
19,씨앤토트,17,"노후된 인테리어, 노후된 결재 프로세스.."
20,씨앤토트,17,사무환경등이 올드한 느낌이 있다. 회사의 성장에 비해 연봉 인상등의 정책이 소극적이다.
21,씨앤토트,17,적은 인원으로 많은 일을 담당 중. 경험치를 쌓기엔 좋으나 몸이 힘들며 그의 따른 복지 및 대우가 따라오지 않음
22,씨앤토트,17,컴팩트한 기업 운영. 복지 혜택이 조금 적다는 점( 지속적으로 개선중 )
23,씨앤토트,17,"""IT 회사 같지 않다"", ""쉽게 바뀔 것 같지 않다"" 는 느낌을 지울 수 없다."
24,씨앤토트,17,신규 입사자가 많아 조직의 화합이 조금은 늦어지고 있는 편입니다.
25,씨앤토트,17,신규인력의 충원이 늦어져 기존 인력의 고정화 문제 및 추가적인 비지니스를 위한 신규 업무 전환에 속도가 늦음
26,씨앤토트,17,"올드한 기업문화, 전자결재시스템 없는 결재구조, 소통이 어려운 경영진, 답답한 사무실 인테리어, 통화 가능한 휴게공간 없음, 회의실 부족, 필터청소 한번도 안 한 정수기, 사용 안하는 커피머신 매달 청소강요, 직급의 불균형"
27,씨앤토트,17,"사무공간 및 결재 및 내부보고 시스템 낙후,"
28,씨앤토트,17,"집이 멀고 가깝고를 떠나서 주차 유류지원을 안해줌, 직원은 일단 안해주지만 임원은 다되는 걸 느끼게 해줌, 회사 규모에 비해 업무시스템 체계화가 너무 안되어 있음"
29,씨앤토트,17,컴팩트한 기업 운영. 복지 혜택이 조금 적다는 점( 지속적으로 개선중 )
30,씨앤토트,17,신규인력의 충원이 늦어져 기존 인력의 고정화 문제 및 추가적인 비지니스를 위한 신규 업무 전환에 속도가 늦음
31,씨앤토트,17,"올드한 기업문화, 전자결재시스템 없는 결재구조, 소통이 어려운 경영진, 답답한 사무실 인테리어, 통화 가능한 휴게공간 없음, 회의실 부족, 필터청소 한번도 안 한 정수기, 사용 안하는 커피머신 매달 청소강요, 직급의 불균형"
32,씨앤토트,17,"사무공간 및 결재 및 내부보고 시스템 낙후,"
33,씨앤토트,17,"집이 멀고 가깝고를 떠나서 주차 유류지원을 안해줌, 직원은 일단 안해주지만 임원은 다되는 걸 느끼게 해줌, 회사 규모에 비해 업무시스템 체계화가 너무 안되어 있음"
34,씨앤토트,17,컴팩트한 기업 운영. 복지 혜택이 조금 적다는 점( 지속적으로 개선중 )
35,씨앤토트,17,직원들의 복지와 연봉에 대해서 조금만 더 신경 써준다면 정말 좋은 회사
36,씨앤토트,17,비슷한 업종의 다른회사에비해 약간 낮은 연봉이 낮음
37,씨앤토트,17,회사 급여가 낮은 편이고 상승폭도 크지 않습니다.
38,씨앤토트,17,적은 인원으로 많은 일을 담당 중. 경험치를 쌓기엔 좋으나 몸이 힘들며 그의 따른 복지 및 대우가 따라오지 않음
39,씨앤토트,17,사무환경등이 올드한 느낌이 있다. 회사의 성장에 비해 연봉 인상등의 정책이 소극적이다.
40,씨앤토트,17,"탄탄한 회사이지만 업계의 선두를 차지 하지는 못하고 있음 급여, 복지, 인력풀 모든 부분에 높은 점수를 줄 수 없는 상황"
41,씨앤토트,17,기업 문화가 그렇게 좋은지 모르겠음 승진이 그렇게 매끄럽지 않음
42,씨앤토트,17,"연차는 나의 것이지만, 공동연차를 만들어서 쓰기 싫어도 강제로 쓰도록 만듦. 임원들의 경우, 나는 괜찮고, 내 밑으로는 안되라는 내로남불 마인드가 강함. 내 팀, 너네 팀이 강해서 자기 마음에 안 들면, 안된다고 함. 직원들은 담배피는게 주 업무이고, 내 일 아니라고 우기는게 보조 업무임. 복지가 임원들 위주로 편향되어 있어, 공평하게 누리지를 못함."
43,씨앤토트,17,비젼이 없어 발전 없음 연봉 쥐꼬리 복지 최악 엔지니어도 영업도 시키는 것만함
44,씨앤토트,17,수평적이려고 하나 회사 분위기나 배치 인테리어부터 수직적임 연봉이 짜다 야근수당이 거의 없는수준이다 복지가 거의 없다 경험을 쌓기에 좋지않다 회사에 체계가 없다
45,씨앤토트,17,밑에사람은 너무 눈치를 안보고 위에는 자기 할일만 하고 너무 윗사람은 아랫사람 눈치만 본다. 할말은 해야하는거고 잘못된거 있으면 잡아줘야하는데 그러지를 못하고 열심히 하는 사람들만 열심히 한다. 내가 월급 루팡이 되고싶다면 추천합니다. 책임감 있고 성실한 사람들은 비추천 드립니다.
46,씨앤토트,17,야근이 많고 야근비는 없거나 적음. 연봉협상없이 회사 마음대로 연봉이 책정됨
47,씨앤토트,17,"엄격한 관리팀- 90년대식 관리 방법 유지, 융통성 부족, 직급간의 소통이 부족. 타 부서와의 협업 부족 및 협조 요청의 어려움"
48,씨앤토트,17,"스트레스가 진짜 너무 심함. 경영진이 매우 꼰대스럽다. 일의 강도가 조금 높은 편이며, 정신적 스트레스가 심하여 멘탈 관리가 중요할 것 같다. 지각하면 엄청 눈치주며 뭐라함."
49,씨앤토트,17,"편하게 일하는 대신 연봉이 적음, 연봉 인상율도 적음 부장이싱급만 우대"
50,씨앤토트,17,복지제도가 없음 중소기업에 머물수밖에 없는 영업력과 회사문화
51,씨앤토트,17,진급이 너무 너무 빠름 왜 단점일까 이게? 윗분들이 더 윗분들 눈치만 보기 바쁨 해야될 말 못함 닫힌 생각을 가진 사람이 더 잘되는 회사
52,씨앤토트,17,연봉이 중소기업이라 작음 개인적으로 큰 성장을 기대하기는 어려움
53,씨앤토트,17,"1. 각 팀장 및 파트장들은 10년이상 서로 끈끈함 웃긴건 그들도 뒤에선 서로 욕함 2. 모든 혜택은 위의 1번무리만 누릴수 있음(주차, 기름값, 다른 인센기준, 자유로운 출퇴근) 3. 위의 1번무리 맘에안들면 그만두도록 유도함 4. 연봉인상은 연에 100만원이라 보면됨 5. 1번 무리들은 출퇴근에 자유로움 근태 체크안함, 하지만 그외에 인력은 출퇴근 빡씨게 체크하고 쪼음 6. 위의1번 무리는 일을하지않고 밑에직원에게 넘김  이게 모두 팩트라는것에 쓰면서 다시한번 감탄함 위의 단점은 1%정도라 생각하고 나머지99%느껴보고싶으면 입사 요망"
54,씨앤토트,17,긴말 안합니다 그냥 그들만의 리그 딱히 능력이나 자질 없는 나이로 다는 매니저타이틀
55,씨앤토트,17,"너무많은데 고인물들 빼고 전부 직원취급아니고 노예취급, 답이 정해져있는 회의 매주월요일마다하고 누군 지각 밥먹듯이 하며 당당하게 지냄. 특정인물이 매니징이란 타이틀 뒤에 숨어서 물흐리고 있음"
56,씨앤토트,17,요즘 유행이 레트로긴 한가보다 80년대 회사문화를 느낄수 있으며 온갖 단점을 다 볼수 있다 체험하고싶으면 입사해서 체험 해보도록
57,씨앤토트,17,"역피라미드 구조, 일에 대한 기준이 없음, 차별, 고인물에 올챙이가 되고 싶다면 추천, 아래사람들이 변화를 외치지만 허공에 외치고 있음, 신입의 낮은 급여 시작, 사람 평가에 대한 기준도 없음"
58,씨앤토트,17,"나이 많은 직원들이 많고, 그에 따른 다소 경직된 분위기. 직급간의 대화가 많지 않음으로 인한 직급간의 상호 이해도가 떨어짐."
59,씨앤토트,17,"80년대로 회귀한 업무 방식. 복지 없음. 역삼각형의 직급체계, 코딱지만한 회사 임원도 임원이라고 아랫사람한테 대접받으려고 조금한 수가 뒤틀리면 일로 복수하거나 뒤에서 구린 말을 해댐. 아랫사람 까대는 윗선(부장급 이상).. 지들이 MS 직원인줄 착각."
60,씨앤토트,17,비효율적인것들이 많다 직원들의 의견을 잘 안들어주는거 같아서 아쉽다
61,씨앤토트,17,결재를 아직도 서류작성해서 손으로 사인해서 진행함 /직원들에게 돈쓰는거 끔찍하게 싫어함/고객위주/워크샵은 거의 대학교 엠티보다 못한 수준으로/일하는사람들 따로있음/월루는 알면서 뭐라안함/임직원및 차부장들은 10년이상 고여있는 인물들이라 서로 감싸기 바쁨/소통없음/급여 어떻게하면 줄이나 생각만 하나봄/인력이탈하고 다시 뽑으려하는데 어떻게든 싸게 아니면 돈이안되는 신입만 뽑아서 일이안됨/ 기존직원들을 이직한 직원들보다 급여나 대우등등 차별함
62,씨앤토트,17,"고이다못해 썩은물들은 모든 혜택을 다 갖고있음(기름값,건물주차지원,핸드폰 전액, 술먹은 다음날 지각, 법인카드로 점심 커피, 하루에 3시간이상이 흡연시간) 이정도 보면 어떤분위기인지는 감이올듯. 어떤이는 법인카드가 필요없는 내근직인데 발급해줌 지각을 밥먹듯이함. 특정인물 편애하는건지 뭔지 잘모르겠지만 기준이없으니 평등하게 혜택이 돌아가지도 않음 윗사람들은 모든 혜택을 받으미 불만없을듯 결론은 나이많고 직급높으면 모든게 허용되고 그게아니면 모든게 불가능한곳임"
63,씨앤토트,17,하는 일이 과중하지 않지만 동종업계 친구들에 비해 급여가 낮다고 생각이 듬. 복지가 생각보다 적음.
64,씨앤토트,17,모든 회사가 그러하듯이 반복되는 업무형태가 많이 있습니다.
65,씨앤토트,17,"역피라미드 구조(과장급 찾기힘듬) 상상도 못할만큼 낮은 연봉 인상률,사람 부품취급, 까라면까 라는 구조 회의를 위한 회의를 밥먹듯하며 밑에직원 의견은 무조건 틀린의견임. 진급기준 모호, 기존 사원들보단 이직한 사원들에게 잘해줌 결국 2~3년 주기로 다 교체됨 비효율적인 업무체계, 비효율적인 팀 구성, 복지 찾기힘듬 등등 많지만 다 적기엔 이 공간이 부족"
66,씨앤토트,17,직급체계 없음. 도대체 무슨 기준으로 승진하는지 알 수 없음. 경력사원의 기준도 모호해서 기존 직원들간에 불만이 많은 상황.
67,씨앤토트,17,단점: 일을 하는것 같지만 자기발전은 정말 힘든 구조. 라이센스 판매가 주 업종이라 다른 파트는 뒷전인것 같음  연봉은 사람마다 캐바캐 인듯 함 보너스가 있어서 업계표준정도 인듯
68,씨앤토트,17,규모에 대한 복지가 많이 없다는게 단점이며. it기업이 연봉이 짜지만 여기도 연봉이 짬 직원 입장에서 안정적인 직장이라 느끼기 힘듬
69,씨앤토트,17,실제적으로 부딪히는 직원들은 자기밑 사람은 모두 부하취급 상상초월 스트레스를 선물로 줌 감투좋아하는곳
70,씨앤토트,17,수평구조가 아닌 수직구조로서 사람들간의 내외부적인 스트레스가 상당히 심함
71,씨앤토트,17,"아웃소싱쪽에는 지원되는 복지가 없다고 생각, 리프레쉬는 잘 이행되나 그밖의것은 찾아볼수 없음"
72,씨앤토트,17,아웃소싱 직원들이 많다보니 소홀해 지는것 같음
