,company_name,company_id,review_text
0,아인커뮤니케이션,4664,야근 수당 없는데 야근 바람  쓸데없는 회의가 있음
1,아인커뮤니케이션,4664,"기본적인 연차도 제공을 안하려고 하는 회사 기본적인 연봉도 맞추려고 하지 않는 회사 기본적인 회사의 방향성, 비전이 없는 회사"
2,아인커뮤니케이션,4664,"개발자로써 성장할 기미가 보이지 않는다. 그 이유는, 신기술을 거부하려는 경향이 무지막지하게 강하며, JAVA, JavaScript만을 할 줄 아는 2-3년차 개발자가 최상위 개발자이며, 모놀리틱한 개발이 당연시되어있고, 2-3년차 개발자가 MSA가 무엇인지 모를정도로 신기술 동향에 대해 아예 모르는점이 많다. 그리고, 회사 정치질이 무엇보다 심각하다. 과장님이 마음에 안들면 부장님에게 보고하고, 부장이 개발자들을 혼내는 스타일. 디자인팀이랑 개발자팀 두 팀이 존재하는데, 개발자가 디자이너보다 못하다 라는 느낌을 받을 수 있는 회사."
3,아인커뮤니케이션,4664,"위에서 말했듯이 야근을 당연하게 생각하고 하는만큼 보상을 준다고 하는데 과연? 약간 좀 꼰머 기질이 있으심, 아 그리고 이사갔는지 모르겠는데 건물이 매우 구림..."
4,아인커뮤니케이션,4664,"1. 말로는 야근하지말라고 하지만,, 야근할 수 밖에 없고, 야근 하면 좋아하는 회사.(같이 퇴근하는걸좋아 함....) 2. 대표가 무능력함... 근데 그걸 잘 모름(그래서 직원들이 고생) 3. 직원들에게 희생을 바라는데 보상은 없음."
5,아인커뮤니케이션,4664,"적절한 보상 없이 야근을 강요합니다. 강요하면서, 아닌 척을 합니다. 건물 위치는 좋지만, 건물은 좋지 않습니다."
6,아인커뮤니케이션,4664,"야근, 주말 포함 쉬는 날 없음 그렇다고 돈은 더 주지도 않음, 연차 못씀, 간접 흡연, 낮은 연봉"
