,company_name,company_id,review_text
0,아이펀팩토리,3285,대표 한명이 유일한 기업의 단점이다. 돌아가면서 맘에 들지 않으면 가스라이팅을 시작하고 다른 직원들한테 정치질 함
1,아이펀팩토리,3285,- 매주 월요일 진행하는 사업회의는 개발팀외에 팀을 까기 위한 청문회 - 본인이 꼰대면서 직원을 꼰대로 만드는 상사 - 본인 만의 논리로 트집잡아 직원을 괴롭히는 대표
2,아이펀팩토리,3285,정확한 개발 방향이 없고 일정제출해도 무의미 하며 즉흥적으로 해야되는 업무가 많음
3,아이펀팩토리,3285,스타트업이기에 아직은 사내 체계가 뚜렷하진 않음 다양한 시도와 시행착오를 통해 체계가 잡혀가는 그 과정에 있으며 시키는 일만 하는 수동적인 사람에겐 그런 점이 힘들 수 있음 승진이 직장생활에 동기부여가 되는 사람 혹은 자신의 권위를 내세워야 하는 사람에겐 수평적인 문화가 맞지 않을 수 있음 부서 간에 소통할 수 있는 기회가 부족함
4,아이펀팩토리,3285,(단점이라기 보단 어려울수도 있는점임) 신입의 경우 케어받지 못한다는 느낌을 받을 수 있다. 단합보단 개인주의적인 분위기 인사고과에 대한 체계가 없다(장점?)
5,아이펀팩토리,3285,입사자 보다 퇴사자 수가 많으며 평균 근속년수가 매우 낮음. (퇴사의 이유는 가지각색이겠지만 평균 근속년수가 낮은 이유는 다 있음...) 체계가 전혀 없어 막무가내로 진행되는 업무가 많음 수평적인 사내문화를 추구하지만 실상은 그렇지 않음 회의 준비를 위해 소모되는 업무 시간이 너무 많음 업무 외적으로 감정의 쓰레기통이 될 수 있음 업무결과의 책임자가 불분명하여 업무 진행이 어려움
