,company_name,company_id,review_text
0,아임커머스,6930,오래된 분들이 많이 계시고 신입이 적기 때문에 중간 역할을 감당하는 사람이 필요하다. 변화가 필요한데 그걸 이끌어 줄 멤버가 없다. 혹은 그걸 방해하는 사람이 있다. 한 사람 때문에 그만두는 직원이 많은데 정작 그 사람은 나가지 않는다.
1,아임커머스,6930,업무 중간 중간에 쉬는시간이 정해져 있어서 그때만 쉴 수 있는게 좀 힘들고 점심 먹을곳도 없고 역이랑도 멈
2,아임커머스,6930,장기 근로자가 많아 승진의 기회도 거의 없고 연봉협상도 없음.부서간 소통이 거의 안됨.
3,아임커머스,6930,"복지제도가 따로 없으며, 수평적인 분위기인듯 아닌 분위기"
4,아임커머스,6930,뚜렷하게 발전이 없는 중소기업의 한계가 있음 회사건물이라고 보이기는 힘듦
5,아임커머스,6930,매출의 부진이 다소 있으나 곧 성장하게 될 듯 아무래도 CD플레이어를 주체적으로 판매하던 회사이다보니 시대의 흐름에 다소 떨어지는 경우가 있긴하나 나쁘지 않음
6,아임커머스,6930,개인전으로 급여에서 실망함 어리다고 생각하고 그런지 모르겠지만 신입 연봉으로 1900이였음 식비를 따로 챙겨주시긴 했지만 취성패로 원래 받아야하는 돈을 받았을 뿐임 다음에 들어온 신입이 나와 비슷한 스펙임에 불구하고 나보다 연봉 500 더 받은거에 충격먹음
