,company_name,company_id,review_text
131,에스케이바이오텍㈜,4535,제약분야에서 성공할 지언정 아래 직군에게도 혜택이 돌아올지는 의문
132,에스케이바이오텍㈜,4535,모든게 안좋다 일도힘들고 사람들도 안좋고 위험하다  급여도 적음.
133,에스케이바이오텍㈜,4535,적은 연봉 경력 인정안해줌 본사랑 처우가 많이 남 이름만 대기업입니다
134,에스케이바이오텍㈜,4535,"회사 체계는 신생 스타트업, 임직원 마인드는 철밥통 공무원"
135,에스케이바이오텍㈜,4535,입사 후 모든게 단점으로 다가온다. 극악의 군대문화 여기서 일하다가 성이 조씨 인사람들이 다 싫어졌다 누군지 알것이다 퇴사자들이나 현재직자들은 인간때문에도 힘들고 급여때문에 힘들고 일때문에 힘들고 사원증을 던져버리고 싶던적이 한두번이 아니다
136,에스케이바이오텍㈜,4535,직군마다 다르겠지만 업무분담이 효율적이지 않은면이있음 연구직 실험직군은 야근이 많음
137,에스케이바이오텍㈜,4535,위에도 말 했지만 T직군 즉 생산직군의 체계가 잡히지 않은듯
138,에스케이바이오텍㈜,4535,야근이 너무 잦고 다른계열사에비해 연봉이 너무 적습니다
139,에스케이바이오텍㈜,4535,"주먹구구식 일처리, 한사람이 시키는 업무를 모두 수행해야한다. 업무만 주어주고 일을 가르쳐 주질 않는다."
140,에스케이바이오텍㈜,4535,돈이 적고 원룸비 지원도 거의 50%이다 돈 벌고 싶다면 다른곳으로 갈 수 있으면 가는 것이 좋다
141,에스케이바이오텍㈜,4535,단순 노무가 너무 많은편 직원들의 편의를 많이 봐줫으면좋겟음
142,에스케이바이오텍㈜,4535,급여가 최저시급수준 . 회사가 아직 과도기라 그럴수 있지만 과도기가 언제 끝날지 모른다. 절대 안바뀔거같다.
143,에스케이바이오텍㈜,4535,"팀장,임원급은 급여도많고, 인센도 많이 받아간다. 실적안좋다고 직원은 줄이면서. 그러면서 힘냅시다 이러는데..참 할말을 잃었다.. 직원들 너무 안뽑아준다. 각 팀에 실무자 2~3명 밖에 없다. 이유는 인건비 아껴서 영업이익 늘려야 임원들이 연임하니까. 회사도 지방이면서 주거정책도 없다. 무슨 자신감? 발전할 것 같은 사업이라고들 하지만 실제로 들여다보면 아님. SK바이오텍은 삼성바이오로직스와는 다른 산업이다!!"
144,에스케이바이오텍㈜,4535,교대근무바꼇지만 점심시간을 제외하는 이상한근무형태.. 쉬는시간보장안되는 미칠듯한 업무강도.. 공채로열심히왓건만 중소기업과 같은 근무강도
145,에스케이바이오텍㈜,4535,무궁무진한 발전 가능성이라는 꿀발린 말로 동종업계 최저 월급을 주면서 직원과 소중한 줄 모르는 회사. 배울 기회가 많다는건 그만큼 대기업이라는 타이틀 때문에 굉장히 체계적으로 움직이려 한다. 하지만 현실은 여기 저기 급한대로 불끄기 정도임.. 정말 숨막힌다. 죽어나는건 직원들뿐.
146,에스케이바이오텍㈜,4535,1. 최소인원으로만 운영 2.통근버스없음 3. 근무 9시간 4.원세지원2년 (세금때야함) 5. 너무 공부해야할게 많다 6. 낮은 급여 7.생산직한테 다넘김 8.중소기업이란 생각이든다. 9. 영업이익도 잘나면서 돈은 적게준다.
147,에스케이바이오텍㈜,4535,연차 시 대근을 구해야되기 때문에 연차 쓰기가 어렵다. 아직 까지 체계가 잡혀있지 않아서 생산쪽에 많은 잡다한 일을 다 시킨다.
148,에스케이바이오텍㈜,4535,"하는일에 비해 급여 말도 안되게 적음, 기숙사 없음, 통근버스 있으나 주간 근무자들 전용(이게 말이되나???ㅋㅋㅋㅋ), 안그래도 월급 적은데 주거지원비 2년 동안 매달 20만원 지원해주는게 끝나면 이 급여에 어떻게 먹고 살고 어떻게 돈을 모아야할지 답이 없음 그렇기에 줄줄이 퇴사 및 퇴사 준비하는 분위기라고 생각, 말이 4조 3교대지 실근무 시간은 8시간 이상일때가 많음(이렇게 해도 월급은 답이없음), 군대문화는 몇몇 많이 좋아진 편이지만 아직도 몇몇 남아있고 신고해도 필요한 인력이라서 달라지는게 없는게 현실, 일이 위험하고 외워야할게 너무 많아서 스트레스 장난아님, 막상 하나의 아이템을 맡아 사수를 시키면 할 수 있긴 하지만 아직 준비가 덜 됐다고 생각하는 본인의 의지와 상관없이 그냥 시키는데 사고나면 책임추궁, 조금만 생각 잘 못해도 큰 사고가 될 수 있어서 뭐하나 제대로 못함 근데 그냥 시킴"
149,에스케이바이오텍㈜,4535,그냥 위에 장점쓰고 남은 나머지가 다 단점인 회사. 급여며 근무환경 근무시간 다 단점.
150,에스케이바이오텍㈜,4535,업무강도에 비해 낮은월급과 처우는 아쉬운 부분이다. 높은 퇴직율로 어제까지 함께 일하던 동료가 사라지는 신기한 경험을 할 수있다.
151,에스케이바이오텍㈜,4535,신생기업으로 기본적인 부분에 있어서 체계확립이 되지않음. 지속적인 보완필요
152,에스케이바이오텍㈜,4535,아직은 정밀 화학에 가까운 기업 문화와 인식 수준을 가지고 있어 원료 의약품 회사가 되기 위해 가야 할 길이 한참 멀은..또한 제약 산업에 대한 경영진들의 전문성이 많이 떨어짐.
153,에스케이바이오텍㈜,4535,말로 설명이 불가합니다 정말 사람을 대할 줄 모르는 회사
154,에스케이바이오텍㈜,4535,절차가 매우 많아 단순한 일도 복잡하게 처리되는 비효율성. 자유로운 분위기이나 혼자 모든것을 헤쳐나가야 함. 따라서 근무 시간 또한 본인하기 나름.
155,에스케이바이오텍㈜,4535,"현재, 성장하고 있는 기업이라 업무량이 많으며, 지속적으로 성장하기에 변동 가능성이 높다."
156,에스케이바이오텍㈜,4535,비젼만 보이고 사람들이 갈려 나간다. 3조 2교대 근무하면서 몸도 힘들고 정신적으로도 힘든 회사는 난생 처음이였다.
157,에스케이바이오텍㈜,4535,t직군과 b직군의 엄청난 급여차이와 급여체계 눈가리고 아웅하는 식의 월급 인상
158,에스케이바이오텍㈜,4535,전형적인 옛날사람들과 새로운세대의 불만 하지만 아무도 말을못함
159,에스케이바이오텍㈜,4535,대표이사가 문제입니다 얼마남지않은 목숨 연명하려고 말도안되는 운영하고있습니다. 사람들 엄청 퇴사합니다 퇴사하는 이유가 있겠지요?
160,에스케이바이오텍㈜,4535,일도힘들고 돈도안되고 사람때문에 힘듭니다  그냥 다 퇴사하고 저혼자 포장할게요..
161,에스케이바이오텍㈜,4535,급여 부분이 최악이다. 한창 바이오쪽으로 밀고 있기는 하나 처우개선이 언제될지 미지수
162,에스케이바이오텍㈜,4535,아직 신생에 기업의 역사가 오래 되지 않아서 체계가 덜 잡혀있으며 노조가 없음 기본연봉이 낮고 연차만 있고 휴가가 없음
163,에스케이바이오텍㈜,4535,동종업계 최하 급여 T직군 채용의 경우 전문대졸이든 대졸이든 모두 고졸대우
164,에스케이바이오텍㈜,4535,이게 중소기업인지 대기업인지 구분이 안감  이정도면 중소라고 볼정도로 체계가 없다
165,에스케이바이오텍㈜,4535,"SK계열사라고 하기엔 믿을 수 없는 임금때문에 야근이 그냥 일상화, 직군간에 보이는 벽이 있다. 벽을 숨기려고도 하지도 않는다. 기술직은 절대 위로 올라갈 수 없다 절대!"
166,에스케이바이오텍㈜,4535,계약직이라 느꼈을 수 있지만 그냥 정직원이 부러웠던거?
167,에스케이바이오텍㈜,4535,군대식 문화와 불필요한 작업 그리고 도급 업체를 정규직화 시켜주면서 직원간 갈등
168,에스케이바이오텍㈜,4535,체계가 잡히지 않고 기존 도급사원를 정직원화 해주었지만 차별은 그대로 남음
169,에스케이바이오텍㈜,4535,근무시간도 길고 워라벨 브레이커입니다. 체력에 자신있으신분은 들어가세요.
170,에스케이바이오텍㈜,4535,3조2교대 치고는 적은 연봉 잡일이 너무나 많다 인원이 너무 적다
171,에스케이바이오텍㈜,4535,일이 굉장히많고 잡무가어마어마하게 많음 잡무하다가 시간다보냄
172,에스케이바이오텍㈜,4535,연봉적음. 직군에 따라서 갭이 엄청나게 큼. 시험직군및 생산직군은 자기회사라는 생각이 없음.
173,에스케이바이오텍㈜,4535,단순노동이강요되고 텃새가 심해 이직률이 높고업무분장이 실시간으로 바뀜
174,에스케이바이오텍㈜,4535,매일이 청소이며 생산의 경우 다른 부서와 다르게 잡일을 많이함 예를 들면 생산뿐이아닌 설비 큐씨쪽일을 생산이 도맡아함 휴게시간이 제대로 보장 안됨
175,에스케이바이오텍㈜,4535,한명이 끌고 나가야 하는게 너무 많다. 정도껏이야 감당이 되는데 이건 질질 끌고가는 느낌밖에 안든다. 해먹는사람만 먹고 못먹는 사람은 못먹는다.
176,에스케이바이오텍㈜,4535,"장점을 상쇄하는 단점들, 중소기업 수준의 임금, 상여금, 워라밸 꿈꿀수없는 2교대, 군대식 분위기와 문화"
177,에스케이바이오텍㈜,4535,"도급업체를 전원 정규직화 하였다. 그리하여 생산직 내부문화는 말할것도 없다.. 심각한 수준이다. 근무환경을 포함하여 모든것이 대기업이라 볼수없고 도급업체에 머물러 있다. 위에서 개선할 의지가 보이지 않는다면, 생산직 인원들이 나서서 고치려고 해야하는데.. 그런의지는 전혀 보이지 않는다. 가장 심각한 문제이다.."
178,에스케이바이오텍㈜,4535,"급여가 아주 낮음. 알바 수준의 급여 기본급, 상여 모두 sk가 아닌 중소기업 보다 못한 수준"
179,에스케이바이오텍㈜,4535,*공조기가 설치 안된 공장은 여름에는 말도 못하게 덥고 겨울에는 말도 못하게 춥다 *주말/야간 근무시 모든 음식을 배달시켜 먹는다(품질은 식대가 만원인데 생산은 8000원) 생산보다 품질부서쪽을 더 챙기는게 아닌가 싶음 차별하나 생각도듬 *시설이 노후된 부분이 많다. *업무량이 많다 인원을 고려하지 않은 업무를 사무직쪽에서는 늘 요구한다 또 생산직은 어떻게든 그 요구를 들어준다 그래서인지 시키면 무조껀 하는구나 (되는구나)하고 업무를 계속 늘려주는거 같음 그래서 몸이 고되다 *사람 몸에 안좋은것만 다룬다 *급여가 낮다 일하는 시간이나 강도를 생각할시 급여가 낮다.
180,에스케이바이오텍㈜,4535,"잡무가 많다, 군대식 서열문화, 대부분이 계약직및 도급직 중소기업월급 잔업및 주말근무해야 돈이 된다."
181,에스케이바이오텍㈜,4535,군대식 조직문화 눈치보는곳. 직원을 노예로생각하고 나는 이랬는데 하는 꼰대 기질 여성을 우선시 하는 기업
182,에스케이바이오텍㈜,4535,직원을 노예로생각함 단점이 너무나 많은 군대식 위계질서
183,에스케이바이오텍㈜,4535,업무를 처리함에있어 문서화된 작업이 너무 많음 해외수출이 대부분의 매출이기 때문에 해외 헤더들의 공장 방문이 잦음. 중소기업 수준의 상여금.
184,에스케이바이오텍㈜,4535,빠르게 성장함으로써 생기는 간과하는 단점들이 있음. 예를들어 처리해야할 일은 많음. 사무직군은 유연 출퇴근 근무제이긴 한데.. 대게 늦게출근하고 늦게가며.. 따라서 일찍왔다 일찍가는 건 눈치가보임.
185,에스케이바이오텍㈜,4535,특정 취업사이트를 보고 플래닛을 봐도 누군가 포장을 하려고 하는데 일을 하기에는 너무나 힘든 회사 수평적이지 않고 무조건 적인 선후배관계에서 나오는 상명하복 군대식 문화와 신입으로 입사하게되면 잡일을 비롯한 입사순의 선배문화 일을 배우기보다 참기와 갈굼을 배우는 회사 내 주변 사람이 입사한다고 한다면 적극 말리기 위해 노력하게 만드는 회사 이름이 대기업일뿐 사내 문화는 중소기업 그 이하. 이름을 보고 입사하겠지만 실상을 안다면 후회를 하게될뿐 회사는 흑자일지라도 내 인생은 적자일 뿐 결정은 본인 탓이니 잘 선택하길...
186,에스케이바이오텍㈜,4535,업무강도 최상 급여 동종업계 비교 최하 (알바수준) 기숙사 제공 x 아직까지는 체계가 부족 현재 실상은 중소기업
187,에스케이바이오텍㈜,4535,생산팀은 아직도 노예일뿐이다. 일하는 거나 인정받는 거나 협력의 틀에 갖혀있다.
188,에스케이바이오텍㈜,4535,신설 법인이다 보니 체계를 갖추는데 시간이 소요될 것같다.
