,company_name,company_id,review_text
0,에스앤소프트,8204,성장하는 회사는 아님. 내 능력을 키운다거나 하는 것은 불가능함
1,에스앤소프트,8204,사장이 돌아다니면 직원들 무슨일하나 일일히 보고 물어봄
2,에스앤소프트,8204,"급여 수준이 낮으며, 능력의 유무와 관계없이 대표의 사적인 평가가 근무 환경을 좌우한다."
3,에스앤소프트,8204,대표의 관여가없으면 잘돌아가지만 너무 하나하나 간섭이많아 일에 진행이 더디고 엎어지는것도 많음 오전 다르고 오후 다르고 변덕이 죽끓음 회사행사 엄청많고 직원을 소모품이라 생각함 직원 투자대비 고효율이길 바람
4,에스앤소프트,8204,사원수가 15명 정도입니다. 너무 적어보입니다. 개인당 할일이 많을듯.
5,에스앤소프트,8204,첫째 - 경영지원팀은 그냥 상담 콜센터 직원임 회계업무 배우고싶으면 다른곳 가세요 가장큰 문제 - 사장이 문제임 아는거 쥐뿔없는데 아는척을 너무 많이함 혁신혁신 미래지향적 이러면서 너무 고지식하고 자기는 다아는것 처럼행동함 그리고 사장이 이부서 저부서 막 들쑤시고 다니고 옆에 와서 뭐하냐고 계속 물어보고 지적함 쓸데없이 회의를 자주하고 그냥 지 기분나쁘면 직원들한테 뭐라함 솔직히 사장은 하는거 없고 아는것도 별로 없고 싸인만 하는 사람임 어느 중소기업이나 그렇겠지만 사장이 문제임
6,에스앤소프트,8204,"한달에 1번 첫째주 월요일에 월례회의(업무끝나고) 6시에 시작하여 언제끝날지 모른다. 인사발령 - 승진을 해도 연봉추가는 없고 연봉협상때만 연봉이 늘어난다. 점심비 지원이 없다, 전화가 자주오는편(개발자제외), 회계를 할줄 알아야 편한업무"
7,에스앤소프트,8204,돈을 너무 적게주고 주말지원이 빈번하다 사장님이 무섭다
8,에스앤소프트,8204,개발 회사인데 개발자가 적고 오래다닌 사람이 많음 영업위주의 회사라고 볼 수있다.
