,company_name,company_id,review_text
0,에스케이바이오텍㈜,4535,급여가 짜다고 생각하며 사내 문화가 별로 인것같다고 생각함
1,에스케이바이오텍㈜,4535,회사에 월급 루팡들이 많음 그로 인해 인원 대비 업무량이 많다고 느껴짐
2,에스케이바이오텍㈜,4535,회사 위치상 너무 시골에 있어서 주변 인프라가 부족하다.
3,에스케이바이오텍㈜,4535,"서울, 경기권에 기업이 위치해 있지 않고, 세종, 대전 지방에 있다는 점이 가장 큰 단점."
4,에스케이바이오텍㈜,4535,노동강도 높은편에 속함 교대근무였었는데 3조 2교대였으나 교대근무 형태 지금은 바뀌었겠죠?
5,에스케이바이오텍㈜,4535,큰 변화가 없어 다들 단조롭게 일함 조직 내외로 커뮤니케이션이 잘 안됨
6,에스케이바이오텍㈜,4535,세종 외진곳에 위치했고 대중 교통으로 출근하기 어렵다. 연봉 기본 급여가 적다
7,에스케이바이오텍㈜,4535,급여가 최저시급과 맞먹는곳. 시골에 위치해 미혼인 경우 사람 만나기 어려움. 자차 없이 출퇴근 어려움. 밥 맛없음.
8,에스케이바이오텍㈜,4535,급여가 만족스럽지 못합니다 그리고 일하는 사람은 죽어라하고 노는 사람은 죽어라 노는 경우가 있어요
9,에스케이바이오텍㈜,4535,"안정적이여서 고인물이 많음 유연하지 않은 체계, 하던 업무 변경 없음"
10,에스케이바이오텍㈜,4535,인사과의 칼부림 협의 따윈 찾아볼 수도 없고 3교대에서 2교대 전환 후 급여 많이 감소함 그러나 인사과에서는 2교대 전환 후 전반적으로 구성원 급여 감소함으로 자기들이 포상받는 아이러니한 부서임. 즉 구성원 월급 깎아먹는게 자기들 일 인듯
11,에스케이바이오텍㈜,4535,"급여가 너무 적음, 그리고 교대조로 인한 삶의 루틴이 불균형 함"
12,에스케이바이오텍㈜,4535,업무 실수에 대한 압박감이 크다. 일이 많다. 교대근무는 힘들다.
13,에스케이바이오텍㈜,4535,업무량이 많고 그에 비해 연봉이 적다...... 야근 수당은 있지만 야근도 많았던..
14,에스케이바이오텍㈜,4535,"업무 체계화 안됨. 서로 떠넘기기 바쁨 관리직들의 무능력함과 본인들 챙기기에 바뻐 고위 간부들 눈치만 살피고, 밑에 직원들은 나몰라라 고된 업무량에 비해 턱없이 부족한 연봉. 내 아이템하기 바쁜데 다른 일로 자꾸 빼감 그래놓고 공정은 완벽하길 바람, 집중을 못하게 자꾸 밖으로 보내버리면서 공정 빵꾸나면 탓하기 바쁨. 화나서 여기서 그만 마무리"
15,에스케이바이오텍㈜,4535,타부서간에 갈등이 매우 빈번함 시골에 있어서 문화생활 누리기 어려움 복지가 부족함
16,에스케이바이오텍㈜,4535,고인물들의 자리를 차지하고 있는 경우와 일부 강압적인 메니져들의 행동이 문제
17,에스케이바이오텍㈜,4535,"교대 근무, 자차 없이 출퇴근이 힘든 곳, 잡일이 너무 많다, 구성원간 존중이 부족한 것 같다."
18,에스케이바이오텍㈜,4535,대기업인줄알고 들어왔는데 그건아님 좋은중소중견까진모를정도? 포지션이 애매함 연봉상승률 에바 23년 기본급상여+뭐하나더 해서 7프로오름 꼰대가 있음(다행히 뒷말은 안나옴) 주력아이템 특허권이 몊년안남았는데 그거 다음 아이템을 구상이 안된거같음 고정아이템을 밀고가야할거같음 더이상의 발전은 모르겠음
19,에스케이바이오텍㈜,4535,대기업치고 만족스럽지못한 급여 사소한 것들도 많지만 사실 가장큰부분을차지
20,에스케이바이오텍㈜,4535,규모가 작고 신규 사원들이 없어 고여가는듯 보임 앞으로 더 발전하려면 많은 채용이 필요할듯 인력이 부족해서 다들 고생
21,에스케이바이오텍㈜,4535,파이 자체가 아직은 영세하기 때문에 파생되는 수익도 어쩔수 없...
22,에스케이바이오텍㈜,4535,전반적으로 인력부족 신입사원이 없어서그런가 다 고인물만 있어서 인력충원이 급하다 한명이 한명이 맡는 업무가 너무 많아보임 체계가 있다가도 없음 인센티브에 치중한 급여
23,에스케이바이오텍㈜,4535,일단 돈이 가장큰 문제인데.. 저는 현장에서 닿기만해도 손이 녹아내리는 산성물질을 고무장갑하나끼고 투입하는데.. 제 친동생이 편의점에서 콜라 바코드찍고 파는데 시급/ 급여가 비슷한거 보고 때려치우길 맘먹었습니다.. 나는 황산뚜껑따서 설비새척하는데.. 황산과 콜라가 같은건가 .. 라는 착각을 하게되네요..
24,에스케이바이오텍㈜,4535,다른 부서는 모르겠는데 제조기준 노동 시간에비하여 귀여운 수준의 급여
25,에스케이바이오텍㈜,4535,급여가 적다.간판은 좋은데 그에 비해 손에 들어오는건 없다 대기업이지만 규모는 중소기업이라 시에서 운영하는 혜택들을 누릴 수가 없다.
26,에스케이바이오텍㈜,4535,세종시 변두리에 위치해 접근성이 좋지 못함. 임금 수준이 동일 산업 분야 다른 업체 대비 아쉬움. sk를 달고 있으나 중소기업스러운 부분이 많음. 중간 지주사에 휘둘림
27,에스케이바이오텍㈜,4535,"노동강도 최상, 예전 삼구아이앤씨 아웃소싱 직원들이 자리잡고 있어서 그렇게 업무 배울때 좋은 편이 아님"
28,에스케이바이오텍㈜,4535,일반적인 SK는 아님. 월급여가 짬 성과급은 괜찮음 (성과가 그렇게 크지않아도 성과급 %가 높음. 기본급이 짜기때문) 모회사에서 자꾸 쥐어짜려고 함. 사업 자체가 요새 잘나가는 바이오는 아님
29,에스케이바이오텍㈜,4535,"급여, 또 급여 세종 사업장의 경우 기숙사 없음. 또한 꼰대 문화 존재합니다."
30,에스케이바이오텍㈜,4535,.연봉상승률이 조금 미흡함. .복지는 많지만 사실상 사용하는건 몇 가지 없음. .인력 채용을 너무 안함.
31,에스케이바이오텍㈜,4535,사업장 위치가 수도권이 아니다보니 우수인력 소싱에 애로가 있지않나 싶습니다. 극복할 대안을 고민해 봐야하제 싶습니다.
32,에스케이바이오텍㈜,4535,입사 시 연봉 후려치기가 심함 입사 후 연봉 점프가 어려움 (사실상 불가)
33,에스케이바이오텍㈜,4535,걍 꼰대도 많은대 좋은사람도 많아서 이건 사람마다 다름니다
34,에스케이바이오텍㈜,4535,잡다한 업무 많음 교대근무 필수 낮은 연봉(진짜 낮음) 자차 필수
35,에스케이바이오텍㈜,4535,다양한 업무를 접할 수 있는 것 같지는 않다. 고정 제품군이 없어 단기간의 프로젝트성 업무. 업무 대응으로 워라밸 보장 어려움.
36,에스케이바이오텍㈜,4535,"일안하려고 삐대는 종특 몇명, 구닥다리 꼰대마인드 몇명, 만 개선 되면 더 좋아질듯. 그리고 효율도 좋지만 너무 작은 땅에 공장을 올려서 빽빽함.. 설계상 효율이 그닥 좋다고 생각하지 않음"
37,에스케이바이오텍㈜,4535,월급이 진짜 쥐꼬리만 함. 대기업 다니는데 월급 들으면 다들 놀람
38,에스케이바이오텍㈜,4535,세종시에서 너무 멀리 떨어진 위치에 공장이 있기 때문에 주변에 은행이나 음식점 등 뭐가 없다.
39,에스케이바이오텍㈜,4535,"업무 강도가 다소 강하며, 야근 초과 근무에 있어서 약간은 무덤덤한 분위기를 가지고 있었습니다."
40,에스케이바이오텍㈜,4535,부바부 고생하는곳은 업무난이도가 꽤 심함 더울때 덥고 추울때 추운 느낌
41,에스케이바이오텍㈜,4535,야근이 많으며 이유 없는 야근이 많음. 해외 수출을 하다 보니 계속 생산을 하여 바쁨 하지만 나름의 여유가 있음
42,에스케이바이오텍㈜,4535,멍청한 사람들이 많다 삼구 출신 사람들이 아직도 협력업체 마인드.
43,에스케이바이오텍㈜,4535,Sk계열사중 최변방으로 속은 곪음. 어떤부서는 팀장때매 팀원 80프로 나가도 아무도 신경안쓰는 대충대충가는 회사
44,에스케이바이오텍㈜,4535,나라에서 주는 연차를 눈치보게 만듬 강제아닌 강제대근 사람이 없으면 휴가를 못가게함 그럼 더 뽑던가
45,에스케이바이오텍㈜,4535,연봉이낮고 상승률낮음 공장이 외지에있음 세종 너무멈...
46,에스케이바이오텍㈜,4535,주변이 공단이여서 퇴근하고 여가생활이 다소 불편할 수 있음
47,에스케이바이오텍㈜,4535,아직도 대기업이라고 하기에는 조금 모자라고 개인성장이 힘듬
48,에스케이바이오텍㈜,4535,1년에 1번 나오는 성과금 빼면 편의점 알바랑 그닥 급여가 차이가 없습니다. 그나마 성과금도 윗머리부터 돌려먹는식이라 차등이 너무 심합니다.
49,에스케이바이오텍㈜,4535,"연봉, 타부서와 사이 안좋음 세종사이트 복지 매우 줄어있음 입사 년도에따라 복지다름"
50,에스케이바이오텍㈜,4535,아직 커가는 회사이므로 복지가 조금 부족한듯 해요 ….
51,에스케이바이오텍㈜,4535,"쓸데없이 평가 한다고 만들어놓은 쓸데없는 것들이 많음 시험,제안 등등 생산팀을 아직 하청보듯이 행동하고 생각하는것들이 많이 보임"
52,에스케이바이오텍㈜,4535,연봉이 적음 적어도 너무 적음 과장이 5천밖에 안됩니다.
53,에스케이바이오텍㈜,4535,"경영진 중 몇몇은 꼰대성향. 특히 사람관리하는 높으신 분, 본인이 엄청 잘나신 줄 알고 본인말만 주장하지 마시고, 사람들에게 전투적으로 대하지 마세요"
54,에스케이바이오텍㈜,4535,기본급이 낮음 대신 성과급으로 커버됨. 윗사람들이 고인물임. 학벌이 중요함
55,에스케이바이오텍㈜,4535,전체적인 시스템이 없고 주먹구구식이다. 문제가 생기면 다들 나몰라라하고 담당자가 어떻게든 처리한다
56,에스케이바이오텍㈜,4535,다른 계열사 대비 연봉이 적다 위치가 세종 변두리리서 교통이 불편하다 이직이 쉽지 않다 산업 태생적으로 갑질을 받게된다
57,에스케이바이오텍㈜,4535,"형평성을 잃은 평가제도, 급여, 고여버린 윗사람들."
58,에스케이바이오텍㈜,4535,"변화하고 있지만 여전히 급여가 낮다, 정치질이 존재, 인력부족"
59,에스케이바이오텍㈜,4535,"급여수준이 상당히 낮은편. SK그룹내에서는 최하인편이고 중견기업들이랑 비교해도... 제약자체가 영업 외에는 급여가 작은편이고(국내제약사 한정), 그나마도 제약사가 아니라 CMO이기때문에 국내에서 비교대상으로 삼을 곳이 없어서 더 그런듯하다. (직원들이 나가도 갈 곳이 별로 없음) 회사가 작아서 그런가? 구성원간에 견제가 은근히 심하다. 정치질도 은근히 심하고...이건 부바부 사바사... 아닌 부서도 있다고 한다."
60,에스케이바이오텍㈜,4535,24시간 교대근무제가 존재함 주말 명절 공휴일 그런거없음 그에 비해 연봉은 업계 최하위
61,에스케이바이오텍㈜,4535,복지는 좋지만 급여가 다른 회사에 비해 적은편 중견기업 보다 못함. 그리고 노친내들이 많아 역 피라미드 구조임. 노채내들 일도 인하고 몸만 사리기 때문에 잘 안돌아감
62,에스케이바이오텍㈜,4535,중소기업연봉 혹은 그이하의 급여. 교대근무임에도 답없는 급여로보인다
63,에스케이바이오텍㈜,4535,급여... 기본급.... 너무 할정도임 여기가 sk가 맞나 싶을정도
64,에스케이바이오텍㈜,4535,생산직원들을 너무 막대하는듯 하청으로 시작해서 그런지 아직까지는 생산직을 짬처리반으로 생각하는것 같다... 타 부서 인력없으면 항상 생산직원들이 처리함. 인력이 부족해도 생산은 충원할 생각이 없음.
65,에스케이바이오텍㈜,4535,"평생해야하는 교대근무, 급여, 인력부족, 하계휴가, 등등 끝도 없음"
66,에스케이바이오텍㈜,4535,사람이 없어서 생산직에서 사람이 한명이라도빠지면 업무에 차질이생김 그런대도 사람을안뽑아줌 대기업이라고는하지만 월급이 적음 Sk공채 인원이랑 예전 삼구시절 꼰대들과의 기싸움이 상당하여 협업이잘 안됨
67,에스케이바이오텍㈜,4535,수직적이고 예전 문화가 살짝 남아있지만 점점 고쳐가고 회사가 점점 젊어지고있음
68,에스케이바이오텍㈜,4535,아직은 낮은 연봉이 단점이지만 점차 개선되어 질 것으로 보인다.
69,에스케이바이오텍㈜,4535,체계적이지 못하여 업무가 과다함 연봉이 낮음 직원들의 윤리의식이 낮음
70,에스케이바이오텍㈜,4535,"연봉적음 관리할줄 모르는 답정너 관리자들이 앉아있어 직원들만 고생. 업무 분배가 매우 잘못됨. 시키는 사람만 시킴.성실한 사람들만 불쌍. 개인을 존중해줌. 여기가 사회가 아니고 학교인줄 알고 다니는 고인물 직원들이 몇명 있음. 그로인해 피해보는 직원이 있음 눈가리고 아웅 . 어쩔수 없다는 마인드 관리자의 능력이 턱없이 부족...  위의 단점들은 직원들이 다 아는 문제이지만 관리자가 모르는것 자체가 문제인듯 한데, 모르는건지 모르는 척 하는건지 궁금함... 심지어 그 관리자를 바꾸려는 의지도 없어 보임.."
71,에스케이바이오텍㈜,4535,최소인원으로 빽빽하게 회사가 돌아간다 연차쓰는게 눈치보인다 윗사람들이 너무 보수적인 생각만 가득하다
72,에스케이바이오텍㈜,4535,연봉 적음. 직군간 보이지 않는 벽이 있음. 규모를 늘리면서 경력직분들이 헤드로 많이 왔음. 경력직들이 전문성은 없고 줄세우고 아부하기에 바쁨. 일을 하는 사람만 함.
73,에스케이바이오텍㈜,4535,매우 일이 힘들고 사람이 부족했음..꼰대문화도 있음..
74,에스케이바이오텍㈜,4535,"수직적 군대 문화, 낮은 급여, 들어와도 자주 나가는 직원들, 2교대 근무, 당연히 해야되는 야근(아예 오후부터 일시작하는 사람도있음)"
75,에스케이바이오텍㈜,4535,적은연봉. 적은연봉을 야근수당으로 매꿈. 야근필수로 하는 분위기. 근무시간에 할수있는 업무양을 야근해야되서 천천히 일하는 분위기. 워라밸 절대 불가능.
76,에스케이바이오텍㈜,4535,여름휴가가없다 도입하는데 사측에서 싫어하는 입장이다. 설추석 명절시에 쉴 수 없다. 설비는 24시간 돌아간다.
77,에스케이바이오텍㈜,4535,"동종업계대비 최하위인 급여. 업무숙련도를 쌓는게 너무 힘듬. 온갖 잡무를 떠넘기기바쁘고, 업무 떠넘긴채 책임전가가 심함"
78,에스케이바이오텍㈜,4535,"단순 작업이 많으며, 하는일에 대해서 책을 보고 따라 하는 느낌을 가질수 있음. 경험은 많으나 단순 행동 많음,"
79,에스케이바이오텍㈜,4535,교대지만 정시출근 정시퇴근 보장 청소안함 직군에따라 다름 무조건 교대해야함 조금 피곤함 일이 빡셈 FM대로 일하는사람만 오래남을 수 있음
80,에스케이바이오텍㈜,4535,일은 너무 많은데 일이 너무많아요 하지만 급여는... 안타까울 따름입니다.
81,에스케이바이오텍㈜,4535,1. 일이 힘듬 포장..허리디스크 초기 인사람 많음 2. 인수인계시간 길다( 안고쳐짐 ) 3. 급여가 낮다 (인상률도 낮아서 과장달아도..) 4. 아마 지금 남아있는사람들은 근래에 결혼하고 버팀. 5. 스펙좋은데 남아있던사람 안타까웠다.
82,에스케이바이오텍㈜,4535,비효율적인 근무. 전원이 교대근무. 고인물들이 너무많음.
83,에스케이바이오텍㈜,4535,주간조로 들어와서 교대 업무를 해야한다. 규정이 너무 타이트하다. 연봉이 높지 않다.
84,에스케이바이오텍㈜,4535,연봉이 높지 않은 편. 회사가 대전에서 세종으로 이전하여 접근성이 아쉬워짐
85,에스케이바이오텍㈜,4535,교대근무로 인한 피로도 상승과 어마무시한 업무량.. 감당불가
86,에스케이바이오텍㈜,4535,대기업 계열사라고 복지 너무 기대하면 실망함. 일부 윗사람들의 업무처리 능력이 다소 의심스러움.
87,에스케이바이오텍㈜,4535,역시나 급여 부분에서는 타 회사에 비해 적은편이다. 주간이나 교대나 타 회사에 비교하면 아쉬운게 사실이다.
88,에스케이바이오텍㈜,4535,비합리적인 인사평가제도. 도대체 인사팀은 뭐하는걸까?
89,에스케이바이오텍㈜,4535,연봉이 너무 극단적으로 문제가 있다.. 알바수준의 연봉을 지급한다. 더 큰 문제는 진급을 해도 급여차이가 없다.. 최악이다.. 10년을 일해도 알바랑 급여차이가 크지 않다는 말이다
90,에스케이바이오텍㈜,4535,잦은 업무 연락. 어느 기업이든 마찬가지겠지만 일을 하는 사람만 함
91,에스케이바이오텍㈜,4535,1 월급이 적음 하지만 적은 만큼 일도 괜찮음 2 세종으로 이전하고 있어서 세종은 자차 없으면 힘듬 3 세종 밥이 맛없음 4 교대함 4조 2교대로 안바꿔줌
92,에스케이바이오텍㈜,4535,"회사 입사자체부터가 단점임 군대식문화, 회사내에 차없으면 밖에 나가기 참 힘듦 부지가 넓어서"
93,에스케이바이오텍㈜,4535,과장들이 많아서 꼰대가 많음 모범이 되었으면 좋겠음 .
94,에스케이바이오텍㈜,4535,낮은임금 그마저도 더 못 깎아내려서 안달난거 처럼 어떻게든 임금 조금이라도 덜 받게끔 하는거 같음 그냥 개인적인 느낌
95,에스케이바이오텍㈜,4535,박봉 경력인정 안해줌 회사에 피 빨리는느낌 나는 몸이부서질거가틈 잦은 실사와 엄격한분위기
96,에스케이바이오텍㈜,4535,교대근무인데 9시간 근무함. 생산직과 사무직 사이에 보이지 않는 벽이 존재함. 공채인원과 비공채 인원 사이에도 마찬가지
97,에스케이바이오텍㈜,4535,그냥 생산이 노예인 회사 어딜가든 업무 떠 넘겨지며 특히 품질이 일 해야하는 부분 들을 다 생산이 일하고 있음 또한 일 강도에 대한 낮은 급여 등 ..
98,에스케이바이오텍㈜,4535,왠만한 단점도 급여 앞에서 무의미 복지 포인트 월급 성과금 이외에는 아무것도 없다
99,에스케이바이오텍㈜,4535,"단순 보고를 위한 문서작업이 많아 비효율적, 대기업에 비해 낮은 연봉, 52간은 어디? 잦은 야근, 여름휴가 없음"
100,에스케이바이오텍㈜,4535,월급 적음 연차 못씀 너무나도 위험한 화학물질이 너무 많음 덥고 추움 현장직 사무직 차별이 너무 심함 성과금이 너무 들쭉날쭉함 취급하는 원료 중량물이 200kg평균 염산99%과 황산99%비중이 이렇게 나랑 가까이있는 물질이었나 하는 생각을 하게됨
101,에스케이바이오텍㈜,4535,대기업 계열사임에도 불구하고 처우 및 근로환경의 열악함
102,에스케이바이오텍㈜,4535,세종 변두리에 자리잡고잇어서 교통편 주변 제반시설 없다고보면됌
103,에스케이바이오텍㈜,4535,교차로 신문보고 입사도 아니지 삼구애들 그냥 면담하고 삼구 다니게 되었다고 들었는데 갸네들 보기에 인적성보고 면접보고 입사한 애들 얼마나 샘나겠음 입사하면 같잖은 군대문화 시작함 조장위에부터 삼구딱지 달았던 애들이 다 눈감아줌ㅋㅋ 입사하면 나름 경력에 자격증갖고 들어가서 몇달간 쓰레기청소만 함 삼구에 인성빻은애들 있는데 갸네들은 그냥 이유없이 갈굼 아주 개쓰레기들임 ㅋ 삼구애들 덕분에 가끔 한번씩 찾아봄 얼마나 잘나가나 보려고 요세도 급여 낮다는데 아주 좋음 그냥 노예들처럼 굴렸으면ㅎㅎ
104,에스케이바이오텍㈜,4535,단점은 기업의 이익이나도 근로자들에게 그만큼 돌려주지않습니다.
105,에스케이바이오텍㈜,4535,"세종,대전지역에서 받기에는 턱없이 작은 급여 개인적으로 이정도 급여면 지방 소도시에서 근무해야 된다고 생각함"
106,에스케이바이오텍㈜,4535,조직간의 경계가 애매할 정도로 R&R정립이 잘 되어있지 않음
107,에스케이바이오텍㈜,4535,처음 신입으로들어가면 할일이 너무많음 군대적문화가존재해 막내가 해야되는일이있어 처음 입사하는거라면 잡일한다고 일을못배움 다른회사보다 생산쪽힘이약해 하라는대로다하고 심지어 노조도없어 노예그자체
108,에스케이바이오텍㈜,4535,연차쓰기 눈치보임 야근 강조하지는 않는데 눈치보임 업무중 스트레스를 많이 준다
109,에스케이바이오텍㈜,4535,"너무 많아서 나열하기 힘들다. 그냥 높은 사람들만을 위한 회사 실무자 배려 없음 연봉 바닥임 SK아님 그냥 편의점 알바수준, 그리고 군대보다 더 군대같은 조직문화 나같음 군대 한번 더 갔다옴, 친구에게 추천해주면 절교임"
110,에스케이바이오텍㈜,4535,타계열사대비 작은회사라 팀장TO가 별로없어서 진급에 연연한다면 힘들수 있습니다.
111,에스케이바이오텍㈜,4535,박봉에 급여인상률도 낮고 상여금도 낮은데 업무강도는 강함. 외주맡기던 거에서 정규직으로 전환한거라 간판은 sk 실상은 중소기업.
112,에스케이바이오텍㈜,4535,"B직군을 위한 회사, T직군 말을 듣는 사람들도 있고 반영해 주려하지만 아예 윗선에서 생각 자체를 안하는 것 처럼 느껴지게끔 말하고 행동함"
113,에스케이바이오텍㈜,4535,첨에 미래를 보고 입사함. 입사하고 현실 직시 회사가 좋아진대도 처우는 안좋아질뿐 나아질기미 안보임. 회사 애사심 생길수가 없는구조
114,에스케이바이오텍㈜,4535,"체계가 없고, 눈치를 많이주며 업무세분화가 안되어있어 새롭게 배우는 일이 많음. 또한, 구성원들의 불만에 있어서 형식적인 모임등으로 때우며 해결방안은 없음."
115,에스케이바이오텍㈜,4535,아직까지는 도급업체의 한계에서 못벗어남 문화도 그대로 가져가려하고 꼰대가 너무 많음
116,에스케이바이오텍㈜,4535,업무가 집중 됨 이전계획이라 어떻게 변할지 모름. 세종이전 후 환경 적응시간이 필요해 보임. 운전원들의 불만이 많음
117,에스케이바이오텍㈜,4535,복지 외에는 열약한 급여수준..최저시급을 약간 넘는 급여..
118,에스케이바이오텍㈜,4535,일이 너무 많다. 생산직원에 대한 대우가 좀 부족하다.. 미래 발전 가능성은 있겠지만 그 때까지 내가 버틸 수 있을지 모를 회사
119,에스케이바이오텍㈜,4535,여름휴가 없음. 연봉 최저 신입기준 잔업 안하면 200안됨.
120,에스케이바이오텍㈜,4535,"낮은연봉, 체계적이지 못한 시스템, 무늬만 대기업인 낮은연봉"
121,에스케이바이오텍㈜,4535,기본급여가 너무 낮기때문에 다른 불만이 생길 수 밖에 없는 구조
122,에스케이바이오텍㈜,4535,상여성과금이 다른 sk계열사에 비해 적음 계열사중 하위계열사라고 생각하면됨
123,에스케이바이오텍㈜,4535,너무 일이많음 진짜..................일이 많고 많고 많고 또 많음
124,에스케이바이오텍㈜,4535,기존 도급사원들을 정규직화 해준것도 사실 외국계 고객들이 꾸준히 클레임을 걸었기때문 ..ex도급직원들이 관리하는데 품질이 관리가 되느냐등등.. 그래서 기존 Sk정규직들과 도급에서 정규직된이들이 차별을 받음
125,에스케이바이오텍㈜,4535,대기업이지만 얼토당토않는 상여금? 생산직원에 대해서 특별하게 생각않는듯한 행위..... 말만 휴게시간이라고 하지만 특별한 휴게시간도 않지키는 회사 바쁜게 좋은거라고 하지만 너무 바뻐서 4조 3교대를 하면서 몸이 축나는 느낌이 든다.
126,에스케이바이오텍㈜,4535,퇴근시간이 자유롭지 않다. 잦은 야근. 그에 반해 급여는 너무 적음.
127,에스케이바이오텍㈜,4535,적은 연봉과 부서간의 협업이 잘 안되며.....세종 시골로 이사감
128,에스케이바이오텍㈜,4535,가르쳐 주는 사람 없이 실험만 반복하는 회사. 향후 세종쪽으로 옮긴다고 함(시골쪽에 위치.) 그리고 돈이 매우 적음.
129,에스케이바이오텍㈜,4535,'돈' 솔직히 조금만이 아니라 많이 올려주셨으면.. 회사에서 하라는거 잘 하고 제시한 목표에 다달하면 우리도 원하는걸 좀 들어줬으면...제발... 급여와 복지을 요구하면 엉뚱하게 동아리 활동을 지원하며 여러분의 요구사항을 반영하였습니다...이러시지 않으셨으면...ㅠㅠ
130,에스케이바이오텍㈜,4535,체계가 아직 덜 잡혀져있는 느낌이 듦. 경영진과의 소통이 잘 안되는 것 같음.
