,company_name,company_id,review_text
95,에프엔씨엔터테인먼트,11818,보고를 위한 자료가 많다 아티스트가 많아서 업무가 많다
96,에프엔씨엔터테인먼트,11818,"1. 사내 밥먹을 곳 없음. 사내에 밥먹는곳 없고, 팀이랑 꼭 나가서 같이 먹으라고 함. 한끼에 15000원 정도 나가는 곳을 매일 가고 식사지원비 이런거 없음. 연봉이 낮으면 식비라도 주던지. 따로 도시락이나 김밥으로 해결하게끔 자유시간을 주던지.  2. 꼰대.갑질 경력 서열정리가 안돼서 경력 인정받고 들어와도 인턴이랑 경력 더 낮은 사원이 꼰대질해도 우쭈쭈 방관하는 상사  3. 비효율적 업무. 야근 해당 부서랑은 관계없는 불필요한 업무를 무작위로 주면서 야근하지말라더니 집가서 할수밖에 없는 구조. 퇴근 후 집에서 근무. 주말 근무. 공휴일 근무. 회사에 몸이 없다고 일을 안하는게 아님  4. 이외에도 단점밖에없다"
97,에프엔씨엔터테인먼트,11818,"모든 엔터업계가 그렇듯, 평일/공휴일 구분 없이 항상 일하고 있는 기분. 왜인지 모르겠지만 퇴근 찍고 야근하라고 함...ㅎㅎ 야근수당이라곤 없다. 일부 팀 별 경쟁? 텃세? 어느정도 있음 고인물들의 파티"
98,에프엔씨엔터테인먼트,11818,"구구절절 말하기도 입아프다. 소속 아티스트는 많아서 할건 많은데 인원은 없고, 일은 죽어라 하는데 보람은 없다."
99,에프엔씨엔터테인먼트,11818,가끔 이해하지 못하는 업무들이 있고 고인물의 집합소라 그들에게 잘못보이면 고생길이 열림
100,에프엔씨엔터테인먼트,11818,분위기를 흐리는 고인물들이 너무 많다. 엔터가 다 똑같다고는 하지만 일하는 만큼의 성과가 전혀 주어지지 않는다.
101,에프엔씨엔터테인먼트,11818,텃세도 있었고 저연차한테 매우 불친절한 회사였다.. 구성원 소통방식이 매우 중구난방이었고 필요없는 페이퍼워크 및 보고 회의 등등 효과없는 프로세스 너무 많았음.
102,에프엔씨엔터테인먼트,11818,확인받아야할 사람 눈치봐야할사람 너무 많다. 스스로 자신있는 업무라도 나중엔 자존가 자신감 하락한다. 모든 상황이 그렇게 만든다
103,에프엔씨엔터테인먼트,11818,"단순 보고를 위해 서류 작업이 너무 많으며 비효율적인 보고 방식, 엔터테인먼트치고 보수적인 회사 분위기, 팀간 정치질"
104,에프엔씨엔터테인먼트,11818,꼰대문화가 남아있어 업무 인수인계 과정에서 말도 안되는 고집을 부릴때가 있음
105,에프엔씨엔터테인먼트,11818,연봉이.. 말도 못하게... 짭니다... 엔터치고도 짠편이어서 좀..
106,에프엔씨엔터테인먼트,11818,"새로운 것을 가져오라고 하지만 결국 윗분들 취향에 맞는걸로 가다보니 결과물은 늘 거기서 거기인 느낌 텃세같은 조직 문화를 묵인하는 윗선 일이 겹치면 미친듯이 바쁨 언제 무슨 연락이 올지 몰라서 늘 휴대폰 붙잡고 살아야 하며 외출 할 때에도 노트북 들고 나가야함 아티스트가 많아서 해야 할 업무가 많음 한 사람이 해야하는 일의 범위가 방대하고, 다들 바쁘다보니 가르쳐줄 사람도 없어서 신입사원이 처음에 입사하면 멘붕의 연속 스트레스 받아서 여기저기 아픔"
107,에프엔씨엔터테인먼트,11818,업무량이 굉장히 많아서 그룹의 활동기간중에는 일과함께 퇴근가능
108,에프엔씨엔터테인먼트,11818,"커피가 맛이 없고, 소문이 너무 많고, 고인물들이 힘듦, 아티스트 맘들도 꽤 있는 듯"
109,에프엔씨엔터테인먼트,11818,"나이 불문 꼰대가 한 둘이 아님. 꼰대질, 정치질 못버티고 나가는 사람 여럿 봄. 오고 가는 뒷담화로 친목 도모하는 경우 수도 없이 많이 봄. 한 귀로 듣고 한귀로 흘리기 힘든 성격이라면 심각하게 입사를 재고려 해보길."
110,에프엔씨엔터테인먼트,11818,비전이 딱히 없어보이고 더크기는 힘들것같음.......
111,에프엔씨엔터테인먼트,11818,대부분의 엔터테인먼트의 고충이 다 그렇든 일단 여초직장에 연예인들이 있으니 견제 엄청나다. 특히 윗선의 연예인 집착은 미저리 수준
112,에프엔씨엔터테인먼트,11818,복지가 하나도 없고 연봉이 작아도 너무 작다 위에서만 다 해먹고 실무진은 고생만 한다 직원들을 위한 복지가 진짜 없다 회사 위치가 애매하다
113,에프엔씨엔터테인먼트,11818,승진이 힘들고 고인물들이 진짜 많아서 텃세문화 심하고 내가 제일 이회사 이 연예인 제일 잘안다는 자부심들 내세우기 경쟁이 심하다
114,에프엔씨엔터테인먼트,11818,복지 제도 전혀 없음. 인센티브 전혀 없음. 휴가 볼때 눈치 봐야함. 핸드폰 붙잡고 살아야함. 여초 회사. 차라리 꼰대 회사가 더 좋은거 같습니다. 직장 내 괴롭힘 있음. 회사 종교있음.
115,에프엔씨엔터테인먼트,11818,부서에 따라 다른 것 같다. 상사가 좋으면 그나마 보람있음
116,에프엔씨엔터테인먼트,11818,연봉이 낮다. 입퇴사자가 많아 업무의 안정성이 떨어진다. 있어보이는 척하지만 뭐가 없다.
117,에프엔씨엔터테인먼트,11818,젊은직원이 많음에도 생각보다는 자유로운 분위기가 아니다. 연봉이 적은편이고 수직적 분위기다. 퇴사율이 높다.
118,에프엔씨엔터테인먼트,11818,인원이 좀 부족한 느낌도 듦. 사무실이 팀별로 좀 다른 건물에 떨어져있늠.
119,에프엔씨엔터테인먼트,11818,보고가 많아서 문서 작성 작업이 많고 여기저기 컨펌 받을 곳이 많다
120,에프엔씨엔터테인먼트,11818,1. 살인적인 근무시간(케바케) 2. 동종업계에서는 적을지 몰라도 일반 기업에 비하면 낮은 연봉 3. 답 없는 고인물들 4. 진급이 느림 (팀바팀) 5. 회사가 외진 곳에 있음
121,에프엔씨엔터테인먼트,11818,직원이 앞으로 어떻게 경력을 개발하고 회사의 어떤 비전을 보고 일할지에 대한 고민이 잘 안 느껴집니다 직원이 회사를 더 좋아하도록 부탁드립니다
122,에프엔씨엔터테인먼트,11818,보수적이고 트렌드에 뒤쳐짐 엔터 특성상 흐름을 앞서거나 적어도 흐름을 읽고 편승이라도 해야하는데 이곳은 뒷북이 특징이다
123,에프엔씨엔터테인먼트,11818,매니지먼트 내 고위간부들이 밑에 직원들의 고충에 관심이 없고 자기 밥그릇챙기기 바쁨. 고이다 못해 썩어들어가는중. 다양한팀이 있어 그만큼 업무량이 많고 피곤함.
124,에프엔씨엔터테인먼트,11818,성장가능성이 보이지 않음. 안일한 컨셉에 사건사고도 많고 신인들이 터지지 않음. 또 인맥 믿고 일하는 사람들이 보임.
125,에프엔씨엔터테인먼트,11818,"부서마다 야근 비중 천차 만별, 부서간 소통이 좀 안됨(기싸움 있음), 내부 인력으로 제작이 안되서 외주쓰려고 하면 돈때문에 스트레스 엄청 줌, 다 좋은데 가사...가사가 문제임..."
126,에프엔씨엔터테인먼트,11818,타 부서 직원분들도 대부분이 퇴근을 늦게 하는 모습을 많이 봄
127,에프엔씨엔터테인먼트,11818,선배텃세를 엄청부리고 현장을 가도 일에 참여하기 불편하고 어렵다.
128,에프엔씨엔터테인먼트,11818,아티스트 맘들이 너무 많아 애정도에 따른 업무 차이가 생김
129,에프엔씨엔터테인먼트,11818,회사 사이즈에 비해 낮은 연봉과 사람을 아쉬워하지 않는다
130,에프엔씨엔터테인먼트,11818,신입 매니저는 그냥 운전기사나 매한가지... 매니저 업무를 배우려면 최소 3년 이상은 버텨야 가능함.
131,에프엔씨엔터테인먼트,11818,"정신적으로 스트레스를 받고 병 얻기에 딱 좋은 구조. 그 어떤 밝은 사람도 다니면서 에너지를 잃고 극한의 우울감을 경험할 수 있음. 있는 듯 없는 듯 조용히 다니는 게 본인에게 득이 되는 회사. 극폐쇄적인 조직문화 때문에 배울 수 있는 게 없음. 싸바싸바로 승진하는 구조상 무능력한 상사가 많음. 신입으로 들어가서 일을 배우면 다음 회사에서 욕 먹으면서 다시 일을 배워야 할 정도로 주먹구구식으로 운영됨. 겉보기에는 번지르르한 상장사이지만 체계는 없음. 일이 터졌을 때 각자 책임 회피하기 바쁨. 팀장들은 자잘못 따지기 바빠서 사원들이 독박 쓰고 책임지는 형태를 꽤 자주 볼 수 있음. 사람이 많아서 구설수도 많고 심지어 경영진들도 일개 사원 뒷담화하기에 바쁨. 시대가 변했다는 걸 알면서 시대에 맞추면 예술을 할 수 없다는 구시대적 우월주의에 빠져 있어서 발전할 가능성은 제로. 본인들은 매우 트렌디하다고 생각하지만 사실 2,3년은 뒤쳐져있음. 엔터에 원대한 꿈이 있어도 꼰대문화에 가로 막혀 아무 것도 할 수 없는 게 현실. 경영진들이 생각을 바꾸지 않는 이상 이곳에 발전은 없고, 미래도 없음. 과거의 영광에 심취해서 한 치 앞도 보지 못함."
132,에프엔씨엔터테인먼트,11818,체계적이지 못한 업무처리와 아무의미없는 불필요한 회의 단합되지않는 개인주의
133,에프엔씨엔터테인먼트,11818,"보고를 위한 보고, 어쩔 수 없는 주먹구구식 쓸데없는 페이퍼 작업 많음 적은 인원으로 너무 많은 아티스트를 굴려서 실무진만 죽어남"
134,에프엔씨엔터테인먼트,11818,야근 많습니다 각 팀간에 쓸모없는 기싸움이 많습니다 뒷말이 많고 소문도 많습니다 어느 역에서 내리던 위치가 애매해서 많이 걷던가 버스 타야 합니다
135,에프엔씨엔터테인먼트,11818,"안정성을 추구하는 만큼, 혁신이 부족하다는 생각이 듬. 위험한 시도는 하지 않는다. 평균 혹은 그 이상의 결과물은 나오지만 시장을 선도하는 무언가를 도출해내기는 힘들어 보인다."
136,에프엔씨엔터테인먼트,11818,"직원 수에 비해 강한 업무 강도, 잦은 퇴사와 야근, 점심식비 미제공"
137,에프엔씨엔터테인먼트,11818,"최저급 돈,워라밸 없음,커리어 노쓸모,인맥 노쓸모,무능력 팀장, 볼 연예인 조차 이제 없는 엔터 업계에 대표 초상집"
138,에프엔씨엔터테인먼트,11818,업계순위가 애매해서 상위권 연예기획사와의 경쟁이 치열한 것 같습니다
139,에프엔씨엔터테인먼트,11818,직원들에 대한 복지 및 급여 수준은 굉장히 낮은 편에 속한다고 생각함. 서두에서 말했듯이 연예인 위주의 회사임. 높은 직원 회전율을 통해서 알수있는 대략적인 분위기
140,에프엔씨엔터테인먼트,11818,보고를 위한 문서작업이 정말 많아 본인의 업무를 하기도 전에 문서작업에 지치는 경향이 있음. 다소 오래된 사무실과 높은 퇴사율로 인해 정이 없고 매우 딱딱한 분위기
141,에프엔씨엔터테인먼트,11818,부서별 소통이 전혀 되지 않아 기본적인 업무 보기도 힘든 상황
142,에프엔씨엔터테인먼트,11818,일이 매우 비효율적이고 체계적이지 않고 야근은 매일 있음
143,에프엔씨엔터테인먼트,11818,"낮은 급여, 위치, 복지, 성장성 낮음, 가족회사, 젊은 꼰대들이 맞음, 위치, 비싼밥값, 아침에 예배드리고,"
144,에프엔씨엔터테인먼트,11818,"오래 일하지 않아서 말하긴 어렵다. 부서별로 차이도 있겠으나 사실 신입을 체계적으로 가르칠 수 없는 시스템이 많음. 커뮤니케이션도 힘들고, 진짜 별로인 부분은 사람들이 있었던 것 같음. 소속부서 외에는 사실 좋은 분도 많은 것 같은데 우선 친해질 기회가 별로 없었음."
145,에프엔씨엔터테인먼트,11818,"많은 업무량, 불규칙한 퇴근시간, 신입사원들이 자리잡기 힘든 구조 성과금이없고 열심히해도 보람있지않음."
146,에프엔씨엔터테인먼트,11818,※ 비합리적인 보고 체계 과-팀장급에서 컨펌할 수 있는 건 좀 그냥 넘기면 좋은데 SNS 멘트까지 임원진 컨펌을 받아야 함 컨텐츠 하나 열기까지 지나치게 많은 컨펌라인으로 매번 오픈시기 늦어지고 일 못한다는 소리만 들음  ※ 돈을 쓰지 않고 새로운 컨텐츠를 만들기를 요구함  ※ 지나치게 많은 페이퍼작업 맨날 뭐만 하면 페이퍼 만들어서 가야하고 모니터링팀이 있는데 모니터링 보고서를 부서마다 따로 만들고 있음 폰트 색깔 수정해달라마라 내용은 안 보고 자잘한 요구가 많아서 이거 하는데 하루 다 감  ※ 아티스트 엄마 많아서 상호 협조가 안됨 엄마들이 너무 많아서 일 한번 하기 쉽지 않음 아티스트에게 다이렉트로 뭔가 요청하면 사방에서 클레임 특히 기획팀이 심함 어쩌다 아티스트와 얘기만 하고 있어도 바로 고나리 걸려오고 사내에 이상한 사람으로 소문남  ※ 아티스트에 맞는 기획을 하는게 아니라 지들 마음에 드는걸 하는 느낌이라 아티스트 캐릭터가 없음
147,에프엔씨엔터테인먼트,11818,사람이길 포기해야함 노예 혹은 시중드는 사람으로 등극 보수적임 엄청 보수적임 새로운 아이디어는 원하면서 아이디어를 제시하면 받아들이지 않음
148,에프엔씨엔터테인먼트,11818,"이름있는 회사치고는 연봉이 적고, 일단 워라벨이란 단어를 꺼낼 수 없음. 바쁠때는 주말은 물론 새해 첫날도 나가야 함."
149,에프엔씨엔터테인먼트,11818,"고인물로 인해 업무처리 효율 낮음. 특정부서 직원들끼리 앞에선 안 그런척 하지만 뒤돌아서면 뒷담화가 엄청 심하고, 텃세 굉장히 심함(남직원들은 모르겠으나 여직원들의 텃세 엄청남). 전형적인 가족회사이고 보수적이며 소위 말하는 꼰대문화 존재. 워라밸 하나도 챙길수 없음. 잦은 야근에 주말출근까지 해야함 업무강도에 비해 현저히 낮은 연봉. 퇴사율이 높은데 왜 그런지 알것같음."
150,에프엔씨엔터테인먼트,11818,엔터 업계 답게 주말 없음. 퇴근 시간 정해진 것 없음.
151,에프엔씨엔터테인먼트,11818,기획사 특유의 약간의 top down 방식 존재. 엔터 답게 수시 야근과 주말 출근은 당연히 많기 떄문에 완벽한 주5일 근무는 불가능.
152,에프엔씨엔터테인먼트,11818,운영이 체계적이지 않음. 업계 특성상 적은 연봉과 복지. 직원들의 잦은 이직. 수직적 커뮤니케이션
153,에프엔씨엔터테인먼트,11818,업무 체계가 합리적이지 않음. 쓸데없는 보고 체계가 많은 편
154,에프엔씨엔터테인먼트,11818,"비합리적인 인사평가 제도 낮은 연봉, 포괄임금제, 야근많음 잘하면 윗분덕 못하면 나때문 결과만 중시 욕심많음"
155,에프엔씨엔터테인먼트,11818,다양한 일을 경험하는게 장점이지만 그만큼 힘듬. 엔터테인먼트가 대체로 그렇듯 야근 매우 많음.
156,에프엔씨엔터테인먼트,11818,대한민국 3대 엔터사를 목표로 하는 회사치고는 직원 복지가 너무 안좋음. 각 부서간 친밀도도 낮은 편이고 일부 부서들은 성비율이 한쪽으로 심하게 치우져있어 특유의 군기 문화가 심함. 대중들에게 회사의 이미지가 굉장히 안좋음에도 일부 고위 간부들 중에 현실파악 못하는 분들이 좀 계심.
157,에프엔씨엔터테인먼트,11818,"여성 위주의 군대 문화, 임금을 뛰어넘는 주말을 포함한 매일의 일과 야근, 직원의 열정 탓만 하는 윗선, 투자없이 트렌드 따라가기에 급급함"
158,에프엔씨엔터테인먼트,11818,사람. 사람이 제일 무섭다. 임원 한 분이 열 몇명을 내보낸거지? 난 인계도 못 받았었는데.
159,에프엔씨엔터테인먼트,11818,업무가 굉장히 비효율적으로 흘러가고 야근 많음 워크앤라이프밸런스가 아니라 그냥 워크밖에 없음 연봉은 이거 받고 이렇게까지 일할 바에야 알바하는 게 훨씬 나은 수준 잦은 야근과 과한 업무량은 좋은 사람도 나쁜 사람으로 만듦 소속 연예인에 대한 팬심이 있는게 아니면 힘듦
160,에프엔씨엔터테인먼트,11818,연봉이 너무 적고 직원들이 실제로 누릴수 있는 복지가 거의 없음
161,에프엔씨엔터테인먼트,11818,여긴 퇴사자가 많은 정도가 아니라 팀 자체가 소멸되는 수준으로 팀장급부터 막내까지 줄줄 퇴사함. 퇴사의 이유가 단순히 일이 많고 힘들어서가 아니라는 걸 좀 알았으면 좋겠음.  뒷소문과 뒷담화가 많고 종종 그런 소문들이 오피셜하게 인사를 평가받고 연봉 협의하는 자리서 확인하듯 나오기도함. 정말 그런말 들을때마다 동아리 같아서 환멸남. 전문성 없는 헤드들 앉혀놔서 실무자만 더 힘들게 만들고 업무상 어떤 실수나 잘못 생기면 팀끼리 책임전가하기 바쁨.  사람 얘기를 안듣는 정도가 아니라 정말 무시함. 심지어 퇴사하겠다고해도 무시함. 퇴사하겠다는데 그 다음달에 승진을 시켜놓질 않나. 퇴사할건데 왜 승진됐는지 물어보면 승진했는데도 퇴사할거냐 이런식임. 에휴 진짜 답답~
162,에프엔씨엔터테인먼트,11818,"0점을못준다는게 화가날정도 직급놀이하는회사 타부서에대한 뒷담화 최고 앞에선웃고있음 직원들이 자진퇴사 강제퇴사 빈번함 직원에대한 사랑x 각부서에 고위직과 관련된 대표 가족과 친구가 꼭 있음 직급이 위인분들 대부분 꽉막히고 보수적인 문화 사무직원도 개인시간 절대없음 감시까지함 오래된비품(컴퓨터,사무용품,창고) 건물외부는멋지나 안전상 문제도있고 건물안에서 쾌쾌한냄새남 전직원 평균 근속년수 1년정도 될까말까임 생활되기에는 힘든 연봉 (모든엔터가그렇지만)"
163,에프엔씨엔터테인먼트,11818,다른 회사에까지 소문나있는 빡셈과 꼰대문화. 보고를 위한 보고 & 일을 위한 일. 후배 아티스트들 실적 좋지 않음. 다른 부서 협조받기 어려움. 신입이건 경력직이건 다들 힘들어하지만 막상 회사는 인력 귀한 줄 모름.
164,에프엔씨엔터테인먼트,11818,근무환경이 생각보다 열악합니다. 급여수준이 타 업종에 비하여 낮은 편입니다.(엔터업계의 공통점) 이직율이 높은편입니다.
165,에프엔씨엔터테인먼트,11818,젊은 사람들이 많다... 이게 들어가면 처음엔 장점 같음. 근데 팀장 과장급이 다 젊은 사람들... 과연 이게 뭘 말해 주는 것일까 생각해보길 바람....미래가 보이지 않았음.
166,에프엔씨엔터테인먼트,11818,"매니지먼트,경영부서는 수직적구조 심각 군대식문화가 심함 강요하고 자유로운분위기라하지만 말뿐이고 이기적보수적분위기 뭐하나 하더라도 급하게진행 형식상 맞추기임 웃으며 일하는분위기아님 고생하다 나가고 험한꼴당해나가고 더러워서나가고 좋게 나가는사람들이없었음 각자 꿈만꿀뿐이지 전혀바뀌지않음 사장의 가족과 친인척들이경영하는거라 안보이지만 뚜렷한 라인이 있음 직원들끼리사이가 형식적인 관계 좋은사람은좋지만 단지비즈니스관계라보임  콘텐츠팀은 직원들끼리 사이가좋기도해서 수평적구조 하지만 잦은야근 쉴틈없는 업무량 일에비해 보상은없음 아이디어 기획해서 제출하면 한번이라도 한번어 통과되지못하여 야근이 일주일중4번이상 물건하나사더라도 결제받기힘듬 주말근무 빈번히있고 외근하고나서도 회사왔다가 퇴근해야함 부서특성상 여자가많아 소문은빠름 타부서,회사운영이야기 개인이야기까지도 소문빠르게탐, 시기질투가없고 여자팀장,여자대리들이 사원들을다독여주고 엄마같은역활을잘해주며 꿈을가지게해주는모습 보여주기도함 그래서그런지 직원들끼리사이가 좋고 젋은부서가많음"
167,에프엔씨엔터테인먼트,11818,"보고를 위한 시간낭비, 주먹구구 시스템으로 중요한걸 놓침"
168,에프엔씨엔터테인먼트,11818,"결제받기도힘들고 부서들간사이가 안좋은경우가끔보임 근속수가 타엔터보다 낮은이유가 뚜렷히보임 전부서가 사람을 소모품 취급 , 3개월후 버려지는 사람들많음 이유도가지각색 대표중인이유는 안맞다싶으면 버리고 끝없는업무량에지쳐 퇴사도많음, 개인생활없음 주말도종종호출함 상여급없음 오래된 물품 사용할수없는물품 교체가필요해보임"
169,에프엔씨엔터테인먼트,11818,복지 별로 없음 사무관련 용품은 주문하려면 상무님 허락 받아야된 뜻 야근하는 경우는 많음 야근 수당을 별도 지금하지 않음
170,에프엔씨엔터테인먼트,11818,퇴사하는 많은 사람들이 어떤이유로 그만두는지 충분히 알지만 쉽게 바뀌지 않는 환경.
171,에프엔씨엔터테인먼트,11818,주어진 업무를 위해 야근이 잦다 승진를 기대하기 힘들다 각자의 부서에서의 업무가 다 다르지만 직원이 자주바뀜
172,에프엔씨엔터테인먼트,11818,부서마다 다른분위기 칼퇴..? 업무량이 많음.. 연예인과 직원은 다른개념? 회의 공간이 없는 편 여자들끼리는 경쟁하고 시기하는게 가끔보임 기독교 살짝강요
173,에프엔씨엔터테인먼트,11818,눈앞의 상황에만 바라보는 업무처리로 큰 비젼을 바라보기 힘듦 사내정치와 줄타기가 심함
174,에프엔씨엔터테인먼트,11818,보이지 않는 정치적인 서열이 존재함. 알아서 상황 판단 하여 잘 행동 해야함
175,에프엔씨엔터테인먼트,11818,"내 개인 삶을 포기해야함, 턱없이 낮은 연봉, 열정페이 강요함"
176,에프엔씨엔터테인먼트,11818,하지만 환기시설 부족 장소 부족 공간 활용이 잘 안됨 사람을 잘 못뽑음
177,에프엔씨엔터테인먼트,11818,잦은 야근 사람들도 텃세가 좀 심함 분위기가 너무나 삭막함
178,에프엔씨엔터테인먼트,11818,"주말근무에 대한 대체휴무를 사용할 수 있지만 바빠서 사용하지 못하는 경우가 많고, 연차 사용도 비슷합니다. 열심히 일해도 보상받는다는 기분이 전혀 들지 않습니다. 정치질이 없으면 인정받기도 어렵고, 연봉도 낮은편입니다."
179,에프엔씨엔터테인먼트,11818,사생활이 없을 정도의 업무량과 그에 비해 턱없이 낮은 연봉이 큰 단점
