,company_name,company_id,review_text
0,에프앤가이드,8586,너무 많음 인사팀때문에 잘하는 사람이 다수 나감 잘 모르는 사람때문에 피해를 보고 일처리가 하늘로 감
1,에프앤가이드,8586,가늘고 길게다니려는 마음가짐으로 임하는 사람들이 있음
2,에프앤가이드,8586,칼퇴근 할 수 있으나 칼퇴근을 맨날 하면 팀장이 싫어함. 사적인 일이 인사고과에 반영되는 것 같음. 감정적으로 일하는 윗사람들이 있음. 일 적당히 할 수 있지만 이 때문에 일 많이 하는 자와 안 하는 자로 양극화 되어 있다. 일 안 하는 자에 대한 케어가 부족해 일 많이 하는 자들의 불만이 많은 것 같음. 연말 주식 휴장일에 강제로 휴가 쓰게 함. 강제가 아니라고 하는데 분위기는 반 강제임. 휴가 안 쓰고 싶으면 출근하는 사유가 있어야 됨. 매년 KPI 일정 빡빡하게 짜는데 다른 업무도 많이 시킴. 다른 팀과 KPI가 맞물려있지 않기 때문에 요청사항에 민감하게 반응함. 의견이 항상 열려 있다고 하지만 상부에서는 하부에서 올라오는 의견에 네거티브하게 반응하는 면이 있음. 적당히 본인 의견 없이 시키는 것만 하고 다닐 수 있는 소극적인 사람들에게는 오히려 좋은 듯.
3,에프앤가이드,8586,지난 수 년간 추진하던 모든 신사업들 모두 말아먹었거나 말아먹는중. 그럼에도 정신 못차리고 아직도 헛된거에 돈 쏟아붓는중. 기존 사업 하던거나 해야지 하는 수동적이고 열정없는 고인물들만 남게되고 진취적이고 본받을만한 직원들은 대리정도되면 대부분 도망감. 그래서 일 안/못하는 직원들이 특히 많으며 주니어임에도 업무가 엄청나게 많을 수 있음. 고인물들이 딱히 할게 없다보니 사내 정치와 경영권 분쟁 등이 자주 발생하며 최근들어 더 심해지고 있는 추세.
4,에프앤가이드,8586,안정적이라서 크게 성장 할 일이 없다. 크게 성장할 먹거리를 찾아야 한다.
5,에프앤가이드,8586,업무를 하려면 매뉴얼이 아닌 사람을 통해서 과거의 업무 히스토리를 찾아보고 일을 진행해야하는 구조. 매뉴얼이 없으니 일의 진행이 더딤.
6,에프앤가이드,8586,빨리쳐내야하고 정신없이 돌아가는 업무 무엇을 위한 회의인지 많은 회의(실무업무 관련 말고..)
7,에프앤가이드,8586,새로운 사업이나 신규 매출이 될만한게 안보임 또한 이것저것 일은 벌리고 접고의 반복
8,에프앤가이드,8586,건물 내 환기가 잘 안되는 구조인데 공기청정기가 없어서 불편했음
9,에프앤가이드,8586,신 사업 및 성장에 대한 의지가 부족 시니어로 갈수록 성장에 대한 의지가 없는 사람들만 남게 되어 신 사업 및 공격적인 마케팅이 제한됨
10,에프앤가이드,8586,수평적인 회사를 지향하고자 하지만 수직적임. 다들 나태하게 일하는 경향이 있어서 개인이 노력하지 않는다면 발전하기 어려움.
11,에프앤가이드,8586,중소기업에선 나름 좋은 연봉이지만 금융회사 연봉 생각하면 ㅠㅠ
12,에프앤가이드,8586,여의도에 있었으면 더 좋았을 것 같습니다. 이직하는 사람이 많습니다. 자기개발에 대한 필요성
13,에프앤가이드,8586,점심시간이 한 시간 반이어서 그만큼 퇴근 시간이 늦어지는게 별로였음.
14,에프앤가이드,8586,"마곡 특성상 식사비가 비싼데 식대 미지급, 연차 외 여름휴가 등 부재"
15,에프앤가이드,8586,능력이 많은 사람들이 많아보이진 않는다. 실제로 능력이 있다 하더라고 그게 발휘되고 않는 것처럼 느껴진다.
16,에프앤가이드,8586,미래 먹거리를 아직 정확히 찾지 못했음 거래처들이 힘든 시기에 같이 힘들어서 차세대 먹거리가 필요함 그에 대한 대처가 미흡
17,에프앤가이드,8586,아직 이렇다할 신사업이 잘 되고 있는게 없음 새로운 매출을 발생시키지 못하고있음
18,에프앤가이드,8586,보고(회의)를 위한 보고(회의)가 매우 많음. 신사업 몇년째 하는것마다 빼놓지않고 모두 꾸준히 말아먹는중 열려있는척 하지만 엄청 보수적이고 꽉막힌 경영진 보상체계는 공무원급 노나먹기수준 아님말고식의 결과만 요구하는 내리꽂기식 업무지시 도깨비방망이 찍듯이 말만하면 다 되는줄 아는 IT지식없는 윗선 중간관리자는 다 퇴사하고 없어서 방치된 신입사원들. 그중에서 살아남은사원들은 퇴사자들의 일만 더 받아서 만능 멀티가 됨
19,에프앤가이드,8586,복지가 많지 않음 수직적인 조직문화 업무 외에도 회사행사로 인한 일들이 종종 있음
20,에프앤가이드,8586,1. 대표를 비롯한 윗 쪽이 꽤 보수적이다. 2. 연봉 상승률이 높지는 않다. 3. 수익이 꽤 오래 안나는 부서를 버릴 줄 알아야하는데 그러지않아서 다른 부서에서 버는 비용이 밑빠진 독에 물붓기로 오래동안 나가고있다.(시장 점유율도 처참하고 해당 본부 인원들도 왜 이회사에 그부서가 있는지 납득못함.) 4. 두 대표중 한 명은 밑사람들의 의견을 잘 경청하지 않고 다른 대표는 경청하지만 건의해도 달라지는게 없다.
21,에프앤가이드,8586,복지제도가 좀더 확충되었으면 하는 바램이 있습니다. 근무시간도 조금 더 자율적이었으면
22,에프앤가이드,8586,낮은 연봉. 꼰대 보수적 그룹 존재. 거듭 실패하는 신규 사업. 주 사업의 경쟁력 의문.
23,에프앤가이드,8586,업무분장이 공평하지 않아 업무가 특정인들에게 쏠려있는 경우를 어렵지 않게 볼 수 있움. 워라밸을 바라고 들어온 사람이 자칫 운나쁘면 실망과 현타가 올 수 있음. 일반 직장인으로서는 나쁘지 않지만 금융업계에 비하면 여전히 비교적 낮은 수준의 연봉. 묘한 사내정치 기류가 존재
24,에프앤가이드,8586,고였다고 해야할까 미래가 불투명함 바쁜 부서는 매번 야근의 연속임
25,에프앤가이드,8586,"- 회사의 성공은 임원의 덕, 실패는 직원의 무능력이 되는 회사 - 직원이 많지도 않은데 회의 많고 보고 많고 자료작성 많음 - 연봉, 승진 등 공정하지 않음"
26,에프앤가이드,8586,업무가 제대로 체계화되어있는지가 의문이다. 하나의 대상에 대해 갑론을박 하시는 경우가 많고 재수없으면 그 수정사항들 다 고쳐야한다
27,에프앤가이드,8586,급여가좀짜고 임원급 이사이상? 능력이없어보인다 근데회사룰오래안다녀서 잘모른다
28,에프앤가이드,8586,사업의 레거시. 새로운 먹거리부족. 일부 꼰대 마인드의 상사
29,에프앤가이드,8586,진급시를 제외하고는 극악의 연봉 상승률을 자랑한다. 연봉이 많아서 상승률이 극악인것도 아니고 연봉도 작은데 상승률이 극악이니 연봉통보가 기대도 안된다.
30,에프앤가이드,8586,"잦은 조직개편과 인사발령, 결정된 사항도 윗사람말에 따라 계속 바뀌는 일, 비효율적인 업무시스템, 일부 주먹구구식으로 진행되는 프로젝트"
31,에프앤가이드,8586,"업무 시 업무분장과 스케쥴이 잘 논의되는 경우도 있으나 일정이 촉박하게 진행되는 개발, 기획, 신규사업 업무가 많음.  신사업, 통합업무 등으로 다양한 일이 동시다발로 진행되어서 그런 경향이 있는듯...  신사옥이 마곡에 위치하였는데 교통편이 다양하지 않음. (버스 노선도 비교적 적어보임)"
32,에프앤가이드,8586,"실무에 대한 고려와 인력 충원, 장비 투자 그리고 뚜렷한 비젼 없이 그냥 아무 신사업을 빠른 시일내에 만들어 공개하라하는 경영진의 마인드, 그래서 어쩔 수 없이 보여주기식으로 만든 신사업이 대부분. 사원, 대리가 줄퇴사하는 환경. 성과에 비례하지 않는 연봉과 성과급. 말도 안되는 매출목표 설정 후 달성 못했다고 평가등급 후려쳐서 성과급 후려치기."
33,에프앤가이드,8586,"부서 내는 수평적이지만, 상부의 지시는 상명하복임. 왜 이렇게 해야하는지 이해할 수 없는 지시에 대해 설명을 하기보단 그냥 하라고 하는게 다수."
34,에프앤가이드,8586,"알바라고는 하지만, 진행 상황에 대해 업데이트를 해주면 조금 더 일을 수월하게 할 수 있었을 것 같음"
35,에프앤가이드,8586,움직이지 않는 회사. 자기 발전이 가능할지 잘 모르겠음
36,에프앤가이드,8586,사옥위치가 안좋음 연차가 높은 사람이 많음 수직적인 문화
37,에프앤가이드,8586,주먹구구식 업무진행과 무의미하고 반복적인 업무들로 인해 야망있고 스펙좋은 직원들은 어느정도 경력 쌓이면 바로 나감. 핵심인재들이 나가려하면 붙잡지도 않을뿐더러 그들의 빈자리를 또다른 쌩신입으로 충당하여 기존 직원들만 계속 죽어나는 구조(중간위치의 직원이 없음) 고인물들은 더욱 더 고여가고 연차 짧은 사원들은 언제든지 나갈 준비중. 이때문에 회사에서도 평범한 직원들을 좋아하며 일잘하고 열심히 하는 직원은 별로 키울생각이 없음
38,에프앤가이드,8586,금융데이터 다루는 회사치고 급여가 좀 많이 적은 것 같음
39,에프앤가이드,8586,회사가 강서 구석에 있어 차량이 필요하나 주차비 지원 없음.
40,에프앤가이드,8586,상하관계가 다소 경직되어 있고 다양한 의견을 듣고자하는 자세가 좀 부족함
41,에프앤가이드,8586,지인 추천 입사 및 강남 인근 거주자 많음 또는 장기근무자 이렇다보니 같이 일하는 사람들이 발전적인 태도가 없거나 업무역량이 부족함 물론 통장에 찍히는거 보면 그만큼만 일하는게 맞음
42,에프앤가이드,8586,"제공되는 데이터중 실제 본인들이 생성한 것 중 성공한게 몇가지가 있을지 의문인 회사. 성장가능성, 발전가능성 낮음"
43,에프앤가이드,8586,합병하고서는 조금 분위기가 달라진듯. 가족같은 분위기는 사라지고 있는 듯
44,에프앤가이드,8586,사람을 갈아 넣는 부분이 아직도 존재함 정체되어있는 부분이 많음
45,에프앤가이드,8586,실무를 모르는 윗사람들이 많음. 비합리적인 인사평가제도. 나름 티타임 등으로 분위기를 부드럽게 풀어보려고 노력하는듯 하나 참여하지 않는 팀도 매우 많음. 경직된 분위기가 만연함.
46,에프앤가이드,8586,스스로 찾아서 해야하는것이 많은편. 체계가 확실히 잡혀있지는 않은거 같다. 업무분담등
47,에프앤가이드,8586,탑다운 방식의 일방통행식 의사소통 구조 연봉인상률이 높지않음
48,에프앤가이드,8586,"조직문화에 배타적인 분위기가 있음. 본인이 기존에 수행하던 업무만 수행하려고 하고, 신규 업무 혹은 누구 업무라고 하기 애매한 업무의 경우에 적극적으로 나서는 분위기 미약함. 아마도 그래서 대부분 칼퇴가 가능한 듯."
49,에프앤가이드,8586,"수평적인 조직문화를 추구한다고는 하나 권위적인 모습은 여전히 존재함. 기관컨설팅 및 펀드평가팀은 잦은 야근과 업무량에 비해 급여가 짬. 최근 회사에 2개의 DBMS를 통합한다 했으나 2개의 DBMS 그대로 유지하는 모양새. 기존업무 + 신규프로젝트 업무로 업무량 과다 IT인력들 어찌 버티는지 모르겠음. 인덱스의 경우 인력들의 능력대비 급여가 매우 낮으며 정규직/병특 혼용이나 정규직의 경우 인력+사람 문제로 인력교체가 매우매우 많이 이루어짐, 병역특례라는 고급인력을 싸게 구할 수 있어보이나 최근에는 막상 급여보고 안오고 핀테크로 대부분 감, 땜빵식 인력운용으로 결국 퇴사자에게 원격접속이나 업무 알려달라고 퇴사 후에도 고통을 줌. AI팀을 신설했으나 해체되고 다시 신설한다 하는 것 같음. 기존 급여테이블로 딥러닝 엔지니어를 데리고 올 수 있을지 의문임. 데이터팀 여초인데 군기문화가 심한편. 솔루션팀 및 밸류팀은 당연하겠지만 파견업무가 많으며 고객사한테 시달리는 경우 허다함."
50,에프앤가이드,8586,"경영지원쪽은 소통이 되지 않고 단순 업무인데도 결재 올리는 과정과 승인 어려움. 비협조적인 태도를 보이며 비용청구나 건의사항을 쉽게 올리지 못하는 분위기를 자체적으로 만듦. 일처리 매우 느림. 갑질하려는 경향. 겉으로는 열린 문화를 지향하는 듯 하나...겉 보이기식. 진정한 복지를 위한 길을 멀음. 짜잘한 행사식/ 일회성 복지는 그만하길 국내 인덱스 사업 유일한. 병특 고급인력을 정기적으로 소비하며 연명. 최근 정규직을 충원하는 듯하나 일과 사람이 힘들어 퇴사율 높음. 이직시 경력으로는 좋음 데이터팀. 여초, 여군기 문화 최고, 1팀과 2팀이 있는데 1팀은 와이즈출신, 2팀은 에프앤가이드 출신. 데이터통합 아직 무리, 팀에 남자는 한명 다 여자. 전문대나 이름 모를 대학 나온 출신이 많음. 있다면 서울 중하위 대학 정도? 하지만 소수. 본인보다 스펙이 높은 아랫 직원이 오며 찍어 누르기식. 우는 여자사원들 많이봄. 복장과 화장에 대한 검열. 앞과 뒤가 다르고 특히 뒷말이 많음. 반복 업무 최고. 몰려다니기 편가르기. 낙인효과. 본인 고과챙기기 위해 아랫사람을 돌보지 않음. 경쟁구도. 금융아이티 관련 솔루션이나 아이티팀? 금융경력력을 쌓기에 좋음. 실적?압박이 있음. 야근을 좀 함. 프로젝트성 업무 경우 파견도 많고 힘듦. 중요인력이탈이 여태까지 있어왔고 그로인해 금융지식에 무지한 아이티 인력들이 경력만 달고옴. 소통제로 경력에 비해 초라한 업무능력. 고인물들이 많고 그로인한 정체성. 부당한 일이 있어도 단순 징계로 끝내거나 묻히기 쉬움 금융관련 교육사업을 하려는거같은데 코로나로 인해 관련 강의가 어려운듯. 펀드평가 사업. 적자사업. 일이 힘들어서 그만두는 사람이 더러있음. 과도한 가격경쟁으로 시장을 점유하려 함. 성장성 의문. 기관컨설팅의 경우 작은 기관위주로만. 펀드평가본부는 다른 회사같음. 경쟁사에서 인력을 데려오는 듯하나 잘 모르겠음."
51,에프앤가이드,8586,고인물들이 많음. 그들 위주로 돌아감. 늘지도 줄지도 않는 매출.
52,에프앤가이드,8586,임원이 넘많음 합병이슈로 두벌로 일해야함 일은 케바케임 수평적 문화를 지향하나 현실은 수직적 답정너임 비전이 없음 핀테크 회사로의 발전을 기대하는데 갖춰진게 전혀 없음 진심 걱정됨
53,에프앤가이드,8586,"아주 큰 단점으로 체계가 없음. 합병하면서 업무가 뒤죽박죽되고 거의 모든팀에서 업무공유 및 인수인계가 제대로 이루어지지 않았음. 두 회사 출신 직원끼리 서로 무슨일 하는지팀내에서도 잘 모름. 따라서 각 본부마다 퇴사자 및 부서이동자가 버리고 간 주인없는 붕~~ 떠있는 업무가 굉장히 많았음. 할줄 모르지만 얼떨결에 아무나 줘버리고(상대적으로 팀장/본부장 파워가 약한 다른 팀에 강제로 줘버리기도 함ㅋ) 그러다가 신입사원이 오면 이때다 싶어 몰아서 왕창 줘버림. 그야말로 극한의 카오스 상태. 그러거나 말거나 경영진/임원들은 앞만 보고 달리고 있음. (그러나 2년 새 철저한 공무원집단이 되어버려 실무진들은 앞만보고 달리는 경영진들을 따라갈 생각이 전혀없음) 이사업저사업 하고 싶어서 일은 벌려놨으나 수습은 안되고 그에 따라 돈 못버는 유휴인력(팀)이 좀 있음. 그래서 매 인사이동 시즌때 그 유휴인력이 이팀저팀에 꽂힘. 합병 후 물리적 결합은 이루어졌으나 화학적 결합은 요원한 현실. 거의 모든 팀들이 이러한 상황이라 책임감따위는 개나줬음. 일 남아있어도 걍 칼퇴하는 사람많음 ㅋㅋ 관리자 입장에서는 복창터지는 상황이지만, 괜히 불러다가 뭐라하면 그만두고 나가버릴까봐 제대로 타이르지도 못함. 고로 팀끼리도 일이 몰리고, 팀내에서도 특정인원에게 일이 지나치게 몰림. 어떤팀은 늦게까지 야근하는데 어떤팀은 이미 퇴근 30분전부터 집갈준비함. 따라서 일을 하며 자아를 찾겠다거나, 이 업계에서 나는 프로가 되겠다, 혹은 야망이 있는 사람은 오래버티기 힘듦.(다행인건 여기서 몇 년 일하면 이직하기는 나름 수월한 편) 하지만 나는 꾸준히 돈받아가며 그냥 얼추 일하며 살겠다! 싶다면 이곳은 바로 무릉도원이자 파라다이스."
54,에프앤가이드,8586,"전반적으로 관리자와 실무 인력들의 수준이 낮은 편. k대표는 어디 밖에서 듣고 와서 자꾸 황당한 일들을 벌일려고 하고, 실무 인력들은 대표의 황당한 주문에 그런 일은 실현될 수 없다고 버티는 메비우스 띠의 무한 반복임. 전체적으로 급여 수준이 낮고, 급여 수준이 낮다 보니 인력들도 수준이 낮은 편. 스펙이 안돼서 금융권은 갈 수 없고, 그러나 금융권 비슷한 일이라도 해 보겠다는 사람들은 다닐 만함. 복지 수준은 열악하고, 명절 때 대표가 직원들마다 떡조각 1~2개씩 나눠 줌. 그 정도 수준임. 사내 분위기도 별로 좋지가 않음. 주간업무보고 회의는 조선 철종 시기의 어전 회의를 방불케 함"
55,에프앤가이드,8586,"더 성장하기 위해 새로운 사업아이템을 꾸준히 모색하고는 있으나, 추진력 부족, 잦은 인력 변경 등 아직 수직적이고 답답한 문화가 자리잡고 있음. 최근 젊은 직원들이 많이 입사에도 아직 꼰대들이 많이 남아있어서 소통이 잘 안되며 개답답함"
56,에프앤가이드,8586,"일 못/안하고 늘 툴툴대는 고인물들과 들어온지 몇 년 안 된 사원/대리급들이 주를 이룸. 따라서 특정 직원들한테 일이 몰리는데 그렇다고 더 챙겨주는 것은 전혀 없음. 대리급 이상 직원중에 좀 괜찮다 싶은 사람은 다 나가서 없고 여기말고 갈곳 없는 사람들만 남아있음. 오죽하면 요즘같은 취업난에도 여긴 아니다싶은건지 갈 곳 없이 일단 나가는 사람도 꽤 됨. 수평적 문화 추구하는 '척'하지만 실상은 99.99% 경영진 맘대로 함. 모든것이 상부 보고용이며 요식행위일뿐. 합병 이후 얻은 독점적 지위나 코스닥 이전상장, 동학개미운동 등 긍정적인 외부 기회들을 전혀 활용하지 못하고 헛발질만 주구장창 하다가 기존 사업은 기존 사업대로 팽겨쳐져 있음. 신규 사업은 진행이 더디며 뒤죽박죽 난리도 그런 난리가 없음. 돈 못버는 유휴인력/팀이 엄청 많음. 파레토의 법칙의 정확한 사례일듯."
57,에프앤가이드,8586,연봉이 매우 적고 그러다 보니 다들 이직하려고 함 연봉협상도 협상이 아니라 그냥 통보
58,에프앤가이드,8586,사내 전체의 분위기가 수평적 분위기보다는 수직적 분위기에 가까움. 팀별로 약간의 차이는 있지만 위에서 하라면 아래에서는 무조건적으로 해야하는 분위기.
59,에프앤가이드,8586,"불필요한 보고, 문서 작업이 많은데 이는 다 위쪽에 보고용, 보여주기 식의 자료임"
60,에프앤가이드,8586,보다 체계적인 계층별 교육과정에 대한 고민과 이에 대한 개선이 필요한 상황입니다..
61,에프앤가이드,8586,"반복적인 업무, 황량한 회사주변, 임원과 일반직원들의 괴리감 등.."
62,에프앤가이드,8586,욕심없이 안정적이게 다닐 수 있음. 윗사람들이 보여지는 일들을 많이 하는 편. 보수적임. 업무강도 높음. 한계가 있는 사업모델인데 매출과 성과압박있음. 부서별로 잡일을 하는 단순노동집약적 부서가 가끔 있음. 뒷말 많음. 한번찍히면 낙인효과 큼. 가족같은 분위기를 바탕으로 사생활 간섭정도 있음. 남녀사이 간섭 소문 많음. 합병이후 분위기 안 좋고 최근 퇴직자수 급격히 늘고있음. 정치질 잘하고 인내심잇고 욕심없는 사람들은 다닐만하다. 능력있는 사람들은 다들 이직한 상태거나 이직을 준비중. 합병한 와이즈에프앤과 존속회사간의 차별 존재.
63,에프앤가이드,8586,연봉 낮은게 제일 큰 단점. 두번째로는 2~3년 일하면 다른 일도 해보고 싶게 마련인데 별로 업무 확장성이 없어서 했던 일만 계속 해야 되는 것 같음. 일부 꼰대같은 팀장이 있음. 주말 체육대회도 시대에 맞지 않음.
64,에프앤가이드,8586,"업무강도 강, 업무 난이도와 강도 대비 연봉낮음, 직원들이 말해도 귀를 잘 안, 임원들의 신사업 추진 강도가 강해서 따라가기 벅참, 문제시 원격 업무 시스템"
65,에프앤가이드,8586,부서마다 다르지만 철저한 계급사회. 조직문화의 다양성을 인정하지 않음. 합병으로 인해 시너지가 나오는 듯 하지만 갈길이 멈.
66,에프앤가이드,8586,"보고할거 많음, 업무절차가 복잡하고 비효율적 합병해서 적응힘듦 교통이 다소 불편"
67,에프앤가이드,8586,"체계가 없음, 급여 수준도 열악함, 강제로 야근함. 자유롭긴 하나 그냥 방임이라고 생각됨"
68,에프앤가이드,8586,능력계발하는 사람이 없음 남탓만 하고 주도적인 사람 없음
69,에프앤가이드,8586,사업모델이 안정적인데 비해 확장성의 돌파구를 못찾는 상황. 여러가지 사업 다각화를 추진해보지만 제대로된 기획과 검토가 이루어지지 않아 최근 신사업은 거의다 흐지부지됨. 직무마다 격차가 심하고 특정 조직은 성장 가능성이 많이 없음. 퇴사율이 높음.
70,에프앤가이드,8586,용역 수행을 위한 입찰 압박이 일반직원에게까지 미치며 사소한 일까지 임원의 구미에 맞춰야함.
71,에프앤가이드,8586,임원과 일부 몇몇 직원에게만 집중되는 보이거나 보이지 않는 혜택이 많음. 임원 복지는 대기업 뺨치지만 직원은 그렇지 않음.
72,에프앤가이드,8586,"아무래도 소기업이다 보니 급여도 상대적으로 낮고 성과급을 기대하기 어려움, 임원들은 복리후생이 많지만 직원들은 별달리 없음, 의료비 지원 없음, 직원들의 업무 저항이 심하고, 루틴한 일을 하는 직원들을 제외하고는 나머지 직원들이 무의미한 일에 투입됨"
73,에프앤가이드,8586,"- 6시 칼퇴가 가능하나 8시에 출근한다는 점은 큰 단점. 그러나 최근 출퇴근 시간 조정(시간 단축)하기로 결정하였음(아직 시행은 되지 않음). - 의사결정이 대표이사에게 집중되어 있어 본부장/팀장이 대표이사의 의견과 다른 직원의 의견을 반영한 의사결정하기 쉽지 않은 구조. 덕분에 직원 입장에서는 본부장/팀장이 상사 비위만 맞추려 한다거나, 사내 정치가 중요하다는 인식이 꽤 생겨 있음. - 평가에 대해서 대부분 직원들이 불만이 큼. 안정적인 직장 분위기 탓인지 상대적으로 일안하는 사람이나 열심히 일하는 사람에 대한 평가 편차가 적고 열심히 해봤자 돌아오는 게 별로 없다는 인식이 강함. 이로서 직원들의 로열티 낮아지고 모두 최선을 다하지 않게 되고 무사안일주의로 흐르는 악순환. - 마곡으로 이전 예정으로 출퇴근 거리 부담 증가할 것."
74,에프앤가이드,8586,"급변하는 시장상황에 맞추려다보니 업무에 있어서 계획적으로 진행되는 경우가 드뭄. 업무에 대한 명확한 가이드라인, 계획된 집중 교육, 확실한 멘토가 없어 초기 입사시 적응에 힘들수 있음. 팀간 업무 및 분위기 차이가 크며 시장분석 및 사업성 평가, 초기시장 대응에 대한 부분이 약해 무분별한 사업 진행이 많음."
75,에프앤가이드,8586,칼퇴해도 하루 9시간 근무시간. IT기업답지않은 문화. 직원관리가 좀 미흡해 보임.
76,에프앤가이드,8586,"업무시간 단축해준건 고마운데 윗선에서 집에안가서 못가는 경우가 많고 , 직원들은 5시퇴근,임원들은 6시퇴근. 다섯시에 퇴근하라고 하면서 여섯시까지 오는 전화는 또 받으라고함. ㅋ"
77,에프앤가이드,8586,보수적이고 권위적인 기업문화. 그 안에 아첨하고 단물빨겠다는 기회주위자들이 많음. 진짜 열심히 일하는 사람들이 상대적으로 손해보는 상황임. 한때 업계 2위로 떨어졌으나 2위였던 회사 흡수통합하여 다시 1위. 어느정도 경력 쌓고 좋은곳 생기면 이직하는...거쳐가는 회사라고 생각길 권합니다.
