,company_name,company_id,review_text
78,에프앤가이드,8586,실무진 사람들이 안좋다. 라인을 타야함 좋은대학 필수 스카이는 기본으로
79,에프앤가이드,8586,일부 직원들이 증권사나 운용사로 이직. 이직 못한 직원들의 패배주의가 있음. 성과를 평가할 마땅한 기준이 없다.
80,에프앤가이드,8586,"퇴근시간은 타 회사에 비해 빠른편이지만, 실제 업무시간은 긴 편입니다."
81,에프앤가이드,8586,"높은 분 잘 만나시면 승진할 수 있음 아니면 그냥 포기하고 다니면 좋음 사람 의존도가 심함에도 불구하고 쿨하게 보내줘서 독박 자리에 들어가면 삶이 피곤해짐. 소규모에다가, 한공간에 몰려있어서 서로 비방하기 바쁨 한번 찍히면 끝이라고 생각하면됨. 직원 무한책임임. 어떠한 업무를 맡았는가 마다 다르겠지만, 절대 성골들에게 책임을 부여하지 않음."
82,에프앤가이드,8586,출근이 오전 8시로 일반 기업에 비해 빠른 편. 팀별 업무분장이 명확하지 않아서 그 사이에서 일어나는 갈등 존재.
83,에프앤가이드,8586,새로운비즈니스 창출을위해 노력하고있고 본인 의지만 있다면 새로운 일들에 대해 경험하고 배울수 있음
84,에프앤가이드,8586,조직안에서 능력이 있는 인력에게만 업무가 집중되는 경우가 있음
85,에프앤가이드,8586,금융데이터를 제공하는 비지니스이니 스스로 금융권이라고 말하고 싶어하지만 사실 회사 전체에서 실질적인 금융업무는 극히 일부분인듯. 데이터를 기반으로 하는 회사라서 인력관리가 중요한 법인데 그부분은 크게 신경안쓰는 듯.
86,에프앤가이드,8586,"적은 연봉 및 인상률, 잦은 이직률, 개인주의적인 성향"
87,에프앤가이드,8586,부서마다 상이하지만 업무 강도가 높은 편임
88,에프앤가이드,8586,인사제도의 기준이 명확하지 않아 형평성 문제 있음
89,에프앤가이드,8586,입사 시 학위에 따라 진급에 걸리는 기간이 다름. 근무 중 학위 취득해도 인사에 반영 안됨. 매출이 적은 팀은 실적 압박이 있을 수 있음.
90,에프앤가이드,8586,"인사평가제도가 합당하다 생각 되지 않으며, 프로젝트를 책임지고 이끄는 사람이 없습니다."
91,에프앤가이드,8586,굉장히 수직적인 업무구조를 띄고 있어 종종 설득되지 못한 일을 함으로써 업무 만족도 하락. 암암리에 벌어지는 정치와 뒤에서 나오는 얘기들은 드라마 저리가라..
92,에프앤가이드,8586,연봉. 아직 새로운 먹거리를 아직 찾지 못함.
93,에프앤가이드,8586,데이터를 다루는 곳 이여서 조용하고 차분한 분위기 입니다. 위크샵과 기념행사를 주말에 합니다. 8시 업무 시작이지만 다니다보면 적응됩니다.
94,에프앤가이드,8586,중소기업이라서 그런지 부서간의 조율문제 등 업무에서 체계적이지 못한 부분이 있다. 현재 주 고객층인 금융업계의 상황이 좋지 않다는 게 불안요소.
95,에프앤가이드,8586,작은 기업답지 않게 사내 정치가 심하며 보수적인 금융권 문화까지 심하게 존재함
