,company_name,company_id,review_text
0,에프엔씨엔터테인먼트,11818,"쓸데없는 보고 체계, 비효율적인 컨펌 라인, 고여버린 사람들로 인해 그것이 비효율적인지도 모르는 집단 속에 2-3시간이면 끝날 일을 3일 넘게 걸려서 확인하고 회신하고 하는 일들이 부지기수"
1,에프엔씨엔터테인먼트,11818,단순 업무를 반복하는거기때문에 지루함이 있고 잔업이 다소 있습니다.
2,에프엔씨엔터테인먼트,11818,짜디짠 연봉 사내 정치질 불필요하고 잡다한 보고업무 고인물 체계가 있어보이나 없음 잦은 야근
3,에프엔씨엔터테인먼트,11818,1. 일이 그냥 휘몰아친다 2. 체계가 없다 3. 고인물들이 판을 친다
4,에프엔씨엔터테인먼트,11818,업종 특성도 그렇고 워라밸이 정말 별로라 워라밸을 추구한다면 비추
5,에프엔씨엔터테인먼트,11818,모든 비용을 아끼기만 해서 돈을 써야 하는 프로젝트에도 투자되지 않는다. 직원 연봉도 마찬가지.
6,에프엔씨엔터테인먼트,11818,경영진의 무능력함과 안일함 보고의 보고를 위한 보고 체계 인력에 비한 과한 업무량
7,에프엔씨엔터테인먼트,11818,대표님과 컨펌권자들이 올드하고 트렌드를 1도 모르기 때문에 업계를 리딩할 새로운 콘텐츠 아이디어를 가져와도 컨펌 되지 않는다. 그리고 그것을 후에 다른회사들이 하기 시작하면 왜 너네는 이런생각 못하냐고 묻는다. 한두번이 아님. 업계에 대한 이해도가 없는 아저씨들이 임원들이라 이럴줄 알았다. 일반 직원들에 대한 급여와 승진이 박하다
8,에프엔씨엔터테인먼트,11818,"Top Class 연예인은 아니고, 새로운 사업이 성공하지는 않는다."
9,에프엔씨엔터테인먼트,11818,"워라벨 보장이 안되며, 팀장급 사람들이 강압적이어서 부댬스러움"
10,에프엔씨엔터테인먼트,11818,일이 너무 많아서 매일 새벽까지 야근하는 워라밸이 맞춰지지 않는 생활패턴
11,에프엔씨엔터테인먼트,11818,"능력없는 상사 아래서 일하면서 팀은 분열되고 , 심지어 텃세도 정말 대단하게 심한 회사였어요..."
12,에프엔씨엔터테인먼트,11818,"열정페이, 급여가 작은게 가장 큰 단점입니다. 그리고 위치고 청담이라 주변 물가도 비싸요."
13,에프엔씨엔터테인먼트,11818,부서 개편이 잦고 사칙이나 조직도가 자주 변하는 편.. 야근이 많다..너무도 많다.. 야근을 하지 않으면 쏟아지는 업무를 감당할 수 없다.. 그런데 사람은...뽑기 쉽지 않음.. 업무량에 치여서 건강도 잃고.. 사람들 성격도 예민해지는 듯...그리고 도무지 윗분들이 생각하는 기준에는 맞추기 어렵다.. 엔터테인먼트의 본질과 목적성을... 팬덤을 유지하고 유입시키기 위한 진정한 방향에 대해 알아주시기를..
14,에프엔씨엔터테인먼트,11818,엔터 이름 바꿔라.. ㅎㅅㅎ엔터로..^^ 지 입맛에 안맞으면 아무리 좋아도 다 나가리시키는데 소속 가수들만 불쌍함.
15,에프엔씨엔터테인먼트,11818,자율출퇴근제라지만 고정화되어있고. 위에서 의사결정을 너무 늦게내려줌
16,에프엔씨엔터테인먼트,11818,야근 등으로 인한 불균형적인 워라벨.. 사내정치.. 승진에 대한 기준 애매모호
17,에프엔씨엔터테인먼트,11818,- 휴게 공간 거의 전무함. - 엔터는 거의 그렇겠지만 워라밸…포기해야함 - 수직적이고 보수적인 기업 문화 (겉으로는 안그래 보일 수 있지만 눈치를 엄청 봐야하는 분위기)
18,에프엔씨엔터테인먼트,11818,장점 외 모든 것 체계가 없음 회사가 이래도 돼? 소리 절로 나옴 커리어적으로도 전혀 도움이 될 거 같지 않음 고인물 파티
19,에프엔씨엔터테인먼트,11818,장점 빼고 거의 모든..직원들 분명 실무 딴에선 노력하겠지만 걍 모두가 개선하려는 노력이 없음 걍 모든 면이 암담 급여도 복지도 회사의 미래도
20,에프엔씨엔터테인먼트,11818,"의미없는 서류 작업, 수평적인척하는 그냥 수직적 문화, 고인물이 많음, 체계적이지못한 업무인수인계, 신입이 적응하기 힘든 체계"
21,에프엔씨엔터테인먼트,11818,발전할 수 있을지 모르겠다 트렌드에 한참 뒤쳐진 느낌 이미 다른 곳에서 한것들을 한참 모자라게 따라함
22,에프엔씨엔터테인먼트,11818,사소한 일로 야근이 많았습니다. 사수가 없어서 혼자서 일을 해와서 그런지 실력이 느는것 같지도 않았구요 인지도가 없음.
23,에프엔씨엔터테인먼트,11818,성과 인정 기준이나 보상체계 자체가 없음. 매우 높은 업무 강도에 비해 연봉이나 복지수준이 낮음. 직원들의 직무 전문성 교육 부족. 관리자급 직원들의 역량 부족.
24,에프엔씨엔터테인먼트,11818,"트렌디하지 못하고, 한 업무에 들어가는 쓸 데 없는 서면정리가 많음… 팀마자 다르지만 사내정치도 다소 존재"
25,에프엔씨엔터테인먼트,11818,엔터업계 전반적인 분위기가 그렇듯 초과 근무와 주말 출근이 잦은 편이다
26,에프엔씨엔터테인먼트,11818,"장점 빼고는 다 단점임 누구를 위한 신사옥인가? 상무, 이사, 대표 등.. 임원들을 위한 신사옥인듯 직원들 눈치보는척 상사평가도 한번 하고 끝, 직원들 위하는 척 복리후생 타령하더니 눈에 띄게 달라진점 없음.. 그럴 거면 말이라도 하지 말든지 경영지원팀조차 대표 눈치보고 실무에 대해서는 하나도 몰라서 그냥 위에서 시키는 것만 네네 하고 있음"
27,에프엔씨엔터테인먼트,11818,워라벨 없음 초라한 연봉수준 고인물 파티에 과다한 문서작업 등등
28,에프엔씨엔터테인먼트,11818,그냥 장점 빼고 다 인듯ㅋㅋ 여기 가끔 회사에 물들었는지 윗선마냥 아티스트 깎아내리는 후기 쓰는 사람들 있는데 보고있다면 정신차리길..아티스트도 회사가 돈안주고 비교하고 막말하고 스트레스주는거땜에 우울증걸렸어서 방에만 있고 매일 울었었다는사람이 한둘이 아닌데 굳이 깎아내리고싶음? 좀만 찾아봐도알겠지만 여긴 윗선문제임 대표 포함 경영진이 죽거나 병들든가 암튼 걔네가 사라지면 됨 급나누고 남 깎아내리고 뒷담까는 최악요건이 다 윗선에있음ㅋ
29,에프엔씨엔터테인먼트,11818,본사랑 복지 차이남. 오더 위주로 돌아가는 것 같음. 커리어 성장 면에서는 모르겠음
30,에프엔씨엔터테인먼트,11818,입사 시 제대로 된 안내가 단 하나도 없음. 설명해 주는 것을 꺼려함. 아티스트가 많아서 비수기가 없음. 휴가를 쓰기 쉽지 않음. 쉬는 날이 없음. 인적 자원을 비효율적으로 이용. 팀 간의 사이가 좋지 않음. 고인물들은 퇴사를 안 하고 신입의 퇴사가 잦음.
31,에프엔씨엔터테인먼트,11818,"입사 시 혹은 연초 회의에 경영진이 직원들과 약속한 업무성과에 대한 인센티브 지급을 미루거나 주지 않으려고 노력하며, 이로 인하여 업무성과에 들어간 노력에 박탈감을 느끼게 함. 급여 인상율이 동종기업에 비해서 인색함."
32,에프엔씨엔터테인먼트,11818,"핵심콘텐츠가 점점 부족, 구설수에 오르내리는게 아쉬움, 낮은 연봉"
33,에프엔씨엔터테인먼트,11818,두가지의 장점 빼고 모든것 위치부터해서 근무하는 방식 그리고 텃세부리는 팀원들 그걸 방치하는 윗선부터 일부터 모든것
34,에프엔씨엔터테인먼트,11818,"상장사로 경력을 쌓을 수 있겠지만 이직 시 배운거라고는 사회생활뿐이라 내 커리어를 쌓기에는 역부족, 무능한 사람들이 넘치고 넘쳐 바보가 되는 기분"
35,에프엔씨엔터테인먼트,11818,꼰대 많음. 기싸움 많음. 연봉은 적은데 바라는 성과 많음. 업무 강도 높음.
36,에프엔씨엔터테인먼트,11818,실제 경력 연차가 낮은데 직책은 장인 사람들이 많음. 그래선지 체계 여부를 떠나 어수선하며 자격 없는 장들은 업무 능력도 떨어지고 사람 관리 못하고 일하기도 부족한 시간에 직원들은 서로 헐뜯고 기싸움 하느라 정신 없음(진짜 망한). 몇 명 있지도 않은데 정치싸움. 감 없는 윗선도 매우 큰 문제.
37,에프엔씨엔터테인먼트,11818,형편없는 연봉에 말도안되는 야근의 연속임. 대우 그딴거 없음. 신입이 모든 일을 다 함
38,에프엔씨엔터테인먼트,11818,하고 싶은 것만 많은 감없고 촌스러운 윗분들 소꿉장난에 장단 맞추며 놀아드려야 합니다!
39,에프엔씨엔터테인먼트,11818,중간급이 업무를 마치면 확인해줄 윗급이 없음. 잘못되도 알수가 없음
40,에프엔씨엔터테인먼트,11818,많아서 나열을 못하겠으나 직원 복지가 전무한 수준이고 부바부 사바사이지만 배울 수 있는 사람 없음. 그리고 더 중요한 건 회사가 감이 없음. 아무래도..요직에 전문성이 없는 지인들이 있어서 아닐까?
41,에프엔씨엔터테인먼트,11818,"업계 특성상 어쩔 수 없긴하지만 내 삶은 포기할 수 밖에 없음. 아래 직원들 끼리의 기싸움, 윗선 상사들의 무능함."
42,에프엔씨엔터테인먼트,11818,일이 너어어무 많아서 매일매일 야근했다 내 생활은 없다고 보면 될듯
43,에프엔씨엔터테인먼트,11818,감각없는 상사들과 일하려니 좋은 직원들이 다 나가는 게 문제
44,에프엔씨엔터테인먼트,11818,"모든 것을 페이퍼 작업을 해야해서, 실무를 해야할 시간이 부족할 지경. 보고를 위해 작성되는 기획서와 콘셉안은 어떤 의미가 있을까. 페이퍼의 목적은 모든 스텝과 명확한 목적에 대한 약속을 하기 위함에 있다는걸 모르고 보고를 위한 목적을 위해 쓴 페이퍼는 스텝들에게 모호함만 줄 뿐이었다."
45,에프엔씨엔터테인먼트,11818,컨펌만 받고 일의 세부사항은 잘 모르는 고인물들이 많음 어느 엔터나 동일하겠지만 초반 텃세를 견뎌야 함
46,에프엔씨엔터테인먼트,11818,엔터 기업은 다 그렇지만 워나벨이 없어요. 저의 시간을 많이 못갖는다는게 단점입니다
47,에프엔씨엔터테인먼트,11818,타부서는 재택이 있다던데 재택 경험하고 싶네요. 왜 우린 못하는 거죠....?연차 자유롭게 왜 못 쓰죠?? 2일 이상 쓰고 싶은데 왜 눈치주나요....?
48,에프엔씨엔터테인먼트,11818,"생각보다 내부가 별로 안 좋았음, 당시에는 얼음 정수기가 없고 제빙기가 있었던 듯 지금도 그러려나"
49,에프엔씨엔터테인먼트,11818,복지 없음 밥도 내가 사먹어야함 야근수당 없음 야근 종종했음
50,에프엔씨엔터테인먼트,11818,고인물 텃세가 심하다 하지만 윗 사람들은 고인물 편이다
51,에프엔씨엔터테인먼트,11818,지하철역에서 회사까지 거리가 너무 멀고 직원들을 소모품으로 보는 경향이 큼 컴퓨터도 너무 안좋음
52,에프엔씨엔터테인먼트,11818,실무진은 계속 바뀌지만 바뀌는 이유는 한결같고 고인물들이 너무 실무를 장악하고 있어서 업무 스킬을 높일 수 없는 환경입니다. 팀바팀이긴 하나 연차 쓰려고하면 눈치주고 일할때도 눈치 많이 줌. 듣기론 일부팀은 텃세도 심하다고 함.
53,에프엔씨엔터테인먼트,11818,고인물들의 요구와 쳐낼 줄 모르는 위사람들의 환장의 콜라보 결국 그 요상한 일들은 밑에 실무진들이 울면서 쳐냄
54,에프엔씨엔터테인먼트,11818,"저번에 적었던거 어느날보니 지워져있더라구요?ㅋㅋㅋ 뭐가 그렇게 찔려서 지웠는진 모르겠지만..^^ 이제껏 경험했던 최억의 회사네요 진짜.. 여러모로? 텃세는 기본에(본인들이 텃세부리는지 모르는게 함정&본인들은 신입 위해주고, 피해보고 있다고 생각하는 것도 함정), 정치질 매우 심하고, (매우매우) 찐꼰대+젊은꼰대의 환상의 콜라보를 경험할 수 있음. 또한, 중간에서 말이 왜곡되는 장면과, 실시간으로 잘못을 남에게 전과하는 과정을 볼 수 있음. 과연 중간 역할을 해야하는 직책의 사람들은 본인의 직책에 어울리는지 다시한번 잘 생각해보길.. 본인이 제대로 못해놓고 모든걸 사원탓으로 돌리면, 그 자리에 앉아있는 이유가 무엇인지...^^ 타사(다른엔터), 타팀, 외주업체 뒷담을 엄청 하는데, 본인들부터 되돌아보는걸 권해봄..ㅋㅋ 그러면서 다른엔터는 엄청 따라하는데, 문제는 맞지도 않고, 유행 지난걸 따라하는 실상.. 다들 본인들이 잘나서 다른곳, 다른 사람들이 이상하다고 생각하는 사고방식은 언제부터 시작된건지.. 이곳에서 5년 이상 근무한 사람들은 문제가 있다는걸 본인들이 깨달아 보시길.. 그럴리 없겠지만..ㅋ"
55,에프엔씨엔터테인먼트,11818,"주말 공휴일에 대한 개념이 전혀 없고, 공휴일은 회사에 출근하지 않을 뿐 집에서 일하는 것과 같음 최악의 워라밸 + 최악의 팀워크 텃새를 부리기 때문에 신입이 떠나는 것이지 신입이 퇴사하는 것에 의아해 하지 말길 왜 고인물들만 고여가는 지 알 수 있음 업무를 개선하고자 하는 노력은 없으며, 불필요하고 비효율적인 업무의 반복"
56,에프엔씨엔터테인먼트,11818,일이 많았고 가끔 젊은 꼰대들이 사람을 정신적으로 힘들게함
57,에프엔씨엔터테인먼트,11818,1.자유로운 분위기를 생각하면 안됨 2.고인물들이 너무 많음 3.새로운 도전을 하는 분위기가 아님 4.정형화된 스타일 5.왜 나락으로 가는지 알거임
58,에프엔씨엔터테인먼트,11818,"아티스트에게 휘둘림, 뚜렷한 주관으로 설득 절대 못함, 이 일을 이 부서에서 대체 왜 해야하는지 알 수가 없음(쓸데 없는 일 물어와서 시키는 경우 있음), 비전이 없음, 이사와 팀장 이른바 리더를 갈아치우지 않으면 앞으로도 영영 비전이 없을 것임"
59,에프엔씨엔터테인먼트,11818,"야근이 심하다. 필요에 의한 야근시 새벽야근은 기본이고, 그보다 문제는 불필요한 눈치보는 야근이 많았다. 연예인 이슈들로 인한 회사의 분위기 변화가 심하다. 급여 낮음"
60,에프엔씨엔터테인먼트,11818,눈치주고 비위 맞춰주고 말하지 않아도 알아서 기어주기를 바라는 상사들 :)
61,에프엔씨엔터테인먼트,11818,팀장이 뒤에서만 타팀팀장과 팀원의 실명을 자주 거론하며 상스러운 욕을 한다 ~ 팀안에서 듣고싶지않아도 크게 잘 들린다 ~ 늘 강약약강의 태도를 솔선수범하며 팀원들을 차별하고 편애한다 ~ 업무에도 그 차별과 편애가 깃든다! 팀원이 퇴사하면 태세전환하고 남탓하기 바쁘다 ~ 12시넘도록 야근하고 택시비지원이 복지? 수당은 당연히 없고~ 복지도 없고 연봉은 동결 ~ 야근시키면서 미리 퇴근체크를 시킨다!
62,에프엔씨엔터테인먼트,11818,"쓸데없는 문서작업 너무 많고 경영진들은 코로나 적자 매우기에 급급해 실무진 업무량 생각없이 여러 프로젝트를 동시에 진행시킴. 팀장급은 대리-사원급이 모든 업무를 처리하길 바라며 일 하나도 안함(꼰대문화), 실무진 수는 턱없이 부족하며 야근이 일상이고 신입들에게 가스라이팅 매우 심하여 버티지 못하고 퇴사하는사람이 줄을 섰음. 주52시간 절대로지켜지지 않고 포괄임금제라 야근수당 따로 없으며 급여에 식비10만원 포함되어있는 금액임"
63,에프엔씨엔터테인먼트,11818,단점이 뭐냐고 물으시면 공고가 몇달째 올라온지 보시면 될 것 같습니다 :) 엔터를 경험해보고 싶어서 오면 한달이면 퇴사하고 싶어질것 아무도 책임져주지 않아요. 못해도 됨 안해도 됨 근데 책임은 내가 져야함! 그냥 당신은 여기 갈려나갈것이에요 내 연차도 연봉도 쳐주지 않아요 더 쓰기도 입아프니까 겪어보시든지. 최악 ^^
64,에프엔씨엔터테인먼트,11818,사라지는 복지들 오래된 사람들의 텃세 그 텃세를 옹호하는 윗선
65,에프엔씨엔터테인먼트,11818,낮은 급여. 실팀장급의 정치질과 꼰대질. 조직관리를 안함. 퇴사율이 높음. 체계가 없다
66,에프엔씨엔터테인먼트,11818,야근이 많을 수 밖에 없는데도 불구하고 야근하지 말라고 눈치준다 아티스트별로 담당이 나눠져 있는게 아니라서 갈리기 딱 좋음 무능력한 팀장들 때문에 직원들만 고생하는 구조
67,에프엔씨엔터테인먼트,11818,이직률이 많고 회사 직원들이 금방 바뀜 한 부서에서 하는 업무가 너무 많아 야근을 밥 먹듯이 함 고인물들의 고인 의견들의 향연
68,에프엔씨엔터테인먼트,11818,팀장급이 팀원 욕하고 다니고 이간질이 난무하는 곳 인적성 검사는 왜 하는지 모름 소시오패스 대량 보유 중
69,에프엔씨엔터테인먼트,11818,지금 현재 구인광고 보세요 힌트입니다. 도망가세요 !!! 어차피 들어와도 나가요 ㅎ 진짜 🤦 말릴때 가지마세요. 1년내내 뽑는 이유가 뭘까요???? ㅎㅎㅎ.
70,에프엔씨엔터테인먼트,11818,높은 사람들이 고정적으로 많아 다음 단계를 생각하는 사람은 비추
71,에프엔씨엔터테인먼트,11818,"정치질도 아닌 꼰대+일진놀이+텃세의 콜라보. 같은 직급끼리 그러면 그러려나 하지만, 갓 들어 온 신입에게 심함. 적응 할 수 있게 해주질 않고, 업무 등으로 차별+편을 가름. 가운데 사람 역할이 중요하지만, 더 나서서 선을 그어 편을 가르고 텃세를 부림. 중요한건 그게 텃세+일진놀이+꼰대라는걸 모름. 정말 젊은 꼰대들의 집합소^^ 주먹구구식으로 업무 진행하며 본인들이 업계에서 제일 잘한다는 생각을 가진 직급이 있는 사람들은 과연 정말 그 직급을 달만한지 잘 생각해보길.. 늘 타팀 뒷담, 타사 평가, 비교.. 들어보면 왜그러면서 사나 싶음. 윗선에 보고하기 위한 야근을 하는 곳. 굳이 야근해야하나 싶은 쓸데없는 야근이 잦음. 업무시간에 몇몇이 수다떨지 않으면 충분히 시간내 끝낼 수 있지만, 밤에 일이 더 잘된다며 수다떠는 시간으로 인해 출근은 오전이지만 업무는 늦은 오후에나 시작함.. 시간 버리는 곳..^^"
72,에프엔씨엔터테인먼트,11818,능력은 없지만 가족빽으로 자리 하나 꿰차서는 직장내 갑질하고 오지랖 떨고 참견하는 가족 있음 조금이라도 존경할만한 실장 팀장급이 없다
73,에프엔씨엔터테인먼트,11818,부서마다 다르겠지만 야근 많은 부서는 개처럼 일함. 윗대가리는 인맥으로 무능한 인사. 그게 회사 망쳐감.
74,에프엔씨엔터테인먼트,11818,다들 수준이 너무 떨어져서 배울게 없는데 스스로는 대단하다고 착각하는 우물안 개구리 능력없는 팀장 소속이면 고생길 회사 곳곳 임원 가족 친인척이 갑질한다 (적당히 하세요)
75,에프엔씨엔터테인먼트,11818,대중들의 니즈를 잘 파악하지 못하는 것 같은 기획. 의견을 내도 잘 안 받아들여짐
76,에프엔씨엔터테인먼트,11818,"경영분야는 직급 던져야 할 듯. 대리가 사원한테 배우고, 물어보고, 경력으로 들어와도 본인 업무 파악도 못하지만 직급대우는 받고 싶어하는 회사 나이가 많으면 그냥 직급 옛다,받아랏 하고 주는 회사 그래서 정작 일 잘하는 사람들은 떠나가고 못하는 사람들만 다른사에서는 본인을 원하지 않으니 못 떠나고 고인물이 되어가고 있음ㅋㅋ 본인 업무처리의 잘못된 건 파악 못하고 오지랖 부리기 최고. 업무 간에 프로세스 맞춤을 위해 자료등 요청하면 이건 내 일 아닌데? 필요하면 너가 해~ 하기 바쁨(서로 자기 업무가 아니라고 해서 힘 없는 팀장이 권력에 져서 말도 못하고 마지못해 가져옴) 힘 들면 말하라 하지만 달라지는 거 아무것도 없음. 대리가 사원이고, 과장이 대리이고, 팀장이 과장급인 회사"
77,에프엔씨엔터테인먼트,11818,너무 많아서 다 못쓰겠습니다 팀바이팀이지만 연차 쓰는거 눈치주고 휴가 연차 알면서도 전화하고 일주는 팀장 팀원 욕하고 다니는 팀장!
78,에프엔씨엔터테인먼트,11818,"꼰대 많음, 워라벨은 포기해야 맘 편함, 발전 없음, 돈을 안쓰려함, 소속 아티 인지도 낮아 성취감 없음 등등"
79,에프엔씨엔터테인먼트,11818,일단 월급도 짠대 매일 새벽에 퇴근하는데 야간교통비지원같은거 없음 그래서 맨날일만하지만 돈이 다 나감 복지같은거 하나도없음
80,에프엔씨엔터테인먼트,11818,직원을 위한 정책이나 관심이 아예 없는듯. 인사팀 모하는지 모르겠음. 복지 하나도 없음. 진짜 커피머신이라도 없었으면 어쩔뻔..일하는 사람만 죽어라 일하고 노는 사람은 끝까지 놈. 이럴거면 인사평가를 왜함?? 젊은 꼰대들이 많음. 텃세 심함. 첫 출근한날 자리안내 받았는데 컴퓨터도 없고 의자도 없었음 뒤늦게 직원이 와서 설치함. 준비가 안되면 채용하지 말길.
81,에프엔씨엔터테인먼트,11818,상사가 너무 무능력함. 본인들과 회사의 문제는 생각도 안하고 직원들 탓만 함. 업무적으로도 실무를 제대로 아는지 모르겠으며 책임회피하기 바쁜 모습에 정이 떨어짐. 회사 자체도 제대로된 실적이 없어 미래가 불투명함.
82,에프엔씨엔터테인먼트,11818,인력이 너무 부족함. 보고할 것도 지나치게 많음. 팀마다 분위기가 다른데 심한 꼰대도 간혹 몇명 보임
83,에프엔씨엔터테인먼트,11818,엄청난 위치를 자랑. 직원 복지 전무한 수준인데 돈아낌. 지원 복지 신경써야 하는 팀은 뭐하는 지 모르겠음. 박봉에다 동결까지 서슴치 않음. 사생이나 팬이었던 직원 채용은 제발 좀 거르시길. 위에서 보는 회사의 전망은 어떨지 모르나 어두워보이며 방향성 제시도 안함.
84,에프엔씨엔터테인먼트,11818,야근해도 야근수당이 없다. 택시비를 저녁 12시 가까이에 결제시간이 찍혀야지만 청구할 수 있다. 역에서 거리가 매우 멀다. 일이 많은데 야근을 하지말라고 압박을 준다. 그러면서 일정은 전이랑 동일하게 소화하라고 한다 ^^. 연봉이 동결되었다. 자회사가 많아서 대책이 없다 ㅋ.
85,에프엔씨엔터테인먼트,11818,수당없음.복지없음. 주52시간 준수안함.근무시간 조작강요함. 그와중에 몇몇 꿀빠는 사람들로 사기 저하. 열심히하면 손해보는 회사. 부서간 업무양 편차큼. 일하는사람만 개미처럼 일하고 노는사람은 계속 노는 구조. 곳곳 갑질하는 꼰대들 많음. 쿨한척하는 꼰대들에게 의견과 문제점 말하면 찍힘. 꼰대들 하는짓이 직장내괴롭힘인지 모름. 인사팀 왜있는지 모름.
86,에프엔씨엔터테인먼트,11818,인력은 부족한데 업무는 많다고 생각하며 일의 분배가 제대로 되는 건지 의문스러움. 비효율적인 업무 방식이 존재하며 그로 인해 업무에 속도가 더딤.
87,에프엔씨엔터테인먼트,11818,페이퍼 작성이 너무 많다 오래된 사람은 무시한다 아랫사람은 그냥 모른다고 생각하고 자꾸 이상한 곡 주고 잘 만들라고 한다
88,에프엔씨엔터테인먼트,11818,빛좋은 개살구. 과한 수직구조의 회사. 아티스트 대우에도 차별이 있고 직원들에겐 막말도 서슴치 않는 기업.
89,에프엔씨엔터테인먼트,11818,워라밸 망함. 24시간 울리는 카톡 초반 텃세에 수습도 못버티는 사람 수두룩 그러면서 또 면접은 까다롭게 봐서 입사하고 나면 현타옴
90,에프엔씨엔터테인먼트,11818,"업무량이 너무 많음.. 인력이 부족함. 직장 상사에 맞추는 업무 형태,,.."
91,에프엔씨엔터테인먼트,11818,"위치도 애매 일하는 사람만 일하고 노는 사람 정말 잘 놀고 늦출,칼퇴 ㅋㅋ 노는 사람들에게는 꿈의 직장임 그래서 퇴사 생각 안하는거 같아요 일하는 개미처럼 열심히 일하구 인정도 못받아요"
92,에프엔씨엔터테인먼트,11818,엔터치고 서면보고가 많음 사소한것도 서류작성이 필요함 엔터를 잘 모르는 임원진들이 있음 임원진 꽂아넣기가 있음 실무자들보다 쓸데없는 윗선이 많음 결재라인이 많고 오래걸림
93,에프엔씨엔터테인먼트,11818,야근은 기본 상사의 노답은 일상 발전하지 못하는 이유가 있는 회사
94,에프엔씨엔터테인먼트,11818,단순 보고를 위한 문서화 작업이 많아 비효율적인 야근 시간이 많음
