,company_name,company_id,review_text
0,엔자임헬스㈜,10654,"자율성이 왜곡되는 경우가 있고, 관리가 없고 방치 수준에 가까움"
1,엔자임헬스㈜,10654,"지원 인력 비중이 4:1은 되는 것 같다. 지원 인력비중은 높은데, 이상한 공산주의로 돈 버는 부서와 비슷하게 대우해주려고 노력한다. 나도 지원 부서 입사할 걸... 전문성 없는 HR팀을 만들어 놓고는 자꾸 이상한 업무 외적인 요청을 예고 없이 갑자기 하면 , 일은 언제하나요."
2,엔자임헬스㈜,10654,ㅡ 영어 교육 지원 안 됨 ㅡ 워라밸 다소 떨어짐 ㅡ 리더 바이 리더
3,엔자임헬스㈜,10654,새로운 산업 환경에 대한 변화 등이 상대적으로 부족하다.
4,엔자임헬스㈜,10654,대표를 포함 윗선의 시각이 고착되어 있다 사업 말고 공부 연구를 하셔야 할 분이 회사를 이끌다보니 비전이 없는 느낌
5,엔자임헬스㈜,10654,성과급이 1도 없다 돈이나 성과에 대한 보상은 명확하지 않으면서 책임만 부여하는 회사 중간관리급이 없고 말단의 사원에게 모든 일을 맡기며 책임도 함께하지 않는 회사
6,엔자임헬스㈜,10654,의견 반영이 잘 안됨. 윗분들의 생각이 닫혀있는거 같다는 생각
7,엔자임헬스㈜,10654,헬스케어 계열이라 일이 경직되어 있는 편 크리에이티브를 좋아하지만 제약이 많아 제안이 힘든편 팀바이팀이겠지만 고객사에게 합리적인 거절을 못하고 뺑뺑이짓 많이 함.. 아날로그 좋았던 복지마저 축소되어가는 점...
8,엔자임헬스㈜,10654,비효울적인 회의문화와 승급제도가 일을 능률을 떨어트린다. 대리급들은 정말 열심히 일하고 괜찮음. 팀장급도.. 그러나 위로 가면 갈수록 이상하게 보수화되는 현상이 아쉽다.
9,엔자임헬스㈜,10654,야근을 해야만 일 잘하는 사람으로 받아들여짐 고인물 끝판왕 정체된 분위기
10,엔자임헬스㈜,10654,업무의 강도기 굉장히 셉니다. 혼자서 다 처리하는 경우가 많다
11,엔자임헬스㈜,10654,안정적인 성향인 만큼 큰 변화나 도전이 거의 없고 느린 편이다. 새로운 사업 기회를 모색할 필요성이 있어 보인다.
12,엔자임헬스㈜,10654,"- 대외적 이미지를 번지르르하게 관리하는동안 내부 직원들이 죽어나갑니다. - 수많은 개국공신들이 임원을 달고 놀고 있어 실무진이 죽어나갑니다. 조그만 회사에서 임원 달았으니 지휘봉만 휘두르고 평가질이나 하겠다고 맘 먹으면 일은 누가 다 하나요. - 수수료로 먹고 사는 회사인데 수수료를 매번 깎아주면서도 클라이언트 요구에 따라 수정에 수정, 잡일과 잡일을 마다하지 않으니 실무진만 죽어나갑니다. 임원이 나서서 커트해줘야 하지만 절대 하지 않습니다. - 홍보팀 마케팅팀 할 것 없이 죽어나갑니다 밥을 못먹고 일하거나 매일 야근하는 직원들을 발견해도 놀랍지 않아요. - 1년 이상 근속하는 직원이 거의 없습니다"
13,엔자임헬스㈜,10654,성과에 따른 보상 체계 미흡(예를 들어 인센티브 등)
14,엔자임헬스㈜,10654,"장기 근속이 가능하냐가 큰 문제. 사내 정치 있음, 심한정도. 상담을 받을 정도로 어려웠음. 입사자 퇴사자 비율을 본다면 알 수 있다. 잡플 리뷰도 꾸준하게 관리한다."
15,엔자임헬스㈜,10654,전형적인 역 피라미드 구조..업계 특성상 어쩔 수 없지만 아래 직급 인력 갈아서 성장하는 회사 그만큼 주니어 때 많이 배울 수 있긴 함
16,엔자임헬스㈜,10654,장기적으로 성장하는 데에는 무언가 한계가 있어 보임. 근속년수 높은 분들은 대부분 편하게 일할 수 있어 남는듯
17,엔자임헬스㈜,10654,- 실무진 수가 적어서(임원의 반도 안되는 듯) 일이 너무 많음 - 초창기부터 근속한 임원들은 회사가 성장했다는 뽕에 가득 차서 여기가 대기업인줄 아는 듯함. 대기업 인턴했을 때도 들어보지 못한 유형의 멘트를 듣고 놀랐음 - 인턴~사원~대리급 퇴사율이 매우 높고 윗사람들은 안나감 - 채용공고를 올리면 경력직이 지원을 안한다고 들었음 알만한 업계 사람들한테 소문이 별로인 듯
18,엔자임헬스㈜,10654,부바부 클바클 경우에 따라 일 많고 스트레스 과다 회의실 부족함
19,엔자임헬스㈜,10654,- 인원 대비 업무량이 많음 - 선택적 시간근로제 등 일부 복지 제도는 활용이 어려움
20,엔자임헬스㈜,10654,"- 인턴만 하고 도망치거나, 신입으로 들어와서 1년 이내에 도망치거나, 대리 달자마자 도망침 - 다들 도망치는 걸 보고 도망치는 사람들이 문제라고 탓할 뿐 딱히 개선 의지 없음 - 참신한 복지때문에 직원들의 건강을 챙길 것 같아 보이지만 다들 병들어서 나감"
21,엔자임헬스㈜,10654,"리더들이 변화를 좋아하지 않는 경향이 있음. 디지털, 기술력이 필요한 시대에 적극 대처하지 못하는 아쉬움."
22,엔자임헬스㈜,10654,"겉으로 보여지는 것보다 보수적이고 수직적임, 직무 차이가 존재하는데 공평을 강요하는 분위기"
23,엔자임헬스㈜,10654,-굳이 헬스케어 홍보대행사에 취업하고 싶은 게 아니라면 가지 마세요 -이직하기 애매함 대부분 1년도 되기 전에 퇴사하거나 고인물 되어서 어디 가지도 못하고 이직하고 싶다는 말만 함 -5점짜리 리뷰는 거르세요 임원이 대놓고 잡플래닛에 안좋은 평가 쓰지말라는 얘기하는 거 보면 조작이 반일 듯 -임원 수가 실무진보다 많음 임원이 하는 일은 실무진 가스라이팅 -건강 관련 회사인데 직원들 다 병듬 워라밸 최악 -대표 두 분 이미지가 좋아서 면접 때 환상 가지고 입사하는 사람들이 많은데 정작 같이 일할 사람들은 대표님들이 아니라 고인물 임원들이라는 걸 명심하세요
24,엔자임헬스㈜,10654,워낙 헬스 커뮤니케이션에 전문화된 기업이어서 다른 영역에 관심을 갖고 있다면 맞지 않을 수도 있음
25,엔자임헬스㈜,10654,보여주기식 복지가 많음. 야근 많음. 체계는 없는 대행사인데 불필요한 일들로 인해 시간을 잡아 먹는 경우가 많음. 고인물을 너무 우대함.
26,엔자임헬스㈜,10654,팀에 따라서 상황이 다르다. 복지가 좋아보이지만 챙겨먹기 힘든 부분이 있다. 그럴거면 왜 만드나
27,엔자임헬스㈜,10654,직원들의 얼굴만 봐도 불행해보임 다들 언제 어떻게 탈주할지 고민함 높은 입퇴사율 윗 직원들이 아래 직원들을 탓하기 바쁨 신선한 복지를 운영하며 이미지 메이킹을 잘 해뒀지만 사실 팀장급 이상이 아니라면 대부분의 복지를 누리기 힘듬
28,엔자임헬스㈜,10654,-일손이 부족해도 사람을 뽑지 않음 -야근수당 없음. 일이 야근이 불가피할만큼 많을 때도 야근한 이유를 개인탓으로 돌림 -언론홍보 중심. 요즘같은 시대에 비전이 있을지 의문 -어두운 분위기 -고인물. 일을 안하는 대신 직원관리를 해야 하는 사람들이지만 관리는 안하고 직원들을 압박하기만 함. 높은 퇴사율의 원인이 고인물이지만 고인물들이 아부와 정치질을 잘하기 때문에 앞으로도 개선 가능성 없을 듯 -작은 규모에 비해 심각한 정치질. 대표들은 직원들을 배려하려고 하지만 정작 직원들과 함께 일하는 리더급이 직원 귀한줄 모름. 퇴사할 때조차 나가서 실망이라고 하는 적반하장 반응을 보여줌
29,엔자임헬스㈜,10654,탄력근무제와 재택근무의 단점:퇴근이 없다. 월 근무시간을 못맞추는 사람이 없다. 훨씬 초과 근무
30,엔자임헬스㈜,10654,"복지 좋은 회사라는 점을 내세우려면 이리저리 조건 달지 말고 직원들이 온전히 누릴 수 있는 복지들을 제공했으면 좋겠다. 직원들이 정신과를 많이 다니고 정신적,신체적 건강을 잃어가며 퇴사한다."
31,엔자임헬스㈜,10654,"열정 넘치는 리더들로 인해 저녁이나 주말은 포기해야 하고, 업무를 통해서 성장하는 것보단 업무를 치워내는라 바쁘다는 느낌이 강함."
32,엔자임헬스㈜,10654,에이전시 업무에서 비롯되는 스트레스 & 클라이언트의 답없는 요구들 다 받아주고 셀프로 fee 후려치기 바쁜 윗선들에 대한 현타... 우리가 하는 일이 제값을 받을 가치가 있는 일이란 걸 자각해 주시길. 후배들이 보고 무슨 생각할까 걱정됨. 다른 에이전시 대비 일 열심히 하고 돈은 덜받는다는 생각이 강하게 드는 요즘임.
33,엔자임헬스㈜,10654,"직원에게 진심이 없다. 단 하나의 복지라도 그게 진심이면 직원들이 느낄거다. 그런데 복지가 외부 과시용이고 못쓰게 하려고 이리저리 추가조건 만드느라 바쁘다.  인사팀이 없다. 다른회사 보고 좀 느끼시길.  윗직급들도 힘들다는데 힘든 증거를 보여주세요. 엄청 편해보이고 일하는 척만 하는거 신입도 눈치챕니다. 회사가 아무리 편해도 조심하셔야죠.  평정 4,5점짜리 너무 티나요. 여기리뷰 쓸 시간에 본부원들에게 관심 갖으세요."
34,엔자임헬스㈜,10654,"1. 업무에 대한 보상이 없어 업무 열정, 동기부여가 떨어짐. 형식적인 보상이 아니라 실질적인, 매력적인 보상에 대한 고민이 필요함. 2. 직원(월급), 업무 환경(시설, 복지 등)에 대한 투자를 너무너무 아낌. 1번과도 연결되는 부분. 투자가 없으면 발전이 없다는 사실을 알았으면 함."
35,엔자임헬스㈜,10654,수익구조의 한계 사람을 갈아야만 수익이 나오는 구조 그런데 직원의 절반 이상이 팀장임원급 그 연봉을 어떻게 충당해야 할까요? 인턴사원들 줄퇴사를 그러려니 하다보니 대리팀장급들까지 줄퇴사하는 현상 빠른 판단으로 떠나는 사람들과 초고속 승진하는 고인물들
36,엔자임헬스㈜,10654,발전이 없음. 그냥 그대로 굴러감. 초반에는 많이 배울 수 있으나 어느 순간이 지나면 도태되는 느낌이 들기 시작함. 투입대비 수익성을 제발 생각하길. 시스템도 더 갖춰져야함. 이대로 있다가는 예전의 엔자임으로 남아 있을수 없음
37,엔자임헬스㈜,10654,리더급에서 관리해야 할 수익에 대한 압박을 거의 전 사원에게 공평하게 하고 일부 상사가 실무적인 부분에서도 책임전가를 매우 잘함.
38,엔자임헬스㈜,10654,야근 수당 없음 인센티브 없음 복지가 점점 줄어들고 있음 그냥 눈감고 다녀야 됨 잘못된 부분을 알아채는 순간 괴로움의 시작
39,엔자임헬스㈜,10654,직종 특성이지만 프로젝트 몰리는 시기에 따라 야근 많음 그러나 야근을 지양하는 분위기
40,엔자임헬스㈜,10654,"소리소문 없이 없어지는 복지. 사내 정치질에 휩쓸리지 않아야 하는 정신력 필요. 끊임없는 업무에 리더, 팀장급 고인물들의 압박. 안에서 새는 바가지 밖에서도 샌다고 아무리 대행사라 이미지 관리가 업이라지만 내실이 무너지는데 그것에 대해 되돌아보기를 하지 않고 무조건 덮고 이미지메이킹(잡플포함) 하려는 것은 당장은 괜찮을지모르나 결국 스스로 자멸하는 길입니다."
41,엔자임헬스㈜,10654,직원 분위기가 과거 대비 경직되어 가는 듯 함 적당히 하려는 분위기
42,엔자임헬스㈜,10654,-급성장에 따른 직급 인플레이션 -임원이 대리사원보다 많음 -임원들 임금 챙겨줘야지 신사업 해야지... 적자나는 게 당연한 구조 속에서 매출 올리는 방법은 아랫직급 갈아 쓰는 방법 밖에 없음 -그걸 사실대로 말하면 남아있을 사람이 없으니 불가피하게(?) 자행하는 가스라이팅 -똑똑한 사람들은 진즉 알아채고 탈주함
43,엔자임헬스㈜,10654,작은 회사지만 정치질이 있음. 업무 강도 높고 박봉. 보상 체계 부족.
44,엔자임헬스㈜,10654,팀장급 포함하여 그 이상으로 80%는 고이고 썩어있음. 극소수를 제외하고는 발전의 가능성도 의지도 엿보이지 않음. 그리고 인당 말도 안되는 매출 부담을 부과시키며 숨도 못쉬게 일하도록 굴린다. 지금 마케팅이고 홍보고 다들 일이 꽉꽉 들어차서 한껏 예민해진 상태로 죽어라 일하는게 보임. 이러니 사내 분위기 좋아질 수가 없고 하나같이 어떻게든 탈주하려는 기회만 엿봄이 느껴짐.
45,엔자임헬스㈜,10654,"대행사의 공무원화, 더 나아지고자 하는 의지가 보이지 않음 특히나 리더급들의 마인드가 궁금함. 사원부터 리더까지 대행사임에도 덜 일하고 빨리 집에가고자 하는 전반적인 분위기가 형성 열심히 일하고자 하는 사람들의 경우 의욕이 상당히 떨어짐"
46,엔자임헬스㈜,10654,근무 시간에 비해 연봉은 낮은 편 ㅜ 야근이 진짜 많은 편인듯.
47,엔자임헬스㈜,10654,1. 경영(인사)팀의 평가 기준은 아무도 모름 ( 연봉통지서를 편지 마냥 줌. )  2. 구시대적인 회계처리 프로세스 ( 아직도 영수증 일일히 종이에 붙여서 처리.)  3. 인턴/사원에게 일을 시키는 것이 아니라 던짐. ( 팀관리 못해서 사수가 없더라도 나몰라라)  4. 화이팅! 힘내자! 같은 소리만 반복함 ( 직책에 맞는 솔루션을 내주시길 ;;; )  5. 업무 룸이 있던 말던 상사 보여주기 식으로 짜바리 같은 일을 계속 가져옴 ( 정작 팀 매출은 적은데 실무진만 죽어남)  6. 대기업 아닌데 대기업 인척 뇌절. 좀 오래 있었다 하는 사람들은 엔자임 신앙심이 깊음
48,엔자임헬스㈜,10654,"복지 : 1. 도서 구입시 회사에 반납해야 함 2. 교육비 지원에 뒤따르는 서류 및 공유 등으로 더러워서 안하는 분위기 3. 탄력 근무제는 잘 사용한다면 좋은 시스템이지만 눈치를 주는 상사 때문에 사용 못함(본인은 자유롭게 사용) 급여 : 연봉 인상률...... (사람마다 다르겠지만) 비전 : 꼰대들이 하나로 똘똘 뭉친 회사라 더 발전하긴 힘들어 보임 몇 년째 이렇다 할 성과가 없는데 위기 의식이 없는것 같음  전반적으로 능력있는 실무자들은 다 못 버티고 나가는 듯 회사 입장에선 그들이 없어도 되고 대체 된다고 생각하는 것 같은데,,무능력한 경영의 표본"
49,엔자임헬스㈜,10654,"야근을 안 하려면 업무시간에 숨도 못 쉬고 일해야 함, 여초 집단의 단점들 모두..."
50,엔자임헬스㈜,10654,고인물 많음. 성장 동력이 부족함. 그래서 큰 변화나 성과 없음.
51,엔자임헬스㈜,10654,"코로나를 핑계로 수많은 내부 복지가 사라졌다. 그냥 특별한 이유도 없이 내맘이다라는 경영마인드. 여기서 불만표출하는 직원들은 역적으로 몰려 복수 당하기도 함.  나이든 고인물들이 모여서 자기들 맘에 안드는 직원 발견되면 일이든 뭐든 응징을 하는 유치한 시스템.   일은 타 대행사 대비 정말 많이해야하지만 그에 따른 보상이 전혀 없다. 하나를 잘하면 꼭 못하는걸 만들어내서 연봉 인상도 막음.  코로나임에도 수많은 직원들이 이탈했다는건 그만큼 문제가 있다고 볼법도 한데, 일하는 직원들만 고생할뿐 고인물들은 이제 신경도 안씁니다. 내 밥그릇만 지키면 된다는 생각이겠죠?"
52,엔자임헬스㈜,10654,복지가 날로 축소됨. 리더가 너무 많고 밑에 애들만 들락날락
53,엔자임헬스㈜,10654,고 인 물. 고이다 못해 썩어감. 흔하디 흔한 표현인데 이것보다 더 잘 표현할 자신이 없음 ㅋㅋ 본부장 위로는 삶의질 매우 높아보이나 그 아래론......그냥 답이없음. 일하다 코피도 쏟음
54,엔자임헬스㈜,10654,"- 야근, 주말 출근 많음에도 수당 없음 - 캐파 파악 안된채로 이것저것 하던 업무 시킴(부서바이부서) - 헤드는 대표님한테만 잘보이면 되고, 사업 관리에는 신경 안씀"
55,엔자임헬스㈜,10654,"야근과 초과근무, 실적 압박, 이미 버거운 상황에서 제안서 작업에 동원 힘든 걸 힘들다고 표현할 수 없는 문화 잘하고 있다고 생각하는 리더와 경영진 총체적으로 난국"
56,엔자임헬스㈜,10654,"본부마다 분위기 차이 크며, 다소 과도한 업무를 요구할 때가 있음. 역동적인 분위기보다는 다소 차분하고 조용한 분위기"
57,엔자임헬스㈜,10654,여러 가지 사업으로 확장하면서 다소 어지럽긴 합니다. 조정이 되겠지요.
58,엔자임헬스㈜,10654,"아무 소리소문 없이 사라져버린 복지. 반차, 야근식대 없음. 야근택시비도 실상 없어진 상태. 일부는 코로나때문이더라도 관련 내용은 무성의한 통보로 일축. 이런 단편적인 부분들에서 회사 경영 마인드를 알 수 있고, 그간 충분한 설명이 이루어졌다면 퍼져버린 회사에 대한 불신을 이렇게까지 키우지 않았을 것이라 생각합니다. 회사 성장을 위한 개인의 노력과 이해를 요한다면 회사도 쌍방이여야 한다는 게 당연한 전제 아닐까요? 좋았던 기업 가치들은 도대체 어느 순간 사라져버린 건지... 그리고, 근래 사내 분위기 안좋습니다. 겉으로는 수평적인 것 처럼 보이나 몇년째 고여있는 사내 문화...몇몇이 문제 제기를 해도 돌아오는 것은 무관심 또는 꼰대 마인드. 이해 불가능한 경영진들의 고인물 감싸기까지. 처음 시작하던 그 때 엔자임이 아니고 지금은 2021년입니다."
59,엔자임헬스㈜,10654,경력직 이탈이 꽤 있는 편. 제약이 많은 편이라 답답함.
60,엔자임헬스㈜,10654,다양한 분야의 업무가 많아 경험을 쌓기는 좋지만 그만큼 힘든 회사
61,엔자임헬스㈜,10654,에이전씨의 어쩔 수 없는 한계이긴 하나 시간이 갈수록 기본 비즈니스 모델의 수익성이 떨어지면서 개개인이 맡아야 하는 프로젝트의 수가 계속 늘어나는 느낌.
62,엔자임헬스㈜,10654,일이 많다. 진짜 많다... 다른 에이전시 사람들이 놀란다 왜그렇게 빡세고 바쁘냐고..... 인당 클라이언트 3-4개 맡아야 룸이 찼다고 하는 빡센 업무로드. 정신없이 동시에 여러 업무 쳐내다 보면 자연스레 퀄리티는 떨어질 수 밖에 없고 아 모르겠다 하는 마음으로 그냥 넘긴다.. 어쩔 수 없음... 일 하는 사람에게만 일이 몰리는 구조가 과거의 엔자임 명성까지 깎아먹고 있는 기분 ... ㅠㅠ
63,엔자임헬스㈜,10654,"착한 회사, 복지가 탄탄한 회사로 포지셔닝 하지만 갖은 방법을 써서 축소하려는게 보이는 급여와 복지 제도. 코로나를 핑계로 온갖 사내 이벤트 및 복지 제도 줄임, 다른 방식으로 제공할 수 있지만..절대 그럴 생각은 없음. 코로나와 관련 없는 복지들도 아무도 모르게 교묘히 점점 줄여감. 그럴거면 복지좋은 회사로 홍보하여 모두를 기만하는 건 그만했으면 좋겠다. 유연근무제 실시로 출퇴근시간 자유롭게 조정할 수 있다고 말하지만, 이로 인한 장점보다 단점이 훨씬 많아짐. 야근식대, 택시비 축소, 10시 이후 법인카드사용 불가,, 근무시간은 절대 줄일 수도 없고 줄이도록 독려하지도 않지만 초과근무에 따른 기본적인 복지요건은 최대한 줄여버리는,, 아래 사람들은 주말근무 새벽근무까지 해가며 고생하지만 윗사람은 실무도 안하고, 자기계발은 물론 팀 발전에 대한 고민도 하지 않음,, 이러니 여기 아니면 받아줄 곳도 없어 계속 고여 썩어가기만 함. 직원들은 거의 모든 부서가 이러한 고민을 안고 있고 기업리뷰만 봐도 같은 지적이 이어지는데 절대 바뀌지 않음. 고인물을 영원히 안고 갈 회사. 매년 퇴사자 우수수 ...회사 입장에서 직원은 그냥 부품이고 갈아끼우면 그만이라고 생각하는 듯."
64,엔자임헬스㈜,10654,"일반 사원, 대리직보다 높은 분들이 많아서 실무진이 많이 부족한 분위기. 오래 회사에 있던 분들이 많아서 가끔 힘들어하는 사원분들을 보았다"
65,엔자임헬스㈜,10654,부서 간 소통이 조금 어렵고 업무량이 아랫급에 과중되는 경우가 많음 어딜가나 마찬가지지만 리더의 중요성이 큼
66,엔자임헬스㈜,10654,아무래도 에이전시이다보니 고객(클라이언트)의 요청에 따라 업무가 진행되기 때문에 갑작스러운 일정 변경 등으로 타임 매니지먼트를 아주 잘 해야 합니다. 경력이 많은 베테랑 직원들은 아주 잘들 하시지만 초년생들은 처음에는 어려움도 있고 배우는 데 시간도 걸리곤 합니다.
67,엔자임헬스㈜,10654,헬스케어 분야에 집중할 수 있는 것이 장점이지만 거꾸로 헹스케어 홍보 PR 마케팅이 제약이 많아서 일반적으로 아주 재미있는 예를들어 연예인 만나고 힙한 그런 일을 하게 되는 일은 적음
68,엔자임헬스㈜,10654,착한기업처럼 포지셔닝했지만 그렇지 않은 회사 고인물들이 분위기를 좌지우지하는 회사 정말 윗사람이 누구인지 꼭 알아보고 들어갔으면 하는 회사
69,엔자임헬스㈜,10654,인턴으로 근무하였기 때문에 딱히 단점으로 크게 와닿는 것은 없었음...ㅜ 그렇지만.음..대행사 특성상 야근이 많음.
70,엔자임헬스㈜,10654,"처음 이 회사에 들어왔을때와 비교했을 때 너무나 많은게 달라졌다. 그나마 엔자임의 장점이라고 할 수 있었던 (일주일 정도는 보장되던) 연말 클로징 휴가도 이젠 어떻게 될 지 모르고, 납득할 수 없는 사유로 사라진 반차휴가와 주 단위(!)로 정산되는 유명무실 유연근로제만 남았다. 안그래도 일이 쌓이고 쌓여 모두가 지친 와중에 구성원들을 위한 아주 기본적이고 사소한 것들이 깎여져 나가니 출근하는 것 자체가 하루하루 사람을 좀먹는 소모전이 된다. 아, 인센티브나 성과급 당연히 없음. 이것 또한 도무지 사람이 의욕을 가질 수 없게 만드는 요인이라고 보지만 더 말을 얹지는 않겠다 어차피 안 바뀔테니까. 실무에 허덕이는 아래 직급들과, 업무 상황 고려하지 않고 말도 안되는 목표치를 채우고자 계속 일만 던져대는 윗 직급들이 공존하는 곳. 어떻게든 버티고 버티던 사람들이 왜 올해 들어 연달아 퇴사하고 있는지 진지하게 고민하긴 커녕 이럴때도 있고 저럴때도 있다는 식의 태도에 질려버린지 오래다. 솔직히 이제 막 들어와 땜빵 메꾸는 데 다급하게 동원되어야 할 신입 사원들이 안타까울 정도. 참고로 이제 역시나 납득가지 않는 사유로 야근택시비 및 야근식대 또한 공식적으로 지원되지 않으며, 토요 근무시에는 대체휴무도 나오지 않는다. 참고하시길."
71,엔자임헬스㈜,10654,딱히 보고 배울만한 윗사람이 없다(특히 경력이라면) 몇몇 분들은 자리만 차지하고 계심..
72,엔자임헬스㈜,10654,PR 특성상 야근이 많다. 팀마다 다르긴 하지만 대개 인턴에게는 야근을 많이 안 시키려고는 한다. 하지만 언제나 팀마다 다른 것이고 실제 야근 많이 하는 인턴도 봤음
73,엔자임헬스㈜,10654,"워라밸이 없는점이 힘들다. 저녁을 잘 챙겨먹기가 힘들고, 일이 몰릴때는 야근이 많다."
74,엔자임헬스㈜,10654,스펙낮고 능력없는 고인물들이 많음. 열폭과 후려치기릉 매우 잘함
75,엔자임헬스㈜,10654,여자 군대같다 특히 직급이 높은 몇몇분들은 아래사람을 하칞게 생각하고 막대한다
76,엔자임헬스㈜,10654,팀에 따라 분위기가 천차만별이라 업무 효율성 피로도 등에 차이가 많은 편.
77,엔자임헬스㈜,10654,"연봉협상 테이블 없이 당일날 종이 한 장으로 통보. 장기간 근무한 사람들이 고인물이 되어서 회사를 망치고 있지만 경영진들은 이를 모르는 척 하는 중. 업무에 대한 책임은 아래 직원들이 져야 하는데 이 와중에 매출 압박까지도 받는 특이한 구조. 허울 뿐인 복지 제도가 많고 회사 특혜는 과장급 이상에게만 주어짐. 최근 들어서는 이마저도 없어지는 중. 팀에 따라 일을 잘 배울 수도, 못 배울 수도 있음."
78,엔자임헬스㈜,10654,복지 하나하나 따져보면 그 불합리성에 헛웃음 나옴. 가장 큰 단점은 자리만 차지하고 있는 헤드들. 그 어떤 발전도 배움도 기대할 수 없음
