,company_name,company_id,review_text
79,엔자임헬스㈜,10654,과거 헬스케어 분야에서 거의 독보적인 에이전씨였지만 이제는 유사한 서비스를 제공하는 곳이 많이 생긴 상황 속에서 차별화된 무엇을 제시하지 못하고 있는 것 같음. 그렇다고 다른 분야로 넓히기엔 헬스에 특화되어 있다는 점이 워낙 부각되어 있어서 그러지도 못하고 있는.. 헬스 특화라는 점이 오히려 독이 되어 돌아오는 듯한 느낌 (단점이라기 보단 한계네요)
80,엔자임헬스㈜,10654,"인턴에게 주어지는 업무량이 매우 많으며, 체계적이지 않은 자료조사 프로세스로 인해 일이 돌아가는 경우가 허다함"
81,엔자임헬스㈜,10654,"과장급 이상에게만 해당되는 복지제도, 바쁠 땐 화장실 가기도 힘듦"
82,엔자임헬스㈜,10654,"업무에 체계가 없고, 업무량이 지나치게 많음, 생각보다 복지 없음,"
83,엔자임헬스㈜,10654,팀에 따라 다르지만 사람을 소모품 취급하는 경우가 있음.
84,엔자임헬스㈜,10654,"은근히 수직적인 문화. 일부 원년멤버와 성장과정에서 영입한 인사들이 그대로 고인물이 된 케이스. 밑에 직원들만 고생하고 위에 고인물 직원들은 방관하며 퍼포먼스만 요구하는 편. 승진기회도 사실상 없고, 초임연봉은 높은데 이후 성과평가가 너무 박해서 연봉인상도 쉽지 않다. 영업매출 압박도 상당한데, 결국 밑에직원만 쪼는게 문제. 겉에서 보기에는 안그런것 같은데 야근도 은근히 많은 편. 맨파워가 떨어지면서 같이 하락하는 전문성."
85,엔자임헬스㈜,10654,"모든 회사가 그렇겠지만 팀 분위기가 천차만별. 책임감 있는 임원도 있지만, 반대로 직급에 비해 능력과 리더십이 다소 부족하고 많은 일을 아래로 떠넘기는 임원도 있음. 고질적인 문제라 분명 경영진도 알고 있을테지만 개선의지는 없어보임"
86,엔자임헬스㈜,10654,"자유로운 분위기이다 보니, 출근시간에 정확히 오는 직원들이 많이 없음, 사적으로는 굉장히 밝고 좋으나 공적으로는 조금 딱딱한 분위기, 타 부서와의 교류활동이 많이 적은 편"
87,엔자임헬스㈜,10654,딱히...다만 빠르게 돌아가야 하고 임원진이 야근을 안좋아하시다보니 그거에 맞추려면 일찍 나와야 된다...
88,엔자임헬스㈜,10654,각 팀에 최소 한명이상은 잉여인력이 있음 그래서 사원들은 너무 힘들 수 밖에 없음 / 그리고 매우 비상식적인 매출 구조를 가지고 있음
89,엔자임헬스㈜,10654,"대행사가 그렇듯이 바쁨. 담당하는 프로젝트에 따라 야근, 주말출근 등이 불가피할 수 있음. 그러나 주말출근의 경우 대체휴가로 보상받을 수 있음. 가르쳐 주는것보다는 알아서 배워야 할 때가 많음"
90,엔자임헬스㈜,10654,홍보대행사라 어쩔 수 없는 야근.. 식사비랑 택시비 지원됩니다.
91,엔자임헬스㈜,10654,윗선 알력 심함. 야근 많음. 자유롭지 못한 의사소통 체계. 뒷담화.
92,엔자임헬스㈜,10654,여자군대같은 분위기고 일을 다 아래로 내리고 고여있는 느낌 퇴사자가 많음
93,엔자임헬스㈜,10654,에이전시 특성상 야근이 잦고 워라밸은 포기해야 함 여초 특유의 분위기는 감내해야함
94,엔자임헬스㈜,10654,"사내 문제점을 알고도 모른척 or 이해못하는 경영진. 기존 멤버의 횡포. 직급이 올라갈수록 은근히 일 안함. 다들 아는데 모르는척 하는지, 진짜 모르는지??? 일이 너무 많아서 연차를 다 쓸수 없음. 잦은 주말근무, 보상은 눈치보며 써야하는 휴가 하루. 그나마도 다 못씀. 금전보상 없음. 못쓰면 끝. 사람을 채워주면 그이상 더 일해야함. 인원 보충이 의미없음. 퇴사율이 과거보다 높아지고 있는것 같음. 오로지 인력에 의해 수익을 내는 곳이기 때문에 굴리고 또 굴리나 합당한 보상도 없고, 인센도 없고, 직급 낮으면 또 구르고... 외적으로 보이는게 전부가 아님. 수익 적은 늘어나는 신사업, 고통받는 직원. 수익이 적은 일을 하면 그만큼 보상을 해주거나 돈이 적게 벌릴수 밖에 없음을 감안해 주어야 하는데 말로만 힘내 라고 함.     업계특성상 일과 삶의 불균형."
95,엔자임헬스㈜,10654,업계 특징일 수 있는 업무량의 조절이 자의적으로 힘든 부분이 있음.
96,엔자임헬스㈜,10654,"그러나 에이전시로서의 회사 시스템, 워크앤밸런스 불균형 등의 한계가 있고 인력이 자산인 작은규모의 서비스회사이다보니 팀마다 안정된 클리이언트 운영여부, 인센티브, 분위기 등의 편차가 상당히심함. 특히 시스템으로 해결안되고 손이 많이가는 업무들이 많은 홍보업무 특성상 낮은 연차들에게 이러한 업무까 쏠리면서 창의력까지 요하는 무리한 업무스콥을 커버해낼수 있어아함 ㅋ 급성장한만큼 1년 연차 차이에 직급이 차장, 과장 등으로 인플레이션이 심하고 나중에 입사한 사람들에게 불리한 측면이있음. 헬스케어/제약업계에서도 미디어홍보나 캠페인등 한정된 영역이라는 점은 꼭 명심필수."
97,엔자임헬스㈜,10654,"복지는 있으나 누릴 시간이 없음. 대행사로써의 강한 업무 강도는 예상해야함. .... 몇년간 일하고, 업무 노하우를 아는 직원들의 퇴사가 이어질 경우 경우 경쟁력약화가 예상됨"
98,엔자임헬스㈜,10654,"진리의 팀바이 팀, 인센티브 없음, 업무량에 비해 연봉이 적은 편"
99,엔자임헬스㈜,10654,"대행사 특유의 쏟아지는 업무, 높은 일의 강도, 업무가 쌓이다 보면 휴가를 잘 사용할 수 없음..."
100,엔자임헬스㈜,10654,"어느 대행사나 비슷하겠지만 일정 경력 이상이 쌓이기 전까지는 급여가 낮은 편임. 변화가 많이 없는 업계 특성상 일이 다소 루틴해질 수 있고, 사내 일부 상사의 경우 다소 본인 취향의 직원에게만 애정을 쏟는 경향이 있음."
101,엔자임헬스㈜,10654,업계가 그렇듯 아쉬운 연봉 여자들이 많아 기싸움 약간 있음
102,엔자임헬스㈜,10654,딱히 큰 단점은 꼽을수 없지만 여성 근무자가 꽤 많은 홍보대행사라 가끔은 딱딱한 조직 분위기를 느낄수도있음.
