,company_name,company_id,review_text
0,엔에스스마트,2567,"복지 無, 통신비 지원 조금 해주는게 전부. 연봉인상 인색함."
1,엔에스스마트,2567,배울점이 없다. 온보딩 시스템에 없고 일 가르쳐줄 선임도 없다. 현실에 안주하게 되기 딱 좋은 직장이다.
2,엔에스스마트,2567,저연차 개발자를 고용하면서 5년차 이상의 퍼포먼스를 요구한다. 회사가 개발한 서비스를 회사가 알지 못한다. 인수인계 없이 유지보수를 해야하는 업체도 존재한다.
3,엔에스스마트,2567,"분명 개발이 주인 회사인거 같지만 실상은 개발자 대우 없고 하드웨어 유지관리하는 팀이 강세인듯? 직원 나가면 안뽑아줌, 연봉인상 박함, 설 명절 상품권 주는거 말고 복지 1도 없음. 업무체계 개판 5분전. 너무 많은데 손가락 아파서 그만씀"
4,엔에스스마트,2567,"현장 업무를 보는 하드웨어팀과 개발팀이 있지만 개발자가 하드웨어 업무를 보는 경우도 잦으며, 본인의 역량이 높거나 다룰줄 아는 기술이 많다면 업무량이 증가함. 개발기간이 짧은 편임. 복지없음."
5,엔에스스마트,2567,병원에서 항시 돌아가야 하는 업무의 솔루션이기에 장애에 대한 부담이 크고 유지관리 업무의 중요성이 매우 높다.
6,엔에스스마트,2567,병원 업무가 끝나고 설치작업이 진행되다보니 설치땐 새벽까지 작업해야되는 경우도 많음(개발자 포함)
7,엔에스스마트,2567,의료 van수수료 말곤 없음. 미래 불확실 급여 채불 종종 일어남. 직원들 업무마인드 대충대충. 능력없고 사내정치 유도하는 실세. 기업 자금 경로 불투명. 지방 장기 출장.
8,엔에스스마트,2567,아부를 잘하고 정치를 잘해야 이쁨받음.직원들 마인드도 잘하고자하는 마음 없음. 다들 눈치보는 분위기
