,company_name,company_id,review_text
0,엠씨에스솔루션,1757,"비효율적인 문서 작업, 영업직 외에는 우대x, 대표 중심의 비효율적 경영, 영업 외 업무는 물경력, 포괄임금제"
1,엠씨에스솔루션,1757,회사규모가 작아서 조직이 큰 회사의 시스템을 배우고 익히기에는 부족함이 있다.
2,엠씨에스솔루션,1757,연봉이 좀 짠편이 있다 업무강도가 부서바이부서라 편차가심하다 돈을 좀 더 줬으면 좋겠음
3,엠씨에스솔루션,1757,관리팀의 관리자 부재. 주임~대리급을 관리자로 채용하나 매주 보고에 회의를 진행하는데 바로윗상사가 대표. 커리어를 쌓아가기엔 비효율적.
4,엠씨에스솔루션,1757,"일부 시스템 개선이 필요함, 내부 회의가 많은거 빼고 다 좋음"
5,엠씨에스솔루션,1757,"회사에 사람이 없고, 체계적인 시스템이 갖춰지지 않아서기술적으로 배울 수 있는 부분이 없고, 사람이 없다보니 주업무가 아닌 잡일을 하는 경우가 많음. 또한 기술력이 낮다고 생각함."
