,company_name,company_id,review_text
0,엠에스아이코리아,8126,"삭막한 분위기, 사원급들은 돌아가면서 일주일씩 탕비실 청소, 복지랄게 딱히 없다, 직원들 퇴사가 잦음"
1,엠에스아이코리아,8126,기업규모 대비 연봉이 짜다..식대제공 안됨 이것외엔 없음
2,엠에스아이코리아,8126,급여가 매출대비 낮은편이고 직무를 배우는데 한계가 있습니다
3,엠에스아이코리아,8126,연봉이 우선 소소함 관리자급 아니면 압박이 크지 않은듯?
4,엠에스아이코리아,8126,인수인계가 사실상 없다고 느껴졌고 처음에 일을 배우기가 매우 막막함. 업무에 따라 다르겠지만 면접 볼 때 못한다 말한 외국어가 너무나도 필요한 업무를 맡음
5,엠에스아이코리아,8126,연봉이 낮고 인상율도 높지 않아서 타사와 연봉 비교를 많이 하게됩니다..
6,엠에스아이코리아,8126,급여가 매우 낮고 올라갈 수 있는 한계가 분명해서 젊음을 불태우다 끝날 수 잇음
7,엠에스아이코리아,8126,임금이 적음. 서비스직이라 감정노동이 심함. 휴가가 쓰는 방법이 이상함
8,엠에스아이코리아,8126,서비스센터는 승진이 힘든곳 마음대로 연차를 흐거나 붙여쓰기 힘든곳
9,엠에스아이코리아,8126,목표가 높지 않고 요구하는것이 많지 않다보니 대신 거기서 돌아오는 금전적 댓가도 크지 않다. 모두가 그렇진 않겠지만 일부 관리자 직원의 능력치가 그렇게 높지 않다. 자신의 분야에서 잘 모른다는 말만 하는건 크게 문제가 있다
10,엠에스아이코리아,8126,사장이 퇴근을 안하면 전직원 모두 퇴근을 못한다. 진짜 심한 대만 꼰대들
11,엠에스아이코리아,8126,디자인팀은 자기할거다하고 6시땡하면 자율적으로 퇴근하지만 나머지부서는 사장이 퇴근하면 퇴근할수있지만 (눈치보면서) 사장이 퇴근하지않으면 약 20~30분뒤에나 (눈치보면서) 퇴근한다. 회사내 잡다한일은 부서 신입사원들이 다 해야된다. 연봉이 너무 작다.
12,엠에스아이코리아,8126,"마음 속 도화선에 불을 붙일거다. 애인이 있어야지 책임감 있는거다.  너 정도 능력으로 우리 회사 들어올수 있겠냐. 너 처럼 회사에서 뭐하는 지 모르면 퇴출당한다.  다른 사람은 욕먹고 죽을랑 말랑 버텨서 지금도 있다.  내가 너를 뽑았다. 절박하지 않으면 그냥 너는 잡무나 하게 하고 새롭게 판 짤거다. (신입 새로 뽑는다는 뜻)  니 능력갖고는 출장가서 유흥업소나 찾아서 칭찬 받겠지.  너 그 정도 간단한 일도 못하면 알바나 구해야 겠다. 니 선임은 죽어라 갈궈도 버텼다. 너도 그럴 수 있다.  니 업무 외에 다른걸로 갈구면 너 멘탈 나간다 내가 그렇게 해줄까?  요즘 세대 애들은 책임진적도 없고 무리를 주도 한적도 없어서 회사에 어울리기 힘들데 그래서 너도 그럴것 같아 그러면 우리가 어떻게 하는 줄 알아? 고용하지 않으면 돼, 그런 애들은 계속 갈아 치우는거지  -------------------------------------------------------  업무하면서 들은 덕담 모음 고소 안한걸 다행인줄 알아요.  대만계 회사라는게 얼마나 대단한지 모르겠지만. 내리갈굼이라는 명목 하에 3개월간 신입 갈구는건 들으면서 참 멋지다고 생각한다.  군대에서도 그렇고 폐쇄된 무리에서는 사람이 옳고 그른 부분을 판단하기 힘들어진다. 아~ 내가 받는 부조리함이 당연한 것이구나. 내가 못나서 그렇지. 얘는 내가 받은 것 처럼 해야겠네... 라고 세뇌된다."
13,엠에스아이코리아,8126,보수적인 성향이 크다 보니 신입사원들이 자주 퇴사를 한다. 이는 기업의 이미지에 큰 타격이 있을 것이며 회사 내부 젊은 사원들의 분위기도 좋지 않는데 그 원인 파악과 개선에 여지가 없음 또한 디자이너를 오퍼레이션으로만 생각한다는 점이 너무 아쉽다. 업무적 설득 대화가 기업의 계급으로 막히며 눈치를 본다는 점이 매우 아쉽다.
14,엠에스아이코리아,8126,복지 제도가 없고 업무의 체계가 없어 업무를 배우기에는 부족함 업무를 배운다고 해도 끼리끼리의 문화가 큰 곳이어서 우물안의 개구리가 될 가능성이 높고 일정 수준 이상의 경력 쌓기가 힘든 곳 승진의 체계가 없어 경력이 많음에도 불구하고 적은 경력으로 이직한 직원 보다 직급이 낮을 수 있고 사장만의 기준으로 승진이 됨 반면 사장의 결정으로 인해 승진이 되므로사장의 눈에 들면 쉽게 승진이 가능함 또한 영업 위주로 돌아가는 곳으로 영업을 위한 마케팅 활동이 주를 이룸 업무의 경계가 뚜렷하지 않아 떠맡지 않아도 될 일들을 자주 떠맡는 경우가 많으며 타팀에서 업무 요청이 와도 팀장이 커버하지 않아 욕먹지 않기 위해 스스로 불편과 고생을 감수해야함 겉모습은 외국계이나 지극히 한국 회사의 군대 문화를 가지고 있어 직급이 높다고 사람을 막대하는 상사가 종종 있음 이외에도 능력 부족인 타 팀원과 협업 시 그 부족함을 팀원의 팀장이 아닌 내가 채워야하는 경우도 부지기수임 특히 업계 특성상 같은 업계로 이직은 쉽게 가능하나 타 업계로 이직하기엔 한정적인 경력만 쌓게됨 업계 내 최저 연봉이지만 야근 수당이 별도로 없음에도 야근을 당연시 여기는 사람들이 대부분임
15,엠에스아이코리아,8126,"업무에 대한 매뉴얼도 없는데 인수인계가 엉망이고, 사용하는 자체 전산시스템이 완성도가 낮아 적응하기까지 시간이 걸립니다, 또한 개인적으론 해당 부서에서 왜 처리하는지 이해가 안되는 업무가 몇몇 있었습니다."
16,엠에스아이코리아,8126,업무가 끝났는데도 사장이 퇴근을 하지 않았다면 사장 퇴근 후에 퇴근 가능함. 사장 보다 퇴근 먼저하면 욕 먹을 수 있음. 항상 눈치 보고 90도로 인사하고 퇴근 늦게 하고 비효율적인 시간 낭비가 많음. 일주일에 한번 씩 근무 중에 청소 업체가 와서 청소를 하는데 사무실내 창문도 없어서 공기도 좋지 않은데 청소를 함. '근무 중에 청소' 라는 게 상식이 있는 회사이고 생각이 있는 관리부 직원들 이라면 퇴근 후에 청소팀을 부르거나 점심시간을 이용하여 청소를 할텐데. 참 안타까움. 여성이 다니기엔 힘듦. 남성들의 비밀스러운 문화와 텃세가 심함. 외국계 라고 하지만 '이름만 외국계' 라고 생각하면 됌.
17,엠에스아이코리아,8126,"당연 디자인회사는 아니다 보니 디자이너에 대한 고충을 이해하기 어렵고 소스나 폰트도 갖춰지지 않았던 상태. 이미지사이트 건의했고 결재는 해주었지만 누구하나, 같은 디자이너 마저 달갑지않아 했던 현실. 그러면서 원하는건 고퀄리티?. 지금은 디자이너들 없으면 안될정도로 활용 엄청함. 기존에 고퀄리티 뽑아냈던 디자이너가 있었는지 아이러니. 사업확장으로 경력직 디자이너를 충원하고, 그만큼 퀄리티와 비중있는 업무를 요구함에 비해 경력은 무시 이해는 부족. 사업확장으로 더 많은걸 원했다면 같이 병행할 퀄리티 좋고 실력있는 팀장급이 필요. 왜 더 경력 많고 장기근속한 디자이너에겐 요구하지 못했는지? 눈가리고 아웅인지, 아니면 퀄리티를 포기하는걸 추천. 비중있는 업무를 맡길 요구하되 경영진과 대화할 일이없으므로 열심히 달려왔으나 결과적으론 회의감이 큼. 퇴사할때나 대화했던듯 그러니 소통도 어려움. 매번 고민하며 열심히 해도 누가 어떤팀에 어떤작업을 했는지 모르니 보람이 없음. 같은 디자이너마저 이미지사이트가 잇음에도 불구하고 같은 회사라며 당연하게 원본요청, 소스 짜집기에 복붙하기가 난무. 시안 참고가 아니라 결국 본인이 편하고 쉽게 작업하려는거 아닌지? 작업물이 근거고, 아직도 울궈먹기 시전중. 만드는사람 따로있고 사골마냥 울궈먹는사람 따로있는건지? 디자이너고 실무자라면 뻔히 눈에 보이며, 상실감이 듦. 승진에 대한 욕심있고 본인이 디자이너라면 동료가 작업한거 적당히좀 짬뽕하고 울궈먹고, 디자이너로서 인정받길 바란다면 본인 스스로 포트폴리오 쌓으며 역량을 펼치길. 그렇게 작업하면 대체 누구의 포트폴리오인지? 해가바껴도 동료에게 홈페이지/서버 기본적인 공유조차 안해주는 이상한 시스템. 페이지만 주구장창 만들고 경력직 디자이너 단물만빨림."
18,엠에스아이코리아,8126,외국계지만 대만기업이므로 급여가 낮음 한국지사라는 포지셔닝이 가져오는 업무의 한계 점점 축소되는 컴퓨팅 및 노트북 시장
