,company_name,company_id,review_text
373,예스이십사,6058,승진체계가 잘 되어있지 않음 사원 대리 과장(파트장 또는 팀장) 선임팀장(본부장) 이사 대표이사 회장 구조. 단촐. 승진기회 아주 어려움 . 팀마다 다르나 의욕없고 노는 사람 많음. 열심히 일하는 사람만 함. 매출압박 심함. 매출 문제로 여의도 공원을 뛰게 하는 등 이상한 징벌있음. 회장 의견이면 수직소통. 개발자 부족. 개발 리소스 부족. 변화를 두려워하는 분위기. 의욕 없는 직원 꽤 있음.
374,예스이십사,6058,일이 체계적이지가 않습니다. 일을너무 중구난방식으로 했었네요ㅠㅠ
375,예스이십사,6058,사무실 분위기가 전반적으로 산만하였음. 레이아웃에 전혀 신경쓰지 않는 느낌. 부서간에 커뮤니케이션이 부족함.
376,예스이십사,6058,"8시 출근 6시 퇴근, 복지제도가 거의 전무, 보수적인 관리 시스템, 지나치게 많은 회의"
377,예스이십사,6058,"8시 출근 6시 퇴근을 강제시킴. 8시 1분에 와도 지각사유서 결재받아야 하는 황당한 규정. 겉만 인터넷 서점일 뿐 경직된 유통회사. 개인적인 조직 분위기, 계약직 사원 1인에게도 매출 실적을 강요하는 불합리한 부분. 복지포인트는커녕 그 흔한 회사콘도도 없음. 직원 복지에 관한 시스템은 거의 없다고 할 수 있음. 인센티브는 있으나 받는 부서만 받고 못 받는 부서는 영영 못 받음."
378,예스이십사,6058,"가족회사. 멈춰진 시스템. 업무적으로는 발전이 없음. 매출증대에 있어 굉장히 예민하고, 그외엔 효율적인 업무시스템, 이라던지 근무자들을 위한 배려는 적음"
379,예스이십사,6058,매출부서의 경우 매출달성에 대한 압박이 있음. 미달성 시 아침 달리기 등의 다소 비합리적인 처벌(?)이 존재(달성시엔 인센티브로 보상). 여성직원이 많으나 팀장급 이상은 모두 남성. 승진 및 인사평가의 기준이 다소 불명확함. 자유로운 분위기 이면에 약간의 뒷담화(?) 문화가 공존.
380,예스이십사,6058,"중소 기업, 오너 기업의 문화가 남아있다. 이미 가족같지 않은 규모인데 가족같은 분위기를 강요받는 느낌이랄까. 책이라는 제품군 특성 상 가격 경쟁력 말고는 특별히 전략이 없는 느낌이라 서비스만 맡는 사람들은 상대적으로 지원이 약하다는 생각이 든다. 개인의 성장 부분에서는 다소 의문점. 아 아직도 페이퍼로 결재를 올려야한다."
381,예스이십사,6058,매출부서/비매출부서간의 차이가 좀 있는 것 같다 매출부서가 우대받는 것 같다. 시스템팀의 인력/대우가 부족하다고 들었다
382,예스이십사,6058,"승진 힘듦, 복지 제도는 전무하다시피.., 도서사업부의 자부심이 눈꼴시릴 정도."
383,예스이십사,6058,"본사의 경우, 사업부서의 경우 최근 몇년간 신규채용이 없다시피 한다. 나갈 사람이 없다는 것, 즉 사업부에 있으면서 다른 산업군에 접목해서 이직할 곳이 별로 없단 소리다. 이 회사가 최고라고 쓰고 딴회사 가면 밑천 드러난다고 읽으면 될 듯. 동종업계로만 이직을 할 수밖에 없는데 연봉이 깎일 확률이 높기 때문에 아무도 안감.  본사의 경우, 사업부서 이외의 경우 퇴직자가 많은 편. 즉 짜증난다는 것, 특히 시스템쪽은 들어왔다가 나가는 사람도 많고 버티다가 못견디고 지지치는 사람도 많은 편. 시스템이 낙후되어 가는 게 보이는데 일의 우서순위는 무시하는 처리방법과 적은 투자에 다들 힘들어한다."
384,예스이십사,6058,비지니스나 업무범위에 비해 인력이 적은 편. 근무시간은 9시간. 8시출근 복리후생은 보통이하.
385,예스이십사,6058,IT회사는 아님. 상황에 따라 매우 다름. 요즘은 정치좀 한다던데...
386,예스이십사,6058,보통 아줌마들이 많은데 파벌이 약간있지만 분위기는 괜찮음 성수기때는 많이 힘듬 하지만 보너스수당 줌!
387,예스이십사,6058,"경력 입사시 직급 및 연봉 하락폭이 큼, 대중교통이 불편/주차장 없음"
388,예스이십사,6058,"본부마다 다르지만 매출에 대한 압박 심함, 공채가 대부분이라 경력직은 견딤에 있어 조금 힘듬"
389,예스이십사,6058,야근이많고 일이 대체로 몰리는 편인듯...업무강도가 약하진않음
390,예스이십사,6058,기본 근무시간이 길고 특별히 복지가 없음.
391,예스이십사,6058,승진 체계가 명확하지 않아서 힘들수도 있다. 일반적인 IT회사라고 쌩각하시면 안됩니다.
392,예스이십사,6058,사람을 많이 뽑지 않는것이 제일 큰 문제
393,예스이십사,6058,"물류 현장사원 출신의 관리자 밖에 없어서 그런지 과도한 자부심으로 타 기업의 발전을 눈여겨 보지 않음. 점점 우물안 개구리 신세. 주말, 공휴일이 의미가 없고, 야근은 당연히 해야 하는 곳"
394,예스이십사,6058,1위라는 자만심 때문에 신규 사업에 대한 추진력이 약하다. IT 지원 취약.
395,예스이십사,6058,기준이 없고 기본적으로 필요한 요소라도 부족한 부분이 많으며 조직화 되지 않은 부분들이 있습니다. 복지가 없습니다. 개인주의적인 성향의 사람들이 많습니다.
396,예스이십사,6058,"복지 제로, 새롭게 변화하는것에 제한이 많고, 팀별 인원이 적다."
397,예스이십사,6058,복지제도가 없음. 동기부여가 되지 않음
398,예스이십사,6058,"도서 MD를 제외한 부서는 약간 아웃사이드 느낌, 오너 경영이라 좋은 면도 있지만 조직장들이 너무 눈치를 봄, 복리후생 거의 전무, 타 부서간 교류 거의 없음"
399,예스이십사,6058,완전 여고 분위기. 왕따도 시키키도하고 갑마인드 굉장히 강하다.
400,예스이십사,6058,근무시간이 타 회사 보다 한시간이 길다. 하지만 그만큼 추가 수당이 나온다.
401,예스이십사,6058,"한시간 더 근무 함 (8:00-6:00), 24시간 운영 되는 만큼 낮이고 밤이고 긴장의 끈을 놓을 수 없음. 할인 제도나 보너스 같은 복지가 거의 없음 (연차수당은 있음) 인력이 부족한 편 야근은 부서마다 틀림"
402,예스이십사,6058,"승진이 어려움, 복지 전혀 없음, 직원의 미래 따위 고려하지 않는 인사 이동과 업무 분장"
403,예스이십사,6058,있던 복지도 없애다 보니 이제는 없앨 복지도 없는 상황. 개개인의 창의성을 없애 주는 회사. 도서 사업부의 일개 팀원은 지원부서의 팀장과 맞먹는 파워를 가진 회사.
404,예스이십사,6058,"이해할 수 없는 인사평가, 인제경영은 먼가요? 효율적이지 못한 업무와 개념없는 기업문화"
405,예스이십사,6058,대리에서 과장으로 승진하기는 하늘의 별따기임. 직원 복지 전무.
406,예스이십사,6058,연봉 인상폭이 낮아서 인생 주기에 맞춘 재무설계 불가. 직원들이 서로 친하게 지내지만 그만큼 관계 스트레스는 분명히 존재함. 연봉 외에 기타 복지는 없음.
407,예스이십사,6058,복지제도 무(회사 소개에 나와있는 복지는 사실상 없다) 여성이 지나치게 많으며 여중 여고의 문화를 가졌다(겪어본 사람은 알듯) 불합리한 인센티브 제도 상사들과의 커뮤니케이션이 좋지 못하다 무늬만 아이티이지 사실상 물류. 쓰리디 삽질 경력을 키우기 좋은 조직은 아님. 자기 계발은 외부에서 알아서 해야한다 인사제도가 엉망. 10년 넘게 다닌 대리들이 수두룩 매출이 안좋으면 새벽 6시 30분에 여의도 공원을 달려야 한다 출근시간이 아침 8시이고 퇴근은 저녁 6시 현재 신입을 뽑은지 한참 되었다. 업무 배분이 공평하지 못하다
408,예스이십사,6058,"4대보험과 경조사 이외의 직원복지는 전무. 정규직 공채의 경우는 연봉대우가 좋으나 경력직의 경우 상대적으로 공채보다 연봉이 낮은 경우들이 종종 눈에 띔. 정규직 공채는 학벌이 뛰어난 편이나 회사 내 직무개발 프로그램이 없고, 허드렛일 중심의 업무만 주어지는 까닭에 동기부여 요소가 없어 입사 1년 내 이직율이 높은 회사임. 매출부서는 매출이 안나올 경우 회장의 지시에 따라 약 한달간의 아침조깅 벌칙이 주어짐."
409,예스이십사,6058,"온라인 기업은 대부분 트렌드가 급속히 변하면서 배울것도, 도전할 것도 많은 데 비해 1위라 그런지 조직 내에서 '도전'하려는 분위기가 거의 전무한 느낌. 직업적 전문성 역시 스스로 노력하지 않는다면 업무를 통해 키워나가기 어렵다."
410,예스이십사,6058,개인별 과다 매출목표로 인한 개인주의적 성향. 도전을 두려워하는 1위 기업 행태. 경영 승계를 위한 비효율적인 것들이 종종 있음. 업무 부하가 심함. 복지가 전혀 없음. 중간 관리자의 도태. 느린 진급. 휴가 잘 못씀.
