,company_name,company_id,review_text
249,예스이십사,6058,상여없음. 지원부서는 인센도없음. 낮은 연봉인상률. 인성문제상사. 사람들이 지속적으로 퇴사하고있으나 전혀 달라질 생각이없는듯함.
250,예스이십사,6058,비합리적 인사평가 오래된 구조로 이미 매너리즘에 빠진회사 팀장은 리더십 교육좀 보내자 몇몇오래 다닌 직원들의 텃세 새로운 사람들 거의 못버티고 떠나는데도 변하는건 없음
251,예스이십사,6058,네임벨류 있는 기업 치고는 연봉이 적었음 인하우스 디자인 특성상 업무 자체가 지루하고 반복 될 수 있음
252,예스이십사,6058,"연봉이 많지 않고, 복지제도가 거의 전문함. 의사결정에 많은 시간이 소요되어 프로젝트 진행속도가 느림."
253,예스이십사,6058,흠.....사람들의 퇴사 원인을 알지만 바꾸려고 하지 않는 회사
254,예스이십사,6058,남녀 다 같이 일함에도 그 안에서도 남자가 해야 할 역할을 정해둠. 힘을 조금만 쓴다고 해도 남자가 해야 됨.
255,예스이십사,6058,경영진이 실무자의 업무방향을 잘 모르고 있음 연 평가제도가 비공개로 불 공평함
256,예스이십사,6058,온라인 기반의 사업 분야라고 해도 사람에 대한 애정은 조직에 필요해 보인다.
257,예스이십사,6058,업무를 하고 있는 와중에도 일이 밀리면 팀장들이 불같이 화를 냄
258,예스이십사,6058,콜실적에대한 압박이있고 한가할때는 반강제적으로 무급휴가를 써야하고 따로 휴게시간이없어서 점심시간을 제외하고는 따로 커피를 사오거나 별도 쉬는시간을 가지는건 불가함(관리자급아니고는) 앉아서 기계처럼 콜만받다보니 지치고 힘듬 진상고객등 정신적인 스트레스 무시못함.
259,예스이십사,6058,회사 규모에 비해 직원들 복지가 없음 복지가 없다는 거 하나만 보더라도 경영진에서 직원들을 어떻게 생각하는지 알 수 있지 않을까..
260,예스이십사,6058,고인물이 많아 성장성은 떨어져보임. 여초회사. 피곤함.
261,예스이십사,6058,"- 여자가 남자보다 1 호봉 더 낮고 대리진급도 1년 늦음 - 개인 커리어개발 ⭐진심 1도 안됨⭐ 직장다니면서 돈만벌면 된다고 생각했던 나를 커리어에 허덕이게 만들어줘서 고마울 따름. -고인물들 많아서 업무도 다 고정되어있음. 하던일 그냥 몇년씩함. 그리고 신입들도 똑같이 고인물되는 지름길 - 연봉인상률 매우 낮음 - 사무실에서 일 안하면 노는걸로 생각하는지 코로나 이 지경인데도 재택 절대 안함. 오른쪽,왼쪽건물 다 확진자 나와도 목숨걸고 회사 와야됨."
262,예스이십사,6058,"서로 소통 안 함. 이야기 안 함. 결정한 것 통보. 회의 내용 공유 안 함. 그냥 공유가 안 됨. 아는 사람도 없음. 담당자도 없음. 그런데도 유지가 됨....? 팀마다 책임 회피가 쩔어서, 이슈가 있는 거 알면서도 자기 팀 일 아니면 얘기 안함. 책임감 없어도 팀장. 올드해도 너무 올드한 서비스, 언제 탈피할라나. 사람 바뀌기 전엔 안될 듯. 정상적인건 대표 하나 같은데, 대표가 사람 볼 줄 모르는듯."
263,예스이십사,6058,은근한 꼰대적 분위기가 있고 무언가 열심히 하는 것을 다들 귀찮아 하는 분위기
264,예스이십사,6058,"연봉인상률 낮음, 불분명한 성과제도, 복지수준 미비, 의사결정과정이 늦음"
265,예스이십사,6058,단점은 야근이 많으며 여직원들이 가끔 남자직원에게 업무에 대해 짜증을 많이냄
266,예스이십사,6058,AR사원이 많아 그로 인해 변경되는 업무 내용이 많다.
267,예스이십사,6058,연봉. 연봉협상을 4월에 하는 회사가 있다? 업무가 단조로워서 공무원같음 지루함.
268,예스이십사,6058,출근 시간이 너무 이름 여자화장실 한층에 한개 있는데 두칸이라 타이밍 잘못 맞춰서 가면 항상 기다리고 양치도 기다려야함
269,예스이십사,6058,오너기업으로 회장의 권한이 너무 커 대표이사조차 몸을 사리는 경향이 있음
270,예스이십사,6058,"직원을 너무 소모품으로 생각하고, 필요없는 일에도 많이 투입시키는게 짜증남. 그리고 야근도 종종 있음."
271,예스이십사,6058,오전 8시 출근이라는 점은 상당한 압박감으로 작용이 된다. 직급에 따라서 불필요한 보고서 작성이나 회의등의 참석이 잦은 편이다. 기존에 개발된 코드 베이스들에 대한 문제점 개선이 필요하지만 이미 기존 구조에 익숙해진 구성원들로 인해 쉽지 않으며 개발 환경 또한 변화하는 요즘 기준과 비교했을때 너무 뒤쳐진 느낌이다. 자신의 실력 성장을 가파르게 하고 싶다면 이곳에서의 생활을 고민을 고민 해봐야 한다.
272,예스이십사,6058,직원의 의욕을 꺾는 천부적인 능력이 있는 임원진 및 관리자들 IT기업이 맞나 싶은 회사 문화와 분위기
273,예스이십사,6058,처음일땐 잘 모르지만 근무하다보면 조용한데 거기서 은근한 신경전이 있음. 워낙에 근무공간이 조용해서 무슨말하는지 다들림.
274,예스이십사,6058,8시출근 6시퇴근으로 근무시간이 한 시간 더 길다. 기본적인 최소한의 것 외에 특별히 복지라고 할만한 건 없음.
275,예스이십사,6058,"AR사원의 비율이 많고, 그로인해 사람들이 자꾸 바뀐다. 이는 업무에도 많은 영향을 끼치는 것 같다."
276,예스이십사,6058,기업 매출에 비해 복지가 취약한편 그러나 계속 나아지고 있음.
277,예스이십사,6058,문서 작업 다수 버티지 못하면 구제가 어려움 보고 시스템
278,예스이십사,6058,여름방학이나 겨울방학이 되면 성수기때라 단기 아르바이트생을 많이 뽑는데 그에 비해서 식당이 비좁아 밥을 먹으러 가면 긴 줄을 서서 기다려야됐음
279,예스이십사,6058,개인의 발전이 전혀 없으며 회사의 지원도 없음 복지도 없음
280,예스이십사,6058,"현 경영진의 열정,방향성,전문성 등이 많이 부족함. 기업의ㅇ세대교체가 안좋게 진행되고 있는 케이스라고 생각됨"
281,예스이십사,6058,"워라밸이 훌륭한 만큼 하는 일이 없다, 사고 나지 않을 정도로만 현행을 유지하고자 하는 분위기가 발전을 저해함, 조직 내 자아도취가 심함, 회사에 대해 쓴소리를 하는 이가 아무도 없음, 블라인드도 조용함"
282,예스이십사,6058,출근8시 퇴근 6시 추가급을 주긴하지만 근무시간이 긴 편이다
283,예스이십사,6058,답답한 조직 구조. 낡은 마인드의 상사들과 경영의 불편함을 고스란히 겪을 수 있음. 낡은 사무실도 단점.
284,예스이십사,6058,오너가 능력이 없음. 직원들끼리 안친함.그렇다보니 서로 이해가 안되고 융화가 안됨. 사업부는 지원부 욕하고 지원부는 사업부 욕하고
285,예스이십사,6058,8시출근 6시퇴근 한시간 더 근무함 도서쇼핑몰 1위이긴하지만 시스템이 너무 낙후됨
286,예스이십사,6058,승진이 오래걸리고 힘듬. 야근눈치안보고 업무강도가 높지않은대신 본인 발전을 기대하기는 힘듬.
287,예스이십사,6058,절대 적인 그분의 마인드에 따라서 업무의 중요도가 달라진다 실시간적인 업무 지시가 위에서 부터 내려온다.
288,예스이십사,6058,복지가 별로 없고 생일 및 명절에 예스24 상품권으로 줌. 주차장이 협소하여 자차를 끌고 출퇴근 하기 어려우며 여의도에 있어 사무실에서 항상 시위 소음에 노출되어 있음. 여성 직원 비율이 높음
289,예스이십사,6058,배울게 많지 않은 것같음 연봉인상률ㅎ 배우는건 별로없는데 바라는게 많음 명절 상여금 예스24상품권으로 찔끔 줬었는데 지금도 그런가모를
290,예스이십사,6058,8시 출근. 복지가 거의 없음. 실적 나쁘면 아침 7시 남들 출근하고 있는 시간에 공원 뛰게하는 굴욕적인 관행이 있음(이건 정말 도움 안됨)
291,예스이십사,6058,때로는 업무량이 밀려 바쁘기도하지만 업무량만채우면 정시에 퇴근할수있지만 대부분 업무 할당량을 채우지못해서 야근을 권유하는 경우가 많습니다. 일일 업무량을 수행해야하기때문에 강요는 하지만 살짝 눈치는 볼수있습니다.
292,예스이십사,6058,급성장한 조직이라 규모에 비해 체계적이지 않음 IT인데 IT에 투자를 안 함 보편적 복지가 부족함
293,예스이십사,6058,경력자 연봉 업무 후려치기. 복지 전무. 무능력한 고인물 직책자들의 대환장파티
294,예스이십사,6058,"개발 진행 시, 매번 기획이나 방향이 달라지며 프로젝트 관리 하는 주체하는 사람 역할이 명확하지 않다. 개발자 스스로 방향을 정할때도 있으며 대 부분 대표님 지시에 따라서 프로젝트가 흘러 간다."
295,예스이십사,6058,업무강도가 높지 않은만큼 연봉인상률은 높지 않음. 승진의 기회는 다소 적은편이고 승진사례도 보기 어려움
296,예스이십사,6058,배울게 없다... 경영진에게 직언을 하는 임원은 없다
297,예스이십사,6058,승진힘듬. 회장.대표이사 지시사항으로 긴급처리 일이 많음.
298,예스이십사,6058,출근시간8시-6시퇴근. 복지 전혀없음. 먼가 회사 시스템의발전이나 개선을 하려고하면 나만 답답해짐
299,예스이십사,6058,전문성을 키우기 어려움 8시 출근-6시퇴근 하는 긴 근무시간
300,예스이십사,6058,"아침 8시출근 - 6시 퇴근, 공무원 같은 수동적인 기업문화, 오래된 기업이라 그런지 시스템, 업무 프로세스가 낡았음"
301,예스이십사,6058,"매출본부가 갑이고, 그 갑질이 은근 짜증남. 그리고 기술적으로 배울게 없는 회사. 경력 5년 이하는 절대 비추"
302,예스이십사,6058,"하지만 8시 출근 발전? 그건 전기를 만들 때 사용하는 단어이고, 여기 직원 하나하나 잡고 물어보면 답 나옴. 여긴 최악"
303,예스이십사,6058,효율적으로 업무가 돌아가는지는 의문 승진에 한계가 있는 것 같다.
304,예스이십사,6058,뭐 하나 물어보면 제대로 돌아오는 답이 없음. 피드백이 계속 늦어지니 일의 진행도 늦어짐.
305,예스이십사,6058,승진이 너무너무 힘듬. 대리 다는것도 오래걸린. 개인 능력향상엔 정말 꽝
306,예스이십사,6058,일할때 눈치가 좀 보인다. 윗사람들이 아직 회식이나 이런부분에 대해서 강요까진아니지만 눈치를 주는편
307,예스이십사,6058,"전략을 기획하는 사람이 별로 없음 직급 체제가 나무 낮음 사원->대리->과장(매니저)->팀장 차,부장 직급이 없음"
308,예스이십사,6058,대리 달려면 최소 60개월 다녀야 함 과장은 십년은 다녀야 ㅎㅎㅎ
309,예스이십사,6058,"일부 부서를 제외하면 유명무실한 인센티브 제도 직원 개개인의 능력 발휘하기 어려운 의외로 수직적인 구조 노조가 없고 직원 간 단합, 교류도 거의 없다시피 함 복지라고 할 게 거의 없음"
310,예스이십사,6058,고여있는 윗사람층이 아주 두터움 / 도전적인 분위기는 아님 / 8시 출근 6시 퇴근
311,예스이십사,6058,무능한 팀장 본부장급 발전없이 업계에서 퇴보하는 곳 부처의 마음 필요
312,예스이십사,6058,"단점이라기보단 개인적인 생각이지만, 직원들 대부분은 이대 또는 숙대 출신으로 학연 위주의 채용이 의심스럽다."
313,예스이십사,6058,"여름휴가 없음 개인휴가에서 써야함, 공채와의 연봉 차이가 있음, 대표가 하는게 없음, 개발직군은 인력 갈면서 일해야함 일정통보, 기획자 없고 정책관리 정리해놓은게 없어서 코드보면서 사업부한테 다시 알려줘야함 지원부서는 외주취급 승진 연차가 너무 길고 인상율이 적음"
314,예스이십사,6058,단순 작업인 것으로 소모인력으로 구성됨. 아르바이트/ 계약직에 있어서는 한계가 있는 직종임. 업무마다 다르지만 내가 일했던 분야는 그랬음.
315,예스이십사,6058,모든 팀의 월1회 회장님 보고가 있음. 연1회 사내등산 대회.
316,예스이십사,6058,8시출근 낮은 연봉 복리후생이 전혀 없음 비전이 크지 않음
317,예스이십사,6058,"복지없고, 연봉짜고 (승진해도 5% 승진률 실화?), 상여는 있다만, 개발 30%, 사업부 70%이고 개발과 사업부 인력 구성이 2:7인 회사에요."
318,예스이십사,6058,"공채위주, 이상한 조직 문화, 오너 일가가 제일 문제..... 딸이 제일 문제.."
319,예스이십사,6058,근무 환경 자체는 열악하다. 특히 한겨울에는 외부에서 일을 할 때가 많아서 건강이 많이 안좋아진다. 그만큼 퇴사도 많다.
320,예스이십사,6058,엔지니어에 국한된 것만 그런지는 모르겠지만 업무에 익숙해지고 년차가 쌓여가면서 능숙해지고 안정된 업무수행 능력을 갖추게 되고 이에 상응하는 급여 인상을 원하는 부분에 대해 다소 아쉬운 대우가 있습니다.
321,예스이십사,6058,8시 출근 / 경영지원부서는 야근 존재 / 복지의 부재
322,예스이십사,6058,고등학교 같은 끼리끼리의 여초 문화가 웃김. 현실을 알지 못하는 상부의 지시를 거역하는 사람 없음
323,예스이십사,6058,복지가 별로 없음...상여금도 예스24 상품권으로 줍디다 ㅠㅠㅠ
324,예스이십사,6058,복지가 너무 없어서 일의 의욕이 생기지 않습니다. 동기부여 할만한 것들이 많이 부족합니다.
325,예스이십사,6058,"근무시작 시간이 8시부터이며, 일 근무시간이 9시간입니다."
326,예스이십사,6058,비효율적인 면이 다소 없지 않아 성향에 따라서 기업의 단점이 부각되어 보이기는 하나 잘 살펴보면 장점이 있으므로 마인드 컨트롤이 강하게 요구됨
327,예스이십사,6058,전체적인 도서 시장 상황이 안좋음. 오너의 능력이 검증 안됨. 할많하않.
328,예스이십사,6058,관리자들이 일방적으로 지시를 내리고 사원들은 군소리 없이 따라야 하는 분위기. 도서 물류에서 1위다 보니 현장에서 다뤄야 하는 책의 양이 무시무시함. 오래 일해도 챙겨주지 않음.
329,예스이십사,6058,고인물... 조직자체의 혁신이 부족함 매출에 비해 직원복지가 약하다 성장동력이 없음
330,예스이십사,6058,기존 시스템에 대한 기술부채가 상당히 높은 편이고 단기간에 이를 모두 없앤다는 것은 사실상 불가능.. 무엇보다 변화하는 개발 환경과 문화에 비해서 상당히 낙후된 환경은 높은 마이너스 요인..
331,예스이십사,6058,뒷담화 많음 도대체 왜 저럴까 하는 사람들이 많고 유독 한사람 목소리를 출근부터 퇴근까지 들어야됨
332,예스이십사,6058,"배송 항의전화가 많이 옴. 전화 빗발칠 땐 화장실 자주 못감. 지금은 어떨지 모르겠는데 내가 근무할 당시엔 점심에도 전체의 반은 밥 먹고,반은 전화를 받아야 했음. 정신적 스트레스 심하고 이직률 높음."
333,예스이십사,6058,수직적인 분위기. 임원진의 무리한 요구가 많고 투자는 없는데 매출을 올리기를 요구함. 사내 소문이나 비방이 심함.
334,예스이십사,6058,야근수당이 없고 지각에 칼처럼 정확함. 복리후생이 빈약함.
335,예스이십사,6058,업무가 매우 루틴해서 초반엔 적응이 쉽지만 연차가 쌓일수록 지루함이 커짐. 3일 이상 연차 불가능. 일주일을 통으로 휴가 가본적 없음. 업무성과에 따른 인사평가보다 윗사람과의 친분이 다 중요함.
336,예스이십사,6058,남사원들한테는 야근 압박과 매출 압박이 심함 특히 남자 사원들한테는 주중 및 주말에 대한 야근 압박이 심하고 개인적인 일이 있음에도 안보내준다
337,예스이십사,6058,의욕없는 조직 분위기 / 새로운 걸 도전하고 발전시키기는 어려움
338,예스이십사,6058,이커머스 회사치고 이해할 수 없을 정도로 보수적인 분위기
339,예스이십사,6058,소모적인 경력관리 여건과 업무처리와 편파적인 인적평가로 인한 피해 가능성
340,예스이십사,6058,체계가 없음. 주먹구구식이 많음. 시스템보다 사람으로(?) 해결하는 경우 많음.
341,예스이십사,6058,일부 부서는 환경 개선이 필요. 사내 여자가 많음에도 불구하고 성희롱 등에 대한 대처가 미흡하다.
342,예스이십사,6058,"- 각 사업팀마다 장단점의 차이가 너무나도 큼. - 꽤 철저한 가족경영. 소수의 취향과 기분에 따라 사업방향이 자주 바뀜 -> 분기별로 신규사업을 시작했다가 엎기도 했다가.. - 헤드가 대부분 남자이다보니 줄타기, 정치질은 굉장히 심함. - 최소 회장 혹은 이사를 대동한 분기보고가 1년 최소 4번 (전 팀원 참여). - 영업파트는 부서불문 대단히 압박 당하는 편. - 칼퇴에 대한 뒷감당은 부서별로 상이. 철면피면 상관없음. ex) 추가수당 없이 새벽 퇴근, 주말출근 후 연차도 아닌 반차 쓰는데 질색함. - 회사가 먼저 나서서 복지나 급여를 개선하려는 곳은 전혀 아님. 직원한테 돈 들이는 일에 있어서 무척 인색하다는 느낌 - 10년차 혹은 그 이상 다닌 대리/과장급 많음. 근데 2~5년차들의 이직/퇴사율은 부서를 막론하고 굉장히 높은 편. 승진이 밀린다고 해야하나.. - 실적 떨어지면 전 팀원이 새벽에 나와서 임원진과 여의도 공원 걷고 모닝커피 마심 ㅎㅎ"
343,예스이십사,6058,1시간 초과 근무. 과한 압박. 인센티브 제도의 공평성??. 가족경영. 인원 적음. 빡셈. 승진어려움.
344,예스이십사,6058,주말 등산... 새벽 조깅 ... 비전제시 없음 ... 실무자만 쪼음..
345,예스이십사,6058,"내부 인력도 갈겠지만 내부 인력보단 외부 경력 직원 갈아 만드는 느낌. 회사에 갈아져서 그런지 다들 뭔가 소소하게 이기적임. 뭐 사람탓 보단 회사 탓을 하겠음. 8시출근 18시 퇴근은 어떤 인간 발상인지 고리짝 사상에 박혀있음. 교통도 거지같은 편인 관계로 영등포구, 그 외 교통이 편하다 생각하는 사람만 있기를...^^;;"
346,예스이십사,6058,매뉴얼 없고 체계적이지 않고 큰 규모에 비해 시스템 없이 개개인의 능력에 크게 기대는 형태로 되어 있다. 인센티브도 인사평가도 이상한 구조.. IT에 투자좀 하고 괜히 1시간 더 근무하는 거 없애면 좋겠음.
347,예스이십사,6058,"첫 회사인 사람들이 오래 머물러 꼰대 마인드. 생일축하비 냄 반차,연차 쓰는 사람들은 안 내도 됨; 싫은사람있으면 연차 쓰면 됨. 낸 돈이 있어도 내 생일날 연차자 많으면 못받음. 내 생일 오기전에 나가면 내고만 퇴사. 승진할때 이 회사 경력만 쳐줌 10년 경력이여도 들어온지 1년이면 걍 1년 경력임. 나가면 해야하는 뒷수습이 귀찮아서 이유불문 잡아놓음."
348,예스이십사,6058,오래된 조직이 많아 인사적체 있음. 오너쉽이 강하고 자제들이 경영에 참여하면서 전문적이지 않은 방향으로 갈때 있음. 복지 없음. 동종업계대비 초기 연봉은 높을수있으나 연봉인상률 낮음. 출근시간 8시.
349,예스이십사,6058,"80년대 꼰대 마인드, 위에서 하라고 하면 무조건 해야됨, 직원복지 0프로, 다른기업보다 한시간 더 일하도록 하면서 연봉은 짬! 주말등반, 주말 워크샵, 매출 안나오면 아침 6시까지 강제 출근시켜 여의도 공원 돔"
350,예스이십사,6058,"아직도 모든 업무를 서류로 수작업한다 옛날 방식으로 업무를 처리해 효율이 떨어지나 시스템 개발에 투자하지 않는다 그래서 직원들만 죽어간다 시스템, 교육, 인센티브 등에 인색하다 그러나 실적=매출 압박이 대단하다 채용 기준이 모호하다 승진 기준 또한 모호하다"
351,예스이십사,6058,"부서간의 소통이 조금 적은 듯하며, 야근이 많은 편. 중견기업에서 대기업으로 도약하는데 체계정리나 부서간 조율이 많이 필요할듯"
352,예스이십사,6058,근무시간이 8시-6시임. 부서에 따라 다르지만 칼퇴는 충분히 자유로운 듯. 과장급 이상으로는 진급이 사실 어려움. 자리도 딱히 늘어나지 않고 윗분들도 나가지는 않아서.. 모회사와 오너가 회사의 방향에 아주 큰 영향을 미침. 그렇다고 딱히 일관성있지도 않음..최근 들어서(2016년 이후) 너무 많은 사업을 늘리고 있음.
353,예스이십사,6058,"지금은 어떤지 모르겠지만, 업무 매뉴얼이 아주 체계적으로 갖춰져 있지는 않았음. 팀간의 보수나 복지는 좀 차이가 있는 것 같음"
354,예스이십사,6058,실적이 떨어지면 난리가 난다 사람들이 일을 못함 고객들을 생각하면서 일하지 않는다
355,예스이십사,6058,급여가 적음. 체계가 잡히지 않아 일이 제각각임. 복지가... 복지가... 없다고 봐도 무방.
356,예스이십사,6058,"8시 출근 6시 퇴근. 수평적 자율적이지만, 내부 소통은 그렇게 원활한 분위기는 아님."
357,예스이십사,6058,8시출근 연봉별로 승진안좋음 연봉상승률 최악 복지없음
358,예스이십사,6058,"하는 일의 강도에 비해 직원이나 아르바이트생이 적다는 느낌을 받았음. 대리면 대리 팀장이면 팀장 아르바이트는 나이에 상관없이 먼저 들어온 사람에게 선배라는 호칭을 붙이는데.. 호칭을 붙이는 것은 좋으나 호칭을 통일해줬으면 하는 생각이 들었다. 누구는 이렇게 불러라 하고 누구는 저렇게 불러라 하니 혼란이 오고, 점장인 사람이 그 호칭에 예민한 사람이라면 사람들이 알려준 다 다른 호칭 때문에 걸핏하면 지적받고 혼나게 됨."
359,예스이십사,6058,"명색이 아이티기업인데 시스템에 대한 투자를 아까워함. 주먹구구식, 올드한 경영방식만을 쫓는 경영진. 의욕없는 회사 동료들. 복리후생이 전무함. 부서마다 퇴근시간이 큰 차이가 남"
360,예스이십사,6058,일한 시간에 대한 보상이 안됨. 신입과 인턴에 대한 텃세와 이지매가 심함. 뒷담화를 잘 할 수 있는 능력을 갖추어야만 조직에 안착할 수 있음. 커리어에 도움이 되지 않는 업무. 복지가 전무함. 대표와 회장을 제외하면 무능력한 임원진.
361,예스이십사,6058,업무의 양이 많으며 잦은 퇴사가 많다보니 결원이 수시로 생김
362,예스이십사,6058,8시-6시 퇴근 8:30-6:30반 퇴근 처럼. 한시간 더 근무함. 복지 전무함. 1년에 한번 산에 가야함. 우울한 사무실 분위기. 우울한 사무실 환경(먼지 작살). 개인주의적인 사내문화로 인해 활기가 없음.
363,예스이십사,6058,지원부서 대우를 너무 안해줌 업무순환으로 인해 커리어 개발 힘듬 회장님만 바라보는 분위기
364,예스이십사,6058,부서별로 업무편차가 심하다. 서로 중간점에 있는 업무에 대해 책임의식이 부족한 사람이 많다.
365,예스이십사,6058,업무 분화가만되어 있음 업무파악하는데 시간이 많이 걸림
366,예스이십사,6058,출근이 8시고 퇴근이 6시임. 다른회사보다 1시간 강제로 더 근무함. (추가수당은 연봉에 포함) 개인적인 발전은 절대없는게 단점. 1년에 한번씩 무조건 등산가야함. 연봉이 높은거 외엔 추가 다른 복지는 절대없음.
367,예스이십사,6058,복리후생은 전무. 개개인의 역량을 높이기엔 힘든듯 it업계지만 마인드는 제조업
368,예스이십사,6058,복지 부분에서 많이 부족함. 출산휴가등 여성을 위한 복지가 괜찮지만 다른 부분에서 아직 부족하여 개선하려고 노력하고있음
369,예스이십사,6058,체계가 덜 잡힌 느낌이 있으며 다소 우왕좌왕하는 경우가 있음.
370,예스이십사,6058,상담건수가 곧 실적이므로 파트장이 콜수에 굉장히 민감함. 그렇다보니 상담이 오래걸리거나 콜수가 작으면 뭐라고함. 상담프로그램이 오래된것같아 비효율적. 상담건수에 따른 인센티브도 박함.
371,예스이십사,6058,다만 출근시간은 오전8시까지이다. 사내문화로 가끔씩 대체적으로 매출이 떨어지거나 직원들 사기가 떨어질때? 새벽6시에 나와 조깅하는 문화가 있다.
372,예스이십사,6058,능력보다 인맥과 말빨이 중요. 일 잘하는 사람은 몇년 내 다 도망감. 일 못해도 목소리 큰 사람이 이기며 회사가 발전이 없음. 전형적인 사람 갈아서 돌아가는 회사.
