,company_name,company_id,review_text
140,예스이십사,6058,빠르게 성장한 회사라 덩치와 규모에 비해 못따라가는 인프라가 많음. 급급하게 쳐내기 바쁜 일감들
141,예스이십사,6058,무조건 8시 출근이라 힘들때도 있습니다 거리에 따라서나 개인의 자유도에 따라 8~10시 출근중 택1을 할 수 있으면 좋겠습니다.
142,예스이십사,6058,아무것도 아무기대도 하면 안된다.벙어리 3년 귀머가리 3년 하면 바보 되있는곳
143,예스이십사,6058,장기근속자가 많은 만큼 고인물들의 천국임 혁신. 개혁. 트렌드와는 다소 뒤떨어진 기업문화가 제살깍아먹기중임
144,예스이십사,6058,오더기업으로 회장 및 대표의 업무영역이 명확하지 않으며 시스템 및 IT의 투자가 미비하여 시스템환경이 그리 좋지 않음
145,예스이십사,6058,노동 강도가 쌔다 체계가 가춰져있지만 연장근무는 2시간전이나 마치기 직전에 알수있다 엄무강도에 비해 월급이 적다는 인식이 있을수있다
146,예스이십사,6058,직원 복지가 처참하다 윗선 분들께서 원하시는 것을 이해할 수 없음 노 메뉴얼 배울 수 있는 사람이 없어 알아서 성장해야 하는 시스템
147,예스이십사,6058,열심히 일하면 보상받는다는 느낌을 받겠끔 해줘야지 안주하고 더 일은 하고 싶지않음.
148,예스이십사,6058,직원수가 적은편이 아닌데도 불구하고 화장실이 너무 작아서 줄서서 기다려야 할때가 많았어요 이부분은 조금 개선되었으면 합니다
149,예스이십사,6058,고인물이 너무 많다. 연봉인상율 최악. 복지없음. 잘나가는 부서만 주력한다.
150,예스이십사,6058,회장님 부회장님의 의견이 너무 중요 CEO가 구성원을 아끼지 않음 정체된 근무 분위기
151,예스이십사,6058,"복지 없음, 급여 낮음, 직급 승진 외엔 매년 연봉 상승율 낮음, 조직개편 잦음, 퇴사자 자주 발생돼 업무폭탄 피하기 바쁨, 야근수당(포괄임금제)/야근식비 없음"
152,예스이십사,6058,"발전이 없어보이는 듯 , 퇴사하는사람이 꽤나 잇어요"
153,예스이십사,6058,팀 분위기와 문화가 별로였다. 업무 분위기가 굉장히 별로임.
154,예스이십사,6058,일하는 사람만 일주는 분위기. 윗사람들의 사람다루는방식이 그러함. 그러니 사람들이 나가떨어짐.
155,예스이십사,6058,"연봉이 쎄지도 않고 승진하려면 경력이여도 3년차 이상이여야 대리 달 수 있음 연차되도 대리 심사시 대리 누락도 빈번히 발생함, 과장달려면 7년차 이상으로 알고있음"
156,예스이십사,6058,딱딱한 조직문화 오래다닌 사람들이 많아 생기가 없음 자기발전적인 업무를 경험할 기회가 적음
157,예스이십사,6058,복지 진짜 중소기업보다 구림. 명절에 yes24상품권 줌. 그걸 다시 당근마켓에 올려서 95000원에 팜. 온라인전자상거래인데 it 조직 진짜 구림 구림 핵구려.
158,예스이십사,6058,몇몇 분들이 조금 텃세도 있고 좀 노후돼서 시설이 그렇게 깨끗하진 않아요
159,예스이십사,6058,야근이 잦으며 주로 모든 시간 서있음으로 평발등 하체에 문제가 있을시 건강을 해칠 가능성이 있음.
160,예스이십사,6058,"여러 사업들을 동시다발적으로 시키고, 다들 자기가 급하다고한다."
161,예스이십사,6058,보여주기식 보고만 좋아하는 경영진들. 자리 보전이 최선인 몇몇 팀장 본부장들. 새로운 걸 시도해보려 하면 업무가 틀어지니 저지하게 되는 보수적인 문화. 우물 안 개구리 되기 쉽고 좋음
162,예스이십사,6058,"무엇이나 느림, 진행속도가 느리고, 관리 체계가 부족함"
163,예스이십사,6058,피라미드 형식의 밑에 있는 직원들 위주로 업무가 진행 됨
164,예스이십사,6058,"자사 할인 없음, 화장실 겁나 좁음, 건물에 창문이 없음"
165,예스이십사,6058,복지가 없음 윗사람들이 무능하고 대표 입맛에 맞추기 바쁠뿐
166,예스이십사,6058,단순 보고를 위한 문서 작업과 발표가 너무 많다. 기업의 크기에 비해 하찮은 복지.. 심각한 고인물이 많다.
167,예스이십사,6058,"퇴근은 허락받고 가능 팀원간 협력플레이 금지, 주말작업도 당연하게(?)생각하는 마인드팀장, 사회적으로 진자고점 꾸준히 찍고있으나 재택일정짜기 귀찮고 업무지시불펼하단이유로 안시켜줌"
168,예스이십사,6058,발전이 없다 새로운 걸 도입하려하지도 않고 연봉이 짜다 인센도 고인물들만 받음
169,예스이십사,6058,초봉은 높으나 연봉이 낮음 경력에 대한 대우가 낮은 점 무리한 매출목표
170,예스이십사,6058,복지가 전혀 없고요 내가 로보트인가 싶을정도로 계속 닥달하기때문에 계속 전화받으면 됩니다
171,예스이십사,6058,개인의 성장을 바라긴 어렵다. 회사 자체가 고여서 발전없음
172,예스이십사,6058,수직적인 분위기 불안정한 퇴근시간 성수기처럼 바쁠 때는 주말출근도 해야되고 안한다고 하면 눈치줄 때도 있다 성과에 대한 압박으로 상사들이 압박할 때도 있다
173,예스이십사,6058,정말 필요한데 사람 잘 안뽑아줌. 사무실 환기 잘 안됨. 명절에 상여금 없음. 별 생산적이지 않은 보고와 발표 좋아하고 자주 함. 승진 체계 너무 느리고 연봉 상승률도 낮음. 연봉협상도 늦게함. 가끔 이해 안되는 결정들이 있지만 윗선의 결정이기 때문에 그대로 따라야 함. 뭐라 반대를 말하기엔 사내 분위기가 매우 딱딱한 편 아무도 나서려고 하지 않는 듯.
174,예스이십사,6058,코로나가 터져도 확진자가 나와도 8시 출근 5시 퇴근(나름 정시 퇴근 비스무리) 꼰대 참 많음(일도 안하고 회사에 바라는 것만 많다고 투정댐) 그냥 일찍 나오고 늦게 퇴근하는 사람 좋아하는 회사 체계라든가 이력관리라든가 1도 없이 그저 가성비 가성비만 외침 투자한다해도 쌓여있는 옛 유산들 걷어낼려면 지금 투자론 택도 없음 어떤 서비스 한다라고 말나오면 1년은 족히 걸림 마켓컬리 새벽배송 한지가 언젠데 올해 들어서 겨우 한다고 광고 중 업력은 길지만 혁신은 없음 회장은 YES24는 그냥 캐시카우일뿐 최대 매출올려도 너넨 돈을 못번다 이제 돈을 벌어야한다고 신년사 함 웹툰 시장 네이버 카카오 잠식해 가는데 이제 겨우 신사업이라며 투자하기 시작함
175,예스이십사,6058,"도대체 인센티브는 주려고 만든 제도냐? 뻑하면 목표 바꾸고 이래서 높이고 저래서 높이고 아 걍 돈 주기 싫다고 하세요 구차하게시리. 연봉도 작아서 빡치는데 인센도 못받게 함.  일 잘하는 불쌍한 주니어급들한테 일 몰아주는것도 제발 그만해. 경력직이랍시고 다른 곳에서 데려오는 사람들마다 다 꽝이오. 보는눈이 있는건지 없는건지 없으니까 그러고 있겠지  그리고 20대 좀 그만 착즙했으면. 20대 수당이라도 주던가? 여기서 20대라고 써먹어 저기서 20대라고 써먹어, 보는 30대가 다 불쌍하다. 나의 늙음이 죄가 아니듯 그들의 젊음 또한 죄가 아니로되. 젊음을 써먹으려면 그 대가를 지불하도록 하세요."
176,예스이십사,6058,복지도 없고 급여도 너무 낮아서 일하려는 동기부여 부족
177,예스이십사,6058,연봉상승률 너무 적음. 상사 평가 제도 없음. 고과 평가 기준 모호(윗사람 마음대로인 것으로 보임) 탕비실 없음. 상여금 없음. 무능한 관리층이 대거 포진해있어 전망이 매우 어두움.
178,예스이십사,6058,여직원분들이 많은 것에 비해 여자화장실 칸이 2개밖에없어서 불편함
179,예스이십사,6058,90년대 마인드 의사결정이 오래걸림 방향성없이 안주하며 흘러가는 회사
180,예스이십사,6058,고인물들이 대우만 받고 싶어함.... 워라밸 말고는 복지도 없고....여기서 일하면 발전 가능성은 제로.....
181,예스이십사,6058,승진리 힘듬 승진 발표도 따로 해야함 이래저래 발표가 많음
182,예스이십사,6058,장점응 제외한 나머지가 모두 단점인데.... 직원을 부품 정도로만 생각 하는 것이 가장 큰 단점
183,예스이십사,6058,다양한 종류의 작업을 할 수 없는 기업의 구조상 지루하게 느껴질 수 있다
184,예스이십사,6058,열심히 일하는 직원이 바보인가 싶을 정도로 멍청하고 일이 없는 사람을 방치해두고 잘하는 사람을 괴롭힘..
185,예스이십사,6058,자기들끼리만 좋은 분위기. 발전이 없는 분위기 할일 찾으면 많고. 안찾으면 없음
186,예스이십사,6058,연봉이 높지 않고 복지가 적은편 그 외에 큰 단점은 없음
187,예스이십사,6058,무능한 경영진. 일은 너무 많으나 월급이 짜다. 연봉 상승률 거의 없다고 보면 됨.
188,예스이십사,6058,최악의 연봉인상률. 바뀌지 않는 조직. 뭘 물어보면 아무도 히스토리를 몰라서 계속 넘기고 넘기다가 해결이 안됨. 시스템이 옛날 그대로임
189,예스이십사,6058,승진 가능성 없음. 7년차 사원이 존재하는 곳. 사람 갈아서 매출 내왔고 점점 더 심해지고 있음. 인사 시스템에 문제가 있고 개혁 의지 없음. 인센티브 줄 생각도 없음. 급여인상폭이 너무 낮음.
190,예스이십사,6058,"팀장급이 너무나 능력이 없고 윗사람만 엄청 신경씀. 보고서가 엄청 많음. 보고하다가 매년 끝암. 연봉협상을 4,5월에 함. 통보임. 보너스 없음. 도서할인도 없음."
191,예스이십사,6058,사실 단점은 잘 모르겠다... 8 to 5 인것...? 처음엔 적응 안 됐었는데 이마저도 적응 되니까 저녁시간 길고 좋았음~ㅎㅎ
192,예스이십사,6058,전문직에 대한 배려가 없습니다. 유통회사이기 때문에 디자이너 개발자들이 발전하기에는 힘들고 사회 초년생들이 다니기 힘듭니다. 경력을 쌓기 위해서는 본인이 플러스 알파로 더 노력하고 그이상 따로 공부해야 합니다.
193,예스이십사,6058,"1. 경쟁업체를 기준으로 업무를 진행한다. 2. 복지가 대부분 없다. 그 흔한 콘도 지원도 없으며, 설명절에도 자사 상품권이 나온다. 3. 각 팀별로 책임지는 업무를 하고 싶어 하지 않는다. - 왜 있는지 알수없는 팀도 있다."
194,예스이십사,6058,"낮은 연봉, 아무리 연봉협상하고 들어온다하더라도 연봉협상에서도 테이블이 있다고 그렇게 높여주지 않는다. 연봉 협상은 되게 늦다. 작년엔 4월, 올해는 3월말인 현시점에서도 아직도 그 어떤 이야기도 없다. IT 인력은 여기가 무덤인것같다. 안되어 있는 것도 많고 커뮤니케이션이 잘 안된다. 최근엔 퇴사자가 늘어나고 있는 분위기이다. 프로젝트가 엎어지는건 부지기수다. 커리어 쌓지 않고 그냥저냥 월급만 받는다면 다닐 순 있다. 국회의사당역 근처라 역에서 회사 위치는 멀지 않지만 9호선 급행을 타고 다닌다면 여의도역에서 일반열차로 갈아타야해서 번거롭다. 화장실이 칸 수가 적어서 늘 붐비고 복잡하다. 자리에 파티션도 없다. 명절때 10만원 예스24 상품권 주는게 다다."
195,예스이십사,6058,업계 평균 연봉이 높지않아 큰 기대를 하긴 어렵다. 조금 오래된 분위기
196,예스이십사,6058,"회사가 자기 건물이 아님, 여의도라서 근처 식당 가격 높음&맛도 별로임 복지가 거의 없는 편 사람이 별로 없어 일이 빡셈"
197,예스이십사,6058,일정에 너무 목 맨다 어디 보여주기 식으로만 일정을 짜니 일하는 사람은 죽어남
198,예스이십사,6058,"정규직분들은 칼퇴, 칼출이 불가해보였습니다. 최소 출퇴근시간보다 30분씩 일찍오심.탕비실 없음. 화장실 별로."
199,예스이십사,6058,복지 없음. 하다못해 도서 지원비 조차 없다. 명절 보너스는 자사 상품권 10만원. 떡값이 없다고 보면 된다. 인센티브도 없다. 받는 것이 겅의 불가능. 승진과 연봉 상승도 불가능. 워라벨 없다. 잦은 야근. 자잘한 야근은 수당 요청하기 힘듬. 결국 포기하고 그냥 간다. 구린 시스템 일은 많고 해결은 되지 않으며 일할 사람은 없고 오류가 많아 고객은 항상 화가 나있다. 대면하는 쪽은 죽을 맛. 상급자가 업무 해결을 미루거나 이슈가 생기면 서로 폭탄 돌리기 식으로 흐지부지 된다. 실무자만 업무가 가중된다. 그 와중에 서로 사이가 나빠서 사내 분위기 흉흉하다. 어느 분야든 꼭 뒤에서 누구 하나 왕따만들려는 왕고나 시조새 있다. 사람들이 1년 주기로 계속 나간다. 빠르면 3개월만에도 나간다. 일 좀 잘한다 싶은 사람은 정말 최소만 채우고 이건 아니다 싶으니 다들 이직한다. 특정 분야 이야기도 아니다.
200,예스이십사,6058,"1.개발도서라고 한번 재고를 제공한 적이 있었는데 폐급 스레기 개발사였다. 몰래 카메라인가 싶었다. 도서 회사면 개발자에게 커리어 향상에 필요한 책을 제공해 줄법도 한데 그런 것도 없다.직원의 커리어 향상이 회사의 발전에도 기여할텐데 어리석은 생각을 하는 회사라 생각한다.  2.팀에 1인당 팀비가 제공되는데 개인소유는 아니고 팀소유고 야근에 해당하는 비용(식비, 택시비)까지 포함되나. 야근을 많이 하거나 그러면 마이너스가 될 수 도 있고 회식도 불가하다.  3.다른 직군들 보다도 많은 프로젝트 및 성과를 내도 하는일에 대비하여 연봉상승율이 제대로 이루어지는지 의문이다.  4) 챙겨주는 척하는데 그런것 1도 없다. 2년동안 개고생해서 병도 걸리고 연봉 5%올린게 너무 불쌍함 ㅠㅠ 그리고 퇴사하자마자 퇴사자 욕하는거 보고 너네랑 일안해야 겠다 생각함  개발자가 왜 ㅠㅠ 연봉상승율이 5프로받으면서 일하나 ㅎㅎㅎ   상여금이라도 많다하면 연봉 상승율을 오구하는것은 문제가 있다만 상여금이 없는데 내 개발자 인생에서 연봉 상승율을 염전 소금보다 더 짜게 진행한다.  처음에는 로얄티를 가지고 많은 프로젝트를 진행하고 일했지만 회사에서의 평가 및 처우 및 대우를 보고 이직을 결심했다.  어느 회사이건 비IT 부서에서 개발에 대해 쉽게 말하는 태도에 대해서는 별 신경안쓴다. 직급 상관없이 연봉 상승율이 높아서 내연봉만 잘 관리하면되니깐^^  근데 여기서는 프리랜서가 왜 비싸게 고용되는지 모르는거 같고 개발자들은 금방 이직 가능한 것을 모른다.  개인적으로 퇴사한 사람들 보면 대체적으로 좋은 회사로 이직했다.  연봉상승율이 일반 사무직이랑 비슷하게 올라가는거 보면 그냥 퇴사를 결심하게 된다.  그 이후 로얄티가 사라졌다. IT 가 중요한 시대에 살고 있는데 역행하는 모습이 멋지다  이 회사의 가치는 점점 공룡 기업들에게 뺏길 것으로 예상한다."
201,예스이십사,6058,느린 의사소통 마감을 지키지 않는 연봉협상 1월 시작이지만 5월에 함 ㅡㅡ 연봉상승률 최악 무능한본부장
202,예스이십사,6058,규모에 비해 체계가 너무 없고 지원 부서가 생각보다 지원해 주는 일이 너무 없으며 연봉 협상도 아닌 통보를 5월이나 돼서야 함. 새로 시작하려는 사업은 많은데 전문가를 불러놓지 않고 기존 직원들을 갈아서 억지로 일을 만들어 내니 당연히 구멍이 생길 수 밖에 없는데 그걸 항상 직원들 탓을 함.
203,예스이십사,6058,현재의 수준을 뛰어넘을 만한 사업영역이 없고 낡은 닷넷기반 서비스 유지중
204,예스이십사,6058,"여러 부서 얘기를 들어보면 회사의 방향성이 모호하고, 본인이 왜 해당 업무를 하는지 납득하지 못하는 경우가 많음. 또한 진급이 잘 안됨."
205,예스이십사,6058,현재는 어떨지 모르겠으나 깊게 생각하고 고민하여 일을 할 수 있는 환경이 되지는 못하여 어느정도의 레벨만 쌓으면 사용하던 기술만 사용하고 서비스에 대한 지속적인 리팩터링은 그야말로 꿈에서나 가능한 이야기임.
206,예스이십사,6058,출근이 너무 빠르다 발전하지 않는다 새로운 도전을 하지 않기 때문에 개인도 별로 도전할일이 없고 발전할 일이 없다 복지가 없다
207,예스이십사,6058,"사업부 간 연계가 부족해서 시너지를 내지 못한다. 업계 1위를 주장하고 있으나 경쟁사 대비 움직임이 느리고, 이커머스 기업이라기엔 시스템 인프라가 매우 열악하고 블랙홀이 되어 사업부 및 개발 인력들이 변화에 지쳐 멈추는 경우가 많다."
208,예스이십사,6058,"신규기준 아르바이트로만 뽑고 2년뒤 계약직으로 전환, 또 한 2년쯤 뒤 정규직 전환기회를 준다고 들음, 복지 후짐"
209,예스이십사,6058,다소 정체된 분위기와 변화하는 시장에서 올드한 느낌이 있음.
210,예스이십사,6058,모기업이 제조업이라 그런지 구시대적 조직 문화. 몇몇 무능력한 헤드가 질러놓은 일을 처리하기 바빠 젊은 사람들이 동기를 부여받기 어려움. 매번 늦은 연봉협상과 부족한 보상.
211,예스이십사,6058,"기업문화 너무 정체되어있다. 변화없고, 고인물 많다. 오너기업의 단점들 있다."
212,예스이십사,6058,대기업 같지만 개인회사같은 느낌.. 그로인해 파생되는 피곤함들
213,예스이십사,6058,편한만큼 퇴사율이 높지 않아 고인물들이 많다. 일이 단조로운편
214,예스이십사,6058,이커머스 기업이지만 IT인력이 메인이 아님 우대를 기대하지말것
215,예스이십사,6058,상당히 노후된 시스템과 그만큼 노후된 경영진 복지도 없습니다. 그냥 워라밸만 좋음
216,예스이십사,6058,발전이 없음. 고인물많음. 의사결정느림 등등 너무 많군..
217,예스이십사,6058,최소한만 지키는 회사다. 특별한 복지가 없지만 그렇다고 법을 어기진 않는다.
218,예스이십사,6058,겨울에 은근 추움.너무 조용한 분위기(약간 답답할 수 있음.) 그외의 단점을 많이 못찾은 듯.
219,예스이십사,6058,칼퇴 외엔 다 단점 ...... 사무실 환경도 업무 환경도 별로이고 보고단계가 많아서 진도가 안나간다. 일을 하자는건지 말자는건지 .. 맨날 보고서만 쓰는 ....
220,예스이십사,6058,온라인에만 신경을 쓰다보니 오프라인 신경을 거의 안씀 그래놓고 경쟁업체에 왜 밀린다고 고민하는지 모르겠음
221,예스이십사,6058,일 많은 편. 대외이미지에 너무 신경쓰는 편. 1등 이미지를 만들기 위한 각고의 노력 필요... 부서마다 다르지만 다들 바쁘고 야근팀은 늘 야근 중
222,예스이십사,6058,"연봉 상승률이 낮음. 10년넘게 일한 팀장,본부장급들 연봉 대강 들어보면 어떨지 감이 잡힐듯 복지 없음. 온라인 서점이라고 하지만 개발팀은 중요하지않은 부서임"
223,예스이십사,6058,1. 크게 내세울 만한 복지 혜택이 없다 2. 보고를 위한 회의가 조금 있는 편이다
224,예스이십사,6058,전형적인 여초 회사. (뒷말을 참 많이 함. 상사한테 잘못 보이면 그냥 퇴사할 생각해야됨. 팀장이 나서서 이상한 소문 내고 대놓고 왕따 시킴. 사람 바보만들고 공개적으로 꼽주는거 굉장히 좋아함) 개인주의(옆사람이 쓰러져도 본인 업무만 하고 있을 정도로 남의 일 신경 안씀) 복지 전혀 없음 (그나마 하나 있던 창립기념일 기념품 주는것 마저 없어짐) 보고를 위한 문서 작성 등의 비효율적인 업무가 많음 (아주 사소한 업무라도 보고 받는걸 굉장히 좋아하고 실제로 일 안하고 보고만 잘하면 이쁨 받음. 예뻐하는 사람이라면 업무시간에 점심때 먹은 메뉴 이야기 해줘도 좋아함) 팀장이 누구냐에 따라 다르지만 새벽에 메일 보내거나 쉬는날에 메일 보내는일 자주 있음.
225,예스이십사,6058,매출 매출 매출 매출 매출의 대한 스트레스 8시출근 입니다.
226,예스이십사,6058,적은 급여 / 매일같이 부족하다는 생산량 / 토요일 필수 / 시즌되면 무조건 잔업필수
227,예스이십사,6058,고인물이 많고 복지가 하나도 없음 오너일가의 간섭이 심함
228,예스이십사,6058,복지가 1도 없음. 온라인 서점이면서 직원에게 도서지원비는 커녕 도서 할인도 해주지 않음. 인센티브 제도가 있지만 받는 팀만 받고 못받는 팀은 한번도 받지 못함. 회사가 발전해도 개인에게 돌아오는 건 없다고 느껴짐.
229,예스이십사,6058,지금은 어떨지 모르겠지만 대기업 특유의 수직적인 보고 체계. 느리고 시간이 걸리는 업무 프로세스가 만연한 편.
230,예스이십사,6058,경영진이 40대로 젊은 편인데 꼰대 문화 만연 남자들은 담배피우면서 사람 하나 갈아넣어 회사를 운영중
231,예스이십사,6058,근무환경이 너무 독서실같았던ㅋㅋㅋㅋ 일을 전문적으로 배우기 어렵고 물경력되기 쉬움
232,예스이십사,6058,리더들 중 능력 없는 사람들이 많았으며 대표이자 오너인 회장님의 입김에 사업이 좌지우지 되는 경우가 많음 그리고 고인물들이 많아서 연차가 쌓여도 발전을 하기 보다는 3년차 정도의 스킬이 이후에도 계쇠해서 유지 되는 경험음 할 수 있음
233,예스이십사,6058,사내 인적 네트워크를 쌓기 어렵습니다. 항상 하는 업무만 하게 되는 경향이 있어 새로운 경험을 할 기회가 적습니다.
234,예스이십사,6058,미래가 없음. 직원들이 심각하게 관성에 젖어서 하던일만 하려고 함. 새로운일 생기는 순간 서로에게 미루기 바쁨. 일은 더럽게 못하지만 정치질만 하는 인간들이 득세하는 회사.
235,예스이십사,6058,복지제도가없음. 매일 같은일 반복에 자기발전이 절대없어서 이직하기힘듬. 능력없는 고인물들이 절대 퇴사하지않아서 바뀌는게없음.
236,예스이십사,6058,부서의 장부터 그릇이안됨 빌빌 기어야하고 눈치보고 갖다 뭘 받춰야 인정받음 문제는 장부터 중간관리자들에게 배울점이없음
237,예스이십사,6058,과장급이 많아 더 이상 승진이 어렵다. 사업부의 입김이 너무 강해 같은 회사지만 을로써 일하게 된다. 퇴사자가 많다. 연봉이 높지 않은 편.
238,예스이십사,6058,고이다못해썩은물들이 요직차지 합리성보다 보여주기만 따짐 뭘 상상하든 아무것도 없는 복지 진급 너무 느림 능력대비대우 그딴거없음 그닥 경영에 재능없어보이는 오너2세들
239,예스이십사,6058,"개방적이지 않은 업무 형태로 누가 무슨일을 어느정도의 난이도로 하고있는지 알지 못하여, 일이 몰리는 경향이 있다"
240,예스이십사,6058,여직원이 많은 만큼 너무 치열하고 예민하게 구는 여직원들이 많음.
241,예스이십사,6058,"명절 예스상품권 지급. 직원 혜택 거의 없음. 낮은 연봉. 부바부, 팀바팀, 사바사가 너무 심해서 칼퇴가 가능한 팀도 있고 일복이 넘쳐나서 아닌 팀도 있음. 코로나로 인한 재택근무도 팀바팀. 요즘 시대에 상명하복과 희생을 강요하는 장급도 꽤 있음. 최근 들어 사람을 갈아 넣는 분위기가 심해졌고 권고사직(통보)과 자진 퇴사자도 많아짐. 나쁜 사람이 많진 않은데 대부분이 윗사람인게 문제. 상호적 의사소통이 아닌 대부분 상명하달이고 역방향으로는 의사소통이 거의 불가능하다. 빛 좋은 개살구라는 말이 딱 맞는 것 같다."
242,예스이십사,6058,업무량과다 업무가많아서야근필수 택시타고집가기 집에서도모니터링하기 등등등
243,예스이십사,6058,"이렇다 할 복지 혜택 없음. 정말 없음. 명절 때 예스24 상품권 줌. 승진이 매우 늦음. 수평적인 분위기이나, 실상은 수직적."
244,예스이십사,6058,복지 없음. 매번 소 잃고 외양간 고치는 식으로 업무 진행
245,예스이십사,6058,"본부장급들이 실재적인 성과를 우선순위로 보기보다는 위에서 내려주는 지시만 따라가고 있음, 그래서 불필요한 업무가 있더라도 위에서 원하는 부분이면 무조건 따라 가야함."
246,예스이십사,6058,"뒷담화를 많이 하는 환경, 지속적인 괴롭힘을 당할 수 있다, 같이 일하는 동료들이 동료 의식이 없다."
247,예스이십사,6058,복지가 딱히 없는게 단점. 연봉상승폭도 그닥 크지 않다.
248,예스이십사,6058,평사원이.좋은 사람들인것 외에 전부. 복지없음 급여낮음
