,company_name,company_id,review_text
0,올리브디앤피,12883,자수성가의 기업이라 보수적인 면이 강함 디자인 외 잡무가 있었음
1,올리브디앤피,12883,"외진 곳에 있어 차 없으면 출퇴근 매우 힘듬, 차량 지원도 없음 점심시간 마음대로 못 쉼, 복리후생이 거의 없음"
2,올리브디앤피,12883,임금 안줘서 맨날 독촉전화오고 나 역시 돈을 못받았다. 받을때까지 이 글은 내리지 않을 것이다. 퇴사 이유 역시 직원들의 월급을 미루기 때문이었다. 이것으로 말 다했지만 그 외에도 단점은 많다. 회사에 인성 지저분한 또라이 한 명 있다. 입사하고 일주일 안에 그 사람이 누군지 알게 될것이다. 멍청하게도 자기 인격이 쓰레기인걸 숨기지 않고 입으로 떠벌리고 다니기 때문이다. 자격지심이 많은 꼰대의 전형이다. 하지만 그녀는 멍청한게 밖으로 티가 나므로 큰 적은 아니다. 가장 중요한 문제는 회사가 직원들에게 정당한 돈을 지불하지 않고 조직폭력배들처럼 군다는 것이다. 하는 짓이 완전 양아치들이 따로 없다. 요즘 시대에도 돈을 떼먹는 회사가 있다니. 이런 회사는 노동청에 신고 먹고 망해야 한다.
3,올리브디앤피,12883,"회사 만의 그룹웨어 프로그램도 부족하고, 인수인계도 엉망이며 아날로그. 틀린 걸 맞다고 우기는 회사. 아부만 잘 떨면 뭐든 욕 안먹고 가능하다. 가족회사 능력 없는 사람 일단 앉혀둠 사장이 고장 난 자동차처럼 급발진 심하고 책상 내리치면서(점프도함) 소리 지름. 가끔 사장 손녀 오는데 그때만 기분 좋음. 여자 직원들 험담 진짜 심하고 괴롭힘(일 있다고 1시간 일찍 출근하게 하고 일찍 가면 없다고 함(일찍 나오게 하려고 구라친거)) <-이건 진짜 약과 회사에 돈 없어서 퇴직금 못 받았던 사람이 2~3명 정도 신입이 와서 1~2일 일하고 못 버텨서 나갔는데 돈 안줌 (준다고 했었음) -> 나중에 돈 달라고 전화했는데 돈 밝힌다고 뭐라함  이거 말고도 많아요~ 멘탈 튼튼하면 가세요^~^"
4,올리브디앤피,12883,연차 없음 식대없음 야근수당없음 그냥 뭐가 다 없음 서울 근무만 야근은 좀 많은데 저녁도 직접 사먹고 수당도 안나오고 그냥 야근 안하는게 답이다
5,올리브디앤피,12883,휴가 외에는 복지가 없다. 연월차없다. 체계가 잘 안잡혀있다.
6,올리브디앤피,12883,조금 느린 업무프로세스로 인해 더디게 진행되는 일도 있음
7,올리브디앤피,12883,하지만 정체된기분은 든다. 보수적인 환경은 좀 그렇다 연봉도 좀 짜다 아무래도
