,company_name,company_id,review_text
0,올인원커뮤니케이션,10797,업무분담체계가 조금 부족. 많이 배우고자 한다면 사수의 부재를 약간 느낄수있다.
1,올인원커뮤니케이션,10797,클라이언트들의 안목이 요즘 트렌드를 잘 몰라서 신식디자인을 보는 눈을 기르기는 힘듬 평범한디자인을 하게돼 손이 굳어질수있음 출장갈때 1인분 이상을 해야하는 업무량
2,올인원커뮤니케이션,10797,젊고 시대의 흐름을 쫓아가다가 다른것들을 놓치는 경향이 너무 직원들의 희생을 강조 직원들이 대체적으로 신입 위주와 자주 바뀌는 바람에 경험이 없음
3,올인원커뮤니케이션,10797,한쪽업계만 파다보면 고이기때문인지 빠르게 변화하는 IT업계의 흐름을 읽지못함
4,올인원커뮤니케이션,10797,"대표의 사업수완이 너무뛰어남. 다방면에 사업을 하고있고, 또 그 사업들이 잘되어서 정작 내가다니고 있는 회사가 성장할것같다 라는 생각이 들지않음"
5,올인원커뮤니케이션,10797,인원이 적었던 터라 좀 업무적인 부분에서 과중되는 부분이 있다. 지금은 어떻게 되는지 모르겠지만 제대로 된 분업이 필요했다.
