,company_name,company_id,review_text
0,윈윈마켓,8895,사업 움직임이 제한적이고 새벽 회의 같이 좀 말이 안되는 일을 한다. 엘레베이터가 엄청 붐비는 편이라 출근 시간과 점심시간 퇴근시간에 속터진다.
1,윈윈마켓,8895,대표의 쓸데없는 간섭과 투자를 매우 아낌 잘나가는 모회사가 있는데도 투자에 인색함
2,윈윈마켓,8895,위 장점과 똑같이 너무 관리가 안되다보니 중심이 안잡히고 서로 다른방향을 보는것같음
3,윈윈마켓,8895,"텃세,잦은회의,회의==>인격무시,화풀이용 대표인가... 그 할아버지 오면 직원들 앉혀놓고 무조건 화풀이하는날임 아...여자들은 왠만해서는 안깨짐... 남자들만 집중타켓으로 엄청 깸"
4,윈윈마켓,8895,사람소중한줄 모르고 단기간에 어마어마한 성과를 내기 원함 줏대없는 경영과 90년대 트랜드에 갇혀있는 경영진. 사무실이 너무 조용해서 타자치는데도 눈치보임. 비효율의 끝을 보여줌. 생긴지 5년이나 됐는데 체계도 하나 안잡혀있고 대표가 와서 회의하는날은 회의가 아니라 혼나는날임. 다 혼나는것도아니고 영업부만 엄청 혼내고 들들볶음.
5,윈윈마켓,8895,정식연차없음. 아직 체계가 잡혀있지 않음. 마케팅이 cs보고 영업팀이 기획하는 업무분배없는 회사. 대표와 이사의 의견불일치로 매번 두번 일하거나 했던 일을 뒤집을 때가 많음. 대표가 아주 작은 업무까지 사사건건 참견함. 직원을 믿고 업무를 맡기지 않음.
