,company_name,company_id,review_text
0,유엔젤,7958,좀 보수적이고 군대식 분위기가 있습니다. 담배피우면서 중요한 얘기들 해버리고 비흡연자들은 잘 못따라가서 불편했던 기억이... 연봉도 좀 박했던듯
1,유엔젤,7958,"급여가 적은 것이 단점이지만, 개인 시간이 보장되어서 자기개발을 하면서 다닐 수 있는 환경을 원한다면 추천 드립니다."
2,유엔젤,7958,"낮은 연봉, 일하는 사람들은 하고 노는 사람들은 노는 회사"
3,유엔젤,7958,혁신과 도전에 대한 리스크 부담을 되도록 회피하고자 함. 그렇기 때문에 신입사원이나 젊은 인원들에게는 재미가 없을수도 있음.
4,유엔젤,7958,차부장급이 넘치는 곳. 변화보다는 안주하는 것에 치중하기에 단점이라면 단점
5,유엔젤,7958,업계평균에 비해 낮은 연봉. 예전에 만들어둔 복지항목에서 더이상 추가되지 않아요.
6,유엔젤,7958,성장이 멈추어 있는 상황이 안타 깝네요. 조금 더 적극적인 투자로 신규 사업 개발을 해야 할 듯 합니다
7,유엔젤,7958,새로운 프로잭트를 시작할때 충분한 검토 시간이나 준비할 수 있는 기간이 모자라서 늘 시간에 쫒기듯 진행하는 점이 아쉽습니다
8,유엔젤,7958,규모가 작아서 업무 프로세스가 체계적이지 못하고 부바부가 심하다. 본인이 챙기지 않으면 자칫 물경력이 될 수도 있음.
9,유엔젤,7958,"입사 후 처음 업무를 진행할 때에도, 도움을 받기가 쉽지 않음. 회사 분위기 자체가 오래 다닌 사람들이 많고, 폐쇄적인 느낌이 있음. 계약직과 정규직의 업무적인 차이는 주지 않으면서 복지적인 차이는 주는 점이 의아함."
10,유엔젤,7958,야근은 없는데 일정은 밀리는 느낌 탕비실이 너무 부실함
11,유엔젤,7958,"IT 회산데 개발자에 대한 투자를 하려고 하지 않습니다. 어떻게든 최저 ~ 평균 사이에 딱 맞춰서 아슬아슬하게 인력유출을 막으려고 하는 것 같은데, 이미 중간은 다 나가고 모래시계 구조가 되어버렸습니다. 지금은 윗사람이 많이 있어 괜찮은데 미래는 어두워 보입니다."
12,유엔젤,7958,"제일 중요한 돈이 너무 적음, 사무실도 너무 구림 사람 귀한 줄 모르고 투자하지 않는 회사, 사람을 지금 순간만 붙잡아둘 요령만 피움 사람 대할때도 근시안적인 시각 갖고 있는 회사가 투자는 얼마나 잘 할지 의문임 안주하면서 편하게 다니기 좋아 고인물이 많고 중간급 유출이 심함 중소기업치고 복지가 있는 편이라고 했는데 이십년전에 만들어져 그때 기준으로 만들어진 뒤 바뀌지 않은 것들 투성이고 일회성인 것들이 많음 회사 입장에서 나름 변화한다고 하는데 매우 느리고 보수적으로 변화하는 중이라 직원 입장에서는 체감 안됨 눈에 보여야 일한다는 생각 있어서 직원 쉬는 꼴을 못봄 연차 사용은 자유로운건 연차 보장은 법적인 부분이고, 매번 미사용 연차 소진하라고 재촉하는거보면 미사용 연차 돈으로 주기 싫어서인듯, 창립기념일에도 내 연차로 쉬어야함 저 위에 사람들은 성과 재촉만 하지 책임지는 부분이 없음 대체 뭘 하는건지 모르겠음 노는 쟤나 일바쁜 나나 연봉도 비슷하게 간다 열심히 할 필요성이 느껴지지 않음 도태 되고 싶은 사람 대충 꿀 빨고 싶은 사람 가면 좋을 회사"
13,유엔젤,7958,주변에 흡연구역이라 담배피는 사람이 많다 그리고 시설이 좀 노후화 되어있다
14,유엔젤,7958,임원 혹은 매니저급의 금전적인 개념이 아직도 10~20년 전에 머물러 있는 듯
15,유엔젤,7958,연봉이 조금 낮다는 단점. 임원들이 뭐 하는지 모르겠다.
16,유엔젤,7958,우리 모두 돈보고 들어가잖아요? 여긴 그 가장중요한 연봉이 낮음
17,유엔젤,7958,노후화된 시설 IT기업인데도 수동결제받아야되는 시스템 적은연봉 발전가능성이 별로없어보임 뭘 배우고 싶어서 입사하는거면 비추
18,유엔젤,7958,정체된 느낌 있음. 무난하게 흘러가기 좋으나 배우고 성장하기엔 아쉬움.
19,유엔젤,7958,성장 힘든 회사이고 보수적인 사업마인드로 통신사 서비스 수주 외 미래 사업 전략이 약함
20,유엔젤,7958,it업체이지만 재택근무에 굉장히 회의적인 편이라 코로나 시국에도 열외없었음
21,유엔젤,7958,미래 성장 동력이 부족하여 성장이 멈춰 있는 아쉬움이 있음
22,유엔젤,7958,최근에 큰 성공 사례가 없어서 직원들이 조금 지켜있음 새로운 것들을 시도는 많이하지만 송공하지 못하여서 앞으로도 조금 힘들 것 같음
23,유엔젤,7958,"기업 규모에 비해 일을 주먹구구식으로 하는 경향이 있고, 연봉이 높지않음"
24,유엔젤,7958,"신규사업이나 B2C 서비스 사업등 관련 경험이 없다보니, 너무나 소극적이고 특히 인원 충원은 회사 운영에 매우큰 리스크라고 여겨 인력이 필요할 경우 무조건 계약직으로 충원함."
25,유엔젤,7958,어떤 팀이냐에 따라 많이 좌우되는것 같습니다.일 많고 바쁜 팀이지만 노는 사람은 그대로 놀고 바쁜 사람만 무지하게 바빠요.팀장님이 잘 조율하지 못하는곳 가면 고생이 많습니다.
26,유엔젤,7958,부서마다 분위기가다르고 시스템부서는 다른부서에 비해서 딱딱한 분위기. 새로운 먹거리바 있지는 않아서 현상유지는되나 여기서 더 성장할것같지는 않음.
27,유엔젤,7958,"프론트 서비스 업무가 대부분 그렇지만, 항상 장애에 대한 대비가 되어야 하고, 대응을 해야 함 근데 이건 대부분의 서비스 회사가 어쩔 수 없는 듯."
28,유엔젤,7958,예전 방식 그대로 유지하는 편. 개발자 많은 회사임에도 재택근무 없음. 장기근속자가 많은게 장점이자 단점
29,유엔젤,7958,완전 주니어가 아닌 이상 업무에서의 성장을 기대하기 어렵습니다. 교육 파트를 제외하고는 대부분 SI 위주의 업무를 담당하게 되어 인하우스를 원하는 분은 적합하지 않습니다. 경직된 조직문화를 가지고 있습니다. 근속년수가 매우 높은 직원이 많아 팀 리드의 기회는 거의 없다고 할 수 있습니다.
30,유엔젤,7958,직원들은 위한 보상이 적으며 변화하는 트렌드를 쫓아가지 못한다
31,유엔젤,7958,야근 필수적인 분위기. 한달 택시비로 40만원까지 쓴적있음 밤새는 경우도 많음
32,유엔젤,7958,"오래된 건물과 화장실, 협소한 근무 환경 (노트북 작은거 한대)"
33,유엔젤,7958,사무 공간이 너무 오래됨 인테리어 필요 위사 결정이 너무 느림
34,유엔젤,7958,회사 돈은 많다는데 직원에게 돌아오는게 없음. 즉 연봉이 짜다. 변화를 거부하는 윗선으로 인해 많이 답답하다.
35,유엔젤,7958,연봉이 낮음. 경영진이 목소리를 듣는 척하지만 이루워지지 않는다.
36,유엔젤,7958,성장엔진이 멈춘 회사 경영진 마인드가 너무 올드하고 부서끼리 자존심 싸움 심함
37,유엔젤,7958,"역피라미드 구조, 꼰대가 많음. 왕꼰대가 있었는데 나가서 좀 나아졌으려나?"
38,유엔젤,7958,"평화로워서 그런지 권력 다툼이 심한 편인데, 사업부마다 분위기가 많이 다르다"
39,유엔젤,7958,개발회사같지않음. 재택없고 유연근무제도 수직적. 연봉낮음. 경영진들에게 건의해도 절대 들어주지않음. 트렌드 전혀 못따라감
40,유엔젤,7958,경영진들이 보수적인 편. 팀 바이 팀. 팀에 따라 업무 환경이 안 좋을 수도 좋을 수도... 복불복이 강하다.
41,유엔젤,7958,"체계없음,담당자가 모두 책임.업무체계 확립이 필요합니다."
42,유엔젤,7958,"기업의 단점이라기 보다 근무 환경, 주변 환경 관련된 이야기입니다. 제가 비흡연자인데 회사 건물 아래쪽에 흡연구역이 따로 없어 담배피시는 분들이 길거리에 이곳 저곳 많았습니다. 그리고 제가 일했을 당시에는 회사 위치상 건물자체가 조금 오래된 면이 있었습니다. (회사 내부는 항상 청결하게 유지되었습니다)"
43,유엔젤,7958,- 몇몇 수준 낮은 매니저 만나면 같이 수준이 낮아질 수 있음 - 연봉이 그닥 높지 않음 - 신사업 발굴에 어려움을 겪고 있음
44,유엔젤,7958,"너무 안정적으로 지내고자 하는 분위기라 혁신적인 방향으로 가고자 하는 비전이 보이지 않고, 하던 업무를 몇년이고 동일하게 수행하여야 함. 비전을 보고자 한다면 비추"
45,유엔젤,7958,건물 자체가 오래되나 보니 생활환경이 좋지는 못합니다.
46,유엔젤,7958,"역 피라미드 구조, 아래 사람들을 많이 뽑아야할 것 같음 기본급이 타 아이티 회사보다 낮은 것 같음"
47,유엔젤,7958,철밥통이다 -> 근속년수가 많은 사원이 많기때문에 커뮤니케이션이 힘들다 연봉 협상이 어렵다
48,유엔젤,7958,"너무 낮은 연봉, 군 미필자들의 군대식 문화, 점심제공안함 야근비없음"
49,유엔젤,7958,"기본급이 좀 적음, 연봉 인상률이 높지 않음, 점심식대 제공 없음, 매일 밥사먹는거 고려해보면 230만원 복지비 그대로 털리는 느낌"
50,유엔젤,7958,개인주의적인 회사분위기 및 오래된 임직원이 엄청 많다.
51,유엔젤,7958,연봉 테이블 자체가 낮아서 아쉽네요. 회사가 우량하긴 하지만 성장을 못해서 역삼각형 구조라 중간 및 신입 등의 개발자가 필요한 상황입니다.
52,유엔젤,7958,"IT 기업이 맞나 싶을 정도로 보수적인 사내문화, 인프라도 IT회사가 맞나싶음"
53,유엔젤,7958,"차장/부장급이 너무 많고, 사원/대리급이 너무 적은 비대칭 구조. 그래서 자연스럽게 수직적이고 옛날 사고 방식이 만연하다."
54,유엔젤,7958,si 프로젝트가 많고 미래 비전은 보이지 않아서 이직함
55,유엔젤,7958,"부서마다 업무 강도가 크고, 매출압박도 받는팀만 받음."
56,유엔젤,7958,꼰대문화 수직적 구조 커리어에 도움이 안됨 연봉협상 일절없음 재택 할 수있는 구조지만 직원을 안믿음
57,유엔젤,7958,"급여가 많이 작았았지만, 값진 경험으로 생각하고 있다."
58,유엔젤,7958,단점 1시간 읊으라고해도 다 읊을수 있습니다. 연봉부터 시작해서 프로세스 따위 없어요. 몇몇 지배자들이 존재합니다. 어벤져스 타노스 보다 강해요. 그중 실력없는 사람은 대부분.
59,유엔젤,7958,코로나에 영향을 받아 실적이 잘 안나옴. 역피라미드 형태의 노령화로 목소리 내기가 쉽지 않음.
60,유엔젤,7958,연봉이 거의 안오른다. 코로나인데 재택근무 한번도 없었음.
61,유엔젤,7958,중간중간 이상한 사업한다고 해서 말아 먹은게 많음. 고인물들 조금 있음.
62,유엔젤,7958,성장동력이 예전만큼은 없네요. 예전처럼 해외 사업이 많아지면 좋겠습니다. 화이팅하세요~
63,유엔젤,7958,연봉이 동종업계보다 너무 적은 편. 중간 직급인 과장이 별로 없고 부장이 많아서 역 피라미드 구조임. 평일 초과 근무 수당을 밤 10시 이후에 지원해서 휴일 근무를 하지 않는 이상 지급 받을 수 없음
64,유엔젤,7958,퇴사율이 낮은만큼 고인물+라떼 시전은 있으나 한귀로 흘릴 수있다면 그냥 다니기 좋음 경영진이 발로 뛰지않는다 책임지려는 리더가 별로 없고 시간이 해결해 줌
65,유엔젤,7958,새로움과는 거리가 먼곳.낡은 관습을 버리지 않으면 더이상의 발전은 없습니다.인재를 키워주세요
66,유엔젤,7958,"발전이 없음, 별다른 일을 하지 못한상태로 연차만 쌓일 수 있음"
67,유엔젤,7958,정직원과 계약직 간 눈에 보이지않는 차별이 크다. 팀마다 다르지만 근무강도가 빡셈.
68,유엔젤,7958,최근 몇년동안 비슷한 업무만 진행하고 있음. 발전적인 일이 필요함
69,유엔젤,7958,새로운 것에 대한 도전의식이 약하고 임원들의 올드한 마인드 오래된 아저씨들의 월급약탈자들...노는 사람이 너무 많음...
70,유엔젤,7958,"회사 성장이 정체, 소폭 쇠퇴 중. 일부 구 사업들이 기업의 발목을 잡고 있음. 새로운 비즈니스 모델 및 상품 개발이 필요함. 연봉인상률이 그렇게 좋지 못해서 대리 과장급이 경력쌓고 대기업으로 이직을 많이 함. 중간이 없는 모래시계 구조."
71,유엔젤,7958,"수직적임. 낡은 사고를 가진 사람들이 종종 있음. 사원, 대리급에게 좋은 회사는 아니라고 생각함."
72,유엔젤,7958,"특정 본부에서 회사돈을 있는 데로 갇다씀, 그런데 인센티브는 전 직원이 n빵함"
73,유엔젤,7958,보상이 현저히 낮음 업무 자유도가 떨어짐 연령대가 높음
74,유엔젤,7958,에스아이 위주 프로젝트 다수여서 호불호 있을수 있음..
75,유엔젤,7958,연봉 결정권자의 따라 천차만별 배울 것 없음 지옥같은 곳
76,유엔젤,7958,"기업의 성장세가 둔화된 것이 가장 큰 단점이며, 신규 사업을 이끌 창의적인 인재가 부족합니다."
77,유엔젤,7958,적자가 나는사업을 몇 년째 계속 이어가고 있음. 해당 사업을 접지 않는 이상 무조건적으로 마이너스 성장률을 보일 것으로 예상. 대부분의 사람들이 프로젝트에 대한 애정이 없음. 제품을 돌아가만들면 되지 라는 생각을 가지고 있음.
78,유엔젤,7958,"조금 오래된 시설, 엄청 적지도 않지만 많지도 않은 연봉"
79,유엔젤,7958,야근과 철야가 너무 많은 기업입니다. 업무가 없어도 저녁식사가 필수인 기업입니다.
80,유엔젤,7958,"올드할뿐만 아니라, 부장급만 너무 많고 중간 대리급이 너무 없는 회사. 왜 대리급들이 오래 못버티고 나가는지 의문도 없고 도구처럼 쓰고 버리는 회사."
81,유엔젤,7958,무난하다. 개인주의. 좋지도 않은 복지. 매너리즘. 한정적인 고객. 레거시한 형상 관리.
82,유엔젤,7958,단점인지는 모르겠지만 과장 차장이 정말 많다 평균연령이 너무 높다 그만큼 ㄲㄷ가 많다
83,유엔젤,7958,"평온하다...너무..변화가 없고, 부서간 단절되어 있다."
84,유엔젤,7958,연령대가 높다보니 이런저런 일처리에 고지식한 면이 있음(부서 마다 다름) 연봉 상승폭이 높지 않음
85,유엔젤,7958,나이 많은 사람들이 많음 그로인한 꼰대가 많음 이런저런 소문 말이 많음
86,유엔젤,7958,"2018년 들어 흑자전환하긴 했지만, 그 전 2년간은 적자인 상태였기 때문에 장기적인 안정성은 약간 떨어집니다."
87,유엔젤,7958,경직된 상하관계 명령하달식 커뮤니케이션 대우개선에대한 희망고문
88,유엔젤,7958,성장세가 없다. 기존의 사업만 고수하고 신규사업에 대해 투자가 소홀한 편이다.
89,유엔젤,7958,집에서 출퇴근길이 멀어서 힘들었음/ 딱히 단점이 없었던 회사 2년 열심히 다니고 퇴사했습니다.
90,유엔젤,7958,"단, 일이 많다. 팀마다 분위기가 상이하고 줄을 잘 서야한다. 야근이 강요되지 않지만 일정이 빡빡하게 돌아간다. 개발자들의 고집이 너무 강하다."
91,유엔젤,7958,가족같은 분위기라 서로 눈치보면 올바른 얘기하기 힘든 분위기
92,유엔젤,7958,"통신망에서는 현재의 트렌트를 쫒아가지 못 하고 있고, 투자를 하지 않고 성과만 얻으려고 함. 업무 효율보단 야근을 많이 하면 좋아함"
93,유엔젤,7958,적은 연봉. 역피라미드 구조. 부서에 따라 야근이 많은 곳도 존재함. 업무 분담이 효율적이지 못함
94,유엔젤,7958,"업무강도가 약하다. 사원, 대리 제대로 배워야 할 시기에 일을 못 배운다. 사업부에 의욕없는 사람이 많다. 성과에 대한 보상이 약하다."
95,유엔젤,7958,사업적 결정을 하지 못하고 기준이 없음. 예전에 쉽게 수익을 내던 시절의 문화에서 변화에 적응하지 못함.
96,유엔젤,7958,"차/부장 직급자들이 점점 많아지고, 정치적인 분위기가 스물스물 올라오는 분위기. 그리고 미팅좀 적당히 했으면 좋겠음"
97,유엔젤,7958,"전혀 없다고 볼수있는 회사복지. 복지는 전혀 없다고 보면된다. 많은 사람들이 계약직, 아르바이트로 근무하여 잦은 업무 인수인계로 피곤한 부분이 많다."
98,유엔젤,7958,"타이트한 인력관리, 하지만 이건 개인의 업무 능력에 따라 장점이 될 수 있다."
99,유엔젤,7958,신사업실패로 SI가 주인 부서는 바쁘기만하고 노잼. 통신사 납품으로 연명. IT기업답지 않은 수직문화 분위기. 상위임원층 중간관리자층 하위개발자층이 개미 몸처럼 분리되어 돌아감.
100,유엔젤,7958,"옛 기술로 현재도 사업은 진행 되고 있으나, 새로운 기술에 대한 사업이 부족합니다"
101,유엔젤,7958,"보고도 많고, 의심도 많아서 감시를 많이합니다. 개발관련한 교육도 안보내줌"
102,유엔젤,7958,"차 부장이 너무 많다. 팀장,부장 들이 임원 눈치를 심하게 본다. 올라갈수록 힘들어지는 회사 팀간 소통이 없다. 변화는 위험하다고 생각하는듯. 현재유지가 최선이고 변화의 바람은 나 빼고가 되어야 하기에"
103,유엔젤,7958,"역피라미드가 심하여 낮은 직위의 직원들이 힘들고, 회사 발전 가능성이 매우 낮다"
104,유엔젤,7958,"급여 수준이 업계 평균이아하며, 경영진 마인드가 좋지 않음. 휴가 연차등 직원 복리에 신경 쓰는 모습이 전혀 없음."
105,유엔젤,7958,시도 때도 없이 갑으로 부터 전화를 받게 된다. 통신 개발 외 파트로 빠질 경우 소외되는 느낌을 받을 수 있다. 통신 개발 파트로 빠지면 정말 일을 많이 하게 된다.
106,유엔젤,7958,연봉이 낮다. 인상률도 높지 않다. 미래 성장성도 낮은 편이다. 미래에 대한 투자가 비적극적이다.
107,유엔젤,7958,"역피라미드 구조이다.(윗사람들이 너무 많음) 사원, 대리급들이 별로 없다. 사업부에 따라 분위기가 천차만별"
108,유엔젤,7958,회사의 노령화로 인해 시니어 개발자의 부재가 큼 수직적인 조직문화
109,유엔젤,7958,보고 문서 작업이 너무 많고 굉장히 수직적임. 요즘 하락세를 달림...
110,유엔젤,7958,"조직문화가 딱딱한 부분이 있음, 사무실 분위기는 조용하고 도서관 같은 느낌"
111,유엔젤,7958,역피라미드구조가 너무심해서 팀에 사원 대리가 거의없다 과장 보다 차장이 더많고 차장만큼 부장도 많다. 내부시설도 오래됨
112,유엔젤,7958,"부서에 따라서 호불호가 갈리며, 중소기업이라는 한계상 연봉이 크지 않다는 점이 가장 크다. (경력직 제외)"
113,유엔젤,7958,모험하지 않는 기업 문화로 새로운 시도를 잘 안함. 요구사항을 잘 안들어주는데 그만 두겠다고 하면 들어준다고 함.
114,유엔젤,7958,개인에게 바라는 능력치가 매우 크고 일에대한 해결보다 책임을 추궁하고 일에 포커스를 맞추기보다 보고에 드는 시간이 많음
115,유엔젤,7958,창업멤버들이 그대로 임원진으로 남아있어서 승진은 부장까지만 가능함. 오래 근무한 직원들이 많다보니 기업문화가 좀 구식임
116,유엔젤,7958,신규 입시자가 3년을 버티지 못함. 왜 그런지 위는 관심 없음. 그저 나가는 사람이 못버티고 나가는거라고 얘기함
117,유엔젤,7958,자기 발전 하기 어렵다 회사가 너무 군대식이다 판단이 너무 느리다
118,유엔젤,7958,의리가 있다보니 경쟁심한 it업계에서 살아남기힘듬!!!!!!!!!!!!!!!!!
119,유엔젤,7958,"다이렉트로 일 처리 해도 될 것을 하나하나 돌려가며 일을 처리하여 일의 속도가 떨어짐. 정규직, 계약직을 너무 구분하여 생활함"
120,유엔젤,7958,회사가 점점 커가기보다는 점점 정체되어가고있다. 새로운 제품을 미리 만들어 미래를 준비하기보다는 그때그때 필요한제품을 개발하여 급조한 프로덕트로 임기응변식 대처가 늘고있어 회사 역량이 정체되고있슴
121,유엔젤,7958,부서마다 팀분위기가 틀리지만 군대 문화가 있는 팀이 많은듯하다.
122,유엔젤,7958,"신입 사원이 일은 배우기에 체계적인 시스템이 없어 아쉬움, 부서 분위기, 상사에 따라 일을 배우는 분위기가 좌우 되는 것 같다."
123,유엔젤,7958,"연차를 사용할 때 눈치가 보임. 프로젝트에 따라 인력이 부족해도 충원은 없음. 차/부장급 인력이 상당히 많음(직원들이 이직을 안하는 것은 언뜻 장점일 수 도 있으나, 안정적이라기 보다는 정체된 느낌이 강함)"
124,유엔젤,7958,"개발이나 운영인 경우, 잦은 야근과 철야 작업이 있으며 연령대가 높은 과장 이상급이 다수로 아래 사람이 새로운 일을 배울 기회가 적다고 느껴지며 업무 강도가 세다. 연봉이 적으나 복지는 대기업 수준에 맞추려고 노력함"
125,유엔젤,7958,신규사업의 경함도 프로세스도 모두 부족해 보임.사람을 중요하게 생각하긴 하지만 능력있는 리더가 부족해 보임.
126,유엔젤,7958,조식거리가 없음 휴식시간을 지키지 않음 일이 한곳에 몰리는 비효율적임 구조
127,유엔젤,7958,모든 평가와 사업에 대한 판단 등이 정성적으로만 이루어진다. 지나치게 가족적이다보니 냉정한 판단보다는 관계와 감에 따라 움직이는 편 오래 다닌 사람들에게는 편안하겠으나 신입이나 외부 경력직 들은 적응에 시간이 걸릴 수 있다. 전체적으로 노후한 분위기가 문제.
128,유엔젤,7958,힘든 사업을 계속 하고 있음. 매출 대비 수익 창출이 저조해 보임 팀/부장으로 올라가기가 힘듬. 복지제도는 15년전하고 동일함.
129,유엔젤,7958,"임원의 야근 강요 마인드, 팀/부장급들의 임원 눈치보며 내리갈굼, 휴가 사용에 대한 눈치, 적은 연봉 인상률"
130,유엔젤,7958,야근은 있는 편임(아주 많지는 않지만 적당히 있음.) BtoB->BtoC로 전향 하고 있으나 아직 실적은 많지 않음.
131,유엔젤,7958,역동적이지 않아서 조금 심심했던 회사 약간 정체되어 있다는 느낌을 받았음 벤처정신을 가지고 더 빠르게 움직여여함
132,유엔젤,7958,개발자들이 많고 남자들이 많아서인지 약간.. 군대식? 마인드를 갖고있는듯함 차장급 이상이 업무에 미치는 영향이 굉장히 크고 본인 판단으로 사업을 좌지우지 하는 경향이 있음(ex. 내가 이 사업에 pm 이지만 하다보면 아닌듯한 마음을 가질수도있음 내꺼인듯 내꺼아닌 내꺼같은 그것)
133,유엔젤,7958,"엄청 보수적인 분위기,압박으로 인한 불편함 다소 있음. 성장가능성 다소 지체"
134,유엔젤,7958,"역 피라미드 구조, 윗선에 아직 군대식 문화와 마인드가 남아있음. 보여주기식 업무처리를 하지 않으면 터치가 들어옴. 신규사업의 실패를 직원들에게 매꾸게 하려는 것이 보임."
135,유엔젤,7958,새로운 사업보다 기존 사업을 유지하는 것에 힘쓰는 편입니다. 찍어내듯 만들어내는 일이 단점이라 생각합니다.
136,유엔젤,7958,팀마다 다르나 아직 군대문화에 젖어있는 직책자가 존재함. 동종업계의 공통단점인 장애발생시 야간 주말 언제든 연락이 올 가능성 존재
137,유엔젤,7958,보수적이다.옛영화에 고취해 있다.당장의 이익만을 쫏는다.새로운 사업하다가 힘들어서 다들 그만둔다.
138,유엔젤,7958,IT기업다운 인력에 대한 투자나 새로운것에 대한 도전 에너지가 약해보임.
139,유엔젤,7958,"최근 분위기가 야근을 권장함 수직적 소통이 적으며, 의견 수용이 소극적임 좋은 아이디어가 사장되는 경우가 많음"
140,유엔젤,7958,임원들이 보수적이고 IT 기업답지 않게 보수적임. 회사 행사가 일관성이 없음 했다가 안했다가 마음대로 임.
141,유엔젤,7958,의미없는 평가제도 새로운 역량의 영입부제로 인해 고인물이 되어가고있음
142,유엔젤,7958,"연봉이 짰고, 업무 강도가 아주아주아주 높았습니다. 그리고 업무가 통신쪽과 하는 것이라서 힘들수 있습니다."
143,유엔젤,7958,야근이 부서별로 차이가 크다보니.... 부서별 정치싸움 장난 아님.. 개발자 회사이다보니 기획자의 힘이 너무 없음..
144,유엔젤,7958,"조직구조, 직책자, 개인별 담당업무가 너무 정체되어 있다. 조직개발실에서 하는 일이 너무 없다. 체계가 없고 주먹구구식 일처리가 많음. 직책자 승진기회가 거의 없음. 연봉 통보."
