,company_name,company_id,review_text
145,유엔젤,7958,"낮은 연봉 및 인상율, 경영진 맘대로 진행되는 사업. 사렂관련해서 아래사람들의 의견은 무시되는 편. 무능한 사람이 많은데 경영진은 그걸 모르는듯. 임직원 평균 연령대가 너무 높다."
146,유엔젤,7958,"자기 개발 시간이 부족하다, 미래의 비젼이 부족하다. 직원의 커리어 패스를 관리가 별로임"
147,유엔젤,7958,사업부와 팀마다 분위기가 많이 다르며 팀원 개개인의 역량에 의존하는편 일부특정 부서의 경우 암묵적인 야근문화 존재
148,유엔젤,7958,"역피라미드 구조, 정체되는 듯한 개발능력, 팀에 따라 을의 설움을 느낄 수 있음."
149,유엔젤,7958,교육업으로 시작한 회사가 아니라 교육 브랜드 이미지가 약해 개발된 어플들의 공신력이 떨어지는 경우도있음.
150,유엔젤,7958,"역피라미드 구조, 신입사원 공개채용은 거의 없음. 대부분 경력 직원 채용이 많고 IT 기업치곤 보수적임"
151,유엔젤,7958,"부서마다 차이가 있겠지만 직원들의 자존감을 높혀주지않으며 오히려 자존감을 상실하게 만든다 역시 부서마다 차이가 있겠지만 어떤 팀은 개발자가 고객응대, 시스템설정, QA, 고객사 상대, 패키지 적용, 그리고 잘못되었을때의 모든 책임 등 모든 업무를 홀로 진행하며 그게 당연시되고 있다. 개발자로서의 실력향상은 기대할 수 없다"
152,유엔젤,7958,야근을 강요하는 분위기. 새로운 것에 대해서 윗사람들이 부정적.. 당장 돈 되는 일 아니면 진행을 꺼려함...
153,유엔젤,7958,임원들의 대기업적인 마인드. 실무 인원들에 대해 배려를 하는 것이 없으며 근태로 많은 것을 판단함
154,유엔젤,7958,"IT회사답지 않게 매우 보수적입니다. (업무시간 인터넷 금지, 집중근무제 도입으로 점심시간 12시-13시 칼처럼 지켜야 함) 일이 없어도 야근 하기를 강요하는 분위기입니다. 업무강도와 스트레스는 매우 높은 편입니다. (철야 작업있음) 사내 동호회나 문화는 전혀 없습니다."
155,유엔젤,7958,합리적인 업무문화가 필요하다..야근해야 돈을 벌수있다라는 공식은 어떻게 만들어 진걸까
156,유엔젤,7958,여름휴가 본부장 결재 없이 3일까지 가능하여 대부분 휴가를 3일만 계획함
157,유엔젤,7958,"개발자 출신의 경영진의 특성으로, 개발 관련 사업에는 적합하나, 그외 사업적인 결정에는 취약한 편. 신규 사업하기에 적합하지 않음.여름휴가 본부장 결재 없이 3일까지 가능, 5일 가려면 본부장까지 결재 받아야 해서, 대부분 3일만 감"
158,유엔젤,7958,복지카드 때문인지 딱 200만원 만큼 연봉이적은 느낌. 일을 배우기가 쉽지않고 을의 설움이 있다
159,유엔젤,7958,너무 안정적이라 직원 구성이 역피라미드 구조다. 사원-대리 급 실무진들만 죽어난다.
160,유엔젤,7958,역피라미드...구조 위에 어르신들이 많고 보수적 성향이 다소..
161,유엔젤,7958,회사 계급 분포도가 역 피라미드 구조라서 모셔야 할 분들이 많다는 점.
162,유엔젤,7958,"신입은 들어왔다 금방나가고 10년이상 장기 근속자들이 많음,"
163,유엔젤,7958,"평가와는 다르게 적용되는 인사 시스템이며, 야간 작업이 많은 부서도 있음"
164,유엔젤,7958,기술력은 좋으나 신사업을 무리하게 진행 한다.
165,유엔젤,7958,오너의 마인드가 좋지 못함. 못해도 잘해도 연봉 차이가 크지 않음
166,유엔젤,7958,상당히 보수적이고 상하적 관계로 경직된 사내 분위기
167,유엔젤,7958,지나치게 보수적이고 문제발생시 책임소지를 너무 따짐
168,유엔젤,7958,업무 순환이 쉽지 않으며 사이트에따라 업무 강도가 다름.
169,유엔젤,7958,"개발, SI위주의 조직 문화. 보수적인 투자 마인드."
170,유엔젤,7958,일부 임원들이 답정너 스타일로 쪼아대서 퇴사하는 경우가 있음. 본부 간 협업이 잘 안됨. 위에서 비전을 제시하지 않고 밑에서 만들어내라고 함.
171,유엔젤,7958,보수적인 측면이 강함. 새로운 시도를 많이 하고 있지만 본업 이외에는 크게 성공하지 못하고 있음
172,유엔젤,7958,기업 비젼의 불투명. 임원진들의 옹고집.
173,유엔젤,7958,윗분들의 주관적 의견이 사업진행에 많이 반영되는 점이 아쉬움. 당장 눈앞의 사소한 손해를 두려워하여 전전긍긍하는 면이 있음.
174,유엔젤,7958,"보수적인 분위기인 것 같고 젊은 20, 30대보다는 40대 부장님들이 더 많습니다. 회사 이익 구조도 정체되서 고민이 많은 것 같습니다."
175,유엔젤,7958,"8층 연구개발본부는 오래전에는 실력으로 평가하였으나, 점점 정치와 인맥으로 평가함. 이로 인하여 오래된 숙련된 개발자들이 하나씩 이직을 함"
176,유엔젤,7958,임원들이 정치만 한다. 또한 여기 저기 유명한 회사의 낙하산이 들어와 있다. 대표적인 상명하복구조 아무리 아니라고 이야기 해도 위로 의견이 반영되지 않는다.
177,유엔젤,7958,"반복되는 업무 범위에서 벗어나지 못하므로 무언가 배우기는 어렵다는 점, 약간의 군대문화"
178,유엔젤,7958,그들만의 리그. 자화자찬에 능하다. 유가증권시장 상장사라는 10년전 허울 뿐.
179,유엔젤,7958,복지에 비해 적은 연봉 갈수록 작아지는 연말 인센티브
180,유엔젤,7958,"회사 규모에 비해 사무용품(모니터, 책상, 의자)이 열악하고 회의실 관리가 효율적이지 못하다."
181,유엔젤,7958,"그 외 모든 것이 단점. 비전도 없고 수익도 없다. 분위기만 안 좋아지고 있다. 일도 없고 수익도 없는 공간에서 야근만 강요하면서 이를 바탕으로 근태를 논하고 있다. 근무시간 일을 다 마치고 가는 사람보다 능력이 없어 밤 10시까지 남아있는 직원을 더 소중히 여기는 회사. 결국, 일 잘하는 사람도 일을 다 끝냈음에도 불구하고 일 못해서 남아있는 직원을 이기기 위해 밤 10시까지 남아야한다. 이 무슨 쓰레기 같은 처사인가?!!"
182,유엔젤,7958,한줄평에 쓴것처럼 경직된 회사 분위기가 최대 단점이다. 연구개발본부에 한정하면 야근을 매우매우 장려한다. 주말출근도 장려한다.
183,유엔젤,7958,"회사가 경직되어 좋은 개발자들은 나가는 분위기 자기의 의견 개진이 힘듬 팀마다 공유하는 지식, 기술들이 보이질 않음. 따라서 팀마다 노하우가 쌓이지 회사에 노하우가 쌓이지 않음. 야근을 새벽 2시까지 해야 3만원정도를 줌(pm 10 ~ am 02)"
184,유엔젤,7958,회사가 많이 침체되어 있다. 인사 및 사업 개편이 필요
185,유엔젤,7958,새로운 성장동력이 없어서 수익성은 계속 악화 되는 중 몇년동안 지속된 수익성 악화로 가장 큰 장점인 안정성이 최근 들어 많이 떨어지고 있음 하는 일만 계속 반복되며 새로운 기술을 배우고 성장하기 위해 다닐 수 있는 회사는 아님
186,유엔젤,7958,- 아직은 새로운 성장가능성을 가진 사업이 보이지 않음. - 최근 몇년간 하락새를 보임.
187,유엔젤,7958,새로운 사업을 찾고자 노력하나 마땅히 길이 보이지 않는 상황.
188,유엔젤,7958,너무 안정적으로만 가는듯. 돈되는 기업들 인수해서 회사좀 키웠으면 중견사정도 되었을텐데 아쉬움.
189,유엔젤,7958,"역피라미드 구조. 부장,차장급이 엄청 많음. 10년 이상 연속근무자도 많고. 그만큼 업무에 전문가이고 분위기가 안정적인 부분도 있지만, 새로운 의견이 받아들여지는데 시간이 오래 걸린다는 평."
190,유엔젤,7958,"기업문화가 보수적인 면이 없지 않아 있음, 신입이나 새로운 입사자는 조금은 적응이 어려울수 있음. 인센티브제로 계약 연봉은 적을수 있음"
191,유엔젤,7958,본부마다 개발 프로세스의 수준 차이가 많이 납니다. 어느 본부는 주먹구구식 개발이 아직도 자행되고 있어 자기 개발의 기회가 미약할 수도 있습니다.
192,유엔젤,7958,편한만큼 배울게 없음 본인이 정말 많이 노력해야 공부할 수 있음 공부 많이 하세요.
