,company_name,company_id,review_text
0,이데아인터렉티브,10271,비효율적인 주말출근 대표눈치보기 회식문화(아직도 그럴련지 잘모르겠지만) 연봉도 복지도 메리트가 딱히 없음 디자이너 커리어에 악영향 딴곳가면 적응못할정도로 발전이 없어서 개인개발 필수 뒤에서 쓸떼없는 말도 많고 심심하신건지 잘모르겠음
1,이데아인터렉티브,10271,대표가 너무 권위적임. 실력없는직원많음. 사무실에서 큰소리가 많이남. 특정 직원편애
2,이데아인터렉티브,10271,"체계가 없고 대표가 곧 법이요, 오래 다녀서 이직해도 적응 못할 고인물들이 체계인 곳입니다. 복지라고 있던 것은 대표 기분 거슬리게 하는 직원이 한 명이라도 있으면 없어지거나 그 직원 죄 짓는 기분들라고(직접 들은 얘기) 변경되기 일쑤. 연차도 자유롭게 쓰라고 하지만 일에 전혀 지장이 없이 인수인계가 되어 있는 상황에서도 대표 눈에 거슬리면 뒤에서 욕합니다. 직원 개개인에게 다른 직원의 됨됨이를 묻는다거나 오랜된 직원이라는 이유만으로 위아래 상관없이 타 직원 평가하도록 시킵니다. 대표 본인이 이 회사는 오래된 직원들이 직원들을 평가한다고 입에 달고 사는 사람입니다. 가끔 듣고 싶지 않은 다른 직원 개인사 얘기도 해줍니다. 대표실은 따로 없고 사무실 윗 층 자택에서 수시로 내려와 큰 소리로 업무 관련 문제에 대해 흥분하거나 회의 하는 날엔 집중이 전혀 안되는 사무실 구조입니다. 디자이너는 툴로 사용할 뿐 말도 안되는 수준의 사람들이 디자인을 평가합니다. 디자인 상사가 컨펌하는 구조가 아니라 촌스럽기 그지없는 기획자와 프로모션 직원들이 디자인이 이러쿵 저러쿵 이야기하고 대표에게 평가하기 바쁩니다. (이것이 그들이 사는 방법.)본인들 업무 능력을 제발 한 번이라도 다른 회사에서 평가 받아보기를 진정으로 바랍니다. 그 어떤 회사에서도 본 적 없는 무대뽀 스타일입니다. 누가 야근을 하네 안하네 대표에게 일러바치기 바쁩니다. 그 외에도 진짜 할 일도 더럽게 없네 할 정도의 일들이 너무 많습니다. 구조 상 디자이너는 오래될수록 퇴보할 수 밖에 없는 곳이라 판단됩니다."
3,이데아인터렉티브,10271,별로 탄력근무제가 적용되는 팀이 있지만 아닌 경우도 있어서 아쉬움. 사내 복지 제도는 일괄적으로 적용되는 것이 좋지 않을까
4,이데아인터렉티브,10271,여자 사장이라 우먼파워가 쎈편이라 남자직원이 입사시 적응을 잘못할수도 있음
5,이데아인터렉티브,10271,눈치주는 분위기이다. 배려하는 문화가 눈꼽 만큼도 없고 디자인팀에게 일시킬때는 내놔라식이 많다. 상세페이지는 보통3일정도 주지만 더 급하게 요청하는 식이 많고 수정이 많은데 수정건은 바로바로 처리해야해서 마음이 바쁘고 여유가 없다. 일 자체를 넘겨줄때 기획이란것을 보통 해서 주는데 여긴 그딴거 없고 그냥 문구배치정도와 원하는 방향 이미지를 주는데. 참 수준떨어져서 코웃음만 나온다. 그나마 이렇게라도 주면 일이라도 하는데 프로모션팀이라고 행사를 진행하는 부서인들은 아예 이런것도 없고 대충 피피티에 글자만 작성하고 보내놓고 빨리달라고 징징댄다. 기획이란 기획은 찾아볼 수가없는 구조이다. 기획자가 없기때문. 행사가 있을때 생각해둔 방향이 있냐고 물어봐도 없다고 대놓고 말한다. 하도 어이가없어 디자이너가 기획을 해서 진행해야한다. 또한 행사가 시작되기전 디자인해야할 리스트조차도 없고 당일날 아니면 하루전날 급하게 해달라고 또 징징댄다. 물론 클라쪽에서 무리하게 시킬때도 있지만 매번 하는 행사를 허둥지둥 진행하는 모습을 보고 있으면 참 머랄까 타회사 신입사원을 보는거 같았다. 이렇게 바보같이 일하고 있는 사실을 경영자들에게 이야기해도 오래다녔다라는 이유로 편애하며 귀닫고 오히려 디자이너들이 이해하라고 부탁을 받는다. 다녀보면 안다. 얼마나 썩었는질..너무썩어서 냄새날정도이다. 상황이 이렇다보니 디자이너들만 계속 퇴사를 하며 타부서 사람들만 계속 오래오래 다니는 구조인데 경영자들은 오래다니는 직원들이 많아서 좋은 회사라고 착각한다. 참 재밌는 구조이다. 다니면서 느낀점은 오래된 사람들이 실력이 없다보니 회사가 정체된 느낌을 받았다. 훨씬더 클 수 있다고 보여지는데 멈춰있는 느낌. 디자이너만 물갈이 계속되는 상황. 디자이너들이 3개월 버티기 힘든곳. 다녀보면 안다. 다녀봐라 ㅎ
6,이데아인터렉티브,10271,특정 기업의 업무만 하다보니 한정적인 작업스타일 아쉽다
7,이데아인터렉티브,10271,"디자인 업무의 특성상 자잘한 수정이 잦은편이나 이부분은 어떤 광고주와 기획자를 만나느냐에 따라 케바케. 업무의 8할이상이 K사 업무라서 권장 컬러와 가이드가 정해져있는 경우가 많기 때문에 독창적이고 새로운 시도를 하거나, 디자이너 본인이 만족할만한 시도를 하기 힘듦."
8,이데아인터렉티브,10271,"오래된 회사인데 조직이 어수선함, 최근 트렌드와는 다른 복리후생"
9,이데아인터렉티브,10271,"일을 잘해야만 한다(당연한 얘기지만), 업무가 몰릴 때와 그렇지 않을 때의 차이가 많이 있다,  직장 생활을 해본 사람들은 알겠지만, 완벽한 회사는 없습니다. (어느 곳이나 장단점이 있고 부족한 부분이 있지만 터무니없는 리뷰들을 보고 황당. 그 정도의 단점은 아니라고 생각하며,) 디자이너로서 충분히 발전과 경험의 시간은 가질 수 있다고 생각합니다. (일이 몰릴 때와 담당 광고주에 따라 힘들 수도 있지만)"
10,이데아인터렉티브,10271,년차높은 장기근속자가 많은게 장단점 모두가 될 수 있음 근무시간은 길지 않지만 그시간동안은 바쁨
11,이데아인터렉티브,10271,업무량이 좀 있는 편이라 업무 터득하기전까지 힘들었어요
12,이데아인터렉티브,10271,"컴퓨터가 엄청나게 느림. 이 컴터로 대형 인쇄물 작업해야 됨. 야근의 주된 이유가 컴퓨터인 경우 꽤 많음 / 무를 경험할 수 있음. 여기서 무는 갑을병정무. 원청인 k사에서 무리한 일정을 요구해도 대표조차 일정 조율 불가(SSKK가 요기잉네??) /k사에서 권장하는 색상_ 블랙, 레드, 민트(빛바랜 방수페인트 색) 이 세 가지 색상이 있는데 같이 사용하면 이게 뭔 조화인가싶음. 게다가 색약자들을 위해 색상 대비값이 높지 않을 시 반려하는 프로그램을 사용하게 하는데 디자이너들은 알 거임 대비값을 높이고 한정된 색상으로 작업할 경우 디자인 퀄리티는 기대하기 힘들다는 것을. 이건 뭐 포트폴리오에 넣기도 부끄러운 퀄인데 컨펌도 오지게 오래걸림. 10차 수정은 기본인데 수정을 거듭할 수록 퀄도 저 나락으로 떨어짐. / 프로모션 기획자는 기획안 없이 업무 요청을 말로 함. 매번 하던 작업물의 업무 리스트조차 만들 줄 모르는 게 제일 신기한 부분 /"
13,이데아인터렉티브,10271,당시는 타부서간의 업무로 야근 혹은 주말출근이 종종 있었음 대기시간이 많아 비효율적이라 생각함
14,이데아인터렉티브,10271,"일을 그지같이 한다 / 기획자는 있는데 기획이 없고 전달자들만 넘처난다 / 매번 같은 행사를 하는데 허둥지둥 갑자기 일을시켜서 짜증나게 하고 주말에도 일시킨다 / 야근하지말라고 앞에서 이야기하고 뒤에서 야근안한다며 보복성 복지를 없앤다(패밀리데이, 그날데이 맘대로 취소) 월요일날 전직원 9시 10분 청소시간이지만 하는사람만 계속하고 안하는 사람은 늘 안하거나 뺀질거린다 / 디자이너는 타부서 책상까지 닦아야한다 ?? 왜죠?? / 디자인실이 너무나 개방적이며 늘 자유롭게 돌아다니며 심지어 모니터들이 대놓고 보이는 자리가 반이다 제일 어이없는 부분 / 직원의 차별이 심해 이쁨받는 능력없는 직원이 지각했을때는 아무말 않다가 실력있는 미운털박힌 직원이 지각시 사무실이 다 들릴정도로 면박준다 / 회식도 본인들이 좋아하는 직원들만 데리고 가서 사주고 미운털이 박혔거나 퇴사 예정자들은 아예 데려가지도 않는다 즉 먹는걸로 직원들에게 소위 맥일려고 하는 치졸하고 옹졸한 방식으로 대한다 / 여기는 직급이 필요가 없고 그냥 자기사람이냐 아니냐에 따라서 모든게 결정된다 / 기본 상세페이지 업무에 행사 업무가 더해지면 업무량이 정말 많아지는데 그상태에서 수정이 계속 발생하며 새로운 행사일은 갑자기 해달라는 식이여서 이 업무를 한 사람이면 퇴사한다.아니면 퇴사예정이다 / 디자이너는 고생해서 일을 끝내도 고생했다는 말은 한마디도 못듣고 휴가도 안나온다 / 보여주기식 야근을 좋아하는데 힘들어서 야근을 할 수가 없다 / 집중력을 200% 발휘하면서 숨돌릴 시간도 없이 계속 일을 하면 6시가 된다 / 이렇게 일하니 디자이너들이 땡하면 퇴근하기 바쁘다 머리가 너무 아프다 /"
15,이데아인터렉티브,10271,단점을 무엇부터 적을까 고민할 정도로 전부 문제지만 제일 큰 문제는 특정 부서의 사내 갑질과 관리자의 80년대 마인드
16,이데아인터렉티브,10271,마음의 병들이 있음.. 특히 오래된 직급(대표랑 부장 제외)의 몇몇 관리자들은 새로운것을 싫어하고 대표의 개혁적 혁신적 태도를 따라가지 못함.
17,이데아인터렉티브,10271,"-포괄임금제(연차도 12로 나눔??황당 그 잡채, 외근 시 교통비 지원도 없음) -월요일 20분일찍 출근 후, 아침청소 (청소해야 애사심이 생긴다함, 이시대에 손걸레질 할많할않) -대기업의 무리한 업무 요청으로 야근 발생 -디자인 수정이 너무 많음 -디자이너 이직이 매우 잦음 -대표 기분에 따라 복지가 생겼다 사라졌다 함(기복이 심한 편) -직원 간의 형평성을 이야기하지만 임원진이 좋아하는 직원의 형평성임, 그들만의 형평성을 운운함 -업무 환경이 정말 안 좋음, 작은 공간에 다닥다닥 붙어있음. 숨소리도 들릴정도임.모니터에 대한 프라이버시가 없으며 다른 직원의 모니터를 수시로 감시? 하는 기존 직원이 몇 명 있음(다른데 가서 이러면 욕먹습니다.^^) -뒤에 와서 삿대질로 업무 지시하는 몇 직원 있음 -타 부서 직원들이 디자인이 별로라며 대놓고 이야기 하는데 이게 잘못된 걸 모름.. (님들이나 잘하세요.) -오래된 직원이 많음 너무 많음"
18,이데아인터렉티브,10271,야근이 매우 많고 담당자가 혼자 감당해야 하는게 전부라 고통 그나마 같이 일할때 괜찮으면 다행
19,이데아인터렉티브,10271,오너가 왕 입니다. 그래도 다닐만해요...야근 견디면..
20,이데아인터렉티브,10271,한 브랜드에 집중되어있다보니 매너리즘에 빠지기 쉽다 주변이 주택가 지역이라 먹을곳이 마땅치가 않다
21,이데아인터렉티브,10271,쓸데없이 야근많음 주말출근도 가끔있음 반복적인 일로 금방 지겨움 / 보너스 없음
22,이데아인터렉티브,10271,인력에 비해 업무량이 많다. 업무 특성상 클라이언트의 무리한 요구도 감내해야 한다.
23,이데아인터렉티브,10271,클라이언트의 요구에 무조건 맞추기위해 업무 외 시간에도 대응해야했고 암묵적으로 당연하게 여기는 문화가 단점이다.
24,이데아인터렉티브,10271,많은 업무가 있지만 실무자는 적음 야근은 많지만 보상이 전혀 없음 경영진들은 직원이 야근 하는 것을 당연하다고 생각함
25,이데아인터렉티브,10271,"상하관계 확실함 디자인팀, 전산관리팀 야근 잦음 대기업 수주가 메인이라 발전가능성이 적음"
26,이데아인터렉티브,10271,"직급간의 수직관계, 상명하복이 분명하고, 1년 이상 장기 근무하신 과장급 이하로는 퇴사가 잦습니다. 업무량이 많고, 한 기업과의 업무로 스킬 향상과 경력에는 도움이 못 되지만, 반대로 비교적 안정적이고 반복적인 업무입니다. 광고대행/이벤트 대행사인만큼 상시 이벤트로 인하여 주말, 자정 때의 업무가 있습니다."
27,이데아인터렉티브,10271,상명하복 수직분위기. 사내정치. 주휴수당 없음. 디자인부서 야근 자주함. 희생강요. 포괄연봉제. 사원들 간에 불만족이 상당함.
28,이데아인터렉티브,10271,13분의 일의 급여체계/퇴직금포함/기타상여금없음/야근수당없음/교통비가 그날 밤 12시 되어야 나옴/한 대기업(이름 밝히지 않음)의 것이 90%정도를 차지하므로 수주가 떨어질 시 위험함
29,이데아인터렉티브,10271,"업무 강도가 높은편이라서 업무분야에 따라 야근, 주말근무 있음 ,업무 강도에 비해 직원이 많이 부족"
30,이데아인터렉티브,10271,경영진의 독재가 심하며 근무시간 업무량 이상이 주어지며 야근과 주말업무가 당연시 여겨짐. 가족같은 분위기다보니 편하게 대하는 것이 다소 막대함
