,company_name,company_id,review_text
0,익수제약,4887,버스에서 내려서 20분 정도 걸어 들어가야 하고 길이 좋지 않음 야근이 잦음
1,익수제약,4887,"시설이 진짜 올드하다 못해, 썩어 문 들어져 있는데, 신규 면접자들 면접보러 올때마다 깜짝깜짝 놀라는게 보일 정도.. 남녀 공용화장실은 진짜 최악이라 집에 갈때까지 꾹 참은 게 한 두 번이 아님..  90년대 업무 스타일을 현재까지 고집 중.. 아직도 페이퍼 업무, 팩스전송, 상시 대면보고, 안 되는 것은 없다 마인드, 직원 쥐어 짜내서 성과 올리기 등..  A4종이가 담긴 결재판 들고 결재 받으러 이리저리 돌아 댕겨야 하며, 그 흔한 그룹웨어가 없어서 팩스 쓰고 있음... 그래놓고 A4용지 아끼라고 난리도 아님 ㅠㅠ  정말 수시로 불려서 이것저것 대면보고 해야하며, 그때마다 못할 것 같은 늬앙스나 대답 잘 못하면 막말 시작되면서 갈궈 대는데, 그렇게 갈려 나가면서, 마른오징어 물 나올때까지 쥐어짜기 시작함  이게 사람 미치게 만드는데, 정말 돌아버릴 지경임  회사 연혁이 오래되었으니 과거 자료라도 있겠거니 하겠지만, 말했다시피 페이퍼 스타일로 진행하기 때문에, 남아 있는 자료가 전무함.. 맨땅에 헤딩하면서 꾸역꾸역 일하던 게 계속 반복되는 지경임"
2,익수제약,4887,단점이 가장 자신있는 부분임. 환경이 최악이었음. 학교 실험실보다 못하고 너무 오래됨. 화장실도. 밥이 맛이 없음. 자차 없으면 야근할 때 힘듦. 오르막길 끝에 회사가 있고 어두워서 위험함. 교통비 주는 것도 아님. 생산부 야근하면 셔틀버스 해주는데 품질은 안해줌. 경력직 뽑으면 죄다 런해서 회사에는 신입밖에 없음. 경력직이 런 한다는 것은 많은 의미가 있죠. 업무량은 과다하며 신입으로서 감당하기 힘든 업무가 주어짐. 업무 때문에 퇴사하는 경우 있음. 업무 지시가 명확하지 않음. 팀끼리 업무 협업 안됨. 중간관리자 부족함. 뽑아도 런을 하니 어쩔 수 없음. 계속 이럴 듯. 안그래도 적은 인원으로 일하고 사람은 계속 나가는데 출하압박 심해서 야근하고 고생하는데 큐씨 대우는 회사 내에서 젤 밑임. 큰 소리 날때마다 불안했었음. 다른 부서와 스케줄 협의라는 건 없고 하라면 해야지 말이 많아? 이런 분위기. 안하겠다는게 아니라 인원이 없어서 조정하자는 건데 협의가 전혀 안됨. 다들 나갈날만 기다리고 있는게 보여서 힘들었음. 인원 변동이 너무심함. 오면 연구도 해야됨. 알아두세요. 인건비나 환경에 투자해야 제약업계에서 살아남을듯?
3,익수제약,4887,체계가 부족하고 계획이 없다. 중요한 일정 아니면 하기싫으면 그냥 나중으로 미루기도하고 오늘은 이거해볼까 저거해볼까 이런식이다. 더불어 직무에 대한 전문성이 매우 부족하다. 업무 진행 방식이 상당히 즉흥적이고 때로는 듣도보도못한 방법으로 주먹구구식으로 해결한다. 선임이 10년을 일했다는데 일하는게 어설프다. 심지어 공구 이름도 제대로 모른다.(뭐지?) 2주가 지나도 3주가 지나도 업무분담같은거 없다. 입사후 거의 한달동안 공구 한번 제대로 만져보지 못했다.(뭐 이딴..) 그저 졸졸 따라다니며 구경이나하고 간섭하면 기분 나빠한다. 실습생 조수로 들어간 느낌을 강하게 받았다. 이런게 텃세 아닐까. 내 커리어 조질거같아서 바로 다른데 면접보고 빤쓰런했다.ㅎ
4,익수제약,4887,근무 환경 시설 노후 고립된 위치 고인물 많음 대체로 분위기 건조함
5,익수제약,4887,"직원수는 적은데, 그에 맞지 않는 업무를 주십니다.."
6,익수제약,4887,업무로 인한 개선 사항은 직원을 최대한 이용하여 해결하고 있음. 바뀌는 부분이 식약처의 요구방향과 동일한지 모르겠음.
7,익수제약,4887,1. 종이결제시스템(결제 받으러 돌아다녀야함) 2. 개인이메일사용(회사메일 및 전자결제가 있지않음) 3. 화장실 공용(진짜 너무 충격이였음) 4. 잦은 퇴사율(인사하러가면 그만뒀다고함) 5. 개인주의 끝판왕(조직사회다보니 협업이 필요한데 너무 심함) 6. 의사소통 부재(다른부서간 소통이 잘 안됨) 7. 연봉에 식대포함(점심제공x) 8. 인수인계없음(따로 해주거나 그런거는 없어서 본인이 습득해야함)
8,익수제약,4887,"1. 위치적으로 산속에 고립되어 있고 당연히 인근에 편의시설은 전무합니다. (대략 15분 이상 걸어 내려오면 그나마 식당이 보인다) 2. 야근이 잦은 편이나 식대, 교통비 없습니다. 만약 야근 후 자차가 없으시다면 스마트폰 손전등 불빛에 의존한 채 산길을 내려오는 진기한 경험을 할 수 있습니다. 3. 외부 및 내부 시설이 노후화되어 있습니다. 솔직히 대학교 실험실보다 노후화된 실험실 환경이 좀 충격적이었습니다 4. 주관적인 부분이나 점심이 맛이 없습니다 5. 장기근속자가 없어서 과거의 무언가를 확인해야 하는 일이 발생하면 머리가 지끈거립니다 6. 인력이 부족(특히 중간관리자)하나 계속 새로운 무언가를 시도하는 덕분에 기존 인력만 죽어나고 있으며 해당 내용에 관해 문의를 넣어도 소통이 원활히 이루어지지 않습니다"
9,익수제약,4887,종이 결재 시스템으로 매번 도장 받으러 다님. 화장실은 층마다 하나고 공용.
10,익수제약,4887,밥이 맛이 없음. 일이 많음. 야근이 많다. 자차 없을시 퇴근이 쉽지 않다. 건물과 실험실의 노후화가 큼. 시스템이 없음.
11,익수제약,4887,단점은 무지하게 많다. 1. 건물이 낡았다. 화장실 개선이 필요함 2. 출퇴근이 어려움. 자차 아니면 힘듦 3. 점심이 맛이 없음 4. 급여가 적고 직원들간에 정도 없음
12,익수제약,4887,회의회의회의 하지만 보고 드린 내용 다음 보고에 기억 못함 여자 화장실 가려면 건물 나가서 돌아가야함 미래가 기대 되지 않음 망해가고 있음
13,익수제약,4887,보고체계 엉망. 관리 할 급이 아닌데 관리시킴. 윗사람들은 본인이 해도될 업무를 사원에게 굳이 넘김. 신입사원이 들어와도 윗직급은 신경쓰지 않음.같은 사원한테 기기 원리부터 사용법까지 배움. 제대로 알려주는지도 위에서 신경쓰지 않음. 오히려 사원에게 너가 공부해서 알려줘야한다 함.
14,익수제약,4887,밥 맛없음 건물 노후함 직원 복지 없음 접근성 안좋음 기숙사 노 없음
15,익수제약,4887,밥이 너무너무 맛없음. 체계가 안잡혀 일이 힘듬. 오래된 회사 임에도 체계가 잡히지 않은게 신가함
16,익수제약,4887,단점 그냥 모든 걸 다 가지고 있으며 왜 직원들이 회사에 불만이 있는지 전혀 모르는 윗사람들 자기들 밥그릇만 지키는 철밥통 모임 가족회사는 가지 못할 곳
17,익수제약,4887,신입으로 들어가면 답이 없음 알려주는사람 없고 이리저리 일은 하는데 자기가 해결책 및 책임도 져야되는 미래가없는 회사
18,익수제약,4887,회사위치가 역이랑 멀어서 지하철 내리고 버스를 한번 더 타야됨
19,익수제약,4887,"업무 체계적으로 부족한 점이 있으며, 문서작업 및 보고 등 다소 올드함 계획부터 종료까지 프로젝트에 대한 간결하면서 명확한 프로세스 확립이 필요하다 생각되며, 업무강도는 있는 편임"
20,익수제약,4887,너무 막굴림 회사가 왜 크게 안돌아가는지 전혀 모르는 사람들이 많음 월급 너무 적음
21,익수제약,4887,"복지 일절업음 다른 회사들은 교통비, 통신비, 자기계발비 지원해주는 곳이 있다고 들었는데 사원들 복지 전혀 신경쓰지 않음, 개인 책상과 컴퓨터가 있기는 하지만 그냥 문서업무하기에도 컴퓨터가 벅차보임 책상은 매우 좁아 문서 몇장 올려놓으면 자리가 없음, 기숙사는 있긴한데 회사 사무실이랑 같은 건물이고 뭐... 80년대 군대 막사같이 생겼음 매일 벌레나오고 화장실, 샤워실 밖에 있어서 매우 불편함. 건물도 산중턱에 있어서 출퇴근 매우 힘듬 자차 있지 않는 이상 출퇴근 매우 어려움. 사무실 건물 시설 매우 안좋음. 사소한 사무용품도 잘 안사줌 사원들이 사무용품 쓰는 돈이 아까운가봄. 부서장은 윗 눈치보기 급급해서 사원들 편 절대 안들어줌. 업무 A를 하고 있는데 갑자기 B와C를 시키고 왜 A를 못끝냈냐고 물어봐서 B와 C 때문이라고 하면 핑계대지 말라고 하는 회사"
22,익수제약,4887,한방회사 제품의 원료가 중국이나 러시아에서 오는게 많은데 국제정세로 인해서 가격변동이나 원료 품귀현상이 많아 제품 판매에 차질이 생기는 경우가 많음.
23,익수제약,4887,"사무실 환경 열악, 화장실 최악, 밥 맛없음, 부서 간 의사소통이 잘 되지 않으며, 부서장은 눈치보기 급급해서 정작 팀원은 챙기지 않음"
24,익수제약,4887,"위치 구림, 야근 시 교통 관련 지원 X 체계화가 되지 않은, 대학교보다 미흡한 주먹구구식 공지/관리 복지는 정말 연차가 끝. 탕비실도 비어있고 비품 하나도 아까워함 시설 심각하게 노후됨, 본사가 공장 신경을 안쓰고 공장직원을 은근 무시하는듯"
25,익수제약,4887,위치가 좋지 않아 출퇴근이 불편합니다. (출퇴근 버스 이용도 제한적입니다.)  업무량에 비해 연봉이 너무 낮은 관계로 근무 의욕이 많이 저하됩니다.  점심이 제공되나 맛과 질에서 많이 부족합니다. (차라리 외주를 통해 해결하는 것도 좋을 것 같습니다.)  기숙사가 제공되지만 환경적으로 많이 열악합니다.
26,익수제약,4887,식당밥이 정말 맛이 없습니다. 모두가 먹기 싫어하는데 전혀 직원을 고려하지 않습니다. 교통편이 매우 불편하여 자차 필수 입니다. 성과금 없습니다.
27,익수제약,4887,점심 식사 정말 별로 반찬투정급의 문제가 아님 가끔 오래된 재료로 납품되나 싶은 정도의 퀄리티  임원급 사람들의 불분명한 업무지시 및 책임지지않고 아랫직급에게 떠넘기려는 태도 이거만큼 아랫사람들에게 퇴사욕구를 샘솟게 하는것도 없을거 같습니다.  각 부서에서 해야하는 업무 범위가 있어야하나 다른 부서호 떠넘김 공장 업무도 아닌 업무도 본사쪽 부서의 임원이 입김이 강해서 업무 넘어옴 (이런 부분때문에 루틴하게 진행되어야하는 업무 외 중간중간 쓸데없는거 하는데 시간을 많이쓰게됨 )  사무용품 잘 안사줌 늦게 사주거나 안사주는 경우가 허다해서 직접 본인들이 사오는 경우 꽤 봄  시설이 너무 낙후되어있음 사무실 공간도 좁으며 실험실 환경이 매우 좋지 않음 이게 과연 gmp 시설인가 싶다 새로 공장 지어서 gmp 인증 새로 받는게 훨씬 빠를것 같다  위치 안좋음 기숙사 있지만 수용인원 적어서 들어간 사람 몇 없고 기숙사가 회사 안에 있는것도 놀라운데 사무실이랑 같은 건물  부서간 소통 절대 안됨 추후 통보되는 일이 많으며 그 일에 대한 뒷처리는 다른 부서가 함 본사가 일찍 퇴근하는거 공장이 모르거나 공장이 일찍 퇴근하는거 본사가 모르거나 하는 일이 생김  연구소와 품질부서가 통합되어 운영됨 뭐 같은 공간에서 운영될 수도 있다고 생각함 그런 경우 인원은 따로 나누어 운영되는것이 업무 효율상이나 직원의 업무 혼동도 줄일 수 있다고 생각됨 (연구쪽 장 품질쪽 장도 달라야 한다고 생각함 해왔던 업무 가 다르기때문에 한명이 이 두가지를 모두 케어하는건 역량이 되지 않는 이상 따로 두는게 맞다고 봄)
28,익수제약,4887,"복지 제도가 없음. 영업직인데에 비해 실적 급여라던가 기본급 자체가 매우 낮고, 회사 자체의 변화에 대한 두려움이 너무 강하다. 변화를 시도하지만 워낙 경영진들이 보수적이기에 진전이 더디다. 출장이 주 4회정도 있는데 지원이 거의 없다."
29,익수제약,4887,"중소기업임 딱. 영업부 내에서 지점장들끼리 싸우고 실적 챙김. 그리고 지역구가 확실히 정해져있지가 않음. 단, 오래된 직원들이 거대 약국 거래처를 다 붙잡고잇음. 이건 어느 제약사를가든 마찬가지임 대형제약사든 소형제약사든 오래한 사람이 큰 파이를 차지하는건 당연하지만 새로운 신입사원한테 악성처 넘겨주는건 너무함."
30,익수제약,4887,지리적으로 지하철역과 좀 떨어져 있기 때문에 버스를 한번 타야된다는 점
31,익수제약,4887,"1. 사람이 좋았다. 2. 복지가 전혀없다.(건물이 노후되어있고 크지않다보니 청소업체를 부르지 않고 건물청소를 직원들이 함). 3. 이미 고일대로 고여버린 업무방식 탓에 뭔가 변화를 줘 제대로 일하려면 10년전 일까지 바꿔버려야하는 상황이 생김. 4. 정치질하는사람 없을것같죠 ? 여기도 있었습니다. 5. 공식적인 사내인사평가는 없지만 사원이 본인 기준대로 *주관적*인사평가를 함. 정작 상대방은 본인이 인사평가 당하는지 모르고있음. 6. 커뮤니케이션이 하나도 안됨. 7. 지금은 어떨지 모르겠지만, 기숙사는 많이 노후되어있음. 8. 일을 못하면 얄짤없음 배척시킴. 9. 월급이 적음. 10. 출퇴근이 힘듦. 셔틀을 타지 못하면 약 2.1km를 걸어올라가거나 택시를 타야함.(택시 안잡힘, 잡혀도 거기는 안감)."
32,익수제약,4887,한약제제 특성상 업무범위에 한계가 있음. 사람이 적어서 R&R이 모호함. 낮은연봉
33,익수제약,4887,연봉이 너무 작고 체계가 제대로 잡혀있지 않았습니다.식사도 맛이 없었습니다.
34,익수제약,4887,1. 자차가 없으면 출퇴근 매우 불편(야산에 위치).기숙사 상태는 어휴.. 2. 인원이 부족한걸 이팀저팀 끌어쓰기 바쁨. 타팀 바쁜게 누적되며 악순환 3. 퇴사자의 인수인계가 제대로 안되어 개판이었음. 중심을 잡아줄 중간도 없어서 뭘 배운다는것을 기대하면 안됨 4. 밥심 기대하지말것 5. 야근 등에 계산이 매우 이상함.주긴함 6. 시설 노후화에 비해 투자가 제대로 안됨 7. 꼰대
35,익수제약,4887,기본급이너무적음 수금액대비급여를받으니 급여가들쑥날쑥합니다 매월 곤지암가서 영업회의해야하는데 너무힘듭니다...................
36,익수제약,4887,모든 부서간에 소통이 부재. GMP마인드 없음. 교육 시스템이 전혀 없음
37,익수제약,4887,직원들을 위한 복리후생이 열약함 연봉도 동종업계에 비해 많이 부족함
38,익수제약,4887,"연봉낮고, 인상폭 없고, 연차쓸 때 눈치 줌, 복지가 없음"
39,익수제약,4887,낮은 연봉과 함께 일정 경험이 쌓이면 이직을 바로 생각하게 되는 이유가 여러가지 있습니다. 사람 중심의 경영으로 보완되어야 되지 않나 싶습니다.
40,익수제약,4887,아직까진 완벽하게 체계적이진 못함. 감사 준비 때 힘들 수 있음. 기숙사 시설이 좋진 않음. 점심이 맛없음.
41,익수제약,4887,"작은 중소기업의 단점들을 그대로 느낄수 있음. 업무 프로세서가 제대로 체계를 가지고 있지 않고, 회사 분위기도 중소기업이라 의기소침함."
42,익수제약,4887,일단 연봉이 너무 낮습니다. 경영진에서 연봉을 올려줄생각이 없고 일하는 직원들을 소모품으로 생각한다는 느낌이 있습니다. 일반의약품 그 중 생약제제만 생산하다보니 전문의약품등 다양한 경험을 할 수 없다는 것이 경력에 크게 도움이 되지 않습니다. 추후 이직등을 생각하시는 분들에게는 좋은 경력은 안될것 같네요. 연차가 있지만 어떤사유로 연차를 쓰는지 말해줘야 연차 사용이 가능합니다. 복지도 없음...
43,익수제약,4887,이사진의 막무가내식 업무지시. 타부서의 일 떠넘김이 심합니다. 낮은급여
44,익수제약,4887,말도안되는 연봉. 윗선의 무능함으로 인해 비효율적인 업무가 많음. 연차 자유롭게 못 쓰게 하며 돈으로도 안 줌. 책임감도 없으며 잘되면 내탓 안되면 니탓.
45,익수제약,4887,복지혜택도 별로 없고 연봉도 다른 동종업계보다 낮아 회사다닐 맛이 안남
46,익수제약,4887,일단 회사에 입사하면 야근은 각오해야한다고 봐야함 게다가 의약품을 생산하는 공장인데 시설들이 많이 낙후되어 있고 복지는 거의 없다고 봐야함.
47,익수제약,4887,제조시설이 낙후됫으나 기준은 강화되고 생산량은 늘어나서 일이 많음 기본부터 안되있는 경우가 큼
48,익수제약,4887,평균적으로 보수가 많지 않고 인상률 높지 않음. 복지라고 할게 거의 없음.
49,익수제약,4887,연차쓰지 못하게 하며 이유를 다 물어봄 많은 문제들이 산재되어 있음
50,익수제약,4887,월급이 굉장히 적은 편이고 경영진 마인드가 직원을 존중하지 않음.
51,익수제약,4887,"1.기본급80 에서 100 사이 판매매출, 수금 금액 등 목표달성률에 따라 인센티브가 적용됨 신입의 경우 인센티브 따내는건 불가능 2.지역구분이 없어 담당구역에 영업사원 다 나옴 한 지역에 모든 영업사원이 다나오는경우가 있음 3.인수인계 없음 팀원 퇴사시 기존직원끼리 우량거래처 나눠먹은 후 인수인계 4.6개월동안 기존직원만큼의 거래처 확보 못하면 해고 다단계적 시스템 5.반품으로 인센티브 삭감 6.각팀 팀장이 인수인계를 미끼로 끌어들이지만""성과가 낮다 더 노력하라""며 거래처 할당 안해줌"
52,익수제약,4887,연봉이 지나치게 작고 매년 늘어나지도 않음. 연차쓸때 꼬치꼬치 물어봄
53,익수제약,4887,"연봉도 복지도 기대하면 안됨. 연봉테이블 자체가 없는 듯, 들쑥날쑥함. 돈욕심 없고 스스로 학습법이 몸에 베어있는 분은 입사를 추천합니다!!"
54,익수제약,4887,잦은 팀원 교체로 인수인계를 제대로 받지 못하거나 교육이 부족해서 헤매이는 경우가 많고 경력직은 어느정도인지 모르지만 신입 사원은 연봉이 적다.
55,익수제약,4887,첫째도 급여 둘째도 급여! 경력 되신 분들은 어떻게 받는지 모르겟지만 신입은 최저시급도 못받는듯
