,company_name,company_id,review_text
0,인사커뮤니케이션,10696,텃세부리는 사람이 있음 대기업 흉내냄 (정규직 전환시 평가함)
1,인사커뮤니케이션,10696,일 강요하는거 좀 있음. 혼자서 하는게 많음. 사람나가면 많이해야함
2,인사커뮤니케이션,10696,연봉이 너무 낮습니다. 이 연봉으로 다니기에는 비전이 없어 차라리 알바를 여러개 하는게 나을 수도 있습니다.
3,인사커뮤니케이션,10696,타워 디펜스마냥 몰아치는 업무량과 그것을 해결하려 아등바등하던 팀원들 부서끼리의 서로 어떤 업무를 하는지 이해를 못함
4,인사커뮤니케이션,10696,대표가 고집이 있어서 아래에서 이런저런 얘기를 해도 안받아들여지는 부분들이 있음 그런 부분들에 직원들이 지쳐함 그래도 면담 요청같은거 하면 받아주시고 얘기는 들어주시고 해결해주려 하시는 모습은 보이는데 모습까지만 보이고 통쾌하게 해결되는 부분이 없었음 복지는 좋은데 연봉이 낮음 연봉 괜찮았으면 더 오래 다녔을듯 매출 문제에 대한 것도 직원들은 왜 낮은지 알 것 같은데 위에선 모르는 것 같음 뭔가 하려고 하면 처음에 불 붙어서 하는가 싶다가도 어느새 흐지부지 되어있음 야근 없는 사람은 없고 많은 사람은 많은게 눈에 보임 야근은 팀바팀도 아니고 사바사인 것 같음 복지나 업무용 기기에 들어가는 돈을 아까워하는 짠돌이 면모가 자주 나와서 직원들이 불만 가짐(예를 들면 미팅 갈때 택시비 지원x 대중교통 타고 가야함)
5,인사커뮤니케이션,10696,한줄평가에서도 말했지만 경영진이 정확한 영상 업무 프로세스나 영상에 대한 전문적인 지식이 많이 없다는 점이 단점이라면 단점
6,인사커뮤니케이션,10696,그저 같은 업무를 하기에 성장에 기회조차 없습니다. 퍼포먼스 야근 필요
7,인사커뮤니케이션,10696,"모든 회사가 그런지는 잘 모르겠지만, 작업 시간이 촉박해서 야근을 자주 하게 되었고 공장식으로 일을 하는 경향이 있었으며 일을 하는 사람만 더 많이 하는 느낌이 들었음"
8,인사커뮤니케이션,10696,관리직의 역량이 부족하고 본인의 밥그릇 챙기기 바쁨. 사원입장에선 매일 급하게 넘어오는 일을 주먹구구식으로 처리 해야해서 역량을 키울 수 있는 가능성은 거의 없다고 보면됨
9,인사커뮤니케이션,10696,"텃세부리는 사람이 있고, 분위기 좋지못함 사람들 관리가필요하다"
10,인사커뮤니케이션,10696,컴퓨터가 너무 느려요.. 그래서 일처리가 좀 더뎌져요..
11,인사커뮤니케이션,10696,빠르게 많이 찍어내는 방식의 프로젝트 진행. 당연히 마감기간도 촉박하여 빠르게 처리해도 그 다음의 다음 일들이 기다리고 있음. 야근은 피할 수 없는 선택.
12,인사커뮤니케이션,10696,너무나도 많은 단점이 있지만 여기 야근 눈치 줍니다. 그리고 마지막주 금요일 일찍 퇴근하는거 1년차부터 시켜줍니다.
13,인사커뮤니케이션,10696,"컴퓨터가 너무 구리다,, 마케팅/웹/디자인/영상을 하는 기업인데 너무 느리니 업무 효율이 떨어지는 기분,, 1시간이면 할 일을 2시간 하게 되는"
14,인사커뮤니케이션,10696,"식대는 연봉에 포함 노무사끼고 월급주는데 월급명세서가 이상해서 직원이 월급명세서 확인하고 질문해야하는 회사임 급여계산을 제대로하는건가 싶음.. 야근수당최대 2시간인데 식사시간 포함하면 3시간 뒤 퇴근해야함 연봉이 최저임금에 가까움, 잔업무가 많음, 컴퓨터 사양이 안 좋다. 대표와 소통이 잘 안된다. 평점이 3.5인 이유를 모르겠었는데 입사해서 얘기들어보니 안좋은 평은 다 삭제한다고함"
15,인사커뮤니케이션,10696,컴퓨터가 매우 좋지 않음. 프로그램 하나 여는데 최소 5분. 작업하다 컴퓨터 꺼지는 건 다반사. 점심비 지원 안됨. 야근비는 2시간만 지급
16,인사커뮤니케이션,10696,여자가 너무 많아... 여자가 싫어서 이런말 쓰는 것이 아니다. 까딱 잘못하면 내일 누군가 내욕하고 있다. 그건 남여 구분이 없다.... 소문 도는데 빠르면 하루 늦어도 몇일안에 누군가 내이야기 하고 흉보고 있을지도 모른다.
17,인사커뮤니케이션,10696,"매일 매일이 같은 작업 반복이며, 일의 성과를 따지는 것에 있어 의문점이 듬 일에 대한 평가보단 위에 사람들에게 잘보이고 잘해야 인정을 받는 듣한 느낌이 듬 실력이 늘 수 있는 곳은 아닌 듯함"
18,인사커뮤니케이션,10696,수직적이고 디자이너 무지하게 쪼아댐 디자이너들이 뽑아내는 만큼 매출이 나는 것이기 때문에 엄청난 업무량 절대 비추
19,인사커뮤니케이션,10696,"연봉협상의 어려움. 성과지향적이라, 직원들간이 경쟁이 있는편."
20,인사커뮤니케이션,10696,한사람에 의해 분위기가 좌지우지 되고 일을 할수록 커리어를 쌓기엔 부족함이 많다
21,인사커뮤니케이션,10696,앞에 말한대로 시스템이 비체계적이라 알아서 해야하는 일이 많음.
22,인사커뮤니케이션,10696,내 실력이 부족하면 업무를 따라가기 힘들어서 튕겨저 나오게 됨. 일이 몰릴땐 미친듯이 몰려서 어떤달은 한달내내 칼퇴하고 어떤달은 한달내내 야근함.
23,인사커뮤니케이션,10696,복지는 수습기간이 지나고난 후 적용 윗선의 힘이 굉장히 세다
24,인사커뮤니케이션,10696,다양한 마케팅을 배울 수 있어 좋지만 그만큼 일이 많아 힘들다. 부서간 친밀감이 부족한거 같다. 수평적인 분위기가 처음엔 좋았으나 계속 있어보니 이게 최고의 단점으로 부각된다.
25,인사커뮤니케이션,10696,"루틴한 업무다 대부분이어서, 창의적이고 새로운 업무를 해 나가고자 하는 경우엔 맞지 않을 수 있음."
26,인사커뮤니케이션,10696,팀장이 본인 업무는 하나도 안하고 시키기만 함. 걸핏하면 보고서 만들라고 하고 대화가 안됨. 전형적인 꼰대임. 왜 직원들이 싫어하는 전혀 이해를 못함.
27,인사커뮤니케이션,10696,팀장중 자신은 일 안하고 부하직원 시키는 사람이 있음. 여직원 많아서 진짜 별별 말이 다 돌아다님. 팀끼리 서로 편하게 일할려고 미루는 건 좀 아니라고 생각함. 다 같이 먹으라고 사논 간식이 왜 매번 다 사라지는지..
28,인사커뮤니케이션,10696,"포폴이 약함(대부분 병원) 오래다니는 직원이 거의 없고, 사내정치가 심한 편. 점점 더 복지가 없어지는 추세이며 형식적 복지. 직원들 의견에 귀기울이지 않음"
29,인사커뮤니케이션,10696,너무 자유로운 분위기가 문제임. 수평적인 기업문화가 잘못된 형태로 나타나기도 함. 복지제도도 연차에 따라 적용이 달라서 최근에 입사한 사람은 복지제도가 다 적용되지 않음. 분위기 흐리는 직원이 각 팀마다 있는데 팀장이 모르는지 모른척 하는지...
30,인사커뮤니케이션,10696,"업무시스템이 잘 잡혀있지 않아 눈치껏 일해야 하는 경우가 많음. 패턴을 벗어난 마케팅, 트렌디한 마케팅을 접하기 어려움."
31,인사커뮤니케이션,10696,처음에 들어가면 잡다한 업무가 조금 있을 수 있습니다. 그렇게 큰 단점은 없었습니다.
32,인사커뮤니케이션,10696,다른팀과의 교류가 많지는 않음. 큰기업보다는 소기업위주임.전문적인 마케팅보다는 바이럴위주이니 참고.
33,인사커뮤니케이션,10696,"단순 보고를 위한 문서 작업이 많아 비효율적임, 선임이 명확히 지정되지 않아 업무를 체계적으로 배우기 어려움, 대부분 개인주의적 성향이라 업무 협조가 더딤, 체계가 불분명해 책임자가 없음."
34,인사커뮤니케이션,10696,디자인이 잘나와도 광고주 맘대로.. 산으로 가는 경우가 있다. 여직원이 많아서 말이 많다.
35,인사커뮤니케이션,10696,클라이언트가 한쪽으로 치우친것은 단점이고 직원들이 여성이 많아서 그런지 파벌(?)같은게 있음.. 끼리끼리 문화..
36,인사커뮤니케이션,10696,"딱히 없지만. 창의력을 요하는 일보다, 단순한 업무가 많다는 점. 새롭게 배울 수 있는 일이 많지 않다...(누구나 할 수 있는 일...) 사무실 환경이 좋지 않다는 점 (현재는 좋은 곳으로 이전한듯)"
37,인사커뮤니케이션,10696,팀들간에 대화가 부족함. 각자 자기일만 하고 협업해야 하는 일에 대해서는 소통 부족으로 쉬운일도 어렵게 하는것이 문제임. 자기 일만 하면 끝이라지만 팀간 관계가 좋지 못함
38,인사커뮤니케이션,10696,"프로젝트는 많지만 스케쥴을 다소 급박한편, 사내 분위기는 서로 뭉치지 못하고 겉도는 듯한 분위기, 급여는 다소 부족한 수준."
39,인사커뮤니케이션,10696,마케팅 전문으로 웹개발쪽은 마케팅의 서브일뿐. 웹기획이나 디자인이나 개발쪽의 성장가능성이 희미하다.
40,인사커뮤니케이션,10696,회사에 체계가 없는 것. 그래도 내규를 만들어가려고 하나 부족
