,company_name,company_id,review_text
0,인천일보,11773,사장님이 자주 바뀌어 직원들의 업무 흐름이 깨진다 회사의 방향성
1,인천일보,11773,"물경력 쌓기 딱 좋은 회사, 설립된지 오래돼서 주먹구구식 회사"
2,인천일보,11773,"주6일근무 지금은 변했는지 모르겠으나 실내흡연, 욕설, 비난이 난무 잦은 술자리 적은 급여"
3,인천일보,11773,평균 연령 지속 상승 중. 낮은 연차 구성원들의 이직율 높음.
4,인천일보,11773,"사내 식당, 많은 회식, 근무외 행사, 평균보다 낮은 급여"
5,인천일보,11773,붕괴된 체계 사내정치 회사 옆에 바로 도로여서 큰차가 지나가면 건물 흔들림 소통 부족
6,인천일보,11773,꼰대 천국 나때는 말야 의식 박힌 사람이 많음 이직이 잦음
7,인천일보,11773,사람들도 기자라기보다는 험하고 예의가 없는 편. 건물도 오래돼서 급식실이 매우 더러움. 월급도 오르지 않는 편
8,인천일보,11773,단점도 외근인데.. 교통비.. 식비.. 등 자기부담이었습니다.. 그에 비해 월급은 무척 적었었죠.. 여기저기 많이 돌아다녀야하는데 보통 택시를 타고 다녀야 했습니다.
9,인천일보,11773,비전이 없어서 일하는 도중 현타가 옴 사내정치 심함..진짜 고래 싸움에 새우 등 터짐..알아서들 해결하세요 제발
10,인천일보,11773,우선 사람이 적다는 점이 가장 큰 단점. 동종업계 대비 낮은 연봉.
11,인천일보,11773,회의 종류가 많다. 코로나19로 인해 직원 간 원할한 소통의 장이 부족하다.
12,인천일보,11773,급여가 많지 않다 / 역이랑 거리가 굉장히 멀다. / 조용하다
13,인천일보,11773,꼰대들의 집합소 나잇대가 꽤 있다보니 꼰대들이 즐비하다 빌런이 많음
14,인천일보,11773,"일단 연봉이 높지 않아요. 그건 이 회사만 그런게 아니라 지역언론사 자체가 높지 않아 입사시 감안해야할 부분입니다. 신입의 경우 인턴 3개월, 수습 6개월 과정이 조금은 길다는 개인적인 생각입니다."
15,인천일보,11773,매일 술먹이고 술취하면 욕하는 곳 연봉도 적고 호봉이 크지않은 곳 밥 진짜 맛없는 곳(위생 노답)
16,인천일보,11773,경기 본사(수원)와 지역 주재 기자들 몇몇은 텃세 심함. 실력이나 키우시길...
17,인천일보,11773,"1. 연봉이 적음 2. 인사평가시 기준이 없음 3. 신문 구독을 안하고, 점점 줄어들고 있는데 이유와 명분없는 밀어내기식의 영업전략 4. 소통 부재"
18,인천일보,11773,"업무가 끝나도 선배들 일이 다 끝나지 않으면 퇴근하지 못하는 분위기인 팀이 있음. 팀마다 다르지만, 대부분 눈치를 보게 됨. 술 무조건 마셔야 하는 문화이고, 못 마시면 눈치 보이는 문화."
19,인천일보,11773,타사에 비해 다소 낮은 급여이나 경영상태가 호전되고 있으므로 좋아질 것으로 믿는다.
20,인천일보,11773,의사결정 과정에서 다소 하부조직의 의견을 너무 적극적으로 반영함으로써 전체조직의 위계질서가 다소 산만하다.
21,인천일보,11773,연령대가 높고 틀?이 정해져 있어 새로운 사람이 들어오면 적응하기 힘들다
22,인천일보,11773,지역언론이다보니 기사부수 확장에 예민함. 기사 부수를 매일 아침마다 성적표처럼 건네받음. 그리고 기사를 쓰기 위한 도제식 교육이 강압적임.
23,인천일보,11773,체계적인 느낌이 떨어지고 꼰대문화 존재함 이건 어느 기업이나 있다고 생각함
24,인천일보,11773,일 잘하는 것은 크게 중요하지 않고 얼마나 선배말에 예썰 예썰 복종하느냐가 중요한 회사 분위기...
25,인천일보,11773,"사원,대리급엔 정치가 크게 상관없었는데 윗선들끼리 정치질이 너무 심해서 사원들에게도 영향이 갈 정도였음. 승진은 능력이 아니라 나이가 차면 해주는듯함"
26,인천일보,11773,회의가 많고 회사가 가끔 불안정한것 같기도 하고 경영진도 자주 바뀌는게 단점이라면 단점?
27,인천일보,11773,사람이 전부인 회사는 사람때문에 다니고 결국 사람에 지쳐 관두게 됨. 그리하여 사람과 일하는 것에 질린 사람들은 좀.. 장점도 많은 회사지만 사람이 전부라는게 큰 단점.
28,인천일보,11773,근무 환경이 열악하다. 오래 일할수록 편해지는 시스템 때문인지 고인물이 흥건하다.
29,인천일보,11773,다들 어르신이라 대화가 안통함 이건 정말임 안통할거임 정말정말 진짜 정말임
30,인천일보,11773,구도심에 위치함. 낡은 건물. 행사가 많다. 부족한 인력. 인지도가 떨어짐
31,인천일보,11773,"10~20년차 이상 고인물들이 한자리씩 차지하고 있어서 회사가 발전이없음, 채용(낙하산, 재입사가 난무), 사장 성향에 따라 모든 업무처리방식이 바뀜, 야근수당 휴일근로 연차수당 일체 없음,"
32,인천일보,11773,"일단 매출구조의 한계가 엿보이고, 이로 인한 신규사업의 한계도 있으며 직원들의 처우도 그리 뛰어나다고 볼 수 없습니다."
33,인천일보,11773,실세 한명의 결정이 전부가 되는곳. 사장은 2년에 한번 바뀔수도있고 아닐수도있고 노후된 건물 월급의 미니미
34,인천일보,11773,행사같은경우 직접나가게 됨 오후출근자인경우 새벽에 출근해서 저녁에 퇴근하게 됨
35,인천일보,11773,낮은급여. 계속 추락하는 인지도. 아무래도 급여가 타 회사보다 많이 적어 만족도가 많이 낮음
36,인천일보,11773,"여전히 수년전 과거에 얽매인 꼰대들이 많음,다른 회사였으면 이런 대우에 이렇게 취급하는 상사들은 이미 나갔어야 함,신입기자들도 사내정치에 한몫함,경영진의 무능함,회사 자산관리 등 투명한 경영관리는 어디에?"
37,인천일보,11773,수직구조화. Up to down 업무방식. 중간관리없음. 상사말이 곧 법. 80년대 기업모습이 궁금하다면 한번쯤은 체험삼아 가보면 충분히 느낄수 잇는 군대식 문화. 능력보다 꼬리를 흔들면 인정받는다. 중고위직중 90프로가 낙하산과 비리 정치질하느라 일을안함.
38,인천일보,11773,연령대가 극과 극이다. 팀마다 다르지만 분위기는 매우 보수적인 편.
39,인천일보,11773,"인턴, 수습 각각 3개월씩 한 후 정기자로 임용되도 연봉은 인턴때랑 같음. 심지어 그 연봉이 고깃집 알바보다 못한 수준. 5시에 출발해 다음날 새벽1시에 퇴근하는 일도 있음."
40,인천일보,11773,월급이 짠걸로 모든 장점이 상쇄됨. 업계 최저수준. 공장에서 알바해도 그거보단 많이 벌 듯. 사람들이 그만둬도 빈자리를 안채워줘서 갈수록 일이 빡세짐.
