,company_name,company_id,review_text
0,지방자치연구소,12533,장점을 제외한 모든것이 죄다 단점. 일단 오너부터 별로인 회사
1,지방자치연구소,12533,대표가 너무나도 무능력하여 방치된 직원들은 서로에게 총칼을 겨누는 안타까운 상황
2,지방자치연구소,12533,"위에 언급했듯이 대표님 리스크보단 시스템의 문제 같습니다. 결국 지방자치연구소 산하의 잡지입니다. 기자일을 배우는 것은 불가능하고, 어떤 중소기업의 사무보조로서 입사한다고 생각하시면 이해가 쉽습니다."
3,지방자치연구소,12533,빠른 성장과 혁신적인 변화에도 불구하고 내부 커뮤니케이션과 직원 복지 면에서 개선의 여지가 있씁니다. 이로 인해 일부 직원들 사이에서 업무 부담과 스트레스가 증가하고 있습니다 .
4,지방자치연구소,12533,야근식대는 8시부터 ㅋ그나마도 8천원미만 대표 샤우팅에 오금이 저림 매주 청소하러 30분 조기출근 70년대 막장기업으 표본
5,지방자치연구소,12533,읽지도 않으면서 매일매일 업무보고 강요. 기분대로 업무를 바꾸는 대표의 처참한 무능력함이 너무나도 큰 단점. 대표가 직접 망상적 험담으로 직원들의 사이를 갈라놓음. 장기근속 직원들도 대표에게 아부떠는 것 그만하고 정신차려야 함.
6,지방자치연구소,12533,대표의 성질머리 머슴보다 못하게 굴리는 마인드 연차는 있으나마나 포괄임금제 악용의 대표적 출근은 항상 미리 심지어청소하러 주1회 조기출근 퇴근은 정시에하면 난리남 당근 수당 없음 사람 갉아먹는 곳인데 대표는 본인만 잘난줄안다 매일 직원들 불러다가 쥐잡듯이 잡는소리에 조마조마하다
7,지방자치연구소,12533,업무량이 가끔 많은 경우가 있다. 그 외에 단점 없음.
8,지방자치연구소,12533,꼰대적인 문화 이 한마디면 다 해결 될 것 같습니다 특히 대표가 사람이 아닙니다
9,지방자치연구소,12533,중간 관리자 전무 대표가 매우 기분파이며 일을 벼락치기로 시킴 (그리고 못하거나 안 맞으면 꼽 줌)
10,지방자치연구소,12533,체계가 없고 연봉도 적고 연차도 눈치보고 써야 함 무엇보다 대표 기분맞춰 일해야 한다는점과 그 대표가 분노조절장애가 있다는걸 알아두기 바람... 대표가 퇴근하기 전까지 퇴근하면 눈치줌
11,지방자치연구소,12533,출장과 야근이이 조금 있을 수 있다. 여러가지 민원 상황 발생
12,지방자치연구소,12533,위치만 좋아요. 사람들을 못 잡아 먹어 안달인 곳 입니다. 다들 오래 못 버티고 떠나는 이유는 말해 모해요
13,지방자치연구소,12533,대표의 독단으로 모든게 진행되는 회사 야근이 기본인 회사! 직원 복리후생이 없음
14,지방자치연구소,12533,수직적인 관계가 약간 존재합니다 다닐 때 교통이 조금 불편했음
15,지방자치연구소,12533,급여 체제가 미비하며 연봉이 낮은 편에 속한다. 출퇴근에 대한 업무 시간
16,지방자치연구소,12533,경영자 마인드가 쌍8년대 수준이고 자연스럽게 직원들의 수준도 매우 낮다. 함부로 들어가면 쌍욕을 처먹기 일쑤다. 소리 지르는 건 일상이다.
17,지방자치연구소,12533,개인에 의해 굴러가는 구조. 젊은 인재가 없어서 높은 연령대의 사람들과 함께 일해야 하는 지루함을 견뎌야함.
18,지방자치연구소,12533,"너무 많아서 일일이 열거하기도 어려운데, 일단 정신건강에 대단히 해롭다. 입사 첫 날부터 시작되는 대표의 반말과 막말, 그리고 폭언 세례는 현재 No2로 군림하고 있는 대표 최측근들에게조차 버거울 정도. 20-30 mz세대라면 일단 여기서 바로 퇴사를 결심하게 되고, 실제로 한 달 미만 퇴사자 비율이 동종 업계 단연 원톱이다. 대표 기분에 따라 업무 지시가 바뀌기 때문에, 업무 일관성이나 퀄리티 완성도 등을 내려놓는 자만이 살아남는다. 그냥 하루살이처럼 그날그날 대표 눈치를 보며 대표 기분에 맞춰주는 것만이 전부인 회사. 거의 매일 이어지는 야근과 그걸 너무 당연시 하는 대표와 팀장들."
19,지방자치연구소,12533,"36시간 연속 근무를 들어보신 적 있으신가요? 기자/PD 직군 지원자분들은 마감기간 평일 고정 10시 30분 퇴근(지하철 안 끊기는 시간까지 최대한 노동 착취), 마감일 밤샘 근무가 일상입니다(담당 팀장은 아예 혼자 침낭을 가져와서 새벽 3시 이후엔 중간중간 자리에서 드러누워 잡니다). 주말 출근 당연하고, 10시까지 야근과 밤샘 근무를 해도 단 한 푼의 야근비나 주말 수당 없는 것은 물론 대체 휴가조차 아예 없습니다."
20,지방자치연구소,12533,드라마에서나 볼법한 회사가 진짜 있구나 싶은 레전드 회사.. 연봉 선심쓰듯이 잘 주는척하고 고스펙자들이 오고싶어했던것처럼 포장하지만 실제론 하루이틀만에 많은 사람들이 런..이유는 몇시간만 있어도 알 수 있음 그리고 상식적으로 기관장 만난걸 누가 일일히 회사 벽에 붙여놔..더 없어보여요..
21,지방자치연구소,12533,대표가 사무실에 있으면 지옥임 대표실에서 직원들 쥐잡듯이 하는 소리 다 들림
22,지방자치연구소,12533,"연차조차도 마음대로 못 쓰고, 상여금도 안주고, 직원이 회사를 위해 희생하는건 당연하고 회사는 직원을 위해 아무것도 하지 않는. 진짜 이런 회사 처음봄"
23,지방자치연구소,12533,비효율. 대표가 확인 안하면 문자 하나를 못 보내는 구조. 그래 놓고 딴 소리 많이 함. 식사 제공 된다 했다가 지원금 깎이면 직원 복지 깎는 곳. 경영진이 솔선 수범 하는 것 처럼 말하지만 속은 그렇지 않음. 소명의식 강조하는데…어이없음
24,지방자치연구소,12533,"야근, 주말 출근, 직원들의 잦은 퇴사, 급여 및 복지 낮음."
25,지방자치연구소,12533,단순보고를 위한 비효율적이고 소리를 지르지말았으면 좋겠다... 야야 거리면서 말을 삼가해줬으면 한다.
26,지방자치연구소,12533,"대표님 그날의 기분과 그날의 결정에 따라 수시로 변경되는 업무, 아이들이 잘못할 때 사랑의 매는 꼭 필요하다고 말하며 직원들에게 언어적인 모욕을 아끼지 않음"
27,지방자치연구소,12533,아쉽다 이래저래 많이 아쉬운점이 많은 회사입니다! 복지며 급여 적고 야근은 달고 사는 듯합니다
28,지방자치연구소,12533,워라벨 전혀없고 정말 옛날 회사 스타일. 젊은 직원이 없음
29,지방자치연구소,12533,업무량에 비해 인력 보충 필요. 그 외 특별한 단점은 없음. 교육 특성상 야근과 주말 출근 있음.
30,지방자치연구소,12533,"대표 중심적이다. 소기업의 단점이 고스란히 녹아있다. 시키는대로 하면 되지만, 그대로 하기가 힘들다. 마감일은 정말 너무 힘들다."
31,지방자치연구소,12533,출근은 9시인데 퇴근은 6시반 퇴근도 대표눈치봐야함 연차없음 모든 직원의 비서화
32,지방자치연구소,12533,많은것들이 대표에 의해 결정되며 직원의 의사결정이 조금만더 존중되었으면 하는곳. 뜻이 확고하다면 대표를 이길각오해야 함
33,지방자치연구소,12533,출근시간은 회의때 청소시간때 일찍 가야됨 퇴근시간은 실질적으로 보장 불가 추가근로에 대한 보수 절대 없음 막차 놓쳐도 개인돈으로 택시타고 가야됨 업무에 대한 기본적인 흐름이 전혀 없음 대표마음대로 개인의견은 무조건 묵살
34,지방자치연구소,12533,있다는 자체가 최대 단점임 대표본인은 대단하다고 하는데 1인기업이나 마찮가지
35,지방자치연구소,12533,"출근 시간은 9시 지만 분위기상 8시 20분에 착석 해야하고 퇴근 시간은 ??? , 워라벨 그런거 없다 워크 라이프 워크"
36,지방자치연구소,12533,어지간한 멘탈로 버티기 힘듬.말 잘 듣는 순종적인 사람을 선호하지만 그런 사람들로 주인의식 부여하는 것 같은 동기부여를 제공하는 것이 어려움
37,지방자치연구소,12533,처음 사회생활 시작할때 방식으로 일하는 회사 직원입장에서 생각을 안함
38,지방자치연구소,12533,저는 다니다가구두로 해고통지 받았음 해고사유? 이유를 안알려줌..그렇게 알바로 처리하여 급여지급된 사람들이 많았던거 같습니다만.. 다닌동안 일이 없었음 나에게 오더를 내리지 않았음 경영지원쪽일을 했는데 노무사 세무사에 다 맡기고 기장하기 때문에 경영지원쪽 일을 하고 싶은분들에겐 물경력이 될거 같음!
39,지방자치연구소,12533,"최악중에 최악이다 직원을 부품처럼 생각을 하고 연장 야간 휴일근로수당 따위는 없다, 연봉도 엄청 짜다. 그중 최악은 대표다."
40,지방자치연구소,12533,1. 대표가 어마어마한 꼰대입니다. 2.하는 일은 기자가 아닌데 마인드는 언론인의 마인드를 바라고 있습니다. 3. 월급 쥐꼬리만큼 주면서 많이 준다고 생색냅니다 4. 10일 연속 출근하고 마감때는 밤을 새는 일이 허다한데 직원들을 소모품으로 생각하는지 전혀 미안해하지않습니다 주말 2일 일해도 대체 휴일은 1.5일 주고요.
41,지방자치연구소,12533,"신입이야 똥인지 된장인지 모르니 온 몸을 불사지르다 퇴사 경력자들은 문턱 밟고 넘어서야 똥밟았구나,, 똥밟고 퇴사 한달에 얼마나 많은 인원이 입퇴사를 반복하는지 하루를 조용히 넘긴 적이 손에 꼽음 대표실에 불려가면 상황따라 한시간은 기본 사람 혼을 빼놓고 진저리 쳐지게 함 그 이상은 상상말라,,, 일을 해야하는데 일을 더 더디게 만듦 육체적인건 그렇다치고 정신적으로 멘탈 탈탈 털림 그에 비해 급여는 소름끼치게 작음. 전혀 위로가 안됨. 길면 6개월 빠르면 1-2달 견디다 퇴사하는 사람 80%이상"
