,company_name,company_id,review_text
0,지파워,2132,팀별 업무구분이 모호하지만 모두 업무 서포트를 잘해주는 것 같습니다
1,지파워,2132,업무체계가 잡히지 않았다. 방향성이 모호하려 직원들이 방향성 가지고 업무에 집중 못함.
2,지파워,2132,작은회사다 보니 일부 몇명의 의견만 들어줌. 자금이 충분하지 않다보니 확고하게 프로젝트 진행하기가 힘듬.
3,지파워,2132,"급여체계가 없음. 같은 학력,같은학교 나왔어도 부서가 달라서 낙하산인데도 연봉400~600이상 차이남, 영어이름 부르는데, 적응안됨. 영어단어쓰며 회의하는데 한국말해도되는데 굳이..ㅋㅋ; 개발부서 아닌이상은 업무분장 안되어있음."
4,지파워,2132,"연봉은 충분하지만, 업무량이 의외로 많았다는 점밖에 없음."
5,지파워,2132,아직은 스타트업이고 비지니스 모델이 확립되지않은 상태이지만 발전 가능성은 항상 높은 것 같습니다.
6,지파워,2132,"중간 관리자(대리~팀장)에겐 별로... 대표의 지시를 받아 일해야하고 PM/PL을 하는 사원을 따라야 함. 기타 수당은 기대할 수 없고 연봉협상없이 그냥 계속 지나감. (연봉협상을 왜 안하냐고 하면, 니가 하자는 말 없었잖아~ 식임)"
7,지파워,2132,아직 스타트업이라 매출이 일정하디 않은점은 아쉽습니다.
