,company_name,company_id,review_text
0,참좋은인터넷,4260,"그 작은 회사에서 어찌나 사내정치가 많던지… 퇴사한지 꽤 오래되었지만 다른 회사들 다녀보니 이 회사가 얼마나 비상식적인 사람이 많았던 곳인지 깨달았습니다.  고인물의 사내정치, 뒤쳐지는 기술… 출산휴가도 연차수당도 정말 최근에야 생긴거 알면은 다들 놀랄 듯"
1,참좋은인터넷,4260,1. 소통이 거의 없음 2. 체계가 없음 3. 할일 없으면 칼퇴하는게 맞는데 계속 칼퇴하다가 보여주기식으로라도 앉아있다 퇴근하라는 소리들음 4. 최악의 연봉
2,참좋은인터넷,4260,소통이 많지 않음 복지없음 보너스없음 연봉적음 중소기업 대표답게 직원들의 편의생각하지 않음
3,참좋은인터넷,4260,배울 게 크게 없음 체계 전혀 없음 고인물들 천지임 작은 회사인데도 정치질 와우
4,참좋은인터넷,4260,1. 음료수만 있음 2. 조용한 분위기라 별로임 3. 칼퇴가 가능한데 눈치봐야 함 4. 야근 수당 없음 5. 최악의 연봉
5,참좋은인터넷,4260,회식이 없어서 좋긴한데 전혀 없다시피 해서 사실 직원간 유대감이 생기기 어려웠습니다. 하지만 대표님 의도 이시긴 해서 큰 불만은 없었습니다.
6,참좋은인터넷,4260,1.칼퇴가 가능하나 눈치줌 2.완전 방치되다시피 함 3.체계가 없어 사장과 다이렉트 소통(왕부담) 4.퇴직금 안주려고 1년되기 직전에 해고시키는 사장 5.공고와 다른 업무 6.분위기가 엄청 조용하고 소통도 잘 안됨 7.회식없음
7,참좋은인터넷,4260,조금 답답함이 있음 고전적인 SI 기업이다 보니 발전은 없고 유지만 하는 정도 정말 사무실 분위기 조용함
8,참좋은인터넷,4260,"유지보수를 고려하지 않은 코드를 유지보수해야함. 스파게티, 누더기란 무엇인가 알 수 있음 jdk 1.4부터 1.8까지 고루 사용할 수 있는 레거시 프로젝트 다수 존재 주력 솔루션이 스트러츠였고 스프링을 최근 도입했으나 최대한 스트러츠와 비슷하게 만든 혼종임 사내 서버는 먼지 쌓인 구형 데스크탑이고 이중화나 백업은 없음 코로나 격상과 관계없이 사택근무 지향 냉.난방 중앙제어 남자 화장실 변기 2칸, 화장실에서 흡연하는 무개념 있음 건물 미화여사님들 청소하던 고무장갑으로 엘베버튼이나 비상계단 문고리 여는 등 끔찍한 광경 목격 가능 연봉이 짬. 대졸자 전공자도 2400으로 후려치는 짠내 체감 가능"
9,참좋은인터넷,4260,"인력이 많이 부족하여, 계약된 일정안에 프로젝트 종료하기 힘든경우가 있음. 간혹 말도안되는 양의 일이 주어질때가 있음"
10,참좋은인터넷,4260,활발한 사람들은 이기업에서 적응하기 힘듬 모두 업무에만 집중하기 때문에 매우 조용하고 자칫 지루할 수도 있음
11,참좋은인터넷,4260,동료들도 훌륭하고 복지가 짱짱해서 정말 좋은 회사인데 새직원이 들어오지 않습니다. 와주세요... 같이 일해요. 에어컨이 중앙 냉방이라 여름에 좀 더워요. 엘레베이터가 좀 이상하게 작동합니다. 주변 식당 밥값이 좀 비싸요.
12,참좋은인터넷,4260,중식제공 없음. 체계없음. 사수가 없어서 알아서 해야 됨. 부여받은 일이 없더라도 다른 사람들의 터치가 전혀 없고 방치해둠. 상당히 삭막함. 야근을 안 해도 되지만 알아서 눈치껏 해야 됨.
13,참좋은인터넷,4260,직원을 도구로 생각하지 말았으면 좋겠다 의사 전달을 명확하게 하세요
14,참좋은인터넷,4260,복지가 미흡하다..혼자 열심히 일하면 된다 체계가 없음
15,참좋은인터넷,4260,"프리랜서 임금(잔금) 결제가 대부분 지체됨. 이유는 항상 ""클라이언트 검수가 안나서"" 결국 프리랜서는 항상 잔금받을 때가 되면 (계약일정 이후에도) 사측이 요구하는 각종 수정/추가 작업을 끌려다니면서 해줄 수 밖에 없음.  계약일정 내에 계약된 결과물을 모두 산출했건, 그 이상으로 일을 잘했건 아무 상관없음. 결국 돈받을때가 되면 매번 수차 확인 및 아쉬운 소리를 하게 만드는 회사. 결국 모년도 프로젝트에서 체불이 한도를 넘어 결국 민사소송을 통해 승소, 잔금 및 이자를 받고 업체와는 결별함."
16,참좋은인터넷,4260,- 한번씩 프로젝트가 4~5개씩 겹치는 경우가 있어서 이럴 때마다 퇴사자가 생기는 편 - 야근 수당없고 늦게까지 일하거나 주말에 일해도 해당 직원이 따로 어필하지 않으면 대체 휴가도 따로 챙겨주지 않음. 본인이 챙겨야하는 편 - 이미 안정적인 솔루션과 정해진 업무 템플릿이 있기 때문에 커리어적인 발전을 원하고 오면 실망할 수 있음. 그냥 평범하고 안정적인 회사 다닌다는 느낌으로 다닐만한 회사 - 연차 대비 능력없는 사람이 있어도 일이 극단적으로 안 좋아질 때까지 별다른 조치없이 방치하는 경우를 많이 봄. 결국 남은 사람들만 피해보는 경우가 허다했음.
17,참좋은인터넷,4260,"1. 주먹구구식 프로젝트 진행 2. 정해진 업무 프로세스가 없다. 3. 1년이 되기 전에 자르는 경우가 많다. 4. 사수가 없기에, 혼자서 알아서 해야 한다."
18,참좋은인터넷,4260,1. 복지 없음 2. 체계 없음 3. 오로지 혼자 감당해야 하는 업무(사수라는 개념이 전혀 없음) 4. 승진해도 연봉인상 전혀 없음 5. 회식 안하는게 장점이기도 하지만 안해도 너무 안함 6. 식비 제공 없음 7. 퇴직금 못 받게 하려고 1년 되기 전에 자름
19,참좋은인터넷,4260,사수 없이 혼자서 일을 해야 하는 경우 많음. 개인의 역량보다 더 그 이상을 원하고 가능할 거라 생각 복지 크게 눈에 보이는 점 없음
20,참좋은인터넷,4260,조그만 회사라 복지 이런게 갖춰진 회사는 아니다. 그렇다고 감정적으로 직원들을 잘 챙겨주는 회사도 아님.
21,참좋은인터넷,4260,단점을 이미 알고 있음 협업툴을 불편하게 사용함 바쁜 사람만 바쁨
22,참좋은인터넷,4260,고인물들이 문제입니다 항상 하던 방식만을 고수하려 하고 자기가 최고인 줄 아는...; 그리고 이 작은 회사에서도 정치질이 있읍디다...꼴값 그 자체...
23,참좋은인터넷,4260,"업무흐름이 매끄럽지 않고 매번 쳇바퀴 돈다. 결정사안을 자꾸 번복. 상여금 없다. 구직사이트에 기재된 복지는 없다. 전형적인 남초회사, 진짜 웬만한 사람들보다 말이 많이 많다."
24,참좋은인터넷,4260,그당시에는 일거리가 많이 없어서 임금체불이 좀 있었습니다. 나중에 다 받긴 했지만 좀 불안했었네요. 복지 같은건 전무했고 지금은 나아졌으리라 생각됩니다
25,참좋은인터넷,4260,파벌만들기에 바쁜 몇명의 직원이 분위기를 흐림. 대표는 그다지 진행중인 사업에 관심이 없음.
26,참좋은인터넷,4260,그 당시는 경영난으로 직원들 임금을 제때 지급하지 못함 지금은 나아졌는지 모르겠지만 그당시에는 한달 이상 밀렸었음 승진 및 연봉인상의 기회가 전혀 없어보였음
27,참좋은인터넷,4260,"1.특정 인물 .. 그사람이 실세임. 그사람 눈밖에 나면 퇴사해야함. 자기 멋대로에 개념없고 자기가 잘보여야 하는사람한테만 엄청 딸랑이짓 하는데 본인은 그걸 자랑스럽게 생각함. 옆에서 보면 한심함. 2.퇴사 한사람들 남자,여자 구분없이 알고보면 다 저 인간 때문에 그만뒀다는 사람이 한둘이 아닌데 본인만 그걸 모름. 3.개발팀 매일 야근함. 아홉시까지 근무는 기본임. 4.한달에 한번이라도 상담을 해서 어떤부분이 문제이고 어떤 사람이 문제인지 회사내에서도 좀 얘기가 나왔으면 함. 5.복지 없음...그냥 월급 끝...퇴사율이 왜 많겠어요? 오래다닐 회사라고 생각이 안드니까 그렇죠. 6.회식 없는건 그냥 사장이 짠돌이라 없는거..단점이기도 하고 장점이기도 하네.. 7.연차제도도 2년 전에 겨우 생김 ㅋㅋ 8.포괄연봉제라 매일매일 야근해도 1원도 수당없음. 9.퇴직금 바로 안 줌.ㅋㅋ"
28,참좋은인터넷,4260,11시 59분에 대부분 일은 안하지만 밥먹으러도 못가는 분위기. 출퇴근 등 근태 까탈스러움. 개인 회사같은 분위기. IT회사지만 변화에 대응할 준비가 안되어 있음.
29,참좋은인터넷,4260,프로젝트에서 기획자에게 PL로서의 권한을 인정해주지 않음. 상사가 사사건건 관여함. 개발팀 매일 야근함. 사람이 자주 바뀌는 데는 이유가 있음. 회사에서 상사가 야 너 하는 분위기. 아무도 말리는 사람 없음
30,참좋은인터넷,4260,디자인팀은 일년에 서너번 야근하는데 기획팀은 야근을 하는 경우가 그 보다는 조금 많고 개발팀은 그 보다 조금 더 많습니다. 현재는 개발팀 인원 충원하여 나아졌으리라 생각합니다.
31,참좋은인터넷,4260,입사 후 일년 내외로 퇴사하는 사람이 많고 장기 근속자가 손에 꼽는다 디자이너는 작업시 특정폰트만 사용하는 등의 업무적 제약 많음 개발중심회사로 다른 직무라면 적응하기 힘들수도 있다. 부서간 소통 거의 없고 조용해보이지만 실상은 뒷담화와 정치질이 심한 사내분위기 업무가 특정인에 의해 크게 좌우되고 성과보다는 대충 해결만 하면 되는 식의 체계없는 업무방식을 경험할 수 있다 임원진들이 사내에 관심이 없어 문제가 생겨도 해결해주지 않음
32,참좋은인터넷,4260,면접 시에는 장황하나 막상 입사하면 근로자의 기본 권리인 연차도 눈치보며 써야하며 프로젝트 여건 여부에 따라 조율하는 것이 아니라 눈치보며 쓰는 걸 당연하게 여김. 일의 체계가 없음.
33,참좋은인터넷,4260,퇴근후에도 업무 연락이 많이 옴. 구인공고나 회사소개의 복지는 대부분 거짓이라고 보면 됨. 박봉에 책상의자 모두 너무 낡아서 불편함. 연차제도는 작년에야 처음 생겼지만 그 전부터 구인공고에 연차있다고 명시함. 연차 생겼어도 수당은 없음. 직접 사무실 쓰레기 버리고 청소하고 분리수거 해야함. 상사들이 반말함. 오래된 일부 직원들때문에 업무시간에 큰소리가 많이 남. 그 외 직원들 대부분 1년만 채우고 퇴사하는 편.
34,참좋은인터넷,4260,"야근 강요, 복지가 전혀 없음, 회사 내 정치가 심함, 경력에 도움안됨, 퇴사자가 상당히 많음, 이상한 책상 구조, 막말을 아무렇지도 않게 함, 너무 오래된 물건들, 경영진 마인드가 많이 이상함, 내부공유가 전혀 안되서 닥치면 해야함, 구인공고 복지와 완전 반대라고 생각하면됨"
35,참좋은인터넷,4260,"1. 야근있음 2. 연차보장안됨. 연차수당없음. 3. 수년된 독일책상과 고장나서 불편한 의자투성이. 4. 구직사이트에 체크된 혹할 복리후생... 그러나, 까보면 속빈강정껍데기. 실제 복지는 다 연봉에 포함되어 있다며 구직사이트에는 온갖 복리후생(우수사원 표창/포상, 야근수당, 성과급)에 모든걸 다 체크해놓으심. 복지는 전혀없음."
36,참좋은인터넷,4260,직원들과의 소통의 부재가 있다. 각자 자기 할일만 하고 퇴근한다. 복리후생이 부족하다.
37,참좋은인터넷,4260,어쩔때보면 보수적인것같은 분위기의 느낌이 강하게 들 때가 있다
38,참좋은인터넷,4260,점점 강팍해지는 분위기와 관리자의 무책임함이 점점 신경쓰임 일정이나 기획적인 부분에서 많이 부족하기때문 복지 없음
39,참좋은인터넷,4260,"박봉. 칼퇴근 어려움, 자유로운듯 하나 조용하고 소통없는 사내"
40,참좋은인터넷,4260,사내 분위기가 조용하고 직원들간에 딱히 교류할 시간이 많지는 않습니다.
