,company_name,company_id,review_text
1841,쿠팡(주),6026,단순하고 택배물량이 빡세고 많아서 덥고 멘탈갈리고 욕나올장도로 빡셈...
1842,쿠팡(주),6026,업무 강도가 낮지는 않았고 사람들과 소통하기가 힘들었음
1843,쿠팡(주),6026,"윗선에서 효율적일 것 같아서 일을 시키지만, 실근무자들이 일해보면 정말 비효율적인 일이라는 것을 알고 하지만 윗선은 잘 모르니 계속 비효율적으로 일을 하게됨."
1844,쿠팡(주),6026,근무 강도가 상당히 힘듬. 적응하는데에 시간이 꽤 걸림.
1845,쿠팡(주),6026,작업함에 있어 비효율적 그리고 여초회사이다. 그리고 연봉이 약하다
1846,쿠팡(주),6026,"초 분 단위로 업무가 평가됌, 재택이여도 일하는지 티를 내야함. 계약직 비율이 높고 전환율이 낮은듯"
1847,쿠팡(주),6026,이 회사 저 회사 다녀봤지만 크게 단점이라고 생각되는건 없었습니다. 면접을 깐깐하게 보는 만큼 똑똑하고 모나지않은 직원들이 대부분이라서요. 굳이 뽑자면 복지가 없다는거 정도입니다.
1848,쿠팡(주),6026,"노동강도가 사람마다 다르며, 개선하려고 많은 것들을 노력하기는 하지만 현실에서는 어려운 부분이 많은듯 보임."
1849,쿠팡(주),6026,복지가 없다는 것 . 개인 주의라는 것은 장점이자 단점인 듯 커리어 성장해서 나가려는 것 같은 직원들
1850,쿠팡(주),6026,많이들 알고 계시겠지만 쿠팡이란 회사에서 하는 업무는 택배업이다 힘들다
1851,쿠팡(주),6026,"말도 안되는 업무강도, 중심이 잡혀있지 않음, 상사들 갑질심합니다."
1852,쿠팡(주),6026,휴가를 잘 쓸 수 있는게 장점이지만 자리가 너무 적음 부서마다 최대인원이 다르지만 우리는 3명이 최대였음
1853,쿠팡(주),6026,화장실가는 동선이 멀고 바쁠때 가기 눈치보임 식당밥이 별로여서 실망했음
1854,쿠팡(주),6026,"승진(레벨업)이 다소 힘듬, 팀이동이 잦음, 독서실 같은 사무실 분위기(소음 허용X)"
1855,쿠팡(주),6026,회사가 몸집이 커졌어도 아직도 스타트업 같이 일하며 변화가 많아 신규입사자의 적응이 힘들다.
1856,쿠팡(주),6026,창고가 너무 커 동선이 크고 힘듬 창고라 어쩔 수 없겠지만 여름엔 덥고 겨울엔 추움 교통편 좋지 않음
1857,쿠팡(주),6026,"부서이동이 많아서 자리 자주 옮겨다님, 급하게 진행되는 업무가 가끔 있었고 계약 업무 외 조금씩 추가 업무 하게 됨"
1858,쿠팡(주),6026,일이 자주자주 바뀌고 갈때마다 다른일을 함 여름엔 무지 더웠습니다
1859,쿠팡(주),6026,급여가 너무 작고 일은 많고 계약직에서 정규직 되기가 너무 어려움
1860,쿠팡(주),6026,부서마다 분위기가 너무 다름 레벨 업 기회도 부바부가 심함
1861,쿠팡(주),6026,사람을 갈아넣어서 유지되는 모든 공정 과정. 한계가 보인다.
1862,쿠팡(주),6026,전문직이 아닌 한계가 뚜렷하여 승진이 어렵다. 복지제도 부족
1863,쿠팡(주),6026,"일이 너무너무너무너무너무 많다. 초보자들은 쉬는 것도 눈치봐야 하고,,, 로봇같이 일하다보니 몸이 고장났는지도 모르다가 집에 와야 쑤시기 시작. 부품의 삶이 이런 것이구나,,, 하고 느낄 수 있다. 8월에는 더워서 너무 힘들다."
1864,쿠팡(주),6026,계약직이 많아 퇴사가 잦아 연령대가 다소 20댜 중반이 많다
1865,쿠팡(주),6026,체계적이지 않음 단순히 일 방식 뿐만이 아니라 같은 부서 같은 팀도 도대체가 무슨일을 하고 있는지 알 수가 없달까? 비효율적인 구조
1866,쿠팡(주),6026,대우 별로고 밥도 맛없고 화장실도 눈치보면서 가야함 생산율 낮으면 따로 불러서 뭐라함
1867,쿠팡(주),6026,구내식당이란건 따로없고 중간층에 도시락 코너가 있는데 식당이아니라서 매일도시락먹어야함
1868,쿠팡(주),6026,"쿠팡이츠 기준, 절대 쿠팡이츠가 붙은 직무는 비추 워라밸 없고 어리고 꼰대인 최고 상사가 리더로 있어서 답없는 일에 돈 쳐붓는 일만 미친듯이 함 그 결과로 쿠팡이츠 모든 부서가 표준근무시간 외 근무를 하고 있음 이에 따른 보상은 전혀 없음 (포괄연봉제)"
1869,쿠팡(주),6026,빠르게 작업을 해야한다 그리고 장비가 엄청 무거운데 옮겨야한다
1870,쿠팡(주),6026,"임원이 말그대로 하루아침에 드라마처럼 잘리는걸 목격할 수 있음. 복지전무. 그나마 있던 월 5만원 복지비는 팀회식때만 사용하는걸로 바뀌었고, 도서비 지원은 테크조직만되고, 비개발쪽은 밀리의서재 선착순 지원됨. 선릉, 판교 거점 오피스도 테크조직만 지원됨."
1871,쿠팡(주),6026,윗 사람 잘 만나면 좋은데 잘 못 만나면 일 배울 때 힘들어요ㅠㅠ 급여 적어요..
1872,쿠팡(주),6026,계약직은 급여가 너무 짬. 어떤 일을 배우고 있는지 이게 쓸모가 있는지 의문. 그냥 컴퓨터로 단순노동하는 느낌
1873,쿠팡(주),6026,"임직원들의 업무 경쟁력이 강한편이고 워낙에 인력이 많다보니 위에 매니져 분들이 직원 한명한명 애정어리게 챙기거아 끌어주는 부분이 거의 없다 알아서 차고 올라가서 본인을 어필해야 알아줄수 있고, 빨리 처리해야 능률이 올라서 업무강도가 쎈편이라 여져진다"
1874,쿠팡(주),6026,교육을 받아야합니다 그것이 힘듭니다 그리고 일도 힘들긴합니다
1875,쿠팡(주),6026,1. 복지 너무하다 싶을 만큼 없음 2. 이건 반반인데 중국인들 일잘하는 사람은 잘하는데 못하는 사람은 진짜 1부터 10까지 일일이 뭐해야되는지 전달하지 않으면 딱 눈에 보이는거만 함. 3. 매니저 절대평가로 하위 10프로 팀원은 연봉 동결 및 인센 미지급 (다 잘하는 팀이든 실적 대박 치든 말든 예외없음) 기본적으로 정치질 유도하는 정책인듯
1876,쿠팡(주),6026,업무에비해 급여가 너무 낮음 대부분 계약직 근무자임 자유로움 때로는 단점임
1877,쿠팡(주),6026,너무 고객중심으로 돌아가고 급성장으로 체계 없다고 느낄때가 많음
1878,쿠팡(주),6026,"부서간 협력이 순조롭지 않음, 사공이 많음, 줌 회의 아주 많음, 직원 식당이 없어 중식으로 간편식(샌드위치 도시락 등) 제공됨"
1879,쿠팡(주),6026,의사결정이 주먹구구식으로 진행되며 외국인과 개발자외에는 구성원으로 존중하지 않음
1880,쿠팡(주),6026,계약직이 70퍼센트 이상. 그중에 정규직 전환률을 1퍼센트 정도 정말정말 회사를 위해 업무 외 시간도 할애하며 연습하고 일해야 사람들 눈에 띄고 그런사람들만이 정규직 도전 기회를 얻음. 도전뿐이지 전환이 되는 것도 아님.
1881,쿠팡(주),6026,속도가 느릴 수 밖에 없는 시스템 안에서 스타트업처럼 빠르게 진행해야 함. 승진은 능력순이 아니라 인맥순. 상위 직급이 대부분 외국인이고 한국인은 그들의 성과를 위해 희생되는 구조. 상향평가가 없고 대부분 매니저의 평가로 내 평가가 결정됨.
1882,쿠팡(주),6026,노선공정성이없음 공휴일에 연차경쟁 휴무랜덤배정으로 상호교환해야함 비오는날 또는 여름이 고생을 엄청함 특히5층 6층 많은 노선 장기근무의 장점이나 비전이 딱히없음
1883,쿠팡(주),6026,무릎 고장나기 좋음. 여름에 더워서 쉽지 않아요. 캠프마다 분위기 상이함
1884,쿠팡(주),6026,스타트업의 장점인 유연함보다는 체계가 잡힐듯 잡히지않는 시스템이 모호합니다
1885,쿠팡(주),6026,택배 상하차일 오래하면 허리 나가서 병원비가 더 들거같음
1886,쿠팡(주),6026,복지제도가 많이 있다고는 하지만 현장 근무하는 사람들에겐 거의 없음. 식비 지원이 안됨. 일이 빡셈
1887,쿠팡(주),6026,높은 퇴사/이직률. 이곳에 정착하는 것이 아니라 경유해서 커리어를 쌓고 이직하려는 분들이 많아 다소 어수선한 느낌? 과연 지속 가능한 경영이 가능할 것인가라는 의문이 자주 생김..
1888,쿠팡(주),6026,남자들만 죽어라 일함. 물론 여자들도 일을 열심히 하기는 하나 일해보면 불합리하다는 생각이듬. 임금 차이를 두는게 어떨까 싶은데 또 그러면 그분들이 뭐라 할듯...
1889,쿠팡(주),6026,일을 너무 많이 시킨다.. BM 했는데 하루 평균 12시간은 기본으로 일함..실적압박 엄청남
1890,쿠팡(주),6026,개발자가 아니면 별로 대우를 못받음. 개발자 위주. 연봉 낮음. 커리어에 별로 도움이 되지 않음.
1891,쿠팡(주),6026,미들-시니어급에겐 최악의 회사 매니저라도 했다간 워라밸 붕괴 이츠관련 사업은 처다보지도 말 것 성장과 내실보다는 숫자싸움에 집중하는 곳 계약직은 절대 비추
1892,쿠팡(주),6026,오래 일한 사람들이 텃세를 부림... 단순 작업인데 괜히 아는 척 훈수두면서 간섭함. 특히 아줌마들ㅋㅋㅋ 뒤에서 욕하는 경우도 심심찮게 볼 수 있다ㅋㅋㅋ 그리고 일이 너무 힘듬ㅜㅜ 무거운거 많고 일하는 내내 서있어야 해서 여기저기 아프다..
1893,쿠팡(주),6026,노동량에 비해 급여가 짜다 자기 몫을 하기위해 몸을 갈아넣어야한다
1894,쿠팡(주),6026,복지제도가 없으며 생각보다 일을 많이 하는 내 자신을 보게됨
1895,쿠팡(주),6026,1. 자꾸 일을 벌임 2. 체계도 갖추지 않고 일을 벌여 직원에게 일이 가중이 됨 3. 적당히 일해서는 인정 받지 못함 4. 적당히 일해서는 월급도 오르지 않음 5. 깐깐한 직원평가 6. 자기네들이 짠 스케줄에 맞춰야 하는 주말근무 발생 7. 전배가 누구에게나 쥐어질 기회처럼 말하나 그런 일은 일어나지 않음 8. 본인들의 필요로 자꾸 본업이 아닌 다른 일을 시킴 9. 다른 일 시키고 본업 평가에서 진급누락시킴  앞뒤 안가리고 일만 하고 싶은 워커홀릭에겐 최적임
1896,쿠팡(주),6026,사람을 사람으로 보지 않고 그저 부품으로 보고 나를 굴림.. 우린 그저 사회의 톱니바퀴일뿐 사내 정치도 심하고 그냥 개힘듦
1897,쿠팡(주),6026,외부에서 판단하는 쿠팡의 이미지가 사람을 갈아넣는다고 하는데 그건 맞는말이에요. 시스템화보다도 인력을 써서 해결을 하려고 하니...ㅎㅎ
1898,쿠팡(주),6026,외국 임원들 채용으로 배가 산으로 가고 있음 침몰하기 직전인데 그 누구도 방향키를 돌리지 않고 있음
1899,쿠팡(주),6026,화장실 가는것도 눈치 보이고 중간중간 쉬는 시간과 휴게실이 마땅치 않음 밥 먹고 바닥에 앉아서 쉬어야 함 여름엔 너무 더움
1900,쿠팡(주),6026,반면 그 날개를 펼칠 기회가 나중에는 실적에 대한 스트레스로 이어지는 편입니다.
1901,쿠팡(주),6026,시간급은 연봉이 매우 짬.. 복지 없음. 무슨 일을 배우고 있는지 앞으로 발전가능성은 있는지 의아함.
1902,쿠팡(주),6026,"특정한 사람에게만 일이 몰린다. 대부분은 중심에서 멀어져있고, 멀어지려고 한다. 이런 상황을 관리할 방법을 모른다. 그리고 외국인들이 최근 많이 채용되는데 그 퀄리티가 최악이다."
1903,쿠팡(주),6026,부바부여서 안좋은 곳은 한없이 안 좋음 영어되고 입 잘 털면 아주 잘 인정받는 곳
1904,쿠팡(주),6026,전문지식이 없는 사람이 너무 많고 체계가 없음 인성검사가 없음
1905,쿠팡(주),6026,"아무것도 모르는 무능한 외국인 리더와, 거기에 장단 맞추는 무능한 한국인 리더들이 있었음"
1906,쿠팡(주),6026,"로봇같이 쉴틈없는 업무시간, 밀려드는 택배박스를 온몸으로 받다보니 다리 팔 상관없이 멍 듬"
1907,쿠팡(주),6026,"속도감이 굉장히 빠르기때문에 이에 맞춰 일하는 것이 쉽지않음. 워라밸 불균형, 업무 성과 압박"
1908,쿠팡(주),6026,배송직의 경우 몸관리를 개인적으로 꾸준히 유지해야함. 회사정책이 수시로 바뀌는것이 장점이자 단점
1909,쿠팡(주),6026,복지제도 제로 알바라지만 너무 했음 화장실도 눈치보면서 감
1910,쿠팡(주),6026,몸이 힘든 점이 단점이었으며 다시 들어가고 싶지는 않다
1911,쿠팡(주),6026,일단 저희 집에서 멀어서 좀 불편하긴 했습니다 그리고 일의 강도가 빡셉니다
1912,쿠팡(주),6026,"파견직을 갈아서 겨우겨우 굴러가는 회사. 회사 사람들이 전부 자기가 공무원인 줄 암. 직원들 일 하기 싫어하는 사람들 많음. 사람 많이 뽑고, 많이 나가는 회사."
1913,쿠팡(주),6026,"각자 도생, 신규 입사자가 적응하기 쉽지않음 빠르게 적응해서 구성원으로 인정받는게 중요함 성과를 매우 빡세게 관리해야됨"
1914,쿠팡(주),6026,"출, 퇴근 시간이 길고 장기적으로 보고 일을 하기엔 아쉽다."
1915,쿠팡(주),6026,아마존 출신 리더들이 말아먹는 것 같음 결국 디테일 없는 압박
1916,쿠팡(주),6026,규칙이나 질서가 없다. 아직도 작은 물품을 대충 상자에 훌렁 넣어서 보내는건 이해가 안된다. 그렇다고 물어볼 사람도 없고 다들 하루 일하다 하루 벌고 가는 입장이라 궁금해하는 사람도 묻는 사람도 없다. 그냥 하던대로 할 뿐.
1917,쿠팡(주),6026,업무가 매우 세분화 되어있어서 부품같은 느낌이 든다. 부서마다 분위기가 다르겠지만 소속감이 없었다. 매일 새로운 이슈가 터져서 정신없다.
1918,쿠팡(주),6026,삭막하고 직원들간의 유대관계가없이 정말 기계처럼 일만 하다가 오는 느낌을 받았습니다
1919,쿠팡(주),6026,포괄근무제로 인하여 추가근무시 나오는 수당 없음 비효율적인 업무방식 많은 업무량에 치임
1920,쿠팡(주),6026,휴게시설이 매우 부족하고 출근시에 핸드폰을 제출해야한다.  일하는 사람들이 부족하다.  쉬는시간이 정해진것이 없어 힘들다.
1921,쿠팡(주),6026,성과 경쟁이 너무 심하고 단순 업무가 주를 이룸. 포괄임금제로 야근해도 수당 안나옴. 돈 많이 주는듯 하지만 거의 매일 야근하는 거에 비하면 적은 편. 업무의 변화가 너무 빠름. 하루 아침에 프로세스가 변경 됨.
1922,쿠팡(주),6026,빠른 외적 성장에 비해 내적으로 구조적 안정성이 미흡함
1923,쿠팡(주),6026,개인주의가 장점이 될수도 있으나 가끔은 무관심하단 생각이 들었음
1924,쿠팡(주),6026,이커머스이다보니 다른 스타트업에 대해서는 다소 수직적인 문화이고 대기업의 단점들이 보이기 시작함.
1925,쿠팡(주),6026,복지는 정말...아무것도 없다고 보면됨 진짜 아무것도 없음
1926,쿠팡(주),6026,타워730 한정 엘리베이터 전쟁이다. 현금성 복지가 부족하다. 근무강도는 높은 편.
1927,쿠팡(주),6026,일부 임원급들이 개발문화를 많이 망쳐놓아서 줄퇴사가 이어짐.. 개발 문화 망쳐놓고 본인들은 ㅌㅌ..
1928,쿠팡(주),6026,"올해부터는 특히 비용절감 포커스로 퇴사해도 인원이 충원되는게 느리고 자유롭게 하던 시도도 비용때문에 리젝당하는 경우 많은듯 함, 외국인 조직장과 한국인 팀원의 부조화로 발전이 없는 팀 많음"
1929,쿠팡(주),6026,"미국, 인도, 중국 외국인들을 리더로 너무 앉혀놔서 조직이 우왕좌앙함. 한국 시장을 잘 모르는 사람들이 숫자 좀 보고 이래라 저재라 판단. 문제는 그들은 계약직들이나 회사를 떠나면 그뿐. 한국인들을 오퍼레이션만 하는 하위 직원이라는 인식이 다소 있음"
1930,쿠팡(주),6026,팀장 잘못 만나면 혹사 플러스 거의 괴롭힘 수준의 크리틱
1931,쿠팡(주),6026,"과도한 업무, 식사 시간 보장 안됨 모두가 일을 끝내야 퇴근할수 있는 시스템. 좋아보이지만 고문관들이 많음"
1932,쿠팡(주),6026,너무 정신없이 바쁘고 빠르게 돌아가기때문에 다소 산만하고 적응하는데 시간이 좀 걸릴 수 있음
1933,쿠팡(주),6026,단순작업이 은근 많음 개인적인성향인사람만 강추합니다...
1934,쿠팡(주),6026,따라가기 어려워요. 급격하게 변화하는 프로젝트가 많은데 따라가기 어려울 때가 많아요.
1935,쿠팡(주),6026,점심시간 엘리베이터 줄이 너무 김 여름에 덥고 겨울에 추움
1936,쿠팡(주),6026,은근히 보고서작성으로 인해 피로감이 누적될 수 있음. 일이 몰릴땐 너무나도 바쁘고 내생활이 없음.하지만 일이 없을 땐 할만하므로.. 모르겠음
1937,쿠팡(주),6026,하루종일 감시당하며 일하는데 내가 무슨 말을 하고 무슨 행동을 하는지 모두 다 감시함
1938,쿠팡(주),6026,물량터지면 답이 없음. 조절해야하는데 그런게 없고 일이 엄청나게 들어와서 힘듬
1939,쿠팡(주),6026,지원을 많이나가고 레벨이 높으면 처음가는 지역도 기프트수를 과도하게 주는 경향이 있고 이기적인 팀원을 만나면 상당히 힘들어짐
1940,쿠팡(주),6026,힘든일 인력필요할때 포장에서 남자빼가네요 포장으로 알바지원했는데 일시작할때 바로 딴데로 끌려감 연속으로가면 얼굴기억해서 같은일로끌려감
1941,쿠팡(주),6026,수평적인게 장점이기는 하지만 결국 의사 결정은 수직적일 수 밖에 없음. 그리고 다소 개인주의 성향이 강한 것 같습니다.
1942,쿠팡(주),6026,매월 랭킹 공개 단순반복식 업무 교육 2일후 업무투입
1943,쿠팡(주),6026,새벽에 일어나야한다. 기계처럼 일한다. 체력적으로 힘들다. 계속 왔다갔다 해야해서 다리가 아프다... 일용직 노동.. mz세대형 노가다
1944,쿠팡(주),6026,"실적 압박이 심함, 효율적인 것을 추구한다고 하지만 비효율적인 면이 다소 있음, 교육 기간이 짧아서 초반 업무 숙지하는데 어려움 존재"
1945,쿠팡(주),6026,"겉으로 보기에만 좋고 속은 아무것도 없다, 그흔한 복지도 뭐도 아무것도 없음, 미쳐버린 성과주의이기 때문에 내 성과 뺏기면 그냥 망하는거임"
1946,쿠팡(주),6026,복지가 없다. 유일한 복지는 자판기 300원 음료와 명절 상여 쿠팡 캐쉬 10만원
1947,쿠팡(주),6026,야근을 하는걸 많이 볼 수 있음 위로 갈수록 무서워지는 분위기
1948,쿠팡(주),6026,돈이 알바수준 3년지나도 안오를수도 아무리 개인이 잘해도 매니저가 안올려주묜 승진 없음 업무를 제대로 안알려주고 무조건 하라고 함 오래 다니는 사람들보면 돈욕심없는 사람들
1949,쿠팡(주),6026,"업무특성상 체력과 근성 필요함, 기상상태에 따른 업무 이슈가 많이 발생함, 당일 업무강도 복불복"
1950,쿠팡(주),6026,아무래도 적은 급여가 가장 큰.. 단점이었고.. 반복 작업이 좀 지루하고 업무 방식이 점점 산으로 가는 .. 느낌이 있었음
1951,쿠팡(주),6026,인간미는 좀 떨어질 수도 있음. 이건 진리의 케바케이긴 함.
1952,쿠팡(주),6026,반대로 너무 변화가 빠르기 때문에 업무 적응에 오래 걸리는 사람은 힘들수도 있고 때론 그냥 소모품처럼 느껴질때도 있음..
1953,쿠팡(주),6026,"최소한의 복지 외에는 이렇다할만한 복지의 부재. 대부분의 대기업이 그렇겠지만 티 안나는 월급루팡들이 곳곳에 있으며, 재택으로 인해 더 심각했던 것 같음. 똑똑하고 열정있는 직원들이 최근 많이 퇴사함."
1954,쿠팡(주),6026,아무래도 야외 근무다 보니 날씨 영향도 많이 받고 계단 많이 걸리면 육체적으로 힘듦
1955,쿠팡(주),6026,실시간 배송량을 전화와서 이유를 물어봄 연차가 내가 원하는 날에 못쓰는 경우도 있음 많이 자유롭지 못함 열심히 일하면 몸이 상함
1956,쿠팡(주),6026,노동의 강도가 너무 편안하다 스케줄근무라서 주말에 쉬기가 쉽지않다 부서마다 다르겠지만 비교적 업무가 많다
1957,쿠팡(주),6026,너무 일용직만 쓰다보니 교육시간이 많이 할애하는거갘습니다
1958,쿠팡(주),6026,수평문화이다 보니 다양한 사람들을 많이만남. 부하직원으로 들어와도 뭔가 조금하나 어긋나면 hr에 신고하여 트러블이 많이생김. 모든 회사들이 그렇듯 사바사가 큰듯.
1959,쿠팡(주),6026,최저시급 커리어 박살 단순 업무로 비둘기도 할 수있는 지루한 업무 명절 보너스 쿠팡캐시10만원
1960,쿠팡(주),6026,낮은 연봉 및 인센티브제도로 월급이 불확실. 잦은 내부 변동으로 스스로 어디로 팀이 변경 될 지 확인 어려움.
1961,쿠팡(주),6026,승진이 어려우며 네임벨류에 비해 급여수준이 좋지는 않음. 내부체계가 복잡한 편으로 회사에 적응하기 쉽지 않음. 많은것들이 계속 변동되는 회사.
1962,쿠팡(주),6026,직원은 일용직사람들 무시 욕설 난무 근로자가 많은상황에도 큰소리내며 화를냄
1963,쿠팡(주),6026,표면적 수평적 조직 엘레베이터 불편 구내식당이 딱히 구내식당 스럽지 않음
1964,쿠팡(주),6026,실시간 실적 조회가 가능하여 실적 압박이 상당하다! 멘탈관리필수
1965,쿠팡(주),6026,물류 쪽은 힘든 곳은 정말 힘들다. 최저시급 받고 해야 하는 노동강도가 아니라고 생각한다.
1966,쿠팡(주),6026,어플오류 및 버스어플 오류가 좀 납니다 이런건 고쳐줬으면 합니다
1967,쿠팡(주),6026,현저히 낮은 연봉 레벨업 생각보다 어려움 자기 발전의 기회가 적음
1968,쿠팡(주),6026,쿠팡맨 배송보조 업무간 점심식사 해결할 곳이 마땅치 않았음
1969,쿠팡(주),6026,조직이 너무 자주 바뀌어서 혼란스럽고 업무의 범위가 너무 세세하게 나뉘어 있어서 성장하기에 아쉬움
1970,쿠팡(주),6026,단순업무가 주를 이루며 특별하게 잘난것없는 매니저들의 줄세우기 문화가 아쉬움. 내가 성장한다는 느낌보다 회사의 부품이 되어 돌아간다는 느낌이 많음
1971,쿠팡(주),6026,계약직과 정규직의 차이가 확연하게 드러나서 애사심이 절로 불타진 않음.
1972,쿠팡(주),6026,"플랙스는 처음가면 빌라, 주택등 어려운 곳만 주고 작업반장?이랑 친한사람은 배송은 아파트 줌."
1973,쿠팡(주),6026,근거없는 타겟 알수 없는 근거를 위한 근거를 위한 근거 타겟을 설정했으면 어떻게 도달 할 것인지에 대한 플랜을 세우지 않고 실무자들이 직접 부딪히며 가 만들어야 되는 상황 이 만드는 과정자체가 조직 구조상 정해진 것 이외로 뻗혀나가기가 쉽지 않음
1974,쿠팡(주),6026,앉아서 쉴 수가 없음… 거의 반나절을 일하는데 식사시간 제외하면 앉아있는게 눈치보임 그리고 업무 분담이 당일 랜덤이라 내가 어디로 배치될지 무슨일을 할지 모름
1975,쿠팡(주),6026,체계화되지않은 프로세스덕에 불필요하고 비생산적인 업무를 하게 되는 일이 종종 있으나 개선하는중
1976,쿠팡(주),6026,개인에게 주어진 업무가 너무많다. 성장 속도대비 직원 복지는 낮음. 현재는 많이좋아졌다고하지만 체계가없음...
1977,쿠팡(주),6026,전반적으로 일이 많음(부바부지만 업무강도 높을 수 있고 재택이라 그런지 오히려 야근을 더 많이 하는듯) 회의 많음 적응하기 어려운 환경 복지 부족함
1978,쿠팡(주),6026,부서를 잘만나야 할듯. 열심히 일했는데 발전이 느껴지지 않았고 부서내 소통이 잘 안되어서 답답했다.
1979,쿠팡(주),6026,현장직이다보니 사람들이 사나워질 수 있고 업무가 쏟아질 때는 정말 힘듭니다.
1980,쿠팡(주),6026,제가 일했던 파트는(상품등록관련) 단순한 일이 반복이라 지루하고 시간안갈수도있습니다
1981,쿠팡(주),6026,복지제도는 그다지 좋은지 모르겠음 아무래도 몸을 쓰는 일이라서 힘듬
1982,쿠팡(주),6026,시스템이 너무 자주 바뀜 급작스럽게 다 엎어질때도 많음 외국인들 뭔생각인지 모르겠음
1983,쿠팡(주),6026,하루 실적 달성을 못하면 퇴근의 개념이 없어집니다. 오전 10시 출근 저녁 10시 퇴근 하는 수가 있어요 일주일 내내
1984,쿠팡(주),6026,직원을 위한 복지가 점점 줄어들고 있어요. 쿠팡캐쉬 외 직원 명절 선물 제로. 그리고 계약직 치고 일이 너무 많아요 정규직 전환 이야기는 하는대 거의 실현 가능성 제로입니다. 사람 바꿔 사용하는 기계 소모품 느낌 정도. 네임벨류 맞지 않는 회사. 쿠팡 다녀요 오 좋은곳 다니네요? 실상은 아님
1985,쿠팡(주),6026,조직분위기가 개방적인척 꼰대분위기 라인 엄청 중요시하는 조직구조 매뉴얼 상시 바껴서 복잡함 체계가 잇는듯 없음
