,company_name,company_id,review_text
4850,쿠팡(주),6026,어느정도의 기대치를 부응하며 생활해야 한다는 점에서는 압박이 들 수 있다
4851,쿠팡(주),6026,끊임없이 일을 해야합니다. 진짜 정말 끊임없이 계속 일이 생깁니다. 필요에 따라 주말근무 합니다.
4852,쿠팡(주),6026,자유로운 동시에 불필요한 야근이 많고 조직내에서 변화가 빨라 한곳에 정착하여 일하고 싶어하는 사람에게는 비추천
4853,쿠팡(주),6026,야근이 생각보다 많아 힘이듭니다 야근없는 직장이 없겠지만 생각보다 함들었습니다
4854,쿠팡(주),6026,계약직일 경우 굉장히 빠듯하고 기계부품마냥 굴러가는 시스템에 지쳐 버릴 수 밖에..
4855,쿠팡(주),6026,모든게 단점 일단 체계도 안잡혀있고 업무처리가 유동성이 너무 심함
4856,쿠팡(주),6026,출퇴근시간이 정해져있는데 퇴근시간은 정해져있지않은듯 퇴근해야하는데 계속일시킴
4857,쿠팡(주),6026,같은 업무를 여러 팀이 쪼개서 하는 경우가 많아 커리어 쌓기에는 적절하지 않음. '너가 하고싶은대로 다 해봐' 마인드로 인한 업무 스트레스 존재. 경력직이 쿠팡으로 이직해서 오면 엄청 좋은 회사일 듯
4858,쿠팡(주),6026,어디서나 그렇지만 여기서도 사내정치가 있음. 이쪽 업계가 거기서 거기다보니 돌고 도는 사람들이 많음.
4859,쿠팡(주),6026,"공개채용이 없어서 파견직으로 들어와서 전환을 하거나 경력직으로 입사해야합니다. 팀장, 부장, 차장 등의 직급 구분이 없어서 적응하는데 어려움이 있을지도...?"
4860,쿠팡(주),6026,일이 너무 힘듬 생산일이라지만 손이 빨라야하는 사람이면 추천 그래도 단기아르바이트중에 나은거같음. 일이 힘든게 단점임
4861,쿠팡(주),6026,너무 반복적인 작업으로 1년이상 하면 같은시간을 일해도 쉽게 지친다.
4862,쿠팡(주),6026,업무의 양이 받는 임금에 비해 터무니 없이 많다고 생각한다
4863,쿠팡(주),6026,워낙 빠르게 돌아가는 조직이다보니 업무처리가 깔끔하지못함 사람이 많이 오고가서 인수인계는 당연히 제대로 없고 알아서 커야하는곳
4864,쿠팡(주),6026,상여금은 없지만 인센은 있음 다만 명절 보너스가 있지만 생각보단 적은게 아쉽
4865,쿠팡(주),6026,"너무 반복적임.. 미래가 있을까 라는 생각이 들정도, 최저임금"
4866,쿠팡(주),6026,잦은 야근으로 인한 번아웃 직원들이 많음. 수직적인 문화가 남아 있음
4867,쿠팡(주),6026,일을 체계적으로 배운다는 느낌은 없습니다. 그리고 영어를 잘하지.못하면 실무 능력과 상관없이 한계.
4868,쿠팡(주),6026,타이틀한 일처리 과정에 있어서 몸이 상하기 쉬울거 같다.
4869,쿠팡(주),6026,"젊은 꼰대가 많고, 비전을 보여주지 않은 관리자 그리고 발전이 전혀 없는 회사"
4870,쿠팡(주),6026,"칼퇴하는 사람들 정말 많은데.. 우리팀은 주말도없이 일했다.. 계약직이라서 금액은 적고, 일은많고. 또 정규직 시켜준다는 희망고문으로 사람 힘들게하는 기업"
4871,쿠팡(주),6026,계약직들은 개무시당하면서 일해야하고 구내 식당이 없어서 맨날 사먹음
4872,쿠팡(주),6026,월급이 적고 경쟁이 치열하다. 반복적인일을 계속해야된다.
4873,쿠팡(주),6026,"여러가지가 있겠지만, 채용할 때와 막상 입사했을때의 실무가 너무 다릅니다. 그리고 3개월 뒤에 정규진 전환 검토라고 쓰여있었지만 실제로는 3개월 뒤 검토는 없고 계약직으로 전환해준다고 했습니다. 그리고 18개월 근무 시 정규직 전환 기회를 준다고 하였습니다."
4874,쿠팡(주),6026,"실시간 업무현황 공유 시스템이 부족함, 인사팀 인력이 부족함"
4875,쿠팡(주),6026,연봉이 적고 완성도 보다는 많은 양의 딜을 처리하는게 우선이라 다양한 디자인을 시도하기 힘듬
4876,쿠팡(주),6026,신사업을 마니 하고있는만큼 바쁘고 정신없음 하루가 어떻게 가는지 모르겠음
4877,쿠팡(주),6026,"업무량이 너무많음, 윗사람 계속 일 시킴/ 너무 실적위주임, 일한만큼 돈이 많이 안들어오는게 제일 문제점"
4878,쿠팡(주),6026,굉장히 비효율적인 단계를 거쳐서 진행해야 했던 프로젝트가 많았음 우유부단한 경영진들
4879,쿠팡(주),6026,특정 안건에 대해서 이견이 있는 직원들에개는 다양한 업무로 직원들 보호가 안됨
4880,쿠팡(주),6026,야간 작업 및 연장근무가 많음. 업무 강도가 낮은 이유로 ㅅ일급이 적은 편임.
4881,쿠팡(주),6026,"쿠팡맨  1. 회사에서 보장되는 60분의 휴식시간을 사용할 여유가 없을만큼 바쁨. 지방은 수도권보다 좀 널널하다는 소리가 있음 2. 운전으로 이동하는 시간이외에는 10시간 근무시간 모두 달리기를 해야함. (이온음료를 안먹으면, 탈수증상이올 가능성 있으며, 꼭 주머니에 초코바를 넣고 다녀야 안쓰러짐 안그러면 당떨어저 다리 풀림, 밥먹을 시간따위는 사치) 3. 본사와 달리 각물류센터(캠프)는 캠프리더가 대통령이라 운영이 제각각, 캠프간의 표준화가 필요함. 4. 나이먹고 할거 없다고 지원하면 후회함, 20-30대 정도만 버틸 체력이 됨"
4882,쿠팡(주),6026,타사에 비해 연봉이 좋은 편이지만 업무량은 많다 합리적인 보상체계를 마련해줬으면 좋겠다
4883,쿠팡(주),6026,하루하루 달라지는 정책으로 인해 혼란스럽고 처음에는 좋은정책으로 모집하지만 나중에는 뒷통수 친다
4884,쿠팡(주),6026,"물류업 특성 상, 동료들과 보다 많은 소통의 기회(회식 등)를 갖기 어려운 구조는 다소 아쉬움."
4885,쿠팡(주),6026,업무강도의 케바케 직원의 역량 차이 심함 인성차이는 더심함
4886,쿠팡(주),6026,작업의 난이도가 매우 차이가 많이 나서 가끔 불공평 하다고 느끼느적이 있다 텃세가 매우 심하며 일부 직원들에게 모욕적인 말을 들은 적도 있다 80%아르바이트 생들이 일주일을 못 버티고 나간다
4887,쿠팡(주),6026,"외국인에 대한 고평가가 문제, 잦은 조직 변경 문제 등등이 있다. 직접 들어가 보면 암, 30자 이상 쓰라고 하는데 생각보다 없네.. ㅎ"
4888,쿠팡(주),6026,"외국인,개발자 우대하는 문화, 비합리적인 성과 평가, 보상. 겸손한 직원 복지제도"
4889,쿠팡(주),6026,그냥 전화상담하는게 힘들었음. 체계적인듯하나 분위기가 텃새 있는거 같기도하고 아무튼 그럼
4890,쿠팡(주),6026,밥이 돈을내야되고 흡연실이 지하2층에 밖에 없다 정규직되면 야근을많이한다
4891,쿠팡(주),6026,출퇴근 엘레베이터 지옥임. 사람이 너무 많아서 탈수가없음... 사내식당이 없음. 도시락을 사먹어야 하는데 너무 맛없음.
4892,쿠팡(주),6026,점심을 제공하지만 맛이 없다. 도심에서 멀어서 사먹을수도없다. 휴식 시간에 쉴만한 곳이 없다(쪼그려서 누움). 냉방이 안되서 굉장히춥다.
4893,쿠팡(주),6026,앉아서 컴퓨터만 8시간 보고 모니터링을 해야해서 눈알이 빠지는 줄 알았음 이외에는 업무가 완전 분업 체계적이라 뭔가 공장속 기계느낌이 강했음 업무 성격을 파악 못하고 입사한 나의 잘못도 있는것 같았음
4894,쿠팡(주),6026,업무 자체가 고객지원 업무이다보니 사람스트레스가 크고 인력 턴오버가 심한편. 위로 올라갈수 있거나 발전가능성은 크지 않음
4895,쿠팡(주),6026,"오후 12시전까지 주문을 하면 로켓배송이 되는데 이것떄문에 12시 이전에 필연적으로 트래픽이 엄청 몰립니다. 따라서 야근 개념이 아니라 필수적으로 야간까지 근무를 해야 합니다 (똘아가면서 순번으로 함 ) , 커머스 회사인데도 불구하고 직원들 혜택이 형편없습니다. 쿠팡 에서 사면 추가적립 말고는 아무런 혜택이 없어서 좀 황당했습니다. 외국인 개발자들 퍼포먼스가 너무 낮은데 영어만 잘하면 회사에서 무조건 우대 해주는 그런게 있습니다. 아마 오너가 자란곳이 미국이라 그런것 같음 식당이 없어서 식사시간마다 밥을 사먹으러 나가야하는데 이게 점점 하다보면 일도바쁜데 짜증납니다"
4896,쿠팡(주),6026,근무 환경에 비해 임금이 작다 기업규모에 비해 낮은 대우
4897,쿠팡(주),6026,"기업규모에 비해 박봉이며, 어느정도 이상 계급이 올라야 무난한 생활을 유지할 수 있다. 사내 정치질이 심하다보니 특별한 편이 없으면 여기저기서 남들의 뒷담화를 들어야한다."
4898,쿠팡(주),6026,시간에 쫒기며 배송을해야하며 이슈가생기는날엔 밥도먹지못하고 일을함 주말에 쉬는걸포기해야함
4899,쿠팡(주),6026,업무의 체계가 잘 잡혀있지 않고 업무방식과 기준이 자주 바뀜. 문화가 너무 개인적이라 팀원들끼리 화합이 잘 안됨. 구내식당이 없어서 불편함
4900,쿠팡(주),6026,업무 시스템이 체계화되있지 않고 서로 공유가 잘 안되 일을 두번하게되는 경우도 많음
4901,쿠팡(주),6026,"빠르게 성장하다보니 업무 변화가 많으며, 직원도 계속 바뀜"
4902,쿠팡(주),6026,비합리적인 야근제도 야근을 하는인원이 정해져잇는데 그 인원뽑는방식이 잘못됨
4903,쿠팡(주),6026,급여가 적고 젊은 꼰대가 많음 파견직은 야근수당이 따로나오지만 정규직은 아닌듯 식대 지원해주는데 5000원
4904,쿠팡(주),6026,일이 너무 힘듬 일을 하고 안아픈날이없음 나이가 좀 있다면 안하는게 나음
4905,쿠팡(주),6026,출근 및 점심 엘리베이터 잡기 너무 힘들다. 점심도 그냥 제공이 아니고 도시락이나 샌드위치를 사먹거나 밖에 나가서 먹어야한다.
4906,쿠팡(주),6026,일 못하면 바로 짤림 3일만에 짤렸음 너 아님 할 사람들 많다는 식의 마인드
4907,쿠팡(주),6026,먼저들어온사람들은 꼰대기질 있음 하지만 업무 능숙해지면 참을만함
4908,쿠팡(주),6026,월급에 비해 너무 많은 일을 소화해야하고 몸을 쓰는일이다보니 다치기 쉽다 점심은 거의 편의점으로 떼우거나 못먹는 경우가 있다
4909,쿠팡(주),6026,일을 한가지만 할수있는게 아니라 여러가지 다 시킴 그래서 한가지일을 하다가 다른일로 불려나감.
4910,쿠팡(주),6026,"사무직일뿐 공장같음. 아무리 돈벌려고 잠깐 일하는 거라지만 정말로 자기개발이나 성장 같은건 개나줘버림, 공기마시는 시간조차 아까워서 그만둠"
4911,쿠팡(주),6026,소통이 많치는 않음 가끔 머하는지 모를때가 있음 직원간 소통이 필요함
4912,쿠팡(주),6026,"아직까지 발견하지는 못했다. 하지만 일을 시키기 보다는 스스로 찾는 것이 중요하기에, 아직 익숙하지 않다면 고생할 것 같다."
4913,쿠팡(주),6026,"일반 회사 처럼 직장 상사는 캐바캐입니다. 휴가도 은근 눈치 보이고, 그렇지만 상사가 누구냐에 따라 다릅니다."
4914,쿠팡(주),6026,적자연속이라 그런지 연봉이 높은 편이 아님 상여금도 거의 떡값 수준 경영진들부터 위계질서 없는 편이라 대체적으로 평등한 분위기 잘 갖추어져 있음 서로 영어이름 부르긴 함 정말 신입이나 막내들이 편하게 아무 생각 없이 다니기 좋긴 한데 손이 모자라서 일 열심히 잘하면 일감 많이 쌓아줌
4915,쿠팡(주),6026,신입들은 적응하기 너무 어려움 점심메뉴 맨날 똑같음 좀 다르길 원함 실적 너무 챙김
4916,쿠팡(주),6026,업무량이 많아 종종 비효율적으로 느껴질 때가 있습니다.
4917,쿠팡(주),6026,업무가 비교적 단순함. 물경력이 될 수 있음. 계약직만 뽑고 정규직 전환이 어려움. 주 5일 근무제라 주말 출근은 피할 수 없음. 인센티브 제도가 없어 일에 대한 보상을 받지 못함.
4918,쿠팡(주),6026,계속 새로운 프로모션으로 키워나가다보니 프로세스가 자주 바뀌는게 적응하는데 힘들 수도 있음
4919,쿠팡(주),6026,아무리 보고를 올려도 달라지지 않음 -> 숫자로 결정내림 시간땜에 스트레스
4920,쿠팡(주),6026,파견직이라 환경상 배제되는 느낌도 많고 잡일이 많아서 힘들었음
4921,쿠팡(주),6026,임원이 다 외국인이며 업무가 빡센편이다ㆍ적응하면 할만하다고 본다ᆢᆢ 보고서 쓰는거 많으며 복리후생이 별 로없음 ㆍ
4922,쿠팡(주),6026,"단, 레벨 7이상은 외국인이 대부분이기 때문에 진급에 한계가 있는 것 같습니다. 외국인과 한국인 중국인끼리의 정치가 심한 편입니다."
4923,쿠팡(주),6026,일자체가 너무 힘들고 간단한 일이면서도 일이 너무 많았다
4924,쿠팡(주),6026,근무지가너무 오지에있고 위계질서가 없다보니 나이많은게 장땡이라고생각하는사람이많다
4925,쿠팡(주),6026,"힘의 권력에 의해 줄서기로 승진이 이루어지고 있고, 개인의 역량 개발에는 관심 없다."
4926,쿠팡(주),6026,단순한 업무만 진행하였습니다. 직급이 높아지거나 경력 쌓이면 업무확장 가능하리라 생각합니다. 저는 크게 욕심이 없어서 퇴사하였습니다
4927,쿠팡(주),6026,"정얼말 리더 맘대로임 . 시대가 바뀌는 만큼 리더 교육도 조금 더 해줬으면 좋겠다. (상명하복 ,수직적구조, 희생정신, 워라밸은 말도안된다고 생각하는 꼰대아저씨 리더일 경우)일을 오너쉽 갖고 해야지 사람을 오너마인드?라는 명분하에 막 굴리는것은 말도 안됨. 의욕을 떨어뜨림. 노예, 소처럼 일하라고 소리지르는건 어느시대 발상?"
4928,쿠팡(주),6026,"승진에 대한 고민이 많이 드는데, 쉽게 승진하기는 어려울 것 같다는 생각을 함. 근데 이건 기업의 단점이라기보다는 경영사무직에서는 공통으로 나타나는 문제인 것 같음"
4929,쿠팡(주),6026,"전 파트타임인데, 정규직 직원들 말 들어보면 부서 별 연봉차이 많이 나는걸로 알고있어요"
4930,쿠팡(주),6026,잦은 조직개편 숫자 조직만 쪼는 현상 (어디는 꿀 어디는 헬)
4931,쿠팡(주),6026,고객들 클레임과 모든 짜증과 불만을 인내심을 갖고 들어야한다 친절한 고객들도 있지만 인바운드다 보니 매우 힘듬
4932,쿠팡(주),6026,단점은 쉬는시간이 점심시간밖에없다는거 특히 여름엔 더워서 죽을맛
4933,쿠팡(주),6026,좁은 생태계 적자구모 두가지는 앞으로 개선해야할 문제점이며 개선에 큰 무리가 업싣고 보여짐
4934,쿠팡(주),6026,"원격근무지의 관리자(캠프 co)의 아쉬움,  수준미달의 쿠팡맨들이 다수 존재함으로 그들만의 이상한 문화가 형성 되어있음.  또한 계약직, 정규직의 차별이 심함."
4935,쿠팡(주),6026,"의사결정의 기준 = 대표 기분 의사결정 기준이 그렇다보니 무의미하고 소모적인 일을 많이하게됨 목적의식, 주도적으로 일을 하다가도 다음날이면 사업방향 달라져있음"
4936,쿠팡(주),6026,"단순작업이 많았고, 수시로 바뀌는 업무, 계약직이 너무 많아 빨리 그만두는 사람들도 많았음"
4937,쿠팡(주),6026,밤시간대에 일해서 피곤할 때가 많고 불규칙적인 생활을 하게됨
4938,쿠팡(주),6026,먼지가 많이 날리는것때문에 여름에도 마스크를 착용 후 일해야됐습니다..
4939,쿠팡(주),6026,"-내가 한만큼 성과를 열심히 보여줘야하며, 동기임에도 불구하고 그것에 따라 진급의 차이가 날 수 있다. -부사마다 다르지만 파견직이나 계약직이 많아 2년 이상 오래 다닌 사람이 드물다. -정규직전환이 바늘구멍이다"
4940,쿠팡(주),6026,업무량이 너무 많아 자유로운듯 하지만 자유롭지 못하여 워라벨이 힘들다
4941,쿠팡(주),6026,일단 일이 많아서 좀 힘든 부분도 있음 물량은 쏟아 지는데 인원은 없고 처리 할 사람도 부족하고 예고 없이 연장이나 특근이 있는 경향이 있음
4942,쿠팡(주),6026,"물류 현장 퇴사율이 많아서 그런지 일이 많음. 관리직으로 분명 지원했는데 소분, 청소, 짐나르기, 주차안내, 플라스틱 박스 정리 등 노가다 멀티플레이"
4943,쿠팡(주),6026,일단 복지는 말할 필요도 없다 이런 복지시스템으로 직원들이 남아있는것도 신기. 숫자에 미친느낌? 보여지는 숫자에만 연연해서 무조건 적으로 지르는 느낌이다 한국인 직원들은 공장의 기계같은 취급을 하는 느낌
4944,쿠팡(주),6026,복지제도 전혀 없다. 최저임금 주면서 등급나눠서 평가한다.
4945,쿠팡(주),6026,"연봉이 적고, 일의 강도도 적지만 대체적으로 근무시간이 길어 짜증나는 편임."
4946,쿠팡(주),6026,"우선 회사와의 소통이 잘 안되고, 일반 택배처럼 몰락하는중. 그리고 급여를 많이받기위해 근속년수가 제일 중요해짐. 버텨야 되지만 일의 강도가 녹녹하지않음."
4947,쿠팡(주),6026,"외국인이 많음 부서장이 외국인이면 조금 힘든점이 많음 의사소통, 등등등"
4948,쿠팡(주),6026,외국어 능력을 너무 많이 중시. 외국인 관리자가 대부분이라 왠지모르게 한국인 역차별이 느껴짐.ㅎㅎㅎ
4949,쿠팡(주),6026,월급이 가끔 밀려서 들어옴.늦게들어오는 사유 일절 공지없음.업무에 대한 스트레스가 심함
4950,쿠팡(주),6026,변화가 끊임없이 시도되어 한가지 루트에 정착햇다싶으면 또 변하고 정착하면 변하고 적응하는데 힘든점이 잇음 일의 강도가 날이 갈수록 쌔짐 데이터기반 시스템이라서 현장과 조율이 안되는점
4951,쿠팡(주),6026,부서별 조직장들의 고착화 (암묵적 순번대기) 몇몇 조직장들은 야근을 분위기로 강요. 인간미 or 정감을 기대하기엔 본인들 성과경쟁으로 팀원들 압박이 심하다. 회사의 커진 규모대비 복지가 좋지 않음 야근비 없음
4952,쿠팡(주),6026,(신사업의 경우) 아직까지 체계가 잡혀가는 과정에서 변동/애로사항들이 많음.
4953,쿠팡(주),6026,스트레스 심하고 복지가 별로다 월급은 일에 강도에 비해서 현저히 적음
4954,쿠팡(주),6026,줄을 잘서야함 기존 직원과 기업이 성장하며 데려온 직원의 눈치싸움이 있었음
4955,쿠팡(주),6026,팀원분배가 잘 안되는게 아쉬웠습니다 큰 기업인만큼 체계적으로 하면 좋을것같아요
4956,쿠팡(주),6026,기업이 어린만큼 무질서한부분도 있는것 같음ㅎㅎ 별로인게 너무많아서
4957,쿠팡(주),6026,변화가 너무 잦고 타겟이 많음.. 이것도 저것도 다 챙겨야 하는 슬픈 스타트업 ㅠㅠ
4958,쿠팡(주),6026,일이 많을때는 많지만 야근이 잦아요 업무 특성상 다르지만 배우고 발전 할 수 있다는 생각이 안듭니다
4959,쿠팡(주),6026,비슷비슷한 작업을 하다보나 약간 지겨운 느낌이 있음..
4960,쿠팡(주),6026,영어가 본인에게 허들이라면 회사에서 허들을 느낄 것입니다. 더불어 한국 정서와 맞지않는 기업문화가 낯설것입니다
4961,쿠팡(주),6026,너무 다양한 사람들을 마구잡이로 채용한 대가가 눈에 보임
4962,쿠팡(주),6026,현장 내 에어컨이없어 덥습니다. 이직율이 높아 동료끼리 정을 주고받기 힘듭니다.
4963,쿠팡(주),6026,지금은 어떤지 모르지만 쿠팡 정도의 회사에 구내 식당이 없었음 점심으로 사내 도시락
4964,쿠팡(주),6026,계약직 해지 및 정직원이 되기 힘든 구조. 갈수록 물량이 늘어나 쿠팡맨이 하루 160가구 280기프트 이상 배송하는 일이 다반사.
4965,쿠팡(주),6026,비효율적인 업무체계. 언젠가는 무너질것만 같은 젠가쌓기 일처리방식은 과연 어떤결과가 나올까.. 밥맛없음 연봉 업계 최악
4966,쿠팡(주),6026,"실적 싸움이 강하고, 매번 면담을 하는데 실적이 좋지 않으면 퇴사를 할 수도 있음."
4967,쿠팡(주),6026,정규직과 비정규직 차별이 좀 있음 잦은 인사이동과 대표가 시키면 무조건 진행
4968,쿠팡(주),6026,밥먹고 일하는사람이10%도 안될껍니다 이건 장담할수있음
4969,쿠팡(주),6026,고객 전화가 너무 많고 바쁩니다. 택시비 지원은 어쩌면 당연한걸수도ㅠㅠ
4970,쿠팡(주),6026,하는것에 비해 월급이 상당히 짜고 밥을 먹긴 먹는데 먹는 시간이 너무 없다 쉴 시간이 너무 부족하고 날이 가면 갈 수록 물량이 늘어남
4971,쿠팡(주),6026,"회의만 하루종일. 점심 먹기전과 먹은후, 어제와 오늘 매번 바뀌는 업무. 윗사람도 자기가 멀해야하는지 모르는듯하다. 결국 콜업무시킬거면서 업무를 왜 포장한건지? 위메프보다 못한 수동기업. It기업이라고 하지말자ㅜㅜ."
4972,쿠팡(주),6026,중국인 CTO가 불러들인 중국인 관리자들 속에 인종차별과 온갖 정치질이 난무함
4973,쿠팡(주),6026,힘들다 힘들다 몸이고되다 나할때 330개씩배송하다 다쳐도배송
4974,쿠팡(주),6026,정리안된다. 뭔 쓸데없는 면접담계만 만고 불필요한 소통이 많다
4975,쿠팡(주),6026,주6일 근무하셔야하고 로테이션과 쉬프트를 돌지만 꽤 피곤합니다 물론 돈만보면 크게 단점이 아닐수도 있는데..또 진상고객들도 가끔 있어서 이 부분이 되게 힘들게 느껴질수있겠네요
4976,쿠팡(주),6026,딱히 복지랄게 없다. 업무 프로세스가 없으며 상사 잘못만나면 발전이 없다고 느껴질듯
4977,쿠팡(주),6026,"탑티어의 경우 모두 외국인으로 이루어져있으며, 경력이 오래 쌓더라도 꼭 승진이 보장되지 않음. 또한, 평가에 대해 높게 평가받기 어려운 평가구조를 가지고 있음."
4978,쿠팡(주),6026,아무래도 성장기에 있기때문에 오늘과 내일이 다른 룰 때문에 외부 커뮤니케이션이 힘들다
4979,쿠팡(주),6026,실적이 낮으면 인사고과에 반영되고 그 인사고과는 자연스레 연봉과 연결되는 만큼 모든 고객에게 친절하게 행동해야합니다 이게 불친절 누적이 쌓이고 쌓이면 결국 인사고과가 낮아주고 최후에는 정리가 되버려요..어찌보면 감정노동이 심하다고 볼수있네요
4980,쿠팡(주),6026,크게 없긴 하나 개인적으로는 거리가 멀다는 단점이 있었음. 분위기와 노력에 비해서 연봉이 적다는 것은 단점입니다.
4981,쿠팡(주),6026,단순반복업무라 지루할 수 있음. 그래도 업무가 힘들거나 스트레스 받는 일은 없었음. 조직변화가 빠른편
4982,쿠팡(주),6026,아무리 좋은 기업으로 포장해놓아도 결국은 콜센터 업무 제대로된 직무 설명없이 입사했다 후회하고 퇴사하는 사람이 80퍼
4983,쿠팡(주),6026,"단점은 딱히 없음..계약직은 계약직끼리 업무를 봐서 눈치가 안보이지만, 어수선한 분위기가 있음"
4984,쿠팡(주),6026,물류쪽 몸자체가 힘듬 물량 터지는날은 쉴세없이 바쁘고 피곤한하루
4985,쿠팡(주),6026,인사이동이 너무 잦고 승진 가능성이 적다. 라인을 잘 타야 승진 가능함. 급여가 짜다.
4986,쿠팡(주),6026,1.단순히 포토샵 툴만 할줄 알면 가능한 작업을 굳이 디자인경력직과 디자인전공자를 뽑아야하는지 의문이 듬 2.팀내부 분위기도 어둡고 업무적 커뮤니케이션이 원활하지 않음 3.관리자는 본인 승진에만 관심이 있고 사람관리 하려는 모습이 보이지 않음 4.좋아하는직원 안좋아하는 직원 사람대우 차별 심함 (기준없음 그냥 싫으면 싫은사람) 5.업무능력떨어져도 싫은사람(싫어하는사람한텐 인사도 안 받아줌)
4987,쿠팡(주),6026,"부서마다 차이가 있지만, 개인의 삶을 존중받기 어렵습니다. 개인의 상황이나 일상적인 부분 보다는 당장 비니지스의 방향과 속도가 우선시 되는 경우가 상당합니다."
4988,쿠팡(주),6026,고객에 대한 서비스를 강조하는만큼 내부고객(쿠팡맨)에 대한 서비스도 제공했으면 합니다
4989,쿠팡(주),6026,커머스 기업인 만큼 업무량도 많고 야근이 있는 편. 업무 외적의 일을 시키지는 않지만 다소 많은 양의 일들이 주어지고 업무의 가이드가 자주 변동됨.
4990,쿠팡(주),6026,식당 없어서 도시락(4500) 먹음. 파견직부터 시작시 너무 적은 월급. 소모품같은 느낌.
4991,쿠팡(주),6026,쿠팡맨들은 2년 계약직 신분으로 있다가 정규직으로 전환되는데 그 비율은 높은 편은 아닌 것 같다. 정규직으로서의 범위를 조금 더 넓혔으면 좋겠다.
