,company_name,company_id,review_text
3368,쿠팡(주),6026,효율적인것처럼 업무를 진행하지만 비효율적인 제도가 무긍무진하다.
3369,쿠팡(주),6026,"주먹구구식 운영, 능력없는 상사들과 프로모션의 기준 또한 편파적이고 이상함"
3370,쿠팡(주),6026,근무 환경 갈수록 열악(물량이 많아짐) 인센티브 축소 규모에 비해 주먹 구구식
3371,쿠팡(주),6026,파트별로 상이하겠으나 업무량이 많을 때는 정신이 없음 딱히 단점은 없음 > 파트별로 상이
3372,쿠팡(주),6026,B2C가 매출의 80퍼 이상으로 장기계획 수립이 불가능한 구조이기 때문에 불매 세게맞으면 GG
3373,쿠팡(주),6026,"1. 목표를 달성하면 곧바로 그 이상의 목표를 무리하게 계속 요구하며 달성하지 못할 경우엔 본인에게 책임을 물리는 분위기. 실적을 채우지 못할 경우엔 개인 연차를 소진해서라도 목표치를 채우라는 중간관리자 등 현실성이 없는 목표를 내놓으며 '부진자' 라는 타이틀로 압박함. 2. 주먹구구식으로 문제가 터져야 돌아가는 시스템. 점주가 불만사항이 있더라도 처리가 불가하다면 제대로 된 보상 프로세스도 없어 묵인되는 현실. 3. 이곳의 영업사원은 영업사원이 아니다. 계약서만 작성하면 계약자와는 연락도 모두 차단하고 나중에 문제가 발생하더라도 모르는 일이라며 상쇠, 상부에서는 계약 건수만 잘나오면 전혀 문제없다는 식으로 오히려 우수사원이라는 대우를 해줌. 이러한 방식으로 실적 우수자들은 모두 챙길만큼 챙기다가 차후 일이 크게 터지거나 본인 마음에 안들면 바로 정리하는 스타일. 4. 군대같이 수직적인 분위기가 특징. 회식자리에서의 술 강요는 기본이며 그러한 인지도를 쌓지 못하면 프로모션(승진) 기회도 없기 때문에 매니저급 라인과 어떻게든 해보려고 옆에서 충신마냥 따라다니는 사람들이 대부분. 시국이 시국임에도 불구하고 계속되는 회식지라와 술강요, 8,90년대 영업부 분위기라 해도 전혀 과언이 아니다."
3374,쿠팡(주),6026,1.시스템이 없음 2.직원을 소모품처럼 여기는게 느껴짐 3.업무속도가 너무 빠름 4.부서에 따라 대기업의 단점과 스타트업의 단점이 동시에 나올 수 있음
3375,쿠팡(주),6026,쉬는시간이 좀 부족하다 좀도 줬으면 한다
3376,쿠팡(주),6026,업무공유를 잘 되었으몀함 다 결정되고 나중에 결과를 알수있음
3377,쿠팡(주),6026,작업 절차가 복잡하며 서로간의 신뢰가 필요함 또한 직원들간의 문제에 과할정도로 폐쇄적임
3378,쿠팡(주),6026,그냥 진짜 힘들고 계속 눈치주고 힘들어죽음.ㅠ 몸살을 얻을수있음
3379,쿠팡(주),6026,비개발 직군에게 너무나도 낮은 연봉. 계약직에서ㅜ정규직으로 전환이 되도 낮은연봉.
3380,쿠팡(주),6026,"외국인들이 많은데 인도 얘들은 최악, 현실과 이상의 gap이야 어디든 있겠지만 참 현실을 직시하지 못하는 경영진"
3381,쿠팡(주),6026,"외부에서 바라보는 이미지가 거지같다. 탑다운 제대로다. 외국인들에 의한 강점기다. 자기개발의 끝판왕이지만, 반대로 그만큼 나를 많이 괴롭힌다."
3382,쿠팡(주),6026,한국인 차별이 존재한다고 많은 이들이 느끼는 듯. 경영진도 다 외국인. 일이 어마무시 많음
3383,쿠팡(주),6026,물량이 많아 힘든부분은 분명하게 있음. 그로인한 잔업의 유무도 확실하게 많음
3384,쿠팡(주),6026,"지금도 그런지는 잘 모르겠습니다. 개발자와 비개발자의 대우가 극심하게 차이가 납니다. 그리고 경력 입사자들이 많은데, 분열이 많습니다. 직급 파괴라고 했는데 경력 입사자들은 이전 직장의 직급을 쓰는 경우가 많았습니다. 그리고 비개발자 대우가 안좋다 보니까 금방 나가고 또 금방 들어옵니다. 그러니 업무 연속성도 저하됩니다. 프로젝트 진행 중에 담당자가 자주 바뀌는 것을 보았습니다."
3385,쿠팡(주),6026,복지제도가 다양하지만 쓸모 없음. 인력이 대체가 많이 됨. 각박함. 그래프로 순위매기고 그럼.
3386,쿠팡(주),6026,"모든 직원의 보상이 심하게 다르다. 기존 재직자들의 연봉이 낮고, 신규 경력직의 능력이 더 안되는데도 보상은 훨씬 크다."
3387,쿠팡(주),6026,외국인들의 의사결정으로 인해 한국식 정서로는 이해가 안될때가 있다. 계약직은 계약직.
3388,쿠팡(주),6026,복지는 거의 전무하다 보면되고 턴오버가 높은 곳이죠. 직원이자 휴먼으로 존중 받는 분위기는 아닌듯
3389,쿠팡(주),6026,특수 채용 건임에도 불구하고 노멀한 포지션 수준의 업무 역량을 원하는 듯.
3390,쿠팡(주),6026,단순사무보조. 하다보면 내가 사람인지 기계인지 혼동이 올 정도. 돈이 너무 적다.. 이월급에 일은 또 얼마나 쪼아대는지.. 그놈의 생산성타령. 돈더주면 더하겠다만 이월급으로 글쎄..?
3391,쿠팡(주),6026,매니지먼트가 데이타 기반의 결정을 많이 하지만 조직원들에게 설명이 부족하기도 합니다.
3392,쿠팡(주),6026,대부분의 콜센터 업무가 그렇겠지만 특히나 이곳은 직원 본인이 기계처럼 느껴지게 하는 대우를 많이 함. 공고에는 단순 상담 이라고 되어 있으나 그 단순 상담의 업무량이 어마어마함. 매일마다 업데이트되는 이슈가 상당하며 전화받는 업무시간중에도 방대한 량의 업무테스트를 자꾸 풀게함. 여차해서 관리자 잘못 만나면 연차쓰는것도 기약이 없음..등등
3393,쿠팡(주),6026,"외국계인데 한국에 있음, 너무 자주 파격적임, 능력있는 사람보다 쓰기 좋은 사람이 승진한다는 사실을 알게해준 회사, 결국 회사는 거기서 거기라는 사실을 알려준 회사 법령만 칼같이 지킴"
3394,쿠팡(주),6026,워라밸이 팀바팀 체계가 부족하다 복지가 부족하다 성과 리뷰가 국내 기업들에 비해 너무 칼 같음 (상위는 비슷한 것 같은데 하한에 대해 무자비) 외국인 우대
3395,쿠팡(주),6026,오래 다닐 곳으로는 추천하기 어려워요 업무의 책임이 너무 강해서 워라벨을 중요시한다면 생각해 보세요
3396,쿠팡(주),6026,"자유로운듯 하나 다들 바빠서, 업무 인수인계 제대로 되지 않고, 인턴/ 계약직은 은연중에 하대하는 듯한 분위기 있고, 물 경력 될 수 있으니 주의하시면 좋을 것 같습니다. 특정 부서에서는 텃세 있을 수도 있습니다."
3397,쿠팡(주),6026,요구하는 스펙에 비해 연봉이 매우 적으며 인간 톱니바퀴가 된듯한 느낌을 버릴수가 없음
3398,쿠팡(주),6026,일이 너무 쉬워서 사무직 공장같음 반복적이고 배울수 있는게 딱히 없음
3399,쿠팡(주),6026,리더(디렉터급)에 과도한 권한이 있어 복종이 필수인 분위기 복지는 없음 재택 근무로 인한 불통과 오해 대기업으로 가는 길목에 필요한 인사제도의 불충분과 여러가지 컨펌/보안 절차의 까다로움
3400,쿠팡(주),6026,너무 영업위주로 굴림 목표액 못맞추면 엄청 쿠사리먹음
3401,쿠팡(주),6026,전형적인 수직문화 군대문화 개인의 성장하긴 힘든 조직입니다~~~~
3402,쿠팡(주),6026,비즈니스 매너가 부족하며 업무 처리가 느림 쓸데없는데 회의를 소집하고 결과는…항상 최선이 아닌 차선을 선택하는 느낌
3403,쿠팡(주),6026,너무 자주 바뀌는 프로잭트라서 지난주에도 뭘 했는지도 기억안남
3404,쿠팡(주),6026,가끔 오래다닌 이상한 사람들이 있다 지금도 그런지는 잘 모르겠다
3405,쿠팡(주),6026,"상당히 정치적, top down이 강한회사. 일 강도에 비해 급여가 짬.."
3406,쿠팡(주),6026,출퇴근 시간 엘리베이터 아직도 그런지 모르겠지만 너무 사람이 많아 이용하기 힘들었음
3407,쿠팡(주),6026,워라벨 붕괴 그 자체. 퇴근 시간 이전 이후 업무 지시 미팅 등등등
3408,쿠팡(주),6026,"회사에서 주는 복지가 전혀 없음 마스크 주는것밖에 핸드폰지원비, 회사콘도 리조트, 기타 할인 관련 내용 복지서비스 부족"
3409,쿠팡(주),6026,업무 성과의 압박이 큰 편입니다. 같은 직원들끼리 랭킹 순위를 따져가며 빠른 시간 내 최대 효율을 끌어내는 방식은 개선해야 할 필요가 있다고 생각합니다.
3410,쿠팡(주),6026,출근할 때마다 엘리베이터 지옥 그리고 생산성 지옥.....
3411,쿠팡(주),6026,외지인이 오면서 알맹이없이 라인타고 넘어온 매니저들. 사바사바로 먹고사는 암덩이들이 생겨남. 이러다 똥되는건 시간문제
3412,쿠팡(주),6026,탑다운으로 결정번복하는점. 플렉스 타임 출근이라고는 하나 부서에 따라걍 출퇴근 시간 고정인곳도 있음. 부서별로 워라벨 편차도 꽤 클수있음. 워낙 외국인 디렉터들을 많이데려와서 내부 승진 가능성이 높은것같지않음.
3413,쿠팡(주),6026,업무량이 너무 많은데 사람은 많이 안뽑고 뽑아도 퇴사하는 사람이 많음 10명이 들어오면 두세달이면 세명만 남고 금방 그만둠. 정규직 전환이 극히 어려움 일 잘하는것 보단 상사 비위를 잘 맞추고 타이밍을 잘 맞춰야되며 상사보다 경력이 많으면 안됨
3414,쿠팡(주),6026,같이 일하는사람들과의 어려움 계속 서있어야함 휴게시간 한방에서 다같이 쉬는데 너무 휴식공간이 부족함
3415,쿠팡(주),6026,"애매한 평가시스템, 물류 외 지원 시스템은 별로이며 월급 루팡들이 곳곳에 있어 의욕이 안 날때도 있음"
3416,쿠팡(주),6026,연봉이 높은 편은 아니다. 인상률 또한 그렇다. 일이 고되다
3417,쿠팡(주),6026,혼자 시작하다보니 답답한 부분도 있었음. 물건만 내놓고 가버리니까 뭐 물어보기도 어려움.
3418,쿠팡(주),6026,"업무진행, 의견 수렴의 과정이 복잡하다. 다문화, 다국적 기업이라 그런지 소통이 쉽지 않다. 부서가 다양하고 복잡하여 업무 구분이 애매하다."
3419,쿠팡(주),6026,혹시라도 리쿠르터가 굉장히 달콤한 말로 입사를 유도하면 기억하자 여기는 아니라는걸 정규직 전환 안됨 돈은 적게 주고 최대한을 끌어내려고함 절대 대기업아님 개발자는 조금 다른 것 같음 여튼 개발자 아님 도망가
3420,쿠팡(주),6026,오르지 않는 연봉..업무에 비해 짠 월급 업무 농도 매우 높음. ㅠㅠ
3421,쿠팡(주),6026,부바부가 심할것 같음. 물론 정규직 전환을 바라고 입사하였지만 실패. 정규직되는 사람이 있고 아닌 사람도 있고 그런듯...
3422,쿠팡(주),6026,"연봉이 아주아주 작음, 아주 큰 단점으로 모든 장점을 가림"
3423,쿠팡(주),6026,수직구조가 아닌 수평구조 하룻밤사이에 달라지는 규정 계약직들은 그냥 욕받이
3424,쿠팡(주),6026,"업무프로세서가 확실히 구분되지만, 당당업무에대한 책임만큼 권한이 없음"
3425,쿠팡(주),6026,"연차 자유롭다고 하지만 그것도 부서마다 다름. 일단 연차를 막진않으나 애초에 일은 엄청많은데 대체 인력이 없어서 쉬고싶어소 못쉼. 나 퇴사때까지 돈으로 환사된연차 다합치면 연차 45개더라,,,근데 내주변도 연차 계속 쌓고 못쉼.  그리고 진짜 사람시달릴정도로 업무재초 심함. 두시간정도 걸릴수있다고 했는데도 15분마다 혹시 다됐나고,언제 줄수있냐고 수차례물어봄.  그리고 정말 지독하다 느낄정도로 월급이 짬. 거의 대기업중에 최저라고 생각함 그렇다고 인상률이 높은것 같지도 않고...  그리고 이건 우리부서가 좀 심햇던거같은데...어차피 한배에 탄거 서로 업무 정보 공유하면서 일을했으면 좋겠는데 점말 공유안하드라...같은 부원끼도 자기만 알구자기만 돋보이려고 하는데 몇년이 지나도 이게 정말 이해가 안됨"
3426,쿠팡(주),6026,너무 많음 셀수 없음 일은 더더더 시키는데 월급 몇년째 동결
3427,쿠팡(주),6026,휴가에 자유가 없으며 사람에 따라 업무강도가 다소 높다고 생각될 수도 있음
3428,쿠팡(주),6026,연봉이 복지라는데 글쎄.. 복지가 너무 없다 너무 고객중심이다. 직원은 고객이 아니라는게 함정?! 탑리더십 내부 소통이 부족한듯 모든게 너무 자주 바뀜
3429,쿠팡(주),6026,쿠팡맨을 기계의 부속으로 생각을 하며 캠프장이 자기 마음대로 할려고 하며 근무자의 휴무를 이야기도 없이 변경하여 인사평과를 안좋게 만들며 나몰라라 하는 일이 대다수
3430,쿠팡(주),6026,단순 노동을 계속적으로 하다보니 육체적인피로가 많이 온다. 분위기가 그렇게 밝진않고 무거운 느낌이 많이 든다.
3431,쿠팡(주),6026,"급여,계약직이 대부분, 단순 업무, 체계가 잡히지 않음"
3432,쿠팡(주),6026,"재택근무인줄 알고 지원했으나 합격 후 첫 출근일에 모니터 2대, 본체, 그외 필요부품을 가지고 가야한다는 얘기를 들음. 택시비를 준다고는 했으나 매우 당황스러웠음. 당연히 노트북일거라 생각했는데 컴퓨터라니.. 무게도 엄청나고 랜선도 직접 구매해야 한다는 점이 이해가 안됐음. 사전 공지 필수여야할 부분인데 실망"
3433,쿠팡(주),6026,사람을 기계 부품으로 봄 누구든 맞는 부품을 갈아끼우면 된다고 생각함 극단적 경쟁사회의 표본
3434,쿠팡(주),6026,"뭐...다들 그렇듯 정규직/계약직 구분이 확실. 명절 선물도 다르고 애초에 업무지원정도의 일이라 뭘 배우는 것도 아님. 계약직>정규직 전환은 꿈도 못 꿀 일인데, 쿠니로 정규직 입사 후 점프하는 경우는 왕왕 있다고 들음."
3435,쿠팡(주),6026,동종 업계 대비 복지수준이 매우 떨어짐. 비개발에 대한 복지가 없음 업무시간의 경계가 없음. 자율출퇴근제이긴 하나 새벽부터 새벽까지 일하는 근무환경
3436,쿠팡(주),6026,1. 주어진 업무가 많을 수 있으니. 수행하면서 효율적으로 일하는 법을 배웁니다. 2. 회식이 뜸합니다(술 강요는 없지만 회식을 좋아하는 직원들은 조금 슬픕니다.)
3437,쿠팡(주),6026,빠르게 바뀌다보니 이랫다 저랫다하는 경우가 많음 대부분 경력직이다보니 다들 지잘난맛에 사는듯 영어못하면 위로 못올라감 라인잘타면 퇴사했다가도 다시 넣어주고 레벨올려줌ㅋㅋㅋ
3438,쿠팡(주),6026,나가라고 등 심하게 밀어줌. 목표 못 채우면 늦게까지하세요.
3439,쿠팡(주),6026,근무환경 열악. 물류센타내 코로나사태 확진자다수발생이 이유가있음. 작업관리자 잘못 만나면. 그날 너무 고생함. 물류센타일은 체력많이 소모되므로 하루다녀오면 병나기도함.
3440,쿠팡(주),6026,신발이 불편함 그리고 시끄럽고 안정성이 떨어진다. 일을 조금더 친절하게 알려주고 일하면 좋겠다.
3441,쿠팡(주),6026,일 자체에 강압적인 느낌을 주는 것이 있음. 상하 관계에 불편함을 느끼기도 함. 휴게 시간을 자유롭게 사용하지 못한 적이 있음
3442,쿠팡(주),6026,쿠팡 물류 아르바이트 형식으로 해서 단순노가다 물류 일을 맡았는데 저에 대한 성장성을 못느꼈습니다..
3443,쿠팡(주),6026,몸을쓰는일이기에 쉬는날축처짐 대신 주5일이기에 내일만한다면 시간은금방감
3444,쿠팡(주),6026,자유로운 연차라 하는데 캠프에선 배송직이나 자유롭게 연차쓰지 관리직들은 눈치 봐가면서 휴무 일정 조율 다 하면서 연차 써야함 수평적인 문화? 가 맞나 싶을 정도로 이상한 군대문화가 개입됐는거 같은 분위기
3445,쿠팡(주),6026,외국인과 일해야한다. 성장이 최우선이지만 생각보다 보수적인 측면들이 보인다.
3446,쿠팡(주),6026,본인의 역량에 따라 근무시간이 달라 지는것과 근무 환경이 썩 좋진못합니다.
3447,쿠팡(주),6026,계약직의 경우 숫자로 평가됨으로 일하는 로봇인지 생각 드는 경우가 많다. 단순반복적인 일을 하게 됨으로 경력을 쌓는다는 느낌도 들지 않아서 다들 회의감이 들어 퇴사하는 경우가 다반수
3448,쿠팡(주),6026,체력적으로 너무 힘듦 대부분 이삼일하고 안나옴 계속 걸어야하며 잠시라도 쉴 수 없다
3449,쿠팡(주),6026,유독 용인쿠팡 사람들 중 이상한 사람들이 많았고 남의 일까지 내가 하는 상황들이 많았음 불만을 이야기해도 달라진건 없었고 이해하라는 식 답답한 사람이 일 더하는건 어딜가나 똑같아도 여긴 유독 심함 알아주는것도 아니고 도 맡아서 하다가 그냥 내 일이 되어버리는 경우가 많음
3450,쿠팡(주),6026,어딜가나 사람때문에 힘든건 매한가지. 폭증하는 물량에 쿠팡친구들 많이 힘듬. 계속적인 혁신을 추구한다고는 하나 그저 사람 갈아넣어서 하는것 밖엔 없음 대외 광고에서 말하는 쿠팡에 속지 마시길. 실상은 이미 뉴스에 나온대로 보고 믿으면 됨
3451,쿠팡(주),6026,"평가제도, 설문조사 등이 많아 실적에 압박을 느낀다. 정신적으로 스트레스 받는 업무이다보니 정신적으로 직원의 복지를 챙길수 있는 제도도 있었으면"
3452,쿠팡(주),6026,일의 강도가 너무쎈데 비해서 시급이 너무 낮다. 전반적으로 비추천
3453,쿠팡(주),6026,필드지원 전무 매일 바뀌는 인센 그리고 허들 수평이지만 수평적이지 않음
3454,쿠팡(주),6026,18년도 기준)고객이 갑이었다. 근무시간 내에 cs전화를 받는데 잘못 걸리면 몇십분씩 붙들렸다. 그런날은 근무시간내에 CPH가 저조할 수 밖에 없는데 이 점은 이해를 해줬으면 좋지 않았을까 싶다. 그외에는 전혀 불만 없던 곳.
3455,쿠팡(주),6026,복지 없음 가이드라인 없음 소통이 잘 안되는 느낌 주먹구구식
3456,쿠팡(주),6026,계약직이다보니 돈이 세지 않고 연차도 편하게 신청 가능하나 눈치를 보게 되긴 함...
3457,쿠팡(주),6026,"한번 들어오면 끝날때까지 나갈수 없음. 산골이라서 좀 무섭고, 노동이 힘듬. 하다가 도망칠까 생각해도 산골이라서 버스 아니면 나갈수가 없음"
3458,쿠팡(주),6026,속도와 성장을 중시하는 분위기라 소프트웨어 퀄리티는 보장 못함 Office 365말고 GSuite 쓰면 좋겠다
3459,쿠팡(주),6026,외국인들을 위한 회사임. 한국인들은 그를 뒷받침 하는 노동자.
3460,쿠팡(주),6026,it는 아니고 열악한 노동자환경 개선필요할듯 과도한 업무량에 뉴스가 많이 나오는편이니까 이런 부분 고쳐야죠
3461,쿠팡(주),6026,"정말 빠르고 자주 변화하며, 조금만 게을리 처신하면 뒤처지고 올라갈수가 없다"
3462,쿠팡(주),6026,이기주의가 심하다 몇 팀은 일 떠넘기기 바쁘고 그렇게 회사 다닐꺼면 집에가라 쫌
3463,쿠팡(주),6026,"-계약직 직원의 정규직 전환률 낮음, 불투명 -계약직 직원에게 많은 권한과 책임을 줌 -낮은 급여"
3464,쿠팡(주),6026,현장분위기가 천지차별임 어떤 곳은 그져그런데 진자 다혈질인 분들이 많음
3465,쿠팡(주),6026,무대뽀 외국인들의 한국정서를 무시하는 의사결정 및 은근히 한국인 무시하는 태도. 통역이 있지만 영어가 안되면 다소 힘듦
3466,쿠팡(주),6026,건당 배송비가 지속적으로 하락하여 초기보다 수익이 적어짐
3467,쿠팡(주),6026,시도때도 없이 일을 시킴. 메일로 슬랙으로 사람을 정신못차리게 일을 지시함. 책임지지 않않으려는 회사 문화로 메일 수신자와 참조자에 기본 50명 부터 시작해서 30번의 메일을 주고 받는 경우도 있음.
3468,쿠팡(주),6026,일하는시람만일함다들일안하려고함밥먹을때줄이너뮤김연장하면셔틀이없시때문에 무조건해야함
3469,쿠팡(주),6026,아직도 자리 잡지 못하고 체계도 제대로 잡히지 않은 부서가 여럿 있음 능력없는 상사들의 짬밀?이 존재하는 곳.. 일단 일을 벌리고 봄. 뒷수습은 말단 사원들이 함
3470,쿠팡(주),6026,정규직과 계약직의 현저한 차이. 장규직의 매리트를 발견하지 못했음 ㅠ
3471,쿠팡(주),6026,월급이 적다. 밥도 도시락같은거 시켜먹어야하는데 질린다.
3472,쿠팡(주),6026,"복지라고 할 수 잇는 부분이 생각보단 많지 않음. 휴게공간 없고 본사 건물 주변으로 나와있는 팀들은 식당 , 카페도 이용하기 어려움"
3473,쿠팡(주),6026,"하루하루의 실적압박, 수평문화속에 있는 꼰대들, 높은퇴사율, 잦은 상급자변경"
3474,쿠팡(주),6026,아직도 정리해고를 하는 회사. 이유는 없다. 이유가 없다.
3475,쿠팡(주),6026,이직하고 입사해서 바로 재택근무를 하다보니 업무를 익히기에 부족하다
3476,쿠팡(주),6026,탑다운이 만연함. 윗사람이 쪼면 뭐든 하루만에 해내는 엄청난 압박.
3477,쿠팡(주),6026,복지가 경호 일할때는 없구 그냥 완전 땅부터 내가 일할곳 만든기분
3478,쿠팡(주),6026,회사에서 배송직 사원은 소모품으로 생각함 신입사원 10명이 들어오면 8명은 3달안에 그만두고 1명은 인사사고 등 징계로 짤리고 남은 한명만 오래다님 그만큼 일이 힘들다 배송물량은 시간이 지날수록 늘어나는데 급여는 몇년째 동결 그 외에도 단점 엄청 많은데 여기까지만 쓰겠음
3479,쿠팡(주),6026,집에서 회사까지 왕복4시간이나 걸려서 시간이 좀 아까웠다
3480,쿠팡(주),6026,복리후생이 너무 없음 다른 회사랑 비교했을때 아주 많이 부족함
3481,쿠팡(주),6026,일이 많고 체계가 은근 없어서 힘들때가 가끔 있다. 그래도 계속 다님
3482,쿠팡(주),6026,일이 너무 많고 빡시다 돈에 비해 일이 많음..
3483,쿠팡(주),6026,빠르다. 일이 많다. 늘 사건이 터진다. 일이 계속 늘어난다. 사람에 대한 존중이 약하다.
3484,쿠팡(주),6026,사람을 소모품으로 생각하는 회사 이슈가 끊임 없이 있움
3485,쿠팡(주),6026,직원에 대한 배려가 없다...싫으면 관두던가 느낌 윗대가리들급은 다들 자기 인맥중심으로 끌고 오는 느낌이다.. 상위 관리자는 능력자인데 자기 따까리 하던 사람들을 중간관리자로 데리고 오는 경우가 많다....그런 사람들이 종종 보인다. 그리고 웧급 이외에 아무 복지도 없다.
3486,쿠팡(주),6026,젊은층만 있어서 두서없음 수평적인 구조 결정권자의 우유부단함
3487,쿠팡(주),6026,"부족한 복지 (특히 차가운 도시락), 이 부분은 신규 사옥이 생기면서 보완되고 있음 보안 정책이 너무 타이트함"
3488,쿠팡(주),6026,빠른 결재가 이루어지는 장점이 있지만 체계 불안정해보임
3489,쿠팡(주),6026,비개발과 개발의 처우 차별이 심각..(연봉 반토막 수준) 극악의 워라밸........... 연봉 인상이 기존 인력보다 신규 인력에 맞춰짐 오래 다닐수록 원천이 줄어 듬
3490,쿠팡(주),6026,외국인 임원 쓸대없는 회의가 너무 많음 로켓 보고 문화 그날 지시 그날 보고 하루종일 그룹웨어 보고 작성 점심을 개인부담 사먹음
3491,쿠팡(주),6026,단순노동이다보니 몸이 많이 힘들다. 아르바이트라는 생각에 애사심은 물론 없다. 위로 올라가는 시스템이나 정직원이 될수 있는 기회를 줬으면 좋겠다.
3492,쿠팡(주),6026,"군대식 문화, 캠프 매니저가 대부분 부사관, 장교출신으로만 구성되어있어서 빡빡함"
3493,쿠팡(주),6026,평등한 조직은 아님 위계질서가 철저하고 영어로 일하는 한국 대기업
3494,쿠팡(주),6026,돈이 작아도 너무 작음.. 직군별로 다르겠지만 쿠팡은 경력직으로 와야할 곳
3495,쿠팡(주),6026,지금은 어떨지 모르겠지만 식당에서 매일 도시락 샌드위치만 먹어서 구내 식당의 의미가 없다는 느낌을 받았습니다 하지만 알아서 다양한메뉴를 시켜줘서 편하긴 했어요. 업무가 매일 반복 단순업무라 지루하고 업무적으로 발전한다는 느낌이 없었어요
3496,쿠팡(주),6026,실적 압박이 심하고 바쁠때는 미친듯이 바쁘고 쪼인다. 업무 페이스가 급격하게 탑다운으로 떨어지고 지독하게 독하고 경쟁에서 살아남는 자만이 살아남을 수 있다.
3497,쿠팡(주),6026,속도와 스케일에 적응하지 못하면 쉽게 도태될 수 있음. 특히 안정성에 초점을 둔 사람이라면 이직에 신중을 기할 것.
3498,쿠팡(주),6026,계약직 파견직의 경우 팀바팀이지만 물경력 될 가능성이 커요
