,company_name,company_id,review_text
0,쿠팡(주),6026,전체적으로 문화수준이나 기술력 레벨이 높다고 판단됩니다 초년생이나 경험이 부족하신 분에게는 일의 허들이 높다고 판단됩니다
1,쿠팡(주),6026,"열심히 앞만 보고 달리기 때문에 분위기나 환경이 어려운 편이다, 연수기간처럼 교육을 받는 기간이 길지 않다."
2,쿠팡(주),6026,많은 인원이 움직일 때 엘레베이터 탑승이 너무 힘들었습니다. 항상 8층에서 1층까지 걸어 내려가야했습니다.
3,쿠팡(주),6026,승진이 비교적 힘들며 야근 부담이 있는편이고 주간 보고 체계가 비효율적이며 복지 제도를 제대로 활용하기가 힘듬
4,쿠팡(주),6026,체계가 아직 많이 잡혀 있지는 않은 것 같다. 처음 적응하기에 어려울 수 있음
5,쿠팡(주),6026,재택이 장점이지만 이로인해 서로 마주보고 일하지 않아서 의사소통이 조금 불편 할 때가 있음 월급 루팡 하는애들 조치가 필요함
6,쿠팡(주),6026,사내 문화가 너무 보수적이고 업무에 사적인 영역이 포함됨
7,쿠팡(주),6026,너무 강요적이고 잔업이 많다. 또한 근로자에 대한 배려가 없다.
8,쿠팡(주),6026,성장 가능성이 없어요. 일하는 사람만 일하는 느낌 매니저 직급이 무슨 업무를 하는지 잘 모르겠어요
9,쿠팡(주),6026,"그만큼 책임과 노력이 필요하며, 성공에 대한 강한 집착이 필요함"
10,쿠팡(주),6026,수직적이며 체계가 부족하며 세일즈 이해도가 떨어지는 분들이 있음
11,쿠팡(주),6026,성과를 내면 낼수록 ‘이게 되네?’ 하고 높아지는 목표가 버겁다
12,쿠팡(주),6026,낮은 연봉. 낮은 복지제도랑 퇴사하고 신규직원이 많아 다소 혼란스러움
13,쿠팡(주),6026,많은 인원을 뽑으니까 그만큼 인력관리가 제대로 되지 않아 괜찮은 사람이 들어올 확률이 적음
14,쿠팡(주),6026,업무 강도는 분기마다 다르게 형성된 점 바쁠 때는 많이 바쁜느낌입니다.
15,쿠팡(주),6026,"복지가 따로 없으며, 빠르게 성장하는 만큼 업무가 많다"
16,쿠팡(주),6026,복지.. 책상에 앉아있는 사람들은 모르겠는데 현장은 너무 열악함
17,쿠팡(주),6026,나의 영혼을 갈갈갈.. 과한 목표를 쫓아가기는 쉽지않았다
18,쿠팡(주),6026,리더급은 외국인으로 도배. 영어를 잘하지 못하면 살아님기 힘듬
19,쿠팡(주),6026,"개발직 IT부서위주 우대 정규직들 정시에 퇴근하는거 못봤음 매번10시넘어서 퇴근함. 심지어 물류센터는 퇴근 지문찍고 근무 상사 잘못만나면 갈굼당함. 상사케바케 (일잘하는 직원들어 왔다고 쿠팡 내 소문나니까 상사가 괴롭혀서 결국 내 사수를 나가게 만든사례가 부서에 있었음, 심지어 실수한 걸로 다른부서직원과 해당직원들 모두 보는데서 소리질러서 망신줬었음. ) 인센티브가 없다. 인센티브 포함 연봉받았었으면 인센티브 제외하고 연봉만 측정해서 결국 해당연봉이 삭감한채 들어온 분 계셨음."
20,쿠팡(주),6026,쉬는시간이 없는게 아쉽습니다 출퇴근 거리가 먼편?...
21,쿠팡(주),6026,ㅡ 실적에 대한 압박 ㅡ 복지가 아예 없다 ㅡ 장기근속자 부재
22,쿠팡(주),6026,변화를 좋아함 기존 프로세스가 좋았는지 나빴는지 평가하기보다 계속해서 어떻게 바꾸면 좋을지만 고민하는중
23,쿠팡(주),6026,명절 떡값을 쿠팡캐시로 지급한다는 것이 아쉬웠습니다.
24,쿠팡(주),6026,연봉이 제일 단점입니다.... 최저시급보다 조금 많음
25,쿠팡(주),6026,핸드폰을 걷어서 중요한 연락은 확인이 불가능하다. 같이 일하는 사람이 문제가 가끔 있음
26,쿠팡(주),6026,신규 직원들은 진입장벽이 높다고 생각됨 일이 힘듬 세벽에 나가 피곤함
27,쿠팡(주),6026,자신의 성과가 잘 하고 있는지에 대한 다른 지표가 따로 없다보니 계약직으로써의 불안함이 계속 있음. 고용연장 등등
28,쿠팡(주),6026,일이 너무 힘들고 여름엔 더더욱 더 힘들어요.. ㅠㅠㅠㅠ
29,쿠팡(주),6026,여러팀들이 있지만 어느부서의 누가 담당자인지 서로 모름 또 알려주는 사람이나 부서도 없음
30,쿠팡(주),6026,열정을 강요하는 문화와 일하는 사람이 더 일하게 만든느 문화
31,쿠팡(주),6026,일이너무 자주 바뀌고 직원들은 윗사람의 성과맞추는 도구이다
32,쿠팡(주),6026,체력적이나 신체적으로 힘듬. 운전이 서툴면 사고위험.
33,쿠팡(주),6026,"개발직 제외하고는 낮은 연봉, 주먹구구식, 체계가 없으면서 체계적이길 바라는 곳, 재택근무라 거의 매일이 야근"
34,쿠팡(주),6026,"위에 작성한 장점 외 전부, 직원을 부품으로 생각하는 회사"
35,쿠팡(주),6026,체계적인 면은 좋으나 누구나 할 수 있는 일을 할 경우 발전하는 면에 있어서는 장기적으로 좋지 않을 것 같습니다
36,쿠팡(주),6026,직원을 하나의 부속품처럼 생각하는 회사. 욕심보다는 야심이 있어야 다닐 수 있는 회사
37,쿠팡(주),6026,뛰어난 팀원들 각자 너무 바빠서 도움 없음 나몰라라 실력 있으면 좋은 회사
38,쿠팡(주),6026,사회생활 17년 쿠팡 6년을 다녔는데 매일같이 바뀌는 업무때문에 쿠팡에서의 경력을 이력서에 적을수가 없음. 내가 6년간 뭘했는질 모르겠음
39,쿠팡(주),6026,워라밸 바라면 안됨. 연봉빼고 다른 복지 거의 없음.
40,쿠팡(주),6026,근무패턴이 일정하지 않아 언제 쉴 지 예상하기 어렵다.
41,쿠팡(주),6026,물량이 많아지면 인센을 안받고 딱정해진 물량 만 소화 할수가 없어요..
42,쿠팡(주),6026,물량 조절 못하는 것 이외에 불편 사항은 없습니다.
43,쿠팡(주),6026,일이 끊임없고 연봉에 비해 업무강도가 너무 세고 입퇴사가 잦아 체계가 부족
44,쿠팡(주),6026,"일이 끊이지 않고 항상 평가당해야 함. 초과근무해도 시스템에 올릴 수 없음. 업무시간 중 너무 많은 미팅, 정작 해야할 일은 퇴근후 하게 되는 스케줄"
45,쿠팡(주),6026,기업문화가 사람을 믿지 못하고 소통 없이 무조건 잘못을 지적하는 구조
46,쿠팡(주),6026,계약직의 인원 비중이 너무 높다. 일한 팀만 그랬을지 모르지만 정규직3 에 계약직 6-7은 너무 말이 안된다고 생각한다.
47,쿠팡(주),6026,일이 많이 힘듭니다 정규직 아니라면 더 힘듭니다 각오를 해야 합니다
48,쿠팡(주),6026,"고객만족, 콜수, 처리시간 실적 압박 진상이 많음 물류센터랑 다이렉트 연결이 안되서 고객 문제를 해결해줄수 없음 고객도 불만, 직원도 불만"
49,쿠팡(주),6026,계약직이라 급여 핵적음 은근 계약직 무시함 다들 개인주의 강함
50,쿠팡(주),6026,매우 빈번한 팀 조직과 해체 그리고 다양한 사람들과 상대
51,쿠팡(주),6026,"워낙 조직적으로 일이 진행되는 곳이다보니, 가끔은 부품같은 일원으로 느껴질 때가 있었어요"
52,쿠팡(주),6026,"여느 유통업계와 물류업계가 다 그렇지만, 힘든 업무 강도, 쉬는 시간이 다소 부족."
53,쿠팡(주),6026,스타트업의 단점과 대기업의 단점만 쏙쏙 뽑은 느낌이 상당히 남
54,쿠팡(주),6026,시스템 보다는 개인 역량 의존도가 매우 높음 조직도가 명확하지 않아 담당자 찾는게 큰일임 스피디한 의사결정이 자칫 편향된 결과로 이어질 수 있음
55,쿠팡(주),6026,계약직과 사원급은 글쎄... 연봉 인상도 적은 편이었다
56,쿠팡(주),6026,업무 기준이 매일 바뀝니다. 헬퍼들이 알려주긴하지만 매일 기준이 바뀌니 배워도 숙지가 안되기일쑤입니다.
57,쿠팡(주),6026,너무 경쟁적이고 개발자가 아니라면 연봉도 동종수준에 비해 부족함
58,쿠팡(주),6026,물류센터같은경우 정규직 채용이 적어 역량을 뽐낼기회가적다
59,쿠팡(주),6026,부서 내부 직원들간의 소통 부족 계약직 차별 비효율적인 사무장비 지급 방법 회사 내 메신저의 불편함  무거워서 들지도 못하는 데스크탑을 가져가래서 너무 당황했고 퇴사 시 반납도 해야하는 상황이라 끔찍했습니다. 노가다 하러 온 줄 알았어요. 노트북 지급해주면 되지 않나요? 정규직들은 재택 시에도 노트북 사용하던데 계약직들에게만 회사용 데스크탑이랑 모니터 지급하는 이유는 계약직들 감시 목적인지 궁금합니다.
60,쿠팡(주),6026,열려있는 척 하지만 절대 열려있지 않음 계약직으로 쓰다가 거의 대부분 나감
61,쿠팡(주),6026,너무 복잡하다. 리더십프린스플고ㅓ다르게 매우 다른부분들도 보인다
62,쿠팡(주),6026,복지가 딱히 없음 설날 추석 쿠팡캐쉬 10만원 더 늘려줘야할듯
63,쿠팡(주),6026,여러 다양한 사람들이랑 하다보니 알려주는 회사측에서도 로봇 느낌으로 사람을 대했습니다
64,쿠팡(주),6026,복지가 거의 없다고 봐야 함 강도 높은 업무와 그로인한 업무 스트레스 업무는 많고 야근이 많지만 그에 따르는 동기부여가 잘 안되는 것 같다 수평적인 것 같으나 수평적이지 않음
65,쿠팡(주),6026,근무환경이 열악해도 너무 열악합니다 물류센터라 다 그렇긴한데 안전확보가 최소한으로 되어있는느낌
66,쿠팡(주),6026,위에서 무슨일을 하는지 잘 모르겠고 온보딩 시스템이 잘 갖춰지지 않음
67,쿠팡(주),6026,그외 전부 까라면 까는 군대식문화 수평적문화라고 하지만 전혀 그렇지않음
68,쿠팡(주),6026,관리자들이 조금 빡센점? 직원들한테 짜증내는 관리자를 본 것 같았는데 뭐 이건 어쩔 수 없다고 생각함
69,쿠팡(주),6026,복지가 없다. 대신 연봉을 많이 준다고 하지만 평균의 함정인듯.
70,쿠팡(주),6026,연봉이 생각보다 적음 복지가 너무하다 싶을 정도로 없음
71,쿠팡(주),6026,체력적으로 많이 힘들어서 체력 약하신 분들은 버티기 힘듭니다
72,쿠팡(주),6026,바빠서 쉴 틈이 없고 육체적 피로가 너무 심함. 담 날 하루종일 집에서 쉬어야함
73,쿠팡(주),6026,보상이 매우 짜고 복지가 매우 짜다. 특히 올해는 흑자 전환을 이루엇음에도 말로만 직원들의 덕이다라고 말할뿐 돌아오는 보상은 없다
74,쿠팡(주),6026,육체적 노동이 힘들다는점? 그점때문에 조금 벅찰수도있어요
75,쿠팡(주),6026,"실적 압박, 매일 이어지는 야근, 경쟁 심화 분위기, 불안감"
76,쿠팡(주),6026,잦은 지방 출장 / 지속 변화하는 내부 시스템 / 변화되는 시스템에 맞춰가니 또 바뀜
77,쿠팡(주),6026,"매일매일 아침저녁으로 챌린지 당하고, 압박감과 스트레스 심함"
78,쿠팡(주),6026,"비전 전혀없음, 그냥 잠깐 다닐때없을때 다니기 좋은 곳"
79,쿠팡(주),6026,- 복지가 거의 없음 연봉으로 모든 것을 만족해야함 - 진리의 부바부 사바사
80,쿠팡(주),6026,복지가 거의 없다싶이하고 직원에 대한 배려가 없다. 그리고 개인 성적에 대한 경쟁이 굉장히 심함
81,쿠팡(주),6026,혼자만 하는게 단점이 될수도 있을텐데 시간내에 업무를 소화시키지 못하면 다른 분들한테 분배를 하거나 해야해서 역량이 부족하면 피해를 줄 수 있습니다
82,쿠팡(주),6026,지원해서 가기가 어려움 처음하는 사람은 잘 안뽑아주는듯 손 느리면 관리자가 뭐라고 함
83,쿠팡(주),6026,혼자 일해서 심심하기도 하고 계역직이라서 3개월마다 불안함
84,쿠팡(주),6026,체력이 딸리면 몸이 너무 힘듦. 몸살까지 올수도있다.
85,쿠팡(주),6026,"공장 찍어내듯 강압적인 분위기, 흡연실 없음, 재택근무지만 실적이 없으면 현장근무"
86,쿠팡(주),6026,일을 못하면 가차없이 짤리고 평가가 낮게 나옵니다. 개인주의가 심합니다
87,쿠팡(주),6026,보편적 복지나 보상보다는 개별 성과에 대한 하이라이트로 편차가 심하다
88,쿠팡(주),6026,사내식당 밥 맛없음 그리고 엘베 타기 넘 힘들고 쉬는시간 짧
89,쿠팡(주),6026,회의가 많고 그로인한 야근이 많다 야근 수당이 없다 외국인이 많아 영어가 부족한 한국인은 슬프다
90,쿠팡(주),6026,"함께 무언가 이뤄간다는 느낌이 적고, 기능적으로 사용된다는 점"
91,쿠팡(주),6026,우선순위 따지다가 실행을 못 하는 것이 답답. 그 시간에 하나라도 더 하자
92,쿠팡(주),6026,초반 적응 힘듦 모두가 프리랜서처럼 일함 팀 잘만나면 천운
93,쿠팡(주),6026,생각보다 짠거 같음 일이 몰리면 쳐내기 힘듬 월급 좀 올려주셈
94,쿠팡(주),6026,계약직이라서 그럴 수 있겠지만 생각했던 업무랑은 좀 차이가 있었습니다.
95,쿠팡(주),6026,너무 빠르고 변화를 추구하다보니 안정화되는 부분이 없음
96,쿠팡(주),6026,끈임없는 챌린지로 쉼없이 달려야함.... 스스로 관리가 안되면 번아웃 올 수있음
97,쿠팡(주),6026,고인물이 많고 성과에 대해서 압박감이 심하고 화상회의에세 성과안나오는사람에게 망신줌
98,쿠팡(주),6026,"한국의 문화와 정서를 모르는 외국인 매니저, 디렉터 들."
99,쿠팡(주),6026,경력 쌓기나 일을 배운다는 느낌은 없음 다 바쁘고 허둥지둥 주먹구구식
100,쿠팡(주),6026,계약직도 정규직못지않게 쓰고 굴려먹으려는게 잇는듯...
101,쿠팡(주),6026,"대기업인 척하는 스타트업의 느낌이 강함. 개발 직군에 포커스가 맞춰져 있고, 모든 의사결정이 데이터에 의존해서 비개발 직군으로서 소외받는다는 느낌이 강함. 급하게 성장한 만큼 주먹구구식 시스템이 있음."
102,쿠팡(주),6026,연봉 외에는 복지가 거의 전무하단게 아쉽네요. 흑자전환 후 안정적인 궤도에 오르면 복지도 점점 좋아졌으면 합니다.
103,쿠팡(주),6026,다른 분야는 모르겠으나 성장하기 어려움 복지가 부족함
104,쿠팡(주),6026,빠르게 진행되기 때문에 리드의 힘이 쎄며 발언권이 큰편
105,쿠팡(주),6026,"1. 회사의 성장 속도와 비례하지 않는 내부 시스템. 모두가 쉴틈없이 바뀌는 말도 안되는 정책을 따라가는데 급급해 어떤 것도 돌아볼 시간이 없음. 2. 말도 안 되는 업무량, 그로 인한 빠른 인앤 아웃. 그 빠른 인아웃을 맞추기 위해 채용팀은 정말 기계식의 채용을 진행함. 그 과정 또한 정말 불쾌하기 짝이 없음. > 다짜고짜 진행된 서류 스크리닝 콜, 전화를 받자마자 기계적으로 이직 사유 등을 물어보고, 주제에 맘에 안 드는 답변이 나오면 그건 너무 당연한 소리라며 비아냥 됨. 채용 시스템 부터가 이미 너무 미개한 수준. 그 전화에서부터 연봉을 물어보고, 경매를 하듯 연봉을 깎아도 진행할거냐고 물어봄. 애초에 그때부터 들어오면 안 되는 회사였음 3. 비개발 직군의 연봉 테이블 정말 낮음. 정말 정말 낮음"
106,쿠팡(주),6026,변화와 발전이 빠른만큼 그러지 못한 직원에 대한 도태
107,쿠팡(주),6026,여름 과 겨울 덥고 춥고 이 문제만 아니면 너무 좋은 환경임.
108,쿠팡(주),6026,여전히 체계 없이 비효적인 업무방식과 구성원 갈아넣기와 정치
109,쿠팡(주),6026,대부분의 의사소통이 영어로 이루어지기 때문에 영어를 못하면 힘들 수 있다.
110,쿠팡(주),6026,야근 너무 많이 하고 업무 평가 압박 완전 심함 그래서 다 죽기살기로함
111,쿠팡(주),6026,이츠의 경우 재무가 마케팅을 너무 모르는데 마케팅 헤드가 없어서 이상했음
112,쿠팡(주),6026,"매번 바뀌는 조직, 일관성 없는 왔다리 갔다리, 체계 없고 공정하지 않은 인사제도, 저성과자를 매몰차게 내보냄, 그런데 그 성과 기준도 명확하지 않을 때가 있음."
113,쿠팡(주),6026,인센제도라서 필드영업으로 난이도나 힘듦이 존재합니다.
114,쿠팡(주),6026,승진 기회가 적으며 업무시간 내에서는 너무 빡세게 굴려 건강 악화..
115,쿠팡(주),6026,탑다운이 심하고 부서마다 차이가 심했음. 가끔 사람이 도구처럼 쓰일 때가 있음.
116,쿠팡(주),6026,"유류비, 식비 등 영업직이라면 지원 받아야할 것들을 절차가 까다롭게 만들어 놓아서 아쉬웠습니다."
117,쿠팡(주),6026,가끔 탑다운 식으로 전사 적용 업무가 할당될 때가 있다. 중요 사항이라 이해는 되지만 기존 비즈니스 업무를 처리하던 중에 긴박하게 할당되면 쉽지 않다. 이를 고려해서 할당해주면 좋겠다. dr test가 외국 팀 기준으로 돌아갈 때가 많다. 제대로 준비 좀 했으면 좋겠다.
118,쿠팡(주),6026,큰 규모와 엉망인 시스템. 외국 기업과 한국 기업의 단점들만 모아놨음
119,쿠팡(주),6026,실무를 모르는 인도인 리더 잦은 리더 변경에 따른 의사결정 지연
120,쿠팡(주),6026,조직간의 이익추구로 인해 wow the customer를 져버리는 경우가 요즘들어 잦아짐. 기존 인원보다 경력직을 우대하고 성과와 보상에 있어 체계가 없고 정치질만 난무함. 큰 틀에서의 방향성이 리스크를 계속해서 만들어내고 있고 앞으로도 이 자리를 지킬 수 있을지 미지수
121,쿠팡(주),6026,"포기하면 편하지만 포기하기엔 아직 미련이 남은 나자신?, 단점은 개개인을 신경쓸 필요없는 마인드...?"
122,쿠팡(주),6026,월급이 작음 나름 대기업인데 월급 250은 넘어야 되는거 아닌가 게다가 근무지가 서울인데
123,쿠팡(주),6026,한국인들은 그저 쓰다버리는 부품에 불과함 처음 입사했을때랑 같은 업무를 한다고 기대하지마세요
124,쿠팡(주),6026,재택이다보니 각자 일하는 분위기였음 자율좌석제인데 은근 자리 정해져있음
125,쿠팡(주),6026,너무 변화가 많아 오히려 혼란스럽다. 변화무쌍한 기업이라 내부에서 힘듦.
126,쿠팡(주),6026,계약직을 굉장히 많이 뽑아놓고 치열한 경쟁구도를 만들어 냅니다. 결과를 만들어내는 하나의 전략이겠죠
127,쿠팡(주),6026,어느 조직이나 사람이 문제지만 이곳은 조금 색다르다. 무능한 외국인 상사를 만나보았는가? 상상 이상이다...
128,쿠팡(주),6026,갈수록 복잡해지고 어려워지는 업무난이도로 인해 신입으로 입사하면 매우 힘들다.
129,쿠팡(주),6026,반복업무이며 자기발전의 기회가 적습니다. 자기 발전을 이루고 싶다면 다른 회사에 도전해보세요.
130,쿠팡(주),6026,급여가 다른 비슷한 일들에 비해 많이 짬 최저임 그래서 여러 번 일해야 함
131,쿠팡(주),6026,그만큼일을 열심히해야하거 생각만큼 체계적이지는않습니다요
132,쿠팡(주),6026,빠른 변화 속도에 적응해야함 외국어 능력이 필요한 분야가 있음
133,쿠팡(주),6026,사내 온보딩과 업무 파악을 스스로 해야하지만 위키가 잘 정리되어있다
134,쿠팡(주),6026,"일이 너무 많아서 업무 중, 휴무 등.. 아무것도 할 수가 없음"
135,쿠팡(주),6026,승진 기회가 매우 제한적 승진을 시킬 바엔 상위 직급자를 채용
136,쿠팡(주),6026,일이 아직 체계적으로 잡혀있는게 아니라 유동적이라 그런거에 스트레스 받는 사람은 힘들지도
137,쿠팡(주),6026,체력이 안되면 하지 않으시기를 바랍니다. 다리가 너무 아프네요
138,쿠팡(주),6026,부서마다 편차가 크다. 몇명으로 일이 굴러가는 느낌이 컸습니다.
139,쿠팡(주),6026,속도가 너무 빠름. 매번 다른 시도를 하려고함. 속도와 변화를 못따라가면 도태됨.
140,쿠팡(주),6026,단순하고 반복적인 업무로 다양성을 느끼기 어렵고 업무가 경쟁적이
141,쿠팡(주),6026,일하면서 제대로 휴게할수없었고 식사도 잘 못한 점이 힘들었습니다
142,쿠팡(주),6026,처음부터 빨리빨리 하라고 시킴. 물류가 무거운데 많아서 힘듦
143,쿠팡(주),6026,짜치는 업무가 좀 많긴합니다. 무조건 영업력으로 승부바야해서 압박이 잇습니다.
144,쿠팡(주),6026,"집에서 할 수 있는 일이라는 거 외에는 모든게 단점, 진상고객을 만날때면 멘탈이 와장창 깨져서 다음 콜을 받기가 두려워짐"
145,쿠팡(주),6026,정체되기도 하고 계약직이 많은 부서였는데 너무 사람을 그냥 쓰고 버리고 비요휼적인 측면이 있다
146,쿠팡(주),6026,몸이 힘들어 육체적으로 피곤합니다 보안이 철저해서 까다롭기도
147,쿠팡(주),6026,현장직은 처리 단말같은 느낌임 현장업무를 숫자로만 파악함 본인들이 말하는 규칙은 보여주기용인듯
148,쿠팡(주),6026,"일이 힘든편이며, 급여도 그렇게 높지는 않습니다. 경쟁이 심화되고 있어 더 힘들어질꺼라 봅니다"
149,쿠팡(주),6026,명절같은 경우 연달아 쉴 수 있을 수가 없음 대신 명절휴일만큼 따로 다른날에 쉴 수 있음 빠르면 빠르게 배달할수록 인센티브 받을 수 있는 컷트라인이 높아져 점점 인센티브가 낮아질 수 있음 그리고 점점 인센티브 가격을 줄이는 추세
150,쿠팡(주),6026,체력이 많이 필요함. 체력이 약해서 좀만 무리해도 다음날 영향이 가거나 비리비리한 사람이라면 오지 않는 게 좋음.
151,쿠팡(주),6026,근로자 처우가 더 좋아지면 좋겠다 복지도 더 좋아지면 좋겠다 쉬는 것 눈치 보인다
152,쿠팡(주),6026,생각보다 너무 폐쇄적이다. 매니저 성향에 따라 내 앞길이 너무 갈린다.
153,쿠팡(주),6026,아르바이트 시작하면 일도 안가르쳐주고 바로 현장에 투입해요
154,쿠팡(주),6026,외국계 임원이 많은데 유럽의 자유로운 스타일을 기대했다면 절대 아님. 사람을 기계처럼 굴리고 못 버티면 나가야함.
155,쿠팡(주),6026,업무 처리 속도가 느리진 않은데 업무가 많다보니 하루에 쳐내야할게 많음
156,쿠팡(주),6026,인력을 갈아넣는 구조. 젊은 대학생 또는 알바를 원하는 여러 계층들에겐 계륵같은곳. 시대적 근로 사각지대의 아픈 곳
157,쿠팡(주),6026,할당량 압박이 은근 있음. 강제로 해야하는 일들이 너무 많음.. 최저시급 보다도 못한 월급 노조분들 본사 앞에서 시위하시는거 때문에 시끄러웠음
158,쿠팡(주),6026,사람을 부품으로 생각하는 리더들과 실력없이 입만 터는 사람들의 승승장구
159,쿠팡(주),6026,잠깐의 목돈이 필요하거나 짧은 아르바이트식의 일을 원하는게 목적이라면 제격이다 그 외에 목적이 있다면 단점일 수도
160,쿠팡(주),6026,낮은 연봉 및 승진의 기회가 적고 내정자가 정해져 있는 팀이였음
161,쿠팡(주),6026,업무강도가 높은편 실적이 바로바로 눈으로 확인가능해서 쉴틈없이 알함
162,쿠팡(주),6026,쿠팡캐시밖에 안 줌 (명절 떡값) 별도 상여금 등 없고 관리자한테 잘못 걸리면 승진이 힘듦
163,쿠팡(주),6026,말로는 상위 30프로는 정규진 전환 기회를 준다는데 말이 좋아 기회지 사실상 상위 5프로는 돼야 될까말까 입니다.
164,쿠팡(주),6026,너무 시간에 대해 압박을 주는 점. 점점 노동 강도를 올리는 점
165,쿠팡(주),6026,쉴틈없이 일해야하고 너무 힘듦. 휴계시간 너무 짧습니다
166,쿠팡(주),6026,많은 업무량을 소화하다보니 빠른 일처리가 요구되어 야근이 필요할 때가 있습니다
167,쿠팡(주),6026,노동자를 부품처럼 인식하고 사용하려는 움직임이 보임.
168,쿠팡(주),6026,잘 보이기 위해 사람들을 짜내는 윗선에 업무 요구에 지쳐 떠나는 사람이 많아요
169,쿠팡(주),6026,사람의 삶을 갉아먹는 좀비같은 회사 여기서 버티는 만큼 수명은 준다
170,쿠팡(주),6026,업무 시간에 핸드폰을 반납해야 하는 점 특정 기간에는 구직이 어려운 점
171,쿠팡(주),6026,"- 정규직 전환은 현재 아주 어려워 보입니다. 적어도 제 직무에서는요.  - 저는 노는 것보다 이거라도 하는 게 나을 것 같아 했지만, 일에서 성취감을 찾는 분들은 다른 걸 찾아보시길 바랍니다."
172,쿠팡(주),6026,잘 안알려진 사실이지만 매년마다 하위 고과 권고사직 권유하고 저성과자 낙인 찍음 이런 인사제도를 채용 할때 말해주지 않음
173,쿠팡(주),6026,- 업무 과중으로 인한 직원들의 고통 - 월급여 인상율 대비 성과금은 많이 적은 편 - 복지없음
174,쿠팡(주),6026,체계가 없고 아직 옛날 방식의 업무스타일 근속자가 많지 않아 배울 부분이 적음
175,쿠팡(주),6026,아무래도 신생 회사다 보니 체계가 확실하게 잡히지 않았었고 수평적 구조를 지향하지만 크게 느껴지진 않았습니다
