,company_name,company_id,review_text
0,태강대부,1369,또래동료가 많이없음. 광화문 근처라 주변에 시위소리 너무 시끄러움
1,태강대부,1369,나라 금융정착에 따라 좌지우지되는 수익율.. 외근이 잦아서 운전이 힘듭니다.. 업무를 진행하면서 마음한구석이 무거운경험을 할수있다.. 정장불편함..
2,태강대부,1369,"고인물들이많아서 승진의 기회가 다소 제한적이며, 승진에 따른 인센티브가 없음. 또한 반복적인 업무로인하여 정신이 피폐해짐."
3,태강대부,1369,"팀장급들 고여있고, 회사가 더 커질 일이 없기에 성장을 위한다면 퇴사해야 함 직원을 위한 복지에 인색함"
4,태강대부,1369,"매달 녹취털림 , 복도에 붙여놈 CS점수 ㄷㄷ , 담배시간 정해져있음"
5,태강대부,1369,윗사람들이 너무많아 올라갈곳이없음 조직 커지지않아 업무성장 어려움
6,태강대부,1369,대리직급이 너무 많음 뭉치는 사람들끼리 뭉침 체계적인듯 하나 막상 그렇지 않음
7,태강대부,1369,반복적인 업무. 자유롭지 않은 업무 분위기. 타업종대비 낮은 급여
8,태강대부,1369,올라갈수있는 승진에 한계가 있습니다 기회가 보장돠면 좋을꺼같습니다
9,태강대부,1369,대부업이라는 이미지는 역시나 인식이 안좋음 부서장이나 임원이 너무 많음 - 인사적체 역시나 가장큰 단점은 연봉이 높지않고 인상폭이 없다시피함
10,태강대부,1369,연봉이 가장 문제입니다 돈많이 주면 다 싫어도 견디며 열심히 일할 것 같아요
11,태강대부,1369,얼마전에 위에서 노동부 직장내 괴롭힘으로 고발당해 벌금맞아도 가해자는 회사 잘다님. 연차 자유 롭게 사용하라고 하고서 눈치 엄청주고 특별한날아니면 주말이나 쉬는날 같이 못씀. 철밥통이 있어 승진의 한계가 있음 군대문화 핸드폰 자류롭게 사용못함 일할때 팀장이 보관 감시하며 윗선에 보고 상여금없음 그들의 세상에 속하지못하면 회사생활 어려움
12,태강대부,1369,"박봉(6년차 대리와 6개월차 신입 연봉이 같음. 최저임금 오르고 입사하면 이득임) 기존 직원들 텃세, 앞으로의 비전이 없음 타회사 대비 많은 업무량 관리자는 10명인데 팀원이 18명임.. 관리자가 매달 팀원들 인사고과 평가하는데 그거에 따라서 연봉이 달라짐 정해진 쉬는시간 외에 화장실 갈 때 관리자에게 보고하고 가야함 팀원들은 업무시간에 핸드폰 반납하지만 관리자들은 개인통화도 자리에 앉아서함 관리자들의 기분에 따라 사무실 분위기가 달라져서 매일매일 눈치보러 출근하는 기분임 목요일 아침마다 사무실 청소함 아침간식, 유니폼, 휴게실 얼마없던 복지도 다 사라짐"
13,태강대부,1369,단점은 너무나 많은데 실적압박 연봉협상 개판 지점문화는 거의 학창시절 선후배 수준
14,태강대부,1369,"멘토? 멘티?? 개념자체를 없앴으면 좋겠다. 멘토 잘못 만나면 개고생. 그 기간 끝나면, 선임대우 받으려고 별것도 아닌일로 꼬투리 잡음. A4용지 제대로 못채운다고도 뭐라하질 않나 그것도 안 배웠냐 알려주지 않았냐 부터 해서 사내정치질 시작. 시집못가는덴 다 이유가있음. 나머지 팀원들이 아무리 잘해주고 좋아도 그 사람 하나가 분위기 다 망침. 심지어, 출퇴근 인사도 본인이 기분 안좋으면 안받아줌. 자기 멋대로 행동하며 실세인척 함. (실세가 따로있는지 본인만 모르는 듯ㅋㅋㅋ) 팀원들이 좋고 해보고싶던 업무라 더 다니려고 엄청 노력했으나 그사람의 히스테리는 거이 넘사벽. 팀장도 알면서 방치하는것 같아 아쉬움"
15,태강대부,1369,부서별로 팀장이나 부서장에 따라 분위기가 다른 곳 신입교육이 집단교육이 아닌 멘토교육으로 이루어져 멘토 운에 따라 적응 난이도가 달라짐 초봉이 높지 않음. 직원 복지가 약함
16,태강대부,1369,정해진 시간까지만 하는 야근이지만 야근이 없는날 실적대비란 명목으로 갑작스럽게 야근진행하는 경우가 있으며 다소 딱딱한 업무 분위기 / 연차사용이 다소 제한적인게 단점
17,태강대부,1369,"1. 연봉 (암울한 수준) 2. 분위기 : 부바부 이지만 답없는 노처녀들 몰려있는 부서 조심하세요. 열등감에 똘똘 뭉쳐있는 분들이라 들어가는순간 공공의적이되는 경험 하실수있음. 군대도 안다녀온사람들이 군대처럼 갈굼. 3. 업무 : 정말 쓸데없는 일을 많이 함, (ex 뭐 물어볼경우, 5초만에 알려주면 끝인 작업을, 이 작업이 어떻게 나왔는지 모든 마우스클릭 작업을 정리해서 엑셀로 보기좋게 작성해서 보고하세요 -> 자기들끼리 쑥떡거려서 부서장 귀에 들어가면 똑같은 이야기 한번 더 말하는식 -> 그러다가 결론은 회사 보안상 안되는 작업이라 전부 취소 매사 이런식. 아무 능력없고 쓸데없는 인성 파탄자들이 모여서 어떤 말을 하던 어떤 행동을 하던 답은 정해져있음. 꼬투리잡고 우루루 신입 가스라이팅하고 뒷담화하는 회사 전 직원 업무 일지 보면 7일, 3일, 21일, 30일 이렇고 다들 없어져있음 ㅋㅋ 신입이 들어오면 왜 못버티는지 생각해보시고, 들어가시는분은 조심해서 잘 찾아가세요"
18,태강대부,1369,연봉제로 상여 전혀없음. 연차도 눈치보며 써야함. 직급은 올라가나 연봉이 그만큼 올라가는것도아님. 텃세심함
19,태강대부,1369,아침에 인사 안받아주는건 그러려니 하겠는데 청소도 신입만 하고 조금만 실수해도 너땜에 민원걸리면 책임질거냐고 윽박지르며 갈구는것도 정도가 있지않나 생각이 든다 요즘세상에 화장하는게 예의라하고 복장지적하며 신입 갈구는 회사도 있는지 의문이고 여기가 학굔지 회산지 모르겠다
20,태강대부,1369,"1. 적은급여(정규직되도 큰차이x) 2. 복지없음(상여금,성과급x) 3. 반복업무로 이직시, 경력에 큰 도움되지않음 4. 팀장 잘못만나면...ㅎ 5. 매월실적평가로 등수 공지함 6. 연차쓰는 날짜 한달전에 미리 말해야함(그마저도 많이 겹치면 못씀)"
21,태강대부,1369,"보수적, 꼰대, 미래 없음 / 굉장히 수직적인 구조로 신입들이 버티기 힘든 회사"
22,태강대부,1369,부서장의 스타일에 따라 같은 회사라도 분위기가 너무 달라 상태적박탈감이 있음
23,태강대부,1369,한명이 좌지 우지하고 직원한테 그만한 대우를 안해주고 혹시 시킬라고함
24,태강대부,1369,"공고자체가 사기.. 사무직이라 안내받고 입사했는데 사실상 전화상담직임, 심지어 연봉도 달랐음. 연차제재있음, 빨간날있는 달엔 잘못쓰게함. 뭔.. 학교도아니고.. 사무실에서 핸드폰못쓰게함.. 코로나때매 휴게실없애서 쉴공간없음.."
25,태강대부,1369,1. 연봉이 낮다. 2. 대부업관련 스트레스 높다. 3. 연봉 낮은데 식대도 없다.
26,태강대부,1369,여초회사라 회사분위기 무서웠고 제대로 업무를 가르쳐주기보다 혼자서 하라는 식. 지금은 모르겠으나 다닐때 화장실 가는걸 눈치주고 무조건 업무를 많이 해야만 인정해주는 곳
27,태강대부,1369,"고인물 천지에 무식한 팀장들,,,오래다녀서 우물안 개구리들만 잔뜩"
28,태강대부,1369,지점마다 특색이 있는듯. 회사같지 않은 학교같은 회사 개판임
29,태강대부,1369,그냥 모근게 단점이고 저비용 고효율만 생각하며 복지수준이나 회사수준은 대기업에 발뒷꿈치도 못미치는데 직원들의 마인드는 대기업수준을 원하는 회사
