,company_name,company_id,review_text
0,테라젠헬스케어,6073,금요일 8시 예배있음 집 먼사람들은 새벽에 나와서 출근해야함. 차량상태 엉망...수리라도 좀 해줘으면
1,테라젠헬스케어,6073,"강제로 예배드려야됨. 강제로 일찍나온거는 급여에 안쳐줌.. 경리가 가족임.. 가족 회사.. 임원이었던 사원의 가족이 사원으로 있는데 대한민국에서 하면 절대 안되는 그걸 먹고 운전을 하다가..면허증없어짐..면허증 없어도 자르지 않음. 영업사원들 자기 지역 있는데도 하루 이틀 빼서 면허증 없는 영업사원 대신 운전해줘야됨.. 매출 안나와서 회의 시간마다 인격모욕 수준에 가까운 잔소리를 사람들 앞에서 하는 대표..직원들이 일찍 끝내고 집에가니 매출이 안나오는데 그냥 매출+매출+수금+수금 소리만 하는 대표 출근만 하면 강제로 ""예수는 그리스도 모든문제해결"" 억지로 시켜서 그만두고도 가끔 입에서 예수는 그리스도라고 자동으로 나옴.."
2,테라젠헬스케어,6073,차량수리 심하게 안해주고 노후화 유효기간 지난거 재사용(박스갈이등) 출근 및 출장시 새벽이동 연차사용 어려움 금요일 7시 반 출근 예배 납품 몇 년을 다녀도 신입급여 시장에서 점유율 떨어짐 급여 및 성과급 투명성 떨어짐 반품 어려움 휴대폰도 데이터 초과되면 직원부담 품질 가격 이미지 약국에서 최하 영업보다는 납품에 가까움 점점 하락하는중 운영진의 독선과 독재 무능 모든게 영업사원 탓 겉포장만 번지르르 한 기업 모두 들어왔다 몇 일만에 나감 진짜 갈 곳 없으면 들어오는거 강추 회의시간 본인 이야기하고 끝 모든게 본인이 답 남은 사람은 모두 50전후 미래성이 없음 대일밴드 만든 대일제약 아니니 명심 모든 직원의 목표는 탈출 그리스도는 엄청 부르면서 하는 행동은 참
3,테라젠헬스케어,6073,"인센티브 축소, 경쟁사가 많아 경쟁력 약화. 신제품이 잘 안 나옴."
4,테라젠헬스케어,6073,"자기개발에 대한 부분에 지원은 부족한 거 같고, 사무실 위치가 출퇴근시 불편함이 있음."
5,테라젠헬스케어,6073,대표라는 사람이 직원 의심하고 도둑놈 취급함 직원 귀한줄 모름 또뽑으면 그만이라는 마인드 회사 업무용차 고장나면 수리를 잘 안해줌 유튜브보고 고치라함 그럴거면 공업사 취직했지 이딴회사 왜감? 모집공고에 적힌 연봉이랑 실제랑 다름 금요일 아침마다 예배함 본사가 성남인데 성남에서 먼곳에 사는 직원들은 새벽 5시에 출발해야됨 미래가 안보임 오래다녀도 관리자 기회가 없고 4~50살 먹어도레이에 짐 한가득 싣고 약국 배달다녀야됨 팀플이라고 해서 지방이나 담당지역 영업다니는데 이게 젤 골때림 부산을 아침 8시 반까지 도착하라고함 기차 지원도 없음 직원들이 새벽에 운전해서 가야함 졸음운전으로 죽으면 책임질거임? 북한도 아니고 대표가 독재가 너무 심함 단점 더 많은데 너무 많아서 다 못쓰겠음
6,테라젠헬스케어,6073,"이 회사에 대해 여지껏 아무런 정보가 없었던 이유는 이런 사이트가 있다는 것조차 모를 정도로 임직원들의 무지함과 이직할 능력이 없는 무능함 때문이었다. 단점이 하도 많아서 어디서부터 어떻게 설명해야할지 모르겠다. 혹시라도 이 회사의 채용공고를 보고 지원할까 말까, 혹은 최종합격을 하여 다닐까 말까 고민을 한 끝에 여기까지 왔다면 밑도 끝도 없이 그냥 가지 말라고 조언하고 싶다. 무능하고 하찮은 직원들만 뽑는 이유는 싼 값에 굴려도 이직할 능력이 없으니 어쩔 수 없이 다니게 하게끔 하기 위함이다."
