,company_name,company_id,review_text
0,테크에이스솔루션,3340,직원 관리 미비. IT 기업 답지 않은 사내 정치를 해야하는 부담. 초기 멤버들의 텃새가 존재.
1,테크에이스솔루션,3340,체계가 없다. 승진이 어렵다. 복지가 많은 것 같지만 없는 느낌 다들 얇고 길게 갈 수 있다.
2,테크에이스솔루션,3340,"미국 본사에서 거의 모든 부분을 컨트롤하고 있어, 한국 지사의 독립성이 떨어짐."
3,테크에이스솔루션,3340,팀바팀이 좀 있음. 팀을 옮기기가 쉽지 않음. 신기술을 많이 접할 수 있지만 어느 회사나 마찬가지겠지만 배우고 쓰는건 자기 몫
4,테크에이스솔루션,3340,체계가 잡혀있지 않아 아르바이트 하는것 같은 느낌. 나이든 사람들이 많음
5,테크에이스솔루션,3340,너무나 빈번한 야근으로 인한 개인 생활 불가 설 추석 상여금 및 선물 없음 팀에 따라 업무강도 차이가 심함
6,테크에이스솔루션,3340,"빈번한 야근, 멘토 부족, 눈치보며 써야되는 휴가 그리고 평균 이하의 연봉"
7,테크에이스솔루션,3340,정확히 어떤방향을향해 나가고 있는지 잘 모름 주로 솔루션 위주
8,테크에이스솔루션,3340,"경영지원의 체계성이 부족함, 팀, 부서의 구분이 명확하지 않음"
