,company_name,company_id,review_text
0,트럼피아,3508,"외국계 기업이라고 되어있지만 그저 외국에 서비스하는 전형적인 한국 꼰대회사이며, 주변 사람들에게 얘기해도 해도해도 너무한다는 썰이 다수 포진한 회사 본인의 삶이 너무 지루하고, 쥐꼬리만한 월급으로 대충 살다 은퇴해도 괜찮다고 생각하는 사람에게는 추천 경력 개미지옥 (이 회사에 한번 빠지면 물경력으로 경력을 쭉 낭비해서 이직 못 할 수도 있음) 회상 일 안하는 고인물이 다수 포진되어 있어 평소엔 여유롭지만, 회사에 긴급하게 돌아가는 상황이 발생하면 다들 우왕좌왕하고 해결하지 못하다가, 결국 주니어들 탓으로 돌리고 그들을 내침. 그리고 주니어들이 잘못해서 일이 이지경이 됐다고 합리화 함. 고인물들은 여태 그렇게 이 회사에서 살아남았고, 앞으로도 절대 변하지 않음 참고로 위에서 언급한 고인물들은 모든 부서에 포진되어 있으며, 그들끼리 모두 한통속이라 혼자 잘해보겠다고 되는 정도가 아님"
1,트럼피아,3508,힘좋은 사람들 존재 놀라운 경영능력 놀랍고 아름다운 인사평가 아름다운 개인주의 Big brother is watching
2,트럼피아,3508,"비전문가의 뇌피셜로 개발방향성이 정해짐. 애자일이 기록을 하지 않는 것이라는 이상한 말도 들었음.  가장 큰 특징은 폭포수 모델이 갖는 Worst 를 경험할 수 있음.  정책이나 스펙은 없다고 보면 됨, 조사도 안하고 뇌피셜로 작성된 문서를 던져주고 개발을 강요함. 뇌피셜이기에 논리적이거나 기술적으로 부정을 넘어선 불능이 존재하기도 함. 이에 대해 말해도 개발리드들은 기본 CS 도 제대로 아는 이들이 없기에 정치적인 입김이 쌘 사람의 의견에 무지성 동의를 함. 실제 업무는 주니어 개발자에게 돌아감. 개발도중에도 하드코딩으로 바꾸라는 식의 강요를 받게됨. DB는 Varchar, 코드는 하드코딩을 사랑하는거 같음. 정규화 따윈 기대하면 안됨. 그게 뭔지 제대로 모르는 듯함. 물어보면 당연히 안다는듯 웃으면서 넘기려하지만 디테일하게 질문하면 헛소리만 하다가 화내면서 회피함. 여튼 여차저차 개발이 완료되어도 QA 시작과 동시에 방향성이 물갈이됨. 이때부터 새로개발한다고 보면되지만 윗선에서 정한 마감일이 끝나기 일주일 전쯤되기에 개발자는 바빠짐. 마감일 당일에도 계속 바뀌는 정책을 감당해야함. 그러면서 기존버그에 대한 책임을 물음. 깃로그 보면 3년전부터 그렇게 동작햇어도 그날 안좋게 보이면 버그가 되고 수정해야하는 것임. 일단 QA 가 자동화도 모르기에 시간이 오래걸리고 브라우저에 대한 이해도가 없음. 퍼블리싱이 이상해 보인다는 식의 버그티켓이 올라오지만 개발자도구로 보면 픽셀까지 정확함. 하지만 이상해보인다고 이상해보이는 이유를 물어봄. 근데 이 서비스는 도메인자체가 자동화기에 DAU 가 거의 AccountManager 가 접속하는 것 뿐임. 그래서 비즈니스나 로직이 중요하지만 매번 이상한 디자인이나 뇌피셜로 QA 진행하다가 6개월은 기본으로 걸리는거 같음. 1-2년 이상 걸리는 프로젝트도 있었는데, 이건 개발리드들이 이벤트소싱도 모르고 EDD 라는 키워드만 어디서 듣고와서 삽질하는거 였음. JDD 가 기본이라서 주니어들이나 비전공자 오면 뭔지도 모르고 낚임"
3,트럼피아,3508,"최근 리뷰 별점이 이 회사가 나아가는 방향을 보여줌 예전 리뷰는 진짜 옛날 얘기가 되어버림. 지금은 그 장점이 전부 사라졌음 근로기준법은 개나 줘, 아직도 주말 근무를 포함한 열정페이를 당연시하는 동네 슈퍼마켓만도 못한 경영정책 경영진의 기본 예의조차 없는 말투 + 영양가도 없는 헛소리를 듣고 있어야 해서 정신적으로 피폐해짐 한마디로 회사 와서 사람 취급받고자 한다면 어림도 없는 회사 비전공자가 봐도 이게 맞나 싶은 운영방식 회사에 대변기가 하나인데, 하루에 2~3번 30분씩 대변기에 앉아서 애니메이션 보는 월급도둑이 있어서, 생리 현상이 급할 때 신께 기도 가능 그의 존재를 회사도 알고 있는 것 같으나, 그 사람이 고인물이라 눈감아주는 느낌 출 퇴근 시간, 외출 시간을 초 단위로 체크해서 직원들에게 항상 그 사유를 물음 실제로 근무 시간이 1초 모자라서 한 소리 들은 직원이 존재하는 조선시대 회사 팀장급들 기본적인 CS 지식 없음. 합리적이고 정상적인 업무를 진행하려고 하면 말도 안되는 이유로 블락 먹고, 의견 내는 걸 가르치려 든다고 생각해서 기분 나빠함 이런 이유로 한 기능 출시에 6개월~2년 가까이 걸리니, 누가 뭐 했느냐 묻는다면 이 모든 과정과 회사 서비스에 대해 주절주절 설명해야 이 사람이 뭘 했구나. 대충 이해할 수 있는 정도 당신이 입사 후 너무 힘들어서 6개월~1년 사이에 퇴사를 결심한다면 당신의 포트폴리오엔 완성된 프로젝트 한 줄도 쓸 수 없다는 말 회사 경영진은 이전 퇴사자들을 배신자에 못되고 일 못하는 무능자로 만드는 거짓말만 하고 본인들 돌아볼 생각 안함 이렇게 써놔도 리뷰 쓴 사람이 누군지 찾고 처벌할 생각만 함. 절대 반성과 참고 따위 없음 조직문화를 개선하고자 했던 일 잘하는 사람들은 전부 퇴사하고 없어서 회사 분위기 안 좋음 짧게 쓸 수가 없는 단점이 이 회사의 가장 큰 단점"
4,트럼피아,3508,실세가 능력은없고 힘만 쎄니까 뭐... 회사 발전하기가 힘듦니다
5,트럼피아,3508,"수직적인 소통이 문제임. 요구사항이 개발적으로 잘못되어서 반론하면 공격한다고 생각함, 특히 시니어들이 CS 나 개발관련 지식이 부족해서 소통하기 힘듬."
6,트럼피아,3508,평균 근무 시간 및 지각을 초단위로 평가하는데 근무 시간을 판단하는 지문인식 기계의 오차범위는 20초가 넘어감. 해당 사항에 대해 여러 번 기계 결함에 대해 얘기했으나 고쳐주지 않고 그냥 일찍 오라고만 이야기함. 화장실 들르는 시간도 근무 시간에서 차감함.
7,트럼피아,3508,"위에것들 빼고 거의 다 어디로 가는지 모르는 회사의 비즈니스 모델, 정치질, 생색내는 복지 등등.."
8,트럼피아,3508,"연차가 오래된 직원분들의 텃세가 한없이 심하며, 회사의 발전에는 1도 도움이 되지 않는것을 대표를 포함한 경영진만 모릅니다."
9,트럼피아,3508,"사내정치 - 일부 사람의 기준에 맞춰 옳고 그름이 정해짐. 눈 밖에 나거나 일부 사람의 기준에 맞추지 않는 경우 회사 생활에 어려움이 생김. 사내 정치에 따른 업무량 분배의 불공정과 일 몰아주기 존재. 업무 성과나 강도에 상관 없이 눈에 든 직원을 업무적, 경제적으로 편애함. 인센티브의 지급 기준과 인사평가 역시 사내 정치에 영향을 많이 받음.  사내 괴롭힘 - 팀별로 다르나, 납득하기 어려운 이유로 타팀 혹은 같은 팀의 사우를 배제하거나 눈치보게 하는 분위기를 조성. 배제 당사자에게는 폭언으로 느껴질 수 있는 수위의 발언이 쉽게 오감.  개발 환경 - 경영진이 개발에 대한 이해가 부족하여 개발자의 의견을 수렴하지 못함. 개발 일정에 있어 개발자의 충분한 근거가 있음에도 경영진이 일정을 일방적으로 강요하여 야근과 주말근무를 강행하는 경우가 빈번함.  개발 역량 - 일부 관리자급 인사 기준이 모호함. 업무/조직 관리적으로 직급에 맞지 못하는 퍼포먼스를 보여주어 일반 사원의 경우 경력에 도움되지 않음 - 신입의 경우 개발적 역량을 얻을 수 있는 기회가 적으며 선임들이 적거나 개인적 업무로 바빠 개발적 노하우를 얻기 힘듬. 경력의 경우도 비슷하게 도메인 교육을 할 수 있는 선임이 적어 도메인 교육이 원활히 이루어지지 않음. 그러나 경력이라는 이유로 과중한 업무 분배와 과도한 책임감이 요구됨."
10,트럼피아,3508,"효율적이지 못한 업무 환경 - 수직적 구조로 인해 업무 일정이 실무자의 의견을 반영하지 못함 - 업무 일정을 줄이려고만 하는 경영진으로 인해 끊임없이 버려지는 주요 기능 - 자동화되지 않은 QA 테스트로 인해 긴 릴리즈 일정 (3개월 기본). 화면단에서만 이루어지는 QA 테스팅. - Redmine을 통한 비효율적인 이슈 관리 - Waterfall 형태로 업무가 진행되는 회사의 모든 단점을 가지고 있음.  타겟 없는 비즈니스 모델 - 정확한 타겟층이 지정되지 않은 비즈니스 모델로 인해 User research가 소용 없음 - Data 기반의 요구사항 분석이 아닌 경영진 의사 판단에 따른 기획이 이뤄짐 - IT 업계 트렌드에 전혀 무지한 경영진. - 의사 결정, 판단에 있어 Data를 기반으로 설득시켜 보려고 해도 전혀 듣지 않음.  경영진의 폭언/폭설 - 회의 시 욕설 사용 빈번 - 본인이 이해하지 못한 사안에 대해 언성을 높이고 화를 냄 - 회의 시 실무자 이야기를 듣지 않고 말을 끊으며, 본인이 원하는 답변이 나올 때까지 실무자를 다그침.  개선되지 않는 조직 문화 - 부서 간 불화. 사내 정치질 있으며 해당 사항에 대해 여러 번 퇴사자가 불만을 제기했으나 수용하지 않음."
11,트럼피아,3508,"기술적 발전이나 개발 조직 및 개인의 성장에 무관심의 정도가 지나친 것 같으며 그 이유는 세가지임  첫째, ""기술 부채"" 방치  개발 간 봉착하는 문제와 분석방식, 해결방식, 그 담당자의 시각에 대해 관심과 피드백이 부족함 그 대신, 담당자의 태도에 의존하거나 개인 취향을 토대로 엔지니어링 이슈를 해결함으로써 합리성을 쫓지 않음 편협함이 축적되고 기술부채는 당연한 것으로 인지하는 분위기  둘째, ""소통"" 방치  개발 간 회고나 의견을 묵살하지는 않으나, 업무에 반영하는 실행 징후가 불투명함, 의견은 상급자와 다르면 고집으로 치부되며 합리적 근거를 찾아내는 협의나 노력이 없기 때문인 것으로 추측됨 또한 현안은 자동으로 위로 보고되길 원하나, 자동으로 아래로 전달되지 않음 리더가 규정한 인풋/아웃풋의 소화만이 최대 관심사로 보임. ""구성원 = 특정 부품""이길 직/간접적으로 강제하고 있다는 느낌, 허울뿐인 경청과 존중/명령어조 사용/정기 회의 방치 등의 수단을 통해 지속적 소통을 허용하지 않는 인상을 받음 불통은 으레 일하면서 느끼는 스트레스이며 그 정도만 지켜볼 뿐, 현 인원 지키기 등의 다른 우선순위를 갖는 요소가 있는 듯함  조직by조직이며 주관적인 부분임 개선의 여지가 있어 보완이 될 것으로 기대되나 현재는 기술적 발전은 방치되고 자기방어적 행태를 용인하는 분위기임  셋째, ""코드"" 방치  경영진/개발자 모두가 체감할 수 있도록 개발 활동의 만족도를 개선 또는 개선 방법을 찾을 수 있는 직접적인 일이 코드를 리뷰하거나 관심을 갖는 일이라고 생각하지만 효과적으로 일어나지 않고 관리 대상이 아닌 것 같음   어쨌든 장점/단점은 공존하는거고, 단점을 통해 배울 것도 많음"
12,트럼피아,3508,"초 단위로 이루어지는 출근시간 및 점심시간 관리 화장실 포함 중간 외출시간 차감 타이트한 재택근무보고서 작성 기준이 모호하며 낮은 연봉 인상 추가 근무에 대한 기준없는 보상 혹은 보상 없음 끊임없는 회의가 실제 업무를 방해 특정 부서가 업무와 무관한 힘을 가지고 일정과 프로세스를 통제 몇년째 개선이 없는 프로덕트 관리 계층의 임원이 직접 직원 관리를 시도하나, 관리 능력의 부재 직원들을 자주 심리적으로 태움"
13,트럼피아,3508,역량이 부족한 몇몇 사람들이 반대로 훌륭한 역량을 가진 몇몇 사람들에게 심하게 묻어가는 느낌이 있었고. 본사와의 거리적 문제로 쓸모없는 관리 시스템들이 종종 생겼습니다.
14,트럼피아,3508,성장 동력에 의문 제왕적인 사장님. 근데 정작 사람 관리는 못하시는 듯... (죄송하지만) 배울만한 동료가 거의 없었음
15,트럼피아,3508,"화장실 가는 시간 포함 자리를 비우는 모든 시간을 근무시간에서 깎아서 점심시간 제외 8시간 근무 여부 확인. 주먹구구식 업무와 명확하지 않은 업무 범위. 경영진의 기분에 따라 직원을 심하게 몰아붙이는 분위기. 예전에는 낮은 연봉이 아니었겠지만, 현재 기준에서는 절대 높은 연봉의 회사가 아님. 사내 정치가 심함."
16,트럼피아,3508,실력 괜찮은 몇 개발자를 제외하고는 개발자 맞나 싶음. 회사 분위기가 개인주의 성향이 강하고 누가 누굴 봐줄 시간없이 개인들 일정이 빡빡하기에 개인이 맡은 프로젝트에 대한 비즈니스는 알아서 배우고 깨우쳐야 함. 근태를 초단위로 관리하고 화장실이 밖에있어 화장실가는 시간도 근무시간에서 제외하여 일 8시간을 무조건 채워야 함. 15년 정도 된 기업이라 고이다못해 썩은물이 존재하고 사장은 미국에 있어 가끔 한국에 오니 사장 측근들에 입김이 매우 강하고 정치질 이간질 등이 존재하나 윗선은 전혀 모르며 안다 하더라도 손댈 생각이 없어보임
17,트럼피아,3508,일하는 사람만 일하기 때문에 놀면서 인센티브를 같이 받아가는 사람들이 좀 있음
18,트럼피아,3508,"보고를 위한 문서화, 회의 및 사전회의가 많아 윗 직급은 본인의 업무를 할 시간이 없어 거의 항상 야근함. 포괄임금제라서 수당이 없음. 서포트 처리 전화가 새벽이나 퇴근 후 종종 옴. 수습기간이 아닌 모든 사원부터는 뛰어나 퍼포먼스를 요구하여 사원에게는 대리급, 대리는 과장급 등 더 뛰어난 성과를 요구함. 승진체계를 아는 사람이 없음. 인사평가 시, 사람을 A~D 등급 등으로 나누는데 맡은 업무를 충실히 수행한 사람은 C, 기껏 뛰어나봤자 B등급이라고 하는 말이 있는데 이는 좀 과함."
19,트럼피아,3508,사장 맘대로인 회사. 문제가 생기면 개인의 탓을 하고 개인을 쫒아냅니다.
20,트럼피아,3508,사장이 너무 일부 사람의 말만 맹신함 이력도 화려하고 경력도 충분하신 분들이 어찌 이리 근시안적이신건지 모르겠음
21,트럼피아,3508,"보고를 위한 문서화가 지나치게 많고, 회의를 위한 회의 또한 많아 윗 직급으로 올라갈수록 본인의 시간이 없어져 야근이 빈번함. 또한 포괄임금제라서 수당은 따로 없음. 기존의 유연한 제도는 점차 없애고 중소기업에서 대기업의 퀄리티를 자꾸 요구함."
22,트럼피아,3508,업무의 강도가 쎄지만 다양한 경험 쌓기엔 좋은 회사인 것 같아요
23,트럼피아,3508,당신의 의견을 전달해줄 관리자는 아무도 없으며 사소한 의견을 제시하는 것 조차 부정적인 평가로 반영될 각오를 해야함. 고민하고 토론하는 문화의 부활은 도저히 기대할 수 없을 것.
24,트럼피아,3508,"1. 회사가 무엇으로 돈을 벌고 있는지 아무도 모르고, 성장시키려면 무엇을 해야 하는지 고민하거나 비전을 가진 사람이 없음. 그냥 문구점을 차렸는데, 학교가 앞에 있어서 여기까지 성장한 것. 기획 하는 사람들도 기획의 기준이 없음. 서비스를 설계하고 구현하는 당신도 기획의 목적을 알 수 없다.  2. 회사에 대리 과장이 없다. 왜 없을까? 사람이 남지 않는 것에는 이유가 있다.  3. 당신이 신입이라면 배울 수 있는 사람이 없을 것이다. (미안한데, 신입이 혼자 설계 구현 다 정상적으로 할 수 있을거라고 생각하는 여포는 없을 거라고 본다. 스스로를 믿지 마라.. 이상한 습관만 생기고 앞길에 좋지 않다.) 아무도 자신의 미래에 대해 치열하게 고민하거나 자기개발하지 않으며, 당장 회사가 문을 닫으면 갈 곳 없는 사람이 태반이다. 회사에 개발,기획, QA는 없고 공무원만 있다.  4. 당신이 좋은 서비스를 개발하는 것 보다, 상부에 복종하는 Yesman이 되는 것이 당신의 인사고과에 좋을 것이다.  5. 열정적으로 무언가를 해 보려 하지마라. 당신만 상처받고 떠날 것이다.  6. 당신 주변에 악의적인 Snitch가 있다. 조용히 떠날 준비를 해라."
25,트럼피아,3508,"1. 높은 개발자의 퇴사율 2. 일정, 인사, 업무 등 회사 전반에 걸쳐서 10년간의 노하우가 있는지 의문 3. 업무처리 프로세스의 부재와 비 엔지니어 직군의 높은 개발프로세스 개입 비중으로 인한 10년간의 기술부채 4. 업무지원 처리를 위한 외부 유료서비스 지원에 대해서는 굉장히 보수적인 편 5. 업무와 직접 연관된 학습 외에는 사내 학습시 부정적인 시선 존재"
26,트럼피아,3508,너무 감옥 같이 직원들을 시간 등으로 조여옴. 1초 2초 마저 따지는 회사.
27,트럼피아,3508,일하는 사람만 쪼이고 그 뒤에 숨은 자들은 편하게 다님. 사장 눈밖에 나면 사원이고 과장이고 다이렉트로 깨짐.
28,트럼피아,3508,회사에 개발자가 아니라 공무원 마인드의 직장인이 너무 많다. 사장은 투자해서 앞으로 달려가려고 하나 회사의 분위기는 단 하나의 리스크도 감당하지 않으려는 태도가 많다. 사장은 미국에 있고 개발자가 아니기 때문에 문제를 정상적으로 인지하지 못하고 있다. 위에 문제로 인해 남아있는 허리를 담당하고 있는 인력이 점점 줄어 간다. 본인이 야망이 있다면 중간까지는 누구보다 빠르게 올라가겟지만 벽에 부닥치게 될 것이다.
29,트럼피아,3508,"사장, 경영지원팀 마음대로 규율이 정해지고 제재하는것도 그들의 기분과 친분을 기준으로 좌우 사장이 자꾸 교회얘기함"
30,트럼피아,3508,8시간 근무를 채워야 함 화장실 or 담배 피우러 갈 경우 그 시간만큼 더 채워야 함 안 채웠을 경우 인사평가에 불이익이 있음.  기획서가 픽스 안되고 개발 기간 중 계속해서 바뀜 기획서가 바뀌어도 개발자들은 정해진 일정에 맞춰서 개발해야 함 심지어 테스트 기간에도 기획서가 바뀌어 업무강도가 엄청 높음 이점을 경영진에게 말해도 너네가 참고 감내하며 개발하라고함  사내 정치가 매우 심함 언제나 정치에서 지는 건 개발자임  회사 분위기가 개인주의 성향이 강하고 개인들 업무강도가 높아서 물어봐도 잘 알려주지않음(못알려줌) 개인이 도메인 지식과 비즈니스 로직을 스스로 깨쳐야 함  릴리즈가 있을 경우 미국시간에 맞춰서 진행하다 보니 저녁 늦게 퇴근함 회사에서는 나름 선심 쓴다고 아침 10시에 출근하라고 하는데 10시에 출근해서 22시에 퇴근하는데 무슨 의미인가 싶음  회식비는 오로지 저녁 회식에만 사용해야 함 이전에는 회식을 안 하는 경우 음료를 사 먹거나 간식을 사 먹었지만 어느 새부터 저녁 회식 이외에는 사용하지 말라고 함 저녁회식은 잘 안 하려고 해서 팀 끼리 소통이 없음  사장이 재택근무 하는거를 매우 싫어하지만 어쩔 수 없이 허락함 한창 코로나가 심할 때 A조 B조로 나뉘어 격일로 사무실 출근/재택근무 하라고 하는데 이게 무슨 의미인가 싶었음
31,트럼피아,3508,정치질을 하는 사람이 있어서 회사 분위기를 다 망침. 내가 일을 잘하고 못하고는 그 사람들의 친분에 따라 결정됨. 협력 할 수 없는 분위기며 서로 일을 하려고 하지 않음.
32,트럼피아,3508,인력은 부족한데 쓸데없는 일을 자꾸 벌려서 정작 능력있는 개발자들은 몇년새 줄퇴사. 미국에서 사업하니까 문제 생기면 새벽에 미국에서 전화옴.
33,트럼피아,3508,"책임에 대해서 근거없이 책임을 묻는다. 왜 책임을 져야 하는지 모름. 사장님의 각 개인에 대한 마이크로 매니징을 하는데, 이에 대한 근거가 없음 (그냥 기분). 팀장들에게 권한은 주지 않고 책임을 계속 요구함."
34,트럼피아,3508,"개발은 주로 한국에서 맡아서 하고 미국에서는 영업, 마케팅을 위주로 하기 때문에 미국에서 개발자로 일하기에는 커리어 측면에서 좋은 것 같진 않음. 개발자로서 커리어를 쌓기에는 적합하지 않은 듯"
35,트럼피아,3508,사업 부문 특성상 다른 방향을 모색하지 않으면 향후 큰 성장을 기대하기는 어려움 시스템이 불안불안하고 극소수 개발자에 대한 의존도가 지나치게 높음 배울만한 사람이 거의 없다 보니 개발자로써 개인의 성장은 불가능하다 보면 됨
36,트럼피아,3508,"일하는 사람만 일하고, 일하는 사람한테만 일이 몰린다.  DBA는 딱히 없고, 보통 해당 개발자가 필요한 걸 직접 다 만드는 경우가 많다. 그로 인해 일정 기간 이상 새 기능이 추가되고 나면, 최적화를 위한 리팩토링과 DB 구조 개선 작업이 따로 필요한 경우가 있다. 물론 이마저도 다른 업무에 밀려서 이것도 똑바로 할 시간을 안 준다. 결국 서비스는 불안정해지기만 할 뿐.  업무 강도는 자신의 스케줄을 직접 관리하는 분위기로 쾌적한 편이지만, 인사고과는 실제 실적보다 실세들의 평가가 더 크게 작용하기때문에, 공정하다고 평가하긴 힘들다."
37,트럼피아,3508,"노른자를 먹어본적이없어 두려움에 흰자만 돌려먹음. 신입 1년차가 약 30% , 소기업의 어이없는 한국식 정치세력, 효율적인 경영팀의 부재는 직원들의 다양한 불만과 악순환구조를 반복 시킬수 있다."
38,트럼피아,3508,"관리자, 기술력, 시간(일정) 개념의 부재 성장가능성을 높이 볼수 없음"
39,트럼피아,3508,거의 대다수의 직원이 2년차가 안된다. 그로인해 의사결정이 오래 있던 사람의 의견을 무시할 수 없고 사장이 없기 때문에 정치가 심하다. 서비스는 비효율적이며 복잡하다. 과거에 업무량이 많고 속도에 집중해서 인지 대학생 과제 수준의 코드가 여기저기 있다. 문서화는 없고 정리된게 없어서 업무진행은 더디기만 하다.
40,트럼피아,3508,"미국과 일하다보니, 시차에 따른 업무 진행이 가끔씩 답답할때가 있음. 스카이프를 통한 sign in , sign out 일과체크로 인해서 압박감이 있는편. 2달정도마다 릴리즈에 따른 야근업무가 있음."
41,트럼피아,3508,"비생산적인 프로세스, 개발 기술이 노후되었지만 갈아엎지않고 억지로 운영하고 있음"
42,트럼피아,3508,하루 일하는 시간중 10분 쉬는것도 못마땅해함. 암묵적으로 초과근무에 대한 압박이 있다. 정치가 심하며 직원들간 신경전으로 건강이 악화되어 퇴사하는 사람들이 더러 있음. 업무 강도와 사람에 대한 스트레스로 직원들에게는 생기라고는 찾아볼 수 없으며 입사초반 열정적이고 생기있던 사람들도 모두 시들어버림.
43,트럼피아,3508,비합리적 인사태도 와 평가시스템 그리고 실세 에게 잘 보이면 어느정도 위치까지 올라갈 수 잇음
44,트럼피아,3508,"회사가 설립된지 오래되지 않아서 그런지 자주 변경되는 시스템으로 인한 불편함. 직종에 따라 다른 편이지만, 잦은 라이브 서비스로 인한 잦은 야근."
45,트럼피아,3508,"""체계가 안잡힌것이 제일크다. 회사의 시스템 및 서비스가어려워 신입이나 주니어개발자 또는 경력직 개발자들이 처음와서 적응하기가 힘들다. 끼리끼리 노는 문화. 실세가 존재함."""
