,company_name,company_id,review_text
0,펄어비스,567,"급작스러운 인사와 불완전한 리더십, 조직적으로 확장할 수 있을지 의문"
1,펄어비스,567,"일이 생각보다 많고, 그게 과연 효과적인지는 단 시간에 눈에 들어오지 않기 때문에 의문이 생긱 때가 종종 있습니다."
2,펄어비스,567,c++자체엔진이 처음에는 흥미롭지만 시간이 지날수록 경력을 살릴 수 있을지 의문이 듬
3,펄어비스,567,"임원급은 물론이고, 실장직까지 지인으로 채워지는 곳. 능력없는 사람이 헤드이니 머리에 든 것은 없으나 어찌됐든 이건 아니란 식의 피드백만 줌. 살아남으려면 점쟁이가 되어야 함."
4,펄어비스,567,회사분위기가 경직되어있습니다. 특히 일부 사람들은 타 직군에대해 우호적이지 않습니다.
5,펄어비스,567,업무 난이도가 너무했습니다. 시스템상 계속 헤맬 수 밖에 없었어요
6,펄어비스,567,"워라밸이 없음, 워라밸이 없어도 너무 없어요. 10년을 다닌사람 보면 진짜 존경스러움"
7,펄어비스,567,워커홀릭이 아닌 이상 추천하기 어렵습니다. 관리자들이 여러모로 좋지 않습니다.
8,펄어비스,567,수시로 앞뒤가 다른 모순적인 업무형태로 인해 자존감이 높은 사람도 버티기 힘듦
9,펄어비스,567,딱히 단점은 없었는데 채용을많이 안하는게 아쉬웠던 회사
10,펄어비스,567,성과중심문화가 강해서 업무에집중하고 결과를 보여줘야 한다
11,펄어비스,567,야근을 하지 않으면 이상하게 보는 기업 문화 ASAP 요구되는 개발이 많은 편
12,펄어비스,567,어떤 기준으로 사람을 뽑는지 모르겠음 계약직이 많고 정규직이겠지 했던 사람도 계약직 부바부겠지만 부의 제일 높은 사람이 일의 능력치보단 사람을 느낌으로 판단해서 계약이 결정됨 계약하지 않을 사람을 쎄하게 차이를 두고 행동해서 본인이 앞으로 어떻게 될지 미리 알아버림 내가 이 부서의 모든 권한을 가지고 있다는 말을 입사 초반에 들음 야근이 매우 잦음
13,펄어비스,567,작업방식과 조직구조가 치명적으로 맞지 않다. 팀 단위 부서끼리 수평적으로 업무에 대해 얘기하지만 그 이상의 결정권자는 이 대열에서 벗어나 있다. 즉 아무리 합의된 사항을 만들어 제출해내도 승인의 여부에 따라 무용지물이 되며 결국 입맛 맞추기로 방향이 회귀하는 현상이 일어난다.
14,펄어비스,567,"1. 기준이 없는 리뷰문화. 피드백 받으면 그냥 고쳐야합니다. 2.리뷰시 실수가 생기면 모든 내용은 슬랙에 적습니다. 구두공유해도 실수내용은 무조건 남겨 자존감을 박살냅니다.(자잘한 것 들일지라도요) 3. 그러다보니 리뷰시에는 어떻게는 태글걸기위해 예민해지고, 눈에 쌍심지를 켜게 됩니다. 4. 자리를 비우면 눈치가보이고 숨이막힙니다 5. 업무에 집중하다가도 슬랙은 즉시 확인을 해야합니다-> 확인하다보면 업무의흐름이 모조리 다 깨집니다. -> 멀티를 하다보면 뇌가 망가짐을 느낍니다. 6. 잘해도 칭찬보단 다른 못한점을 부풀려 피드백을 해줍니다. 7. 사람을 뽑았으면 같이 성장시켜주고 북돋아주어야하는 문화도 있어야하는데 연차와 상관없이 칼같이 업무성과를 내지 못하면 일 못하는 사람, 펄어비스와 안맞는사람으로 간주됩니다. 8. 평상시 일만하고 사적인대화가 잘 없습니다. 9. 산책과 잠시 휴식은 알아서 하되 눈치보여서 자리비우는 사람 보기 힘들고 바쁠땐 꿈도 못꿉니다. 10. 사내병원가는 10분조차도 휴게(돈 깎임)를 올리고 가야하는, 당연한건데 뭔가 씁쓸함이 느껴집니다. 11. 업무보고를 해야할 곳이 너무 많습니다. 보고할게없으면 알아서 찾아내야합니다. 12. 위치가 좋지 않습니다. 13. 밥이 맛이 없어졌습니다. 14. 사람을 소모품 취급합니다. 돈이면 다 되는줄압니다. 뽑는건 대기업행세를 해서 들어가기힘들지만, 그에비해 사람자르는걸 쉽게 생각합니다. 15. 시험의 내용이 실무에 직접 쓰이지 않고 커리어에 도움안되는 일만 쳐내기 바쁩니다. 16. 일상생활 컨트롤이 잘 안됩니다. 평일약속은 꿈도 못꿉니다. 17. 경력을 안좋아합니다. 경력이면 모든것에 순종해야합니다. 18. 프로그래머라면 커리어발전이 어렵습니다. 신입은 잠시다니기엔 괜찮을지도. 19. 사람의온기를 잃습니다. 그냥 모두 가면쓴 것 같아요"
15,펄어비스,567,샤우팅 종종 듣고 업무하중이 심함. 야근은 밥먹듯이 함
16,펄어비스,567,게임업계 특성상 업데이트 싸이클이 일반적으로 일주일이라 빡시다
17,펄어비스,567,복지도 결국 연봉에 포함되서 연봉 뻥튀기가 심함. 나중에 이직을 고려할 때 걸림돌이 되기도함. 그리고 내가 이곳에서 높은 곳을 바라본다면 그건 내시가 되는거 아니면 정말 힘드니... 욕심을 버리고 일하는 것을 추천함.
18,펄어비스,567,다들 갈려나감. 야근 많이함. 눈치 많이 줌. 게임을 못만들어냄
19,펄어비스,567,솔직히 정직원들은 많이 힘들어보였음. 비포괄이라곤 하지만 야근이 당연한 기업문화였음. 회사 내에서도 어느 스튜디오에서 일하는지에 따라 분위기가 상당히 다른듯 함
20,펄어비스,567,전형적인 탑다운인데 그마저도 제대로 소통이 되지 않는다.
21,펄어비스,567,"근본 없는 체계, 당일 해고, 직원들은 못하게 하지만 윗선들은 하는 친목질, 주먹구구식 업무진행"
22,펄어비스,567,복지 빼곤 다 안좋음 최근 퇴사율만 봐도 알 수 있는 사실임
23,펄어비스,567,알바 계약직이었어서 아쉬워요 더 길게 일했으면 좋았을텐데
24,펄어비스,567,"신작 출시가 늦어져 미래가 불투명하지만, 검사로 잘 버티고는 있음"
25,펄어비스,567,"주말근무, 내 시간이 없음. 상사의 악평과 동료들한테 밥먹는 장소와 인간관계도 눈치까지 봐야함."
26,펄어비스,567,1. 너무 잦은 퇴사자로 인해 인수인계가 없는 경우가 발생합니다. 2. 항상 최선의 방식을 찾아 효율성을 따진다고 하지만 비효율적 입니다.
27,펄어비스,567,[단점] - 개인의 삶이 없어짐 (개인 시간이 아에 보장되지 않았습니다) : 업무 시간 외에도 슬랙하고 답변 안오면 전화가 왔습니다 - 구성원간 소통이 안되는 문화 - 오래된 신작 출시 지연으로 인해 신작 부서 뿐만 아니라 조직 전체가 병들고 있음 - 회사의 비전이 보이지 않아서 퇴사했습니다.
28,펄어비스,567,"출퇴근길 불편, 야근 강요 분위기, 주먹구구식 일처리, 멘토 찾을 수 없음"
29,펄어비스,567,커리어성장이 어려움 오래다닐수록 이직이 어려울듯 꼰대문화. 천룡들 아니면 살아남기 어려운구조. 겪어봐야앎
30,펄어비스,567,부바부겠지만 워라벨 포기해야 할 수도 있음 이것도 부바부 겠지만 텃세가 있을 수 있음
31,펄어비스,567,한 해 동안 일한거 내려쳐서 연말평가 안좋게 줌 어떻게든 연봉 안올려주려고 하는듯
32,펄어비스,567,몇년 전이지만 월화수목금토 꽉 채워서 일했고 야근이 기본이었습니다. 다들 바빠서 업무를 체계적으로 배우는 것이 불가능
33,펄어비스,567,주는만큼 시킵니다. 사실 일하면서도 이정도 주는데 이정도 해야지라는 생각이 들긴 하는데... 사실상 워라밸이 좀 많이 부족합니다.
34,펄어비스,567,"급여와 복지 제외하고, 좋은 점을 찾기 어려움.. 업무 히스토리 찾기가 어려우며, 매번 주먹구구식으로 프로젝트가 기획됨, 정치가 심해 주측들에게 한번 찍히면; 그 후는 알아서 상상해보시길; 업무는 시/분 단위로 보고 해야해서 업무량보다 보여지는 업무에 신경을 써야함 폭언이 일상이지만 , 그 주인공들은 남아 있고 주변 동료들만 퇴사하는 것을 보면… 지속적으로 감소하는 인원을 보면 대략 다들 답 나올 것임"
35,펄어비스,567,업무와 삶의 균형을 맞추기 어렵고 워라벨을 추구하는 분들에게는 근무환경이 좋지않음
36,펄어비스,567,프로세스가 잘 갖춰져 있지 않음 빠르게 바뀌는 의사결정
37,펄어비스,567,돈을 제외하면 장점을 찾기가 힘듭니다. 갈수록 기회도 줄어들고요
38,펄어비스,567,독특한 경영철학? 너무 특이해서 왜저러나 싶을때가 있음. 그래서 묘하게 불편하고 불안함
39,펄어비스,567,"수직적인 문화와 타이트한 일정, 이로 인해 쌓여진 처리 해야 할 이슈들 이런 부분들이 모여서 퇴사자가 많다 거기서 나가는 인원과 새로 들어오는 인원들의 순환은 자체 프로세스 특성과 맞물려 업무의 과중 스트레스로 이어지며 또 다시 순환으로 이어진다"
40,펄어비스,567,고인물들 팀장 초창기 멤버 등 문제가 많은곳이며 신입들은 살아남기 힘듬
41,펄어비스,567,"기계마냥 하루하루 갈려가는 내 자신을 보며 현타가 옴 주먹구구식 경영, 열심히 작업한 작업물이 윗사람 말 한마디에 날아감"
42,펄어비스,567,전혀 소통이 되지 않는 천룡인 군단. 일은 팀원들에게 배우는 것 같은데 막상 일 잘하는 팀원들은 다 잘려나가는 기적과도 같은 현상.
43,펄어비스,567,팀장급이 모든 결정을하기에 자리에 없으면 업무가 안돌아감 의미 없는 야근
44,펄어비스,567,너무 삭막해서 등꼴이 오싹함 라인이 눈에 보이지 않지만 있다. 사람이 많지만 사람냄새 안난다. 기계같다.
45,펄어비스,567,일이 많다 정말 일이 많다 리니지 라이크를 안만드니깐 직원이 힘들다
46,펄어비스,567,"장점빼고 전부 라고 많이들 적으시는데, 그렇게 제가 입사해서 많이 당했습니다. 대충 몇가지 적어봅니다.  1. 천룡인이라 불리는 N명에 의해 모든 결정이 내려지는 회사. 퇴사 면담시 인사팀에서 ""천룡인이라 불리는 분들 때문에 저희도 어떻게 맞춰드릴 수가 없습니다... 그냥 그분들 기조에 맞추지 못하시는 분들은 다 퇴사하시더라구요"" 라는 말을 들었음. 당사자 빼고 모두가 아는 기형적인 구조. 스타트업으로 시작한 회사라, 초기 맴버들이 권력을 쥐고있고, 스타트업으로 시작한 회사라 체계가 없어도 이해해야하고~~~~ 등등의 궤변을 늘어놓지만 펄어비스는 지금 스타트업이 아닙니다. 정신차리세요. 2. ""야근 안하면 고과 안좋을 수 있습니다"" 라고 말하는 천룡인 이 말 듣고 식겁했다. 다행히 본인은 강제로 굴림 당하며 N개월 연속 풀야근을 찍고, 미친듯한 추가수당을 보며 겨우 버텼음.. 회사의 기조가 그냥 이렇습니다. 열심히 한다의 척도가 누가누가 오래 엉덩이 붙이고 앉아있는지 여서 퇴근을 못해요. 3. 24시간 내내 진행되는 최악 그 이상의 정치질. 그 안에서 살아남으려면 나도 괴물이 될 수밖에 없었음. 아무리 영리를 추구하는 집단이여도, 같은 팀이면 서로 챙겨주고 보듬어주며 함께 나아가야 하는데, 이 회사에 대다수 팀들은 전혀 그렇지 않았습니다.. 나 포함, 다른 친한 분들의 팀에서도 동일하게 뒤쳐지는 사람들은 철저히 비난의 대상이 되며 점진적으로 인사 불이익을 주고 결국 제 발로 나가게 만듭니다. 이렇게 친한 동료들을 10명 넘게 잃었습니다. 결국 제 스스로도 책임소재부터 생각하고, 남의 잘못된점부터 확인하려 하고.. 괴물이 되어가고 있는것을 느꼈고 더 무저갱으로 빠지기 전에 이직을 결심했습니다."
47,펄어비스,567,무엇을 상상하든 그 이상. 정치와 라인타기 모함 음해가 가득한 회사. 다니면 다닐수록 물경력이 되지만 정치력은 급상승 하는 곳. 누군가를 상처입히고 짓밟으며 올라가도 양심에 거리낌이 없는 자들만이 살아남는 곳.
48,펄어비스,567,아래 직원들을 그저 소모품으로 생각하는 경향이 있습니다
49,펄어비스,567,윗선 눈치를 어마어마하게 봄 분단위 초단위 업무 기록 및 파악 이게 실무 시간보다 오래걸림
50,펄어비스,567,업무 강도가 강하게 느껴질 수 있다. 대중교통 이용이 불편하다. ( 역사로 부터 도보거리가 좀 있다 )
51,펄어비스,567,주먹구구식의 일스타일은 사람을 힘들게한다. 회사사이즈를 보면 전혀 그럴것같지않지만 정말 작은 스튜디오처럼 일을하고 그렇게 일을하는것이 회사의 자랑이라 생각한다.
52,펄어비스,567,회사의 존재 자체가 단점인 최악의 기업. 여러 회사를 다녀봐서 회사마다 장/단점을 생각해 볼 기회가 많이 있었으나 펄어비스는 장점을 도저히 찾을수가 없다. 유사이래 최악의 영리집단이며 사회가 배제해야 할 패악과 병폐의 온상
53,펄어비스,567,업무량이 진짜 과다한다.. 감당이 안될 수 있는 정도로 많고 힘들 수 밖에 없음
54,펄어비스,567,"사내 정치, 실무자들의 멘탈이 박살나는 회사 운영, 팀바팀이겠지만 블라인드엔 90퍼 이상이 욕이다."
55,펄어비스,567,개발이 워낙 빡시다보니까 회사의 중심은 개발부서를 위해서 돌아가고 있습니다. 단점은 아니지만 많은 분들이 힘들어하는 요인 중 하나인 것 같긴 합니다.
56,펄어비스,567,코드리뷰 없었음(지금은 있는지 모르겠네요) 대화하기 좀 삭막함
57,펄어비스,567,"자체엔진이라 상용 툴이 아니다보니 이직하기 어려울 수 있음, 힘듬"
58,펄어비스,567,상기 장점 외에는 모두 단점. 리더들이 하나같이 고압적이고 소통을 할줄 모른다. 그런 문화를 그대로 배운 신입들은 똑같이 행동한다. 답이 없다.
59,펄어비스,567,"잦은 야근, 이것 저것 시키는것 다 해야한다. 짜잘한거부터해서 아예 모르는 분야들까지 해야한다. 면접시에 넌지시 얘기를 듣는다면 무조껀 다른 분야 업무 하게될 가능성이 높아요."
60,펄어비스,567,초역세권은 아니라는 점? 역에서 15분 정도 걸어야 함. 제외하고는 딱히 없었던 것 같다.
61,펄어비스,567,"규모가 큰 개발 집단인데 비해, 게임 기획서를 작성하지 않는다 인턴 초기엔 자사 게임을 플레이 안해도 뽑았다고 했지만, 막상 전환되는 것은 자사 게임 플레이가 크게 작용한 거 같다"
62,펄어비스,567,맨 꼭대기층 사람들 위주로의 경영 시설은 좋아 졌지만 층간의 분리로 인해 부서간 협업이 전보다 잘 안되는듯 워라밸 없음
63,펄어비스,567,"팀,직무별로 다르겠지만 본인이 속한 팀은 정규직 전환율이 매우 낮았음."
64,펄어비스,567,세상 정치질이 심함.. 일 잘해도 천룡인 눈에 벗어나면 나가야 함 여친 팀장으로 꽂고 그 여친과 전에 사내연애했던 일잘하는 사람은 쫓아냄. 회사가 정말 잘 돌아간다.
65,펄어비스,567,"꽉 막힌 결정권자, 업무 이해도가 떨어지는 상급자, 결정을 뒤업는 유관부서 사옥으로 다 함께 모였지만 업무 진행이 안될 때가 있습니다."
66,펄어비스,567,체계가 부족한 것 같음. 계획적이지 않게 눈앞에 닥친 일만 하는 경향이 있는 것 같음
67,펄어비스,567,"진짜 영혼과 시간을 갈아넣는 곳. 인격모독, 가스라이팅, 정치질, 팀원이 언제든지 내 등쳐먹을 준비하고 있어도 난 야근 수당으로 환산해주기민 하면 괜찮다? 그럼 오시면 됩니디."
68,펄어비스,567,고인물에 ㄷㅇ씨의 신영역화로 내의견따윈없다 고인물들의 정치판인데 무적신성 완도브라더스의 입김이면 다짱먹음
69,펄어비스,567,기업문화가 비정상적임. 비상식적인 규율을 그냥 윗분들이 싫어하니까. 라는 이유로 강제로 해야하며 지켜야 함. 친목이나 업무 외적인 것으로 직원과 대화 금지시 되며 어울림을 보이는 순간 바로 불려가는 문화방식.
70,펄어비스,567,중간중간 꼰대 상사가 껴있다. 하지만 그거 말고는 딱히 신경쓸 부분이 없는 듯 하다. 굳이 따지면 교통편정도?
71,펄어비스,567,불안한 고용 환경 동료를 동료로 바라보기 힘든 조직 구조 경영진의 독단적 의사 결정
72,펄어비스,567,워라밸 포기해야 함. 최선을 다해서 열심히 해도 더 열심히 해야 한다는 마음이 있어야 함
73,펄어비스,567,"손이 빠르고 일처리가 남들보다 빠른편인데도 달에 3~5회 씩은 야근을 했었던 것 같다. 직접적인 커뮤니케이션을 내세우고 있지만, 당연 좋은 점도 많겠지만 입김이 쌘 직원의 말로 큰 일도 끝물에 흐지부지되는 경우가 많다고 느꼈다."
74,펄어비스,567,출퇴근이 어려움 개발자 비개발자 사이에 벽이 있는 느낌 어중간한 시니어가 많음
75,펄어비스,567,위에 말한 장점 외 다른 것들 사내 정치가 심함 수직적인 분위기 쎈 업무 강도 별로인 윗사람들 눈밖에 나면 사람 무시하는 중간직 눈밖에 나면 그냥 한순간에 정치질로 중간직 이상들에게도 그렇게 소문이 나는듯함 오히려 사원들이 제일 착하고 친절함 중간직 이상도 케바케긴 하지만 몇몇 사람들 인성이 신기할 정도라서 퇴사 후에 우울증 약도 처방받음  업무 강도가 높은 것은 개인적으로 마음에 들었으나 실질적으로 사람이 제일 힘들었음. 오히려 업무 강도가 있는 점이 제일 맘에 들었으나 높은 위치의 사람들 때문에 다시 가고싶지는 않고 갠적으로 멘탈 강하다 생각했는데 보아하니 걍 멘탈 겁나 흔들어 놓고 네네 하면서 수직적인 구조 다 받아들이면서 다닐만한 사람 뽑는듯
76,펄어비스,567,"신사옥 근처에 아무것도 없음, 가끔 들려오는 소문에 놀람"
77,펄어비스,567,"딱히 쓸 말은 없지만 굳이 적어본다면 , 체계가 없음 팀이 자주 바뀜"
78,펄어비스,567,출근길 교통이 불편한 소소한 단점이 있음. 업무 강도가 매우 센편이고 인사평가에 대한 보이지않는 스트레스가 항상 깔려있다.
79,펄어비스,567,다른 사람들을 봤을 때 단기간에 빠르게 일을 처리해야돼서 일이 빡세보임. 확실히 다른 곳 보다 일이 많은건 맞는 것 같다.
80,펄어비스,567,야근이 많아 워라벨이 지켜지지않음 주말에도 근무했을때가 많습니다
81,펄어비스,567,본건물이 있지만 직원이 많아 주변의 사무실들을 임대로 빌려써서 식사나 편의시설을 이용하기 위해서는 건물들을 옮겨다녀야 했습니다.
82,펄어비스,567,회사 위치 애매. 보고하는데 시간을 너무 많이 들임. 일을 엄청 몰아치고 사람을 기계처럼 쓴다는 말이 무슨 말인지 알 것 같음. 야근 기본으로 함. 딱딱한 분위기. 구성원 중 다수가 주니어라 불안 불안한 느낌이 있음.
83,펄어비스,567,주는만큼 빼감 실적압박 부품같은 느낌을 지울 수 없음 인센티브 없음
84,펄어비스,567,정치질 못해서 윗 사람 눈 밖에 나면 업무 실력과 무관하게 내쫓김. 스스로 나가도록 종용하고 안나가면 철저하게 고립시켜 나가도록 만듦. 동료들이 왜 나가야 하는지 모르겠음
85,펄어비스,567,야근이 많지만 포괄임금제도가 아니기 때문에 그만큼 보상은 받을 수 있습니다. 워라벨을 챙기는것은 무리가 조금있습니다.
86,펄어비스,567,고용불안이 심하다 많은 팀원들이 이 문제로 정신적으로 힘들어했다 실력 있는 사람들도 그런 고민을 하니 옆에서 보는 입장에서 같이 힘들어진다 그리고 여기서 배운 것들 나가서는 적응하기 힘들었다
87,펄어비스,567,항상 촉박한 업무에 시달려야하고 무리한 일정들에 스트레스를 받음.
88,펄어비스,567,새로운걸계속 공부하고싶고 아직 성장하고싶다면 비추 일이다 비슷비슷함
89,펄어비스,567,야근이 많은 듯 보임 주니어 개발자는 코드 검토를 받고 커밋 가능한데 이게 장점도 되고 단점도 되는 듯
90,펄어비스,567,가스라이팅하고 텃세 장난아님. 사람은 계속 바뀌는데 근본적인 이유는 찾지못하는듯 아니 알면서도 눈가리고 아웅하는듯
91,펄어비스,567,인턴이라 그런지 실무를 접해보지 못했고 일을 배울 수 없어서 내가 마치 과제하러 온 대학생인 느낌... 체험형 2달로 바꾸는게 좋을듯함
92,펄어비스,567,교통.. 사옥앞에 초등학교 있으며 2차선 도로.. 역에서 거리가 애매함 다양한 부서에서 발견되는 폭언 젊은 꼰대 다수
93,펄어비스,567,일이 매우 많아 야근도 자주 하는편이지만 포괄임금제가 폐지되어 이 부분은 수당으로 받을 수 있어 개의치 않았음 딱 봐도 사람이 부족한 상황인데도 최소한의 인원으로 야근까지 돌려 겨우겨우 처리해내는듯한 느낌을 많이 받았습니다.
94,펄어비스,567,위를 제외한 나머지 전부 연줄 없으면 못올라감 아무리 일 잘해도 절대 위로 못올라감 의장이랑 친한 사람만 높은 자리 앉혀놓고 옆에서 온갖 비위 다맞추고 정치질 하면서 딸랑 거리면 어느정도까진 올라감 경영이든 일이든 전부 윗대가리들 맘대로 함 근거도 없고 논리도 없음 이런식이면 앞으로 회사가 당연히 망할거라고 봄
95,펄어비스,567,검은 사막 이후 이렇다할 차기작이 없음. 부서마다 다르지만 근무강도는 상당히 있는편. 구성원이 젊은편이라 대체적으로 자유로운 편이나 일부 부서는 부조리가 심한 곳도 있음.
96,펄어비스,567,일이 참 고달프고 힘듦 이거저거 굴리다가 안되면 쫑내고 시간도 더주지도 않고 그게 내 실적이되서 쿠사리먹고 눈치먹고
97,펄어비스,567,인사이트 없이 찍어누르는 탑다운 업무지시와 전문성 없는 윗분들
98,펄어비스,567,1. 게임 회사 보다는 일반 회사 같은 느낌 2. 어딘가 모르게 벽이 느껴진다. 3. 계약직 분들이 많이 정규직으로 전환을 못한다.
99,펄어비스,567,업무 감시가 심해 하루 중 절반을 보고하느라 정작 일을 하기 힘듬. 업무교류라면서 직군과 전혀 상관없는 일을 시키고 이를 거부시 인사고과에 반영됨. 예전이야 동종업계 대비 연봉도 복지도 좋았다지민 지금은 오히려 뒤쳐지고 있는 실태이며 대놓고 야근을 강요하고 압박한다.
100,펄어비스,567,"건물이 아직 새건물이어서 그런지, 중간중간 잡음이 있습니다. 나무위키에 보면 잘 나와있습니다 틀린 말이 없는거 같네요."
101,펄어비스,567,다른 직원분들 야근이 조금 많아보였음.주에 3번 이상은 야근하시는 것 같음.
102,펄어비스,567,정치질이 정말 심하고 원하는 것 못하고 본인들이 싫어하면 나가게 된다
103,펄어비스,567,일 때문에 언제든 퇴근 후 전화/메신저가 올 수 있다.
104,펄어비스,567,정치적인 문제가 있음 하고 싶은것이나 다양한 도전은 할 수 있으나 피드백 없음
105,펄어비스,567,복지가 좋은 이유: 주는거 이상으로 굴리고 회사에 있어야 할 일이 매우 많이 때문(야근을 풀로 땡기기 때문). 정직원분들 힘내십쇼…
106,펄어비스,567,사람을 사람 취급하지 않고 노예부리듯 하며 노예가 조금이라도 불만을 보이면 처단을 서슴지않는 비인륜적 경영철학을 갖고있음
107,펄어비스,567,사람을 갈아서 운영한다는 말 그 자체이다. 한 사람에게 과다 업무를 주는 건 당연하고 수시로 바뀌는게 더 힘들다 같이 일하는 사람들이 계속 바뀌면 남는 사람도 중심잡고 있기 힘들다
108,펄어비스,567,좋은 만큼 살아남기 어려울 수도 있다 업무를 잘한다고 해서 위로 갈 수 있는 곳은 절대 아님
109,펄어비스,567,"인턴 미션 수행이 어려울 수 있으나, 도와주는 사람이 많아서 걱정하지 않아도 됨. 단점이랄건 엘레베이터 속도뿐"
110,펄어비스,567,호칭이 수평적이지만 수평구조가 없을수없음 허례허식적인 부분이 좀 많은것같다
111,펄어비스,567,힘들다. 그냥 힘들다 여러번 뒤집히기도 하거니와 공유가 하나도 되지않는다.
112,펄어비스,567,돈을 쓸 시간이 없을 정도로 업무량이 많다. 실시간으로 여기저기서 업무가 들어온다.
113,펄어비스,567,라인타기 정치가 있고 인맥으로 타고 오기도한다 열심히 하는 직원이 하무할정도
114,펄어비스,567,출퇴근시간이 정해져있지만 생각보다 정시에 퇴근하는 사람이 은근 적음
