,company_name,company_id,review_text
350,펄어비스,567,"야근많음, 일양많음, 너무 자유로운 분위기라 신입들은 힘들 수도 있음, 딱히 단점이 생각나진 않음."
351,펄어비스,567,"수평구조 라고 하지만 어느 회사나 당연히 있듯이 계급 존재, 특히 부서간 격차 심함, 야근은 이제 뭐 당연"
352,펄어비스,567,"많은 업무량에 복지를 즐길 시간도 분위기도 안되는 편, 수평적인 분위기를 지향하나 현실적으로 이루어지긴 힘듬"
353,펄어비스,567,내인생이없다.! 일만원한다면 추천합니다. 그것이 장점이자 단점
354,펄어비스,567,개인주의적 분위기 일하는 기계들 자신 말곤 아무 관심도 없고 누굴 키울 생각도 그다지 없다.
355,펄어비스,567,기업의 단점의 경우 기획서가 없기 때문에 이전에 벌려놓은 실수를 번복함
356,펄어비스,567,비합리적인 윗분들의 업무 결정방식. 게임회사인데 자유로움이 없고 허용되지않는느낌. 사람을 소진시키고 소진시키기만 하는 분위기라 오래근무한사람들은 진짜 영혼까지갈아서 일하는 분위기.
357,펄어비스,567,것보기엔 수평적인 조직이나 사내에서의 정치적 입지에 따라 하청업자 부리듯 생각하는 것이 싫었음. 사업/운영 프로세스가 잘 안 잡혀 있었음 (중간 매니저들이 인맥으로 들어온 사람들인데 실무만 하던 사람들이라 프로세스 관련 결정을 할땐 우유부단한 면이 많았음).
358,펄어비스,567,팀바팀 편차심함. 업무체계. 아직도 모자라는 인력. 좀더 개선된 자율 출퇴근 필요. 업무 프로세스 일부 개선했으면..
359,펄어비스,567,인생 대신 일을 살 수 있습니다. 정말로요. 일이 정말 많습니다.
360,펄어비스,567,일이 너무 많다. 창립기념일이 휴일이 아니다. 명절전에 일찍퇴근은 없다. 샌드위치데이나 연휴에 전체 공동연차를 활용하는 IT기업이 많은데 흠;;; 전혀없다~ 연차수당을 지급하지 않는다!!
361,펄어비스,567,야근이 많다 철야가 많다. 업무 진행이 비효율적이다. 상하 수직관계가 너무 적나라하다. 고인물들이 자리와 권력을 한번에 꿰차고 있어 신입은 적응이 어렵다.
362,펄어비스,567,"전반적인 업무가 그날 저녁에 확정되고 아침까지 완료하는 말이 안되는 일정으로 진행되며,12시 넘어가는 철야는 기본임 하지만 어느 장들도 그거에 문제가 있는걸 깨닫지 못하고 있음, 사내 정치 / 뒷담화가 많음, 덕분에 사람들이 금방나가고 교체가 반복됨"
363,펄어비스,567,빠른 속도로 규모가 커져서 체계가 아직 완성되지 못한 느낌.
364,펄어비스,567,"야근을 지양한다고 하는데 체감은 글쎄.. 파견직, 계약직을 많이 채용하는 분위기 정규직 전환은???  최대 단점은 워라밸이 없다."
365,펄어비스,567,엄청난 업무량 일은 힘들다. 하지만 일이 많아 시간가는줄 모른다
366,펄어비스,567,야근을 할 수 밖에 없는 시스템이고 비효율적임 뜬금없이 평촌에 있어서 불편함 강약약강의 팀장들 평준한 관계라고 하는데 전혀아님 연차 팀장 눈치보면서 써야함 야근안하면 눈치줌 야근금지는 눈가리고 아웅 퇴근할때 출입카드 찍지말라고함
367,펄어비스,567,정시퇴근이 불가능했으며 매우 수직적인 문화로 사고력은 늘리지 못하고 그저 시키는 일만 잘하는 사람이 될 가능성이 높다. 휴가를 자유롭게 쓰지 못함
368,펄어비스,567,야근이 많았었다. 지금은 사라짐. 불도저식 일처리. 매주 패치 업데이트 ㅜㅜ
369,펄어비스,567,1. 급속도로 발전하는 강소(?) 기업이라 아직 체계가 덜 잡힘(매우 자유로운 분위기도 이에 한몫 한다고 봄) 2. 업무량
370,펄어비스,567,추천하고 싶지 않습니다. 사람들이 비인간적이고 이기적이며 자기 생각만 하는 사람들이 많습니다
371,펄어비스,567,꼰대기질있는 윗사람 만날 확률이 상당합니다 특히나 수직 관계 심한 부서는 더욱더...
372,펄어비스,567,야근이 매우 많음 기획 단계가 답이 없음 기획이 자주 바뀜 왜 바뀌는지 모르겠음 그에따라 다른 부서는 강제 야근 기획팀은 그냥 던져주고 집감
373,펄어비스,567,윗사람 눈치보고 눈에 잘들기 위해 노력해야만 하는 곳. 정치플레이 하지 않으면 위로 올라갈 수 없음. 체계 없어서 적응하고 살아남기 매우 힘듬. 진취적이고 적극적이고 눈치 빠르지 않다면 힘듬. 자부심 애사심 과하게 심하고 전반적으로 그걸 장려하는 분위기. 회사와 일에 일상과 인생을 바치기를 원하고 그게 당연시 되는 문화. 워리밸 따위 없음. 야근 많음. 야근 안하면 일 못하고 안하는 것으로 인지됨. 일하는 티를 꼭 내야만 하는 곳.
374,펄어비스,567,하루종일 일만해도 업무가 안끝남. 그것도 하루이틀이지 매일 그렇게 하면 계속 지치고 스트레스만 쌓임. 계속 곡소리 나는데 진짜 일하다죽을수도있겠다는 거 처음 생각듬.
375,펄어비스,567,일하다가 사망할 수 있다. 야근 매우 많이 한다. 업무강도 엄청 매우 아주 세다.
376,펄어비스,567,"야근이 많다, 개발쪽은 모르겠으나 일반화사에 당연히 있는 경영기획팀이나 경영전략팀 전략기획팀 같은 중심을 잡는 팀이 없다.....사업계획과 예산은 ceo보고는 누가하는지 원 ;;;"
377,펄어비스,567,팀바팀이겠지만 정말 일만 하러 나와서 일만 하고 감 팀원들끼리의 화합 정말 하나도 없음 그냥 퇴근시간이 밤 10시부터임 게임쪽은 자체 템플릿으로 여기서만 일할거 아니면 다른데서 일 못함
378,펄어비스,567,야근? 정말 당연하다 일단 정말 빠르게 퇴근 가능한 시간이 밤 10시. 패치가 있다면 밤을 새고 오후에 퇴근한다. 이부분은 이해 가능하지만 52시간 제대로 안지켜지고 있는걸로 보인다. 데드라인을 맞추기 위해 몇십시간을 잠도안자고 일하는 사람도 여럿봤다ㅋㅋ 이러다가 사람 잡는거 아닐런지...
379,펄어비스,567,아예 처음 일을 하는 사람 입장에서는 다소 부담스럽게 느껴질수도 있는 업무 구조. 당사의 게임에 흥미를 느끼지 못 한다면 모든 업무가 스트레스로 다가올 수도 있음. 게임을 좋아하지 않는데 외적인 면만 보고 들어간다면 후회할 듯.
380,펄어비스,567,보수적이래도 너무 보수적이고 소심한 개발마인드 및 90프로의 개발이 고인물들의 마음에 의해서 돌아간다. 아무리좋은것이라도 고민물의 마음에들지않으면 소용 없음
381,펄어비스,567,"어느 정도 느껴지는 군대식 문화, 지금은 어떨지 모르겠지만 재직할 당시에는 연차 사용이 굉장히 힘들었음"
382,펄어비스,567,장점을 모두 씹어먹음 복지가 좋아도 복지를 사용할 시간이없으면 무용지물 자신의 삶이 없는걸 느껴보고 싶으면 추천
383,펄어비스,567,일의 양이 많습니다! 일의 강도가 세요!!! 항상 바쁩니다.
384,펄어비스,567,복잡한 절차 없이 진정 개발자들만을 위한 곳. 일이 있는 곳에 너의 인생은 없다 그것은 당연한것. 그러나 너의 인생과 일을 일치 시키면 살아남을 수 있다.
385,펄어비스,567,일이 일단 많습니다.. 버티다보면 좋은커리어가 될것이라고 생각합니다. 야근많아요~
386,펄어비스,567,신입이라면 체계가 없기 때문에 어깨 너머로 알아서 잘 배워야한다. 체계와 프로세스를 정립하는 것에 투자하지 않는다. 은근한 성과주의 압박 은근한 계파 친목질이 있어 업무상 정보 공유가 잘 되지 않으므로 어느정도 처세술이 필요하다.
387,펄어비스,567,돈 많이 준다고 하지만 하루 거진 14시간 근무인데 엔병
388,펄어비스,567,"업무 스타일을 배워나가기는 힘듬 야근이 잦아 새로운 기술 등을 습득하기에는 한계가 있음 QA 팀 자체에 새로운 기술 습득 및 테스트 케이스를 정리하려는 의지가 없음. 때문에 QA팀에 대한 입지 및 신뢰도가 매우 낮음. 전문적인 기술을 가지고 있는 집단이라고는 생각하기가 어려운 편. 그래서 게임을 많이 해본 사람을 뽑는 경우가 있었으나, 최근에는 길드 등 특정 단체를 대변할수도 있다는 생각이 들었는지 많이 안해본 사람도 뽑는 편. 인턴을 신입으로 뽑는데, 인턴이 인수인계를 하는 상황. 그마저도 기본 프로그램 깔아주고 내부에서는 이런 것 저런 것을 쓴다고 알려준 후 알아서 파악하게 하는 시스템. 알려주는 게 없어 초반에 노력하지 않으면 붕 뜨게 됨. 이 때문에 게임을 많이 플레이해보고 오라고 하는 것 같음. 개발팀의 일정에 끌려다니며, 기획팀에게 전달받는 기획 문서가 없어 일일히 물어가며 업무를 진행하거나 업데이트 내역을 보며 진행해야 함."
389,펄어비스,567,고속성장을 한 회사라 그런지 의외로 체계가 덜잡혀 있는듯...
390,펄어비스,567,"빠른 의사결정으로 인한 빠른 업무속도. 생각보다 약한 국내 인지도(울엄마는 매일 말해도 잘 모름), 급성장으로 체계적이지 못한 시스템"
391,펄어비스,567,팀장님들이 너무 열심히 일하세요. 경력직도 많아서 따라가기 벅찰 때가 많음. 신입들이 업무에 적응할 수 있는 시간을 많이 주지는 않음. 같은 부서여도 누가 누군지 잘 모르겠어요. 다른회사 사람에게 인사한 적이 많음. 뭔가 대책이 필요해 보임. 지하철에서 회사까지 거리가 너무 멀어요. 요즘 같은 여름철에는 출근하기 힘듦.
392,펄어비스,567,의사결정이 빠름. 성급하다는 느낌은 어쩔 수 없음 많은 복지 중에 게임관련 복지가 없음. 주위에서 아이템을 달라고 하면 난감함. 직급이 없는 구조로 의사결정은 스스로의 결정이 많이 중요함. 책임감이 많이 필요함.
393,펄어비스,567,"팀원들이나 회사사람들끼리 친해질 기회가 별로 없습니다. 개인적으로는 동호회 활동으로 타부서 사람들과도 많은 교류가 있으면 좋을 것 같은데, 그런 분위기 없이 업무에만 몰두하는 분위기라서 이런 부분은 좀 재미가 없네요. 그리고 회사가 안양에 있어서 친구들을 만나거나 세미나 같은 행사에 참석하기 너무 힘듭니다. 개인적으로는 가까이 사는 분들에게 거주비 50만원씩 지원해주는 비용을 아껴서, 서울까지는 아니더라도 판교나 좀 접근성이 좋은 동네로 이사갔으면 좋겠습니다."
394,펄어비스,567,동호회 활동이나 회식 등 친목을 도모할 수 있는 자리가 부족함. 그렇지 않은 팀도 있지만 특히 술을 좋아하는 사람 입장에서는 생각보다 답답할 수 있다.
395,펄어비스,567,"신속한 의사결정이 장점이기는 하지만, 가끔 일을 너무 급하게 추진한다는 느낌을 받을 때가 있음. 결정과 실행 사이에 조금 여유를 가졌으면 좋겠다."
396,펄어비스,567,"보통 회사처럼 다니면 낭패..언제나 열정을 요구함. 예전엔 그 열정이 야근으로 이어져서 문제였다. 지금은 매출도 잘 나오고 회사가 안정되서 야근으로 열정을 보답하진 않음. 회의가 잦고 긴 편. 일할 땐 일하자는 문화라, 생각만큼 연차가 후하진 않음."
397,펄어비스,567,그러나 하고 싶은 업무만 하는 것은 아니다. 잡일이 더 많음. 너무 야근이 당연시 되어서 사람들이 힘들어함.
398,펄어비스,567,퇴근 10시에 하면 농담삼아 칼퇴한다고 하는 곳. 업무가 없어도 눈치 때문에 야근을 해야합니다
399,펄어비스,567,야근이 매우 많고ㅡ직완들 모두 워커홀릭 수준임 ㅡㅡ 다들 퇴근을 안함
400,펄어비스,567,수평적인 구조처럼 보이지만 계급을 엄청 따짐. 업무가 없어도 눈치보며 야근을 의무적으로 해야함. 신입에게 전문성을 요구함. 케바케지만 상사 잘못만나면 회사생활 힘듬
401,펄어비스,567,직원들 목숨 갈아서 게임 만드는 회사다. 이미 악소문이 너무 퍼져서 괜찮은 개발자 지원안해서 남은 사람들만 고생하는 시스템 돈이라도 많이 주면사람들이 참고 다녔을탠대 딱히 그러지도 않으니 어느 파트는 근속연수가 1년 이 넘질 못한다
402,펄어비스,567,"낮은 연봉과 매우 높은 노동 강도. 개발자라면 일주일에 최소 한두번은 회사에서 자고 가며, 개발자가 아니어도 딱히 다를건 없었음."
