,company_name,company_id,review_text
115,펄어비스,567,"모든지 구두로 진행하는 업무, 책임지지 않는 리더 그룹. 팀 간 차별, 천룡인 등등"
116,펄어비스,567,과천이라고 하지만.. 주변 공터 공사장 아파트뿐이고 도로를 만들기 전이라 출퇴근 교통이 엄청 복잡하다
117,펄어비스,567,일이 많고 사람들이 예민함 휴가를 길게 쓰기 힘든편임 자유로운 분위기 속 수직적 문화가 있음
118,펄어비스,567,시키는 대로만 빨리 하면 됨 대신 열심히 했던 업무가 잘 엎어짐 엎어짐에 무뎌져야 심신 건강에 무리가 없음 근데 이건 다른 기임회사도 마찬가지라고 생각함 조직 문화가 그럴싸해 보이지만 굉장히 탑다운으로 수직적임
119,펄어비스,567,"전문성이 조금 떨어짐, 이런 저런 프로세스를 위한 환경이 잘 구축되어 있지만, 인력의 전문성이 떨어짐, 뭔가 더 배우고 싶다면 독학을 하길 권장"
120,펄어비스,567,"초과수당이 뭐죠? 있기는 합니다만 라떼꼰대, 사내정치 만연으로 있던것도 없애는 훌륭한 회사"
121,펄어비스,567,"안양이라는 단점, 긴 시간동안의 업무, 짧은 근속년수, 회사만의 자체 프로세스로 타 회사 이직시 어려움을 겪을 확률이 높음"
122,펄어비스,567,"복지 없음, 차별 많음, 연봉 최저시급 9160원 맞춤, 뭐만하면 너는 안되, 나는 파견직이라 못보는데 왜 모르냐고 욕먹습니다."
123,펄어비스,567,복지 많은데 실제로 쓰면 눈치보이고 쓰는 사람 거의 못봄
124,펄어비스,567,개발진이 원하는대로 회사가 돌아가기 때문에 개인의 의견과 역량이 중요한 사람한텐 적응하기 어려운 곳
125,펄어비스,567,사람을..기업의 부속품으로 본다는 점 어쩌면 맞는 말이지만 마인드가 티날 때..더보기
126,펄어비스,567,비개발은 잘 모르겠지만 개발 부서에서는 매일매일 결정권자들의 결정이 바뀜. 그래서 만들고 뒤엎고 만들고 뒤엎고를 매일매일 반복하는 중
127,펄어비스,567,파트마다 다르겠지만 썩 좋은 분위기는 아님 입사하고 몇명은 몇일 안가서 컷됨
128,펄어비스,567,단시간에 너무 많은 업무를 줘서 괴로움 제시간에 귀가한 적이 드뭄 휴일도 쉬는 것 같지가 않음 약속된 시일 내에 결과물을 줘야 한다는 압박에 결국은 새벽에도 일하게 됨
129,펄어비스,567,개발이 전부임 제대로된 운영과 경영 시장과의 소통을 전혀못함
130,펄어비스,567,장점을 제외한 모든 것 내부 고인물들의 마인드가 너무 심함 신입으로 들어간다면 펄어비스에서 뼈 묻을 생각해야됨. 다른 회사 들어갈 때 적응 못함
131,펄어비스,567,일이 너무 많다. 일정이 빡세다. 야근 너무 많다. 눈치 너무 준다.
132,펄어비스,567,높은 연봉을 바랄 수는 없습니다. 보상보다는 휴식을 원하는 분이 지원해야합니다
133,펄어비스,567,초과근무는 채우는 것을 기본으로 생각해야함...........
134,펄어비스,567,"정규직과 비정규직 차별이 너무 심합니다. 연봉이 너무 작습니다. 저연차 사원의 말들은 잘 반영되지 않으며 ""올사람 많으니 맘에 안들명 나가라"" 라고 이야기를 듣습니다. 가스라이팅이 심하고 사내 괴롭힘이 많으며 어떠한분은 이로인해 자살상담까지 했다고 올라왔습니다."
135,펄어비스,567,나머지 최악 사람 최악 구성원 최악 멘탈 관리힘듦 업무 강도 매우 높음
136,펄어비스,567,정규직 인원에 비해 파견직이 많은편으로 파견직 1년 근무 후 정규직 전환이 가능할지는 의문이다.
137,펄어비스,567,"사람을 사람으로 안 봄 아무 일이나 아무렇게나 막 시켜놓고 쥐잡듯이 잡음 개인의 커리어 발전을 전혀 기대할 수 없음 꼰대 문화, 정신적 압밥감을 자양분으로 삼은 회사"
138,펄어비스,567,전체적으로 회사 내부 분위기가 좋지 않음. 직원들을 가스라이팅하는 기분
139,펄어비스,567,기계처럼 뽑아내는 것 그렇지만 시간이 빠르게 간다. 장점이자 단점인가...
140,펄어비스,567,"회사의 위치가 조금 애매하지만 앞에 설명한 장점으로 다 상쇄됨, 딱히 단점을 찾아볼 수 없음, 굳이 꼽자면 근로 시간의 유연성인데, 팀바팀/부바부인듯"
141,펄어비스,567,눈치를 많이보고 팀바팀이지만 야근존재 사람이 자주 바뀜
142,펄어비스,567,그다지 단점에 대한 것은 느끼지 못했음 굳이 뽑자면 회사 내의 복지가 단계적으로 나누어져 있어서 사원으로 입사하고 끝이 아니라 레벨 업을 해야 할 것 같은 느낌을 줌 좋다면 좋지만 사원에 따라서는 이게 부담으로 느껴질 수 있을 것 같다는 생각을 하기도 함
143,펄어비스,567,비정규직은 해당되는 복지혜택이 없습니다 연봉이 너무 적습니다.(실수령 딱 200입니다...) 연차인데 연락이 잦습니다. 비정규직이라고 철저하게 선긋고 일합니다
144,펄어비스,567,너무 빡세다?? 그래도 상식적으로 일하는 것 같아요 굳
145,펄어비스,567,"계약직, 파견직들은 좀 쉽게 내쳐지는거같은 느낌에요 ㅠㅠ"
146,펄어비스,567,사내정치가 존재하며 죽지 않을 만큼만 일을 합니다. 재직당시 워라벨을 찾아보기 어려웠습니다.
147,펄어비스,567,자체엔진사용으로 인해 위 장점들이 전부 상쇄되고 오래있으면 안되는곳이란걸 느낌.. 이부분이 정말 아쉽다고 생각됨
148,펄어비스,567,단점은 딱히 보이지 않지만 하면 업무 외 시간에 연락 정도
149,펄어비스,567,일을 많이 줍니다. 일정도 빡세고 스트레스도 많고 가족이 있는 사람에겐 지옥입니다.
150,펄어비스,567,야근이 너무 많으며 일잘하는 일부에게 업무가 몰빵되어있는 경향이있음
151,펄어비스,567,"파견에서 계약직, 계약직에서 정규직 전환이 정말 높은 벽으로 느껴졌습니다. 본인은 고사하고 같은 팀 인원중에서 근무 형태 전환된 케이스가 거의 없다시피 합니다."
152,펄어비스,567,"부바부로 연차 사용제한이나, 정치 성향이 큰걸로 알고있음. 워라밸 기대하지마십쇼. 10시출근 10시퇴근이 정규근무라고 생각하면될거같습니다. 인센 1도 없습니다. 업계 최고 연봉도 옛말"
153,펄어비스,567,비효율적이라고 생각되는 업무들이 가끔 있습니다. 필요 시 주말에도 근무를 해야할 때가 있습니다.
154,펄어비스,567,"팀바팀이긴 하겠지만, 인간성이 의심되는 리더들. 그리고 그들을 냅두는 회사. 업무는 아직도 체계라고 할만한 것이 없습니다. 경력자들이 거의 버티지 못하고 금방 퇴사하고, 회사도 경력자를 뽑을 생각이 없는 것 같습니다."
155,펄어비스,567,"이제는 평균이 되어버린 근무하는 대다수의 사람이 받을 수 없는 복지 혜택, 어지간한 고인물도 놀랄 정도의 사내정치와 전반적으로 수평적인 척 하는 기업 분위기, 팀바팀이라는 곳들도 피바람 몰아치는 장면을 여러 번 봤다. 어제까지 열심히 일하던 평판 좋던 사람조차 하루아침에 PC빼고 사라지는 안정성. 많은 리뷰가 올라온 뒤 문제되는 중간 관리자들도 몸을 사리는 모습을 보였지만 사내에선 여전히 보여주는 바뀌지 않는 모습들."
156,펄어비스,567,"정규직 1.일이 바뻐서 복지를 못사용하고 당일해고 인한 퇴직시 기존 복지로 지원받던 월세금이 끊겨버려 낙동강 오리알신세 2.실력보단 정치 위주로 돌아가기에 일잘하는 사람보다 말 잘듣고 정치 잘하는 사람이 더 오래 근무 3.야근이 굉장히 많음(평균급여가 타사대비 높게 책정되어있는데 매주 52시간 꽉꽉채워서 근무하기에 급여가 높게 책정되었고 야근을 위해 회사에서도 샤워실, 수면실을 제공하고 있습니다.) 4,주말, 연차에도 업무상 연락이 많습니다. 5.아침에 일하고 점심에 오면 의자가 사라져있는 당일해고 6.회사에 고충상담이라고 만들어놓은 사우협의회가 있으나 공아서 답변 해주는게 있고 답변도 없이 그냥 뭍어버리는게 많습니다. 7.여긴 재택 못해요.. (고충으로 다른 사우분이 질문했더니 ""재택을 못하게 하면 부서장과 터놓고 이야기 해보세요""라고 답변이 돌아왔습니다.) 8.평가는 항상 관리자급이 진행하며 인사평가 잘못받으면 연봉 거의 동결 (쌍방평가 도입좀 해주세요..)  비정규직 1.계약, 파견직의 차별이 심함 (인턴도 복지 다 쓸수있는데 파견,계약은 해당사항 없고 사내에 중요한 공지가 있지만 해당 인원들은 모르기에 사내 행사 불참, 업무에 지장이 많음) 2.업계 최고수준의 급여를 약속했으나 비정규직은 현저하게 적은 연봉 3.정규직 전환을 빌미로 오늘안에 불가능한 업무를 주며 야근을 종용 4.전체 임직원 복지지만 비정규직은 해당이 안됩니다 5.여긴 재택 못해요.. 6.전사 사원평가인데 비정규직은 평가 못하게 막아놓았습니다. (비정규직은 해당사안이 없다고하네요..) 7.회사 상여급, 인센티브, 자사주 등 전사 임직원 지급이나 해당 없음"
157,펄어비스,567,"게임사의 느낌, 분위기등 경험을 조금이라도 얻고 싶어 지원했으나 그냥 단순 사무직 그 이상, 이하도 아니였다."
158,펄어비스,567,1.야근이 굉장히 많습니다. 회사에 수면실이 있는게 괜한 이유가 아니더라구요..  2.파견직에 대해 생각보다 많은 차별 펄어비스 최고의 장점은 다양한 복지지만 파견직은 장점에 나온것 말곤 회사에서 쓸수있는 복지는 없을뿐더러 파견직도 참여 가능한 복지지만 정작 파견직은 해당 공지를 못보기에 있는줄도 모르고 지나간 경우가 한두번이 아닙니다..
159,펄어비스,567,1. 기업문화에 관심을 갖는 건 장점이지만 정작 문제점이 무엇인지 전혀 모르는 것 같음.. 우리는 다 아는데 말이죠.. 2. 너무 일만 하다 보니 동료 간에도 서먹하고 개인주의 성향이 매우 강함. 3. 일이 많아도 너무 많음..
160,펄어비스,567,일이 생각보다 많은 편. 회사 위치가 애매함.(회사가 이사 예정이라 위치가 더 애매해질 듯)
161,펄어비스,567,"야근이 당연시되고 위치가 평촌이라 출퇴근하기 좋지 않음, 거주 지원비도 회사 위치가 좋지 않아서+야근이 많아서 나오는 것임, 분위기가 칙칙하고 소심하며 정치질이 아주 심함"
162,펄어비스,567,업무량이 많습니다. 연차가 있더라두 업무량때문에 쉽게 연차를 사용하기가 눈치보입니다. 퇴근에 자유가 있긴하지만 업무가 많다보니 쉽게 칼퇴하기 어렵구 눈치가 많이 보입니다.
163,펄어비스,567,일에 집중할 수 있도록 만들어주는만큼 쉬엄쉬엄 일하면 살아남을 수 없는 분위기
164,펄어비스,567,영혼이 갈려서 나오는 게임 회사 문화가 퇴보. 조금 다녀보먼 정치질 온상 느낌
165,펄어비스,567,업무강도가 쎄다? 하지만 야근수당으로 보상해주니 워커홀릭이시면 단점은 아닌듯 해요
166,펄어비스,567,업무가 많습니다. 많은 경험을 해보고 싶다면 추천이지만 워라베가 중요하다면 비추
167,펄어비스,567,"매일 야근, 본인 시간도 없을 뿐더러 주말에도 메신저 안오나 오나 수시로 점검해야함  끼리끼리만 나눠먹는 성과금"
168,펄어비스,567,"호칭만 님문화일 뿐 팀 내에서는 여전히 수직문화. 군대놀이, 정치질, 꼰대 다수 있음. 문서정리 없이 진행되는 작업이 많아 히스토리 파악하기 힘든 부분이 많음. 일정대로 진행되기보다 급박하게 처리 요구하는 작업이 많음."
169,펄어비스,567,업무강도가 높은편이라 익숙해지지 않으면 적응하기 어려울 수 있다.
170,펄어비스,567,재직 기준 (19년) - 유관부서 인원들이 자꾸 바뀐다 - 팀 이동이 쉴틈 없이 일어난다 - 야근은 패시브 (11시 혹은 그 이후 까지) - 너무나도 고인 경영진
171,펄어비스,567,딱히 없었습니다 시끄러운 사무공간정도와 서울에서 출퇴근하기 너무나도 힘들다는 점
172,펄어비스,567,"사내정치가 존재하며, 직원의 실수를 개인의 문제로만 치부하고 재발할 수 있는 위험이슈를 방치하여 주기적으로 같은 이슈가 발생함"
173,펄어비스,567,빡센 업무량 커뮤니케이션 안되는 부서 존재 이 외에는 별로 없네요
174,펄어비스,567,단순 보고를 위한 문서작업량이 많이 업무시간이 비효율적임. 주먹구구식 프로세스. 평가 시스템 모호.
175,펄어비스,567,"연봉 다른회사에게 따라잡힘, 쉬는거 되게 눈치줌, 연차다 못쓰는 사람도 다수 보임, 아랫사람의 의견을 무시함, 각자 자기일만 하느라 소통이 없음"
176,펄어비스,567,근무를 하면서 은근 개발자들 간의 신경전들이 있습니다. 파일의 위치 같은 것을 친절하게 알려주지 않는 등의 문제가 있습니다.
177,펄어비스,567,"일을 위한 일을 하지말자고 지향하지만 일을 위한 일을 자꾸 만들어오는 회사, 휴먼 리소스로 대체되는 부분이 많고 끊임없이 일이 늘어남."
178,펄어비스,567,일을 해야하는 속도가 따라가기가 쉽지 않습니다. 실력만 좋다면 사실 단점은 없다고 생각해요
179,펄어비스,567,능력이 없는 사람들이 게임만 좋아한다는 이유로 자리를 차지하고 있음. 함께 일하면 힘듬. 그래서 실력자들이 퇴사하는거 많이 봄
180,펄어비스,567,숨막히는 보이지 않는 근무 스트레스 a-z가 아닌 부분부분만 하기에 실력쌓기 애매
181,펄어비스,567,맨파워 위주의 업무 방식을 취하고 있어 사람이 퇴사를 하면 해당 업무에 대한 히스토리를 잃어 가고 있는 구조입니다. 그 뒤는 상상이 가겠네요.
182,펄어비스,567,1. 딱히 모르겠음 2. 유연근무제 미시행 3. 계절별 휴가 없음
183,펄어비스,567,복지 진짜 많은데 솔직히 미혼은 주거말고 쓸거없음 그렇게 따지면 다른 회사랑 다를거 없음 정치질 너무 심함 연령대가 너무 어림 근속년수가 곧 법임 아무리 잘해도 오래다니지 않은 사람이라면 적응하기 힘듦
184,펄어비스,567,경직된 분위기 사람들 많이 바뀜 하루 아침에 갈림 그들만의 리그
185,펄어비스,567,보고서 많고 야근 많고 과천의 등대라고 불림. 택시비 지원 옶음.. 팀마다 뷴위기 다름
186,펄어비스,567,열정적인 분위기를 선호하지않는다면 힘들수도 있음 본인의 생활보다 회사가 우선시될수도
187,펄어비스,567,일부 직급 높으신 분들의 마인드는 회사의 규모에 비해서 매우 아쉬운 듯.
188,펄어비스,567,"커피타임 없음, 그만큼 모두가 일에 집중도가 높음, 워커홀릭이 되어야함, 업무 프로세스가 깔끔한 편은 아님,"
189,펄어비스,567,성장하는 단계의 회사인만큼 프로세스가 없고 직원의 성장보다는 회사의 성장을 중요하게 생각하는 부분이 있음
190,펄어비스,567,너무 회사 중심이며 워라밸이 전무하다시피 함 돈이 있어도 돈을 쓸 개인 시간이 없을 정도.
191,펄어비스,567,당일 .... 등 비인간적인 인사문화 여전히 존재. 옆에 있던 내 동료가 반나절만에 사라지는 꼴도 볼 수 있음. 고용불안정으로 공황장애 걸릴수도 있음. 사내에 심리상담실이 왜 생긴지를 생각해보자. 블라인드에서 유우우우명한 일부 팀은 절대로 정규직될 일 없으니까 지원하지 말길.
192,펄어비스,567,리더들의 의사결정이 과연 합리적으로 이루어지는가에 대한 의문. 특정 인물의 사내 영향력이 막강하다
193,펄어비스,567,경기도에 있어서 출근시간이 오래걸림 역과 거리가 좀 있었음 약간 아는 사람이 없으면 친해지는데 시간이 좀 걸림
194,펄어비스,567,1. 일정 및 인력 관리가 제대로 되지 않았음. 2. 몇몇 소수의 의견에 많은게 좌우됨
195,펄어비스,567,"내부 조직이 자주 달라지고 있고 보수적인 성향, 1가지 의제를 하려고 할때 윗선에서 이중적인 면이 보일때가 종종 있음. 또한 부서장간 갈등때문에 팀원이 눈치보는경우도 있었음"
196,펄어비스,567,팀마다 일의 구조가 비효율적이다. 다른업무를 주고 발전 할 수없는 구조. 일정이 매우 타이트하다
197,펄어비스,567,면접 때 팀 프로젝트 경험을 왜 물어봤나 싶을정도로 팀 소속감을 느끼기 힘들었습니다. 아무리 인턴이라지만 한달 가까이 ㅌ미장님이 어떤 분인지도 모르고 눈치껏 팀원들이 어떤 사람이다라는 파악해야할 정도였습니다. 사실상 팀 내부 인원이 아닌 외부 사람 취급을 하다 사수가 너무 바빠 도움을 받기 힘들었다는 얘기를 하니 다른 팀원에게 도움을 요청할 생각은 왜 하지 않았느냐는 이야기를 하시니 좀 어이가 없더군요.
198,펄어비스,567,그만큼 많이 일합니다. 배우기 좋았지만 그만큼 던져지는 일도 많았습니다. 쳐내면 그래? 이것도 해봐 하는 느낌이 있었습니다. 그만큼 급여는 챙겨줍니다만... 워라벨을 생각하시는 분은 힘들 수 있습니다. 업무조정이 어느정도는 가능하지만 한계가 명확합니다.
199,펄어비스,567,그들만의 리그라는게 존재한다. 내 생활이 없다. 줄을 잘 서야 한다. 상사한테 잘 보여야 한다. 찍히면 커리어 끝장남. 바쁘면 남 일도 내가 하기 때문에 내가 모델러로 왔는데 레벨디자인을 하고 있을수도 있다. 게임이 런칭을 해도 감흥이 없다. 윗선들끼리만 나눠먹기 때문이다.
200,펄어비스,567,"갈려나가는 느낌, 매주 바뀌는 인사정책, 누구에게는 필요없는 공정하지 않은 복지혜택"
201,펄어비스,567,일이 많음 출근부터 퇴근까지 계속 업무에 집중해야함 급성장한만큼 자주 바뀌는게 많지만 나아지는 것 같음
202,펄어비스,567,자체 엔진이라 때깔은 좋지만 큰기대가 될만한 게임이 나올거라 기대가 안되며 검은사막에 너무 의존하여 미래가 없어보임
203,펄어비스,567,"외주, 계약직 인력이 많다. 경력 정규직도 수습기간을 적용한 계약직으로 뽑아 초기 고용안정에 불안을 느낀다 (물론 수습기간을 무사통과하면 정규직으로 전환된다)"
204,펄어비스,567,우선순위가 계속뒤집힘. 사내정치없는척 개오짐. 자존감도둑들. 아무리 열정있게 일해도 돌아오는건 불신
205,펄어비스,567,철야를 강요함. 금방 살찔 수 있는 환경임. 몇몇 사람들 외에는 부품취급함.
206,펄어비스,567,"윗분들과 친하면 일못해도 꾸준히 회사에 붙어있기 가능, 쓸데없는 보고, 잦은 인사이동"
207,펄어비스,567,"처음 신입으로 들어오셨을때 신입 교육시스템이 조금 부재하여,, 자기가 직접 알아봐야하거나 동료분에게 많이 알아보시고. 상급자분들이 바라는게 알아채는 눈치가 빠르시면 좋을것같습니다. 일 열심히해도 눈치없으면 전환은 힘들어보입니다."
208,펄어비스,567,회사에 고인물이 너무 많다. 체계가 없이 진행되는 업무. 윗사람 한 마디에 바뀌는 업무내용 등 회사의 이름이나 규모에 비해 너무 주먹구구식으로 진행되는게 많다. 같은 동료를 무시하는 발언으로 가스라이팅을 하는 사람이 있다. 고생에 비해 짠 연봉인상율
209,펄어비스,567,"업무가 넘쳐난다. 일정관리 없다. 그냥 닥치는 대로 하고 닥치는 대로 밀어넣는다. 신체적, 정신적 스트레스를 많이 느낄 수 있다."
210,펄어비스,567,업무 압박이 조금 심하다보니 항상 노력하는 사람만 살 수 있어요
211,펄어비스,567,인턴이라그런지 관심을 안가져주고 방치식으로 과제만 하고 간단한 코드리뷰하는데 피드백은 전혀 없음
212,펄어비스,567,아직은 미흡한 평가와 보상 체계? 인원대비 할일 많아서 어서 좋은 분들이 많으 들어왔으면 합니다. 아직은 미흡한 시스템?
213,펄어비스,567,"사람을 부품처럼 씀, 주기적으로 현타옴, 어제 옆자리에 있던 사람이 오늘 사라짐"
214,펄어비스,567,업무량이 살인적으로 많다. 돈으로 다 보상해준다 하는데.. 그것도 이제는 옛말이 되었다..
215,펄어비스,567,평가방식이 굉장히 비밀리에 진행되고 투명하지 않음. 업무방식에 있어 다양한 논의가 없고 이견을 내면 펄어비스에 적응하지 못하는 부적응자로 찍힘. 고용 안정성이 매우 떨어짐.
216,펄어비스,567,"수평적인 척하는 수직적 분위기, 입사 초반부터 업무 강도 높음 체계가 없어 신규 입사자 업무 교육부터 두서없이 진행되며 연차가 쌓여도 동일함, 조각조각 떨어지는 업무가 많아 커리어 성장에 도움 안됨"
217,펄어비스,567,복지제도 다양하지만 실제로..글쎄 계약직도 무관하게 복지제도를 적용해주지만 실제로 사용할 수 있는 복지는 많이 없음. 연차사용 눈치보는 부서 꽤나 있음
218,펄어비스,567,"연봉 이상의 퍼포먼스를 요구하나, 일정이 없으며 모든 업무를 아삽으로 처리해 내부프로세스도 주먹구구식, 팀장급들이 사원에게 책임을 넘깁니다. 집에 못들어가는건 다반사입니다."
219,펄어비스,567,내 몸이 아프다 내몸이 또 아프다 돈은 버는데 언제쓰지 업무가 계속 들어온다 퇴근은 11시 ㅋㅋㄱ
220,펄어비스,567,"수직적인 사내문화, 애니메이션팀 파이프라인 엉망으로 주먹구구식 업무 진행. 야근 많음."
221,펄어비스,567,복지만 좋음. 성과금 없음. 회사가 여유가 없어 보임.
222,펄어비스,567,빽이 있어야 함. 라인을 타야 함. 내 능력 보다는 성골들 마음에 드는것이 중요함. 의사결정이 오락가락 함. 고용이 불안정함. 빽이랑 라인 있는 사람 마음에 안들면 언제 자리가 없어질지 모름. 신입들이 일을 못해도 관리해주는 사람이 없는 건지 같은 실수를 반복하고 업무효율이 떨어짐.
223,펄어비스,567,"누가, 어떻게 골랐는지도 모르는 특정 그룹들에게 특혜가 주어지고 일반 사원들에겐 그 흔한 인센티브가 없습니다. 더 투명하고 공정한 방식으로 성과가 주어진다면 회사에서 죽어가는 표정으로 일하는 사람들의 절반 이상은 나아지지 않을까 생각해요."
224,펄어비스,567,필자 근무 당시에는 신입 교육 체계가 부족했다고 생각합니다. 지금은 개선이 됐는지 모르겠습니다.
225,펄어비스,567,사람을 잘 짤라서 정규직도 안심하지 못함.... 불안에 떤다.
226,펄어비스,567,"- 펄어비스가 연봉 높다는건 옛말, 업계평균이거나 그 이하로 받음 - 업무능력 < 사내정치 (사내정치가 매우 심함) - 흡연자 흡연시간 외에 비흡연자는 휴식시간이 없음 - 간부직들의 절대 권력과 사람을 인격체로 대우해주지 않고 부품취급함 - 언론 플레이 (사내에서 혜택을 받지 못하는 사람이 대부분인 복지에 대해 실제로 모두 받고있는 듯한 거짓적인 언론 플레이가 심함)"
227,펄어비스,567,야근이 너무 많아서 개인시간이 적고 경쟁이 치열한편입니다
228,펄어비스,567,복지 외에는 전체적으로 삭막하다. 대우받는 느낌 전혀 없음. 채용공고가 숨쉬듯이 올라오는 거엔 이유가 있다.
229,펄어비스,567,빠르게 발전한 회사라 프로세스가 없고 간부들이 수준이 낮음
230,펄어비스,567,"빠르게 돌아가는시스템, 빠르게 개발하는 환경 요런것들이 힘들다면.. 크게 단점으로 다가올거같다"
231,펄어비스,567,엄청나게 많은양의 업무. 과연 다 할수 있을까 의문이 들정도의 업무량. 팀바팀 이지만 분위기가 매우 무겁다.
232,펄어비스,567,음 아마 다들 기사로 보셨게지만 사람갈아서 게임 만듬 근데 대부분의 게임 회사가 그러니까 그건 그러려니 합시다 대신 각팀별 리더의 평가가 아주 괴랄함... 실무자들끼리는 저 사람이 일 안하고 라인 탄게 보이는데 그런 사람들이 좋은 평가를 받음 열심히 일하는 사람인데 아침 면담후 오후에 짐싸서 나가는 경우가 많음 내부적으로 우리와 맞지 않다고 함 왕족에게 잘보이면 살아남을수 있음
