,company_name,company_id,review_text
233,펄어비스,567,"시스템부재, IT업 특유의 짧은 근속연수, 성과급 없음(지급하더라도 평사원은 안줌, 특수인원 또는 팀장이상 리더만 지급, 리더 베너핏이라는 듣도 보도 못한 제도?! 삼성 sk 현대차 엘지에서 들으면 기겁할 제도) 성과급이라고 하면 모두에게 지급하되 공과 사를 가려서 평가결과에 따라 100 200 300프로 지급해야 하나 여긴 일부 리더급만 성과를 가져가 모두의 노력이 희석되고 일부 팀장이상 직원만 가져가는 경향이 직원들 사기 저하로 이어짐...10명중 2명 정도가 지급 받는듯"
234,펄어비스,567,소수의 대빵들에 의사결정으로 회사가 돌아가고 나머지는 계약 파견직으로 소모품으로 쓰임
235,펄어비스,567,상대적으로 강한 업무강도와 업무시스템의 잦은변동으로 인하여 본업무 이외에 신경쓸것이 많은편입니다
236,펄어비스,567,워라벨. 고용불안. 인센의 전무. 너무 독자적인 회사의 개발 방식. 매우 오래 묻어 다닐 수 있다면 상관이 없지만 그렇기에는 고용불안의 문제가 해소가 되지 않고있다.
237,펄어비스,567,"계약직,파견직을 많이 뽑는 이유가 다 있다고 생각..나갈려면 나가라.."
238,펄어비스,567,"문서화 하지 않고 구두로 설명하는 경우가 많은데, 그런 것들이 단점으로 작용하는 경우가 많음. 군대식 문화. 수직적인 분위기. 삭막한 분위기"
239,펄어비스,567,얼마 안있었지만 사람잘짜르는회사가 맞긴한거같음.. 나 들어가기 이전에 나갔다는 전임자들도 몇명있었고 수습기간중에 나가는거 본적도있고..
240,펄어비스,567,가장중요한복지인 안정성이 없음 주변사람들이 어느날 사라짐 기본급은높지만 성과급이 리더급만 있다
241,펄어비스,567,정치질하는 사원들을 거르지 못하는 관리능력부족의 관리자(이 있었다. 지금은 정리된듯) 현재 이전과는 프로세스가 바뀌긴하였음. 물론 그에 따른 장점도 있겟지만 그 바뀐 프로세스가 서로의 전문성을 파괴하는 식의 프로세스라는 것이 문제. 가장 큰 문제는 큰 회사가 대게 그렇겟지만 이 곳은 항상 정치가 있었다. 그리고 그 영향을 사원들이 받게 된다.(정작 분위기를 해친 사람들은 영향 받지 않았음) 오래된 사람들에게 다소 너그러운 점(장점이자 단점)
242,펄어비스,567,겉모습은 수평적인 것 같지만 수직적 구조입니다. 얼음장같은 팀 분위기 고요 그자체 소리없는 아우성
243,펄어비스,567,"리더그룹이 누군지도, 뭘 하는지도 모름. 정치질이 난무하고 라인만 잘 타면 무능력해도 상관없음"
244,펄어비스,567,문서 작성 없이 구두로 전달하는 사항이 많아 단점을 작용할 때가 많음. 군대 문화가 강함
245,펄어비스,567,일이 많고 야근많다 뭐 이것도 좋다면 좋다 발전할수잇다
246,펄어비스,567,개인적으론 역량을 계속해서 끌어올려야 한다는 압박감이 조금 있는 것 같음.
247,펄어비스,567,교육관련해서는 체계가 잘 잡혀있지 않아서 혼자서 배우려고 노력을 좀 해야한다
248,펄어비스,567,계약직만 고용해서 사람 불안하게 함. 회사내 관리하는 시스템이나 방향 변동 좀 비인간적으로 심함.
249,펄어비스,567,군대문화 밑에 직원들끼리 비교하고 경쟁붙임 워라벨 망함 맨날 야근 주말출근도 하는 직원도 봤음 아주 건강이 안좋아짐 스트레스 받고 삭막한 사무실이었던 기억이 남 눈치보게되고 꼰대상사 군대문화 밑에 직원들끼리 비교하고 경쟁
250,펄어비스,567,야근이 많고 일을 하기가 상당히 빡세다 동료들과 경쟁의식이 팽배해 있어서 협력하기가 쉽지 않고 일을 하기 힘들 정도로 인간관계가 삭막한 편이다.
251,펄어비스,567,확실히 어딜가나 안좋은 분은 존재 한다 일에 비해 원하는 것들이 좀 많다 게임회사다보니 워낙 다양성을 추구한다
252,펄어비스,567,"1. 좋은 복지는 대부분 기혼자를 위한 복지 2. 회사에만 있으니 삼시 세끼는 다 회사에서 먹는게 당연 3. 인력관리는 최악, 인사팀이 잘 못하는게 아니고 수뇌부측에서 꽉막힌 소통으로 업무처리 4. 회사 근처에 같은 회사 사람이 많은건 회사가 외지에 있어 다 이사오기 때문 5. 대부분 복지는 시간이 부족해서 사용 못함"
253,펄어비스,567,셀 수도 없이 많은 복지 혜택이 있지만 제대로 누린 건 딱 2개: 공짜 밥과 야근 야식비 지원이었음. (맞다. 눈 뜨고 일하기 위해 수도 없이 마셨던 커피도 포함) 그냥 그림의 떡임. 전 직장에서 안양의 등대라고 부르곤 했는데 직접 가보니 소문보다 더 심함. 야근의 야근의 야근을 하는 모습을 볼 수 있음! 어느 정도 라인도 잘 타야하며 팀바팀이지만 전반적으로 사람 갈아치우는 것에 익숙한 분위기임. 피바람이 지속적으로 붐.
254,펄어비스,567,정직원의 경우 상황에 따라서 야근이 많다고 들었습니다. 하지만 52시간 이상의 추가근무는 없다고 합니다. 안양에 위치해 있다는 점을 제외하고는 단점을 찾지 못하겠습니다.
255,펄어비스,567,야근이 엄청 많아요 야근 안하면은 사람들 왜 야근 안 하냐 물어봐요 ㅎ 잠깐 쉬려고 휴게실로 가면은 5분만 가도 대화방에 얘기해야되요 ㅎㅎ
256,펄어비스,567,빡세다보니 사람들이 화가 많은 느낌이 강함. 그리고 여유가 없다는 점
257,펄어비스,567,수평적인척 하는 수직적인 분위기. 업무강도가 매우 높아서 적응하지 못하는 경우가 많음. 사내친목행위 불가. 주차 공간이 부족해서 차를 가지고 출퇴근하기가 어려움.
258,펄어비스,567,"구두로 전해지는 기획, 누락된 내용을 찾기 힘듦, 표면적인 수평구조"
259,펄어비스,567,장점빼고 모든것. 일이 많아서 다들 날카로운것인지? 팀장은 자기팀원들 인사는 왜 안받아주는지?
260,펄어비스,567,왜 기획자의 무덤이라고 불리는지 알것같음. 1년 이상 쯤 되면 어느순간 기획자가 아닌 작업자가 되버리는 자신을 볼수가있음.
261,펄어비스,567,(퇴사전 기준)업무량이 많아서 개인시간이 많이 부족하다.
262,펄어비스,567,"비정규직 및 계약직이 많으며, 비교적 입사 난이도 자체는 높지 않으편 그러나 그 동안 쌓아온 야근등 업무량이 많다는 동종업계의 대외적인 인식등이 좋지않다."
263,펄어비스,567,업무량이 살인적임 빡세게 일하는 분위기라서 조금 얼타거나 뒤쳐지면 가차없이 소리소문없이 사라져버림
264,펄어비스,567,부서를 가리지 않고 모두가 업무강도가 센 편. 그래서 몸과 마음이 지치는 경우가 발생하기도 함.
265,펄어비스,567,커뮤티케이션이 아쉽다 타 부서 눈치봐야함 하도 사람들이 눈치봐서 괜히 나도 따라하게됨
266,펄어비스,567,줄을 못 잡으면 다니는 내내힘들다 그리고 잘하는 사람들도 이유없이 자른다
267,펄어비스,567,많은 일을 소화함에 있어 애자일 개발 방법론 중 스크럼을 지향하고 있어 스스로 모든 일을 소화하면서 프로덕트 매니저와 긴밀하게 협업하는 구조이기 때문에 모든 신경을 다 쏟아야만 일을할 수 있습니다.
268,펄어비스,567,회사동료와의 협력관계 보단 서로 경쟁하도록 은근히 부추기며 개발에 문제 발생시 같이 해결하려고 하긴 보단 누군가를 탓하려는 씁쓸한 사내문화가 있음
269,펄어비스,567,잘 다니다가 경고도 없이 하루아침에 권고사직 당할수있음
270,펄어비스,567,"업무강도가 높고, 야근과 철야가 잦은 편이었습니다. 야근이 당연시되는 문화가 있습니다. 기업 문화라고 공지되는 부분이 사람마다 다르게 적용되어 지켜지지 않습니다."
271,펄어비스,567,이 회사는 노예 아니면 어차피 자를텐데 '노예 계약서 Y/N'으로 거르고 회사 홈페이지에도 '우리는 한마디도 거스르지 않는 노예만을 모집합니다'라고 쓰는 편이 옳다. 돈낭비 시간낭비 기회비용 낭비가 많다 상호간에.
272,펄어비스,567,너무 열정적이여서 조금이라도 안심하면 뒤에 쳐지기 때문에 매 순간 긴장 해야 합니다.
273,펄어비스,567,당일 권고사직으로 지인들 나가는 거 보니 싸늘하다. 등 뒤에 비수가 날아오 꽂히는 느낌. 주먹구구식 메니징. 흡사 재입대한 느낌. 일정이 굉장히 타이트해서 압박이 심하다.
274,펄어비스,567,야근이 많은 것이 함정인 것 같고 그것이 최고의 단점이라 생각된다.
275,펄어비스,567,"높은 업무 강도, 고용불안정, 고용 갑질. 정규직들도 해고 되는 사람 비일비재"
276,펄어비스,567,특이한 업무 프로세스. 하지만 이 점은 단점도 장점도 될 수 있다 생각한다. 나는 좋았으나 적응 못하는 사람 종종 있다고 들었다.
277,펄어비스,567,"기대하는 기준치가 높아서 일의 강도가 쎔. 일이 위에서 탑다운 식으로 내려오는데 밑에서는 왜 그게 그렇게 결정되는지 알기 힘듬. 분명 회사 문화는 ㅇㅇ님 쓰자고 명시되어 있는데, 고인물들 끼리는 형님 동생 하고 있음. 반말이 친해지는데 좋다나 뭐래나. 뭐 어느 장단에 춤추라는 건지. 단기간에 급격히 덩치를 키운 탓에 하드웨어는 게임계 대기업급이 됐지만 소프트웨어는 여전히 30명 미만의 중소기업 수준이라 거기서 오는 괴리감으로 적응이 힘듬. 겉으로는 신기술의 최전선에 있는냥 언론플레이를 했지만 현실은 자체엔진 툭하면 에러 터지는 것 때문에 쓰는 사람들은 업데이트 한번씩 할때마다 열불터짐. 놀랍게도 제대로 된 메뉴얼 하나 정리되어 있지 않아서 주먹구구식으로 오래 다닌 사람에게 알음알음 익히거나 저 구석에 박힌 오래된 위키를 알아서 찾아내야함."
278,펄어비스,567,사원들을 대하는태도와 옆자리의 동료가 언제갑자기 사라질수도있다는 불암감
279,펄어비스,567,꼰대들의 수직 문화. 가스라이팅. 숨 쉴틈 없는 업무 강도
280,펄어비스,567,복지 - 그럼에도 야근 없는게 가장 큰 복지이기 때문에 복지가 안좋다고 볼 수 있다
281,펄어비스,567,"""젊은꼰대"" 이 한마디로 이 회사의 모든것을 설명 가능하다. 실패를 겪어보지 않았기때문에 어처구니없는 요청을 받았을때 합리적인 대안을 제시해도 반려당하기 일쑤이며 만약 천룡인의 뜻에 거부를 하다보면 어느새 당신은 아침에 해고통보를 받을것이다. 퇴직율이 말도안되게 높은 이유는 그만한 이유가 있다. 특히 지원직군이 아트라면 정말로 다시한번 생각해보길 권한다."
282,펄어비스,567,일정압박이 심하고 업무가 전반적으로 너무많다. 평촌에 꺼지지 않는 등대!
283,펄어비스,567,"장점과 연계되는데, 회사 규모에 비해 일이 굉장히 주먹구구식임. 그리고 장급들이 퇴사당시에 리얼 꼰머마인드로 무장되있음. 나때는 밤새서 업뎃했어 이정도가지고 힘들다하지마라~"
284,펄어비스,567,그냥 까라면 까라는 식의 업무문화 사람은 소모품이라는 문화 등 나열할수없음
285,펄어비스,567,"나는 이 기업에 어렵게 들어왔는데, 들어가기 쉬운 중소기업과 비교하면 업무 강도라던가 급여 차원에서 별다른 차이점을 못느끼겠음.."
286,펄어비스,567,회사 규모에 비해 건물이 없어 부서마다 건물이 다른점은 매우 불편함
287,펄어비스,567,업무 분담 체계가 확실하지 않아 업무량이 많습니다. 야근 자주 합니다.
288,펄어비스,567,일이좀 빡셉니다 개발진들 수준도 높고 게임의 수준이 높아서 진짜 힘들어요
289,펄어비스,567,장점 외 나머지. 팀에따라 인신공격도 받음. 팀원들 앞에서 정치얘기하면서 특정 정치색 강요하는사람도 있었음.
290,펄어비스,567,굉장히 타이트한 업무일정. 패치만 한다하면 엄청나게 빠듯한 일정으로 숨쉴 틈이 없어요
291,펄어비스,567,"최고 결정권자가 개발자라서 사업팀의 힘이 다른회사들 보다 비교적 약한 편. 일이 적성에 맞는다면 성장하기에도 최적의 환경이지만, 회사 업무 스타일에 적응하지 못하면 천국이 순식간에 지옥이 된다."
292,펄어비스,567,삶이 없고 스트레스가 상당함. 업무 프로세스에 대한 스트레스도 있다.
293,펄어비스,567,복지제도 다양하지만 쓸기회가 없다. 일을 위한 일이 많이생김 (체계없는것) 수평적 문화를 추구하나 수직적 야근야근야근야근 어디로 가는지 모르는 인센티브
294,펄어비스,567,"회사에서는 일을 하고, 퇴근해서는 자사의 게임을 해야 하니 실질적으로 본인의 시간이 없다. 오로지 펄어비스의 게임에 미쳐있다면 일하기에는 좋은 환경이다."
295,펄어비스,567,인간 관계가 좋지 못하다. 함께 즐기며 게임을 만드는 것을 원한다면 이곳은 오면 안된다. 계약직으로 일하는 사람에게 당일 퇴사 통보 하는 것을 여럿 보았다. 본인이 여기서 배워나가겠다면 큰 오산이다.
296,펄어비스,567,인센도 없고 특히 고용안전 최악 어제 재계약한 사람이 오늘 잘림
297,펄어비스,567,실력이 있던 없던 그냥 라인만 잘타면 인정받음 라인 안타고 일만 잘할경우 모든 업무가 집중되지만 인정받기 힘듬. 관리직이 능력도 없고 놀다가 문제 발생시 남탓하기만 바쁨 똑같이 남탓하지 못할경우 혼자 다뒤집어씀
298,펄어비스,567,1. 기술력에 걸맞게 많은 시간을 회사에 투자해야함 2. 밥이 맛있고 안움직이게 되니 살이 찜 3.다른게임회사 스타일로 일하면 큰코 다침
299,펄어비스,567,"무리한 스케줄로 업무를 진행하면서 계속해서 기존에 사용한 코드를 반복사용하며, 예전부터 있던 사람들이 높은 자리를 차지하여 강압적인 업무 지시나 폐쇄적인 기업문화를 보여줌."
300,펄어비스,567,개발 속도 및 업데이트 속도가 엄청나게 빠르다 업데이트 일정에 맞추기 위해 야근을 자주함 게임 스팩이 자세하게 정해지지 않은 상태에서 개발할때가 많음
301,펄어비스,567,일이 너무 많고 체계화가 안 되어 있음 개발자의 영향력이 너무 큼
302,펄어비스,567,팀간의 계급이 아주 명확함 그리고 그 팀 내에서도 수직 서열이 명확함
303,펄어비스,567,정말 일에만 집중 하는 문화이다보니 팀원들 간에 교류가 많이 있지 않음
304,펄어비스,567,실습부터 정규직 전환 전 계약직까지 고용 불안정에 시달린다. 야근 문화. 신입들은 10시보다 훨씬 더 일찍 출근해서 야근 후 다같이 늦게 퇴근한다.
305,펄어비스,567,워라밸과 반대로 가는 회사. 어떻게든 워라밸을 지키지 않기 위해 머리를 쓰는 회사. 하지만 일을 좋아하면 문제는 안됨
306,펄어비스,567,"처음에 적응 하기 약간 어려울 수도 있지만 열심히 한다면 충분히 커버 가능함, 배운다는 의지만 있으면 충분히 할만함"
307,펄어비스,567,"정규직 계약직 가리지않는 당일 퇴사권고, 일정 고려하지 않는 상사들의 요구사항, 고인 성골들의 파티, 이 모든걸 이 회사만의 문화라고 자랑처럼 얘기함"
308,펄어비스,567,"치열한 근무환경과 야근의 일상화, 아직 체계적이지 않은 평가 보상 체계, 직책자와 팀원간의 괴리감, 업무 강도가 매우 강함. 조직 문화가 상당히 이질적이라 처음에 적응하기가 상당히 어려움"
309,펄어비스,567,야근이 많다 맨날 야근하는데 야근하라고 말이 떨어진다 주52시간을 권장하지만 일 양이 52시간으로 되지 않는다 수평적 문화라면서 다들 윗사람 눈치 심하게 본다 사람이 나간만큼 사람이 새로 안들어온다 인원이 부족하단 말을 하지말고 더 뽑아라 일할때 분위기는 거의 군대같다
310,펄어비스,567,연봉이 높아 다른 회사로 이직하기 힘들고 고인물들끼리 끈끈한 우정덕에 다른 주니어들이 끼기 어려우
311,펄어비스,567,주 1일마다 패치로 인한 엄청난 근무 강도와 자유롭다고 포장하지만 막상 위계직급이 있고 엄격한 규율이 있음
312,펄어비스,567,"편파적인 업무 분배와, 고인물 그들만의 리그가 눈에 훤히 보이며 직원들 복지에 힘은 쓰나 실질적 이익 분배는 그들만이..."
313,펄어비스,567,장점이자 단점 개인주의 성향이 강함 각자 할 일만 하고 퇴근. 팀원이 계속 퇴사함. 경력직들이 버티기 힘든 이상한 구조
314,펄어비스,567,일처리가 비교적 비효율적이고 사람 피말리는곳. 텃세는 없는편이고 능력이 부족해보이는 사람들이 간혹 보임 같은일 뺑뺑이 도는 경우가 꽤 많음
315,펄어비스,567,"경기도에 위치한점, 게임사 특성상 프로젝트 전엔 밤낮없이 일해야한다.................."
316,펄어비스,567,"야근이 많다, 사람을 잘 자른다, 성과급상여금을 전체인원의 10프로가 독식한다, 미래가 불투명하다, 안양에 있다. 모든 구성원의 노력으로 매출이 신장되고 성과가 나지만 회사가 지정하는 일부 인원의 노력으로 이뤄졌다고 판단! 윗선끼리 나눠먹기 시전중..20대~30대초반의 일반 직원들의 희생과 노력은 야근수당으로 퉁치고 외면함.."
317,펄어비스,567,"팀바이 팀이지만 업무 교육부터 잘 이루어졌으면 한다. 게임회사라서 야근은 필수적이고, 끼리끼리 움직이는 경향이 있다"
318,펄어비스,567,업무가 많고 프로세스가 잘 잡히지 않은 경우가 있음 생각보다 수직적인 분위기 성과가 나오지 않으면 일방적인 퇴사 통보 받는 경우 있음
319,펄어비스,567,그 외 모든것 사람짜르는거 아주 우습게 아는 회사임 심지어 해고 전날 재계약 했는데 다음날 자름
320,펄어비스,567,"왜 삼시세끼가 나올까? 복지 쓸 시간이 없음. 앵간하면 계약직. 사원을 그야말로 믹서기에 넣고 갈아서 게임을 만듬. 사내정치 있고 애초에 불가능한 스케쥴을 제시하고 맞추지 못하면 깜. 매일 11시반 넘어서 퇴근하는 진풍경., 상여금을 받는 특수 상위?그룹 20퍼센트가 있음. 나머지는 안줍니다"
321,펄어비스,567,업무가 매우 바쁘다. 업무 시간에 쉴 틈이 없다. 항상 일이 쌓여있다. 문서화를 하지 않는다. 항상 메신저나 구두로만 전파한다. 사람에 너무 의존적이다.
322,펄어비스,567,수평문화인척 하면서 수직문화인 점. 끝내야 될 일이 끊임없이 있다
323,펄어비스,567,업무 강도가 너무 쎔. 급할 때 앉은 자리에서 종아리 근육에 작은 경련 일어나고 이명이 들림.
324,펄어비스,567,업무강도가 강함 개인적인 능력과 생각보다는 상사에 대한 기준 강요함 휴식은 자유이나 업무강도가 강하다보니 휴식을 취할 수 없음
325,펄어비스,567,"회의가 좀 많고, 개발 프로세스에 나머지 팀들이 전부 말려들어가는 기분이 없잖아 있다. 이전에는 퇴근은 꿈도 못꿨는데, 그래도 최근에는 많이 나아졌다고 한다."
326,펄어비스,567,"자살할듯한 분위기, 인성 쓰레기가 뭔지 제대로 알 수 있는 상사, 님문화 라고 하지만 최강의 군대 문화, 병들어 퇴사 가능한 회사"
327,펄어비스,567,인턴이 정직원 됬단 소릴 들어본적도 없으며 본 적도 없음
328,펄어비스,567,게임회사답게 생각지도못한 야근이나 주말출근이 있을수있습니다. 물론 모두 정규업무시간을 넘어간 업무시간은 정확하게 체크되어 추가수당이 나오긴합니다.
329,펄어비스,567,야근이 거의 필수이다 보니 하루에 거의 12시간동안 회사에 붙어있음 때문에 퇴근하고 자고 일어나면 바로 출근 나의 시간이 없음
330,펄어비스,567,빠른 의사결정과 과감한 실행을 통해 앞을 보고 달려가는 기업문화에 적응하지 못하면 회사생활이 힘들 수 있다.
331,펄어비스,567,입사 후 여가생활을 즐길수가 없습니다. 항상 퇴근하면 11시가 넘었습니다.
332,펄어비스,567,넘지 말아야할 선이 너무 타이트하고 항상 일정에 치이고 야근이 많음
333,펄어비스,567,"보고서 같은 문서가 필요 없어 편리하나, 그에 따른 문제도 많이 발생"
334,펄어비스,567,"고인물이 많음, 그로인해 퇴사자 증가, 결정이 하루에도 수십번 바뀜"
335,펄어비스,567,"군대식, 건강이 나빠짐. 사람쉽게쉽게 자름 다닐수록 사람들 표정이 달리지고 성격이 예민해지기 시작함"
336,펄어비스,567,일을 처리할떄 확인 하는 과정이 많아 비효율적임. 일이 너무 많은 편인데 업무량에 비해 성과는 잘 안나올 수 도 있음. 업무에 대한 보상이 소수에게 집중되어 있음
337,펄어비스,567,야근이 많음. 근처에 게임회사가 없는 외딴 곳이라 교통이 좋지는 않았음.
338,펄어비스,567,일이 많다. 팀바팀이지만 군대 분위기이다. 언제 짤릴지 모른다는 불안감이 크다.
339,펄어비스,567,다른 회사와달리 신분제도가 확실히 있는 회사이다. 초기멤버들은 왕족 및 양반 나머지는 노비들이다. 팀장들은 그런 노비들을 잡는 추노꾼이다. 현금성 복지는 좋은데 그걸 누려보기전에 짤려나가거나 자기발로 나가게 된다. 인력 소중한지를 좀 알았으면 좋겠다. 취준생들 및 이직자들는 환상갖지 말길...!
340,펄어비스,567,"1. 성과급 상여금이 없음 개발자와 팀장 임원등 초기 설립자들에 국한해서 전체직원중 일부 20프로에게만 지급됨. 상대적 발탈감이 크니 입사시 현혹되지 말것! 2. 근속연수가 짧음, 현재를 위해서는 다닐만 하지만 5년 10년을 다닐수는 없는 회사3. 회사의 미래가 불투명 차기작 망할시 급속도로 가세가 기움, 4. 엄청난 야근..못버티면 너희 책임이다 나가라 마인드..아래직원들 갈아서 윗사람들 배불리는 구조"
341,펄어비스,567,게임회사면 피할순없지만 야근이 정말 자연스러운문화가되버렸응..
342,펄어비스,567,야근이 적지 않은 편입니다. 게임회사 특성상 불가피한 부분일수 있지만 단점을 꼽아보라면 야근정도인것 같습니다.
343,펄어비스,567,"불분명하고 시시각각 뒤엎어지는 의사결정, 인격모독, non respect, 불분명한 업무 롤, 모든건 소수가 의사결정 및 진행, 나머지는 부품 (대기업에서 당연한 일이나 인격모독 및 정치질 당하면서 부품으로 전락하면 답없음), 정치 없다는 얘기들이 들리는데... 소수의 권력자 눈 밖에 나면 그대로 끝입니다.  개인적으로 제 연차 대비 예상하기 어려운 연봉을 받았음에도 이건 사는게 아니다 싶어 퇴사했습니다."
344,펄어비스,567,"워라밸 포기 해야함 지독한 야근으로 갈려나간다는 말이 괜히 나온게 아님 안양의 등대 그리고 요즘 대부분 파견, 계약직 뽑죠? 정규직 안뽑는 이유가 뭘까 그냥 전환 갑질임 그리고 회사는 입사자에게 절대적 충성을 바랄거임 못하겠으면 내보낼 수 있다고 하던가..."
345,펄어비스,567,배울 것이 하나도 없다. 창립멤버만 코어를 다루고 나머지는 모두 반복 업무이다. 절대 개발자가 우대 받는 회사가 아닌 정치를 잘하는 사람들의 회사. 모든 직원의 표정이 하나이다. 연봉가 복지가 좋아져도 사람들이 계속 퇴사하는 것에는 이유가 있다고 생각한다. 내부 정치를 잘하고 일은하지 않지만 계속 다니기 편한 회사. 정치를 못하면 수습 후 연봉조정 들어간다.
346,펄어비스,567,야근을 장려하는 수준의 빡센 야근문화 제가 있었던 층만 그런건지는 모르겠지만 사내 분위기가 최악
347,펄어비스,567,"몸이 너무 힘들어짐 주말에도 출근이꽤있고, 밤샘근무는 많음"
348,펄어비스,567,일단 일이 매우 많다. 주 4~5일은 야근을 해야 한다고 생각해야 한다. 관리자급이 집을 가지 않고 일을 끊임없이 준다. 심지어 밤 12시에 일을 받을 적이 있다. 자존심? 자기 주장이 강한 사람이 많아 일방적으로 의사 결정이 되는 경우도 있다.
349,펄어비스,567,대체적으로 일이 많다는 것과 점검날이 있기 때문에 다국어 게임 서비스의 특징 상 점검시간이 대체적으로 달라서 점검날에는 하루종일 긴장상태에 있습니다.
