,company_name,company_id,review_text
0,포드커머스,6413,1분만 지각해도 반차처리 함 아직도 시대에 변화하지않고 도태되어있음 최근에 궁금해서 홈페이지 들어가봤는데 온라인 쇼핑몰인데 아직도 10년전 홈페이지 그대로 ㅠㅠ 오히려 안타까운 마음임...
1,포드커머스,6413,"사장이 직원들이랑 너무 어울리려고 하며, 맘에 들지 않으면 가차없이 잘라버린다. 그리고 급여가 너무 적다."
2,포드커머스,6413,무의미하게 느껴지는 회의 같은말만 계속 하게되나 발전없음 노후된 회사 시스템들 회식강요
3,포드커머스,6413,"낮은 급여, 체계 없음, 불필요하고 내용이 없는 회의, 안정적이라고 생각되는 것 외의 리스크를 부담하려 하지 않다 보니 새롭게 도전하거나 뭔가 달라지는 일은 없음, 한 달에 한 번씩 의무적으로 참여해야하는 회식"
4,포드커머스,6413,"사이트,작업방식,업무환경 모두 올드함, 효율성이 없음 왜하는지 모르겠는 답답한 회의를 함"
5,포드커머스,6413,크게 단점이랄거는 없지만 어느 회사에나 있는 약간씩의 불평 불만은 어쩔 수 없는 것 같음..ㅋ
