,company_name,company_id,review_text
0,한국다케다제약,4580,분위기가 경쟁적인 면이 있고 무슨 일을 하는지 잘 모르겠는 노조가 있다.
1,한국다케다제약,4580,"승진 잘 안되고, 윗사람들 비위맞춰야함. 점심먹으러 가기 어려움. 롯데타워라서"
2,한국다케다제약,4580,일부 사업부 매각으로 인해 많은 인원이 회사를 퇴사함으로써 직원에 대한 보호의지가 다소 약함
3,한국다케다제약,4580,"너무 복잡한 시스템, 무능력한 인사팀, 샤이어 출신들은 능력이 많이 부족해도 승진이 잘 된다"
4,한국다케다제약,4580,현지화된 외국계의 특성이 보임. 권한이 상부에 뭉쳐짐. 조직이 좀 더 외국계 형태의 매트릭스 조직이 된다면 어떨까
5,한국다케다제약,4580,주니어의 경우 연봉조건이 좋아보이지는 않음. 업무량이 절대 적은 편은 아니었으나 개인 또는 팀에 따라 다를 것으로 예상됨
6,한국다케다제약,4580,경력이 낮은 연차가 많아서 업무를 같이 진행하고 배우는데에 한계가 있음. 일본계라서 한국계와 다국적 회사의 그 어딘가의 애매모호한 경계.
7,한국다케다제약,4580,파이프라인이 강하지않음 그외 크게 단점은 못느끼고 있음
8,한국다케다제약,4580,몇 몇 하이애나들은 여전히 있고 현 헤드라인은 매우 폴리틱해서 실력과 열정이 퇴색된 느낌.. 국내사와 외자사의 믹스된 열정적이고 다이나믹한 조직문화는 지금은 찾아보길 힘들듯.. 규모의 축소는 좋으나.. 파이프라인의 한계는 계속 풀어야할 과제.. 1sr class 론칭 품목이 거의 없다는 점이 큰 약점임
9,한국다케다제약,4580,변혁의 시기에 수많은 라인인사가 있어서 아쉬웠음. 그 휩쓸리는 분위기.
10,한국다케다제약,4580,업무보고 상당한 디테일을 요구 할 때가 있음 / 매출 증빙/ 영업 증빙들도 상당히 까다롭고 세세한 룰이 있어서 승인 받기 어려움
11,한국다케다제약,4580,외국계제약사라고는 하지만 국내사의 분위기가 남아있어서 다국적 회사를 꿈꾼다면 아쉬운 부분이 많습니다 하지만 점점 좋아지고 있습니다
12,한국다케다제약,4580,"프랜차이즈 별 팀 분위기가 극과 극을 달렸고, 야근 수당 신청이 불가하다는 점, 일본 기업의 전형적인 비효율적 서류 업무"
13,한국다케다제약,4580,시스템이 바뀌면서 펜딩되는 건이 되어 일처리가 늦어지는 점이 있음
14,한국다케다제약,4580,글로벌에서 막으면 지사인 한국은 어쩔 수 없는 부분이 있음.
15,한국다케다제약,4580,합병하면서 기존직원들을 홀대하고 무시. 합병된 회사사장과 인사부디렉터가 회사를 이상하게 만들어버림. 각부서 헤드들도 자기 수하로 다 올킬
16,한국다케다제약,4580,계약직일 경우 단기용 직원이라는 느낌이 강했음 잡 업무가 좀 있어음
17,한국다케다제약,4580,"딱히 없는 것 같은데, 개인주의 경향이 있습니다. 신입에게는 약간 적응하기에 힘들 수도 있어요."
18,한국다케다제약,4580,노조와 갈등이 있었고 합병된회사에 잠식당해서 기존 직원들 대거그만둠
19,한국다케다제약,4580,HR director란 사람이 직원 내보내는데 혈안이 되어 자르기 바쁨
20,한국다케다제약,4580,연봉이 높은편은 아니고 글로벌 조직이라 사람을 쳐내는데에는 가차없음
21,한국다케다제약,4580,"일이 너무 많다. 건강 관리는 알아서, 아니면 지친다."
22,한국다케다제약,4580,제약사 특유의 정적이고 패씨브한 업계문화가 있는 편. 주니어들이 경력을 시작하기에는 다소 힘이 들 수 있다.
23,한국다케다제약,4580,사실 몸소 느낀 단점은 거의 희박... 순간 적으로 많은 일들이 몰려와 쉴새없이 일했다는 점...?
24,한국다케다제약,4580,글로벌 보고가 많고 간섭 범위가 넓음. 프로세스가 복잡하고 서류 절차가 많음. 의사결정 관련자가 많은 편.
25,한국다케다제약,4580,글로벌 기업이다보니 명예퇴직을 불가피하게 진행하는 경우도 생기겠지만 조금 더 피고용인의 입장을 배려해 주지 못한 헤드분들의 미흡함이 아쉬움
26,한국다케다제약,4580,아르바이트라 나는 정해진 시간동안 일했지만 다른 직원 분들은 일이 많아 야근을 많이 했다.
27,한국다케다제약,4580,과거 강성 노조이미지 있음. 기존직원들이 희망퇴직으로 다수 나가고 남아있는 직원들의 자리가 여전히 불안함
28,한국다케다제약,4580,아무도 챙겨주지 않습니다 계약직 차이가 표면적으로 많이 드러니는 회사
29,한국다케다제약,4580,비효율적인 문서 페이퍼 작업이 많음 정규직들이 본인의 업무를 자세히 모르는 사람이 너무 많다 (정말 이상함) 회사 사용 프로그램 및 사람이 자주 바뀜 (결재라인 통보없이 수시로 바뀌어서 프로세스 혼란) 계약직 정규직 전환 x 요즘 퇴사하는 사람이 많아짐
30,한국다케다제약,4580,"글로벌 경영진과 한국경영진이 외부에서 온 사람들이라 자신만의 이익을 추구함. 2011년 나이코메드 20조 가량 주고 매입, 2018년 샤이어라는 듣보잡 회사 65조, 중간중간 Lap과 특허기술을 가진 자잘한 회사를 많이 사들여 글로벌 부채가 매우 심각한 수준.  자사 제품을 주력제품과 비주력제품으로 나눠 글로벌에서 여러나라로 쪼개서 팔아버림. 그로인해 cash cow품목도 팔려나가 항암제와 희귀질환만 다루는 회사로 변화할려고 하지만 시장에서 비주류 제품이라 향후 지속가능한 매출이 있을지는 미지수.  노조가 매우강성이며 그들만의 리그로 깡패같은 모습을 보여줄때가 많음"
31,한국다케다제약,4580,무리한 글로벌 정책으로 채무가 많고 내놓을만한 블록버스터가 없어 언제든 기울수 있다고 봄. 직원을 가볍게 여겨 10년 이상 근속이 어려움.
32,한국다케다제약,4580,샤이어인수로 최근 사업부 매각 지속..남아있는 직원들은 고용불안에 시달림.
33,한국다케다제약,4580,GM 에 집중된 권한이 인사나 재무쪽도 포함되어 분산이필오
34,한국다케다제약,4580,"한국지사 최초 설립 시 유사년차 경력직 대거 채용으로, 내부 경쟁이 치열하였음. 현재 합병 후 다케다 출신 직원보다 신규 유입된 샤이어 직원이 대부분 고위 요직에 있음. 합병 과정에서의 공정성 논란과 최근 ERP 진행으로 인해 직원 사기가 매우 떨어져있음"
35,한국다케다제약,4580,보건휴가 무급. 일이 많아 야근을 해야하나 야근비를 주지않음. 직원을 갈아서 회사 운영
36,한국다케다제약,4580,"직원들에대한 차별이 심함, 합병당한 회사가 모든걸 차지하고 기존 직원들에게 함부로하는 부분, 신약 파이프라인이 올바른 방향이 아님"
37,한국다케다제약,4580,고용불안 동일 경력이라도 연봉의 개인차가 큼 매니져가 너무 많음
38,한국다케다제약,4580,캔틴이 협소함. 미팅룸이 너무 없음. 젤 중요한건 연봉이 제약회사 중간(평균) 이라고 하는데 그렇지 않음. 복지비 합해서 연봉이라고 하면 그렇지만 빼고 순월급만 보면 진짜 너무 짬
39,한국다케다제약,4580,보수적이고 매우 바쁘고 사람들이 매우 개인주의적 입니다
40,한국다케다제약,4580,일본의 수직 문화가 강하게 남아있음. 더불어 임원진들의 권한이 막강함. 정체되어 있는 곳
41,한국다케다제약,4580,연봉 편차가 심하고 경력직임에도 불구하고 직급이 없다보니 다들 평사원임. 다만 임원들은 자기들 맘대로 직급 부여. 일하는 직원들만 일하고 나머지는 일하는지 모를정도. 현재 샤이어 인수합병 후 역으로 먹힘.
42,한국다케다제약,4580,정시 퇴근이 힘든 것처럼 보였고 단기 아르바이트여서 식대 제공은 따로 없었음
43,한국다케다제약,4580,사무실이 'ㅁ'자로 환기도 어렵고 방없는 사원들에겐 매우 불편한 구조
44,한국다케다제약,4580,"21세기에 서류 뽑아서 결재판에 넣어 상급자한테 서명 받으러 다님 HR이 거지같고 직원을 소모품 취급함 도대체 이정도 규모 회사에 HR인원이 왜 저렇게 많은지 모르겠음 헤드가 샤이어 출신, 직원들은 기존 다케다인 부서가 많고 그런 부서들은 앞에선 네네해도 뒤돌아서면 샤이어 부서장 무시하고 씹음"
45,한국다케다제약,4580,"샤이어 합병 후 두 회사 문화가 쉽게 융화되지 않아 분위기 뒤숭숭하고, 보고/결재 철자가 복잡함"
46,한국다케다제약,4580,음...층이 나뉘어져 있어 업무 진행시 이동이 잦았던 기억이 있습니다.
47,한국다케다제약,4580,급여수준은 좋은 편이나 상대적으로 다소 아쉬운 복리후생
48,한국다케다제약,4580,"회사분위기, 개인플레이, 뭔가 이상한 사람들이 있다.(소리지르는 사람, 화내는 사람)"
49,한국다케다제약,4580,"개인의 일을 중심으로 진행이 되다보니깐 서로 교류가 없어보였고 영어이름을 사용하고 있지만 직급이 명확이 나누어져 있기는 했음, 정규직도 많이 있었지만 계약직으로 이루지는 고용형태가 많아보였음"
50,한국다케다제약,4580,조직이 수평적이나 산업 특성상 수직적인 부분도 분명히 존재하고 있음
51,한국다케다제약,4580,경영진에 너무 공격적인 사람이 많고 본사 지시에 따라 사장이 바뀌는 일도 있음
52,한국다케다제약,4580,그런데 그 자기 일이 엄청 많다. 일을 잘 해도 쓴소리 듣기 일쑤이며 모두 책임을 미루는 분위기이다. 만약 다른 사람의 사소한 잘못을 그냥 넘어가 준다면 본인이 잘못한 게 되어 호구된다.
53,한국다케다제약,4580,"일부 임원진의 고압적 태도, 조직안의 불신이 여전히 남아있어 바뀌는데 앞으로도 많은 시간이 걸릴듯. 매뉴얼업무가 많고 부서간 배려나 이해 부족으로 커뮤니케이션 어려운경우가 있음."
54,한국다케다제약,4580,단점은 잘모르겠다. 다만 업무량이 너무 많다고함 그래서 칼퇴하는 부서가 적음
55,한국다케다제약,4580,"문서 작업 많음, 보고를 위한 준비 많음, 업무량 매우 많음"
56,한국다케다제약,4580,"비합리적인 인사평가제도로 인해 승진과 부서이동, 한국직책 변경등이 이해가지 않은 상황 수시 발생 , 소통부재, 시스템의 부조화"
57,한국다케다제약,4580,사람별 일의 양이 다름. 합병 후 길을 잃어가는 중.
58,한국다케다제약,4580,사장실 들어가기 전에 눈물 훔칠 준비해야 하는 회사. 월급쟁이 CEO의 한계
59,한국다케다제약,4580,"팀별로 다르나 대체적으로 업무가 과다함. 통합시스템이 없어 수작업이 많고 업무적으로 성장할수 있는 기회나 시스템이 없음. 외국계임에도 보수적인 조직문화이며 직원들을 소모품 다루듯하여, 좋은 복지나 보상이 있음에도 이직희망자가 많음. 내근직은 턴오버가 높고 신규채용과정이 길어 인수인계가 제대로 되지 않거나 업무히스토리 등 관리가 잘안되는 경우도 종종 있음."
60,한국다케다제약,4580,인사 및 발령 이해하기 힘듬 줄세우기 있는듯 최근에 있었던 갈등이 아직 가라앉지 않음 부서간 직원 이동으로 특정 부서내 인력부족한데 충원 안되고 있고 명확한 이유를 제시하지 않음
61,한국다케다제약,4580,치열한 생존경쟁. 회사가직원을 중요시여기지않음. 수시로 체제가바뀜 진정한 경영인이없음. 셀피쉬 집합체
62,한국다케다제약,4580,한국에서의 역사가 짧은 만큼 기업 문화가 제대로 정착되지 않음. 임원진들이 보수적이고 독단적임.
63,한국다케다제약,4580,"경영진의 마인드가 글로벌 기업과 맞지 않음, 지나친 성과 위주의 경영, 우수한 자들의 연이은 퇴사"
64,한국다케다제약,4580,규모에 비해 시스템이 매우 미약한 수준. 시스템이 업무수준를 받혀주지 못함.
65,한국다케다제약,4580,"비합리적인 인사평가와 연봉제도, 프로세스 및 시스템 미비, 협업이나 조직보다 개인 및 팀 성과만 챙기도록 만드는 조직문화와 경영진"
66,한국다케다제약,4580,글로벌 기업이라고는 하나 아짓도 일본 전형적 문화가 존재하여 더 발전에 장애물이 될 수 있음 다양한 파이프라인이 있다고는 하나 대부분 후발 제품으로 도일힌 효과나 부작용이 있어 경쟁력이 다소 떨어짐
67,한국다케다제약,4580,"다국적제약회사이고 오너회사가 아닌데도 불구하고 지사장 개인의 의견에 회사의 방향이 좌지우지 되는 분위기. 실무진이 뛰어나도 임원진들과의 상하관계와 국내사와 같은 강압적 분위기가 다분함. 다른 외자사에 비해 턱없이 낮은 복지혜택과 삶의 질이 불만인 직원이 대부분. 하지만 이역시 실무진에만 국한되는 얘기로, 임원진 많이 다를 수 있음"
68,한국다케다제약,4580,결과 중심적인 성과 관리로 모든 것을 평가
69,한국다케다제약,4580,국내기업같은 보수적 문화. 오너기업이 아님에도 불구하고 모든 것이 사장의 의견으로 정해짐
70,한국다케다제약,4580,많은일들이산재
