,company_name,company_id,review_text
0,한빛인포텍,7480,채용담당자가 직원을 소모품으로 보는 경향이 있음. 너말고도 일할사람 많다는 식. 연봉협상 후 계약서를 구두로 진행하여 퇴사시에 반영이 안되었음. 기존 연봉으로 퇴직금 정산 당함.
1,한빛인포텍,7480,인사평가제도 최악이고 연봉을 안올리고 동결 상태로 유지할려고함
2,한빛인포텍,7480,"원격을 통해 PC 문제를 해결해 주는 좋은 취지의 일이나 실상은 콜센터와 다르지 않음,온갖 하자많은 고객이라는 이름의 왕관을 쓴 인간들을 상대해야 하며 거기서 오는 스트레스가 상당함,정시마다 고객PC 점검이 예약되있으며 2대를 동시에 점검함,애플 맥이나 핸드폰 등도 원격 지원 서비스에 포함되있어 서비스 지원 범위가 너무 방대함,다방면에 걸쳐 높은 문제 해결 능력을 요구하고 연봉은 알바보다 못함,휴게실이라는 공간조차 굉장히 허접하며 업무 중 출출할 때 먹을 것도 일체 없음,회사내 직원들을 보면 나이어린 친구들이 굉장히 많고 온갖 문신 및 염색 등 용모가 단정하지 않은 사람이 많음,사내 분위기나 호칭 등 여기가 아르바이트하는 곳인지 회사인지 분간이 안감,장기 근속자가 많지 않음,을의 위치에 있는 회사다보니 갑의 눈치를 엄청 봄."
3,한빛인포텍,7480,IT를 전혀 모르는 전무가 옴으로써 자기 뜻대로 회사를 운영하기 시작함 그 사람 말에 거슬리면 무조건 Target이나 고문관이 됨. 새로 들어온 사람에 대한 배려가 전혀 없음(전무가 현장 분위기에 대해선 전혀 아는게 없음) 주 단위로 알게 모르게 매출에 대한 압박이 있으며 기다려주질 못하는걸 보면 회사에 돈이 없음 장기적인 Plan을 가지고 영업 활동을 하기엔 최악임
4,한빛인포텍,7480,"복지 없음. 추가근무 및 야근이 많지만 추가근무 수당, 야근수당 없음."
5,한빛인포텍,7480,"그냥 알바하는게 나을 수도 있는 박봉,TS와 CS가 결합된 형태라서 진상고객으로 인해 만만치않은 감정노동이 있음,원격 지원 범위가 방대해서 이런 것까지 해줘야 되나 싶을 때가 있음,서로간에 형 동생하며 부르다보니 여기가 회사인지 구분이 안됨,정시마다 2대의 PC를 동시에 점검하는 구조라서 빠른 해결이 안되면 어느순간 4~5개의 PC가 원격으로 붙어있음,통화량이 많을 때는 말하다가 지칠 때가 많음,제대로된 휴게실이 없으며 허접한 탕비실,고객과의 통화 녹취나 점검 녹화파일을 돌려보며 친절하게 했는지 그리고 제대로 점검했는지 평가함,점검때문에 식사시간이 많이 지나 편의점 도시락을 사와서 먹고 바로 일할 때도 있음."
6,한빛인포텍,7480,매우낮은 연봉 및 승진기회부족 cs팀 답게 고객들을 상담하며 클레임이 매우많이 들어오는데 말도안되는 부분역시 고객의편에서서 사원을 힘들게함 현재는 어떻게 되어있는지 모르나 그부분이 매우 힘들었음 교대근무같은경우는 현재는 안하는걸로 알고있어서 단점에서제외
7,한빛인포텍,7480,비헙리적인 인사평가와 업무분해가 효율적이지 못함 최대 단점
8,한빛인포텍,7480,"보수적인 업무부분, 작은 회사이지만 개개인 너무 경쟁적심리가 강한부분이 있음"
