,company_name,company_id,review_text
0,한울정보통신,770,일이 많습니다. 퇴근시간이 자주 늦어집니다. 경력자분들은 괜찮겠지만 신입들은 초반에 많이 힘듭니다.
1,한울정보통신,770,주먹구구식 운영 복지가 안좋다 멀다 환경이 별로 안좋다.
2,한울정보통신,770,너무 출장이 잦아서 힘들다 그리구 주말에 당직이있어서 조금 약속잡기도 힘듬
3,한울정보통신,770,손이 좀 느리면 초반에는 조금 힘들 수 있음 최종적으로 업무가 숙달되면 설치하러 가는 곳이 조금 빡셈
4,한울정보통신,770,눈치보여서 연차를 한달에 한개만 사용하다보니 다 사용못함 야근하더라도 하는만큼 다 받지는 못하는거 같다 설날 추석 떡값 같은건 없다 급여가 작은편
5,한울정보통신,770,일 터지면 엄청 바쁨. 심지어 주말출근 무급. 높은곳도 올라가야하는 강 심장 필수. 간혹 야간근무 있음. 무급임. 노예처럼 일해도 월급 똑같음. 공휴일 출근이 많을수도있음. 자기 시간이 많이 필요한 사람은 지원 비추
