,company_name,company_id,review_text
0,한터기술,7409,군대 느낌의 수직적 문화. 잦은 야근 철야. 박봉. 아침조회
1,한터기술,7409,경영자가 오판단을 할 수 있게하는 임원급 직원이 다수 었음
2,한터기술,7409,야근 수당이라는게 존재하지 않는데도 야근을 시킴. 퇴직연금도 빼서 퇴직금도 제대로 못받는 곳
3,한터기술,7409,하는일만 계속하게되고 상급회사 눈치를 많이봄 철도쪽에서 을중에을
4,한터기술,7409,윗분들이 많은 역피라미드 구조의 회사. 연봉이 높지않다.
5,한터기술,7409,영업 조직의 수장의 능력이 낮아 경영진의 오판을 불러옮 CEO가 자기애가 강하며 앞에서는 경영적 비판에 수긍하는듯 보이나 결국에는 자신의 판단으로 결정함
6,한터기술,7409,급여인상이 인색함 진급을 하기전까지 매년 호봉으로 조금씩 오름 역피라미드 인력구조 사원 대리가 10%안쪽
7,한터기술,7409,연차가없다. 퇴근눈치를 줌. 새로운일이 거의없다. 장거리출장
8,한터기술,7409,복지제도가 다양하지만 쓸수없음.연차 눈치보임.야근 강요.야근 안하면 진급에 영향있음.정치해야함.고인물들이 많아 일하는 사람은 정해져있음
9,한터기술,7409,윗분들에 비해 실무자들이 적음. 역피라미드 구조인 회사
10,한터기술,7409,임금체불 문제 발생으로 퇴사자 다수 발생 및 대표의 방향성이 얼마나중요한지 알게됨
11,한터기술,7409,이렇다 자랑할만한 복지는 없었던 것 같다. 직원 연령대가 높았고 회식이 잦았다.
12,한터기술,7409,"훈련되지 않은 팀장 이상급 관리자들로 인해 협력, 협업이 어렵고, 체계적인 업무 관리 안됨 불필요한"
13,한터기술,7409,"고인물들이 많아서 기업문화는 수직구조임 . 그래서 연차 쓸때 눈치 보이고 , 퇴근할때도 눈치 보인다 . 그들의 기업문화는 안그랬기에..."
14,한터기술,7409,급여인상에 인색하고 여름 휴가 이외에 휴가쓰기가 눈치보임
15,한터기술,7409,CEO의 경영 판단 잘못을 회사를 어려워 지게 했으며 마지막까지 자신을 욕심을 채우려 직원들을 내침
16,한터기술,7409,경영진의 눈치를 보는 경우가 많아 업무 프로세스가 많이 지체되는 경우가 종종 있음.
17,한터기술,7409,나이 많은 윗사람들이 많고 일하는 사람만 일하는 분위기임
18,한터기술,7409,부서별 업무 차가 심하고 일 진행이 너무 루즈하게 진행되는 회사
19,한터기술,7409,"부서별로 난이도가 다르다, 부서별로 연봉도 다르다. 부서별로 안친하기도 하다."
20,한터기술,7409,"좋은 아이템으로 한방에 말아먹은 곳, 회의를 위한 회의가 너무 많은 회사, 인사관리를 경영진이 너무 이상하게 바꿈"
21,한터기술,7409,"호봉제, 사원대리급 진급 느림 연차가 따로없음.. 특정사유 있을때 말하고 쉴수 있음. 출장이 많고 주말출장/현장에서 밤새는일이 번번히 있음."
22,한터기술,7409,급여지연 임원진의 무능함 무능해도 이렇게 까지 무능할수있나싶음
23,한터기술,7409,"매출 대비 연구소 및 영업 인력이 너무 많고 특히 이사급들의 인력이 많음, 대기업 오더가 점차 줄어듬"
24,한터기술,7409,역피라미드식 과장 부장급이 너무 많음 개인 월차가 없음 때로 휴가없음
25,한터기술,7409,너무 편해서 일을 안하는 사람들도 많다 임원들이 많고 팀장급들 엄청 많다
26,한터기술,7409,선택과 집중이 전혀 되지 않음. 주력 업종의 모호함. 사원대비 임원이 너무 많음.
27,한터기술,7409,노하우 있고 열심히 하는 중간직급들이 빠져나가면서 일을 할 사람이 없어짐. 일 잘하면 몰아줌. 책임감없이 일하다보니 계속 문제생기고 회사도 타격
28,한터기술,7409,"연봉인상 많지 않음, 수직적인 구조, 역피라미드 구조."
29,한터기술,7409,"기본적인 연봉이 낮음, 게다가 인상율도 상당히 낮음 비슷한 규모의 중소기업보다도"
30,한터기술,7409,승진 기회가 적고 중간계층이 적은 역피라미드 구조의 회사
31,한터기술,7409,"임직원 및 사장의 무능함, 책임전가 식의 업무, 현대의 갑질에 버텨야 하는 회사."
32,한터기술,7409,불필요한 결재라인 많음. 일이 많이 몰려있음. 복지 미흡. 쓸데없는 PR 많음
33,한터기술,7409,시간만 죽치면 진급되서 임원이 많음. 전체인원의 10% 이상이 임원임. 전체적으로 일하는 연구원들만 죽어라 일하고.. 각 부서별 협조도 없고 업무 떠밀고 네책임이니 내 책임이니.. 서로 핑퐁 싸움.
34,한터기술,7409,"상대적으로 임원이 많음 정해진 휴가가 없음, 연구원들은 많음 그런데 일하는 사람은 적음 담당자가 퇴사하면 후임자는 머리뜯다가 이어서 퇴사함 필요 이상으로 열심히 하면 억눌르거나 아님 지원없이 본인이 걍 알아서 다 하게 해서 지풀이 지쳐서 나가게 함 걍 정해진 틀 안에서 열심히 해야함"
35,한터기술,7409,프로젝트가 끝나지 않는다. 급여가 밀린다. 일하는 사람만 일을 한다.
36,한터기술,7409,단순 보고를 위한 문서 작업이 많아 비효율적. 단순 보고를 위한 회의가 많아 비효율적. 복지 제도가 다양하지만 실제로 쓰기는 힘들다. 성과급이 없다.
37,한터기술,7409,인력 구조가 역피라미드 구조로 임원이 너무 많다. 매출은 있으나 이익이 없어 급여가 밀린다. 급여가 밀리는데 회사 정상화를 위한 노력이 부족하다. 정상화의 기회가 있어도 사장 및 임원들의 욕심으로 정상화의 기회를 날려 먹는다. 비정상적인 인사평가 제도로 회사만 다니면 적게나마 급여가 오르고 진급도 함. 그러나 인사평가 제도가 미흡하여 열심히 일하는 사람이 없음.
38,한터기술,7409,매출대비 이익구조가없으며 일할사람이 부족함 자금 운영계획이 없음 그때그때 다름
39,한터기술,7409,1. 복지 문제 / 연차휴가가 없음 - 아래 이유로 없다고 함 (법정근로시간 최대 주52시간으로 계산 토요일 휴무로 연차가 없어진다함) 일이 있을 경우에는 연차휴가로 쓸 수 있으나 위 이유로 인해 엄청난 눈치를 줌. 2. 승진이 불투명함 3. 직급의 역피라미드 구조 - 임원이 사원보다 많음
40,한터기술,7409,"쓸때없는 야근을 시킴, 직급 높은 직원들끼리의 알력다툼이 심함, 20시 넘어서 퇴근찍어야지 저녁식권 하나주고 야근비 없음."
41,한터기술,7409,복지는 전혀 바라지 않는 것이 좋음. 몇몇 인물들 때문에 아랫물이 흐려지는 느낌. 공식적인 연차가 딱히 없다.
42,한터기술,7409,부장급이나 임원급이 너무 많음. 즉 일하지 않는 사람들이 많고 아부하면 인정받는 곳. 연봉 오르는 폭이 매우 적음. 연차도 특별한 사유 없으면 쓰기 힘듦. 첫직장으로 추천하지 않음.
43,한터기술,7409,"사내 문화가 정치적이고, 일 잘하는 사람만 일을 하게 된다, 군대식 문화가 좀있음. 임원진이 너무 많음."
44,한터기술,7409,개발 및 양산하는 품목이 많은 반면 개발 엔지니어 수는 생각보다 많지 않다.
45,한터기술,7409,임원이 많음 즉 실제로 일하는 사람은 적어 사원대리급에 일이 많이 몰려있음. 연봉인상폭이 적고 진급이 매우 어려움. 연차 갯수도 가르쳐주지 않고 특별한 사유를 말하지 않으면 연차 쓰기 어려움.
46,한터기술,7409,실무 하는사람이 한정적이다. 작은회사 조직안에서 임원부터 팀장까지 심지어 팀내에서도 실무는 안하고 말전달하는 관리만 하려고 한다.
47,한터기술,7409,실무자보다는 경영진의 말한마디에 기울어진다. 이 작은 회사에서도 라인이 필요한가?
48,한터기술,7409,나이많고 일않하는 임원이 많음 개발분야가 상닫히 많아 한가지업무에 많은 집중과 노력을 하기 힘듬
49,한터기술,7409,중소기업이라 시스템이 없음. 임원급이 일을하지 않기 때문에 업무가 비합리적임. 연봉이 적고 휴가 쓰기가 쉽지 않음. 개발 직이 잡다한 일을 많이 함.
50,한터기술,7409,"연봉이 낮음, 이사급의 역량 부족, 업무의 폭이 너무 넓음, 철도쪽에 계속있을 사람 아니면 비추"
51,한터기술,7409,"각 팀별 차이가 있으나, 업무량에 비해 인원이 적음. 전체 직원대비 부장, 이사급 인원이 많음. 잦은 인원변동으로 업무 이력 단절이 있음. 불필요한 회의와 PR로 인한 업무가 과중됨. 타팀과 업무 협업이 이루어지지 않음."
52,한터기술,7409,부서별로 케바케의 문화. 사람을 잘 만나야한다. 기업 특성상 업무 스케줄이 타이트하다. 연봉이 낮은편
53,한터기술,7409,자유로운 분위기여서 모두가 편하게 일할수 있으나 최소한의 일도하지않는 사람들 때문에 일하는 사람들만 일을 하는회사
54,한터기술,7409,인사평가제도가 딱히 없고 연봉도 오를 기회가 없음. 연차제도가 없다고 봐야함
55,한터기술,7409,서로 책임을 회피하려는 분위기. 너죽고 나살자?
56,한터기술,7409,제대로된 업무 관련 교육 없고 프로젝트 일정이 짧아 야근 많고 출장도 많음
57,한터기술,7409,매출의 큰부분이 하나의 대기업에 편중되어 있음. 회사가 크게 성장하지 않고 있음.
58,한터기술,7409,"업무가 계속 중첩됨. 철도 차량의 특성상 개발 일정이 짧고, 프로젝트가 완료되기전 다른 프로젝트 시작하는경우가 대부분임."
