,company_name,company_id,review_text
0,해금광고,10650,서면보고를 하는 구식 업무 방식 체납 독촉 전화 공장지대 위치로 기관지에 안 좋음
1,해금광고,10650,"회사 재정상황이 어려워 급여 체납이 많고 거래처 대금 지급도 늦음 돈이 들어와도 티가 안남 주 5일이라고 하지만 매월 첫주 출근에 토요일,공휴일 당직으로 주 5일이 아님"
2,해금광고,10650,"- 잦은 급여 지연 지급 - 처우 개선 및 약속의 불이행(수습 기간 이후 임금 인상, 면접시 제시한 근로 조건과 실제의 차이) - 노령화 (회사 규모에 비해 지나치게 많은 60대 이상의 이사급 이상의 임원수) - 잦은 이직률(잦은 채용과 잦은 퇴사, 장기 근속자 적음, 신입 비중이 높음) - 공휴일 근무"
3,해금광고,10650,회사가 오래된만큼 보수적인성향이 강하고 직원분들 연령대가 전체적으로 높아서인지 디자인작업 외적으로 엑셀작업을 하는 경우가 더 많을때가 있음.다른분들이야기를 들어보면 거의 대부분이 초반에 약속했던 급여조건에 이유를 들어 급여를 낮출뿐만아니라 연차 및 월차개념이 조금은 달라서 면접시 말해준 조건과 많이 다름.또한 월급밀리는걸 당연시 생각하는 회사.
4,해금광고,10650,디자이너로 들어왔지만 전산 등 다른 일도 도맡아하며 영업팀의 보조역할을 합니다. 제일 큰 단점은 수습3개월이 지나도 급여가 오르지 않으며 월급날에 급여가 제 때 들어오지않고 한달 반 이상은 급여가 밀립니다. 면접때 협의했던 사항과 많이 달라 입사 후 많은 부당한 대우를 받게되는 경우도 많습니다.
5,해금광고,10650,"수습기간등 여러가지 이유로 입사시 얘기했던 급여보다 작게주고 수습기간이 끝나도 올려주지 않으며, 상대적으로 나이가많은 다른부서에서 자기일을 떠맡기려는경향이 있으며, 다른것보다 일단 월급이 제 날짜에 지급되지 않고 많게는 3개월 이상도 밀리는 것을 보았으며 그것이 회사 내에서 당연시 되고 있었다."
