,company_name,company_id,review_text
0,휴먼수피아,3605,룰이 없다. 버텨보다가 급하면 돈으로 떼운다. (고용노동부 민원 들어오면 바로 입금) 대표가 일을 하지 않는다. 대표의 뒷주머니는 두둑해진다. 일하지도 않은 친인척의 명의로 급여가 지급이 되었다. 대표가 출퇴근 하기 편한곳으로 회사가 이사를 했다.
1,휴먼수피아,3605,"경력직을 뽑는데 경력이 애매하다고해서 연봉이 깎임 경력같은 신입을 원하는 회사 기본적인 복지가 너무 없고, 지원해달라고하면 이게 왜 필요하냐고 반문함"
2,휴먼수피아,3605,직원을 그냥 일하는 부품처럼 여기거 대우 안좋음 노동법 위반 사항도 많음
3,휴먼수피아,3605,"프로젝트마다 다르겠지만 살인적인 야근, 연봉도 낮고 바라는건 많다 여느 Si업체와 같이 철저히 직원을 을로 대한다"
4,휴먼수피아,3605,가이드라인이 없어 이것저것 잡무를 해야 한다. 청소부터 비품관리도하고 큐에이도 한다.
5,휴먼수피아,3605,사무실도 넘 춥구..ㅜㅜ술마시면 감정격해지시는분도있구..일없으니 제안서쓰라하고..꼰대아닌 꼰대문화도있고..워크샵 스키장간다고ㅋ그렇게 소리치시더니ㅋㅋ스키장은 구경도못했어요..ㅎㅎ연봉도 그닥 그리고 돈 1000원에 예민한회사?ㅎ
6,휴먼수피아,3605,복지는 없는것과 다름없음 제대로된 교육이 없어 신입은 첫단추 잘못 끼울 가능성 높음 과장급은 각자만의 주장이 강해 어느 장단에 맞춰야하는지 혼란스러움 소프트웨어에 관련된 지식이 있는 관리자가 없어보임 생산직 인력파견회사에 애드온 달고 운영하는 느낌 회식도 옛날 회사처럼 건배사 하고 오글거리는 딸랑이짓 해야함
7,휴먼수피아,3605,파견이니 본사에 있는 관리자가 신경을 엄청 안쓴다. 하다못해 야근을 하면 챙겨주는 것도 없고... 힘들게 알아서 자기 밥그릇을 챙겨야됨
8,휴먼수피아,3605,비합리적인 인사평가제도 가성비를 중시하여 연봉이 매우 낮음 근로기준법에 어긋나는 취업규칙이 많음 거짓말을 일삼는 경영진 사람 면전에다 대놓고 반말하면서 윽박지르는 경영진
9,휴먼수피아,3605,사무실이 독산역 근처라 교통이 불편하다 식대가 연봉에 포함된다. 10만원... 책상 의자 컴퓨터가 모두 낡고 오래된 제품들이다 연봉협상은 기대하지 말자. 말그대로 통보. 파견나갔는데 자꾸 본사 업무 시켜서 고객사 몰래 업무해야 한다
10,휴먼수피아,3605,아웃소싱 회사로 고객사의 요청을 모두 수용하여 근로자가 힘듦
11,휴먼수피아,3605,"하청업체의 하청을 받는듯한 이미지.  회사가 돈이 없어보입니다.  경영진의 마인드가 구식이어서 직원들에게 윽박지르는 모습이 포착됩니다.  직원들 지각하는건 엄청 까탈스럽게 관리하면서 일부 경영진은 한두시간씩 늦게출근하고 일찍퇴근합니다.  사무실 출근하자마자 인력관리소라고 느낄정도의 장비들이 있습니다.  한 사무실에 두개의 회사가 있습니다. (사무실 공유하는듯?)  모든 사무용 프로그램은 불법소프트웨어를 사용합니다.  높으신 분들이 일어나지 않으면 점심시간이 되어도 밥을 먹으러 가잔 소리를 하지 않고, 퇴근도 안합니다;; 이건 진짜 너무한듯.  어떤 요청을 하면 답변이 돌아오는데 두달 넘게 걸리기도 합니다.  공단에서 시행하는 건강검진이 마치 회사의 복지인것처럼 홍보합니다. 나라에서 시행하는 콘도지원사업도 마찬가지 입니다.  워크샵 예산으로 300만원을 지원해준다고 말한지 1년정도 지났습니다. 지금까지 워크샵은 얘기도 안나옵니다.  직원들 퇴사할때 잡플래닛 리뷰 잘 써달라고 굽신거립니다. 꽤나 신경쓰는 모양인데 본인들이 무엇을 잘못하고있는지 모릅니다."
12,휴먼수피아,3605,"높으신 분들이 지각을 밥먹듯한다 > 사원이 지각하면 징계먹이고 감봉 시킴. 셀프 스터디를 할 시간이 많다 > 프로젝트 수주 능력이 부족하다. 교육이랍시고 URL만 던져준 뒤 알아서 구글링해보라고 한다. 지급해주는 장비도 너무 사양이 부족하고, 의자나 책상 등 90년대 회사를 방불케한다. 철저하게 가성비만을 따지는 윗분들 때문에 연봉협상은 기대하지 않는것이 좋다. 사무실에 냄새난다고 탕비실에 서서 밥먹게 하거나, 한여름에 야외테라스에서 취식하라고 한다.(이건 부당행위 아닌가?) 회사가 돈이 없는지 아나바다 운동을 하던 시절에나 쓰던 모니터들이 있다."
13,휴먼수피아,3605,법적으로 주어진 개인의 연차휴가를 마음대로 쓸 수 없음 반드시 수직구조의 승인을 거쳐야만 함 청년추가고용 장려금을 받고 있어 해고와 권고사직을 할 수 없으니 힘과 권력으로 찍어눌러 자진퇴사하도록 유도함 퇴사를 하지 않으면 사소한 일에도 경위서 및 사유서 작성을 요구하여 이를 모아 사원의 책임으로 해고하려는 회사 운영비를 사용해도 된다하여 사내 직원과 식사하는곳에 썻음에도 경위서 작성을 요구하는 회사 지원을 받지않는다 했더니 찔리는게 있는거같다고 의심하는 회사 인사를 하지 않는다고 불러내는 회사
14,휴먼수피아,3605,법적으로 주어진 개인의 연차휴가를 마음대로 쓸 수 없음 반드시 수직구조의 승인을 받아야만 하며 수직구조의 체계를 군대식에 비교하며 강요하는 회사 직원을 힘과 권력으로 찍어누르며 부려먹는 회사 청년추가고용장려금을 받아 해고와 권고사직을 할 수 없으니 직원을 힘과 권력으로 찍어누르며 자진퇴사하도록 유도하는 회사 무능력한 상사을 세워 모든것을 회피하고 팀원 잘못으로 책임전가하는 상사가 있는 회사
15,휴먼수피아,3605,인사관리 체계가 다소 미흡한 회사. 그러나 전문 노무법인 컨설팅으로 개선되고 있음
16,휴먼수피아,3605,"그러나 체계적 교육 프로세스 부족, 프로젝트 인원 충원을 카드 돌려막기 하듯 기존에 맡은 프로젝트에서 철수시키고 바로 인원 충원요청한 프로젝트에 투입시킨다. 제대로 완성된 실무경험은 쌓을 수 없다. 연봉 5~10% 삭감 등의 어느 기준인지 모를 인사고과 제도가 있으며 고객사에게 을의 태도를 과하게 강요한다."
17,휴먼수피아,3605,"당사자와 아무런 협의 없이 직군을 변경하게하고, 일을 잘 하지 못한다는 이유로 윽박지르며 자진 퇴사를 강요하게 하는 파렴치한 회사  연차를 쓰기 위해서는 써도 되는 사유인지 허락을 받은 다음 승인 절차를 거쳐야 한다. 사유가 없으면 사용하지 못하는 경우도 있다.  존재하지 않는 영남본부, 영남본부 인원이 있다며 다른 업체에 총 직원수를 속이는 회사. (실제로는 20여명이지만, 다른 업체에 소개할때는 200여명이라고 거짓말을 한다.)  청년내일체움공제가 좋은 제도이며, 적극적으로 지원해주겠다는 거짓말을 한다. 청내공에 가입되면 태도가 돌변하여 불합리한 인사고과와 부당노동행위를 통해 근로자를 퇴사시키지 못하게 묶어두려 한다.  제대로 갖춰지지 않은 정책과 프로세스가 많으며, 주먹구구식으로 일을 처리하는 회사  현재 회사에서 사용중인 거의 모든 소프트웨어는 어둠의 경로로 다운받았으며, 키젠과 크랙을 사용하게 가이드 하는 회사.  부서장에게 어떠한 의견도 제시할 수 없는 군대같은 문화  프로젝트가 없어서 본사에 있을때에는 아무 일도 시키지 않고 방치시키거나 직무와 전혀 관련이 없는 청소, 쓰레기분리수거, 전화응대 등을 시킨다.  두 개 이상의 프로젝트를 동시에 진행하게 하여 매출을 뻥튀기하는 회사. 한 명이 같은 기간 내에 두개의 프로젝트를 진행해야 한다. 야근이 필수로동반되거나, 너무 쉽고 간단한 일을 하게된다.  인사평가 잘 받으려면 본인에게 잘보여야 한다는 말을 회식자리에서 공개적으로 한다.  프로젝트 철수나 프로젝트 이동(근무지가 변경된다.)을 하루전에 알려주는 매너없는 회사.  인사고과 평가자가 본인의 지인들에게 근로자의 개인사생활과 회사에서의 처우를 비난하고 험담을 일삼는다. 근로자의 명예를 더럽히기위해 소문을 퍼트리는 임원이 있다.  식대지원을 해준다 하여 별도의 금액을 청구할 수 있는 시스템인줄 알았으나 나중에 알고보니 '연봉에 포함'되었다. 틀린말은 아니지만 식대 별도 지급이라고 명확하게 설명해주야 할것 같다."
18,휴먼수피아,3605,"내부 상하관계가 군대식인데, 고객사쪽에 굽신거려서 실무자 쉴드는 못해 줌"
19,휴먼수피아,3605,"직원을 위하는 마인드가 전혀 없는 이기적인 회사 QA 아웃소싱 경험이 부족한 회사 다른 업체에 프로젝트 수행이력을 부풀려서 배포하는 회사 진행한 적이 없는 프로젝트를 진행한것 처럼 꾸며서 거짓 이력을 만들어내는 회사 고객사의 대외비 사항을 본사 홈페이지 포트폴리오에 게시하는 회사 소프트웨어 QA업무를 위해 30만원대 인터넷 서핑용 노트북을 지급하는 회사 거짓된 채용공고를 게시하여 활동성이 높아보이도록 꾸며내는 회사 주말근무를 할 경우 수당으로 3만원을 지급해주는 회사 고객사에 파견나간 직원에게 '일부러 야근을 해서 사람이 더 필요한 것처럼 보여줘라'고 지시하는 회사 복지를 위해 돈을 안쓰는 회사 직원들의 요구사항에 대해 해줄것처럼 둘러대기만 하는 회사 개인의 역량은 완전히 무시하고, 학력과 경험만을 가지고 연봉을 측정하는 회사 경력을 위조하여 고객사에게 유포하는 회사 복지에 돈을 아끼는 회사 조직장에게 어떠한 의견도 제시할 수 없게 만드는 회사 보고 배울만한 사수가 없음 일처리가 매우 느려서 무언갈 요청하면 다음달에 답변받음 교육에 대한 커리큘럼이 없어서 주먹구구식으로 교육하는 회사 프로젝트 없으면 본사에서 인사업무 또는 마케팅 업무 시키는 회사"
20,휴먼수피아,3605,철저히 아웃소싱으로 소기업 이다 보니 사원이 부당한 일을 당해도 입다물라고 하는 회사. 24시간 밤샘에도 야근수당 및 아무 복지 따위 없는 회사. 연차를 쓸수있지만 프로젝트 기간에 연차를 쓸수 없는 회사. 저녁값 9천원 한번 먹었다고 7천원 이상으로는 절대 지원 해줄수 없다는 회사.
21,휴먼수피아,3605,야근안하는 회사라고 강요하지만 법적공휴일까지도 근무 하는 회사. 파견나간 직원이 부당한 대우를 받아도 참고 넘어가라고 하는 회사. 복지따윈 아무것도 없는 회사. 인사평가 어떻게 받을지 궁금하지 않냐고 협박하는 회사. 갑이 아닌 을인 회사
