company_id,company_name,news_title,news_text,news_url,posted_at
1341,(사)한국통신사업자연합회,"국내 5G 속도, 해외보다 4배이상 빨라…통신사업자연합회조사","해당 품질 테스트는(사)한국통신사업자연합회(KTOA)에서 한 것이나, 정부와 학계도 5G 속도에서 만큼은 우리나라가 다른 나라보다 빠르다고 인정하고 있어 앞으로 5G에선 속도(품질)보다는 다양하고 저렴한 요금제 이슈가 부각될 전망이다. KTOA는 해외 주요 7개국(8개 도시)을 대상으로 5G와 WiFi...",http://www.edaily.co.kr/news/newspath.asp?newsid=03388246635741432,
1341,(사)한국통신사업자연합회,지난해통신4사 취약계층통신요금 1.26조 지원,한국통신사업자연합회(KTOA)는 12일 지난해 776만명을 대상으로 1조2604억원의통신요금을 감면했다고 밝혔습니다. 이는 2017년도 4630억원에 비해 약 2.7배 이상 증가한 수치입니다. 2017~2023년 취약계층통신요금 감면액. (자료=KTOA) 2000년부터통신사업자취약계층과 국가유공자의통신요금을 35~50%까지...,http://www.newstomato.com/ReadNews.aspx?no=1222909&inflow=N,
1341,(사)한국통신사업자연합회,"제각각통신요금, 이곳에선 한 번에 비교 가능","(ⓒ뉴스1, 무단 전재-재배포 금지) 스마트초이스는 이용자들의통신서비스와 요금제 선택권 보장을 위해 (주)케이티, SK텔레콤(주), LG유플러스 (주), SK브로드밴드(주)와(사)한국통신사업자연합회가 공동으로 서비스를 제공하고 있다. 이는 급변하는 정보통신환경과 정보의 홍수로 정확한통신서비스와 요금제...",https://www.korea.kr/news/policyNewsView.do?newsId=148928325&call_from=naver_news,
1341,(사)한국통신사업자연합회,"한국통신사업자연합회, 1사1촌 자매결연",<아이뉴스24>한국통신사업자연합회(KTOA)는 지난 15일 강원도 홍천군 서석면에 있는 검산1리와 자매결연식을 가졌다고 17일 발표했다. 검산1리 마을회관 앞에서 가진 이날 자매결연식에는 설정선 상근부회장을 비롯한한국통신사업자연합회임직원 50명과 검산1리 마을이장 이준희 마을주민 200여명이 참석했다....,http://www.inews24.com/php/news_view.php?g_serial=522100&g_menu=020300,
1341,(사)한국통신사업자연합회,"부산국토청-통신(전력)사, 이중굴착 방지 협력체계 구축","다양한 분야에 대해 여러 기관 등과 서로 상생·협업해 윈-윈(Win-Win)하는 방안을 적극 발굴하겠다""고 말했다. *통신(전력)사공동협의체 :한국통신사업자 연합회(SK텔레콤(주), ㈜KT, 등 10개통신업체),한국케이블TV 방송협회((주)씨제이 헬로비젼 등 92개 케이블 방송업체),한국전력공사 부산경남본부.",http://www.gukjenews.com/news/articleView.html?idxno=922361,
1341,(사)한국통신사업자연합회,공정위통신사지원금 제재 하반기 결론 전망…'격론' 예고,"이에 대해통신사들은 번호이동 현황은한국통신사업자연합회(KTOA) 전산망을 통해 확인 가능한 공개 데이터로, 경쟁을 위해 참고했을 뿐 담합과는 무관하다는 입장이다. 공개된 데이터로 가입자가 빠져나가는 것을 확인했을 때 지원금을 확대해 가입자를 추가 유치하려한 과정은 '경쟁'에 해당하지 담합과는...",https://www.etnews.com/20240423000314,
1341,(사)한국통신사업자연합회,통신3사가 키우는 벤처기업 한 곳에,"한국통신사업자연합회(KTOA)는 17일 개막하는 ‘월드IT쇼 2024’에 KTOA 벤처리움에서 육성해온 정보통신기술(ICT) 분야 기업들과 함께 참가한다. 벤처리움은 2018년부터 KTOA가 운영한 ICT 벤처창업 육성지원 사업이다. SK텔레콤, KT, LG유플러스가 출자한 코리아IT펀드(KIF) 투자수익의 일부를 활용한다. 이...",https://www.hankyung.com/article/2024041638741,
1341,(사)한국통신사업자연합회,"“설 선물배송, 세뱃돈 송금을 사칭한 스미싱 주의보”","(사)한국통신사업자연합회는 SK텔레콤, KT, LG유플러스 등 3개 이동통신사업자가 설 명절 전후 스미싱 등 민생사기 범죄 예방을 위해 전 고객을 대상으로 문자 메시지를 발송한다고 5일 밝혔다. 공공기관 및 금융기관 인증마크 문자 메시지 설 명절 전후에는 선물 택배 안내를 가장한 휴대 전화 문자사기(스미싱)...",http://www.edaily.co.kr/news/newspath.asp?newsid=03824486638787568,
1341,(사)한국통신사업자연합회,"안동시, 과기부 공중케이블 정비사업 선정",과학기술정보통신부와(사)한국통신사업자연합회(KTOA) 주관인 공중케이블 정비사업은 인구 30만 이상 지자체를 대상으로 5년 단위의 종합계획을 수립해 추진하는 사업과 긴급 정비수요나 계획된 정비지역 이외 지역에서 정비 요청 시 추진하는 사업이다. 안동시는 대상 인구 조건에는 미치지 못하나...,http://www.hidomin.com/news/articleView.html?idxno=527653,
1341,(사)한국통신사업자연합회,"안동시, 과기부 공중케이블 정비사업 선정",과학기술정보통신부와(사)한국통신사업자연합회(KTOA) 주관인 공중케이블 정비사업은 인구 30만 이상 지자체를 대상으로 5년 단위의 종합계획을 수립하여 추진하는 사업과 긴급 정비수요나 계획된 정비지역 이외 지역에서 정비 요청 시 추진하는 사업이다. 안동시는 대상 인구 조건에는 미치지 못하나...,http://www.bzeronews.com/news/articleView.html?idxno=627529,
