company_id,company_name,news_title,news_text,news_url,posted_at
1020,(주)씨에스원파트너,"부산 중구-씨에스원파트너, 중구 청년 우선 채용 MOU 체결","부산 중구는 지난 22일, 구청장실에서 LG U+ 자회사인 ㈜씨에스원파트너와 '중구 청년 우선 채용 업무협약(MOU)'을 체결했다고 밝혔다. 중구 청년 우선 채용 협약식 체결 모습/제공=중구청 이번 협약은 관내 기업의 원활한 기업활동 지원과 지역 청년의 일자리 창출을 연계한 상생형 일자리 창출을 위한...",https://www.gukjenews.com/news/articleView.html?idxno=2928817,
1020,(주)씨에스원파트너,"부산 중구-(주)씨에스원파트너, ‘중구 청년 우선 채용 업무협약’ 체결",빈일자리 해소 및 지역 인재 유입을 위한 LG유플러스 기업설명회 개최 예정 부산 중구(구청장 최진봉)는 22일 구청장실에서 LG U+ 자회사인 ㈜씨에스원파트너와 ‘중구 청년 우선 채용 업무협약’을 체결했다. 이번 협약은 관내 기업의 원활한 기업 활동 지원과 지역 청년의 일자리 창출을 연계한 상생형...,https://www.dnews.co.kr/uhtml/view.jsp?idxno=202402222203234850824,
1020,(주)씨에스원파트너,"씨에스원파트너, 공식 CI 선봬",씨에스원파트너(대표 이석재)는 오는 9일 창립 100일을 앞두고 CI(기업이미지)를 확정했다고 7일 밝혔다.씨에스원파트너는 LG파워콤의 고객센터 업무를 전담하고 있는 자회사로 지난 9월 1일 설립됐다. 이번에 확정된씨에스원파트너의 CI는 고객만족 하나를 위해 존재한다는 기업 의지와 고객감동...,http://www.ddaily.co.kr/news/news_view.php?uid=44733,
1020,(주)씨에스원파트너,"씨에스원파트너, 직원들 위해 시각장애인 안마사 고용","[지디넷코리아]씨에스원파트너(대표 이석재)는 '헬스키퍼(Health Keeper)' 제도를 전주지역에서 최초로 도입, 시행한다고 25일 발표했다.씨에스원파트너는 지난 9월 LG파워콤이 100% 출자해 설립한 법인으로 LG파워콤의 고객상담 업무를 전담하고 있다.씨에스원파트너전주고객센터는 센터 내에 피로 회복실을...","http://www.zdnet.co.kr/news/spotnews/network/etc/0,39040078,39175638,00.htm",
1020,(주)씨에스원파트너,씨에스원파트너CI확정,LG파워콤의 고객센터 업무를 전담하는씨에스원파트너(대표 이석재)는 7일 CI를 확정했다고 밝혔다.씨에스원파트너는 CI에 고객만족 하나를 위해 존재한다는 기업 의지와 고객감동 일등기업이 되겠다는 경영이념을 담았다. 고객에 대한 신뢰감을 상징하는 회색을 주 색상으로 하고 고객만족을 뜻하는 CS중...,http://www.etnews.co.kr/news/detail.html?id=200812070029,
1020,(주)씨에스원파트너,"LG파워콤, 고객 업무 전담 자회사 ‘씨에스원파트너’ 설립","고객 정보 유용으로 영업정지에 들어간 LG파워콤이 고객센터 업무를 전담할 자회사 ‘씨에스원파트너’(영문명; CS ONE Partner)를 설립했다고 2일 밝혔다. 이번에 신설된 ‘씨에스원파트너’는 LG파워콤이 100% 출자한 법인으로, LG파워콤의 고객상담 업무만 전담하게 된다. LG파워콤은 이석재 강남지사장을...",http://www.heraldbiz.com/SITE/data/html_dir/2008/09/02/200809020116.asp,
1020,(주)씨에스원파트너,"정심여자정보산업학교-씨에스원파트너, 업무협약 체결","(사진제공=법무부) (안양=국제뉴스) 박생규 기자 = 정심여자정보산업학교(법무부 안양소년원, 교장 황계연)와 (주)씨에스원파트너(대표이사 김상도)는 최근 소년원 학생 교육활동의 효과적 지원과 취업 연계 등 유기적 협력을 통한 상호발전을 도모하기 위해 업무협약을 체결했다고 20일 밝혔다. 이번 업무협약은...",http://www.gukjenews.com/news/articleView.html?idxno=412037,
1020,(주)씨에스원파트너,"LG파워콤,씨에스원파트너설립 기념 이벤트",[ LG파워콤(대표 이정식)은 27일 고객센터 업무를 전담하는 자회사 ‘씨에스원파트너(CS ONE Partner)’ 설립을 기념해 이벤트를 실시한다고 밝혔다. 이번 이벤트는 다음달 10일까지 진행되며 LG파워콤의 엑스피드 홈페이지(www.xpeed.com)를 통해 고객센터 자회사의 이름 '○○○○파트너'를 채우면 추첨을...,http://www.newspim.com/sub_view.php?cate1=6&cate2=2&news_id=185398,
1020,(주)씨에스원파트너,"LG데이콤, 100% 출자씨에스원파트너신규 설립",LG는 1일 계열사 LG데이콤의 자회사인 LG파워콤이 100% 출자한씨에스원파트너를 설립하고 계열사에 추가한다고 공시했다. 신규 설립된씨에스원파트너는 텔레마케팅서비스를 주요 사업으로 하며 자본금은 2억원 규모이다. [디지털뉴스부] [ ],http://news.mk.co.kr/news_forward.php?no=600161&year=2008,
1020,(주)씨에스원파트너,㈜씨에스원파트너장애인 맞춤훈련생 모집,"한국장애인고용공단 부산직업능력개발원은 오는 5월5일까지 LG U+ 자회사인 ㈜씨에스원파트너와 연계해 근무할 장애인 훈련생을 모집한다. 모집대상은 근무지까지의 출퇴근이 가능하고, 의사소통 및 PC 사용이 가능한 사람이다. 고객상담직 경험자 및 장기근속 가능자는 우대한다. 훈련생으로...",http://www.ablenews.co.kr/News/NewsContent.aspx?CategoryCode=0038&NewsCode=003820150424111307556901,
