company_id,company_name,news_title,news_text,news_url,posted_at
7919,(주)청호컴넷,카카오 SM 시세 조종 사건 변수로 떠오른 ‘이준호의 입’,이 부문장이 과거 몸담았던 드라마 제작사를 예당엔터테인먼트가 2008년 인수했고 이후 이 회사를 인수한 웰메이드예당(현 이매진아시아)은 2016년 지창배 원아시아 대표가 대표로 있던 현금자동인출기(ATM) 제조업체청호컴넷을 최대 주주로 맞았다. 지 대표는청호컴넷창업자의 아들이다. 지 대표는 운영하는...,https://biz.chosun.com/topics/law_firm/2024/04/15/LDSBSU6OPRBIJLMF3WRNE23KVA/?utm_source=naver&utm_medium=original&utm_campaign=biz,
7919,(주)청호컴넷,"군위청호컴넷, 지역 인재양성 교육발전기금 200만 원 기탁","군위군 소재의청호컴넷(대표 최수용, 오른쪽)은 28일 군위군청을 방문, 지역의 교육 발전과 인재양성을 위해 써달라며 교육발전기금 200만원을 기탁했다. 군위군 소재의청호컴넷(대표 최수용)은 28일 군위군청을 방문, 지역의 교육 발전과 인재양성을 위해 써달라며 교육발전기금 200만 원을 기탁했다. 최수용...",http://www.kyongbuk.co.kr/news/articleView.html?idxno=2127652,
7919,(주)청호컴넷,"청호컴넷, 군위군에 교육발전기금 200만원 기탁","청호컴넷(대표 최수용)은 지난 27일 군위군청을 방문해 지역의 교육 발전과 인재양성을 위해 써달라며 교육발전기금 200만원을 기탁했다. 최수용 대표는 “오늘 기탁을 통해 우리 아이들이 행복해질 수 있는 기반이 됐으면 한다”며, “군위의 밝은 미래를 위해, 학생들의 밝은 미래를 위해 최선을 다해달라”고...",http://www.ksmnews.co.kr/default/index_view_page.php?idx=419585&part_idx=286,
7919,(주)청호컴넷,"[더벨]'센트럴인사이트' 새 옷청호컴넷, 지배구조 변화 눈길",'현금지급기(CD)·현금자동입출금기(ATM)' 전문기업청호컴넷이 센트럴인사이트로 새 출발한다. 경영권 변경과 맞물려 사명을 비롯해 이사회 구성원도 전면 재편했다. 재무적 투자자(FI)의 힘을 빌려 경영권을 포함한 최대주주 지분을 사들인 가운데 유상증자와 전환사채(CB) 발행 등이 뒤따를 예정이다....,http://www.thebell.co.kr/front/free/contents/news/article_view.asp?key=202008311337141200108459,
7919,(주)청호컴넷,"[더벨]청호컴넷M&A, 원매자 FI 확보 여부에 '이목 집중'",청호컴넷의 오너일가가 지분과 경영권 매각에 나서면서 새 주인의 인수자금 마련 능력이 최대 관심사로 떠올랐다. 앞서 원매자가 해지됐던 인수합병(M&A) 계약의 연장선에 있는 상황에서 이번에 인수자금을 지원할 재무적투자자(FI)를 확보했는지가 관건이다. 13일 업계에 따르면 유가증권 상장사청호컴넷은...,http://www.thebell.co.kr/front/free/contents/news/article_view.asp?key=202008131428426560105042,
7919,(주)청호컴넷,[더벨]청호컴넷매각 재시동…첫 실패 딛고 완주할까,'현금지급기(CD)·현금자동입출금기(ATM)' 전문기업청호컴넷이 한차례 무산됐던 경영권 매각을 재추진한다. 원매자는 기존청호컴넷의 재무구조 개선과 변경 예정인 사명 '센트럴인사이트' 등의 조건을 이어받으며 인수합병(M&A) 의지를 불태우고 있다. 다만 앞서 실패했던 M&A와 인수 주체만 바뀐 채 연장선에...,http://www.thebell.co.kr/front/free/contents/news/article_view.asp?key=202008121450222960105090,
7919,(주)청호컴넷,"[마켓인사이트]경영권 매각 앞둔 ATM 전문 업체청호컴넷, 유상증자·전환사채...",≪이 기사는 08월12일(10:11) 자본시장의 혜안 ‘마켓인사이트’에 게재된 기사입니다≫ 현금자동입출금기(ATM) 전문 업체청호컴넷이 경영권 매각을 앞두고 전방위 자금조달을 추진한다. 유상증자와 전환사채 발행을 동시에 결정하면서 신규 사업 확대를 준비하는 모습이다. 12일 증권업계에 따르면 사무용...,https://www.hankyung.com/finance/article/202008133888u,
7919,(주)청호컴넷,"[iTN]청호컴넷, 새주인 맞아 한계기업 탈피할까…요동치는 주가",인더뉴스 김현우 기자ㅣ 10년 연속 적자를 기록하고 있는 현금자동인출기(ATM) 제조·판매업체청호컴넷의 주가가 요동치고 있다. 대주주 변경을 앞두고 있어 향후 회사가 어떠한 모습으로 변모할지 안갯속인 만큼 주가도 변동성을 키우는 모습이다. ◆ 불황에 10년 연속 적자기업..대주주 변경 이슈에 연일...,http://inthenews.co.kr/article-63573/,
7919,(주)청호컴넷,"청호컴넷, 유상증자와 전환사채로 400억 규모 자금조달 결정",청호컴넷이 유상증자와 전환사채 발행을 통해 모두 400억 원 규모의 자금을 조달한다.청호컴넷은 10일 이사회를 열고 제3자 배정 증자 방식으로 200억 원 규모의 유상증자를 실시하기로 결정했다고 11일 공시했다.청호컴넷로고. 이번 유상증자로 보통주 400만 주가 새로 발행된다. 신주의 예정...,http://www.businesspost.co.kr/BP?command=article_view&num=191282,
7919,(주)청호컴넷,"청호컴넷, 매각 동시에 관리종목 풀리나",경영권 구주 200억 매각…감자로 자본잠식 탈피 계획청호컴넷의 경영권이 매각된다. 이와 동시에청호컴넷은 재무 구조조정 절차를 밟는다. 경영권 이양이 마무리되면 자본잠식을 벗어나기 위한 절차가 즉시 시작될 전망이다. 모든 작업이 끝나면청호컴넷은 지난 3월 지정된 관리종목에서도 벗어날...,https://www.paxnetnews.com/articles/64055,
