company_id,company_name,news_title,news_text,news_url,posted_at
4694,(주)제이씨원,"제이씨원, 창립 20주년 기념 '이싸인온 20% 할인 이벤트' 진행",전자계약서비스 이싸인온의 개발사인제이씨원이 창립 20주년을 맞아 이싸인온 요금제 할인 이벤트를 진행한다고 9일 밝혔다. 이싸인온 요금제를...제이씨원에 따르면 현재 이싸인온은 50만 기업이 이용하고 있는 중이다. 또한 최근 고객들의 편의성 증대에 중점을 두고 기능 개선을 진행해 부서 기능도...,http://www.it-b.co.kr/news/articleView.html?idxno=74778,
4694,(주)제이씨원,[Who Is ?] 범진규 드림시큐리티 및 한국렌탈 대표이사,<드림시큐리티> △제이씨원과 SW 저작권 관련 소송해 패소 드림시큐리티가제이씨원상대의 저작권 침해 손해배상 소송에서 최종 패소했다. 대법원은 2019년 5월9일 드림시큐리티가 소프트웨어 제작 업체인제이씨원을 상대로 제기한 저작권 침해 손해배상 상고심에서 원고의 청구를 기각하고제이씨원의...,https://www.businesspost.co.kr/BP?command=article_view&num=349422,
4694,(주)제이씨원,"페이퍼리스 솔루션 기업제이씨원, 여가부 '가족친화기업' 인증 획득",제이씨원제공제이씨원은 여성가족부과 주관하는 '가족친화인증기업' 인증을 획득했다고 밝혔다.제이씨원은 전자계약 서비스 이싸인온(eSignon)을 제공하고 있다. 심사 후 3년간 우수 기간 자격을 유지할 수 있는 가족친화기업은 우수한 가족친화제도를 운영하며 근로자의 일·가정 균형을 지원하는 기업에...,http://www.kdpress.co.kr/news/articleView.html?idxno=125798,
4694,(주)제이씨원,"제이씨원'이싸인온', 승인 기능 업데이트","사진 =제이씨원제공 G밸리뉴스 윤선미 기자 = 솔루션 전문 기업제이씨원이 자사의 전자 계약 서비스 '이싸인온'의 '승인 기능' 업데이트를 진행한다고 30일 밝혔다. 이싸인온은제이씨원의 기업부설연구소에서 자체 개발한 전자계약서비스로 PC, 태블릿, 휴대폰 등 어느 기기에서나 쉽고 빠르게 계약을 시작할 수...",http://www.gvalley.co.kr/news/articleView.html?idxno=612623,
4694,(주)제이씨원,"제이씨원전자계약서비스 이싸인온, 동양저축은행에 공급 중",제이씨원(대표 신종호)는 자사의 전자계약 서비스 이싸인온을 동양저축은행에 공급해 적용 중이라고 26일 밝혔다.제이씨원에 따르면 최근 금융권에서 지속가능한 기업 경영을 달성하기 위해 필요한 3가지 핵심 요소인 ESG(환경·사회·지배구조)가 선택이 아닌 필수 요소가 되고 있고 저축은행에서도 전자계약...,https://www.dt.co.kr/contents.html?article_no=2023122602109923088002&ref=naver,
4694,(주)제이씨원,"제이씨원, 전자계약 '이싸인온' 할인 및 환승 프로모션 동시 실시","제이씨원(대표 신종호)는 자사의 전자계약서비스 이싸인온(eSignon)에 대해 12월 한 달간 연말 및 새해맞이 할인 및 환승 프로모션을 동시에 진행한다고 5일...제이씨원신종호 대표는 ""이싸인온을 이용해 주시는 고객님들께 감사한 마음을 전하고 2023 연말 선물을 드린다는 마음으로 풍성한 혜택으로 따뜻한...",http://www.it-b.co.kr/news/articleView.html?idxno=72312,
4694,(주)제이씨원,"제이씨원, '2022 대한민국소프트웨어 대전' 참가",전자계약솔루션 전문 기업제이씨원은 오는 12월 7일부터 9일까지 열리는 ‘2022 대한민국 소프트웨어 대전’에 참가한다고 6일 밝혔다. 2022 대한민국...제이씨원은 IT서비스/SI/클라우드 분야에서 클라우드 구독형 전자계약서비스 이싸인온과 SI 구축형인 스마트이폼을 선보인다. 전자계약은 기존 종이 계약에...,http://www.edaily.co.kr/news/newspath.asp?newsid=01922086632555896,
4694,(주)제이씨원,"제이씨원, 고진모터스와 구축형 전자계약 솔루션 '스마트이폼' 공급 계약 체결","제이씨원제공 전자계약 솔루션 기업 '제이씨원(대표 신종호)'은 아우디 공식딜러 '고진모터스'와 구축형 전자계약 솔루션 '스마트이폼' 공급 계약을 체결했다고 17일 밝혔다. 업체에 따르면, 전자문서를 활용하여 전자서식을 작성, 배포, 저장, 관리하는 이폼 기반 전자서식관리 솔루션인 스마트이폼은 구축형...",http://www.kdpress.co.kr/news/articleView.html?idxno=115691,
4694,(주)제이씨원,"제이씨원, 전자계약 서비스 '이싸인온' 5월 업데이트 실시",-계약서 작성 화면 UX/UI 개편 -API 기능 추가 및 리뉴얼 G.ECONOMY(지이코노미) 이장세 기자 | '제이씨원(대표 신종호)'은 자사의 전자계약 서비스 '이싸인온' 5월 업데이트를 단행한다고 밝혔다.제이씨원에 따르면 이싸인온은 페이퍼리스·디지털 업무환경에 활용되는 전자서명 솔루션이다. 특히 PC...,https://www.geconomy.co.kr/news/article.html?no=271402,
4694,(주)제이씨원,"제이씨원, 'ICT 기술사업화 페스티벌' 참가…페이퍼리스 솔루션 선보인다",현장에 마련된제이씨원부스에 관람객들이 솔루션을 확인하고 있다.제이씨원이 과학기술정보통신부가 주최하는 '2022 ICT 기술사업화 페스티벌'에서 페이퍼리스 솔루션을 선보인다. 이달 20일 서울 코엑스에서 열리는 '월드IT쇼(WIS) 2022'와 동시 개최하는 ICT 기술사업화 페스티벌은 ICT 연구개발(R&D)의...,https://www.itbiznews.com/news/articleView.html?idxno=69852,
