company_id,company_name,news_title,news_text,news_url,posted_at
4839,(주)투루텍,투루텍등 전남지역 SW 5개사 GS인증 획득,"전남정보문화산업진흥원(원장 오창렬)은 최근 ㈜투루텍·㈜엔와이인포텍·㈜한국공학기술연구원·㈜동천기공·㈜엘시스 등 5개 기업이 굿... 최귀상투루텍대표는 ""품질인증 획득을 원하는 SW중소기업이 많지만 사전 컨설팅과 심사비용의 부담이 큰 것이 걸림돌이 되고 있다""며 ""SW품질인증 지원사업을...",http://news1.kr/articles/?2022163,
4839,(주)투루텍,가람정보기술 등 지역 IT업계 “생존 위해 열공”,"가람정보기술, 남선산업, 가민정보시스템, 공간정보, 광영이엠씨, 쌍용소프트웨어, 아프로, 원시스템, 유풍정보기술, 지에프티,투루텍등 지역... 지에프티,투루텍등 지역 산·학·연·관과 함께 국가인적자원개발컨소시엄 구성을 대표로 들 수 있다. 협약 기업들은 지난 2월부터 신입 및 경력사원 채용...",http://www.etnews.com/20160509000225,
4839,(주)투루텍,각종 재난으로부터 '안전 전남' 만든다,"또 ㈜투루텍에서 기상강우 웹기반 정보시스템에 대한 교육을 실시해 참가자들의 이해도를 높일 계획이다. 전남도는 그동안 여름철 자연재난 대응을 위해 도와 유관기관 실무 간담회 개최, 자료 및 정보공유 등 상호 협력체계를 강화해 왔다. 특히 수방자재와 재해 구호물자 확보 등 지원체계를 구축하는 한편...",http://www.jndn.com/article.php?aid=1556098521279723003,
4839,(주)투루텍,광주지역 20여업체 SW전문인력 자체육성 나선다,"원시스템,유풍정보기술, 지에프티,투루텍등 지역IT기업 20여개사는 ICT분야 인재육성을 위해 노동부 국가인적자원개발컨소시엄에 참여하고 있다. 힘을 모으기로 한 기업은 원시스템, 가민정보시스템, 공간정보, 광영이엠씨, 쌍용소프트웨어, 아프로, 유풍정보기술, 지에프티,투루텍등이다. 대략 20여개...",http://www.etnews.com/20151231000226,
4839,(주)투루텍,"조선대 과학문화교육사업단, 24일 취업컨설팅 및 박람회","이와 함께 부스 6개가 설치돼 한국커리어개발원, 롯데정보통신, 골드투룹스, (주)투루텍, (주)티디엘, 국립광주과학관, 국제청소년교육재단 등 빅데이터와 과학문화 관련한 기업체 담당자가 기관 및 기업 소개, 모의면접과 입사서류 첨삭, 자소서 작성, 취업 컨설팅 등 학생들의 취업에 유익한 각종 정보를...",http://view.asiae.co.kr/news/view.htm?idxno=2015092316025433494,
4839,(주)투루텍,전남도 전자부품·해상기자재 8개 기업 유치,"㈜투루텍(대표 최귀상)은 광주전남공동혁신도시 산학연클러스터 1000㎡ 부지에 60억원을 투자하고 ㈜나인콤(대표 노정학)은 광주전남공동혁신도시 산학연클러스터 1650㎡ 부지에 38억원을 투입, 네트워크 보안장비 및 소프트웨어를 개발한다. ㈜대성에프앤비(대표 김경진)는 동함평산업단지 3300...",http://www.newsis.com/ar_detail/view.html?ar_id=NISX20140516_0012922206&cID=10809&pID=10800,
4839,(주)투루텍,클라우드의 열기를 전국으로 확대! ‘VMware 로드쇼 2013’ 개최,"특히 해당 지역의 주요 고객인 ETRI, 완도구청, 스타리온 등은 직접 VMware 솔루션의 성공적인 도입 사례를 발표할 예정이며, 청담정보기술(부산), 이엠맵(대구), 아이티앤씨(대전),투루텍(광주) 등 각 지역을 대표하는 파트너사들이 솔루션 상담 부스를 운영한다. 이 외에도 행사 중 VMware와의...",http://www.kbench.com/life/?no=120491&sc=1,
4839,(주)투루텍,"위노블, 매직소프트웨어 전국 지역별 협력사 체제 완비","이 협력계약에 참여한 회사는 △서울ㆍ경기지역 파트너인 코니언씨엔에스, 아이티파워, 스미포, 브론즈아이즈, 비에스티정보통신 △강원ㆍ호남ㆍ부산경남ㆍ제주지역 파트너인 강원시스템,투루텍, 신화정보통신, 커널인포텍 △지역별 교육제품 협력사인 인첼베이스, 대구한컴, 아이티스테이션...",https://n.news.naver.com/mnews/article/029/0000044627?sid=111,
4839,(주)투루텍,[시큐리티 라운지],"○…시큐브(www.secuve.com 대표 홍기융)는 14일 나음정보기술, 넥스맨시스템,투루텍, 웰컴정보시스템, 강원시스템, 월드소프트, 센타비전, 우노시큐리티, 대성정보기술 등과 사업 및 기술협력(CSTP : Certificate of SECUVE Technical Partner) 계약을 체결하고 채널영업을 본격화한다고 밝혔다. 시큐브의 사업 및...",https://n.news.naver.com/mnews/article/029/0000020916?sid=105,
4839,(주)투루텍,시큐브 2003년도 사업 및 기술 협력사 계약 체결,"시큐브(www.secuve.com 대표 홍기융)는 14일 나음정보기술, 넥스맨시스템,투루텍, 웰컴정보시스템, 강원시스템, 월드소프트, 센타비전, 우노시큐리티, 대성정보기술 등과 사업 및 기술협력(CSTP : Certificate of SECUVE Technical Partner) 계약을 체결하고 채널영업을 본격화한다고 밝혔다. 시큐브의 사업 및 기술...",https://n.news.naver.com/mnews/article/029/0000020904?sid=105,
