company_id,company_name,news_title,news_text,news_url,posted_at
7042,㈜모니터랩,"모니터랩, 튀르키예 현지기업과 파트너십 계약…중동 시장 거점 확보","모니터랩은 튀르키예 현지 기업 알리파이 컨설팅 그룹(이하 ALIFAI)와 파트너 계약을 체결했다고 8일 밝혔다. 이로써모니터랩은 일본, 동남아, 미국, 호주에 이어 본격적으로 중동 시장 진출에 필요한 거점을 확보했다. 튀르키예 이스탄불 소재의 ALIFAI는 컨설팅 회사로, 인공지능(AI)을 활용한 업무·데이터...",https://www.newsis.com/view/?id=NISX20240508_0002727291&cID=10406&pID=13100,
7042,㈜모니터랩,"[RSAC 2024] 아이온클라우드(모니터랩), SaaS 형태의 SSE 플랫폼으로 ‘주목’","아이온클라우드(모니터랩, 대표 이광후)는 SSE(Security Service Edge)를 기반으로 모든 네트워크 보안 스택을 고객에게 구독형으로 제공하는... 아이온클라우드(모니터랩) 이광후 대표는 “이번 행사에서 아이클라우드 서비스에 대한 미국 고객사들과의 높은 관심을 확인했다”며, “국내...",http://www.boannews.com/media/view.asp?idx=129676&kind=,
7042,㈜모니터랩,"모니터랩, 'RSA 콘퍼런스 2024'에서 SSE 플랫폼 기반의 제로 트러스트 보안 솔...","모니터랩(대표이사 이광후)이 지난 5월 6일(월)부터 9일(목)까지 미국 샌프란시스코에서 열린 'RSA 콘퍼런스 2024'에 참가해 제로 트러스트...모니터랩은 2017년부터 꾸준히 참가해 왔으며, 작년과 마찬가지로 올해도 독립부스를 운영하며 아이온클라우드를 선보였다....",https://www.dailysecu.com/news/articleView.html?idxno=155875,2024-05-10 18:47
7042,㈜모니터랩,"모니터랩, '재팬 IT 위크 스프링 2024'서 SSE 플랫폼 '아이온클라우드' 선봬","B2B 서비스형 보안(SECaaS) 전문 기업모니터랩(대표 이광후)은 4월 24~26일 3일간 일본 도쿄 빅 사이트(Tokyo Big Sight)에서 열린 일본 최대 IT...모니터랩은 2016년부터 꾸준히 해당 전시회에 참여해 왔으며, 2018년 이후로는 별도의 독립부스를 운영해 자사의 '아이온클라우드(AIONCLOUD)...",http://www.itdaily.kr/news/articleView.html?idxno=222734,
7042,㈜모니터랩,"모니터랩, 일본 최대 IT 전시회 ‘Japan IT Week Spring 2024’ 참가",전문기업모니터랩(대표이사 이광후)이 지난 24일에서 26일까지 3일간 일본 도쿄 빅사이트(Tokyo Big Sight)에서 열린 일본 대규모 IT 전시회 ‘재팬 IT 위크 스프링 2024(Japan IT Week Spring 2024)’에 참가해모니터랩의 SSE 플랫폼 ‘아이온클라우드(AIONCLOUD)’를 선보였다고 밝혔다....,http://www.boannews.com/media/view.asp?idx=129370&kind=,
7042,㈜모니터랩,"[탑픽전쟁] 이오테크닉스 vs모니터랩, 승리 전략은?","종목모니터랩- 보안 소프트웨어 전문 기업- 국내 웹 방화벽 시장에서 압도적 점유율 확보- 목표가 7,900원 / 손절가 6,000원생방송 '탑픽전쟁'은 월~목 6시에 방송됩니다.* 이 방송은 머니투데이방송 홈페이지(http://mtn.co.kr)와 케이블TV, 유튜브를 통해 실시간으로 시청하실 수 있습니다. 또한 방송...",https://news.mtn.co.kr/news-detail/2024041519541184243,
7042,㈜모니터랩,모니터랩주가 초강세... 외국인은 10거래일 대량매도,"모니터랩주가가 초강세를 보이고 있다. 12일 한국거래소에 따르면 이날 오전 7.11% 올라 7080원에 거래되고 있다. 주가는 급등이후 하락추세에서 벗어나려...모니터랩은 B2B SaaS(서비스로서의 소프트웨어) 전문기업으로 자리매김, 웹방화벽과 보안웹게이트웨이 서비스 분야에서 국내 시장을 리딩하고 있다....",https://www.pinpointnews.co.kr/news/articleView.html?idxno=258668,
7042,㈜모니터랩,"""BTS, 날 베낀 것"" 주장한 민희진...근거 마련용 여론모니터·인터뷰 정황 포...","하이브와 갈등 중인 민희진 어도어 대표 등 어도어 경영진 일부가 관찰 대상 그룹과 관련된 소속사 직원을 대상으로 인터뷰를 진행하고, 인터넷 여론을모니터링했다는 정황이 포착됐다. 24일 스포츠동아는 어도어 경영진 일부가 근거 마련용 여론모니터링을 했다는 의혹에 대해 하이브가 '내부감사'를 통해...",https://www.tvreport.co.kr/breaking/article/806459/,
7042,㈜모니터랩,"모니터랩, 주가 급락…거래소 ""투자 주의""",모니터랩주가가 시간외 매매에서 급락했다. 4일 한국거래소에 따르면 전일 시간외 매매에서모니터랩주가는 종가보다 4.55% 내린 7350원에 거래를 마쳤다.모니터랩의 시간외 거래량은 22만8247주이다. 이는모니터랩이 투자주의종목으로 지정됐기 때문으로 풀이된다. 전일 장 마감 후 거래소는...,http://www.thebigdata.co.kr/view.php?ud=20240404061007731cd1e7f0bdf_23,
7042,㈜모니터랩,"모니터랩, ‘AI 바우처 지원사업’ 공급기업 선정","전문기업모니터랩(대표이사 이광후)은 과학기술정보통신부와 정보통신산업진흥원(NIPA)이 주관하는 ‘2024 AI 바우처 지원사업’에...모니터랩은 올해 최초로 공급기업으로 선정됐으며, 수요기업에게 ‘MWP(Malicious Web-Attack Prediction)’와 ‘MAD-PDF (Malicious All-File Detection – PDF)’을 지원한다....",http://www.boannews.com/media/view.asp?idx=128522&kind=,
