company_id,company_name,news_title,news_text,news_url,posted_at
13760,㈜바이오솔루션,"라이프시맨틱스, '바이오코리아'서 의료 AI솔루션2종 소개",아주경제=권가림 기자 hidden@ajunews.com AI 기술 기반 디지털헬스 전문기업 라이프시맨틱스가 10일까지 서울 코엑스에서 열린 ‘바이오코리아 2024’에 참가해 의료AI솔루션을 선보였다고 밝혔다.바이오코리아 2024는 한국보건산업진흥원과 충청북도가 공동 주최한 국내 최대 규모의 보건산업박람회다....,https://www.ajunews.com/view/20240510081652726,2024-05-10 08:40
13760,㈜바이오솔루션,"HD현대마린솔루션, 코스피 상장 첫날 96%↑[핫스탁](종합)",코스피 시총 53위로 52위인 에코프로머티리얼즈(7조3607억원)과 54위인 SK바이오팜(7조90억원) 사이에 위치하게 됐다. 올해 상반기 기업공개(IPO) 최대어로 꼽혀온 HD현대마린솔루션은 이날 유가증권시장에 상장했다. 2016년 11월 설립된 HD현대마린솔루션은 선박부품·유류 판매 등 애프터마켓(AM)...,https://www.newsis.com/view/?id=NISX20240508_0002727598&cID=10403&pID=15000,
13760,㈜바이오솔루션,바이오코리아 개막…글로벌 제약바이오·투자사 한 자리에,"독일의 세포기반 연구, 치료제 개발 및바이오메디컬 연구솔루션기업인 밀테니바이오텍(Miltenyi Biotec)의 울푸 배트케(Ulf bethke) 박사는 '세포유전자 치료제 분야의 기술, 임상, 규제혁신'을 소개한다. 앱티스, 사이러스테라퓨틱스, 큐로셀 등 국내 다수의 기업에서 보유하고 있는 신규 모달리티...",https://www.news1.kr/articles/5408977,
13760,㈜바이오솔루션,"강스템바이오텍, 크로엔 지분매각 완료","강스템바이오텍 CFO는 ""크로엔과 HLB바이오스텝은 이번 협력을 통해 독성과 약효 평가의 통합솔루션이라는 메리트를 확보하게 되었다. 강스템바이오텍은 향후에도 크로엔 지분의 20% 이상을 보유하며 크로엔의 IPO 등 미래성과를 위한 협력을 HLB바이오스텝과 지속할 예정이다""고 말했다 이어 ""이번 딜을 통해...",https://www.newspim.com/news/view/20240510000331,2024-05-10 10:40
13760,㈜바이오솔루션,"엔젠바이오, ‘여섯발자국’과 펫 헬스케어 전략적 사업 제휴",이번 엔젠바이오와의 협약을 통해 ‘닥터뮨 마이크로바이옴 건강체크 KIT’ 서비스를 출시해 5개 카테고리 18항목 검사로 반려견의 장내 미생물 군집을 분석하고 건강상태를 진단한 후 맞춤솔루션을 제공할 예정이다. 윤태영 여섯발자국 대표는 “이번 협약을 통해 엔젠바이오의 마이크로바이옴 검사...,http://www.edaily.co.kr/news/newspath.asp?newsid=01964726638887608,2024-05-10 10:40
13760,㈜바이오솔루션,"[바이오게시판] 알테오젠, 신규 히알루로니다제 변이체 개발 착수 등",▲바이오플랫폼 기업 알테오젠은 주식회사 테라자인과 피하제형을 위한 신규 인간 히알루로니다제 변이체 개발에 착수했다고 9일 밝혔다.... 한독은 바로잰Fit을 출시하며 연속혈당측정기 시장까지 비즈니스를 확대해 혈당측정기 시장에서의 리더십을 확고히 하고 바로잰의 만성질환 토탈케어솔루션...,https://biz.chosun.com/science-chosun/bio/2024/05/09/OEOBYT4R3ZD55EC2BDXPQ4BK5M/?utm_source=naver&utm_medium=original&utm_campaign=biz,
13760,㈜바이오솔루션,"메디웨일, 세계 최대 안과학회서 심혈관위험평가 AI솔루션연구 발표",AI솔루션‘닥터눈(Reti-CVD)’을 활용한 연구 초록을 발표했다고 9일 밝혔다. 메디웨일은 이번 학회의 주요 연구로 망막 사진을 인공지능(AI)으로... 이번 ARVO에서는 영국바이오뱅크 데이터를 사용하여 이미 심혈관질환을 진단받은 고위험군 환자에서도 심혈관 관련 사망 위험에 있어 추가적인...,https://www.etoday.co.kr/news/view/2358177,
13760,㈜바이오솔루션,"[카드] 라이프시맨틱스,바이오코리아서 의료 AI솔루션선봬",인공지능(AI) 기술 기반 디지털헬스 전문기업 라이프시맨틱스(347700)는 지난 8일부터 10일까지 서울 코엑스에서 열린 '바이오코리아 2024(BIO KOREA 2024)에 참가해 의료 AI솔루션을 선보였다고 10일 밝혔다.바이오코리아 2024는 한국보건산업진흥원과 충청북도가 공동 주최한 국내 최대 규모...,http://www.newsprime.co.kr/news/article.html?no=639166,2024-05-10 12:40
13760,㈜바이오솔루션,바이오헬스 케어 기업과 의사를 연결하는 'Mint MD' 눈길,"Match는 기업이 의사를 영입하고자 할 때 이를 연결하는 인재 채용솔루션이다. 송 대표이사는 ""Dr. Match는바이오헬스케어 전문성 기반의 인재 검색 프로그램으로 대학병원 출신의 의사들이 직접 인재 탐색 및 전문적 인재 채용 컨설팅을 수행한다""며 ""기업의 인재상에 부합하는 검증된 이냊를 추천하는...",http://www.monews.co.kr/news/articleView.html?idxno=331856,2024-05-10 06:40
13760,㈜바이오솔루션,"[바이오소식]강스템바이오텍,자회사 크로엔 지분 매각 완료 外 엔젠바이오·디...","강스템바이오텍 CFO는 ""크로엔과 HLB바이오스텝은 이번 협력을 통해 독성과 약효 평가의 통합솔루션이라는 메리트를 확보하게 되었다. 강스템바이오텍은 향후에도 크로엔 지분의 20% 이상을 보유하며 크로엔의 IPO 등 미래성과를 위한 협력을 HLB바이오스텝과 지속할 예정이다""고 말했다 이어 ""금번 딜을...",https://www.getnews.co.kr/news/articleView.html?idxno=673608,2024-05-10 09:40
