company_id,company_name,news_title,news_text,news_url,posted_at
12530,㈜보리문화,제19회 군산꽁당보리축제,"이외에도 시민이 참여하는 꽁당보리노래자랑, 5월을 맞아 우리 아이들에게 농업문화를 알릴 수 있는 농촌체험 프로그램 등이 준비되고 있다. 개막식에 참석한 강임준 군산시장은 “꽁당보리축제는 가난하지만 소박하면서도 정겨웠던 옛날을 떠올리게 하는 추억의 장이었다. 그러나 이제는 젊은 세대가 좋아하는...",https://www.farmnmarket.com/news/article.html?no=21170,2024-05-10 09:00
12530,㈜보리문화,"목포시, 서산동보리마당 서산경로당 준공식 개최","현재까지 공공편익 시설인 금화경로당 조성, 주거환경 정비, 공영주차장,보리언덕 조성 등 6개 사업을 완료했으며, 청년문화예술 창작촌 조성, 보행도로(경관길) 등 마중물 사업을 추진 중에 있다. 특히, 서산경로당은 서산동 8-69번지 일원에 조성했으며 지난해 6월 실시설계를 완료하고 세부 행정절차 이행...",http://www.bzeronews.com/news/articleView.html?idxno=659237,
12530,㈜보리문화,"목포시, 서산동보리마당 서산경로당 준공식 개최","현재까지 공공편익 시설인 금화경로당 조성, 주거환경 정비, 공영주차장,보리언덕 조성 등 6개 사업을 완료했으며 청년문화예술 창작촌 조성, 보행도로(경관길) 등 마중물 사업을 추진하고 있다. 특히 서산경로당은 서산동 8-69번지 일원에 조성했으며 지난해 6월 실시설계를 완료하고 세부 행정절차 이행 후...",https://www.newscj.com/news/articleView.html?idxno=3137674,
12530,㈜보리문화,"[목포시 소식] 목포시, 제52회 어버이날 기념 행사...경로효친문화확산 外","현재까지 공공편익 시설인 금화경로당 조성, 주거환경 정비, 공영주차장,보리언덕 조성 등 6개 사업을 완료했으며, 청년문화예술 창작촌 조성, 보행도로(경관길) 등 마중물 사업을 추진 중에 있다. 특히, 서산경로당은 서산동 8-69번지 일원에 조성했으며 지난해 6월 실시설계를 완료하고 세부 행정절차 이행...",https://www.psnews.co.kr/news/articleView.html?idxno=2054484,
12530,㈜보리문화,'최수종의 여행사담' 도솔암-청보리밭 등 해남 여행,"3부작인 '최수종의 여행사담'은 최수종이 배우 겸 가수 정진운과 전남 장성, 해남, 진도를 여행하며 아름다운 풍경과 특색있는 지역의문화를 경험하고... 한반도의 끝이자 시작인 땅끝마을에서 여정을 시작한 두 사람은 놀라운 비경의 도솔암, 봄의 빛깔을 입은 청보리밭 등 해남의 아름다운 풍광을...",https://www.polinews.co.kr/news/articleView.html?idxno=646807,
12530,㈜보리문화,보리밭 사잇길로…군산 '꽁당보리축제' 5월 2일 개막,싱그러운보리밭을 걷고 농경문화를 즐기는 제19회 군산꽁당보리축제가 5월 2일부터 사흘간 전북 군산시 미성동보리밭에서 펼쳐진다. 한국전쟁 전후에 극심한 흉년으로 쌀이 수확되기 전보리만으로 밥을 지어 먹어야만 했던 '꽁보리밥'의 추억을 되새기며 봄날을 즐기는 경관 축제다. 여느 축제와 달리보리를...,https://www.yna.co.kr/view/AKR20240425050600055?input=1195m,
12530,㈜보리문화,"경북 안동, 차전장군노국공주축제서 다채로운 민속문화공연",안동시가 개최한 ‘2024 차전장군노국공주축제’에서 다양한 민속문화공연이 펼쳐지고 있다. 지난 3일에는 안동저전동농요보존회가 주관하는 경상북도... 이번 공연에서는 △물 푸는 소리 △집터다지는 소리 △모찌기소리 △모심기소리 △애벌논매기소리 △두벌논매기소리 △보리타작소리 △달게소리의...,https://www.hankyung.com/article/202405057245h,
12530,㈜보리문화,군산 대표 농업축제 '제19회 군산꽁당보리축제' 개막,"이외에도 시민이 참여하는 꽁당보리노래자랑, 5월을 맞아 우리 아이들에게 농업문화를 알릴 수 있는 농촌체험 프로그램 등이 준비되고 있다. 개막식에 참석한 강임준 군산시장은 ""꽁당보리축제는 가난하지만 소박하면서도 정겨웠던 옛날을 떠올리게 하는 추억의 장이었다. 그러나 이제는 젊은 세대가 좋아하는...",http://news.tf.co.kr/read/national/2095629.htm,
12530,㈜보리문화,"""쓰다듬어주면 세상 행복해요""…미소천사보리[가족의 발견(犬)]",최서윤 동물문화전문기자 = 대다수 보더콜리 종의 강아지들은 활발하다. 운동량도 많아서 바깥에서 뛰어 노는 것을 좋아한다. 그런데보리는 그동안 산책을 거의 하지 못했던 걸까. 몇 달 전 입양센터에서 처음 산책을 나갈 때 바깥세상을 두려워하는 모습을 보였다. 다행히 지금의보리는 활발함을 되찾고 새...,https://www.news1.kr/articles/5405856,
12530,㈜보리문화,[포토타임] 어린이 궁중문화축전...오늘은 취타대 체험해요~,"어린이 궁중문화축전은 1일부터 어린이날인 5일까지 경복궁과 창경궁 일대에서 열린다. 취타대 외에도 숙수, 의관, 화원, 역관 등 조선시대 궁궐 속 다양한 직업체험을 할 수 있다. 모든 프로그램 참가비는 무료이며 다섯 가지 조선시대 직업 체험 중 세 가지 이상을 완료한 어린이에게는 녹봉(쌀,보리등이...",https://www.joongang.co.kr/article/25246381,
