company_id,company_name,news_title,news_text,news_url,posted_at
14281,㈜보템,청도군 지방보조금 관리시스템(보템e)현장교육 실시,"청도군(군수 김하수)은 지난달 30일 평생학습행복관 다목적강의실에서 지방보조금 담당 공무원 및 민간보조사업자 60명을 대상으로 지방보조금관리시스템(보탬e)에 대한 현장교육을 진행했다. 지방보조금관리시스템(보탬e)은 2024년 1월부터 전국 지자체에 전면 개통됐으며, 그동안 수기로 관리하던 지방보조금...",http://www.hidomin.com/news/articleView.html?idxno=547168,
14281,㈜보템,"평창군, 청년 창업가 인큐베이팅 지원 추진","2024년도 청년 창업가 인큐베이팅 지원사업의 접수기간은 이달 17일까지이며,보템e 시스템(httpas://www.losims.go.kr)을 통해 접수를 받는다. 지원대상은 18세 이상 49세 이하 청년으로 창업 7년 이내 법인·개인사업자를 대상으로 하며, 지역 내 청년을 고용한 창업가는 평가 가점을 부여받는 등의 혜택이...",https://www.sportsseoul.com/news/read/1425928?ref=naver,
14281,㈜보템,"[MSI] 어렵게 승리 거둔 T1 오너, ""다시 G2 만나면 완승 가능하다""","신짜오와 리신으로 분전하며 팀이 많은 킬을 올리는데 큰보템이 됐고, 결국 승리를 가져왔다. 특히 5세트에서는 리신으로 위기의 순간에 적 챔피언들을 잘 끊으면서 역전의 발판을 마련했다. 다음은 T1 정글 오너 문현준과 진행된 질의 응답을 정리한 것이다. Q : 이제 BLG와의 대결을 앞두고 있는데 오너...",http://www.gamevu.co.kr/news/articleView.html?idxno=32822,
14281,㈜보템,"(U리그)'최진혁 결승골' 호남권 강자 광주대, 조선대 1-0로 꺾고 첫 승 올려!...","""일대일 경합에서 순간 순발력이나 수비 가담 폭이 넓은 활동량이 제가 갖진 장점이라 생각한다""며 ""앞으로도 더 다듬어 팀에 큰보템이 되는 선수로 성장해 하루빨리 K리그 무대에서 뛰고 싶다""고 다짐했다. 광주대 이승원 감독이 10일 장성 옐로우시티 보조구장에서 열린 '2024 대학축구 U리그1' 조선대와...",https://www.gukjenews.com/news/articleView.html?idxno=2991395,2024-05-10 22:51
14281,㈜보템,청소년희망나비학교 장학금 전달식 개최,"최지석 지청장은 인사말에서 ""학생들이 즐겁고 보람있는 시간을 많이 보내고, 사회에보템이 되며 개인의 행복을 추구하길 바란다""고 말했다. 전용감 협의회장은 ""민간봉사활동의 일환으로 모범적으로 운영되는 나비학교가 자랑스럽다""며 ""대안교육을 통해 미래에 희망을 갖고 학업중단위기를 극복하여...",https://www.dnews.co.kr/uhtml/view.jsp?idxno=202405081025028550499,
14281,㈜보템,"[포토뉴스] 원주시시설관리공단 누리보듬봉사단, 장애인의 날 행사장서 사회적...","봉사단은 장애인의 날 행사에 일손이 부족하다는 소식을 듣고 작은보템이 되고자 행사장을 찾아 의자 정돈과 도시락 배부를 도왔다. 공단 관계자는 “장애인의 날 행사에보템이 되는 봉사활동을 할 수 있어 매우 기쁘고 사회적 가치를 실현하는 공단이 되도록 최선을 다하겠다""고 했다. ess003@ekn.kr",https://www.ekn.kr/web/view.php?key=20240420020589990,
14281,㈜보템,"나주 영산동,‘사랑플러스 정성 투플러스 손자처럼 소중하게 키워요!",이윤정팀장은 “사회적 이슈로 떠오른 취약계층의 사회 안전망 구축과 삶의 희망을 통해 새로운 미래를 일궈가는 생활에 조금이나보템이 되고자 이번 행사를 실시했다”고 강조했다. 이어 이팀장은 “영산동이 독거노인과 취약계층이 주민의 20%나 차지하는 영세한 지역이라며 공직자로써 당연한 봉사 행정을...,http://news.heraldcorp.com/view.php?ud=20240506050008,
14281,㈜보템,"농협사료, 선제적 가격인하 1,400억원 농가실익보템","- 지속적인 사료가격 인하와 서비스 개선으로 농가 경영 안정 기여 농협사료(대표이사 김경수)는 출범 이후 지속적인 성장을 통해 국내 배합사료 시장을 선도해 왔고, 선제적인 가격인하와 서비스 개선으로 축산농가의 경영안정에 기여해왔다. 지난해에는 각종 전염병 발생, 축산물 가격 하락, 수입 쇠고기...",http://www.kenews.co.kr/news/article.html?no=84738,
14281,㈜보템,"아산시, ‘만사형통시스템’, ‘보템e’ 본격 가동","충남 아산시가 2024년 새해 달라지는 시책·제도 61건을 발표한 가운데, ‘행정·안전 분야’에서 시민들이 행정서비스에 보다 쉽게 접근할 수 있도록 새로 도입하는 정책들이 주목받고 있다. 아산시는 우선 ‘만사형통시스템’을...",http://www.breaknews.com/1014273,
14281,㈜보템,"""파워퍼프걸과 손잡으면 뜬다!""...뉴진스에 이어 대박 난 파워퍼프걸 콜라보템...",최근 잘파세대(1990년대 중반 이후 출생한 세대) 사이에서 대세로 통하고 있는 '파워퍼프걸'지난 여름 뉴진스는 파워퍼프걸과 협업해 선공개곡 '뉴진스'(New Jeans) 뮤직비디오를 공개했다.파워퍼프걸로 깜짝 변신한 뉴진스 멤버들은 지금까지도 팬들 사이에서 엄청난 화제를 모으고 있다. 팬들 사이에선...,https://www.insight.co.kr/news/458487,
