company_id,company_name,news_title,news_text,news_url,posted_at
9971,㈜아트파크,"더현대대구,아트·공연·팝업 가득한 '아트웨이브' 26일까지 진행","현대백화점 더현대대구는 오는 26일까지아트웨이브(Art Wave) 행사를 열어아트콘텐츠, 이벤트, 팝업 스토어를 선보인다고 10일 밝혔다. 9층에는 '브릭스 빌리지' 테마파크를 만들어 수백만개의 브릭을 조립해 만든 디오라마, 공룡, 캐릭터 등을 전시한다. 8층 히어로 라운지에서는 '브레드 이발소' 캐릭터와...",https://www.news1.kr/articles/5410751,2024-05-10 09:10
9971,㈜아트파크,"창원시, 청년 문화예술복합공간 '스펀지파크' 상반기 조성","경남 창원시는 성산구 용호동에 '청년 문화예술복합공간'(스펀지파크) 건립사업을 추진하고 있다고 9일 밝혔다. 시는 해당 부지 연면적 594㎡에 디자인아트박스(컨테이너 박스)를 설치해 청년 예술인 창작공간 6개동, 교육·전시공간 각 1개동 등을 운영한다. 이달 초 착공한 이 사업은 올해 상반기 중 완료될...",https://www.yna.co.kr/view/AKR20240510037700052?input=1195m,2024-05-10 10:10
9971,㈜아트파크,아산시 탕정테크노 산단에 선보이는 ‘탕정 푸르지오 센터파크‘ 5월 분양,"옆에 아산갈산중학교(‘25년 개교 예정) 부지가 있어 자녀들의 안전한 통학이 가능하다. 또 삼성고, 충남외고 등 명문 고등학교가 가깝고, 천안 불당동 학원가 이용이 편리하다. 단지 남측으로 흐르는 곡교천의 경우 ’곡교천아트리버파크통합하천사업‘을 통해 새로운 여가 공간으로 탈바꿈할 예정이다.",http://www.wowtv.co.kr/NewsCenter/News/Read?articleId=A202405100176&t=NN,2024-05-10 16:10
9971,㈜아트파크,'새로운 랜드마크 위해'...아트파크디자인 공모전 찾은 이장우 대전시장,대전 중촌근린공원에 들어설 음악전용공연장과 제2시립미술관 건립을 위한 '대전아트파크기획디자인' 국제지명공모 작품 발표회가 10일 개최된 가운데 이장우 대전시장이 시청 2층 로비 마련된 전시장을 찾아 공모 작품을 둘러보고 있다. 이번 공모에는 ▲켄고 쿠마 & 어소시에이츠(일본) ▲유엔...,https://www.newspim.com/news/view/20240510000970,2024-05-10 15:10
9971,㈜아트파크,[앵글속 세상] 격납고가 테마파크로… “놀이터보다 신나요”,"패밀리데이를 맞아 본사에 자리한 비행기 격납고는 테마파크로 변신했다. 어린이용 놀이기구, 드론게임, 포토부스, 벌룬아트, 어린이 사원증 키오스크, 페이스 페인팅, 푸드트럭 등이 들어선 대형 놀이 공간은 아이들은 물론 임직원도 ‘동심의 나라’로 데려갔다. 올해에 남자 프로배구 최초로 4연속...",https://www.kmib.co.kr/article/view.asp?arcid=1714968709&code=11151400&cp=nv,
9971,㈜아트파크,"현대백화점 더현대 대구,아트·공연·팝업 스토어로 가득한아트웨이브 테마...",올해는 소비자에게 좀 더 친숙하게 느껴지는 대중적아트전시를 운영한다. 최근 방영했던 tvN 토일드라마 '눈물의 여왕'의 촬영지로 알려지며 SNS와 소비자의 많은 관심을 받고 있는 9층(더 포럼)에서는 '브릭스 빌리지' 테마파크를 조성해 수백만개의 브릭을 조립해 만든 다양한 브릭작품을 전시할 계획이다....,http://news.heraldcorp.com/village/view.php?ud=202405090946078291587_10,
9971,㈜아트파크,"파크로쉬, 마마콤마 협업 팝업 클래스 선보여",아름다운 자연 속아트를 결합한 이색적인 웰니스 국내 최초의 프리미엄 웰니스 리조트이자 가장 진정성 있는 웰니스를 선보이고 있는파크로쉬가 국내 아티스트와 협업해 대자연 속에서 트렌디한 감성과 함께 즐길 수 있는 마인드 풀한아트콘텐츠를 선보인다.파크로쉬가 협업한 아티스트는...,https://www.pressian.com/pages/articles/2024050819035346953?utm_source=naver&utm_medium=search,
9971,㈜아트파크,수년 방치 '센트럴파크미술품' 흉물 전락,지난 5일 오후 3시쯤 인천 연수구 송도 센트럴파크.아트포레 상가와 맞닿은 공원에는 서로 다른 높낮이의 흰색 콘크리트 구조물 3개로 이뤄진 작품명 '3 큐브'가 전시돼 있었다. 2015년 11월 인천경제청의 '송도아트시티 공공미술 프로젝트'로 설치된 이 작품은 오랜 세월이 지나며 갈라지고 겉 부분이 뜯겨...,https://www.incheonilbo.com/news/articleView.html?idxno=1248328,
9971,㈜아트파크,[라이센스 라이프 PICK] 시그니엘 부산·모두투어·이랜드파크·제주신라호텔,"이랜드파크의 해외 호텔&리조트 법인 마이크로네시아 리조트(이하 MRI)가 운영하는 코럴 오션 리조트 사이판이 글로벌 최대 규모 여행플랫폼... ◆ 시그니엘 부산, '아트부산 2024' 맞아 최병소 작가 작품 전시 시그니엘 부산, 최병소 작가 전시 [사진=시그니엘 부산 제공] 시그니엘 부산은 한국 대표 현대 미술의...",https://www.lcnews.co.kr/news/articleView.html?idxno=74899,
9971,㈜아트파크,국내 최대 체험형 미디어파크'원더파크' 서울대공원 내 개장,국내 최대 규모의 미디어아트기반 체험형 미디어파크인 '원더파크'가 29일 오전 경기도 과천 서울대공원에서 개관식을 갖고 정식 운영을 시작한다. 원더파크는 이날 정식 개관을 기념해 이날 낮 12시부터 현장에서 오프라인 40% 입장권 할인 이벤트를 진행한다. 신세계건설과 미디어앤스페이스 파트너스가...,https://www.newsis.com/view/?id=NISX20240428_0002716110&cID=10405&pID=10400,
