company_id,company_name,news_title,news_text,news_url,posted_at
6193,㈜에스더블유(SW),"신원의료재단에스더블유헬스케어, 우즈베키스탄 국립아동병원과 임상검사센터...","신원의료재단은 최근 우즈베키스탄에SW-LAB(에스더블유-랩)을 설립하고, 임상검사센터 운영을 위한 모든 프로세스를 준비해 12월1일부터 정식으로 운영에 들어갈 예정이다. 신원의료재단 해외사업부 김준채 이사는 “장기간 해외에 파견되어 임상검사센터를 구축하는 것이 매우 힘들고 어려웠지만 국내의...",https://mdtoday.co.kr/news/view/1065599765484637,
6193,㈜에스더블유(SW),"㈜에스더블유헬스케어, 인니 의료 시장 진출 본격화",/SW헬스케어 의료기기 및 바이오 글로벌 유통기업 ㈜에스더블유헬스케어(대표 이의구)는 인도네시아 K-홈쇼핑 대표기업 PT.Lejel Shopping(대표 유국종)과 인도네시아 시장확대를 위해 상호 전략적 파트너쉽을 공고히 하는 업무협약을 체결했다고 8일 밝혔다.에스더블유헬스케어는 (의)신원의료재단이 설립한...,https://www.pinpointnews.co.kr/news/articleView.html?idxno=215955,
6193,㈜에스더블유(SW),SW해운 회생절차 조기졸업,"서울중앙지방법원 제22파산부(황진구 수석부장판사)는에스더블유(SW)해운의 회생절차 종결 결정을 내렸다. 법원은 ""채무자가 회생계획에 따른 변제를 시작했고 앞으로 회생계획의 수행에 지장이 없다고 인정된다""며 지난 2일자로 이 같이 결정했다. SW해운은 지난 5월10일 회생채권의 11%만을 10년에...",http://www.ksg.co.kr/news/main_newsView.jsp?bbsID=news&bbsCategory=KSG&categoryCode=all&backUrl=main_news&pNum=110227,
6193,㈜에스더블유(SW),"울산시, 태화호 활용 친환경선박 분야 기술 선도","또한 휴맥스모빌리티, 한국조선해양, 지오소프트,에스더블유(SW)이노베이션, 한국조선해양기자재연구원 울산본부 전기추진·안전기술센터, 울산정보산업진흥원, 한국해양대학교 총 7개 기관에서 총 52명의 연구 인력이 투입된다. 과제 세부 내용을 살펴보면, 연안선 및 중대형선 2가지 주제(콘셉트)로...",http://www.enewstoday.co.kr/news/articleView.html?idxno=1660504,
6193,㈜에스더블유(SW),"""과일에 살짝 뿌리기만 해도 진무름 방지돼요~""","친환경 위생관리 생활용품 생산기업인 월드켐은 국내 최초로 야채ㆍ과일 진무름 방지제 '바이오산에스더블유(SW)'를 16일 출시했다. 이 제품은 인체에 무해한 천연 향균제인 자몽 추출물로 만들었다. 야채와 과일에 묻은 각종 농약을 제거하고, 세균 및 곰팡이를 살균하는데도 효과가 있다. 특히 진무름...",http://www.ajnews.co.kr/uhtml/read.jsp?idxno=200909160935441990147,
6193,㈜에스더블유(SW),동해항-베트남 호찌민 컨테이너 항로 내년 6월 개설,"강원도는 오늘(10일) 강원도청에서 동해지방해양수산청,SW(에스더블유) 해운사와 컨테이너 항로 개설 업무 협약을 맺었습니다. 이에 따라, 20피트짜리 컨테이너 1,100여 개를 실을 수 있는 선박이 내년 6월부터 동해항과 베트남 호찌민 항로에서 첫 운항을 시작할 예정입니다.",https://news.kbs.co.kr/news/view.do?ncd=5345893&ref=A,
6193,㈜에스더블유(SW),"충청 '강소기업' 한양로보틱스, 25년만에 첫 투자유치 이유는? [허란의 VC 투...","3일 벤처투자(VC) 업계에 따르면 한양로보틱스가 진행한 시리즈 A 단계 투자라운드에는에스더블유인베스트먼트를 비롯해 원티드랩파트너스... 이번 투자를 주도한 강명우에스더블유인베스트먼트 상무는 ""다관절 협동 로봇 시장은 연평균 33%씩 성장하여 2030년 80억 달러(약 11조원) 규모로 커질 전망""이라며...",https://www.hankyung.com/finance/article/202211033709i,
6193,㈜에스더블유(SW),"[2018 파리모터쇼] 4일 개막, 신규 차종 대거 공개","이와 함께 최상위 세단인 508을 기반으로 한 왜건(지붕이 트렁크까지 일자로 연결된 형태)차량인 508에스더블유(SW)의 신형도 처음으로 공개한다. 또, 신규 PHEV 엔진은 새로운 8단 자동변속기에 1.6 퓨어 테크 가솔린 엔진과 전기 모터가 결합돼 최고 출력 225마력, 300마력을 제공한다. ▲ 시트로엥의 C5...",http://www.ohmynews.com/NWS_Web/View/at_pg.aspx?CNTN_CD=A0002476309&CMPT_CD=P0010&utm_source=naver&utm_medium=newsearch&utm_campaign=naver_news,
6193,㈜에스더블유(SW),우수 한인·한국기업 상품 홍보 바이어 눈길,"Partners)’, ‘에스더블유그린라이프(SWGreenlife)’, ‘데코리아 인터리어(Decoria Interior)’, ‘솔고(SOLCO)’, ‘코세트(Kosette)’, ‘MITSOSA New York’ 등이 참가했다. 또한 한국 기업은 한국무역협회(KITA) 회원사인 ‘물망(mool mang 제조사 USB Inc)’과 ‘지한메디올스(Chi Han Medi- Alls)...",http://www.koreatimes.com/article/1204426,
6193,㈜에스더블유(SW),"삼성그룹, 9월 9일 부터 2016년 하반기 공채 시작","삼성전자 지원자 가운데 에스(S)직군(소프트웨어 개발 인력)은 직무적성검사 대신 ‘에스더블유(SW)역량 테스트’를 본다. 직무적성검사에 합격하면 실무 면접과 창의성 면접, 임원 면접을 거친다. 창의성 면접은 주어진 주제를 지원자가 40분간 검토해 10~15분간 발표한 뒤 면접 담당자와 토론하는...",https://magazine.hankyung.com/job-joy/article/202102194256d,
