company_id,company_name,news_title,news_text,news_url,posted_at
7865,㈜씨에이웨이브,[11월3일 워크넷 채용정보] 유타렉스·엠티비·씨에이시스템·에코마이크로웨...,"내규 ■씨에이시스템, 생산직 채용 ▷모집부문 : 신입, 경력 ▷담당업무 : 삼성디스플레이 사내에 AGV/컨베이어 유지 보수 관리(기술력 관계 없음... 에코마이크로웨이브, 무선통신필터 연구개발 엔지니어 채용 ▷모집부문 : 신입, 경력 ▷담당업무 : 무선통신필터, Cavity & ceramic, RF/Microwave filter 연구개발...",https://www.news2day.co.kr/article/20221103500190,
7865,㈜씨에이웨이브,"아이티아이즈, 자회사 협력사 여의도로 모은다","금융·헬스케어 플랫폼 전문기업 아이티아이즈(대표 이성남)는 그룹 내 비즈니스 시너지 제고를 위해 자회사씨에이웨이브(대표 주태한)와 헬스케어 협력사인 메가브릿지(대표 정한수)의 사무실을 아이티아이즈 본사 서울 여의도 기계회관 건물로 확장, 이전한다고 2일 밝혔다.씨에이웨이브는 클라우드...",https://www.etnews.com/20230502000255,
7865,㈜씨에이웨이브,"엔비디아, 실적발표 D-1... 엔비디어 관련주 '상승' SK하이닉스-'하락' MDS테...",연결대상 종속회사로 컴퓨터시스템통합자문 및 구축 서비스업을 주요사업으로 하고 있는씨에이웨이브가 있으며 독자적인 기술로 클라우드 기반의 디지털 플랫폼인 GURMWI™를 개발했다. 이수페타시스는 전자제품의 핵심 부품인 인쇄회로기판(PCB)을 전문으로 생산함. 한국 이수페타시스 본사는 3개의...,https://www.pointdaily.co.kr/news/articleView.html?idxno=191177,
7865,㈜씨에이웨이브,아이티아이즈 주가 불끈...거래소 전력IT 유지관리 위탁용역 사업 수주로 실적...,연결대상 종속회사로 컴퓨터시스템통합자문 및 구축 서비스업을 주요 사업으로 하고 있는씨에이웨이브가 있다. 독자적인 기술로 클라우드 기반의 디지털 플랫폼인 GURMWI™를 개발했다. 이날 오전 10시 25분 STO(토큰증권 발행) 관련주인 비유테크놀러지 아이티아이즈 신한지주 하나금융지주 키움증권은...,https://www.pinpointnews.co.kr/news/articleView.html?idxno=239060,
7865,㈜씨에이웨이브,아이티아이즈 주가 다시 기지개...내년 본격 전개 토큰증권 신사업 촉각,연결대상 종속회사로 컴퓨터시스템통합자문 및 구축 서비스업을 주요 사업으로 하고 있는씨에이웨이브가 있다. 독자적인 기술로 클라우드 기반의 디지털 플랫폼인 GURMWI™를 개발했다. 전 거래일 IT서비스 관련주인 유니포인트 갤럭시아머니트리 비투엔 미래아이앤지 솔트룩스 오파스넷 케이아이엔엑스...,https://www.pinpointnews.co.kr/news/articleView.html?idxno=235504,
7865,㈜씨에이웨이브,"아이티아이즈 주가 방긋...""탱큐! 3분기 영업이익 흑자전환""",비롯하여 클라우드 기반 디지털 플랫폼 등으로 사업 분야를 확장시키고있는 금융서비스를 주요 사업으로 하고 있다. 연결대상 종속회사로 컴퓨터시스템통합자문 및 구축 서비스업을 주요사업으로 하고 있는씨에이웨이브가 있다. 독자적인 기술로 클라우드 기반의 디지털 플랫폼인 GURMWI™를 개발했다.,https://www.pinpointnews.co.kr/news/articleView.html?idxno=227699,
7865,㈜씨에이웨이브,"아이티아이즈 주가 '미소'…""올해를 턴어라운드 원년으로""",연결대상 종속회사로 컴퓨터시스템통합자문 및 구축 서비스업을 주요사업으로 하고 있는씨에이웨이브가 있다. 독자적인 기술로 클라우드 기반의 디지털 플랫폼인 GURMWI™를 개발했다. 2021년 코스닥시장에 신규 상장했다.,https://www.pinpointnews.co.kr/news/articleView.html?idxno=203432,
7865,㈜씨에이웨이브,아이티아이즈 주가 휘파람...외국인과 기관 적극 매수 가담은 별로,비롯하여 클라우드 기반 디지털 플랫폼 등으로 사업분야를 확장시키고있는 금융서비스를 주요 사업으로 하고 있다. 연결대상 종속회사로 컴퓨터시스템통합자문 및 구축 서비스업을 주요사업으로 하고 있는씨에이웨이브가 있다. 독자적인 기술로 클라우드 기반의 디지털 플랫폼인 GURMWI™를 개발했다.,https://www.pinpointnews.co.kr/news/articleView.html?idxno=201826,
7865,㈜씨에이웨이브,아이티아이즈 주가 휘파람...'토큰증권' 뭐길래? 실적개선 기대 부푼 꿈,연결대상 종속회사로 컴퓨터시스템통합자문 및 구축 서비스업을 주요사업으로 하고 있는씨에이웨이브가 있다. 독자적인 기술로 클라우드 기반의 디지털 플랫폼인 GURMWI™를 개발하고 있다. 같은시간 마이데이터 관련주인 아톤 유이벨록스 파스 파이오링크 쿠콘 나이스평가정보등도 함께 오르고 있다.,https://www.pinpointnews.co.kr/news/articleView.html?idxno=198374,
7865,㈜씨에이웨이브,아이티아이즈 주가 그대로 달릴까...원격의료·협진 서비스 '촉각',비롯하여 클라우드 기반 디지털 플랫폼 등으로 사업분야를 확장시키고있는 금융서비스를 주요사업으로 하고 있다. 연결대상 종속회사로 컴퓨터시스템통합자문 및 구축 서비스업을 주요사업으로 하고 있는씨에이웨이브가 있다. 독자적인 기술로 클라우드 기반의 디지털 플랫폼인 GURMWI™를 개발했다.,https://www.pinpointnews.co.kr/news/articleView.html?idxno=178329,
