company_id,company_name,news_title,news_text,news_url,posted_at
3511,㈜엑심베이,"엑심베이, '2022년 청년친화강소기업' 3년 연속 수상","해외 결제 전문기업엑심베이(대표 김준헌)가 3년 연속 '2022년 청년친화강소기업'으로 선정됐다고 18일 밝혔다. 고용노동부는 2016년부터 해마다 임금 및 일생활균형, 고용안정 등 청년에게 양질의 근무 환경을 제공하는 중소기업을 '청년친화강소기업'으로 선정한다. '2022년 청년친화강소기업'으로 선정된...",http://news.mt.co.kr/mtview.php?no=2022011815254834209,
3511,㈜엑심베이,"엑심베이, 22년 5월 개장 '춘천 레고랜드'에 결제 서비스 제공",글로벌 결제 플랫폼 전문기업엑심베이(대표 김준헌)가 2022년 5월 개장하는 '레고랜드'에 결제 서비스를 제공하기 위해 레고랜드코리아리조트(사장 김영필)·엑심HS(대표 허용)와 3사 업무 협약을 체결했다고 27일 밝혔다. 2022년 5월5일(어린이날) 레고랜드가 강원도 춘천에서 문을 연다. 레고랜드는 1968년...,http://news.mt.co.kr/mtview.php?no=2021122717085674506,
3511,㈜엑심베이,"레고랜드코리아 리조트, 글로벌 결제 플랫폼엑심베이와 업무 협약 체결","레고랜드코리아리조트(LLKR)는 글로벌 결제 플랫폼기업인 '엑심베이'와엑심베이의 호텔서비스를 전담하는 '엑심HS'와 3사 업무협약을 체결했다. 지난 22일 레고랜드 코리아리조트에서 진행된 협약식에는 김영필 레고랜드코리아리조트 사장과 김준헌엑심베이대표, 허용 엑심HS 대표가 참석했다....",http://www.kado.net/news/articleView.html?idxno=1105332,
3511,㈜엑심베이,"엑심베이, 여성가족부 2021 ‘가족친화인증기업’ 선정","국내외 글로벌 통합 결제 플랫폼을 제공하는 기업엑심베이(대표 김준헌)가 여성가족부의 '2021 가족친화인증기업'으로 선정됐다고 17일 밝혔다. '가족친화인증기업'이란 여성가족부가 가족친화제도(자녀 출산 및 양육 지원, 유연근무제도, 가족친화직장문화조성 등)를 모범적으로 운영하는 기업에 인증을...",http://news.mt.co.kr/mtview.php?no=2021121716020552442,
3511,㈜엑심베이,"엑심베이, ‘제58회 무역의 날’ 산업통상자원부장관 표창 수상","글로벌 결제 플랫폼 전문기업엑심베이는 자사 김준헌 대표가 지난 6일 열린 '제58회 무역의 날' 행사에서 산업통상자원부장관 표창을 수상했다고 밝혔다. '무역의 날'은 한국무역협회가 주최하고 산업통상자원부가 후원하는 행사다. 수출 확대와 해외 시장 개척, 일자리 창출 등에 기여한 무역인들의 성과를...",http://news.mt.co.kr/mtview.php?no=2021120717081561661,
3511,㈜엑심베이,"‘토마토솔루션’,엑심베이와 전략적 제휴… 결제 선택 폭 넓어져","토마토 플랫폼의 해외 진출에 큰 도움이 될 듯 앞줄 좌측부터엑심베이김준헌 대표, 리테일앤인사이트 성준경 대표. 뒷줄 좌측부터엑심베이김의진 이사, 공현진 상무, 리테일앤인사이트 이재성 팀장, 심문용 팀장. 사진=리테일앤인사이트 차세대 마트 통합시스템 ‘토마토솔루션’의 개발사인...",https://www.news2day.co.kr/article/20211028500053,
3511,㈜엑심베이,"엑심베이, 비마이프렌즈에 글로벌 통합 결제서비스 제공",글로벌 결제 서비스 전문기업엑심베이가 고객 친화형 글로벌 통합 결제 서비스를 비마이프렌즈에 제공한다고 30일 밝혔다. 이에 따라 더 많은 글로벌 고객이 비마이프렌즈의 서비스를 사용할 전망이다.엑심베이에 따르면 비마이프렌즈는 한류의 팬덤 신화를 성공적으로 이끌 신개념 팬덤 플랫폼...,http://news.mt.co.kr/mtview.php?no=2021113013192851238,
3511,㈜엑심베이,"비마이프렌즈·엑심베이, 글로벌 페이먼트 협력 MOU","D2C SaaS 개발 스타트업 비마이프렌즈(이하 비마이프렌즈)는 크로스보더(X-Border) 결제서비스 기업엑심베이와 글로벌 페이먼트 협력을 위한 업무협약을 체결했다.엑심베이는 지난 10여년 동안 글로벌 PG에 집중해 온 크로스보더 결제 전문 공급자로서 최상의 파이프라인(1만개 이상의 가맹점, 글로벌...",https://www.venturesquare.net/836175,
3511,㈜엑심베이,"엑심베이, 클라우드 기반 호텔 PG 사업 진출",해외 결제 서비스 분야의 국내 수위 PG(전자결제대행) 업체엑심베이(대표 김준헌)가 호텔 결제 사업에 진출한다.엑심베이는 호텔 PMS(자산관리시스템) 세계 1위 업체인 오라클과 손잡고 국내 최초로 클라우드 기반 호텔결제솔루션 'G-빌링'을 개발해 지난 9일부터 '홀리데이인 익스프레스 서울 홍대 호텔'에...,http://news.mt.co.kr/mtview.php?no=2021081012063554292,
3511,㈜엑심베이,"엑심베이, 2년 연속 '청년친화강소기업' 선정","해외결제 전문기업엑심베이(대표 김준헌)가 최근 '2021년 청년친화강소기업'에 선정됐다. 고용노동부는 2016년부터 매년 임금 및 일생활균형, 고용안정 등 청년에게 양질의 근무 환경을 제공하는 중소기업을 '청년친화강소기업'으로 선정한다. △임금우수 △일생활균형우수 △고용안정우수 분야에서 '2021년...",http://news.mt.co.kr/mtview.php?no=2021011411405031165,
