company_id,company_name,news_title,news_text,news_url,posted_at
3380,㈜솔로몬엠,"한진 설립 휴데이터스, CE. Info Systems·솔로몬엠과 업무협약 체결","Info Systems(MapMyIndia)’와 차량 IT 전문기업 ‘솔로몬엠’과 업무협약을 체결했다. 인도에 기반을 둔 CE. Info Systems(MapMyIndia)는 디지털지도, 지리 공간... Info Systems(MapMyIndia) 및솔로몬엠과의 업무협약을 체결해 국내 및 해외에서 차량 및 도로데이터를 수집하고 가공해 이를 필요로 하는 다양한...",http://www.nspna.com/news/?mode=view&newsid=592144,
3380,㈜솔로몬엠,"한진의 '휴데이터스', 세계 3대 지도 솔루션 기업과 MOU","△(왼쪽부터)유오케이 강성학 대표이사,솔로몬엠홍지수 대표이사, CE. Info Systems(MapMyIndia) 로한 버마(Rohan Verma) 대표이사, 휴데이터스 이정재... Info Systems(MapMyIndia)', '솔로몬엠'과 함께 이동형 수집장치를 활용한 데이터 플랫폼 개발을 위한 업무협약을 맺었다고 밝혔다. 휴데이터스는 '도로정보...",http://www.klnews.co.kr/news/articleView.html?idxno=305586,
3380,㈜솔로몬엠,"한진의 '휴데이터스', 세계적 지도·솔루션 기업과 글로벌 공략 추진","지난 7일 서울 중구 소재의 한진빌딩에서 진행된 업무협약식에서 (왼쪽부터) 유오케이 강성학 대표이사,솔로몬엠홍지수 대표이사, CE. Info... Info Systems(MapMyIndia)'와 차량 IT 전문기업 '솔로몬엠'과 업무협약(MOU)을 체결했다고 10일 밝혔다. 인도에 기반을 둔 CE. Info Systems(MapMyIndia)는 디지털지도...",http://www.efnews.co.kr/news/articleView.html?idxno=98440,
3380,㈜솔로몬엠,[유통산책] 취약층 아동 지원부터 이른둥이 기저귀 기부까지,"Info Systems(MapMyIndia)’와 차량 IT 전문기업 ‘솔로몬엠’과 업무협약을 체결했다. 인도에 기반을 둔 CE. Info Systems(MapMyIndia)는 디지털지도, 지리 공간... Info Systems(MapMyIndia) 및솔로몬엠과의 업무협약을 체결, 국내 및 해외에서 차량 및 도로데이터를 수집하고 가공해 이를 필요로 하는 다양한 고객을 대상으로...",http://www.g-enews.com/ko-kr/news/article/news_all/202209121239106268fd3ea9dd48_1/article.html,
3380,㈜솔로몬엠,"한진 휴데이터스, 세계 3대 지도ㆍ솔루션 기업과 업무협약","Info Systems(MapMyIndia)’와 차량 정보기술(IT) 전문기업 ‘솔로몬엠’과 업무협약을 체결했다고 8일 밝혔다. 인도에 기반을 둔 이 회사는 디지털 지도, 지리... Info Systems 및솔로몬엠과의 업무협약을 체결했다. 국내외에서 차량 및 도로데이터를 수집하고 가공해 이를 필요로 하는 다양한 고객을 대상으로...",https://www.dnews.co.kr/uhtml/view.jsp?idxno=202209081119550820712,
3380,㈜솔로몬엠,"휴데이터스, 글로벌 도로정보 DB사업 진출 본격화","Info Systems(MapMyIndia)' 및 차량 IT 전문기업인 '솔로몬엠'과 업무협약을 체결했다. 인도에 기반을 둔 CE. Info Systems(MapMyIndia)는 디지털지도, 지리 공간... Info Systems,솔로몬엠과 함께 사업 확장의 기회로 삼겠다""고 말했다. 한편, 지난 7일 서울 중구 소재 한진빌딩에서 진행된 업무협약식에는 노삼석 한진...",http://www.dailylog.co.kr/news/articleView.html?idxno=23596,
3380,㈜솔로몬엠,"한진, 세계 3대 지도·솔루션 기업과 ‘도로정보 사업’ 협력",한진은 도로정보 DB(데이터베이스) 사업을 위해 설립한 휴데이터스가 세계 3대 지도 및 솔루션 기업 CE 인포시스템즈(Info Systems)와 차량 IT(정보기술) 전문기업솔로몬엠과 업무협약을 체결했다고 8일 밝혔다. 이번 협약에 따라 CE 인포시스템즈와솔로몬엠은 도로정보 DB 사업에 활용할 영상정보...,https://biz.chosun.com/industry/company/2022/09/08/BUSLDBYA35GNJGMOS4FNWEKLRQ/?utm_source=naver&utm_medium=original&utm_campaign=biz,
3380,㈜솔로몬엠,[Who Is ?] 정몽윤 현대해상 회장,"Ltd., HG이니셔티브, 에이치지플레이스, 더패밀리랩, 안전가옥, 엠지알브이, 엠지알브이바이브, 솔로몬테크노서플라이,솔로몬엠, 에이치지파이낸스... 엠지알브이바이브,솔로몬엠등을 기업집단 소속회사로 거느리고 있다. 현대해상이 현대C&R, 현대하이카손해사정, 현대인베스트먼트자산운용...",https://www.businesspost.co.kr/BP?command=article_view&num=228018,
3380,㈜솔로몬엠,"[1일 낙찰/계약 동향] 2020학년도 여강고등학교 교무실 복사기 임대용역, 구미...","▲ 낙찰업체 : 주식회사솔로몬엠, 계약금액 : 25,899,900(원), 계약명 : 2020년 차량속도 조사 용역. 계약기관 : 서울특별시 서초구, 계약일자 : 2020-02-20, 계약방법 : 수의계약, 발주처(수요기관) : 서울특별시 서초구, 계약 : 주식회사솔로몬엠- 서울특별시 서초구 (2020년 차량속도 조사 용역, 2020년...",http://www.fintechpost.co.kr/news/articleView.html?idxno=102678,
3380,㈜솔로몬엠,[표] 신설법인 (11월 13일~ 11월 19일) 대전,"204호솔로몬엠이정숙 980 관광, 문화, 체육, 레져시설 개발ㆍ운영사업 둔산동 916 4층 케이디엘 이영식 50 렌터카사업 삼성동 374-16 네오에너지 지광호 100 다목적 경유첨가제 도소매 장대동 337-2 삐아네따빌딩 402호 메디아트 장연중 50 의료기기 도소매 태평동 349-1 세미티에스 오세헌 10...",http://news.mk.co.kr/news_forward.php?no=601587&year=2009,
