company_id,company_name,news_title,news_text,news_url,posted_at
5693,㈜위즈컴퍼니,의료기기 관련주 상승…디오·미래컴퍼니기술력 지수 '저평가',"또한, 디오의 기술력점수(TSS)는 208.22점, 기술투자지수는 16.4, 기업가치추정은 저평가, 미래컴퍼니의 기술력점수(TSS)는 180.23점, 기술투자지수는 14.5, 기업가치추정은 저평가로 나타났다. 5대 기술지표(기술투자지수, 기술력 점수, 퀀트기술등급, 보유 특허수, 기업가치추정)는 특허가치평가기업위즈도메인의...",https://www.pointdaily.co.kr/news/articleView.html?idxno=200912,2024-05-10 01:22
5693,㈜위즈컴퍼니,"KT, AI로 미디어·콘텐츠 산업 혁신…AICT컴퍼니전략 가속","이를 바탕으로 AICT컴퍼니전략 실행에 속도를 낸다. KT는 스카이라이프티브이(skyTV), KT스튜디오지니와 29일 오전 노보텔 앰배서더 서울 동대문에서... 12개 그룹사 역량 모아 콘텐츠 밸류체인 확립…그룹 시너지 강화 KT그룹의 미디어 계열사는 사업 영역에 따라 ▲원천 IP(스토리위즈, 밀리의서재)...",https://economist.co.kr/article/view/ecn202404290014,
5693,㈜위즈컴퍼니,"KT그룹, 미디어 밸류체인에 AI 접목… 'AICT컴퍼니' 전략 가속","이를 바탕으로 AICT컴퍼니전략 실행에 속도를 낸다는 계획이다. KT는 스카이라이프티브이(skyTV), KT스튜디오지니와 29일 오전 노보텔 앰배서더 서울... KT그룹의 미디어 계열사는 사업 영역에 따라 ▲원천 IP(스토리위즈, 밀리의서재) ▲콘텐츠 기획 및 제작(KT스튜디오지니) ▲콘텐츠 기획 및 채널 운영...",https://www.moneys.co.kr/article/2024042908195921278,
5693,㈜위즈컴퍼니,"KT그룹, AI로 미디어·콘텐츠 산업 혁신…AICT컴퍼니전략 가속","KT는 12개 그룹사의 역량을 모아 콘텐츠 밸류체인을 확립해 AICT컴퍼니전략 실행에 속도를 낼 방침이다. KT는 스카이라이프티브이 KT스튜디오지니와... KT그룹의 미디어 계열사는 사업 영역에 따라 △원천 IP(스토리위즈, 밀리의서재) △콘텐츠 기획 및 제작(KT스튜디오지니) △콘텐츠 기획 및 채널 운영...",https://www.etoday.co.kr/news/view/2355191,
5693,㈜위즈컴퍼니,"KT, 미디어 사업에 '인공지능' 접목해 사업 혁신...'AICT컴퍼니' 전략 가속","인공지능(AI) 역량을 바탕으로 그룹의 미디어 사업 혁신을 주도하고, 글로벌 시장에서 K-콘텐츠 확산을 위한 투자를 강화해 AICT컴퍼니전략 실행에 속도를 낸다는 전략이다. KT그룹의 미디어 계열사는 사업 영역에 따라 ▲원천 IP(스토리위즈, 밀리의서재) ▲콘텐츠 기획 및 제작(KT스튜디오지니)...",http://www.consumernews.co.kr/news/articleView.html?idxno=704966,
5693,㈜위즈컴퍼니,"K-뷰티 글로벌 시장 개척… ㈜위즈온컴퍼니-카자흐스탄 메가인플루언서, 한국...",K-뷰티(Beauty)가 전 세계적으로 주목을 받고 있는 가운데 글로벌 시장 개척을 위해 ㈜위즈온컴퍼니와 카자흐스탄의 '메가 인플루언서' 다밀리아 스왓(DAMELI SWEET)이 협력의 날개를 펴기 시작했다. 김현경위즈온컴퍼니대표(대한인플루언서협회 회장)가 지난 3월 29일위즈온컴퍼니회의실에서...,https://www.newscj.com/news/articleView.html?idxno=3129170,
5693,㈜위즈컴퍼니,"위즈온컴퍼니, 글로벌 인플루언서 미디어커머스 시장 ‘출사표’","㈜위즈온컴퍼니, 2023 서울콘의 메인 페스티벌인 ‘2023 에이판 스타 어워즈’ 공동 주관사로 글로벌 인플루어서 미디어커머스 시장에 본격적으로 진출한다고 밝혔다. 서울경제진흥원(SBA)이 주최하는 '2023 서울콘'은 서울의 매력을 세계에 알리고 경제적 가치를 창출하는 세계 최초의 인플루언서...",http://www.wowtv.co.kr/NewsCenter/News/Read?articleId=A202312270148&t=NN,
5693,㈜위즈컴퍼니,[포토종합]위즈온컴퍼니'서울콘 에이판 스타 어워즈' 성료… 글로벌 인플루...,"올해로 9회째를 맞는 이번 시상식은 ㈜위즈온컴퍼니(회장 김현경)가 공동 주관으로 나서고, 대한민국인플루언서협회(회장 김현경)가 후원하며, 서울경제진흥원(SBA)이 주최하는 2023 서울콘의 주요 행사이다. 2023 서울콘은 서울의 매력을 전 세계에 알리고 경제적 가치를 창출하는 세계 최초 최대의...",https://www.newscj.com/news/articleView.html?idxno=3095581,
5693,㈜위즈컴퍼니,"[2023유망중소기업대상] ㈜위즈온컴퍼니, 체계적 인플루언서 교육으로 시장 개...","이날 시상식에서 유망중소기업 대상 부문에는 인플루언서 매지니먼트 분야인 ㈜위즈온컴퍼니(김현경 회장)가 선정됐다.위즈온컴퍼니는 소상공인, 경력단절녀, 인플루언서 커머스로 성장하고 싶은 인플루언서들을 대상으로 3년간 기본과정, 심화과정, 전문가과정 3단계로 나눠 무료 교육을 체계적으로...",https://www.newscj.com/news/articleView.html?idxno=3088896,
5693,㈜위즈컴퍼니,"이무생, KT위즈승리 기원 시구 나선다","잠든 사이'로 관객과 만나고 있으며, 드라마 '마에스트라'로 대세 배우에 등극한 데 이어 '하이드'에서도 연속 변신에 성공하는 등 다양한 작품에서 활약을 보여주고 있다. 이무생이 승리 기원 시구자로 나서는 KT위즈경기는 오는 3일 저녁 6시 30분부터 펼쳐진다. [티브이데일리 /사진제공=에일리언컴퍼니]",http://www.tvdaily.co.kr/read.php3?aid=17120174201706041002,
