company_id,company_name,news_title,news_text,news_url,posted_at
3499,㈜소프트원,"엔씨 박병무 ""삼성동 사옥 매각하고 플랫폼 수익화""(종합)","""판교 본사 사옥 유동화도 검토…동남아 진출 준비 중"" ""글로벌 콘솔 플랫폼사와 협업…기존 IP 콘솔화 추진"" 박병무 엔씨소프트공동대표가 실적 악화... 새로운 장르와 BM으로 신뢰를 회복하고, 회사는 '원팀'으로 유연한 조직을 만들어 시장 예측보다 더 높은 실적을 낼 수 있도록 최대한 노력하겠다""고...",https://www.yna.co.kr/view/AKR20240510052851017?input=1195m,2024-05-10 11:34
3499,㈜소프트원,"엔씨소프트, 1분기 영업익 257억원…전년比 68.5%↓","엔씨소프트(036570)가 올해 1분기 연결 기준 매출액으로 3979억원, 영업이익 257억 원을 기록한 것으로 잠정 집계됐다고 10일 공시했다. 전년 동기 대비 각각 16.9%, 68.5% 급감한 수치다. 다만 영업이익의 경우 에프앤가이드가 제시한 시장 기대치(137억원)는 웃돌았다. 플랫폼별 매출액은 모바일 게임이...",https://www.sedaily.com/NewsView/2D94UORPKC,2024-05-10 09:34
3499,㈜소프트원,마이크로소프트365로 디지털 전환에 박차를 가하다,"프로젝트단위에서 산출물 생성, 공유, 관리 등을원드라이브를 통해 생산성과, 신뢰성을 모두 확보할 수가 있었습니다. Q. 마이크로소프트365 앱 중 하나인 파워 BI는 기업이 데이터를 분석하고 시각화해 비즈니스 인사이트를 도출합니다. 다양한 데이터 소스를 연결하고, 데이터를 분석하여 차트, 그래프...",https://zdnet.co.kr/view/?no=20240507141715,
3499,㈜소프트원,"NC, 성남시 '인디크래프트' 6년 연속 후원","엔씨소프트(NC)가 6년 연속 후원사로 참여한다. 인디크래프트 사무국은 올해 인디게임 출품작 심사를 거쳐 오는 5월 20일 선정작을 공개할 예정이다.... 이 외에도 넷마블과 카카오게임즈, CFK, 유니티, 컴투스플랫폼, 플레이오, 앱실링, 모리사와 코리아, 디앤엠, 원스토어, 마이크로소프트...",http://www.g-enews.com/ko-kr/news/article/news_all/202405021100303796c5fa75ef86_1/article.html,
3499,㈜소프트원,"디지털융합교육원, MS365 원데이클래스 '업무효율화 비법' 온라인 강좌 개최","참가자들은 Word, Forms, PPT, Excel 등의 Office 도구들을 포함한 MS소프트웨어의 코파일럿 활용법을 배울 수 있다. 강좌는 네이버카페 '디지털활용교육... 변은주 강사는 오후 1시부터 2시까지 코파일럿 Word 활용법을, 유채린 강사는 2시부터 3시까지 마이크로소프트Forms를 주제로 강의한다. 이어 최재용...",http://www.fntoday.co.kr/news/articleView.html?idxno=320226,
3499,㈜소프트원,"기사회생 원스토어, SK스퀘어 효자될까",앞서 원스토어는 2021년 도이치텔레콤·마이크로소프트(MS)로부터 168억원 규모의 투자를 유치한 바 있다. 아울러 최근에는 SK스퀘어의 모회사인 SK텔레콤이 도이치텔레콤과 '텔코 LLM 얼라이언스'를 결성해 협력 범위를 넓히고 있다. 즉 원스토어가 글로벌 시장에서 유의미한 성과를 낼 수 있는 환경이 조성되고...,https://dealsite.co.kr/articles/122201,
3499,㈜소프트원,[게임 NOW] 한빛소프트·호요버스·룸식스,"▶ 한빛소프트에서 서비스하는 리듬댄스 게임 '오디션'이 신규 상시 콘텐츠인 '올스타 미션'을 선보였다. ▶ 호요버스의 RPG '붕괴: 스타레일'이 오는... 한빛소프트, '오디션' 업데이트 한빛소프트가 서비스하는 리듬댄스 게임 '오디션'이 새로운 상시 콘텐츠를 공개했다. 이번 콘텐츠는 '올스타 미션...",https://www.ytn.co.kr/_ln/0135_202404291448050555,
3499,㈜소프트원,대만 시장 눈독 들이는 韓 게임사…왜?,"이날 기준 대만 구글플레이스토어 매출 1위는 엔씨소프트'리니지M', 4위는 리니지W가 차지하고 있다. 특히 대만은 대규모 전투 및 유저 간 대결(PvP) 콘텐츠에 대한시장 선호도가 높아 아스달 연대기, 아키에이지 워 모두 흥행 가능성이 점쳐지고 있다. 앱마켓 원스토어는 연내 대만에 현지 앱마켓을 연다는...",https://www.newsis.com/view/?id=NISX20240423_0002710127&cID=13008&pID=13100,
3499,㈜소프트원,먹구름 낀 美경제소프트랜딩할까...가장 큰 위협은 ‘연준의 오판’,미국 경제의 항로를 점치기 위한 이번 대형 서베이에서 전문가 37명 중 27명(73%)은 “미국 경제는 그래도소프트랜딩(soft landing·연착륙)할 것”이라고... 장중원·달러 환율이 1400원을 넘기도 했다. 이번 설문에 응한 전문가 37명 중 미국 소비자물가 상승률이 올해 말 연준의 목표치인 2% 아래까지 떨어질...,https://www.chosun.com/economy/weeklybiz/2024/04/25/DMDYWARSMRE65CZ76LAGTFME64/?utm_source=naver&utm_medium=referral&utm_campaign=naver-news,
3499,㈜소프트원,"조이시티, 1분기 영업익 46억원...전년比 13.9% 늘어","조이시티는 지난 1분기 매출액 386억원, 영업이익 46억원, 당기순이익 36억 원을 기록했다고 7일 공시했다. 전년 동기 대비 매출은 5.5%, 영업이익 13.9... 2월에는 엔드림 자회사 테이크파이브스튜디오스에서 개발 중인 모바일 전략 게임 '디즈니 렐름 브레이커스'를 싱가폴, 호주 등에소프트론칭한 바...",https://www.fomos.kr/redirect/news_view?news_cate_id=7&entry_id=132178,
