company_id,company_name,news_title,news_text,news_url,posted_at
13781,㈜휴메딕스,"휴메딕스, 올 1분기 매출 412억…""14% 성장, 최대실적""","휴온스그룹의 에스테틱 자회사휴메딕스가 올해 1분기 매출과 영업이익 모두 전년 동기 대비 두 자릿수 성장을 기록하며 분기 최대 실적을 냈다.휴메딕스는 올해 1분기 개별재무제표 기준 매출 412억원, 영업이익 106억원, 당기순이익 93억원을 기록하며 전년 동기 대비 각각 14%, 14%, -16%를 기록했다고 10일...",https://www.newsis.com/view/?id=NISX20240510_0002730299&cID=10434&pID=13200,2024-05-10 11:41
13781,㈜휴메딕스,"휴메딕스, 中 에스테틱 시장 공략 나서",휴온스그룹의 에스테틱 자회사휴메딕스(대표 김진환)가 중국 시장 확대에 나섰다.휴메딕스는 최근 중국 ‘대련 웨이미스 트레이딩’과 ‘엘라비에 코스메틱’ 브랜드 화장품 총판 계약을 체결했다고 7일 밝혔다. 대련 웨이미스 트레이딩은 중국 내 병의원 및 에스테틱샵 등에 다년간 코스메틱 제품을...,http://news.heraldcorp.com/view.php?ud=20240507050413,
13781,㈜휴메딕스,[제약업게 소식] 5월 10일,"■휴메딕스, 1분기 매출 412억원···'최대 실적' (주)휴메딕스(대표 김진환)는 1분기 개별재무제표 기준 매출 412억원, 영업이익 106억원, 당기순이익 93억원을 기록하며 전년 동기 대비 각 14%, 14%, -16%를 기록했다고 10일 밝혔다.휴메딕스는 호실적의 배경으로 엘라비에 필러 중심의 에스테틱, CMO, 해외 사업...",http://www.doctorstimes.com/news/articleView.html?idxno=227090,2024-05-10 16:41
13781,㈜휴메딕스,"대웅제약, 영업부문 신입채용 外","◇휴메딕스, 1분기 역대 최대 실적 달성휴메딕스(대표 김진환)는 1분기 개별재무제표 기준 매출 412억원, 영업이익 106억원, 당기순이익 93억원을 기록하며 전년 동기 대비 각 14%, 14%, -16%를 기록했다고 밝혔다. 매출과 영업이익 모두 전년 동기 대비 두 자릿수 성장을 기록하며 분기 최대 실적을 갱신했다는...",http://www.newsmp.com/news/articleView.html?idxno=240808,2024-05-10 17:41
13781,㈜휴메딕스,"바이오 투심 시들하지만, 활짝 핀 미용의료는 꽃잔치","9일 관련업계에 따르면 국내 주요 미용의료기기 업체 클래시스와 비올, 미용소재 기업 휴젤과휴메딕스가 실적성장을 앞세워 최근 시장에서 호평받고...휴메딕스는 중국과 브라질 등에 필러공급을 늘리는 등 수출국 다변화로 실적성장을 뒷받침했다. 최근 헤파린나트륨의 식품의약품안전처(식약처) 원료의약품...",http://news.mt.co.kr/mtview.php?no=2024050817582314328,
13781,㈜휴메딕스,"휴메딕스, 고기능성 앰플로 中 에스테틱 시장 공략","휴메딕스는 최근 중국 '대련 웨이미스 트레이딩(Dalian Weimisi Trading Co., Ltd. 대표 Jin Zhe)'과 '엘라비에 코스메틱' 브랜드의 화장품 총판 계약을 체결했다고 7일 밝혔다.ㅣ휴온스그룹 제공 휴온스그룹의 에스테틱 자회사휴메딕스가 중국 시장 확대에 나섰다.휴메딕스는 최근 중국 '대련 웨이미스...",http://www.biztribune.co.kr/news/articleView.html?idxno=311245,
13781,㈜휴메딕스,"미용의료기기, 연초 부진 딛고 호실적 랠리…고금리 수혜","이외에도 비올, 휴젤,휴메딕스등 미용의료기기, 미용 소재 기업 등이 일제히 호실적을 보였다. 피부미용 의료기기 전문 기업인 비올은 매출액 112억원... 휴온스그룹휴메딕스는 올해 1분기 매출과 영업이익 모두 전년 동기 대비 두 자릿수 성장을 기록하며 분기 최대 실적을 갱신했다.휴메딕스는 1분기...",https://www.newsway.co.kr/news/view?ud=2024051014590547694,2024-05-10 16:41
13781,㈜휴메딕스,"제약사, 장기지속형 주사제 개발 '줄이어'…한번 주사로 효과는 길게","휴메딕스는 HLB제약과 공동으로 비만치료용 장기지속형 주사제 후보물질 'HP-P038'을 개발하고 있다.휴메딕스는 기술을 이전받아 임상, 품목허가, 생산, 판매를 맡고 HLB제약은 SMEB 플랫폼 특허 기술을 활용해 비만치료용 장기지속형 주사제의 제형 연구를 담당한다. SMEB는 HLB제약의 장기지속형 주사제...",https://www.greened.kr/news/articleView.html?idxno=314056,2024-05-10 14:41
13781,㈜휴메딕스,"2023 제약바이오 부채비율, 코스피 82.61%, 코스닥 73.48%","화일약품(6.62%), 엔지켐생명과학(8.69%), 케어젠(8.79%),휴메딕스(11.06%), 신일제약(13.02%), 삼아제약(15.38%), 파마리서치(15.81%), 고려제약(16.37... 연간 부채비율이 전년도 대비 가장 감소한 곳은 스피어파워(-145.73%)이며 CJ바이오사이언스(-56.59%),휴메딕스(-52.21%), 한국파마(-42.04...",http://www.yakup.com/news/index.html?mode=view&cat=12&nid=294014,
13781,㈜휴메딕스,바이오 투자 별로라고? 미용의료는 이제부터 '전성기',"8일 관련업계에 따르면 국내 주요 미용 의료기기 회사인 클래시스와 비올, 미용 소재 기업인 휴젤과휴메딕스가 실적 성장을 앞세워 최근 시장의 호평을...휴메딕스는 중국과 브라질 등에 필러 공급을 늘리는 등 수출국 다변화로 실적 성장을 뒷받침하고 있다. 최근 헤파린 나트륨의 식품의약품안전처(식약처)...",http://news.mt.co.kr/mtview.php?no=2024050815120429257,
