company_id,company_name,news_title,news_text,news_url,posted_at
10647,㈜하나애드컴,‘대한민국 커뮤니케이션 대상’ 해외상에하나로애드컴공간21 수상,"하나로애드컴(대표 손정희)과 공간21(대표 최하진)이 지난 24일 한국프레스센터에서 열린 ‘2023 대한민국 커뮤니케이션 대상’에서 디자인 및 기획 부문 해외상을 받았다.하나로애드컴과 공간21은 지난 10월 2023 한강페스티벌 민간협력사업의 일환으로 진행된 '롤링페이퍼-한강아, 내 꿈을 부탁해!...",https://www.asiatoday.co.kr/view.php?key=20231128001722466,
10647,㈜하나애드컴,"하나로애드컴, 대한민국 커뮤니케이션대상 수상 업체 선정",디자인 전문업체하나로애드컴이 대한민국 커뮤니케이션대상 수상 업체로 선정되었다. 총 종업원 22명으로 구성된하나로애드컴은 디자인 연구소를 필두로 기획관리팀 등 기타 세부 부서들의 유기적인 협업을 바탕으로 언제나 뛰어난 디자인 결과물을 생산하여 디자인 업계의 신뢰를 받고 있는 전문...,https://www.dailysecu.com/news/articleView.html?idxno=117182,
10647,㈜하나애드컴,"디자인 전문업체하나로애드컴, 대한민국 커뮤니케이션대상 13년 연속 수상","하나로애드컴이 대한민국 커뮤니케이션대상을 13년 연속 수상하였다. 디자인 전문업체하나로애드컴은 1995년에 설립되어 인쇄, 출판물의 기획과 디자인부터 웹진 등 인터넷 관련 서비스까지 디자인과 관련한 대부분의 사업 영역에서 뛰어난 성과를 내고 있는 중견 디자인 업체이다. 이를 바탕으로...",http://www.gokorea.kr/693046,
10647,㈜하나애드컴,"복은희하나온애드컴대표, 브랜드대상 받아","복은희하나온애드컴대표, 브랜드대상 받아 복은희하나온애드컴대표, 브랜드대상 받아 복은희하나온애드컴대표가 창의적인 옥외광고의 새 지평을 열었다는 평가를 받으면서 지난 28일 서울 강남구 임페리얼팰리스호텔에서 진행된 ‘2019 대한민국 브랜드 대상’ 시상식에서 광고분야 영예의 대상을...",http://www.viva100.com/main/view.php?key=20191129010010243,
10647,㈜하나애드컴,"하나로애드컴, 아시아-태평양 스티비상 금상 수상","하나로애드컴(대표 손정희)이 지난 6월 1일 홍콩 미라호텔에서 열린 ‘2018 아시아-태평양 스티비상(2018 Asia-Pacific Stevie Awards)’에서 금상 1개, 은상 1개를 수상했다.하나로애드컴은 4년 연속 금상을 수상했다.하나로애드컴은 커뮤니케이션 디자인전문회사로 ‘소비자제품&서비스산업...",http://news.mt.co.kr/mtview.php?no=2018061415412552914,
10647,㈜하나애드컴,[포토] IBA 시상식서 금상 수상한하나로애드컴손정희 대표,하나로애드컴손정희 대표가 20일 오후 영국 인터컨티넨털 런던 파크레인 호텔에서 열린 제15회 국제비지니스대상 IBA (International Business Awards) 시상식에서 Creative Awards Category 금상을 수상하고 기념촬영을 하고 있다.,http://www.ntoday.co.kr/news/articleView.html?idxno=63801,
10647,㈜하나애드컴,"[새 책] 신입사원부터 임금피크제 직원까지 연금노하우 공개, '37년 월급쟁이...","1~3장에서는 직장인이라면 누구나하나쯤 가입된 연금저축과 IRP에 대한 기초적인 지식, 퇴직연금, 연금계좌에서 운용할 수 있는 금융상품의 종류를 상세하게 담았다. 4장부터는 국민연금, 주택연금, 건강보험료, 기초연금, 농지연금에 이르기까지 독자가 알고 싶어 하는 실질적인 내용을 담았고 마지막...",http://sports.chosun.com/news/ntype.htm?id=202006040100040270002393&servicedate=20200604,
10647,㈜하나애드컴,"하나로애드컴, 2017국제비즈니스대상에서 ‘가장 영예로운 마케팅대행사’로 ...",[머니투데이 김진수 MT해양 에디터] 2017 IBA 시상식에서 수상소감을 발표하는 손정희대표/사진=하나로애드컴하나로애드컴(대표 손정희)은 2017국제비즈니스대상(IBA: The International Business Awards)에서 ‘가장 영예로운 마케팅대행사’로 그랑프리인 그랜드스티비상의 영광을 안았다고 밝혔다. 또한...,http://www.mt.co.kr/view/mtview.php?type=1&no=2017102515055955699&outlink=1,
10647,㈜하나애드컴,하나로애드컴'2017 월드클래스 강소기업대상' 우수서비스 부문 수상,"[머니투데이 신재은 에디터]하나로애드컴손정희 대표(사진 오른쪽)가 21일 오후 서울 중구 소공동 프레스센터에서 진행된 머니투데이 주최 ‘2017 월드클래스 강소기업대상’에서 우수서비스 부문 최우수상을 수상했다.하나로애드컴은 사보, 브로슈어, 웹진, 광고의 디자인, 인쇄 등 다양한 사업을...",http://news.mt.co.kr/mtview.php?no=2017122016090787307,
10647,㈜하나애드컴,"제4회 아시아-태평양 스티비 어워즈,하나로애드컴","=제4회 아시아-태평양 스티비 어워즈 시상식이 열린 2일 오후 일본 동경 힐튼호텔에서 고객 서비스분야 고객서비스, 경영, 기획, 실행 혁신상 및 기타 서비스산업 분야의 금상을하나로애드컴(사장: 손정희)의 설명성 이사와 장채순 실장이 수상후 소감을 밝히고 있다. 2017.06.03. (사진...",http://www.newsis.com/view/?id=NISI20170603_0013077108,
