company_id,company_name,news_title,news_text,news_url,posted_at
1819,㈜홈마스터,"홈초이스, 금주의 신작 '쿵푸팬더4' VOD 론칭 프로모션 진행",영화 ‘쿵푸팬더4’는 모든 쿵푸마스터들의 능력을 그대로 복제하는 가장 강력한 빌런 ‘카멜레온’에 맞서기 위해 용의 전사인 자신마저 뛰어넘어야 하는 ‘포’의 새로운 도전을 담은 작품이다. 8년 만에 돌아온 쿵푸팬더 시리즈는 용의 전사 ‘포’ 목소리로 코미디언이자 배우인 잭 블랙도 함께...,http://gamefocus.co.kr/detail.php?number=155731,
1819,㈜홈마스터,"메종오브제, 9월 개최 ...홈데코 라이프스타일 트렌드 플렛폼 모인다","지난 1994년부터 사피(SAFI)가 주관해온 메종&오브제(Maison&Objet)는 세계적 디자인,홈데코 및 라이프스타일 전문가들을 한데 모은다. 9월 5일부터... 주도하는마스터클래스, 비즈니스별 맞춤 코칭 및 토론을 통해 풍부하고 구체적으로 구현될 것이다. 메종&오브제는 2024년 9월 전시회를 위해 '리오넬...",http://www.ktnews.com/news/articleView.html?idxno=132829,
1819,㈜홈마스터,"오전 11시 ""지오마스터"" 오퀴즈 문제+정답!","OK캐쉬백 오퀴즈에서 ""지오마스터""관련 퀴즈를 제시했다. 목요일인 5월 2일 오전 11시경 제시된 '지오마스터'관련 문제는 ""지노마스터에는 질 건강관리에 특화된 원료인 리스펙타 유산균을 OO억 마리 함유해 질 내부 밸런스를 유지하는데 도움을 주는데요, 다음 중 빈칸에 들어갈 숫자는 무엇일까요?""다....",http://www.economytalk.kr/news/articleView.html?idxno=254964,
1819,㈜홈마스터,"세라젬, '마스터V9' 사전계약 50만원 할인","행사는 신제품 '마스터V9'을 포함한 척추 의료기기와 안마의자 파우제 등 다양한홈헬스케어 가전을 대상으로 진행한다. 특히 자·타사 무관 안마의자 보상판매, 결합 할인 등 합리적인 가격에 제품을 구매할 수 있도록 혜택을 강화했다. 먼저 전문성과 사용성을 대폭 강화한 신제품마스터V9을 사전계약할...",https://zdnet.co.kr/view/?no=20240409144048,
1819,㈜홈마스터,세라젬 '마스터V7·파우제M4' 獨 '레드닷 디자인 어워드' 본상,"받았다""며 ""마스터V7은 건강관리 기능과 인테리어 효과를 동시에 충족할 수 있도록 모던하면서 절제된 외관으로, 파우제 M4는 부드러운 곡선을 살려 공간에 자연스럽게 녹아드는 외관으로 높은 평가를 받았다""고 말했다. 이어 ""고유 디자인 철학을 바탕으로홈헬스케어 가전의 디자인 트렌드를...",https://www.news1.kr/articles/5396457,
1819,㈜홈마스터,"""가성비로 경쟁력 확보""…대형마트들, PB상품 강화로 '승부수'","이 가운데 롯데마트는 HMR PB 브랜드 '요리하다'를 비롯해 식품·일상용품·건강기능·식품 등을 포괄하는마스터PB 브랜드 '오늘좋은' 등의 브랜드를 집중 운영한다는 계획이다. 회사 측에 따르면, 최근 인기를 끌고 있는 PB 제품은 요리하다 제품군 중 시중가 대비 30% 저렴한 '사골곰탕(500g)'와 등갈비로...",https://www.youthdaily.co.kr/news/article.html?no=151748,
1819,㈜홈마스터,"광주FC, 27일 수원FC와홈맞대결…“연패 끊는다”","또한, 패스마스터윤빛가람, 국가대표 출신 수비수 이용과 공격수 지동원 등 스타플레이어들이 즐비한 수원 FC를 상대로 광주는 잠시라도 경계를 늦출 수 없다. 수원FC전을 시작으로 5월에만 7경기를 치러야 하는 광주. 5연패를 끊고 대반등에 성공할 수 있을까? K리그 팬들은 광주가 다시 한번 반전 드라마를...",http://www.kjdaily.com/article.php?aid=1714041564628378007,
1819,㈜홈마스터,"핍스홈(PHYPS HOME), 매장 리뉴얼 오픈","특히, 혼다(Honda)와의마스터라이선스 계약을 통해 선보인 ‘혼다 모터사이클’ 컬렉션의 전 상품도 한자리에서 확인할 수 있다. 모터사이클에 대한 다양한 콘텐츠를 경험할 수 있는 ‘핍스홈(PHYPS HOME)’은 용산구 한강 대로에 위치해 있으며 매일 10시부터 오후 8시까지 운영된다. 또한, 혼다의...",http://www.apparelnews.co.kr/news/news_view/?idx=210936,
1819,㈜홈마스터,6라운드 MVP는 부산 ‘패스마스터’ 임민혁 [K리그],부산의 ‘패스마스터’ 임민혁. K리그 플레이어 오브 라운드: 부산의 ‘패스마스터’ 임민혁 부산은 6라운드 천안전에서 4대2로 승리하며 3위(승점 9)에 올랐다. 이날 임민혁은 2골 1도움을 기록하며 부산의 다득점 승리를 이끌었다. 임민혁은 지난 시즌 서울에서 부산으로 임대되어 24경기 2골 2도움으로...,http://www.kukinews.com/newsView/kuk202404110206,
1819,㈜홈마스터,"[그래도 K리그] '패스마스터' 기성용의 FC 서울, 다시 반등할까","올 시즌 전 경기 풀타임을 소화하면서 공격지역으로의 패스 성공률 1위의 '패스마스터' 면모를 보이고 있는데 전북전에서는 어떤 경기 내용을 보여줄지 기대된다. 하지만 전북은 서울을 상대로 최근 20경기 연속 무패(15승 5무)의 압도적 우위를 보여 승패 향방은 안갯속이다. 20, 21일 열리는 '하나은행...",http://news.tf.co.kr/read/soccer/2092257.htm,
