company_id,company_name,news_title,news_text,news_url,posted_at
6025,다비앙,"[2016 Korea Top Brand]다비앙AV프라임…오디오, 홈시어터 업계 최초 찾아가는...","[동아일보] 고객감동브랜드 부문 / 2년 연속 오디오, 홈시어터 쇼핑몰 ㈜다비앙(대표 이정복) AV프라임이 코리아탑브랜드 고객감동브랜드 대상을 2년 연속 수상해 국내 최고의 오디오, 홈시어터 쇼핑몰 브랜드라는 명성을 굳건히 지켰다.다비앙AV프라임은 오디오, 홈시어터에 익숙지 않은 입문 소비자들에게...",http://news.donga.com/3/all/20160413/77557353/1,
6025,다비앙,"㈜평창에프앤비 ‘다비앙·평창다원’, 브랜드 리뉴얼 출시! “전 제품 생분해...","㈜평창에프앤비는 허브차 브랜드 ‘다비앙’과 전통차 브랜드 ‘평창다원’의 브랜드 리뉴얼을 통해 모든 제품을 새롭게 출시한다고 13일 밝혔다.특히... 현재 순차적으로 적용 중이며, 오는 8월까지 전 제품을 생분해 티백으로 변환할 예정이다.㈜평창에프앤비 관계자는 “이번 리뉴얼 제품으로는다비앙의...",http://gokorea.kr/news/view/687182,
6025,다비앙,"광동제약, 배변 건식 ‘광동다비앙’ 출시","광동제약은 24일 배변 고민에 도움을 줄 수 있는 건강기능식품 ‘광동다비앙’을 출시했다. ‘광동다비앙’은 1포(80ml)당 식이섬유 6000mg을 함유해 원활한 배변활동에 도움을 준다. 주원료인 난소화성말토덱스트린 식이섬유 6000mg은 딸기 15개, 토마토 약 7.5개, 오이 약 7.5개에 해당하는 분량이다. 또한...",http://www.newstomato.com/ReadNews.aspx?no=421033,
6025,다비앙,"광동, 배변 고민 ‘다비앙’으로 비우세요","‘광동다비앙’ 시음 이미지. 사진제공=광동제약 광동제약이 배변 고민을 해결할 수 있는 건강기능식품 ‘광동다비앙’을 출시했다고 22일 밝혔다. ‘광동다비앙’ 1포에는 딸기 15개, 토마토·오이 각 7.5개에 해당하는 식이섬유 6000mg이 담겨있다. 광동제약은 주원료인 난소화성말토덱스트린 식이섬유...",http://www.econovill.com/archives/138303,
6025,다비앙,"[신제품] 광동제약, 배변에 도움 주는 건강기능식품 ‘광동다비앙’","광동제약이 배변 고민에 도움을 줄 수 있는 건강기능식품 ‘광동다비앙’을 출시했다. 광동다비앙은 1포(80ml) 당 식이섬유 6000mg을 함유해 원활한 배변활동에 도움을 줄 수 있다. 주원료인 난소화성말토덱스트린 식이섬유 6000mg은 딸기 15개, 토마토 약 7.5개, 오이 약 7.5개 각각에 해당하는 분량이다....",http://news.kukinews.com/article/view.asp?page=1&gCode=cul&arcid=0007777594&cp=nv,
6025,다비앙,"[2017 한국품질만족도 1위] 차(茶) 전문 브랜드,다비앙","평창다원의다비앙이 10월 18일 서울 청담동 리베라호텔에서 열린 소비자가 뽑은 ‘2017 한국품질만족도 1위’ 시상식에서 식품(차,음료) 부문 1위를 수상했다.다비앙은 평창다원의 차(茶) 전문 브랜드로, 직수입된 우수한 원재료를 별도의 생산라인에서 추가 선별 가공·제조해 더욱 품질을 강화하고 있다....",http://magazine.hankyung.com/business/apps/news?popup=0&nid=01&c1=1007&nkey=2017101899999055254&mode=sub_view,
6025,다비앙,"광동제약, 변비개선 건강기능식품 ‘광동다비앙’ 출시","광동제약은 배변에 도움을 줄 수 있는 건강기능식품 ‘광동다비앙’을 출시했다. ‘광동다비앙’은 1포(80ml)당 식이섬유 6,000mg을 함유하여 원활한 배변활동에 도움을 줄 수 있다. 주원료인 난소화성말토덱스트린 식이섬유 6,000mg은 딸기 15개, 토마토 약 7.5개, 오이 약 7.5개 각각에 해당하는 분량이다....",https://n.news.naver.com/mnews/article/011/0002428383?sid=102,
6025,다비앙,"다비앙, 디자인가구 브랜드 다가구(dagagu) 런칭","거대 가구기업 이케아의 공세로 국내업체들이 몸살을 앓고 있는 이즈음, 국내 온라인 홈오디오 유통 사이트를 운영중인 (주)다비앙(대표이사 이정복)... 한편,다비앙의 대표이사는 ""우리가 조립가구를 생산하는 큰 목적 중 하나는 소비자들이 직접 조립을 함으로써, 생산공정 중에 마지막 단계를...",http://wowstar.wowtv.co.kr/news/view.asp?newsid=54236,
6025,다비앙,"다비앙다가구, 2015 국가소비자중심 브랜드 대상수상",[헤럴드경제 시티팀 = 김연아 기자] ㈜다비앙(대표이사 이정복)의 아름다운 생활도구가 가득한 곳 ‘다가구(DAGAGU)’가 지난 4일 동아일보가 주최하고 산업통상자원부와 한국 브랜드경영협회에서 후원하는 2015 국가소비자중심 브랜드대상(NCDB) 디자인가구 부문에서 대상을 받았다. 다가구는 모던스타일...,http://biz.heraldcorp.com/view.php?ud=201502100949027350749_1,
6025,다비앙,"씨앤에스테크,디지털 셋탑박스 '다비앙' 소니코리아 공급","씨앤에스테크놀로지는 지상파용 HD 디지털 셋탑박스 ""Davian""을 이달초부터 소니코리아에 공급하고 있다고 18일 밝혔다. 이번에 소니에 납품한 셋탑박스는 분리형 디지털 TV를 통해 고화질의 디지털 방송을 시청하려 할 경우 꼭 필요한 필수품으로 소니는 자사의 HD급 프로젝션 TV를 구입하는 고객에게...",https://n.news.naver.com/mnews/article/015/0000578122?sid=101,
