company_id,company_name,news_title,news_text,news_url,posted_at
12674,다보아이앤씨,美 엔비디아·퀄컴·인텔·AMD 등 반도체 관련주 강세…韓 테마주에 외국인은...,"앤씨앤,아이앤씨, DB하이텍, 아이에이, 에이엘티, LX세미콘 주가가 상승했고, 고영, 아진엑스텍, 삼성전자, 시지트로닉스, 아나패스. 주가가... 대덕전자,다보링크, 에이스테크, 피피아이 주가가 하락 마감했다. 통신장비 관련주, 5G(5세대이동통신) 관련주 상승 기가레인 종목이 속한 통신장비...",https://www.pointdaily.co.kr/news/articleView.html?idxno=190250,
12674,다보아이앤씨,"美 방위산업 관련주 '폭락' 韓 테마주에 외국인·기관 다 '물렸다' 퍼스텍, 기...","이미지스, 드림텍, 아진엑스텍, 육일씨엔에쓰, 이엠텍 ,이엠앤아이, 블루콤, LG전자,아이앤씨, 엘엠에스, 인탑스, 하인크코리아, 파트론, 아모그린텍...다보링크, 인텔리안테크, 라이트론, AP위성, 핸디소프트, 우리로, 기산텔레콤, 텔콘RF제약, 자람테크놀로지, RF머트리얼즈, 기가레인, 루멘스, 센서뷰...",https://www.thekpm.com/news/articleView.html?idxno=178643,
12674,다보아이앤씨,"美 방위산업주 강보합, 韓 관련주에 외국인 '팔았다' 빅텍, 에이스테크, 에스...","LG전자,아이앤씨, 토비스, 덕산네오룩스, 액트로, 동운아나텍, 인탑스, 이수페타시스, 아비코전자, 삼성전자, 켐트로닉스, 아모그린텍, 엘엠에스... 루멘스,다보링크, RF머트리얼즈, 서진시스템, 핸디소프트, 빛샘전자, CS, 텔콘RF제약 주가가 상승했고, 이노와이어리스 주가가 보합 마감했다. 한편, 업종...",https://www.thekpm.com/news/articleView.html?idxno=176849,
12674,다보아이앤씨,美 엔비디아·AMD·인텔 등 '급락' 국내 반도체 관련주 외국인·기관 동반 매...,"피에스케이,아이앤씨, SFA반도체, 한미반도체, 테크윙, 앤씨앤, 오디텍, 자람테크놀로지, 칩스앤미디어, 텔레칩스, 케이알엠, 에이디테크놀로지... 우리로,다보링크 주가가 하락중이다. 통신장비, 5G 관련주 약세 기가레인 종목이 속한 5G(5세대이동통신) 관련주는 총 53개 종목으로 업종 평균 0.41...",https://www.thekpm.com/news/articleView.html?idxno=178518,
12674,다보아이앤씨,美 방위산업 테마 '반등' 韓 관련주에 외국인·기관 쌍끌이 매수 '종목' 퍼스...,"하이비젼시스템,아이앤씨, 텔레칩스, 슈피겐코리아, 토비스, 해성옵틱스, 에코볼트, 에이스테크, 다산솔루에타, 레몬, 씨유테크, 노바텍, 아모텍... 반면, 업종 상승에도 파이오링크, 빛샘전자, 센서뷰, 루멘스, 라이콤,다보링크, 유비쿼스, 에치에프알, 이노인스트루먼트, RFHIC, 케이엠더블유...",https://www.thekpm.com/news/articleView.html?idxno=178134,
12674,다보아이앤씨,美 방위산업 테마주 연일 '급락'에 韓 관련주 외국인 거래 '희비' 에이스테크...,"엔터파트너즈,아이앤씨, 나무가, 모베이스, 웰킵스하이텍, 캠시스, 서진시스템, 테이팩스, 피델릭스, 시노펙스, 하이소닉, 유아이엘, 토비스, 엘디티... RF머트리얼즈,다보링크, 인포마크, 라이트론, 알엔투테크놀로지, 피피아이, 센서뷰, 기가레인 주가가 하락중이다. 통신장비, 5G 관련주 약세...",https://www.thekpm.com/news/articleView.html?idxno=177796,
12674,다보아이앤씨,美 방위산업주 '폭락' 국내 테마주에 외국인 연일 매도·매수 '종목' 기가레인...,"케스피온,아이앤씨, 코아시아씨엠, 엠씨넥스, 와이솔, 알에프텍 주가가 상승했다. 한편, 업종 상승에도 제이엔티씨, 서원인텍 주가가 보합... 에이스테크,다보링크, 에치에프알, 아이크래프트, 나무기술, 대덕전자, 삼지전자, 자람테크놀로지, RFHIC, 삼성전자, 서진시스템, 이루온, 기가레인, 텔코웨어...",https://www.thekpm.com/news/articleView.html?idxno=176661,
12674,다보아이앤씨,"美 방위산업주 '폭등' 국내 테마주 '외국인 동향' 에스코넥, 현대로템, 기가레...","서원인텍,아이앤씨, 엑사이엔씨, 와이팜, 한국컴퓨터, 알에프텍, 디스플레이텍, 서진시스템, 앤디포스, 유아이엘, 엘컴텍, 서울반도체, 한솔테크닉스... 한편, 업종 강세에도 LG전자, 쏠리드, 삼성전자, 대덕전자, 이수페타시스, 라이콤,다보링크, 에치에프알, 에이스테크 주가는 하락했다. 기가레인이...",https://www.thekpm.com/news/articleView.html?idxno=176174,
12674,다보아이앤씨,드디어 반등한 5G·통신장비주 '외·기 주식 쓸어 담았다' 기가레인 주가 '반...,"한편, 업종 강세에도 LG전자, 쏠리드, 삼성전자, 대덕전자, 이수페타시스, 라이콤,다보링크, 에치에프알, 에이스테크 주가는 하락했다. △5G, 통신장비... 시노펙스,아이앤씨, 와이팜, 토비스, 한국컴퓨터, 아진엑스텍, 알에프텍, 위니아에이드, 디스플레이텍, 서진시스템, 유아이엘, 테크엘, 슈피겐코리아...",https://www.thekpm.com/news/articleView.html?idxno=176137,
12674,다보아이앤씨,"美 엔비디아·AMD 등 반도체주↓국내 반도체 관련주 디아이, 기가레인, 하나마...","에스코넥, 파인엠텍, 블루콤, 디에이피, 와이솔, 인터플렉스, LG이노텍,아이앤씨, 앤디포스, SBW생명과학, 파인테크닉스, 이엠앤아이, 재영솔루텍... 와이어블,다보링크 주가가 상승했고, 트루윈, 이수페타시스, 이노인스트루먼트, 대덕 종목이 보합 마감했다. 반면, 업종 상승에도 기가레인, 피피아이...",https://www.thekpm.com/news/articleView.html?idxno=173621,
