company_id,company_name,news_title,news_text,news_url,posted_at
523,다에리소프트,다에리소프트'더 스파이크' 4천만 다운로드 기록,"자료제공 -다에리소프트스튜디오 선시안이 개발하고다에리소프트(대표 유다엘)가 서비스하는 '더 스파이크:리마스터드'가 글로벌 4,000만 다운로드를 돌파했다고 19일 밝혔다. '더 스파이크:리마스터드'는 리얼 배구 경기를 재현한 모바일 게임으로, 현장 배구장 사운드와 타격감으로 실제 배구 경기 같은...",https://www.inven.co.kr/webzine/news/?news=289544,
523,다에리소프트,"다에리소프트, 방치형 핵앤슬래시 '잡캐키우기' 정식 출시","다에리소프트(대표 유다엘)는 자사가 직접 개발하고 서비스하는 모바일 방치형 핵 앤 슬래시 RPG(역할 수행 게임) '잡캐키우기'를 모바일 양대 마켓 및 원스토어에 정식 출시했다고 4일 밝혔다. '잡캐키우기'는 다양한 캐릭터와 장비를 수집하고 키워나가는 모바일 방치형 핵 앤 슬래시 RPG 장르로, 제목에서도...",https://game.donga.com/109178/,
523,다에리소프트,다에리소프트‘유니티 런타임 요금 정책’ 대응책 발표,"다에리소프트, 파트너사들에게 추가 지원...퍼블리싱 게임에 부과되는 추가 요금 모두 부담 국내 게임 개발 및 퍼블리싱 전문 기업다에리소프트가 지난 12일 발표된 ‘유니티 런타임 요금 정책’과 관련하여 대응책을 발표하고, ‘유니티 런타임 요금 정책’이 이대로 확정될 경우엔 자사 퍼블리싱 게임에...",https://www.fetv.co.kr/news/article.html?no=147586,
523,다에리소프트,"다에리소프트, 2023년 VIP 파티 개최 ""매년 소중한 파트너분들을 위해 자리 마...","""지난 해에 이어 올해도 저희다에리소프트를 아껴주신 중요한 파트너분들을 모시게되어 기쁩니다. 저번 보다 더 맛있는 음식과 술을 준비하려 노력했고 멋진 공연을 준비했으니 마음껏 즐겨주세요."" 8월 25일 부산 해운대 인근의 체스154에서 열린 다에리 2023 VIP 파티에서,다에리소프트유다엘 대표는 60여...",https://game.donga.com/108664/,
523,다에리소프트,다에리'잡캐키우기' 출시 전 소통 강화,"왼쪽부터다에리소프트의 차보경 아나운서, 임진호 디렉터.다에리소프트가 서비스를 중단한 '잡캐키우기'를 인수한 뒤 재출시 준비에 매진하고 있다. 3일 관련 업계에 따르면,다에리소프트(대표 유다엘)는 최근 모바일게임 '잡캐키우기'를 방송을 통해 유저와 소통하며 향후 서비스 계획을 밝혔다. 이 작품은...",http://www.tgdaily.co.kr/news/articleView.html?idxno=326747,
523,다에리소프트,"다에리소프트VIP 파티 개최 ""소중한 파트너분들에 대한 보답의 자리 마련""","""그동안 저희다에리소프트를 아껴주신 중요한 파트너분들을 모시게되어 기쁩니다. 다양한 음식과 술, 공연을 준비했으니 마음껏 즐겨주시면 감사하겠습니다."" 9월 1일 부산 서면 인근의 AC BAR에서 열린 다에리 VIP 파티에서,다에리소프트유다엘 대표는 60여 명의 다에리 VIP 파트너를 대상으로 환영의 뜻을...",https://game.donga.com/104389/,
523,다에리소프트,"다에리소프트, 네이버웹툰 '99몽', '나혼 뉴비' 게임으로 만든다",다에리소프트(대표이사 유다엘)는 네이버웹툰 '99강화나무몽둥이'와 '나 혼자 만렙 뉴비'의 게임 개발 및 서비스를 통해 IP사업을 강화한다고 발표했다. 네이버웹툰 '99강화나무몽둥이'와 '나 혼자 만렙 뉴비'는 각각 웹툰 시장에서 높은 인기를 누리고 있는 작품이다.다에리소프트는 작품들을 게임으로...,https://www.inven.co.kr/webzine/news/?news=290145,
523,다에리소프트,"다에리소프트, 네이버웹툰 IP 게임 개발 및 서비스로 IP 사업 강화","네이버웹툰 인기작 '99강화나무몽둥이', '나 혼자 만렙 뉴비' 게임화...새로운 IP 게임 사업 영역 확장다에리소프트는 네이버웹툰 '99강화나무몽둥이'와 '나 혼자 만렙 뉴비'의 게임 개발 및 서비스를 통해 IP사업을 강화한다고 발표하였다. 네이버웹툰 '99강화나무몽둥이'와 '나 혼자 만렙 뉴비'는 각각 웹툰...",https://www.fetv.co.kr/news/article.html?no=151558,
523,다에리소프트,"다에리소프트'잡캐키우기', 구글 인기 1위·앱스토어 3위 달성","다에리소프트의 모바일 방치형 핵 앤 슬래시 RPG '잡캐키우기'가 10월 31일 기준 구글 플레이스토어 인기 1위, 애플 앱스토어 인기 3위를 기록했다. '잡캐키우기'는 클래스에 관계 없이 다양한 무기를 착용하고 개성 있게 육성하는 콘텐츠를 제공한다. 유저들은 자신만의 캐릭터를 만들어 나가며, 다양한 무기와...",https://www.khgames.co.kr/news/articleView.html?idxno=220585,
523,다에리소프트,"다에리소프트유다엘 대표 ""10여 종의 신작으로, 방치형 이상의 재미 전할 것...","방치형 RPG '사신키우기'의 흥행으로 게이머들 사이에서 인기 게임사로 등극한다에리소프트가 올해 인기 IP를 활용한 신작과 자체 개발 작품 등 10여 종의 신작 게임을 출시한다.다에리 소프트유다엘 대표는 다양한 확장 및 융합으로 방치형 RPG가 가진 잠재력을 돌파하겠다는 계획이며, 개발사와 다양한 협업...",https://game.donga.com/102388/,
