company_id,company_name,news_title,news_text,news_url,posted_at
4341,다인커뮤니케이션,"픽스다인무브먼트, ‘ICT 어워드 코리아’ 디지털커뮤니케이션부문 통합대상","디지털 UI/UX, 마케팅 그룹 픽스다인무브먼트(이하 픽스다인M)가 미래에셋증권의 모바일트레이딩시스템(MTS)으로 ‘ICT 어워드 코리아 2022’에서 디지털커뮤니케이션통합 대상(경기도지사상)을 수상했다. ICT 어워드 코리아는 한국정보과학진흥협회가 주최하는 국내 최대 규모의 ICT 분야 어워드로, 매년...",http://www.fnnews.com/news/202209021019029045,
4341,다인커뮤니케이션,"벨로다인라이다, 제3회 연례 자율주행 기술 관련 세계 안전성 서밋 발표",벨로다인라이다커뮤니케이션담당 부사장은 ldquo세계 안전성 서밋에는 자율주행 자동차가 이룩할 수 있는 안전성 이점에 관한 관심을 끄는 대화를 촉발할 전문가 발표자들이 대거 참가한다rdquo며 ldquo이러한 의견교환은 정보를 제공할 뿐 아니라 더 안전한 이동성을 실현하기 위한 협력의...,http://robotzine.co.kr/entry/252710,
4341,다인커뮤니케이션,"다인정공, 사내 커뮤니티의 중심인 사보 '툴툴' 창간호 발간","다인정공 사보는다인정공의 임직원들과 고객에게 브랜드 아이덴티티를 전달하고 사내커뮤니케이션역할을 활성화 하기위해 기획되었다. 11월 창간호를 시작으로 연 4회(2月,5月,8月,11月) 계간지 형태로 발간될 예정이다. 또한 메인 타이틀 <툴툴>은 '근심걱정을 모두 툴툴 털어버리자'라는 의미와...",https://www.itbiznews.com/news/articleView.html?idxno=116227,
4341,다인커뮤니케이션,"다인정공, 사내 커뮤니티의 중심인 사보 ’툴툴’ 창간호 발간","(사진=다인정공 SNS 카카오톡 채널)다인정공 사보는다인정공의 임직원들과 고객에게 브랜드 아이덴티티를 전달하고 사내커뮤니케이션역할을 활성화 하기위해 기획되었다. 11월 창간호를 시작으로 연 4회(2月,5月,8月,11月) 계간지 형태로 발간될 예정이다. 또한 메인 타이틀 <툴툴>은 ‘근심걱정을...",http://www.mfgkr.com/archives/23096,
4341,다인커뮤니케이션,"레다게임즈, ""다인플레이 더한 ‘타인은 지옥이다’ 온라인 방탈출 기대해 주...","게임에 펀딩 페이지에서 볼 수 없었던다인플레이 모드가 추가됩니다. 이정환 PD: 스토리 중심의 게임이다 보니 처음에는 조금 회의적이었습니다. 그래서... 배윤성 총괄: 초기 개발이 스토리 중심 게임인 만큼 더 많은 이용자보다는 4~5명 정도가 함께 즐길 수 있는 수준으로 테스트를 해봤고,커뮤니케이션에서...",https://game.donga.com/109712/,
4341,다인커뮤니케이션,"[MI-여성 리더 초대석④] 임수민다인정공 대표 ""모든 회사는 사람이 만든다""","스피디한커뮤니케이션시스템 구축, 인사기획팀 신설, 조직문화 및 HR 개선 등 소통에 대한 투자도 아끼지 않고 있다. 임 대표는 ""첫 술에 배부를 순 없기에 직원들이 필요로 하는 부분을 계속 들으려고 한다""며 ""생산지역, 연구, 영업, 현장 서포트 등 분야를 막론하고다인정공이 키운 인재는 남들보다...",http://www.m-i.kr/news/articleView.html?idxno=1025646,
4341,다인커뮤니케이션,"픽스다인무브먼트, 'ICT 어워드 코리아 2022' 디지털커뮤니케이션통합대상 ...","디지털 UI/UX, 마케팅 그룹 픽스다인무브먼트(이하 픽스다인M)가 미래에셋증권의 모바일트레이딩시스템(MTS)으로 지난 8월 19일 ‘ICT 어워드 코리아 2022’에서 디지털커뮤니케이션통합 대상(경기도지사상)을 수상했다고 2일 밝혔다. ICT 어워드 코리아는 한국정보과학진흥협회가 주최하는 국내 최대...",http://www.etnews.com/20220902000088,
4341,다인커뮤니케이션,"1인 가구,다인가구보다 고도 흡연할 위험 1.5배 높아",1인 가구는다인가구보다 골초(고도 흡연)가 될 위험이 1.5배 높다는 연구결과가 국내에서 나왔다. 25일 한국식품커뮤니케이션포럼은 영남대병원 가정의학과 이근미 교수팀이 2010∼2018년 국민건강영양조사에 참여한 성인남녀 흡연자 7984명을 가구원 수별로 나누고 분석한 결과 이같이 드러났다고 밝혔다....,http://www.datasom.co.kr/news/articleView.html?idxno=122538,
4341,다인커뮤니케이션,"택배 물류, 상하차가다인줄 알았지?...데이터 분석+커뮤니케이션능력 필요","◇물류, 데이터 분석력과커뮤니케이션능력 필요=물류 전문가가 되기 위해서 중요한 직무 역량은 분석력과커뮤니케이션능력이다. 전반적인 물류 시스템을 관리하기 때문에 관련 업무에 대한 포괄적인 지식이 필요하다. 특히 택배는 매우 많은 양의 데이터를 다루는 일이기 때문에 숫자에 대한 감각과...",https://www.sedaily.com/NewsView/1ZAHBIMLY0,
4341,다인커뮤니케이션,"벨로다인라이더, 자동화 기술 및 안전성 관한 디지털 학습 시리즈 진행 발표",벨로다인라이더커뮤니케이션담당 부사장은 ldquo코로나바이러스 팬데믹은 기업계 의료부문 및 정부가 근로자와 일반 대중을 전염병으로부터 안전하게 지키면서 필수적인 서비스를 제공하는 혁신적 방안을 모색하도록 한다 라이더 기능을 가진 로봇이 이러한 위기에 대응하는 중요한 지원을...,http://robotzine.co.kr/entry/250560,
