company_id,company_name,news_title,news_text,news_url,posted_at
9058,동양저축은행,[NW리포트]'우리금융'이 물꼬 튼 M&A…매물 쌓인 보험·저축銀 기대감 ↑,아직 정식 매물은 아니지만 다자그룹의 또 다른 생보사인 ABL생명이 매물로 나와 있는 만큼 보험업계에서동양생명은 잠재 매물로 여겨진다.저축은행업계는 우리금융의 M&A 가속도 소식에 희망을 가지는 모양새지만 최근 PF대출 및 개입사업자 연체율 고공행진 등 건전성 이슈로 단기간에 매각에...,https://www.newsway.co.kr/news/view?ud=2024050916393457787,
9058,동양저축은행,"KDB생명, 보험약관 이해도 평가 1위…웰컴저축銀, '아이사랑 정기적금' 리뉴얼...","웰컴저축은행이 'WELCOME 아이사랑 정기적금'을 최고 연 10%(세전)의 금리 혜택을 제공하는 상품으로 리뉴얼해 출시했다. ⓒ웰컴저축은행웰컴저축銀...동양생명이 지난달 22~26일 전사 '그린 위크(GREEN WEEK)' 캠페인을 전개했다. ⓒ동양생명동양생명, 35번째 창립일 맞아 '그린위크' 캠페인 전개동양생명...",http://www.sisaon.co.kr/news/articleView.html?idxno=160901,
9058,동양저축은행,저축은행예금금리 하락세…실효성도 의문 '사면초가',"이 밖에도 △상상인플러스 △오투 △대백 △대한 △더블 △동양저축은행등도 4%대 정기예금 상품을 판매하고 있다. 아울러 또 다른 방법으로 파킹통장을 활용해 이용자 확보에 열을 올리고 있지만,저축은행업권의 파킹통장은 상품별 금리 제공 조건이 상이해 실효성은 '그닥'이라는 평가다. 실제...",http://www.shinailbo.co.kr/news/articleView.html?idxno=1865403,
9058,동양저축은행,"캐롯, 안전운전시 20% 추가 할인보험 출시…애큐온저축銀, 신용평가모형 개발...","애큐온저축은행CI. ⓒ애큐온저축은행애큐온저축은행, 업계 최초 신용평가모형 개발 애큐온저축은행이 고객의 금융 접근성 확대 및 리스크관리 역량...동양생명 임직원이 창립 35주년을 맞아 적극적인 ESG 경영 실천을 위해 지난 19일 서울시 광진구 뚝섬 한강공원에서 나무 식재 행사를 전개했다. ⓒ동양생명...",http://www.sisaon.co.kr/news/articleView.html?idxno=160581,
9058,동양저축은행,지난해 금융감독원 민원 절반 이상은 보험업권...은행권은 43.8% 급증,"KDB생명, DGB생명, KB라이프생명, 메트라이프생명, 신한라이프, 흥국생명,동양생명, NH농협생명, 한화생명, 미래에셋생명, ABL생명, AIA생명, 삼성생명... 신용카드사,저축은행, 신용정보사, 대부업자 등 중소서민 부문은 2만514건으로 전년 대비 30.6%(4810건) 증가했다. 업종별 비중은 ▶신용카드사(45.4...",http://www.consumernews.co.kr/news/articleView.html?idxno=704343,
9058,동양저축은행,정기예금 최고금리 역전됐다 지방은행보다 낮은저축은행,"저축은행의 경우 대백·더블·드림·머스트삼일·민국·유니온·조은·CK저축은행의 정기예금 최고우대금리가 연 4.00%였고동양·바로·예가람저축은행은 연 3.95%, 남양·대한·동원제일·상상인플러스·아산·우리금융·조흥·청주·한성·흥국·JT·MS저축은행은 연 3.90%였다.은행권에선 지방은행들이...",http://www.smedaily.co.kr/news/articleView.html?idxno=288099,
9058,동양저축은행,[단독]저축은행부동산 PF 대출 65% 리스크 노출,"상위 10위권 밖의저축은행중에서는 모아저축은행의 연체 규모가 71.6%로 나타났고,동양저축은행79.1%, 안국저축은행80.1%로 높게 나타났다. 부동산 PF 대출 연체는 건설·부동산의 경기 침체 영향이다. 건설·부동산 업계는 고물가, 고금리, 고환율 등으로 인한 분양가 및 원자재가격 상승 등의 영향이다....",https://www.news1.kr/articles/5389567,
9058,동양저축은행,정기예금 4월 브랜드평판 1위는 농협은행,"2024년 4월 빅데이터 분석한 정기예금 브랜드는 30위권 금융사 외에 국제저축은행, 한화저축은행, IBK저축은행,동양저축은행, BNK저축은행, 애큐온저축은행, 스타저축은행, 모아저축은행, 더케이저축은행, 참저축은행, 대신저축은행, 키움예스저축은행, 인천저축은행, 예가람저축은행, 청주저축은행...",http://www.joseilbo.com/news/news_read.php?uid=515250&class=18&grp=,
9058,동양저축은행,[인사종합] SK증권·국가철도공단·동양생명 등,SK증권 ◇MS저축은행▲대표이사 최창훈 ▲기업문화본부장 윤성필 ■ 한국과학기술연구원 ▲전북분원 복합기술소재연구소 분원장 최원국... 장동삼 ■동양생명 ◇임원 전보▲CCO(Chief Consumer Officer) 서혜연 ▲COO(Chief Operations Officer) 원진희 ▲B2B 부문장 안준영 ▲BA영업본부장 이호태 ▲GA영업2본부장...,https://www.safetimes.co.kr/news/articleView.html?idxno=213815,
9058,동양저축은행,"제이씨원 전자계약서비스 이싸인온,동양저축은행에 공급 중",제이씨원(대표 신종호)는 자사의 전자계약 서비스 이싸인온을동양저축은행에 공급해 적용 중이라고 26일 밝혔다. 제이씨원에 따르면 최근 금융권에서 지속가능한 기업 경영을 달성하기 위해 필요한 3가지 핵심 요소인 ESG(환경·사회·지배구조)가 선택이 아닌 필수 요소가 되고 있고저축은행에서도 전자계약...,https://www.dt.co.kr/contents.html?article_no=2023122602109923088002&ref=naver,
