company_id,company_name,news_title,news_text,news_url,posted_at
7662,드림포스,[PMPS] 매운맛 장착 완료! '농심 레드포스' GF 2일차 첫 '치킨',끝까지 풀 스쿼드를 유지한 농심 레드포스는 마지막 치킨 경쟁에서 이엠텍 스톰엑스를 꺾고 12킬 포인트를 추가해 4위로 올랐다. 매운맛 교전을 보인 '비니'는 4킬 730대미지로 MOM에 선정됐다.11일 배틀그라운드 모바일 프로 시리즈(이하 PMPS) 2024 시즌1 그랜드 파이널 경기가 대전 이스포츠 경기장드림...,https://www.asiatoday.co.kr/view.php?key=20240511001543431,2024-05-11 16:21
7662,드림포스,"드림텍 주가 기세등등... ""기업가치에 비해 지나치게 빠졌다""","드림텍, 인탑스, 영풍, 이엠텍, KH바텍, 하이비젼시스템, 엠씨넥스, 세경하이테크, 코아시아, 파트론, 유티아이, 에스코넥, 나무가, 하인크코리아, 아이엠, 와이솔, 엘컴텍, 슈피겐코리아, 이랜텍, 노바텍, 덕우전자, 캠시스, 우주일렉트로, 이미지스, 아모텍, 디케이티, 알에프텍, 와이팜, 아모센스, 앤디포스...",https://www.pinpointnews.co.kr/news/articleView.html?idxno=263138,
7662,드림포스,[핸드셋 상장기업 브랜드평판] 1위드림텍·2위 인탑스·3위 영풍,"앤디포스순이었다. 1위드림텍 브랜드는 참여지수 225,261 미디어지수 206,262 소통지수 199,614 커뮤니티지수 268,052 시장지수 1,397,422 사회공헌지수 47,123이 되면서 브랜드평판지수 2,343,734로 분석됐다. 지난 3월 브랜드평판지수 2,282,623과 비교해보면 2.68% 상승했다.​ 2위 인탑스 브랜드는...",https://www.gukjenews.com/news/articleView.html?idxno=2972807,
7662,드림포스,"[브랜드평판] 핸드셋 상장기업 2024년 4월 빅데이터 1위드림텍, 2위 인탑스,...","앤디포스순이었다. 핸드셋 상장기업 브랜드평판 1위를 기록한드림텍 브랜드는 참여지수 225,261 미디어지수 206,262 소통지수 199,614 커뮤니티지수 268,052 시장지수 1,397,422 사회공헌지수 47,123이 되면서 브랜드평판지수 2,343,734로 분석됐다. 지난 3월 브랜드평판지수 2,282,623과 비교해보면 2.68...",https://www.cbci.co.kr/news/articleView.html?idxno=465304,
7662,드림포스,[비바 2080] 창업 성공 CEO에게서 배운다...'세일즈포스' 마크 베니오프,◇ ‘커뮤니티의 힘’을 믿다세일즈포스는 2003년부터 매년 가을에 90개 나라에서 17만 명의 직원과 가족들을 샌프란시스코의 ‘드림포스’ 현장으로 나흘 동안 초대한다. 세일즈포스의 가장 큰 고객 이벤트이자 가장 대규모로 이뤄지는 사회환원 이벤트다. 이 자리에서 베니오프는 세일즈포스의 회사 및...,https://www.viva100.com/main/view.php?key=20240326010008321,
7662,드림포스,"[사진]NCT드림런쥔,'귀공자포스'",19일 오전 그룹 엔시티드림(NCT DREAM)이 SM타운 도쿄 콘서트 일정을 위해 일본 도쿄로 출국했다. 엔시티드림런쥔이 출국장으로 향하고 있다. 2024.02.19,http://www.osen.co.kr/article/G1112277829,
7662,드림포스,[‘드림포스2023’에 가다] (1) ‘Trusted AI’ 향한 세일즈포스의 도전,"글로벌 CRM 기업 세일즈포스가 연례행사드림포스에서 새로운 꿈을 강하게 피력했다. 마크 베니오프 세일즈포스 CEO는 ‘신뢰받는 인공지능(trusted AI)’을 수차례 강조하며 “AI의 열반에 도달하고 싶다”고 포부를 드러냈다. 2분기 실적 발표 콘퍼런스콜이 끝난 지 2주도 안 된 시점에, 세일즈포스...",http://jmagazine.joins.com/forbes/view/338477,
7662,드림포스,[‘드림포스2023’에 가다] (2) 존 쿠세라 세일즈포스 AI PM 수석부문장,세일즈포스는 올해드림포스에서 아인슈타인 원 코파일럿 스튜디오와 아인슈타인 트러스트 레이어 등 기업용 AI 기술을 대거 선보였다. 전 세계의 모든 산업군에 기업 맞춤형 AI 솔루션을 제공하겠다는 방침이다. 신속성과 보안성은 기본 중의 기본이다. 글로벌 CRM(고객관계관리) 클라우드·소프트웨어...,http://jmagazine.joins.com/forbes/view/338478,
7662,드림포스,"군산 현대중공업 사내협력사,드림스타트 아동‘책가방’후원","이날 현대중공업 사내협력회사 협의회 업체 중 9개 업체 ((유)에스티엠 김영훈 대표, 신화ENG 송정훈 대표, ㈜선영테크 유효석 대표, ㈜백산HD 김영민 대표, ㈜선명ENG 박동석 대표, ㈜서해테크 이영섭 대표, ㈜강민 문대길 대표, ㈜보원 강보상 대표, ㈜현대포스문현식 대표)는드림스타트 대상 중 예비 중등...",http://www.shinailbo.co.kr/news/articleView.html?idxno=1819558,
7662,드림포스,"대유플러스·태영건설우·비엘팜텍 등 6종목 상한가, 비트컴퓨터·에코앤드림...","반면 현대차 -2.86%, 기아 -1.90%, 카카오 -1.81%, 삼성SDI -1.19%, NAVER -1.18%, 삼성전자우와 셀트리온이 각 1.16%, LG에너지솔루션 -0.66%, 삼성전자 -0.13% 하락했다.이밖에 비트컴퓨터 25.97%, 에코앤드림24.68%,포스뱅크 19.91%, GST 17.34%, HLB생명과학 16.52%, 인터플렉스 13.60%, 미래에셋생명 13.10...",https://www.yeongnam.com/web/view.php?key=20240130001548062,
