company_id,company_name,news_title,news_text,news_url,posted_at
4574,만사시스템,“10년 뒤 한국 첨단칩 생산 3분의 1로 추락” 충격적 보고서 [김민지의 칩만...,"2032년 한국은 파운드리를 포함한 최첨단시스템반도체 생태계에서 조연으로 남을 수밖에 없는 걸까요? 오늘 칩만사에서 알아보겠습니다. 첨단 반도체 생산 31%→9% ‘뚝’…“미국·유럽·일본, 빈자리 채울 것” 미국반도체산업협회(SIA)와 보스턴 컨설팅 그룹(BCG)의 최근 보고서에 따르면, 한국은 2032년...",https://news.heraldcorp.com/view.php?ud=20240510050734,2024-05-11 09:03
4574,만사시스템,[오동진 영화만사] 고래 보호와 스크린 보호가 같은 맥락인 이유,"자본주의 경제구조, 특히 양극화의 심화를 조성하는 신(新)자유주의시스템에서 기업이나 특정 개인의 이윤 추구 행위를 법적으로나,시스템상으로나, 무엇보다 도덕이나 윤리적으로 재단할 수 없다. 아무리 도덕 연 한다 해도 모두들 자본의 이윤, 금융상의 이해 관계에서 벗어날 수 없다. 극장들이 너도 나도...",https://isplus.com/article/view/isp202405080031,
4574,만사시스템,"특별승진제 논란에 이재준 수원시장 ""인사혁신시스템만들겠다""","이 시장은 2일 오전 시 공직자들에게 '인사가만사입니다'라는 제목의 전체 메일을 보냈다. 이 시장은 해당 메일에서 ""자녀 같은 신규 공직자의 의원면직... 그는 해당 메일에서 자치단체장으로서 시정 운영에 대한 고민과 이를 인사시스템을 통해 개선하려는 의지를 전달했다. 이 시장은 이러한 인사개혁을...",https://www.newsis.com/view/?id=NISX20240502_0002721036&cID=14001&pID=14000,
4574,만사시스템,“의지·열정·끈기로 꼭 해내겠다” 이재용의 외침…삼성 ‘1등 꿈’ 실현 가...,"그 안의 말랑말랑한 비하인드 스토리부터 촌각을 다투는 트렌드 이슈까지, ‘칩만사’가 세상만사전하듯 쉽게 알려드립니다. “메모리에 이어 파운드리를 포함한시스템반도체 분야에서도 확실한 1등을 하도록 하겠습니다. 굳은 의지와 열정, 그리고 끈기를 갖고 꼭, 해내겠습니다.”(이재용 삼성전자...",http://news.heraldcorp.com/view.php?ud=20240429050710,
4574,만사시스템,[최준영의 세상만사<19>] 일본의 오커스 참여…AI 등 첨단 기술 기반 군사 혁...,대신 필라 2에 포함되는 국가는 미국이 주도하는 개방형시스템아키텍처에 따라 신규 무기를 제작·개량함으로써 미국과의 합동작전 능력을 향상해야 한다는 조건이 있다. 또한 지휘·통제 부문에 있어서도 상호 운용성을 높여 미군이 동맹국과 공동작전을 전개하는 데 있어 장애물이 없도록 해야 한다는 전제...,https://economychosun.com/site/data/html_dir/2024/04/19/2024041900001.html,
4574,만사시스템,“보여줄게 완전히 달라진 나~” 삼성 반도체 올해 첫 성적표에 기대감 ↑ [김...,"그 안의 말랑말랑한 비하인드 스토리부터 촌각을 다투는 트렌드 이슈까지, ‘칩만사’가 세상만사전하듯 쉽게 알려드립니다. 삼성전자가 오는 30일에 1분기 실적을 발표합니다. 이날은 이재용 회장이 ‘2030년시스템반도체 1위’에 오르겠다고 발표(2019년 4월 30일)한지 5주년이 되는 날입니다....",http://news.heraldcorp.com/view.php?ud=20240426050688,
4574,만사시스템,"“파운드리는 과잉, HBM은 협공” 한치 앞 모를 AI전쟁 삼성 ‘셈법복잡’ [김...","‘칩(Chip)만사(萬事)’ 마냥 어려울 것 같은 반도체에도 누구나 공감할 ‘세상만사’가 있습니다. 불안정한 국제 정세 속 주요 국가들의 전쟁터가 된... SK하이닉스는 메모리만 양산하기 때문에 TSMC와 경쟁관계가 아니지만, 삼성전자는 메모리와 파운드리, 그리고시스템LSI까지 모두 하고 있는 IDM...",http://news.heraldcorp.com/view.php?ud=20240419050688,
4574,만사시스템,"아크시스템웍스, PS4 & NS '라이브러리 오브 루이나' 한국어판 25일 출시",만사귀찮아하는 성격에 무기력한 청년. 어질러진 책더미 속에서 누워있는 모습이 종종 보일 때가 있다. - 총 플레이 타임 100시간이 넘는 풍성한 볼륨! 카드와 주사위를 융합한 ‘도서관 배틀 시뮬레이션’시스템① 손님의 정보를 확인하고 전략을 구상하라 '라이브러리 오브 루이나'에서는...,http://gamefocus.co.kr/detail.php?number=155460,
4574,만사시스템,[세상만사] 이제 소통과 타협의 정치가 필요하다.,"그 결과 국가체계를 지탱하고 있는 제도적 장치와 행정관료시스템이 제대로 작동되지 않았고 국가자원의 배분이 민주적이지 않았음을 드러내고 있다. 그러므로 우리 사회는 사회의 제반 분야에서 총체적인 위기상황을 맞이하게 됐으며, 이를 극복하기 위한 대혁신과 해결책이 요구되고 있다. 이처럼 국가의...",https://www.kgnews.co.kr/news/article.html?no=790411,
4574,만사시스템,[세종만사] 3월 물가 성적표 앞둔 물가당국 '긴장',"O…차세대 R&D 통합 행정시스템불만 과학기술정보통신부가 범부처 연구개발(R&D)시스템을 차세대 R&D 통합 행정시스템으로 바꾸면서 연구자들 원성이 커지고 있다고. 연구 성과 등을 입력해야하는데시스템안내가 미흡해 제때 제출하지 못하는 일이 발생하고 있다고. 행정부에선 각 부처, 기관들에 전체 R&D...",https://www.etnews.com/20240329000244,
