company_id,company_name,news_title,news_text,news_url,posted_at
12199,메가스터디(주),"서초메가스터디기숙학원, ‘2025 반수시작반’ 개강 및 대학생 특별장학 시...",메가스터디교육 직영 서초메가스터디기숙학원이 6월 22일 ‘2025 반수시작반’을 개강한다. 이번 ‘2025 반수시작반’은 6월 22일부터 11월 14일 수능일까지 약 4개월 반 기간 동안 수능 준비에 꼭 필요한 최적화된 필수 수업과 함께 학생 수준에 맞는 다양한 자율선택 수업을 제공해 실력 향상을 도모한다. 입학...,http://www.edaily.co.kr/news/newspath.asp?newsid=02072966638887608,2024-05-10 10:53
12199,메가스터디(주),[교육서비스 브랜드평판] 1위메가스터디·2위 대교·3위 웅진씽크빅,"메가스터디교육 로고 교육서비스 상장기업 브랜드평판 2024년 5월 빅데이터 분석결과, 1위메가스터디교육 2위 대교 3위 웅진씽크빅 순으로 분석되었다. ​ ​한국기업평판연구소는 국내 교육서비스 상장기업에 대한 브랜드 빅데이터 평판분석을 하였다. 2024년 4월 9일부터 2024년 5월...",https://www.gukjenews.com/news/articleView.html?idxno=2989543,
12199,메가스터디(주),[2025 5월학평] 등급컷메가스터디발표.. 국130점 수140점,"메가스터디가 발표한 8일 오후 7시1분 기준 2025 5월학평(2024년 5월 모의고사) 표준점수 기준 예상 1등급컷은 국어 130점, 수학 140점이다. 2등급컷은 국어 125점, 수학 129점으로 봤다. 선택과목에 따라 원점수 컷은 차이가 있을 수 있다. 원점수 컷은 공통+선택과목 조합에 따라 바뀔 수 있으므로 특정...",http://www.veritas-a.com/news/articleView.html?idxno=503492,
12199,메가스터디(주),"[Daily New유통] GS25, SPC 파스쿠찌, 달바 外","◇메가스터디교육, 초록우산 어린이재단 기부메가스터디교육이 고등학생 등 수험생 회원이 참여한 기부 선행 이벤트를 통해 조성한 기부금을 아동복지 전문기관인 초록우산 어린이재단에 기부했다.메가스터디교육은 지난 2월 20일부터 3월 11일까지 고등 인터넷강의를 제공하는메가스터디사이트에서...",https://biz.newdaily.co.kr/site/data/html/2024/05/10/2024051000039.html,2024-05-10 10:53
12199,메가스터디(주),"메가공무원, 2025 9급 공무원 국어/영어 기본 이론 강좌 특별 기획전 진행… ...","메가스터디교육의 공무원 시험 전문 브랜드 '메가공무원'이 2025 9급 공무원 국어, 영어 과목의 출제기조 전환 대비 기본 이론 강의 특별 기획전을 진행한다고 밝혔다. 개편되는 2025 9급 공무원시험은 공무원 직무에서 요구하는 수준의 '실용적 사고력'을 기르는 것이 중요하다. 그동안의 시험은 지식 암기...",https://www.lecturernews.com/news/articleView.html?idxno=152112,2024-05-10 10:53
12199,메가스터디(주),"고3 5월 모의고사(모평) 예상 등급컷 발표, 국어 130점 등","이런 가운데 5월 모평에 대한 분석이메가스터디와 이투스로부터 각각 발표됐다. 양대 교육 기관은 이번 모의고사의 표준점수 기준 예상 등급 컷을 제시하며, 학생들의 관심이 집중되고 있습니다.메가스터디에 따르면, 1등급 컷은 국어 130점, 수학 140점으로 설정되었습니다. 반면, 2등급 컷은 국어...",https://www.gukjenews.com/news/articleView.html?idxno=2989104,
12199,메가스터디(주),"메가스터디학원, ‘수(秀) 모의고사’ 무료 체험 프로모션 진행","메가스터디학원이 ‘수(秀) 모의고사 무료 체험’ 프로모션을 진행한다고 밝혔다. 2025 대입에 도전하는 고3 수험생 및 N수생이라면 예약 신청을 통해, 재원생에게 제공하는 해당 프로모션을 무료로 체험할 수 있다. 서초메가스터디학원 의약학전문관에서 오는 11일에 진행되는 ‘수(秀) 모의고사 무료...",http://www.wowtv.co.kr/NewsCenter/News/Read?articleId=A202405030129&t=NN,
12199,메가스터디(주),"메가스터디교육, 1분기 영업익 202억…전년 대비 16% 감소",메가스터디교육이 202억원의 영업이익을 기록했다. 지난해 동기 대비 16.2% 감소한 수치다.메가스터디교육은 3일 공시를 통해 2493억원의 매출을 올렸다고 밝혔다. 매출액은 같은 기간 2.8% 증가한 반면 당기순이익은 163억원으로 14% 감소했다.메가스터디교육은 2015년메가스터디에서 중고등...,https://www.bloter.net/news/articleView.html?idxno=615835,
12199,메가스터디(주),[골든크로스 종목] 이엔플러스·코웨이 등 주가 상승…SM C&C·메가스터디주...,"SM C&C 주가는 전 거래일 대비 0.97% 하락한 2050원,메가스터디주가는 전 거래일 보다 0.18% 내린 1만1240원에 거래를 마쳤다. 한편 골든크로스는 단기(20일) 이동평균선이 장기(60일) 이동평균선을 돌파하는 경우의 종목이다. 이는 단기 주가이동평균선이 중장기이동평균선을 아래에서 위로 뚫고 올라가는 것을...",https://www.pointdaily.co.kr/news/articleView.html?idxno=200498,
12199,메가스터디(주),"메가스터디교육, 4거래일 연속 하락 '행진'...외국인도 순매도 전환",메가스터디교육 주가가 4일 연속 하락했다. 8일 한국거래소에 따르면메가스터디교육 주가는 전날 5만6400원에 마감하면서 지난 3일 종가 5만9600원과 비교해 5.37%(3200원) 하락한 것으로 나타났다.메가스터디교육의 시가총액도 하루동안 374억원 감소해 6596억원을 기록했다. 이날...,https://www.pinpointnews.co.kr/news/articleView.html?idxno=264131,
