company_id,company_name,news_title,news_text,news_url,posted_at
6956,메디캐스트,바이오·건강 스타트업 육성 플랫폼 '메디오픈랩' 개소,"약 100명을 수용할 수 있는메디오픈랩에는 스파크랩이 투자한 진캐스트, 이노제닉스, 제노플랜 등이 입주를 확정했다.메디오픈랩은 현재 입주기업 8개사를 추가로 모집 중이다. 바이오·헬스 관련 분야 기업을 대상으로 하며 혈액 테스트를 기반으로 하는 암 조기 진단법 '액체 생검'(liquid biopsies)과 정밀 의료...",https://www.yna.co.kr/view/AKR20240416111400017?input=1195m,
6956,메디캐스트,"제약협동조합, 키메디와 '키캐스트' 활용 업무협약","여기에 키캐스트를 활용할 경우 기존 키메디플랫폼과 연계해 퀴즈·리서치·라이브 웨비나·오프라인 행사 등 통합적인 마케팅이 가능하다고 한다. 조용준 이사장은 ""중소, 중견 제약사들의 마케팅에 대한 중요성은 이전부터 인식하고 있었으나, 비용에 대한 부담으로 적극적으로 진행하지 못하고 있다는...",http://www.bosa.co.kr/news/articleView.html?idxno=2216893,
6956,메디캐스트,"키메디, 제약협동조합과 동영상 홍보 플랫폼 '키캐스트' 업무협약",키캐스트는 키메디가 내놓은 새로운 방식의 동영상 홍보 플랫폼으로 HCP를 대상으로 홍보 마케팅을 진행하고 싶은 제약 바이오 기업들이 저렴한 비용으로 고객과 만날 수 있도록 돕는다. 특히 기존 제약 바이오산업의 주요한 온라인 마케팅 수단이었던 웨비나와 비교해 제품·서비스의 판매 포인트를 직접...,https://www.rapportian.com/news/articleView.html?idxno=203699,
6956,메디캐스트,"키메디, HCP 동영상 홍보 플랫폼 '키캐스트' 론칭","김명진 키메디대표는 ""키캐스트를 통해 새로운 온라인 마케팅 플랫폼의 첫발을 대딛게 되었다""며 ""향후 라이브커머스, 크라우드 펀딩, 블록체인 및 메타버스 등 다양한 분야에서 키캐스트를 활용할 수 있도록 고도화할 예정""이라고 말했다.",http://www.bokuennews.com/news/article.html?no=239923,
6956,메디캐스트,"휴온스메디텍,메디허브와 '아이젝(URO)' 독점 공급계약 체결",휴온스메디텍은 아이젝과 남성용 필러인 더블로필을 필두로 비뇨기과 제품 라인업을 한층 강화해 나갈 계획이다. 휴온스메디텍은 아이젝을 이용해 남성 음경 확대 시술 시 필러를 정량에 맞게 정밀 주입할 수 있어 시술 편의성은 물론 환자 만족도 또한 높일 수 있는 장점이 있다고 설명했다. [시사캐스트],http://www.sisacast.kr/news/articleView.html?idxno=53825,
6956,메디캐스트,"한국제약협동조합, 키메디와 MOU 체결","나아가 키캐스트를 통한 마케팅 활동은 기존 키메디플랫폼과 연계해 퀴즈 · 리서치 · 라이브 웨비나 · 오프라인 행사 등 통합적인 풀스케일 마케팅으로 그 효과를 극대화할 수 있다. 조용준 이사장은 “중소, 중견 제약사들의 마케팅에 대한 중요성은 이전부터 인식하고 있었으나, 비용에 대한 부담으로...",http://www.whosaeng.com/150251,
6956,메디캐스트,"'K-OTC 상장 예정' 세렌메디, 업계 최고메디칼 디바이스 전문기업 목표","권하림 선수는 ""선수로서 부상을 당했을 때 세렌메디의 엑스캐스트제품을 사용하면서 기존 석고 깁스와는 차별되게 훈련하는데 지장이 없었고 탈부착이 가능해 수영과 샤워가 자유로웠다""며 ""무엇보다도 투박하지 않고 트랜디하게 보여 의료기기임에도 불구하고 선수들이 선수촌 내에서 제품에 대해...",http://www.newstomato.com/ReadNews.aspx?no=1145189&inflow=N,
6956,메디캐스트,[오전 주요 국제금융뉴스] (7일),"6일(현지시간) 뉴욕타임스(NYT)에 따르면 미국 은퇴 연금인 사회보장(Social Security)과메디케어(Medicare)는 더 많은 근로자가 노동시장에 참여함에... 7일(현지시간) 호주파이낸셜리뷰(AFR)에 따르면 모엘리스는 MA 파이낸셜의 팟캐스트에 출연해 ""백악관 입성 경쟁에서 도널드 트럼프가 선두""라며...",https://news.einfomax.co.kr/news/articleView.html?idxno=4308591,
6956,메디캐스트,[코스닥 공시] 알티캐스트/ 코렌 /메디포스트,◇알티캐스트＝1분기 영업이익 46억원으로 전년 동기비 8.9% 증가. 매출액(168억원) 6.2% 증가. ◇코렌＝1분기 영업이익 11억원으로 전년 동기비 39.6% 증가. ◇메디포스트＝미국 특허청으로부터 연골분화 능력이 우수한 줄기세포 선별방법에 관한 특허 취득. [매일경제 모바일 서비스 | 페이스북] [매일경제...,http://news.mk.co.kr/news_forward.php?domain=news&no=753421&year=2014,
6956,메디캐스트,"환인제약, 우울증 치료제 에스시탈로프람정 일본 PMDA 품목 허가 획득 外","나아가 키캐스트를 통한 마케팅 활동은 기존 키메디플랫폼과 연계해 퀴즈ㆍ리서치ㆍ라이브 웨비나ㆍ오프라인 행사 등 통합적인 풀스케일 마케팅으로 그 효과를 극대화할 수 있다는 것이 조합측의 설명이다. 조용준 이사장은 ""중소, 중견 제약사들의 마케팅에 대한 중요성은 이전부터 인식하고 있었으나...",http://www.newsmp.com/news/articleView.html?idxno=239412,
