company_id,company_name,news_title,news_text,news_url,posted_at
12136,메디칼뉴스,[하나證 주간추천주]LG이노텍·금호석유·제이시스메디칼,"(사진=연합뉴스) △금호석유(011780) -최근 천연고무 가격 상승에 따른 합성고무 실적 개선 전망. -기업 밸류업 프로그램에 따른 주주환원책도 긍정적. △제이시스메디칼(287410) -HIFU, RF 등 다양한 에너지원 기반의 미용 의료기기 업체. -파트너사 다변화로 실적 성장, 믹스 개선 시 수익성 개선 전망",http://www.edaily.co.kr/news/newspath.asp?newsid=01289046638885640,
12136,메디칼뉴스,"[게시판] 한미약품·메디칼필하모닉, 장애아동 기금 2천600만원 전달","▲ 한미약품은 서울의대 출신 의사들로 구성된메디칼필하모닉 오케스트라(MPO)와 함께 '빛의 소리 나눔 콘서트'를 통해 조성한 '빛의 소리 희망 기금... MPO는 매칭펀드 형식으로 2013년부터 지금까지 3억5천200여만원의 기금을 조성, 장애 아동과 청소년의 문화예술활동을 지원하고 있다. (서울=연합뉴스)",https://www.yna.co.kr/view/AKR20240416107300017?input=1195m,
12136,메디칼뉴스,[위기를 기회로] ⑥ 선진국 의존하던 의료기기 기술독립 이끈 성원메디칼,"(청주=연합뉴스) 김형우 기자 = ""위기가 있어야 기업은 성장합니다."" 12일 청주시 흥덕구 강내면 성원메디칼본사에서 만난 이대희 대표는 최근 의대 정원을 둘러싼 정부와 의료계의 갈등을 언급하며 이렇게 말했다. 대형 상급 병원들이 수술을 축소하면서 입원이나 수술환자가 급감했고, 성원메디칼이 생산하는...",https://www.yna.co.kr/view/AKR20240411158400064?input=1195m,
12136,메디칼뉴스,"[IB토마토]제이시스메디칼, 미 기업 지분 인수하지만…자본잠식 '숙제'",뉴스토마토 = 김혜선 기자 | 이 기사는 2024년 04월 8일 18:00 IB토마토 유료 페이지에 노출된 기사입니다. 제이시스메디칼(287410)이 국내 뿐만 아니라 해외 법인 호실적이 이어지면서 영토 확장에 나서는 모습이다. 최근 미국 의료기기 제조기업 지분 매입에 앞서 대규모 차입금 조달까지 감내했다. 다만...,http://www.newstomato.com/ReadNews.aspx?no=1226407&inflow=N,
12136,메디칼뉴스,"JW메디칼, 초음파 진단기기 사업 공식 파트너사 모신다...모집 완료시까지","jw메디칼CI 라이센스뉴스= 김준서 기자 | JW메디칼은 국내 초음파 진단기기 사업 확대를 위해 공식 파트너사를 공개 모집한다고 28일 밝혔다. 모집 대상은 수도권 일부와 강원, 인천 지역 내 초음파 진단기기 영업 업무를 수행할 기업이다. JW메디칼은 사업 경쟁력 강화와 네트워크 확대를 함께할 유능한...",https://www.lcnews.co.kr/news/articleView.html?idxno=70259,
12136,메디칼뉴스,"JW메디칼, 초음파 영상진단기기 '아리에타 750 딥인사이트' 출시","아리에타 750 딥인사이트 (제공=JW메디칼) ©열린뉴스통신ONA JW메디칼은 고해상도 이미지 구현 기술이 접목된 초음파 영상진단기기 '아리에타 750 딥인사이트(ARIETTA 750 DeepInsight, 이하 AR750DI)'를 출시했다고 22일 밝혔다. 일본 후지필름이 개발한 AR750DI는 기존 초음파 영상진단기기 '아리에타 750'에...",https://www.onews.tv/news/articleView.html?idxno=198307,
12136,메디칼뉴스,"[포토뉴스]원주 씨유메디칼시스템, 코레일에 자동심장충격기 기증",씨유메디칼시스템은 최근 원주 본사 대회의실에서 한국철도공사(코레일)에 원격관리시스템이 장착된 최신형 자동심장충격기(AED) 200세트를 기증한 데 이어 철도이용객의 생명·안전을 지키기 위한 업무협력 방안에 대해 협의했다. 이 업체는 중앙에서 실시간으로 통제 관리할 수 있는 중앙관제시스템(RMS)...,https://www.kwnews.co.kr/page/view/2024012318112438650,
12136,메디칼뉴스,"JW메디칼, 이동형 엑스레이 'DRX라이즈' 선봬","JW메디칼은 영상 진단 분야에 집중하는 JW중외제약 계열사다. 초음파진단장치, 디지털 엑스레이, CT, MRI 등 글로벌 프리미엄 혁신 장비 일체를 국내에 공급한다. 2020년 미국 케어스트림 헬스와 계약을 맺고 케어스트림 헬스가 개발한 영상 진단 기기를 국내에 독점 판매하고 있다. KPI뉴스",https://www.kpinews.kr/newsView/1065588971040426,
12136,메디칼뉴스,[상한가 보드] 티와이홀딩스우 SK이터닉스 상한가 기염...대양제지 이베스트투...,이날 하한가 종목은 나오지 않았다. 코스피는 상승했으나 코스닥은 하락세로 마감했다. 티와이홀딩스우는 3거래일 연속 상승그래플 그린 바 있다. 세종메디칼은 정말 오랜만에 상승을 보여줘 눈길을 끌기도 했다. ▮ CBC뉴스ㅣCBCNEWS,https://www.cbci.co.kr/news/articleView.html?idxno=463064,
12136,메디칼뉴스,"제51회 상공의 날, 성원메디칼(주) 이대희 대표이사 국무총리 표창","성원메디칼㈜ 이대희(사진) 대표이사가 국무총리 표창을 수상했으며, 주식회사 제이에이치씨 김병선 대표이사... discovers people of merit who have contributed to local economic growth and development. I recommend it. 원본 기사 보기:충북 브레이크뉴스",http://www.breaknews.com/1022114,
