company_id,company_name,news_title,news_text,news_url,posted_at
14100,메드파크,"메드파크, 두바이 Arab Health와 AEEDC 2024 참가","재생의학 토탈 솔루션' 기업 '메드파크(대표 박정복)'가 오는 1월29일부터 2월1일까지 아랍에미리트 두바이 월드 트레이드 센터에서 열리는 의료기기 전시회 '아랍헬스(Arab Health) 2024 전시회'에서 Bone(뼈), Skin(스킨), Collagen(콜라겐), Human Soft Tissue(인체조직)에 이르는 재생의학 전 분야의...",http://www.doctorstimes.com/news/articleView.html?idxno=225739,
14100,메드파크,"메드파크, 유럽 임플란트 학회 참가",﻿﻿ ﻿재생의학 기업메드파크(대표 박정복)가 오는 9월 28일부터 30일까지 3일간 독일 베를린에서 열리는 유럽 최대 임플란트 학회 'EAO Berlin 2023'에 참가한다.메드파크는 이번 EAO 2023 참가를 통해 유럽시장에서 이미 검증된 골이식재 제품인 'S1'을 소개한다. 특히 다양한 임상 증례를 통해 기존...,https://www.dailymedi.com/news/news_view.php?wr_id=902771,
14100,메드파크,"메드파크, 치과 전시회서 골이식재 소개",﻿﻿재생의학 전문기업메드파크(대표 박정복)가 최근 서울 코엑스에서 열린 'SIDEX 2023'에서 골이식재 ‘S1’을 소개했다. SIDEX는 서울시치과의사회가 주최하는 국내 최대 규모의 치과 기자재 전시회다. 올해로 20회를 맞이했으며 1만4000여 명의 참관객이 참여했다.메드파크는 이번 행사에서 제품 소개와...,https://www.dailymedi.com/news/news_view.php?wr_id=898582,
14100,메드파크,"메드파크, SIDEX 전시부스서 특강 및 핸즈온","국내외 유명연자 총출동, 특별 프로모션 혜택까지메드파크(대표 박정복)가 오는 26~28일 코엑스에서 개최되는 ‘SIDEX 2023’에서 ‘MedPark International Meeting(MIM)’ 무료 강연을 펼친다. ‘What is moldable Bone’을 주제로 진행되는 이번 강연은 국내 유명연자 5인이 다양한...",http://www.dentalnews.or.kr/news/article.html?no=37616,
14100,메드파크,"메드파크, IDS 2023에서 골이식재 S1 전시","메드파크가 오는 14일부터 18일까지 5일간 독일 쾰른에서 개최되는 세계 최대 국제 치과 기자재 전시회 IDS 2023에 참여한다.IDS 2023은 올해 100주년을 맞이하는 세계적 학회로 지난해부터 IDS Connnet를 통해 온·오프라인으로 치기공부터 치과 진료, 서비스 등 광범위한 치과 관련 사업 전반에...",https://www.medicaltimes.com/Main/News/NewsView.html?ID=1152475&ref=naverpc,
14100,메드파크,"메드파크, ‘AEEDC 2023’서 존재감 과시","신개념 골이식재 ‘S1’ 제품 우수성 홍보메드파크(대표 박정복)가 지난 7일부터 9일, 두바이에서 개최된 ‘AEEDC 2023(이하 에덱)’에 참가, 참석자들의 발길을 사로잡으며 묵직한 존재감을 과시했다. 올해로 26회를 맞는 에덱은 지난해 코로나19 여파로 37개국 400여 개사가 참가했으나, 이번 전시회에서는...",http://www.dentalnews.or.kr/news/article.html?no=36524,
14100,메드파크,"메드파크, 두바이 'AEEDC 2023' 참가",메드파크(대표 '박정복')가 지난 2월 7일부터 9일 까지 두바이 월드 트레이드 센터 (World Trade Center)에서 개최한 AEEDC 2023에 참가했다고 밝혔다. 올해로 26회를 맞는 아랍에미레이트 국제 치의학 컨퍼런스 및 치과 기자재 전시회 'AEEDC'은 지난해에는 코로나19의 여파로 37개국 400여개사가 참가했으나...,http://www.bosa.co.kr/news/articleView.html?idxno=2191189,
14100,메드파크,"재생의학기업메드파크, 두바이 'AEEDC 2023' 참가 '호평'",재생의학기업 '메드파크'(대표 '박정복')가 지난 2월 7~9일까지 두바이 월드 트레이드 센터(World Trade Center)에서 열린 'AEEDC 2023'에 참가했다고 밝혔다. 올해로 26회를 맞는 아랍에미레이트 국제 치의학 컨퍼런스 및 치과 기자재 전시회 'AEEDC'은 전년도에는 코로나 19로 인해 37개국의 400여 개 사만...,http://www.doctorstimes.com/news/articleView.html?idxno=221779,
14100,메드파크,"자이메드-MHFocus, 업무협약 체결... CES 2024서 선보인 통합센서 헬스케어 솔...","한편, 자이메드는 이번 CES 유레카파크(Eureka Park)에 조성된 서울통합관에서 동맥경화 안저 AI 솔루션 'FUNDUS-CVD AI'와 통합센서 헬스케어 솔루션 'XAI CARESYS23'을 선보여 일본·미국·유럽 등 의료선진국을 대상으로 큰 관심을 끌었다. 자이메드는 CES 2024 개최 기간 동안 다양한 활동을 통해 국내외...",https://kr.aving.net/news/articleView.html?idxno=1788184,
14100,메드파크,"서울국제관광전 ""아태지역 국가, 한국 관광객 유치에 진심""","노랑풍선은 올해 클럽메드, 제이파크리조트와 협업 패키지를 준비하며 전년 보다 높은 성과를 예상했다. 이와 관련 노랑풍선 관계자는 ""오프라인 행사운영 시 실제 방문 고객들의 직접적인 참여를 통해 자연적으로 바이럴이 될 뿐만 아니라 현장 전용 상품 구성, 신상품 소개 및 상담, 예약까지 원스톱으로...",https://www.econovill.com/news/articleView.html?idxno=654559,
