company_id,company_name,news_title,news_text,news_url,posted_at
14318,무등의료재단,"[무등의 아침] GGM노조, 민주노총 가입…무노조·무파업 사회적 합의 깨지나?",무등의 아침] ■ 방송시간 : 08:30~09:00 KBS광주 1R FM 90.5 MHZ ■ 진행 : 윤주성 앵커 ■ 전화연결 : 김동찬 광주경영자총협회 상근부회장 ■ 구성 : 정유라 작가... 광주상생일자리재단초대 대표이사를 역임한 김동찬 광주경영자총협회 상근 부회장은 이 문제 어떻게 보고 있는지 궁금합니다. 안녕하십니까?...,https://news.kbs.co.kr/news/pc/view/view.do?ncd=7958467&ref=A,
14318,무등의료재단,[무등60초] '스타필드' 광주에 들어서다,"▶의료공백에 최악으로 몰린 시골 보건소 병원은커녕 하루아침에 의사마저 빼앗긴 시골 보건소에는 어르신들의 앓는 소리가 끊이지 않는다. 집단... ▶ 광주문화재단, 23일 전통문화관서 '무등풍류 뎐' 광주문화재단은 오는 23일 오후 1시 전통문화관에서 우리의 전통문화를 즐기고 체험할 수 있는 융...",http://www.mdilbo.com/detail/F6ACgr/715842,
14318,무등의료재단,[무등의 아침] “전략 선거구에서 3인 경선으로…광주 서구을 승자는?”,"무등의 아침] ■ 방송시간 : 08:30~09:00 KBS광주 1R FM 90.5 MHZ ■ 진행 : 윤주성 앵커 ■ 전화연결 : 김경만, 김광진 더불어민주당 광주 서구을 국회의원 예비후보... 따라서 ""탄약고 이전 부지에 적은 비용으로 진료원의료서비스 그런 것들을 제공하기 위해서 공공 요양병원, 공공시설을 만들겠다""는 것입니다. 그래야...",https://news.kbs.co.kr/news/pc/view/view.do?ncd=7905654&ref=A,
14318,무등의료재단,"[무등의 아침] “열심히 잘했다 vs 존재감이 없다…민주당 북구을 경선 후보,...","무등의 아침] ■ 방송시간 : 08:30~09:00 KBS광주 1R FM 90.5 MHZ ■ 진행 : 윤주성 앵커 ■ 출연 : 이형석, 전진숙 더불어민주당 광주 북구을 예비후보 ■ 구성... 저는 북구 의원 그리고 광주 시의원, 청와대 행정관과 여성가족부의 공익재단에서 사무총장을 지냈습니다. 시민사회 운동과 풀뿌리 정치로 시작해서 국정...",https://news.kbs.co.kr/news/pc/view/view.do?ncd=7891888&ref=A,
14318,무등의료재단,[무등의 아침] “적자 이유로 광주시립 제2 요양병원 전격 폐원…노인 공공의...,무등의 아침] ■ 방송시간 : 08:30~09:00 KBS광주 1R FM 90.5 MHZ ■ 진행 : 윤주성 앵커 ■ 전화연결: 김수형 보건노조 광주시립 제2 요양병원 지부장 ■ 구성... 그렇기 때문에 민간 그런재단에서 병원을 운영하게 되면 수익이라는 것 때문에 자꾸 공공의료나 그런 것의 질이 어긋나기 때문에 말씀을 드렸는데 결국 자꾸...,https://news.kbs.co.kr/news/pc/view/view.do?ncd=7856132&ref=A,
14318,무등의료재단,[무등60초] 그린벨트 해제···광주경제 활성화되나?,▶기사바로보기 ▶ 전공의 빈자리 메우는의료진들 고군분투 정부의 의과대학 정원 확대 방침에 맞선 전공의들이 집단행동이 사흘째 접어들면서... ▶ 대한민국 휩쓴 힐링뮤지컬 광주서 보자 국립아시아문화전당재단(이하 ACC재단)이 'ACC퍼니' 첫 무대로 창작뮤지컬 '빨래'를 내달 22~24일 선보인다. '빨래'는...,http://www.mdilbo.com/detail/F6ACgr/713506,
14318,무등의료재단,"장호직 삼호·무등의료재단이사장, 한국경제문화대상 수상","장호직 삼호ㆍ무등산의료재단이사장, 한국경제문화대상 수상 노인ㆍ암 환자 치료에 기여, 어려운 이웃 나눔 실천 소외계층ㆍ위기청소년 사회안전망구축에도 앞장서 장호직 삼호ㆍ무등산의료재단이사장이 2020 한국경제문화대상 사회공헌부문 수상자로 선정됐다. 한국경제문화연구원(회장 최세진)은 최근...",http://www.namdonews.com/news/articleView.html?idxno=593597,
14318,무등의료재단,광주시의사회 제31회무등의림상 수상자 선정,"박창수무등의림상 특별상 씨젠의료재단광주호남검사센터 박창수 대표원장은 1978 전남대학교 의과대학 졸업, 전남대학교병원 교육연구실장, 전남대학교 의과대학 학장, 전남대학교 의생명인력양성사업단 단장, 미국 오클라호마 의과대학 연구교수, 대한병리학회 부회장,광주시립제2요양병원장을...",http://www.bosa.co.kr/news/articleView.html?idxno=2162406,
14318,무등의료재단,"[사설] 전남권 의대 총선공약 추진,의료공공성 핵심돼야",국립의대 설립이 전남 지역민들의 최대 현안이라는 사실은 지난해무등일보 여론조사에서도 확인됐다. 지난해 12월 고흥·보성·장흥·강진과 해남·완도... 효율로재단하는 정부 재정운영 기조에서 국민 기본권을 확보하기 위한 정치적 노력은 아무리 강조해도 지나치지 않다. 작금의 수도권의료블랙홀...,http://www.mdilbo.com/detail/nPE2fj/710568,
14318,무등의료재단,"광주시의사회, 제33회무등의림상 수상자 선정","(북구/김상도내과의원),무등의림 학술상은 신종희 교수(전남의대 진단검사의학과)·정종훈 교수(조선의대 내과)·김순호 부장(광주기독병원 내과)·윤서라 제1진료실장(광주보훈병원 재활의학과)이 받는다. 강주오 원장은 2008년 5월이후 광주응급의료정보센터 공중보건의로 근무하면서부터 '광주 외국인...",http://www.doctorsnews.co.kr/news/articleView.html?idxno=151707,
