company_id,company_name,news_title,news_text,news_url,posted_at
11535,민커뮤니케이션,"[전문] 하이브, 민희진 주장 반박 ""뉴진스 볼모로 협박하는 쪽은민대표""","산하 레이블 어도어의 민희진 대표가 경영권 찬탈을 기도했다며 배임 혐의로 고소한 하이브가 26일민대표의 전일 기자회견에 대해 조목조목 반박했다.... <하이브커뮤니케이션조직은 뉴진스 PR에 총력을 다하고 있습니다. 지난해 1년간 뉴진스로만 273건의 보도자료를 작성, 배포했습니다. 방탄소년단을...",https://www.newspim.com/news/view/20240426001027,
11535,민커뮤니케이션,"부산 ‘유튜버 살인’ 현장 중계 영상, 차단전 하루도 안돼 조회수 35만회",이 과정에서 수십 건의민·형사상 고소도 제기돼 현재 재판이 진행 중이다. 사건 당일에도 B 씨는 부산지법 앞에서 라이브 방송을 하다가 A 씨로부터... 김대경 동아대 미디어커뮤니케이션학과 교수는 “앞으로 이 같은 문제가 계속 일어날 수 있다”며 “유튜브 속 게시물의 표현 수위를 제재하는 등 조치가...,https://www.munhwa.com/news/view.html?no=2024051001070927093001,
11535,민커뮤니케이션,"민커뮤니케이션, 글로벌 인턴십으로 학생과 기업 모두 '윈윈' [란온라인]","[자료제공 :민커뮤니케이션] 란온라인의 개발∙서비스사인민커뮤니케이션(대표 김병민)은 지난 10일, 해외 사업 역량 강화와 우수인재 발굴 및 육성을 위해 진행 중인 글로벌 인턴십 프로그램의 3회째 수료식을 마쳤다고 오늘 전했다. 이번 글로벌 인턴십 수료 대상자들은 경북대학교에...",http://www.inven.co.kr/webzine/news/?news=36532,
11535,민커뮤니케이션,"민커뮤니케이션, 전 직원에게 아이패드2 지급","민커뮤니케이션, 전 직원들에게 아이패드2 지급[민커뮤니케이션제공] MMORPG(다중접속온라인게임) 란온라인으로 해외에서 인기몰이 중인 게임 개발사민커뮤니케이션(대표 김병민)이 지난 4일, 전 임직원들에게 아이패드2를 지급하여 눈길을 끌고 있다. 이번 아이패드2 지급은 란온라인의 동남아 서비스...",http://www.thisisgame.com/board/view.php?id=653813&category=101,
11535,민커뮤니케이션,아이패드2 전직원 지급! `민커뮤니케이션`의 통큰 복지,"▲아이패드2를 받고 좋아하는 직원들 MMORPG 란온라인으로 해외에서 인기몰이 중인 게임 개발사민커뮤니케이션(대표 김병민)이 지난 4일, 전...민커뮤니케이션의 정현석 경영기획실장은 “모든 직원들의 노력으로 자사게임인 란온라인이 해외시장에서 좋은 성과를 내고 있다. ”고 말하며 “앞으로도...",http://www.gamemeca.com/api/move.html?co_comp=naver_s&move_url=http%3A%2F%2Fwww.gamemeca.com%2Fnews%2Fnews_move.html%3Fseq%3D7%26ymd%3D20110506,
11535,민커뮤니케이션,"민커뮤니케이션"" 해외게임시장 공략 앞으로""","대구지역 게임기업인민커뮤니케이션(대표 김병민)이 최근 해외시장 다지기에 총력을 쏟고 있다. 이 업체가 안정적인 해외서비스를 위해 직접 운영하고...민커뮤니케이션은 지난 2007년 대만에 민타이완을 설립, 대만과 홍콩지역에 자사의 온라인게임 ‘란온라인’에 대한 직접서비스를 시작했다....",http://www.etnews.co.kr/201106210117,
11535,민커뮤니케이션,"민커뮤니케이션, 2011년 상반기 경력직 인재 모집","`란온라인` 과 `메르메르 온라인` 을 개발 및 서비스하는민커뮤니케이션이 2011년 새로운 도약을 위해 능력 있는 경력직 인재를 모집한다고 밝혔다....민커뮤니케이션의 정현석 경영기획실장은 ""현재의 안정적인 사업기반과 글로벌 역량을 바탕으로 올 해는 새로운 도약의 원년이 될 것이다. 역량 있는...",http://www.gamemeca.com/api/move.html?co_comp=naver_s&move_url=http%3A%2F%2Fwww.gamemeca.com%2Fnews%2Fnews_move.html%3Fseq%3D25%26ymd%3D20110304,
11535,민커뮤니케이션,"민커뮤니케이션, 2011년 상반기 경력직 모집",[동아닷컴]민커뮤니케이션(대표 김병민)은 2011년 새로운 도약을 위해 경력직 인재를 모집한다고 금일(3일) 밝혔다. 모집 일정은 오늘(3일)부터...민커뮤니케이션의 정현석 경영기획실장은 “현재의 안정적인 사업기반과 글로벌 역량을 바탕으로 올 해는 새로운 도약의 원년이 될 것.”이라며 “역량...,http://www.gamedonga.co.kr/gamenews/gamenewsview.asp?sendgamenews=44186,
11535,민커뮤니케이션,"게임개발업체민커뮤니케이션, 해외 사업 확대","[세계일보] 대구 게임개발업계 ‘빅3’중 하나인민커뮤니케이션인(대표 김병민)이 올해 들어 직접서비스 국가 확대, 해외 현지법인 설립 등 다양한 신규 사업에 박차를 가하고 있다. 3일 대구디지털산업진흥원(DIP)에 따르면민커뮤니케이션은 지난 달부터 자사가개발한 대규모 다중접속롤플레잉게임...",http://www.segye.com/Articles/NEWS/ECONOMY/Article.asp?aid=20110303000787&subctg1=&subctg2=,
11535,민커뮤니케이션,게임개발社민커뮤니케이션해외 사업 확대,"대구 게임개발업계 '빅3'중 하나인민커뮤니케이션인(대표 김병민)이 올해 들어 직접서비스 국가 확대, 해외 현지법인 설립 등 다양한 신규 사업에 박차를 가하고 있다. 2일 대구디지털산업진흥원(DIP)에 따르면민커뮤니케이션은 지난 달부터 자사가 개발한 대규모 다중접속롤플레잉게임(MMORPG)...",https://n.news.naver.com/mnews/article/001/0004939074?sid=101,
