company_id,company_name,news_title,news_text,news_url,posted_at
6004,바나실아이엔씨,"바나실아이엔씨, ‘서울국제유아교육전&키즈페어’서 천연 풀 ‘후에키(Fueki...",[머니투데이 중기&창업팀 허남이 기자] 안심하고 사용할 수 있는 문구 브랜드를 선보이는바나실아이엔씨(대표 홍종훈)는 지난 23일부터 26일까지 서울 코엑스 전시장에서 개최된 ‘제40회 서울국제유아교육전&키즈페어’에서 옥수수로 만든 천연 녹말 풀 ‘후에키(Fueki)’ 등 다양한 문구류를 선보였다....,http://www.mt.co.kr/view/mtview.php?type=1&no=2017112817263586103&outlink=1,
6004,바나실아이엔씨,"경기도내 기업, 전문무역상사로 수출의 돌파구 찾다","과천시 소재 블랙박스 제조업체인바나실아이엔씨는 P무역상사와 터키 및 중동 시장 진출에 대한 상담을 진행해 기존 일본에만 수출하고 있던 거래선을 확대할 수 있는 기회를 얻었으며, 총 110만불의 상담실적을 거뒀다. 시흥시 소재 다이어트비누 제조업체인 ㈜페르더마는 G사와 국내 약국 및 병원 유통에...",http://www.asiatoday.co.kr/view.php?key=20141030010019245,
6004,바나실아이엔씨,중소기업 버그바운티 대회 ‘화이트햇 투게더’ 1기 결과 공유회 개최,KISA는 이 프로젝트의 일환으로 참여기업의 서비스와 제품을 허용된 플랫폼 안에서 해킹을 통해 보안 취약점을 발견하고 신고한 화이트해커에게 포상금을 지급하는 버그바운티 대회를 개최했다.대회에 참가한 200명의 화이트해커는 △벤디스(식권대장) △글로벌브릿지(잡브릿지) △바나실아이엔씨...,http://www.boannews.com/media/view.asp?idx=111698&kind=,
6004,바나실아이엔씨,"KISA, 중기 버그바운티 대회 1기 결과 공유회 개최","참여 중소기업은 글로벌브릿지,바나실아이엔씨, 벤디스, 비온시이노베이터, 쉐어앤쉐어, 에이텐시스템, 유라클, 카티어스, 코발트, 코코넛사일로, 크린랲, 휴네시온, 휴넷 등이다. 이에, KISA는 취약점이 발견된 중소기업에 맞춤형 정보보호 컨설팅을 무료로 제공하고, 기업별로 최대 600만원(자기부담금 10...",http://www.koit.co.kr/news/articleView.html?idxno=105808,
6004,바나실아이엔씨,中企 수출촉진 간담회…“해외인증 획득 지원 필요 ”,"차량용 블랙박스 제조업체바나실아이엔씨의 박주형 이사는 ""정부 수출지원기관의 자료를 보고 해외 전략을 짜는데, 산업별 개괄적인 정보만 담고 있어 품목별 시장 상황을 판단하기에는 한계가 있다""고 말했다. 수처리 기자재 제조업체 에코셋 황우철 상무는 ""규정 변경에 따른 추가 인증, 국가별 인증 획득 등은...",http://biz.chosun.com/site/data/html_dir/2019/02/22/2019022201464.html,
6004,바나실아이엔씨,"경기도내 수출 중소기업, 대기업 손잡고 '해외판로 개척'","과천의 블랙박스 제조업체 '바나실아이엔씨'는 P무역상사와의 상담을 통해 기존 수출국이었던 일본 외에도 터키 등 중동 시장으로 거래선을 확대하는 기회를 얻었다. 시흥의 다이어트비누 제조사 '(주)페르더마' 역시 국내 병원과 약국으로의 유통을 위해 G무역상사와 상담을 진행, 1만개 비누를 납품키로...",http://www.kyeongin.com/?mod=news&act=articleView&idxno=912497,
6004,바나실아이엔씨,중기센터·무역협회 '수출상담회' 개최…상담실적 1500만 달러,"과천시의 블랙박스 제조업체인바나실아이엔씨는 P무역상사와 터키, 중동 시장 진출 상담을 벌여 일본에만 수출하던 거래선을 확대할 수 있는 기회를 얻었으며 모두 110만 달러의 상담실적을 거뒀다. 시흥시 소재 다이어트비누 제조업체인 ㈜페르더마는 G사와 국내 약국과 병원 등의 유통에 대한 상담을...",http://www.newsis.com/ar_detail/view.html?ar_id=NISX20141030_0013265973&cID=10803&pID=10800,
6004,바나실아이엔씨,"경기중기센터-한국무역협회 경기지역본부, 수출상담회…1,500만 달러 실적",과천시 소재 블랙박스 제조업체인바나실아이엔씨는 P무역상사와 터키와 중동 시장 진출에 대한 상담을 진행해 기존 일본에만 수출하고 있던 거래선을 확대할 기회를 얻었다. 이자리에서 110만달러의 상담실적을 거뒀다. 또 시흥시 소재 다이어트비누 제조업체인 (주)페르더마는 G사와 국내 약국 및 병원...,https://n.news.naver.com/mnews/article/011/0002592386?sid=102,
6004,바나실아이엔씨,"‘전문무역상사 초청 수출상담회’, 1천500만＄ 상담 실적",과천지역 블랙박스 제조업체인바나실아이엔씨는 P무역상사와 터키 및 중동 시장 진출에 대한 상담을 진행해 기존 일본에만 수출하고 있던 거래선을 확대할 수 있는 기회를 얻었다. 시흥지역 다이어트비누 제조업체인 ㈜페르더마는 G사와 국내 약국 및 병원 유통에 대한 상담을 진행했고 1만개의...,http://news1.kr/articles/?1930934,
6004,바나실아이엔씨,246건 상담·1천500만달러 수출실적 거두다,"이를 통해 블랙박스 제조업체인바나실아이엔씨(과천)는 P무역상사와 110만 달러 규모의 터키·중동 시장 진출에 대한 상담실적을 거두고, 거래선을 확대할 수 있는 기회를 얻었다. 또 시흥시에 위치한 다이어트비누 제조업체인 ㈜페르더마는 G사와 국내 약국·병원 유통에 대한 상담을 벌여 1만개의...",http://www.kgnews.co.kr/news/articleView.html?idxno=399364,
