company_id,company_name,news_title,news_text,news_url,posted_at
7606,바른정보기술,"법무법인바른IT 전문대응팀, 공학도 출신 변호사·변리사 대거 포진…IT 기...",법무법인바른의정보기술(IT) 전문대응팀은 전원이 이공계 출신 변호사로 구성됐다. IT 기업들이 예상하지 못한 법률적 이슈를 미리 발견해 사법 리스크를 예방하고 벤처·스타트업의기술보호와 성장에 기여하고 있다는 평가다.바른의 IT 전문대응팀은 국내 최고 이공계 대학 출신 변호사들로 구성됐다....,https://www.hankyung.com/article/2024042396611,
7606,바른정보기술,대구교육청 '바른디지털 매체 활용 교육' 실시,"교육은바른스마트기기 활용, 건전 게임 이용, 사이버범죄 예방 등 3가지 주제 중 학교에서 원하는 주제에 맞는 전문 강사의 방문 교육으로 진행된다. 교육에는 165개 초·중·고 학생 3만8000여명이 참여한다. 대구스마트쉼센터 소속 전문 강사들이 스마트폰의 순기능과 역기능, 미래 사회의 ICT(정보통신기술)...",https://www.news1.kr/articles/5383045,
7606,바른정보기술,[9일 성남시] ‘어린이 안전체험캠프’ 운영 등,"초교 4학년생 ‘치과주치의’ 사업 실시 수정구보건소, 성남시 치과주치의 사업 올바른칫솔질 교육 중. 사진=성남시 성남시는 오는 11월 30일까지... 장애인의 사회·경제활동 참여와 디지털정보격차 해소를 위해 과학기술정보통신부, 경기도와 함께 추진하는 사업이며, 보급 품목은 모두 143종이다. 장애...",https://www.asiatime.co.kr/article/20240509500334,
7606,바른정보기술,"피봇브릿지, SCI평가정보우수기술기업인증 'T5등급' 획득","기술은 M&A 매치에 있어 M&A 당사자 간의 직접적인 의사합치부터 딜 종료에 이르기까지 '자율 매칭' 형태로, 모든 절차를 플랫폼 내에서 해결할 수 있다는 것이 특징이다. 피봇브릿지 김태섭 대표는 전바른전자그룹 회장으로 1988년 창업해 30여년을 공격적인 투자와 M&A로 그룹화에 성공한 바 있는, 국내정보...",http://www.kdpress.co.kr/news/articleView.html?idxno=127777,
7606,바른정보기술,"[하정우, K-AI를 말하다]②미국은 인텔에 대규모 보조금 주는데…한국은 '찔끔...","하정우 '바른과학기술사회 실현을 위한 국민연합' 공동대표 겸 AI미래포럼 초대 소장으로부터 일상 속 AI 활용방안과 한국이 AI 강국으로 발돋움하는데... 국회 과학기술정보방송통신위원회는 AI를 포함한 과학기술·정보통신·방송 관련 의정을 담당한다. 이에 관해 하 대표는 ""과학기술과 방송(언론)을 (별도...",https://www.bloter.net/news/articleView.html?idxno=615919,
7606,바른정보기술,"""과학기술총선공약, R&D 재원 마련·제도 개선 구체성 부족""",2일 '바른과학기술사회 실현을 위한 국민연합'(과실연)은 온라인 회의를 열어 주요 정당의 과학기술·정보통신기술(ICT) 총선 공약을 평가했다. 과실연은 2005년바른과학기술사회를 목표로 학계 전문가들이 모여 설립한 시민단체다. 과실연은 R&D 강화에 필수적인 예산·인재 확보 대책이 구체적이지 않다고...,https://www.news1.kr/articles/5371792,
7606,바른정보기술,"40주년 맞은 한국 이동통신 시장.....연세대바른ICT연구소 'AI 시대, ICT가 ...","SK텔레콤과바른ICT연구소의 노력은 계속될 것""이라고 다짐했다. 이어진 순서에서는 김경만 과학기술정보통신부 통신정책관과 권남훈 건국대학교 경제학과 교수가 각각 '이동통신 40년 성과와 향후 ICT 정책 방향'과 'AI 시대, ICT가 가야 할 길: 전망과 과제'라는 주제로 발표를 진행했다. 발표를 진행하는...",http://www.handmk.com/news/articleView.html?idxno=20742,
7606,바른정보기술,"AI 시대,정보통신기술이 가야 할 길","연세대학교바른ICT연구소는 이 같은 흐름에 맞춰 'AI 시대, ICT가 가야 할 길'이라는 주제로 대한민국 이동통신 40주년 기념 토론회를 5일 개최했다. 그간정보통신기술(ICT) 영역 성과를 돌아보고, AI 시대에정보통신기술의 역할이 무엇일지에 대한 답을 찾기 위해서다. 기자도 이날 현장에 참석해 발표자들의...",http://www.niceeconomy.co.kr/news/articleView.html?idxno=83511,
7606,바른정보기술,"[경기포커스] 정윤경 도의원 ""독도에 대한바른역사 인식 위한 교육 무엇보다...","저는 대한민국 국민의 한 사람으로서 일본의 망언에 맞서서 독도를 지키기 위해서는 일본의 독도 역사 왜곡을 바로 직시하고, 독도에 대한바른역사... 다들 아시다시피 우리나라가 IT정보기술활용에 상당히 앞서 있다고 보고 있는데요. 이 점을 독도 교육에 적절히 활용해 보려는 게 이번 조례안의 주요 내용...",https://news.ifm.kr/news/articleView.html?idxno=382841,
7606,바른정보기술,"[포토] 김범수 연세대학교바른ICT연구소장 ""AI 시대 필요한 정책 모색할 것""","연세대학교바른ICT연구소가 이날 '인공지능(AI) 시대,정보통신기술(ICT)가 가야 할 길'을 주제로 대한민국 이동통신 40주년 기념 토론회를 개최했다. 김 소장은 축사를 통해 ""AI 시대를 맞이해 초거대 AI, 챗GPT는 출시 두 달만에 월간 사용자 1억명을 돌파하며 누구나 쉽게 일상생활에서 AI를 활용할 수 있는...",https://www.onews.tv/news/articleView.html?idxno=199302,
