company_id,company_name,news_title,news_text,news_url,posted_at
11175,바움크리에이티브,"[ㄴㅅㅇㅋ_진단] 부산소주 '대선' 6회 연속 대한민국주류대상 수상 뒤, 실적 ...","또 정확한 지분 구조를 확인할 수 없으나 광고 대행사이자 비엔그룹의 또 다른 계열사인바움크리에이티브에 지급된 광고 선전비는 2019년 26억원, 2020년 15억원, 2021년 19억원이었다. 가령 2021년 총 광고 선전비 중 무려 38.5%에해당하는 부분이바움 크리에이티브에 지급된 것으로 나타나 해당 계열사에...",http://www.newsworker.co.kr/news/articleView.html?idxno=172680,
11175,바움크리에이티브,"오픈런 아카데미, 국내 대학생 아이디어 뉴욕 앤디어워드 '올해의 광고' 선정","특히 뉴욕 앤디 어워즈는 상업계의 저명한 글로벌크리에이티브디렉터들의 까다로운 심사가 있기로 저명한 대회로, 올 해에는 광고업계의 유명인사인 PJ 페레이라(PJ Pereira), 구글 뉴욕크리에이티브대표 수잔나 애펠바움(Suzana Aplebaum), 오길비 미주 대표 크리스 비어스포드힐(Chris Beresford-Hill)을...",http://www.businesskorea.co.kr/news/articleView.html?idxno=97013,
11175,바움크리에이티브,대선주조 등 BN그룹 임직원 180여명 '환경마라톤' 참가,"이날 마라톤 대회에는 비아이피, 대선주조, 비엔스틸라, 비스코, 바이펙스, 비엔철강,바움크리에이티브등 비엔그룹 계열사 임직원 180여 명이 참가해 하프 마라톤, 10km로드레이스, 건강달리기(5km) 등 다양한 코스에서 부산 시민과 함께 뛰었다. 비엔그룹은 이번 대회에 단일 기업체로는 세 번째로 많은...",http://www.mt.co.kr/view/mtview.php?type=1&no=2014032418450985583&outlink=1,
11175,바움크리에이티브,"21세기 쇼비즈니스의 새로운 모델 패리스 힐튼, 그녀는 누구인가? [1]","커신바움본드크리에이티브네트워크라는 마케팅 회사 관계자의 말을 인용한 뉴욕의 한 일간지의 표현처럼 “패리스 힐튼에게 최악의 보도란 그녀를 보도하지 않는 것”뿐이다. 패리스 힐튼은 앨범 발매, 향수 발매, 보석 브랜드 런칭과 같은 각종 사업 뉴스를 포함해 섹스 비디오, 가슴노출사진...",http://www.cine21.com/Index/magazine.php?mm=005001001&mag_id=49102,
11175,바움크리에이티브,바다를 품은 샤넬과 <더블유>가 함께한 2024 스프링 컬렉션,"볼과 입술은 ‘바움에쌍씨엘(머메이드 글로우)’로 투명한 광채를 입히고, 볼에 ‘레 꺄트르 옹브르(88 코랄 트레저)’의 라일락 핑크 섀도를... 샤넬의 2024 스프링 컬렉션은 가브리엘 샤넬과 샤넬의 글로벌크리에이티브메이크업 파트너, ‘꼬메뜨 콜렉티브(Cométes Collective)’의 멤버인 발렌티나 리가...",https://www.wkorea.com/2024/03/01/%eb%ac%b4%ed%95%9c%ed%95%9c-%eb%b0%94%eb%8b%a4%eb%a5%bc-%ed%92%88%ec%9d%80-%ec%83%a4%eb%84%ac%ea%b3%bc-%ea%b0%80-%ed%95%a8%ea%bb%98%ed%95%9c-2024-%ec%8a%a4%ed%94%84%eb%a7%81-%ec%bb%ac%eb%a0%89/?utm_source=naver&utm_medium=partnership,
11175,바움크리에이티브,2024 IFS 제56회 프랜차이즈 창업·산업박람회 참가업체는?,(주)호윤크리에이티브( 나 뭐 먹고 살지 ) ▲ (주)워시업코리아 ( 호텔런드리 ) ▲ 월드와인(주) ( 월드와인 ) ▲ (주)센트온 ( 센트온 )... 것 ) ▲바움코리아 (바움코리아 ) ▲ 리빙메이트 ( 리빙메이트 ) ▲ 주식회사 싱크닥터 ( 싱크닥터 ) ▲ 주식회사 하이클린 ( 하이클린 )...,http://www.shinailbo.co.kr/news/articleView.html?idxno=1844376,
11175,바움크리에이티브,"샤넬에서 처음 선보이는 메이크업 아티스트 그룹, '꼬메뜨 콜렉티브'","샤넬의 새로운 글로벌크리에이티브메이크업 파트너, 꼬메뜨 콜렉티브(Cometes Collective). 왼쪽부터 발렌티나 리(Valentina Li), 아미 드라메(Ammy Drammeh)... 연출해주는 ‘바움에쌍씨엘 글로우 스틱(트렌스페어런트, 루쥬 후레)’으로 하이라이트와 입체감을 더한 뒤, ‘쥬 꽁뜨라스뜨(430 포시아 로사)’와 ‘N...",https://www.wkorea.com/2023/12/22/%ec%83%a4%eb%84%ac%ec%97%90%ec%84%9c-%ec%a3%bc%eb%aa%a9%ed%95%98%eb%8a%94-%eb%a9%94%ec%9d%b4%ed%81%ac%ec%97%85-%ec%95%84%ed%8b%b0%ec%8a%a4%ed%8a%b8-3%ec%9d%b8/?utm_source=naver&utm_medium=partnership,
11175,바움크리에이티브,[부산 공연] 이번 주에 뭐 볼까? [2023년 6월 5~11일],◆2023 원먼스 페스티벌 참여 ‘초록향기 콘서트’ [오페라바움] 부산소공연장연합회가 주관하는 ‘원먼스 페스티벌’ 일환으로 오페라바움이... ◆2023 원먼스 페스티벌 참여 ‘골목 미술관에서 만나는 해설이 있는 음악회-잼끗’ [구박갤러리] 아트크리에이티브그룹 ‘잼꿋’이 보수동에 위치한...,https://www.busan.com/view/busan/view.php?code=2023052814284526341,
11175,바움크리에이티브,여성의 이중성을 핑크 컬러를 통해 표현한 샤넬 ‘깡되르 에 엑스뻬리앙스 : ...,"샤넬의 글로벌크리에이티브메이크업 & 컬러 디자이너 루치아 피카 인터뷰. 최근 몇 년간, 샤넬의 메이크업 컬렉션은 출시하면 곧바로 품절 현상을... 때론 샤넬 화장품 중 가장 좋아하는 제품 중 하나인 ‘바움에쌍씨엘(로제)’을 발라 마무리한다. 직접 보여주길 원하나? 물론이다. (손등에 바르기 시작)...",https://www.wkorea.com/2020/08/12/%ec%83%a4%eb%84%ac-%eb%b7%b0%ed%8b%b0%eb%a5%bc-%ea%b7%b8%eb%a6%ac%eb%8b%a4/?utm_source=naver&utm_medium=partnership,
11175,바움크리에이티브,토미 캐시가 패션 악동이 된 이유,크리에이티브를 정량적 수치로 정의 내리려는 회색 정장 차림의 고리타분한 임원들이나 쓰는 단어예요. 저는 인플루언서 같은 단어도 싫어해요. 그런... Q : 몇 주 전 저는 2012년 성층권에서 뛰어내린 최초의 사람이자 그 점프 후 바로 은퇴한 익스트림 스포츠 선수인바움가르트너를 인터뷰했어요. 그가 말하길...,http://www.esquirekorea.co.kr/article/80761,
