company_id,company_name,news_title,news_text,news_url,posted_at
6081,보그스타일,멧 갈라 젠데이아의 헤어스타일의 비밀... 다이슨 헤어드라이어에 있었다,"멧 갈라(Met Gala)는 미국 패션계 최대 행사 중 하나로,보그와 뉴욕 메트로폴리탄 박물관의 코스튬 인스티튜트가 매년 주최하는 자선 행사이다.... 젠데이아의 헤어스타일링을 담당한 헤어스타일리스트 우르술라스티븐(Ursula Stephen)는 다이슨 슈퍼소닉 r™ 헤어드라이어(Dyson Supersonic r™ hair dryer)와...",https://www.wikitree.co.kr/articles/949720,
6081,보그스타일,"“연기 은퇴 잘했다” 엠마 왓슨, 숏컷 헤어스타일찰떡[해외이슈]","사진 속 엠마 왓슨은 화장기 없는 얼굴에 숏컷 헤어스타일로 매력을 발산했다. 한편 엠마 왓슨은 2018년 ‘작은 아씨들’ 이후에 연기 활동을 중단했다. 그는 지난해 12월보그와 인터뷰에서 ""연기를 그만두기를 정말 잘한 것 같다""면서 ""이전에는 느끼지 못했던 나만의 목소리와 창의적인 공간, 주권을 갖게 된...",https://mydaily.co.kr/page/view/2024050110472949780,
6081,보그스타일,케이티 홈즈와 수리 크루즈가스타일DNA를 셰어했다,수리의 이런 보헤미안스타일은 사실 홈즈에게서 영향을 받은 것입니다. 끌로에의 오랜 팬인 홈즈는 피비 파일로 재임 시절부터 가브리엘라 허스트까지 끌로에의 제품을 반복적으로 착용하며 특유의 보헤미안 드레스를 즐겼죠. US <보그>는 이에 대해 끌로에의 새로운 크리에이티브 디렉터 셰미나 카말리...,https://www.vogue.co.kr/2024/04/29/%ec%bc%80%ec%9d%b4%ed%8b%b0-%ed%99%88%ec%a6%88%ec%99%80-%ec%88%98%eb%a6%ac-%ed%81%ac%eb%a3%a8%ec%a6%88%ea%b0%80-%ec%8a%a4%ed%83%80%ec%9d%bc-dna%eb%a5%bc-%ec%85%b0%ec%96%b4%ed%96%88%eb%8b%a4/?utm_source=naver&utm_medium=partnership,
6081,보그스타일,"하얏트-보그코리아, 하석진 주연 독점 브랜드 필름 'Be More Here' 공개",글로벌 호텔 기업 하얏트는 'Be More Here' 글로벌 브랜드 플랫폼 론칭 일환으로보그코리아와 배우 하석진 주연의 독점 브랜드 필름을 공개한다고 23일... 영상 속 배경인 안다즈 도쿄 도라노몬 힐스는 2014년에 오픈해 올해로 10년째를 맞은 럭셔리 라이프스타일호텔이다. 아름다운 도시 전망과 편안한...,https://www.news1.kr/articles/5394062,
6081,보그스타일,"하얏트,보그코리아와 함께한 하석진 주연 브랜드 필름 ‘Be More Here’ 공...","글로벌 호텔 기업 하얏트는 ‘Be More Here’ 글로벌 브랜드 플랫폼 론칭 일환으로보그코리아와 함께 배우 하석진 주연의 독점 브랜드 필름을... 영상 속 배경인 안다즈 도쿄 도라노몬 힐스는 2014년에 오픈해 올해로 10년째를 맞은 럭셔리 라이프스타일호텔로 아름다운 도시 전망과 편안한 서비스, 종이와...",http://www.sentv.co.kr/news/view/684567,
6081,보그스타일,“레인지로버보그닮아!” 차세대 팰리세이드 실물급 예상도,"▲ 현대차 차세대 팰리세이드 예상 렌더링 <출처=뉴욕맘모스> 후면부는 전체적으로 상당히 각지고 박시한 스탠스를 보여주며, 이는 최근 북미 SUV 시장을 강타하는 도심형과 오프로드스타일이 공존하는 디자인 특징이다. 언뜻 보면 레인지로버보그와 상당히 비슷한 느낌이다. 차량 지붕을 받치는 필러를 블랙...",https://www.thedrive.co.kr/news/newsview.php?ncode=1065599670933527,
6081,보그스타일,프렌치스타일의 정수! 보르도에 자리한 앤-로르의 근사한 집,"고풍스러운 아르데코스타일의 아파트먼트와 인테리어 프로젝트를 거쳐 완성한 ‘카사 카조를라’, 앤 로르의 취향을 담은 두 공간으로 여러분을 초대합니다. 감각 좋은 이들이 <보그>에 보내온 랜선 집들이 #마이월드, 그 다섯 번째 이야기를 만나보세요. MYSELF 안녕하세요, 저는 프랑스 남서부에...",https://www.vogue.co.kr/2024/04/12/%ed%94%84%eb%a0%8c%ec%b9%98-%ec%8a%a4%ed%83%80%ec%9d%bc%ec%9d%98-%ec%a0%95%ec%88%98-%eb%b3%b4%eb%a5%b4%eb%8f%84%ec%97%90-%ec%9e%90%eb%a6%ac%ed%95%9c-%ec%95%a4-%eb%a1%9c%eb%a5%b4%ec%9d%98-%ea%b7%bc/?utm_source=naver&utm_medium=partnership,
6081,보그스타일,"방탄소년단(BTS) 제이홉 파리 패션위크 사진, 美보그'2023 스트리트스타일'...","미국의 패션 매거진보그(VOGUE)는 지난 12월보그에디터들이 가장 좋아하는 2023년 스트리트스타일사진을 선정해 공개했다.보그의 사진작가들이 2023년 한 해 동안 전 세계 10개 도시에서 촬영한 수 천장의 사진이 후보에 올랐으며, 총 11장이 선정됐다. 그리고 그 11장 중에 지난해 1월 파리 패션위크 디올...",https://www.xportsnews.com/article/1809285,
6081,보그스타일,올여름엔 걱정 없이 입는 가짜 미니스커트,"스타일이 각기 다른 <보그> 이탈리아 패션 에디터 3명이 스코트를 직접 입어봤습니다. 트랙 로퍼 한 켤레로 시크함을 추구하는 이도, 레이어드로 풍성한 실루엣을 완성한 이도 있었죠. ""가짜 미니스커트"" 미니스커트와는 항상 '이상한' 관계였어요. 전 키가 작은 편이어서 평소 미니스커트를...",https://www.vogue.co.kr/2024/05/09/%ec%98%ac%ec%97%ac%eb%a6%84%ec%97%94-%ea%b1%b1%ec%a0%95-%ec%97%86%ec%9d%b4-%ec%9e%85%eb%8a%94-%ea%b0%80%ec%a7%9c-%eb%af%b8%eb%8b%88%ec%8a%a4%ec%bb%a4%ed%8a%b8/?utm_source=naver&utm_medium=partnership,
6081,보그스타일,"킴마틴, 공효진과 함께한 '보그' 화보 공개","이외에도 어깨 디테일이 돋보이는 투웨이 집업후드와 독특한 절개선 디테일의 봄버 재킷, 빅사이즈 레더 숄더백으로 한층 감각적인스타일을 완성시켰다. 한편, 공효진이 함께한 킴마틴 화보는 패션 매거진 '보그코리아' 4월호와 킴마틴 웹사이트, 인스타그램을 통해 만나볼 수 있다.",http://www.enewstoday.co.kr/news/articleView.html?idxno=2104055,
