company_id,company_name,news_title,news_text,news_url,posted_at
14503,블루메디텍,"[제약+] 지씨셀, T세포 림프종 치료제 국내 1상 IND 제출 外","◆휴온스메디텍, 미국비뇨기과학회서 대표 제품 선봬 휴온스메디텍이 미국비뇨기과학회 2024에 참가했다고 10일 밝혔다. 휴온스메디텍은... ◆삼양사, 상쾌환 팝업스토어 '블루익스프레스' 오픈 삼양사가 을지로 3가역 인근에 위치한 뉴스뮤지엄 을지로점에서 숙취해소 브랜드 상쾌환의 팝업스토어...",https://dealsite.co.kr/articles/122430,
14503,블루메디텍,"블루메디텍, ‘2023 대한민국 소비자대상’ 의료기기 부문 2년 연속 수상",▲블루메디텍이 ‘2023 대한민국 소비자대상 소비자친화경영 부문(의료기기 부문)’에서 2년 연속 대상을 수상했다. (사진=블루메디텍제공) 정형외과 및 성형외과 의료기기 전문 유통·판매 회사블루메디텍이 ‘2023 대한민국 소비자대상 소비자친화경영 부문(의료기기 부문)’에서 2년 연속 대상을 수상했다....,https://mdtoday.co.kr/news/view/1065592958235386,
14503,블루메디텍,[5월9일 PM] 제약바이오 소식,"흡수성 봉합사 브랜드 '블루로즈' 역시 꾸준한 성장세를 이어가고 있다. 휴젤은 하반기에도 국내외 시장 확대에 주력할 계획이다. '보툴렉스(수출명... ◆ 휴온스메디텍, 미국비뇨기과학회서 대표 제품 선봬 ▲ ASADAL-M1 제품 이미지(제공=휴온스메디텍) 휴온스메디텍은 지난 3일부터 사흘간 미국 텍사스...",http://www.medicopharma.co.kr/news/articleView.html?idxno=62115,
14503,블루메디텍,[혁신스타트업 in 홍릉] 웰스메디텍“세계 첫 LED 치주질환 치료기 세계로”,"웰스메디텍은 LED 치료 기기 두 개를 선보였다. 치과 영역에서 활용할 기기 ‘웰미(WelMe)’는 세 가지 파장의 LED로 치주질환을 치료한다. 먼저 420㎚블루LED로 세균과 박테리아를 없애고 세포 손상을 완화한다. 미백 효과도 낸다. 670㎚ 레드 LED와 810㎚ 근적외선 LED는 각각 치주 염증과 통증 완화, 세포의 재생을...",https://www.donga.com/news/It/article/all/20230125/117569398/1,
14503,블루메디텍,"블루메디텍, 난치성 안구질환 치료 ‘트라이셀 안약’ 선보여",줄기세포 의료기기 유통 전문회사블루메디텍이 난치성 안구 질환 치료에 차별화된 ‘트라이셀 안약’일 최근 선보였다고 8일 밝혔다.블루메디텍오승래 대표는 “PRP 안약 치료는 환자의 혈액에서 순도 높은 결과물을 분리하는 것이 가장 중요하다. 혈청 안약이나 인공눈물과 다르게 트라이셀 안약은 이미...,https://mdtoday.co.kr/news/view/1065594659085151,
14503,블루메디텍,"피오닉스메디텍, 2020 대한민국 중소·중견기업 혁신대상 수상",피오닉스메디텍의 퓨어블루KF94마스크는 재질이 얇아 통기성이 좋으며 부드럽고 안전하게 굴곡진 얼굴 형상을 커버해 착용감 또한 우수하다. 또한 우수한 제품력에 비해 가격대는 저렴해 가성비가 뛰어나 재구매율도 높은 편이다. 신유리 대표가 가장 중점을 두는 부분은 제품의 품질과 우수성이다. 이를 위해...,http://www.kdfnews.com/news/articleView.html?idxno=63537,
14503,블루메디텍,'M&A블루칩' 떠오른 바이오…'한국의 바이엘·GSK' 나올까,"올 들어 국내 바이오 기업이 대기업의 인수합병(M&A)블루칩으로 떠오르고 있다. 그동안 자금 조달을 위해 기술수출과 기업공개(IPO)에만 의존했던 국내... 한화그룹은 2004년 에이치팜, 2006년 한국메디텍제약을 인수한 뒤 바이오시밀러 및 신약 개발에 도전했으나 좌절한 경험이 있다. 당시 바이오 사업의...",https://www.sedaily.com/NewsView/2D58BEYC3W,
14503,블루메디텍,"[Pharm & Now] 대웅제약, 멕시코에 신약 ‘엔블로’ 품목허가신청서 제출 등","제품명블루로즈 포르테)’를 선보였다. ‘레볼렉스’는 유럽 빅5인 독일·영국·프랑스·이탈리아·스페인을 포함 전 세계 34개국에 진출해 있는 만큼... 휴온스메디텍, 메디허브와 ‘아이젝(URO)’ 독점 공급계약 체결 휴온스그룹의 의료기기 전문기업 휴온스메디텍이 남성의학 영역 필러 시장의...",https://www.ebn.co.kr/news/view/1619502/?sc=Naver,
14503,블루메디텍,"피오닉스메디텍, K-방역 위한 '퓨어블루KF94마스크'로 주목","피오닉스메디텍의 대표 제품인 '퓨어블루KF94마스크'는 FDA 클래스 2레벨로 승인 및 EU CE인증을 받았으며 미국 넬슨 연구소 N95 테스트를 통과, 국내외에서 제품력 검증을 마쳤다. 재질이 얇아 통기성이 좋고 굴곡진 얼굴 형상을 부드럽게 커버해 착용감도 좋다. 앙면에 하드쉘을 적용해 안정적인 형상을 잡아주며...",http://www.job-post.co.kr/news/articleView.html?idxno=29261,
14503,블루메디텍,"CJ온스타일, 자원 순환의 날 맞아 친환경 패키징 확대...협력사 지원","HL사이언스, 지온메디텍,블루래빗까지 패션, 식품, 생활 등 다양한 분야의 협력사 선정됐다. 각 기업이 주력 판매하는 품목과 배송 박스 등 개별 상황과 수요에 맞춰 업체별로 자동·수동 작동 방식의 종이테이프를 최대 2500여 개까지 제공받는다. CJ온스타일은 환경부가 유통기업과 손잡고 진행하는 다회용...",http://www.pinpointnews.co.kr/news/articleView.html?idxno=140268,
