company_id,company_name,news_title,news_text,news_url,posted_at
10526,비욘드마케팅그룹,"[컨콜] 컴투스그룹, 경영효율화 성과 나타난 1분기","4%) - 순이익 40억 원(전기 흑자전환, 전년 +95%) ㄴ신작 출시 관련마케팅비, 로열티 등 비용 상승 ㄴ게임 매출 증가로 영업이익 증가 ▣ 2024년 1분기 비용... 3분기 글로벌 퍼블리싱 예정 - 프로스트펑크비욘드더 아이스: 중국 넷이즈가 개발한 모바일 건설 경영 시뮬레이션 게임. 1월 31일 미국/영국...",https://www.inven.co.kr/webzine/news/?news=295466,
10526,비욘드마케팅그룹,"[컨콜] 컴투스 ""퍼블리싱작·자체 개발작 균형 맞출 것""","대중적인마케팅을 전개하고 있다”고 했다. 컴투스는 올해 ‘스타시드: 아스니아 트리거’를 글로벌 시장에 선보이고, 요리 게임 ‘BTS 쿠킹온: 타이니탄 레스토랑’, 생존형 건설 시뮬레이션 게임 ‘프로스트펑크:비욘드더 아이스’ 등의 라인업을 연내 출시할 예정이다. 대형 다중접속역할수행게임(MMORPG)...",https://biz.chosun.com/it-science/ict/2024/05/10/TOZDI2GT5BB3HLMYH7ZUCBZEXA/?utm_source=naver&utm_medium=original&utm_campaign=biz,
10526,비욘드마케팅그룹,"컴투스, 2024년 1분기 실적 발표 매출 1,578억 원, 영업이익 12억 원 기록","‘프로스트펑크:비욘드더 아이스’ 등의 라인업을 지속 선보인다. 대형 MMORPG ‘더 스타라이트’도 ‘25년을 목표로 출시 준비에 매진하고 있으며, 스타... 글로벌은 3분기 출시 목표로 현지화를 준비하고 있고, 국내에서의 시행착오를 보완하고 개선해 글로벌에선 방치형에 가까운 대중적인마케팅을 전개할...",https://www.gamechosun.co.kr/webzine/article/view.php?no=205144,
10526,비욘드마케팅그룹,"컴투스 형제, 1Q 나란히 흑자전환…“중장기 성장전략 가동” 한목소리","분기별로 글로벌 유명 IP와 제휴마케팅및 컬래버레이션을 예고하며 글로벌 흥행을 지속시킨다는 계획이다. MMORPG ‘제노니아:크로노 브레이크’는... ‘프로스트펑크:비욘드더 아이스’ 등의 라인업을 지속 선보인다. 대형 MMORPG ‘더 스타라이트’도 2025년을 목표로 출시 준비에 매진하고 있으며, 스타...",http://www.fntimes.com/html/view.php?ud=2024051010572464747492587736_18,
10526,비욘드마케팅그룹,"[Beauty & Now] LG생활건강, ‘비욘드땡스에디션’ 5종 출시 등","LG생활건강, ‘비욘드땡스에디션’ 5종 출시 LG생활건강은 스킨 릴리프 뷰티 브랜드비욘드에서 비동물성 원료를 사용하고 한국비건인증원에서 비건... △MD(상품기획) △BM(상품개발) △마케팅(글로벌·콘텐츠·퍼포먼스) △IT/개발(백엔드·AOS·iOS·SRE) △디자인 (상품·VMD) △사업관리 등 다양한...",https://www.ebn.co.kr/news/view/1615892/?sc=Naver,
10526,비욘드마케팅그룹,"유통·호텔업계, 봄맞이 아트마케팅활발","현대백화점 관계자는 ""현대백화점의 아트마케팅은 '고객을 행복하게, 세상을 풍요롭게'라는 현대백화점그룹의 미션과 맞닿아 있다""며 ""더 많은 고객과 작가들이 자유롭게 참여하며 문화예술이 더욱 생동감 있는 콘텐츠로 확장하는 데 고객 최접점인 백화점이 일조함으로써 '비욘드리테일'의 새로운...",https://www.ekoreanews.co.kr/news/articleView.html?idxno=72518,
10526,비욘드마케팅그룹,[3월 10일 워크넷 채용정보] ㈜이르테크·㈜단에이앤씨·㈜큐어팜택·㈜한성G...,"등 ■ ㈜비욘드마케팅그룹디지털 마케팅 기획자(AE) 채용 ▷지원자격 : 신입, 경력(2년 이상) ▷채용기간 : 3월 31일까지 ▷전형방법 : 서류, 면접 ▷근무지역 : 서울 강남구 ▷근무시간 : 오전 9시30분~오후 6시 30분, 전일제 ▷임금 : 회사 내규에 따름 ▷고용형태 : 정규직 ▷근무형태 : 주 5일 근무...",https://www.news2day.co.kr/article/20210310500095,
10526,비욘드마케팅그룹,"[더벨][2024 승부수]'뉴롯데' 고삐 죄는 신동빈,비욘드디지털 모색",비욘드디지털의 개념은 단순히 디지털 기술을 넘어 혁신과 창조적인 사고를 통해 미래를 모색하고 발전시키는 것을 의미한다. 신 회장의 언급대로 롯데그룹은 계열사별로 AI 시대를 준비해왔다. 롯데쇼핑은 인공지능 기업 업스테이지와 생성형 AI 상호 업무 협약을 체결했고 롯데면세점은 AI 빅데이터...,https://www.thebell.co.kr/free/content/ArticleView.asp?key=202401041048462040106180,
10526,비욘드마케팅그룹,"BNK금융그룹, 모바일 채널 강화,비욘드금융생태계 조성",그룹전체 디지털 경쟁력 강화가 필요하다는 판단에서다. BNK금융은 위원회 출범 이후 다섯 차례 회의를 통해 ‘고객 지향적 시스템 혁신’과 ‘비욘드... 온·오프라인 채널 간 고객 데이터의 연계를 고도화해 보다 고객 지향적인마케팅을 펼친다는 전략이다. BNK금융은 ‘업무 프로세스 자동화 및 인프라...,https://www.hankyung.com/article/2023101061431,
10526,비욘드마케팅그룹,[제약업계 소식] 4월 29일,"온오프라인마케팅을 전개하여 소비자 접점을 확대할 계획이다""라고 말했다. 한편 조아제약은 29일과 30일 오전 11시 네이버 쇼핑라이브를 통해... ■한국베링거인겔하임 동물약품, 세계 수의사의 날 기념 '고잉비욘드(Going Beyond)' 캠페인 진행 한국베링거인겔하임동물약품(사장 서승원)이 세계 수의사의...",http://www.doctorstimes.com/news/articleView.html?idxno=226937,
