company_id,company_name,news_title,news_text,news_url,posted_at
306,비쥬얼다트,"BIC 조직위,비쥬얼다트와 BIC Festival 캐릭터 개발 MOU 체결","- MOU 통해 BIC Festival 대표 캐릭터 개발…보다 대중적이고 친근한 BIC Festival 이미지 제고- 대표 캐릭터 활용한 굿즈 개발도 함께 진행 계획…BIC Festival에서 최초 선보일 예정 사단법인 부산인디커넥트페스티벌조직위원회(조직위원장 서태건, 이하 BIC 조직위)는비쥬얼다트㈜(대표 이재윤)와...",http://www.thisisgame.com/webzine/news/nboard/4/?n=95907,
306,비쥬얼다트,"비쥬얼다트, 70만 달러 규모 일본 게임 그래픽 개발 수주","게임아트 전문기업비쥬얼다트가 일본 게임 그래픽 시장에 진출했다. 부산게임협회와 부산정보산업진흥원은비쥬얼다트, 골든피그엔터테인먼트, 펄스 등 3개 게임사가 지난 25일~26일 대만 타이페이에서 열린 '타이페이 게임쇼 2018'에 참가, 총 80만 달러 규모의 게임 개발 및 공급 계약을 체결했다고 29일...",http://www.etnews.com/20180129000338,
306,비쥬얼다트,"부산정보산업진흥원, 인턴십 프로그램으로 한-아세안 XR산업 전문 인력 양성","진흥원은 지난 7월부터 아세안 현지 법인 또는 연계 네트워크를 보유하고 있는 기업을 모집하여 ▲비쥬얼다트(서울) ▲프리모엠(부산) ▲유알정보기술(대구) 3개사를 선정했다. 이들에게는 프로그램 운영을 위한 체제비(강사료, 교육장 운영 및 임차 등)로 프로그램 별 최대 75백만원 이내, 총 1.5억 원을...",https://www.gpkorea.com/news/articleView.html?idxno=108283,
306,비쥬얼다트,"비쥬얼다트, 한국 아티스트들의 실력을 세계에 알리고 싶다!","비쥬얼다트는 게이머에게 생소한 회사다. 하지만, 게이머가 접하는 게임에는 이 회사의 흔적이 많이 담겨 있을 수도 있다. 국내 최고의 게임 그래픽 아웃소싱 회사이기 때문이다. 최근비쥬얼다트는 해외 시장 공략에 박차를 가하고 있다. GDC(게임개발자컨퍼런스) 2014에 부스를 낸 것도 그런 이유다. 소니, 징가...",http://www.thisisgame.com/webzine/news/nboard/5/?n=54423,
306,비쥬얼다트,"울트라 에이지, PC-콘솔 전 플랫폼 할인 이벤트 진행…저렴한 가격에 즐길 수...","2일 인트라게임즈(대표 배상찬)은 자사가 넥스트 스테이지,비쥬얼 다트와 협력해 출시한 ‘울트라 에이지(Ultra Age)’의 할인 이벤트를 진행한다고 밝혔다. 이번 할인 이벤트는 PlayStation®4와 Nintendo Switch™, 그리고 지난 4월 28일 선보인 PC 스팀까지 게임이 출시한 모든 플랫폼을 대상으로 진행하며...",https://www.xportsnews.com/article/1584429,
306,비쥬얼다트,"[리뷰]넥스트 스테이지 '울트라 에이지', PC 플랫폼으로 돌아온 국산 액션 게...",인트라게임즈가 유통하고 넥스트 스테이지와비쥬얼 다트가 개발한 액션 게임 '울트라 에이지'가 이번에는 PC 플랫폼 '스팀'과 인트라게임즈 ESD '포게임'을 통해 출시됐다. '울트라 에이지'는 부산의 대표 액션 게임 개발사 넥스트 스테이지와비쥬얼 다트가 협력해 개발한 하이 스피드 액션 게임이다. 4년...,http://gamefocus.co.kr/detail.php?number=128997,
306,비쥬얼다트,"그래픽·사운드 대폭 개선, '울트라에이지' PC 버전 4월 28일 출시","인트라게임즈는 금일(21일) 넥스트스테이지와비쥬얼 다트가 공동 개발하고, 자사가 퍼블리싱하는 액션 게임 '울트라에이지'의 로드맵을 소개하는 온라인 간담회를 공개하고, PC버전 출시일을 확정했다. '울트라에이지' PC 버전은 오는 4월 28일, 스팀 플랫폼을 통해 정식 출시된다. 온라인 간담회에 참석해 직접...",https://www.inven.co.kr/webzine/news/?news=270928,
306,비쥬얼다트,2021 게임자료 공유마당 운영사업 '제4회 게임마당 오픈포럼' 성황리에 마무리,"이번 제4회 게임마당 오픈포럼은 창조공작소 신소헌 대표, 마나크리 이원석 대표,비쥬얼다트이재윤 대표, 스테이지에이트 이완희 대표, 유유자적라이프 김윤정 대표를 모시고 리소스 외주개발사 현안과 현 상황에 맞는 게임마당 발전·지원 방향에 대해 논의하였다. 게임마당 오픈포럼은 총 3개의 세션으로...",https://www.thisisgame.com/webzine/game/nboard/225/?n=138041,
306,비쥬얼다트,"[인디인벤] 넥스트 스테이지, 그들이 언리얼로 게임을 만드는 이유는?","지금은비쥬얼 다트와 협력해 PS4 게임 '울트라 에이지'를 개발 중이다. 인디 게임 개발사 넥스트 스테이지는 지금까지 2개의 모바일 게임을 만들었으며, 지금은비쥬얼 다트와 협력해 PS4 게임 '울트라 에이지'를 개발 중이다. 소규모 개발자들의 경우 강력한 에셋 스토어를 갖춘 유니티로 개발하는 분위기가...",http://www.inven.co.kr/webzine/news/?news=208714&site=indie,
306,비쥬얼다트,"[BIC 2018] 울트라에이지, 스타일리시 액션으로 콘솔 시장 도전","강현우 넥스트스테이지 대표 = 게임조선 촬영 언리얼엔진4를 활용한 모바일게임 ‘다이스이즈캐스트’, ‘프로젝트아크’를 통해 높은 그래픽 퀄리티를 보여준 바 있는 개발사 넥스트스테이지가 게임그래픽 디자인을 전문으로 하는비쥬얼다트와 협력해 개발 중인 액션게임 ‘울트라에이지’가 BIC 2018을...",http://www.gamechosun.co.kr/article/view.php?no=150283,
