company_id,company_name,news_title,news_text,news_url,posted_at
12455,비쥬얼스톰,"[카닥터] BMW NEW 'X1', 러프 디자인 SAV ""이거 괜찮지 않아?""","색상은 주카로 베이지 메탈릭 미사노 블루 메탈릭 BMW 인디비쥬얼 스톰베이 메탈릭 등 3개다. 4개의 휠 디자인을 조합해 다양한 구성을 할 수 있다. 강력하고, 효율적인 파워트레인도 달았다. 유로 6d(Euro 6d-Temp) 규정을 충족하는 3기통또는 4기통 가솔린ㆍ디젤 엔진을 장착했고, 6단~8단 미션을 각...",http://www.econovill.com/news/articleView.html?idxno=364289,
12455,비쥬얼스톰,3기통부터 PHEV까지 부분변경 BMW X1 공개..국내는 하반기,"또한, 뉴 X1은 주카로 베이지 메탈릭, 미사노 블루 메탈릭, BMW 인디비쥬얼 스톰베이 메탈릭 등 3개의 컬러와 4개의 휠 디자인을 새롭게 추가해 소비자 선택의 폭을 넓혔다. 뉴 X1은 강력하고, 효율적인 3기통과 4기통 가솔린 및 디젤 엔진 라인업을 갖추고 있으며, 탑재된 모든 엔진은 새로운...",http://www.edaily.co.kr/news/newspath.asp?newsid=03663766622494168,
12455,비쥬얼스톰,"BMW, 프리미엄 컴팩트 SAV '뉴 X1' 글로벌 공개","또한, 뉴 X1은 주카로 베이지 메탈릭, 미사노 블루 메탈릭, BMW 인디비쥬얼 스톰베이 메탈릭 등 3개의 컬러와 4개의 휠 디자인을 새롭게 추가해 소비자 선택의 폭을 넓혔다. ◆강력하고 효율적인 파워트레인과 섀시 뉴 X1은 강력하고, 효율적인 3기통과 4기통 가솔린 및 디젤 엔진 라인업을...",http://www.thebigdata.co.kr/view.php?ud=201905291703436440d0a8833aad_23,
12455,비쥬얼스톰,PS4 ‘나루티밋스톰4 로드 투 보루토’ 한글판 1월 12일 예약 판매 실시,예약판매특전으로는 <나루토 -질풍전- 나루티밋스톰4 로드 투 보루토>의 키비쥬얼이 인쇄된 ‘콜렉터즈 카드’를 증정한다. 초회동봉특전으로는 스페셜 사운드 트랙(총 9곡)을 다운로드 할 수 있는 프로모션 코드와 특별 일러스트가 인쇄 된 리버시블 자켓도 함께 제공한다. 게임에 대한 보다 자세한...,http://www.thisisgame.com/webzine/news/nboard/225/?n=68199,
12455,비쥬얼스톰,퀘스트 파트너 프로그램 실시,"이번 파트너 프로그램 개편에 따라 협력사들은 코오롱아이넷과 다우기술, 인성디지털, 에이스톰텍,비쥬얼데이타 등의 5개 총판을 비롯, 솔루션 파트너, 파워 리셀러, 리셀러, 서비스 파트너, SI 파트너 등의 6개 그룹을 구분해 단계에 따른 지원을 펴겠다고 회사 측은 밝혔다. 이들 6개 그룹에는 교육뿐...",http://www.dt.co.kr/contents.html?article_no=2007041802010760704003,
12455,비쥬얼스톰,김태희 김수현 시상식 포착 '어메이징한 투샷! 이런비쥬얼본적 있나요?',"특히 두 사람은 ‘드림 아이콘’ 상을 수상하며 한류스타의 위상을 높여 이목을 집중시켰습니다. 이시각 주요 이슈로는 히어로즈 오브 더스톰, 미샤, 도타2, 음악중심, 고아라, 클라라 등이 화제가 되고 있습니다. < Copyright ⓒ MBN(www.mbn.co.kr) 무단전재 및 재배포 금지 >",http://mbn.mk.co.kr/pages/news/newsView.php?category=mbn00012&news_seq_no=1537925,
12455,비쥬얼스톰,[에이지오브스톰]난전의 강자! 은신과 적의 납치에 특화된 암살 영웅 비트레이...,"비록 익숙해지기 까지 어느정도 숙련이 필요하지만 기습적인 은신을 통한 암살과 아슬아슬하게 살아오는 생존력, 충격적인비쥬얼을 가진 외모를... ▲ 외모와 스킬의비쥬얼이 강렬해서인지 적의 가호를 빼내기 쉽다!■ 영웅 스킬 정보 1번 스킬 : 팬텀 나이프 효과 : 패시브 효과로 일반공격 3타 시 60/90/120의...",http://www.inven.co.kr/webzine/news/?news=102243&site=aos,
12455,비쥬얼스톰,도깨비스톰주문형공연 `인기 뚝딱`,"풍물, 무용, 관현악 등을 구사하는 전통 예술 전문인들은 강한비쥬얼의상에 한국 전통 생활소재인 항아리, 대나무 등을 악기로 활용해 다양한 레퍼토리를 만들어내고 있다. 회사 관계자는 ""짧은 시간에 감동을 전하는 게 필수인 외부 행사에서 `도깨비스톰'은 최단시간 내 빠르게 관객을...",https://n.news.naver.com/mnews/article/029/0000038915?sid=111,
12455,비쥬얼스톰,"""가정의 달 대목잡고 코로나 쇼크 탈출"" 국내 완구업계 총력전",■반값 할인 등 판촉전 열기고조 4일 업계에 따르면 로이비쥬얼은 온라인몰에서 5일까지 패키지 상품을 최대 50% 할인 판매에 돌입했다. 어린이날... 이 업체는 가정의 달을 앞두고 애니메이션 헬로카봇 시즌10-뱅의 '자이언트 로더'와 시즌9-펜타스톰X 리턴즈 '펜타스톰X'을 출시하는 등 제품을 다양화하고 있다....,http://www.fnnews.com/news/202105041800501951,
12455,비쥬얼스톰,[2024 게임사 전략] <하>스마일게이트·크래프톤·카카오게임즈 시장 공략 '3...,이용자들에게 익숙한 여러 동화 속 주인공들을 재해석한 개성 넘치는 캐릭터로 고유한 스킬과 플레이 스타일을 통해 아기자기하면서 세련된비쥬얼을... 플라이웨이게임즈의 지난해 세컨드파티 퍼블리싱 투자 규모가 925억원(퍼니스톰·플레이긱·가든스인터랙티브·피플캔플라이그룹)을 넘어섰다....,http://www.srtimes.kr/news/articleView.html?idxno=149473,
