company_id,company_name,news_title,news_text,news_url,posted_at
9356,삼양디자인,"삼양식품, 불닭볶음면으로 전세계에 '불닭웨이브'","결혼 후 평범한 가정주부이자 엄마였으나삼양식품이 IMF 외환위기 때 부도를 맞자 1998년삼양식품에 입사했다. 이후 섬세한 미각과디자인, 마케팅 능력을 발휘하며 적응했고, 불닭볶음면 출시를 주도했다. 김 부회장은 2011년 명동에서 젊은이들이 땀을 뻘뻘 흘리면서 ""스트레스 풀린다""며 매운 음식을 먹는...",http://www.fnnews.com/news/202405011218255073,
9356,삼양디자인,"삼양김정수 부회장의 최애 '까르보불닭', 뉴욕타임즈 주목",까르보불닭은 김정수 부회장이 직접 패키지디자인에 신경 쓸 정도로 불닭 시리즈 중 ‘최애’로 알려졌다.삼양라운드스퀘어는 뉴욕타임즈를 통해 까르보불닭볶음면의 미국 품절대란 현상이 소개됐다고 22일 밝혔다. 까르보불닭은 기존 불닭볶음면에 크림 분말 스프가 첨가된 상품으로 매운 맛과...,http://www.shinailbo.co.kr/news/articleView.html?idxno=1862198,
9356,삼양디자인,"삼양라운드스퀘어, '맵탱' 모델로 이이경 발탁…롯데웰푸드, 외국인 관광객 대...","맵탱 모델 이이경 ⓒ삼양라운드스퀘어삼양라운드스퀘어, '맵탱' 모델로 이이경 발탁삼양라운드스퀘어는 매운 국물 라면 브랜드 '맵탱'의 새 광고... 2번 타입은 한국 전통 자개장 느낌의디자인으로 광화문과 단청 꽃문양이 들어갔다. 후면디자인은 세트를 구성하는 빼빼로 6종(오리지널, 아몬드...",http://www.sisaon.co.kr/news/articleView.html?idxno=160591,
9356,삼양디자인,"[식품家 자제들③]삼양식품 3세 전병우의 청사진, 그 기대와 부담","또 직속조직으로 라면 TFT팀을 신설하고 불닭에 이어 야심차게 미는 라면 신규 브랜드 ‘맵탱’ 기획은 물론 네이밍,디자인, 광고 등 전 과정에 참여했다.삼양애니(ANNI) 대표와 지주사삼양내츄럴스 전략기획부문장도 맡았다. 올해 30세 ‘이립(而立)’의 전 상무는 그룹 전략총괄과 함께 신사업본부장을...",http://www.shinailbo.co.kr/news/articleView.html?idxno=1863750,
9356,삼양디자인,"삼양식품, 日 불닭 굿즈 마케팅…한인마트와 맞손",삼양식품은 인기제품 불닭볶음면 패키지디자인으로 열쇠고리 굿즈 4종을 출시했다. 오리지널 불닭볶음면을 비롯해 △까르보 불닭볶음면 △치즈 불닭볶음면 △콰트로치즈 불닭볶음면 △야키소바 불닭볶음면 열쇠고리를 준비했다. 탑마트 신주쿠점은 일본 도쿄 신주쿠구 신오쿠보에 들어섰다. 신오쿠보는...,https://www.theguru.co.kr/news/article.html?no=69351,
9356,삼양디자인,"삼양식품, '대한민국패키지디자인대전' 대상 수상","이수경삼양식품디자인팀장은 ""브랜드의 차별화된 가치를 담아내고자 한 부분이 좋은 결과로 이어진 것 같다""며 ""앞으로도 브랜드 철학을 담은 혁신적인디자인으로 소비자와 소통하도록 노력하겠다""고 말했다.삼양식품의 건면HMR 브랜드 '쿠티크'",http://www.youngnong.co.kr/news/articleView.html?idxno=44942,
9356,삼양디자인,"삼양식품, 건면ㆍHMR 브랜드 '쿠티크' 패키지디자인대전서 대상","별사탕 캐릭터를 적용한 두 패키지가 양쪽에서 줄다리기를 하는 스토리를 보여줬다.삼양식품 이수경디자인팀장은 ""브랜드의 차별화된 가치를 담아내고자 한 부분이 좋은 결과로 이어진 것 같다""며, ""앞으로도 브랜드 철학을 담은 혁신적인디자인으로 소비자와 소통하도록 노력하겠다""고 말했다.",http://www.foodnews.co.kr/news/articleView.html?idxno=105758,
9356,삼양디자인,"삼양식품, ‘2023 제32회 대한민국패키지디자인대전’ 대상 수상","(Picantia)’, 라면과자 브랜드 ‘별뽀빠이’를 출품해 각각 대상과 팩스타상을 수상했다. 이수경삼양식품디자인팀장은 “브랜드의 차별화된 가치를 담아내고자 한 부분이 좋은 결과로 이어진 것 같다”며 “앞으로도 브랜드 철학을 담은 혁신적인디자인으로 소비자와 소통하도록 노력하겠다”고 말했다.",https://www.cnbnews.com/news/article.html?no=632505,
9356,삼양디자인,K-매운맛 제대로 알린삼양···4분기도 실적 호조 이어가나,"해당 시상식은 한국패키지디자인협회가 주최하고 산업통상자원부·한국디자인진흥원 등이 후원하는 국내 대표디자인어워드로,삼양식품은 건면/HMR 브랜드 쿠티크(COOTIQ)와 수출 전용 브랜드 피칸티아(Picantia), 국내 최초 라면과자 브랜드 별뽀빠이를 출품해 각각 대상과 팩스타상을 수상했다. 대상을...",https://www.womaneconomy.co.kr/news/articleView.html?idxno=220378,
9356,삼양디자인,창립 100돌삼양그룹…김윤 회장 “New삼양원년 삼을 것”,로고는 그룹의 유산을 계승하는 동시에 다음 세대를 향한 움직임을 담아디자인됐습니다.삼양그룹은 100주년 기념 로고를 다양한 색과 형태로 만들어 올해 생산되는 제품과 기념굿즈 등에 적용할 계획입니다.삼양그룹 2024년 시무식에서 김윤 회장이 신년사를 발표하는 모습. 사진ㅣ삼양그룹,https://www.inthenews.co.kr/news/article.html?no=59349,
