company_id,company_name,news_title,news_text,news_url,posted_at
6093,샵피온,"한진, 해외전용 오픈마켓 사업 시작","원클릭 해외배송 카테고리에는 이메세지,샵피온등 종합 인터넷 몰이 입점했다. 고객이 이하넥스 사이트를 방문해 이메세지,샵피온등의 인터넷쇼핑몰에서 제품을 구입하면 한진 사이트 내에서 바로 결제가 이뤄진다. 해외배송대행 제휴몰은 국내 사이트인 패션밀과 일본 임부복 사이트인 이보라보라가...",http://www.etnews.co.kr/news/detail.html?id=201012170056,
6093,샵피온,어느 인터넷쇼핑몰이 상품정보를 잘 제공하고 있나?,e킴스클럽쇼마켓온걸럭키스토어반품닷컴샵피온369쇼핑프라이스디엔조잉몰쇼핑스타한국비즈제이e재래시장바이이즈유니즈닷컴드림쇼핑몰폭스필... 5%)119건62건 ○ 가이드라인 준수요청을 모두 이행한 인터넷쇼핑몰 현황(28개) 옥션지마켓위즈웰 여인닷컴샵피온쇼핑스타분홍코끼리ATC홈쇼핑오일...,http://korea.kr/newsWeb/pages/brief/partNews2/view.do?dataId=155366249&call_from=extlink&call_from=extlink,
6093,샵피온,인터넷쇼핑몰 `국제무역시대` 열렸다,"이하넥스 사이트를 방문해 이메세지,샵피온등의 인터넷쇼핑몰에서 제품을 구입하면 한진 사이트 내에서 바로 결제가 이뤄진다. 해외배송대행 제휴몰은 국내 사이트인 패션밀과 일본 임부복 사이트인 이보라보라가 입점했다. 국내는 물론이고 해외에 있는 고객까지 이하넥스 사이트 내에서 물건을 구입하면...",http://www.etnews.co.kr/201101110030,
6093,샵피온,인터넷쇼핑몰 상품정보제공 `좀 나아졌지만`,"삼성카드몰,샵피온, 신나고, 신세계몰, 예스24, 오가게, 오일피알닷컴, 오토쇼핑, 온니포유, 와이와이샵, 워커힐면세점, 지오몰, 푸드나라몰, 하이마트, 하프클럽, 현대홈쇼핑, 홈플러스인터넷쇼핑몰, AK몰, ATC홈쇼핑, CJ오쇼핑, Enter6mall, GS리테일, GS홈쇼핑, NH쇼핑 9개 상품 준수(2) 제로투세븐, 하이홈쇼핑...",http://www.edaily.co.kr/news/newspath.asp?newsid=01082406593069944,
6093,샵피온,특산품ㆍ첨단기기`눈이 번쩍`,"특히, GSㆍCJㆍ우리ㆍ현대ㆍ농수산ㆍ삼성ㆍ다음ㆍ샵피온ㆍ코리아 등의 홈쇼핑업체들이 총 63명의 MD들을 파견해 마련되는 상담의 장(場)은 중소기업 판매 촉진의 새로운 활력소가 될 전망이다. 온라인쇼핑몰인 G마켓은 박람회 기간동안 특별 온라인 홍보패키지를 마련하고 한 달동안 입점 서비스도...",http://www.heraldbiz.com/SITE/data/html_dir/2006/09/08/200609080042.asp,
6093,샵피온,지금 쇼핑몰에선,○…종합쇼핑몰샵피온(www.shopion.co.kr)에서는 3만원이상 구매고객을 대상으로 영화 주간지 `무비위크`를 무료로 증정한다. ○…종합쇼핑몰 세이브앤조이(www.savenjoy.co.kr)에서는 1만원이상 초콜릿 구매고객 전원에게 3가지 선물을 담은 `퍼니3팩`(Funny3Pack) 사은품을 증정한다. 2만원이상...,https://n.news.naver.com/mnews/article/029/0000128446?sid=105,
6093,샵피온,"중소제조업체,홈쇼핑 통해 판로개척","이번 행사엔 농수산홈쇼핑, 삼성몰,샵피온, 신세계몰, 우리홈쇼핑, 코리아홈쇼핑, 현대홈쇼핑, CJ홈쇼핑, GS홈쇼핑 등 대형 유통업체 9개사가 이미 참여를 신청했다. 이들 유통업체들은 상품군별로 행사기간중 현장에 나와 중소제조업체들과 상담에 나설 담당MD 선정을 마친 상태다. GS홈쇼핑의...",http://www.moneytoday.co.kr/view/mtview.php?type=1&no=2005092114360550603&outlink=1,
6093,샵피온,[지금쇼핑몰에선],"○…종합 쇼핑몰샵피온(www.shopion.co.kr)에서는 7월 20일부터 8월 20일까지 MP아이 MP3를 구매하는 고객에게 매주 5명에게 맥스무비 영화예매권을 9명을 추첨하여 하드타입 MP3, 본더치 모자, 티셔츠 세트, 휴가비 10만원을 지원하는 이벤트를 진행한다. ○…컴퓨터 전문 쇼핑몰...",https://n.news.naver.com/mnews/article/029/0000110511?sid=105,
6093,샵피온,[인터넷 구매가이드]에이원프로 전자사전 `AP750`,"조아존(www.joazone.com)에서는 36만3000원, 맥스마켓(www.maxmarket.co.kr)에서는 37만6000원에 구매 가능하며,샵피온(www.shopion.co.kr)ㆍ터치플러스(www.touchplus.co.kr)는 38만원, 컴퓨존(www.compuzone.co.kr)ㆍ핫엠피(www.hotmp.co.kr)는 39만8000원에 판매중이다. 대형몰의 경우 G마켓(www.gmarket.co.kr)에서는...",https://n.news.naver.com/mnews/article/029/0000101800?sid=105,
6093,샵피온,[지금 쇼핑몰에선]`오렌지PC` 구매시 사은품,"쿠쿠압력솥 무이자 3개월 ○…종합쇼핑몰샵피온(www.shopion.co.kr)은 오는 28일까지 쿠쿠압력밥솥을 구매하는 고객들에게 1만원 할인쿠폰과 무이자 3개월 혜택, 밀폐용기세트 등을 사은품으로 제공한다. ○…종합쇼핑몰 바이이즈(www.buyis.co.kr)는 오는 18일까지 제품구매경험이 있는 회원들을...",https://n.news.naver.com/mnews/article/029/0000095363?sid=105,
