company_id,company_name,news_title,news_text,news_url,posted_at
5924,스카이패션,옛 충주세무서 자리에 지상 37층 '센텀스카이' 들어선다,"주변에 로데오패션거리, 먹거리타운, 이마트, 보건소 등 다수의 편의시설이 자리 잡고 있고, 도보권에 초·중·고교 등의 교육환경도 갖춰져 있다. 충주천변 공원, 용산생활체육공원을 비롯해 호암생태공원 이용이 편리한 점도 센텀스카이의 강점이다. 전세 아파트는 자격 제한이 없고, 자격조건도 없다....",https://www.news1.kr/articles/5410881,
5924,스카이패션,"삼성물산패션구호플러스, '24년 여름 시즌 컬렉션' 출시","삼성물산패션부문의 하이 스트리트웨어 브랜드 구호플러스는 청량하면서도 여성스러운 무드를 담은 '24년 여름 시즌 컬렉션'을 출시했다고 8일 밝혔다.... 애쉬 그레이·스카이블루 컬러의 시어(속이 비칠 정도로 얇은)한 소재로 디자인한 볼륨 소매 점퍼, 라벤더 컬러의 블라우스와 그린 리본 니트 풀오버 등이다....",https://www.dailian.co.kr/news/view/1358873/?sc=Naver,
5924,스카이패션,[#패션·뷰티 신상이오] K2 '코드텐 우븐 라운드 티셔츠' 출시 外 내셔널지오...,"9일 다양한패션·뷰티 신제품 소식을 전한다. ◆K2 '코드텐 우븐 라운드 티셔츠' 출시 K2가 초냉감 원사에 통기성이 뛰어난 우븐 소재를 적용한 '코드텐... 컬러는스카이블루, 블랙 2가지다. 먼싱웨어의 리조트 컬렉션은 먼싱웨어 전국 매장과 공식 온라인몰에서 판매된다. ◆에뛰드 '재창조 메이커 시즌2' 출시...",https://www.newscj.com/news/articleView.html?idxno=3137712,
5924,스카이패션,"""토토로 티셔츠 입어볼까""패션·뷰티업계도 캐릭터 협업 활발","귀엽고 사랑스러운 애니메이션 주인공이 그려진 옷이나 제품은 통상 아이들의 것이라고 생각하기 쉽지만, 최근패션·뷰티업계는 MZ세대를 공략하기 위해... 더블플래그와 시나모롤 콜라보 컬렉션은 시나모롤 특유의 분위기를 그대로 담아내고자스카이블루, 아이보리, 핑크 등 부드럽고 밝은 컬러에 집중했다....",https://www.newsis.com/view/?id=NISX20240503_0002723537&cID=13001&pID=13000,
5924,스카이패션,"시티브리즈, 일본 상륙…팝업 열고 K-패션알린다",일본 젊은 세대를 중심으로 K-패션에 대한 현지 반응이 뜨거워지자 현지 오프라인 시장을 공략하면서 소비자 접점을 확대하는 모양새다. 9일 업계에 따르면 시티브리즈가 오는 14일까지 일본 오사카 한큐백화점 우메다본점에 팝업스토어를 연다. 한큐백화점 우메다본점은 오사카 랜드마크인스카이빌딩...,https://www.theguru.co.kr/news/article.html?no=70669,
5924,스카이패션,"비수기 무더위 호재…패션街, 냉감의류 수요 공략 스타트","사진=프로스펙스 매일일보 = 민경식 기자 | 때 이른 더위로패션업계가 냉감 의류 시장을 선점하기 위해 열을 올리고 있다. 올해는 이전보다 다양한... 주요 제품으로 '코드텐 아이스 폴로', '코드텐 아이스스카이데님' 등이 있다. 마운티아는 시원한 착용감으로 더운 여름까지 간편히 착용 가능한 '아토 쿨...",http://www.m-i.kr/news/articleView.html?idxno=1117410,
5924,스카이패션,옛 충주세무서 자리에 '센텀스카이' 아파트 신축,"이런 가운데 옛 충주세무서 자리에 10년 전세아파트인 '센텀스카이'가 신축되는 것으로 알려지면서 이 지역 주민들이 크게 반기고 있다. 센텀스카이... 또 주변에는 로데오패션거리와 먹거리타운, 이마트, 보건소 등 다수의 편의시설이 근거리에 위치해 충분한 인프라를 구축하고 있다. 도보권에 초·중·고교...",http://www.jbnews.com/news/articleView.html?idxno=1434554,
5924,스카이패션,패션·육아 플랫폼서 ‘프리오더’ 인기 끌어,스카이데일리 노태하기자 = 육아 플랫폼에서도 젊은 부모 중심으로 프리오더가 주목받아 ▲ 이랜드월드 키디키디. 이랜드월드 제공패션플랫폼에서 선주문 후제작 시스템인 ‘프리오더’가 인기를 끌고 있다. 1일 2019년부터 디자이너 브랜드 상품에 프리오더 서비스를 도입해 운영 중인 W컨셉에 따르면 최근...,https://www.skyedaily.com/news/news_view.html?ID=230477,
5924,스카이패션,옛 충주세무서 자리에 주상복합아파트 ‘센텀스카이’ 신축,"해당 아파트는 10년 전세아파트인 '센텀스카이'. 아파트 신축 소식이 알려지면서 이 지역 주민들은 크게 반기고 있으며 해당 지역의 심각한 도심공동화... 주변 인프라도 탄탄해 로데오패션거리와 먹거리타운, 이마트, 보건소 등 다수의 편의시설이 근거리에 위치해 있다. 도보권에 초·중·고교 등...",https://www.joongdo.co.kr/web/view.php?key=20240501010000306,
5924,스카이패션,충주 구도심에 '센텀스카이' 들어선다,"10년 전세아파트인 '센텀스카이'가 해당 아파트다. 이 아파트는 옛 충주세무서 자리에 들어선다. 충주세무서도 지난 2006년 성남동 청사에서 금릉동... 주변 인프라도 탄탄해 로데오패션거리, 먹거리타운, 이마트, 보건소 등 다수의 편의시설이 근거리에 위치해 있다. 도보권에 초, 중, 고교 등의 교육환경이...",https://www.inews365.com/news/article.html?no=812140,
