company_id,company_name,news_title,news_text,news_url,posted_at
14631,시브이바이오,"미래 먹거리 ‘바이오산업·중재의료기기’ 공략하는 전주시, 장기적 차원 후...","협약에는 동국생명과학(주), ㈜시브이바이오, ㈜시지바이오, ㈜오에스와이메드, ㈜S&G바이오텍, ㈜제가텍, ㈜티디엠 등 7개로 서울, 경기, 인천, 광주 등 전국에 소재한 중재의료기기 기업들이 참여했다. 이 자리에서 협약에 참여한 산·학·관 대표들은 △중재의료기기 및 바이오분야 공동연구개발 및 제품화...",https://www.jjan.kr/article/20230503580119,
14631,시브이바이오,전북대 '메카노바이오활성소재 혁신의료기기 실증센터' 의료기기기업 간담회 ...,"이날 전북대 국제컨벤션센터에서 열린 간담회에는 한국보건산업진흥원, 전북대, 전북대병원, 안전성평가연구원 등 유관기관을 비롯해 관련 기업인 플라스바이오, 에이블, 휴벳, 바이오램프, 바이오인터벤션, TDM, 오에스와이메드,시브이바이오, 제이앤킴 등이 참여해 현실적 사업화 지원을 위한 애로사항 청취...",http://www.veritas-a.com/news/articleView.html?idxno=438741,
14631,시브이바이오,"전주, 메카노바이오혁신의료기기 산업 전진기지로!","이와 함께 이날 세미나에는 플라스바이오와 에이블 등 전북지역 기업과 ㈜TDM, ㈜오에스와이메드, ㈜시브이바이오등 국내 의료기기 개발기업 등도 참여해 실증센터에 대한 기업들의 높은 관심을 나타냈다. 이외에도 이번 세미나에는 안정성평가연구원과 캠틱종합기술원, 전북대병원도 참여해 실증센터와...",http://www.domin.co.kr/news/articleView.html?idxno=1396558,
14631,시브이바이오,"전주, '메카노바이오혁신의료기기 산업' 전진기지로..2025년까지 215억 투입","이와 함께 이날 세미나에는 플라스바이오와 에이블 등 전북지역 기업과 ㈜TDM, ㈜오에스와이메드, ㈜시브이바이오등 국내 의료기기 개발기업 등도 참여해 실증센터에 대한 기업들의 높은 관심을 나타냈다. 이외에도 이번 세미나에는 안정성평가연구원과 캠틱종합기술원, 전북대병원도 참여해 실증센터와...",http://kpenews.com/View.aspx?No=2537071,
14631,시브이바이오,"전주시·전북대학교, 메카노바이오혁신의료기기 실증센터 활성화 세미나 개...","이와 함께 이날 세미나에는 플라스바이오와 에이블 등 전북지역 기업과 ㈜TDM, ㈜오에스와이메드, ㈜시브이바이오등 국내 의료기기 개발기업 등도 참여해 실증센터에 대한 기업들의 높은 관심을 나타냈다. 이외에도 이번 세미나에는 안정성평가연구원과 캠틱종합기술원, 전북대병원도 참여해 실증센터와...",http://www.newsfreezone.co.kr/news/articleView.html?idxno=409081,
14631,시브이바이오,"지자체,바이오⸱헬스케어 열풍...투자유치 팔 걷어","# 전주시 바이오헬스케어 산업 육성 맞손 전주시가 바이오 헬스케어 산업 육성을 위해 전북대학교와 시지바이오, 태웅 메디칼, 티디엠,시브이바이오, 오에스와이메드, S&G바이오텍 국내 6개 바이오 의료기기 업체들과 손을 맞잡았다. 이들 기업은 스텐트, 카테터 등 중재의료기기를 주력으로 개발·생산하고...",http://www.pharmnews.com/news/articleView.html?idxno=202343,
14631,시브이바이오,"전주시-의료기기 기업,바이오클러스터 구축 ‘맞손’","협약에 참여한 6개 기업은 ㈜시지바이오, ㈜태웅 메디칼, ㈜티디엠,시브이바이오, 오에스와이메드, S&G바이오텍 등이다. 이들 기업은 스텐트, 카테터 등 중재의료기기를 주력으로 개발·생산하고 있다. 참석자들은 시와 전북대가 구축 중인 바이오 헬스케어 클러스터 관련 바이오 시설·장비를 공유하고, 신제품...",http://www.smartfn.co.kr/view.php?ud=20220324075040942302c37af707_46,
14631,시브이바이오,"전주시,바이오헬스케어 산업 육성 위해 의료기기 업체와 '맞손'","협약에 참여한 6개 기업은 ㈜시지바이오, ㈜태웅 메디칼, ㈜티디엠,시브이바이오, 오에스와이메드, S&G바이오텍 등이다. 이들 기업은 스텐트, 카테터 등 중재의료기기를 주력으로 개발·생산하고 있다. 참석자들은 시와 전북대가 구축 중인 바이오 헬스케어 클러스터 관련 바이오 시설·장비를 공유하고, 신제품...",https://www.wikitree.co.kr/articles/741145,
14631,시브이바이오,"전북대·전주시·기업, 중재의료기기 산업 활성화 업무협약","이날 협약식에는 우범기 전주시장과 송철규 전북대 연구부총장, 권덕철 전 보건복지부장관, 박찬희 전북대 메카노바이오활성소재 혁신의료기기 실증센터장 등과 의료기기 관련 기업인 동국생명과학,시브이바이오, 시지바이오, 오에스와이메드, S&G바이오텍, 제가텍, 티디엠 총 7개 기업의 대표들이 참석했다....",https://www.nocutnews.co.kr/news/5938225,
14631,시브이바이오,"전북대학교, 중재의료기기산업 발전 위해 산·학·관 '연대'","이날 오후 4시부터 전북대 국제컨벤션센터에서 열린 간담회에는 한국보건산업진흥원, 전북대, 전북대병원, 안전성평가연구원 등 유관기관을 비롯해 관련 기업인 ㈜플라스바이오, 에이블(주), ㈜휴벳, ㈜바이오램프, 바이오인터벤션, ㈜TDM, ㈜오에스와이메드, ㈜시브이바이오, ㈜제이앤킴 등이 참여해 현실적...",https://www.lecturernews.com/news/articleView.html?idxno=113322,
