company_id,company_name,news_title,news_text,news_url,posted_at
2370,시스템어소시에이츠,"시스템어소시에이츠, 백신예약시스템 장애 해결 등 시스템구조개선 성공적 수...","이 가운데, 질병관리청의 요청을 받은시스템어소시에이츠(대표 홍성용)가 백신예약시스템 개선을 위해 긴급 지원팀을 편성한 후 신속한 장비 확보 등을 통한 서버 및 스토리지 보강을 성공적으로 수행했다고 12일 밝혔다.시스템어소시에이츠는 복합 모델 5노드 RAC를 성공적으로 구축하여 기존 30만 건의...",https://www.dailysecu.com/news/articleView.html?idxno=127565,
2370,시스템어소시에이츠,"[BizⓝCEO] ㈜시스템어소시에이츠, 경영목표는 '더불어 사는 세상'",< 이 기사는 BizⓝCEO 기획특별판 입니다 > ㈜시스템어소시에이츠(대표 홍성용 www.sa.co.kr)는 시스템 통합에 필요한 토털 솔루션을 제공하는 기업이다. 홍성용 대표는 2004년 31살의 나이로 회사를 설립하고 다음 해 부터국세청과 대한주택공사，대전정부통합전산센터 등의 굵직굵직한 국가 산업의 시스템...,http://www.hankyung.com/news/app/newsview.php?aid=2011062611181,
2370,시스템어소시에이츠,"美 애질리티 로보틱스, 맨해튼어소시에이츠와 협력",시장에는 많은 창고 관리시스템(WMS)이 있지만 주목되는 것은 맨해튼어소시에이츠가 대형 제3자물류(3PL) 운영에 있어서 표준을 보유한 회사라는 점이다. 애질리티는 창고 자동화 공급업체들을 위한 맨해튼 밸류 파트너(MVP) 프로그램과 맨해튼 오토메이션 네트워크(MAN)에 참여하고 있다. 맨해튼과 애질리티는...,http://www.irobotnews.com/news/articleView.html?idxno=34529,
2370,시스템어소시에이츠,'새로운 랜드마크 위해'...아트파크디자인 공모전 찾은 이장우 대전시장,"이번 공모에는 ▲켄고 쿠마 &어소시에이츠(일본) ▲유엔 스튜디오(네덜란드) ▲자하 하디드 아키텍츠(영국), 국내팀 ▲건축사사사무소 에스오에이㈜ ▲㈜더시스템랩 건축사사무소 ▲㈜에스케이엠 디자인 ▲운생동 건축사사무소㈜ 등 국내·외 건축가 7팀이 작품을 제출했다. jongwon3454@newspim.com",https://www.newspim.com/news/view/20240510000970,2024-05-10 15:09
2370,시스템어소시에이츠,"시스템어소시에이츠, '백신 예약시스템 개선' 과기정통부 감사패 받아",시스템어소시에이츠는 코로나19 예방접종 사전예약 시스템의 안정적인 운영에 기여한 공로를 인정받아 과학기술통신부와 질병관리청으로부터 감사패를 전달 받았다고 31일 밝혔다. 과학기술정보통신부와 질병관리청은 지난 25일 '코로나19 예방접종 예약시스템 개선 관련 참여 기업기관 간담회'를 열고...,http://it.chosun.com/site/data/html_dir/2021/08/31/2021083101096.html,
2370,시스템어소시에이츠,"""수요 탄탄한 美클라우드·인도 헬스케어 … 지금이 투자 적기""","시파히말라니 CIO는 ""이 같은 환경에서 유망 투자처는 큰 내수시장에 접근권을 가지거나 특정 정치권역 내 자급시스템을 갖춘 회사""라고 설명했다. 예를... 세계 최대 헤지펀드 브리지워터어소시에이츠의 캐런 카니올-탬버 공동 CIO는 지정학 리스크가 부상하면서 △군비 확대 △공급망 재편 △보호무역 기반...",https://www.mk.co.kr/article/11010825,
2370,시스템어소시에이츠,‘경제 우려 지속돼 IT 일자리 증가세 둔화’… 얀코어소시에이츠보고서,"경영 컨설팅 업체 얀코어소시에이츠(Janco Associates)에 따르면 2023년 4분기 기업들이 약 21,300개 일자리를 추가했음에도 연간 전체 증가 수는 700개에... 반면 같은 기간 컴퓨터시스템설계 업체는 32,300개, 호스팅 제공업체는 14,000개 일자리가 늘었다”라고 설명했다. 현재 IT 구직자들이 직면한 상황에는...",https://www.ciokorea.com/news/320611,
2370,시스템어소시에이츠,"유나이티드어소시에이츠, 혁신적인 AI 학습 솔루션 '엘라' 플랫폼의 B2B 상용...","유나이티드어소시에이츠는 AI 기술 기반의 영어 아웃풋 솔루션인 엘라를 코리아폴리스쿨의 온라인 학습 프로그램(AI 스피킹/라이팅 허브)과 교사들을 위한 학습 관리시스템(LMS)에 맞춤 적용하고, 11월부터 서비스 운영을 시작했다. 엘라는 의사소통 중심의 글로벌 역량 강화를 위해 암기식 영어 스피킹...",https://www.aitimes.kr/news/articleView.html?idxno=29564,
2370,시스템어소시에이츠,"유니포인트,시스템어소시에이츠와 ‘VEGAL’ 총판 계약 체결",웹서비스에 대한 성능 및 장애 실시간 진단 솔루션 [보안뉴스 김태형] 유니포인트(대표 안국필)와시스템어소시에이츠(대표 홍성용)는 최근 사용자 중심의 웹 서비스 모니터링 솔루션인 ‘VEGAL’의 독점 총판계약을 체결했다.시스템어소시에이츠의 VEGAL은 웹서비스에 대한 성능 및 장애를 실시간으로...,http://www.boannews.com/media/view.asp?idx=33498&kind=1,
2370,시스템어소시에이츠,대전아트파크 디자인 작품 발표회…국내외 7팀 참여,"공모에는 국내·외 세계적 건축가 7팀이 참여했으며 국외팀 켄고 쿠마 &어소시에이츠(일본), 유엔 스튜디오(네덜란드), 자하 하디드 아키텍츠(영국)와 국내팀 건축사사사무소 에스오에이㈜, ㈜더시스템랩 건축사사무소, ㈜에스케이엠 디자인, 운생동 건축사사무소㈜ 총 7팀이 작품을 제출했다. 이번...",https://www.newsis.com/view/?id=NISX20240430_0002718395&cID=10807&pID=10800,
