company_id,company_name,news_title,news_text,news_url,posted_at
8359,싸인디지텍,[주식의신] 순위경쟁 불붙었다! CJCGV·BGF리테일·레드로버·금비·한국큐빅...,"CJCGVㆍBGF리테일ㆍ레드로버ㆍ금비ㆍ한국큐빅ㆍ바이오싸인ㆍ코리아에스이ㆍ유유제약ㆍ전방ㆍ현대산업ㆍKTcsㆍ케이엘티ㆍ고려개발 종목으로... 한양디지텍, 디에스케이, 케이엘티, 대성미생물, 에스티오, 아이텍반도체, 대우SBI스팩1호 *오늘의 하한가 [코스피] 포스코플랜텍 [코스닥] 신일제약...",http://www.starseoultv.com/news/articleView.html?idxno=320708,
8359,싸인디지텍,한 눈에 보는 2월 27일 장 이후 주요 뉴스 및 공시,"2% 감소 ▷ 한양디지텍, 지난해 영업익 79억…전년비 168.8%↑ ▷ 진흥기업, 1087.1억 규모 주택재개발 정비사업 공사수주 ▷ LIG손해보험, 12월 영업손... 바이오싸인""지앤엘 지분 인수 검토중"" ▷ 코나아이, 작년 4Q 영업익 82억…전년비 268%↑ ▷ 신일산업, 지난해 영업이익 26억원..전년比 61.28...",https://n.news.naver.com/mnews/article/011/0002646618?sid=101,
8359,싸인디지텍,올해 불성실공시 끝판왕은?,유가증권 상장업체 유니켐은 올해에만 3차례 불성실공시법인으로 지정돼 현재 상장폐지 기로에 선디지텍시스템과 함께 최대치를 기록하는 불명예를... 신우는 이후 바이오싸인(구 경원산업)의 자회사인 썬포커스에 매각됐으나 새주인 역시 만성적자기업이라 미래가 불투명하다. 2년간 4차례 불성실공시(올해...,http://news.mk.co.kr/news_forward.php?domain=news&no=1547036&year=2014,
8359,싸인디지텍,"[Today Biz]""협력사와 상생"" 삼성SDI, 동반성장 대축제","동방디지텍이 품질혁신 부분에서 삼성SDI 대표이사상을 각각 수상했다. 그 외 동일알루미늄와 상아프론테크가 각각 충남도지사상과 동반성장... 이날 나바로 선수는 제공받은 차량과 함께 사진촬영은 물론, 차량에 직접싸인을 하고 입맞춤을 하는 등 ‘올 뉴 쏘렌토’ 수상의 기쁨을 감추지 않았다. 기아차...",http://www.bizwatch.co.kr/pages/view.php?uid=10856,
8359,싸인디지텍,“세력매집 + 폭발적 실적 호조” 초대박을 맛볼 수 있는 대역전의 승부주!,"최근 필자의 추천주 중국식품포장,디지텍시스템, 톱텍 등 추천하자마자 급등대박을 내주고 있으며, 현재진행형이다. 또한 이 종목들의 공통점은... 마지막으로 시장에 전혀 알려지지 않은 베일에싸인특급재료들까지 터지면 장중에라도 줄상한가로 이어질 수 있기에 너무나 다급한 마음을 진정시킬 수 없다....",http://www.newspim.com/common/redirect.jsp?newsId=20101103000225,
8359,싸인디지텍,맥TV의 급등주 선취매 전문가 주주클럽(한상오소장),"매수싸인을 주었다,다행이 3월초 이후 주식시장 전체에 부정적인 영향을 주었던 체계적인 리스크가 다소 완화며 절호의 매수 기회로 활용하자는... 에이스디지텍우리이티아이 CJ인터넷 한국토지신탁 파라다이스 큐렉소 차이나그레이트 포휴먼 테라리소스 KTH 포스렉 동화홀딩스 출처: ㈜리젠에프앤 1577-3733",http://www.fnnews.com/view?ra=Sent0301m_01A&corp=fnnews&arcid=090708131700&cDateYear=2009&cDateMonth=07&cDateDay=08&,
