company_id,company_name,news_title,news_text,news_url,posted_at
6696,씨앤씨모바일,"한사랑씨앤씨, 블루밍 앵콜전 네이버 쇼핑 라이브 진행",▲ ©한사랑씨앤씨삼성전자 온라인 공식 인증점 한사랑씨앤씨는 4월 24일(수요일) 오후 5시부터 1 시간 동안 네이버 블루밍 앵콜전 쇼핑... 라이브 방송 중에서만 만나 볼 수 있는 혜택은 ▲알림 받기 쿠폰 및 추가 적립 포인트 적립 ▲ 구매 인증 시모바일문화상품권 3만 원이 증정...,http://www.betanews.net:8080/article/1465067.html,
6696,씨앤씨모바일,"한사랑씨앤씨, 삼성 갤럭시북4 NT750XGR-A58A 티몬 슈퍼 할인",▲ ©한사랑씨앤씨삼성전자 노트북 공식 인증점 한사랑씨앤씨는 오는 4월 15일(월요일)부터 4월 24일(수요일)까지 2024년 신제품 삼성... 구매 모든 고객에게는 포토리뷰 사은품인 신세계모바일상품권 2만 원권과 블로그 리뷰 사은품인 댕댕이 노트북 파우치가 제공된다.,http://www.betanews.net:8080/article/1464694.html,
6696,씨앤씨모바일,"한사랑씨앤씨, 블루밍 데이즈 갤럭시북4 론칭 라이브 진행",▲ ©한사랑씨앤씨삼성전자 온라인 공식 인증점 한사랑씨앤씨는 4월 17일(수요일) 오후 5시부터 한 시간 동안 갤럭시북4 런칭 이벤트를... 모든 구매 고객에게는 알림 받기 쿠폰 및 추가 적립 포인트가 제공되며 구매 인증 시모바일문화상품권 3만 원이 증정된다. 이 밖에도...,http://www.betanews.net:8080/article/1464407.html,
6696,씨앤씨모바일,"한사랑씨앤씨, 삼성 갤럭시 에코 시스템 패키지 진행","▲ ©한사랑씨앤씨삼성전자 노트북 공식 인증점 한사랑씨앤씨는 노트북과 태블릿의 유기적 사용 환경인 ""삼성 갤럭시 에코 시스템 패키지... 본 행사 기간 중 모든 구매 고객에게는 ""스타벅스모바일기프티콘 2종""이 제공되는 포토리뷰 사은품과 ""삼성 갤럭시 버즈 FE""가 증정되는 한 달 사용...",http://www.betanews.net:8080/article/1464074.html,
6696,씨앤씨모바일,"한사랑씨앤씨, 삼성 갤럭시북4 NT750XGR-A51A 11번가 '신선 집중' 특가 판매","▲ ©한사랑씨앤씨삼성전자 온라인 공식 파트너사 한사랑씨앤씨는 4월 12일(금요일) 단 하루 2024년 신제품 갤럭시북4 NT750XGR-A51A를 11번가... 이번 시선집중 행사를 통해 ``삼성 갤럭시북4` NT750XGR-A51A`를 64만 원 대 특가로 구매할 수 있으며, 포토리뷰 행사 참여 시 신세계모바일상품권...",http://www.betanews.net:8080/article/1464186.html,
6696,씨앤씨모바일,"한사랑씨앤씨, 삼성 갤럭시북4 울트라 게이밍 노트북 예약판매",▲ 삼성 갤럭시북4 울트라©한사랑씨앤씨삼성전자 노트북 공식 인증점 한사랑씨앤씨는 오는 3월 11일(월요일)부터 3월 20일(수요일)까지... 삼성 블루투스 마우스 ▲ Samsung Care+ 12개월 무상 혜택 ▲ 포토리뷰 사은품 신세계모바일상품권 3만 원권 등 푸짐한 혜택이 준비되어 있다.,http://www.betanews.net:8080/article/1461460.html,
6696,씨앤씨모바일,"엘루오씨앤씨, ‘시효‘ 브랜드 웹사이트 2023 앤어워드 수상","한편,엘루오씨앤씨는 디지털 서비스 전반을 컨설팅하고 구축운영하는DX리딩 컨설턴시로서 이니스프리 공식 웹사이트(2023웹어워드 코리아모바일마케팅부문 통합대상),이니스프리 공식 쇼핑앱(2023스마트앱 어워드 브랜드부문 통합대상), IFC MALL공식 웹사이트(2023웹어워드 코리아모바일마케팅부문...",https://ditoday.com/%ec%97%98%eb%a3%a8%ec%98%a4%ec%94%a8%ec%95%a4%ec%94%a8-%ec%8b%9c%ed%9a%a8-%eb%b8%8c%eb%9e%9c%eb%93%9c-%ec%9b%b9%ec%82%ac%ec%9d%b4%ed%8a%b8-2023-%ec%95%a4%ec%96%b4%ec%9b%8c%eb%93%9c-%ec%88%98/,
6696,씨앤씨모바일,"유니씨앤씨, 노트북 장보기 삼성 갤럭시북4 프로/울트라 LIVE 진행","삼성전자 공식 파트너사 유니씨앤씨는 최신 인텔 코어 울트라 프로세서와 WQXGA+ Dynamic AMOLED 2X 터치스크린을 탑재한 삼성 갤럭시북4 프로 / 프로360 / 울트라 대상으로 최대 80만원 할인 혜택과 신세계모바일상품권, SSD 무상 업그레이드, 스타벅스 콜라보 파우치, 로지텍 게이밍 마우스 등의...",https://kbench.com/?q=node/252816,
6696,씨앤씨모바일,"유니씨앤씨, 삼성 갤럭시북4 프로 / 울트라 블루밍앵콜전 LIVE 진행","삼성전자 공식 파트너사 유니씨앤씨는 최신 인텔 코어 울트라 프로세서와 WQXGA+ Dynamic AMOLED 2X 터치스크린을 탑재한 삼성 갤럭시북4 프로 / 프로360 / 울트라 대상으로 할인 혜택과모바일신세계상품권, SSD 더블업, 스타벅스 콜라보 파우치, 로지텍 게이밍 마우스 등의 푸짐한 사은품이 증정되는...",https://kbench.com/?q=node/252649,
6696,씨앤씨모바일,"유니씨앤씨, 2월 5일 오후 7시, 블루밍데이즈 삼성 갤럭시북4 프로 / 울트라 ...","삼성전자 공식 파트너사 (주)유니씨앤씨는 최신 인텔 코어 울트라 프로세서와 WQXGA+ Dynamic AMOLED 2X 터치스크린을 탑재한 삼성 갤럭시북4 프로 / 프로360 / 울트라 대상으로 최대 80만원 할인 혜택과모바일신세계상품권, 스타벅스 콜라보 파우치, 로지텍 게이밍 마우스, 삼성 케어 플러스 등의...",https://kbench.com/?q=node/252421,
