company_id,company_name,news_title,news_text,news_url,posted_at
5003,아이티친구들,[썰로벌]아이티는 어쩌다 갱들의 천국이 됐을까 (영상),"카리브해 섬나라아이티의 수도 포르토프랭스. 방탄조끼를 입은 이 남성은 ‘바비큐’로 불리는,아이티에서 가장 큰 G9이라는 갱단의 두목인데, 지금... 머리부터 발끝까지 힙합 스타일로 치장한 이친구는 포르토프랭스 항만 일대를 장악하고 있는 또 다른 갱단의 두목입니다. ‘이조(Izo)’라는 별명으로...",https://www.kmib.co.kr/article/view.asp?arcid=0020082832&code=61131111&cp=nv,2024-05-11 01:04
5003,아이티친구들,뉴욕 하수도에 악어가 산다고? 현대인의 불안이 낳은 ‘도시 괴담’,"민간 전승 연구 기관에 악어 이야기를 제공한 학생이 “(친구) 조엘하고 래리한테 들었다”고 한 것처럼, 형식상 객관성을 띠지만 정작 출처를 검증할... 바닷가 휴가지에서 입양한 불쌍한 강아지가 알고 보니아이티쥐(중국 쥐 버전도 있다)였다는 이야기는 이민자에 대한 편견을 암시한다. 월마트 직원의...",https://www.chosun.com/culture-life/book/2024/05/11/NTC5GWSN4ZBGNLEVQLOR7DON4A/?utm_source=naver&utm_medium=referral&utm_campaign=naver-news,
5003,아이티친구들,“아버지뻘 동성애자와 우정 쌓더니”…거리 전전하던 가출 청소년의 대반전 ...,"아버지인 제러드는아이티출신의 회계사였습니다. 어머니 마틸드는 브루클린에서 푸에르토리코인 부모에게서 태어난 이민 2세였죠. 중산층 가정에서... 그리고친구인 알 디아즈와 함께 그래피티 낙서 세이모(SAMO·Same Old Shit)를 만듭니다. 세이모는 ‘흔해빠진 개똥 같은’이라는 뜻인데요, 이들은 맨해튼...",https://www.mk.co.kr/article/11007736,2024-05-11 09:04
5003,아이티친구들,나의 선생님,"고향에 가 보니 초등학교 때친구들이 벌써 담배를 피우고 있었다.친구들은 저녁때 강변 풀밭으로 소를 끌고 나와서 풀을 뜯겼다. 다들 이때 모여... 네가 죄가 있든 없든’ 꽃동네 남녀 수도자들은 지금 지구상에서 가장 비참하고 위험한 나라,아이티에서 수많은 갱단으로부터 살인과 납치의 위험을 당하며...",http://monthly.chosun.com/client/news/viw.asp?ctcd=F&nNewsNumb=202405100055,2024-05-10 13:04
5003,아이티친구들,"경동나비엔, 어린이 대상 '환기특공대' 행사 진행","참가자들은 어린이 대상 인기 유튜버 '말이야와친구들','무송송 계란탁'과 간단한 게임을 하며 환기와 실내 공기질 관리의 중요성을 체험했다. 지난9일... 앞으로도 환기청정기로 실내 공기질 관리 솔루션을 제공할 계획""이라고 밝혔다. By 이준성 (코리아아이티타임즈/코리아IT타임스/koreaittimes/ittimes/Korea IT Times)",https://www.koreaittimes.com/news/articleView.html?idxno=131281,2024-05-10 13:04
5003,아이티친구들,"아이티를 위한 비전 일으키기 [아이티박혁, 최미영 선교사]",저희 단체의 기본/필수 훈련 과정인 DTS(예수제자훈련) 또한 원칙적으로 재정을 학생들이 스스로 준비해서 지원을 하게 되지만 저희들이 내년도에 대상으로 하게 될아이티 친구들은 스스로 재정(제3국 학생 1명당 1000불/강의 기간)을 일으킬 능력이 되지 않습니다. 그렇다보니 스쿨기간 동안 렌트한...,https://www.cts.tv/mission300/detail_mission/454/8712,
5003,아이티친구들,[미션리포트] 선교사 긴급 대피… 갱단 폭동으로 무법천지된 '아이티',"저희 사역자들도 가까운친구나 친지들이 살해를 너무 많이 당했기 때문에 굉장히 두려움에 시달리고 있습니다. 이처럼 나라는 철저하게 공황상태에 빠져 있습니다. Q. 이번 사태의 배경은? 이렇게 무법천지가 돼버린 것은 39대 대통령이었던 아리스티드가아이티에 사회주의를 세우고자 했었고, 이 사람이...",https://www.nocutnews.co.kr/news/6120409?utm_source=naver&utm_medium=article&utm_campaign=20240329015910,
5003,아이티친구들,14살 어린 아이도...갱단에 접수된아이티,"아이티수도에 있는 국제공항을 접수하고 최대 규모의 국립교도소를 습격한 주동자. 갱단 연합체인 G9의 두목 지미 셰리지에입니다. ""아이티경찰과 군이... 얼마 전친구가 불에 타 죽는 모습을 지켜볼 수밖에 없었는데 조만간 자신도 그렇게 될 것만 같다고 말합니다. [14살 갱단원] ""저는 제 생활을 바꾸고...",https://news.jtbc.co.kr/article/article.aspx?news_id=NB12168448,
5003,아이티친구들,아이티에는 ‘다국적군’보다 ‘반부패 법원’이 필요하다[기고],"이 자문단을 구성한 것은 2000년대 초반부터 “아이티의친구들”이라는 이름 아래 모인 국가들이었다. 여기에는 미국, 캐나다, 프랑스를 비롯해 베네수엘라, 칠레, 아르헨티나, 멕시코 같은 라틴아메리카 국가도 포함된다. 최근에는 ‘코어그룹’(Core Group)이라 불리는 더 한정된 그룹이 등장했다. 이는 정부...",https://www.khan.co.kr/world/world-general/article/202309251651001,
5003,아이티친구들,"아이티, 주민이 갱단막으려 방어선구축",[네넬 돌메 / 갱단 폭력 피해자 : 일요일에친구와 집 근처에 앉아 있었는데 총알 세 발이 날아왔어요. 한 발을 맞아 뼈가 으스러졌는데 병원에 갈 방법이 없어요.] 인권단체에 따르면 지난 주말부터 현재까지 이 지역에서 24명이 사망한 것으로 전해졌습니다. 폭력 사태가 심각해지자아이티경찰은 총격범들과...,https://www.obsnews.co.kr/news/articleView.html?idxno=1428338,
