company_id,company_name,news_title,news_text,news_url,posted_at
10989,아이두마케팅,"미투온 자회사아이두마케팅, D2C시장 진출",기사내용 요약후레쉬톡톡 출시 미투온(201490) 자회사아이두마케팅이 자체 플랫폼으로 소비자와 직접 거래하는 D2C(Direct To Consumer)시장 진출을 본격화한다고 1일 밝혔다. 사측에 따르면아이두마케팅은 이번에 자일리톨 캡슐 가글 브랜드 후레쉬톡톡(FRESH TOKTOK)을 출시했다. 해당 제품은 캡슐을 입 안에...,http://www.newsis.com/view/?id=NISX20211201_0001671483&cID=10401&pID=10400,
10989,아이두마케팅,"미투온 자회사아이두마케팅, 디지털 광고제 '2020 앤어워드' 그랑프리 수상",미투온 자회사아이두마케팅은 자사 인플루언서 플랫폼인 셀레드가 '2020 앤어워드(Awards For New Digital Award)' 디지털 미디어 카테고리 대형 쇼핑몰 및 전자상거래 플랫폼 부문에서 그랑프리(최고상)를 수상했다고 21일 밝혔다. 앤어워드는 한국디지털기업협회가 주관하고 과학기술정보통신부와...,http://news.mk.co.kr/newsRead.php?no=68474&year=2021,
10989,아이두마케팅,"미투온 자회사 아이두커뮤니케이션즈, ‘아이두마케팅’으로 사명 변경",미투온은 자회사 아이두커뮤니케이션즈가 ‘아이두마케팅’으로 사명을 변경했다고 17일 밝혔다.아이두마케팅은 인플루언서 퍼포먼스 마케팅 플랫폼인 ‘셀레드(CELAD)’를 중심으로 인플루언서 통합 마케팅 기업(IIM)으로 거듭난다.아이두마케팅은 국내 디지털마케팅 기법과 트렌드를 분석하는 맞춤형...,http://www.newsway.co.kr/news/view?tp=1&ud=2020021710430646985,
10989,아이두마케팅,"아이두커뮤니케이션즈, 인플루언서마케팅플랫폼 ‘셀레드’ 전문 마케터 ‘...","아이두커뮤니케이션즈는 인플루언서 전문 마케터 ‘셀러더’의 모집부터, 교육, 운영까지 모든 프로세스에 최고의 인력을 투입해 진행할 것이며, 1차 신청자를 대상으로 11월 23일에 ‘셀레더’마케팅교육을 실시한다. 한편아이두커뮤니케이션즈는 인플루언서마케팅을 주력으로 모바일 플랫폼 뿐만 아니라...",http://news.heraldcorp.com/view.php?ud=20191120000279,
10989,아이두마케팅,"아이두마케팅, ‘셀레드 2.0’ 버전 론칭…사용자 편의성↑","이복현 기자, 미투온 자회사아이두마케팅(대표 노영태)이 사용자 편의성을 높인 인플루언서 미디어 커머스앱 ‘셀레드 2.0’버전 업데이트를 완료했다. 이번 업데이트를 통해 셀레드는 제품을 체험하고 판매 및 구매할 수 있는 기능을 추가했다. 셀레드2.0은 인플루언서가 단순한 제품 후기 콘텐츠만...",http://www.nspna.com/news/?mode=view&newsid=449210,
10989,아이두마케팅,"미투온-아이두커뮤니케이션즈, 인플루언서마케팅플랫폼 앱 '셀레드' 론칭","미투온(대표이사 손창욱)은 자회사아이두커뮤니케이션즈가 인플루언서마케팅플랫폼 모바일 앱 ‘셀레드(CELAD)’를 본격 론칭했다고 5일 밝혔다. ‘셀레드(CELAD)’는 SNS를 중심으로 큰 영향력을 가진 인플루언서를 활용한 미디어 플랫폼이다. 인플루언서의 영향력을 이용하고 싶은 기업, 캠페인을 통해...",http://www.newspim.com/news/view/20190605000837,
10989,아이두마케팅,"국내 광고마케팅기업 '아이두커뮤니케이션즈', BID 국제 무대 진출","디지털 통합마케팅전문기업 ㈜아이두커뮤니케이션즈(대표이사 노영태)가 지난 3월, 독일 프랑크푸르트에서 열린 'BID 국제 비즈니스 품질 시상식(BID International Quality Conventions)'에서 골드 카테고리 부분 우수 회사로 선정돼 대상을 받았다.아이두커뮤니케이션즈는 BID가 세워놓은 총체적 품질...",http://www.econovill.com/news/articleView.html?idxno=341554,
10989,아이두마케팅,"미투온 자회사아이두커뮤니케이션즈, 중국 광고마케팅시장 진출",미투온의 자회사이자 디지털 통합마케팅전문 기업인아이두커뮤니케이션즈는 중국마케팅기업들과 제휴 등을 통해 중국 광고마케팅시장에 본격 진출한다고 28일 밝혔다.아이두커뮤니케이션즈는 디지털마케팅기법과 트렌드 분석을 활용해 맞춤형마케팅솔루션을 제공하는 디지털 통합마케팅...,http://view.asiae.co.kr/news/view.htm?idxno=2018052813315334818,
10989,아이두마케팅,"아이두커뮤니케이션즈, 알솔루션 인수합병 '인플루언스마케팅강화'","디지털 IMC(통합마케팅커뮤니케이션, Intergrated Marketing Communication)기업아이두커뮤니케이션즈는마케팅기법의 확대를 위해 인플루언서마케팅전문 기업인 알솔루션을 인수합병했다고 밝혔다. 알솔루션은 바이럴마케팅을 시작으로 현재는 키워드마케팅부터 인플루언서마케팅까지 온라인마케팅의...",http://www.moneyweek.co.kr/news/mwView.php?type=1&no=2017062215208027209&outlink=1,
10989,아이두마케팅,"미투온, '아이두커뮤니케이션즈' 인수…""글로벌마케팅사 도약""","미투온은 이와 함께아이두커뮤니케이션즈의마케팅노하우를 바탕으로 광고마케팅플랫폼을 개발해 모바일 광고 사업에도 진출할 계획이다. 노영태아이두커뮤니케이션즈 대표는 ""미투온과 합병을 통해 단순히 디지털마케팅을 하는 것을 넘어서 데이터와 IT기반을 통해마케팅솔루션을 제안하는...",http://www.seoulfn.com/news/articleView.html?idxno=278810,
