company_id,company_name,news_title,news_text,news_url,posted_at
7968,아이윈백시스템,"가이온,아이리노테크와 AI기반 차세대 APT 공급 협력",이들 보안 솔루션은 최근 국내 대기업에서 외산 제품을윈백하는데 성공하고시스템을 구축 중에 있다. 가이온 관계자는 “아이리노테크 국내 총판사로서 외산 제품 대비 우수한 기능 보안 제품을 공급해 국내 APT 대응 시장에서 외산 제품을 대체해 국산 보안 제품 시장 점유율을 확대한다”고 말했다.,https://www.etnews.com/20230116000163,
7968,아이윈백시스템,다국적기업 새해 경영화두는… `제품통합` `수요창출`,"블래이드 서버 저변확대를 위해 수도권 중소중견(SMB) 시장의 마케팅을 강화하고 통합서버인시스템아이서버를 앞세워 경쟁사윈백수요를 공략할 계획이다. 소프트웨어그룹은 서비스지향아키텍처(SOA)와 인포매이션온디맨드를 통한 기업의 비즈니스최적화 지원군을 확충하고, 글로벌 서비스와 테크놀로지...",http://www.dt.co.kr/contents.html?article_no=2007010202012260686004,
7968,아이윈백시스템,"티맥스소프트, 외산 DBMS 제품윈백2배 '껑충'",<아이뉴스24> [아이뉴스24 성지은기자] 티맥스소프트의 데이터베이스관리시스템(DBMS) '티베로'가 외산 제품을 대체한 이른바윈백(Win-back) 사례가 크게 늘고 있다. 티베로는 지금까지 국내외 시장에서 2천여 개가 넘는 레퍼런스를 확보했고 국내외 시장에서 점유율을 높여나가고 있다. 30일 티맥스소프트에...,http://www.inews24.com/php/news_view.php?g_serial=1014436&g_menu=020200&rrf=nv,
7968,아이윈백시스템,"엑셈, SK 테크엑스에 인터맥스 공급…경쟁 제품윈백","제품을윈백(win back)했다고 6일 발표했다. SK테크엑스는 서울 성수와 서초에 위치한 IDC센터를 운영·관리·모니터링하던 제품을 인터맥스로 전면 교체한다. 이로써 IDC센터의 핵심시스템을 모니터링하고 각시스템의 웹애플리케이션서버(WAS)와 데이터베이스(DB)간 연계를 강화, 최적화된 성능관리시스템을...",http://www.inews24.com/php/news_view.php?g_serial=995038&g_menu=020200&rrf=nv,
7968,아이윈백시스템,"샤코시스템, 검증필 암호모듈을 탑재한 ‘이지스아이’ 버전 출시","샤코시스템(대표 전용주 www.shaco.co.kr)은 자체 개발하고 IT보안인증사무국의 검증필 암호모듈인 이지크립트(EGCrypt) V1.0을 ‘이지스아이(EGIS-i)’에... SMB,윈백(Win Back) 고객이 늘고 있어 사업 전망도 밝다. 이외에도 샤코시스템은 출도 보안 솔루션인 플롯매니저2(PlotManager2), 외부DRM 제품인...",http://www.kbench.com/life/?no=115786&sc=1,
7968,아이윈백시스템,"한국오라클 vs SAP코리아, 치열한 '윈백' 신경전","<아이뉴스24> ""국내 SAP 고객 가운데 10여개 기업이 오라클로 전환을 염두에 두고 현재 우리와 협의중이다. 'OFF SAP' 전략에 따라 향후 더욱 공격적인 SAP '윈백'에 나서겠다. "" 한국오라클(대표 표삼수)이 13일 SAP 사용자들을 오라클 고객으로 전환시키기 위한윈백프로그램 'OFF SAP' 실시 6개월을 맞아, 그...",https://n.news.naver.com/mnews/article/031/0000074363?sid=105,
7968,아이윈백시스템,"MS-IBM, 그룹웨어 '윈백' 전쟁","<아이뉴스24> IBM이 최근 그룹웨어 제품인 '로터스 노츠·도미노'의 시장확대를 통한 마이크로소프트(MS)의 '익스체인지'윈백전략을 강화하면서... MS는 문서관리, 인스턴트메시징 등 MS의 오피스시스템과 연계한 협업 기능을 추가해윈백을 시도해왔다. IBM은 이메일과 문서 뿐 아니라 액티비티 중심의...",http://www.inews24.com/php/news_view.php?g_serial=206821&g_menu=020200,
7968,아이윈백시스템,"핸디소프트, 3개 교육대학 그룹웨어윈백",<아이뉴스24> 핸디소프트(대표 정영택 www.handysoft.co.kr)는 3개 교육대학교의 그룹웨어 사업을윈백했다고 17일 발표했다. 핸디소프트는 최근 청주교육대... 특히 핸디소프트는 지식관리시스템(KMS)와 업무매뉴얼시스템과 같이 기존 그룹웨어와 연동되는 고도화 사업에 집중해 영업을 펼치고 있으며 일부...,http://www.inews24.com/php/news_view.php?g_serial=243704&g_menu=020200,
7968,아이윈백시스템,"한국MS, 한국오라클에 전면전 선포...DB이어 ERP '윈백' 선언",<아이뉴스24> 한국마이크로소프트(한국MS)가 데이터베이스관리시스템(DBMS)에 이어 전사적자원관리(ERP) 분야에서도 한국오라클을 상대로 한 '윈백'(Win back) 공세를 선언하고 나섰다. 플랫폼과 애플리케이션을 아우르는 기업용 소프트웨어 분야에 걸쳐 두 회사간 거센 몸싸움이 예고된다....,https://n.news.naver.com/mnews/article/031/0000053900?sid=105,
7968,아이윈백시스템,"아크로니스, 타사 제품 30% 할인 '윈백프로모션' 전개",<아이뉴스24> 스토리지 관리솔루션 업체 아크로니스아시아는 타사 백업시스템을 자사의 최신 솔루션으로 교체하면 가격을 30% 할인해주기로 했다고... 이번윈백프로모션은 오는 11월말까지 아크로니스의 총판인 ▲단군소프트 ▲락플레이스 ▲솔로몬에스티 등을 통해 진행된다. /,http://www.inews24.com/php/news_view.php?g_serial=443275&g_menu=020200,
