company_id,company_name,news_title,news_text,news_url,posted_at
459,아이엠씨게임즈,"아이엠씨게임즈, 지난해 영업이익 1억원 기록…전년比 95%↓","게임업체아이엠씨게임즈(대표 김학규)의 2017년 실적이 공개됐다. 11일 공개된 감사보고서 재무제표에 따르면아이엠씨게임즈의 작년 매출액은 98억원, 영업이익은 1억원, 당기순손실은 4억원을 기록했다. 이는 전년동기 대비 매출은 33% 하락했고 영업이익은 95% 하락한 수치다. 당기순이익은...",http://www.nspna.com/news/?mode=view&newsid=278221,
459,아이엠씨게임즈,"아이엠씨 게임즈감마니아 맞손 '트리오브 세이비어M' 대만, 홍콩, 마카오 진...","아이엠씨 게임즈는 26일 감마니아와 계약을 체결하고 자사 개발게임 '트리 오브 세이비어M'을 대만, 홍콩, 마카오 등 지역에 론칭한다고 밝혔다.아이엠씨 게임즈는 지난 2003년 설립, '그라나도 에스파다', '트리오브 세이비어'등 대작 MMORPG를 개발한 회사로, 최근 '트리 오브 세이비어M'을 개발해 공개한 베테랑...",https://www.khgames.co.kr/news/articleView.html?idxno=207317,
459,아이엠씨게임즈,아이엠씨게임즈창립 20주년 기념 AI 통한 이미지 선물 공개,"2003년 창립하여 어느덧 20주년을 맞이한 IMC게임즈(대표 김학규)가 유저들에게 성원에 대한 감사의 인사를 전했다. 해당 기념 포스팅을 통해, 최근 큰... 특히 만우절 깜짝 농담으로 게임 캐릭터 피규어처럼 보이는 이미지를 공개한 바 있는 IMC게임즈에서는 현재 유저들의 캐릭터를 AI를 통해 그려주는...",http://gamefocus.co.kr/detail.php?number=140027,
459,아이엠씨게임즈,"[와이드인터뷰 -아이엠씨게임즈김학규 대표] ""게임이 끝나면 남는 것은 추억...","적이든, 친구든, 길 가다가 잡담을 하던 사람이든, 신세 한탄을 함께 나눴던 사람이든 함께 했던 시간이죠.""아이엠씨게임즈김학규 대표는 게임이 남기는 재미를 추억이라고 봤다. 사람들과 함께 했던 추억, 재미있는 이야기를 나눴던 추억. 게임을 즐기는 그 시간이 바로 추억이 된다. 이를 다른 각도에서 접근해...",https://www.khgames.co.kr/news/articleView.html?idxno=206111,
459,아이엠씨게임즈,"아이엠씨게임즈, 첫 스마트폰 게임 `솔리테어 리그` 출시","아이엠씨게임즈(대표이사 김학규, www.imc.co.kr)는 스마트폰용 게임 '솔리테어 리그 for Kakao'를 금일 카카오 게임하기에 공개했다고 24일 밝혔다. 솔리테어 리그는 널리 알려진 다양한 솔리테어 카드게임 중, 스마트폰 화면에 가장 적합한 스파이더릿(Spiderette)룰에 기반하며 개발됐다. 카카오톡의...",http://game.mk.co.kr/main/gamenews_detail.php?NO=201300888730,
459,아이엠씨게임즈,"위메이드, 위믹스 플랫폼에 '아이엠씨게임즈' 작품 탑재",진현우 인턴기자 = 위메이드는아이엠씨게임즈의 작품을 자체 블록체인 플랫폼인 위믹스에 탑재하는데 합의했다고 19일 밝혔다. 위메이드와아이엠씨게임즈는 이 같은 내용을 포함한 블록체인 사업 협력을 위한 양해각서(MOU)도 체결했다. 지난 2003년에 설립된아이엠씨게임즈는 다중 접속 역할 수행 게임...,http://www.newspim.com/news/view/20220119000494,
459,아이엠씨게임즈,‘투자의 귀재’ 위메이드 투자한 게임 개발사 또 어디?,이외에도 위메이드가 일반투자를 목적으로 지분을 보유한 기업은 △㈜네시삼십삼분 △하운드13 △㈜아이엠씨게임즈△㈜열매컴퍼니 △㈜유티플러스인터랙티브 등이다. 이 중 하운드13은 유망 게임 개발사로 평가된다. 하운드13은 ‘드래곤네스트’ 개발을 총괄했던 박정식 대표가 지난 2014년 설립한...,https://www.ebn.co.kr/news/view/1597352/?sc=Naver,
459,아이엠씨게임즈,"3월, 카카오게임즈·세화아이엠씨6810만주 시장에 풀린다","예탁원 의무보유 해제 윤지은 기자 ginajana@ajunews.com 카카오게임즈(4390만주), 세화아이엠씨(2420만주), 하림(1926만주) 등이 3월 중 증시에 추가로 풀린다. 26일 한국예탁결제원에 따르면 예탁원에 의무보유하도록 돼 있던 주식 총 48개사 2억131만주가 3월 중 시장에 나온다. 기업들은 '증권의 발행 및...",http://www.ajunews.com/view/20210226112806831,
459,아이엠씨게임즈,"유니온·솔리더스, IMC게임즈풋옵션 통해 엑시트",상장 지연·펀드 만기 이슈 등으로 투자금 회수 유니온투자파트너스(이하 유니온)와 솔리더스인베스트먼트(솔리더스)가 상환청구권(풋옵션) 행사를 통해아이엠씨게임즈(IMC게임즈)에 대한 투자금 회수를 완료했다. IMC게임즈에 투자한지 약 3년 만이다. 29일 벤처투자 업계에 따르면 유니온과...,https://www.paxnetnews.com/articles/69131,
459,아이엠씨게임즈,"한빛소프트, 게임개발 업체아이엠씨게임즈주식 28억 원에 추가 취득","코스닥 상장사 한빛소프트가 오늘(28일) 게임개발 업체아이엠씨게임즈의 주식 3천490주를 약 28억 원에 추가 취득한다고 공시했습니다. 주식 취득 뒤 한빛소프트의아이엠씨게임즈지분율은 35.5%가 됩니다. 주식 취득 예정일은 공시 당일입니다. 한빛소프트는 이번 주식 취득의 목적을 ""당사 지분가치 제고...",http://mbnmoney.mbn.co.kr/news/view?news_no=MM1004222108,
