company_id,company_name,news_title,news_text,news_url,posted_at
9495,아이젠,"여름에 만난 눈, 마치 인생처럼…일본 북알프스를 가다 [ESC]",설계를 안전하게 돌파하려면 최소아이젠정도는 필요한데 준비가 부족했다. 여름 산행이라고만 생각했지 3000m 산이라는 사실은 까맣게 잊고 있었다.... 함께 올라온 등산객 대부분은 배낭에서아이젠을 꺼내 등산화에 끼우느라 여념이 없었고 개중에는 스노슈즈(눈 위에서 이동을 편리하게 해주는 보행 도구)를...,https://www.hani.co.kr/arti/specialsection/esc_section/1140115.html,2024-05-11 11:04
9495,아이젠,'초박빙' 바이든-트럼프…제3후보 케네디 변수 [美대선 D-6개월➀],"1956년 드와이트아이젠하워(공화) 당시 대통령과 애들레이 스티븐슨 당시 민주당 후보가 두 번째로 대결했으며, 당시에는아이젠하워 대통령이 연거푸 승리를 거뒀다. 또 미국에서 전현직 대통령이 대선에서 맞붙는 건 1912년 이후 112년 만이다. 그러나 미국의 유권자들은 두 사람의 재대결에 시큰둥한 반응을...",https://www.newsis.com/view/?id=NISX20240503_0002723114&cID=10101&pID=10100,
9495,아이젠,"[이상언의 시시각각] 김 여사 조사, 피할 방법 있습니까?","드와이트아이젠하워 전 미국 대통령은 주어진 과업을 네 종류로 분류했다. ①긴급하고 중요한 것, ②긴급하지만 중요하지 않은 것, ③긴급하지 않지만... ‘아이젠하워 매트릭스’로 불리는 일 처리 방법이다. 검찰의 김건희 여사 조사(도이치모터스 주가조작 사건 관련)는 지난 3년간 ④에서 ③의 단계를 거쳐...",https://www.joongang.co.kr/article/25246345,
9495,아이젠,"[가만한 당신]""그 순간 나는 다시 '인간'이 될 수 있었다""",그린필드의 첫 대통령 고객은 드와이트아이젠하워였다.아이젠하워는 근 40년 간 입던 군복을 갓 벗은 1950년 무렵 뉴욕의 유서 깊은 맞춤정장업체 ‘‘GGG 양복점(GGG Clothings)’ 재단사 그린필드를 만났고 이후 평생 그의 단골이 됐다. 56년 어느 날아이젠하워는 새 양복 호주머니에서 그린필드가 남긴...,https://www.hankookilbo.com/News/Read/A2024042512080003791?did=NA,
9495,아이젠,단국대 신임 총동창회장에 고정용아이젠파마코리아 대표,"고정용아이젠파마코리아 대표(65)가 제50대 단국대 총동창회장에 선임됐다고 15일 단국대가 밝혔다. 고정용 신임 총동창회장의 임기는 오는 17일부터... 그는 태준제약, 한국약품 임원을 거쳐 2013년아이젠파마코리아를 설립해 난임 치료제 전문기업으로 성장시켰다. 고 회장은 국내외 NGO들과 연계해...",https://www.news1.kr/articles/5384665,
9495,아이젠,"[AI의료]루닛,美 임상종양학회서 AI 바이오마커 연구초록 발표 外 휴런·아이...","◆아이젠사이언스-휴니버스글로벌, 병원 업무 보조 AI 개발 협력 사진=아이젠사이언스아이젠사이언스와 휴니버스글로벌은 병원 업무의 효율성을 극대화하기 위한 대형언어모델(LLM) 개발 및 보급에 관한 연구 협력 양해각서(MOU)를 체결했다고 25일 밝혔다. 이번 협약은 의료 분야에 특화된 LLM 기술을...",https://www.getnews.co.kr/news/articleView.html?idxno=671577,
9495,아이젠,"구미시, 미아이젠하워스쿨 연수단 방문","C.아이젠하워 스쿨 연수단이 구미에 소재한 한화시스템, LIG넥스원, 박정희대통령생가를 잇달아 방문했다고 15일 밝혔다.아이젠하워 스쿨은 1933년 졸업생인 드와이트 D.아이젠하워 대통령을 기리기 위해 2012년 명칭을 변경한 국방대학이다. 군 장교와 국방부, 국무부 등 미연방기관 종사자 등을 대상으로 방위...",http://news.mt.co.kr/mtview.php?no=2024041516231687030,
9495,아이젠,"[구미24시] 美아이젠하워스쿨 연수단, 구미 방산기업 방문","아이젠하워스쿨 연수단이 15일 경북 구미시를 찾아 한화시스템, LIG넥스원, 박정희 대통령 생가 등을 방문했다.아이젠하워스쿨은 1933년 졸업생인 드와이트 D.아이젠하워 대통령을 기리기 위해 2012년 명칭을 변경한 국방대학으로 군 장교와 연방기관 종사자 등에게 방위 전략, 국가 안보, 경제 정책, 전략적...",http://www.sisajournal.com/news/articleView.html?idxno=288232,
9495,아이젠,"아이젠사이언스-휴니버스글로벌, 업무협약 체결",아이젠사이언스(대표 강재우)와 휴니버스글로벌(대표 이상헌)이 최근 병원 업무 보조 대형언어모델(LLM) 개발 및 보급을 위한 연구 협력 양해각서를 체결했다. 이번 협약은아이젠사이언스의 의료특화 LLM 기술을 휴니버스의 클라우드 기반 병원정보시스템(PHIS)에 적용해 고도화된 의료 서비스를...,http://www.bosa.co.kr/news/articleView.html?idxno=2221384,
9495,아이젠,단국대 신임 총동창회장에 고정용아이젠파마코리아 대표,"고정용 ㈜아이젠파마코리아 대표가 단국대학교 제50대 총동창회장에 선임됐다. 임기는 오는 17일부터 2년이다. 고 신임 회장은 1985년 단국대 경제학과(35회)를 졸업 후 약 30년간 약업 분야 발전을 위해 활동한 제약업계 전문가다. 태준제약, 한국약품 임원을 거쳐 2013년아이젠파마코리아를 설립해 난임...",https://www.seoul.co.kr/news/peoples/face/2024/04/16/20240416500085?wlog_tag3=naver,
