company_id,company_name,news_title,news_text,news_url,posted_at
3527,앳시스,"[8일 낙찰/계약 동향] 총괄국 안전관리 위탁용역 계약 체결(50인 미만), 향동...","▲ 낙찰업체 : (주)앳시스, 계약금액 : 75,000,000(원), 계약명 : 2019년 사이버콘텐츠 수정개발 사업. 계약기관 : 조달청 대전지방조달청, 계약일자 : 2019-08-27, 계약방법 : 제한경쟁, 발주처(수요기관) : 소방청 중앙소방학교, 계약 : (주)앳시스- 조달청 대전지방조달청 (2019년 사이버콘텐츠 수정개발 사업...",http://www.fintechpost.co.kr/news/articleView.html?idxno=66765,
3527,앳시스,"창업보육센터 일대 혁신.. 한양대, 동문후원창업센터 개소","정철영앳시스상무. (사진제공: 한양대) 한양대(총장 이영무)는 지난 14일 서울 성동구 한양종합기술연구원에서 한정화 중소기업청장, 안진호... 정철영앳시스상무. (사진제공: 한양대) [천지일보=김민아 기자] 청년창업과 일자리창출의 전진기지인 대학 창업보육센터가 창조경제를 구현, 견인하기 위해 일대...",http://www.newscj.com/news/articleView.html?idxno=312942,
3527,앳시스,"한양대, 선배가 후배 돕는 동문후원창업센터 개소","정철영앳시스상무 개소식에는 한정화 중소기업청장을 비롯해 이영무 총장, 안진호 산학협력단장, 류창완 글로벌기업가센터장, 최영준 베택 대표, 임경환 한양벤처동문회장 등 벤처 창업 동문이 참석해 개소를 축하했다. 동문후원 창업센터는 청년창업가를 양성하기 위해 성공한 선배 벤처 창업가가 후배...",http://www.etnews.com/20151015000231,
3527,앳시스,"[단신] 한양대, '동문후원창업센터' 국내대학 최초 개소","사진 왼쪽부터 류창완 한양대 글로벌기업가센터장, 한인석 유타대 아시아캠퍼스 명예총장, 안진호 한양대 산학협력단장, 이상만 휴니즈 대표, 이영무 한양대 총장, 한정화 중소기업청장, 최영준 베택 대표, 이성균 디게이트 대표, 윤종성 훠리스트 대표, 임경환 한양벤처동문회장, 정철영앳시스상무....",http://news1.kr/articles/?2459162,
3527,앳시스,한양대 동문후원창업센터 개소 및 후원기금 전달식,"산학협력단장, 이상만 휴니즈 대표, 이영무 한양대 총장, 한정화 중소기업청장, 최영준 베택 대표, 이성균 디게이트 대표, 윤종성 훠리스트 대표, 임경환 한양벤처동문회장, 정철영앳시스상무가 기념촬영을 하고 있다. 2015.10.15 << 한양대 제공 >> photo@yna.co.kr <저작권자(c) 연합뉴스, 무단 전재-재배포 금지>",http://app.yonhapnews.co.kr/YNA/Basic/SNS/r.aspx?c=PYH20151015059900013&did=1196m,
3527,앳시스,[ 신설법인 현황 ] (2002년 4월8일 ~ 13일) 서울<4>,소프트웨어) 목동 907*앳시스(강찬웅.100.소프트웨어) 역삼동 736의58 문성빌딩 4층*에스지코아(전성균.100.소프트웨어) 여의도동 25의5 동화빌딩 1208호*에이엘비엠(임허규.50.에니메이션게임) 일원동 624의4 가양빌딩 *엔터비지컴(이동 기.200.시스템네트웍) 논현동 94의20 진성빌딩 2층...,https://n.news.naver.com/mnews/article/015/0000498994?sid=101,
