company_id,company_name,news_title,news_text,news_url,posted_at
7397,에이시스템,"쓰리에이로직스, 산업부 '소부장 으뜸기업' 선정","쓰리에이로직스는시스템반도체 기업으로는 유일하게 소부장 으뜸기업 지위를 획득했으며 향후 5년 간 R&D 지원사업을 포함한 범정부 차원의 맞춤형 밀착 지원을 받게 된다. 쓰리에이로직스는 2004년 설립 이후 근거리 무선통신용시스템반도체 칩 개발에 주력해왔다. 국내 첫 NFC 리더 칩, NFC 태그 칩...",https://www.newsis.com/view/?id=NISX20240509_0002729105&cID=10403&pID=15000,
7397,에이시스템,"에이스토리, 우량기업부 승격…웰메이트 K콘텐츠 성과","글로벌 종합 콘텐츠 스튜디오에이스토리가 우량기업부로 승격됐다. 금융감독원 전자공시시스템에 따르면 드라마 ‘이상한 변호사 우영우’, ‘유괴의 날’, ‘킹덤’ 등 다수의 작품을 통해 K콘텐츠의 흥행을 이끌어온에이스토리가 중견기업부에서 우량기업부로 변경되었다.에이스토리는 설립 이래 40여...",http://starin.edaily.co.kr/news/newspath.asp?newsid=01846646638887608,
7397,에이시스템,"에이아이스페라, '부산-경남-울산 대학정보화협의회 세미나'서 공격표면관리 ...","에이아이스페라의 'Criminal IP ASM'은 자체 개발한 위협 인텔리전스 크리미널 IP를 활용한 SaaS(서비스형 소프트웨어) 솔루션으로, 솔루션에 적용된 IP 기반 보안 관제 방법 및시스템은 국내 특허와 미국 특허에 등록되어 기술력을 인정받은 바 있다.에이아이스페라 강병탁 대표는 ""교육 및 연구기관의...",https://www.dailysecu.com/news/articleView.html?idxno=155853,
7397,에이시스템,"에이아이스페라, ‘병원정보보안협회 춘계학술세미나’ 참가… 의료기관 공격...","에이아이스페라와 비테크놀로지는 이번 세미나에서 기관 공격 표면 관리 솔루션 ‘Criminal IP ASM’으로 ▲노출된 병원 CCTV, ▲ 취약한 클라우드 의료시스템, ▲IoT 의료기기와 공급망 공격, ▲다크웹 환자 정보 노출 등 의료 업계 디지털화로 급증하는 사이버 위협을 예방하는 방법을 소개할 예정이다....",https://www.sedaily.com/NewsView/2D93XQMCIP,
7397,에이시스템,"에이아이트릭스, 중환자의학회 학술대회서 '바이탈케어' 소개","모니터링시스템은 환자의 예후를 향상하고 의료 자원 배분을 효율화할 것""이라고 강조했다. 김광준에이아이트릭스 대표는 ""이번 대한중환자의학회 정기학술대회에서 자사가 그동안 연구해 왔던 유의미한 성과들을 공유할 수 있어 뜻깊은 시간이었다""면서 ""앞으로도에이아이트릭스는 입원 환자들이...",https://www.news1.kr/articles/5400322,
7397,에이시스템,[K헬스 리더를 만나다]에이아이트릭스 김광준 대표이사,"저희가 추구하는 것은 0.9인데, 식약처에 내는 결과 값들을 보면 저희시스템은 0.86~0.95를 왔다갔다고 한다고 생각하시면 될 것 같습니다.Q.에이아이트릭스가 10년 후 어떤 모습일까요?- 환자에게 도움이 되는 소프트웨어 회사여야 합니다. 저희만의 노력으로 되는 것이 아니라 의료진이나 환자들의 도움도...",https://www.medicaltimes.com/Main/News/NewsView.html?ID=1158644&ref=naverpc,
7397,에이시스템,"[AI의료]뷰노 일본 파트너 M3 AI, 최고 수준 영업망 확보 外 노을·에이아이트...","의료 인공지능(AI) 기업 뷰노(대표 이예하)의 일본 파트너 M3 AI가 일본 캐논 메디칼시스템즈와 의료 AI 사업 강화를 위한 업무협약(MOU)을 체결하고 현지... ◆에이아이트릭스,대한중환자의학회서 '바이탈케어' 소개에이아이트릭스, KSCCM·ACCC 2024 런천 심포지엄/사진=에이아이트릭스 의료 인공지능(AI) 기업...",https://www.getnews.co.kr/news/articleView.html?idxno=671936,
7397,에이시스템,"[호텔 단신]롯데호텔앤리조트, 정보보호 경영시스템ISO27001 인증 획득","30일, 롯데호텔앤리조트 김태홍 대표이사와 인증기관인에이써티의 민성완 이사 등 양사 임직원이 참석한 가운데 롯데호텔 서울에서 ISO27001 인증서 수여식이 진행됐다. ISO27001은 국제 표준화기구(ISO)에서 제정한 정보보호 경영시스템(ISMS : Information Security Management System)의 국제 인증 기준으로...",http://www.lawissue.co.kr/view.php?ud=20240430153803532107f28b58b8_12,
7397,에이시스템,"에이빌리티, 스타트업 육성 프로그램 대상 기업 선정","지금까지 고정익 기반 백터드 스러스트 기술을 접목한 비행시스템, 분산형 전기 팬제트 추진시스템및 가변 흡입구, 모듈러 하이브리드 에너지 추진시스템등 기술을 구축했다. 이진모 에어빌리티 대표는 “이번 두 건의 프로그램 선정은 신용보증기금에서 에어빌리티의 기술력과 성장 잠재력을 인정한 것”...",https://www.hellot.net/news/article.html?no=89479,
7397,에이시스템,"에이아이스페라, 익스웨어랩스와 OSINT 기반 사이버보안 위협 대응 MOU 체결","사이버 위협 인텔리전스(Cyber Threat Intelligence, CTI) 전문기업에이아이스페라 (AI Spera, 대표 강병탁)는 29일 OSINT 전문 기업 익스웨어랩스(ExWareLabs... 부정탐지시스템‘크리미널 IP FDS’ 등 기업용 보안 솔루션을 제공하고 있다. 동시에 시스코(Cisco), 바이러스토탈(VirusTotal), 스노우플레이크(Snowflake)을...",https://www.dailian.co.kr/news/view/1355470/?sc=Naver,
