company_id,company_name,news_title,news_text,news_url,posted_at
14198,에스제이비,"에스제이비보이즈, 비보잉으로 대중과 소통… ‘직장 문화배달’ 개최","'쿵페스티벌 갈라쇼' 퍼포먼스로 관객을 사로잡은에스제이비보이즈가 이색 공연을 펼친다.에스제이비보이즈는 오는 27일 경기 의왕소방서에서 직장 문화배달 행사를 개최한다. 이 행사는 문화체육관광부가 주최하는 사업으로 평일, 외부 문화 활동이 어려운 직장인을 위해 매달 마지막 수요일 '문화가 있는 날...",http://www.sportsworldi.com/content/html/2018/06/18/20180618001618.html?OutUrl=naver,
14198,에스제이비,"에스제이비보이즈, 직장문화배달 공연 '쿵페스티벌 갈라쇼' 성료","울산 LG화학 온산공장서 선배…이목 집중 노경조 기자 felizkj@ajunews.com 지난달 31일 울산 LG화학 온산공장에서 열리는 직장문화배달 공연 전,에스제이비보이즈 배우들이 기념촬영을 하고 있다. [사진=에스제이비보이즈]에스제이비보이즈가 지난달 31일 울산 LG화학 온산공장에서 특유의 매력을 선사하며...",http://www.ajunews.com/view/20180605145247498,
14198,에스제이비,"에스제이비보이즈, 대구 경북대학교 '베이비' 공연","【서울=뉴시스헬스/뉴시스】에스제이비보이즈는 오는 29일 대구 경북대학교 대강당에서 뮤지컬 '베이비' 특별공연을 선보인다고 27일 밝혔다. 이번...에스제이비보이즈 관계자는 ""'베이비'는 대구, 음성을 시작으로 내년 상반기 제주, 전주, 대전, 광주, 울산, 수원, 천안, 창원 등 20여 개 지방투어가...",https://n.news.naver.com/mnews/article/003/0002974722?sid=102,
14198,에스제이비,"에스제이비보이즈, 뮤지컬 '베이비' 배우 오디션","=에스제이비보이즈는 오는 20일 홍대 앞 비보이 전용극장에서 뮤지컬 '베이비'의 배우 오디션을 진행한다고 13일 밝혔다. 오디션에서는...에스제이비보이즈 관계자는 ""'베이비'는 지난 9월4일~6일 3일간 말레이시아 최대의 소비자 대상 관광박람회에서 총 5회의 공연을 선보이며 여행사들과...",https://n.news.naver.com/mnews/article/003/0002905878?sid=102,
14198,에스제이비,"에스제이비보이즈, 배틀 비보이 '베이비' 선보여",[세계닷컴] 홍대 비보이 전용관을 운영하는에스제이비보이즈(대표 박기원)가 한층 업그레이드된 비보이쇼를 선보인다.에스제이비보이즈 측은 비보이 브레이크 댄스쇼인 '베이비'를 지난 15일부터 세계 최초 개관 홍대 비보이 전용극장에서 공연하고 있다. 이번 공연은 세계 최고 레벨의 멤버들이 합류한...,http://www.segye.com/Articles/NEWS/CULTURE/Article.asp?aid=20090824001665&subctg1=&subctg2=,
14198,에스제이비,"에스제이비보이즈, '비보이 배틀대회' 개최","【서울=뉴시스헬스/뉴시스】에스제이비보이즈는 오는 13일 홍대비보이 전용극장에서 '비보이 배틀대회'를 개최한다고 밝혔다. 이번 대회는...에스제이비보이즈 관계자는 ""이번 대회는 국내 유일 일대일 전문 배틀대회로 라이벌전 경합이 박진감 있게 펼쳐질 것으로 보인다""며 ""비보이들의 기량...",https://n.news.naver.com/mnews/article/003/0002619923?sid=102,
14198,에스제이비,가벼운 주머니로 풍성하게 즐기는 '무료 미술 전시',"◆ SJB PICTURES(에스제이비픽쳐스) : 꾸며낸 이야기 Fairy Tales 서울 금천구 '아트센터 예술의 시간' [기간 2023.04.15 ~ 2023.05.26] 'SJB PICTURES(에스제이비픽쳐스) : 꾸며낸 이야기 Fairy Tales' 전시 이미지 / 아트센터 예술의 시간 노상준, 박준범 두 작가의 콜렉티브 그룹인 SJB PICTURES(에스제이비픽쳐스)가 첫...",http://www.chemicalnews.co.kr/news/articleView.html?idxno=5580,
14198,에스제이비,<서울로미디어캔버스> 6월 전시 기획공모,"‘기획공모 개인전’(展)은 공모를 통해 선정된 2인(팀)의 개인전으로 다발킴 작가의 《드리밍 클럽 Dreaming Club》과에스제이비픽처스(SJB pictures)의... 팀에스제이비픽처스(SJB pictures)를 결성했다. 이번 전시 《Moving》에서는 비행기, 자동차 질주, 주차난과 같은 일상에서 마주치는 현실의 모습을...",https://www.viva100.com/main/view.php?key=20230620010005630,
14198,에스제이비,"[인터뷰] 호산 스님 ""일체중생이 불성 있는데 차별이라뇨""",21일 서울 홍대 앞 비보이전용극장에스제이비보이즈에서는 스님이 대회장을 맡아 '제1회 달마배 청소년 댄스 경연대회'를 개최한다. 이에 앞서 지난달 18일에는 스님의 초청으로 이주노동자와 다문화가족 청소년 160여 명이 수국사에서 한국 전통불교를 체험한 뒤에스제이비보이즈에서 비보이 공연 '쿵 드리머...,http://yna.kr/AKR20190909175500371?did=1195m,
14198,에스제이비,네덜란드 대학생들 홍대 팸투어 성공한 사연?,"여행지로는 전국 최초의 책 테마거리인 경의선 책거리와 비보이 전용극장인 ‘에스제이비보이즈’, 소극장 산울림의 갤러리, 라이브 공연장인... 외국에서 더 유명한 한국 비보이들의 성지 ‘에스제이비보이즈’ 극장도 큰 관심을 받았다. 공연 시간이 아니었음에도 방문단을 위해 특별공연을 펼친 비보이...",https://view.asiae.co.kr/article/2019062500031589752,
