company_id,company_name,news_title,news_text,news_url,posted_at
2796,에스엘커뮤니케이션즈,"[N2 모닝 경제 브리핑-4월 21일] 美 증시, 넷플릭스 쇼크 속 혼조...OTT 업체...",휘닉스커뮤니케이션즈흡수합병 -에스엘바이오닉스(214310) : 우성인더스트리 지분 350억원 취득 인수결정 - 제노포커스(187420) : 고지혈증 치료용 약제학적 조성물 특허권 취득 - 피제이메탈(128660) : 130억원 규모 단기차입금 증가 결정 - 에코프로비엠(247540) : 종속회사 에코프로이엠 500억원 규모...,https://www.news2day.co.kr/article/20220421500008,
2796,에스엘커뮤니케이션즈,장 마감 후 기업공시[4월 20일],휘닉스커뮤니케이션즈흡수합병 ▲에스엘바이오닉스(214310)=우성인더스트리 지분 350억 원 취득 인수결정 ▲제노포커스(187420)=고지혈증 치료용 약제학적 조성물 특허권 취득 ▲피제이메탈(128660)=130억 원 규모 단기차입금 증가 결정 ▲에코프로비엠(247540)=종속회사 에코프로이엠 500억...,https://www.sedaily.com/NewsView/264RNDS8T6,
2796,에스엘커뮤니케이션즈,"[17일 낙찰/계약 동향] 2020년 설 연휴 행사 대행용역, 2020년 청사 영상정보...","위드커뮤니케이션즈에서 2020년 설 연휴 행사 대행용역, 계약금액 21,000,000(원)으로 계약했다. 금번 계약건의 발주처는 국립낙동강생물자원관이다.... ▲ 낙찰업체 :에스엘디자인 주식회사, 계약금액 : 40,000,000(원), 계약명 : 공릉동근린공원 재정비 실시설계 용역. 계약기관 : 서울특별시 노원구...",http://www.fintechpost.co.kr/news/articleView.html?idxno=99073,
2796,에스엘커뮤니케이션즈,"이주의 주식시장은? 경동인베스트 3연상, '네옴시티' 이슈 지속, 코오롱티슈진...","SK텔레콤은 SK커뮤니케이션즈가 보유한 코난테크놀로지 지분 20.77%를 224억원에 인수하기로 했다. 이번 지분 확보로 SK텔레콤은 23.9%를 보유한... 코스닥 거래량 상위 30종목은 모아데이타,에스엘바이오닉스, 삼기, 드래곤플라이, 폴라리스우노, 저스템, 실리콘투, 조광ILI, FSN, 비플라이소프트...",http://www.ggilbo.com/news/articleView.html?idxno=941898,
2796,에스엘커뮤니케이션즈,2017년 10월 프랜차이즈 정보공개서 등록취소 401개 명단 공개,20141071 / ㈜스타캐슬커뮤니케이션즈/ 스타캐슬연기학원 2017-10-19 자진취소 20 20140792 / ㈜영월 / 아시아로 2017-10-19 자진취소 21... (주)아이엠피에스엘/ 쁘띠폴리 2017-10-31 직권취소 210 20160598 / 피에라꼬끄 / 삐에라꼬끄 마켓 2017-10-31 직권취소 211 20141167...,http://www.moneyweek.co.kr/news/mwView.php?type=1&no=2017110510108032379&outlink=1,
2796,에스엘커뮤니케이션즈,[재송]20일 장 마감 후 주요 종목 뉴스,"(050090))=휘닉스커뮤니케이션즈를 흡수합병하기로 했다고 20일 공시 △이화전기(024810)=시설자금과 채무상환자금, 기타자금 등을 마련하기 위해 436억원 규모 주주우선 공모 증자를 시행한다고 20일 공시 △에스엘바이오닉스(214310)=우성인더스트리의 주식 350억원 규모를 양수키로 했다고...",http://www.edaily.co.kr/news/newspath.asp?newsid=01180806632298416,
2796,에스엘커뮤니케이션즈,20일 장 마감 후 주요 종목 뉴스,"(050090))=휘닉스커뮤니케이션즈를 흡수합병하기로 했다고 20일 공시 △이화전기(024810)=시설자금과 채무상환자금, 기타자금 등을 마련하기 위해 436억원 규모 주주우선 공모 증자를 시행한다고 20일 공시 △에스엘바이오닉스(214310)=우성인더스트리의 주식 350억원 규모를 양수키로 했다고...",http://www.edaily.co.kr/news/newspath.asp?newsid=03952406632298088,
2796,에스엘커뮤니케이션즈,'2016 대한민국 취업박람회' 국회서 열려… 참가기업은?,링거스커뮤니케이션즈▲EyeGene Inc. ▲한국정보통신기술협회 ▲한국생명공학연구원 ▲알스텍 ▲셀리버리 ▲한국표준과학연구원 ▲임포유 ▲코미코... 에스렉 ▲에스엘▲재우기술 ▲제이엠그린 ▲단석산업 ▲델타텍코리아 ▲동보 ▲비코닉스 ▲삼의공영 ▲엔젤 ▲케이투이 ▲천세산업 ▲포레시아코리아...,http://www.econotalking.kr/news/articleView.html?idxno=134898,
2796,에스엘커뮤니케이션즈,재야고수 4인이 추천하는 저평가종목,"SK커뮤니케이션즈등을 꼽았다. LS의 경우 총 4개의 자회사 중 LS전선, LS엠트론, LS산전이 성장세를 보일 것으로 예상된다는 점에 주목할 만하다. 또 미국... ▶한동훈 팍스아카데미 선임연구원에스엘케이씨텍 한솔LCD 한동훈(필명 페라리) 팍스아카데미 선임연구원은에스엘, 케이씨텍, 한솔LCD 등을 투자가...",http://www.moneytoday.co.kr/view/mtview.php?type=1&no=2009082016483094217&outlink=1,
2796,에스엘커뮤니케이션즈,대한생명ㆍSK C&C 등 코스피200지수 신규편입,"또 로엔, 루멘스, 실리콘웍스 등은 프리미어지수에, 포스코켐텍과 SK커뮤니케이션즈는 스타지수에 각각 신규 편입됐다. 한국거래소는 31일 ""지난... C&C △대한생명 △광전자 △국도화학 △금호타이어 △동양기전 △락앤락 △베이직하우스 △세종공업 △쌍용차 △아이에스동서 △에스엘...",http://www.etoday.co.kr/news/section/newsview.php?TM=news&SM=0199&idxno=443933,
