company_id,company_name,news_title,news_text,news_url,posted_at
3146,에프아이티시스템,[전북대학교 창업중심대학 초기창업패키지] 의류 제조 ERP 플랫폼 ‘패스트라...,"에프아이티컴퍼니는 의류 OEM 제조 기업이다. 윤현진 대표(36)가 2020년 1월에 설립했다.에프아이티컴퍼니는 의류 제조 전사적자원관리(ERP) 플랫폼... 전산시스템을 뜻하기도 한다. ERP는 기업 전반의 업무 프로세스를 통합적으로 관리, 경영상태를 실시간으로 파악하고 정보를 공유하게 함으로써 빠르고 투명한...",https://magazine.hankyung.com/job-joy/article/202306086657d,
3146,에프아이티시스템,"프랜차이즈산업協, 2024 KFA 대구 프랜차이즈 창업박람회 참가브랜드 공개",주식회사에프아이티그룹 ) ▲ 아이비스터디카페 ( 아이비스터디카페 ) ▲ 본좌김밥 ( 주식회사 본좌 ) ▲ 호맥 ( 호맥 ) ▲ 응급실국물떡볶이응급실닭볶음탕 ( 주식회사 금해코리아 ) ▲ 엠디푸드시스템갈비야 ( (주)엠디푸드시스템) ▲ 프람티드랩 ( 프람티드랩 )...,http://www.shinailbo.co.kr/news/articleView.html?idxno=1870469,
3146,에프아이티시스템,"모코엠시스-에프아이티, 금융 시장 공략 MOU 체결","이번에프아이티와의 업무 협약을 통해 금융 시장 내 사업 기회를 더욱 확대해 나가겠다""라고 밝혔다. 모코엠시스는 문서중앙화시스템과 클라우드 저장소를 통해 문서의 안전한 사용을 지원하는 보안솔루션 사업을 영위하고 있다. 특히 지난 2017년에는 공공기관 대상의 클라우드 저장소인 행정안전부의...",http://www.epnc.co.kr/news/articleView.html?idxno=226023,
3146,에프아이티시스템,"㈜에프아이티, 금융IT전문기업 ㈜뱅가드랩과 업무협약 체결","한편에프아이티는 2009년 회사설립 이후 현재까지 결제시스템구축 및 개발사업을 중심으로 꾸준히 성장하고 있는 강소기업이다. 최근 클라우드기반(SaaS, IaaS) 결제솔루션 공급사업을 주력 사업화하는데 중점을 두고, 클라우드 기업, 빅데이터 기업과의 긴밀한 협력 네트워크를 확대하고 있다.",http://www.edaily.co.kr/news/newspath.asp?newsid=02850326632233800,
3146,에프아이티시스템,"웨이브스트링x에프아이티, 암호화폐 연동 결제시스템플랫폼 구축","에프아이티는 10여년 동안 나이스정보통신, 이비카드, JTNET, 한국신용카드네트워크 등 다수의 VAN 서비스시스템구축 및 결제서비스 개발경험을 갖고 있는 업체다. 양사는 이번 협력으로 암호화폐를 이용한 실시간 결제 플랫폼을 구축해 새로운 형태의 핀테크 결제 서비스를 제공한다는 계획이다....",http://www.edaily.co.kr/news/newspath.asp?newsid=03106166622526312,
3146,에프아이티시스템,[신SW상품대상 추천작]에프아이티`모바일 식권대장부 달아요`,조용준에프아이티대표는 “지역 소상공인은 새로운 시도나시스템을 도입하는 데 상당한 부담을 느낀다”며 “기존 동네 가게 운영방식을 그대로 유지하면서 수기장부 작성을 모바일로 편리하게 대신하는 서비스를 개발했다”고 말했다. 모바일 식대장부 달아요는 오픈플랫폼이다. 거래 당사자의 자발적...,http://www.etnews.com/20160718000120,
3146,에프아이티시스템,"팜팜테크,에프아이티시 사실상 흡수 합병","최건 사장은 ""에프아이티씨의 경우 은행, 증권사 등에 신용평가시스템과 종합자산관리시스템, 투자지원시스템등을 공급한 경험이 있어 팜팜테크의 모바일 솔루션 기술력과 접목해 모바일 금융 솔루션 시장에 진출할 수 있을 것""이라고 말했다. 팜팜테크는 이에 따라 사업 구조 개편 작업을 추진하고...",https://n.news.naver.com/mnews/article/031/0000003848?sid=105,
3146,에프아이티시스템,"에프아이티아시아, 통합 보안솔루션개발",<권민수>에프아이티아시아는 △가정 원격보안시스템△개인용 인터넷방송솔루션 △P2P 인터넷ASP 등 세가지 기능이 통합한 솔루션을 개발했다고 29일 밝혔다. 이번에에프아이티아시아가 개발한 솔루션을 이용하면 외출시 외부인의침입을 휴대폰이나 이메일로 알 수 있고 개인용 인터넷방송국도 구축할수...,https://n.news.naver.com/mnews/article/009/0000080479?sid=105,
3146,에프아이티시스템,"에프아이티아시아,에센박람회 참가","인터넷 솔루션 공급업체인에프아이티아시아(대표 김형모)는 10일부터 13일까지 독일 에센에서 열리는 ""독일 에센 보안 장비 박람회""에 퓨전시스템과 공동개발한 ""영상경계선 감지시스템""을 출품한다고 9일 밝혔다. ""독일 에센 보안 장비 박람회""는에프아이티아시아를 비롯,세계 30개국 약 9백여개사가...",https://n.news.naver.com/mnews/article/015/0000285958?sid=101,
3146,에프아이티시스템,"에프아이티아시아, P2P통합솔루션 개발","에프아이티아시아는 서버없이 일반PC를 연결해 데이터를 공유할 수 있는 P2P(Peer to Peer)기술을 응용해 다양한 인터넷서비스와 보안서비스를 제공할... 보안시스템을 누구나가 쉽게 구축할 수 있다고 회사측은 설명했다. 이 솔루션은 PC카메라를 통해 피사체의 움직임을 이 회사에서 개발,특허 출원중인...",https://n.news.naver.com/mnews/article/015/0000312155?sid=101,
