company_id,company_name,news_title,news_text,news_url,posted_at
3427,엔소프트,소프트뱅크 주가 반등중…일본 ‘라인 뺏기’ 어디쯤 가고 있나,네이버 지분이소프트뱅크보다 1주 많지만 회사를 지배하지는 않아 계열사가 아닌 관계기업이다. 지난해 말 기준 네이버가 인식한 A홀딩스 지분의 장부 금액은 15조 3384억 원이다. 지난 연말 주당 500엔에 근접하던 라인야후 주가는 최근 360엔까지 미끄러졌다. 5조 엔이 넘던 시가총액도 2조 7200억엔(약 24조 원)...,https://ilyo.co.kr/?ac=article_view&entry_id=471991,2024-05-10 15:34
3427,엔소프트,"엔소프트, WMS-AI 첨단 물류 스마트제조 컨설팅시스템화 토탈솔루션 구축","사진=엔소프트엔소프트는 최근 인공지능(AI)기술을 접목해 음성명령 적재 위치 최적화와 피킹 동선 추천 등, 재고 예측 기반 물류 최적화 기능을 탑재한 WMS-AI 시스템을 구축해 본격적인 시판을 앞두고 있다고 11일 밝혔다. 정부가 추진하는 탄소중립실현의 한 수단으로, 국토교통부는 산업에 따른 물류부분...",https://www.pinpointnews.co.kr/news/articleView.html?idxno=195653,
3427,엔소프트,"엔드림 '드래곤 엠파이어', 오는 17일 글로벌 출시","엔드림은 드래곤 엠파이어소프트론칭을 통해 완성도를 높여왔다. 검증된 콘텐츠로 글로벌 시장을 공략한다는 계획이다. 조승기 엔드림 게임 사업부 이사는 ""드래곤 엠파이어는 영지 경영부터 공성전까지 다양한 콘텐츠를 경험할 수 있는 자유도 높은 게임으로 글로벌 시장에서도 충분히 경쟁력을 갖췄다""고...",https://www.techm.kr/news/articleView.html?idxno=118647,
3427,엔소프트,"[종합] 뉴욕증시, 인플레이션 우려 속 혼조…다우 올해 최고 주간","주요 종목 중엔 마이크로소프트(MS)가 0.59% 상승했고 메타와 엔비디아는 각각 0.16%, 1.27% 올랐다. 반면 애플은 0.69%, 알파벳은 0.75% 하락했다. 테슬라는... 달러·엔환율은 0.2% 상승한 155.78엔을 기록했다. 가상자산(가상화폐)은 약세다. 코인데스크에 따르면 한국시간 11일 오전 7시 40분 현재 비트코인은...",https://www.etoday.co.kr/news/view/2358991,
3427,엔소프트,"'슈퍼엔저' 장착 도요타, 영업이익 5조엔 넘었다",핵심 투자 분야는 AI를 활용한 자율주행 등소프트웨어와 전기차다. 최근 전기차 시장 성장세는 줄었지만 중장기 성장 시나리오는 변하지 않을... 도요타는 작년 실적 상승에 큰 힘이 된 엔저 효과는 올해 축소될 것으로 전망했다. 올해엔·달러 평균 환율은 145엔으로 내다봤다. 도쿄=김일규 특파원,https://www.hankyung.com/article/2024050855251,
3427,엔소프트,日 ‘네이버 축출’ 본격화… 우리 정부는 뒷짐만 지고 있나[횡설수설/정임수...,▷일본 정보기술(IT) 기업소프트뱅크와 ‘반반 경영’을 시작한 건 2019년부터다. 네이버의 라인과소프트뱅크가 운영하는 일본 최대 포털 야후저팬이 결합해 ‘라인야후’가 자리 잡았다.소프트뱅크의 손정의 회장이 온라인 비즈니스를 망라한 거대 플랫폼을 만들겠다며 협업을 먼저 제안한 것으로...,https://www.donga.com/news/Opinion/article/all/20240509/124870414/1,
3427,엔소프트,'여친 살해 의대생' 사이코패스 검사..신상공개는 안해 外,"라인야후와소프트뱅크가 네이버와 결별을 공식화했다는 소식이 나왔는데요. 우리나라 국민 메신저는 카카오톡이죠? 일본엔 네이버 '라인'이 있습니다. 일본 국민 1억 명이 사용하고 대만, 태국 등 동남아시아에도 쓰고 있는데요. 라인은 한국 네이버의 메신저 기술을 기반으로 설립됐고 13년 동안 일본의소프트...",https://www.ytn.co.kr/_ln/0101_202405101536242489,2024-05-10 16:34
3427,엔소프트,"지역 강소 SW 기업 키우는 'SW융합클러스터',소프트웨이브 2023서 공동관 꾸...",지역 강소소프트웨어(SW) 기업을 육성하는 'SW융합클러스터' 참여 기업들이 오는 29일 개막하는 대한민국소프트웨어(SW) 대전 '소프트웨이브 2023'에서 공동관을 꾸린다. 올해소프트웨이브 2023은 '소프트웨어가 미래다'를 주제로 진행된다. '국내 최대 SW 전시회'에 걸맞게 국내 대표 SW 기업이 핵심 기술을...,https://www.etnews.com/20231110000128,
3427,엔소프트,"[포토]엔소프트, '2019 스마트팩토리 어워드 코리아' 기업솔루션 MES부문 마...","엔소프트는 기획에서부터 개발과 구축, 운영까지 모든 서비스를 제공을 목표로 기업 또는 단체 고유의 특성에 맞는 맞춤형 시스템 개발에 노력한 공로를 인정받아 '2019 스마트팩토리 어워드 코리아' 기업솔루션 MES부문 마케팅 대상을 수상했다.엔소프트는 2005년 설립돼 SI, 솔루션, MES/POP, 웹, 모바일 등...",http://www.industrynews.co.kr/news/articleView.html?idxno=34512,
3427,엔소프트,엔소프트염성법인-울산과학대 MOU 체결 '해외 인턴쉽 상호 협력',이연주 울산과학대 국제교류·어학교육원 부원장(왼쪽)과 안종용엔소프트염성법인장이 12일 해외 인턴쉽 프로그램 등에 관한 MOU를 맺고 있다. 아시아투데이 이지훈 염성(중국)특파원 = 시스템 통합서비스(SI) 전문기업엔소프트염성법인이 울산과학대학교와 손을 잡고 해외 인턴쉽 프로그램 등에 관해...,http://www.asiatoday.co.kr/view.php?key=20170412010007870,
