company_id,company_name,news_title,news_text,news_url,posted_at
11929,엔터테인먼트아이엠,"(여자)아이들 ""데뷔 6주년 믿기지 않아…평생 함께하자""","아이들이 데뷔 6주년을 맞아 감사 인사를 전했다.아이들(미연, 민니, 소연, 우기, 슈화)은 2일 소속사 큐브엔터테인먼트를 통해 ""데뷔가 엊그제... (여자)아이들은 지난 2018년 5월 2일 미니앨범 '아이 엠(I am)'으로 데뷔한 후 타이틀곡 '라타타(LATATA)'로 음악 방송 1위에 오르며 두각을 나타냈다. 이후...",https://www.hankyung.com/article/202405022970H,
11929,엔터테인먼트아이엠,"몬스타엑스아이엠, 첫 솔로 월드투어…亞 넘어 美까지","이번 월드투어는아이엠이 소니뮤직엔터테인먼트코리아로 이적 후 처음으로 개최하는 것으로, 지난 3일 발매한 신보 '오프 더 비트'와 동명의 타이틀을 내건 공연이다.아이엠은 각기 다른 콘셉트 속 다양한 매력을 보여줄 수 있는 세트리스트로 글로벌 아티스트다운 존재감을 드러낼 전망이다. '오프...",https://www.newsis.com/view/?id=NISX20240422_0002708909&cID=10601&pID=10600,
11929,엔터테인먼트아이엠,"몬스타엑스아이엠, 오늘(29일) 서울 콘서트 티켓 오픈","아이엠의 월드투어 ‘Off The Beat’ 서울 공연은 5월 25일과 26일 양일간 장충체육관에서 열린다. 이후 런던부터 파리, 쾰른, 베를린, 뉴욕, 토론토, 시카고, 타이베이, 도쿄, 방콕 등 총 10개국 18개 도시를 순회를 앞두고 있다. 사진 = 소니뮤직엔터테인먼트코리아",https://www.xportsnews.com/article/1853225,
11929,엔터테인먼트아이엠,"몬스타엑스아이엠, '아이엠온더비트' MC 발탁…20일 첫 공개","17일 소속사 소니뮤직엔터테인먼트코리아에 따르면아이엠은 유튜브 채널 KBS Kpop의 새로운 콘텐츠 '아이엠온더비트' MC로 발탁됐다. '아이엠온더비트'는 싱어송라이터들의 가장 편안한 아지트라는 콘셉트로 기획, 아티스트들의 은밀한 음악 스토리를 들을 수 있는 고품격 작업실 콘텐츠다.아이엠은...",https://www.news1.kr/articles/5387756,
11929,엔터테인먼트아이엠,"몬스타엑스아이엠, 서울 콘서트 양일 전석 매진..티켓 파워","자신만의 음악적 세계관을 공연으로 확장하겠다는 포부는 물론, 그간 머릿속에서 상상하고 그려왔던 모든 것을 이번 투어에서 가감 없이 드러낼 계획이다. 한편,아이엠의 ‘Off The Beat’와 관련된 자세한 사항은 공식 SNS 채널을 통해 확인할 수 있다. 사진제공 = 소니뮤직엔터테인먼트코리아",http://biz.heraldcorp.com/view.php?ud=202404300736408340189_1,
11929,엔터테인먼트아이엠,"[인기가요] IVE 이서, 제베원 한유진, 문성현 새 MC→NCT도영, (여자)아이들 ...","[인기가요] IVE 이서, 제베원 한유진, 문성현 새 MC→NCT도영, (여자)아이들 우기 솔로 데뷔....이번 주 라인업은? /사진 = 도영 / SM엔터테인먼트제공 우기 'FREAK' 신비롭고 사랑스러운 호러 무비 속 주인공! 엉뚱 발랄한 FREAK '우기'! [인기가요] IVE 이서, 제베원 한유진, 문성현 새 MC...",https://www.mhns.co.kr/news/articleView.html?idxno=585673,
11929,엔터테인먼트아이엠,"몬스타엑스아이엠, ‘아이엠온더비트’ MC 발탁…20일 첫 공개","몬스타엑스아이엠, ‘아이엠온더비트’ MC 발탁…20일 첫 공개 그룹 몬스타엑스아이엠(I.M)이 유튜브 채널 KBS Kpop의 새로운 콘텐츠 ‘아이엠온더비트’ MC로 발탁됐다고 소속사 소니뮤직엔터테인먼트코리아가 17일 밝혔다.‘아이엠온더비트’는 싱어송라이터들의 가장 편안한 아지트라는 콘셉트로 기획...",https://www.viva100.com/main/view.php?key=20240417010005697,
11929,엔터테인먼트아이엠,"아이엠, K컨텐츠·엔터테인먼트까지 신규 사업영역 확장",국내 톱아이돌이 대거 출연하는 이번 행사는 여수엑스포OTT페스티벌 조직위원회가 주관하고 골든플래닝이 주최한다. 전 세계 16억명의 가입자와 국내 연 60% 성장률의 OTT K-컨텐츠와 엔터테이먼트 사업에 꾸준한 관심을 갖고 있는아이엠은 행사 주최사인 골든플래닝과...,https://www.seoul.co.kr/news/economy/industry/2024/03/19/20240319500111&wlog_tag3=naver,
11929,엔터테인먼트아이엠,몬스타엑스아이엠솔로 컴백…매혹적인 ‘루어’ 또 반하네 (종합)[DA:신곡],아이엠은 소속사 소니뮤직엔터테인먼트코리아를 통해 “‘OVERDRIVE’ 때보다 조금 더 자유로운 무드의 노래들이 나오지 않았나 싶다. 하나만 고를 수 없을 정도로 모든 곡들이 좋다. ‘LURE’를 포함해서 전곡 다 천천히 들어봐 주시면 좋겠다”고 말했다. 이어 “‘LURE’는 본격 ‘몬베베’(공식...,https://sports.donga.com/article/all/20240403/124304316/1,
11929,엔터테인먼트아이엠,"몬스타엑스아이엠, 신보 'Off The Beat' 기대포인트 셋",사진제공: 소니뮤직엔터테인먼트코리아 그룹 몬스타엑스아이엠(I.M)이 리스너를 향한 '유혹'을 건넨다.아이엠은 오는 3일 오후 6시 각종 온라인 음원사이트를 통해 미니 3집 'Off The Beat(오프 더 비트)'를 발매한다. 'Off The Beat'는아이엠의 음악적 방향성이 '비정형'적임을 표현한 앨범이다. 자신이...,https://www.gukjenews.com/news/articleView.html?idxno=2959274,
