company_id,company_name,news_title,news_text,news_url,posted_at
2691,엠에스시스템즈,[7월 5일 워크넷 채용정보] 네오헬스테크널러지·서우엠에스·세연시스템즈·...,"서우엠에스(주) 네트워크 구축 업무 담당자 모집 ▷지원자격 : 경력 (최소 1년 0 개월 이상) 필수 / 대졸(2~3년) ~ 석사 ▷채용기간 : 채용시까지... (주)세연시스템즈펌웨어 개발자 모집 ▷지원자격 : 경력 (최소 5년 0 개월 이상) 필수 / 학력무관 ▷채용기간 : 7월 15일 16시까지 ▷전형방법 : 서류, 면접...",https://www.news2day.co.kr/article/20220705500190,
2691,엠에스시스템즈,美 반도체 테마주 폭락에 韓 국내 관련주 외국인은 이미 '팔았다' 신성이엔지...,"피엔티엠에스종목은 거래가 없다. 업종 급락에 티엔엔터테인먼트, 신성델타테크, 대한유화, 덕산테코피아, 파워로직스, LG에너지솔루션, 나노팀, 동원시스템즈, 서원인텍, SKC, 디이엔티, 자이글, 글로벌에스엠, 고려아연, 조광페인트, 대주전자재료, 에이에프더블류, 윤성에프앤씨, 황금에스티...",https://www.thekpm.com/news/articleView.html?idxno=178306,
2691,엠에스시스템즈,"[HIT알공] 녹십자, 3분기 매출 4394억…큐리옥스, 27억 공급계약","⑥녹십자엠에스, 3분기 잠정 실적 발표 = 녹십자엠에스는 3분기 잠정 실적으로 매출액 234억9800만원, 영업이익 5억1500만원, 당기순이익... ⑪큐리옥스바이오시스템즈, 27억 규모 공급 계약 체결 = 큐리옥스바이오시스템즈는 종속회사인 큐리옥스바이오시스템즈중국(Curiox Biosystems China Co., Ltd.)과...",http://www.hitnews.co.kr/news/articleView.html?idxno=49563,
2691,엠에스시스템즈,美 반도체 제조·장비·소재 테마 연일 '급락' 외국인 韓 관련주 HB테크놀러지...,"로체시스템즈, 아바코, 원익IPS, 미래컴퍼니, 로보스타, 탑엔지니어링, 아이씨디, 제이스텍, 티로보틱스, 비아트론, 신성이엔지, 케이엔제이, 브이원텍, 엘오티베큠, 피엔티 주가가 상승중이며, 스마트솔루션즈, 피엔티엠에스종목은 거래가 없다. 업종 상승에도 베셀, 에스에프에이, 동아엘텍...",https://www.thekpm.com/news/articleView.html?idxno=178022,
2691,엠에스시스템즈,韓 시스템반도체·반도체장비 관련주 '폭락' 외국인·기관 거래 '희비' HB테크...,"피엔티엠에스종목은 거래가 없었다. 업종 폭락에 삼진엘앤디, 에스에프에이, 윤성에프앤씨, 코윈테크, 티엔엔터테인먼트, 유에스티, 영화테크, 서원인텍, 에이에프더블류, 고려아연, 동원시스템즈, 상아프론테크, 씨아이에스, 티에스아이, 미코, 대한유화, SK이노베이션, 디에이테크놀로지, DI동일...",https://www.thekpm.com/news/articleView.html?idxno=177696,
2691,엠에스시스템즈,[기관 연일 매수 특징주] '보유량 늘려가는 종목' 랩지노믹스·유니온·엘오티...,"바디텍메드, 녹십자홀딩스, 팜젠사이언스, 바이오니아, HK이노엔, 제놀루션, 엑세스바이오, 현대바이오, 파미셀, 녹십자엠에스, 씨젠, 휴마시스... 한편, 업종 약세에 에스에프에이, 윈텍, 참엔지니어링, 한양이엔지, 로체시스템즈, 케이엔제이, 탑엔지니어링, 동아엘텍, 베셀, 에스티아이, 미래컴퍼니...",https://www.thekpm.com/news/articleView.html?idxno=172468,
2691,엠에스시스템즈,[외국인 연일 매도 특징주] '기관 투자 동향은?' 포스코DX·파두·남선알미늄...,"시큐레터, 큐리옥스바이오시스템즈, 에이엘티, 뷰티스킨, 버넥트, 와이랩, 코츠테크놀로지, 파로스아이바이오, 센서뷰, 스마트레이더시스템... 동양피스톤,엠에스오토텍, 화신정공, 동원금속, 모트렉스, 여오하금속, 현대공업, 에스텍, 피에스텍, HL만도, 티피씨글로벌, 와이엠, 새론오토모티브...",https://www.thekpm.com/news/articleView.html?idxno=172162,
2691,엠에스시스템즈,[31일 오늘의 상한가 총정리] 녹십자엠에스·휘닉스소재·메디포럼제약 급등세...,"녹십자엠에스·휘닉스소재·메디포럼제약 급등세 '코로나 재확산 수혜' 코로나19 사회적 거리두기 2.5단계로 격상되면서 식품주와 코로나 관련주가 큰... 사조그룹은 오너 2세인 주진우 회장과 장남 주지홍 상무 일가가 100% 보유한 사조시스템즈를 중심으로 사조산업, 사조오양, 사조대림, 사조해표 등이...",http://www.ccreview.co.kr/news/articleView.html?idxno=281829,
2691,엠에스시스템즈,"[특징주]엠에스오토텍, 테슬라 '배터리데이' 행사 소식에 장중 24%대 널뛰기","테슬라는 2차전지 관련 업체인 배터리 셀 제조업체 '맥스웰 테크놀로지스'와 배터리 장비업체 '하이바시스템즈' 등을 인수한 바 있다.엠에스오토텍은 현대, 기아자동차에 자동차의 골격인 차체 부품을 제조·공급·판매하는 회사다. 테슬라에는 핫스템핑 등 차체 부품을 납품하는 것으로 알려졌다.",http://www.newsworks.co.kr/news/articleView.html?idxno=487888,
2691,엠에스시스템즈,"GC녹십자엠에스, 협력의 장 마련‥`비즈니스 파트너링`",안은억 GC녹십자엠에스대표(앞줄 오른쪽에서 다섯 번째)가 지난 15일 경기도 용인시 GC녹십자 본사에서 진행된 `스위스 바이오벤처 초청 비즈니스... 파트너링 행사에는 진단의료기기 전문기업 맥스웰 바이오시스템즈(Maxwell Biosystems)와 디지털헬스케어 관련 소프트웨어 개발기업인 하코(Haako) 등 총 8곳의...,http://medipana.com/news/news_viewer.asp?NewsNum=239074&MainKind=A&NewsKind=5&vCount=12&vKind=1,
