company_id,company_name,news_title,news_text,news_url,posted_at
10398,여름기획,"W컨셉, 나이키여름스타일링 화보 BECOMING NIKE 공개",W컨셉이 글로벌 스포츠 브랜드 나이키의여름스타일링 화보 'BECOMING NIKE'를 공개한다고 10일 밝혔다. 2019년 나이키와 전략적 파트너십을 맺은 이래 매년 진행하는 스타일링 콘텐츠로 2030 고객 감성을 고려해기획했다. 화보의 주제인 BECOMING NIKE는 W컨셉이 청년들에게 전하는 응원의 메시지다. 무엇이든 될...,https://www.news1.kr/articles/5411864,
10398,여름기획,"올여름인기 휴가지는 어디… 여행사, 할인 혜택 '봇물'","여행사들은 이 같은 여행객을 겨냥해 풀빌라·전세기 등을 갖춘기획상품을 개발하고 판매에 나섰다. 올여름여름휴가도 빠르게 계획 여행사, 온라인여행플랫폼(OTA)들은 여행객들이여름휴가를 준비하는 시점이 지난해보다 빨라졌다고 보고 있다. 실제로 트립비토즈는 자사 데이터를 분석한 결과 아직...",https://www.sedaily.com/NewsView/2D959T7VH5,2024-05-11 06:15
10398,여름기획,"휘닉스 파크, 평창 대자연 품은여름풀파티 패키지 출시","골프를 테마로 한 에어바운스, 캐릭터 미니 에어바운스, 대형 블록 놀이, 보드게임과 포켓볼 등 여러 아이템으로 꾸몄다. 상상놀이터를기획한 휘닉스 파크 서비스유닛2 왕호경 UD는 ""올여름다양한 놀 거리와 자연이 선사하는 생동감 있는 휴식이 있는 휘닉스 파크에서 즐거울여름여행을 즐기길 바란다""고 했다.",https://isplus.com/article/view/isp202405100158,
10398,여름기획,"BYC, 개리야스여름신제품 사전예약판매 실시","모시메리 과수원 런닝은 한국적인여름소재 모시를 활용한 반려견용 런닝 제품이다. 자연광에서도 짧은 시간 안에 건조가 가능한 기능성 원단으로... BYC 관계자는 “매년 고온 현상이 이어져 무더위에 취약한 반려견들을 위한 제품들을 다양하게기획했다”며 “지난해 빨간내복, 김장조끼 등 인기 제품의...",https://www.dailian.co.kr/news/view/1359886/?sc=Naver,
10398,여름기획,"""전기획참여+수익금 기부"" 임윤아, 팬들 위한 '생일 팝업' 오픈","또한 현장을 방문한 팬들에게는 특별 제작된 한정판 쿠키와 음료를 역조공 이벤트로 무료 증정하며, 임윤아가기획부터 참여해 만들어진 미공개... 더불어 팝업이 완성되기까지 모든 과정을 담은 비하인드 영상은 물론, 임윤아의 생일 당일인 5월 30일에는 솔로곡 '여름밤(Feat. 스무살) (Summer Night)...",https://www.xportsnews.com/article/1857420,
10398,여름기획,"""작가가 꿈이라면""…대원미디어, '스토리텔링여름학기' 모집","한편, 스토리작은 작품 스터디 및기획브레인스토밍, 수강생 커뮤니티, 1대 1 밀착 관리 및 피드백이 가능한 전담 PD 등 웹소설 및 웹툰 스토리 작가를 꿈꾸는 모두가 제약없이 지원 가능하도록 스토리텔링 글로벌캠퍼스 24학번여름학기 과정을 무료로 운영한다.",http://www.edaily.co.kr/news/newspath.asp?newsid=01813846638887608,
10398,여름기획,때 이른여름더위에 반소매 셔츠 인기↑,"에이블리코퍼레이션(대표 강석훈)의 스타일커머스 플랫폼 에이블리는 지난달 29일부터 이달 6일까지 진행한 '쇼핑몰 메가세일'기획전 방문 횟수가... 특히 때 이른여름더위에 인기 상품에도 변화가 나타났다. 셔츠, 반소매 티셔츠 등 가벼운여름의류가 높은 인기를 끌었으며, 이는 야상, 가디건 등 아우터...",http://www.enewstoday.co.kr/news/articleView.html?idxno=2125887,
10398,여름기획,"PK헤만, 글로벌 패션쇼 디자인기획상 수상","PK헤만은 5월 5일 인천광역시 송도컨벤시아 2홀에서 열린 글로벌 패션쇼에서 디자인기획상을 받았다. 세계적 브랜드 프랭커스가 주관한 이날 패션쇼에서 PK헤만은 셔츠 가슴 부분에 이탈리아 네오프렌 원단을 덧댄 L4K3의 크롭과 반소매 셔츠로 수상 영예를 안았다. PK헤만은 ""여름에 땀에 젖거나 비에...",https://www.starnewskorea.com/stview.php?no=2024051014291361883,
10398,여름기획,"충북교육문화원, 가족 뮤지컬 '수박수영장' 9∼10일기획공연","충북도교육청 교육문화원은 어린이 베스트셀러 그림책을 주제로 한 가족 뮤지컬 '수박수영장'을 9일과 10일 오전 10시, 오후 7시 총 4회기획공연한다고 밝혔다. 수박수영장은 안녕달 작가의 그림책 수박수영장에 나오는 소나기, 너른 수박밭 등여름의 정취가 느껴지는 장면으로 무대를 구성했다. 흥겨운 음악과...",https://www.news1.kr/articles/5410018,
10398,여름기획,"[e커머스 & Now] 쿠팡, 식품 특가기획전 ‘99마트’ 진행 등","‘99마트’기획전에서 다양한 식품을 최대 50% 할인 특가에 선보인다고 9일 밝혔다. 와우회원은 주문 금액과 횟수 제한없이 무료배송 혜택을 받을 수... 손 선풍기, 캠핑용 선풍기, 써큘레이터 등여름을 미리 준비하는 고객들을 겨냥한 선풍기 반값 판매도 연일 품절을 기록 중이다. 고객들의 이벤트...",https://www.ebn.co.kr/news/view/1622219/?sc=Naver,
