company_id,company_name,news_title,news_text,news_url,posted_at
11916,예감,한강에 세계서 가장 긴 미술관 생긴다… '잠수교 핑크길' 명소예감,"서울 잠수교가 '서울에서 가장 길고 특별한 야외 미술관'으로 탈바꿈한다. 서울시는 ‘문화의 다리, 잠수교(디자인 설계 및 콘텐트 기획) 설계 공모’ 최종 당선작을 10일 발표했다. 시는 잠수교를 서울 최초의 ‘차 없는 보행 전용 다리’로 꾸미기로 하고 설계를 공모해왔다. 설계비는 7억원이다. 공중...",https://www.joongang.co.kr/article/25248363,
11916,예감,"[포토]'더 에이트쇼'화려한 주역들, 대박예감","배우 류준열, 천우희, 박정민, 이열음, 박해준, 이주영, 문정희, 배성우이 10일 오전 서울 중구 장충동 앰배서더 서울 풀만 호텔에서 진행된 넷플릭스 '더 에이트 쇼' 제작발표회에 참석해 포토타임 촬영에 임하고 있다. 8명의 인물이 8층으로 나뉜 비밀스런 공간에 갇혀 '시간이 쌓이면 돈을 버는...",http://biz.heraldcorp.com/view.php?ud=202405101222120891917_1,
11916,예감,이랜드 키디키디 두번째 팝업도 '인기예감',"이랜드월드에서 운영하는 취향 육아 플랫폼 키디키디가 10일부터 16일까지 잠실 롯데월드몰에서 두번째 팝업스토어를 운영한다. 이번 팝업은 첫 행사로 '오픈런' 열풍을 일으킨 키디키디가 두번째 진행하는 오프라인 쇼핑 공간이다. 이번 팝업에선 하이헤이호, 웜앤크리미, 워니리본 등 주요 브랜드 신상을...",http://www.newsbrite.net/news/articleView.html?idxno=183133,
11916,예감,흥행예감'다크앤다커 모바일' 97%가 다시 플레이 원해,"두 번째 대규모 테스트 6월 중 한국에서 진행 7년 차 '배틀그라운드'를 앞세워 역대 최대 분기 매출 실적을 달성한 크래프톤이 모든 사업 부문의 안정적인 성장세를 이끌어내며 실적 날개를 달았다.특히 하반기 글로벌 기대작 '다크앤다커 모바일'이 출시를 앞두고 첫 대규모 테스트를 성공적으로 마쳐, 올해...",https://www.asiatoday.co.kr/view.php?key=20240509001241127,
11916,예감,"박재정, 입대 전 신곡 선물…'무슨 일 있었니' 또 한 번 히트예감",가수 박재정이 입대 전 마지막 신곡을 선보인다. 박재정은 9일 오후 6시 각종 온라인 음원 사이트를 통해 신곡 '무슨 일 있었니'를 발매한다. '무슨 일 있었니'는 '헤어지자 말해요'가 수록된 정규 앨범 1집 'Alone(얼론)' 이후 1년 1개월 만에 선보이는 신곡이다. '헤어지자 말해요'에 이어 이번 곡도 박재정이 작사...,http://enews.imbc.com/News/RetrieveNewsInfo/417238,
11916,예감,강릉 월화거리 야시장 대박예감,"강릉 월화거리 야시장이 큰 인기를 끌며 새로운 핫 플레이스로 자리잡고 있습니다. 일부 식품 매대는 재료가 일찍 떨어져 장사를 못할 정도인데요. 월화교 분수조명까지 재가동돼, 강릉의 밤풍경을 바꿔놓고 있습니다. 보도에 김근성 기잡니다. [리포터] 말 그대로 발 디딜 틈이 없습니다. 개장 첫날부터 방문객이...",https://www.g1tv.co.kr/news?mid=1_207_6&newsid=307324,
11916,예감,"[포토]안판석 감독, 졸업 좋은예감","tvN 새 토일드라마 ‘졸업’ 제작발표회가 9일 오후 서울 신도림 라마다 호텔에서 열렸다. 안판석 감독, 배우 정려원, 위하준이 기자간담회에 참석했다. 2024.5.9",https://www.mk.co.kr/article/11011513,
11916,예감,"'팀 홈런·OPS 1위' 강승호, '대박예감'에도 들뜨지 않는다 ""개인 목표 전혀...","""개인적인 목표는 전혀 없습니다. 매 경기 최선을 다할 뿐입니다."" 1군에서 보내는 8번째 시즌, 3번째 팀에서 새 시즌을 준비하며 강승호(30·두산 베어스)는 이를 갈았다. 7번의 시즌 동안 3할 타율은커녕 0.270에도 도달한 적이 없었다. 그렇기에 지금 결과과 영원하지 않으리라는 것도 잘 알고 있었다. 안주할...",https://www.starnewskorea.com/stview.php?no=2024051022423919179,
11916,예감,“커터로 타자들 교란시켜” 韓 20승 MVP 위력투에 ML이 감탄한다…KBO 역수출...,KBO리그 무대를 평정하고 메이저리그로 복귀한 에릭 페디(31·시카고 화이트삭스)가 제2의 메릴 켈리(애리조나 다이아몬드백스)가 될 조짐을 보이고 있다. 페디는 지난 10일(이하 한국시간) 미국 일리노이주 시카고 개런티드 레이트 필드에서 열린 2024 메이저리그 클리블랜드 가디언스와의 홈경기에 선발...,http://www.osen.co.kr/article/G1112334010,2024-05-11 13:37
11916,예감,"[종합] '인생작' 정려원X'첫 쌍방멜로' 위하준의 '졸업', '눈여' 이을 주말 흥...",이우정 기자 | '졸업' 정려원과 위하준이 메가 히트작 '눈물의 여왕'을 잇는 로맨스 흥행작을 예고했다. 9일 서울 구로구 라마다서울 신도림호텔에서 tvN 새 토일드라마 '졸업' 제작발표회가 열려 연출을 맡은 안판석 감독을 비롯해 배우 정려원과 위하준이 참석했다. '졸업'은 스타 강사 서혜진과 신입 강사로...,http://digitalchosun.dizzo.com/site/data/html_dir/2024/05/09/2024050980181.html,
