company_id,company_name,news_title,news_text,news_url,posted_at
8634,오렌지커뮤니케이션즈,"[오늘의 CPNT] 나 혼자만 레벨업, 만화카페 브랜드 '놀숲'과 콜라보 外","◆김혜림 넥슨커뮤니케이션즈파트장, 장애인의 날 맞아 부산시장 표창 수상 넥슨은 자회사 넥슨커뮤니케이션즈의 김혜림 파트장이... ◆스마일게이트오렌지플래닛, 2024년 상반기 19개 스타트업 선발 스마일게이트오렌지플래닛 창업재단은 2024년 상반기 정기모집에 최종 19개 팀을 선발했다고 19일...",https://dealsite.co.kr/articles/121391,
8634,오렌지커뮤니케이션즈,"퍼틸레인 자회사 '블루오렌지', 상반기 취급고 250억 기록",마케팅 그룹 '퍼틸레인(대표 김진)'은 자회사 '블루오렌지커뮤니케이션즈(블루오렌지)'가 올해 상반기 취급고(광고 수주금액 합계) 250억원을 기록했다고 5일 밝혔다. 사진=퍼틸레인 퍼포먼스 마케팅 에이전시 '블루오렌지커뮤니케이션즈'가 국내 광고 시장 둔화에도 불구하고 올 상반기 성과를 냈다. 마케팅...,http://www.bizwnews.com/news/articleView.html?idxno=61218,
8634,오렌지커뮤니케이션즈,"㈜오렌지베어커뮤니케이션즈, '시니어 모델 클래스' 오픈","㈜오렌지베어커뮤니케이션즈가 시니어 모델 클래스 이벤트를 오픈한다.[포스터=(주)오렌지베어] ㈜오렌지베어커뮤니케이션즈가 시니어 모델 클래스 이벤트를 오픈한다고 30일 밝혔다. 이번 이벤트는 ㈜오렌지베어가 기획한 2022 시니어 컬쳐 프로젝트의 첫 번째이며 ""나를 찾는 공간""이라는 타이틀로...",http://www.enewstoday.co.kr/news/articleView.html?idxno=1559226,
8634,오렌지커뮤니케이션즈,[#게임스테이션] 에픽세븐-오버로드 '콜라보' ·김혜림 파트장 '부산시장 표창...,스마일게이트의 '에픽세븐'이 일본의 인기 IP '오버로드'와 콜라보레이션 콘텐츠를 선보이고 김혜림 넥슨커뮤니케이션즈의 파트장이 '부산시 제44회 장애인의 날 기념행사'에서 부산광역시장 표창을 받았다.오렌지플래닛이 2024년 상반기 정기모집에 최종 19개 팀을 선발했고 넷마블이 '제2의 나라:크로스 월즈...,https://www.newsworks.co.kr/news/articleView.html?idxno=750455,
8634,오렌지커뮤니케이션즈,"퍼틸레인, 퍼포먼스 마케팅 대행사 블루오렌지커뮤이케이션즈 인수",▲ 김진 퍼틸레인 대표(왼쪽)와 이상화 블루오렌지커뮤니케이션즈대표가 M&A 체결 기념사진을 찍고 있다. 종합 마케팅 에이전시 퍼틸레인은 블루오렌지커뮤니케이션즈(이하 블루오렌지)를 인수했다고 1일 밝혔다. 블루오렌지는 다양한 산업군의 퍼포먼스 마케팅 수행과 네이버·카카오의 공식 대행사 선정을...,http://www.datanet.co.kr/news/articleView.html?idxno=180603,
8634,오렌지커뮤니케이션즈,"오렌지커뮤니케이션즈오디오북 '골든아워', 제 6회 전자출판대상 오디오부문...",오렌지커뮤니케이션즈가 제작한 외상외과 의사 이국종 교수의 에세이 '골든아워' 오디오버전이 작품으로서의 가치를 인정받았다. 24일오렌지커뮤니케이션즈측은 자사가 제작한 오디오북 '골든아워'가 최근 서울 삼성동 코엑스에서 열린 '2019년 대한민국 전자출판대상' 시상식에서 오디오부문 1위를...,http://www.etnews.com/20190624000308,
8634,오렌지커뮤니케이션즈,"블루오렌지, 시너지에이앤씨 품었다 “종합 퍼포먼스 마케팅 그룹으로 성장 기...",퍼포먼스 마케팅 기업 블루오렌지커뮤니케이션즈가 중견 광고대행사 시너지에이앤씨를 품고 본격적인 사업 확대에 나선다. 블루오렌지커뮤니케이션즈는 디지털 마케팅 전문기업 시너지에이앤씨를 그룹사로 합류한다고 5일 밝혔다. 블루오렌지커뮤니케이션즈는 지난 2014년 설립 이후 네이버·카카오의 공식...,http://sports.khan.co.kr/news/sk_index.html?art_id=202209051719003&sec_id=564001&pt=nv,
8634,오렌지커뮤니케이션즈,오렌지커뮤니케이션즈'달려라 간지왕'으로 중국 공략 개시,"오렌지커뮤니케이션즈의 신소헌 이사는 “로컬라이징 및 현지화 컨설팅의 노하우를 쌓는데 1년 이상 시행착오를 겪었고, 국내 개발사들의 수익을 극대화하기 위해 중국 채널과의 유기적인 관계는 물론 다양한 마케팅을 충분히 준비해 왔다”며 ""앞으로 한국 게임의 우수성을 중국에 알릴 수 있도록 최선을 다 할...",http://www.gamemeca.com/mv.php?inflow=naver_s&gid=326681,
8634,오렌지커뮤니케이션즈,"미국 여행자유심 말톡, '오렌지유럽 유심' 런칭","국내서 미국여행자용 유심을 선보였던 ㈜다이얼커뮤니케이션즈(이하 브랜드 말톡)가 최근오렌지유럽유심의 판매를 시작하고, 프로모션을 진행한다고 밝혔다. 이번에 프로모션을 런칭한오렌지유럽 유심은 프랑스 기간 대형통신사다. 말톡은오렌지통신사의 통신망을 사용하는오렌지유심을 판매한다....",https://www.dailysecu.com/news/articleView.html?idxno=138675,
8634,오렌지커뮤니케이션즈,"(주)오렌지베어, 한국영상대와 '시니어 문화 진흥 관련 업무협약' 체결",정인숙 한국영상대 공연미디어콘텐츠과 교수(사진 좌측)와 김승환오렌지베어커뮤니케이션 대표.[사진=오렌지베어커뮤니케이션] (주)오렌지베어커뮤니케이션즈(대표 김승환)는 지난 15일 한국영상대학교 공연미디어콘텐츠과(정인숙 교수)와 세종시의 시니어 문화 형성과 진흥을 위한 업무협약을 체결했다고...,http://www.enewstoday.co.kr/news/articleView.html?idxno=1555918,
