company_id,company_name,news_title,news_text,news_url,posted_at
12840,오랜후레쉬,"롯데웰푸드후레쉬민트 디자인·품질 개선, '부활 레트로껌' 프로젝트 첫 작품",롯데웰푸드(옛 롯데제과)가오랜역사를 지닌 롯데껌을 재단장해 출시하는 프로젝트를 시작한다. 롯데웰푸드는 18일 롯데껌 '부활 레트로껌' 프로젝트의 첫 제품으로 '롯데후레쉬민트'를 선정하고 이 제품을 리뉴얼해 선보였다고 밝혔다. 롯데웰푸드가 껌 제품 '롯데후레쉬민트'의 디자인과 품질을 개선해...,https://www.businesspost.co.kr/BP?command=article_view&num=330214,
12840,오랜후레쉬,상상으로 만든 싱그러운 향 '블루베리껌' 13년만에 재출시된다,"롯데 블루베리껌이오랜기간 인기를 끌면서 껌의 향이 대중들에게 실제 블루베리 향기로 인식되기도 했다. 외부 패키지는 1983년 최초 도입 당시의... 지난해 12월에는 모델 김아영과 '후레쉬민트', '이브껌' 등 레트로껌을 내세운 '부활! 롯데껌' 캠페인을 진행한 바 있다. 왓따 풍선껌을 주제로 치열한 경쟁을...",http://www.fnnews.com/news/202404301514536732,
12840,오랜후레쉬,"롯데웰푸드, ‘블루베리껌’ 13년만에 재출시… 상상으로 만든 향","롯데 블루베리껌이오랜기간 인기를 끌면서 껌의 향이 대중들에게 실제 블루베리 향기로 인식되기도 했다. 외부 패키지는 1983년 최초 도입 당시의... 지난해 12월에는 모델 김아영과 ‘후레쉬민트’, ‘이브껌’ 등 레트로껌을 내세운 ‘부활! 롯데껌’ 캠페인을 진행한 바 있다. 왓따 풍선껌을 주제로 치열한...",https://health.chosun.com/site/data/html_dir/2024/04/30/2024043001154.html,
12840,오랜후레쉬,"롯데웰푸드, 블루베리껌 13년 만에 재출시… “추억의 껌 프로젝트 시작”","롯데 블루베리껌이오랜기간 인기를 끌면서 껌의 향이 대중들에게 실제 블루베리 향으로 인식되기도 했다. 롯데웰푸드는 이번 블루베리껌 재출시를... 롯데웰푸드는 부활 레트로껌 프로젝트로 지난해 12월후레쉬민트, 이브껌 등을 재출시했다. 롯데웰푸드 관계자는 “상상으로 만든 향기의 껌 블루베리껌을...",https://biz.chosun.com/distribution/food/2024/04/30/NPV4GOKPZNAZXHJFK3RQBVBM4Q/?utm_source=naver&utm_medium=original&utm_campaign=biz,
12840,오랜후레쉬,[유통가 투데이] ‘참이슬후레쉬' 연간 판매량 9% 증가 外,"◇하이트진로, ‘참이슬후레쉬' 연간 판매량 9% 증가 하이트진로는 자사 ‘참이슬후레쉬’의 지난해 판매량이 2021년 대비 9% 증가했다고 4일 밝혔다.... 롯데호텔 서울과 월드는오랜경력의 호텔리어가 엄선한 ▲횡성 명품 한우(40만원부터 110만원)와 ▲알뜰 정육 세트(47만원)를 판매한다. 수산물로는...",https://it.chosun.com/site/data/html_dir/2023/01/04/2023010402076.html,
12840,오랜후레쉬,[유통가 레이더] 롯데하이마트가 고물가에 대응하는 방법... 20만원대 PB 냉장...,"침향은 수지가 응집되고 숙성하는데까지 10~20년오랜기간이 소요되고 나무 한 그루에서 소량 채취되어, 예로부터 귀한 원료로 여겨졌다. 침향은... 지난해 12월에는 모델 김아영과 '후레쉬민트', '이브껌' 등 레트로껌을 내세운 '부활! 롯데껌' 캠페인을 진행한 바 있다. 왓따 풍선껌을 주제로 치열한 경쟁을...",https://www.greened.kr/news/articleView.html?idxno=313721,
12840,오랜후레쉬,롯데웰푸드 '블루베리껌' 13년만에 재출시,"롯데 블루베리껌이오랜기간 인기를 끌면서 껌의 향이 대중들에게 실제 블루베리 향기로 인식되기도 했다. 외부 패키지는 1983년 최초 도입 당시의... 지난해 12월에는 모델 김아영과 '후레쉬민트', '이브껌' 등 레트로껌을 내세운 '부활! 롯데껌' 캠페인을 진행한 바 있다. 왓따 풍선껌을 주제로 치열한 경쟁을...",http://www.bokuennews.com/news/article.html?no=243553,
12840,오랜후레쉬,소주·맥주 7000원 시대…3900원 '파격' 가격으로 서민 공략 나선 식당들 [이...,"주류업계를 선도하고 있는 하이트진로가 2022년 2월 참이슬후레쉬등 소주 제품 출고 가격을 평균 7.9% 인상했고, 롯데칠성음료도 바로 다음 달...오랜기간 이들 사이에는 역차별 논란이 있었는데요. 국산 주류는 반출가격을 과표로 삼아 세금을 매기지만, 수입 주류는 수입 신고가를 과세표준으로 삼아...",https://www.etoday.co.kr/news/view/2355444,
12840,오랜후레쉬,[포토] 미용티슈로 다시 태어난 쥬시후레쉬껌,"이 티슈는 스테디셀러인 롯데껌 삼총사 ‘쥬시휴레쉬’, ‘후레쉬민트’, ‘스피아민트’의 디자인을 패키지에 적용해 레트로 감성을 담았으며, 코튼펄프를 함유해 부드러운 것이 특징이라고 회사 측은 전했다. 회사 측은 “오랜기간 널리 사랑 받아온 롯데껌 3총사와 잘풀리는집 미용티슈의 콜라보를 통해...",http://www.wflower.info/news/article.html?no=6936,
12840,오랜후레쉬,올 여름엔 국민껌 '쥬시후레쉬' '스피아민트'를 에이드로 즐겨요,"오랜기간 사랑받아온 맛을 여름철 시원하게 즐길 수 있는 에이드 음료로 살린 것에 최근 사회적으로 관심이 높아지는 친환경 요소까지 더해 인기를 끌 것으로 기대된다. 28일 세븐일레븐은 롯데제과와 협업해 쥬시후레쉬, 스피아민트 등 롯데껌 2종을 자체 브랜드(PB) '세븐셀렉트'의 파우치음료로 출시했다고...",http://news.mk.co.kr/newsRead.php?no=514674&year=2021,
