company_id,company_name,news_title,news_text,news_url,posted_at
6608,오픈도어㈜,현대百 판교점에 이태리 발쿠치네 백화점 1호점오픈,기술 '에어리우스도어시스템'을 활용한 아르떼마티카와 지니우스 로치 등 다양한 시그니처 모델이 판매된다. 현대리바트는 2021년에도 또 다른 이탈리아 하이엔드 가구 브랜드인 죠르제띠 매장을 개장했었다. 이번 발쿠치네 매장오픈으로 67평 공간에서 죠르제띠와 발쿠치네 가구를 두루 둘러볼 수 있게 됐다....,http://news.mt.co.kr/mtview.php?no=2024050711093328242,
6608,오픈도어㈜,지역 첫 민간임대 아파트 '순화지구 미래 프레지안' 주택전시관오픈···방...,"4도어냉장고, AI세탁기 등 프리미엄 생활가전을 비롯해 명품 가방 등을 선물로 내건 경품 이벤트를 실시하며, 청약자에게는 고급 프라이팬을 증정하는 사은행사도 마련됐다. 수요자들의 뜨거운 반응 속오픈한 '순화지구 미래 프레지안'은 민간 임대아파트로 공급하는 만큼, 주택수에 포함되지 않아 취득세...",https://www.enetnews.co.kr/news/articleView.html?idxno=24105,2024-05-10 15:39
6608,오픈도어㈜,"한터글로벌, 보이넥스트도어테마 카페오픈…팬들 관심 집중","한터글로벌이 보이넥스트도어카페를 운영 중이다. 한터글로벌은 26일 보이넥스트도어의 테마 카페를 서울 명동 후즈팬카페 명동점에서 진행한다고 밝혔다. 이 카페에선 보이넥스트도어멤버들의 스페셜 보이스 메시지가 방송되며, 내부는 멤버들의 대형 현수막으로 꾸며져 있다. 특히, 'HOW?'의...",https://www.xportsnews.com/article/1852441,
6608,오픈도어㈜,"""혼저옵서예""…체험매장 '나비엔 하우스', 제주에도오픈","경동나비엔이 출시한도어락과 모기업인 경동원에서 생산하는 내화단열 기술이 집약된 프리미엄 단열방화문인 세이프도어수십 종을 전시했다. 경동나비엔 제품을 활용한 '도슨트 투어'도 진행한다. 사전 예약제로 운영되고, 네이버 예약을 통해 신청 가능하다.오픈을 기념해 제주점 방문 고객에게 특별한...",https://www.newsis.com/view/?id=NISX20240426_0002714544&cID=10433&pID=13000,
6608,오픈도어㈜,"2024 BOF, 3일 2차 티켓오픈… 지오디·슈퍼주니어-D＆E·제로베이스원·보이...","오픈하자마자 전석 매진을 기록하며 대란을 일으킨 1차 티켓팅을 아쉽게 놓친 팬들을 위해 부산시와 부산관광공사는 5월 3일 오후 7시, 예스24를... 중독성 강한 신곡 ‘Earth, Wind＆Fire’으로 돌아온 보이넥스트도어(BOYNEXTDOOR)를 빼놓을 수 없다. 탄탄한 실력을 바탕으로 일본 최대의 음악축제...",https://view.asiae.co.kr/article/2024050308364891997,
6608,오픈도어㈜,"현대리바트, 현대百 판교점에 하이엔드 주방 가구 '발쿠치네' 백화점 1호점 오...",기술 '에어리우스도어시스템(Aeirius wall-hung System)'이 적용된 '아르떼마티카(Artematica)' 제품을 비롯해 차별화된 소재와 디자인으로 지속적인 인기를 끌고 있는 '지니우스 로치(Genius Loci)' 등 다양한 시그니처 모델들을 선보인다. 현대리바트는 이번 발쿠치네 판교점 매장오픈으로 지난 2021년오픈한...,http://www.bizwnews.com/news/articleView.html?idxno=82119,
6608,오픈도어㈜,[포토] 더현대 서울서 '보이넥스트도어' 프로모션 스토어오픈,더현대 서울서 '보이넥스트도어' 프로모션 스토어오픈현대백화점은 오는 28일까지 더현대 서울 3층에서 아이돌그룹 ‘보이넥스트도어’의 미니 2집 발매 기념 프로모션 스토어 ‘보이넥스트도어그라운드 인 더현대(BOYNEXTDOOR GROUND in THE HYUNDAI)’를 진행한다고 23일 밝혔다. 이번 프로모션...,https://www.viva100.com/main/view.php?key=20240423010007396,
6608,오픈도어㈜,"경동나비엔, '나비엔 하우스 제주점'오픈",경동나비엔이 오는 27일부터 제주도에 오프라인 체험 매장 '나비엔 하우스'를오픈한다고 26일 밝혔다. 제주시 오라동에 있는 나비엔 하우스 제주점은... 경동나비엔이 출시한도어락과 모기업인 경동원에서 생산하는 내화단열 기술이 집약된 프리미엄 단열방화문인 세이프도어수십종을 전시했다. 또 보안과...,http://www.inews24.com/view/1713053,
6608,오픈도어㈜,"선양소주, ‘도어투성수’에서 ‘선양카지노’ 팝업스토어 운영",‘선양’ 640㎖ PET 제품 전국 GS25 편의점 출시 기념 ‘선양카지노’ 팝업스토어오픈GS25 플래그십 매장 ‘도어투성수’에서 이색적인 카지노 콘셉트로 ‘선양’의 다양한 매력 선보여 ㈜선양소주(회장 조웅래)가 국내 최저 도수(14....,http://www.breaknews.com/1028788,
6608,오픈도어㈜,"""성수동에 카지노떴다""...선양소주, '도어투성수'서 팝업스토어오픈",㈜선양소주는 국내 최저 도수(14.9도)·최저 칼로리(298Kcal) 소주 ‘선양’의 640mL PET 제품 출시를 기념해 이달 25일부터 다음달 12일까지 서울 성수동 GS25 프리미엄 플래그십 매장도어투성수에서 ‘선양카지노’ 팝업스토어를 운영한다고 24일 밝혔다. 선양 640mL PET 제품은 지난 3월 선양소주가 '물가안정...,http://www.fnnews.com/news/202404240936472729,
