company_id,company_name,news_title,news_text,news_url,posted_at
9505,올커뮤니케이션,"맥도날드,올1분기 '햄버거' 브랜드 관심도 1위…롯데리아·버거킹 순",맥도날드가올1분기 햄버거 브랜드 관심도 1위에 올랐다. 사진=데이터앤리서치올1분기 주요 햄버거 브랜드 가운데 소비자 관심도(정보량=포스팅... 특히 지난 3월 38커뮤니케이션등에서 한국맥도날드 임직원들이 국내 창립 기념일을 맞아 맥도날드 방배점에서 매장 지원에 나섰다는 기사가 공유됐다....,http://www.bizwnews.com/news/articleView.html?idxno=82258,2024-05-11 12:06
9505,올커뮤니케이션,"서울우유, 캐릭터 '몰랑'과 협업한 아침에주스·올데이프룻 공개","시즌팩 행사와 아침에주스 한정판 피크닉 세트 경품 이벤트를 진행할 예정이다. 유동훈 서울우유 유음료마케팅팀 팀장은 ""아침에주스와 올데이프룻은 서울우유를 대표하는 스테디셀러 중 하나로 이번 캐릭터 협업을 통해 소비자들과 한발 더 다가간커뮤니케이션으로 브랜드 인지도를 강화할 방침""이라고 말했다.",https://www.newsis.com/view/?id=NISX20240502_0002720938&cID=13001&pID=13000,
9505,올커뮤니케이션,"""통화정책 3대 변수 한달 새 급변""…올금리인하 불투명",올하반기 한은이 기준금리 인하를 시작할 수 있다는 신호로 시장은 해석했다. 하지만 이창용 한국은행 총재가 2일(현지시간) 조지아 트빌리시에서 연... 이 총재는 “보고 내용을 바탕으로 금통위원들과 다시커뮤니케이션하겠다”고 말했다. 금통위원 진용이 바뀐 것도 통화정책의 불확실성을 키우는 요인 중...,https://www.hankyung.com/article/2024050359051,
9505,올커뮤니케이션,"MINI코리아, 뉴올-일렉트릭 MINI 컨트리맨 사전 예약","가격은 트림에 따라 MINI 컨트리맨 E가 5600-5800만원, MINI 컨트리맨 SE가 6200-6700만원 선이 될 예정이다. 뉴올-일렉트릭 MINI 컨트리맨의 사전예약은 'MINI 샵 온라인'에서 진행된다. 6월 이후 공식 출시될 예정이다. 보다 자세한 내용은 MINI커뮤니케이션센터로 문의하면 된다.",http://www.inews24.com/view/1714252,
9505,올커뮤니케이션,"서울우유, 인기 캐릭터 ‘몰랑’과 협업한 아침에주스‧올데이프룻 선보여","브랜드커뮤니케이션을 확대하고자 인기 캐릭터 ‘몰랑’과의 협업 제품을 선보인다고 2일 밝혔다. 서울우유는 스테디셀러인 음료 제품군 중 프리미엄... 대표하는 스테디셀러 중 하나로 이번 캐릭터 협업을 통해 소비자들과 한발 더 다가간커뮤니케이션으로 브랜드 인지도를 강화할 방침""이고 말했다.",https://mdtoday.co.kr/news/view/1065579164836668,
9505,올커뮤니케이션,[안종도의 음악기행 <82> 작곡가와 악보] 오해 없는 진정한커뮤니케이션은 존...,"스마트폰이 삶 깊숙이 자리하고, 전화보다는 텍스트가커뮤니케이션의 중심이 된 요즘, 일상의 대부분을 전화가 아닌 텍스트 형식의 메신저를 통해... 대답은 ‘글쎄요’다.올초 필자는 당황스러우면서도 흥미로운 경험을 했다. 원전 출판사에서 인쇄한 하이든의 작품을 보고 열심히 공부한 후, 독일의 한...",https://economychosun.com/site/data/html_dir/2024/04/26/2024042600035.html,
9505,올커뮤니케이션,"충남교육청,올하반기 교육공무직 479명 공채 [충남에듀있슈]",‘코로나19로 대화 절벽’ 저경력 공무원에커뮤니케이션기법 전수 김지철 충남교육감이 30일 보령에서 열린 저경력 일반직공무원 배움자리에서 공직생활 적응을 돕기 위한 대화를 나누고 있다. 임용후 곧바로 코로나19가 터지면서 대화가 단절되다시피 했던 저경력 MZ세대 공무원의커뮤니케이션능력...,http://www.kukinews.com/newsView/kuk202404300216,
9505,올커뮤니케이션,올8월 대법관 3명 교체…심사동의자 후보 55명 공개,"비당연직 중 외부 인사는 이 총장과 김균미 이화여대커뮤니케이션·미디어학부 초빙교수, 정순섭 서울대 법학전문대학원 교수가 위촉됐습니다. 법관 위원으로는 권창환 부산회생법원 부장판사가 임명됐습니다. △아래는 피천거인 중 심사동의자 명단: 구회근 권혁중 기우종 김대웅 김무신 김문관 김복형...",https://news.sbs.co.kr/news/endPage.do?news_id=N1007643207&plink=ORI&cooper=NAVER,
9505,올커뮤니케이션,[EFGF 2024] 김학균 신영증권 리서치센터장 “日 밸류업 핵심은 주주와 커뮤니...,‘주주들과커뮤니케이션하라’가 일본 밸류업의 핵심입니다.” 김학균 신영증권 리서치센터장이 24일 서울 중구 은행회관 국제회의실에서 열린 ‘2024...올들어 영어 컨퍼런스콜을 하지 않는 기업들이 있는데 이는 좋지 않다고 생각한다”고 말했다. 결국 주주들이 기업과 소통하려면 힘이 있어야 한다는 게...,https://economist.co.kr/article/view/ecn202404240025,
9505,올커뮤니케이션,"[르포] bhc의 아웃백, '브랜뉴'·'올뉴' 아웃백으로 다시 태어난다","고객들과커뮤니케이션하고자 한다""고 말했다. 이어 ""향후에는 성수, 홍대, 연남 등 젊은 층이 선호하는 핫플레이스 3곳을 포함해 리로케이션 매장 1점포... '러브 페어링'의 가장 큰 핵심은 '어떤 순간'이 아니라 '모든 순간'에, 어느 누구와 가도 즐길 수 있는 매장이 되는 것이라는올뉴 아웃백의 바람이 어떻게...",http://www.popcornnews.net/news/articleView.html?idxno=58727,
