company_id,company_name,news_title,news_text,news_url,posted_at
3830,우즈웨어,나이키와 결별한 타이거우즈가 입을 골프웨어는?,타이거우즈가 공개한 골프웨어'선데이 래드'. [사진=PGA투어] ［뉴시안= 안성찬 대기자］27년만에 나이키와 이별한 '골프지존' 타이거우즈(미국)가 테일러메이드와 손을 잡았다.우즈는 13일(한국시간) 이번주 미국프로골프(PGA) 투어 제네시스 인비테이셔널 출전을 앞두고 자신이 입을 골프웨어를 전격...,http://www.newsian.co.kr/news/articleView.html?idxno=67326,
3830,우즈웨어,"10개월 만에 '투어' 복귀… 타이거우즈, 캐디·골프웨어'교체'",우즈는 제네시스 인비테이셔널부터 착용할 새 골프웨어도 공개했다.우즈는 13일 미국 캘리포니아 퍼시픽 펠리세이즈에서 열린 신제품 발표회에서 '선 데이 레드' 착용을 공식 발표했다. 지난달우즈는 27년 동안 동행했던 스포츠용품 업체 나이키와의 계약이 종료됐다. 테일러메이드가 내놓은 '선 데이 레드...,https://www.moneys.co.kr/article/2024021315255296118,
3830,우즈웨어,"27년 만에 나이키 벗은 타이거우즈, 골프웨어브랜드 직접 만들어","이날 연습에는 그가 새롭게 론칭한 골프웨어브랜드 '선 데이 레드' 모자와 옷, 신발까지 완벽하게 장착한 모습이었다.우즈는 프로 선수로 데뷔했던 1995년 나이키와 5년 동안 4000만 달러(한화 약 530억원)에 스폰서 계약을 맺었고, 2000년엔 1억달러(약 1300억원)이 넘는 계약을 체결하며 화제가 됐다. 당시...",https://www.hankyung.com/article/2024021418457,
3830,우즈웨어,"우즈아들 찰리, 그레이슨 클로디어와 의류 계약 맺었나","찰리는 지난 3년간 가족 골프대회 PNC 챔피언십에 아버지우즈와 함께 출전하면서, 늘우즈와 똑같은 커플 골프웨어를 입었다. 그러나 올해 대회만큼은 골프웨어가 달랐다. 찰리는 올해 PNC 챔피언십에 그레이슨 클로디어 의류를 입고 출전했다. SI는 미국프로골프(PGA) 투어 대표 선수 저스틴 토머스(미국)가...",http://starin.edaily.co.kr/news/newspath.asp?newsid=01167686635840160,
3830,우즈웨어,"민주주의정상회의 등장 탈북청년 ""北주민 위한 싸움"" 동참 호소(종합)","우즈라 제야 미 국무부 민간안보·민주주의·인권 담당 차관은 개회식 축사에서 ""시민사회는 민주주의 성공에 필수 불가결하며 지역, 부문, 세대를 초월한... 그러면서 상업용 스파이웨어확산·오용에 대응하는 미국 주도 공동성명에 한국을 포함한 6개국이 새롭게 참여했다고 소개했다. 백악관 홈페이지에...",https://www.yna.co.kr/view/AKR20240319070151504?input=1195m,
3830,우즈웨어,[버디or보기] ‘이빨 빠진 호랑이’우즈… 선수 생활 연장? 연명(延命)?,또 하나는 자신이 최근 계약한 골프웨어‘선 데이 레드’ 등 전 세계 골프 산업에 미치는 영향도 고려하고 있을 것이다. 그의 앞에 숙제처럼 남겨진 기록 경신도 그를 강하게 붙잡는 인장력이 아닌가 싶다.우즈는 현재까지 PGA투어서 통산 82승을 거두고 있다. 그 중 메이저대회는 15승이다. 작고한 샘...,https://www.kmib.co.kr/article/view.asp?arcid=0019818921&code=61161511&cp=nv,
3830,우즈웨어,"10개월 만에 복귀한우즈, 머리부터 발 끝까지 다 바꿨네",[기자] 타이거우즈가 27년 문신과도 같았던 나이키 로고 대신 새로운 골프웨어브랜드 '선데이 레드' 로고를 가슴에 달았습니다. 신발부터 모자까지 모든 것이 바뀌었습니다. 로고의 호랑이 줄무늬 15개는우즈의 메이저 우승 횟수로 앞으로 우승이 추가되면 줄무늬도 하나씩 늘어난다고 합니다 첫날...,https://www.ytn.co.kr/_ln/0107_202402161404138897,
3830,우즈웨어,"'골프 황제'우즈""아직도 우승에 목마르다""",우즈는 27년 동안 입었던 나이키 대신 전날 공개한 새로운 골프웨어브랜드 '선 데이 레드' 모자와 옷을 착용했다. 검정 셔츠와 흰 바지를 입고 검정 모자를 썼다. 가슴과 모자 정면에는 호랑이 형상의 '선 데이 로고'가 선명했다. 검정색 골프 신발에도 '선 데이 레드' 로고가 달려 있었다. 지난 2021년...,https://www.newscj.com/news/articleView.html?idxno=3109165,
3830,우즈웨어,"타이거우즈, '껄끄러운' 리비에라…첫날 누구와 맞붙나? [PGA]",2024년 미국프로골프(PGA) 투어 시그니처 대회 제네시스 인비테이셔널에 출전하는 골프황제 타이거우즈가 연습라운드하는 모습이다. 새로 계약한 골프웨어테일러메이드 '선 데이 레드'(SDR)를 입었다. 사진제공=ⓒAFPBBNews = News1 10개월 만에 미국프로골프(PGA) 투어 정규 대회에 나서는 '골프 황제...,https://golfhankook.hankooki.com/news/articleView.html?idxno=20010163,
3830,우즈웨어,타이거우즈'리비에라 징크스' 깰까...제네시스 인비테이셔널 16일 개막,"한편, 27년만에 나이키와 결별한우즈는 테일러메이드가 5월에 론칭할 골프웨어'선 데이 레드'와 의류 계약을 했다. 리비에라CC에서 연습라운드를 하는 타이거우즈. [사진=PGA투어] ▲1라운드 조편성 16일(한국시간) 1.오전 12시20분 니콜라이 호르고이(덴마크)-체이스 존슨(미국) 2.오전 12시32분 찰리...",http://www.newsian.co.kr/news/articleView.html?idxno=67356,
