company_id,company_name,news_title,news_text,news_url,posted_at
13201,운트바이오,"바이오코리아 행사에 각국 대사 집결…""투자해 주세요""","빅스 상무참사관은 “한국기업이 미국에 투자하는 것이 왜 의미가 있는지를 예시로 보면, 앞서 한국의운트바이오는 미국 웨스트버지니아주에 제조공장을 만들기 위한 투자에 나섰다”며 “웨스트버지니아는 3000만 달러를 투자할 때마다 300만 달러를 지원하고 있다”고 말했다. 그러면서 “한국 의료기기...",https://www.newsis.com/view/?id=NISX20240508_0002727887&cID=10434&pID=13200,
13201,운트바이오,제2회운트바이오메노리자배 전국오픈 배드민턴대회 성황리 열려,"제2회운트바이오메노리자배 전국오픈 배드민턴대회가 9, 10일 이틀 동안 경기도 의정부시 신곡실내배드민턴장에서 성대하게 열렸다. 이번 대회에는 전국에서 지난 1회 대회 때보다 100여 팀 많은 524팀(남복 288팀, 여복 101팀, 혼복 135팀), 1000여 명이 참가했다. 9일 오전 11시 문기성 의정부시 배드민턴협회...",https://www.thefairnews.co.kr/news/articleView.html?idxno=14279,
13201,운트바이오,"운트바이오, 갱년기 건강기능식품 ‘메노리자’ 출시","운트바이오(대표 전용수)가 식약처 기능성 인정 단삼 갱년기 건강기능식품 ‘메노리자’를 출시했다고 밝혔다.뿌리가 인삼을 닮고 색깔이 붉은 단삼(丹蔘)은 ‘다리의 무력감을 없애고 힘을 돋우어 달리는 말을 쫓아갈 수 있게 한다’하여 분마초(奔馬草)라 부르기도 한다. 특히 한방에서는 혈액 순환, 어혈...",http://www.sentv.co.kr/news/view/681648,
13201,운트바이오,"K-바이오운트바이오, 美 인슐린 공장 짓는다…1억달러 투자","웨스트버지니아 대학교와 임대 계약 체결 웨스트버지니아주정부, 경제 활성화 기대 한국제약업체운트바이오가 미국 웨스트버지니아주에 인슐린 공장을 조성한다. 1억달러(약 1300억원)를 투자하기로 결정했다. 웨스트버지니아주 주정부는 일자리 창출 등 경제 활성화 효과가 기대된다며 환영한다는...",https://www.theguru.co.kr/news/article.html?no=52436,
13201,운트바이오,"운트바이오, 미국 웨스트버지니아에 제조시설 건립",한국의 제약회사운트바이오(UNDBIO)가 미국 웨스트버지니아주에 진출한다고 현지매체 인텔리젠서가 12일 보도했다. 미국 웨스트버지니아주 짐 저스티스 주지사는 12일 당뇨병 치료 솔루션을 제공하는운트바이오가 모건타운에 인슐린 제조 시설을 건설하기 위해 웨스트버지니아 주립대학교와...,http://www.businesskorea.co.kr/news/articleView.html?idxno=112778,
13201,운트바이오,"운트바이오""인슐린 생산 美 지원받기로…하반기 첫삽 목표""",운트바이오(UNDBIO)는 전용수 회장과 미국 웨스트버지니아주(West Virginia)의 미치 카마이클(Mitch Carmichael) 경제 개발 장관이 인슐린 사업을 위해 서로 협력하는 내용의 양해각서(MOU)를 체결했다고 20일 밝혔다. 이 MOU에 따라 웨스트버지니아주가운트바이오의 현지 인슐린 생산을 촉진하기 위해 정부 및 주...,http://news.mt.co.kr/mtview.php?no=2022062014232931483,
13201,운트바이오,"운트바이오, 美에 인슐린 제조공장 건설…내년 완공 목표",국내 바이오업체운트바이오가 미국 웨스트버지니아에서 인슐린 제조공장을 건설하는 내용의 양해각서(MOU)를 체결했다고 현지 매체가 보도했다. 외신에 따르면 8일(현지시간) 전용수운트바이오회장과 미치 카마이클 웨스트버지니아 경제개발부 장관은 지난 달 17일 업무협약을 체결했다. 주정부는 회사의...,http://www.newsway.co.kr/news/view?tp=1&ud=2022060909244968343,
13201,운트바이오,운트바이오지속형 인슐린 개발 '박차'…'원료부터 완제품까지',운트바이오(회장 전용수)가 글로벌 인슐린 시장을 목표로 제품 개발에 박차를 가하고 있다. 2023년까지 R&D연구를 완료하고 2025~2026년 임상시험 완료까지 단숨에 진행하고 제품허가 등록 및 승인 등을 걸쳐 2027년 제품 판매를 진행 한다는 계획이다.운트바이오는 국내 여러 기업이 인슐린 연구 개발에...,https://www.kpanews.co.kr/article/show.asp?idx=230079&category=C,
13201,운트바이오,"운트바이오, 美 시장 공략 위해 1억 달러 규모 투자 결정","당뇨병 치료에 강점을 갖는 한국의 제약 회사인운트바이오(UNDBIO)는 미 웨스트 버지니아에 인슐린 제조 시설을 건설하기 위해 1억 달러를 투자할 것이라고 발표했다. 짐 저스티스 주지사실이 발표한 보도 자료에 따르면, 프로젝트는 앞으로 3년 동안 200개의 새로운 일자리를 창출할 것이라고 한다. 2009년에...",http://www.g-enews.com/ko-kr/news/article/news_all/202304160920132826e8b8a793f7_1/article.html,
13201,운트바이오,"'인슐린' 국산화 시동…㈜운트바이오, 투자설명회 개최",국내 최초로 당뇨병 치료제인 인슐린 개발을 선포한 글로벌 제약·바이오기업 ㈜운트바이오가 지난 7일 오후 의정부 소재 아일랜드 캐슬에서 '바이오시밀러 인슐린 사업 투자설명회'를 개최했다. 이날 행사는 국내 인슐린 제조를 위한 공장 건축과 연구소 확대 운영 등 제약사업 투자유치를 위해 마련됐다....,http://www.newsis.com/view/?id=NISX20210708_0001505965&cID=10817&pID=14000,
