company_id,company_name,news_title,news_text,news_url,posted_at
10919,원더랩,"대전신세계, 5월 가정의달 온가족 오감만족 놀이터 된다","신세계 넥스페리움은 어섬시티, 코스믹 스페이스, 크루 라운지,원더랩, 얼라이브룸 등 6개 공간으로 구성돼 있다. 각 공간에서는 콘셉트에 맞춰 다채로운 콘텐츠를 체험할 수 있다. 대전엑스포 아쿠아리움은 4일부터 6일까지 어린이날 행사를 진행한다. 이 기간 아쿠아리움 곳곳에 마련된 포토존에서 인형탈...",https://www.newsis.com/view/?id=NISX20240430_0002718922&cID=10807&pID=10800,
10919,원더랩,"대전 신세계 ""백화점 내 문화시설 부담없이 즐겨보세요""","신세계 넥스페리움은 어썸시티, 코스믹 스페이스, 크루 라운지,원더랩, 얼라이브룸 등 6개 공간으로 구성되어 있으며, 각각의 공간에서는 콘셉트에 맞춰 다채로운 콘텐츠를 체험할 수 있다. 대전엑스포 아쿠아리움에서는 4~6일 어린이날 행사가 진행된다. 이 기간 아쿠아리움 내부 곳곳에 마련된...",https://www.joongdo.co.kr/web/view.php?key=20240501010000170,
10919,원더랩,"종합광고대행사원더랩, 앤어워드(& AWARD) 6년 연속 수상",- 2015년부터 2020년까지 6년간 대기업부터 스타트업 광고까지 수상 - 종합광고대행사원더랩은 앤어워드(& AWARD)에서 5년 연속 수상하면서 명실공히 차별화된 크리에이티브 독립광고대행사로 자리매김했다.원더랩은 지난 2015년부터 2020년까지 매년 탁월한 기획력과 소비자가 좋아하는 크리에이티브를...,http://mbnmoney.mbn.co.kr/news/view?news_no=MM1004271552,
10919,원더랩,[CKL기업지원센터 입주기업 릴레이 인터뷰] 세상 구석구석 비디오로 여행하다...,‘앨리스원더랩’의 김지환 대표는 지도에 나오지 않는 세상의 모든 길을 동영상으로 담아내고자 한다. ‘변화하는 동영상 지도’를 통해 이상한나라를 만들고 있는 그의 이야기를 들어봤다. -앨리스원더랩에 대한 소개를 부탁한다. “우리는 ‘동영상’ 기반의 지도 서비스인 ‘앨리스 맵’을 개발하고 있다....,https://magazine.hankyung.com/job-joy/article/202102167447d,
10919,원더랩,"신도리코, 부산원더랩설립 지원",신도리코가 청소년을 위한 디자인 센터 '원더랩(Wonder Lab)'에 자사 3D프린터 3DWOX DP200 4대를 지원했다. 사진은원더랩내 프로젝트 진행 현장.ⓒ신도리코 [EBN 강승혁 기자] 신도리코는 청소년을 위한 디자인 센터 '원더랩(Wonder Lab)'에 3D프린터를 지원했다고 17일 밝혔다.원더랩은 미국 인디아나 주 Purdue...,http://www.ebn.co.kr/news/view/901102,
10919,원더랩,앨리스원더랩| 동영상 지도로 길 찾기부터 가상여행까지,"▶기업개요 •기업명 앨리스원더랩Alleys Wonder lab, Inc. •대표 김지환 Kim Ji Hwan •주력 콘텐츠 동영상 지도·내비게이션 / Video map·Navigation •설립연도... 크라우드소싱으로 지도 제작 6개월 만에 데이터 650㎞ 쌓여 앨리스원더랩은 길을 쉽게 찾을 수 있도록 동영상으로 만든 지도를 제공한다....",http://news.mk.co.kr/newsRead.php?&year=2017&no=236823,
10919,원더랩,"야놀자, 앨리스원더랩과 손잡고 동영상 길찾기 서비스 제공",야놀자가 앨리스원더랩과 제휴를 맺고 동영상 길 찾기 서비스를 시작한다. 앨리스원더랩은 유저들이 직접 촬영한 비디오 데이터를 수집해 동영상 지도 및 도보 내비게이션 서비스를 제공하는 기업이다. 제공 | 야놀자 [스포츠서울 이상훈기자] 숙박 O2O 기업 야놀자(대표 이수진)가 앨리스원더랩(대표...,http://www.sportsseoul.com/news/read/482783,
10919,원더랩,[2020유니콘]<30>앨리스원더랩,앨리스원더랩로고<사진 앨리스원더랩> 길치가 아니더라도 지도를 보고 목적지를 찾는 것은 쉽지 않다. 여행 등 새로운 장소를 찾아가야 하는 경우는 더 어렵다. 기술 발전으로 2D뿐 아니라 3D 지도 기술이 발달했지만 여전히 직관적 사용자 경험이 필요하다. 앨리스원더랩(Alleys Wonderlab)은 사용자 참여형...,http://www.etnews.com/20170207000189,
10919,원더랩,"앨리스원더랩""지도보기, 동영상으로 편리하게""",앨리스원더랩김지환 대표와(왼쪽 두번째) 임직원(사진=앨리스원더랩) [아이티투데이 김지영 기자]스마트폰 상의 지도 애플리케이션에서 제공하는 길 찾기 서비스 덕분에 국내 어느 곳에 가든 길 잃을 걱정을 덜 수 있게 됐다. 그런데 이보다 더 편리하게 지도를 보는 방법을 제공하는 스타트업이 있다....,http://www.ittoday.co.kr/news/articleView.html?idxno=71532,
10919,원더랩,즐거움을 만드는 과학! 한국과학기술원원더랩,"즐거운 사람들이 모인 한국과학기술원원더랩에서 경험한 ‘즐거운 과학’! 지금부터 함께 만나 볼까요? ● 연구실이야, 놀이터야? 따뜻한 봄날, 기자단... 기자단 친구들은원더랩의 지도교수님이신 이우훈 교수님께 왜 이런 연구를 하시는지 여쭤 봤지요. “이곳은 즐거움을 만드는 연구실이에요. 즐거움을...",http://www.dongascience.com/news/view/12010,
