company_id,company_name,news_title,news_text,news_url,posted_at
6413,유니온풀스,[진단] 정부 선정 5대 유망 식품의 미래,"전문브랜드 '풀스케어'를 온라인으로 출범시켰다. 사진은 풀무원의 꽁치 데리야끼 [사진=풀무원 쇼핑몰] ◇ 신세계푸드, 풀무원, 현대그린푸드, CJ 제일제당 등 국내 식품대기업 총출동 그런가하면 고령친화식품과 관련해 크고 작은 이벤트나 협약 및 시상도 줄을 잇는다. 사회적기업 복지유니온의 대표 상품인...",http://www.youngnong.co.kr/news/articleView.html?idxno=31166,
6413,유니온풀스,풀무원푸드머스 등 8개사 27개 제품 고령친화우수식품 지정,"풀무원푸드머스 '풀스케어 갈치무조림', 현대그린푸드 '더 부드러운 돼지고기 장조림', 신세계푸드 '이지밸런스 소불고기 무스', 푸른가족 '쇠고기야채... 구이무스 △복지유니온(3); 연하도움식 소고기죽, 연하도움식 야채죽, 연하도움식 황태죽이다. 고령친화우수식품 지정 제품들은 포화증기법 등 신기술을...",http://www.foodnews.co.kr/news/articleView.html?idxno=94437,
6413,유니온풀스,초고령 사회 진입에 커지는 '케어푸드' 시장,"푸드머스(9개):풀스케어 갈치무조림, 스무스한끼밀 닭고기 브로콜리, 스무스한끼밀 대구두부, 스무스한끼밀 쇠고기야채, 스무스한끼밀 전복미역... 복지유니온(3개) : 연하도움식 소고기죽, 연하도움식 야채죽, 연하도움식 황태죽 등. 제품의 이름이 독특하고 흥미롭다. '이롭고, 연하고, 부드럽고, 균형...",http://www.youngnong.co.kr/news/articleView.html?idxno=37693,
6413,유니온풀스,생활의 지혜- 고령자에 도움 '고령친화우수식품' 27개 지정,"고추장제육볶음 △㈜푸드머스=풀스케어갈치무조림, 한끼밀닭고기브로 콜리, 한끼밀대구두부, 한끼밀쇠고기 야채, 한끼밀전복미역, 한끼밀팥, 한 끼밀야채, 한끼밀단호박, 입마를땐 촉촉한 △서창산업㈜=(이로운죽) 소 고기, 닭고기 △㈜복지유니온=(연하 도움식) 야채죽, 소고기죽, 황태죽 △ ㈜푸른가족...",https://www.goodnews1.com/news/articleView.html?idxno=400178,
6413,유니온풀스,이디모데 목사 프린스턴신학교 자랑스러운 동문상 수상,"그는 미국 매릴랜드에 있는풀스빌교회(Poolsville Presbyterian Church)에서 담임목사로 5년 6개월 간 목회한 후에 1966년에 한국인으로는 최초로... 1971에유니온신학교(Union Presyterian Seminary)에서 석사(M.A.)를 그리고 1974년에 모교인 필립대학교에서 명예신학박사학위(D.D.)를, 1980년에...",http://www.pckworld.com/news/articleView.html?idxno=58211,
6413,유니온풀스,[신설법인현황] 신설법인현황 2003년 12월30일 ~ 2004년 1월5일자,"837-11유니온빌딩 1803호 한국경과기술연구원ㆍ김성진ㆍ도시경관형성 계획 용역업ㆍ100ㆍ강남구 논현2동 115-12 혜성빌딩 7층... 온트풀스ㆍ임춘배ㆍ""사무용기기 및 통신, 영상, 음향기기 도소매업""ㆍ50ㆍ성동구 성수2가3동 284-67 창미빌딩 305호 이스크라아이티ㆍ정원국ㆍ컴퓨터 및 주변기기...",https://n.news.naver.com/mnews/article/011/0000017099?sid=101,
6413,유니온풀스,[신설법인현황] 신설법인현황 10월14일 ~ 20일,"837-11유니온센터 1613호 주노건설ㆍ김성운ㆍ""토목,건축공사업""ㆍ310ㆍ영등포구 영등포동8가 29-14 세심빌딩 501호 지에스방재ㆍ이익규ㆍ""소방기기... 스타풀스ㆍ김주대ㆍ복권프랜차이즈사업ㆍ500ㆍ송파구 가락동 99-5 효원빌딩 16층 위드골드ㆍ황승하ㆍ지금 및 귀금속 작금 교환ㆍ50ㆍ종로구...",https://n.news.naver.com/mnews/article/011/0000004206?sid=101,
6413,유니온풀스,[신설법인 현황] (2003년 7월7일~7월12일) 서울<2>,케이블티브이) 역삼동 746의18승일빌딩2층*미래에셋유니온사모혼합형펀드칠호(남우도..자산운용) 여의도동 45의1미래에셋빌딩... 사업경영) 등촌동 628의13현대프린스텔601호*사이노풀스(엄성욱.500.부동 산) 논현동 115의7미성빌딩*성도디엔씨(김진환.50.부동산) 잠원동 18의1새롬빌딩...,https://n.news.naver.com/mnews/article/015/0000631672?sid=101,
