company_id,company_name,news_title,news_text,news_url,posted_at
5637,유민코스,"[유통갤러리]유민아르누보 뮤지엄, 지상정원 야간개장 외","아트스테이 상품은 4인 기준 34평형 로얄객실에 투숙하며 제주 바다와 성산일출봉 뷰의 민트 레스토랑코스요리,유민아르누보 뮤지엄 관람권, 수영장 풀사이드바 콤보세트 등으로 구성됐다. 유채가 만발한 단지 내에서 사진을 찍을 수 있는 휘닉스 사진관, 투숙객이라면 무료로 21시까지 이용 가능한 사계절...",http://theviewers.co.kr/View.aspx?No=3185721,
5637,유민코스,"휘닉스 아일랜드 제주,유민아르누보 뮤지엄 지상정원 야간개장","아트스테이 상품은 4인 기준 34평형 로얄객실에 투숙하며 제주 바다와 성산일출봉 뷰의 민트 레스토랑코스요리,유민아르누보 뮤지엄 관람권, 수영장 풀사이드바 콤보세트 등으로 구성됐다. 유채가 만발한 단지 내에서 사진을 찍을 수 있는 휘닉스 사진관, 투숙객이라면 무료로 오후 9시까지 이용 가능한...",https://www.newsis.com/view/?id=NISX20240404_0002687642&cID=13001&pID=13000,
5637,유민코스,"휘닉스 아일랜드 제주,코스요리부터 뮤지엄 관람까지 ‘아트스테이’ 출시","휘닉스 아일랜드 제주 아트스테이는 34평형 로얄객실에 투숙하며 단지 내 글라스하우스 건물 오션뷰 레스토랑인 민트 레스토랑코스요리,유민아르누보 뮤지엄 관람 등으로 구성됐다. 특전으로는 민트스튜디오 셀프사진관, 사계절 온수풀, 키즈플레이라운지 이용 등도 포함돼 겨울 제주 가족여행으로도 적합한...",https://www.socialvalue.kr/news/view/1065591729971064,
5637,유민코스,"휘닉스 아일랜드 제주, '유민아르누보 뮤지엄' 지상정원 야간개장","휘닉스 아일랜드는유민아르누보 뮤지엄 관람이 포함된 아트스테이 상품도 재출시했다. 아트스테이 상품은 4인 기준 34평형 로얄객실에 투숙하며 뮤지엄 관람권, 제주 바다와 성산일출봉 전망이 뛰어난 민트 레스토랑의코스요리, 수영장 풀사이드바 콤보세트 등으로 구성됐다. 또한 밤 9시까지 이용 가능한...",http://www.fnnews.com/news/202404050413244933,
5637,유민코스,"[포토] 황예나 '유민, 우승 축하해'","10일 인천 중구에 위치한 클럽72 하늘코스(파72/ 예선6,648야드, 본선6,685야드)에서 '메디힐·한국일보 챔피언십(총상금10억 원/ 우승상금 1억 8천만 원)' 공식 연습라운드가 열렸다.",http://starin.edaily.co.kr/news/newspath.asp?newsid=01246406638854808,
5637,유민코스,안도 다다오가 전부는 아니다…건축 거장의 '제주 불멍코스',"먼저 들러볼 곳은유민미술관이다. 일본의 거장 안도 다다오가 설계한 건축물이다. 강원도 원주 뮤지엄 산, 서울 엘지아트센터 등 안도의 여느 작품처럼... 1층에 카페와 제주 기념품숍이 있고 2층에는코스음식을 파는 ‘민트 레스토랑’이 있다. 제주 식재료를 활용한 음식 맛도 각별하지만 창 너머로 넘실대는...",https://www.joongang.co.kr/article/25219327,
5637,유민코스,올 겨울 제주여행 10선...놓치지 말아야 할 체험.테마 핫코스는?,"단순한 건축물이 아닌 자연의 아름다움과 더불어 도시의 풍경이 되는 건축코스를 감상하며 더 풍요로운 여행을 즐겨보자.유민미술관(안도타다오) 겨울에도 따듯한 푸르름과 함께 제주의 차 문화를 체험하는 다원 탐방 '녹차밭 기행', 이중섭의 발자취와 문화 예술 작품을 만나는코스'이중섭과 예술가의 길...",http://www.headlinejeju.co.kr/news/articleView.html?idxno=530099,
5637,유민코스,연말연시엔 호캉스…뭘 좋아할지 몰라 다 준비했어,"패키지는 34평형 로열객실 숙박권, 단지 내 글라스하우스 건물 바다 전망 레스토랑인 민트 레스토랑코스요리 이용권,유민아르누보 뮤지엄 관람 등으로 구성됐다. 이외에도 민트스튜디오 셀프사진관, 사계절 온수풀, 키즈플레이라운지 이용 등이 포함돼 겨울 제주 가족여행으로 적합한 상품이다. 성산...",https://lady.khan.co.kr/khlady.html?mode=view&artid=202311220658001&code=12,
5637,유민코스,"휘닉스 제주, 자연·건축·예술 함께 감상하는 호캉스 선봬","21일 휘닉스 제주에 따르면, 이번에 선보인 아트스테이 패키지는 34평형 로얄객실에 투숙하며 글라스하우스 건물 오션뷰 레스토랑 ‘민트’코스요리와유민아르누보 뮤지엄 관람 등으로 구성됐다. 특전으로는 민트스튜디오 셀프사진관, 사계절 온수풀, 키즈플레이라운지 이용 등이 포함됐다. 휘닉스 제주는...",http://www.shinailbo.co.kr/news/articleView.html?idxno=1789222,
5637,유민코스,"[유통갤러리] 동서식품, 음악 꿈나무 지원 '맥심 사랑의 향기' 진행 외","34평형 로얄객실에 투숙하며 단지 내 글라스하우스 건물 오션뷰 레스토랑인 민트 레스토랑코스요리,유민아르누보 뮤지엄 관람 등으로 구성됐다. 특전으로는 민트스튜디오 셀프사진관, 사계절 온수풀, 키즈플레이라운지 이용 등도 포함됐다. 휘닉스 아일랜드 제주는 안다 타다오의 국내 대표 건축물...",http://theviewers.co.kr/View.aspx?No=3016338,
