company_id,company_name,news_title,news_text,news_url,posted_at
9565,유투디자인컨설팅,유투시스템 ‘퓨리수’ 2018 레드닷디자인컨셉상 수상,"종합디자인 컨설팅기업유투시스템(대표 최재현)의 대표 제품 퓨리수(Purisoo)가 ‘2018 레드닷디자인컨셉 어워드’를 수상했다. 지난달 28일, 마리나 베이 샌즈 잔디광장에서 2018 싱가포르 레드닷디자인콘셉트 어워드(Singapore Red Dot Design Concept Award 2018)가 열렸다. 이날 휴대용 정수 물병...",http://www.etnews.com/20181015000342,
9565,유투디자인컨설팅,"오토데스크, 총판에 소프트뱅크커머스 리셀러에유투인터랙티브","지원 및 사후관리는 물론, 잠재 고객의 질의 응대와컨설팅에도 전력을 다할 것""이라고 말했다. 소프트뱅크커머스코리아는 오토데스크와 알리아스의 합병 이전부터 알리아스 스튜디오의 교육용 부문 총판사로 활동해왔으며,유투인터랙티브는 산업디자인 컨설팅전문업체다. 강동식기자@디지털타임스 < >",http://www.dt.co.kr/contents.html?article_no=2006091902010860600006,
9565,유투디자인컨설팅,"오토데스크, 산업디자인부문 파트너 선정","한편유투인터랙티브는 산업디자인및 CAID컨설팅전문업체이다. 오토데스크코리아의 남기환 대표는 ""오토데스크와 두 회사는 각각의 전문분야에서 특화된 기술과 경험을 바탕으로 기존 고객에 대한 교육과 소프트웨어 지원, 사후 관리 등을 담당할 것""이라고 말했다. sjs@ddaily.co.kr",http://www.ddaily.co.kr/news/?fn=view&article_num=15212,
9565,유투디자인컨설팅,사회적기업 자생력 강화에도 앞장,"디자인 컨설팅을 진행한유투시스템, 킹스파머스, 아립앤위립, 내포, 티에이비, 제주마미, 바른핑거스, 주오식품 등 8개 기업의 크라우드펀딩 달성률은 최대 2003%로 목표 금액을 훌쩍 뛰어넘었다. 몽세누, 요크, 공공공간, 아트임팩트 등 11개 기업은 26억원 규모의 계약을 따냈다.",https://www.hankyung.com/economy/article/2022011219451,
9565,유투디자인컨설팅,"청주대, 산학협력 가족회사 교류회 가져","이번 '가족회사 교류회'에서 청주대는 우수 가족회사로 선정된 ㈜로피바이오(대표 함성호), ㈜휴먼케어(대표 송유정), 우암시니어클럽&㈜할머니손맛(대표 김현숙), ㈜유니크미디어(대표 곽희옥), ㈜케이바이오(대표 이강연), ㈜유투디자인컨설팅(대표 최기호) 등 6개 가족회사에 감사패를 전달했다. 박호표 청주대...",http://www.gukjenews.com/news/articleView.html?idxno=839110,
9565,유투디자인컨설팅,文대통령도 멘 친환경 넥타이...디자인입은 사회적기업에 VC 주목,"디자인진흥원과 산업부는 2019년부터 사회적경제기업을 대상으로디자인컨설팅, 디자이너 인력 제공, 서비스·비즈니스모델 개발 등을 지원하는... 데모데이 무대에 오른 스타트업은 △공공공간(000간) △몽세누 △티에이비(tAB) △영디케이 △돌봄드림 △콩트라플로우 △엔젤스윙 △킹스파머스 △유투시스템...",http://news.mt.co.kr/mtview.php?no=2021113015530238890,
9565,유투디자인컨설팅,"산업부.KIDP, 2021 소셜디자인데모데이 온라인 개최","대상으로디자인컨설팅,디자인인력지원, 서비스·비즈니스모델 개발을 지원(2019~2021년 누적 134개사 지원)해오고... 개발업체유투시스템(제품명 : 퓨리수플러스), 지역 시니어의 창작물을 리디자인해디자인제품을 만드는...",http://www.breaknews.com/855454,
9565,유투디자인컨설팅,"사회문제해결,디자인서 답 찾는다···디자인진흥원, 소셜디자인데모데이 ...",대상으로 △디자인컨설팅△디자인인력지원 △서비스·비즈니스모델 개발을 지원해오고 있다. 산업부와 KIDP는 올해 총 52개 사회적경제 조직을 선발... 개발업체유투시스템 △지역 시니어의 창작물을 리디자인해디자인제품을 만드는 플리마코협동조합이다. 지난해 열린 소셜디자인데모데이에는...,https://www.sedaily.com/NewsView/22VAGDKBDA,
9565,유투디자인컨설팅,"한국디자인진흥원, '2021 소셜디자인데모데이' 개최","디자인컨설팅은 서비스디자인전문가 그룹을 구성해 제품·서비스의고도화를 지원하고,디자인인력지원은 디자이너 매칭과 인건비 보조,디자인교육을... 개발업체유투시스템 △지역 시니어의 창작물을 리디자인해디자인제품을만드는 플리마코협동조합이다. 올해 소셜디자인데모데이에는 약 30개의...",http://www.apparelnews.co.kr/news/news_view/?idx=194499,
9565,유투디자인컨설팅,"명동유투존, 5일 '엠플라자'로 새롭게 문 연다","[자라, 포에버21 등 글로벌 패션 브랜드 대거 입점] 명동의 옛 '유투존'이 '엠플라자'(M Plaza)로 새롭게 태어난다. 엠플라자는 지난해 미국계 투자회사... 종합부동산컨설팅회사인 쿠시먼앤드웨이크필드가 맡고 있다. 엠플라자는 연면적 2만8000㎡, 지하2층, 지상 22층 규모의 멀티 쇼핑센터로 차별화된디자인과...",http://www.moneytoday.co.kr/view/mtview.php?type=1&no=2008090414345853812&outlink=1,
