company_id,company_name,news_title,news_text,news_url,posted_at
2862,이미지그룹,"KT, 글로벌세아그룹쌍용건설에 채무부존재 확인의 소 제기",그러나 쌍용건설은 계약상 근거 없이 추가 공사비 지급을 요구하며 시위를 진행하는 등 KT그룹의이미지를 지속적으로 훼손해 왔다는 게 KT 측의 설명이다. 그럼에도 불구하고 KT는 상생협력 차원에서 쌍용건설과 원만한 해결책을 찾고자 노력했으나 이견을 좁히지 못했다고 했다. 이에 KT는 불필요한 논란을...,https://www.financialpost.co.kr/news/articleView.html?idxno=204968,2024-05-10 14:20
2862,이미지그룹,"현대백화점그룹계열사 현대퓨처넷, 현대IT&E 334억에 인수",현대퓨처넷의 국내 최대 실감형 미디어아트 전시관 르 스페이스이미지. 사진=헌대퓨처넷 현대퓨처넷은 현대백화점그룹지주회사인 현대지에프홀딩스(지분 95%)와 현대쇼핑(지분 5%)이 보유한 현대IT&E 지분 100%를 334억원에 매입하는 주식 매매계약을 체결했다고 10일 공시했다. 현대IT&E는 현대백화점그룹IT...,https://weekly.hankooki.com/news/articleView.html?idxno=7088753,2024-05-10 14:20
2862,이미지그룹,"""어려운 금융 용어를 쉽게""...KB금융, 'KB고객언어 가이드' 발간","‘KB고객언어 가이드’가 KB금융뿐만 아니라 금융업 전반에 널리 사용되었으면 한다”며 “KB금융은 고객에게 신뢰받는 금융 언어가 고객의 일상이 되어 금융의 높은 문턱을 낮추도록 하는 마중물 역할을 하겠다”고 말했다. 【 청년일보=김두환 기자 】 KB금융, 'KB고객언어 가이드' 발간.[이미지=KB금융그룹]",https://www.youthdaily.co.kr/news/article.html?no=152633,2024-05-10 18:20
2862,이미지그룹,"DGB금융그룹, 단똑우·우리밀 콜라보 과자세트 제작",▲ DGB 단똑우·우리밀 선물세트이미지. DGB금융그룹제공 DGB금융그룹은그룹대표 캐릭터인 '단똑우'와 제과업체 '우리밀' 상품을 콜라보한 과자 선물세트를 출시했다고 9일 밝혔다. DGB금융그룹은 가정의 달을 맞아 유기농 제과업체인 우리밀과 우리 먹거리를 살리는 데 일조하고자 협업하게 됐으며 일반...,https://www.dkilbo.com/news/articleView.html?idxno=441828,
2862,이미지그룹,"""차세대 미디어 아티스트 발굴""…현대차그룹, 'VH 어워드' 공모전",포쓰저널 서영길 기자 현대자동차그룹은 7월 5일까지 '제6회 VH 어워드' 미디어 작품 공모전을 개최한다./이미지=현대자동차그룹아시아 신진 미디어 아트 저변을 넓히기 위해 현대자동차그룹이 작품 공모전을 연다. 현대차그룹은 7월 5일까지 '제6회 VH 어워드' 미디어 작품 공모전을 개최한다고 9일 밝혔다. VH...,http://www.4th.kr/news/articleView.html?idxno=2062214,
2862,이미지그룹,"현대자동차그룹, ‘제6회 VH 어워드’ 작품 공모전 개최",▲이미지=현대차그룹제공 현대자동차그룹이 차세대 미디어 아티스트 발굴 및 창작 지원을 이어간다. 현대자동차그룹은 오는 7월 5일(금)까지 ‘제6회 VH 어워드(VH AWARD)’ 미디어 작품 공모전을 개최한다고 9일 밝혔다. VH 어워드는 차세대 미디어 아티스트를 발굴하고 이들의 예술적 도전과 성장을...,https://www.sportsw.kr/news/newsview.php?ncode=1065587145031564,
2862,이미지그룹,"다이몬, ‘소년미 가득’그룹콘셉트 포토 2종 공개","다이몬(민재, 세이타, HEE, 태극, REX, JO)은 지난 8일 SNS에 첫 번째 싱글 ‘HYPERSPACE 911(하이퍼스페이스 911)’의그룹콘셉트 포토 2종을 공개했다. 공개된이미지속 다이몬은 아지트에 옹기종기 모여있다. 멤버들은 화기애애한 분위기 속에서 카메라를 바라보고 있으며, 캐주얼한 스타일링으로 각자의...",https://sports.khan.co.kr/news/sk_index.html?art_id=202405092006003&sec_id=540101&pt=nv,
2862,이미지그룹,[불후의 명곡] 트로트 영 레전드 특집.. 정통 트로트 가수부터 크로스오버 그...,"이를 들은 알고보니 혼수상태 역시 “죄송한데 형님도 정상은 아니세요 정말,이미지관리하지 마세요”라고 응수해 현장을 초토화시킨다. 신동엽이... 정통 트로트 가수부터 국악가, 크로스오버그룹등 여러 장르의 출연진이 라인업에 이름을 올리며 더욱 다채롭고 풍성한 즐거움을 선사할 전망이다. [사진=KBS]",https://kstar.kbs.co.kr/list_view.html?idx=315270,2024-05-11 00:20
2862,이미지그룹,“삼흥그룹을 아십니까?” 20년 만에 부활한 ‘부동산 사기왕’,당시 김 회장이 부동산기획 사기에 이용한 회사 이름은 '삼흥그룹'이었습니다. 똑같은 건 회사 이름뿐만이 아니었습니다. 경찰 수사 과정에서 드러난... 김 회장은 범행 와중에도 왕성한 사회공헌 활동을 진행하며 '자선 사업가'이미지를 널리 알리는 데 집중했습니다. 1990년대 초반부터 소년원생 등...,https://news.kbs.co.kr/news/pc/view/view.do?ncd=7957494&ref=A,
2862,이미지그룹,"대상그룹, 이경규 '양심냉장고' 재해석 유튜브 예능 선보인다",©AP신문(AP뉴스)/이미지제공 = 대상그룹대상그룹은 핵심가치 '존중'을 주제로 제작한 유튜브 공익 예능 콘텐츠 '존중 냉장고'를 10일부터 전격 공개한다고 9일 밝혔다. '존중 냉장고'는 1990년대 큰 반향을 일으킨 공익 예능의 원조 '양심 냉장고'를 대상그룹의 핵심가치로 재해석한 콘텐츠다. 대상그룹은...,https://www.apnews.kr/news/articleView.html?idxno=3019157,
