company_id,company_name,news_title,news_text,news_url,posted_at
4223,이누씨,"스마일샤크,이누씨B2B Media SaaS 모델 구축 지원","이누씨SEDN SaaS베타 참가 모집 중… 올해 3월 정식런칭 예정 SaaS모델을 통해 35% 개발 기간 단축 클라우드 스타트업 스마일샤크 주식회사(대표 장진환)는 주식회사이누씨(대표 신후랑)의 비디오 콘텐츠 관리 시스템(CMS, Content Management System) 기반 미디어패키지솔루션 (모델명: SEDN)의 SaaS 모델을 구축...",https://www.dt.co.kr/contents.html?article_no=2024011502109923056003&ref=naver,
4223,이누씨,"이누씨, 미디어패키지솔루션 SEDN v2 공식 출시",이누씨(대표 신후랑)는 멀티 템플릿기반 온라인 비디오 플랫폼(OVP) 솔루션 SEDN v2를 공식 출시한다고 밝혔다 SEDN v2는 콘텐츠관리(CMS) 서버를 기반으로... 국가과학기술연구회(NST) 온라인 법정교육에서 사용 중인 SEDN 웨비나템플릿(이미지=이누씨) 실시간 라이브관련 관리자도구를 다양하게 지원한다....,https://zdnet.co.kr/view/?no=20230515181703,
4223,이누씨,"이누씨, 국내최초 멀티키넥트 기반 가상화뷰 솔루션 Virtual View Maker 출시","엔터테인먼트 콘텐츠 및 뉴미디어 기술기업인 ㈜이누씨(대표 신후랑)에서 국내최초로 다수의 키넥트를 동시에 제어하여 가상화뷰를 만들 수 있는 버추얼뷰메이커 솔루션을 출시했다.이누씨측은 ""가상화 개체를 생성하는데 널리 쓰이는 키넥트(kinnect)는 180도 전면만 모델링이 가능하다는 단점이 있었고...",http://www.joongdo.co.kr/main/view.php?key=20180716001004477,
4223,이누씨,"제주국제컨벤션센터,이누씨와 스마트미러 활용한 디지털경험(DX) 고도화 업무...","내용으로이누씨와 3월 10일 업무협약을 맺었다 키오스크(kiosk) 형태의 무인단말기에 IT기술이 결합되어 진화된 사용자경험을 만들어내고 있다. 특히... On-premise기반 OTT솔루션으로 잘 알려진 (주)이누씨에서 미디어송출, 배포, 원격제어 등 보유한 원천기술을 스마트미러 디바이스중심으로 결합한 차세대...",https://www.dailysecu.com/news/articleView.html?idxno=144424,
4223,이누씨,[가상화폐 주간 동향] '가상자산 종합' 가상화폐 상승장 주도,"'밈 코인', 5%대 상승 도지코인, 시바이누, 페페, 플로키를 포함하는 '밈 코인' 지수는 이번 주 5.22% 증가했다. '밈 코인' 지수는 직전 주간에도 6.83% 오른... 가상화폐 시장 내 시가총액 18위 규모인 시바이누가격도 같은 기간 1.1% 상승했다. 오케이엑스, 게이트아이오, 디지파이넥스, 멕스씨는 순서대로...",https://www.khgames.co.kr/news/articleView.html?idxno=223493,
4223,이누씨,"나인우 ""'내남결' 포상 휴가? 베트남서 '이누♥'로 통해""[별별TV]","결혼해 줘'의 흥행으로 베트남 나트랑에 포상 휴가로 방문했던 당시에 언급했다. 그러면서 ""나트랑 길거리에 걸어 다닐 때 팬들이 '나인우 씌?!'라며 알아봤다고 한다""라며 대신 전했다. 이에 나인우는 ""저한테는 '~씨'를 안 붙인다. 저한텐 '이누♥'라고 한다. 전 '이누♥'로 유명하다""라고 덧붙여 설명했다.",https://www.starnewskorea.com/stview.php?no=2024033118153565619,
4223,이누씨,"치아로도 웃기는 김종민, 역대급 자기관리→미담 공개까지(1박2일)[어제TV]","이에 김종민은 ""우리가 (해외) 팬클럽이 있냐""며 깜짝 놀랐고, 문세윤은 ""제가 인도네시아 촬영 갔을 때 '문세윤씨? 투데이 원나잇?' 이러면서 알아봤다""고 말했다. 딘딘도 ""나랑 (유)선호랑 필리핀 시상식 갔을 때 알아봐주더라""고 증언했고, 나인우는 ""저는 베트남 갔을 때 '이누이누' 이러더라""며 ""나는 '이누'로...",https://www.newsen.com/news_view.php?uid=202403311906200310,
4223,이누씨,"[해외낚시] 일본 대마도 아소만 벵에돔, 한겨울에도 펄펄 끓는구나!",아소만의 다른 곳보다 균 1도 이상 높은 수온을 유지해 늘 안정적인 조황을 보인다.석축 포인트에서 낚은 47cm 감성돔을 자랑하는 김우성씨.우끼조민숙의 낚싯배가 울산 낚시인들을 잠수함 포인트에 내려놓고 있다.취재일 첫 날 기자가이누가노구비 갯바위에서 낚아낸 46cm와 38cm 벵에돔. 포인트만 잘 선택해...,https://fishingseasons.co.kr/fishplace/fishplace_view.asp?b_no=18311&code=n,
4223,이누씨,[가상화폐 주간 동향] '메타버스-대체불가토큰' 가상화폐 시장 주도,"'밈 코인', 6%대 하락 도지코인, 시바이누, 페페, 플로키를 포함하는 '밈 코인' 지수는 이번 주 6.83% 증가했다. '밈 코인' 지수는 직전 주간에도 3.69... 가상화폐 시장 내 시가총액 19위 규모인 시바이누가격도 같은 기간 7.2% 하락했다. 쿠코인, 게이트아이오, 디지파이넥스, 멕스씨는 순서대로 시바이누...",https://www.khgames.co.kr/news/articleView.html?idxno=223297,
4223,이누씨,"부산 방문한 스페인 출신 산악인이누라테기씨""에베레스트 정상 오른 것만큼...",최초 무산소·최연소 등정 트렉스타 홍보이사로 영입 스페인 출신의 세계적인 산악인 알베르토이누라테기(46)씨. 그의 이력은 금단에 대한 도전으로 일관되어 있다. 게다가 장비를 활용해 정상 등정이 보장된 길을 따라가지 않고 사투 끝에 없는 길을 만들어 내 왔다. 그는 지난 1992년에는 23세 최연소...,http://news20.busan.com/controller/newsController.jsp?newsId=20141031000109,
