company_id,company_name,news_title,news_text,news_url,posted_at
8309,이제이정보시스템,연필 같은 필기감…EBS가 쓰는 전자칠판,이제이정보시스템이 전자칠판을 납품하는 발주처다. 이 회사는 각종 기업과 학교에 제품을 공급하며 품질을 인정받았다. 작년에는 신제품 ‘EB 시리즈 전자칠판’(사진)을 내놨다.이제이정보시스템의 전자칠판은 국내 제품 중 반사율이 가장 낮다. 칠판이 빛을 과도하게 반사하면 학생은 광택으로 인해...,https://www.hankyung.com/article/2024040878751,
8309,이제이정보시스템,"(주)이제이정보시스템, IT전자칠판 분야 ""창의적 강의 및 회의환경 솔루션"" 제...","㈜이제이정보시스템(대표 정광열) ""고가의 전자칠판이 1년 혹은 2년 정도 사용하다 고장이 난다면 고객은 어떤 마음이 들까?"" ㈜이제이정보시스템(대표 정광열)에서 고객의 입장을 먼저 생각하며 제품을 만들어 내며 주목받고 있다. 중국 제품이 대부분을 차지하고 있는 전자칠판 분야에서 순수 국내 기술과 국내...",http://www.nongup.net/news/articleView.html?idxno=28667,
8309,이제이정보시스템,"이제이정보시스템, 조달청 지원 해외진출 전자칠판 유망기업 선정","EBS 전체스튜디오에 전자칠판을 납품한 바 있는이제이정보시스템이 지난 22일, 조달청의 지원을 받는 ‘해외조달시장 진출 유망기업(G-PASS기업)’ 선정 기업들의 수여식에 참석했다. 해당 수여식에서이제이정보시스템은 앞으로 더욱 더 해외진출 시장에 기여할 수 있는 기업으로 지정 받았다. 조달청은...",http://edu.donga.com/?p=article&ps=view&at_no=20240103175744386221,
8309,이제이정보시스템,[2023 중소기업우수제품]이제이정보시스템'EB 시리즈 전자칠판',이제이정보시스템은 눈 피로를 최소화한 EB 시리즈 전자칠판을 출시했다. EB 시리즈 전자칠판은 빛의 깜빡임(플리커) 현상과 블루라이트를 최소화한 시력보호 기능을 탑재했다. 또한 빛 반사를 줄인 패널을 채택했다. 학생뿐만 아니라 전자칠판을 장시간 사용하는 선생님 눈을 보호한다고 회사는 강조했다....,https://www.etnews.com/20231206000238,
8309,이제이정보시스템,"전자칠판 기업 ‘이제이정보시스템’ 정광열 대표, 중소벤처기업부 장관상 수...","전자칠판, 책소독기 전문개발기업 (주)이제이정보시스템의 정광열 대표가 지난 6월 22일 중소기업DMC타워에서 개최한 '2022년 서울 중소기업인대회'에서 모범 중소기업인부문 중소벤처기업부 장관상을 수상했다고 밝혔다. 중소벤처기업부 장관 표창은 경영, 기술 혁신, 사회공헌, 고용창출 등 국가발전에 기여하고...",http://edu.donga.com/?p=article&ps=view&at_no=20220721110119385114,
8309,이제이정보시스템,"정광열이제이정보시스템대표, 중소기업 기술혁신 유공자포상","전자칠판 및 책 소독기 국내산 전문제조기업 (주)이제이정보시스템정광열 대표가 중소기업 기술혁신 공적을 치하하는 유공자포상을 받았다. 중소벤처기업부, 이노비즈협회 주최로 이번 기술혁신포상은 지난 9일 서울임피리얼팰리스호텔에서 포상식을 열었다. 중소기업 기술혁신 표창을 받은 정광열 대표는...",https://www.siminilbo.co.kr/news/newsview.php?ncode=1160268205939054,
8309,이제이정보시스템,"이제이정보시스템, ""독자적 기술의 전자칠판으로 스마트 산업 선두주자로 나설...","이 가운데,이제이정보시스템은 국내 기술과 부품으로 직접 개발하고 제조하는 전자칠판으로 매년 성장세를 기록하는 기업이다.이제이정보시스템의 엄정현 이사를 만나 더 자세한 이야기를 들어봤다. 사진=이제이정보시스템엄정현 이사 Q.이제이정보시스템은 어떤 기업인지? 스마트 환경을 구축하기 위해서...",http://www.fortunekorea.co.kr/news/articleView.html?idxno=13902,
8309,이제이정보시스템,"이제이정보시스템, 전자칠판 특허기술로 터치센서 오작동 최소화 해결",이제이정보시스템이 특허기술 '적외선 터치센서 포함한 디스플레이 장치용 조립 프레임'를 적용한 전자칠판 제품을 생산한다고 밝혔다. 해당 전자칠판 제품특징은 적외선 터치센터를 포함하여 형성된 디스플레이 장치의 구성요소들을 지지하여 유리와 패널이 휘거나 처지는 현상을 방지 및 고정을 용이하게...,https://www.fetv.co.kr/news/article.html?no=80828,
8309,이제이정보시스템,"[미리보는 KOBA 2014]이제이정보시스템, 업그레이드된 OPS시스템의 전자칠판...","이제이정보시스템(www.ejboard.com)은 오는 20일(화)부터 23일(금)까지 삼성동 코엑스(COEX)에서 열리는 '제24회 국제 방송·음향·조명기기 전시회(KOBA 2014 - 24th Korea International Broadcast, Audio & Lighting Equipment Show)'에 참가해?업그레이드된 OPS시스템의 전자칠판 'ELED-84R'을 선보일 예정이다. 기존의...",http://kr.aving.net/news/view.php?articleId=916386&Branch_ID=kr&rssid=naver&mn_name=news,
8309,이제이정보시스템,"이제이정보시스템, 전자칠판활용 인터넷방송 스튜디오대여 오픈","전자칠판 전문업체 ㈜이제이정보시스템(EJ Infosys)이 21일 전자칠판을 활용할 수 있는 ‘이제이방송스튜디오’를 론칭 한다고 밝혔다.이제이방송스튜디오는 유투버영상, 쇼핑몰제품촬영, 프로필영상촬영, 기업홍보영상, CEO인터뷰, 온라인강의, 취업강의, 창업강좌/컨설팅 강의용 등 1인 방송 사업자들도...",http://www.gosiweek.com/13490,
