company_id,company_name,news_title,news_text,news_url,posted_at
5107,인성데이타㈜,"1위 루닛·2위 모아데이타·3위인성정보, 4월 2주차 랭키파이 테마별 주식 의...","[출처: 랭키파이 테마별 주식 의료AI 부문 트렌드 지수 분석 결과] 트렌드 지수 1위부터 3위까지 빅데이터로 조사한 결과, 루닛 주가, 루닛 전망, 루닛 무상증자, 루닛 실적, 루닛 매출, 모아데이타주가,인성정보 특징주,인성정보 관련주,인성정보 액침냉각,인성정보 비대면,인성정보 주가...",https://www.delighti.co.kr/news/articleView.html?idxno=78695,
5107,인성데이타㈜,"1위 루닛 주가·2위 모아데이타주가·3위인성정보 주가, 4월 2주차 랭키파이...","테이블] 테마별 주식 의료AI 부문 트렌드 지수 데이터는 루닛 주가, 루닛 전망, 루닛 무상증자, 루닛 실적, 루닛 매출, 모아데이타주가,인성정보 특징주,인성정보 관련주,인성정보 액침냉각,인성정보 비대면,인성정보 주가 등의 키워드 및 트렌드를 분석한 결과이다.",https://cwn.kr/article/1065571524103500,
5107,인성데이타㈜,테마별 주식 ‘의료AI’ 현재 상승률‧‧‧1위 토마토시스템·2위 모아데이타...,"2위 모아데이타주가는 2610원으로 전일대비 55원 상승 중이고 등락률은 2.15%이며, 3위 라이프시맨틱스 주가는 1909원으로... 95% 24,124 36 19인성정보 -2.15% 2,735 ▼60 -2.15% 139,942 432 20 신테카바이오 -2.20% 10,690 ▼240 -2.20% 23,499 474 21 셀바스AI -2.92% 15,970 ▼480 -2.92% 88,096...",https://mdtoday.co.kr/news/view/1065574201767440,
5107,인성데이타㈜,"1위 모아데이타주가·2위 엔젠바이오 주가·3위인성정보 주가, 4월 1일 랭키...","18%이다. 순위 종목명 현재상승률 현재가 전일비 등락률 거래량 트렌드 지수 4월 1일 11시 42분기준 랭키파이 트렌드지수 분석결과 모아데이타주가,인성정보 특징주,인성정보 관련주,인성정보 액침냉각,인성정보 비대면,인성정보 주가 등이 투자자들의 관심 키워드로 나타났다.",https://www.delighti.co.kr/news/articleView.html?idxno=77862,
5107,인성데이타㈜,"대구시 대공노, '대구로' 활성화에인성데이타와 두 팔 걷고 앞장서","조합원 및 대구시청 직원, 다양한 이벤트 및 홍보 아주경제=대구=이인수 기자 sinyong67@ajunews.com 대구광역시는 1일, 대구공무원노동조합이 ‘대구로’ 앱(APP)의 활성화를 위해 서비스운용사인인성데이타(주)와 전략적 협업 및 파트너십 강화를 위한 상호협약을 체결했다. [사진=대구시] 대구광역시는 1일...",https://www.ajunews.com/view/20240201162629284,
5107,인성데이타㈜,"의료AI 관련주, '어깨춤 으쓱으쓱'인성정보·모아데이타·랩지노믹스","30일 한국거래소에 따르면인성정보, 랩지노믹스, 모아데이타는 상승했다.인성정보의 주가는 전 거래일 대비 290원 오른 4300원을 거래를 마쳤다.인성정보의 주가 상승률은 7.23% 다. 랩지노믹스와 모아데이타는 전 거래일 대비 각각 105원, 120원 오른 3750원과 1505원에 장을 마감했다. 랩지노믹스와...",https://www.pinpointnews.co.kr/news/articleView.html?idxno=242059,
5107,인성데이타㈜,"루닛, 4월 3주차 랭키파이 테마별 주식 의료AI 부문 트렌드지수 순위 1위…인...","인성정보는 2,564포인트로 전주보다 1,420포인트 하락해 2위를 차지했다. 뷰노는 2,312포인트로 전주보다 1,134포인트 하락해 3위를 차지했다. 4위 셀바스AI는 2,271포인트, 5위 노을은 1,818포인트, 6위 딥노이드는 1,573포인트, 7위 신테카바이오는 1,374포인트, 8위 모아데이타는 1,345포인트, 9위...",https://www.ekn.kr/web/view.php?key=20240417024427282,
5107,인성데이타㈜,"1위 루닛·2위인성정보·3위 뷰노, 4월 3주차 랭키파이 테마별 주식 의료AI ...","인성정보는 2,564포인트로 전주보다 1,420포인트 하락해 2위를 차지했다. 뷰노는 2,312포인트로 전주보다 1,134포인트 하락해 3위를 차지했다. 4위 셀바스AI는 2,271포인트, 5위 노을은 1,818포인트, 6위 딥노이드는 1,573포인트, 7위 신테카바이오는 1,374포인트, 8위 모아데이타는 1,345포인트, 9위...",https://www.delighti.co.kr/news/articleView.html?idxno=79187,
5107,인성데이타㈜,"대구공무원노동조합,인성데이타(주)와 맞손...'대구로' 활성화에 박차","사진제공=대구시청 1일 (통합)대구공무원노동조합 위원장 김영진, 주강식 은 ""소상공인과 택시기사의 수수료 부담을 덜어주며 지역자본의 역외 유출을 방지하는 시민형종합플랫폼 '대구로'앱(APP)의 활성화를 위해 서비스 운용사인인성데이타(주)와 전략적 협업 및 파트너십 강화를 위한 상호협약을 체결했다.""고...",https://www.gukjenews.com/news/articleView.html?idxno=2914847,
5107,인성데이타㈜,인성데이타'비대면 급식지원 서비스' 복지부장관 표창,"대구시 공공배달앱 대구로 운영사 '인성데이타'가 결식아동을 위한 비대면 급식 지원 서비스로 보건복지부장관 표창장을 수상했다. 그동안 아동급식카드 대면 결제로 인한 낙인 효과, 사용처 제한 등 문제점을 보완하고 추후 갑작스러운 재난 상황에서도 지속해서 안전하게 급식을 제공할 수 있도록 하여...",https://www.idaegu.co.kr/news/articleView.html?idxno=444715,
