company_id,company_name,news_title,news_text,news_url,posted_at
11858,점프엔터테인먼트,[지애드스포츠 퀀텀점프] 조력자로 나선 글로벌 스포츠 OTT 창업자,"최대주주는 미국 음반 레이블 '워너뮤직그룹' 등 대형엔터테인먼트사들을 소유한 글로벌 투자회사 '액세스 인더스트리즈'다. 존 글리셔 부회장은... 박 대표가 UTC인베스트먼트에서 스포츠 펀드를 조성하면서, 일본 최대엔터테인먼트기업인 '마루한'으로부터 자금을 끌어온 것 등이 전부다....",https://www.newstof.com/news/articleView.html?idxno=22335,
11858,점프엔터테인먼트,"'소년점프' 인연…배기성, '마미손 피처링' 신곡 '힘을 내요' 발표","여기에 과거 '소년점프'로 인연을 맺었던 래퍼 마미손이 랩 피처링에 나섰다. 배기성이 직접 작사, 작곡에 참여해 완성도를 높인 '힘을 내요'는 따뜻하고... 음악을 통해 대중과 소통하는 한편 현재 출연 중인 뮤지컬 '써니텐'을 비롯해 다양한 행보를 보여줄 예정이다. [티브이데일리 / 사진제공=PA엔터테인먼트]",http://www.tvdaily.co.kr/read.php3?aid=17132241501707586010,
11858,점프엔터테인먼트,반다이남코엔터테인먼트'샌드 랜드' 한국어판 25일 정식 발매... '스팀' 버전...,"반다이남코엔터테인먼트코리아(지사장 장태근)는 PlayStation®5, PlayStation®4, Xbox Series X|S용 ‘SAND LAND’(한국어판)을 오늘(2024년 4월 25일)... 2000년에 ‘주간 소년점프’에서 연재되어 일본 국내외에서 인기를 끌었다. 2022년 12월에 ‘SAND LAND project’가 발표되어 23년 8월에 극장판이...",http://gamefocus.co.kr/detail.php?number=155440,
11858,점프엔터테인먼트,국내 최초 레트로 콘셉트 매거진 '이큐점프' 발간,"이큐점프는 90년대 인기 만화책 아이큐점프에 모티브를 얻어 만들어진 연예 매거진으로 만화, 연예, 문화, 사회,엔터테인먼트콘텐츠 등을 담고 있다. 해당 매거진의 발행인이자 아시아빅뉴스를 운영 중인 조재윤 대표는 ""전 세계적인 레트로 열풍에 본 잡지를 기획하게 되었다. 60~80년대 선풍적인 인기를 끈...",https://www.bntnews.co.kr/article/view/bnt202404130057,
11858,점프엔터테인먼트,"JPLACE 장자윤 대표, '이큐점프' 창간호 문화예술 자문 맡아","이큐점프는 1990년대 인기 만화책 아이큐점프에 모티브를 얻어 만들어진 연예 매거진으로 만화, 연예, 문화, 사회,엔터테인먼트콘텐츠 등을 담고 있다. 발행인이자 아시아빅뉴스 조재윤 대표는 ""전 세계적인 레트로 열풍에 본 잡지를 기획하게 됐다. 1960~1980년대 선풍적인 인기를 끌었던 잡지 선데이서울을...",https://www.psnews.co.kr/news/articleView.html?idxno=2052444,
11858,점프엔터테인먼트,"연우진 ""결혼은 순리대로…2024년은 일과 결혼"" [엑's 인터뷰③]","통해 그는 ""예술이라는 카테고리 속에 몸담고 있는 게 행복하다고 느낀 순간들이었다. 그런 활동이 꾸준히 이어졌으면 좋겠다""며 ""예술을 사랑하는 눈빛으로 지내고 싶다. 그게 연기가 됐든 다른 활동이 됐든 내가 예술을 사랑하는 눈을 갖고 있으면 좋겠다""고도 밝혔다. 사진=점프엔터테인먼트, KBS, 엑스포츠뉴스DB",https://www.xportsnews.com/article/1856417,
11858,점프엔터테인먼트,"다이몬, 컴백 트랙 스포일러 공개…'소년...소녀를 만나다' 기대 폭발","특히 후렴의 리듬에 맞춰 군중들과 함께점프하는 다이몬 멤버들의 흥겨운 모습이 시선을 사로잡는다. 'K팝 히트곡 제조기' 라이언전이 참여한... 소속사 THE엔터와 SSQ엔터테인먼트관계자는 ""이번 싱글의 콘셉트를 짐작하고, 수록된 전곡의 하이라이트를 미리 들어볼 수 있는 트랙 스포일러가...",https://www.etnews.com/20240511000004,2024-05-11 13:28
11858,점프엔터테인먼트,NHN 정우진 야심작 '다키스트 데이즈'…주주 반발 잠재울까?,"이후 2013년 주주총회를 통해 네이버와 NHN엔터테인먼트(한게임)로 분할됐으며 2019년 NHN으로 사명을 변경했다. NHN은 분할 이후 클라우드, 결제(페이코)... 올해와 내년을 통틀어 한 번 더 퀀텀점프를 할 수 있는 것들을 준비하고 있다”고 강조했다. NHN은 올해 다키스트 데이즈 외에도 올해 ▲서브컬처 수집형...",http://www.fntimes.com/html/view.php?ud=2024051017135848267492587736_18,
11858,점프엔터테인먼트,"연우진 ""40대에 연 챕터2, '멱살 한번'으로 스펙트럼 넓혔죠"" [엑's 인터뷰①...","됨으로써 이 사람이 어떤 시각으로 세상을 바라봤을까 어떤 마음을 갖고 살아갈까 하다 보니 사람에 대한 이해가 넓어지고 사람을 존중하게 되더라. 그런 작업들이 이어졌으면 좋겠다""고 밝혀 한 뼘 더 성장한 배우 연우진이 그려낼 '사람'의 이야기를 궁금하게 했다. (인터뷰②에서 계속) 사진=점프엔터테인먼트, KBS",https://www.xportsnews.com/article/1856415,
11858,점프엔터테인먼트,"신예 이주연 활동명 이윤설로 변경,점프엔터테인먼트와 전속계약","신예 이주연이 활동명을 이윤설로 변경하고,점프엔터테인먼트와 전속계약을 체결했다.점프엔터테인먼트는 23일 “신인 배우 이주연이 ‘이윤설’로 활동명을 변경했다. 동시에 당사와 전속계약을 체결했다”라고 알리며 “이윤설과 소중한 인연을 시작하게 되어 기쁘다. 다양한 분야에서 경험을 쌓으며...",http://sports.khan.co.kr/news/sk_index.html?art_id=202010240001003&sec_id=540101&pt=nv,
