company_id,company_name,news_title,news_text,news_url,posted_at
9527,제네시스씨지,"[시승]특별함으로 물든 플래그십,제네시스G90 블랙",그만큼 선택과 판매 비율도 월등히 높은데제네시스에서 조금 더 특별함을 내세운 블랙 플래그십 신차를 선보였다. 바로제네시스G90 블랙이다. 새 차는제네시스만의 진정성 있는 블랙 디자인 콘셉트 '제네시스블랙'을 적용한 브랜드 최초 제품이다. 내·외장의 모든 부위를 블랙 색상으로 마감해 고급감을...,http://autotimes.hankyung.com/apps/news.sub_view?popup=0&nid=02&c1=02&c2=02&c3=00&nkey=202405092243131,
9527,제네시스씨지,상품성 높이고 340만원 인상된제네시스GV70...독(毒)될까 아니면 약(藥)될까...,"제네시스가 8일 새롭게 선보인 GV70 부분변경 모델은 기존 모델 대비 340만원 가량 인상된 점이 눈에 띈다. 연식 변경 모델엔 MFL 타입 헤드램프와 27인치의 대형 디스플레이가 기본 적용돼 가격 인상이 불가피했다는 것이제네시스측의 설명이다. 하지만, 이번 가격 인상은제네시스에 있어 큰 모험이 될...",https://www.dailycar.co.kr/content/news.html?type=view&autoId=52752,
9527,제네시스씨지,"檢, 전준경 前 민주硏 부원장 기소…""제네시스와 8억 받아""",전 전 부원장은 2015년 7월부터 지난달까지 7개 업체로부터 국민권익위 민원 해결 등을 대가로 7억 8000여만 원과제네시스차량을 받은 혐의를 받습니다. 2017년 1월부터 7월 사이 안산 신길온천 개발사업에 참여한 업체로부터 2600만 원의 뇌물을 챙긴 혐의도 있습니다. 이 가운데 1억여 원과 차량은 2017년에서...,https://news.tvchosun.com/site/data/html_dir/2024/04/25/2024042590201.html,
9527,제네시스씨지,"아파트 주차장서 승용차에 깔려 30대 여성 사망...""제네시스G80 흰색 가해 차...","경찰이 확인한 사고 당시 인근 차량의 블랙박스에는 주차장에 누워있는 A씨위로 승용차가 지나가는 모습이 찍힌 것으로 전해졌다. 경찰은 사고 직후 가해 차량으로 추정되는 승용차가 현장을 벗어난 것으로 보고 있다. 경찰 관계자는 ""주차 차량의 블랙박스에 담긴 영상에제네시스G80 흰색 차량이 뭔가...",https://www.insight.co.kr/news/467854,
9527,제네시스씨지,"""셀프 주유소서 휘발유 넣었는데 시동 안걸려""제네시스G70 차주 '분노'","""주기적으로 엔진오일 잘 갈아주고..정말 소중히 탔는데 마음이 너무 아프다."" 지난 10일 한 온라인 커뮤니티에는제네시스G70 차주의 사연이 올라왔다. A씨는 ""5일 오후 10시쯤 귀농하신 부모님댁 들렀다가 기름이 집에 가기엔 부족해 보여 시골길에서 24시 셀프 주유소에 들렀다""고 전했다. 이어 ""현금을 삽입한...",http://www.fnnews.com/news/202404151315577301,
9527,제네시스씨지,인천 북항터널 달리던 승용차서 불…인명피해 없어,9일 인천소방본부에 따르면 이날 오전 9시3분 인천 중구 신흥동 수도권제2순환고속도로 인천~김포 구간 내 북항터널에서 인천 방향으로 주행하던제네시스쿠페 차량에 불이 났다. 이 불로 해당 차량의 전면부가 불에 타는 등 재산피해가 발생했다. 운전자 A씨가 긴급히 대피하면서 인명피해는 나지 않았다....,https://www.newsis.com/view/?id=NISX20240509_0002728581&cID=10802&pID=14000,
9527,제네시스씨지,안동서 승용차-오토바이 충돌...20대 중상,11일 경북소방본부 등에 따르면 전날 오전 7시 1분쯤 안동시 용상동 한 도로에서제네시스승용차와 오토바이가 충돌하는 사고가 났다. 이 사고로 오토바이 운전자 A(20대.여) 씨는 심정지 상태로 병원으로 이송됐다. 경찰은 운전 부주의로 인한 사고로 보고 정확한 사고 경위를 조사 중이다.,http://news.tf.co.kr/read/national/2097681.htm,2024-05-11 09:09
9527,제네시스씨지,가드레일 들이받은제네시스GV70 '활활'.. 알고 보니 음주운전,"오늘(5일) 서귀포경찰서와 제주소방안전본부에 따르면 이날 새벽 1시 32분쯤 서귀포시 안덕면 동광리의 한 도로를 달리던 현대제네시스GV70 렌터카가 가드레일을 들이받았습니다. 사고 충격으로 차량에서는 화재가 발생했습니다. ""'펑펑' 소리와 함께 불꽃이 발생했다""는 신고를 받고 출동한 소방은 30여 분...",http://www.jibs.co.kr/news/articles/articlesDetail/38154?feed=na,
9527,제네시스씨지,"제네시스, ‘한국적 럭셔리’ 입고 미래 모빌리티로 진화하다",현대자동차그룹제네시스브랜드(이하제네시스)가 한국적인 럭셔리와 장인정신을 고스란히 담은 신규 콘셉트 차량 2종을 전격 공개하고 미래 모빌리티 시대에 걸맞은 ‘브랜드 진화’에 나선다.제네시스는 25일(현지시간) 미국 뉴욕 맨해튼 중심지에 위치한 브랜드 복합문화공간 ‘제네시스하우스 뉴욕’...,http://news.heraldcorp.com/view.php?ud=20240326050082,
9527,제네시스씨지,이재용도 타는 '회장님 차' 뭐길래…벤츠 S클래스 제쳤다,당시 부회장이던 이 회장은 2022년 6월 딸 원주 씨와 함께 정의선 회장의 장녀 진희씨결혼식장에 G90을 타고 등장했다. 정 회장 또한 이 회장과 같은제네시스G90을 타 눈길을 끌었다. 이 회장은 지난달 마크 저커버그 부부와 함께 승지원으로 이동할 당시에도 G90을 탔던 것으로 전해졌다. 최태원 SK그룹...,https://www.hankyung.com/article/202403229728g,
