company_id,company_name,news_title,news_text,news_url,posted_at
14336,제일제약,"입양으로 하나된 6남매…""살면서제일잘한 게 입양이죠""[인터뷰]","살면서제일잘한 일 중 하나가 입양이에요."" 11일 제19회 입양의 날을 맞아 보건복지부의 도움을 받아 지난 9일 뉴시스와 전화 인터뷰를 나눈 장성우(48)... 이어 ""여섯 째를 입양할 땐 경제적인 부분을 많이 보고, 우리 자녀 수가 너무 많다 이런 조건(제약)들이 있었는데, 그런 게 입양 제한 조건이 되지는 않았으면...",https://www.newsis.com/view/?id=NISX20240510_0002730099&cID=10219&pID=10200,
14336,제일제약,"'MZ 펀슈머 잡는다'…GS25, 식품·제약사와 이색 협업상품 출시","편의점 GS25는 식품·제약사와 손잡고 맛과 재미를 추구하는 MZ세대(1980년대 초∼2000년대 초 출생자) '펀슈머'(Fun+consumer)를 겨냥한 이색 상품을... GS25는 지난 3∼4월 CJ제일제당의 인기 브랜드 맥스봉, 고메, 스팸을 활용한 조리빵을 선보인 데 이어 최근에는 오리온과 썬 대파크림치즈, 해태 타코야끼볼...",https://www.yna.co.kr/view/AKR20240509030100030?input=1195m,
14336,제일제약,"제약사들, 콜린알포 급여축소·환수협상 소송 2건 패소","이 소송에는 종근당과 함께 한국프라임제약,제일약품, 서흥, 알리코제약, 한국휴텍스제약, 한국유나이티드제약, 국제약품, 명문제약, 제뉴파마, 한국파마, 신풍제약, 팜젠사이언스, 경보제약, 서울제약, 진양제약, 유니메드제약, 동구바이오제약, 동국제약, 에이치엘비제약, 메딕스제약, 삼천당제약...",https://www.dailypharm.com/Users/News/NewsView.html?ID=311535&REFERER=NP,
14336,제일제약,"코스피제약바이오기업, 4월 주식거래액 반토막","이어 유한양행 6565억원, 한올바이오파마 2442억원, 한미약품 2045억원, 신풍제약907억원, SK바이오사이언스 831억원, 삼일제약798억원,제일약품 739억원, 종근당 712억원, 국제약품 627억원, JW중외제약605억원, 대웅제약507억원 규모의 주식거래가 이뤄졌다, 또한 보령 471억원, GC녹십자...",http://www.bosa.co.kr/news/articleView.html?idxno=2222395,
14336,제일제약,[강재헌의 투자공식] '재료' 살아있는제약·바이오…주가도 부활하나?,"- 연준 인사들 금리인상에 선 그어…""결국은 내릴 것"" - CME 페드워치, 9월·12월 두 차례 금리인하 전망 - 연준 인사 한목소리 ""현 금리,제약적""…파월에... - 음식료주, 삼양식품·CJ제일제당·풀무원 해외에서 인기 - ""유럽 입맛 잡는다""…하림·마니커, 삼계탕 첫 수출 - 실적, 하림이 마니커 대비 우위…미국...",https://biz.sbs.co.kr/article_hub/20000170580?division=NAVER,
14336,제일제약,제일약품 '자큐보'까지 합류 … P-CAB 3파전 돌입,HK이노엔의 케이캡과 대웅제약펙수클루에 이어제일약품의 신약 개발 자회사 온코닉테라퓨틱스가 '자큐보'를 내놓으면서다. 기존에 2세대 치료제인 PPI(양성자 펌프 억제제) 중심이던 국내 위식도 역류질환 치료제 시장의 P-CAB 중심 재편에도 속도가 붙을 전망이다. 온코닉테라퓨틱스는 지난달 24일...,https://www.mk.co.kr/article/11009272,
14336,제일제약,환수율 조정 앞에 둔 '콜린 2라운드 소송'서 '제약사 패소',소송에는 △한국프라임제약△제일약품 △서흥 △알리코제약△한국휴텍스제약△한국유나이티드제약△한국유나이티드제약△국제약품 △명문제약△제뉴파마 △한국파마 △신풍제약△팜젠사이언스 △경보제약△서울제약△유니메드제약△동구바이오제약△동국제약△에이치엘비제약△메딕스제약...,http://www.hitnews.co.kr/news/articleView.html?idxno=54663,
14336,제일제약,'국산 37호 신약' 창사 첫 쾌거 이룬제일약품 오너 3세,그동안제일약품은 외자사 도입의약품 판매 비중이 약 80% 이상으로 연구·개발(R&D) 기반의 신약개발제약사로 보기에는 어려움이 있었다. 그러다가 2020년 온코닉테라퓨틱스를 설립한 뒤 매년 R&D 비용을 늘려 자큐보정이라는 성과를 보였다. R&D 전문기업으로서의 체질 개선에 성공한 것이다. 한상철...,https://www.moneys.co.kr/article/2024050708473825820,
14336,제일제약,"국내 상위제약사, 1분기 성적표 '희비' 엇갈려","광동제약과 JW중외제약,제일약품 등은 1분기 실적이 나오지 않았다. 한미약품은 1분기 매출과 영업이익 모두 두자릿수 가량 성장했다. 한미약품은 영업이익 766억원과 매출 4037억원을 기록했다. 이는 전년 동기 대비 각각 27.9%, 11.8% 증가한 수치다. 한미약품은 중국 자회사 북경한미약품의 선전과 국내외...",http://news.tf.co.kr/read/economy/2095631.htm,
14336,제일제약,"[오늘 상장]‘믹싱 장비 세계 선두’ 노리는제일엠앤에스, 코스닥 데뷔","믹싱은 여러 소재를 고르게 섞는 과정을 말하는데,제일엠앤에스는제약·식품 원료를 혼합하는 전문 장비 공급을 시작으로 현재는 양극·음극 활물질, 바인더 도전재 등 첨가제와 고체 우주 연료, 화약을 혼합하는 장비까지 여러 분야에서 40년 이상 믹싱 장비 사업을 벌여왔다.제일엠엔에스의 핵심...",http://www.edaily.co.kr/news/newspath.asp?newsid=01377606638861368,
