company_id,company_name,news_title,news_text,news_url,posted_at
9152,제일호더블류홀딩스자산대부,"캠코·HUG,대부업체에 '헐값 매각' 부실채권 8.7조원","캠코의 지난 2012년 매각한 부실채권은 티와이머니대부와제일호더블류홀딩스자산대부가 인수했다. HUG는 주택 분양보증, 임대보증금보증, 조합주택시공보증, 전세금반환보증 등의 보증업무를 주로 맡고 있다. 채무자가 부실이 날 경우 HUG가 부실채권을 떠안고 대신 상환해주는 역할을 수행한다....",http://biz.chosun.com/site/data/html_dir/2017/03/15/2017031501043.html,
9152,제일호더블류홀딩스자산대부,"[국감] ""캠코, 6만명 대출채권대부업체에 넘겨""","(2조6003억원·3만4201명)와제일호더블류홀딩스자산대부(3억5324억원·2만9271명) 등 2개 업체에 매각했다. 이 의원은 ""캠코는 민간금융회사에는 사회적 책임을 요구하면서 정작 스스로 보유한 채권을 대부업체에 매각하는 것은 공공부문 주도의 신용회복지원이라는 책무를 망각한 것""이라고 지적했다....",http://biz.chosun.com/site/data/html_dir/2013/10/21/2013102101365.html,
9152,제일호더블류홀딩스자산대부,"홍종학 ""유일호 후보자 배우자 사실상 '신용불량자'""","홍 의원은 “이 채권은 캠코를 거쳐 2012년 9월 ‘제일호더블류홀딩스자산대부’라는 곳에 인수됐고, 더블류홀딩스는 2012년 12월 서울중앙지방법원에 양수금 청구소송을 내고 2013년 10월 1일 원고승소판결을 받게 됐는데, 배우자 함모씨에게 전달하려던 소장부본등은 ‘폐문부재(閉門不在)’는 사유로...",http://www.edaily.co.kr/news/newspath.asp?newsid=01561286612516408,
9152,제일호더블류홀딩스자산대부,개인 신용회복 지원 외면한 캠코,"21일 캠코가 국회 정무위원회 소속 이상직 민주당 의원에게 제출한 자료에 따르면 캠코는 지난해 부실채권정리기금 청산을 앞두고 잔여재산을 시장에 매각하는 과정에서 채무자 6만3,472명의 개인무담보채권 6조1,327억원을 티와이머니대부ㆍ제일호더블류홀딩스자산대부등 2개 대부업체에 매각했다....",https://n.news.naver.com/mnews/article/011/0002411110?sid=101,
9152,제일호더블류홀딩스자산대부,공영개발 '구룡마을' 땅 경매로…한보그룹의 그림자,"한보그룹에서 중책을 맡았던 이 씨는 이 땅을 담보로 서울신탁은행으로부터 자금을 융통했고, 돈을 갚지 못하면서 한국자산관리공사로 넘어갔다. 이 NPL을제일호더블류홀딩스대부주식회사가 지난해 8월 매입했고, 이를 다시 태풍투자로 넘겼다. 현재 태풍투자의 채권최고액은 200억원이다. 공교롭게도...",http://view.asiae.co.kr/news/view.htm?idxno=2016120208174189501,
