company_id,company_name,news_title,news_text,news_url,posted_at
11463,주식회사굿미디어,"하이헷주식회사, 다큐멘터리형 키워드 인터뷰…솔직담백 스토리","하이헷주식회사(이하 하이헷)가 솔직담백한 인터뷰로 눈길을 끌고 있다. 하이헷은 지난 2일 공식 SNS를 통해 다큐멘터리 형식의 키워드 인터뷰 G편을 공개하고 ‘GOOD AGENCY (굿에이전시)’라는 키워드로 이야기를 선보였다. 는 A부터 Z까지 알파벳 키워드에 맞춰 회마다 하이헷의 출범 스토리, 프로듀서진...",https://www.etnews.com/20240203000002,
11463,주식회사굿미디어,"경향미디어그룹, 굿데이 신문으로 변경",㈜경향미디어그룹이 법인명을 굿데이신문주식회사(회장 이상우)로 변경했다. 스포츠신문 「goodday」를 발행하는 ㈜굿데이신문은 창간 1주년을 맞아 지난 5일자로 법인명을 굿데이신문주식회사로 변경했다고 8일 밝혔다. bkkim@yna.co.kr (끝),https://n.news.naver.com/mnews/article/001/0000183478?sid=106,
11463,주식회사굿미디어,"[29일 낙찰/계약 동향] 강남역지하도상가 피난시뮬레이션 용역, 음식물쓰레기...","▲ 낙찰업체 :주식회사굿미디어, 계약금액 : 14,590,000(원), 계약명 : 일자리 안정자금 신청안내 영상 제작(일자리안정계획부). 계약기관 : 근로복지공단본부, 계약일자 : 2020-02-21, 계약방법 : 수의계약, 발주처(수요기관) : 근로복지공단본부, 계약 :주식회사굿미디어- 근로복지공단본부 (일자리...",http://www.fintechpost.co.kr/news/articleView.html?idxno=102673,
11463,주식회사굿미디어,올해 '굿디자인' 대상에 디스트릭트코리아...38년 역사상 최초로 中企 수상,올해 '굿디자인(GD)' 대상은 디스트릭트코리아의 디지털미디어디자인 '웨일#2'가 차지했다. 산업통상자원부(장관 이창양)와 한국디자인진흥원(원장... 올해 신설된 '그린디자인특별상(산업통상자원부장관상)'에는 삼성카드주식회사의 '삼성 iD 카드'와 이십칠와트의 'IROIRO SOAP 친환경 네츄럴 라이프 소프바...,http://www.thereport.co.kr/news/articleView.html?idxno=26609,
11463,주식회사굿미디어,NFT·디지털아트 기반 픽스굿 오프라인 갤러리 개관전 'The New WAVE' 개막,주식회사쿰크(KUMC)가 배포한 자료에 따르면 쿰크는 NFT 플랫폼 픽스굿을 운영하는회사다. 신인 및 젊은 작가 양성과 NFT 대중화를 위해 힘쓴다. 올해초 KT스카이라이프와 제휴해 '강철부대2' NFT를 발행하기도 했다. 개관전 'The New WAVE'는 NFT 아트의 기원인미디어를 작업매체로 다루는 4명의...,http://www.fintechpost.co.kr/news/articleView.html?idxno=160175,
11463,주식회사굿미디어,"[증권소식] NH헤지자산운용, 이동훈 대표이사 2년 연임/테슬라, 2년만에 또 주...","테슬라는 ""주식배당의 형태로회사보통주의주식분할을 할 수 있도록 수권주식(주식회사가 앞으로 발행할주식의 총수)의 증가를 요청할 것""이라고... 에프앤가이드 산업 분류 표준(FICS)에서 내구소비재·의류, 소비자서비스,미디어, 유통, 음식료, 생활용품, 소프트웨어 섹터에 속하는 종목을 분류하고...",https://www.asiatime.co.kr/article/20220329500266,
11463,주식회사굿미디어,[미디어잡 채용속보] JTBC콘텐트허브·STOP·타임프로덕션·상민통운·주식회...,"JTBC콘텐트허브·STOP·타임프로덕션·상민통운·주식회사스킨이즈굿, 신입·경력 모집 방송전문 취업포털사이트미디어잡에서 취준생들을 위한미디어분야 채용속보를 12일 발표했다. JTBC콘텐트허브, STOP, 타임프로덕션, 상민통운,주식회사스킨이즈굿 등에서 신입 및 경력 인재를 모집한다....",http://www.ggilbo.com/news/articleView.html?idxno=617600,
11463,주식회사굿미디어,"[미디어잡 채용정보] JTBC콘텐트허브, STOP, 타임프로덕션, 상민통운,주식회...","방송전문 취업포털사이트미디어잡에서 취준생들을 위한미디어분야 채용속보를 12일 발표했다. JTBC콘텐트허브, STOP, 타임프로덕션, 상민통운,주식회사스킨이즈굿 등에서 신입 및 경력 인재를 모집한다. ■ JTBC콘텐트허브에서 경력직을 모집한다. 모집분야는 음원 해외 유통, A&R이며 3월 17일(일)까지...",http://www.kjdaily.com/read.php3?aid=1552523603464431208,
11463,주식회사굿미디어,"[미디어잡] JTBC콘텐트허브, STOP, 타임프로덕션, 상민통운,주식회사스킨이즈...","미디어잡 (C) 이희선 기자 방송전문 취업포털미디어잡에서 취준생들을 위한미디어분야 채용속보를 12일 발표했다. JTBC콘텐트허브, STOP, 타임프로덕션, 상민통운,주식회사스킨이즈굿 등에서 신입 및 경력 인재를 모집한다. ■ JTBC콘텐트허브에서 경력직을 모집한다. 모집분야는 음원 해외 유통, A&R이며 3월...",http://newsbrite.net/sub_read.html?uid=27513§ion=sc15,
11463,주식회사굿미디어,"리디주식회사, 리디페이퍼 출시미디어데이 개최","이번미디어데이에는 리디페이퍼의 런칭 및 개발 과정을 주도한 리디주식회사의 홍진형 페이퍼사업팀장, 김도훈 페이퍼개발팀장이 직접 나서 리디가 전자책 단말기를 통해 전하고자 하는 핵심 가치를 공유하, 신제품 리디페이퍼의 다양한 장점을 설명했다. 아울러 전자잉크 디스플레이를 위해 개발된 국내...",http://www.lcnews.co.kr/news/articleView.html?idxno=1644,
