company_id,company_name,news_title,news_text,news_url,posted_at
13160,충북대학교병원,"충북대 의대·충북대병원교수 ""충북도, 의대 정원 과정서 부당 개입"" 탄원서...",충북대학교의대와충북대병원교수들이 충청북도가 의대정원 배정심사위원회에 무리한 영향력을 행사하려 했다고 주장하며 법원에 탄원서를 제출했다고 8일 밝혔다. 탄원에 참여한 교수들은 94명이다. 교수들은 지난 3월 15일 열린 배정심사위원회에 의과대학 교육과 무관한충북도청 소속 보건복지 담당...,https://www.nocutnews.co.kr/news/6141975?utm_source=naver&utm_medium=article&utm_campaign=20240508062702,
13160,충북대학교병원,의사집단행동 장기화 우려…충북도 비상진료체계 강화,"이 밖에 중장기적 대책으로 충주의료원 심뇌혈관센터 구축(2025년), 국립소방병원내 권역외상센터 추가설치(2026년), 남부권 권역재활병원유치(2028년),충북대학교병원분원(2029년)을 추진하고 있다. 도 관계자는 ""갑작스러운 휴진이나 교수 사직으로 환자 피해가 발생하지 않도록 의료인력을 추가 파견하는 등...",https://www.newsis.com/view/?id=NISX20240429_0002716756&cID=10806&pID=10800,
13160,충북대학교병원,"[5월 7일병원계 이모저모①]연세의료원, 가톨릭대, 전북대,충북대병원등 소...","◆충북대병원-대전·충청감사협의회, 업무협약 체결충북대학교병원(병원장 최영석)이 대전·충청감사협의회(회장 이은우 KAIST 상임감사, 이하 협의회)와 7일 이병원에서 5월 정례회의를 갖고 17개 회원기관 간 미래지향적 감사업무 교류와 지원 협력을 위한 업무협약을 체결했다. 이번 업무협약을 통해 최근...",https://medicalworldnews.co.kr/news/view.php?idx=1510960926,
13160,충북대학교병원,"화순전남대병원, ‘전남도 환경보건센터’ 현판 제막",(아주대학교) △경상남도(경상국립대학교) △경상북도(동국대학교) △대전(대전대학교) △부산(동아대학교) △서울(서울대학교) △울산(울산대병원) △인천(가천대학교) △전라북도(전북대학교) △제주(제주대학교) △충청남도(순천향천안병원) △충청북도(충북대학교병원) 등 총 14곳이다.,http://www.jnilbo.com/73552563263,
13160,충북대학교병원,"충북대학교병원-대전·충청감사협의회, 감사업무 교류 위한 업무협약 체결",［충북일보］충북대학교병원은 대전·충청감사협의회와 17개 회원기관 간 미래지향적 감사업무 교류와 지원 협력을 위해 업무협약을 체결했다고 7일 밝혔다. 이날 업무협약을 통해 협의회는 △감사인의 역량 강화를 위한 공동 교육프로그램 운영 △전문성 제고를 위한 감사사례 공유 △감사 전문 인력의 교류...,https://www.inews365.com/news/article.html?no=813355,
13160,충북대학교병원,충북도 “충북대 의대 정원 150명 이상 돼야”…교육부 건의,"충북은충북대학교병원충주 분원(500병상)이 오는 2029년 신설 예정이고, 오송 K-바이오스퀘어에 2037년까지 의사·과학자 3000명을 양성하는 등충북바이오산업 성장에 따라 의사 수요가 기하급수적으로 늘어날 것으로 예상된다. 김영환충북지사는 “지역 의료에 큰 비중을 차지하고 있는충북대병원에...",http://www.inews24.com/view/1715824,
13160,충북대학교병원,빈 주차공간까지 알려준다..충북도 주소기반 주차정보 구축,도는 하루 평균 차량 5000여대가 드나드는충북대학교 병원과 각종 행사로 방문객이 많은 청주문화제조창 등 두 곳의 주차장을 사업대상지로 정했다. 도는 대상지에 사물인터넷 감지기를 설치해 주소 기반 지능형 주차정보를 구축할 예정이다. 주차에 특화된 내비게이션 앱을 통해 빈 주차 공간 과 빈 주차...,https://www.seoul.co.kr/news/society/2024/05/01/20240501500080?wlog_tag3=naver,
13160,충북대학교병원,"대학병원(의과대학) 트렌드지수 3위 경희의료원, 4위 부산대학교 병원..그러...","순위 키워드 4월 5주차 4월 4주차 증감 비율 ▲대학병원(의과대학) 트렌드 지수 분석 결과 ⓒ랭키파이 한편, 11위는 중앙대학교병원, 12위 전남대학교병원, 13위 원광대학교병원, 14위 동아대학교병원, 15위충북대학교병원, 16위 고신대학교복음병원, 17위 한양대학교병원, 18위 건국대학교병원, 19위...",https://www.ngonews.kr/news/articleView.html?idxno=150920,
13160,충북대학교병원,"화순전남대병원, 지역 환경성질환 예방·관리 본격 전개",(아주대학교) ▲경상남도(경상국립대학교) ▲경상북도(동국대학교) ▲대전(대전대학교) ▲부산(동아대학교) ▲서울(서울대학교) ▲울산(울산대병원) ▲인천(가천대학교) ▲전라북도(전북대학교) ▲제주(제주대학교) ▲충청남도(순천향천안병원) ▲충청북도(충북대학교병원) 등 총 14곳이다.,http://www.bosa.co.kr/news/articleView.html?idxno=2222170,
13160,충북대학교병원,"정부, 의대 증원 의지… 충주충북대병원예타 통과 기대",［중부매일 정구철 기자］ 충주충북대학교병원건립사업의 예비타당성조사 결과 발표가 임박한 것으로 알려지면서 결과에 관심이 집중되고있다. 예비타당성조사 운용지침에 따르면 예비타당성조사의 기간은 최대 1년 6개월로 지난해 2월에 착수한 충주충북대학교병원건립사업은 오는 7월을 초과하게 되면...,http://www.jbnews.com/news/articleView.html?idxno=1435329,
