company_id,company_name,news_title,news_text,news_url,posted_at
13066,케이엔미디어,"스튜디오산타클로스 “케이엔터홀딩스, 나스닥 상장 초읽기”",케이엔터홀딩스는 지난해 6월 글로벌스타와 합병계약을 체결하며 5억9000만 달러(약 7670억원)의 기업가치를 인정받았다. 글로벌스타는 지난 26일 미국증권거래위원회(SEC)에 증권신고서(F-4)를 제출했고 합병 심사를 거쳐 종목명 ‘케이웨이브미디어(K Wave Media lnc)’로 거래될 예정이다....,https://view.asiae.co.kr/article/2024032808544730374,
13066,케이엔미디어,"황인엽,케이엔스튜디오와 전속계약",독보적인 필모그래피와 글로벌 팬덤을 쌓아가고 있는 황인엽은 2024년 방송을 앞둔 JTBC 새 드라마 ‘조립식 가족’ 출연을 확정 지으며 ‘열일’ 행보를 이어간다. 뛰어난 외모와 지성을 겸비한 해동대병원 정형외과 레지던트 김산하로 분해 대중을 만날 예정이다. [셀럽미디어/ 사진=케이엔스튜디오],http://www.celuvmedia.com/article.php?aid=1704158530468653006,
13066,케이엔미디어,"'K-콘텐츠'케이엔터홀딩스, 5월 나스닥 상장… ""韓 대표 영화사 모였다""",합병이 마무리되면 '케이웨이브미디어'(종목코드 K Wave Media Inc)로 사명을 바꿔 나스닥시장에서 거래된다.케이엔터는 문화콘텐츠 전문 VC(벤처케피탈)인 쏠레어파트너스를 주축으로 한국 콘텐츠 산업을 대표하는 기업들이 모인 연합이다. 쏠레어파트너스는 영화 '서울의봄' '파묘' '기생충' 등의 주요...,https://www.moneys.co.kr/article/2024040816180162368,
13066,케이엔미디어,"천만영화 주역 뭉친케이엔터, 5월 나스닥 상장",케이엔터홀딩스는 미국 SEC로부터 승인받는 대로 합병 절차를 밟는다. 합병이 마무리되면 ‘케이웨이브미디어’(종목코드 K Wave Media Inc)로 사명을 바꿔 나스닥시장에서 거래된다. 국내 종합 엔터테인먼트 콘텐츠 회사가 최초로 나스닥에 입성하는 사례다.케이엔터홀딩스는 충무로에서 인정받는 굴지의...,https://www.hankyung.com/article/2024032710171,
13066,케이엔미디어,"스타트업 美 상장, 어려운 줄만 알았는데...","절차가 마무리되면케이엔터는 케이웨이브미디어로 이름을 바꿔 나스닥에서 거래된다.케이엔터홀딩스를 이끄는 최평호 회장은 CJ CGV 설립 멤버로, CJ ENM 영화사업본부장을 지냈다.케이엔터홀딩스에 합류하는 7개 기업 중에는 영화 ‘택시운전사’로 이름을 알린 ‘더램프’가 대표적이다. 영화...",https://www.mk.co.kr/article/10810416,
13066,케이엔미디어,"스튜디오산타클로스, '케이엔터홀딩스'에 전략적 투자",또 미국증권거래위원회(SEC)의 합병 심사를 거쳐 내년 상반기에 종목명 '케이웨이브미디어(K Wave Media Ltd)'로 거래를 시작하는 것을 목표로 하고 있다. 이번 합병의 법률자문은 법무법인 광장과 미국 로펌 롭앤롭이 맡았고 회계자문은 삼정KPMG가 맡았다.케이엔터홀딩스는 문화콘텐츠 투자전문...,http://www.fnnews.com/news/202308301304016014,
13066,케이엔미디어,"[특징주] 스튜디오산타, 나스닥 상장 추진 '케이엔터' 투자 부각 '↑'",국내 주요 영상 콘텐츠 제작사들이 사업지주회사 형태로 모인케이엔터홀딩스는 글로벌 자금 조달 기회를 넓히고 넷플릭스 등 글로벌 OTT업체들과의 협상력을 강화하기 위해 스팩(SPAC) 합병방식으로 미국 나스닥 상장을 추진 중이다. 내년 상반기에 종목명 “케이웨이브미디어(K Wave Media Ltd)”로 거래를...,http://www.inews24.com/view/1629575,
13066,케이엔미디어,천만영화 주역 모인 '케이엔터' 나스닥 간다,내년 초 주식 거래가 시작될 예정이며 사명은 '케이웨이브미디어'로 변경된다. 합병 과정에서 기업가치는 6억1000만달러(한화 7830억원)로 책정됐다.케이엔터홀딩스는 지난해 매출 1억5300만달러(한화 1951억원)를 기록했다. 영업이익도 이미 1000만달러(한화 127억원) 이상 창출되고 있다. 합병이 완료되면...,https://dealsite.co.kr/articles/105449,
13066,케이엔미디어,(2023 국제광융합 O2O 엑스포 미리보기) 피아이코리아·동부엘이디·케이엔엘...,"제품에는 영상 자동인식 광고 패널 제작 기술 ▲미래형 모듈, 콘트롤 일체형 LED전광판 제작 기술 ▲디지털 멀티미디어시스템 제작 및 운용기술 ▲다단형, 다층형 영상 표출 시스템 제작 기술 등이 반영됐다.케이엔엘이디는 LED전광판의 경우 활용도가 매우 높은 제품으로, LED전광판 기술력을...",https://www.electimes.com/news/articleView.html?idxno=320221,
13066,케이엔미디어,"보이그룹 제타, 여성취향 저격한 보이그룹 등장","제타 / 사진=케이엔미디어제공 제타 / 사진=케이엔미디어제공 제타 / 사진=케이엔미디어제공 [스포츠투데이 오효진 기자] 여성 취향을 제대로 저격한 제타가 전격 데뷔한다. 페임어스(FameUs) 소속사 케이엔엔미디어가 신인 보이그룹 제타(Zetta)를 공개했다. 제타는 호준, 비탑, 제로, 네오, 성현으로...",http://stoo.com/news/stview.htm?idxno=2016070617210996775,
