company_id,company_name,news_title,news_text,news_url,posted_at
1224,케이시스,"케이시스, 안내 전광판 우수제품·혁신제품 국내 첫 인증",케이시스(대표 천병민)는 2004년 설립된 후 지난 21년간 끊임없는 연구개발로 LED 디스플레이 조달시장의 선두 주자 역할을 해오며 LED 전광판의 제조사로...케이시스의 대표 제품은 자체 기술력으로 개발한 ‘대기전력 절감 기술이 적용된 고효율 LED 전광판’이다. 국내 최초로 조달청 안내전광판 분야...,https://www.hankyung.com/article/2024041638161,
1224,케이시스,"LED 전광판 전문기업케이시스, '나라장터 엑스포 2024' 참가",주식회사케이시스(대표 천병민)가 4월 17일부터 19일까지 킨텍스에서 개최되는 '코리아 나라장터 엑스포 2024'에 참가해 우수제품·혁신제품 LED 전광판을 선보인다고 밝혔다.케이시스는 이번 나라장터엑스포에서 상황실·화상회의실·로비·강당 등을 재현한 '대형 LED 디스플레이 전시관'을 마련했다....,http://www.koit.co.kr/news/articleView.html?idxno=121684,
1224,케이시스,"케이시스, 우수조달업체로 조달청장 표창장 수상","LED전광판 전문기업케이시스(대표 천병민)가 조달청 우수조달업체로 인정받아 '조달청장 표창'을 수상했다고 14일 밝혔다.케이시스는 우수제품 및 혁신제품에 지정된 실내 안내전광판을 2022~2023년 조달청 나라장터 종합쇼핑몰을 통해 공공기관에 최다 납품하고, 지속적인 기술개발과 품질향상으로...",http://www.koit.co.kr/news/articleView.html?idxno=121235,
1224,케이시스,"케이시스, 신사옥 확장이전 성료",LED전광판 전문기업케이시스가 신사옥으로 이전했다. [사진=케이시스] LED전광판 전문기업케이시스(대표 천병민)가 지상 6층 규모의 신사옥 '더케이타워(THE KTOWER)'를 준공하고 본사를 확장 이전했다. 3일케이시스에 따르면 지난해 11월 28일부터 신사옥으로 본사를 이전해 본격적인 업무를 개시했으며...,http://www.koit.co.kr/news/articleView.html?idxno=119589,
1224,케이시스,LED전광판 전문기업케이시스'노바스타 월드투어 2023' 성료,LED전광판 전문기업 주식회사케이시스가 '노바스타 월드투어 2023'을 성공적으로 마무리했다고 26일 밝혔다. 부산 해운대 그랜드조선 호텔에서 개최된 '노바스타 월드투어 2023'은 노바스타(NOVASTAR)의 제품을 직접 만나보고 심도있게 논의할 수 있는 월드투어 컨퍼런스 행사로 노바스타가 주관하고케이시스가...,https://www.etnews.com/20231226000163,
1224,케이시스,천병민케이시스대표 '국가품질상 산업부장관 표창' 수상,천병민케이시스대표가 국가품질경영대회에서 산업통상자원부 장관 표창을 수상했다. [사진=케이시스] LED전광판 전문기업케이시스천병민 대표가 '제49회 국가품질경영대회'에서 산업통상자원부 장관 표창을 수상했다고 20일 밝혔다. 국가품질경영대회는 국가산업 경쟁력 향상에 크게 기여한 공로자와...,http://www.koit.co.kr/news/articleView.html?idxno=119312,
1224,케이시스,"케이시스, 자체 전력절감하는 LED전광판 [삶의 질 높여주는 혁신상품]",프리미엄 LED전광판 '레닷 큐브' LED전광판 전문기업케이시스의 프리미엄 LED전광판 '레닷 큐브(일체형 허브보드가 적용된 LED전광판)'가 조달청 우수제품과 혁신제품에 지정됐다.케이시스의 '레닷 큐브'는 종래 전광판의 단점을 보완하기 위해 허브보드가 내장된 LED전광판이다. 허브보드 자체에 케이블...,https://www.mk.co.kr/article/10867464,
1224,케이시스,천병민케이시스대표 '산기협 기술경영인상' 수상,"천병민케이시스대표가 고효율 LED전광판 개발 공로를 인정받아 '산기협 기술경영인상'을 수상했다. [사진=케이시스] ㈜케이시스의 천병민 대표가 한국산업기술진흥협회(KOITA, 이하 산기협)로 부터 '제27회 산기협 기술경영인상'을 수상했다고 밝혔다. 지난달 25일 서울 마곡 LG사이언스파크에서 열린 '제2회...",http://www.koit.co.kr/news/articleView.html?idxno=118056,
1224,케이시스,[2023 중소기업우수제품]케이시스'레닷 큐브',"케이시스가 전력 70% 이상을 절감한 발광다이오드(LED) 전광판 레닷 큐브로 조달청 우수제품과 혁신제품 자격을 획득했다. 레닷 큐브는 기존 전광판...케이시스는 이외에도 GS인증 1등급, 녹색인증, 환경인증, 산업융합혁신품목, 우수발명품 지정 등 100건 이상 수상·인증·특허를 보유했다. 천병민케이시스...",https://www.etnews.com/20231016000216,
1224,케이시스,"LED전광판 전문기업케이시스, GS인증 1등급 획득",LED전광판 전문기업케이시스(대표이사 천병민)가 'GS인증 1등급<사진>'을 획득했다고 밝혔다. 한국정보통신기술협회(TTA)에서 주관하는 GS(Good Software)...케이시스는 콘텐츠 매니저시스템인 'KSYS CMS Ver 1.0'에 대해 GS인증 최고 등급인 1등급을 획득했다. KSYS CMS는케이시스의 독자 기술로 개발한 LED전광판...,http://www.koit.co.kr/news/articleView.html?idxno=114777,
