company_id,company_name,news_title,news_text,news_url,posted_at
11575,크리에이티브안,애플 아이패드 광고 “인간 창의성 파괴” 비판에...애플 “TV 광고 안하겠다...,"미렌 부사장은 “창의성은 애플의 DNA이며 전 세계의크리에이티브에게 힘을 실어주는 제품을 디자인하는 것은 우리에게 매우 중요한 일”이라면서... 이번에 논란이 된 광고는 피아노, 기타, TV, 페인트통, 아케이드게임기 등크리에이티브도구가 유압 프레스에 의해 분쇄된 후 아이패드로 압축되는 모습을...",https://www.mk.co.kr/article/11012373,
11575,크리에이티브안,전국구 대전 빵집 ‘성심당’ 서울 나들이…그런데 빵은안판다?,"‘로컬크리에이티브2024’ 전시회에 참여한다고 밝혔다. 해당 행사는 지역을 주제로 한 전시로, 성심당을 비롯한 50개 이상의 지역 브랜드들이 참여한다. 해당 행사와 연계한 콘퍼런스, 토크쇼, 공연 등도 진행된다. 성심당 쪽은 “문화역서울284에서 개최되는 ‘로컬크리에이티브2024’ 전시에 성심당 빵은...",https://www.hani.co.kr/arti/society/society_general/1139486.html,
11575,크리에이티브안,"서울에서 행사 여는 '성심당' ""빵은안팔고 전시만""","전시 '로컬크리에이티브2024'에 참여한다고 밝혔다. 성심당은 해당 게시물을 통해 전시 참여 소식을 알리면서 ""많은 분들께서 빵도 판매하는지 많이... 소식을 접한 누리꾼들은 ""기대 많이 했는데 전시만 한다니요"" ""역시 성심당 대전에서 사 먹어야 더 맛있어요"" ""서울 팝업스토어에서는 빵안팔고...",https://www.newsis.com/view/?id=NISX20240506_0002724704&cID=10201&pID=10200,
11575,크리에이티브안,"""죄송,안팝니다"" 성심당 서울 오는데 입맛 다시는 이유","성심당은 최근 본점 인스타그램을 통해 전시 ‘로컬크리에이티브2024: 더 넥스트 커뮤니티’ 참여 소식을 전했다. 이 전시는 오는 17일부터 다음달... 한편, ‘로컬크리에이티브2024: 더 넥스트 커뮤니티’ 행사에는 성심당과 태극당 등의 빵집을 비롯해, 헬카페, 모모스커피, 로우키, 복순도가 등 50여개...",https://www.joongang.co.kr/article/25247305,
11575,크리에이티브안,"성심당 드디어 서울 오는데…""죄송하지만 빵은안팔아요""","‘로컬크리에이티브2024: 더 넥스트 커뮤니티’ 전시 참여 소식을 전했다. 성심당은 “많은 분께서 빵도 판매하는지 문의하시고 있는데, 이렇게 많은... 한편 ‘로컬크리에이티브2024: 더 넥스트 커뮤니티’ 행사에는 성심당과 태극당 등의 빵집을 비롯해, 헬카페, 모모스커피, 로우키, 복순도가 등...",https://view.asiae.co.kr/article/2024050515224647256,
11575,크리에이티브안,소문 무성한 애플 AI…“몇 주 안에 큰 발표 계획”,벤 바자린크리에이티브스트래티지스트 애널리스트는 “애플은 생성형 AI 기술이 삼성과 같은 경쟁자와 비교해 무엇이 다를지 보여줘야 한다”며 “아이폰 16의 판매량 사이클 역시 아이폰 15와 비슷할 것으로 예상돼 중대한 혁신 없이는 성장이 여전히 어려울 수 있음을 보여준다”고 분석했다.,https://www.khan.co.kr/economy/economy-general/article/202405051531001,
11575,크리에이티브안,한국 대표 CD들도 깜짝 놀란 대학생들의크리에이티브… '2024 드림 라이언즈...,""" - 이승재 아이디엇 대표 칸 라이언즈 코리아가 주최하는 대학생 공모전 '2024 드림 라이언즈'의 작품들이 현직 크리에이터에 버금가는크리에이티브로... 출품작들에서 올해 주제인 SDGs(지속가능한 발전 목표)에 부합하는 많은 고민과 문제 해결의 의지가 느껴진 바, 그야말로크리에이티브를 위한...",https://biz.newdaily.co.kr/site/data/html/2024/05/03/2024050300013.html,
11575,크리에이티브안,"[유통가 레이더] 한화이글스가 편의점 안으로... GS25, 한화이글스와 플래그십...","먼저, 옥외 광고는 '시리얼 더 이상 당할 수 없다'는 카피와 함께 그동안 시리얼이 당해온 억울한 오해에 대해 재치 넘치는 반격을 펼치는크리에이티브로 눈길을 끈다. 켈로그는 총 3편으로 제작된 이번 광고에서 시리얼은 당 함량이 높고, 튀겨서 만들며, 아침식사로 적합하지 않다는 3가지 오해에 대해...",https://www.greened.kr/news/articleView.html?idxno=313810,
11575,크리에이티브안,"스마일게이트, 에픽세븐 슈퍼크리에이티브신작 ‘카제나’ 공개",스마일게이트는 슈퍼크리에이티브에서 개발 중인 신작 역할수행게임(RPG) '카오스 제로 나이트메어(카제나)'의 공식 커뮤니티를 오픈하고 세계관과 캐릭터들을 선보이는 소개 영상을 공개했다고 22일 밝혔다. '카제나'는 애니메이션 서브컬쳐 게임 개발사 슈퍼크리에이티브에서 출시를 준비하고 있는 신작 RPG다....,https://www.ekn.kr/web/view.php?key=20240422022401109,
11575,크리에이티브안,"대구 달서구, 초등학생 대상 ‘1인 미디어크리에이티브’ 교육 과정 모집",대구 달서구(구청장 이태훈)는 내달 9일부터 본리도서관에서 초등학생을 대상으로 스마트폰을 활용한크리에이티브교육 과정을 운영한다고 18일 밝혔다. 본리도서관에서 주관한는 이번 교육은 ‘손바닥 안에서 펼쳐지는 나만의크리에이티브’로 5월 9일부터 5월 30일까지 매주 목요일(16:30~18:30) 2시간씩 총...,https://sports.donga.com/article/all/20240418/124543647/2,
