company_id,company_name,news_title,news_text,news_url,posted_at
14612,테라젠헬스케어,"""색다른 가족선물로 제격""…롯데헬스케어, '이것' 리뉴얼","롯데헬스케어와테라젠헬스는 이번 리뉴얼을 통해 소비자 선호도가 높은 유전자 검사 항목을 중심으로 상품 패키지를 전면 재구성하고, 가격도 기존보다 내렸다. 초기비용을 줄여 잠재 소비자가 부담 없이 구매하게끔 하기 위해서다. ‘프롬진 유전자 검사 스타터 키트(기본 항목 30종)’가 기본 상품으로...",https://www.newsis.com/view/?id=NISX20240503_0002723111&cID=13104&pID=13200,
14612,테라젠헬스케어,"롯데헬스케어, 유전자 검사 '프롬진' 리뉴얼 출시",롯데헬스케어와테라젠헬스는 이번 리뉴얼을 통해 소비자 선호도가 높은 유전자 검사 항목을 중심으로 상품 패키지를 전면 재구성했다. 가격은 기존보다 42% 낮춘 3만 9800원부터 판매를 시작한다. 초기비용을 줄여 잠재 소비자가 부담 없이 구매하게끔 하기 위해서다. '프롬진 유전자 검사 스타터 키트'(기본...,https://www.news1.kr/articles/5404794,
14612,테라젠헬스케어,"롯데헬스케어, 유전자 검사 키트 '프롬진' 가격 낮춰 리뉴얼","롯데헬스케어와테라젠헬스는 이번 리뉴얼을 통해 소비자 선호도가 높은 유전자 검사 항목을 중심으로 상품 패키지를 전면 재구성하고, 가격도 기존보다 42% 낮춘 3만9800원부터 판매를 시작한다. '프롬진 유전자 검사 스타터 키트(기본 항목 30종)'가 기본 상품으로, 리뉴얼 출시를 기념해 1만원 추가...",http://www.fnnews.com/news/202405031609296580,
14612,테라젠헬스케어,"롯데헬스케어, 유전자 검사 키트 ‘프롬진’ 리뉴얼 출시","롯데헬스케어와테라젠헬스는 이번 리뉴얼을 통해 소비자 선호도가 높은 유전자 검사 항목을 중심으로 상품 패키지를 전면 재구성하고, 가격도 기존보다 42% 낮춘 3만9800원부터 판매를 시작한다. 초기비용을 줄여 잠재 소비자가 부담 없이 구매하게끔 하기 위해서다. ‘프롬진 유전자 검사 스타터 키트...",https://www.dailian.co.kr/news/view/1358038/?sc=Naver,
14612,테라젠헬스케어,제이엘케이 주가 고공행진...헬스케어플랫폼 기업 살루스케어와 무슨 이슈 있...,헬스케어플랫폼 기업 살루스케어와 KMI 한국의학연구소에 흉부 엑스레이 AI 설루션 공급이 주가에 훈풍을 불어 넣고 있는 것으로 보인다.... 한편 이날 오후 3시 4분 현재 원격진료 비대면진료 관련주인 JW중외제약 아스타케어랩스 휴비츠 나노엔텍 인성정보 파마리서치테라젠이텍스 SK케미칼 휴비츠...,https://www.pinpointnews.co.kr/news/articleView.html?idxno=264272,
14612,테라젠헬스케어,"롯데·카카오, 비대면헬스케어서비스 “내가 최고”","이를 위해 롯데헬스케어는 국내 바이오기업 '테라젠바이오'를 비롯해 수면 솔루션 기업 '에스옴니', 디지털 멘탈케어기업 '아이메디신', 스마트팜 기업 '팜에이트', 탈모·두피케어기업 '비컨' 등과 잇따라 파트너십을 맺어 왔다. 캐즐은 인공지능(AI)를 활용해 개인동의 하에 건강검진 데이터 분석, 소비자...",https://www.ekn.kr/web/view.php?key=20240423025152098,
14612,테라젠헬스케어,"의료 파업에 주목 받는 '원격·비대면'...제약·바이오, '디지털헬스케어' 사...",지난해 맞춤형 건강관리 플랫폼 '캐즐'을 출시하며 사업을 시작한 롯데헬스케어는 올 상반기 '체중관리 서비스' 선보일 예정이다. 하반기에는 자회사테라젠헬스의 마이크로바이옴 검사 키트를 캐즐에서 만나볼 수 있도록 서비스를 개편한다. [서울=뉴스핌] 김신영 기자 = 롯데헬스케어캐즐2024.04.22 sykim...,https://www.newspim.com/news/view/20240422001080,
14612,테라젠헬스케어,"LG생건, 디지털헬스케어신사업 재정비","LG생활건강이 디지털헬스케어신사업을 재정비한다. 자회사를 통해 추진한 소비자대상직접시행(DTC) 유전자 분석 기관 승인이 미뤄지고, 협력업체와 계약도 종료된데 따른 것이다. 17일 업계에 따르면 LG생활건강은 지난달테라젠바이오와 계약이 종료되면서 '본디스웨이 플러스' 유전자 분석 서비스를...",https://www.etnews.com/20240417000284,
14612,테라젠헬스케어,"롯데헬스케어자회사테라젠헬스, 파트너사 확대로 유전자 검사 저변 확장",롯데헬스케어는 8일테라젠헬스와 에스옴니와 개인 맞춤형 수면 솔루션 개발을 위한 업무협약을 체결했다고 10일 밝혔다. 정재호테라젠헬스대표이사와 유재성 에스옴니 대표이사를 비롯한 두 회사의 주요 관계자가 협약식에 참석했다. 에스옴니는 인공지능 기반 수면 코칭 솔루션 기업이다. 유튜브에서...,https://www.businesspost.co.kr/BP?command=article_view&num=345013,
14612,테라젠헬스케어,"[바이오 줌人] 정재호테라젠헬스대표 ""DTC 유전자 검사로 맞춤형 의료 수요...","테라젠헬스는 롯데헬스케어외에 여러 플랫폼, 기업들과도 사업적 협력 관계를 맺고 있다. 건기식 기업, 맞춤형 화장품, 운동, 멘탈케어, 반려동물 등 다양한 기업들과의 MOU 가능성도 열려있다. 경영자로서 어려움이 있다면 리더로서는 다양한 경험은 쌓았다만, '대표'는테라젠헬스에서 처음 맡았다.헬스케어...",https://www.sisajournal-e.com/news/articleView.html?idxno=401879,
