company_id,company_name,news_title,news_text,news_url,posted_at
12677,트랜드북스,"메가북스, 영유아 기관 교재 공급 사업 진출","트랜드북스와 전략적 파트너십 체결, 영유아 전문브랜드 mkids 론칭 메가스터디의 출판자회사인 메가북스(대표 최봉수)는 국내 유아교육기관 교재공급 사업을 본격 추진한다고 밝혔다. 영유아 사업 전문기업트랜드북스(대표 황종순)와 전략적 파트너십 체결을 통해 영유아 기관사업을 진행하며...",http://www.segye.com/content/html/2014/11/14/20141114000869.html?OutUrl=naver,
12677,트랜드북스,"메가북스, 영유아 기관 교재 공급 사업 본격 진출","영유아 사업 전문기업트랜드북스(대표 황종순)와 전략적 파트너십 체결을 통해 영유아 기관사업을 진행하며 메가북스의 기 확보된 국내외 콘텐츠 외에 전문 개발진이 개발한 유아영어교육전문 프로그램을 시작으로 유, 아동 시장 전반은 물론 어린이집, 유치원 등 영유아 기관 시장에 진출하게...",http://www.seoul.co.kr/news/newsView.php?id=20141110500104,
12677,트랜드북스,"메가북스, 엠키즈 영유아를 위한 스마트 교육의 종지부를 찍다","메가북스는 mkids사업의 성공적인 준비와 론칭을 위해 유치 프로그램 전문교육기업 ㈜트랜드북스와 전략적 파트너십 체결을 통해 본 사업을 준비해 왔으며, mkids의 첫 프로그램 Right Foot에 대해 ㈜트랜드북스의 황종순 대표는 “하루에 20~30분 수업으로 영어를 좋아하게 되고 영어를 잘하게 될 수...",http://mbn.mk.co.kr/pages/news/newsView.php?category=mbn00013&news_seq_no=2207945,
12677,트랜드북스,"[북스&] 메타버스, 제2의 인터넷이 될까","기술의트랜드를 꿰뚫어보는 저자의 식견을 구하고자 국내 대기업들이 출간 전부터 책에 상당한 관심을 쏟아낸 것도 이 때문이다. 저자는 “휴대전화처럼 사소해 보이는 것들이 결국에는 필수품이 돼 사람들이 예측한 방식으로, 그리고 때로는 전혀 생각조차 하지 못한 독창적인 방식으로 세상을 바꾼다”고...",https://www.sedaily.com/NewsView/29QSEIQLD0,
12677,트랜드북스,"'챗GPT' 출간, ""ChatGPT를 통해 미래트랜드전망 예측 가능""","사진제공 : 생능북스출판 전문 브랜드인 생능북스는 ChatGPT를 통해서 경제 전망과 미래 트렌드를 예측하는 '챗GPT'를 출간했다고 알렸다. 관계자는 ""'ChatGPT'란 테슬라의 일론 머스크, 와이 콤비네이터 창업자 샘 알트만, 링크드인 공동창업자 리드 호프먼 등 IT업계의 거물들이 함께 만든 기업인 오픈AI에서...",http://www.sisunnews.co.kr/news/articleView.html?idxno=178420,
12677,트랜드북스,[박현주의 신간돋보기] 동화로 풀어낸 피란민의 삶 外,"# 챗GPT의 답변, 믿어도 될까 - 챗GPT의 거짓말/트랜드연구소 지음/동양북스/1만9800원 챗GPT가 갑자기 반말하는 경우가 있다. 그것을 지적하면 ‘죄송하다’ ‘미안하다’고 한다. 반말하는 감정을 알고 있고, 모욕이 뭔지도 알고, 사람을 해치는 게 뭔지 알고 있다는 것이다. 이 책은 인공지능에 대해 가졌던...",http://www.kookje.co.kr/news2011/asp/newsbody.asp?code=0500&key=20230825.22014007881,
12677,트랜드북스,[우설래의 설래는 취업준비] PREP으로 통하는 면접,"(Point) 이처럼 무엇부터 시작해야 하는지 모르는 취업준비생들에게 빛이 되어 준 7단계 프로세스를 더욱 연구하여 앞으로도트랜드에 알맞은 체계적인... 지금까지 17년차 강사로 활동하고 있으며, 6,000건 이상의 진로·취업 컨설팅을 진행한 바 있다. 저서로는 『설래는 취업준비(대경북스, 2022)』가 있다.",https://www.lecturernews.com/news/articleView.html?idxno=151661,
12677,트랜드북스,"경기콘텐츠진흥원, 경기도 콘텐츠 기업에 ‘해외 진출’ 지원","픽스트랜드, 다산북스, 아이디어콘서트, 에이스에듀 등 많은 참가기업이 해외 바이어와 콘텐츠 공급 계약 및 업무협약을 체결했다. ‘지커넥션 2020’은 총 210건 이상 상담과 수출계약추진액 5,159만 달러를 달성했다. 지난 12월 1일부터 4일까지 총 4일에 걸쳐 아시아 최대 방송-애니메이션 전시회인...",http://www.newsway.co.kr/news/view?tp=1&ud=2020121417275083180,
12677,트랜드북스,"경기콘텐츠진흥원, 코로나 위기 콘텐츠 기업 해외진출 지원","픽스트랜드, 다산북스, 아이디어콘서트, 에이스에듀 등 많은 참가기업이 해외 바이어와 콘텐츠 공급 계약 및 업무협약을 체결했다. ‘지커넥션 2020’은 총 210건 이상 상담과 수출계약추진액 5159만 달러를 달성했다. 진흥원은 지난 12월 1일부터 4일까지 총 4일에 걸쳐 아시아 최대 방송-애니메이션...",http://moneys.mt.co.kr/news/mwView.php?no=2020121210018028352,
12677,트랜드북스,"[2018 세텍유아교육전] 그레이트북스, 클래식 결합한 노래하는 그림책 '도레미...",그레이트북스는 4월 12일(목)부터 15일(일)까지 세텍에서 열리는 '2018년 서울국제유아교육전&키즈페어 in SETEC'에 참가해 클래식을 결합한 노래하는 그림책... 교육트랜드를 한 눈에 살펴볼 수 있는 국내 최장수 유아교육 전문 전시회다. 올해는 코딩교육을 포함한 다채로운 세미나가 동시에 열려 많은...,http://kr.aving.net/news/view.php?articleId=1385464&Branch_ID=kr&rssid=naver&mn_name=news,
