company_id,company_name,news_title,news_text,news_url,posted_at
14670,팜크로스,[SK그룹] 상승률 상위종목은?...SK바이오팜 1.98% 올라 상승률 상위권,1위 SK바이오팜 8만7600원(1.98%)▲2위 SK디앤디 1만2180원(1.84%)▲3위 드림어스컴퍼니 2800원(1.45%)▲4위 에스엠코어 5630원(1.08%)▲5위 SK리츠 4145원(0.36%)▲6위 인크로스9290원(0.32%)▲7위 SK디스커버리 4만5500원(0.22%)▲8위 SK텔레콤 5만1300원(0.2%)▲9위 SK케미칼 6만500원(0.17%)▲10위 SKC...,https://www.pinpointnews.co.kr/news/articleView.html?idxno=262955,
14670,팜크로스,"이동훈 SK바이오팜 대표, ‘글로벌 빅 바이오텍’ 향한 힘찬 날갯짓","최근에는 신사업을 추진하기 위해 김연태 SK 바이오투자센터장, 김민지크로스보더파트너스 대표 등 투자 전문인력을 중심으로 이사회를 재편하기도 했다. SK바이오팜은 세노바메이트에 이어 희귀 소아 뇌전증 치료제 ‘카리스바메이트’, 차세대 뇌전증 치료제 ‘SKL24741’, 항암 신약 ‘SKL27969’ 등을...",https://www.fetv.co.kr/news/article.html?no=162872,
14670,팜크로스,[더벨][SK바이오팜 '세노바메이트' 확장 전략]투자전문가 등용에 달라진 전략...,"김연태 SK㈜ 바이오투자센터장, 김민지크로스보더파트너스 대표 등 투자 전문 인력을 중심으로 이사회를 재편하면서 신사업 추진을 위한 준비도 마쳤다. SK그룹 내 제약바이오 사업을 두고 계열사 간 교류가 활발해진 점도 그가 부임한 이후 달라진 점이다. 작년 출범한 혁신신약 태스크포스(TF)에서 그룹...",https://www.thebell.co.kr/free/content/ArticleView.asp?key=202403211442187760105396,
14670,팜크로스,"[바이오AI 강자들] 온코크로스, 국내 유일 항암제 적응증 발굴 서비스⑩","2015년 온코크로스를 창업한 김이랑 대표 얘기다. 온코크로스는 기존 연구개발(R&D) 패러다임에서 접근이 어려웠던 희귀질환 및 난치성 질환에 대한 치료제를 AI를 이용해 개발하는 분야에서 가장 앞서 있다는 평가다. 김이랑 온코크로스대표. (사진=온코크로스) 온코크로스핵심 AI 플랫폼으로는, 약물의 최적...",http://www.edaily.co.kr/news/newspath.asp?newsid=01079126638825616,
14670,팜크로스,美 미네랄리스 CBO에 김민지 SK바이오팜 사외이사,미네랄리스는 지난 4일(현지시간) CBO로 김 전크로스보더 최고경영자(CEO)를 영입했다. 이번 인사의 주요 특징은 △글로벌 혁신 △R&D 가속화... 지난 2022년엔크로스보더 파트너스(Cross Border Partners) 최고경영자(CEO)로 재직했다. 미네랄리스는 김 CBO가 차세대 고혈압·만성신장질환 치료제...,https://www.theguru.co.kr/news/article.html?no=64928,
14670,팜크로스,[골든크로스종목] 전진바이오팜·체리부로 등 주가 상승…웅진·원티드랩 등...,"주가를 기술적으로 분석하여 예측하는 지표의 하나인 골든크로스종목에 대한 관심이 증가하고 있다. 16일 주식시장에서 골든크로스종목 중 전진바이오팜 주가는 전 거래일 대비 30% 상승한 8840원에, 체리부로 주가는 전 거래일 대비 2.17% 오른 1740원에 거래를 마쳤다. 아세아제지(+1.44%), LG(+0.84%) 등...",https://www.pinpointnews.co.kr/news/articleView.html?idxno=221664,
14670,팜크로스,춘천팜크로스이노비즈 지정,"건강기능식품을 생산하는 춘천팜크로스(대표 김대선)가 신규 이노비즈(기술혁신형 중소기업)로 지정됐다.강원중소벤처기업청(청장 정영훈)은 18일팜크로스를 방문,이노비즈 확인서를 전달했다.2002년 설립된팜크로스는 지난해 96억원의 매출을 달성한 기능성 식품 제조기업이다. 신관호",http://www.kado.net/?mod=news&act=articleView&idxno=908125,
14670,팜크로스,[포토뉴스]춘천 ㈜팜크로스건강기능식품 전달,"춘천 ㈜팜크로스(대표:김대선)는 지난 3일 춘천시청을 방문해 코로나19 극복을 위한 장학금 1,000만원과 5,000만원 상당의 건강기능식품 1,200개를 전달했다.",http://www.kwnews.co.kr/view.asp?aid=220040500133&s=201,
14670,팜크로스,"보령, 온코크로스AI로 카나브 적응증 찾는다",AI 신약개발 플랫폼 가진 온코크로스에스티팜과 JW중외제약이 활용한 이력 보령이 AI(인공지능) 플랫폼을 활용해 국산 15호 신약 카나브의 적응증을 발굴한다. 보령(대표 장두현)은 AI 신약개발 벤처기업 온코크로스와 공동연구개발 계약을 체결했다고 24일 밝혔다. 이에 따라 온코크로스의 AI 플랫폼이...,https://www.mk.co.kr/article/10659074,
14670,팜크로스,[골든크로스] 에스티팜·케이엔더블유·프리시젼바이오·린드먼아시아 '미소',"골든크로스종목에 에스티팜, 케이엔더블유, 프리시젼바이오, 린드먼아시아 등이 이름을 올렸다. 7일 오전 주식시장에서 에스티팜 주가는 전일 대비... 골든크로스는 단기(20일) 이동평균선이 장기(60일) 이동평균선을 돌파하는 경우의 종목이다. 이는 단기 주가이동평균선이 중장기이동평균선을 아래에서...",http://www.thekpm.com/view.php?ud=2021090709422070495cb205d37d_17,
