company_id,company_name,news_title,news_text,news_url,posted_at
993,포유네트웍스,"익스트림네트웍스, 공식 무선 전문 파트너로 '포유네트웍스' 선정",익스트림네트웍스코리아가 자사의 무선 전문 파트너로포유네트웍스를 선정했다고 밝혔다. 익스트림네트웍스코리아가 자사의 무선 전문 파트너로포유네트웍스를 선정했다고 밝혔다. 고성능 유무선 네트워킹의 선두주자인 익스트림네트웍스는 이번포유네트웍스와의 무선 파트너 체결을 계기로 점진적으로...,http://www.cctvnews.co.kr/news/articleView.html?idxno=18037,
993,포유네트웍스,"KLPGA의 나눔 경영, ‘2023 KLPGA-올포유-레노마 자선골프대회’ 훈훈한 마무...",‘2023 KLPGA-올포유-레노마 자선골프대회’에는 ‘SK네트웍스-서울경제 레이디스 클래식’ 종료 기준 상금순위 50위 이내 중 42명의 선수들과 126명의 아마추어까지 총 168명이 참여했다. 2023시즌 최종전으로 열린 ‘SK쉴더스-SK텔레콤 챔피언십 2023’에서 우승을 차지하며 시즌 4승을 기록하고 다승왕에...,http://www.osen.co.kr/article/G1112222795,
993,포유네트웍스,"익스트림네트웍스코리아, 무선 전문 파트너에포유네트웍스선정",익스트림네트웍스코리아(대표 이근영)가 무선 전문 파트너에포유네트웍스를 선정했다고 11일 밝혔다. 익스트림네트웍스코리아는 이번포유네트웍스와의 무선 파트너 체결을 계기로 제품 공급 및 기술 지원 사업을 강화해 국내 무선 네트워크 시장 수요에 맞는 공격적인 영업을 실행해 나갈 방침이다. 이근영...,https://it.chosun.com/site/data/html_dir/2015/02/11/2015021185025.html,
993,포유네트웍스,"“SNS 소셜마케팅의 선두주자, ‘아이포유네트웍스홍유정 대표’를 만나다”","바로 이제 회사 설립 1주년을 맞게 된 주식회사 아이포유네트웍스이다. 아이포유네트웍스(대표 홍유정, www.i4unetworks.co.kr)는 2010년 10월에 설립, 자본금 3억에 매출규모 10억 대의 아주 빠른 성장을 이룬 기업이다. 현재 직원 수는 총 15명이며, 관련 전문가들로 포진되어 신생 회사지만 현재 SNS를 이용한...",http://www.segye.com/Articles/NEWS/ECONOMY/Article.asp?aid=20111018005519&subctg1=&subctg2=,
993,포유네트웍스,"삼성네트웍스, 흥국생명에 '포유' 서비스","최근 삼성네트웍스(사장 김인)는 IT아웃소싱(ITO) 서비스 '포유(ForYou)'를 흥국생명보험(사장 진헌진)키로 했다. 보험권에서 ING생명에 이은 도입 사례다. 삼성네트웍스는 지난 2008년부터 ING생명보험에 PC 등의 임대공급과 운영관리 및 유지보수를, 2009년부터 흥국금융그룹에 PC, 스캐너, 프린터 등에 대한...",http://www.seoulfn.com/news/articleView.html?idxno=66292,
993,포유네트웍스,삼성네트웍스'포유' 서비스 ‥ 통신망 구축부터 관리까지,"삼성네트웍스는 20일 통신망 구축에 필요한 각종 장비 임대는 물론 운영과 관리까지 책임지는 '포유(ForYou)'라는 종합 매니지먼트 서비스를 선보였다.... 삼성네트웍스관계자는 ""포유를 도입하는 기업은 업무 생산성과 고객만족도를 높이고 비용절감 효과를 거둘 수 있다""며 ""IT 자산 총소유비용을 절감하는...",http://www.hankyung.com/news/app/newsview.php?aid=2008012016091,
993,포유네트웍스,"KLPGA, ‘2023 KLPGA-올포유-레노마 자선골프대회’ 개최…나눔경영 실천",‘2023 KLPGA-올포유-레노마 자선골프대회’에는 ‘SK네트웍스-서울경제 레이디스 클래식’ 종료 기준 상금순위 50위 이내 중 42명의 선수들과 126명의 아마추어까지 총 168명이 참여해 뜻깊은 시간을 보냈다. 특히 이번 대회에는 2023시즌 최종전으로 열린 ‘SK쉴더스-SK텔레콤 챔피언십 2023’에서 우승을...,https://www.sportsworldi.com/newsView/20231115515059,
993,포유네트웍스,"[오늘의 특징주] 미래산업, 빅텐츠, 에이프로젠 그룹, KBG, 이노진, 토마토시...","◇ 다산네트웍스다산네트웍스가 우크라이나 국가기관과 에너지 분야 양해각서를 체결한 소식이 알려지며 강세를 보였다. △다산네트웍스는 10.66% 상승한 5400원에 마감했다. 다산네트웍스는 우크라이나 에너지부 산하 에너지 효율성 및 에너지 절약 국가기관(SAEE)과 에너지 효율화, 탈탄소화 및...",https://www.thekpm.com/news/articleView.html?idxno=169178,
993,포유네트웍스,"삼성네트웍스, 금융권 IT 아웃소싱 서비스 ‘호조’",정보통신서비스기업 삼성네트웍스(대표 김인 www.samsungnetworks.co.kr)는 IT아웃소싱(ITO) 서비스인 ‘포유(ForYou)’를 ING생명보험에 이어 흥국생명보험에도 제공하기로 하는 등 금융권에서 잇단 계약 체결을 이뤄냈다고 밝혔다. ; 삼성네트웍스는 2008년부터 ING생명보험에 PC 등의 임대공급과 운영관리 및...,http://www.datanet.co.kr/news/news_view.asp?id=46095&acate1=0&acate2=6,
993,포유네트웍스,"KLPGA, 올포유·레노마 자선골프대회 개최…나눔 경영 실천","이번 자선골프대회에는 한국여자골프의 레전드인 김영을 포함해 지난 10월 열린 ‘SK네트웍스·서울경제 레이디스 클래식 종료기준 상금 순위 상위자 40명과 한성에프아이에서 초청한 KLPGA 선수 10명, 그리고 150명의 아마추어 등 총 200명이 참여해 뜻 깊은 시간을 가졌다.특히 2년 연속 시즌 6승씩을...",https://www.viva100.com/main/view.php?key=20221115010004389,
