company_id,company_name,news_title,news_text,news_url,posted_at
7795,퓨처웨어,"""착한 소비 해요"" LF 챔피온, '에코퓨처라인 컬렉션' 출시","LF가 수입판매하는 글로벌 스포츠 브랜드 챔피온(CHAMPION)은 지구의 날(4월 22일) 기념 친환경 ‘에코퓨처라인 컬렉션’을 출시했다고 22일 밝혔다.... 챔피온은 1919년부터 액티브웨어, 스웨트 셔츠, 스포츠 브라, 팀 유니폼, 신발, 액세서리 등 남녀를 위한 혁신적인 디자인의 애슬레틱웨어를 전개하고...",https://www.newsis.com/view/?id=NISX20240422_0002707849&cID=13001&pID=13000,
7795,퓨처웨어,"퓨처웍스, 폴란드 홈인테리어 ‘와이즈해빗’ 국내 단독 출시","퓨처웍스는 와이즈해빗의 자체 브랜드 제품과 산하 편집브랜드 'TRE'의 가구, 홈액세서리, 테이블웨어, 키친라인 제품을 순차적으로 한국시장에 선보일 예정이다. TRE는 와이즈해빗이 전 세계의 디자이너들과 함께 작업하는 별도의 산하 편집 브랜드이다. 와이즈해빗은 폴란드 바르샤바에 본사를 둔 디자인...",https://www.ekn.kr/web/view.php?key=20240429028096904,
7795,퓨처웨어,"퓨처웍스, 폴란드 ‘실용적 모듈러 리빙 디자인’ 선보인다","출시한다.퓨처웍스는 30일 “와이즈해빗의 자체 브랜드 제품과 산하 편집브랜드 ‘TRE’의 가구, 홈 액세서리, 테이블웨어, 키친 라인 제품을 순차적으로 한국시장에 선보일 예정”이라고 밝혔다.특히 와이즈해빗의 와이즈키친(Wise Kitchen) 컬렉션은 독일 국제포럼디자인(International Forum Design)...",http://www.kyeongin.com/main/view.php?key=20240430020321114,
7795,퓨처웨어,"퓨처웍스, 폴란드 디자인 브랜드 ‘와이즈해빗’과 전략적 파트너십 체결","와이즈해빗 한국 독점 공급업체인퓨처웍스는 오는 5월부터 와이즈해빗의 자체 브랜드 제품과 산하 편집브랜드 ‘TRE’의 가구, 홈액세서리, 테이블웨어, 키친라인 제품을 순차적으로 한국시장에 선보일 예정이라고 밝혔다. TRE는 와이즈해빗이 전 세계의 디자이너들과 함께 작업하는 별도의 산하...",https://www.dailian.co.kr/news/view/1355331/?sc=Naver,
7795,퓨처웨어,"퓨처웍스, '와이즈해빗'과 전략적 파트너십 체결","이에 따라퓨처웍스는 오는 5월부터 와이즈해빗 자체 브랜드 제품과 산하 편집 브랜드 'TRE'의 가구, 홈액세서리, 테이블웨어, 키친라인 제품을 순차적으로 한국 시장에 선보인다. 25일퓨처웍스에 따르면 와이즈해빗은 폴란드 바르샤바에 기반을 둔 기자인 브랜드다. 감각적 디자인과 지속가능한 기능성...",http://www.ftoday.co.kr/news/articleView.html?idxno=320324,
7795,퓨처웨어,"3월 랜섬웨어공격, 공공기간과 의료분야 중심으로 증가","레코디드퓨처가 랜섬웨어피해 사이트, 정부 기관, 뉴스 보도, 해킹 포럼 및 기타 출처에서 수집한 데이터에 따르면 3월에는 의료 서비스 제공업체에 대한 공격도 소폭 증가한 것으로 조사됐다. 특히 체인지 헬스캐어를 표적으로 삼은 해킹으로 인해 약국과 병원이 몇 주 동안 업무에 차질을 빚었다. 이...",https://www.dailysecu.com/news/articleView.html?idxno=155127,
7795,퓨처웨어,인텔은 네이버 AI '페이스메이커'…‘AI 에브리웨어’ 핵심 ‘개방성’ 검증,"또한 개방형 커뮤니티 기반 소프트웨어와 업계 표준 이더넷 네트워킹을 제공한다. 또한 기업은 싱글 노드에서 클러스터, 슈퍼 클러스터, 수천... 이날 행사에 최수연 네이버 CEO와 하정우 네이버퓨처AI 센터장이 무대에 직간접적으로 오르기도 했다. 네이버는 클라우드에서부터 온디바이스까지...",https://www.ddaily.co.kr/page/view/2024041114364328279,
7795,퓨처웨어,"한국IDC, '제8회퓨처엔터프라이즈 어워드' 참가 신청 시작","단계에 있는 만큼, 이들 조직이 AI 에브리웨어혁명의 리더로서 새로운 혁신을 이끌어 아시아 태평양 지역의 위상을 높일 것으로 기대된다""고 말했다. 어워드 참가 신청 기간은 오는 6월 14일까지이며, 참가 신청 및 보다 자세한 프로그램 내용은 IDC퓨처엔터프라이즈 어워드 웹사이트에서 확인할 수 있다.",http://www.itdaily.kr/news/articleView.html?idxno=220773,
7795,퓨처웨어,"랜섬웨어, 의료·교육기관 대상 공격 진행",의료기관 랜섬웨어공격 동향/ 레코디드퓨처병원 랜섬웨어로 응급환자 이송 장애 일으켜 의료기관을 대상으로 한 공격은 더 큰 피해를 입힌다. 공격자들은 환자 정보를 훔치고 공개할 뿐만 아니라 의료 서비스 자체를 중단시켜 환자의 생명을 위협한다. 미국 미시시피 주 최대 의료 체인인 싱잉 리버 헬스...,https://www.datanet.co.kr/news/articleView.html?idxno=187045,
7795,퓨처웨어,[카드워치] 국민 '퓨처나인 8기 스타트업 모집'·하나 'K리그 대전하나시티즌...,"카드업계는 KB국민카드의 '퓨처나인 8기 참여 스타트업 모집', 하나카드의 '축덕카드 K리그 대전하나시티즌 홈 개막전 이벤트 진행', 우리카드의... 이번 카드 디자인은 명품 디자이너업체 '마자리니(Mazarine)', 미국 법랑웨어브랜드 '크로우캐년'과 콜라보했다. 카드 발급 시 디자인 2종 중 선택 가능하며...",http://www.newswatch.kr/news/articleView.html?idxno=67530,
