company_id,company_name,news_title,news_text,news_url,posted_at
2449,프레도,[사용기] 디지털과 아날로그 교육의 장점만 모았다 ‘플레도 AI’,"프레도의 ‘플레도 AI’는 자신만의 명확한 정체성과 차별점으로 치열한 시장에서 생존력을 확보해나가고 있다. 태블릿만을 활용한 일반적인 학습... 특히프레도는 교육 콘텐츠를 매달 업데이트하고 있다. 가정과 기관에서는 새 콘텐츠를 추가 비용 없이 사용할 수 있으며, 바둑, 체스, AI 서비스도 무료로 이용할...",https://edu.chosun.com/site/data/html_dir/2024/05/10/2024051080162.html,2024-05-10 16:21
2449,프레도,"프레도, 2024 월드IT쇼 참가…에듀테크 혁신기술 소개",에듀테크 스타트업프레도는 17일부터 19일까지 서울 강남구 코엑스에서 열리는 국내 최대 ICT 전시회 ‘2024 월드IT쇼’에 참가해 에듀테크 혁신기술을 소개하고 비즈니스 커넥팅을 성공적으로 마쳤다. 디지털 학습교구 ‘플레도 AI’와 교육 플랫폼 서비스가 주력인프레도는 이 행사에서 서울시와...,https://www.dailian.co.kr/news/view/1352710/?sc=Naver,
2449,프레도,"프레도, 2024 월드IT쇼 참가…에듀테크 혁신기술 소개",스타트업프레도는 지난 17일부터 19일까지 서울 강남구 코엑스에서 열리는 국내 최대 ICT 전시회 '2024 월드IT쇼'에 참가해 에듀테크 혁신기술을 소개하고 비즈니스 커넥팅을 성공적으로 마쳤다고 22일 밝혔다. 디지털 학습교구 '플레도 AI'와 교육 플랫폼 서비스가 주력인프레도는 이 행사에서 서울시와...,https://www.nbntv.co.kr/news/articleView.html?idxno=3015529,
2449,프레도,"프레도, 플레도 AI ‘나만의 그림책 만들기’ 서비스 실시","프레도는 이 부분을 인지하고 아이들이 가진 상상력을 마음껏 담기 위해 ‘이야기 말하기’기능을 통해 통해 그림책을 완성하도록 했다. 그림과... 하지만,프레도는 AI블록의 기술과 온라인과 오프라인을 잇는 차별적인 밸류 채인을 통해 아이들 누구나 쉽게 그림책 작가가 될 수 있고, 비용도 최소한으로...",https://www.mk.co.kr/article/10987733,
2449,프레도,"[에듀플러스]유아동·청소년 '디지털 기기 과의존', 에듀테크 기업 자구책 마...",유아동 디지털 학습 교구 '플레도 AI'를 제작하는프레도는 직접 손으로 블록을 맞추는 학습 방식과 디지털 플랫폼을 융합해 과의존과 두뇌 발달 저하에 대한 우려를 해소했다.프레도관계자는 “디지털 기기를 통해 영상을 시청하는 타 유아동 플랫폼과 달리 플레도 AI는 아이가 직접 손으로 문제를...,https://www.etnews.com/20240429000357,
2449,프레도,"교육업계, 개인 맞춤형 ‘AI 학습 콘텐츠’ 도입 확대","에듀테크 스타트업프레도는 최근 어린이 디지털 학습 교구 플레도 AI의 그림책 만들기 서비스를 선보였다. 3가지 과정을 거치면 누구든 쉽게 그림책을 만들 수 있는데, 먼저 '나는야! 그림책 작가' 콘텐츠 고른 다음 원하는 주제를 선택해 ‘AI 미술 블록’을 본체에 붙여 원하는 대로 그림을 그릴 수 있다....",http://www.betanews.net:8080/article/1466186.html,2024-05-10 12:21
2449,프레도,호찌민에 뜬 K유치원…'라이프 스타일'도 수출한다,에듀테크 기업프레도는 국내 디지털 학습 교구 업계 최초로 베트남에 유초등 학습 프로그램인 ‘플레도 AI’를 수출하는 데 성공했다. 플레도 AI는 1만 여개 이상의 학습 콘텐츠가 탑재돼 영어·수학부터 코딩·챗GPT·경제까지 폭넓은 학습 범위를 갖춘 게 특징이다. 여기에 한국어 콘텐츠가 포함돼 있는 만큼...,https://www.sedaily.com/NewsView/2D7WS0XNT2,
2449,프레도,"""배라 차리면 月 1000만원 가져간다더니…"" 무슨 일?","한때 배스킨라빈스를 추격하던 롯데웰푸드 '나뚜루'는 매장 수가 36개밖에 안 되고 해태제과가 이탈리아 본사를 인수해 들여온 젤라또 브랜드인 '빨라쪼 델프레도'는 30여개, 세계적 아이스크림 브랜드 '하겐다즈'도 매장 수가 10개 안팎에 그쳐 상대가 안 된다. 배스킨라빈스 가맹점주가 가져가는 매출...",https://www.hankyung.com/article/202404307457g,
2449,프레도,日 인스타 게시물 어쩐지 익숙하더라니…수출 상품된 'K라이프스타일',에듀테크 기업프레도는 국내 디지털 학습 교구 업계 최초로 베트남에 유초등 학습 프로그램인 ‘플레도 AI’를 수출하는 데 성공했다. 플레도 AI는 1만 여개 이상의 학습 콘텐츠가 탑재돼 영어·수학부터 코딩·챗GPT·경제까지 폭넓은 학습 범위를 갖춘 게 특징이다. 여기에 한국어 콘텐츠가 포함돼 있는 만큼...,https://www.sedaily.com/NewsView/2D7X6UIKWM,
2449,프레도,"김관석프레도대표 ""전세계 어린이가 즐기는 디지털 학습 교구될 것"" [로그人...","프레도는 디지털 교구를 제작하는 에듀테크 스타트업으로 시작해, 새로운 도약을 준비하고 있다.프레도는 최근 1만개 콘텐츠가 탑재된 '플레도 AI 뉴버전'을 출시하고 베트남 수출 계약을 성사시켰다. IT조선은 김관석프레도대표를 만나 디지털 교구에 대한 설명과프레도의 향후 계획에 대해 들어봤다....",https://it.chosun.com/news/articleView.html?idxno=2023092112462,
