company_id,company_name,news_title,news_text,news_url,posted_at
10033,플래닌,"㈜플래닌, 한남대학교 내 창업카페 H3STORY 오픈","▲ 오픈행사 포스터 ㈜플래닌이 한남대학교 내에 창업카페 H3STORY을 오픈한다. 이번 오픈식은 'H3STORY 오프너 오픈업'을 주제로 오는 27일 월요일 오후 2시 30분~5시까지 진행한다. ▲ H3STORY 창업카페 전경 한남대학교 창업지원단, 한국액셀러레이터협회, ㈜플래닌, 한남대학교 내 창업에 관심있는...",https://www.ccdailynews.com/news/articleView.html?idxno=2193532,
10033,플래닌,"공연예술가 이다슬ㆍ㈜플래닌, 서구에 성금 기탁","공연예술가 이다슬(왼쪽)과 ㈜플래닌(대표 이경수ㆍ왼쪽 세번째),이 서구에 성금을 기탁하고 있다. 사진=대전 서구 제공 대전 서구는 구청 갑천누리실에서 ㈜플래닌(대표 이경수)과 공연예술가 이다슬로부터 300만원을 기탁받았다고 27일 밝혔다. 이날 기탁받은 지원금은플래닌과 이다슬의 공연으로 얻은...",https://daily.hankooki.com/news/articleView.html?idxno=928421,
10033,플래닌,㈜플래닌협력 아티스트 모집,"지역 소극장 아트그라운드플래닌은 2023년 함께 활동할 협력 아티스트를 모집한다. 협력 아티스트는 지역 청년예술가들이 다양한 예술 활동을 시도하고 문화콘텐츠를 만들 수 있도록 ㈜플래닌에서 지원하는 사업이다. 선정 아티스트에게는 공연장 무료대관, 홍보물 제작, 지역 행사 무대공연 출연 혜택이...",http://www.ggilbo.com/news/articleView.html?idxno=958308,
10033,플래닌,"창업지원단 입주기업플래닌, 한남대에 발전기금 기탁",한남대학교 창업지원단 입주기업인 ㈜플래닌이 한남대에 대학발전기금을 기탁했다. (사진제공=한남대학교) 한남대학교 창업지원단 입주기업인 ㈜플래닌이 25일 한남대에 대학발전기금 500만원을 기탁했다. ㈜플래닌은 청년문화기획사로 지역의 청년단체들과 협업해 창의적인 아이디어를 통해 새로운...,http://www.chungnamilbo.co.kr/news/articleView.html?idxno=662527,
10033,플래닌,㈜플래닌H3STORY 창업카페 27일 오픈,"㈜플래닌은 오는 27일 오후 2시 30분 H3STORY에서 한남대학교 창업지원단, 한국액셀러레이터협회와 창업카페 오픈 기념 행사를 개최한다. 'H3STORY 오프너 오픈업'을 주제로 마련된 행사에선 스타트업 발굴과 육성에 매진하고 있는 전화성 씨엔티테크 대표이사의 토크콘서트, 기타리스트 김나린의 핑거스타일...",http://www.ggilbo.com/news/articleView.html?idxno=966206,
10033,플래닌,㈜플래닌달밤소풍 활성화 업무협약,"최근 이경수 ㈜플래닌대표(오른쪽)과 대전시청자미디어센터·베스트푸드트럭충남대전협동조합 관계자들이 달밤소풍 활성화를 위한 업무협약을 체결하고 있다. ㈜플래닌제공 ㈜플래닌은 최근 대전시청자미디어센터, 베스트푸드트럭충남대전협동조합과 지역 축제인 '한 여름밤의 나들이-달밤소풍' 활성화를...",http://www.ggilbo.com/news/articleView.html?idxno=917935,
10033,플래닌,"㈜플래닌, 청춘마이크 대전·세종권역 주관단체 선정","지난해 ㈜플래닌이 비대면으로 개최한 청춘마이크 공연 모습. ㈜플래닌제공 ㈜플래닌이 문화체육관광부가 주최하고 지역문화진흥원이 주관하는 2022 청춘마이크 대전·세종권역 주관단체로 선정됐다.플래닌은 지난해 청춘마이크 사업을 통해 68개 팀을 선정, 코로나19 속에서도 다양한 비대면 공연 영상을...",http://www.ggilbo.com/news/articleView.html?idxno=900427,
10033,플래닌,"㈜플래닌, 2022 청춘마이크 대전·세종 주관단체 선정",3월 중 20팀 모집 예정 ▲ 주식회사플래닌이 2022 청춘마이크 대전·세종권역 주관단체로 선정됐다. 사진은 2021년 비대면으로 진행된 청춘마이크 공연 모습(자료사진). ⓒ플래닌주식회사플래닌이 문화체육관광부가 주최하고 지역문화진흥원이 주관하는 2022 청춘마이크 대전·세종권역 주관단체로 선정됐다....,http://www.ohmynews.com/NWS_Web/View/at_pg.aspx?CNTN_CD=A0002817154&CMPT_CD=P0010&utm_source=naver&utm_medium=newsearch&utm_campaign=naver_news,
10033,플래닌,㈜플래닌청춘마이크 참여 청년예술가 공모,"㈜플래닌은 오는 15일까지 2022 문화가 있는 날 청춘마이크 대전·세종권 참여 청년예술가를 모집한다. 지원자격은 만 19~34세(1987년 1월 1일~2003년 12월...플래닌은 서류 및 동영상 심의, 실연오디션을 통해 청년예술가 20개 팀을 선정할 계획이다. 지원방법은플래닌홈페이지에서 지원신청서와 기획서를...",http://www.ggilbo.com/news/articleView.html?idxno=904820,
10033,플래닌,㈜플래닌청춘마이크 참여단체 추가 공모,"플래닌제공 ㈜플래닌은 2021 문화가 있는 날 청춘마이크 시너지 대전·충남권 사업에 참여할 30개 팀을 추가로 공모한다. 문화체육관광부가 주최하고 지역문화진흥원,플래닌이 공동 주관하는 사업의 신청 자격은 만 19세부터 34세 청년예술가로 학력, 경력, 수상실적 등에 관계없이 재능과 열정을 갖춘 1...",http://www.ggilbo.com/news/articleView.html?idxno=861905,
