company_id,company_name,news_title,news_text,news_url,posted_at
9892,플랜컴퍼니,[Who Is ?] 김준구 미래컴퍼니대표이사,"특히 모로코 정부가 2018년부터 국민 의료서비스 개선을 위한 '헬스플랜2025'를 추진하고 있어 의료 장비 현대화를 위한 수요가 이어질 것으로 회사 쪽은 기대했다. 미래컴퍼니는 레보아이 해외 수출을 이어가고 있다. 2020년 러시아 수출에 성공한 데 이어, 태국, 우즈베키스탄 등에서 판매에 성공했다....",https://www.businesspost.co.kr/BP?command=article_view&num=350524,
9892,플랜컴퍼니,"[더벨][한앤컴퍼니엑시트플랜점검]'상폐 임박' 쌍용C&E, '배당 재개'로 DP...",쌍용C&E는 한앤컴퍼니(이하 한앤코)가 장기 보유하고 있는 포트폴리오 중 하나다. 일각에서는 엑시트가 안되고 있는 상황을 우려하고 있다. 최근... 시장의 관심사는 한앤코의 향후플랜으로 모이고 있다. 잠시 중단된 배당을 언제 재개할 지에 대한 관심이다. 한앤코는 2016년 쌍용C&E 인수 이후 분기...,https://www.thebell.co.kr/free/content/ArticleView.asp?key=202403220959123560102966,
9892,플랜컴퍼니,"플랜원컴퍼니, 한국어린이난치병협회에 기부 실시",마케팅전문기업 ㈜플랜원컴퍼니가 한국어린이난치병협회에 기부했다고 밝혔다. 이번 기부로 ㈜플랜원컴퍼니는 도움이 필요한 희귀난치성질환 아이들 지원을 위한 후원금이 지원된다. ㈜플랜원컴퍼니선행은 이번이 처음이 아니다. △강릉 산불 피해 이웃 위해 성금 △유엔난민기구(UNHCR)에 튀리키예·시리아...,https://www.thefairnews.co.kr/news/articleView.html?idxno=22930,
9892,플랜컴퍼니,미디어 파사드 전문 기업 '에이플랜컴퍼니' 신진작가와 함께 밝히는 서울의 한...,미디어 파사드 전문 기업 '에이플랜컴퍼니'는 지난 12월 14일(목)부터 12월 16일(토)까지 청담 에테르노와 신진 작가들이 손을 잡고 서울의 중심지인 한강을 새롭게 밝혔다. 이는 최근 색다른 작품을 통해 큰 주목을 받으며 미디어 파사드를 선도하고있는 전문 기업 '에이플랜컴퍼니'의 김현호 작가가 함께 하며...,https://www.ksilbo.co.kr/news/articleView.html?idxno=992976,
9892,플랜컴퍼니,㈜에이플랜컴퍼니메세나 활동 인천시에 예술의 빛을 펼치다,"㈜에이플랜컴퍼니는 메세나 활동으로 지자체에 새로운 형식의 예술 작품을 전파하고 있다고 밝혔다. 관계자는 ""낙후된 시설 및 산업 단지의 이미지 개선을 위해 ㈜에이플랜컴퍼니에서 전파한 첫 번째 프로젝트는 인천 남동산업단지에서 시작하였다. 산업단지로 낙후된 시설의 상황과 저녁에는 유동인구가...",http://www.sisunnews.co.kr/news/articleView.html?idxno=207428,
9892,플랜컴퍼니,"플랜원컴퍼니, ‘2024 대한민국 우수브랜드대상' 서비스 온라인마케팅 부문 2...","㈜플랜원컴퍼니가 한경비즈니스가 주최하는 '2024 대한민국 우수브랜드대상'에서 서비스(온라인마케팅) 부문 2년 연속 대상을 수상했다고 밝혔다. '대한민국 우수브랜드 대상'은 각 분야를 대표하는 브랜드들의 제품과 서비스의 우수성, 고객만족도 등을 검증해 소비자들에게 현명한 소비활동의 지표를 제시하고...",http://www.wowtv.co.kr/NewsCenter/News/Read?articleId=A202402280202&t=NN,
9892,플랜컴퍼니,"[더벨][한앤컴퍼니엑시트플랜점검]'캐시카우' SK해운·한온시스템, 투자금...","한앤컴퍼니(이하 한앤코)는 전통적으로 시멘트·자동차 부품·해운 등의 제조업에 투자를 많이 하는 하우스다. '굴뚝 산업'에 투자해 볼트온(Bolt-On)... 두 포트폴리오로 한앤컴퍼니는 1223만GT(Gross Tonnage, 총 톤수)의 운항선대를 보유한 대주주로 우뚝 섰다. 장금상선 계열(573만GT), 대한해운 계열(468만GT)을...",https://www.thebell.co.kr/free/content/ArticleView.asp?key=202403251050364160104076,
9892,플랜컴퍼니,"[더벨][한앤컴퍼니엑시트플랜점검]SK마이크로·루트로닉·대한항공C&D, '볼...","한앤컴퍼니(이하 한앤코)는 그동안 국내에서 다양한 볼트온(Bolt-On)' 전략을 구사하며 시장의 이목을 끌어왔다. 최근에도 SK마이크로웍스, 루트로닉... 한앤컴퍼니관계자는 ""과거 웅진식품 때 경험을 비춰봤을 때 제품 포트폴리오가 다양하면 그만큼 인수 선택지도 넓어진다""며 ""아직 다양한 시나리오를 검토...",https://www.thebell.co.kr/free/content/ArticleView.asp?key=202403190841234540108184,
9892,플랜컴퍼니,"[더벨][한앤컴퍼니엑시트플랜점검]'승기' 잡은 남양유업, 엑시트 선결 조건...","한앤컴퍼니(이하 한앤코)가 홍원식 회장과의 오랜 법적 공방 끝에 남양유업의 경영권을 손에 쥔다. 시장에서는 공개매수 후 상장 폐지, 즉시 매각 등 다양한 PMI(인수 후 통합)와 엑시트 방법론을 전망하고 있다. 한앤코 역시 다양한 시나리오를 검토 중이지만 적자 늪에서 허덕이고 있는 남양유업의...",https://www.thebell.co.kr/free/content/ArticleView.asp?key=202403171539295280105753,
9892,플랜컴퍼니,"한국선불카드, 온더플랜커피컴퍼니선불카드 출시","한국선불카드는 온더플랜커피컴퍼니직영매장에서 사용할 수 있는 선불카드를 출시했다고 27일 밝혔다. 온더플랜커피컴퍼니는 충무로 온더플랜커피랩과 스테인드 커피로스터스 성신여대점, 스테인드 커피로스터스 건대점 매장을 운영 중이며 직접 로스팅한 스페셜티커피와 제과기능장이 직접 굽는 최고의...",https://www.datanet.co.kr/news/articleView.html?idxno=185737,
