company_id,company_name,news_title,news_text,news_url,posted_at
8504,한국페이즈서비스,"[컨콜] 크래프톤, PUBG IP와 인도 시장의 견조한 실적 이어가","매출을 부문별로 살펴보면 PC/콘솔 2,552억 원, 모바일 4,023억 원, 기타 84억 원이며 PUBG:배틀그라운드 IP를 활용한 다양한 라이브서비스를 통해 매출과... 크래프톤은 ESG 위원회 설치를페이즈1, ESG 경영 전략 및 목표 설정과 ESG 경영 이행 성과 점검 및 리스크 관리를페이즈2, 경영 의사결정 내 지속가능성...",http://www.gameshot.net/common/con_view.php?code=GA663b3b3d963d0,
8504,한국페이즈서비스,배그 팬 열기 가득했던 'PWS:페이즈1' 그랜드 파이널,'PWS:페이즈1'의 그랜드 파이널은 상반기한국최고의 배틀그라운드 팀을 가리는 무대였다. 사흘간 15개 매치를 통해 누적 토털 포인트로 16개 팀의... 선수들은 경기가 끝나고 난 이후에도 팬서비스를 잊지 않았다. 경기장 입구를 나서는 팬들에게 사인을 해 주는 등 직접적으로 소통하며 즐거운 추억을...,https://www.tgdaily.co.kr/news/articleView.html?idxno=332160,
8504,한국페이즈서비스,"마일벌스,한국페이즈서비스와 가맹점 바코드 결제서비스 런칭",편리한 포인트경제의 마일리지 통합·결제 플랫폼 마일벌스(대표이사 정진형)가 ㈜한국페이즈서비스(대표이사 전우정)와 가맹점 바코드 결제서비스 연동 계약을 체결하고 11월 30일(화) 오전 11시에 서비스를 런칭한다고 밝혔다. 마일벌스는 ㈜한국페이즈서비스에서 운영하고 있는 바코드 결제서비스 브랜드...,http://isplus.live.joins.com/news/article/article.asp?total_id=24172965,
8504,한국페이즈서비스,"마일벌스,한국페이즈서비스와 가맹점 바코드 결제서비스 런칭","마일벌스,한국페이즈서비스와 가맹점 바코드 결제서비스 런칭 편리한 포인트경제의 마일리지 통합·결제 플랫폼 마일벌스(대표이사 정진형)가 ㈜한국페이즈서비스(대표이사 전우정)와 가맹점 바코드 결제서비스 연동 계약을 체결하고 30일 오전 11시부터 서비스를 런칭한다고 밝혔다. 마일벌스는...",http://www.ggilbo.com/news/articleView.html?idxno=882341,
8504,한국페이즈서비스,"한국페이즈서비스, 모바일 통합상품권 '페이즈기프트' 리뉴얼","한국페이즈서비스가 브랜드 특성과 사용자 소비 성향을 세분화한 모바일 통합 상품권 페이즈 기프트를 리뉴얼 출시한다고 20일 밝혔다. 페이즈기프트는 하나의 상품권을 여러 브랜드에서 원하는 금액만큼 나눠 사용할 수 있는 모바일 상품권이다. 이마트, CGV 등 소비자가 선호하는 브랜드 37개 브랜드와 제휴를...",http://www.wowtv.co.kr/NewsCenter/News/Read?articleId=A202104200340&t=NN,
8504,한국페이즈서비스,"마일벌스·한국페이즈서비스, 디지털 상품권 공급 서비스 계약 체결",마일리지 통합 결제 플랫폼 마일벌스(대표 정진형)는한국페이즈서비스(대표 전우정)와 디지털 상품권 공급 서비스 계약을 체결했다고 19일 밝혔다. 양사는 이번 계약을 통해 마일벌스 앱에서 ▲북앤라이프 도서문화상품권 ▲구글 플레이 기프트카드 ▲신세계이마트상품권 ▲맥도날드 금액권 ▲세븐일레븐...,http://www.datanet.co.kr/news/articleView.html?idxno=156398,
8504,한국페이즈서비스,"마일벌스-㈜한국페이즈서비스, 디지털 상품권 공급 서비스 계약 체결","마일리지 통합 결제 플랫폼 마일벌스(대표이사 정진형)는 ㈜한국페이즈서비스(대표이사 전우정)와 디지털 상품권 공급 서비스 계약을 체결하였다고 2월 19일 밝혔다. 양사는 이번 계약을 통해, 마일벌스 앱에서 북앤라이프 도서문화상품권, 구글플레이 기프트카드, 신세계이마트상품권, 맥도날드 금액권...",https://news.joins.com/article/olink/23590324,
8504,한국페이즈서비스,"다비치안경, 고객 편의 강화한다…한국페이즈서비스와 디지털 상품권 공급 계...","다비치안경체인(대표 김흥수)이 고객 편의를 강화하고자한국페이즈서비스(대표 전우정)와 현금처럼 사용할 수 있는 디지털 상품권 서비스를 시작한다. 다비치 안경 최초로 선보이는 디지털 상품권은 '1만원권', '3만원권', '5만원권'으로 구성됐다. 다비치안경 전국 가맹점 어디서나 현금처럼 사용할 수 있으며...",http://www.e2news.com/news/articleView.html?idxno=231791,
8504,한국페이즈서비스,"“가상자산으로 책 구매”…밀크파트너스,한국페이즈서비스와 맞손",이투데이=박소은 수습 기자 | 블록체인 기반 포인트 통합 플랫폼 ‘밀크(MiL.k)’를 운영 중인 밀크파트너스가한국페이즈서비스와 서비스 이용처 다각화를 위한 사업 협력 계약을 체결했다고 27일 밝혔다.한국페이즈서비스는 도서문화상품권 ‘북앤라이프’를 발행하는 기업이다. 2만여 개가 넘는 대규모...,https://www.etoday.co.kr/news/view/1967495,
8504,한국페이즈서비스,"다비치안경,한국페이즈서비스와 현금처럼 쓰는 '디지털 상품권' 공급 서비스...","다비치안경체인(대표 김흥수)은한국페이즈서비스(대표 전우정)와 디지털 상품권 공급 관련 계약을 체결, 현금처럼 쓸 수 있는 전용 디지털 상품권 서비스를 시작한다. 다비치안경 디지털 상품권은 '1만원권', '3만원권', '5만원권'으로 구성돼 있으며, 다비치안경 전국 가맹점 어디서나 현금처럼 사용할 수 있다....",http://www.seoulwire.com/news/articleView.html?idxno=440506,
