company_id,company_name,news_title,news_text,news_url,posted_at
4122,한국이러닝개발원,"퇴직연금 가입자 교육 전문기관한국이러닝인재개발원, ‘퇴직연금 가입자 교...",최근 고용노동부로부터 퇴직연금 가입자 교육 전문기관 적합 통보를 받은한국이러닝인재개발원이 퇴직연금 가입자 교육 운영을 통해 가입자를 대상으로 한 교육 서비스를 제공한다고 23일 밝혔다. 근로자퇴직급여보장법 개정사항에는 퇴직연금 전문기관설립에 대한 법적 토대가 포함되어 있다. 동 법 및...,https://www.ekn.kr/web/view.php?key=20240423020092484,
4122,한국이러닝개발원,"한국이러닝인재개발원, 학교폭력 온라인 교육 콘텐츠 출시","한국이러닝인재개발원은 최근 '학교폭력 바로 알고 대응하기' 학교폭력 온라인 교육 콘텐츠를 출시했다고 18일 밝혔다. 이번 학교폭력 온라인 교육 콘텐츠는 가해자, 피해자, 교권침해 3가지 콘텐츠로 구성되며 교육청 학교폭력대책심의위원회 심의위원 권동영 변호사가 온라인으로 쉽게 이해할 수 있도록...",https://www.ekn.kr/web/view.php?key=20240318020027088,
4122,한국이러닝개발원,"고용노동부 인증이러닝기관,한국이러닝인재개발원","한국이러닝인재개발원이 ‘2024한국소비자만족지수 1위’ 교육(법정의무교육) 부문을 6년 연속 수상했다.한국이러닝인재개발원은 고용노동부에서 정식으로 인정받은 위탁기관이다. 온라인 교육에 오랜 노하우를 바탕으로 산업안전보건교육 위탁기관, 직장 내 장애인인식개선교육 지정기관, 성희롱예방교육...",https://magazine.hankyung.com/business/article/202402053816b,
4122,한국이러닝개발원,"한국이러닝인재개발원, 2월 법정의무교육 온라인 진행","한국이러닝인재개발원은 2월 온라인으로 법정의무교육을 진행하고 있다고 5일 밝혔다. 법정의무교육은 연 1회, 1시간 꼭 받아야 하는 필수교육이다. 4대 법정의무교육에는 성희롱 예방교육, 개인정보보호법 교육, 장애인 인식 개선교육, 퇴직연금교육이다. 성희롱예방교육은 연간 1회 이상의 교육이 실시되고...",http://www.wowtv.co.kr/NewsCenter/News/Read?articleId=A202402050255&t=NN,
4122,한국이러닝개발원,"달리기 땀 흘린 뒤, 시원한 맥주 벌컥벌컥…이곳 나빠집니다 [건강한 가족]","효과 높이는러닝가이드 달리기는 다른 운동에 비해 진입 장벽이 낮다. 고가의 장비를 갖추지 않아도 되고 멀리 떠날 필요도 없다. 두 발과 운동화만... 도움말=박계영 한양대병원 가정의학과 교수,전상우 이대서울병원 정형외과 교수, 참고 자료=보건복지부·한국건강증진개발원『한국인을 위한 달리기...",https://www.joongang.co.kr/article/25248496,2024-05-11 01:00
4122,한국이러닝개발원,"한국이러닝개발원, 네트러닝홀딩스 자회사 레코스와 업무협약 체결",국내 이러닝 전문 통합 솔루션 회사한국이러닝개발원(대표 최지훈)은 지난 12일 2023 상반기 붐업코리아 수출 상담회 코엑스 A Hall에서 레코스(대표 노원석)와 일본 진출 및 국제표준 오픈 배지 글로벌 교육 환경 구현을 위한 전략적 업무협약을 체결했다고 17일 밝혔다. 이번 전략적 파트너십을 통해 양사는...,http://www.it-b.co.kr/news/articleView.html?idxno=67385,
4122,한국이러닝개발원,"한국이러닝인재개발원, 기업직업훈련카드로 중소기업 직원교육 진행","한국이러닝인재개발원관계자는 ""비용 때문에 직원교육을 망설이는 업체들이 기업직업훈련카드 도움을 받아 교육에 참여하고 있다""며, ""우선지원 기업을 대상으로 선착순 HRD 홈페이지에서 신청해야 교육에 참여할 수 있다. 기업직업훈련카드 우선지원대상 업체는 교육비 100%를 지원한다""고 말했다....",https://www.ekn.kr/web/view.php?key=20240111010003215,
4122,한국이러닝개발원,"한국이러닝인재개발원, 11월 법정의무교육 지인 추천 이벤트 실시","한국이러닝인재개발원은 11월 법정의무교육 지인 추천 이벤트를 진행하고 있다고 1일 밝혔다. 이번에 진행되는 지인 추천 이벤트는 누구나 관계없이 참여할 수 있으며, 본인이 추천한 기업에서 법정의무교육을 신청하면 상품권을 선물하는 이벤트다.한국이러닝인재개발원관계자는 ""11월 중 내가 추천한...",https://www.job-post.co.kr/news/articleView.html?idxno=88135,
4122,한국이러닝개발원,"한국이러닝인재개발원, 9월 산업안전보건교육 온라인 진행",한국이러닝인재개발원은 3분기 마지막 달인 9월 온라인 산업안전보건교육을 진행하고 있다고 19일 밝혔다. 산업안전교육은 오프라인 교육 16시간 또는 온라인 교육 8시간과 오프라인 교육 8시간을 받아야 된다. 교육 대상자는 상시근로자 5인 이상 사업장 전부 해당된다. 근로자 산업안전보건교육은...,http://www.wowtv.co.kr/NewsCenter/News/Read?articleId=A202309190219&t=NN,
4122,한국이러닝개발원,"한국이러닝개발원-와이드브레인, 공동사업 강화 위한 업무협약(MOU) 체결",종합 이러닝 솔루션 기업인 (주)한국이러닝개발원이 메타버스 전문 기업 (주)와이드브레인과 공동사업 강화를 위한 업무협약(MOU)를 체결했다고 16일 밝혔다. 업무협약 및 체결식에는 (주)한국이러닝개발원최지훈 대표와 정혜원 (주)와이드브레인 대표가 참석했다.한국이러닝개발원은 그간 구독형 이러닝 학습...,https://www.dailysecu.com/news/articleView.html?idxno=134305,
