company_id,company_name,news_title,news_text,news_url,posted_at
7667,현진하이테크,"㈜현진하이테크, 교육장비 분야 기술 선도업체","㈜현진하이테크(대표 정금수)는 1999년 설립, 전자제품을 제조하고 정보 통신공사를 전문으로 하는 기업이다. 20여 년간 멀티강의실과 어학실, 시청각실, 음향·영상시스템을 개발하고 있다. 전자제품 제조와 정보통신 분야의 다양한 경험과 전문인력을 토대로 교육장비 분야 기술 선도 업체로 자리잡았다....",http://www.jndn.com/article.php?aid=1644742516331442004,
7667,현진하이테크,"㈜현진하이테크, 교육 환경 개선·미래 정보 인재 육성","㈜현진하이테크(대표 정금수)가 제2회 중소기업 혁신경영대상에서 광주전남중소벤처기업청장상을 받았다. 1999년 설립된 이 회사는 전자제품을 제조하고 정보 통신공사를 전문으로 하는 기업이다. 20여 년간 멀티강의실과 어학실, 시청각실, 음향·영상시스템을 개발하고 있다. 전자제품 제조와 정보통신...",http://www.jndn.com/article.php?aid=1613293570311717004,
7667,현진하이테크,[작지만 강한기업] (주)현진엔지니어링..'하이테크'로 자체브랜드 구축,"현진엔지니어링은 만두제조기기에 관한 한 국내 어느 업체와도 비교를 거부하 는 강한 자부심으로 똘똘 뭉쳐있다. 이 회사가 생산하는 자동만두성형기는 동급 중에서 가장 ""하이테크' 한 기계로 잘 알려져 있다. 여기에는 눈에 보이지 않는 기술력이 집약돼 있다. 고형물이 많은 만두 속 충진이 가능하도록...",https://n.news.naver.com/mnews/article/015/0000676679?sid=101,
7667,현진하이테크,"[11일 일자리 채용 공고/종합] 해운대두산1차아파트, 서산현진에버빌, 의왕내...","FINTECHPOST 해운대두산1차아파트, 서산현진에버빌, 의왕내손 삼성래미안아파트 外 채용 공고. 11일 해운대두산1차아파트는 기술과장 직원 채용... ▲ 아파트명(직원채용) : 에이스하이테크, 담당업무 및 직책 : 기전직, 근무지역 : 경기 군포시(당정동 ). 에이스하이테크, 원서마감일 : 2019년 12월 13일...",http://www.fintechpost.co.kr/news/articleView.html?idxno=94380,
7667,현진하이테크,충북 제천 '현진에버빌'… 실 입주금 2000만 원대,"더불어 제2바이오 밸리(하이테크밸리, 39만여평) 부지는 현재 분양 중이고 일양약품(계약체결) 등의 대기업 위주의 유치 계획이 진행될 것이라고 말했다. 오는 9월에는 한방 엑스포도 개최될 예정인 점도 눈여겨 볼만하다.현진에버빌의 보다 상세한 분양사항은 분양사무소(043-642-3890)로 문의하면 된다....",https://n.news.naver.com/mnews/article/003/0003203185?sid=101,
7667,현진하이테크,[작지만 강한 기업] '(주)현진엔지니어링' ‥ '하이테크'한 식품기계,"현진엔지니어링은 만두제조기기에 관한 한 국내 어느 업체와도 비교를 거부하 는 강한 자부심으로 똘똘 뭉쳐있다. 이 회사가 생산하는 자동만두성형기는 동급 중에서 가장 '하이테크' 한 기계로 잘 알려져 있다. 1시간에 14,000/hr의 생산능력을 갖춘 이 제품은 기존에 나와있는 기계들에 비 해 제조성능이...",https://n.news.naver.com/mnews/article/015/0000669764?sid=101,
7667,현진하이테크,"[동두천24시] 동두천시, 고용노동부 장관에 '폴리텍 동두천교육원 유치' 건의...","건의서에 따르면 폴리텍 동두천 교육원 유치 시 매년하이테크3개학과 60명을 양성할 수 있고 신중년 및 경력단절 여성의 재취업에도 큰 역할을 할... ◇동두천시 생연1동, 특화사업 취약계층 대상 '무료 방역서비스' 실시 생연1동 행정복지센터는 10일현진CS와 업무 협약에 따라 관내 취약계층을 대상으로 무료...",http://www.sisajournal.com/news/articleView.html?idxno=280821,
7667,현진하이테크,"한국전자산업협동조합, ICT 전자·제조 발전 공로 23곳 선정","마지막으로 한국전자산업협동조합 이사장 표창은 △삼원정공(팀장 홍석민) △삼형전자(부장 이상수) △엠에스텔레콤(부장 남기호) △현진하이테크(과장 나한영)에 전해졌다. 한편 이날 행사에서는 기업 경쟁력 강화와 경영혁신을 위한 '전진대회 결의문'을 채택했으며, 정기총회에서는 2021년도 사업보고 및...",http://www.koit.co.kr/news/articleView.html?idxno=93949,
7667,현진하이테크,"[29일 낙찰/계약 동향] 서남지역본부 핵심부품소재센터 옥상 방수공사, 2019년...","▲ 낙찰업체 : 주식회사현진하이테크, 계약금액 : 55,888,000(원), 계약명 : 마한교육문화회관 체육관 조명시설 수선 전기공사. 계약기관 : 전라북도교육청, 계약일자 : 2019-11-26, 계약방법 : 수의계약, 발주처(수요기관) : 전라북도교육청, 계약 : 주식회사현진하이테크- 전라북도교육청 (마한교육문화회관...",http://www.fintechpost.co.kr/news/articleView.html?idxno=92214,
7667,현진하이테크,제 58회 납세자의날 모범납세자(성실납세사업자) 포상명단,영민하이테크노기영 대표이사 ■지방청장표창 삼양마린 주식회사 노승철 대표이사 ■지방청장표창현진바이오 노홍진 대표 ■지방청장표창 두진규치과의원 두진규 병원장 ■지방청장표창 한우테크 류제국 대표자 ■지방청장표창 문소리 문소리 대표 ■지방청장표창 대승메디칼 문승수 대표 ■지방청장표창...,http://www.intn.co.kr/news/articleView.html?idxno=2034197,
