company_id,company_name,news_title,news_text,news_url,posted_at
4265,휴엔시스템,"휴온스메디케어, 공간멸균기휴엔IVH ER 소방안전박람회서 이목 집중",특히 코로나19 등 감염병 위중증 환자 이송 후에는 구급차량 소독이 필수적인데 매번 2~3시간 이상을 구급대원이 직접 구급차량 내부를 닦는 방식으로 소독을 하고 있어 차량 운행 효율이 떨어지고 있는 현 상황에서 전자동시스템공간멸균기휴엔IVH ER은 30분 내외로 멸균 처리 시간이 짧고 효과적 멸균이...,http://www.getnews.co.kr/news/articleView.html?idxno=562030,
4265,휴엔시스템,[KLPGA]휴엔케어와 공식 방역솔루션 서플라이어 계약,"이번 시즌부터는 삼양인터내셔날과의 서플라이어 계약을 통해 기존시스템에 ‘휴엔케어 전문 방역 서비스’의 도움을 추가로 받게 됐다. 내일부터 나흘간 열리는 2021 KLPGA투어 개막전 ‘롯데렌터카 여자오픈’부터 KLPGA투어 모든 대회에휴엔케어 전담 방역팀을 파견하고, 비대면 안면인식 열화상...",https://www.geconomy.co.kr/news/article.html?no=30891,
4265,휴엔시스템,"KLPGA,휴엔케어와 방역 솔루션 계약","이번 시즌부터는 삼양인터내셔날과의 서플라이어 계약을 통해 기존시스템에 ‘휴엔케어 전문 방역 서비스’의 도움을 추가로 받게 됐다. 당장 이번 주 제주도에서 열리는 KLPGA투어 개막전인 ‘롯데렌터카 여자오픈부터 KLPGA투어 모든 대회에휴엔케어 전담 방역팀을 파견하고, 비대면 안면인식 열화상...",http://news.heraldcorp.com/sports/view.php?ud=202104080814051909418_1,
4265,휴엔시스템,"휴온스메디텍, 미국 플로리다 의료기기 전시회서 공간멸균기 '휴엔IVH ER' 등...","대부분의 내시경 소독기들은 세척액을 재사용하는 경우가 많아 교차감염 발생의 우려가 있지만, '휴엔싱글'은 1회용 소독제를 사용해 교차 감염의 위험을 차단하고 편의성을 높였다. 더마샤인 프로는 더마샤인 시리즈의 최신 모델로, 업그레이드된 압력 감지 주사시스템과 세분화된 약물 주입량 및...",http://www.worktoday.co.kr/news/articleView.html?idxno=38013,
4265,휴엔시스템,"휴온스그룹, 계열사 합병 확대…미래 전략 사업 경쟁력 강화 채비",휴엔IVH ER은 전자동시스템으로 되어 있어 30분만에 차량 내부 전체 멸균이 가능하기 떄문에 구급대원들이 직접 2~3시간 동안 닦아서 해왔던 소독 시간을 대폭 줄여주면서 감염병 이송 현장에서 매우 신속하게 사용되고 있다. 미용 영역은 3세대 자동압력주입장치 '더마샤인 프로'가 책임진다. 더마샤인...,http://www.press9.kr/news/articleView.html?idxno=52148,
4265,휴엔시스템,"휴온스메디텍, '소독·멸균·에스테틱·치료' 포트폴리오 갖춰",휴엔IVH ER은 전자동시스템으로 되어 있어 30분 만에 차량 내부 전체 멸균이 가능하기 때문에 구급대원들이 직접 2~3시간 동안 닦아서 해왔던 소독 시간을 대폭 줄여주면서 감염병 이송 현장에서 매우 신속하게 사용되고 있다.휴엔IVH...,http://www.bosa.co.kr/news/articleView.html?idxno=2169389,
4265,휴엔시스템,"서울시, 'AI 미세먼지 예측시스템' 특허 등록 완료",서울시보건환경연구원은 국내 지자체 중 최초로 인공지능(AI)을 활용한 미세먼지 예측시스템을 개발해 올해 특허 등록을 완료했다고 18일 밝혔다. 특허... 연구원은 이러한 문제를 해결하고 정확한 미세먼지 정보를 제공하기 위해 ㈜휴엔릭스와 함께 관련 기술을 개발했다. 최예덕 연구사는 지난해 12월...,http://www.newsis.com/view/?id=NISX20231215_0002560442&cID=10201&pID=10200,
4265,휴엔시스템,[르포] 오토데스크판 챗GPT 공개…AI 접목 Design&Make 고도화,"국내에서는 기계ㆍ장비 분야 ‘스맥’과 플랜트 소프트웨어 분야 ‘휴엔시스템’ 등 4개사가 참여했다. 스맥은 클라우드와 연계해 부품 생산 장비를 공급하는 과정을 설명했고,휴엔시스템은 플랜트 배관 설계 등에 활용되는 3D 소프트웨어를 선보였다. 라스베이거스(미국)= wiss@",https://www.dnews.co.kr/uhtml/view.jsp?idxno=202311150644562140690,
4265,휴엔시스템,[제약 소식]휴엔IVH ER·헥시와입스 선보인 휴온스메디텍… CCM 재인증에 도...,"뷰어스 탁지훈 기­자 휴온스그룹 자회사인 휴온스메디텍은 최근 대구 EXCO에서 열린 국제소방안전박람회에 참가해 자체개발한 공간멸균기휴엔IVH... 현대약품은 지난 2008년, 제약업계 최초로 CCM 인증을 받은 이후, Office365 내 TEAMS시스템을 도입했고, 실시간 소비자 상담시스템을 개발, 일반의약품...",http://theviewers.co.kr/View.aspx?No=2523831,
4265,휴엔시스템,"플랜트 조선 컨퍼런스 2024, 백범김구기념관서 21일 개최","또한 메가존클라우드, 모라이, 에이치디씨(HDC), 스노우플레이크, 위프코,휴엔시스템, 소프트힐스에서는 부스를 꾸며 최신 플랜트 조선 분야의 제품과 기술들을 선보일 예정이다. 또한 캐드앤그래픽스 지식방송 CNG TV에서는 플랜트 조선 컨퍼런스 2024 프리뷰 방송으로 1월 22일 이경호 교수(인하대), 박재만...",https://www.hankyung.com/article/2024021312987,
