,company_name,company_id,review_text
0,(주)스포카,163,젊고 직원에 대한 배려 많고 자유로운 분위기 대체적으로 부드러운 분위기
1,(주)스포카,163,사람을 중요하게 여김 뽑을 때도 교육시킬 때도 최선을 다함. 스타트업의 긍정적인 면을 가져가려는 노력
2,(주)스포카,163,수평적인 사무실 분위기 동료들 연령대가 낮아 밝은 분위기
3,(주)스포카,163,자기개발하고 연차자유로운점 일단입지가너무좋넹ㆍ 쌍방향소통이많아요
4,(주)스포카,163,각자 열심히하고 능력있는 사람들이 많다. 커뮤니케이션이 활발하다.
5,(주)스포카,163,같이 일하는 동료가 열심히 하려는 사람이 그나마 많은 것은 장점 복지포인트 60만원 월 2회 재택 (목금만 가능)
6,(주)스포카,163,구성원들이 젊다. 변화를 시도할 생각은 있지만 실행에 어려움이 많다.
7,(주)스포카,163,복지가 좋앗고. 자기 개발에도 많은 신경을써줫음 능력인정 회사
8,(주)스포카,163,스타트업 기업문화로 위아래 위계 질서에서 비교적 자유로운 편
9,(주)스포카,163,"그래도 비교적 수평적인 기업 문화, 마지막 남은 도도카트에 대한 투자"
10,(주)스포카,163,안정적이고 걱정없이 일할수있음   편안한 분위기…..
11,(주)스포카,163,연차 눈치 안보고 언제든 사용 가능 워라밸 지킬 수 있음
12,(주)스포카,163,대체적으로 젊고 밝은 분위기 체계적이진 않지만 신입 교육이 꼼꼼하게 진행
13,(주)스포카,163,"오래 전 퇴사해서 현재 분위기가 어떻게 바꼈는지 알 수 없으나, 재직 당시 또래가 많아서 자유로운 분위기가 있었습니다. 비교적 빠른 결정 및 액션을 할 수 있었습니다."
14,(주)스포카,163,"유연한 출퇴근 가능해서 코로나 아니어도 재택가능, 자기 프로젝트 기술은 알아서 선택 가능, 회식비도 1달마다 나오고 월급 주 금요일에는 자동으로 오후 반차가 써짐."
15,(주)스포카,163,"동료들이너무좋다 워라벨도좋은편이고, 하는업무에비해 월급이적지안타"
16,(주)스포카,163,"기업 문화가 좋은 편이고 경영진들이 합리적이다. 일하는 동료들이 협조적이고 나이스함, 프로세스나 체계를 만들어가는 중"
17,(주)스포카,163,"워라벨은 여기만큼 좋은 회사는 없음 , 같은 위치의 동료들과 친해지기 좋음"
18,(주)스포카,163,눈치 안보고 재택근무 할 수 있음. 일만 잘하면 터치 안함. 00님이라고 하는 호칭 문화 좋음
19,(주)스포카,163,스타트업의 장점은 다 가지고 있음. 수평적이고 눈치 안보는 문화. 같이 일하는 동료들이 정말 좋음.
20,(주)스포카,163,연차 눈치 안보고 쓸수 있습니다 도서 구입비 지원 됩니다 교육비도 나와요
21,(주)스포카,163,"으쌰으쌰하는 분위기, 젊은 구성원들이 뿜어내는 에너지정도?"
22,(주)스포카,163,"1. 야근이 거의 없고, 연차 눈치 안봐도 됨 2. 구성원들이 젊어서 덩달아 나도 젊어 지는 것 같음 3. 1인 다역을 경험해볼수 있는 흔치 않은 기회임 4. 내일만 잘하면 믿고 맡기는 편이었던걸로 기억함"
23,(주)스포카,163,대표가 스마트하고 코인사업 등 빠르게 사업 확장과 의사결정을 함
24,(주)스포카,163,다같이 해결책을 찾아나가려고 노력하고 무엇보다도 사람을 소중하게 생각하는 조직이라 훈훈한 분위기입니다
25,(주)스포카,163,"연차 윗사람 눈치 안보고 마음대로 쓸 수 있음 자율 복장, 출근시간이 10시인 점"
26,(주)스포카,163,영어 호칭을 쓴다. 개발자로서 성장하기 좋다. 서로 존중하는게 느껴지고 자체 컨퍼런스도 연다.
27,(주)스포카,163,연차 편하게 쓸 수 있음 업무 강도가 높지 않음 수직적이지 않음
28,(주)스포카,163,서로간의 진행하는 업무들을 모두 투명하게 공유하고 피드백을 주고 받습니다. 팀원들이 친절하고 사례깊습니다.
29,(주)스포카,163,연차를 윗사람 눈치 보지않고 사용 가능. O2O 비지니스의 구조를 잘 알수 있는 곳.
30,(주)스포카,163,여러 각도에서 더 안전하고 일 잘 할 수 있는 환경을 만들기 위해 노력하는 동료들이 많았다. 워라밸이 나쁘지 않다.
31,(주)스포카,163,상당히 개방된 기업 문화 수평적인 구조 같이 일하는 사람들이 좋음
32,(주)스포카,163,역에서 멀지않음. 복장터치 x. 선릉역일대는 다른 강남업무지역보다 밥값평균시세가 싼편. 워라밸은 좋은편.
33,(주)스포카,163,복지가 좋음. 연차 눈치 안보고 써도 되고 공휴일 쉬고 도도데이라고 월급 받는 주 금요일은 조기 퇴근인 것도 굉장한 메리트.
34,(주)스포카,163,그땐 이상하게 좋은 인재풀이 많았다. 널널했다. 알아서 하면 되었다.
35,(주)스포카,163,스타트업 특유의 뭔가 일을 만들어가는 느낌 활발한 의사소통이 가능하고 창업 초기에 경험할 수 있는 생동감 있음
36,(주)스포카,163,"같이 일하는 동료들이 모나지 않음. 연차를 자유롭게 사용할 수 있고, 고용 형태 상관없이 서로 존중해주는 마인드."
37,(주)스포카,163,전체적인 분위기는 수평적이고 개인이 알아서 할 수 있음
38,(주)스포카,163,"스타트업 특유의 젊은 분위기, 에너지 넘치던 사무실 컬쳐, 자유롭다"
39,(주)스포카,163,"수평적인 분위기와 자율출근/원격근무 제도 등, 크게 높지는 않은 업무강도"
40,(주)스포카,163,자유로운 분위기 평균 연령이 낮아 활기참 위치가 좋음 업계에서 제일 고객수가 많은 서비스 판매
41,(주)스포카,163,개인적으로는 10시 출근 좋았고 해볼 수 있는거 다해봐서 재밌었다. 사람들도 좋고 편안한 분위기에 재밌는 일을 한다는 생각으로 행복하게 생활함
42,(주)스포카,163,수평적인 사무실 분위기(개발팀 한정) 새로운 기술을 배울 기회가 많음 개인의 의사가 존중됨 회식강요 없음 야근 적음
43,(주)스포카,163,"수평적인 기업문화, 체계적으로 잘 갖춰진 협업 시스템 등"
44,(주)스포카,163,"일반 매장들에 포인트 적립 서비스를 제공함으로써, 길을 다니다 당사의 제품을 보면 자부심을 느낄수 있었음"
45,(주)스포카,163,대체적으로 자유로운 분위기로 젊은 층으로 구성되어있음. 스스로 해결해 나아가야 하는 부분이 많아 사회 초년생에게 어려움이 될 수 있으나 잘 활용하면 장점으로 발휘될 수 있음
46,(주)스포카,163,"복지, 교육, 리모트 근무 등 요즘 좋은 스타트업 복지는 다 있어서 행복하다"
47,(주)스포카,163,다른 팀은 모르겠으나 디자인 팀의 경우 분위기가 좋았고 서로에게 경청하고 함께 일하며 일하는 방식에 있어서도 성장한다는 느낌이 있었음. UX/UI 분야에 대해서도 실용적인 공부가 가능하다.
48,(주)스포카,163,연차를 눈치 안보고 사용할 수 있음. 도서구입비나 교육비 지원. 10시 출근. 야근이 거의 없음.
49,(주)스포카,163,연차를 윗사람 눈치 안보고 쓸 수 있음 출근시간이 10시로 출근이 편리함 업무 자유도가 높아 개인이 스케쥴 정리 함께 일하는 사람들이 매우 좋음
50,(주)스포카,163,연차 눈치안보고 쓸 수 있음. 사내 분위기는 아주 좋음
51,(주)스포카,163,좋은 사람들이 많이 있다. 사람들간 의사소통을 중요시 여긴다.(신입 사원도 가능) 복장이 자유롭다.
52,(주)스포카,163,"미국식으로 전직원이 모두 수평적 관계이며, 닉네임제도를 적용해 부름에도 꺼리낌이 없습니다.하여 평등한 관계속에서 일합니다"
53,(주)스포카,163,"서로 존대하고 존중하는 문화, 개인의 발전을 존중하고 지원해줌 (사내 이벤트, 컨퍼런스 지원 등) 주어진 업무 이외에도 새로운 아이디어를 제시하면 잘 받아줌"
54,(주)스포카,163,"직원 개개인들의 개성이 뛰어나다. 함께 하는 동료를 보며 동기부여하는 이들이 많다.  스케줄상 문제가 없으면 출퇴근, 외출이 자유롭다. 이를 잘 활용해라"
55,(주)스포카,163,연차를 눈치 안보고 쓸 수 있따는 점 그리고 자유롭다는 점 사람들이 좋다
56,(주)스포카,163,"각 팀들과 팀원, 팀들끼리의 커뮤니케이션 등이 굉장히 자유롭고 분위기가 좋다"
57,(주)스포카,163,일단 분위기가 편하고 출근시간이 10시까지여서 괜찮은 편
58,(주)스포카,163,무엇보다 좋은 동료들. 또 디자인적으로 여러가지 시도를 해볼 수 있음. 프로덕트 외적으로도... 플렉서블 근무와 리모트 근무가 가능. 업계 1위라는 나름의 자부심. 도서구입비 지원.
59,(주)스포카,163,열정 가득한 젊은이들이 많아 분위기는 밝고 나름 수평적인 분위기(팀마다 다르긴함)
60,(주)스포카,163,"부서마다 다르겠지만 연차 쓰는데 눈치 보이진 않음, 이것도 부서 바이 부서겠지만 분위기 나름 수평적, 기업 문화 나쁘지 않음."
61,(주)스포카,163,"자유로운 분위기 모난 사람이 없음, 업무 강도가 심하지 않고 자유로운 분위기"
62,(주)스포카,163,"유연하고, 빠른 의사결정이 있으며, 유능한 개발자들이 있음"
63,(주)스포카,163,아주 수평적인 기업문화를 가지고 있습니다. 직원 복지가 엄청 뛰어난 것은 아니지만 사측에서 최대한 배려해주려는 의도는 보입니다. 휴가등이 자유로운 편이고 사원끼리 서로 존중하는 건강한 문화를 가지고 있습니다.
64,(주)스포카,163,"연령대가 젊기에, 자유로운 분위기. 업무강도가 심하지 않음."
65,(주)스포카,163,수평적인 조직 문화로 자유롭고 젊은 분위기에서 일을 배울 수 있다. 연차 사용이 자유롭다. 복지의 경우에도 점점 발전하는 모습을 보여줬다.
66,(주)스포카,163,"자유로운 분위기, 젊은 연령대, 성과에 따른 보상, 동종 업계 대비 나은 서비스와 개발부가 뛰어남"
67,(주)스포카,163,"직원들이 대부분 좋은편임, 경쟁적이기보다는 서로 배려하고 의논하는 분위기, 비교적 수평적인 조직 문화, 휴가 쓰는데 터치 안함, 대부분의 직원이 칼퇴를 함, 일과 삶의 균형이 가능함. 영업은 매월 인센티브가 있어 본인 하기 나름임, 소소한 복지들을 챙겨주고 월 1회 조기 퇴근 하는날 있음."
68,(주)스포카,163,연차 자유로움. 님 호칭. 좋은 팀워크와 상사분들이 있다는 점이 장점이다. 자유로운 분위기를 선호한다면 추천
69,(주)스포카,163,출퇴근 시간이 좋으면 야근 강요 없음. 자유로운 분위기로 일 할수 있음
70,(주)스포카,163,좋은 사람들이 많은 편 주체적인 직원을 좋아하기 때문에 본인이 많은걸 해보고 싶다면 충분히 시도해볼 수 있다
71,(주)스포카,163,사무실이 좋았음 다양한 경험을 해볼 수 있음 좋은 사람들이 많았음
72,(주)스포카,163,"눈치 안보고 연차 씀, 자유로운 분위기 되도록 수평적이 되려는 분위기 월급도 괜찮게 줬었음 모든 애기는 before 사업본부장"
73,(주)스포카,163,1. 수평적인 기업문화 2. 열심히 하는 사람(실적이 좋은 사람)에게 박수를 쳐준다. 3. 정치의 정수를 배울 수 있다. 4. 많이 걸어서 건강해진다. 5. 평소에 받지 못하던 대우를 받아 정신이 건강해진다.
74,(주)스포카,163,연차를 특별한 일이 없을 경우 자유롭게 쓸 수있고 직원들의 연령층이 높지 않기때문에 젊음이 있음
75,(주)스포카,163,"휴가 자유로움, 생각을 실행해 볼 수 있음, 커뮤니케이션 원활."
76,(주)스포카,163,"자유롭고 유연한 기업문화가 있다. 눈치안보고 의견개진, 휴가, 퇴근할 수 있다."
77,(주)스포카,163,"워라벨이 보장되어 있음, 자유로운 문화와 회의 분위기, 스스로 프로세스를 만들어 나갈수 있어 자주적인 직원에게는 참 좋은 회사"
78,(주)스포카,163,"스타트업의 전반적인 부분을 체험할 수 있음, 조금씩 자리 잡혀가는 조직, 개발자에 한하여 자유로운 커뮤니케이션 문화 & 유연한 근무 제도,"
79,(주)스포카,163,"젊은 사람들이 함께모여 서로의 의견을 나누며 일 할 수 있습니다. 확실히 분위기는 밝으며, 같이 일하는 사람들이 좋습니다."
80,(주)스포카,163,주변 직원들이 좋음. 젊은 직원이 많고 활기찬 편. 영업하기 수월함 (제휴 문의 최근에는 꽤 들어옴)
81,(주)스포카,163,1. 연차 눈치안보고 사용 가능 2. 칼퇴 가능(직책과 직무에 따라 다를 수 있음)
82,(주)스포카,163,신입임에도 업무권한이 크다. 하루가 다르게 성장함을 느낄 수 있는 회사.
83,(주)스포카,163,스타트업에 걸맞는 자유 분방한 분위기로 회사 전반적으로 자유분방한 분위기를 지향하고 있음 특히 개발파트의 경우 리모트 근무를 통해 자율도를 더욱 극대화 하는 분위기임
84,(주)스포카,163,자유롭고 유쾌한 분위기. 회사에서 웃음 소리가 끊이지 않음. 꾸준한 성장을 해왔고 새로운 아이템이나 모델에 대한 고민을 끊임없이하고 성장하려고함. 야근은 없다고 봐도 무방.
85,(주)스포카,163,동료들이 매우 좋음. 목표만 채우면 성과는 섭섭치 않게 줌.
86,(주)스포카,163,수평적인문화? 대학동아리같고 같이 일하는 사람들이 다들 좋다.
87,(주)스포카,163,"접근성이 좋고, 자유로운 분위기에 영업은 인센티브가 있었음, 초기에 배울수있는 환경이 있으며 실제로 영업할때 여러명의 사수분들과 동행하여 노하우도 배울 수 있는 기회가 있음. 본인이 잘 한다면 좋은 점이 많음"
88,(주)스포카,163,"자유로운 분위기와 영업직이라는 일에도 불구하고 서로 노하우를 알려주는 등 영업직이라고 경쟁적이지만은 않은 분위기, 성장하고 있는 곳이기 때문에 많은 경험을 할 수 있음"
89,(주)스포카,163,"자유로운 분위기, 내부 스터디, 애자일 프로세스로 타이트한 개발 운용"
90,(주)스포카,163,"연차 눈치 안 보고 쓸 수 있음, 엄청난 워라밸, 웬만한 중소기업보다 후한 상여금."
91,(주)스포카,163,영업력이 있다면 스타트업 중 상위연봉을 받을 수 있는 곳 비교적 수평적인 분위기 존재 (그러나 수직적인 때도 있음) 야근 별로 없음 같이 일하는 동료들이 착함
92,(주)스포카,163,"자유로운 분위기, 영업직무는 본인의 역량에 따라 인센티브가 추가로 지급됨"
93,(주)스포카,163,분위기가 좋다 그리고 사람들이 젊고 수평적이다 존중하는 문화가 있는 듯
94,(주)스포카,163,"연차를 눈치 안보고 쓸 수 있는 자유로움, 야근 특별한 경우를 제외하고는 거의 없음"
95,(주)스포카,163,수평적 제도 도입 열정있는 사람들 업계 특성 때문에 즐거운 업무
96,(주)스포카,163,연월차 정말 눈치 안보고 쓸 수 있음. 인턴이라도 칼퇴 가능하고 편의도 봐줌
97,(주)스포카,163,"회사내 자유로운 분위기, 10시-7시 출퇴근시간, 영업직의 경우 외근이 대부분이며 개인스케줄을 자유롭게 활용가능, 성과에 따른 인센티브 지급"
98,(주)스포카,163,"상호간에 영어이름사용, 직급이 크게 없어 이상한 상사가 없음. 10시출근."
99,(주)스포카,163,기업 구성원들이 대체적으로 좋은 사람들이다. 여유로운 출근시간과 거의 없는 야근덕분에 자기생활을 어느정도 누릴 수 있다. 스타트업의 특성상 여러가지 일을 경험해 볼 수 있다.
100,(주)스포카,163,자유롭고 젊은 사내분위기. 단 영업부는 보일 듯 보이지 않는 위계질서 존재. 사원 간 연차가 짧은 수록 선명해지는 질서.
101,(주)스포카,163,"출근 10시, 복장 자유, 괴롭히는 상사 없음, 불필요한 야근 거의 없음."
102,(주)스포카,163,수평적인 사무실 분위기 사람 스트레스 없이 즐겁게 일할 수 있는 곳
103,(주)스포카,163,10시 출근 7시 퇴근. 영업의 경우 왠만하면 야근 없음. 회사의 전체적인 분위기는 자유로운 편. 인센티브 구조 좋은편이라 영업을 잘 하면 임금에 불만이 크진 않을 것임
104,(주)스포카,163,개발/디자인의 경우 복지가 좋음. 일처리가 합리적임. 사람들도 좋다.
105,(주)스포카,163,- 합리적인 동료들 - 인간적인 동료들 - 젊고(어리고) 활발한 분위기
106,(주)스포카,163,수평적 사내문화 대표부터 사원까지 적극적이고 상호간의 커뮤니케이션이 원활하다
107,(주)스포카,163,수평적인 문화. 불필요한 서열 없음. 말도안되는 지시도 당연히 없음. 할일 잘하면 승진 가능성 당연히 높음. 실력에 따라서 커리어 쌓을 수 있음.
108,(주)스포카,163,자유롭고 젊은 분위기. (크리에이터 기준) 업무 체계나 사내 문화가 굉장히 자유로운 편이고 구성원 전체가 무언가 새로운 시도를 하는 데 거리낌이 없습니다.
109,(주)스포카,163,무언갈 해보고싶으면 일을 만들어서라도 할수있다. 의견이 묵살되지않기 때문에 끝까지 해내는 지구력만 있다면 많은걸 배울수 있다.
110,(주)스포카,163,스타트업으로 성장지향적으로 추진력을 발휘해서 나아가고 있습니다.
111,(주)스포카,163,동료의식이 높고 팀장들도 사려깊게 평사원들을 챙겨주고 가르쳐준다.
112,(주)스포카,163,사내환경 분위기가 좋음. 자유로운 분위기 속 일을 재미있게 배울 수 있음.
113,(주)스포카,163,탁막히는 분위기가 아닌 오픈된 분위기와 사람들
114,(주)스포카,163,인재중시 및 수평적인 기업문화. 사내 분위기 좋음.
115,(주)스포카,163,"성장하고 있는 스타트업 회사이다. 영어 이름을 써서인지 부드럽고, 요즘 많은 스타트업 회사같다."
116,(주)스포카,163,의사 결정 방식이 매우 합리적이다. 사리에 맞는 얘기를 하면 다들 받아들이는 문화. 성장폭 가파름. 기술 수준 높음.
117,(주)스포카,163,"수평적인 문화, 가족같은 분위기, 야근제로"
118,(주)스포카,163,임직원 평균 연령대는 젊지만 개개인의 능력이 뛰어나고 배울점이 많은 인재들로 가득참. 주변 동료 및 리더들을 보면서 많이 자극 받게 됨. 오픈 커뮤니케이션이 가능하고 사람을 존중해주는 분위기. 업무 역량을 강화할수 있음. 빠르게 성장하고 있는 스타트업으로 하루하루 기대됨
119,(주)스포카,163,"스타트업의 처음과 끝을 모두 배울 수 있고, 좋은 문화와 좋은 사람들이 함께 어울려서 좋은 제품을 만드는 회사입니다. 스스로 주도적으로 일을 할 수 있고 대표님, 부대표님 모두 엄청난 능력의 소유자라서 많이 배울 수 있는 장점이 있습니다."
120,(주)스포카,163,"회사가 하루가 다르게 성장하는 것을 느낄 수 있다. 경영진과 사원들 개개인의 역량, 사내 문화, 업무 강도와 질 등 회사 생활에서 부딪힐 수 있는 모든 면에서 만족할 수 있다. 수평적인 문화를 갖고 있고, 팀간 업무 협조도 잘 되고 있다."
121,(주)스포카,163,개발직군 쪽은 확실한 관리자의 관리로 여타 다른 업무지원이나 다른팀의 터치를 받지않고 일을할수있음. 그렇다고 다른팀은 문제가 있다는건 아니고 다른팀도 여타 다른기업에 평균이상의 수준의 자율성
122,(주)스포카,163,사내문화가 민주적이고 가족적이다. 스타트업 기업치고 운영이 상당히 안정적으로 이루어지고 있다.
123,(주)스포카,163,분위기가 정말 좋다. 가족같다면서 가족처럼 부리는 그런 회사 분위기 아님.
124,(주)스포카,163,"자유로운 분위기, 야근 강요 없음, 열정적인 직원들, 새로운 방식 도입에 거부감 없음"
125,(주)스포카,163,회사 내의 여러 분야 중 원하는 분야 개발에 참여할 수 있음. 팀원들이 훌륭함. 원격 근무제도 존재.
126,(주)스포카,163,스타트업 기업인 만큼 다방면으로 사업 범위를 넓힐 방안을 잘 모색하는 기업입니다. 직원분들 다 너무 좋으시구요.
127,(주)스포카,163,자유롭고 자율적인 분위기. 열정적이고 좋은 사람들이 많아서 일이 많은 편이지만 즐겁게 일할 수 있다. 팀별로 정도는 상이하지만 개개인의 성장을 중요시하고 오픈마인드인 분위기도 정착되고 있어 개인적인 커리어 측면에서도 발전할 수 있는 기회를 많이 가질 수 있음.
128,(주)스포카,163,자유로운 분위기. 편한 복장. 좋은 사람들.
129,(주)스포카,163,수평적인 사내문화. 자신의 직무를 넘어서는 경험을 쌓을수있고 성장기회가 많음. 타팀과의 커뮤니케이션이 활발한편. 직원의 의견을 경청하려는 경영진 마인드가 좋음. 주도적으로 프로젝트 등을 진행해볼 기회가 무궁무진함
130,(주)스포카,163,좋은 팀멤버. 투명한 커뮤니케이션 문화. 성장 가능성 (앞으로 10x 이상 성장할듯). 사회적 의미 있는 서비스 (소상공인 대상)
131,(주)스포카,163,"수평적인 관계, 자율적인 분위기, 프로젝트 제안에 대한 경영진 수용도가 높음"
132,(주)스포카,163,"문화는 스타트업다운 문화라고 할수있습니다. 야근이나 회식 모두 자유롭고, 사실 회식도 강압적이지 않고 심지어 팀회식은 동호회 회식같은 분위기... 그리고 요즘은 자택근무도 활용하고 있는 것같네요. 업무량도 딱 바쁠 만큼 있고 새로운 시도를 해볼 기회가 (매일매일은 아니지만) 꽤 있습니다. 개발측과 커뮤니케이션도 자유로운 편이에요."
133,(주)스포카,163,"1. 하고 싶은 일을 주도적으로 진행할 수 있다. 기회가 큰 만큼 책임도 크지만, 자신이 원하는 일을 딜링해보고 싶어하는 사람들에게는 굉장히 매력적인 곳이다. 2. 리모트 시스템이 원활하여, 주당 일정 시간은 자신이 원하는 곳에서 근무할 수 있다. 실험적으로 도입했지만 시스템이 성공적으로 안착하여 직원들의 만족도가 높다."
134,(주)스포카,163,각자 판단하기에 따라 조금씩 다를 수 있지만 전망이 괜찮은 벤처기업이다.
135,(주)스포카,163,인간관계 스트레스 없이 하고 싶은 일은 마음껏 할 수 있다. 개인의 성장에 회사가 관심을 많이 쏟는 편이고 사내 스터디도 활발한 편임.
136,(주)스포카,163,대한민국에서 제일 자유로운 회사. 영업직을 제외한 전 직군에서 압박이 없다.
