,company_name,company_id,review_text
507,(주)신흥,4630,"회사에 대한 시장의 전반적인 인식은 좋은 편으로 신흥 제품에 대한 시장 반응 역시 좋음. 영업직 특성상 많은 사람들을 대하며 커뮤니케이션 능력, 대인관리 등 사람과 사람 사이에 필요한 여러 능력을 키울 수 있음(그러나 스트레스 역시 많음)"
508,(주)신흥,4630,초봉이 높고 초반 업무 스트레스는 적은편 사람 대하는 일이 많아 대인관계 지장없다면 재미 느낄수 있음
509,(주)신흥,4630,치과업계 1위의 자부심을 가질 수 있고 사택이 많아 지원이 가능함.
510,(주)신흥,4630,업계에서 선두를 달리는 회사. 재무적으로 안정적이며 연봉도 괜찮은 편.
511,(주)신흥,4630,초봉 괜찮고 치과계에서는 신흥 하면 모르는 사람들이 없기때문에 영업하기 수월함
512,(주)신흥,4630,노력하는 마인드만 있다면 영업에 관한 다양한 상황들을 경험할 수 있다
513,(주)신흥,4630,초봉을 동종업계에비해 괜찮은편이고 치과업계에 자부심이있고 실적에따른 인센티브가 없습니다. 이직률이높기에 몇년만 잘 버티면 개인의 역량과 전문성은 확보할수 있습니다.
514,(주)신흥,4630,연봉 나쁘지 않고. 안정적인 기업.
515,(주)신흥,4630,안정적이다 열심히하면타기업에비해연봉이높다 다른영옵에비해암장작이다
516,(주)신흥,4630,치과 업계 1위인 부분 자부심을 느낄수 있음
517,(주)신흥,4630,"지방기준해서 적당한 연봉과 주5일 근무, 그리고....없음"
518,(주)신흥,4630,치과업계 선두기업으로 업계에서는 인정받음.
519,(주)신흥,4630,회사가 망할일은 없음. 재무적으로 안전함
520,(주)신흥,4630,동종업계 1위기업. 타 영업직에 비해 안정적인편.
521,(주)신흥,4630,"업계1위, 끈기와 인내심만 잇다면 안정적으로오래 일할수 잇음, 급여나 복지가 좋음"
522,(주)신흥,4630,초봉은 많이 높은 편입니다. 빡센 사내문화를 배울 수 있습니다. 복지는 나쁘지 않은편 입니다.
523,(주)신흥,4630,"주말 특근 절대 없음, 치과의료기 업력이 오래되어 쉽게 망하지는 않을 것 같음, 가늘고 길게 갈 수 있는 회사"
524,(주)신흥,4630,"업계 국내 1위(?) 탄탄한 유통망과 오래된 회사 업력 뭐, 금방 망할수 없는 사업구조와 영업이익. 보수적인 경영 등 안정적."
525,(주)신흥,4630,"확실히 입사 후 1년차 까지는 대기업 못지 않은, 급여가 보장 됨. 또한 돈을 쓸 시간이 없어 쉽사리 목돈을 모을 수 있음. 영업 외에 AS 수금, 컨설팅, 임대자리 확인, 물건 배달등 다양한 업무를 할 수 있어 개인적으로도 다양한 경험과 능력을 키울수 있음"
526,(주)신흥,4630,영업이라는 업무가 그렇다고는하지만 정말 내가 아랫신분이구나를 뼈저리게 느낄 수 있음. 다른 직무로의 생각 전환을 하게 해 줌.
527,(주)신흥,4630,인생의 쓴맛을 느껴볼수있음 갑을이 뭔지 알수있음
528,(주)신흥,4630,초봉 수준은 동종업계 최고 수준. 지방사무소 운영으로 집과 가까운 곳 배치 가능.
529,(주)신흥,4630,급여수준 동등 업계
530,(주)신흥,4630,안정성
