,company_name,company_id,review_text
350,(주)신흥,4630,다양한경험 할수있음 치과계에 관련된 모든일을 경험하고 배울수있음
351,(주)신흥,4630,직원 연령대가 낮아서 의사소통이 잘되는거 같아요.자주 인원이 변경되서ㅈ그런가...?
352,(주)신흥,4630,영업 및 장비 A/S 등을 통하여 멀티플레이어가 될 수 있음
353,(주)신흥,4630,1. 주말 근무가 워낙에 많기에 대체 휴무를 자유로이 사용 가능. (본사) 2. 나쁘지 않은 연봉 3. 사내 카페에서 음료 무제한 (본사) 4. 기업 인지도 및 이미지...가 아직까지는 나쁘지 않다. 단 연세 좀 있으신 치과 의사 분들 한정으로. 5. 화장실 비데 (본사)
354,(주)신흥,4630,"연차를 눈치안보고 사용가능, 다양한 자기계발 가능 , 영업외에도 다양한 경험을 쌓을수 있음"
355,(주)신흥,4630,기업자체가 오래되어 재정적으로 일단 안정되어 있는 회사
356,(주)신흥,4630,장점은 딱히 없는듯 장점이 없는게 장점이다 한번 경험해보면 좋을거같다
357,(주)신흥,4630,나름 업계 위치가 있어 고객들을 쉽게 접할수있는게 장점. 돈이 많은 회사이기에 불안할 필요가 없는 회사
358,(주)신흥,4630,하루종일 사무실에서 눈치 보는것이 아니라 거래처를 다니며 A/S 를 하며 고객과 신뢰를 쌓고 자연스러운 영업의 기회를 만들 수 있습니다
359,(주)신흥,4630,동종업계대비 상대적으로 높은 초봉. 치과장비업계에선 유명한 회사
360,(주)신흥,4630,정말 다양한 업무를 경험할 수 있음. 유관 부서와의 협업이 잦기 때문에 그 만큼 전 분야의 사업 영역을 알 수 있음.
361,(주)신흥,4630,장점을 딱히 생각할게 없는게 장점 30자이내 쓸말도 없네요
362,(주)신흥,4630,딱히 장점을 말할게 없는게 장점 30자이내쓸것도 없음
363,(주)신흥,4630,딱히 장점이 생각나지 않는것이 장점 쓸게없는데 30자 쓸수를 없음
364,(주)신흥,4630,"공무원 같은 회사, 월급 밀리지 않고 초봉이 상대적으로 높다고 함"
365,(주)신흥,4630,신입 연봉 괜찮고 처음 직장으로는 괜찮음. 사무소 직원들과의 관계가 괜찮은 편임. 이곳을 다니면 어디서든 잘 할 수 있음
366,(주)신흥,4630,"업계 1위 기업, 연봉 동종 업계 1위, 인지도 1위, 회사 탄탄함"
367,(주)신흥,4630,초봉이 낮지 않으며 매출압박은 사무소 제외하면 크지 않음.
368,(주)신흥,4630,영업에 비해 비교적 대휴가 자유로움. 시간 외 근무를 하나 퇴근은 크게 늦지 않음. 무료 사내 카페
369,(주)신흥,4630,일하는 시간이 많지만 초봉이 조금 괜찮다는 게 유일한 장점인 것 같아 보였고 업계 코스피 주식회사라는 점이 기업의 장점이다
370,(주)신흥,4630,숨어지내면 오랫동안 고액의 연봉을 받으며 버틸 수 있다
371,(주)신흥,4630,업계에서 가장 오래되고 전통이 있는 업체로 많은 것을 배울 수 있고 기회도 많이 제공받을 수 있다.
372,(주)신흥,4630,1. 업계 대비 높은 초봉 2. 월급이 밀리지 않음 3. 사내 카페가 유일한 복지
373,(주)신흥,4630,가족회사로 결정력이 빨라 좋은일이 진행될때는 처리가빠름
374,(주)신흥,4630,중견치고 연봉이 좋으며 지역마다 편차는 있을 수 있지만 자신이 하는 만큼 돈을 조금 더 올라갈 수 있는 인센티브제가 되어있음. 노력만 하면 대기업수준으로 받을 수 있는 연봉
375,(주)신흥,4630,그저 서울에서 일할 수 있다는 마음이면 추천 하지만 그 이외는 비추
376,(주)신흥,4630,업계 1위이고 경험 쌓긴 좋음 사람들 중에 또라이가 있진 않음
377,(주)신흥,4630,"치과산업에서 인지도 있음, 초봉도 나쁘지 않은 편. 회사의 부채가 없어서 월급 안나올 일은 없음"
378,(주)신흥,4630,타사 대비 높은 초봉. 사내카페. 연차 되면 자동 승진. 그 외에는 장점이 없다.
379,(주)신흥,4630,부서별 다르지만 연차사용가능 경력 쌓기 좋다 초봉 높은편 사내 카페
380,(주)신흥,4630,성과압박이 심하지 않습니다. (상품영업 한정) 휴가쓰는 것에 눈치보는 문화는 아닙니다. (기계영업은 아니라고 알고 있습니다. 기계영업은 가지 마세요)
381,(주)신흥,4630,딱.. 히... 회사 자체의 매력적인 부분이나 장점은 없고 그나마 롤모델이 될 만한 상사가 가뭄에 콩나듯 있음
382,(주)신흥,4630,자기 할일열심히 하면 누가 뭐라고 하는 사람 별로 없이 잘다님 근데 일이많음
383,(주)신흥,4630,사회 초년생 및 업계를 통틀어서 초봉은 적지 않다고 생각한다. 성장을 기다려주는 편이다.
384,(주)신흥,4630,팀장에 따라 부서 분위기가 많이 좌지우지 되는 편. 급여는 동종업계와 비교하였을 때 초봉이 높음. 일반 사람들은 모르지만 업계에서는 알아주는 오래된 탄탄한 기업
385,(주)신흥,4630,오래된 전통을 가지고 있어서 안정성 보장 치과기계 산업에 중상권
386,(주)신흥,4630,당연한거지만 월급이 밀리지 않는다. 사내카페가 있다. 혼자 알아서 일을 배우며 성장한다.
387,(주)신흥,4630,자기가 업무를 일찍 끝내면 야근은 하지 않아도 된다. 타 부서는 모르겠다. 연봉이 동종업계 상위권.
388,(주)신흥,4630,"초봉만 쌘 편, 그냥 오래 다니면 승진은 알아서 됨(공무원 호봉쌓이듯 연수만 차면 과장 차장 다 단다)"
389,(주)신흥,4630,월급이 밀리지 않는다 치과업계에서 인지도는 있다(체어)
390,(주)신흥,4630,안정적인 매출과 덴탈시장에서 입지로 앞으로 성장이 기대되는 기업. 주말근무 야근은 감수해야함. 연봉은 높은편
391,(주)신흥,4630,동종업계에서 비교적 놉고 안정적인 급여  필히 이 업계쪽에서 자영업을 하겠다는 분들께는 추천
392,(주)신흥,4630,60년이 넘는 시간을 견딘 튼튼한 회사임. 근무 여건은 계속 좋아지고있음. 휴일 보장 및 주말 근무시 평일 휴일 보장되며 근무 시간도 나쁘지 않음. 요즘같이 어려운 경제속에서 다양한 사업을 통해 이익 창출에 힘쓰고있음.
393,(주)신흥,4630,영업 목표에 대한 부담이 심적으로 적다면 괜찮음. 업무는 그렇게 복잡하지 않은 편. 기업은 매우 안정적임.
394,(주)신흥,4630,치과업계에 오랜전통으로 나이드신 치과의사님애개 조금은 영업이 수월하다
395,(주)신흥,4630,구성원 하나하나 정말 좋은 사람들과 화기애애한 분위기 속에서 근무를 할 수 있다. 1년차에는 실적에 대한 부담이 적고 다양한 기회를 주며 연수원에서 학습을 통해 많은 지식을 얻을 수 있다.
396,(주)신흥,4630,연봉은 중견기업 수준에서 꽤 괜찮음. 영업수당도 꽤 줌. 이것저것 합치면 그냥저냥 급여부분에선 괜찮음
397,(주)신흥,4630,"기숙사 무료 제공, 상여금등 그래도 업계에선 알아주는 곳이라 다들 꽤 큰 회사이다라고 조금 알고 있는듯 하다"
398,(주)신흥,4630,연차는 사용가능. 하지만 쓰면 눈치보임. 사회초년생에게는 사회란 무엇인가 에 관하여 잘 알게해줌
399,(주)신흥,4630,업계에서 오래됐다는 장점. 높은 초봉. 아 딱히 없다 장점이
400,(주)신흥,4630,연봉인상률이 많이 높지는 않지만 신입 초봉이 높습니다. 근무지에 따라서 분위기가 케바케. 이 업계에 계속 있을 각오였다면 보다 오래 다녔을 것 같습니다.
401,(주)신흥,4630,높은 초봉 / 대체휴무와 연차 사용에 눈치주지 않음 / 정시 출근하고 대체로 야근 없이 정시 퇴근 가능
402,(주)신흥,4630,오래 전 한창 잘 나가던 시절 현금 장사를 많이 해서 그런지 돈이 많은 것 같습니다. 갑자기 망해서 없어질 회사라고는 생각되지 않으며 시장이 어려워도 다른 기업들보다 오래 버틸 것 같습니다.
403,(주)신흥,4630,초봉이 높은편임. 신입도 해외거래선의 담당자로 지정되어 일을 많이 배울 수 있다.
404,(주)신흥,4630,관련 치과기기 업계 회사들에 비해 초봉이 높은 편이다.
405,(주)신흥,4630,초봉 쌘 거 빼고 좋은게 없음 퇴사율이 엄청 높음 주말 전시회때문에 워라벨 없음
406,(주)신흥,4630,영업쪽 제외한 대부분의 부서가 야근은 안하는 편. 연봉은 타 업계에 비해 높은 편. 오래된 기업인만큼 안정적이긴 하다.
407,(주)신흥,4630,초봉은 높아서 초반에는 웬만하면 만족할 수 있는 회사. 그 이상 없음.
408,(주)신흥,4630,"신입치고 높은 초봉, 유류비 지원, 연수원을 갖고 있음"
409,(주)신흥,4630,코스피상장사라 대출용이. 대출도 차때문에 생긴거라 또이또이?
410,(주)신흥,4630,"신입 연봉으로는 나쁘지 않은 시작이지만, 그 이상의 발전은 없음."
411,(주)신흥,4630,업계 1위였던 회사로 안티도 많지만 아직도 찾는 사람들이 많음
412,(주)신흥,4630,엑스레이샤워를 수시로 할수있음 하루에 운전을 평균 5시간은 할수있음 동에번쩍서에 번쩍 할수있음 치과원장의 갑질에 녹아 날수 있음 .......
413,(주)신흥,4630,동종업계 비교해보면 초봉이 높음 영업직은 활동비 추가 지급 사내 카페 이용 가능 교통 편리한 편
414,(주)신흥,4630,"망할 일은 없다. 이익이 엄청 낮은 수준인데, 회사가 운영되는 건 부동산 때문이려나? 업무가 너무너무너무 쉽다. 주말 출근 빼면 마치 공무원과 같은 워라밸을 경험할 수 있다."
415,(주)신흥,4630,신입치고 높은 연봉 확실히 업계 1~2위로써 연봉은 고액연봉으러 만족
416,(주)신흥,4630,1. 나쁘지 않은 초봉 2. 사내카페 커피 등 음료 무료제공 3. 넓은 책상 4. 연차대비 상위 업무 경험가능 5. 다양한 부서 경험 가능 6. 꾸준한 실적과 안정적 구조 7. 주말 출근시 평일 대체휴일 부여 8. 영업/물류/회계 등 상세한 정보가 제공되는 전산 프로그램 9. 매우빠른 엘리베이터(본사기준) 10. 전반적으로 높은 직원들의 인사성 11. 전체적으로 젊은 직원들 연령대 12. 보기드문 호봉제 회사 13. 윤리경영상 운영(주식제공) 및 자사주 매입기회 제공 14. 연차외에 별도로 월 1회 휴일 제공
417,(주)신흥,4630,"사내카페있음. 초봉이 비교적 높은편. 서울역, 충정로 인근이라 출퇴근이 비교적 원활함"
418,(주)신흥,4630,"1년차 까지는 연봉은 괜찮은 듯 한 느낌. 실질적으로는 야근, 주말 출근에 수당 없는가 고려하면 최저시급 받고 일하는 꼴"
419,(주)신흥,4630,연봉이 괜찮습니다. 주변에 맛집이 많습니다. 홍보쪽빼고는 주중 칼퇴가능. 정말 나쁜심보를 가진사람은 없습니다.
420,(주)신흥,4630,"60년된 회사라 적어도 망하지 않고, 월급 꼬박꼬박 받을 수 있음. 안정성 타사 중견기업 대비 신입초봉이 높고, 초봉은 여남 차별이 없음"
421,(주)신흥,4630,오래된거 빼고 찾을 수 없었다...................
422,(주)신흥,4630,연봉은 괜찮은편 서울에서 근무하면 위치는 좋다. 건물은 좋다
423,(주)신흥,4630,"야근이 적고, 치과쪽에서 유명해서 대부분 알고 있는 회사"
424,(주)신흥,4630,그냥 월급은 밀리지 않습니다. 딱히 장점이 없네요. 육체적 정신적으로 시달려서 시간은 빨리 갑니다.
425,(주)신흥,4630,월급이 밀릴 일은 없음. 부서 복불복 팀장에 따른 복불복. 초년생 연봉만 높음(다음 인상없음) 아무리 쓰려고 해도 못 찾..
426,(주)신흥,4630,"인센이없어 모두 다 평등하게 일할 순 있지만, 연봉 상승률이적음"
427,(주)신흥,4630,신입 연봉은 꽤 높은 편이다. 계속해서 이쪽 업계에 있는다면 다니기 괜찮을 듯하다. 회사가 안정적이다.
428,(주)신흥,4630,오래됨. 연봉높음. 업계에서는 메이져. 여자가많아져 복지가 조금씩 좋아지는 중
429,(주)신흥,4630,"높은 초봉 전문성을 기를수 있는 일부 부서나, 담당업무를 잘 배정받는 경우에는 오래 다닐 수 있다."
430,(주)신흥,4630,"업계 최고연봉 성과압박 적음 안정적 고용,부서이동 적음, 사택, 업계내 인지도 높아 자부심 연차 모두소진 가능"
431,(주)신흥,4630,개인 인센티브가 없어서 사무실 분위기가 같이 고생하고 같이 잘해보자는 공동체 의식 강함. 튼튼한 자본력으로 회사가 망할일 전혀 없음. 넓은 영업망 관리를 통해 다양한 치과에서의 다양한 경험 및 A/S스킬 습득
432,(주)신흥,4630,일 대충해도 됨. 개발 기간이 엄청 길어서 업무압박은 없음. 타 업계 연구개발직에 비해 업무 강도 굉장히 낮음.
433,(주)신흥,4630,"치과 업계내에서는 나름 잘나감 하지만, 일반인들이 보면 모름 연봉도 뭐 신입 초봉치고는 나쁘지 않은편 작지는 않다 알바(부수입)도 뭐 나름 짭잘함 ㅡ>하기나름 몸쓰는일 다 해볼수있음 (굳이 장점 찾으려면)"
434,(주)신흥,4630,팀에 따라 다르지만 관리부문은 적당한 업무강도라 사원급 정도까지는 경력 쌓기가 좋다.
435,(주)신흥,4630,"팀마다 분위기가 다름,회식강요 없음, 야근 없음, 주말근무 많음"
436,(주)신흥,4630,안정적. 자본력 탄탄. 중견 기업 치고 대졸 초봉은 높은 편. 유통망이 탄탄.
437,(주)신흥,4630,연봉도 신입사원 기준 높은 편임. 회사 분위기가 경쟁적이지 않기 때문에 팀원들 간의 분위기도 좋음. 점점 회사 분위기가 어려지는 느낌이기 때문에 회사 적응도 어렵지 않다.
438,(주)신흥,4630,"상품부터 유니트체어, 엑스레이 등 다양한 제품군을 유통하여 치과 유통체제를 파악하기 좋고, 향후 개인사업을 할 수 있다는 장점을 가지고 있음."
439,(주)신흥,4630,업계내의 입지가 크다. 일할 때 신흥에서왔습니다라고하면 다들 알아준다.
440,(주)신흥,4630,다양한 경험을 쌓을수 있으며 동종 업계로 이직할 방향이 많다.
441,(주)신흥,4630,"연봉이 괜찮은 편, 오래된 회사인 만큼자체는 안정적이고 사람들이 대부분 좋은 편이다."
442,(주)신흥,4630,초반 높은초봉. 치과계에서 알아주는 인지도. 재무건전성 튼튼해서 대출용이하고 추후 사업확장시 자금조달 용이. 여사원들이 근무하기좋음.
443,(주)신흥,4630,연봉은 많이 주는 편이었음. 운전을 많이해서 운전 잘해짐. 이 둘이외엔 장점은 없었다고 느낌.
444,(주)신흥,4630,연혁이 60년이상 되어 업계에서 안정적인 수요와 매출이 일어나고 있음.
445,(주)신흥,4630,"치과업계에서 유명한 기업, 동종업계 연봉 괜찮은편, 안정된 기업"
446,(주)신흥,4630,오래된 기업인만큼 업계에서 안정적인 위치 판매되는 상품들도 어느정도 점유율 좋음
447,(주)신흥,4630,영업과 기계관리를 동시에 배울수 있으며 안정적인 회사인 점에서 좋다. 퇴사 후에도 다양한 방법으로 사업을 할수 있는 경력을 쌓을수 있다
448,(주)신흥,4630,기계관리 및 영업을 동시에 배울수 있으며 많은 원장님들과 좋음 관계를 형성하면 퇴사 후에도 할 수 있는 사업이 많다
449,(주)신흥,4630,1. 초봉이 높은편 2. 여러가지 다양한 업무를 배울수있음
450,(주)신흥,4630,"힘쓰고 단순한업무 좋아하는사람은 다닐만함 활동비는 나름나옴, 알바비도 잘하는사람은 꽤받음"
451,(주)신흥,4630,"동종 업계 1위라는 장점. 치과 재료 업계에서는 누구나 알아주는 회사, 일을 잘 배울수있음"
452,(주)신흥,4630,아무래도 상대하는 고객이 병원이다보니 많은 기회가 생길수있다
453,(주)신흥,4630,"유구한 역사와 더불어 자부심이 강한 회사로 동종업계에서는 신흥이라 하면 누구다 다 아는 직장이며, 본인의 역량에 따라 많은 것을 흡수하며 성장할 수 있는 기틀을 가지고 있음"
454,(주)신흥,4630,연봉이 높은편입니다 이때문에 회사에남아있는 사람들이많죠 직원들도딱히 악한사람은없는듯
455,(주)신흥,4630,나름 업계 1위회사라는 자부심 현재는 O사에 비해 떨어지는듯 하지만 지방에서는 나름 연봉이 쎈편
456,(주)신흥,4630,외근직이 대부분 자기 목표치만 맞추면 뭘하든 신경 안씀 외근나가서 놀든 자든 지맘대로
457,(주)신흥,4630,사업기반이 안정적이고 체계가 나름대로 잡혀있는 회사라고 생각한다
458,(주)신흥,4630,3000이상 연봉 밑 부수입 오래된 연사 만큼 인지도 잇움 퇴사후 샤인덴탈에 갈수잇음 이 업계에서 한우물만 파면 먹고 살수는 잇음
459,(주)신흥,4630,60년의 역사바탕으로 영업네트워크 잘 갖춰짐 시장에서 높은 인지도 성실한 직원
460,(주)신흥,4630,"연봉 높음(초봉 3000천 이상), 사람하기에 따라서 월급 말고 부수입을 만들 수 있음. 실적을 월초에 달성하면 그달은 본부장이 안 건들임."
461,(주)신흥,4630,"회사가 어려울수 있어도 최소한 부도가 날 위험은 전혀 없다는 장점, 영업직이 맞는다면 도전할 필요가 있음. 많은 사람을 만날 수 있음"
462,(주)신흥,4630,"60년 이상된 회사라 안전함, 신입 연수 진행. 신입초봉은 높은편. 본사의 경우 서울에서 일할 수 있음. 결혼하면 사택지원 단 TO 있을때만"
463,(주)신흥,4630,월급이 밀리진 않음. 업계 1위라는 생각은 있음
464,(주)신흥,4630,영업의경우 나만의 시간을 가질수잇고 자유로이 다닐수 잇음 지역별로 편차가있으나 유한지역은 선후배간 끈끈함이 있음
465,(주)신흥,4630,60년간 다져놓은 치과계에서의 기업입지로 인한 영업이쉬움
466,(주)신흥,4630,주말에 전시회가 많지만 대휴를 쓰게 해주게끔 한다 중견규모임에도 불구하고 높은 초봉
467,(주)신흥,4630,월급은 펑타주고 번화가에 회사가 있어요 기본적으로 인지도가 있어서 영업하기는 편하나 요즘 인지도가 바뀌고있어서 생각을 달리해보세요.
468,(주)신흥,4630,중견기업 평균 연봉이상 받을 수 있으며 의지만 있으면 성장해 나갈 수 있음.
469,(주)신흥,4630,능력제가 아닌 사무실 매출이라 그리 큰 압박을 받지 않음 그러나 타지역 같은경우 윗 사람 잘 못 만나면 진짜 대박 힘드심
470,(주)신흥,4630,중견기업으로 괜찮은 연봉이라고 생각됩니다.. 반년 역사에 빛나는 기업력. 영업직이다보니 할일만 똘똘히 하면 자기시간도 꽤 창출가능하다고 봅니다.
471,(주)신흥,4630,높은 초봉과 다양한 사람들을 접할 수 있음 치과 쪽에 관심이 많은 사람이라면 추천
472,(주)신흥,4630,점유율은 작아지지만 월급 밀릴일은 없는 회사 치과 업계에서는 입지가 있어 원장들에게 내동댕이 쳐지진 않음
473,(주)신흥,4630,업계1위지만 시장전망 좋지않음. 계열사는 야근거의 없음.
474,(주)신흥,4630,"영업이라고는 하지만 접대가 없어 상대적으로 그런 것은 수월하다. 요즘 같은 시대에 나름 괜찮은 연봉을 준다. 영업직 같은 경우는 기름값, 밥값 명목으로 관리비가 나오는데, 그것도 꽤 많은 지원이 있다. 앞으로 계속 치과시장에서 발을 담굴 것이라면, 이 곳에서 오랫동안 노하우를 익히는 것도 좋다. 치과가 단일 의료종목 중에서는 가장 규모도 크고 대중적인 분야이다 보니, 제대로 배우기만 한다면 큰 장점이 될 수 있다."
475,(주)신흥,4630,"기업은 치과 의료기기 시장에서 빅3에 속하고, 역사적으로 다져놓은 브랜드 이미지를 갖고 있기 때문에 앞으로도 지속될 것으로 보인다."
476,(주)신흥,4630,치과업계 1위라 망하지는 않을것같습니다 서울근무인 점이 메리트 연봉도 나름 대기업급 치과업계에서는 신흥을 알아주기 때문에 나름 자부심
477,(주)신흥,4630,"부서마다 다르겠지만 내 부서는 업무 강도 낮은 편. 젠틀한 부서원들과 거의 하지 않는 회식~전근대적 부서문화가 없고 임직원들의 연령대가 낮은 편이라 신선함이 있음. 칼퇴근. 초봉은 삼천 중반대~후반대(영업직)로, 웬만한 마이너급 대기업 수준."
478,(주)신흥,4630,"인도, 인도네시아 및 중국 등의 지속적으로 수주가 증가하고 있다. 대기업을 제외하고 사회 초년생이 받기 힘든 연봉을 받을 수 있다."
479,(주)신흥,4630,"60년이상의 전통, 치과에서 신흥하면 모르는사람 없음, 망할일없을듯"
480,(주)신흥,4630,동종업계속에서 높은 연봉을 자랑하며 복지수준도 나쁘지 않다. 개인 연수원을 갖추고 있다.
481,(주)신흥,4630,연봉이 적지는 않음. 본인만 견디고 열심히 한다면 진급의 가능성이 열려있음.
482,(주)신흥,4630,연봉은 많이 받을 수 있습니다...미래에 치과 재료 및 인맥은 장점이 될 것임
483,(주)신흥,4630,"향후 업계전망나쁘지 않은점, 영업사원으로서 체력이 된다면 도전해봄직함."
484,(주)신흥,4630,높은 초봉 여초부서의 경우는 야근이 덜함 빠짝 돈벌고 나오기 좋음
485,(주)신흥,4630,치괴업계 1위라고 하니 이직할경우 경력인정도 받을수 있고 초봉도 괜찮음
486,(주)신흥,4630,외근직의 경우 자유로운 근무 가능 비교적 높은 초봉 영업적으로 거래처 방문시 환영받는 분위기
487,(주)신흥,4630,초봉이 높다. 스펙 잘 안본다. 건수만 잘 따면 근무 시간에 자도되고 놀아도 된다. 실적이 좋다면야..
488,(주)신흥,4630,주말에 일을 나가야 하는 경우가 많지만 대체휴일을 쓸수 있어 업무강도가 높지 않은 편.
489,(주)신흥,4630,"치과 업계 1위이지만 앞으로는 어떨지 잘 모르겠다. 제조, 유통 전부 다 앞도적인 점유율로 하고있어서 직장다니면서 뽀대는 남"
490,(주)신흥,4630,동일 업종에서 국내 최고 기업. 과점시장이라고 보면 됨. 동일업종에서는 가장 높은 급여를 주는 기업
491,(주)신흥,4630,업계 1위 기업에서의 근무를 통해 계통내에서는 근무 경력이 크게 인정
492,(주)신흥,4630,"경력쌓기 좋음, 동일업계에서 인정해주긴 함, 다양한 분야를 배울 수 있음, 업무가 특정되어 있지 않음, 장기근속 시 복지는 괜찮음"
493,(주)신흥,4630,초봉이 좀 쌘편이다. 입사 시 스펙이 다양한걸로 봐서 큰 차별이 없는 듯 하다.
494,(주)신흥,4630,"본사의 부서를 계열사와 관계사로 나뉘어져있음. 그래서 그냥 부서같은 느낌임. 부서마다 분위기가 다르지만, 관계사와 계열사로 갈수록 눈치가 덜 보이고 퇴근이 빠른 편임. 부서마다 다르지만 야근이 없는 부서도 있음. 중견기업이지만 초봉이 높은편이고, 승진은 연공서열이라서 가만히 기다려도 대리는 달수있음. 착실한 사람이 많이 모여서 싸이코는 없"
495,(주)신흥,4630,치과 산업의 특성상 진입장벽이 높아서 갑자기 망하거나 하지는 않을 것 같습니다.... 공무원처럼 다니고 싶은 사람에게는 안성맞춤인 듯합니다....
496,(주)신흥,4630,치과업계에서 지난시간동안 1위의자리를 지키고있으나 오스템에게 밀리는중
497,(주)신흥,4630,치과업계에서는 오래된기업이라 모르는사람이 없음.동종업계에서는 초봉은 높은편.2-3년 바짝벌고 나오기 좋음.
498,(주)신흥,4630,업계 1위라는 자부심이 있음. 또한 영업에 재능이 있다면 인정을 빨리받음
499,(주)신흥,4630,복지가 좋다 사원들이 일에만 노력하게끔 환경을 만들어준다
500,(주)신흥,4630,업력이 말해주듯 안정적인 회사 규모가 아주 크지도 않지만 또 작지도 않은 중견기업이며 매출이 안정적이고 적자가 나지 않는 회사
501,(주)신흥,4630,업계 1위기업으로써 초봉은 높은편이고 전국에 많은 사무소로인하여 원하는지역에서 근무가 가능함
502,(주)신흥,4630,규모에비해 초봉은 높은편임. 그래도 업계에선 이회사 출신이라면 받아주는곳 많음
503,(주)신흥,4630,장점 같이 일하는 사람들이 나쁘지 않았다. 서울역 위치 교통 편리. 주변 조용함.
504,(주)신흥,4630,이분야에서는 제일 큰 기업이고 자본구조도나름탄탄한것같고 전시회등에서 회사파워를 느낄수있음
505,(주)신흥,4630,회사자체는 탄탄하고 망할 걱정 없고 잘 나간다는게 장점 업계 1위.
506,(주)신흥,4630,팀마다 다르지만 대부분 분위기가 나쁘지 않다. 사옥을 갖고 있음.
