,company_name,company_id,review_text
172,(주)신흥,4630,"다양한 업무를 경험할 수 있음.기계,임플란트 영업 및 기계 설치, AS 등 신규개원까지 다양한 일을 해볼 수 있음"
173,(주)신흥,4630,연차쓰는건 괜춘합니다 점심식사나오고 지문형식 출퇴근입니다
174,(주)신흥,4630,억지로 채워야하는 30자이지만 초봉이 괜찮고가 끝입니다
175,(주)신흥,4630,솔직히 돈은 많이벌수있음... 나온연봉이 솔직히 3천300쯤되는데 배는 벌수있음... 그거말고는 없음...
176,(주)신흥,4630,"연차 및 주말대휴 사용 자유로움. (+부서,팀마다 차이는 있는듯)"
177,(주)신흥,4630,카페있음 교통좋음 초봉낫배드 30자 채우래서 억지로 채웁니다
178,(주)신흥,4630,비교적 연봉이 괜찮다. 엄청 높진 않아도 만족하는 수준
179,(주)신흥,4630,이것저것 경험 가능하고. 의료계 관심있으면 배울 점 많다. 치과의사들 많이 만날 수 있다. 전문적인 업계 전문가가 될 수 있다. 몇년 잘 버티면 다닐 만하다.
180,(주)신흥,4630,동종업계에서 월급이 높은편이며 출퇴근시간이 어느정도 일정한점 동종업계의 기업인지도가 있음
181,(주)신흥,4630,카페가 무료입니다 커피는 공짜로 먹어서 이 복지만 주어집니다
182,(주)신흥,4630,"안정적인 회사. 최초 치과업계, 본사 위치 좋음, 본사 사람들은 인성 괜찮은 편, 접대 없음"
183,(주)신흥,4630,중견기업으로 안정적인 회사 버티기만 하면 오래 일할수 있음
184,(주)신흥,4630,팀에 따라 다르지만 비교적 연차 사용이 자유롭다. 사내 카페가 있다. 덴탈마스크를 한 달에 25매씩 지급한다.
185,(주)신흥,4630,음 서울에잇다 카페가 무료다 건물은 나쁘지안ㄹ다 위치도 괜찮
186,(주)신흥,4630,"사내 카페가 있음. 네임벨류 있는 중견기업, 사옥이 있어서 좋다. 서울에 본사가 있다. 지역별로도 사무실이 있다, 초봉은 괜찮다"
187,(주)신흥,4630,초봉이 쎄지만 연봉인상률이 없음. 잘리겠다는 불안감은 없다
188,(주)신흥,4630,없어. 그래. 솔찍히 냉정하게 생각해서 이시국에 월급 밀리는건없지. 다만 그 돈 주는걸 빌미로 일 오지게 시킴
189,(주)신흥,4630,없지만 굳이 꼽으라면 사무소 인원이 적어 직원들끼리 끈끈하지만 그마저도 금방 퇴사합니다.
190,(주)신흥,4630,사내카페에서 커피 무료로 마실수 있다 지하주차 가능하다
191,(주)신흥,4630,업계에서 가장 오래된 회사라서 독점으로 가지고있는 아이템이 많아 쉽게 망하지는 않을것 같은 회사임
192,(주)신흥,4630,지방사무소에서 일하기에는 좋음 지방에서 생산직 아니고서 이정도 받기 어렵다.
193,(주)신흥,4630,개별 인센티브제도가 아니라 자기가 실적이 없어도 동일한 인센티브를 받음.
194,(주)신흥,4630,"사내 카페 무료, 사내 도서 무료, 아침마다 우유 바나나 같은 간식거리, 월급 밀릴 일 없음, 초봉 괜찮다 (상여금 포함), 워라밸 지켜짐 (부바부겠지만), 사람들 (대리~사원급) 착함, 자잘한 복지 신경쓰는 편, 치과 업계에서 인지도 있음."
195,(주)신흥,4630,1.연차 사용은 자유롭게 2.빨간날 공휴일 다 쉼. 3.급여 잘들어옴 4.직원들 착함
196,(주)신흥,4630,장점은.. 생각보다 높은 급여라고 생각합니다. 정규직으로 전환되고 생각보다 높았습니다.
197,(주)신흥,4630,치과를 들어가면 원장님들이 신흥을 모르는 사람은 없음 요즘은 신흥안티도 엄청 많아져서 이것도 장점인지 모르겠음
198,(주)신흥,4630,"영업비 지원, 사내 아파트 지원 보너스가 자주 나온다."
199,(주)신흥,4630,상대적으로 높은 업계 초봉말고는 큰 장점을 찾기 어려움.
200,(주)신흥,4630,업계대비 높은 연봉. 없지 않은 복리 후생. 업계1위 기업이라 치과 어딜가나 알아봄
201,(주)신흥,4630,"사내카페가있으며아침마다 바나나 우유등을 제공, 작기는 하나 체력단련실도 있는게 장점이라면 장점임임"
202,(주)신흥,4630,워라밸은 확실하고 동종업계대비 연봉이 높은 편이라 생각없이 다니기 좋음
203,(주)신흥,4630,근무환경과 분위기가 좋고 일을 배우기에 좋습니다. 치과 의료 장비 시스템업체이고 인정받는 기업입니다 본사가 서울에 있음
204,(주)신흥,4630,"동종 업계 상위연봉, 서울 중심 위치, 편리한 교통, 무료 사내 카페, 야근 없음"
205,(주)신흥,4630,"신입 연봉이 높아서, 처음에는 굉장히 혹한다 카페테리아가 있어서 무료로 음료를 먹을 수 있다."
206,(주)신흥,4630,장점이 뭐가 있는지 곰곰히 생각해보았는데 시간이 자유로운 점 정도. 업계에선 유명해서 모르는 치과의사는 없음.
207,(주)신흥,4630,60년이상의 업력을 바탕으로 다양한 경험을 쌓을수 있다.
208,(주)신흥,4630,중소기업치곤 초봉이 높은 편이다. 그래서 신입들이 많이 들어오지만 얼마안되서 금방 다들 그만둠. 많이 그만두니까 많이 뽑음. 금이랑 부동산이 많아서 재정은 튼튼하고 아직도 업계 1위라는(옛날말임. 지금은 인지도로 보나 오스템임..)망상에 빠져잇음. 퇴사했던 동기들도 신흥만 추억하면 거기가 얼마나 지옥같았는지... 지금 회사가 천국같다고 입을 모아 말함ㅎㅎ 이직한 회사에서 사소한 거 하나하나에 감사하고 감동하며 살게되엇음 ㅋㅋ
209,(주)신흥,4630,덴탈체어로 명맥을 잇다가 기자재로 파이를 넓히려고 노력
210,(주)신흥,4630,쉬는 날 쉬고 월급이 딴 곳보다 높으며 따박따박 제 날짜에 나온다. 그리고 사내카페
211,(주)신흥,4630,초봉 높다. 대리까지 높음. 카페있으나 자꾸 돈받으려고 함
212,(주)신흥,4630,월급이 밀리지않아 좋다. 특별히 업무가 없는이상 칼퇴가능
213,(주)신흥,4630,기업한줄평에 말한대로 신입사원치고 초봉이 괜찮음. 사원들도 부서마다 다르겠지만 연령대가 어린 편임. 사내에 무료 카페가 있다는 것도 장점
214,(주)신흥,4630,업계에서 꽤나 입지가 높으며 일부 재료들은 시장에서 과점하고있어 영업이 수월
215,(주)신흥,4630,월급 밀리지않고 초봉은 문과기준 높다 서울 위치 접근성 좋음 전시회빼고 루틴업무..고인물에게 편한
216,(주)신흥,4630,업계 대비 초봉이 높으나 연봉 상승률은 낮음 기술을 배울 수 있다는 장점이 있음 운전실력 상승 고된 의료장비 설치로 간접헬스 체험
217,(주)신흥,4630,단단한 재무구조로 공무원식의 생활이가능하다 별장점이 없네요..
218,(주)신흥,4630,"부서마다 분위기는 다르지만, 연차 사용에 큰 제한은 없다. 카페 라운지, 북카페 등이 있어서 직원들이 활용할 수 있는 공간이 있다."
219,(주)신흥,4630,높은 초봉. 호화로운 연수원에서의 신입사원 연수. 유류비 지원.
220,(주)신흥,4630,치과 업계에서 모르는 사람이 없는 업계 사관학교. 인지도만큼은 최고
221,(주)신흥,4630,규모가 있는편이라 일배우기 좋음 이경험 저경험 다양하게 할수있음
222,(주)신흥,4630,혼자 일하니 시간 배율 잘하면 본인시간 챙길수 있음 본사 좋음
223,(주)신흥,4630,적지 않은 급여 근무지등이 좋다 연수 절차들이 잘 되어있다
224,(주)신흥,4630,커피가 무료/ 책 대여 가능 그 이상 없는데 어떻게 30자를 쓰라는거죠!!!!!
225,(주)신흥,4630,초봉이 높음 회사물건 안 팔고 시중에 파는 물건으로 수리시 알바비 벌수 있음
226,(주)신흥,4630,월급이 밀리지는 않는다. 회사가 망하지는 않을듯. 인생을 돌아보게 됨
227,(주)신흥,4630,"동종 업계 대비해서 초봉은 높음, 부서에 따라 다르겠지만 본사 직무일 경우 나름 지켜지는 퇴근시간"
228,(주)신흥,4630,사회초년생이 받기에는 높은 급여 나이든 치과의사들에게는 악명도 높지만 신뢰도도 높은 기업
229,(주)신흥,4630,"치과에서 알아주는 브랜드, 높은 초봉, 폭넓게 업무를 수행가능."
230,(주)신흥,4630,회사가 안정적임 월급 밀리는 일 없고 시키는 것만 하면 되는데 체계 없이 급박하게 진행되는 일만 있어서 지치기 쉽다.
231,(주)신흥,4630,"동종업계 대비, 중견업계 치고도 초봉이 높은 편. 아침에 간단한 사내 카페가 무료."
232,(주)신흥,4630,영업비는 나쁘지않게 나오며 그래도 나름 업계에서 이름 있는 브랜드파워
233,(주)신흥,4630,치과의료기기는 알아주는회사이다 그 점에서 아주 괜찮다.
234,(주)신흥,4630,"초봉이 높고, 회사에서 별다른 통제나 관리가 거의 부재함"
235,(주)신흥,4630,나름 인지도가 있어 치과의사들이 많이 접해본 회사이다.
236,(주)신흥,4630,"커피무료, 준공공기관마인드로 큰욕심없이 다닐수있음. 사장이하라는대로만 하면 중박은침. 주도적으로 하려는 마음을 버리면 편안하게살수있음"
237,(주)신흥,4630,야근이 거의 없음(야근비도 없음) 업무 강도가 낮음 신입들은 생각없이 다니기 좋음
238,(주)신흥,4630,"회사 월급 및 그 외 영업활동비, 인센티브 등을 잘 준다. 열심히 하는 만큼 부수적인 수입도 기대할 수 있다."
239,(주)신흥,4630,직원들은 착하고 좋은분들은 있다는점 이외에 아무것도없음
240,(주)신흥,4630,"AS, 영업, 설치 등 다양한 분야의 일을 하고 있어 일을 배우는데 좋다"
241,(주)신흥,4630,상여금까지 포함하여 계산하면 나쁘지 않은 신입 초봉. 사내 카페 마련되어 있으며 모든 음료 및 간식 무료. 월급이 밀릴 일은 없음. 버티면 철밥통이나 다름없는 안정적인 직장.
242,(주)신흥,4630,적당히 돈벌면서 다니기는 괜찮은거 같고 평일저녁 가족과 같이 있기 싫으면 다닐만한 기업이다. 그외에 장점은없는듯 하다
243,(주)신흥,4630,장점이랄게 있을까. 초봉은 좀 높은 편이지만 급여 상승폭이 낮음. 서울 본사 사옥이 좀 이쁘긴 함. 사내카페 있음
244,(주)신흥,4630,초봉이 높고 무료 카페가 있음. 업계에서 알아주기 때문에 영업할 때 방문 판매식이 아닌 연락을 받고 찾아가는 식이다.
245,(주)신흥,4630,초봉이 괜찮은편.먹을건 잘챙겨줌. 사람들도 무난하고 욕심있는 사람 없음
246,(주)신흥,4630,"타 회사에 비해 초봉은 높음 편임 , 사내 카페가 있다."
247,(주)신흥,4630,임플란트 업계에서는 알아주는 회사다. 동네 치과 좀 큰데만 가도 신흥 알아 본다. 페이는 평균 이상인것으로 알고있다.
248,(주)신흥,4630,초반 진입이 쉬움. 업무 난이도 높지 않고 치과 생태체험 가능. 퇴사후 재료상으로 전직가능.
249,(주)신흥,4630,기업의 장점은 너무 힘들어 직원들끼리 유대관계가 좋습니다.
250,(주)신흥,4630,카페 이용이 자유로운 점 사내 카페를 이용할 수 있어 이점은 좋음
251,(주)신흥,4630,인센티브를 잘 챙겨받을 수 있고 연차를 윗사람 보지 않고 사용할 수 있음
252,(주)신흥,4630,나름 높은 초봉과 기업인지도. 치과업계에서 신흥이라고하면 알아줌.
253,(주)신흥,4630,장점은 카페가 무료이다 아침에 출근해서 커피 점심먹고 커피 일하다 화가나면 커피를 마실 수 있다 이것은 매우 만족
254,(주)신흥,4630,"일단 초봉은 제일 많다는데 거의 오르지않는다고보면되고 영업,as 등 다양하게 배울수밖에없음"
255,(주)신흥,4630,군대조직문화를 좋아하시는 나이가 있으신 분들이 오면 좋을듯합니다.
256,(주)신흥,4630,월급 제때 나오며 망하지않을 곳 입니다. 일 자체가 많거나 한 곳은 아닙니다.
257,(주)신흥,4630,장점이라.. 정말 찾기힘드네요 월급 제대로 나오는게 최대장점
258,(주)신흥,4630,그냥 저냥 다니는 것에는 나쁘지 않음. 한마디로 모든 것에서 무난하다고 보면 됨.
259,(주)신흥,4630,"정확하고 밀리지 않는 월급, 내일만 잘하면 큰 문제 없음"
260,(주)신흥,4630,주말근무 빼고는 퇴근시간 명확. 야근 안하는거에 비해서 급여는 안정적
261,(주)신흥,4630,팀마다 분위기 다르지만 칼퇴가능. 위치가 서울역이라 편함. 근처에 은근 맛집 많음.
262,(주)신흥,4630,큰 장점은 모두가 말하듯이 월급 칼같이 들어옵니다 말곤.. 딱히...
263,(주)신흥,4630,일 잘하는 사람만 업무 몰빵으로 레벨업 가능 무상 카페 제공운 최대의 장점
264,(주)신흥,4630,다양한 일을 적은 연차에 경험할 수 있음. 그 만큼의 권한도 주어짐.
265,(주)신흥,4630,중소기업을 넘어선 중견정도여서 그래도 나름 시스템은 잘 갖추어져있었음
266,(주)신흥,4630,초봉이 높음. 관련업계에서 뼈를 묻고 싶다면 경험해보는 것도 좋음
267,(주)신흥,4630,"굳이 꼽자면 업력에 따른 안정성, 다양한 사람들이 있구나 경험해볼 수 있음"
268,(주)신흥,4630,"사내 카페, 사내 카페, 사내 카페, 좋지도 나쁘지도 않은 급여 , 남자 영업사원에게 좋은 회사"
269,(주)신흥,4630,여러 복지들이 있습니다. 카페 급여 등 만족할만한 복지가 있기는 합니다.
270,(주)신흥,4630,"휴가가 비교적 자유로움, 젊은 직원이 많아 동료애를 느낄수 있음"
271,(주)신흥,4630,회사 내 카페가 무료! 나름 괜찮은 연봉과 회사 내 분위기 또한 사원들과 상사들이 좋은분들이 많음
272,(주)신흥,4630,굳이 장점을 뽑자면 기본급은 높은편. 그외에 장점을 찾기 힘듬.
273,(주)신흥,4630,"서울근무시 서울역 근처 회사가 있고, 부서마다 상이하지만 업무강도가 쉬운곳도 분명히 있다."
274,(주)신흥,4630,"유통망이 그나마 장점, 쌓아온 치과계 인지도. 알짜부동산으로 인해 안정적"
275,(주)신흥,4630,타기업에 비해 연차 자유롭게 쓸 수 있음. 전시회 근무가 많지만 (주말) 그에 따른 보수는 적절하게 지급하여 줌.
276,(주)신흥,4630,충정로 역 부근 본사 건물 사내 카페 월급 밀리지 않음
277,(주)신흥,4630,사내 카페 인지도에 비해 높은 초봉 기업의 안정성이 높다. 망하지 않을 듯
278,(주)신흥,4630,연봉은 적지않은편 나이가 많으신 분들은 아직 신흥에 대한 이미지가 좋은편 인거같습니다
279,(주)신흥,4630,육아휴직은.쓸수있는것으로.알고있으나 위에서.눈치주는것같음
280,(주)신흥,4630,없습니다. 장점이라고 다니면서 느껴 본게 없어요 아 동료들끼리 친하다는 점?
281,(주)신흥,4630,초봉이 높고 치과의 모든것을 배울수있음 개인성과가 아닌 사무실 매출이라 영업하긴 편함
282,(주)신흥,4630,"동종업계 중 초봉이 가장 높은 편, 적당히 경력 쌓을 수 있음"
283,(주)신흥,4630,초봉에 쎈편이다 서울역/충정로역이라 위치는 나름 괜춘하다 카페테리아 있어서 커피를 무제한이다 연수원이있다
284,(주)신흥,4630,회사 건물 있음. 업계에서는 나름 인지도 있음. 초봉이 나름 높은편
285,(주)신흥,4630,급여가 밀리지 않고 업무강도는 케바케다.가장 큰 장점은 카페가 공짜라는 점정도.
286,(주)신흥,4630,업계에서 나름 알아주는 회사 업무를 주도적으로 하지 않는 사람이라면 만족할 수 있을 듯 분위기가 보수적이고 윗선이 결정한 업무를 수행만하는 단순한 업무가 많음
287,(주)신흥,4630,좁은 인력풀로 인해 많은 것을 빠르게 배울 수 있음. 다양한 업무를 경험할 수 있음
288,(주)신흥,4630,서울에 위치하여 자가와 가까워서 좋았습니다. 다양한 경험을 할 수 있어 좋습니다.
289,(주)신흥,4630,"업계에서 가장 오래된회사, 이며 회사 빚이 적어 단단함, 많은것을 배울수 있으나 그것이 오히려 단점"
290,(주)신흥,4630,월급이 밀리지않고 서울역에서 가까움...업무강도는 엄청 높지않지만 중간계급이 다 빠져나가서 고인물만남아 배울점이 많음
291,(주)신흥,4630,"안산공장의 경우 식대 무료, 결혼시 주택제공, 학자금 50% 지원 등등 복지가 꽤있었음 그리고 안산공장의경우 주어진시간만 딱일하고 퇴근함."
292,(주)신흥,4630,"사내 무료 카페 이용, 연수원 이용, 높은 초봉이 큰 단점"
293,(주)신흥,4630,"급여가 연차대비 높으나, 업무강도가 높다. 몸쓰는일이 70프로 이상."
294,(주)신흥,4630,말한대로 신입 연봉치고는 낮지 않음. 업계에서도 연봉을 높은 편. 연봉이 높다는 것 밖게 없긴 함.
295,(주)신흥,4630,"동종업계 최고 수준의 초임, 부서마다 다르지만 워라밸 어느정도 보장."
296,(주)신흥,4630,장점? 그냥 오래된 회사? 앞에서는 티는 안냄 뒷말 많은 꼰대회사
297,(주)신흥,4630,오랜 회사역사를 가진 전통있는회사 업계에서는 인정받는 시장지배력 회사
298,(주)신흥,4630,겉보기엔 커보인다. 체계적으로 보이고 치과계의 고유명사같은 회사라 네임밸류는 있다.
299,(주)신흥,4630,없음 모르겠음 장점이 있는지 몰라요 힘들어요 일 잘하면 칭찬받음 그게 끝임
300,(주)신흥,4630,"초봉 쌤, 망하지않음, 사택있음, 월급안밀린다, 본사가 보기좋다, 직원들 커피숍을 운영한다, 잘할자신있는 사람은 미래가보인다"
301,(주)신흥,4630,가족 같아서 친근하고 좋습니다. 정해진 야근 요일 외에 추가 근무는 거의 없습니다.
302,(주)신흥,4630,말한대로 초봉이 높아 첫 직장으로써 기분좋게 출발할수있다.
303,(주)신흥,4630,"사회초년생에게 주는 것치고는 다소 높은 연봉, 워라밸이 좋은 편으로, 출근 시간이 이르고 퇴근시간이 늦기는 하지만, 출퇴근 시간만 맞추면 야근을 할 일이 그다지 많지 않음. 단 기계 영업은 예외"
304,(주)신흥,4630,"경쟁사, 연차 대비 급여를 약간은 더 주는 듯 함. 영업직은 일비 포함하면 꽤 괜찮은 급여 수준을 유지할 수 있다."
305,(주)신흥,4630,상여금제도가 맘에 들었습니다. 2달 단위의 체계는 좋았습니다.
306,(주)신흥,4630,"카페테리아, 전용 사옥, 업계 탑이라 자부심있고 배울 수 있느넥 많아서 경력 쌓기 좋음"
307,(주)신흥,4630,오랜 역사를 가진 회사인만큼 탄탄하고 체계적인 운영을 이루고있음. 또한 사회초년생이 경험하기는 좋은회사임
308,(주)신흥,4630,장점은 연수원 보유하고 있고 주말 내내 서서 근무하면 5만원 상품권 줌
309,(주)신흥,4630,연월차를 눈치안보고 쓸수있고 장기근속자는 혜택을 주는기업입니다. 기본적인 업무프로세스는 잘 갖춰져 있는편입니다. 업무를 다방면으로 경험하기 좋습니다.
310,(주)신흥,4630,"직원의 99% 이상은 공채를 통해 입사하므로 회사에 대한 소속감과 애정이 강하고, 선후배간의 친밀도가 높다. 동종업계에 종사하는 사람들중 신흥 출신 인력이 대단히 많으므로 관련업계의 전문가를 캐리어로 삼는다고 생각하면 대단히 좋은 출발처가 될수있슴"
311,(주)신흥,4630,초봉은 높음 이게 유일한 장점인데 30자 이상으로 뭘적으라는건지 자유로운 업무분위기도 사무소마다 다름 30자 이상으로 뭘적으라는건지 30자 이상으로 뭘적으라는건지
312,(주)신흥,4630,"비교적 자유로운 연차, 근무지가 역과 가까워 통근 용이"
313,(주)신흥,4630,의료기기에 관한 교육을 아끼지 않습니다 신입치고 연봉은 나쁘지 않다 나름의 연차를 권면한다
314,(주)신흥,4630,초기 3개월간 다른회사에 비해 연봉이 조금 높은 그러나 나중
315,(주)신흥,4630,초봉이 높은 편에 속하기 때문에 급전이 필요할 때 입사를 추천.
316,(주)신흥,4630,일반 대중들에게는 생소하지만 업계에서는 네임벨류가 높은 기업으로 인식됨
317,(주)신흥,4630,영업에 자신 있다면 추천합니다. 실적 스트레스만 받지 않는다면 괜찮은 회사에요.
318,(주)신흥,4630,- 동종업계 대비 높은 연봉. 월급 안밀림. - 음 그리고 30자
319,(주)신흥,4630,1. 나쁘지 업무 강도. 더럽기로 유명한 의료제약 분야 치고는 상당히 순한 맛이라고 생각 2. 나쁘지 않은 연봉. 특히 유닛체어 영업쪽이라면 다양한 방법으로 짭잘하다. 3. 그래도 인간적인 사람들. 물론 나랑 안맞으면 고통은 두 배
320,(주)신흥,4630,월급은 단한번도 안밀림. 팀회의 필요없음 어차피 사장이 결정하고 생각함
321,(주)신흥,4630,가늘고 길게 오래다니기엔 좋음. 돈은 그럭저럭주고 이름빨이 조금 있는회사임
322,(주)신흥,4630,"초봉이 높고, 능력이 전혀 필요없다. 그저 버티고 버티는 사람만 남는 회사."
323,(주)신흥,4630,회사가 절대 안망할 것 같은 점 월급이 은근 괜찮 채용과정은 투명하다 근데 동기들 보면 저런애가 왜들어왔나 싶다
324,(주)신흥,4630,"직원들이 공짜로 마실수있는 사내카페가 생겼으며, 다른 회사로 이직이 좋다"
325,(주)신흥,4630,회사가 보유하는 돈이 많아서 쉽게 망하지는 않을 회사라는 점
326,(주)신흥,4630,사내 카페 공짜임 그래서 밖에서 사먹을 필요가 없어서 좋음
327,(주)신흥,4630,업계에서 신흥이라고 하면 다 알고있어서 거래처 방문하기 쉽다.
328,(주)신흥,4630,"요즘 신입사원 연봉들이 낮게 시작하는 곳도 많지만, 이곳은 그래도 이 업종 내에서는 높은 신입사원 연봉을 제공하는 편입니다.(동일업계기준)"
329,(주)신흥,4630,글쎄요 장점은 연봉이 높음 근데 그마저도 영업다니는 사람은 자차필수 기름값은 줌
330,(주)신흥,4630,"사무소 바이 사무소이지만 몇몇 지방 사무소의 경우는 퇴근시간이 매우 빠르고, 외근 특성 상 업무의 강도를 본인의 의지대로 조절 가능하다. 덴탈업계에서 나름 명성이 있어 고객을 대하는데 있어 큰 어려움이 없다. 많은 분야의 취급으로 일반 기술에서 부터 연구까지 깨닫고 얻는 것이 많다."
331,(주)신흥,4630,"신입사원 채용시 절차가 여느 대기업에 뒤지지 않을 만큼 체계적, 치과 관련 산업의 토탈 솔루션 제안, 초봉 치고 낮지 않은 급여, 서울역 인근의 접근성(본사)"
332,(주)신흥,4630,대리 정도까지는 급여가 괜찮다 그거 말고는 없다 좋은게 좋은거다라는 마인드임 그래서 특별히 모난 사람은 많지않다
333,(주)신흥,4630,"회사 경영을 위한 자금은 부족하지 않아 보인다. 사내 카페가 있어 자유롭게 이용 가능하다. 휴양 시설을 이용할 수 있다. 단, 자리가 남아 있을 경우"
334,(주)신흥,4630,초봉이 높고 소소하게 내 할일도 할 수 있는 회사라고 생각함
335,(주)신흥,4630,초봉은 조금 높은편이다. 지역에 따라 다르지만 분위기가 좋은 곳도 있다.
336,(주)신흥,4630,입사 후 운전이 늘고 빚도 늘고 스트레스도 늘어 납니다.
337,(주)신흥,4630,카페무료. 끝. 좋은걸 30글자나쓰라니 너무하시네요 ㅠㅠㅠㅠㅠㅠㅠ 좋은게없습니다. 정말 솔직하게.
338,(주)신흥,4630,신입으로는 꽤 높은 초봉과 업계에서 알아주는 탄탄한 기업!
339,(주)신흥,4630,정말 다방면으로 배울수있다. 오래버티면 승진가능 사내 카페잇음 회사 망할일은없음 건물이 깨끗
340,(주)신흥,4630,안정적이며 누구나 능력을 발휘하면 좋은 기회를 얻을 기회가 많다. 출신학교에 대한 차별이 없고 능력별로 판단한다. 대졸 초임은 중소기업치고 좋은 편이다.
341,(주)신흥,4630,공짜 사원카페
342,(주)신흥,4630,연차 및 대휴 눈치안보고 사용가능 업무가 개개인으로 나누어져있음
343,(주)신흥,4630,"월급이 제때 들어옴, 월급이 많은편이라고 함. 오래된 기업...."
344,(주)신흥,4630,as에 대한 기술적인 부분을 많이 배워 현금화 가능한 아르바이트 가능
345,(주)신흥,4630,주 5일이라서 자기 시간이 많고 기숙사를 지원 해주고 기숙사를 이용흐는 사람은 아침을 지원해 준다
346,(주)신흥,4630,야근없음 있다하면 많아야 달에한번정도 승진은 시간되면 되고 월급도 연차되면 알아서 오름 생각없이 출퇴근하기좋음
347,(주)신흥,4630,"의료분야이기에 대부분이 수입에 의존하는데, 국산화를 시도하기위해 개발조직을 설립하는등 적극적으로 시장을 확대하려고 노력하는 회사입니다."
348,(주)신흥,4630,"의외로 연봉이 높고, 되게 안정적임. 영업에서 수익이 증대하는건 아니나 안정적인 구조임"
349,(주)신흥,4630,"연차 슬슬 사용가능, 실수령기준 대기업 뺨치는 연봉, 사택지원등"
