,company_name,company_id,review_text
0,(주)리드코프,1388,"워라밸이 아주 좋고, 내가 다녔던 지방 지점 사람들의 인성은 좋은편이었음"
1,(주)리드코프,1388,급여가 낮다는 리뷰가많은데 24년 현재 22년 초봉보다 500~1000만원은 많은듯 사람들 매너있고 괜찮음 큰소리내는 사람이없음 조용조용함 여름휴가 5일 휴가비 50만원 한화계열 리조트사용가능 기본적인 중견급 복지 다수 존재 실손가입 회식 거의안함 시청역 바로위 접근성 좋음 건물 내부시설 깨끗하고 좋음  중소 강소기업들보단 훨씬좋음
2,(주)리드코프,1388,일자체는 심사업무라 재밌었다. 그리고 대체로 젊은층이 직장동료들인것도 좋았음
3,(주)리드코프,1388,"워라밸 좋고 위치가 역세권, 당일 일만 잘 끝내면 야근은 따로 없음"
4,(주)리드코프,1388,월급이 밀리지 않고 잘나오며 일년에 두번 상여금을 지급 받는 점이 좋았다. 월급이 늦게 나오는 일이 없으니 안심하고 다닐 수는 있다
5,(주)리드코프,1388,대부업계의 공무원 칼퇴 급여는 상여금 합치면 나쁘진 않음
6,(주)리드코프,1388,특별한 일이 없다면 정시퇴근(하지만 공고에는 없는 8시반 출근으로 매일 30분씩 야근하고 있는 셈임)
7,(주)리드코프,1388,"특별한 일이 있지 않으면 워라벨이 보장되며, 같이 근무하는 직원들이 대부분 좋습니다."
8,(주)리드코프,1388,연차사용 가능하다. 단 팀원들이랑 겹치면 조율해야되는게 번거로움
9,(주)리드코프,1388,장점이 없네요. 여의도에 위치해서 다니기 편했습니다..
10,(주)리드코프,1388,야근이 많지 않으나 이해되지 않는 업무를 디테일 없이 시작부터 함.
11,(주)리드코프,1388,좋은거는 딱히 없고 월급 안밀리고 나오고 칼퇴근이 가능한게 좋았음
12,(주)리드코프,1388,워라밸 좋음. 급여가 밀리지 않음. 많은 일을 경험해 볼수 있음
13,(주)리드코프,1388,잔업없음. 칼퇴근. 급여밀릴일 없음.동종업계 대비 만족할만한 성과금
14,(주)리드코프,1388,"워라밸이 장점이며, 일은 참 쉽다, 내가 있던 곳은 사람들도 좋은편이었다"
15,(주)리드코프,1388,출퇴근에 유일한 장점인데 이제 그것도 잘 모르겠다 한숨나옴
16,(주)리드코프,1388,반영이 아닌 날은 칼 퇴근 시간 (개발자에겐 딱히…)ㅋㅋ 연차 사유 묻지 않음
17,(주)리드코프,1388,시청역이랑 무지 가깝다 비오는날 지하로 다니니 비 안맞는다
18,(주)리드코프,1388,추심쪽은 워라밸 철저함. 8:30 출근에 18:00 퇴근이긴한데 진짜 딱 그것만 하면 됨. 야근 한번도 없었고 주말출근 한번도 없었음.
19,(주)리드코프,1388,칼퇴근이 가능하다. 월급이 안밀린다. 이석이 자유롭다..
20,(주)리드코프,1388,한달에 한번 연차 사용 여름휴가 5일 사용 가능(연차 소진) 빨간날 근로자의날 휴무 월급날이 주말이면 월급 먼저 입금
21,(주)리드코프,1388,연차쓰기 자유. 상여금나옴 워라벨 여러가지 경험을 쌓을수있음
22,(주)리드코프,1388,"월급 안밀리고 상여, 휴가비 나옴, 연차 자유롭게 사용 가능"
23,(주)리드코프,1388,밀리지 않는 월급 상여 휴가비 야근 거의 없는 칼퇴 가능
24,(주)리드코프,1388,한달에 한번 연차 가능. 칼퇴 가능함. 해고는 없는 회사.
25,(주)리드코프,1388,급여 제때제때 나옴 상여금 제때제때 나옴 휴가비 제때제때 나옴 연차 및 휴가 지점마다 케바케지만 못써도 환급해줌
26,(주)리드코프,1388,월급 안밀림 짬차면 놀아도 아래직원보다 돈 많이 받고 어깨에 힘 뿜뿜
27,(주)리드코프,1388,주5일근무와 공휴일 다 쉬는점이 장점.. 야근없음 그리고 a4용지 무한제공 실내 공기청정기 커피 제공
28,(주)리드코프,1388,연차 매달 쓸수 있음 여름휴가 달 상관없이 갈수 있음 명절 상여있음 여름 휴가비 있음
29,(주)리드코프,1388,그나마 있는 인센티브? 그 외엔 장점이 전무하다고 생각함
