,company_name,company_id,review_text
0,㈜메이드인헤븐,3812,소소한 문화와 사람들이 좋고 업무강도가 너무 심하지 않고 워라벨 보장됩니다.
1,㈜메이드인헤븐,3812,다양한 프로젝트 경험이 가능하며 업무적인 성장도 어느정도 가능
2,㈜메이드인헤븐,3812,굳이 꼽자면 비교적 자유로운 연차 사용. 그리고 엄청나게 딱딱하지는 않은 분위기 정도? 그외에 딱히 생각나는 장점은 없음.
3,㈜메이드인헤븐,3812,기기 구입비 지원. 사람들은 좋음. 가끔 이벤트도 함.
4,㈜메이드인헤븐,3812,"연차같은 경우는 윗사람 눈치 안보고 쓸 수 있으나 파견지가 어디냐에 따라좀 다를 수 있음. 연차에 따라 물품 구매비나 효도비, 국내여행, 해외여행 자금 지원이나 깜짝 이벤트 등 여러가지 복지에 관한 부분은 많이 생각하는편이다."
5,㈜메이드인헤븐,3812,"최소한의 복지를 갖추고 있다. 케바케이긴 하지만 팀별로 프로젝트를 수행할 때도 있고, 프로젝트에 대한 네고가 어느정도는 가능하다."
6,㈜메이드인헤븐,3812,"연차는 자유롭게 사용 가능하고, 일 하는 사람들의 성격은 좋음"
7,㈜메이드인헤븐,3812,"여러 복지제도가 존재하며, 성장의지를 보이면 도와주려고 함"
8,㈜메이드인헤븐,3812,월급이 잘 나옴 비용처리 잘됨 출퇴근시간은 비교적 좋은편임
9,㈜메이드인헤븐,3812,자기계발비 장비지원금 눈치 안보임 부모님 이벤트 마스크 지원
10,㈜메이드인헤븐,3812,연차는 눈치 안보고 쓸수 있습니다. 다양한 복지가 있으나 연차가 낮으면 쓸수없음
11,㈜메이드인헤븐,3812,"자기개발비 지원, 대기업 파트너사로 어떻게 돌아가는지 배울 수 있음, 이벤트를 많이해주는 편임(어버이날, 휴가, 예방접종 등)"
12,㈜메이드인헤븐,3812,나름대로 사람들 괜찮고 연차 쓰는데 프바프이긴 하지만 자유롭게 쓸수는 있음 월급 안밀리고 따박따박 나오고 인센도 나름 챙겨주긴함
13,㈜메이드인헤븐,3812,장비지원금(24개월분할지급) 경력직의 개인플레이 성향에 적합
14,㈜메이드인헤븐,3812,"디자이너, 퍼블리셔가 수시로교체되는데 빠른속도로수급이됨. 그것이 장점"
15,㈜메이드인헤븐,3812,급여 입금은 바로 바로 해줍니다. 그외 장점 없어요. 30자 채우기 힘드네요.
16,㈜메이드인헤븐,3812,연차는 나름 자유롭게 사용 가능 수평적인 회사 분위기 가끔 부모님 선물 보내줌
17,㈜메이드인헤븐,3812,중소기업에 비해 복지는 나쁘지 않습니다. 사내 활동 활성화를 위해 다양한 시도를 합니다. 성과급을 지급해 줍니다.
18,㈜메이드인헤븐,3812,사이트 파견으로 인한 독립적인 근무 그래서 눈치보지 않고 개발업무를 수행할수 있다.
19,㈜메이드인헤븐,3812,다양한 분야에 경험을 쌓을수 있다. 의사를 물어 다음 일에 대한 방향성을 제시해줌
20,㈜메이드인헤븐,3812,"눈치보지않고, 일할 수 있으며, 다양한 개발스택과 개발기술에 대해 배울 수 있으며, 최신 기술접목에 대해서 회사가 노력하는 편, 재택근무에 대해서 회사에서 긍정적으로 생각함"
21,㈜메이드인헤븐,3812,연차를 눈치 안보고 사용할수 있으면 출퇴큰 문화가 좋다
22,㈜메이드인헤븐,3812,"월급이 아침 7시에 들어와서 인상적이었다. 계약서 작성도 웹으로 하고, 여러모로 프리랜서가 일에만 집중할 수 있게 잘 해줘서 기억에 남는다. 경영지원 담당자들도 친절했다."
23,㈜메이드인헤븐,3812,개발자 대우 좋음 다양한 복지 제도가 있음 자기개발비와 장비 지원금으로 원하는 장비 구입 수평적 문화로 연차 사용 자유로움 SI / SM 골고루 하는편
24,㈜메이드인헤븐,3812,"연차를 눈치안보고 사용가능, 지각해도 뭐라그러는 사람 없음 불이익도 없음"
25,㈜메이드인헤븐,3812,급여가 밀리지 않으며 작업자 편의를 많이 봐주려고 합니다.
26,㈜메이드인헤븐,3812,"권위적이지 않은 임원들, 직원들을 위한 복지 정책에 관심이 많다"
27,㈜메이드인헤븐,3812,"눈치 안보고 연차사용 가능하지만 파견지의 갑 눈치가 너무 보임 갑에게 평가를 받는 시스템이기 때문에, 소소한 선물 잘 챙겨줌"
28,㈜메이드인헤븐,3812,회식이 거의 없음. 거의 칼퇴근. 또 장점은 아무리 생각해도 없음..
29,㈜메이드인헤븐,3812,연차사용이 자유롭고 모든 사람들이 친절하다 유연 출퇴근제도 괜찮다
30,㈜메이드인헤븐,3812,파견근무를 하는 회사로서 직원이 요청하는 조건에 맞는 근무지로 최대한 맞추어 줍니다. 파견지에서 애로사항이 있을 때 경영진이 직원의 요청사항을 들어주고 고객과 면담을 해 주며 해결해주고자 합니다.
31,㈜메이드인헤븐,3812,월급이 10일 오전에 출근도 전에 들어옵니다. 이렇게 빨리 주는 곳 처음..; 한 번도 늦은 적 없었어요.
32,㈜메이드인헤븐,3812,"많은 복지와 술을 권하지 않는 회식, 이제 곧 사옥도 생기고 동료 개발자도 다 좋다"
33,㈜메이드인헤븐,3812,"자유롭게 자신의 의견을 말할 수 있는 분위기, 복리후생의 끝판왕이라 불릴 수 있는 다양한 지원(자기계발비, 복지몰운영, 매월 부모님용돈지급, 부부해외여행지원등) 직원이 행복해야 고객이 웃고 회사도 성장한다는 기업의 분위기가 자리 잡고 있고 직원의 만족도를 높이기 위해 노력하는 회사."
34,㈜메이드인헤븐,3812,업체에 파견되어 업무하게 됨. 급여는 생각보다 많이 줌.
35,㈜메이드인헤븐,3812,연차를 눈치 않보고 쓸수 있고 중소기업이지만 직원 복지를 위해 노력하는 회사
36,㈜메이드인헤븐,3812,"좋은 사람들이 좀 있고, 급여는 잘나온다. 급여는 오전 7시쯤되면 칼같이 들어오고 문자로 수고했다고 온다."
37,㈜메이드인헤븐,3812,사내 분위기가 좋고 직원들에 대한 대우가 좋다. (급여 제외)
38,㈜메이드인헤븐,3812,팀 단위의 파견과 상대적으로 팀 분위기가 좋음. 회사에서 지속적으로 다양한 시도가 있음.
39,㈜메이드인헤븐,3812,"자유로운 회사 문화, 직원들간의 유대관계가 좋음, 직원들간 소통을 중요시 하며 모든 의견에 귀를 기울임"
40,㈜메이드인헤븐,3812,최고의 장점은 급여가 밀리지않고 따박따박 제때 잘들어오는것이지욤^^
41,㈜메이드인헤븐,3812,급여는 밀리지 않습니다. 특별한 사유가 있지 않는 한 인력 교체는 하지 않습니다. 그 외 프리랜서는 거의 신경 쓰지 않아 어떤 장점이 있는지 잘 모르겠습니다.
42,㈜메이드인헤븐,3812,규모에 비해 복지에 신경쓰고 노력하는게 보임. 규모가 크지않은회사는 대표님의 마인드가 가장중요한데 여기는 직원들을 존중해주며 직원들 의견을 들어줌.
43,㈜메이드인헤븐,3812,정말 수평적인 분위기임. 연차나 휴가도 눈치 안보고 한도내에선 자유롭게 쓸 수 있음. 중소기업 치고 복리후생도 나쁘지 않음. 자꾸 소통해서 건의사항들이나 안좋은 것들은 개선해나가려고 함.
44,㈜메이드인헤븐,3812,사원복지는 다른곳 (SI업체 기준)보다 좋음. 개발자를 단순 돈벌이대상으로 여기지 않고 인간적으로 대우해줌. 프리가 되어서도 관계 지속.
45,㈜메이드인헤븐,3812,자기개발비 조그줌 플젝나가면 본사 눈치 조금밖에 안봄 그래도 노력을 하려는거같긴한데 돈은 안씀
46,㈜메이드인헤븐,3812,복지혜택은 훌륭하다고 할 순 없지만 기본 이상은 주어지고 일하기에 나쁘지 않음. 꾸준히 일감이 있어서 월급이 밀리는 일은 없었음. 대표이사의 성품이 훌륭함.
47,㈜메이드인헤븐,3812,저는 복지에 관하여서 전반적으로 만족하고 있는 중입니다.
48,㈜메이드인헤븐,3812,불필요한 야근 등에 대해서는 타인의 눈치를 보지 않아도 됨. 대표 마인드가 직원들의 능률 향상에 관심이 많음
49,㈜메이드인헤븐,3812,프리랜서 계약의 경우 금액이 나쁘지않고 계약서대로 잘 이행하며 임금 체불이나 생트집 잡는게 없다
50,㈜메이드인헤븐,3812,파견 업체의 장점은 대표님 눈치를 안본다는 것이겠죠. 그리고 월급이 밀리지 않는 회사라 좋음
51,㈜메이드인헤븐,3812,개발자로써 초반 경력을 쌓기에는 괜찮음. 대표님의 매너는 정말 최고.
52,㈜메이드인헤븐,3812,신입 또는 초급으로 SI프로젝트 경험 쌓기에는 좋음
53,㈜메이드인헤븐,3812,나쁘지않은 복지혜택과 사람들이 좋음 팀제도로인한 회식이많음
54,㈜메이드인헤븐,3812,사장님은 정말 젠틀해 보임.. 내부 직원들 사람 너무 좋다.
