,company_name,company_id,review_text
0,㈜시어스랩,2133,강남에 위치해 있음. 새로운 건물로 이전해서 근무환경이 좋다.
1,㈜시어스랩,2133,같이 일하는 사람들이 좋았었다. 출퇴근하기 위치가 상당히 좋다.
2,㈜시어스랩,2133,AR이라는 기술과 딥러닝 그리고 최근 메타버스에 대한 기술 이해도를 높일수 있다. 유명한 대기업들과 협업하는 프로젝트에 참여할 수 있다.
3,㈜시어스랩,2133,여러가지 경험을 해볼 수 있고 진취적으로 업무를 진행할 수 있다
4,㈜시어스랩,2133,접근성 좋은 곳에 위치함. 사내 분위기가 좋은 편. 자판기 가격이 매우 쌈. 사무실 쾌적한 편. 대체로 야근이나 주말 출근 강요 없음
5,㈜시어스랩,2133,월급이 밀리지 않아요. 매달 정해진 날짜에 바로 들어와요.
6,㈜시어스랩,2133,버스 정류장 20초거리로 덥근성 용이 플렉서블 출근 제도
7,㈜시어스랩,2133,일이 없어서 개인적인 시간 보내기 좋음 간혹 회사인지 도서관인지 의문임
8,㈜시어스랩,2133,버스정류장과 가깝습니다. 강남이라서 접근성이 좋습니다.
9,㈜시어스랩,2133,"자유로운 분위기,부족하지도 넘치지도 않는 적당한 복지,다양한프로젝트를 경험해 볼수 있음"
10,㈜시어스랩,2133,자율출퇴근 장점 강남역 위치가 접근성이 좋음 다양한 프로젝트진행으로 다양한 경험가능
11,㈜시어스랩,2133,좋은사람들. 좋은문화.강남역부근. 정치질없음. 복지좋음
12,㈜시어스랩,2133,"IT관련 기술 회사 보다는 유통 회사 같으며, 이것이 장점인 이유는 유통/물류 회사 사람들은 잘 맞을 것이라 생각함. 그 외에 장점 보다는 단점이 더 많음."
13,㈜시어스랩,2133,"작은 규모의 회사지만 휴가 복지가 좋았음(25일) 회사 내의 분위기가 좋음, 동료들이 좋았다"
14,㈜시어스랩,2133,"지금은 모르겠지만 근무시기에는 사람들이 너무 좋았음 특히 경영지원팀이 잘 해줬고 대표님도 너무나 재미있게 해줬음 칼퇴, 주말근무없이 잘했고 점심 식사도 식당에서 할수 있었음 연차 눈치안보고 쓸수있음"
15,㈜시어스랩,2133,- 10시~7시 근무시간으로 아침이 편함 - 사람들은 좋음 - 사내 정치질 없음
16,㈜시어스랩,2133,"강남역에서는 좀 멀지만 버스 정류소가 바로 앞에 있어서 광역버스로 출퇴근하는 경우 (광주나 김포, 수원 등) 많이 걷지 않아도 됨"
17,㈜시어스랩,2133,스타트업이자만 히트 상품을 보유하고 있다.앞으로의 가능성이 있지만 매우 중요한 시기를 맞이하고 있다.강력한 리더십이 중요
18,㈜시어스랩,2133,같이 일하는 사람들이 대다수는 좋은 사람들 (물론 그중에도 기본적인 예의가 뭔지 모르는 부류는 있음)
19,㈜시어스랩,2133,사람과의 관계에서 상처받을 일이 별로 없었음 식비 줌 강남역이나 버스정류장에서 멀지 않아 위치가 나쁘지 않음
20,㈜시어스랩,2133,지금도 있는지 모를 장점 1. 좋은 팀원 2. 신규분야(였던것) 도전 3. 무시하면 가능한 워라벨(너네 퇴근 못하게 할거야!) 4. 연차 자유롭게 사용가능
21,㈜시어스랩,2133,- 강남에 위치해 있어서 출퇴근이 편했음. - 점심을 그래도 주긴 줬음. - 주변 동료들이 성격이 좋았음.
22,㈜시어스랩,2133,책임 이하는 연차사용이 자유롭지만 단 한사람이 휴가를 3일전에 올리지않으면 싫어함.
23,㈜시어스랩,2133,프로젝트 데드라인이라 어쩔 수 없는 경우를 제외하면 야근 없음. 연차 사용이 반려된 적은 없음. 대체로 수평적인 조직문화. 회사의 성장 포텐셜은 높다고 생각함.
24,㈜시어스랩,2133,메타버스플랫폼을 야심차게 준비하고 있음. 외형도 점점 성장하고 있음
25,㈜시어스랩,2133,"중간중간 휴식 가능, 식대 제공, 작업물이 많아 경험 쌓기에 최적화, 사업기반 안정적이고 체계적인 시스템을 갖춤."
26,㈜시어스랩,2133,"함께 일하는 ""대부분의"" 직원들이 착하고 친절했습니다."
27,㈜시어스랩,2133,연봉이 괜찮은 편이다. 희망 직무와 일치하는 경우 여러 경험을 쌓고 나름 성장할 수도 있다.
28,㈜시어스랩,2133,작업자 간의 사이(만) 좋습니다. 최근에 점심 식대를 주기 시작했습니다. 사무실이 강남권에 있습니다.
