,company_name,company_id,review_text
0,네오에스티엠,7748,"각자가 담당했던 프로젝트에 대한 성과 반영이 확실하게 이루어지는 기업, 조직 문화가 개방적인 편이며 바쁜 프로젝트 기간이 아니면 휴가나 출퇴근에 대한 부분도 유동적인 편이다."
1,네오에스티엠,7748,1층에 부품수리소인 사모님은 친절함 이것저것 직원들을 챙겨주심 강아지를 키우고 있어서 힐링이 됨
2,네오에스티엠,7748,사장님이 친근하심. 장점이자 단점이 될 수 있을 듯. 간식이 있는 부는 좋음
3,네오에스티엠,7748,생각을 해봐도 장점이란게 있는 회사인지 잘 모르겠다. 그나마 이 회사에서 버틸 수 있는건 부서 사람들때문이 아닐까 싶음.
4,네오에스티엠,7748,"비교적 자유로운 분위기의 기업문화이기 때문에 대인관계는 원만했습니다. 통신비와 차량지원, 유류세 지원을 했기때문에 업무에 큰 부담이 없었습니다."
5,네오에스티엠,7748,공부할 시간을 많이 주고 자기계발할 시간도 많이 준다. 직원분들이 다 착하며 회식이 거의 없는것이 아주 맘에 든다
6,네오에스티엠,7748,야근식대 눈치안보일정도 선에서의 가격으로 제공. 특별히 어려운 일은 없어서 눈치껏 자기계발시간 갖을 수있음
7,네오에스티엠,7748,"큰회사의 톱니바퀴의 톱니처럼 닳아 없어지는것이 아닌, 회사의 몸통으로, 일의 처음부터 끝까지, 배울 수 있는곳. 잘리는 직원없이, 직원의 능력에 맞는 일을 찾아줍니다. 벌어온만큼, 인정받는 분위기입니다."
8,네오에스티엠,7748,직원들은 정이 많은 편. 정말 잡다하게 업무를 경험할 수 있음.
