,company_name,company_id,review_text
0,다스디자인,13249,"쾌적한 근무환경, 식대가 따로 들지 않는것은 좋습니다."
1,다스디자인,13249,현재는 어떤지 모르겠으나 재직 당시에는 자유로운 분위기였어서 나름 괜찮았음.
2,다스디자인,13249,"일년이면 주임 칭호를 달수있음. 하지만 월급은 주임이 아님. 최저는 되려나? 아마 야근하는 양에 비하면 최저조차 맞지 않을 가능성이 매우 높음. 야근비를 준다며 복지를 줌. 단, pm 8시 이후부터 시간당 만원이며 pm 7:50이 되면 가라고 재촉함. 참고로 그때까지 밥을 먹지 않고 업무를 함. (새로 올라온 글에 야근비를 주면 좋겠다 라는 이야기가 있는 것으로 보아 새로 들어온 사람들은 안주나? 분명 있긴했는데. 8시 이후 시간당 만원.)"
3,다스디자인,13249,전 직원이 친절하고 서로간의 간섭이 적다. 개인 자리가 아주 넓고 칸막이가 잘 되어 있어 프라이버시가 잘 지켜진다. 안 바쁠 때는 굉장히 한가하다. 구내식당이 있고 외식도 자주 하고 커피도 사 주신다(밥값은 안 아끼는 느낌). 또한 꼭 같이 식사를 하지 않고 따로 먹고 싶은 걸 사먹으러 가도 된다. 디자인 색채가 확연하지 않아서 디자인 색채가 강한 디자이너들도 어렵지 않게 적응한다. 월요일을 제외하고 살짝 지각해도 뭐라 하지 않는다. 배려받고 존중받는다는 느낌을 자주 받는다. 회식 강요가 없고 회식을 가더라도 굉장히 오손도손한 느낌이다.
4,다스디자인,13249,다들 좋은 분들이고 구내식당이 있어서 식비 걱정은 없다 회식을 강요하지 않는다
5,다스디자인,13249,업무분담을 개인이 전담 받아 일해서 간섭이 작다. 자리가 넓다.
6,다스디자인,13249,일년이면 주임 칭호를 달수있음. 하지만 월급은 주임이 아님.
