,company_name,company_id,review_text
0,대봉엘에스㈜,6133,"조직문화가 전체적으로 자유로움 (복장 규율, 연차 눈치 없음) 단순 제조업에 갇혀 있지 않고, 새로운 사업 개발이나 업무환경에 투자하고 있음 근무환경이 노후화되었으나, 송도 신사옥으로 이전 준비중임"
1,대봉엘에스㈜,6133,"자유로운 근태 (연차, 출퇴근) 중소기업치고는 괜찮은 복지(식대, 셔틀버스, 사우회 등) 기업이 안정적으로 매출을 내고 있어 압박이 크지 않음"
2,대봉엘에스㈜,6133,"점심식대 제공 / 구내식당 운영 / 밥 맛있음 통근버스 운행 / 내일채움공제(재직자, 신규입사자 가능) / 기숙사 운영 및 지원 다과비 지원 / 회식비 지원 / 자유로운 연차사용 / 우수사원 포상"
3,대봉엘에스㈜,6133,의약춤 화장품 연구개발 모두 경험해볼수 있으며. 자유로운 연차사용 과 연구소는 정부과제를 지원받아 복지를 경험할 수 있다
4,대봉엘에스㈜,6133,"연차 비교적 자유로움, 연구개발 프로젝트를 진행하는 팀은 나름 입지가 탄탄하고 연구비 지원으로 비교적 인센티브를 기대할 수 있고 연구장비,재료 구매가 수월한편 팀복지도 좋다. 출퇴근 셔틀버스가 있어 역까지 가는데 지옥버스 안타도 됨"
5,대봉엘에스㈜,6133,자유로운 회사생활과 직원들이 다 좋음 통근버스 운행를 운행합니다
6,대봉엘에스㈜,6133,"칼퇴가능하며 점심제공, 2025년도 송도 신사옥으로 이전 예정"
7,대봉엘에스㈜,6133,점심식사는 무료로 제공되며 남동공단 위치적 특성상 셔틀버스를 운영합니다.
8,대봉엘에스㈜,6133,구내식당이 있긴한데 맛은 그닥/역까지 셔틀 버스가 운행/
9,대봉엘에스㈜,6133,사람들이 매우 정겹고 상황에 맞게 업무를 잘 정리해주는데 회사는 글쎄...
10,대봉엘에스㈜,6133,수도권에 위치하여 좋고 구내식당 밥이 훌륭합니다. 기숙사와 셔틀 버스가 있어 좋습니다.
11,대봉엘에스㈜,6133,야근이 없고 팀원들과의 사이가 좋다. 업무 난이도도 높지 않음.
12,대봉엘에스㈜,6133,연차 사용에 문제 없음. 근로기준법 준수. 점심 제공. 기숙사?
13,대봉엘에스㈜,6133,셔틀도 있고 출퇴근 힘들지는 않음 나름대로 흐름이 있음
14,대봉엘에스㈜,6133,1. 자유로운 연차사용 2. 따듯한 점심 저녁제공 기숙사제공 3. 다양한 업무기회?
15,대봉엘에스㈜,6133,점심이 정말 맛있고 무료로 제공됩니다. 영업은 현지퇴근이 가능하기에 복귀 안하고 대부분 업체에서 3시~4시면 퇴근 가능합니다.
16,대봉엘에스㈜,6133,칼퇴. 사장님 눈치보느라 정작 일에는 무관심. 착하고 좋은 동료들. 배우거나 공부하는 행위 필요없어서 편함.
17,대봉엘에스㈜,6133,장점 셔틀버스랑 밥 꽁짜말고 아무것도 없습니다 진짜로...
18,대봉엘에스㈜,6133,칼퇴. 연차사용. 구내식당있음(공단 내부라 어짜피 구내식당밖에 선택권이 없음).
19,대봉엘에스㈜,6133,장점은 중소기업 치고 매출이 높고 회사 안정적 인것 같다
20,대봉엘에스㈜,6133,적당히 일하고 이런거 없이 열심히 다들일해서 배우는 만족도는 높음
21,대봉엘에스㈜,6133,인천 남동공단내에 위치하고 있으며 직원 기숙사 및 셔틀을 운행하고 있는 등 직원 복지에 힘쓰고 있다
22,대봉엘에스㈜,6133,"공무원처럼 다닐 수 있음, 자기개발 안하고 다닐 사람에게는 최고의 직장"
23,대봉엘에스㈜,6133,"부서 내 선배님들이 되게 잘해주고 잘챙겨줬다. 이거하나로 정리 끝, 더 바랄게 있나?"
24,대봉엘에스㈜,6133,부바부이지만 우리 부서는 연차 눈치없이 쓸 수 있는거 정도 직원식당 제공
25,대봉엘에스㈜,6133,"사업기반이 안정적이며, 의약품, 화장품, 의료기기소재 모두 차별화 있는 소재를 개발가능하며 천연 화장품소재까지 개발하고 있어, 미래지향적인 비젼있는 기업"
26,대봉엘에스㈜,6133,야근 수당이 있음(다 나오진 않음) 연차는 비교적 자유로움
27,대봉엘에스㈜,6133,"점심제공, 곧 송도로 이사감. 원인재, 동춘 등 셔틀버스 있음."
28,대봉엘에스㈜,6133,연차 사용 자유로움. 식대 지원. 셔틀 있음. 정시퇴근 가능.
29,대봉엘에스㈜,6133,상장도 했고 회사 구내 식당이 있다는 점이 장점 기숙사를 운영한다는 점이 장점
30,대봉엘에스㈜,6133,연차 눈치 안 보면서 사용 가능 식대 일부 지원 강압적인 야근 강요 없음
31,대봉엘에스㈜,6133,연차를 마음대로 쓸 수 있음. 나이대가 비슷하여서 또래분들이 많아 일하는데 편함.
32,대봉엘에스㈜,6133,연차를 윗사람 눈치 안보고 사용할 수 있음. 회사 위치가 역과 가까우며 셔틀버스를 운행함.
33,대봉엘에스㈜,6133,연차 눈치 안봐도 됨 / 야근 거의 없음 / 통근버스 / 기숙사 운영 / 점심식사 제공
34,대봉엘에스㈜,6133,"이것저것 다 판매하기때문에 영업입장에서는 배울게 많음,그것말고는..뭘배울지ㅎㅎ 직원들이 열심히 하려고 노력을 많이함. 칼퇴함 식당밥이 괜찮고 무료임,적응하면 오래다닐만 한 느낌"
35,대봉엘에스㈜,6133,장점은…식당이 건물안에 있는거.. 그리고 평사원들은 착한거….구리고 딱히 없음
36,대봉엘에스㈜,6133,연차 사용시 큰 제약이 없음. 제주 지역 및 화장품 분야에 한하여 연봉이 적은편은 아님.
37,대봉엘에스㈜,6133,정시 출퇴근 가능. 사내 점심 무료제공. 기숙사 제공. 금전적으로는 아니더라도 여러 복지부분에서 챙겨주려는 것이 느껴짐.
38,대봉엘에스㈜,6133,"연차 자유로움, 셔틀운영, 동료들이 착함, 회식 자유로움 (회식 잘 안하고, 참석 강요 없어서 자유로움), 직원들 연령이 낮음"
39,대봉엘에스㈜,6133,송도에 회사를 짓고 있어 요즘 뜨고 있는 송도로 출퇴근 할 수 있음 하지만 언제 완성될지는 모름
40,대봉엘에스㈜,6133,연차 사용의 편리함 근로기준법 개정으로 인한 주 52시간 근무시간을 지킬 수 있도록 노력하는 곳 본인의 큰 실수만 없다면 장기적 근무가 가능함
41,대봉엘에스㈜,6133,점심제공. 현지퇴근. 철저한 개인주의로 도움받지않고 도움주지않고 지내는거 좋아하면.
42,대봉엘에스㈜,6133,"연차 자유로움, 점심식사 지원, 여름휴가5일 하지만 연차사용"
43,대봉엘에스㈜,6133,"의약품 원료, 화장품 원료 등 다양한 분야의 사업을 하고 있는 것이 장점이다. 전문성은 떨어질 수 있지만 한 분야의 시장상황에 적게 흔들린다는 것이 장점이다."
44,대봉엘에스㈜,6133,"가장 큰 장점은 출퇴근에서 역앞에 버스는 아니지만 항상 봉고차가 대기하고 있어서 걱정이 없었음, 야근 강요나 특근 강요는 없음,"
45,대봉엘에스㈜,6133,"연차는 눈치 안보고 쓰긴 하는데 부서마다 틀리지만, 연차 못쓰게 하는 부서는 들어본적이 없다. 월급도 바로바로 나온다"
46,대봉엘에스㈜,6133,칼퇴근 가능. 자유로운 연차사용 가능. 이상한 사람 잘 없음
47,대봉엘에스㈜,6133,업무 공백없이 미리 조율한다면 연차 자유롭게 사용가능함. 부서장에 따라 월/금 연차 눈치 줄 수 있으나 꽤 자유로운편. 칼퇴가능. 아무리 짜내봐도 두 가지 밖에 없음.
48,대봉엘에스㈜,6133,1. 금년부터 드디어 점심값을 줍니다. 2. 셔틀버스나 기숙사 제공. 3. 회사가 탄탄하여 매출도 나쁘지 않고 월급도 밀린적 없음
49,대봉엘에스㈜,6133,연차 눈치 안보고 사용할 수 있음. 동춘역에서 통근버스를 운영함. 젊은층으로 이루어져 있음.
50,대봉엘에스㈜,6133,칼퇴근 가능 역에서 회사까지 셔틀버스 있음 조만간 송도 신사옥으로 이전예정
51,대봉엘에스㈜,6133,1. 퇴근시간 보장 2. 자유로운 연차사용 3. 텃세가 없음 4. 대표님이 잡플래닛을 본다. (개선X / 리뷰 내용을 현직원에게 이야기만함) 5. 여름휴가 5일 이상(BUT 연차차감됨)
52,대봉엘에스㈜,6133,직원들이 순둥순둥하고 통근버스 운영으로 퇴근시간에 눈치가 덜보임
53,대봉엘에스㈜,6133,양심없고 멘탈만 좋다면 공무원처럼 다닐 수 있습니다 농담 같지만 진짜임..
54,대봉엘에스㈜,6133,칼퇴 가능 자유롭게 휴가 사용 가능 워라밸 최고 공단이긴 하나 근무 위치 나쁘지 않음
55,대봉엘에스㈜,6133,장점은 인천에있어 아무래도 위치적으로 아주 중요한 곳이라고 생각합니다 베리구웃뜨
56,대봉엘에스㈜,6133,연차 자유로움 칼퇴가능 자유로운 분위기 구내식당 있음
57,대봉엘에스㈜,6133,연차 눈치 그다지 안보임 근데 이건 부서마다 케바케 구내식당 있긴 있으나 월급에서 깜
58,대봉엘에스㈜,6133,퇴근 눈치안보고 퇴근할수있으며 다른회사에 비해 자유롭게 쉬는시간을 이용할수있음
59,대봉엘에스㈜,6133,"급여일 놓치적 없음, 회사 내 동아리 운영은 꾸준히 했었음, 밥 잘 나옴"
60,대봉엘에스㈜,6133,남동공단 안에 있어서 지하철 역까지 통근버스가 있음 때문에 통근버스 시간에 맞춰서 늦게까지 야근하는 경우가 거의 없음.
61,대봉엘에스㈜,6133,연차를 윗사람 눈치안보고 자유롭게 사용가능 사내식당 프리함 워라벨 좋음
62,대봉엘에스㈜,6133,절대 안짤림 칼퇴가능 일 못할수록 더 일 안시킴 그러니 더욱 모르는척하면서 편하게 다니자
63,대봉엘에스㈜,6133,연차를 눈치안보고 쓸수 있다. 사람들끼리 힘내서 일할수 있는 구조
64,대봉엘에스㈜,6133,"연차의 자유로움, 년차별 연봉인상률 좋음, 많은걸 배울수 있음, 영업의 최적화, 외근이 자유로움,현지퇴근 가능"
65,대봉엘에스㈜,6133,1.연차 사용 자유로움 2.사람들이 좋음 3.서로 도와주는 분위기
66,대봉엘에스㈜,6133,"새로운것을 항상 시도하려하며, 도전하려함 디지털트랜스포메이션 프로그램을 도입하여 수행하고있음"
67,대봉엘에스㈜,6133,연차를 윗사람 눈치 안보고 쓸수 있지만 상사에 따라 케바케인듯
68,대봉엘에스㈜,6133,상장사라는 것과 근무시간이 9시간 근무에서 8시간으로 줄었음
69,대봉엘에스㈜,6133,"연차 눈치 안보고 사용 가능, 업무 배우기 좋음, 근데 발전이 있는지는 잘 모르겟음"
70,대봉엘에스㈜,6133,화장품회사랑 같이 붙어있어서 여러분야적으로 접해볼수있어 도움이 될듯
71,대봉엘에스㈜,6133,안정적인 회사 재무구조 연차 자유롭게 사용하는것밖에 없음
72,대봉엘에스㈜,6133,"월급이 밀리지 않고 나옴, 한달에 한번 제철 과일이 지급되었었음"
73,대봉엘에스㈜,6133,"대표의 이상이 높고, 깨어있음. 그러나 주변 상황은 고려하지 않고 진행하는 것 같음. 기업문화를 개선하려고 노력중임"
74,대봉엘에스㈜,6133,"자유로운 연차, 사장님이 직원의 발전에 힘을 쏟음, 회식 강요 없음"
75,대봉엘에스㈜,6133,"제약, 화장품 관련 원재료 업체로 네임밸류가 어느정도 있으며 지속적으로 성장하고자 함. 본인이 하는 것에 따라 인정을 받고 업무 확장 기회를주며 그것에 따른 보상도 따라옴"
76,대봉엘에스㈜,6133,"의약품, 화장품 모두 연구개발을 진행하여, 합성, 분석, 허가 까지 모두 배울수 있고, 2022년 송도로 이전하게 되어, 직원들 모두 더 큰 꿈을 가질 수 있음"
77,대봉엘에스㈜,6133,"직원들끼리 사이가 좋음 , 부서마다 다르지만 야근 강요안함 , 회식강요안함"
78,대봉엘에스㈜,6133,회사자체는 기본적인 복지는 해주려고 노력하는게 보이지만 중소기업의 한계가보여짐
79,대봉엘에스㈜,6133,"회사가 탄탄함, 화장품/의약품 원료쪽에서는 인지도 높음, 자유로운 연차 사용, 우수사원/혁신사원에 대한 적절한 포상, 최신 업무 프로그램 사용, 능력이 뛰어나면 조기 승진 가능"
80,대봉엘에스㈜,6133,미래가밝은회사이며 의약품 및 화장품 모두 진행하고있어서 큰 장점이라고 생각합니다 송도로 이전하게 되어도 화장품으로 크게 성공하게 될것으로 예상됩니다.
81,대봉엘에스㈜,6133,통근버스. 기숙사 지원. 부서마다 퇴근시간 다름. 의리가 있음. 바뀌려는 경영진의 노력
82,대봉엘에스㈜,6133,도저히 찾을수 없었음! 구내식당정도? 맛이 있고 없고의 문제가 아니라 그냥 생각없이 먹고 빨리 끝내는 차원에서 편하니깐
83,대봉엘에스㈜,6133,체계는 잘잡혀있음 나름 업계에서 대기업이고 상장업체라 재무는 탄탄함
84,대봉엘에스㈜,6133,업무 강도가 낮아 워라벨 보장 근무지 위치 양호 직원들끼리 사이 좋음
85,대봉엘에스㈜,6133,기업의 장점은 월급이 제 기간에 나오는 점과 또 다른 장점은 없습니다.
86,대봉엘에스㈜,6133,연봉이 인천치고 괜찮다고생각했는데 그냥 공단이짬 퇴근이자유로움
87,대봉엘에스㈜,6133,연차를 눈치를 보지않고 쓸수 있음 사람들이 직원들끼리 으쌰하면서 일하는곳
88,대봉엘에스㈜,6133,"자유로운 연차, 구내식당, 업무에 집중할 수 있는 환경."
89,대봉엘에스㈜,6133,정시퇴근 가능. 월급 밀리지 않음. 통근버스 있음. 식당있음 (식대 지원 X)
90,대봉엘에스㈜,6133,1. 셔틀버스를 운행하여 출퇴근이 용이함. 2. 월급이 밀리지 않고 나옴. 3. 내일채움공제(2/3/5년제) 지원
91,대봉엘에스㈜,6133,연차를 마음대로 쓸 수 있고 퇴근 눈치를 잘 안보며 자유로운 분위기 같이 일하는 사람들도 좋다 사내식당도 있다 메뉴보고다른식당 다른음식을 먹어도 된다 일을 많이 배울 수 있다
92,대봉엘에스㈜,6133,연차 자유. 구내식당 있음(식대 연봉 포함). 통근버스 있음
93,대봉엘에스㈜,6133,"통근버스있음, 연차 사용 자유로움, 회식강요 없음, 정시출퇴근 가능"
94,대봉엘에스㈜,6133,급여가 밀리지 않고 회식 때 강요되는 음주 문화가 없음.
95,대봉엘에스㈜,6133,"칼퇴, 업무강도가 높지 않음. 월급이 많지 않고 상승폭도 제한적이지만, 밥 값나갈 일도 없고 소소한 복지가 있어서 돈 모으기엔 나쁘진 않은 듯."
96,대봉엘에스㈜,6133,"2019년까지의 장점 -야근수당 지급/야근 강요 없음 -워라밸 괜찮음  하지만 2020년에 포괄임금제로 바뀌면서 한달에 무조건 20시간씩 하라고 압박줌 그렇다고 포괄임금제가 되면서 연봉이 많이 오르지도 않음.(야근수당 받는 것이 더 이득)  그나마 장점은 -팀원들(튀는 사람 없고, 자기 업무는 자기가 알아서 잘 처리하고, 서로 잘 도와주는 분위기) -인원이 적어서 신입에게도 큰 일을 맡기므로 여러가지를 빨리 배울 수 있다. -공단치고 위치 괜찮음 -셔틀버스 있음 -기숙사 제공"
97,대봉엘에스㈜,6133,사무환경이 쾌적합니다. 출퇴근 통근 차량이 있어서 편리합니다. 근퇴를 중요시 합니다.
98,대봉엘에스㈜,6133,일한만큼은 급여를줍니다. 일한만큼 잔업특근비는 지급합니다. 상당히 힘들었지만 돈은 많이 벌었내요 돈많이 버실분들은 추천드립니다 .
99,대봉엘에스㈜,6133,딱히 없습니다. 급여가 밀리지 않습니다. 출퇴근시 약간 멀지만 대중교통을 이용할 수 있습니다.
100,대봉엘에스㈜,6133,"연차사용 시 거의 문제가 없으며, 개인에따라 다르지만 자유롭다."
101,대봉엘에스㈜,6133,여러가지 일들은 경험해볼수 있다는것이 장점이다....
102,대봉엘에스㈜,6133,부서별로 다르겠지만 팀 분위기는 좋았습니다. 야근 강요는 없었습니다. 회식 강요 없습니다.
103,대봉엘에스㈜,6133,눈치 보지 않고 칼퇴하고 필요시 연차 눈치 안보고 연차 사용 가능
104,대봉엘에스㈜,6133,업계에서 높은 평가. 단단한 기반. 기업의 성장을 위해 플랜을 구축. 향후 성장 가능성 큼. 근로기준법 준수.
105,대봉엘에스㈜,6133,중소기업들 중에서는 연봉이 낮은편은 아님(아주 높진 않지만) 나름 회사 재정은 튼튼한편
106,대봉엘에스㈜,6133,1. 칼퇴 2. 밀리지않는 월급 3. 구내식당 4. 자유로운 연차사용
107,대봉엘에스㈜,6133,자유로운 연차 자유 복장 집과 가까움 일없으면 정시 퇴근
108,대봉엘에스㈜,6133,연차를 자유롭게 쓸 수 있음. 개인의 업무에 지장이 없으면 대체적으로 칼퇴근이 가능함. 부서의 전반적인 업무를 모두 배울 수 있음.
109,대봉엘에스㈜,6133,1. 재무가 탄탄함. 2. 업무의 종류가 많음.(배울 것이 많음) 3. 오래 다니면 다방면의 지식을 습득하게됨
110,대봉엘에스㈜,6133,"근무환경이 자유로우며, 퇴근 보장 점심, 저녁 제공, 기숙사 제공"
111,대봉엘에스㈜,6133,부서마다 다르긴하지만 칼출퇴 가능하며 연차사용이 자유로운 편.
112,대봉엘에스㈜,6133,연차 눈치 안보고 사용 가능 셔틀이 있음 건물이 깔끔함
113,대봉엘에스㈜,6133,부서마다 약간의 차이는 있지만 연차를 자유롭게 쓸수있고 칼퇴는 약간 눈치보이지만 큰 터치를 하지않는다. 업무강도 중.
114,대봉엘에스㈜,6133,부서에 따라 연차 자유. 재무상태가 좋아서 월급 밀릴 일 없음.
115,대봉엘에스㈜,6133,"api, 화장품 원료등 다양한 분야를 접할 수 있으며 연구뿐만 아니라 마케팅분야까지 접할 수 있다"
116,대봉엘에스㈜,6133,재무가 안정적임. 월급 밀릴일이 없음. 코스닥 기업&매출액 높아서 주변에서 높게 평가
117,대봉엘에스㈜,6133,"직속상사나 부서에 따라 다르지만 업무에 지장이 없다면 당일 오후 반차도 가능. 화장품 업체 답게 남자 장발/염색/펌/귀걸이 까지도 가능할 정도로 자유로운 분위기. 연구소, 품질부서는 과장 미만 야근수당 특근수당 지급. 육아휴직, 출산휴가 후 복귀에 문제 없음."
118,대봉엘에스㈜,6133,여러가지 다양한 일들을 접하고 일은 어렵지 않음. 직원들에게 무언가를 해주기위해서 노력하는편.
119,대봉엘에스㈜,6133,자유롭게 연차를 쓸 수있다
120,대봉엘에스㈜,6133,통근버스 정도??기숙사도 있긴하지..관리를 전혀안해주지만...
121,대봉엘에스㈜,6133,연차 사용 자유로운편 일없을땐 칼퇴가능 윗급의 부재로 인한 수평적 구조
122,대봉엘에스㈜,6133,법을 잘지킨다.근로기준법을 잘지키려고 하는것 같다. 그나마장점이다.
123,대봉엘에스㈜,6133,"야근 수당 및 특근 수당이 존재하며, 연봉적인 측면에서도 개선을 하려고 노력중인 회사임"
124,대봉엘에스㈜,6133,"의약품 업계에서는 1,2위를 다툴정도의 입지와 이름이 알려져 있다. 하지만, 많은 특허가 걸려있는 의약품 업계에서 잘 버티고 있다."
125,대봉엘에스㈜,6133,사사로운거 잘챙겨주고 업무 보통으로 본인만 열심히 하면 빛을 발함
126,대봉엘에스㈜,6133,연차 사용이 자유로움 직원들 분위기가 좋음 회사 위치도 나쁘지 않음
127,대봉엘에스㈜,6133,성장동력은 있으나 의지 부족 가족적인 회사의 단점들을 다 가지고있음
128,대봉엘에스㈜,6133,1. 업계에서 손꼽히는 회사 2. 자본금이 많아 회사가 망할 확률 낮으며 회사가 성장할 가능성 높음 3. 2년정도만 있다 나와도 업계에서 알아주어 여기보다 연봉을 높여 이직가능
129,대봉엘에스㈜,6133,재무구조는 튼튼한듯. 적은 인력으로 초인적인 일을 하게 만드는 대~~~단한 회사
130,대봉엘에스㈜,6133,신입이 일 배우기에는 매우좋음. 팀내분위기가좋고 어렵지않다. 사내식당있음
131,대봉엘에스㈜,6133,연차자유롭게쓰고 칼퇴가능. 힘든일이 없고 사람들 좋음.
132,대봉엘에스㈜,6133,"꾸준히 성장하고 있고, 신입으로 배울 것이 많습니다. 성장 가능성이 높다."
133,대봉엘에스㈜,6133,"매년 매출/손익 성장하는 회사로, 년말에 작게나마 성과급을 지급해 주는 회사임 연구개발 인력이 많음."
134,대봉엘에스㈜,6133,"눈치는 보여도 칼퇴할 수 있고, 가족적인 회식분위기가 최대 장점. 통근버스가 있어 편리함."
135,대봉엘에스㈜,6133,재무구조가 탄탄하고 계열사가 다양함. 장기근속자가 많지 않기에 텃세는 없는편. 식당에 치킨이 자주나옴. 대표가 젊고 적극적임. 여성승진은 어렵지 않음. 복지는 나아지고 있다고 함. 그러나 보통 이하 수준.
136,대봉엘에스㈜,6133,일 없을때는 칼퇴근 가능한 분위기 팀원들과 타부서직원들 결속력이 좋다
137,대봉엘에스㈜,6133,재무 상태가 좋다. 꾸준히 거래하고 상장하기 때문에 무너질 일은없다
138,대봉엘에스㈜,6133,특정 원료의 시장 점유율이 높다고 함. 제주 등으로 넓게 퍼져 있고 중국에도 나서려고 함. 젊은 직원이 많음.
139,대봉엘에스㈜,6133,다양한 업무를 배울순있어서 다른회사에 갈경우 도움이 될것같다
140,대봉엘에스㈜,6133,월급은 안밀림. 젊은 사람들이 많음. 업무 잘 배워서 나가면 좋은 데 갈수있음.
141,대봉엘에스㈜,6133,일을 여러가지해볼수있다. 또한 역량이 크게 늘어날것이다 좋은사람들과 지낼수있다 일한만큼 돈을 벌수있다
142,대봉엘에스㈜,6133,회사 전망이 갈수로 커지는 것이고 그외의 느껴지는 장점은 없다
143,대봉엘에스㈜,6133,회사가 발전해 기업이미지가 좋아 회사취업시 주변에서 알아줌
144,대봉엘에스㈜,6133,원료의약품 화장품 매출이좋은편이고 월급은안밀린다성장할수있는기회높음
145,대봉엘에스㈜,6133,1. 회사를 오래 다니면 그만큼 호봉제로 쳐주기 떄문에 진급에 대한 압박이나 고민은 없을 듯 하다.  2. 출퇴근 버스 운영해서 좋음.  3. 기숙사 있음.
146,대봉엘에스㈜,6133,"발전 가능성이큼, 계속 성장하고 있는 기업, 신입이 배울 것은 많음"
147,대봉엘에스㈜,6133,비교적 안정적??적인 회사의 매출로 꾸준히 조금씩 성장하는 회사 잦은 회식이 없다
148,대봉엘에스㈜,6133,"업무적인 터치는 없음, 신입에게는 배울 수 있는 기회가 많음"
149,대봉엘에스㈜,6133,"재무상태가 튼튼하고, 지속적으로 성장하고 있음 업무강도가 심하지는 않아 자기계발의 시간이 많음"
150,대봉엘에스㈜,6133,"다양한 원료를 접하며, 과중업무로 많은 걸 배움. 훈련이됨"
151,대봉엘에스㈜,6133,원료판매회사로 다품목을 취급하고 있어 찾는 업체들이 많음
152,대봉엘에스㈜,6133,야근에 대한 압박이 없고 분석기기를 많이 다뤄볼수있다
153,대봉엘에스㈜,6133,배울것이 많고 승진의 기회가 많고 승진하면 보상을 받는다.
