,company_name,company_id,review_text
0,디지털퍼스트,10497,"넓은 사무실 뷰 먹지고 않는 아이스크림, 음료수 힐링룸(30분 마사지)"
1,디지털퍼스트,10497,1. 모든 복지를 상쇄하는 주2회 재택 2. 깔끔하고 뷰가 쩌는 사무실 3. 광고업계에서 보기힘든 워라밸 4. 용산 핫플레이스 섭렵 가능한 위치
2,디지털퍼스트,10497,유연한 재택근무와 조용한 분위기가 장점이라고 생각합니다
3,디지털퍼스트,10497,"주 2회 재택근무 아이스크림, 음료수 비치 쾌적한 회사 환경 신용산역 역세권 젊은 분위기와 괜찮은 동료들"
4,디지털퍼스트,10497,"IPO 한다고, 그리고 신규 ERP도입한다고, 용산 사옥으로 가서 비용절감한다고 하기전까지가 딱 모든 것이 좋았다. 그 이후로는 서서히 무너져가고 있을뿐"
5,디지털퍼스트,10497,"자유로운 분위기와 좋은 팀원 팀장, 재택근무 주 2회 진행"
6,디지털퍼스트,10497,해피데이 등 복지가 좋고 같이 실무하는 사람들이 좋음
7,디지털퍼스트,10497,그래도 큰 건물 깨끗한 건물에 잇구요 생각보다 큰 회사라 다닐 만햇어오
8,디지털퍼스트,10497,사람들이 좋았다 일도 잘 가르쳐주시고 사내 분위기도 좋았음
9,디지털퍼스트,10497,"자잘한 복지가 있다. 음료수, 커피, 아이스크림 무제한"
10,디지털퍼스트,10497,기업 분위기가 젊고 데이터를 중심으로 돌아가기 때문에 배울 점이 많다고 생각합니다.
11,디지털퍼스트,10497,재택근무가 있다는 것..? 일주일에 두번 재택근무 보장 음료수 냉장고 사내 헬스 테라피
12,디지털퍼스트,10497,"(나름) 수평적인 구조, 유연한 업무 환경(재택근무 주2회), 소소한 복지(커피머신, 아이스크림, 음료수 등)"
13,디지털퍼스트,10497,멋진 팀동료들과 같이 플젝을하고 성장해나간다는 것 그리고 좋은 복지였던 것들
14,디지털퍼스트,10497,재택 주2회와 통신비 3만원 지원 혜택 말고는 딱히 없었음
15,디지털퍼스트,10497,괜찮은 동료들 나쁘지 않은 워라밸 주2회재택근무 용산사무실 깔끔하고괜찮음
16,디지털퍼스트,10497,"2022년 이전까지 직원을 확실히 챙겨주던 다양한 복지, 일 잘하는 유능한 직원들"
17,디지털퍼스트,10497,재택근무 해피데이 역세권에 위치한 오피스 깨끗한 화장실
18,디지털퍼스트,10497,재택 또는 어른이날 등 복지는 좋았고 팀바이팀 격차가 크다
19,디지털퍼스트,10497,이제 남은 장점은 재택정도 있으려나...? 좋았던 문화가 없어지는중
20,디지털퍼스트,10497,처음 입사 당시에는 복지도 좋고 분위기도 좋았습니다. 그렇지만 모두 과거형에 불과해요.
21,디지털퍼스트,10497,"나름대로의 아끼지 않는 복지 현금성 복지, 스낵 복지, 시간성 복지 등"
22,디지털퍼스트,10497,"전 대표님,,,? 해피데이 복지 업무 성장 기회가 많다"
23,디지털퍼스트,10497,사무실 위치 / 실내 컨디션 / 업무 환경 / 커피 등의 사무실 복지 우수
24,디지털퍼스트,10497,"팀바팀이지만 좋은 사람들, 유쾌한 사람들이 많아 사람보고 다닌다"
25,디지털퍼스트,10497,재택근무 아이스크림 음료 생일반차 해피데이 말고는 없습니다
26,디지털퍼스트,10497,주2회 재택 커피머신이 훌륭하다 같이 일하는 실무진들이 좋았었음
27,디지털퍼스트,10497,"자유로운 수평적 분위기, 재택2일 유지, 사무실환경 쾌적"
28,디지털퍼스트,10497,"팀바팀으로 자유로운 분위기를 추구하는 팀도 있음. 본인이 욕심이 있다면, 약간의 기회를 주는 척은 함. 자신의 건강과 시간이 남아도는 분이라면 추천."
29,디지털퍼스트,10497,주어진 일에 최선을 다하면 그 결과가 연봉인상율과 인센티브 등으로 구성원들에게 돌아왔던 회사. 구성원들을 위한 여러 이벤트로 일하는 것외에 회사 다니는 재미를 주었던 회사.
30,디지털퍼스트,10497,"주 2일 재택 제도 해피데이, 생일 조기 퇴근 제도.."
31,디지털퍼스트,10497,다양한 복지와 재택근무가 최고의 장점. 그 외에도 다양한 행사를 하고 있어서 나쁘지 않음.
32,디지털퍼스트,10497,간식 아이스크림이 상비되어있고 가끔은 예전같은 행사도 열긴함
33,디지털퍼스트,10497,"자유로운 분위기, 회사 사무실 컨디션이 좋다, 사람들 마인드가 좋다"
34,디지털퍼스트,10497,재택이 남아있는 몇 안 되는 회사. 힐링룸이랑 스낵바는 좋음
35,디지털퍼스트,10497,"주2재택 유지중 (더 늘었으면 좋겠음) 업무 효율성 수직상승! 아이스크림&음료 냉장고, 월1호 헬스키퍼, 젊은 구성원, 분기별 소소한 이벤트 (간식 이벤트 등) 직원들의 이야기를 들으려는 경영진의 노력?"
36,디지털퍼스트,10497,팀마다 물론 다르겠지만 자유로운 분위기와 얽매이지 않는 직급 구조 냉장고 항상 든든한 음료와 나름 역세권으로 출퇴근 용이
37,디지털퍼스트,10497,눈치보지않고 연차사용가능하나 팀바팀 님문화 자율출퇴근할수있음 재택2회 헬스키퍼
38,디지털퍼스트,10497,팀바팀이겠지만 자유로운 분위기와 수평적인 조직문화가 좋습니다.
39,디지털퍼스트,10497,재택근무가 최고 장점. 윗사람 눈치 안보고 연차 사용 가능. 사무실 뷰 좋음. 렙사 중 나름 이름 알려진 곳. 한달에 한 번씩 주는 해피데이. 음료/아이스크림 무제한 등 나쁘지 않는 복지.
40,디지털퍼스트,10497,"여러 매체들을 매니징해볼 수 있는 회사, 젊은 분위기, 음료, 커피, 아이스크림 제공, 사내 마사지사가 있어 1달에 1번 시술 가능 등 복지 있음"
41,디지털퍼스트,10497,중견기업치고 소소한 복지가 괜찮음 일 안하는 인사팀..만 아니면 괜찮음
42,디지털퍼스트,10497,실무자들의 능력은 매우 우수하고 같이 일하면 서로 스킬업할 수 있는 곳 함께 일하는 사람들 중 빌런이 거의 없었던 것으로 기억 회사에서 제공하고 있는 데이터 활용 등이 좋았음
43,디지털퍼스트,10497,수평적인 분위기.주 2회 재택근무. 소소한 복지사항들.
44,디지털퍼스트,10497,팀바팀이지만 자유로운 연차 사용 탕비실에 다양한 음료수 및 아이스크림 주 2회 재택근무
45,디지털퍼스트,10497,재택근무 있음 해피데이 사용 자유로운 편 연차 사용도 눈치 안봄 (팀바팀) 인센 (힘들 때 못주는거 이해함)
46,디지털퍼스트,10497,"뭐가 있을까 생각해 보니 재택근무, 아이스크림 빼고는 없음"
47,디지털퍼스트,10497,장점은 사람들이 좋고 팀별로 다르지만 일주일에 두번 재택 가능
48,디지털퍼스트,10497,"재택근무2일, 커피와 음료수 아이스크림 무제한 제공, 역세권."
49,디지털퍼스트,10497,"좋은 분위기, 좋은 동료들, 직원을 생각하는 여러 복지. 하지만 다 과거형이다. 지금은 그 어느 것도 좋은지 모르겠음"
50,디지털퍼스트,10497,그나마 렙사 중에서 밝았던 분위기 월급 안 밀리고 나온다는 정도
51,디지털퍼스트,10497,복지 괜찮고 워라벨도 업계 대비 좋음 체계가 잘 되어있는 것 같음
52,디지털퍼스트,10497,"그래도 소소한 복지가 있음, 월 1회 조기출근/퇴근, 힐링룸 , 그리고 아직까지 재택근무 2일 ..!"
53,디지털퍼스트,10497,중간급들이 많아 신입들이 일배우기는 좋은 환경. 수평적인 조직문화 지향한다고는 하나 진리의 팀바팀.
54,디지털퍼스트,10497,데이터 분석을 핵심 역량으로 가지고 있기 때문에 앞으로 마케팅 부문에서 더 많은 성장을 이룰 것으로 생각됨 처음 일을 시작하는 사람들이 일을 배우기에 나쁘지 않은 곳 분위기 젊은 편
55,디지털퍼스트,10497,"수평적이고 밝은 사내 분위기, 자잘한 직원 복지, 인사팀의 센스, 쾌적한 시설"
56,디지털퍼스트,10497,"대표이사의 훌륭한 마인드, 다만..... 몇몇 리더들 때문에... 성과도 안나고 분위기도 흐림"
57,디지털퍼스트,10497,"신입에겐 배울 기회가 많음, 소소한 복지혜택, 팀바이팀이긴 하지만 대체로 좋은 팀분위기 등"
58,디지털퍼스트,10497,회사에서 사원들을 위해 노력하는 모습이 보임 근데 또 팀바팀인거 같음
59,디지털퍼스트,10497,경력직은 다니기 편하며 신입들을 못잡아먹어서 안달인 회사
60,디지털퍼스트,10497,온라인미디어의 전반적인 흐름을 배우고 성장하는데 있어서 좋은 환경을 갖추고 있음 회사 위치가 서울의 가장 중심부인 용산에 위치하고 있어서 서울에서 출퇴근 시 좋음
61,디지털퍼스트,10497,사내 분위기가 원만하고 좋음 타 광고대행사 대비 높은 연봉 그 외 딱히…
62,디지털퍼스트,10497,팀 분위기도 좋고 사무실도 깨끗하고 좋습니다. 많이 배울 수 있었고 사람을 배려하는 기분이 들었습니다.
63,디지털퍼스트,10497,사업기반이 안정적이고 용산에 있다는것 말고는 장점없는듯 정치질잘하면 편하게 다닐수있음
64,디지털퍼스트,10497,팀바팀이지만 디자이너가 많아서 보고 배울 것이 많음. 매너없는 사람이 별로 없고 수평적인 조직 문화를 지향함.
65,디지털퍼스트,10497,"자유로운 연차 사용, 조기퇴근/늦은출근 같은 복지 등등"
66,디지털퍼스트,10497,연차 눈치 안보고 씀 재택2일 수평적 분위기 음료수 냉장고/아이스크림 커피머신
67,디지털퍼스트,10497,수평적인 분위기. 좋은 회사 동료들. 전반적으로 회사 분위기가 좋은 편
68,디지털퍼스트,10497,자유로운 분위기 넉넉한복지 젊은 회사 위워크 사무실 조아요
69,디지털퍼스트,10497,"팀바팀이지만 칼퇴 가능(업무 상황따라), 연차 눈치 안봄, 사내 분위기 좋음, 수평 문화, 강요 문화 없음, 회사 뷰 좋음, 출퇴근 시간 선택 가능"
70,디지털퍼스트,10497,연차 해피제도를 눈치없이 사용할 수있는 분위기 가끔 챙겨주는 회사복지가 있다
71,디지털퍼스트,10497,연차자유롭게 쓸 수 있고 성장하는 조직애서 함께해서 좋음
72,디지털퍼스트,10497,"직원들이 편하게 다닐 수 있는 분위기, 그리고 다음 단계로 나아가기 위해 디딤돌 역할이 될 수 있는 곳이다"
73,디지털퍼스트,10497,"내부적으로 발전하고자하는 노력이 있음. 어느정도의 체계도 잡혀있고, 일하는 동료들이 좋음"
74,디지털퍼스트,10497,같이 일하는 동료들이 좋음 예전같은 분위기는 아니지만 대행사치고 복지 나쁘지 않음
75,디지털퍼스트,10497,진리의 팀바팀. 재택근무. 가끔 진행하는 복지차원의 이벤트 등
76,디지털퍼스트,10497,당시에는 작읔 복지들이 많았다. 먹는걸 아끼지 않는 회사였음.
77,디지털퍼스트,10497,주 2회 재택근무는 좋은 것 같고 회사에서 보는 뷰가 좋다
78,디지털퍼스트,10497,부서마다 다르지만 다양한 업무 경험 가능 같이 일하는 사람들이 좋다 회사 뷰가 좋다 재택근무
79,디지털퍼스트,10497,"대기업까지는 아니지만 배울것도 많고, 초봉도 나쁘지 않고 복지도 좋은편 전반적으로 만족하면서 다니긴 했음."
80,디지털퍼스트,10497,상대적으로 수평적인 문화가 갖추어져 있음. 탕비실의 무한 음료수 / 아이스크림 / 커피
81,디지털퍼스트,10497,"자유로운 분위기에서 일할 수 있음 다양한 광고주를 접할 수 있음 역세권에 좋은 사무실 사용 재택근무가 있음 음료 무제한 , 커피머신이 매우 좋음"
82,디지털퍼스트,10497,"신용산 신사옥으로 쾌적함,교통 편이, 눈치안보고 쓸 수 있는 연차"
83,디지털퍼스트,10497,좋은 경영진 좋은 복지가 장점이었지만 다 옛 이야기 입니다
84,디지털퍼스트,10497,비교적 자유로움 업계 평균 연봉 이상으로 맞춰주려 함 때에 따라 다르지만 워라벨 조음
85,디지털퍼스트,10497,"자유로운연차사용, 한달한번 조기퇴근제도 음료수 먹을것은 잘 챙겨줌 회사의 대우에 비해 간혹 뛰어나신 분이있음 팀바팀이긴 하지만 괜찮은 팀 가면 많이 배움"
86,디지털퍼스트,10497,회사 설립연차대비 체계는 있고 복지도 이만하면좋다. 먹을거하난 잘 챙겨준다
87,디지털퍼스트,10497,나름대로 복지가 잘 되어 있고 팀바팀이지만 분위기도 나쁘지 않음
88,디지털퍼스트,10497,능력있고 똑똑한 동료들 용산 사옥 뷰가 좋음 해피데이제도 연차 눈치 안보고 쓸수 있음
89,디지털퍼스트,10497,"여러가지 시도를 많이 함 성장해나가는 회사 내부에 음료냉장고, 아이스크림, 커피 제공 2.5시간 해피데이"
90,디지털퍼스트,10497,직원들 한분한분 사람이 괜찮아서 사람때문에 스트레스 받은적은 없습니다
91,디지털퍼스트,10497,영어이름을 써서 수평문화(하지만 팀에따라 조금씩 다름)
92,디지털퍼스트,10497,연차 눈치없고 나름 자유로운 분위기 대표님 마인드가 좋으심 수평적인 문화
93,디지털퍼스트,10497,경영진들 마인드는 좋다고 생각한다. 같이 일하는 팀 사람들이 좋았다.
94,디지털퍼스트,10497,재택근무 직급 구분없이 친절한 사람들 회사 이전하면서 넓고 쾌적해진 오피스 환경 연 1회 인센 지급제 명절에 스팸 대신 상품권 지급
95,디지털퍼스트,10497,"복지 나쁘지 않음 몇명 빼면 대체적으로 사람들 좋음 음료수 무제한 연봉 괜찮음 자유로운 분위기 자유로운 연차 사용 또 뭐가 있나 대표님이 살갑고 성격 좋으심 화장실이 깨끗함 그외,,, 사무실 생각보다 괜찮음"
96,디지털퍼스트,10497,"팀바팀일수는 있지만 저희팀은 팀장님께서 팀원들 성장과 업무환경개선을 위해 많이 신경써주시는게 느껴집니다.  당연히 대행사이기 때문에 바쁜시기에는 많이 바쁘지만, 광고주들이 나름 짱짱해서 미디어나 툴 공부 & 적용해보기 좋아요."
97,디지털퍼스트,10497,"올해 이사한 사옥의 깔끔함과, 결국 진리의 팀바팀이지만 일 잘하는 사람들이 많은 장점이 있음 회사 차원에서 다양한 복지 행사들이 많음 (명정 경품추천 등) 년 1회 인센티브가 존재하며 연봉 인상률도 나쁘지 않다고 생각함"
98,디지털퍼스트,10497,업무 분위기는 자유로움. 수평적인 분위기. 일할 수 있는 환경은 좋음
99,디지털퍼스트,10497,자유로운 문화와 전문 인력이 많다. 복지와 시설 및 환경이 잘 갖춰져 있다. 급여도 나름 괜찮은듯
100,디지털퍼스트,10497,나름 복지을 챙겨주려고 노력은 함 매체에 대해 다른 렙사보다 더 잘알수 있었는듯 여기찍고 보통 메조로 이직 많이 함
101,디지털퍼스트,10497,"자유로운 분위기에서 일할 수 있으며, 그만큼 주체적으로 일을 한다면 더 많은 것을 성취할 수 있는 것이 장점 연봉 등 타사 대비 떨어지지 않는 복지 체계를 갖춰가는 중"
102,디지털퍼스트,10497,"사람을 생각하는 기업이며, 소소한 행복을 누릴수있는 복지가 있음. 분위기가 좋음. 사람이 좋음."
103,디지털퍼스트,10497,향후 비전 / 자유로운 분위기 / 실력있는 동료들 깨끗하고 넓은 사무실 / 상시 준비된 음료수와 자잘한 이벤트
104,디지털퍼스트,10497,"장점이라고 그나마 할만한점은 재택...? 하지만 이마저도 팀바이팀으로 다르고 재택은 절대 복지가 아니라는 점 명심하시길. 최근 용산 신사옥으로 옮겼는데 이전 강남 위워크가 더 위치적으로 좋았음. 교통이나 주변 인프라. 해피데이 (2시간 반 일찍 퇴근, 늦게출근) 있지만 이마저도 쓸때 눈치보임."
105,디지털퍼스트,10497,수평적인 사내 문화가 돋보이며 직원을 톱니바퀴처럼 생각하지 않는다. 회사의 성장을 나날히 느끼며 상장을 앞둔 회사다 보니 재정적인 안정이 되어 있다
106,디지털퍼스트,10497,복지와 인사팀의 열린 사고가 최고의 장점이다. 다양한 동호회가 있고 매달 1번 조기퇴근이 가능하며 한달에 한번 이벤트로 간식 및 음식이 제공된다
107,디지털퍼스트,10497,자유로운 분위기 인사팀 재무실 디자인팀 사람들이 너무 좋음
108,디지털퍼스트,10497,연차를 자유롭게 쓸수 있음 비교적 자유로운 회사 분위기 또래 문화형성이 좋음
109,디지털퍼스트,10497,"매주 스낵데이, 재택근무, 자유로운 연차사용 등 다녔던 회사 중에 가장 자유롭다"
110,디지털퍼스트,10497,"수평적인 분위기로 연차, 해피데이 등의 휴가사용은 어렵지 않다. 마찬가지로 지원팀 요청도 어렵지 않은 편."
111,디지털퍼스트,10497,"월 1회 해피 아워로 일찍 퇴근할수 있는 문화, 사람들이 모두다 친절, 코로나로 못하지만 활발한 동아리 활동으로 팀 이외 분들과 교류가 많다"
112,디지털퍼스트,10497,자유로운 연차 사용 및 젊은 분위기 눈치 안보고 주도적으로 업무를 할 수 있음
113,디지털퍼스트,10497,직원들을 위해 많이 애쓰는 인사팀 덕분에 타 회사 대비 즐겁게 일할 수 있다. 시작은 늦어도 경쟁력있는 기술과 모기업 덕분에 성장하는 것을 직접 볼 수 있어서 뿌듯하고 애사심을 갖고 다닐 수 있다
114,디지털퍼스트,10497,배울 수 있는 사람들이 많습니다 사람들 개인적으로는 접하면 참 좋습니다 인사팀이 여러모로 애쓰는 것이 많이 보입니다
115,디지털퍼스트,10497,젊은 사람들이 많아 수평적인 구조이며 복지에 굉장히 신경쓴다는 느낌을 받으며 근무할 수 있음 급여도 동종업계 대비 괜찮은 편
116,디지털퍼스트,10497,복지는최고 위치는최고 연봉도쏘쏘 경영자마인드 최고 단점이 없는듯
117,디지털퍼스트,10497,"도서구입비 지원(이긴 한데 저는 써본적이 없습니다), 사내 음료수 무료 제공, 자유로운 연차 사용, 강남 위워크에 입점하여 깔끔한 사무실, 다양한 회사 이벤트를 많이 함"
118,디지털퍼스트,10497,"재택근무 제도가 잘 마련되어 있음, 자유롭고 경직되지 않은 조직 문화, 이벤트성 복지"
119,디지털퍼스트,10497,"직원들에 대한 회사의 지원이 좋음(스낵데이, 해피데이, 음료&아이스크림, 씨리얼, 상품권 등), 회사 전체가 더 좋은 조직 문화를 만들고자 노력하는 게 보여서 좋음, 개개인의 소리에 귀기울일 줄 아는 회사, 직원을 위해 재택근무조 유연하고 재빠르게 실시함 등"
120,디지털퍼스트,10497,"좋은 사람들과 일할 수 있음 / 위워크로 쾌적한 사무실 / 음료, 아이스크림 무한제공 / 스낵데이 같은 작지만 행복한 복지 / 동호회 또래오래 같은 다른 직원들과 친해질수있는 복지 / 코로나 상황에서 빠른 판단으로 전일 재택근무"
121,디지털퍼스트,10497,"좋은 복지가 있다. 코로나로 인해 재택근무를 발빠르게 도입하였고, 모니터를 배송까지 해주며 회사가 많이 배려해준다는 느낌을 받음"
122,디지털퍼스트,10497,직원들의 이야기를 최대한 반영하려고 노력한다. 그래서 나름대로 워라밸이 지켜지는 팀들이 있다.
123,디지털퍼스트,10497,수평적이고 자유로운 분위기. 주어진 연차 최대한 쓰도록 해줌.
124,디지털퍼스트,10497,"자유로운 연차사용, 다양한 사내 이벤트, 영어 호칭 사용, 위워크 시설 이용 가능, 시국에 민감한 대처 (주1근무/재택), 근무환경조성(각 가정에 듀얼모니터 전달)"
125,디지털퍼스트,10497,자유로운 분위기. 직원들을 위한 복지가 좋음. 오래 다니기 좋은 회사
126,디지털퍼스트,10497,복지가 매우 좋고 대표님도 매우 젠틀 점점 커져가는게 느껴지는 회사
127,디지털퍼스트,10497,"자유로운 분위기, 가끔 주는 맛있는 간식들(스낵데이), 팀간 서로 굳이 어울리게 만들려고 노력하는 몇몇분들,"
128,디지털퍼스트,10497,동종업계대비 복지가 좋고 대표가 사원 생각하는 마인드가 좋음
129,디지털퍼스트,10497,위워크 입주해있어서 근무 환경이 좋다. 다양한 동아리가 있어서 다양한 사람들과 취미를 공유할 수 있는 것도 장점. 매달 스낵데이도 귀찮을 법한데 매번 잘 챙겨주셔서 좋았음
130,디지털퍼스트,10497,개인의 역량을 키우기에 충분한 데이터와 선배들이 포진하고 있는 곳. 디지털마케팅에 데이터를 접목한 좋은 회사.
131,디지털퍼스트,10497,쾌적한 공간 다양한 음료 회사 위치 복지(한 달 하루 2.5시간 일찍 퇴근)
132,디지털퍼스트,10497,자유롭고 수평적인문화 연차 반차 눈치안봄 스낵데이있고 동호회 잘되어있음
133,디지털퍼스트,10497,정해진 복지는 아니지만 특이한 복지가 많음 문화자체도 되게 프리한 느낌
134,디지털퍼스트,10497,자율성이 높다. 다양한 복지가 많다. 대표님의 마인드도 좋으십니다.
135,디지털퍼스트,10497,"팀 별 유연근무제, 나스 메조를 제외한다면 나쁘지 않은 처우, 위워크 근무환경, 한달에 한번 해피데이, 점프하기에 나쁘지 않음, 성장가능성 있음"
136,디지털퍼스트,10497,유연한 조직문화 가능성있는 운영방향 데이터를 접목한 미디어바잉 업계상위 처우조건
137,디지털퍼스트,10497,"영어 이름 사용, 위워크 입주, 모바일 영역에 강함, 비교적 나쁘지 않은 사람들(?)"
138,디지털퍼스트,10497,여러가지 이벤트를 운영하면서 회사의 소속감을 일깨워줌. 위치도 지하철 역과 정말 가까움. 각 팀에 몇몇 엘리트들이 숨어있음
139,디지털퍼스트,10497,우선 사람이 좋음. 사내 직장 동료들의 성격뿐만 아니라 능력도 좋다. (팀바팀인 듯하지만..) 주니어로서 배울 점이 많다. 회사측에서도 꾸준히 사소한 복지를 위해 노력 중. 유치한 정치싸움이 없는 듯.
140,디지털퍼스트,10497,"다양한 배움의 기회, 좋은 사람들(팀바팀), 위워크에서 일할 수 있는 장점"
141,디지털퍼스트,10497,비교적 자유로운 분위기와 미디어렙 기준의 상위권 연봉 다양한 애드태크를 활용한 기술적 지원
142,디지털퍼스트,10497,내부 이벤트 많이하여 즐거운 분위기 위해 노력하는 것이 엿보임
143,디지털퍼스트,10497,"연차를 눈치 보지 않고 사용할 수 있음 업계 내에서도 괜찮은 연봉수준, 특히 연봉 인상률은 매우 높은 편"
