,company_name,company_id,review_text
0,디지게이트,6355,식대 1만원에 맞춰서 먹으면 별 말 안하고 특별한 문제 삼지않습니다 1만원 +- 맞추면서 먹으면 되요
1,디지게이트,6355,주변에 먹을데가 많아 점심시간은 편합니다 그리고 퇴근은 왠만해선 칼퇴합니다.
2,디지게이트,6355,없습니다. 진짜 없어요. 근처에 밥집이 많은거 빼고는 없어요
3,디지게이트,6355,"1, 2층 분할되어 사장을 계속 안봐도 된다는 것 다만 2층으로 발령난 포지션은 퇴사를 권장"
4,디지게이트,6355,"이회사의 장점이라하면 실장님께서 월급을 꼬박꼬박 잘주시고 단, 한분 빼고는 다들 성격도 좋으시고 잘 지도해줌"
5,디지게이트,6355,생각보다 직원들간의 단합력이 높습니다. 절대 나쁜뜻이 아니며 직원들간의 분위기가 좋습니다. 그리고 앞전에 말씀드렸다시피 아직도 모든 작업을 전산화가 아닌 수작업으로 진행하다 보니 쇼핑몰이 처음이고 쇼핑몰에대한 자세한 기초 시스템을 배워보고자 하는 분들께서는 입사하셔서 배워보시는것도 나쁘지 않을듯 합니다.
6,디지게이트,6355,"사장이 없으면 자유로운 분위기, 연차있음, 공휴일 쉼, 주말 쉼, 식대 해줌,사람들은 좋음"
7,디지게이트,6355,"사장이 없으면 널널하고 편안한 분위기, 그러나 사장이 있으면 혼나는 교무실 분위기가 나는 회사이다."
