,company_name,company_id,review_text
0,모츠,10780,젊은 사람들로 구성되어 있어 생각이 유연함. 서울 강남에 위치하여 접근성 좋음
1,모츠,10780,경력에 비해 크고 작은 많은 프로젝트들을 경험할 수 있음
2,모츠,10780,"야근 식대 , 야근 택시 지원 가능 일정에 따른 유연한 근무와 연차 가능 직원들의 식사와 간식에 최선 편안하고 유연한 사내 분위기"
3,모츠,10780,"점심식대 지원, 스낵바 퀄리티 최상, 업계 타회사에 비해 연봉이 높다는 말은 들음 끊이지 않는 프로젝트"
4,모츠,10780,- 석식제공 - 야근 후 제공되는 택시비 이 외에는 없습니다.
5,모츠,10780,"먹는거에 대한 복지 (식대,간식,야근식대 등등) 식대를 위해 아끼지않음 먹는걸 정말 좋아하는듯 그리고 큰소리낼만한 일이 없는거같다 사람들도 최대한 서로 트러블안생기게 하려고하는듯"
6,모츠,10780,"창의적인 생각을 하게끔 도와줌 간식줌, 트렌디한 오프라인 이벤트 경험을 쌓을 수 있음"
7,모츠,10780,회사 분위기가 긍정적이고 활기차도록 늘 노력함 팀별 실장님의 역량과 성향에따라 분위기가 다름
8,모츠,10780,"연차 눈치 안보고 쓰기, 자유로운 분위기, 수평적인 업무 환경, 풍성한 간식, 업계 중에서도 높은 연봉, 지옥철을 벗어나는 10to7 근무시간, 사람들 좋음"
9,모츠,10780,회사 마포에있었음 직원분들 다이뻤음 휴게실 이런건 잘되어있었음 건물 식당 맛있었음 행사 현장나가면 분위기좋았음 재밌게 일했음
10,모츠,10780,연차를 눈치 안보고 쓸수 있고 평등한 분위기. 맛난 간식과 스타벅스 커피가 무한대로 무료제공 직무능력 위주로 대우
11,모츠,10780,대체연휴와 야근식대 간식 등 복지가 좋습니다 기안등 문서가 체계적입니다
12,모츠,10780,"고생하는 직원들을 위해 회사 차원에서 무언가를 많이 노력하는 편 (간식, 직원들간의 단합대회 같은..?) 외부의 어려움이 있어서 그런지 직원들 사이가 끈끈해짐, 직원들간의 좋은 관계로 직장생활을 버티게됨"
13,모츠,10780,자유로운분위기의출퇴근 무한제공 스낵바.높은연봉.마인드가좋은 회사
14,모츠,10780,"최고를 바라고 업무에 임하는 만큼 상위급의 기획서 작성을 해볼 수 있었고, 다양한 부분에서 경험해볼 수 있었다."
15,모츠,10780,회사 대외 커뮤니케이션을 위한 마케팅팀이있어서 회사 이미지는 좋음
16,모츠,10780,"회사가 복지와 관련하여 가끔 보여주기식의 복지도있지만 대체적으로 회사이미지를 위해서나 직원들을 위해서나 복지에 대한 여러가지 시도를 많이하는편 브랜드도 크고 굵직한 괜찮은 브랜드가 많다. 직원들 뽑는 기준이 외적인부분도 한몫하는듯하다. 외모가 괜찮거나 스타일이 괜찮은사람들이 많음(지금은모르겠지만) 공기업,관공서일보다 기업일이 더 많은편, 꼰대가 없다보니 욕설이나 성적인농담이 오가는 분위기가 아님"
17,모츠,10780,정말 다양하게 일할 수 있습니다. 작은 기획부터 큰 기획까지 하나하나 다 배울 수 있습니다. 나름 안에서는 문화란걸 만들려고 하시는것 같습니다.
18,모츠,10780,- 일이 힘든만큼 회사 생활에서의 자유도도 높았어요. - 식사는 입주한 빌딩 구내식당에서 가능
19,모츠,10780,대표님 마인드가 좋고 젊고 감각있는 능력자들이 있어서 많이 배울 수 있는 곳입니다. 직원 복지에 많이 신경을 씁니다.
20,모츠,10780,"연차 관계없이 프로젝트에 참여하는 정도, 관여할 수 있는 정도가 굉장히 높아 단기간 성장이 가능"
21,모츠,10780,"주차 지원, 간식 구비 , 건물 구내 식당, 대체휴무있음"
22,모츠,10780,트렌디한 클라이언트가 많음 크리에이티브하고 재밌는 아이디어 구현 가능 본부별 자율성 높아 실전경험을 빠르게 쌓을 수 있음 또래가 많아 업무 분위기 편한 편
23,모츠,10780,특정분야에 특화된 트랜디한 이미지와 노하우로 광고주 신뢰도가 강하고 맨파워 또한 강해서 의지만 있다면 성장 가능한 회사. 복지도 좋고 일도 많고 다양한 브랜드 경험
24,모츠,10780,적은 연차에도 다양한 브랜드의 캠페인을 메인으로 잡고 경험해볼 수 있다.
25,모츠,10780,"새로운 것, 트렌디한 것을 계속 찾으려고 노력함 하던것만 지속하기 보다는 시대의 변화에 발맞춰 가기 위한 노력을 지속하는 회사"
26,모츠,10780,"사내 카페테리아, 간식 제공 등 소소한 복지가 있어요."
27,모츠,10780,이름만 들으면 알 수 있는 클라이언트 업무 진행 가능 다양한 행사 접해볼 수 있음
28,모츠,10780,대표님이 엄청나게 직원 생산성을 '복지'로 챙기려고 노력하심. 스낵바며 각종 버스데이 캐시며 직원들의 애사심을 높이는 액션을 많이 취하심. 그리고 여러 기업들의 이벤트를 기획하고 진행하는 일 자체가 잘 맞다면 매우 즐거움.
29,모츠,10780,국내외 탑 클래스 브랜드들의 공간 마케팅. 비대면 언택트 마케팅. 체험 마케팅. 끝내주는 프로모션을 세련되게 설계하는 기업입니다.
30,모츠,10780,"그래도 깔끔한 사무실과 식대제공, 그리고 커피와 간식이 무제한 제공"
31,모츠,10780,어느정도 체계적으로 진행되는 업무 분담과 팀별 클라이언트의 성격차이가 분명하여 어정쩡한 업무는 진행되지 않음
32,모츠,10780,새로운 도전속에 트랜드를 배우고 나름 보람있게 일할수있음 소소한 직원복지도 있음
33,모츠,10780,"라운지에 조명이 이쁨, 냉장고 넓음, 얼음 많음, 중간에 잘먹으라고 간식 많이 줌 이 외 딱히 장점이 없는거같음;;"
34,모츠,10780,하이브랜드부터 대중적인 브랜드들을 모두 맡아서 하기때문에 경험쌓기 좋음 / 팀 복지비가 나오고 카페테리아가 잘 되어있음
35,모츠,10780,"식대지원, 택시비 지원, 사내에 스낵바가 있어서 배고프지 않은 회사 생활을 할 수 있음. 주말 출근 시 대체 휴무 인정, 다 쓰지 못한 대휴(프로젝트휴무)는 한 해가 바뀌어도 또 쓸 수 있도록 배려해줌!"
36,모츠,10780,꼰대분위기는 많이 없고 고리타분한 일은 지양하려고 한다 재밌는일 많이 잇는데 열정이 많이 필요함
37,모츠,10780,"눈치 없이 쓸 수 있는 휴가, 다양한 복지, 중식/석식 제공, 깔끔한 인테리어, 자기 일만 열심히 하면 인정 받는 조직"
38,모츠,10780,포트폴리오에 좋은 대형 클라이언트 다수이며 꽤나 자유로운 분위기에서 업무 진행 가능
39,모츠,10780,불필요한 사내 정치. 눈치 보지 않고 자신의 역량을 충분히 끌어 올릴 수 있는 멋진 동료와 함께 진정 창의적인 일을 통해 보람과 긍지를 가질 수 있게 하는 기업.
40,모츠,10780,"자유로운 분위기, 비지 않는 쇼케이스 (먹을 것이 많음),"
41,모츠,10780,"수평적인 사무실 분위기를 가지고 있음. 물론 팀바팀이기는 하나, 사원급 아이디어를 반영해주려는 팀장이 있음 (물론 아닌 팀도 있음). 수주하는 광고주가 비교적 큰 브랜드가 많아서 포트폴리오 쌓기엔 나쁘지 않음"
42,모츠,10780,"1. 휴가간다고 말리는 사람 절대 없음 2. 근무당시 팀원들 다들 너무 착하고 열심히 일함 3. PD로 입사하였으나 밑에 분들에게도 배울점이 많음 4. 팀장, 실장급은 정말 프로페셔널함 5. 요청만 하면 대표님께서 직접 자료공유도 해주심 6. 대표님이 매우 인자하시고 도움을 주려고 많이 노력하심 7. 정말 일을 제대로 배우고 싶다면 상무님과 친분을 쌓으면 최고 8. 경영지원팀분들도 매우 친절하심 9. 그냥 회사 다니는데 불편하거나 이게 더 필요하다라고 느낀적은 없음"
43,모츠,10780,"이벤트 회사 4번째인데 내가 다닌 회사 중 최고의 복지를 자랑하는 회사. 프로젝트 휴무가 제일 좋았고 사람을 배려해주는 복지가 많았으며 경조사를 챙겨주는 복지는 정말 업계 최고였습니다. 결혼, 임신, 출산을 모두 겪으면서 배려를 해준다는 느낌을 정말 많이 받았고 인간적인 회사에 반했습니다."
44,모츠,10780,다양한 행사를 경험 할 수 있음. 회사 친목 행사가 많음. 직원들 생각해주려고 노력은 함. 젊은 분위기의 회사.
45,모츠,10780,장점이 많은 회사. 동료들도 멋있고 좋아서 긍정적인 영향 많이 받았어요. 솔트에서 진행하는 행사나 상조회에서 진행하는 월간 이벤트도 좋고 결속력있게 만들려는 노력이 돋보였습니다. 프로젝트 휴무도 체계적이고 총무 매니저님이 진짜 엄마같이 챙겨줘요.
46,모츠,10780,"사람을 배려할 줄 아는 회사, 대표님 마인드가 아랫사람을 챙기고 웃음을 전달하고 퐈이팅 있게 해줘요 그리고 프로젝트 휴무가 있는게 너무 좋았어요! 복지 없는 회사 다니다가 모츠 복지 보고 반해서 입사 했습니다"
47,모츠,10780,"의식주를 많이 챙기는 회사 야구잠바, 티셔츠로 직원들을 챙기고 점심, 저녁, 간식, 가끔 솔트에서 만들어 주는 디저트 등을 포함해 건강하게 먹고 인테리어와 각종 소프트웨어도 즉각 대처 해준다 프로젝트 휴무부터 연차, 경조사등 프로세스도 잘 되어 있음"
48,모츠,10780,사무실 인테리어가 좋고 깔끔합니다. 중식 석식 제공되고 나머지는 정말 모르겠습니다.
49,모츠,10780,"대기업 이벤트 기획, 운영을 할 수 있기에 매우 즐거움"
50,모츠,10780,복지가 좋은 편이다. 지금은 모르겠으나 이전에는 그 좋은점을 못 느끼는 친구들도 많았다.
51,모츠,10780,프로젝트휴가. 사내카페테리아. 중식제공. 23시부터 야근택시비지원. 휴게실. 회사는 도태되지않을려는 경영진의 프로젝트에 대한 의지를 보임. 경영인사팀은 직원대상 회사 내외적으로 이벤트를 진행함. 내부 마케팅팀이 대외적으로 회사 마케팅을 함.
52,모츠,10780,"점심, 간식, 커피, 석식, 야식, 야근 택시비 모두 지원되다보니 개인적으로 드는 비용이 없음.(+연봉 높은 편) 대표님 뿐만 아니라 회사 사람들이 너무 좋음. 사람이 좋아서 버틸 수 있을 정도, 사원들을 위한 복지가 정말 잘되어 있음."
53,모츠,10780,큰 규모의 프로젝트를 많이 다루고 커리어에 도움이 된다.
54,모츠,10780,"직원들의 복지가 우선인 회사로, 같은 업종의 타회사들 보다는 만족도가 높다/ 직원들의 친목을 신경쓰며 그 덕분에 새로운 임직원들의 회사 적응이 어렵지 않다/높은 퀄리티의 결과물을 우선으로 하기에 배울 점이 많은 회사"
55,모츠,10780,"다른 회사에 비해 연봉을 조금 더 줌 (그래봤자 일하는 거 치면 최저) 식대 지원, 출근시간 꽤 자유로운 편 (10시까지인데 열시반까지 아무도 안옴)"
56,모츠,10780,쉴 때 눈치 절대 안줌. 직원들끼리 끈끈함이 있음. 즐거운 분위기 속에서 일하기위해 부단히 노력. 내부간에 정보교류가 잘됨
57,모츠,10780,"업무 특성상 주말 및 휴일 업무가 있으나 그에 대해서는 200% 대체 휴무 보상, 사내 라운지 운영으로 업무 중 에너지보충과 충분한 휴식가능, 본부 별 업무에 대한 확실한 구분으로 업무에 대한 집중도 배가,"
58,모츠,10780,"BTL 업계에서 트렌디한 회사라고 인정받고 있으며, 트렌디함을 지키기 위해 노력하고 있다는 느낌이 많이 듭니다. 직원들에 대한 대우도 좋은 편입니다. 회사가 직원 복지에 신경을 많이 쓰고 있다는 느낌이 듭니다.(식대 지원, 주차비 지원, 사내 매점, 소소한 이벤트 등) 자부심을 느끼며 일할 수 있을 정도로 굵직한 클라이언트들이 많으며, 동종업계대비 연봉도 나쁘지 않은 편입니다. 트렌디한 기획력과 꼼꼼한 실행력을 모두 갖춘 회사로 주니어들이 배울점이 많습니다. BTL 광고에 관심이 많은 사람이라면 재미있게 일할 수 있을 듯 합니다."
59,모츠,10780,본부별 분위기는 다르지만 비교적 다른 회사에 비해 자유로운 분위기 출퇴근에 대한 압박감이 없음 경영진쪽에서 직원들을 위한 기업문화를 지속적으로 시도하는 모습이 좋다.
60,모츠,10780,"오래된만큼 회사가 탄탄하고 다른 BTL대행사이 비해 직원들을 위한 복지, 체계가 잘 잡혀져 있음 야근, 주말 출근 등 워라벨은 포기해야하지만 그에 상응하는 대가와 대우를 해주는 편 지금은 조직이 바뀐걸로 아는데, 다닐땐 좋은 분들 밑에서 배우고 다양한 프로젝트를 경험하며 다닐 수 있어서 좋았던 것 같음"
61,모츠,10780,일은 많음. 사람들은 다 좋은 듯 함. 능력치가 높은 분들로 구성. 회사내 먹는 것에 대한 복지는 국내 최고일 듯.
62,모츠,10780,"연차를 눈치 안보고 쓸 수 있고, 젊은 사람들이 많아 수평적 업무를 진행 할 수 있다. 업무 강도는 대부분의 회사와 비슷하겠지만 프로젝트 휴가가 주워져 쉴 수 있는 환경이 구성되어 있음 점심 저녁 식대를 지원해 밥값이 들지 않음"
63,모츠,10780,다른 회사보다 돈은 많이 줌. 간식 구비. 회사가 굴러갈라고 노력하는건 많아서 도태될 위험은 없다고 본다
64,모츠,10780,자유로운 근무 분위기에서 일할 수 있다. 이름만 들으면 아는 국내외 유명 브랜드의 프로젝트를 경험할 수 있다. 같이 일하는 직원들의 수준이 상당히 높다. 하나의 마케팅 프로젝트를 기획부터 실행까지 경험할 수 있다.
65,모츠,10780,개인 노력에 따라 다양한 경험과 성장가능 그 외에는 그닥 없음 철저히 소모품화될수있음
66,모츠,10780,나름 업계에서 네임밸류? 하지만 아는사람들중에 네임밸류... 결국엔 을 입장..... 다른 BTL회사보다 연봉 쪼금 더 준다는거?
67,모츠,10780,회사의 인테리어 사내에 있는 편의점? 등 직원에 대한 예우가 좋다 무엇보다 직원을 생각하는 대표의 마인드가 좋다. 젊은 직원들이 대다수 여서 분위기는 너무 엄숙하지도 너무 밝지도 않고 딱 적당하다.
68,모츠,10780,"프로젝트 휴무를 편하게 사용할 수 있고, 간식 및 복리후생이 좋다. 자체적 시상식을 통해 별도 리워드가 있고 성과에 대한 보상이 확실하다"
69,모츠,10780,체계적인 업무 프로세스와 개인 역량을 향상시킬 수 있는 다양한 경험을 할 수 있음. 중.석식 지원해줌. 주차비도 지원해줌. 사무실 인테리어도 크리에이티브 하고 간식.커피 항상 구비되어 있음. 연차 상사 눈치 안보고 사용 가능. 연차 보상비 있음.
70,모츠,10780,"이벤트/프로모션 업계에서 럭셔리, 프리미엄 등 아티스트리 이벤트를 경험하고 다양한 포트폴리오를 구축할 수 있는 기회와 가능성이 최대 장점, 회사 경영의 Transparency를 위해 실적 및 평가/보상 기준에 대한 공개와 더불어 임직원들을 위한 다양한 복지(프로젝트 휴가, 주차, 중/석식 지원, 사내 편의점 등) 제공"
71,모츠,10780,"복리후생에 대한 강점이 많은 곳, 타 이벤트 회사에서 느낄 수 없는 차별화된 복리후생을 만들고 제공하는 곳. 야근과 주말 출근에 대한 보상, 식음료, 성과에 대한 보상 체계가 확실함. 젊은 사람들이 많아서 어울리기 좋음"
72,모츠,10780,"업계에서 나름 인지도 있음, 대표가 대외적으로 보이는 것을 중요하게 여기기 때문에 복지 면에서는 나쁘지 않았다. 하지만 어디까지나 보여주기식 복지, 그리고 그 복지는 먹는거나 보여지는 시설 등이지 워라밸에 대한 고민은 일절 없음을 참고하시길.."
73,모츠,10780,럭셔리부터 세일즈 프로모션까지 최고의 퀄리티를 자랑한다.
74,모츠,10780,아침 점심 저녁 공짜로 줌 (구내식당) 사무실 인테리어 화려함
75,모츠,10780,"다른 업체에 비해 열려있는 수평적인 문화, 직원들에 대한 대우도 괜찮음. 내부 행사도 간혹 있음."
76,모츠,10780,"직원 복지 신경쓰는 대표, 인테리어는 좋다. 딱 거기까지다. 전체적으로 분위기는 나쁘지 않으며 겉에서 보면 참 좋아보인다."
77,모츠,10780,회사가 좋은 의미의 욕심이 많담 페이도 업계에서 괜찮고 배울기회와 역량 키울 기회도 많다. 또 회사가 젊고 세련되려는 욕심이 많다. 트렌드에도 민감한 편이고 최신 문화예술에 대한 관심이 많다.
78,모츠,10780,"직원들의 복지를 향상시키기 위해 많이 신경써줌, 큰 행사를 처음부터 끝까지 경험할 수 있음, 대체적으로 자유로운 분위기"
79,모츠,10780,"비교적 자유로운 기업 분위기, 동종업계 대비 연봉은 괜찮은 편"
80,모츠,10780,자기개발 지원도 있고 회식비 지원도 있고 사무실 인테리어나 복리후생적인 방면에서는 확실히 좋았던 기업 연봉도 괜찮은편 음주가무 즐기면 추천
81,모츠,10780,"일을 배울수 있는곳, 여러가지 복리후생, 직원들에게 혜택을 주기 위해 많은 노력을 함 업무 특성상 자유로운 출퇴근 가능, 중식/석식이 제공되며 다양한 커뮤니티를 만들어 직원들이 일을 더 원활히 할 수 있는 기회 마련"
82,모츠,10780,큰 규모의 프로젝트를 경험할 수 있다. 직원들을 생각해서 뭔가 해주려는 마음이 느껴짐
83,모츠,10780,비교적 자유로운 업무 분위기. 야근이 많은 만큼 출근시간도 자유로운편. 택시비 지원. 내부 인테리어 등 근무환경이 좋다. 직원들을 위한 사내문화 만들려고 노력하는 편.
84,모츠,10780,회사의 단기적인 매출이나 성장도 중요시하지만 장기적인 플랜을 가지고 시장을 보고 있으며 차별화를 항상 생각하는 기업. 다양한 행사 경력이 많은 임원진이 구성되어 있으며 깊이 있는 포트폴리오를 가지고 있어 발전가능성이 많은 기업. 업무에 따라 유동적인 출근 및 휴가시간이 가능함.
85,모츠,10780,회사의 독특한 사내 문화와 감각적인 감각이 있음. 대한민국에서 열리는 큰 행사들을 다양하게 경험 할 수 있음. 팀 별 개인 능력을 인정 해줌. 미래가 밝은 회사.
86,모츠,10780,직급에 상관없이 여러 프로젝트에 참여가능하며 여러가지 롤을 줌으로 빨리 배울 수 있음
87,모츠,10780,근무환경이 좋다. 자유로운 분위기. 자기계발비등의 지원이 있으며 내가 한만큼 보상과 대우를 해 준다. 업무에 따라 출.퇴근 시간이 자유롭다.
88,모츠,10780,"이벤트업계의 특성상 어쩔수 없는 야근을 할 수 밖에 없는 경우가 간혹 있긴하지만, 그에 대한 적절한 대우는 받는 것 같다. 급여 수준도 높고 회사 복지제도가 제법 괜찮은 편이다. 일할때 자유로운 분위기"
89,모츠,10780,복지가 좋을거 같지만 실상보면 그냥 연봉이 높아서 좋은것. 연마다 인상 조정하여 급여가 뿌듯
90,모츠,10780,"국내 TOP BTL회사로 업력도 인정 받은편. 큰 프로젝트 수주건이 많음. 다양한 대기업 마케팅 관련 업무를 진행 할 수 있음. 경험쌓기엔 좋을듯. BTL업계에선 연봉 높은편. 복지, 보상제도가 정말..많음. 해외 인사이트 체험 기회."
91,모츠,10780,다수의 대기업 광고주 보유. 능력만 된다면 큰 광고주들과 큰 행사들을 다양하게 접할 수 있음. 젊은 기업으로 사람들이 전부 좋음. 업계에서 알아주는 편. 복지 및 연봉이 좋은 편.
92,모츠,10780,지하1층 클럽인태리어 및 최상의 카페테리아 조성 헌가지만 좋음
93,모츠,10780,젊고 가족같은 구성원 회사로고가 브랜딩된 아이템을 많이 제공해 줌 예쁜 카페 겸 회의실
