,company_name,company_id,review_text
0,모스트콘텐츠,11986,"복지나 워라밸, 직원처럼 개발 업무와 무관한 것들은 매우 좋습니다. 역에서도 가깝고 사무실도 넓고 쾌적합니다. 비개발자 직군은 나쁘지 않아 보였습니다."
1,모스트콘텐츠,11986,1..자유로운 연차사용이 가능합니다. 여타 다른 기업들처럼 당연히 업무가 바쁘면 사용 못하고 대체로 사용 가능했었습니다.
2,모스트콘텐츠,11986,마실 수 있는 음료가 많고 간식이 제공되어 있음. 복지가 괜찮은 편.
3,모스트콘텐츠,11986,회사 건물이 깔끔하고 사람들이 좋다. 야근으로 인한 스트레스는 없음.
4,모스트콘텐츠,11986,팀 잘 만나면 분위기는 좋음 아닌 팀은 정말 아님. 기본적으로 투자나 정부사업 위주로 자금을 지원받음 저작권 사업이다보니 작품을 많이 할 수록 수익은 지속적으로 발생. 복지를 늘리려고 하기는 함
5,모스트콘텐츠,11986,"업무적으로 배울것이 많으며, 다양한 경험들을 할 수 있습니다. 사내 분위기는 자율성이 있으며, 직장동료들 간의 관계가 좋습니다."
