,company_name,company_id,review_text
125,미리디,5180,자유로운 호칭으로 편하게 의견교환을 할 수 있고 야근을 강요하지 않는 분위기로 기간안에 자율적으로 업무를 할 수 있습니다 이전에는 어땠는지 알 수 없으나 작년부터 분기마다 진행되는 경영진 평가를 통해 빠른 피드백을 받을 수 있습니다
126,미리디,5180,연차를 눈치 안보고 쓸 수 있음 개인의 역량의 최대한으로 발휘할 수 있게 다같이 고민해주는 회사 아침밥 주는 회사
127,미리디,5180,연차 눈치안보고 쓸 수 있음. 수평적임. 성과를 아래사람과 나누려고 함
128,미리디,5180,기여하는 만큼 인정을 받고 같이 커갈 수 있습니다. 정직하고 성실하게 성과를 보여주면 인정받을 수 있습니다. 1년 이상 근무 시 60만원의 자기계발비 지원/아침점심 식비지원/도서구매지원 등 복지가 좋습니다.
129,미리디,5180,"가족경영이라는 글이 있으나 최근에 대부분 퇴사 했음 수치와 성과로 업무를 평가할 줄 아는 경영과 그 목표를 이룬 보상을 잘해주는 장점을 가진 회사 성과에 대해 보상을 적절히 하는 기업이 많지 않은데 이곳은 수치와 가시적 성과가 나면 승진, 처우를 잘 해줌 인센까지 챙겨줄 줄 아는 사장"
130,미리디,5180,업무 능력에 큰 부담을 가지지 않아도 됩니다. 편하게 생각하면 편하게 다닐 수 있습니다. 실제로 업무 능력에 부담을 가진 직원을 편한 부서로 인사이동 해주기도 합니다. 근무환경이 자유롭습니다.
131,미리디,5180,급성장하는 기업으로 나름대로의 보람과 자부심을 가지고 일을 할 수있는 환경입니다.
