,company_name,company_id,review_text
0,미리디,5180,"워라벨 괜찮았고, 회사 성장가능성이 있었음 부서간 분위기 보통"
1,미리디,5180,계속 새로운 것들을 진행해서 새로운 개발할 것들이 많아서 나름 재밌음
2,미리디,5180,분위기가 수평적이고 자유롭습니다. 노력만 한다면 다양한 기회를 얻을 수 있습니다.
3,미리디,5180,자유롭고 재택이 가능. 새로운 툴을 익히면서 배울수 있음
4,미리디,5180,다양한 업무를 맡아 해볼 루 있다는 점과 적은 연차에도 도전할 수 있는 기회
5,미리디,5180,점심값 아침 도서 동호회 지원 나쁘지 않은 위치 장비 지원 주2회 재택근무 자율출퇴근
6,미리디,5180,"깔끔한 사무실, 식대 어느 정도 지원, 모니터가 크다."
7,미리디,5180,주 1회 재택근무 그나마 조금이라도 자유로운 분위기
8,미리디,5180,조식 지원 점심식대 꽤 지원 기타 책상 의자 등 사소한 것까지 편안하고 좋음 복지에 대해 건의하면 대부분 긍정적으로 듣고 수용해줌 전체적으로 사람들이 좋다 무엇보다 주니어 개발자에게 추천하고 싶음
9,미리디,5180,직장동료 사람들이 너무 좋고 새로 온 사람에게 관심이 많아서 금방 잘 적응할 수 있다.
10,미리디,5180,"안정적인 수입 구조로 시도해볼 여지가 많고, 대표 및 임원들이 대화의 창을 항시 열어두고 있다. 대표 지분이 대부분이라 외부 세력 눈치를 안 본다. 정치가 없다. 가끔 정치 있다고 쓴 글 봤는데 사내 정치가 뭔지 모르시는 사회 초년생들 글인 듯. 자리 싸움 하는 임원들 없고 (오히려 사이 굉장히 좋고 협력적이다) 누구 라인 이런 거 없고, 회사 이익 대신 개인 이익을 우선하는 집단 형성하는 분위기도 없다. 그래서 모든 의사 결정이 나름은 합리적이다. 당신의 생각과는 맞지 않을지 몰라도 적어도 신입 사원이 대표실 문 두드리고 말 거는 걸 환영하는 문화이다. 대표가 본 네이쳐 개발자에 전문 스키 강사 자격증을 가졌다. 전략 이사는 아마츄어급 복싱 실력을 가졌고, 기술 이사는 개발자로서도 뛰어나지만 전문 서핑 강사 이력도 있다. 품질 보증 팀 리더는 스노우보더들 사이에선 꽤 인지도가 있는 실력자다. 그렇다. 미리디에서는 당신의 업무를 잘 하는 건 당연한 거고, 적어도 또 하나 정도는 내놓을 게 있어야 한다…고 말해도 좋을 정도로 다재다능한 사람들이 많다. 그렇다고 위축될 필요는 없다. 그런 열정을 가졌다는 것이 중요한 거지. 찾아보면 댄서 출신의 기획자나 쇼츠 영상에서 본 거 같은 피엠을 찾는 것도 어렵지 않다. 리더를 업무로 보고 등급으로 생각하지 않기 때문에 굉장히 경력이 적지만 리더가 자신보다 고경력의 팀원을 리딩하는 모습도 볼 수 있다. 그리고 그런 상황이 누구에게도 불편하지 않은 기업 문화가 있다. 사람들이 매우 좋은 분위기를 만들고 이어가고 있다. 퇴사할 때 가장 고민했던 부분."
11,미리디,5180,복지가 좋고 점심 식권 및 포인트가 다양해서 생활비에 보탬이됨
12,미리디,5180,간단한 아침이 주어졌는데 요즘은 어떤지 모르겠네요. ㅎㅎ
13,미리디,5180,젊은 직원이 많아서 동아리 활동 등 즐길거리가 있는 장점이 있다.
14,미리디,5180,기업 분위기는 젊은 편 계산되고 부풀려진 복지들 그리고...
15,미리디,5180,"조식, 점심식대 일부 지원과 같은 소소한 직원 복지가 있어요."
16,미리디,5180,타부서 사람들은 좋음 회사 비전 및 전망은 긍정적인 편임 성과금 등 직원들을 챙겨주려 하는 부분이 있음
17,미리디,5180,"다작하고 다양한 디자인, 도안도 맡다보니 자연스레 스킬적으로나 감각이 향상될 수 밖에 없음."
18,미리디,5180,한줄평에 적힌 내용과 동일합니다. 그리고 기본적인 예의가 갖춰진 사람들이 대다수라서 좋습니다.
19,미리디,5180,"동료들이 좋고, 좋은 분위기에서 일할 수 있어요. 계속 성장중이라서 본인의 의지만 있다면 회사와 같이 성장 할 수 있음. 워라밸 신경쓰기도 좋음"
20,미리디,5180,디자이너가 활동하기 편하게 해주시는 것 같아요. 크게 어려움 없이 업무 잘 하고 있습니다. 개개인마다 평가는 다르겠지만 저는 만족하고 있어요
21,미리디,5180,연차는 자유롭지만 연봉은 낮아 뭔가 발전한다고 느끼기에는 어려운곳입니다. 뭐 자유롭게 지내고싶다면 가도좋을것같기도항데 청춘을 허비한다고 많이느끼실수있습니다.
22,미리디,5180,연차 자유롭게쓸 수잇엇고 평균 연령높아서 소통하기 좋앗음
23,미리디,5180,"부서에 따라 다르긴 하지만 워라밸 챙길 수 있음. 몇몇 부서는 야근하는 것이 필수라는 분위기. 구로에 위치해 서울 기준 서쪽에 사는 사람들은 강남 대비 출퇴근 편함. 조식, 중식 일부 지원하여 일부 식비 절감 가능"
24,미리디,5180,"성장하는 회사, 앞으로도 기대가 되는 회사, 성장하는 만큼 직원복지도 챙기는 회사"
25,미리디,5180,출퇴근이 유연 근무로 자유롭다... 사후 연차 쓰기 눈치 보이지 않는다..???? 직원들을 챙겨주려 하는 듯 부서별로 분위기가 매우 다른 듯
26,미리디,5180,"연차눈치안보고 쓸 수 있음, 아침에 출근하면 아침 싸게 구입가능, 지하에 구내식당이 있어서 좋아요"
27,미리디,5180,연차 아무때나 사용 가능 행복복지비 명절에 상품권 줌 인사팀의 열일 점심 비용 일부 지원 야근 식대 있음 재택(리더재량)
28,미리디,5180,근무하는 중 좋았습니다. 특히 수평적 조직문화와 주차 지원 등 복리후생들이 타 중견 업체 보다 좋은 편임
29,미리디,5180,나름 체계적으로 성장하고 있다고 생각함. 일정 조율이 자유롭게 가능.
30,미리디,5180,자유로운 곳에서 일할 수 있다. 프리랜서로 일하면 한명의 관리자와만 연락을 하기 때문에 다른 사람과 이야이하지 않아도 된다.
31,미리디,5180,일은 내가 찾아서 한다. 실력자가 많다. 일거리가 아직 있다.
32,미리디,5180,"아침, 점심 식대 일부 지원. 복지성 비용 일부 지원."
33,미리디,5180,디자인 강점 회사라 배울게 많고 자유로운 분위기로 좋아요
34,미리디,5180,매우 매우 수평적이며 주니어가 빠르게 커리어를 쌓을 수 있다. 대신 공부 많이 해야함.. 많은 챌린지를 할 수 있도록 해준다.
35,미리디,5180,식대 지원으로 조식 중식 지원됨. 자유로운 연차사용이 좋음.
36,미리디,5180,직원들이 하고 싶은 건 지원해준다. 개발자들이 다니기 좋은 회사. 개발하면서 월루 가능~~
37,미리디,5180,연차 눈치없이 쓸 수 있음. 사람이 좋음. 잘할 수 있는 업무를 배정해줌
38,미리디,5180,"회사와 신입이 함께 성장하는 기업. 신입을 기다릴 줄 아는 회사, 좋은 사람들이 많아, 조언을 받기 좋은 회사."
39,미리디,5180,- 월 3만원으로 조식 신청 가능 - 점심 식대 일부 지원 - 명절에 신세계 10만원 상품권 지급
40,미리디,5180,사람들이 아주 좋고 착하다. 아침 점심 밥 지원과 행복개발비가 지원되고 다양한 업무를 경험 할 수 있다.
41,미리디,5180,사람들이 착해요 간식도 무한 제공 하고 근무한 경험이 좋아요
42,미리디,5180,연차사용편함 식대지원 사무실 깔끔함 장비 및 사무용품 지원 잘해줌 일할때 필요한 것에 대해선 아끼지 않는 편
43,미리디,5180,자유로운 연차 사용 점심 포인트 지원 분위기 좋음 (사람들이 다 착함) 모난 사람들이 없음 성장률 높음
44,미리디,5180,수평적인 조직문화이고 자유로운 연차 사용이 장점인 것 같다
45,미리디,5180,수평적인 분위기. 그럼에도 연차에 따라 서로 상호보완을 해주며 성장하는 분위기.
46,미리디,5180,오래 다닐 수록 기회가 많아 집니다. 오래다닐려면~~ 스스로 많이 스터디해야 합니다. 정적인 분에게는 힘들 수도 있습니다.
47,미리디,5180,행복개발비 조식지원 식대지원 수습끝나면 기념선물 입사시 웰컴키트 커피 및 간식 지원 회식비 지원 등 복지가 괜찮음 휴가사용도 자유로움.
48,미리디,5180,사람들이 다 유하고 좋음 보고를 위한 보고 일절 없고 효율적인 근무 분위기 소소한 이벤트가 많음 폭풍 성장 중
49,미리디,5180,연차 자유롭게 쓸 수 있음 동료들이 비슷한 나이대라 의견 나누기 좋음
50,미리디,5180,"개발자에게는 좋은듯, 대표가 젊음, 사무실이 역 근처에 있음 사무실이 깨끗함 야근은 거의 없음"
51,미리디,5180,- 연차 자율(3일 전에만 결재 올리면 됨) - 사내 지하 1층 식권 지원해줌(돈이 안 드는 것은 아니나 저렴하게 먹기 가능) - 화장실 깨끗하고 생리대 구비 - 빠릿빠릿한 인사팀 - 서면 결재 없음 - 사무용품 줌 - 사무실 깨끗함 - 아침 3만원만 내면 한달치 도시락 먹을 수 있음 - 자기계발비 - 명절 신세계 상품권
52,미리디,5180,"건물이 깨끗하고, 실무하는 사람들은 다 젊고 좋았어요 아직 체계가 잡혀있진 않았지만 그냥 경력쌓기 정도로 괜찮았습니다."
53,미리디,5180,"연차 사용 자유로운 편. 다양한 의견 제시 가능. 조식, 이벤트 데이 간식 증 자잘한 복지가 있음."
54,미리디,5180,"행복개발비, 도서지원비, 식대 지원 등 복지가 좋음. 팀바이 팀이겠지만 자율출퇴근, 수평조직이라 숨막히지않음. 성장은 알아서. 일 하는데 있어서 자율성을 보장함. 회사 내에 이상한 사람(?)이 없음."
55,미리디,5180,직무적으로 발전하고자 하는 분위기가 갖춰져있음. 단 회사 차원이라기 보다는 성장하고자하는 직원들이 모여있어서 새로운 툴이나 사이트 등을 공유하며 자발적으로 노력함.
56,미리디,5180,출퇴근 자유롭고 업무가 명확하였다 근무환경 깨끗하였고 자기할일 하고 퇴근하는 분위기
57,미리디,5180,"더이상 발전은 좀 어려워보이는 회사, 연봉도 낮고 꼰대가 판을침"
58,미리디,5180,실무를 이루는 인력은 젊기 때문에 함께일하는 재미는 있다. 서로 눈치 볼일이 많이 없고 업무 환경이 자유로운 편이라 워라벨이 좋은 편이다. 개인 역량이 있다면 어느정도 실현시킬 수 있는 환경.
59,미리디,5180,"워라밸이 좋음. 직장인들 모두 바쁜 시즌, 안 바쁜 시즌 있을텐데, 워라벨이 뒷받침 되지 않으면 안 바쁜 시즌에도 눈치보고 죽어라 일만하게 됨. 여긴 안 바쁜 시즌엔 필요한일 하고 집 가면 됨. 그리고 연차 사용도 자유로우니까 바쁠 땐 빡세게 일해서 성과내고 비시즌엔 체력을 보충할 수 있음. 결론은 소모품으로 소모되지 않음."
60,미리디,5180,명한 현수막을 잘 팔아서 돈이 있다 투자 때문에 구걸할 필요는 없다
61,미리디,5180,담당자와의 소통이 빠르며 근무시간이 자유로운편 . 자기 스케쥴에 맞게 조절하면됨 디자인 양이 많지 않음 (주 1-2개 작업)
62,미리디,5180,"자유로운 분위기, 저렴하게 아침밥 먹을 수 있는것, 같이 일하는 사람들은 좋았음 사람은 죄가 없는데 일이..."
63,미리디,5180,"식대 지원이 좋음. 점심 지원이 빵빵하고 조식도 저렴한 가격에 해결 가능. 그 외로 간식비나 도서지원비, 행복계발비 등과 같이 지원해주는 복지가 꽤 있음. 카페테리아도 기분 좋게 잘 구성되어 있고, 작은 1~2인용 회의실도 아주 요긴. 기본적으로 분위기가 좋은 편이라서 사람 스트레스가 매우 적은 편"
64,미리디,5180,회사가 성장하면 직원들에게도 더육 신경 쓰고 복지 급여도 더 좋아지고 있습니다. 성장을 나누려는 노력을 합니다
65,미리디,5180,복지가 좋고 디자인을 잘 하는 사람들이 많아수 배움이 많으
66,미리디,5180,"비슷한 규모의 중소기업에 비해 자기 계발비, 식대지원 등 복지를 갖추려고 노력하고 있음. 동료들이 유한 편이며, 업무강도가 낮아 편하게 다니기 좋음. 워라밸 잘 맞음."
67,미리디,5180,"야근강요없고, 연차 눈치 안보고 쓸수 있고 복지를 신경쓰며 임직원간 상호 소통을 중요히 여기는 편."
68,미리디,5180,연차를 윗사람 눈치 안보고 쓸 수 있음. 재택근무가 굉장히 자유로움. 젊은 사람들이 모여 깨어있는 분위기. 주도적으로 업무에서 다양한 시도를 해볼 수 있음.
69,미리디,5180,"아침, 점심 저녁 제공 다양한 복지제도있음 동호회 지원있음 적극적 온보딩"
70,미리디,5180,"당연하지만 기획서가 있다, 피드백이 비교적 빠른 편이다."
71,미리디,5180,"체계적인 시스템, 디자인 건수 및 작업 일정은 적당한 듯"
72,미리디,5180,연차 쓰는거 하나도 눈치 안보임. 존대말 문화가 잘 자리잡고 있음. 출퇴근 시간이 유연함. 소통이 잘됨. 인턴에게도 잘 대해줌.
73,미리디,5180,"프리랜서로 일했던 기업 중에서 시간적으로도, 비용적으로도 가장 합리적으로 작업을 할 수 있었던 것 같아요. 담당자분과도 소통이 빠르고 명확해서 좋았습니다."
74,미리디,5180,사람들이 좋고 연령대가 비슷하기때문에 소통하기 편하고 좋다
75,미리디,5180,자유롭게 편하게 일할 수 있다. 내가 한만큼 보상받을 수 있다.
76,미리디,5180,이것저것 많이 하려고 보이나 다른회사에서도 많이 하고는 있습니다 그래도 직원을 위한 복지를 하기위해 노력합니다
77,미리디,5180,연차사용 눈치 안보고 쓸수있음 같이 일하는 사람들이 좋음
78,미리디,5180,근무시간을 자유롭게 사용가능. 건당 급여를 받을수 있기때문에 작업속도가 빠른 분들에게는 좋은곳.
79,미리디,5180,연차를 눈치없이 쓸 수 있음 많은 것을 배울 수 있는 곳
80,미리디,5180,편한 근무환경. 실력있는 개발자가 많음. 큰 부담없는 업무 등
81,미리디,5180,연차 마음대로 쓸 수 있음. 수평적이고 회사 분위기 좋음. 사람들끼리 으쌰으쌰 하면서 잘 지냄.
82,미리디,5180,회사 시설이나 직원을 위한 복지는 좋은편임 수평적 구조 해당 팀은 대부분 칼퇴가능
83,미리디,5180,"- 같이 일하는 동료들이 정말 좋음 - 다양한 업무를 배우기 좋음 - IT기업의 장점은 모두 가지고 있음 - 식대 지원, 자기개발비 지원 등 직원복지에 신경쓰고 있음 - 본인이 원한다면 워라벨 챙길 수 있음 - 위키와 지라사용으로 히스토리 및 레퍼런스 찾기가 쉬움 - 의견제시가 어렵지 않음  해당 직무에 신입이라면 정말 많은 것을 배울 수 있고, 주변 동료들이 좋아 마음 편히 일할 수 있다. 관심을 갖는다면 타직무의 업무도 이해할 수 있다. 처음 커리어를 쌓는데 좋은 회사이다."
84,미리디,5180,"- 연차 눈치 안봄 - 자율근무제 점심시간 포함9시간 근무하면 되서 사실상지각없음 - 사람들이 순하고 착한편 - 야근압박 업음 - 조식과 점심식대 저렴한편 - 자유로운 분위기, 복장제한없음"
85,미리디,5180,타 중소기업에 비해 기업문화나 복지가 괜찮은 편이다. 사무실 분위기 또한 좋은 편이다.
86,미리디,5180,식비지원 ........................말곤 사실 없음........
87,미리디,5180,요새 핫한 조직 문화를 따라하려고 애씁니다. 그래서 요즘 핫한 기업의 조직문화의 현 주소를 알 수 있습니다.
88,미리디,5180,"1) 잘 갖춰진 개발 프로세스 및 문화 2) 수평적이고 서로 존중하는 문화 3) 준수한 복지 (자기계발비, 식대, 도서) 4) 미리캔버스의 성장성 (1년 안에 회원이 150만명 넘음) 5) 다양한 연령대의 사람들이 모여있지만, 평균연령은 낮고 파릇파릇함. 난 아님. 6) 강요 없음 (회식, 술, 야근 등) 7) 여름에 반바지 가능 (개인을 존중하고 자유도가 높다는 뜻) (아, 겨울에도 가능) 8) 자율출퇴근제 있고 휴가 자유롭게 쓸 수 있음. 9) 부장님과 함께하는 등산 없음 (그냥 등산 자체가 없음) 10) 사내정치 없음 11) 입사선물 있음 (난 없을 때 들어옴) 12) 사내 서비스 포인트 제공 (점점 살 게 많아짐)"
89,미리디,5180,"1.코로나, 폭설 등 재해 발생시 재택, 원격 근무 지원 2.직무 교육을 위해 전폭 지원 3.적응 못하거나 잘 못하면 잘 할 수 있는 부서로 곳으로 옮겨주거나 트레이닝 시켜주는 것 자주 봄"
90,미리디,5180,연차를 마음대로 쓸 수 있음.(관련 업무 협의가 이뤄졌을 경우) 식대를 일부 지원해줌.
91,미리디,5180,깔끔하고 정확한 기획서와 피드백으로 디자인 방향성이 뚜렷합니다. 또한 소통이 빠른 편이라 시간단축을 할수있어 가장 좋았습니다.
92,미리디,5180,"사장님이 개발자 출신이라 개발자를 잘 이해 해주는 편. 수평적인 조직 구조, 젊음, 그리고 일하는데 좋은 환경."
93,미리디,5180,"수평적인 구조, 조식제공, 중소기업치고 좋은 복지제도, 임원급 빼고 나머지 사람들이 좋았다."
94,미리디,5180,연차는 내가 쓰고싶을때 마음껏 사용할수 있다 복지비있음 업무환경 좋음 자율출근제라서 출퇴근이 자유롭다
95,미리디,5180,수평적관계 나름갠춘. 정치질이좀 잇엇지만 그래도 완전 쓰레기같은 사람들은 없어서 자기가 처신만 잘하면 다닐만했었음
96,미리디,5180,"구로디지털단지역에 있어서 출퇴근이 편하고, 지하 구내식당이 있어서 점심메뉴 고민이 없어서 좋음. 다른 콜센터와 달리 점심시간은 잘 지켜주려고 함"
97,미리디,5180,"개발문화가 구시대적이지 않고 이것저것을 자연스럽게 배울 기회가 많음 기술적으로 2~3년차 수준까지 빠르게 성장할 수 있음 자율출근, 식대, 자기계발비 등 괜찮은 복지가 여러 개 있음"
98,미리디,5180,"자기 개발 비용 지원, 연차를 눈치보지 않고 사용할 수 있음, 식권을 사용할 수 있는 곳이 많음, 체계적인 이슈 관리 등"
99,미리디,5180,"자유로운 분위기에 좋은 사람들, 출퇴근시간이 자유로워 큰 부담없음 회사는 지속적으로 성장중이며 안정적임"
100,미리디,5180,"분위기가 젊으나 회사는 조용하다 기업 문화를 위해 신경쓰는게 보인다, 만족스럽다"
101,미리디,5180,"제일좋은건 연차를 눈치안보고 쓸수있었고, 식대 지원, 거의 다들 칼퇴근하는 분위기.. 적립금을 매달 줘서 제품마들어서 사용할수있었음.."
102,미리디,5180,조식지원 문화복지비 지원 젊은 사내분위기 자율출근제 막상 나오고 보니 꽤 좋은 회사... 연봉만 더 줬다면 안정적인 직장으로 뼈묻기 가능할듯 모든 사람들이 둥글둥글하고 업무 스트레스가 크지 않음.
103,미리디,5180,연차 자유롭게 쓸 수 있고 식대지원으로 식권 저렴하게 구입가능함 전체적으로 연령대가 젊고 분위기좋은편
104,미리디,5180,연차 자유롭게 쓸수있고 식대지원으로 식권 저렴하게 구입가능 연령대가 젊고 분위기 괜찮음 개발자에게 좋음
105,미리디,5180,"행복개발비(자기계발비 지원) 해외여행 시 비행기표, 운동, 학원 지원해줌. 조식도 있음. 업무 진행시 문제점이나 개발 요청하면 바로 확인 후 필요성이 느껴지면 바로 개선해주고, 개발해주려고 한다."
106,미리디,5180,1. 자유로움. 다만 너무 자유로워서 의사결정이 발산함. 2. 하는 만큼 해볼 수 있음. 발전은 자기 하기 나름임. 하지만 CTO 영입 후로 제한됨.
107,미리디,5180,비교적 능력에 맞는 업무가 주어져 업무 스트레스가 상대적으로 덜 한 회사 자기 일만 잘 마무리하면 야근 강요 등 없는 회사
108,미리디,5180,디자인 직군에대해 정말 아무것도 모르는 신입으로는 훈련?비슷한 반복된 업무에서 배울 수 있는 부분이 많습니다.
109,미리디,5180,발전가능성 보이고 계속 더 위로 올라가고자하는 부분이 보임
110,미리디,5180,"1) 조식, 중식을 저렴하게 먹을 수 있음. 2) 수평적 문화 (라서 승진도 없음, 단점이기도 함) 3) 경영진제외 2~30대 젊은 직원들이라 나름 재미있습니다. 팀장+팀원들 덕에 힘들어도 좀 더 다니게 되는 회사"
111,미리디,5180,"연차 눈치 안보임, 연간 자기계발비 60만원, 동호회 지원, 도서구매 지원 등등 복지는 기업규모에 비해 좋음"
112,미리디,5180,"식사제공, 연차사용자유 (시즌이나 큰 업무만 없으면 정말 거의 자유) 거의...! 워라밸이 완벽하게 지켜지는 문화라 업무시간에 초집중만 한다면 정말 저녁이 있는 삶을 누릴 수 있다. 팀바이팀이지만 리더급들이 다 제대로 리딩할 수 있는 사람들이라 보고 배울 수 있음. 수치나 GA를 매우 중요시하는게 장단점을 모두 가질 수 있는데 최대한 최신 트렌드에 맞는 툴을 적용하려고 함. CS부터 디자인, 개발 모두 한 회사에 있어서 전체 프로세스를 익히고 확실히 배울 수 있는건 많다."
113,미리디,5180,"연 60만원 복지비, 일부만 내면 조식/중식 지원, 야근할시 식대지원, 야근강요안함, 수평적인 문화, 딱 기본만 배우기 좋은회사"
114,미리디,5180,휴가를 눈치 안보고 쓸 수 있음. 사장님이 개발자 출신이라 개발자들을 잘 이해해주심. 직원들의 불만사항에 대한 피드백이 빠름.
115,미리디,5180,"연차 자유롭게 쓸수있음 명절에 10만원 조식, 식권 저렴하게 구매 1년에 60만원 지원"
116,미리디,5180,새로운 정책을 도입하고 발전하고자 노력하는 회사 특히 타 개발파트에 비해 야근이 적고 스터디 지원 등 좋은 기회가 많은 편 대표 및 팀장 대부분이 개발자 출신이라 개발에 많은 지원을 주는 편
117,미리디,5180,연차 자유로움. 3개월 무지각시 자율출근 가능. 아침점심제공(한식사당 천원만 본인이 냄). 1년 근무시 행복개발비 줌.
118,미리디,5180,장점 그냥 사회초년생에 1년 다니기에 좋은회사 개발자들이 아니면 다니기 글러먹었고 대우도 쓰레기임 그냥 개발자만 1~2년 있기좋은회사
119,미리디,5180,"눈으로 보이는 장점들이 많음. 사내 서비스들 월 3만원씩 적립금 제공, 점심 준 제공, 야근시 저녁/택시비 제공, 자기계발비 제공, 자율출근제 도입 등. 야근/회식을 명시적으로 강요하지 않음. (원한다면) 사내 동호회 생성 및 가입 가능. 복장 등에 완전 자유로움."
120,미리디,5180,"행복개발비라는 이름으로 학원비 책 등으로 60만원 지원(자신이 사용한 금액의 70%를 환급, 분기별로 영수증을 받아 금액을 돌려준다) 팀장님께 책 신청해서 공공서적으로 구매가능 야근 식대 및 11시 이후 퇴근 시 택시비 지원 점식 식권 약 5천원 지원(=식권을 천원~2천원에 판매) 직원 연령층이 낮아 꽤 수평적 자유로운 분위기 수평적 호칭"
121,미리디,5180,복지가 좋음 디자인직군 야근없음 철야없음 휴일근무 진짜없음 출퇴근시간/점심시간 어느정도 여유롭게 자율로쓸수있음 연차 진짜자유롭게씀(많진않음) 조.중식저렴한값에 식권제공 직급없음(대표와 각팀리더는있지만 다 호칭을 이름으로통일) 수평적이라 의견표출자유롭고 다들 젊어서 사내문화자체도젊음(왜인지 다들동안이기도함) 틈틈이 뭔가 자잘하게 잘챙겨주려함 다들 자기일 해당 사업에 애정이생기게끔하는 그런 분위기가있음 으쌰으쌰하는.. 소속감강한사람들은 일할맛남 잼난 이벤트가 되게 자잘자잘하게있음 일상에 피해는 안줌 분업화가 크게크게 잘돼있는데 함께하는일에도 서로 견제같은거 없는편 굳어있지않고 계속 발전하려하는게 (업무든 복지든) 사원들 눈에도 보일정도 체제를 바꾸거나 방식을 바꾸는데에 있어서 경영진이 대범함 좋은것같음 (물론 엄청 무리할수준은아니겠지만..)
122,미리디,5180,팀끼리 조율해서 연차 자유롭게 쓸 수 있고 복지 나쁘지 않고 괜찮음.
123,미리디,5180,연차를 자유롭게 쓸수있고 특히 여름휴가 이외시즌에 휴가를 써도 뭐라하는 사람없음. 거의 칼퇴 했던 분위기
124,미리디,5180,자기 할일만 다하면 연차를 눈치 안보고 쓸수있다. 중소기업치고는 복지가 좋은편이다.
