,company_name,company_id,review_text
0,미팩토리,6132,영업적으로 열심히 엶심히 노력을 하고 있음. 미샤 산하로 들어가서 그 시스템을 적용하려 하던 찰나였나봄
1,미팩토리,6132,복지도 좋고 경영진의 방향성이 시원시원해서 좋았으나 이후 들어온 경력직 정치질 하는 남자들 말에 경영진 의사 결정이 이랬다 저랬다하면서 회사가 망조로 들어가서 아쉬웠네요.
2,미팩토리,6132,업무량이 많아 일을 어느정도 빨리 배우게되는 장점이있음
3,미팩토리,6132,시차출근제 카페 음료 할인 매주 금요일 단축 근무 야근 거의 없음
4,미팩토리,6132,사람들이 젊고 열정적임 물론 지금은 모르겠으나 전반적으로 젊고 합리적 분위기임
5,미팩토리,6132,딱히 없습니다. 역세권이고 핫플 근처라 퇴근 후 젊은이들이 많아요
6,미팩토리,6132,"복지카드, 4일 출근 이런건 괜찮고 나머지가 문제ㅎㅎㅎㅎ"
7,미팩토리,6132,"복지가 좋음, 성수역에서 가까움. 분위기는 자유로움. 지속적으로 사업이나 신제품을 개발하려고 함. 어쨋든 매출은 계속 나오는 편."
8,미팩토리,6132,"수평적인 문화, 회사가 어렵거나 하는 부분이 없어요요요"
9,미팩토리,6132,"강아지 데려올수있다 젊은 분위기 수평문화, 복지 제도 좋음"
10,미팩토리,6132,"팀바팀이겠지만 팀 분위기 좋은 편이고 간식, 컬쳐데이 등 소소한 복지 챙기려고 노력"
11,미팩토리,6132,복지가 좋은 편 개인 복지카드 월 20만원 / 자유로운 연차사용
12,미팩토리,6132,칼퇴근 가능하고 역이랑 가깝고 복지가 점점 늘어나고 있다 연차도 자유롭게 사용가능하다
13,미팩토리,6132,워라벨 좋음 역과 가까운곳에 위치 해 있어 출퇴근이 좋음
14,미팩토리,6132,수평 문화로 개인 의견을 자유롭게 말할 수 있는 분위기 억압적인 분위기가 아니라 편하게 일할 수 있었습니다
15,미팩토리,6132,젊은 조직. 자유로운 의견 공유. 좋은 사람들. 음악을 틀고 일을 하고 서로의 생일도 챙기며 한때 정말 좋은 조직문화를 서로가 만들었음.
16,미팩토리,6132,자유로운 분위기의 회사 카페가 직원할인이 돼서 좋습니다 야근이 거의 없습니다 자유로운 연차사용 가능
17,미팩토리,6132,"사내 카페 이용 가능하며 할인하여 구입 가능 , 자사 제품 할인 구매 가능, 간식바 있음 ,트렌디한 느낌의 사무실"
18,미팩토리,6132,젊은층 직원들이 많아 활기찬 분위기 회사 규모치고 괜찮은 복지
19,미팩토리,6132,사람들이 모두 젊기 때문에 자유로운 근무 환경이며 늘 새로운 것을 추구하며 나름 수평적 관계 유지
20,미팩토리,6132,연차 사용이 매우 자유롭다. 당일 연차 사용도 가능. 1층에 카페 저렴하게 이용 가능. 분위가 자유로움. 대체로 젊은 사람들과 일을 할 수 있다.
21,미팩토리,6132,"편하고 자유롭고 자기 할일만 잘하면 되는 곳, 역에서 가까움"
22,미팩토리,6132,그나마 1세대 마케팅으로 유명해서 신입이 배우면서 커리어 쌓기좋음 나때는 사람들 좋았음 복지도 나름 쏘쏘
23,미팩토리,6132,연차 눈치보지 않고 쓸 수 있음. 스낵바 운영. 쾌적한 근무환경. 밑에 카페 있고 직원할인 가능. 개인 법인 카드 지급. 자유로운 분위기. 적당히 일하며 적당히 놀 수 있음. 복지 나쁘지 않음
24,미팩토리,6132,"연차 눈치없이 사용가능. 육아휴직 하신분 있었음. 간식바있음. 넓은 데스크,시디즈 의자. 전체적으로 자유도가높음."
25,미팩토리,6132,연차 자유 간식있음 괜찮은 사람 한두명 정도 있는데...
26,미팩토리,6132,"연차 자유롭게 쓸수있고, 회사 워라벨이 좋은편. 작은 복지들도 존재"
27,미팩토리,6132,성수동에 위치해서 카페도 많고 역에서도 가까워서 출퇴근이 쉬웠습니다. 젊은 사람들로 채워져 있어 자유로운 분위기가 있었고 사옥이 예뻤습니다.
28,미팩토리,6132,연차사용이 자유롭고 매주 한번씩 패밀리데이가 있어 조기퇴근도한다. 직원들이 원하는 간식들이 비치되어있고 소소한 복지들이있어 긍정적이다.
29,미팩토리,6132,"연차를 자유롭게 쓸 수 있었고, 스타트업이라 자유로운 분위기었음"
30,미팩토리,6132,"1개월 도서구매비 지원, 직무관련교육비 지원 등 성장에 욕심있는 사람에게 좋은 제도가 있었음. 지금도 스 제도가 유지되고 있는지는 잘 모르겠다."
31,미팩토리,6132,카페 바로 옆에 있는 것(?) 그외에 기억에 남는 것 없음.
32,미팩토리,6132,"복지카드 매 월 원하는 출퇴근시간 선택 가능, 매주 금요일 조기퇴근 자유로운 연차 사용"
33,미팩토리,6132,직무마다 다르긴 하지만 직접 소통하며 일하다 보면 다양한 부분에 대해 배우고 익힐 수 있음
34,미팩토리,6132,젊은 연령층의 직원들로 소위말하는 꼰대는 없다. 젋고 빠르게 일할수 있다
35,미팩토리,6132,윗분들 마인드나 방향성이 확실해서 좋았고 추진력있는 젊은 회사의 모습 카페테리아가 있어서 편하게 음료 마시고 미팅하기 좋았다
36,미팩토리,6132,윗사람 눈치 안보고 일하는 환경이기 때문에 의견을 마음컷 낼 수 있는 부분이 좋음. 복지중에 자유롭게 사용가능한 복지카드가 있음.
37,미팩토리,6132,편안한 분위기와 비슷한 연령층으로 자유로운 분위기 에서 근무
38,미팩토리,6132,매우 자유로운 분위기. 수평적 구조기 때문에 책임을 부여하고 자유를 줌
39,미팩토리,6132,회사 분위기가 굉장히 자유롭다. 직원들의 연령대가 대체로 낮으며 수평적 조직체계를 가지고 있다. 지하철역과 가까운 곳에 위치해 접근성이 좋다.
40,미팩토리,6132,복지카드 지급 맥주바 있음. 월 1번 1시간 일찍 퇴근 가능 생일자에게 선물 지급  직원 복지는 확실히 괜찮습니다.
41,미팩토리,6132,"나름의 복지들이 잘 지켜지는거 같아서 너무 좋았음( 간식창고, 생일파티, 패밀리데이 등)"
42,미팩토리,6132,"연차사용눈치없음. 사무실 노래나옴 복지카드있음 자신영량만 있으면 다양한 경험 할수있음 칼퇴 회식강요없음 사내카페있음/맥주바도있음 복지로 일찍 퇴근있음 (패밀리데이, 생일, 가족me등등) 성수역 도보 5분"
43,미팩토리,6132,"회사 위치 말고는 기업에 대한 장점을 찾아볼 수 없지만, 입사 시 회사 화장품을 써 보라고 이제품 저제품 제공한다."
44,미팩토리,6132,"연차사용 자유로움 복장 자유/음악 들으며 업무 복지제도(패밀리데이,생일선물 등) 하고자 하는만큼 성장가능"
45,미팩토리,6132,1. 연차 눈치 없음 2. 회사 생활이 자유로움 3. 복장 자유로움 4. 트렌디한 음악과 함께 근무 가능
46,미팩토리,6132,"연차,반차 사용할때 사유불문 자유롭게 사용할 수 있음. 초과근무 강요 절대 없음. 드물긴 하지만 커리어를 기업에서도 인정해주고 보상해주려고 하는 편."
47,미팩토리,6132,눈치 안보고 연차 쓸 수 있어요. 복지 혜택 많아요. 자유로운 분위기라 업무에 대한 압박감이 적은 편이에요. 더 성장할 수 있는 회사라고 생각해요.
48,미팩토리,6132,"한달에 한번 다섯시 퇴근, 가족 생일 및 본인 생일 일때도 다섯시 퇴근함 회사 앞에 카페 커피 맛있음"
49,미팩토리,6132,"워라밸 보장, 연차 눈치 안봄, 일찍 퇴근 복지제도가 많음(한 달에 최소 두 번 이상 일찍 퇴근), 복지카드, 음악 틀고 젊은 사람들끼리 일하는 분위기"
50,미팩토리,6132,"연차 자유로움, 간식 지원, 사내 카페테리아 있음, 업무중 노래 나옴"
51,미팩토리,6132,- 복지카드로 월 15만원 사용할 수 있음 - 휴가 사용이 자유로운 편  월15만원이랑 휴가(당연한 것)가 조금 자유롭다고 해서 선택했다가는...ㅎ
52,미팩토리,6132,"간식바가 있었오요. 도서 지원,야근시 식대 지원 해줍니다."
53,미팩토리,6132,연차 자유로움. 강아지 동반 출근 가능. 1층 카페 저렴하게 이용 가능.
54,미팩토리,6132,"자유로운 분위기  다양한 복지(패밀리데이,컬쳐데이,간식바등)  애견동반 출근가능"
55,미팩토리,6132,화장실 자유롭게 갈 수 있음. 성수역 근처라는점.....
56,미팩토리,6132,"성수역 근처에 맛집과 카페가 많아서 퇴근 후 친구들하고 약속 잡기 좋음, 연차를 자유롭게 사용할 수 있음"
57,미팩토리,6132,연차 사용이 자유롭고 성수역에서 위치가 가까움. 1층 카페를 직원가로 저렴하게 이용 가능.
58,미팩토리,6132,연차 눈치 안보고 사용 가능. 칼퇴 가능(전반적으로).
59,미팩토리,6132,스타트업치고는 체계는 잘 잡혀있던 곳임 간식 냉장고와 간식바가 잇음(근데 경쟁치열)
60,미팩토리,6132,"노래나옴, 복지포인트 있음. 복장 자유. 사내 카페 있음"
61,미팩토리,6132,윗사람 눈치를 보거나 출퇴근에서는 자유로움 그냥 아무 생각없이 편안하게 다니기엔 좋음
62,미팩토리,6132,직원들의 다양한 의견을 수렴하여 개선하고자 노력하며 젊고 파이팅이 넘치는 조직과 문화를 가지고 있다
63,미팩토리,6132,연차를 자유롭게 쓸수있으며 편하게 다닐 수 있음!!!!!
64,미팩토리,6132,"연차 자유, '~님'호칭, 복지카드 자유롭게 사용가능.패밀리데이&컬쳐데이 월 1회씩"
65,미팩토리,6132,자유로운 분위기 워라벨 맞출 수 있음 연차사용 자유로움
66,미팩토리,6132,"자유로운 분위기, 연차 자유, 거의 칼퇴 가능, 수평구조"
67,미팩토리,6132,자유로운 분위기.. 카페 커피맛 ㅅㅌㅊ..반려견 동반 가능..
68,미팩토리,6132,사내 문화가 수평적이고 전체적으로 오픈마인드인 회사라고 생각
69,미팩토리,6132,자유로운 분위기 간식이 있음 강아지도 데려올수 있는정도의 자유로움
70,미팩토리,6132,연차 사용 자유롭고 회사가 성수역에서 가까움. 1층에 카페가 있어서 직원가로 저렴하게 이용 가능.
71,미팩토리,6132,"1. 팀 이직하는 그 순간까지도 고민하게 한 원인. 다른 것만 보면 정말 이직을 해야했지만, 이런 팀에서 또 일할 수 있을까하는 생각으로 계속 고민하게함. 실제로 더 좋은 조건으로 여러번 이직제의가 왔음에도 이 팀에 남은 이유. 서로 뭐 하나라도 챙겨주려는 정말 긍정적 의미의 가족, 친구같은 팀.  2. 워라밸 물류판에서는 볼 수 없는 워라밸. 이 워라밸은 물류팀이 서로 도와가며 업무를 진행한 덕분이라 볼 수 있음.  3. 복지카드 매월 충전되는 복지카드. 자유롭게 쓸 수 있음.  4. 강아지 동반 출근(본사는 모르겠음)"
72,미팩토리,6132,"연차 눈치, 칼퇴가 가능해서 좋음. 전혀 없음 수평적인 회사 분위기"
73,미팩토리,6132,스타트업 장점인 밝은 분위기에서 일할 수 있고 간식이 매우 많다
74,미팩토리,6132,안정적인 느낌 (약간 반공무원) 가파른성장을했던 좋은 기억을 가지고 있음
75,미팩토리,6132,"연차를 눈치보지 않고 쓸 수 있음. 자유로운 분위기. 프리함,이것 외에 별다른 장점이 없는 것 같음"
76,미팩토리,6132,성장할 수 있다는 것. 접근성이 좋아서 출퇴근이 편함.
77,미팩토리,6132,"연차 자유, 간식바, 월마다 도서 구입, 교육비 지원, 경조사비 지원"
78,미팩토리,6132,성수역과 가까움. 사옥 있음. 분위기 자체는 스타트업에 맞게 자유로운 편이었음
79,미팩토리,6132,역 근처라서 다니기 쉬움 대 충 말해도 괜찮음 어차피 못 알아듣고 변화 없음 최 고의 장점은 화장실 마음대로 갈 수 있음 악 세사리나 복장은 자유로움
80,미팩토리,6132,자유롭고 누구 눈치볼 분위기는 아님. 복지가 많아서 꽤 쏠쏠함. 새로도전하는 것을 적극적으로 추진 시켜줌. 간식바 있어서 배고플일은 없음
81,미팩토리,6132,강아지 데려올 수 있음..! 좋은 회사가 되기위해 많이 노력하지만 버거운 듯한 느낌
82,미팩토리,6132,올리브영입점으로 자부심을 느낄 수 있음. 일이많지만 배울점이많음
83,미팩토리,6132,다 젊은 직원들이라 분위기가 다르긴함 회사 밑에 카페 직원할인 되는거.. 빵 맛있음..
84,미팩토리,6132,"자유로운 분위기, 마르지 않는 간식 냉장고(각종 다과,음료,간편식,맥주까지) ,젊은 연령대 , 칼퇴지향"
85,미팩토리,6132,여러 직장을 경험해보진 못해서 다른회사의 분위그는 모르지만 사내 분위기만큼은 진짜 좋다고 말할수있습니다.
86,미팩토리,6132,사내 분위기 좋음 일할때 편안한 분위기를 원한다면 좋음
87,미팩토리,6132,"회사는 자유로움. 눈치없이 연차도 쓸수있고, 1달에 한번 5시 퇴근, 맥주제공, 간식바 제공(일주일에 한번씩 채워짐) 자유롭게 회의하고 팀회식도 자유로움."
88,미팩토리,6132,연차 자유로움. 매주 채워지는 간식. 생맥주 제공. 비교적 넓은 책상. 한 달에 한 번 5시 퇴근
89,미팩토리,6132,수평적인 사무실 분위기로 자유로운 업무가 가능. 업무가 명확히 분업와 되어 있어 맡은 업무에 대한 파악이 쉽다. 협업이 필요한 업무의 경우 타 업무에 대한 이해력도 습득할 수 있음
90,미팩토리,6132,"자사카페할인, 달마다 도서1권 지원, 1달에 한번 5시퇴근, 1달에 한번 팀 컬쳐데이 있음. 직원들이 화합하고 편하게 다닐 수 있는 제도가 많다."
91,미팩토리,6132,연차를 사용하는게 매우 자유로움 회사 카페가 있어 좋음 간식바가 있어서 배가 든든함
92,미팩토리,6132,"돼지코팩이라는 키아이템, 에이블에 인수, 출퇴근편한곳에 위치"
93,미팩토리,6132,"스타트업이기 떄문에 많은 성장 기회는 있으나, 그만큼 안정성에 있어서는 확실하지 않은 곳"
94,미팩토리,6132,다양한 업무를 해볼 수 있다는 장점은 있다. 간식바가 매우 풍부하다. 온라인 마케팅 경험을 해보고 싶다면 경험상으로는 도움이 됨
95,미팩토리,6132,핫한 성수동에 위치. 자유로운 분위기를 느낄 수 있다고 자부하는 회사. 젊은 나이대의 직원들
96,미팩토리,6132,"자유로운 연차 사용, 도서구입비 지원, 교육비 지원, 간식바, 자유로운 분위기,"
97,미팩토리,6132,기업의 장점은 수평적인 구조였다는 것. 이는 과거형 지금은?
98,미팩토리,6132,자기개발에 쓰이는 비용을 많이 지원받을 수 있다. 또 한달에 한 번 패밀리데이라고 5시에 퇴근할 수 있음. 자유롭고 편한 분위기. 복장도 편하고 상사나 부하직원간의 위계질서도 심하지 않다.
99,미팩토리,6132,"연차 자유, 패밀리데이, 생일자 상품권, 간식 바 정도"
100,미팩토리,6132,복지가 좋은 편인 회사. 그나마 제일 큰 장점은 젊은기업이라 복지가 좋은 편이긴 하나 그마저도 점점 사라져가는 중. ㅗㄴ이
101,미팩토리,6132,마음먹으면 워라벨 지킬수 있음./자유로운 연차사용/일층 카페의 커피맛이 생각보다 좋음
102,미팩토리,6132,"연령대가 젊고, 분위기가 매우 자유로우며 연차 눈치없이 쓸 수 있다. 간식이 제공되고 자사카페 할인이용 가능"
103,미팩토리,6132,연차 눈치 없고 월에 한번 도서 신청해서 무료로 책 읽을 수 있음. 회사에서 운영하는 카페가 있어 싸게 먹을 수 있는 장점.
104,미팩토리,6132,먹을게 많습니다. 매주 리필해줘요. 하지만 하루 아침이면 다 사라집니다. 여성들이 90%를 차지하고 있어요 남자들은 살아남기 힘들어요... 여러모로 힘듭니다.
105,미팩토리,6132,지하철 역에서 가까운 것 회사 사내카페가 있어 커피만 할인가로 먹을 수 있음
106,미팩토리,6132,"업무환경 쾌적함, 인테리어 좋음, 사내 커피숍, 회사물품 직원가 구입 , 도서 지원, 간식지원, 둘째주 수요일 페밀리데이 등"
107,미팩토리,6132,연차 사용과 간식 이용 정도..?.. 그 이상은 아무리 생각해도 모르겠음
108,미팩토리,6132,"인턴이지만, 스타트업이기때문에 많은 것을 경험할 수 있음 또한 연차 눈치 안보고 씀"
109,미팩토리,6132,연차를 마음대로 쓸수도 있고 간식 스낵바가 있어서 배고플 걱정은 안해도 되는점.매주 새로운 간식이 들어오고 먹고싶은 간식을 신청할수도 있어요
110,미팩토리,6132,"도서구입비 등 자기계발 비용 지원, 열린 문화로 자유롭게 의견 개진 가능, 멋진 사옥"
111,미팩토리,6132,연차사용 자유로움. 풍성한 간식바. 눈치는 보이나 칼퇴가능
112,미팩토리,6132,눈치는 많이 보이지만 눈치는 안보이는 거 처럼 해야하고 회의가 많다는거
113,미팩토리,6132,없음/굳이 뽑자면 간식이 많다는 것..?/도서비용 지원/
114,미팩토리,6132,"수평적인 기업문화는 보장, 간식도 부담없이 먹을 수 있는 분위기이다."
115,미팩토리,6132,장점이라고 하면은 머 간식 있고 음악들을수 있다는거 외에는 먼 장점이 있는지는 잘 모르겠음.......
116,미팩토리,6132,"자유로운 연차 사용, 풍부한 간식, 자유로운 분위기, 회사 카페 이용, 야근식대 만원 지원, 야근시 교통비 지원, 젊은 CEO"
117,미팩토리,6132,연차 눈치 안 보고 쓸 수 있음 간식이 많음 회사내 운영하는 카페 직원가로 이용 가능
118,미팩토리,6132,젊은 기업이 가지는 장점이 고루 있는 곳. 당근과 채직이 적절히 썪여 있어 회사와 함께 발전 할 수 있고 수평 구조로 직원의 소리를 잘 들어주는 경영진이 있음
119,미팩토리,6132,연차사용 편함. 체계가 없기때문에 조금만 영악한 스타일이라면 잘맞을꺼임. 쉽게 입 털면서 월급루팡 가능함.
120,미팩토리,6132,연차 자유로움. 간식바. 회사 카페. 평균연령대 텃세 없는 팀원
121,미팩토리,6132,자유로운 연차. 수평적 문화. 소소하지만 직원을 생각해주는 혜택들. 다양한 시도를 할 수 있는 문화
122,미팩토리,6132,명함 정도는 내밀수 있는 회사 네임 퇴근과 연차 사용 눈치 없음 넓은 사무공간 자유로운 분위기와 복장 직급에 관계없이 서로 존댓말을 씀 간식바
123,미팩토리,6132,"연차 사용이 자유롭고, 도서 + 1달에 1번 문화생활 + 슈퍼맨 타임 등 복지 혜택이 좋음. 야근도 거의 안함"
124,미팩토리,6132,수평적인 사무실분위기라서 의사소통이 자유롭고 연령층이 젊어서 분위기도 밝은편임. 직원과 회사가 함께 발전하고자 함
125,미팩토리,6132,1) 간식이 많다 2) 자유로운 연차사용 3) 자신의 업무만 잘하면 정시퇴근 가능
126,미팩토리,6132,신입에게 팀장급 업무를 요하는 만큼 능동적으로 일하다 보면 스스로 길을 개척해나가는 경험을 쌓기에는 좋음. 탕비실 무한한 간식
127,미팩토리,6132,"전체적으로 젊은 분위기와 수평적 구조, 유연함으로 새로운 것을 직접 시도해볼 여지도 많고 배울 수 있는 것도 많다. 사람들도 좋음"
128,미팩토리,6132,연차 사용 비교적 자유로움 / 풍족한 간식 / 비교적 수평적인 구조
129,미팩토리,6132,원한다면 개인이 A부터 Z까지 다 할수가 있다. 한가지 업무를 담당하기보단 많은걸 실전에서 경험할수가 있다.
130,미팩토리,6132,1. 눈치/텃세 없음 눈치를 봐야하는 상사나 오래다녔다고 텃세부리는 직원이 없어서 대기업에 비해 사람 스트레스는 적습니다  2. 많은 기회 성장 중인 회사이기때문에 시도/도전해볼 수 있는 기회가 정말 많습니다. 성장과 자기발전에 대한 욕심이 있는 분이라면 회사에서 많은 기회를 제공합니다.  3. 협업되는 회사 보통 타 부서와 사이가 좋지 않은 회사들이 많은데 미팩토리는 유관부서와 큰 트러블 없이 협업이 잘 되는 편입니다. 어렵거나 필요한 업무들이 있을 때는 서로 도우며 해결합니다.
131,미팩토리,6132,"젊은 구성원들로 업무 진행이 빠르고, 새로운 시도를 하는데 있어 두려움 없이 할 수 있어 좋다."
132,미팩토리,6132,1. 자유로운 분위기 2. 다양한 간식 3. 해보고 싶은게 있다면 적극적으로 주도하여 해볼수 있음 4. 젊은 회사 5. 동종업계에 비해 뛰어난 복리후생
133,미팩토리,6132,"오픈 된 사무실 분위기 만큼 타 기업에 비해 상대적으로 자유로운 근무 환경. 업무적인 면에서도 개인의 역량만큼 스스로의 가치를 올릴 수 있는 기회가 많이 찾아오고, 결국에는 개인의 역량에 따라 회사내에서 자신의 가치가 결정 됨. 단순히 루틴화 된 직무 수행을 하고 싶지 않은 도전적인 인재들에게는 매력적인 근무 조건"
134,미팩토리,6132,"앞으로도 디지털마케팅은 더 중요해질 시기에, 제품을 판매하는 커머스를 대행사가 아닌 직접 브랜드를 보유하고 디지털 마케팅을 집행하여, 직접 기획하고 운용하고 판단할 수 있는 기회가 많음."
135,미팩토리,6132,자유로움 / 자율복장 / 연차자유로움 / 성수동 위치 / 카페
136,미팩토리,6132,업무 분위기가 자유롭고 기회도 많은 편 임직원들 나이대가 어리고 텃세도 적다. 사옥 분위기가 좋음
137,미팩토리,6132,1. 나와 비슷한 또래들과의(20대~30대초반) 사회생활을 경험할 수 있음. 2. 자유롭고 수평적인 문화를 간접적으로 느낄 수 있음.
138,미팩토리,6132,페이스북 마케팅 1세대이고 선발주자라서 사업적 기회가 많습니다
139,미팩토리,6132,간식구비.회사예쁨.사람들이 나름 친절함. 여자많아도 텃세없음
140,미팩토리,6132,3개월 인턴직을 수행했기때문에 회사의 깊은 내부사정까지는 알 수 없지만.. 제가 느낀바는 아래와 같습니다.  1. 많고 다양한 업무를 경험해볼 수 있습니다. 2. A to Z 로 업무를 진행해볼 수 있습니다. 3. 이사님 팀장님과 나름 수평적인 관계를 지닙니다. (타회사에 비해 확실히 덜 위계적입니다) 또한 경영진이 직원들과 소통하려고 엄청나게 노력하고 있는 것이 눈에 보입니다. 4. 간식이 구비되어 있습니다. 5. 사무실이 매우 힙합니다.
141,미팩토리,6132,어느 기업이나 그렇지만 성장에 대한 의지가 강한 회사입니다. 문제를 파악하고 지속적으로 해결하려는 경영진이 전체적으로 방향성을 제시하고 직원들이 일을 하며 성장을 경험할 수 있는 회사입니다.
142,미팩토리,6132,인하우스 브랜드가 다수 있어 새로운 브랜드를 경험 할 수 있다.
143,미팩토리,6132,코팩 브랜드들 중에서 대중적으로나 지인들에게 인지도가 높은편
144,미팩토리,6132,다들 어리고 젊다 간식냉장고가 있어 간식을 먹을 수 있다
145,미팩토리,6132,"제품기획, 콘텐츠제작, 유통 등 마케팅과 관련한 모든 것을 다 해보라고 하기 때문에 일 년 만에 마케팅에 대해 초고속으로 훑어볼 수 있음. 뷰티업계 종사는 하고 싶은데 경험은 없고, 대기업 들어갈 실력은 안 되고, 대학 갓 졸업한 사회초년생인 사람들에게 인턴경험 정도 쌓기에는 좋을 수 있는 회사."
