,company_name,company_id,review_text
151,비기닝리테일,6208,1. 프롬비기닝의 인지도. 모델 전수린의 인지도 2. 대표이사 이하 젊은 조직 3. 경영진의 마인드가 변화에 그나마 능동적 4. 현재 조직개편중으로 변화의 과정에 있음. 5. 사무환경 엄청 좋은 걸로 알고 있음. 6. 연차 비교적 자유로움. 7. 출근시간 10시인것도 매력적
152,비기닝리테일,6208,"홍대 근처에 위치해서 놀기는 좋았음. 다른 리뷰들처럼 별로인 관리자도 있지만, 배울점이 많은 관리자도 있음.(케바케임). 제대로 실행된건 많지 않지만.. 어쨋든 뭔가를 계속 시도하려고 하는건 좋았던것같음."
153,비기닝리테일,6208,쇼핑몰 물건은 좋음 여자친구 있으면 아이쇼핑 추천 추천....
154,비기닝리테일,6208,개인 쇼핑몰치고는 어느정도 안정적인면도 있고 많이 힘들거나 눈치받거나 하지않고 오너가 마음대로하지않고 팀단위로 나름대로 잘 움직입니다. 개인 쇼핑몰인점과 팀단위때문에 이런 저런 정치?없고 팀구성원내에서 일만 잘하면됩니다.
155,비기닝리테일,6208,홍대에 있어 끝나고 놀기 좋음 샘플이 많아서 이옷저옷 볼수있음 대신 그만큼 샘플은 내몫
156,비기닝리테일,6208,"연차,휴가를 눈치없이 쓸수있음, 휴가가 7일이라 좋음. 팀원들 연령대가 비슷해서 친하게 지낼수 있음"
157,비기닝리테일,6208,비슷한 나이대의 사람들이 모여서 마음 통하는 사람끼리는 편하게 잘 지낼 수 있다.
158,비기닝리테일,6208,노는거 좋아하는 사람은 다니기 좋음 홍대임 10일 정도의 긴 여름휴가
