,company_name,company_id,review_text
0,비기닝리테일,6208,한달에 한 번 두시간 조기퇴근 명절 상품권 생일 상품권 생일자 조기퇴근
1,비기닝리테일,6208,칼퇴 하는 점이 진짜 맘에 들었습니다 아무도 눈치 안주고 대부분 제시간에 칼퇴함
2,비기닝리테일,6208,담당 업무 외 타 부서 업무를 경험해 볼 수 있다. 다양한 경험.
3,비기닝리테일,6208,홍대라 퇴근하고 놀기 좋고 사무실 인테리어도 예뻤어요.
4,비기닝리테일,6208,1. 직원등의 일과 삶의 균형에 신경 쓰는 복지가 늘고 있다. 예)명절 하루전 전사 1시 조기퇴근등 업무 영역을 넓히고 관리가 가능한 팀은 재택도 하고 있다.  2.성장을 견인라는 브랜드가 있다.   3.실력이 있는 사람들은 차등해서 보상하려는 제도들이 늘고있다.
5,비기닝리테일,6208,업무가 단순하다 그래서 복잡함이 없다 홍대 번화가에선 좀 떨어져있지만 퇴근하고 약속 잡기 좋다
6,비기닝리테일,6208,1. 최근들어 늘어나는 복지 제도 1) 명절 선물. 명절전 조기퇴근 2) 생일 선물. 생일자 조기퇴근(반차 3) 건강검진공가 지원 4) 무제한 캡슐 커피머신. 전자렌지 5) 자사 브랜드 제품 할인 6) 우수 사원 시상 등등  2. 예전 후기에 이상한 사람들은 나가고 변화해 가는중
7,비기닝리테일,6208,1. 자사 제품들의 할인 2. 매달 세 번째 금요일 조기 퇴근 3. 생일 반차 4. 자유로운 연차 사용 5. 수평적인 구조 6. 능력에 따른 다양한 업무 기회 부여
8,비기닝리테일,6208,젊은 기업. 워라밸이 지켜지는 편이다. 메신져. 새로운 제도들이 생기고 있다.
9,비기닝리테일,6208,"명절 20만원 상품권, 한달에 한 번 두시간 조기퇴근 가능"
10,비기닝리테일,6208,직원 구매 할인이 된다는거랑 커피를 내려 먹을수있는거?
11,비기닝리테일,6208,젊다 계속 변화함 연차 자유로움 복지라는 것도 약간 있음 업무의 세분화 홍대
12,비기닝리테일,6208,이벤트나 워라밸을 위한 좋은 제도들이 생겨가고 있음.
13,비기닝리테일,6208,커피머신 있고 예쁘고 쾌적한 사무실 환경. 같이 일하는 팀원들은 좋습니다.
14,비기닝리테일,6208,"매월 1회 2시간 조기퇴근, 생일자 조기퇴근 등 워라밸을 지킬 수 있음. 최근 제도를 잡고 있어서 능력이 된다면 재택근무도 가능할 수 있도록 하고 있으며, 많은 긍정적인 변화가 일어나고 있음."
15,비기닝리테일,6208,평균연령대가 그래도 낮은 편 연차 적당히 편하게 쓸 수 있음 직원할인 되는 게 제일 큰듯
16,비기닝리테일,6208,"1.담당자가 하려고 한다면 권한을 많이 부여 해주며 전문성을 인정하고 의견을 수렴 함. 2.매월 셋째주 금요일 2시간 조기퇴근제도, 생일자 선물 & 조기퇴근, 우수사원포상, 팀활동비 등 직원에게 필요한 제도를 만들고 복지를 합리적인 선상에서 재정비하고 있음. 3.불필요한 문서 작업과 보고를 위한 보고가 없음. 담당자가 능력만 있다면 바로 실행가능."
17,비기닝리테일,6208,연차 나름 눈치 안보고 사용 할 수 있는 곳 명절 선물 보너스 한달에 한번 조기퇴근 복지 생겼었음
18,비기닝리테일,6208,"연차, 반차 있음. 셋째주 금요일 2시간 조기 퇴근. 끝"
19,비기닝리테일,6208,"장점을 30자 이상 쓸게 없네요, 정수기가 있고 개인 책상과 의자가 있다"
20,비기닝리테일,6208,복지 안좋은 쇼핑몰 많은데 그래도 돈 주면서 일 시키고 출장 수당도 줌
21,비기닝리테일,6208,"업무 진입장벽이 낮기때문에 누구나 할 수 있는 업무이고, 비대칭 업무능력을 가진 티오가 존재하기에 업무가 큰 무리없이 유지되는 편 입니다. 연차는 물류특성 상 큰 사정이 아닌 이상, 암묵적 룰이 존재합니다. 승진에 있어서는 연차가 차면 자연스레 기회가 주어지나 어느정도 평가와 업무능력에 대해서 하는만큼 인정을 받는 구조이기에 기회는 충분합니다. 하지만 업무능력의 한계에 따라서 기회가 없을 수 있습니다. (현장에서 사무를 겸하게 되는 업무 변경이기 때문입니다.) 복지&급여는 여타 다른 회사들과 마찬가지입니다. 업무와 삶의 균형은 전체 업무능력에 따라 달라집니다. 평일 중 3일 바쁨 2일 수월함&시즌/비시즌때 또 달라집니다. 이때 티오 변동이 있을 수 있으니 다니실거라면 평소에 필요한 사람이 될 수 있도록 노력하면 되겠습니다. 사내문화는 끼리끼리 노는편입니다. 경영진에 대해서는 말을 아끼도록 하겠습니다. 대표께서는 충분하다 생각 될 정도로 수용적 태도를 지니신 분이라 예상하나, 부하직원들은 눈치를 많이 보는 편 입니다."
22,비기닝리테일,6208,그나마 깔끔한 사무실? 이것도 대표층만 깔끔하고 다른층은 공장형
23,비기닝리테일,6208,월급하나는 안 밀린다는 점이 유일한 장점입니다 일을 하는 사람만 하기에 일을 나 혼자 독점해서 혼자 하고 싶으시면 추천합니다
24,비기닝리테일,6208,월급은 안밀리긴 했는데 그거외엔 딱히 없었던거 같고 그나마 같이 일하는 사람들은 좋았었음
25,비기닝리테일,6208,자유로운 연차 홍대 저연차 비슷한 또래가 많다 네스프레소 한달에 한번 조기퇴근-이게 가장 메리트
26,비기닝리테일,6208,너무 좋은 사람들과 대화 잘통하는 인원들이 많아서 좋아요 내부 인테리어 너무 이쁨
27,비기닝리테일,6208,사무실 쾌적한 편 자율복장 ........그럴싸한 장점이 없다
28,비기닝리테일,6208,우체국 내 식당 이용 가능해서 점심 고민 할 필요 없습니다.
29,비기닝리테일,6208,팀원들이 좋았지만 상사들의 인아웃이 너무 심했어요 아쉽
30,비기닝리테일,6208,다인원의 큰기업이라 4대보험이나 각종 체계는 잘 잡혀있는 듯합니다.
31,비기닝리테일,6208,자유로운 연차 명절상품권 월1회 조기퇴근 커피머신기 젊은 대표 및 직원 직원들 각자의 자리에서 나름 최선을 다하고 있는게 장점인듯 기존 나이많은 부장과 그 부하들이 퇴사해서 나름은 옳은 방향으로 가고 있는듯
32,비기닝리테일,6208,"젊은 여성비율이 많고, 위치가 홍대이다. 장점은 별로 없음."
33,비기닝리테일,6208,1. 일하는 동료들이 대부분 또래이고 관심사가 의류인 사람이 많아서 같이 일하기엔 재밌다. 2. 나름 쾌적한 인테리어와 환경 3. 연차 눈치안보고 쓸 수 있음 4. 복장 자유로움
34,비기닝리테일,6208,한달에 한번 2시간 조기퇴근 실무진인 사원~대리급 소통 잘되는 편 깨끗한 근무 환경 온라인에서 규모 좀 있었던 회사
35,비기닝리테일,6208,연차 사용 자유로움 지하철역과 나름 접근성 좋은 사무실 위치
36,비기닝리테일,6208,일하는 사람들이 다들 젊음 인테리어 깨끗해서 좋음 홍대 번화가라 약속 잡기 좋음
37,비기닝리테일,6208,흡연구역 가까움.주차가능. 홍대인근 주택가 에 위치해 조용합니다
38,비기닝리테일,6208,"깔끔한 인테리어, 연차사용 자유로움, 네스프레소 커피머신기, 얼음정수기, 넓고 쾌적한 자리, 명절상품권 등 대단하지는 않지만 뭐가 있기는 있다. 다른 후기들 보면 그냥 평범하다고 생각한다."
39,비기닝리테일,6208,연차자유로움 홍대 위치 팀원간 분위기좋음 화장실 층마다있음
40,비기닝리테일,6208,"한달에 한번 조기퇴근, 직원구매 할인, 나름 대형 쇼핑몰이라는 네임밸류?"
41,비기닝리테일,6208,"기존 꼰대 부장들한테 들러붙어 정치하던 사람들이 나가고 있음. 다는 아니겠지만 아래글 대부분이 그 사람들인듯 이 회사에 가장 망팀이 디자인팀이였음. 회사에서 디자인팀을 그리 밀어주었는데 능력없는 디자인팀장이 별로였음. 올해 제장상품을 보면 다들 눈치챌 것임. 결과로 올해 가을 시즌오픈을 못함.. 회사 사람들은 다 알고 있다고 생각됨..이정도 규모의 패턴, 샘플실 있는 쇼핑몰 본적 있는지.. 여튼 기존 정치하던 사람들 물갈이 되고 있음."
42,비기닝리테일,6208,9시출근 6시 퇴근 주5일근무 국경일 휴무 월급 안밀림
43,비기닝리테일,6208,연차 눈치안보고 사용가능 원두카피 제공 홍대라 퇴근하고 약속장소로 편리
44,비기닝리테일,6208,얼음정수기. 원두커피 제공. 한달에 한번 2시간 조기퇴근.
45,비기닝리테일,6208,"연차있음, 4대보험 에 관한 법의 테두리 안에서 만 복리후생지켜줌-지각안할시-! 회식비제공"
46,비기닝리테일,6208,연차 쓰는데 눈치 안보이는 편 월 1회 조기퇴근(2시간) 커피있음
47,비기닝리테일,6208,한달에 한번 조기퇴근. 대충 일하는 척하고 아부만 잘하면 편하게 다닐 수 있음. 원두커피 연차 맘대로 쓸 수 있음(라인타면 없는 연차도 땡겨쓰기 쉬움)
48,비기닝리테일,6208,"연차 자유, 활동비 등 지원 빵빵함, 직원할인 구매 쏠쏠"
49,비기닝리테일,6208,직원구매가능. 자율복장. 얼음정수기. 월급은 안밀림. 역에서 걸어올수 있는거리?(약 10분?). 한달한번 2시간 조기퇴근.
50,비기닝리테일,6208,자유로운 연차 사용 가능 홍대에 위치 네스프레소 기기 있음
51,비기닝리테일,6208,장점은 홍대에 있다말고는 생각나는게 없어요........
52,비기닝리테일,6208,원두커피 팀마다 다르겠지만 사원들끼리 사이가 좋음 깔끔한 사무실
53,비기닝리테일,6208,자유로운 연차 자유로운 연차 느낌있는 사무실 홍대위치 커피머신기
54,비기닝리테일,6208,비교적 연령대가 젊은편 여자들이 많다 직원구매 할인 연차가 자유로운편
55,비기닝리테일,6208,홍대인근 자유로운 연차 깨끗한 사무실 음악틀고 근무 원두커피....  꽤많네요
56,비기닝리테일,6208,"10시출근이다. 이거말고는 장점있나? 연차 아주자유롭진 않지만, 연차수당 지급이후로는 연차를 외려 장려하니 그건 좋다고 해두죠."
57,비기닝리테일,6208,홍대근처라 저녁약속 잡기 쉽다. 사무실 감성좋다. 10시출근. 원두커피.
58,비기닝리테일,6208,화장실 있음 물 마실수 있음 이름이 알려져 있어 경험해보기 나쁘지 않음 사람들이 괜찮았다
59,비기닝리테일,6208,기대주로 눈에 안뜀 관심없어서 편하게 다닐수있다.욕심있고 능력쌓기 최저생계 워라벨 추구자는 괜찮음. 좀 업무욕심있어 튀는 사람만 못살게 굼
60,비기닝리테일,6208,직원들이 젊고 사장과 이사도 나이가 많지 않아서 겉으로 보기엔 나쁘지 않다 업계 탑은 아니지만 외형 매출은 잘 나온다
61,비기닝리테일,6208,"연차자유롭고, 젊은 조직으로 수평적분위기를 추구하는 회사. 팀내분위기 괜찮은 편임"
62,비기닝리테일,6208,월급 안밀림. 원두커피 제공. 사무실 께끗. 근무중 음악 틀어놓고 근무함.
63,비기닝리테일,6208,"급여 정확한 날짜에 준다 , 듀얼모니터 사용, 인테리어가 깔끔하고 괜찮다"
64,비기닝리테일,6208,연차 눈치 안보고 씀 업무 강도 낮은 편 그 이상은 없다
65,비기닝리테일,6208,"젊은 구성원, 잦은 회의, 개선하려는 의지가 보이고 성장하려는 마인드가 있다"
66,비기닝리테일,6208,사업기반이안정적이고 신입대우 좋으며 사람들도 다 친절하고 좋은거같어용
67,비기닝리테일,6208,연차를눈치안보고쓸수있음 간식제공 근무환경깨끗한편 홍대에위치하고있어서 집과의거리가 가깝다
68,비기닝리테일,6208,언차눈치없음 강압적 분위기 없음 개인역량을 지지해주는 분위기로 일이 빡시고 프로세스를 만들어가고 있어서 경력 쌓기에 나쁘지 않음
69,비기닝리테일,6208,연차수당 야근수당 챙겨줌 당연한건가..? 내가 있던 곳은 분위기 괜찮았으나 팀마다 분위가 달라서 잘모르겠음
70,비기닝리테일,6208,연차 눈치안보고 사용할 수 있다 홍대사무실 깨끗하고 조용한 위치에 있다 물류의 위치도 좋음-우체국에 있음 업무를 배울 수 있는 나름의 장점이자 단점 좋은 사람들이 그래도 있다 프로세스를 잡아가는 과정이라 어렵지만 나름 장점 명절에 챙겨줌
71,비기닝리테일,6208,자유 롭고 연차 눈치 안보고 젋은 사람들이 많아서 활기 넘침
72,비기닝리테일,6208,홍대가 사무실이라는 점…. 같이 일하는 동료들이 20대 초 중반이 많아 조금은 편한 점
73,비기닝리테일,6208,회사 안에 인테리어가 이쁨 홍대와 가까워 주변에 볼 것들이 많음 장점을 더 얼마나 써야 하나 ㅋㅋ
74,비기닝리테일,6208,"장점은 리모델링한 사무실, 회사위치가 홍대번화가 근처인거 빼고 없다"
75,비기닝리테일,6208,"개발실과 패턴실 있어서 소통하며 일하기 편안함, 회사 인테리어나 건물 자체가 커서 일하기 좋은편"
76,비기닝리테일,6208,홍대에 있어 약속 잡기 쉬움 .. 야근수당 나옴 그리고 없음
77,비기닝리테일,6208,연차를 눈치 안보고 쓸 수 있음. 칼퇴 가능. 개인주의. 쾌적하고 넓은 회사.
78,비기닝리테일,6208,다른 파트는 잘 모르겠지만 디자이너들은 잘 밀어주는 분위기이다. 상황에 따라서 이겠지만 디자이너로서 현재 하고 싶은것들 자유스럽게 시도 가능한곳
79,비기닝리테일,6208,"월급이 밀리진 않고 제때 줌, 일하는 시간에 해당하는 돈은 줌"
80,비기닝리테일,6208,수평적인 사무실 분위기 주변 맛집이 많아 점심식사 걱정 없음 젊은 직원들이 다수라 같이 일하기에 좋다
81,비기닝리테일,6208,크게 간섭없는 분위기. 연령대도 다들 비슷해서 직원들과 친하게 지낼 수 있음.
82,비기닝리테일,6208,연차를 그나마 좀 쓸 수 있고 야근하면 저녁 잘사줌 오래다닌 윗사람한테 잘 보이면 회사생활이 편함 이게 장점이 될지는모르겠지만..
83,비기닝리테일,6208,자유로운 분위기 좋은사람들 어렵지않은 업무 난이도 불화없는 직원관계
84,비기닝리테일,6208,1. 젊은 사원으로 구성되어 있어 분위기가 자유롭다. 같이 일하는 사람들도 좋은 편 2. 인테리어가 쾌적하다
85,비기닝리테일,6208,은근 텃새있어서 적응하기 힘듬 정말남신경안쓰고 일만할것 같은사람들에게 적합한 회사
86,비기닝리테일,6208,홍대에 있어 약속 잡기 편함. 먹을 곳이 많음. 회사의 장점은 딱히
87,비기닝리테일,6208,"옷 직원 할인. 칼퇴. 그 밖에 없음. 위치 홍대. 20대 초반이 많아서 좋지만 사회초년생들이라 더 무시하고, 안 챙겨주는 분위기."
88,비기닝리테일,6208,"직원구매, 칼퇴 워라벨 어느정도 보장 받음 음 그리고 듀얼 인테리어 좋음"
89,비기닝리테일,6208,고객에 대한 관심. 가성비 좋은 일. 유연한 업무처리 방식.
90,비기닝리테일,6208,연차는 자유로운편. 직원구매할인이 있음. 무거운 분위기나 눈치보이고 그러진 않음.
91,비기닝리테일,6208,홍대와 가까우나 좀 거리가 있어서 걸어가야 함 크게 터치는 없는 분위기
92,비기닝리테일,6208,연차 눈치 안봄 사무실이 홍대라 약속잡기 편함 이외는 잘모르겠음
93,비기닝리테일,6208,그냥 딱 그 중소기업. 회사가 규모가 있는 것에 비해 복지와 처우 없음.
94,비기닝리테일,6208,직원들 대부분 젊다 옷에 대한 관심으로 입사한 직원들이 많아 열정이 있다
95,비기닝리테일,6208,대부분 칼퇴하는 분위기라는 것 빼고는 장점을 찾을 수가 없다 칼퇴도 일반 사원급들인것 같음
96,비기닝리테일,6208,"연차 자유롭게 쓰는 편, 주 5일제 10 to 7의 근무시간"
97,비기닝리테일,6208,연차 자유 자유로운 보장 10시 출근 기타등등
98,비기닝리테일,6208,"젊은 분위기, 휴식시간이 잦음, 일의 강도가 높지않음 정도의 장점"
99,비기닝리테일,6208,"야근 수당나옴, 인테리어 좋음, 홍대 위치, 월차 조절해서 사용 가능"
100,비기닝리테일,6208,"10시 출근 7시 퇴근, 홍대 근처 음식 맛집, 연차 사용 눈치없이."
101,비기닝리테일,6208,케바케이겠지만 업무 끝나면 정시에 퇴근이 가능한 정도 혹은 연차 사용에는 크게 눈치가 보이지 않는다 정도
102,비기닝리테일,6208,급여관리 하나는 그래도 잘 되어있는 것 같다 몇몇 오래일한 사람들에게는 좋은 곳
103,비기닝리테일,6208,연차 자유롭게 쓸 수 있음 팀 내 분위기 좋음. 직원가로 옷 구매 가능. 야근 수당 있음.
104,비기닝리테일,6208,교통시설이나 편의시설등이 편한곳에 위치해있음. 연차사용시 눈치 보지 않음.
105,비기닝리테일,6208,연차를 회사 눈치보지않고 쓸수는 있음. 회사가 홍대인것
106,비기닝리테일,6208,직출직퇴가 가능하다는 장점 (외근시 하는업무에대해 전혀 체크가 없기때문에 가능)
107,비기닝리테일,6208,크게 특별한 기술같은게 없어도 일하거나 하는데 큰 문제가 없고 들어가기거 쉬움 별 생각없이 다닐수 있음
108,비기닝리테일,6208,눈치없이 연차 쓸수 있음 주변에 밥 골라먹을때 많음
109,비기닝리테일,6208,알바비제때제때줍니다 추가수당 맞춰줍니다 알바는 칼퇴시켜줬었습니다 그닥없습다
110,비기닝리테일,6208,큰 기업이라 배울 점도 많고 시스템이 갖추어져 있는 느낌이에요.
111,비기닝리테일,6208,출근시간의 여유 근무지 지역이 서울지역의 중심에 가까워 접근성이 좋았음 근무지역의 위치로 번화가와 가까우며 점심 메뉴가 다채로웠음
112,비기닝리테일,6208,홍대에 있어 약속 잡기 편함. 연차 눈치 안보고 쓰기.
113,비기닝리테일,6208,회사 분위기가 조용하고 내부는 인테리어 깔끔하고 쾌적한 편 야근수당 있음
114,비기닝리테일,6208,"홍대에 있어서 퇴근후 약속잡기 좋음 윗사람들(과장,부장급)과 허물없이 지낼 수 있음 하지만 친하게 지내고싶지않음"
115,비기닝리테일,6208,새로운 변화를 쉽게 들여놓음. 회의가 많음 젊은 경영진
116,비기닝리테일,6208,1. 젊은 감각의 이사님 2. 또래 동료들이 많아 회사에 적응하기 쉬움 3. 깔끔한 인테리어 4. 업무 강도가 쉬워 나름 편하게 일할 수 있음
117,비기닝리테일,6208,업무 강도가 낮음. 직원들이 좀비처럼 일하는 분위기라 서로에게 기대치가 워낙 낮음.
118,비기닝리테일,6208,"홍대고, 깔끔한 인테리어, 젊은 직원들. 장점을 찾기가 어려운 회사."
119,비기닝리테일,6208,특정 시간 이후부터 야근수당 나옴 수습기간에 월급 삭감없이 다 줌
120,비기닝리테일,6208,홍대근처에 있어서 놀기좋음. 차있는 사람들은 주차공간 제공. 사무환경 좋음. 깨끗한 인테리어. 사내 분위기 조용함.(사람마다 느끼는 정도에 따라 다르겠지만). 회식강요 안함. 대체로 젊은 직원들.
121,비기닝리테일,6208,대표님은 좋은분 같지만 밑 부서장들을 보니 그것도 아닌것 같습니다 홍대근처.야근수당있으나 한도 있음
122,비기닝리테일,6208,야근수당 줍니다. 일정시간이 넘어가면 못 받는 룰이 있고 그 일정시간이 항상 넘어갈만큼 야근이 정말 많지만요.
123,비기닝리테일,6208,단골 고객이 많아서 매출은 꾸준했음. 브랜드 인지도가 높아서 그것이 제일 큰 장점이라고 할 수 있음.
124,비기닝리테일,6208,"10시출근이 장점이라면 장점이 되겠네요, 대표 이사님은 매너 있으신 편이어서 좋게 생각했어요 ."
125,비기닝리테일,6208,아는 사람은 아는 회사. 그래도 업계에서 오래버틴게 회사의 저력. 다만 다른 쇼핑몰로 이직하는 거 아니면 쇼핑몰 경력으로만 괜찮게 이직하기는 어렵다.
126,비기닝리테일,6208,"수평적이고 , 좋은 기업을 지향할려는 방향이 장점인거 같습니다."
127,비기닝리테일,6208,"연차를 불편함 없이 사용할수 있고 ,자유로운 팀분위기가 있다"
128,비기닝리테일,6208,일 못해도 정치만 잘하면 살아남는 회사. 정치 못하면 시나리오 짜져서 퇴사길로 가는 직원 여럿 봄. 다른 회사들이 오너 리스크가 있다면 여기는 오너 리스크가 없음. 대신 오너가 아닌 사내 정치와 그와 연관된 부패가 회사 망치는 케이스. 회사 홍대에 있는 것만 장점.
129,비기닝리테일,6208,직원구매 가능하고 팀별 활동비 지급됨. 홍대위치하고있어 20대에게 위치상 좋을수도.
130,비기닝리테일,6208,나름 여성의류 쇼핑몰 중에서는 잘나가는 업체임 홍대에 있어서 출퇴근은 편했던거 같음 뭐가 더 있더라
131,비기닝리테일,6208,"출퇴근 교통이 편한 홍대에위치해있고, 퇴근후 친구들과 약속잡기 편함. 개인별 업무관리를 안하기 때문에, 일할생각이 있으면 찾아서 하는 즐거움이 있다, 그게 아니면 일단 시키는것만 하는척해도 되므로 근무시간의 여유가 있다"
132,비기닝리테일,6208,"연차 제도는 사용하는데에 눈치주는 편이 아니며, 전체적으로 분위기는 괜찮은 편입니다."
133,비기닝리테일,6208,홍대 위치 좋다. 젊은 직원들 많은 것이 장점이라면 장점이였음. 모델이 인지도가 높다. 잠깐 일하기 좋음.
134,비기닝리테일,6208,연차 눈치 안 줌. 야근 수당 나옴. 대표님 이사님 좋은 분. 쇼핑몰 마케팅 업무 배움.
135,비기닝리테일,6208,쇼핑몰중 인지도 높음 대표님 두분 좋으심. 여자친구옷 사주기 좋음
136,비기닝리테일,6208,"팀비, 직원할인 , 생일자 상품권 지급 아 사무실 인테리어 깔끔함"
137,비기닝리테일,6208,"시장분석을 하여 빠르게 적용함, 경력과 능력을 불문하여 급한대로 사람을 채용하므로 많은 사람들에게 일할 기회를 주어지게 한다는 점에서 좋은 직장이다."
138,비기닝리테일,6208,가족같은 분위기가 있어서 좀 프리한편이고 활동하는 면에서도 제약이 많지 않았고 주도적인것도 많이 할 수 있었음.
139,비기닝리테일,6208,적당한 직원복지와 연차 자유로움이 보장되어있어 크게 눈치 보지 않고 워라벨 가능한 회사
140,비기닝리테일,6208,연차제도 / 야근 초과 근무수당등 그래도 기본적으로 직원들에게 해줄건 해주려고 노력함
141,비기닝리테일,6208,회사 분위기가 편하고 자유로워서 답답함은 없음 연차도 사용하기 좋은편임
142,비기닝리테일,6208,To. 마xx팀으로 입사할 예정인 분들에게.. 알랑방구 잘 뀌는 성격이고 윗분들한테 배울 점이 없어도 괜찮다면 추천. 월급일에 월급 잘 나오고 야근 수당도 잘 주는 편.
143,비기닝리테일,6208,연차쓸수있음 홍대에서 가까움 출근시간 10시인것 연령대가 20대라 또래가 많음
144,비기닝리테일,6208,"대표와 대표이사의 마인드가 젊다. 그러나 과장 부장급은 굉장한 꼰대  분위기가 아주 좋은 팀도 있음. 사원, 대리급 직원들과는 무난하게 어울릴 수 있다. 그러나 뒷담화가 심하고 뒷 말이 많으므로 조심해야 한다. 여초 회사로 무리지어 다니는 습성 때문에 그런듯. 쓰다보니 단점이네요."
145,비기닝리테일,6208,직원들이 젊음. 사회초년생이 일하기 좋은회사. 회식시 술 강요가 없고 홍대 번화가 바로인근이라 일끝나고 놀기가 좋음.
146,비기닝리테일,6208,전반적인 쇼핑몰 시스템이 어떻게 되어있는지 알아볼 수 있음.
147,비기닝리테일,6208,회식 강요 안함. 수평적인 분위기지만 라인을 잘타야 승진이 빠름
148,비기닝리테일,6208,개인주의적인 성향이강해 혼자 일처리 잘하고 눈치보지않는다면 오래다닐수있을것같음
149,비기닝리테일,6208,능력있는 사람이면 본인 능력을 뽐내기 쉬운 회사. 복지가 나쁘지않음 직원 생일때 상품권 지급 등 팀활동비도 넉넉함. 사무실 리모델링하여 책상과 깨끗한 환경. 경력직들 많이들어옴. 칼퇴 눈치안봐도됨 오히려 야근하면 눈치보임.
150,비기닝리테일,6208,이사가 직접 관여하기 때문에 퀄리티나 진행에 있어서는 빠릿빠릿하게 이루어짐.
