,company_name,company_id,review_text
157,성원애드피아,12409,식사비주는정도밖에없습니다 교통이좋은편 지하철역과 가깝게있는것이외없음 연말.야유회시 돈다발들고와 돈세며 뿌리는정도의 수준높은? 지급방식
158,성원애드피아,12409,점심 식권을 지급합니다. 자유로운 복장으로 출근할수 있음.
159,성원애드피아,12409,"식권준다. 야근은 별로 없으나, 대표가 시키고 싶어 안달났다."
160,성원애드피아,12409,"주말에 별도 특근없이 사무직의 경우 , 5일제를 확실히 시행하는곳입니다. 월요일부터 금요일까지 업무시간 이외의 별도의 야근을 하지않습니다."
161,성원애드피아,12409,"점심 식대 매달 어플로 지급. 상여금 형식으로 휴가, 구정연휴, 추석연휴 일정부분 줌. 급여 꼬박꼬박 나옴"
162,성원애드피아,12409,내부의 일만 담당하기에 다른 회사에 비해 일이 아주 많진 않다. 야근이 적음. 사옥을 쓰기에 근무 환경이 쾌적한 편.
163,성원애드피아,12409,점심 식대가 있어서 넉넉하게 아무거나 사먹을 수 있는 것 말곤 장점이 없다.
164,성원애드피아,12409,없습니다 이정도 쓰는데 편파적이 라고 등록이 안되면 그게 이상한 겁니다
165,성원애드피아,12409,건물은 깨끗함. 지하철 접근성이 좋음. 야근이 별로 없음. 그 외에 장점 전혀 없음
166,성원애드피아,12409,"군대같음; 월급은 꼬박꼬박 잘 나옴, 출근만 확실함 그이상 뭐 없음... 점심도 주고"
167,성원애드피아,12409,뚝섬역이라는 환상적인 위치라 서울/경기 어디서도 접근성이 좋습니다. 지은지 얼마 안되는 공장이라 깨끗한 시설에서 쾌적한 근무를 할 수 있었습니다.
168,성원애드피아,12409,아직까지는 국내 인쇄광고홍보물 제작 업계에서 최상위 업체입니다. 본인의 역량강화에 힘쓰지 않더라도 다양한 방법으로 경영진 일가의 인정을 받아 승승장구하실 수 있습니다.
169,성원애드피아,12409,다년간 쌓인 노하우로 판매 컨텐츠는 좋음. 자체 사옥이고 전철에서 가까워 근무 환경은 좋음.
170,성원애드피아,12409,"사옥내 운동시설 및 옥상에 정원과 쉼터를 꾸며 전 직원이 이용할 수 있는 환경을 조성함은 물론, 출 퇴근을 탄력적으로 할 수 잇는 탄력출근제를 실시하고 있습니다."
171,성원애드피아,12409,현금보유와 현금흐름이 좋음. 앞선 기술력과 매해 들어오는 최신의 인쇄기계. 어느정도 완성된 자동화 시스템
172,성원애드피아,12409,없습니다. 단점에서 자세히 쓸께요 최소 30자 이상인데.. 아 하나 있네요 밥값은 줍니다 그리구 장점이 없다고 이런 리뷰가 정식등록 안되는 경우도 있던데 다른 구직자 혹은 이 회사를 지원 하는 사람들을 위해 진실만을 쓴거입니다. 편협해서 쓴게 아니라는걸 말씀드리고 싶네요. 악평이 많고 안좋은 소리만 쓰는게 다 이유가 있는 겁니다 굳이 이런 곳 지원 해서 시간낭비 하지 마세요
173,성원애드피아,12409,"시키는 대로 일만 하면 됨. 누군가에게는 장점이, 누군가에게는 단점이 될 수도 있음."
174,성원애드피아,12409,같은 사무실에서 알하는 분들이 너무 잘해주셔서 가족같은 분위기에 일할수 있었음.
175,성원애드피아,12409,시키는 대로만 하면 큰 무리없이 다닐 수 있는 회사입니다
176,성원애드피아,12409,인쇄직무는 나름 좋은 페이를 받지만 한계치는 있음 그외는 천대받음 매우 안좋음
177,성원애드피아,12409,큰 규모에서 할 수 있는 다양한 인쇄 경험 도심 역세권에 위치해 수도권에서 출퇴근이 대체로 수월하다
178,성원애드피아,12409,사장과 실무진 사이에 팀장급이상 중간관리자 수가 적어서 의사결정이 매우 빠름. 업무추진 과정에서 사장만 이해와 설득시키면 중간관리자 의견 관계없이 바로 진행가능.
179,성원애드피아,12409,장점은 그냥 오래 일할수 있는거? 그것도 요즘기업은 잘모르겠다 오래 일하고자 하면 다니면됨 자르진 않는데 대신 연봉은 고정시킬듯
180,성원애드피아,12409,급여가높고 환경이 좋습니다. 인쇄소라고하면 열악하고 냄새도심하고하다고하는데 환경이좋고 깔끔하고 좋습니다.
181,성원애드피아,12409,중소기업치고 있을거 있는 복지 점심을 내맘대로 사먹을수있는거?
182,성원애드피아,12409,새건물이라 시설은 좋아보임 밥은 식권으로 줌 경영진 및 가족들이 무지하여 경영관련 업무 모름 줄 잘타면 오래다님
183,성원애드피아,12409,식사제공. 다른건 찾아봐도 없음. 호텔에서 약간 혜택을 받는 정도.
184,성원애드피아,12409,인쇄업계 최강자로 모든 인쇄업계를 쥐락펴락 하고 있음. 모바일 식권으로 하루 6천원 지원. 명절 및 여름휴가 상여 지급.
185,성원애드피아,12409,분위기가 쫌 자유롭고 그나마 눈치안보고 퇴근할수있다는게 장점
186,성원애드피아,12409,회사 자체가 많이 커져서 복지나 이런것등 다른 인쇄디자인 회사보다 큰 혜택들이 많음.
187,성원애드피아,12409,동 업종의 타 기업보다 빠른 IT 서비스의 제조와의 결합으로 경쟁력이 높음
188,성원애드피아,12409,인쇄업계에서는 나름 유명한 업체 상업 인쇄에 기초 전반적인 공정 흐름에 대해서는 빨리 터득할수 있음
189,성원애드피아,12409,중식제공 탄력근무제 (출근시간 선택가능) 깨끗한 사무 환경 가끔 보너스 나옴 야근이 많지 않음
190,성원애드피아,12409,자기가 스케줄관리 중식제공 일 잘하면 그만큼 보상됨 다양한 인쇄경험
191,성원애드피아,12409,체계적으로 분업화되어 있어 담당 업무만 맡으면 된다. 식대를 지급한다. 업무 시스템이 비교적 편리하다.
192,성원애드피아,12409,네임벨류 및 다양한 업무의 경험. 주변 사람들이 잘 챙겨줌
193,성원애드피아,12409,큰회사이고 인쇄쪽에서는 시스템을 경험해볼 수 있는 회사입니다. 인쇄쪽에서 일을 하실 분이라면 좋은 경험을 쌓을 수 있습니다
194,성원애드피아,12409,디자인업무를 하지만 야근과 주말출근에 시달리지 않아도 됨. 자회사의 광고와 상품기획에만 매진할 수 있다는게 장점이다.
195,성원애드피아,12409,"탄탄한 재정상태로 월급이 절대 밀리지않으며, 인쇄의 전반적인 실무를 눈으로 보며 배울수 있다."
196,성원애드피아,12409,"건물이 깨끗하다. 점심 식대비를 지급한다. 근무복을 지원한다(단, 1년 이상 근무해야 근무복을 받지 않는다.)"
197,성원애드피아,12409,본사 직원의 경우 성수동 신사옥에서 근무하기 때문에 사무환경이 깨끗하고 좋음
198,성원애드피아,12409,초과근무가 거의 발생하지 않음 신사옥이라 근무환경이 좋음 공휴일에 칼같이 쉼(연차에서 차감)
199,성원애드피아,12409,인쇄업계의 손꼽히는 회사 회사 사옥에 기계도 외국에서 여러 도입으로 고퀄리의 인쇄가능
