,company_name,company_id,review_text
0,성원애드피아,12409,"적당한 정해진 규칙 속 기업이 도움이 되는 자기역량을 발휘하면 인정 받을 수 있는 기업문화. 모든 직원간 존중 및 사생활 간섭 전혀 없음. 야근, 회식 등 강요 없고 지양 하는 분위기."
1,성원애드피아,12409,환경이 깨끗하며 복지도 점점 좋아지고 있으며 점점 일이 많아지고 있어서 회사가 날이갈수록 커짐 망할일은 절대 없을거 같음 연차 자유롭게 사용가능하며 야근도 없다.
2,성원애드피아,12409,실력과 기획능력이 있다면 이 회사에서는 성장할 수 있는 기회가 많이 열려있다. 업무에 지장이 없다면 연차사용이 자유롭다
3,성원애드피아,12409,1. 연차사용가능 2. 많은 생산공정을 한눈에 볼 수 있음 3. 식권어플 톻해서 점심식사제공됨 4. 연봉에 상여금 비포함
4,성원애드피아,12409,재무적으로 탄탄하며 인쇄업종에서는 성장하고 있어 누구나 이름대면 알만한 회사 타업체에 비해 복지와 대우가 좋으며 급여도 다른 인쇄업종에 비해 좋다. 생각을 가지고 스스로 업무능력을 키우고 배우고자 하는 자세로 일을 한다면 많은 일을 경험하고 배울수 있다
5,성원애드피아,12409,기본작인게 장점 뭐 월급 안밀림 이런거 꼰대 많음 고인뮬
6,성원애드피아,12409,월급이 제때들어온다. 칼퇴가능한 곳 식대지원가능해서 나름괜춘
7,성원애드피아,12409,인쇄 플랫폼으로 오래된 회사여서 안정적으로 보이는 듯 하다.
8,성원애드피아,12409,대표가 정말 머리좋고 10수 앞서 생각하는사람임 존경스움
9,성원애드피아,12409,역 근처에있어서 출퇴근 용이  근처에 밥집 카페 많아서 좋지만 식권대장 점심값은 턱없이 부족
10,성원애드피아,12409,글쎄 시간을 많이 준다는거? 그래서 더디다는거? 딱히 노출할만한 장점? 점심값을 준다?
11,성원애드피아,12409,딱히 없지만 충무로역과 뚝섬역에서 가까워서 지하철을 탈 수 있다는 점
12,성원애드피아,12409,워라벨은 지킬 수 있는 장점이 있어요. 식대도 챙겨줘요.
13,성원애드피아,12409,지하철엳 하고 가까움 밥줌 연차 내 마음대로 사용 가능
14,성원애드피아,12409,지하철역과 가깝고 식대와 상여는 연봉과 별도 연차 마음대로 쓸수있음
15,성원애드피아,12409,연차가 있다.(연차가 있어도 자신에 필요한 날에 사용할수있다.)
16,성원애드피아,12409,"부서마다 차이가 있지만 정시 퇴근 비율이 굉장히 높고, 점심 식대 제공 그리고 연차를 자유롭게 사용할 수 있습니다."
17,성원애드피아,12409,기업의 재정적인 안정성으로 기업입지와 자본력 등 안정성이 뛰어나다.
18,성원애드피아,12409,점심 식권으로 먹을수 있는점? 내돈안내고 먹을수 있다는 장점
19,성원애드피아,12409,"아무리 쥐어짜도 없지만 시차출근, 식대8천원, 자율복장, 간식제공 끝"
20,성원애드피아,12409,식권나옴지하철가까움밖엔없음 밥값은 절약되나 그외는없음
21,성원애드피아,12409,충무로 사옥 성수동 사옥 모두 지하철역에서 가까운거 정도
22,성원애드피아,12409,기업의 자산이 튼튼하다보니 월급이 밀린적없이 따박따박 나옵니다.
23,성원애드피아,12409,사장한테 잘보이면 현금을 용돈처럼 받아갈 수 있다 식권대장이 나와 점심은 식권대장으로 사용가능
24,성원애드피아,12409,연차 사용이 쉬움(부서마다 다름) 중식 지원(한끼에 7~8000원 선) 휴가비 지원 명절 선물+떡값
25,성원애드피아,12409,식권대장 점심지원 역이랑 가까움 커피머신 엘리베이터있음
26,성원애드피아,12409,"식권대장 지원이있다, 역세권이다, 본사가 성수에 있다,"
27,성원애드피아,12409,장점은. 식권주고. 월급 밀린적없고. 연차 맘대로쓰고. 휴일 다쉬고. 전철역 가깝고. 회사 안망할거같고.
28,성원애드피아,12409,야근비 있음/ 충무로 역과 가까운 곳에 있음/ 회식없음/
29,성원애드피아,12409,식대를 주고 연봉이 중소기업대비 높은편입니다. 업종도 경쟁력이 있어서 향후 성장이 예상됩니다.
30,성원애드피아,12409,지하철 가까운편 식대나옴 업계에서 큰편 사옥 깨끗한편 또 장점이 뭐가있을까요
31,성원애드피아,12409,"회사 자체가 인지도 있고, 나름대로 탄탄하며 매출이 높음. 업계 1위 평판."
32,성원애드피아,12409,정수기 있음 엘리베이터있음 탕비실 있음 건물이 낡지 않았다 모니터있음
33,성원애드피아,12409,점심식사 식권대장 이용 뚝섬역 5분 거리 이것 외에는 1도 없음
34,성원애드피아,12409,30자라니...식대제공?? 역 근처?? 정도가 될 것 같네요
35,성원애드피아,12409,2021년도부터 회사에 약간의 변화의 조짐이 보인다. 직원들의 복지와 워라벨을 신경쓰기 시작했다.
36,성원애드피아,12409,"그나마 식대 제공이 된다는 것(현급으로 주지는 않고 식권대장 마일리지 형태로 줌) 그리고 복장이 자유로웠음. 복장에 대해 머리스타일 등에 관대한 편임. 비교적 정시퇴근. 부서마다 다르겠지만, 특별한 일이 없으면 정시퇴근. 교통이 편리함"
37,성원애드피아,12409,"재정적으로는 여유가 되는 회사라 성과금, 연봉인상 등 금전적인 부분은 아쉬운 부분이 없다."
38,성원애드피아,12409,점심 식대지원이 되고 뚝섬역 부근이라 멀지 않다 나머지 장점은 모르겠다
39,성원애드피아,12409,법적으로 당연히 생기고 보장 받는 연차를 쓸 수 있다는 점
40,성원애드피아,12409,식대 지급해줌. 교통이 편리하다 지하철에서 가깝다 그거 말고는 없음니다. 쓰고싶지도 않네요 할말없다니까 뭘 자꾸 적으라네.
41,성원애드피아,12409,"건강검진, 각종 경조사 지원, 인센티브, 퇴직구, 주차장 제공 , 연차 같은 다른 기업들도 제공하는 것들."
42,성원애드피아,12409,"앞서 말한듯이 교통편 식대, 깨끗한 근무환경, 같이 일하는 사람들이 좋았습니다"
43,성원애드피아,12409,"연차를 마음껏 사용할수있고 , 점심식대 지원으로 인해 복리후생이 좋습니다."
44,성원애드피아,12409,"성원애드피아 복리후생  1.검강검진, 각종 경조사 지원, 퇴직연금,인센티브제,퇴직구,야근수당,휴일수당,연차수당,4대보험,-->타사에서도 동일하게 시행하는데 마치 성원애드피아 독점 복리후생인것처럼 장황하게 홍보함.  2. 편안하게 일할수 있는 최선의 환경(휴게실 포함)-->휴게실 없음, 샤워실도 캐비넷, 청소용품 비치 공간으로 전락함.  3. 주차장 제곰-->임원 또는 장기 근무자만 주차 가능, 이하 직원은 절대 이용불가  4. 야근강요 안함-->대표 지시사항이라며 타 부서에서 업무 강요하는 경우 야근은 기본, 타 부서도 눈치보느라 쉽게 퇴근 못함.  5. 연차,하계휴가,반차,포상휴가,경조휴가제-->성원애드피아에서만 시행하나??  더 많은 내용이 있으나 생략함, 더 이상 언급할 가치조차 없는 기업임."
45,성원애드피아,12409,점심비용 제공해줌 그만두기 전에 8천원으로 올려줘서 신기방기
46,성원애드피아,12409,"식대지원, 야근수당지급 제휴된 호텔 뷔페나 식당을 저렴하게 이용가능한점"
47,성원애드피아,12409,점심 제공 근무환경은 그럭저럭 있을만 해요....
48,성원애드피아,12409,식권이 잘나와 점심 저녁을 먹을수있고 기계시설이 좋고 건물이 있습니다
49,성원애드피아,12409,뚝섬역에서 가깝고 사옥이 깨끗한 편이었어요 점심 식대 제공
50,성원애드피아,12409,식대를 제공해주는데 그걸 어플로 결제할 수 있어 사용적인 면에 있어서는 편한 것 같음
51,성원애드피아,12409,사옥이 깨끗한 편인 거 뚝섬역에서 그렇게 멀지 않은 거
52,성원애드피아,12409,"뚝섬역과 근접, 점심식사 비용을 앱으로 줘서 회사 근처에서 사용가능 (사용가능 식당 많음) 점심을 안먹더라도 저녁을 대신 먹든 각자가 알아서 할수있음  월말에 소진되고 충전되서 월말에 남은 금액은 알아서 소진  인쇄업 전반을 배울수있음"
53,성원애드피아,12409,"식대지원, 야근 극히 드뭄, 자유로운 연차사용 (하지만 휴가 연차 차감), 역세권, 복장 자율화"
54,성원애드피아,12409,사옥이 깨끗한 편이에요. 그리고 식대는 어플로 결제가 됩니다.
55,성원애드피아,12409,"급여 별도로 중식제공되는 점은 좋았음, 경조금 지원되는 것도 좋았음"
56,성원애드피아,12409,역에서 가까운 곳에 있으니 출퇴근 하기에 편리하다. 서울시에서 대중교통을 편리하게 만들어 놓은건데 이걸 장점이라고 써야 한다니 얼마나 장점이 없는지 알겠죠.
57,성원애드피아,12409,역에서 가깝다(장점이 너무 없어서 이거라도 씁니다 30자를 어떻게 채웁니까)
58,성원애드피아,12409,"어플로 식대 제공해준다(7,000원 제공해줍니다. 요즘 한끼에 9,000원 하는데 7,000원씩이나 제공해주다니 정말 대단합니다)"
59,성원애드피아,12409,점심 지원해주는거 정도? 나머지는 장점이랄게 없다. 일이 많아서 망할일 없다라는것 정도.
60,성원애드피아,12409,"연차 사용을 불편해하는 분위기가 없으며, 월급도 제때제때 나오며, 시스템이 잘 짜여있어 일하는데 편의성이 좋다."
61,성원애드피아,12409,열심히 하면 성장할수 있는 기업입니다 잘만 하면 수익도 많이나고 더 크게 성장할수 있어요
62,성원애드피아,12409,밥값7000원 지원해줍니다 지하철이랑 가깝다 일이 여유롭다
63,성원애드피아,12409,지하철에서 가까우며 공장 건물이 깨끗함 연차 사용 가능하고 급여가 지급됨 가끔씩 공장 내에서 고기 구워서 나눠 먹기도 함
64,성원애드피아,12409,급여가 나온다 그 마저도 아까운지 급여가 오후 늦게 입금된다 일한 만큼 주는 돈도 아까운가 봄
65,성원애드피아,12409,건물이 깨끗합니다. 사옥에 엘리베이터가 있어서 계단을 오르 내리지 않아도 됩니다.
66,성원애드피아,12409,라떼 사다 받치며 아부떨면 편하게 다니실 수 있습니다. 일 못해도 밉보이지만 않으면 아무말 안 듣고 조용히 다닐 수 있습니다.
67,성원애드피아,12409,급여 나옴 오후 5시 임박해서 입금됨 일한 만큼 주는 돈도 아까운가 봄
68,성원애드피아,12409,"식대 제공, 지하철역에서 가까움 인쇄업계에서는 큰 회사"
69,성원애드피아,12409,최첨단 인쇄기계를 갖추고 있다. 사람보다 뛰어난 봇을 탑재해 정확도와 신속성을 높였다
70,성원애드피아,12409,"출근, 퇴근 시간이 잘 키켜지고, 월급이 꼬박꼬박 잘 나옴"
71,성원애드피아,12409,점심 식대 주는거와 지하철에서 가까운 거 월급 제때 나오는 거
72,성원애드피아,12409,거의 없는데 굳이 찾자면 지하철역에서 가깝다는거 식대가 나온다는거
73,성원애드피아,12409,월급만 밀리지 않고 나오고 경영진이 가족 기업이라 벌어놓은 돈이 많음
74,성원애드피아,12409,식대나옴 지하철가깝다 상여금은 상사맘대로 정하므로 친하거나 아부떨면 많이 받을 수 있다
75,성원애드피아,12409,1. 점심식대 제공함(7000) 2. 번화가 주변에 위치 3. 업무강도는 적은편 4. 이년차부터 상여금 지급 5. 회사내에 휴식공간이 없음
76,성원애드피아,12409,"점심식대가 지원이 되며, 앱으로 이용할 수 있어서 편하다."
77,성원애드피아,12409,점심이 지원됩니다. 어플로 계산 되기 때문에 사용이 용이하다 그 외에는 아무리 생각해도 없다.
78,성원애드피아,12409,밥준다는거죠 그게 최고의 장점입니다. 그 외에는 없는 것 같아요.
79,성원애드피아,12409,"연차 사용하는데 눈치볼 필요가 없다. 식대 제공한다. 설, 추석, 여름휴가때 상여금 나온다."
80,성원애드피아,12409,"연차 사용, 식대 지원 정도. 장점이라기보다 노동법에 규정된 사항들만 어쩔 수 없이 지키는 그런 느낌? 그런것도 복지라고 생색을 많이 낸다"
81,성원애드피아,12409,대표소유의 부동산이 많고 매출이 일정해 지속적으로 수익이 발생해 돈이 많은 회사지만 그만큼 직원들에게 돌아가는 복지는 적다고 사려됨.
82,성원애드피아,12409,서울에 있다 일 7000원 기준 점심값 지급 규모는 큼. (박리다매의 장점이 크게 작용)
83,성원애드피아,12409,월급 안밀리고 명절에 상여금도 나와요. 내 할 일만 잘 하면 다니기 편한 곳이에요.
84,성원애드피아,12409,"개인의 연차를 사용할수있어서 ,눈치안보고 자유롭게 사용이 가능하며 이로인한 워라벨이 좋은 회사입니다."
85,성원애드피아,12409,서울에 있다 일 7000원 기준 점심값 지급 규모는 큼.(박리다매의 장점이 크게 작용)
86,성원애드피아,12409,지하철가까운정도와 점심제공 보너스 명절에 선물세트지급 정도입니다
87,성원애드피아,12409,식비가나옵니다. 어플로쉽게 근처식당에서 결제하기가편하긴합니다. 역근처있어서 회사가기는 편합니디.
88,성원애드피아,12409,"업무강도가 몰릴때가 있음, 역에서 거리는 가까워서 좋음"
89,성원애드피아,12409,"회사건물 크고 깨끗한편, 역에서 가까움, 다음 생각나지 않는다."
90,성원애드피아,12409,이 회사에서는 월차를 사용할 수 있다는 점이 좋았습니다.
91,성원애드피아,12409,"인쇄, 디자인 관련 국내 1등 기업이며 IT 기반의 경영으로 안정적인 직장생활이 가능한 곳"
92,성원애드피아,12409,호텔운영함. 식당운영함. 연차사용. 식권대장. 좋은팀장과 나쁜팀장 구분이 확실. 좋은팀장과 나쁜팀원 구분이 확실. 좋은팀원과 나쁜팀원 구분이 확실. 좋은팀원과 나쁜팀장 구분이 확실. 하기에 좋은 팀장팀원이 많이 보여 일하기 좋음.
93,성원애드피아,12409,장점은 하나같이 밥준다는거죠 그게 최고 장점입니다. 사용도 편해요
94,성원애드피아,12409,여러가지 인쇄일이 많아 인쇄관련 지식을 짧은 시간안에 경험하고 알아갈수있음 지하철이랑 가까워 출근하기가 편함 식권대장사용으로 근처 제휴식당을 이용해서 점심을 먹을 수 있음 사무실이 깔끔해서 업무환경은 쾌적하다
95,성원애드피아,12409,힘들거나 어려운 업무보다 반복적인 업무가 많아 생각없이 일만 하고 싶은 사람에게 추천. 어플사용으로 점심식비 지원. 지하철이 가까워 출퇴근이 편리.
96,성원애드피아,12409,식대로 이용가능한 식당이 다양한 편이다 정점은 글쎄 라디오광고로.네이밍은 알려진편
97,성원애드피아,12409,"연차는 자기 일처리만 잘하면 눈치 안보고 쓸 수 있음 식대지원, 지하철역에서 가까움"
98,성원애드피아,12409,연차 사용 식대 지원 등 장점이라기보다 노동법에 규정된 사항들만 어쩔 수 없이 지키는 느낌? 그런 것도 복지라고 생색을 많이 낸다
99,성원애드피아,12409,앱에 등록되어 있는 식당만 이용할 수 있으며 점심을 제공해준다.
100,성원애드피아,12409,월마다 식대포인트 제공 회사 재정상태는 매우 안정적임 지하철역 인근에 위치하여 출퇴근 편함
101,성원애드피아,12409,점심 식대 주는거와 지하철에서 가까운 거 월급 제때 나오는거
102,성원애드피아,12409,식대지원! 그런데 식당 몇곳만 지정해 놓아 나중에는 질림!
103,성원애드피아,12409,돈은 꼬박꼬박 나옵니다. 회사도 공유 오피스는 아니라 좋아요. 엘베가 하나뿐이지만
104,성원애드피아,12409,중식제공 식권어플을 사용하여 조금 편리하긴 하나 마지막 남은 돈이 이월되는게 아니여서 조금 아쉽다.
105,성원애드피아,12409,"식권 준다. 급여의 1/4을 설날, 여름휴가, 추석에 준다. 올해는 코로나때문에 어렵다며 그나마 깎았다."
106,성원애드피아,12409,"점심식대 지원, 야근강요 안하지만 안하면 안될 거 같은 분위기?"
107,성원애드피아,12409,"점심 식대 제공, 직장 동료간 커뮤니케이션 및 사내 분위기는 좋은 편에 속함."
108,성원애드피아,12409,점심이 지원됩니다. 어플로 계산되기 때문에 사용이 용이하다. 그외에는 아무리 생각해도 없다.
109,성원애드피아,12409,연봉협상 잘하면 높은 연봉 받을수 있어요 주말 빨간날 다쉬고 공장 치곤 이런 공장 없죠 상여금 연봉 포함 아닙니다 그래서 사람들이 욕해도 그냥 다니는 이유죠
110,성원애드피아,12409,"통상적인 인쇄업계의 기존 틀에 박힌 오프라인 영업을 탈피해서 ERP의 과감한 투자(PHP 외 프로그램 개발자 약 30명)를 통해 온라인 시스템을 구축한 유일한 회사이며, 연봉외에도 상여금과 성과급 제도 정착을 통해 직원들과의 win-win 전략을 추구하고 있음."
111,성원애드피아,12409,연차를 눈치 볼것없이 직급과 상관없이 연차를 사용가능하다는것이 장점입니다. 주말을 끼고 월요일이나 금요일 사용시 최대 3일간 휴식이 가능합니다.
112,성원애드피아,12409,인쇄업계에서 조금 큰 정도 규모의 회사. 월급은 따박따박 나오고 있음.
113,성원애드피아,12409,가족친화적인 회사...경영진이 모두 가족....가족에게만 잘보이면 만사오케이...못보이면....
114,성원애드피아,12409,열악한 인쇄업계를 비교한다면 4대보험과 급여가 제대로 지급되고있습니다.
115,성원애드피아,12409,"과감한 최신설비 투자, 스마트한 공정 체계, 투명한 자금 운용 등 고객이나 직원이나 기업을 신뢰할 수 있다는 점."
116,성원애드피아,12409,"본인의지만 있다면 새로운 업무-직무이동의 유동성-가능하다는 점 (아직 그렇지 않은 업체가 많은데)우리만의, 사내 자동화시스템 투자 및 라인형성이 되어 있다보니 업무상에 있어 효율성이 뛰어나다는 점 관리자보다 ceo가 더 수평적 조직문화?! 및 회사 발전의 새로움 추구? 아이디어 센스가 돋보인 ""new"""
117,성원애드피아,12409,같은업종 타기업보다 기술력에 투자를 많이해서 그런지 좀더 편하게 일할수 있는것 같고 대표님의 마인드가 너무좋다
118,성원애드피아,12409,시스템이 잘되어있다
119,성원애드피아,12409,스스로 찾아서 일을 하기때문에 업무능력을 키우거나 발휘하는데 좋다. 때문에 강요적인 야근은 없어서 업무 스케쥴 조정을 잘 한다면 야근없는 직장 생활이 가능하다.
120,성원애드피아,12409,다양한 인쇄물을 편하고 쉽게 주문할 수 있는 시스템을 갖추고 있습니다.
121,성원애드피아,12409,종합적인 인쇄업무 실행 및 자기계발 가능성이높다. 안정적인 근무시간으로 개인여가 활동 가능. 인쇄물에 대한 많은 지식과 경험을 쌓을 수 있다.
122,성원애드피아,12409,끊임없이 연구하고 발전해 가는 기업입니다
123,성원애드피아,12409,"식대제공, 쾌적한 근무환경, 상여금 지급, 유연한 근무 스케줄관리, 본인의 의지만 있다면 인쇄의 겨의 모든 분야를 공부하고 직접 배울 수 있다."
124,성원애드피아,12409,업계의 다양한 업무를 접해볼 수 있다
125,성원애드피아,12409,"부서장 잘 만나고 직무를 잘 맡는다면 일을 하는만큼 대우받고, 인정받을수 있음 성장가능성이 많은 회사"
126,성원애드피아,12409,안정적인 수익구조
127,성원애드피아,12409,인쇄업계에서 괜찮은 IT 인프라를 갖췄고 장비 및 시설투자에 관대한 편 현금보유액이 많음 회사 자산이 많음. 월급이 밀리지 않고 잘 나옴.
128,성원애드피아,12409,"칼퇴근이 가능하며, 점심 식대가 제공된다. 회사의 자본이 많고, 경영 상 큰 돈 나가는데에는 크게 주저하지 않는 것 같다. 능력있고 사람 좋은 직원들이 많이 있다."
129,성원애드피아,12409,"신제품 및 고객입장에서 필요한 제품을 항상 연구개발하고 있다는 점입니다.  직원들에게는 대표님께서 조금이라도 더 좋은 복지를 해주시기 위해서 , 항상 노력중입니다."
130,성원애드피아,12409,매년 성장 발전하는 회사 앞으로도 더욱더 발전해나갈 가능성과 발전될수있는 여력이 무궁무진한 회사
131,성원애드피아,12409,세상이 망해도 살아냠는다
132,성원애드피아,12409,1. 야근 없다. 2. 워라벨이 가능한 회사 3. 식대 제공해서 연봉과 별도로 식비를 절감해서 좋다. 4. 외부일이 아닌 회사 일만하기 때문에 외부적 스트레스가 없다. 5. 급여걱정이 없다. 매년 상승분을 제공한다.
133,성원애드피아,12409,"* 본인이 흔들림 없는 의지만 있다면, 역량을 펼칠 수 있는 곳"
134,성원애드피아,12409,주5일제
135,성원애드피아,12409,저비용 고품질의 동종업계 경쟁력 우수함
136,성원애드피아,12409,경쟁력
137,성원애드피아,12409,일감이 많고 자체회사라는게 무엇보다강점이다.
138,성원애드피아,12409,노력에 대한 보답이 있습니다 본인 일에 열심히 하면 성장할 기회가 있습니다
139,성원애드피아,12409,가격경쟁의 우의
140,성원애드피아,12409,업무에 자율성이 보장되는 만큼 다양한 업무가 가능하다. 커리어를 쌓고 발전해 나가는데 도움이 된다.
141,성원애드피아,12409,꼭 뽑자하면 밀리지 않는 월급?
142,성원애드피아,12409,보수적인 제조업인 인쇄업종임에도 불구하고 자동화 및 ERP 등 모든게 전산화가 되어있어 인원대비 효율성이 매우 훌륭하며 실제 기술연구소가 업종과 달리 IT 및 전산 프로그래머 전문가가 약30명가까이 근무하고 있음. 경영진은 현재에 만족하지 않고 새로운 먹거리를 위해 항상 도전하고 있는 중...
143,성원애드피아,12409,"매출이 높아서, 기업이 안정적이다."
144,성원애드피아,12409,불필요한 회의가 없는 효율적인 운영 빠른 의사결정 연간 3회 지급되는 상여금
145,성원애드피아,12409,회사내파벌이있어서라인을잘타면다행이지만아니라면 그리좋다고수없다.
146,성원애드피아,12409,"독판 인쇄분야에서는 국내 최상위급 회사이며, IT기술을 접목하여 독보적 성장을 한 회사임. 연구개발분야에는 충분한 투자와 대우를 하는 편임 사장과 직원사이에 중간 임원이 없는 관계로 짧고 확실한 의사결정과 자금지원은 확실함"
147,성원애드피아,12409,월급만 밀리지 않고 잘 나오고 경영진이 가족 기업이라 벌어놓은 돈이 많음
148,성원애드피아,12409,"혼자 일 하는 방식이므로, 동료들과 밥을 같이 먹지 않는 이상 얼굴 붉힐 일이 크게 없다."
149,성원애드피아,12409,"회사 매출이 좋아서 탄탄하고, 갈수록 규모가 커가고 근무지 환경도 좋은듯함"
150,성원애드피아,12409,중식대 제공 지하철에서 가깝다 야근시 식대 제공 장점을 찾기힘든 회사이다
151,성원애드피아,12409,식대나옴 지하철가깝다 상여금은 상사맘대로 정함으로 친하거나 아부떨면 많이받을수 있음
152,성원애드피아,12409,- 부서마다 업무마다 상이하지만 대부분 워라벨 가능함 - 사무직은 회사 규모가 크기 때문에 많은 직무 경험을 쌓고 자기개발 하기 좋음 - 상여금 등 대우가 좋음 - 식대지원
153,성원애드피아,12409,- 부서별로 다르겠지만 회사가 야근을 근본적으로 지양하기 때문이 워라벨이 좋음. 사원들도 대부분 칼퇴. - 중견기업을 뛰어넘는 매출액 때문인지 상여금이나 우수사원상에 돈을 아끼지 않음. - 충무로/뚝섬역에서 3분정도 거리에 있어 출퇴근이 편함. - 식대 7천원 지원. 식권대장 이용. - 가족경영이란 단점만 이겨낸다면 편하고 괜찮은 회사.
154,성원애드피아,12409,점심비용을 앱을 통해서 지원해주는건 좋습니다. 회사 근처에 생각보다 다양한곳에서 식사 가능합니다
155,성원애드피아,12409,규모가 있어 어쩔수 없이 법적으로 지키려고 애쓰는점이 있지만 그또한 잘 피해서 교묘하게 비켜감 강소기업이지만 오너마인드는 구멍가게 수준
156,성원애드피아,12409,"칼퇴근 보장(내일 아닌듯이 퇴근하면되고, 오늘일 급하지 않으니 내일하면 그만) 대표가 기분이 좋으면 용돈을 줌"
