,company_name,company_id,review_text
0,애크로덴트,5223,회사 개발제품은 확실이 좋은것 같음. 야근이 많지는 않음
1,애크로덴트,5223,휴가기간때 휴가를 많이 주셔서 푹 쉴 수 있었어요 여러 일을 경험해 볼 수 있구 사원분들이 친근하셔서 서로 도우며 재밌게 일할 수 있었습니다 점심마다 사장님이 맛있는 음식을 사주세요 출퇴근이 변동없고 야근도 거의 없습니다
2,애크로덴트,5223,"연차사용가능, 야근 거의 없음. 직원들 다들 좋아서 큰 애로사항 없음."
3,애크로덴트,5223,"인원이 적어서 파벌이 없고, 사장님 성격이 꼼꼼하셔서 직원들이 힘들기는 하지만 직원들을 잘 챙겨 주십니다. 출근시간이 9시입니다."
4,애크로덴트,5223,소수의 인원으로 자유롭게 업무가 가능하며 칼퇴가능하며 직원간 끈끈함이 있음.
5,애크로덴트,5223,주력제품의 가치성이 있고 연봉이 작지는 않고 출퇴근이 정확함
6,애크로덴트,5223,고객들이 인정하는 좋은 아이템과 젊은 직원들이 함께 업무를 진행하기에 분위기가 좋음.
