,company_name,company_id,review_text
0,에스티엘,2552,그냥저냥 편하게 다니기에는 괜찮았던거 같습니다 그냥 딱 그정도
1,에스티엘,2552,야간근무를 하면서 자기계발할수있는 시간이 있음 그런거는 장점
2,에스티엘,2552,상사의 관여만 없다면 연차는 편하게 쓸 수 있는것 같아요. 방재업무다보니 편한 곳은 편한것도 장점
3,에스티엘,2552,식사 제공 유니폼 제공 휴식시간 제공 이게 끝인거같은데
4,에스티엘,2552,각 사업장 마다 분위기가 다르겠지만 본인의 근무지에서는 서로 배려하며 다른 회사 대비 비교적 좋은 분위기였습니다
5,에스티엘,2552,연차 조정편하게할수있음. 부서마다 장단점이 다름. 교대근무하면 몸이 편함
6,에스티엘,2552,"법은 잘 지킨다 칼퇴근에 하계휴가, 연차사용, 야근 수당까지 챙겨준단"
7,에스티엘,2552,"연차를 그나마 자유롭게 쓸수있는곳 , 퇴근시간이 일정해 칼퇴근을 할수있는곳 , 점심식사 제공을 해주는곳 , 나름 쉬는시간이 보장이 된다"
