,company_name,company_id,review_text
0,에스피에이치,4986,중소기업에서도 탑티어 복지라고 생각함. 재택이나 근무시간부분
1,에스피에이치,4986,10 to 7 야근 거의 안함 금요일 재택 자기 할 것만 잘하면 터치 없음  위 세개 만으로 다른 자잘한 장단점은 다 씹어먹음
2,에스피에이치,4986,-연차를 자유롭게 사용 가능함 -자기 계발비 지원 -10 To 6로 적은 업무시간 -생일선물 지원
3,에스피에이치,4986,10시 출근 6시 퇴근 금요일 재택근무 전 직원 식비 카드 지원 까지 해주니 이런 복지 측면에서는 아주 나이스 하다. 개발자에 대한 크게 터치가 없다.
4,에스피에이치,4986,연차 자유 사용 3년마다 리프레쉬 휴가 상하반기 보너스 자기계발비 지원 식대제공 생일선물비 워라벨 추구하는 사람들의 꿈의 회사처럼 보임
5,에스피에이치,4986,"역 과 이어져있어서 편하고 각종 복지가 좋으며 워크샵, 생일선물, 개인법카 등 혜택이 많다"
6,에스피에이치,4986,근무 시간이 짧음 업무량이 적음 식비 지원 탄탄한 재정
7,에스피에이치,4986,분위기가 자유롭고 새로운 복지나 문화 도입에 거리낌이없다. 직원들의 의견을 존중해주는 편
8,에스피에이치,4986,연차가 자유로운건 다른 회사도 마찬가지이고. 출퇴근 시간이 10to 6인 점
9,에스피에이치,4986,"자유로운 연차 소진 실무자를 배려하는 복지 (10시 출근, 생일 축하금 등) 변화에 빠르게 맞춰 진행하려는 정책 (재택근무 등) 자기개발에 적극 투자 (운동, 자격증 공부 등) 식비 카드 제공"
10,에스피에이치,4986,"- 10시출근/18시퇴근 - 여의도역과 가까운 거리에 위치 - 자유로운 연차사용과 자기개발비지원(도서, 운동 등) - 사소한것도 불편하지않게 직원 복지에 신경을 많이 씀 - 직원들 각자 책임감 있게 열심히 일함 - 클라이언트 요구에 무조건 예스하지않음 - UI 담당이 있어 불필요한 공수가 들지않음"
11,에스피에이치,4986,- 식대 제공 - 출근 10시!! - 생일에 30만원 제공 - 운동 및 자기 계발비 50% 제공 - 임원들은 주로 독단적으로 결정하기보다 모든 직원들의 의견을 듣고 수용 및 조절하는 경우가 많음. - 동료들이 시기 질투하지 않고 서로서로 도와주려고 하는 분위기 - 여의도 IFC몰과 현대 백화점이 있어서 밥 먹을 곳은 아주 많음 - 야근보다는 칼퇴하는 분위기이기때문에 저녁있는 삶 가능.
12,에스피에이치,4986,"점심 식대 개인법카 제공, 영어/중국어/운동 관련한 것에 대한 자기개발비 지원, 10시출근 6시퇴근"
13,에스피에이치,4986,"10시출근으로 지하철 널널 함. 이제 9시 출근 못할듯. 일만 마치면 6시 칼퇴 구글 캘린더에 휴가를 표시하고 자유롭게 휴가를 감, 남은 휴가일수 잘 모름 PPT, 발표자료, 보고서 템플릿 없고 형식보다는 내용위주, 세미나때도 각자의 양식 매년 봄 전직원 해외 워크샵가고 가서는 강제적인 단체행사 없어 힐링하고 놀다 옴 3년 근무시마다 1개월 리푸레쉬 휴가를 갈 수 있는데 유럽이나 휴양지로 잘 감"
14,에스피에이치,4986,10시 출근 6시 퇴근 자유로운 연차 사용 (별도 결재 없이 캘린더에 등록) 개인별 식대카드 제공 자기개발비 지원 3년 근무시 유급 한달 휴가 3년 주기로 refresh! 2년에 한번 건강검진 부족함 없는 간식 교육 및 세미나 참석 지원 도서 구입비 지원 상하반기 인센티브 지급
15,에스피에이치,4986,연차는 네이버폼 작성하고 구글캘린더에 일정 걸어놓으면 끝이어서 쓰기 쉬워요. 구글 캘린더에 걸어놓으면 이 사람이 연차 썼구나~라고 다들 압니다. 자기 업무 일정에 지장 없으면 자유롭게 사용 가능해요. 연차 눈치 절대 없습니다. 명절 전 날은 일찍 퇴근 시켜줘서 집이 먼 사람은 차 막히기 전에 갈 수 있어요. 12월 말에는 크리스마스 전에 종무식하고 전체 쉽니다. 2019년에는 12월 24일에 종무식하고 1월 1일까지 쭉 쉬었어요. 밥이나 음료 사먹으라고 개인 식대 체크카드를 줍니다. 출근시간이 10시까지에요. 10시 딱 도착해도 됩니다. 모르는거 질문하면 다들 잘 알려주세요. 이것저것 배울 기회가 많아요. 생일자 법인 카드로 30만원 이하로 선물 마음대로 사는 복지 있습니다.
16,에스피에이치,4986,"주 35시간의 근무시간, 연차 자유(진짜 캘린더에 올려놓기만 하면 됨) 생일에 30만원 이내의 선물 운동이나 외국어를 배울 수 있는 복지비 수평적인 분위기 매년 성과에 따른 인센티브 지급 등등 회사에 더 바랄게 없는 정도"
17,에스피에이치,4986,"1. 당일 연차 사용 가능. 이유조차 안물어볼 때가 더 많다. (팀 바이 팀) 2. 10-6시의 근무시간. 3. 야근 거의 안함. 바쁠때 제외. 4. 자기계발비 120만원 지원. (운동/외국어/기타 공부 자기부담금 50%) 5. 간식+네스프레소+비품도 거의 다 사주는 편. 간식도 사달라는 걸로 사줌. 6. 개인법카로 매달 점심 식대 17만원 지원. 밥말고 다른 데에 써도 되는데 평일에만 사용 권고. 7. 1년에 2번 연봉 외 인센티브 지급. (2월 상여+8월 휴가비) 8. 입사 3년마다 리프레쉬 휴가 지원 (10일. 기존 휴가+10일 합쳐서 사용 가능.) 10. 생일 때 30만원 한도로 선물 구입가능. 11. 연말에 크리스마스+주말 잘 맞추면 4,5일 정도 모두 쉰다. (개인 연차 사용) 12. 대체/임시 공휴일 안쉰적 없음. 13. 거의 매년 해외워크샵을 간다. 이름만 워크샵이지 비행기/리조트 예약해주고 알아서 노는 분위기라 더 좋다. 14. 인사를 강요하지 않음. 다들 조용하게 각자 이어폰끼고 일하는 분위기. 15. SI 프로젝트 진행시 파견이 default 가 아님. 가급적 내부에서 진행할 수 있게 영업함. 16. 프로젝트 외부진행시 법카 비용을 올려줄 때도 있다. (개발자 한정. 대표님이 가끔 까먹기도 함) 17. 회식+술 절대 강요 안함. 간다 하더라도 술보다 메뉴가 주고 되는 분위기이고, 2차부터는 안가는 사람이 더 많다."
18,에스피에이치,4986,"전체적으로 복지와 근무환경이 좋은 회사임 사람들도 전체적으로 분위기 비슷. 둥글둥글하고 배려할 줄 알고 커뮤니케이션 원활. 뭐 이런 사람들만 뽑는듯   - 10시 출근 6시 퇴근, 주 35시간 (9-6 일하는 사람 대비 한달 약 20시간 가량 더 자기 시간 있다고 생각하면 개꿀인 부분) - 점심 식대 제공 (도서구입, 편의점, 커피 등으로 사용가능. 근데 여의도 물가 안습.. 더 올려주세요) - 연차 사용 자유 (본인 일만 잘 끝내놨다면.. 이건 뭐 당연한 것) - 연 2회 인센티브 (상반기는 작년 성과별로 개인별로 다름, 하반기는 휴가비 정도로 동일) - 효율적인 업무 프로세스 (구글캘린더, 먼데이닷컴 등등 다양한 업무 툴 적극 사용으로 팀원간 소통 절차가 편함. 단순 보고를 위한 문서작업 없음) - 생일자 해당 달 30만원 사용지원 - 자기개발비 50% 지원 (개인 운동, 외국어 학습 등.. 퇴근 후 운동하는 직원이 대다수) - 업무 스킬 관련 교육, 세미나, 서적 100% 지원 - 간식비, 비품비 사용에 인색하지 않음. 항상 넉넉함 - 개인 업무 성과를 연봉 및 성과금으로 잘 반영해주는 편 - 연말 (12월 크리스마스 ~ 1월 신정 까지) 4~5일 가량 전직원 휴가 - 3년 근속 시 한달 리프레시 휴가  이 밖에 자유로운 근무환경, 수평적 조직문화가 강점인것 같다. 발언의 자유도도 높은 편임. 솔직히 팩트만 나열했는데 새삼 좋은 회사였단걸 깨달음  회사마다 다양한 복지제도가 있고 더좋은 회사도 분명 있을 것이나 복지제도가 유명무실하게 실제로 써먹을 수 없는 회사도 많다는 것에 비하면.. 감사하며 다니고 있음  규모는 작은 회사이나 업무 분담이 확실하고 개인별 역량이 다들 뛰어난 직원들이라 일하는 데 불편함 없고 좋음 계속 이렇게 좋은 방향으로 발전했으면.."
19,에스피에이치,4986,"10시 출근 6시퇴근의 주35시간으로 출근시 여유로움. 직급 체계가 존재하지만, 허울이라고 봐도 좋을정도로 발언에 자유롭다. 생일에 30만원 이내 금액에서의 생일선물 구입비가 지원됨.(요건 올해부터 시행함) 월 식대 법인카드가 나옴. 자기 개발비 지원.(본인 부담 반액, 근데 다쓰기가 힘듬..)"
20,에스피에이치,4986,본인의 할 일만 잘하면 자유롭게 회사생활을 할수있음. 자기개발비로 취미활동을 할수있음.
21,에스피에이치,4986,"연차 자유, 자기개발비 지원, 점심식대 제공(개인 법카), 수평적인 사무실 분위기, 팀 별로 업무 분담이 정확히 되어있으며 팀별 커뮤니케이션이 원활함"
22,에스피에이치,4986,"하루 7시간 근무 (10시 출근 ~ 6시 퇴근) / 운동 및 교육, 도서 구매비 지원 / 3년 근속 시 유급 리프레시 휴가 / 점심, 저녁 식대 제공 (법카 결제) / 매년 해외 워크샵 진행 / 눈치 안보고 업무 조율 잘 한다면 연차 사용 원활"
