,company_name,company_id,review_text
0,에스제이씨성전,12989,오너일가의 자기 밥그릇 챙기기에 열을 올릴때에도 직원들은 맡은 바 최선을 다하는 모습이 좋았다.
1,에스제이씨성전,12989,자차가 있다면 서울이나 경기 남부권 대비 출퇴근이 비교적 쾌적하였음
2,에스제이씨성전,12989,"점심, 저녁식사는 무료로 제공. 오래된 업력에 비해 시설은 노후화되지 않음."
3,에스제이씨성전,12989,진짜 가족같고 편안한 분위기 속에서 일할수있다. 개인적으로 식사가 다른 회사에 비하여 맛이 있다고 느껴지며 나름 인쇄업계에선 체계가 잘 갖춰있는 회사.
4,에스제이씨성전,12989,"비상식적이고 무모해 보이지만, 최고 경영자의 추진력과 업계의 관행을 넘어서는 결정력은 때론, 업계 안에서는 비난받을 일이어도 회사의 이익을 위한 부분이기에 소속되어 있는 직원으로써는 일을 수월하게 진행할 수 있음."
5,에스제이씨성전,12989,"중식, 석식이 제공되며 타 인쇄업체에 대비해 체계적이고 매우 깔끔하고 깨끗한 환경에서 근무할 수 있다."
