,company_name,company_id,review_text
0,에스알테크날러지,1527,새로지은 아파트형 공장이라 건물이 깔끔하고 간단한 편의 시설이 건물내에 있어 근무 환경 자체는 좋음
1,에스알테크날러지,1527,비교적 새건물에서 근무하게됨. 문서 작성 기술 및 요령은 배우게 될것임.
2,에스알테크날러지,1527,특별히 장점은 없으나 굳이 작성하려면 야근이나 주말 근무등 눈에 띠는 근무 활동을 하면 칭찬을 해줌.
3,에스알테크날러지,1527,사무실 분위기는 좋았습니다. 삭막한 분위기도 아니라 소속원들끼리 두루두루 친해질 계기가 많아 좋았습니다.
4,에스알테크날러지,1527,가족같은분위기와 작은회사임에도 급여가높고 이런저런 혜택들이 많다 말만 잘듣고 하라는대로 맞춰주면 좋은 회사
5,에스알테크날러지,1527,직원들이 정치질하는 사람이 없음. 본인 업무 외에도 다른 사람들 일 잘 도와줌.
6,에스알테크날러지,1527,야근이 별로 없고 개인주의라면 편한 회사.. 영업이라면 힘들듯
7,에스알테크날러지,1527,"9시반 출근, 급여 밀리지 않음 연차 사용 자유로움   장점이라곤 딱히.."
8,에스알테크날러지,1527,처음 입사한 사람들에게 무리한 일을 주지 않고 차근차근 잘 알려주시며 여유없이 촉박한 다른 회사에 대비 여유가 있는 편 해외 수출도 많이 하는 회사이기 때문에 미래 전망이 나쁘지 않은 것 같다. 사장님부터 대리님까지 모두 친절하게 대해주시고 꼰대나 정치질은 못느꼈다. 이상적인 회사
