,company_name,company_id,review_text
0,에프앤가이드,8586,야근이 없음 회사 외관이 이쁨 그냥 흘러가는대로 있으면 월급이 따박따박 들어옴
1,에프앤가이드,8586,"직원을 생각하는 복지가 점차 증진되고있음(교육비, 운동비 등)"
2,에프앤가이드,8586,"칼퇴근 할 수 있다. 마음먹고 뭔가 안하려고 하면 안 할 수 있다. 그냥 쏘쏘한 회사. 일 잘하는 사람 못하는 사람 다 있고 서로 개인적인 부분은 건드리지 않는 문화가 잘 되어 있음. 휴가를 길게 쓰는 팀도 몇 있음. 역이랑 가깝고 큰 도로에 근접하여 버스도 많아 서울외곽 치고 교통 불편하지 않음. 5호선 아니면 불편할 수 있음. 주차장이 있어 차 끌고 오는 직원도 있음. 혼밥문화가 잘 되어 있어, 혼자 먹는다고 흉 보거나 억지로 데려가지 않음."
3,에프앤가이드,8586,한적하고 깔끔한 동네에 위치했으며 무엇보다 회사가 새건물인게 가장 큰 장점. 경쟁사가 딱히 없다보니 열심히 일 안해도 매출에 큰 영향 없으며 다들 대충일하기 때문에 사내에서도 별 문제가 안생김. 복지가 점점 더 좋아지는 중. 막상 개인적으로는 쓰는사람이 별로 없긴하지만 고가의 금융정보 서비스를 임직원들은 무료로 사용할 수 있다.
4,에프앤가이드,8586,분위기가 나쁘지 않으며 대표님이 사원을 잘 생각해줍니다.
5,에프앤가이드,8586,"자유로운 연차 사용, 강하지 않은 업무 강도, 사람들과의 관계"
6,에프앤가이드,8586,꾸준한 수요가 있음 뭔가를 해보려는 노력? 단 체계적이진 않음
7,에프앤가이드,8586,워라벨과 눈치안보고 연차쓸수 있음 건물이 새건물이고 복지가 좋아지고 있음
8,에프앤가이드,8586,"남자가 매우 많으며, 업무 후 6시되면 다들 빠르게 퇴근하는 문화"
9,에프앤가이드,8586,"나쁘지 않은 급여 및 복지, 워라밸 근로자 친화적인 업무 분위기"
10,에프앤가이드,8586,"연차 눈치 안봄, 휴가 자유롭게 쓸수 있음, 워라밸이 좋음."
11,에프앤가이드,8586,"연차 편하게 사용할 수 있음, 출퇴근 시간 조절, 자율복장 등등"
12,에프앤가이드,8586,"사옥이 쾌적하고, 자유로운 분위기. 워라밸이 좋음 직원 분들이 다 좋으심 칼퇴가 보장됨"
13,에프앤가이드,8586,회사 건물이 자사 건물이라서 편했음. 연차 쓸 때 눈치 안보고 쓸 수 있어서 좋았음.
14,에프앤가이드,8586,"연1회 상여 지급, 교육비 지급, 운동비 지급 자유로운 연차사용"
15,에프앤가이드,8586,기업 문화는 수평적에 가깝고 안정적인 캐쉬 기반이 있음. 근무시간을 선택할 수 있어서 본인에게 편리하게 출근을 할 수 있음. 야근 같은 경우는 본인 능력여하에 따라 안할 수도 있다.
16,에프앤가이드,8586,윗사람 눈치 안보고 연차 쓸 수 있음 복지가 늘어나는게 눈에 보임 칼퇴칼퇴칼퇴 워라밸 최고
17,에프앤가이드,8586,사무실이 새 건물이라 좋으나 층별로 사람이 너무 많은곳도 있고 편차가 있음
18,에프앤가이드,8586,연차 맘대로 하도 뭐라하니까 이젠 연봉은 매년 잘 챙겨주러고 함 일부 부서 제외하고 칼퇴 가능 회식 강요 없음 서로 터치안하는 분위기 합병하고 많이 개선된 기업문화 업계에서 알아주는 브랜드 파워보유 시장독점. 망할일 없는 회사.
19,에프앤가이드,8586,지금은 모르겠으나 대부분 정시퇴근이 가능 신사옥이어서 깨끗함
20,에프앤가이드,8586,1. 부바부긴 하지만 야근이 잘 없음. 2. 중소기업 중에서는 초봉이 좋은 편. 3. 사옥에서 지내기에 다른 회사를 마주칠일이 없다.(자회사였던 회사 제외) 4. 수년내에 영등포쪽으로 회사를 이전하여 접근성이 나아질 것으로 예상한다. 5. 같이 일하는 사람들은 몇몇을 제외하고 좋은 편이다.
21,에프앤가이드,8586,IT기업과 금융사의 분위기가 합쳐진곳이라고 생각되며 무거운 환경은 아닙니다
22,에프앤가이드,8586,연차 출퇴근 눈치 안봄. 근무 환경 좋음. 커피 휴식시간 자유로움. 좋은 사람들. 해보려는 문화.
23,에프앤가이드,8586,"기업한줄평에도 적은 장점들과 자율복장, 업무 분담제 덕분에 간섭이 최소화 되는 환경이 좋았음. 연도별 신입 연봉테이블이 계속해서 빠르게 올라가는건 긍정적."
24,에프앤가이드,8586,부바부이긴 하나 퇴근을 빨리 할 수 있음 바쁜 부서는 매번 야근 연속인듯
25,에프앤가이드,8586,"- 재택가능 - 워라밸 양호한 편 - 코스닥 상장기업 - 대체로 정규직이며, 나름 안정적임"
26,에프앤가이드,8586,출퇴근 시간은 생각보다 잘 지켜준다. 연차를 내는것도 자유로운 편이다. 업무의 대한 자율성이 어느정도 있는편이다
27,에프앤가이드,8586,개발기본을 공부하고 업무를해볼수있다. 그리고 금융권 업무를경험흘수있다
28,에프앤가이드,8586,사옥있음. 칼퇴보장. 자유로운 업무. 자유로운 복장. 업무구분확실. 좋은 팀장.
29,에프앤가이드,8586,워라벨이 최강이다 퇴근시간 되면 모두들 나간다. 음료는 시키는 대로 다 사준다. 그리고 점심시간이 한시간반인것이 장점이라면 장점 이겠지만 이건 사람마다 다른듯.
30,에프앤가이드,8586,"육아휴직 다 챙겨서 쓸수있음, 연차사용 팀바이팀이지만 비교적 자유로움, 칼퇴근 대체적으로 가능, 명절 상품권 지급"
31,에프앤가이드,8586,팀바팀이나 연차 사용 자유롭게 가능한편. 진짜 업무로 바빠서 못 쓰는것이면 몰라도 충분히 쓸수 있는 휴가 눈치줘서 못쓰게 해서 강제로 출근시키는 분위기는 아님.  신사옥이라 깨끗함.
32,에프앤가이드,8586,연차를 자유롭게 쓸 수 있다. 거의 대부분 다 칼퇴근 특정 부서는 야근함. 직원들 대부분 성격이 좋다.
33,에프앤가이드,8586,눈치 보지 않는 연차 사용. 자기계발비용 지원. 좋은 부서 분위기.
34,에프앤가이드,8586,"알바 기준) 재택 근무가 가능함, 하는 일에 비해 페이가 나쁘지 않음"
35,에프앤가이드,8586,연차 눈치 안보고 사용 가능. 칼퇴 가능.업무 강도 높지 않음
36,에프앤가이드,8586,다양한 경험을 쌓기 좋음 신사옥이어서 쾌적함 연차가 높은 사람이 많음 정시퇴근 가능
37,에프앤가이드,8586,사람들이 대체로 모나지않아 동료직원들에 대한 스트레스 없이 일할 수 있음. 한 몇년 해보면 전체적으로 일 자체의 난이도가 별로 어렵지 않음. 시장에서 독점적인 지위를 가지고 있어 타사와의 경쟁에 대한 스트레스가 별로 없음. 신사옥이라 건물이 쾌적함. 전체적으로 과거에 비해 발전하고 있는 중.
38,에프앤가이드,8586,개인주의적인 문화 정제된 금융데이터에 상대적으로 자유롭게 접근 가능한점
39,에프앤가이드,8586,윗사람 눈치 안보고 연차 사용가능. 비교적 출퇴근 편함.
40,에프앤가이드,8586,연차를 자유롭게 사용 가능하고 어무 강도도 높지 않음 노력 여하에 따라 많은 경험을 해볼 수 있고 동료들도 좋음
41,에프앤가이드,8586,본인 업무 지장 안가는 선에서 휴가 편하게 사용 가능 원하면 오래 다닐 수 있음
42,에프앤가이드,8586,가끔 멘토가 될 사람이 있음. 물론 그런 사람은 오래 다니지 않음.
43,에프앤가이드,8586,6시 퇴근 시간 이후에 고개를 들어보면 자리에 아무도 안남아 있는 기젹의 워라벨
44,에프앤가이드,8586,팀마다 다르겠지만 워라벨이 어느정도 보장됨. 마곡 근처에 사옥이 있어 쾌적한 환경에서 업무 가능
45,에프앤가이드,8586,동료들이 대부분 성격이 좋고 날서지 않았음. 중기업치고 연봉이 낮은편은 아님.
46,에프앤가이드,8586,"나름 괜찮은 수익구조를 가지고 꾸준히 성장하는 회사, 노력하면 많은것을 배울수도"
47,에프앤가이드,8586,자유로운 연차사용 점점 늘어가는 복지 야근이 많지않음 회사소유의 신축건물
48,에프앤가이드,8586,워크 앤 라이프 밸런스가 잘 맞춰져 있음. 본인 업무 끝나면 보통 칼퇴하는 분위기. 휴가 사용도 특별한 일 없다면 자유재량. 여성 직원들은 산후휴가도 많이 신청해서 사용하고 있음.
49,에프앤가이드,8586,"금융데이터를 마음대로 쓸 수 있음, 퇴근 빨리 할 수 있음, 복장 자율, 코스닥 상장사임, 휴가 사용 자유(근데 휴가중에 일 시킴)"
50,에프앤가이드,8586,"건물이 좋음, 눈에 보이기식 짜잘한 복지, 합병을 통한 독과점, 상장을 통한 우리사주, 인덱스 사업 장점, 금융데이터 접근성 좋음. 회사 마케팅에 대한 노력?. 합병 후 회사 성장성에 대한 고민을...하는듯."
51,에프앤가이드,8586,작지만 꾸준한 매출을 기록하는 회사 시장에서는 나름대로 입지가 있는 회사
52,에프앤가이드,8586,워라밸이 좋음 연봉은 별로 직원들은 대체로 좋음 젊은 직원들이 많음 업력이 길고 망하지는 않음
53,에프앤가이드,8586,아무생각없이 다니기 좋음. 부모님이나 배우자가 돈을 잘번다면 그냥 구색맞추면서 다니기에 안성맞춤. 사고치지 않는 이상 짤릴일도 없고 시장에서 독보적인 점유율을 차지하고 있어 내가 다니고 있는 동안 망할일 없는 안정적인 회사임. 업계에서 을의 위치지만 뭔가 을이 아닌듯한 기업. 증권 및 자산운용사 다니는 지인들이 있으면 신기하게 혹은 부러운 눈치로 바라봄.
54,에프앤가이드,8586,직원들이 웬만하면 6시에 퇴근할 수 있는 회사임. 노가다 업무가 주업이다보니 업무 마감 시간을 넘겨 일하기는 체력적으로 어려움. 유일한 장점이라면 6시에 퇴근할 수 있다는 것?
55,에프앤가이드,8586,"팀바팀이지만 자유롭게 연차 사용 가능, 복지도 매년 확대하고 있으며, 워라밸 보장(팀바팀이지만 웬만하면 다 칼퇴하는 분위기). 특히 유아휴직 등 휴직 제도도 잘 되어있고, 나름의 유연근무제를 실시하여 대학원 다니는 분들 혹은 자녀들 등하원 등 필요에 맞춰 퇴근시간 조정이 가능. 연봉도 업계 수준으로 많이 올리려고 노력하고는 있음."
56,에프앤가이드,8586,"아래 열거한 수두룩한 단점들에도 불구하고 워낙 기존 사업(금융정보, 인덱스)이 막강해서 최소한 현상유지는 하는 회사. Free한 사내 분위기. 사내/회사근처 분위기가 한적해서 조용한 분위기 좋아하는 사람에게는 딱 좋은 회사일듯. 워라벨 최최상."
57,에프앤가이드,8586,수평적인 사무실 분위기 중소기업이다보니 팀장 직급까지도 젊으신 분들이 많아서 전체적으로 사내문화는 좋은 것 같습니다. 그리고 이건 팀마다 다르겠지만 본인 할일이 다 끝났다면 칼퇴가능합니다.
58,에프앤가이드,8586,새건물이라 깨끗하고 복지가 나름 괜찮음. 퇴근시간이 빠름.
59,에프앤가이드,8586,연차 쓸 때 눈치 보지 않아도 되고 정시퇴근이 가능한 것이 장점
60,에프앤가이드,8586,"스스로 학습할 수 있는 분위기가 조성되어 있어 노력 여하에 따하 자기계발의 문이 항상 열려 있으며, 수평적인 조직문화 형성을 위해 노력하고 있습니다."
61,에프앤가이드,8586,웬만한 팀은 연차 눈치안보고 쓸수 있고 연봉도 금융권(금융권+빅데이터+IT 등의 혼종)치고는 적지만 그래도 웬만한 문과생이 갈수있는 중견기업보다는 많이준다. 나머지는 뭐 그냥저냥 지내기 좋음. 회사도 우리나라 동종업계 독점이라서 망하는 일은 없을듯. 증권데이터 리포트 등 이거저거 다뤄봐서 나중에 다른 금융권 이직하기도 좋다
62,에프앤가이드,8586,업계사람들과 접점이 넓다. 보여지기엔 좋아보임. 금융지식 활용도 높으나 부서 바이 부서로 업무인수인계가 잘 되지않아 버거운 점. 친화적인 분위기를 만드려고 노력. 합병후 규모적으로 커짐. 사옥 좋음. 겉으로만 좋아보이는 복지
63,에프앤가이드,8586,"팀 분위기에 따라 다르나 비교적 자유롭게 연차 사용할 수 있으며, 야근이나 주말근무 등을 할 일이 비교적 없는 편이나 팀장에 따라 분위기가 많이 다름. 합병 후, 새건물이라 환경이 쾌적하고, 독점 위치인지라 성장은 계속 할 듯."
64,에프앤가이드,8586,"배울것이 많고 방대한 db활용 가능, 자유로운 분위기, 신사옥, 근처 맛있는 밥집 많음, 시설 굿, 다양한 증권 자산운용사와 컨텍"
65,에프앤가이드,8586,최고의 복지 칼퇴. 그 외엔 없음.최근 합병 이슈로 발전이 기대됨 .
66,에프앤가이드,8586,휴가 눈치 덜봄 칼퇴근 가능 새건물 주변상권 좋음 개발단지이며 서울식물원이 보임 병원 가까움
67,에프앤가이드,8586,"개인 위주다 보니 간섭이 심하지 않음, 직원에 대한 관심이 적다보니 그만큼 자유로움"
68,에프앤가이드,8586,데이터 회사라 안 망함. 급여 밀리지 않음 안정적 칼퇴가능
69,에프앤가이드,8586,비교적 자유롭고 수평적인 분위기. 자기계발에 직원을 많이 해줌. 사업모델은 비교적 안정적이고 최근 경쟁사 인수합병으로 사업 안정성 확보.
70,에프앤가이드,8586,비교적 업무환경이 자유롭고 본인의 업무를 문제없이 처리한다면 간섭이 적음.
71,에프앤가이드,8586,"작지만 안정적인 고정매출, 아직까지는 유효한 브랜드네임? 사업다각화 꾸준히 시도중"
72,에프앤가이드,8586,"칼퇴근 시켜 주는 회사, 프로그래머들 연봉이 생각보다 괜찮은 회사, 자유로운 휴가 사용, 근무강도가 아주 빡세지는 않음"
73,에프앤가이드,8586,- 야근이 없는 문화. 임원급도 늦게 퇴근하거나 야근 강요하는 사람 없으며 6시면 거의 대부분의 직원이 퇴근하고 개인 휴가도 별 제약 없이 쓸 수 있는 분위기. 임산부 단축근로나 육아휴직 등도 대부분 사용 가능. - 정규직 채용 위주. 계약직 뽑더라도 1년 이내 정규직 전환하는 등 고용 안정성 높은 편. - 고객사 이탈이 적고 안정적인 매출을 시현하고 있어 재무적으로 상당히 안정된 편. - 2018년에는 사옥 신축하여 이전 예정으로 업무 환경이 개선될 것이나 금융권 중심인 여의도에서 서울 서부권인 마곡으로 이전하는 거라 장점일지 단점일지는 관점에 따라 다르게 해석할 듯.
74,에프앤가이드,8586,상사의 눈치 없이 정해진 퇴근시간에 퇴근이 가능하며 정말 야근 및 주말출근이 거의 없음. 퇴근 시간이후에 남아있는 인원은 손가락에 꼽을 정도로 업무시간에 대한 장점이 우월함. 임원을 제외한 인원들간의 상하관계가 딱딱하지 않고 어느정도의 예의만 지킨다면 상하관계에 얽매이지 않는 자유로운 관계.
75,에프앤가이드,8586,상사눈치안보고 칼퇴가 가능. 직원의 목소리에 많이 귀기울이는 편. 의지만 있다면 업계의 방대한 데이터를 경험할수있는 환경.
76,에프앤가이드,8586,팀에따라 다르지만 연차쓰는건 거의 자유로움. 칼퇴도함. 원래 한시간씩 초과근무를 하고있었는데 이제 그런거 없이 퇴근시켜준다고함.
77,에프앤가이드,8586,급여가 밀리지 않음. 일은 원없이 할 수 있음. 그것 외엔 없음.
78,에프앤가이드,8586,회사 경영진이 스마트하다 잘되고있다. 회사가 상장도하고 잘나간다. 부수입이 있을수있다
79,에프앤가이드,8586,부서마다 다르지만. 금융과 it를 동시에 배울수 있다. 신입들이 교육을 받고 증권사나 운용사로 이직하는 경우가 종종 있다.
80,에프앤가이드,8586,자기계발 비용지원 등 직무에 필요한 교육 지원을 잘해줍니다. 임직원 평균나이가 젊은층으로써 사내 분위기가 좋습니다.
81,에프앤가이드,8586,"근무하기 좋은 건물, 좋은 위치에 있으며, 국내 금융 데이터를 통해 분석가로서 역량을 키울수 있는 곳 육아 휴직 등 나름 챙겨주는 거 있음 대표님 인맥이 넓음"
82,에프앤가이드,8586,팀별로 차이는 있지만 본인이 하는 일만 제대로 마치면 정시 퇴근 가능. 사람들이 무난한 편.
83,에프앤가이드,8586,아이티쪽은 금융데이터가 많아 본인 의지만 있으면 업무공부가 가능. 칼퇴가능.
84,에프앤가이드,8586,"비교적 빠른 퇴근이 가능, 부서 이동이 가능 하여 다양한 업무 가능"
85,에프앤가이드,8586,이 회사가 가지고 있는 비지니스 모델 자체는 좋다고 생각함.
86,에프앤가이드,8586,시장 경제가 흘러가는 상황 및 증시 정보 파악이 용의함.
87,에프앤가이드,8586,"방대한 금융데이터, 안정적인 재무구조"
88,에프앤가이드,8586,일하는 성과만큼 인정받고 욕심이 있으면 주도적으로 일할수있음
89,에프앤가이드,8586,"자기 개발 비용지원, 회사에서 출시하는 금융상품의 가입 금액 지원 등의 복지 지원, 일부 부서의 특정 업무 외에 업무 강도가 높지 않음. 금융 데이터를 접할 수 있음."
90,에프앤가이드,8586,부서마다 다르지만 다른 회사에 비해 칼퇴근을 눈치 보지 않고 할 수 있습니다.
91,에프앤가이드,8586,"회사에 현금이 많고, 비교적 안정적으로 수익을 창출하고 있음. 업계에서 알아주는 회사이고, 나름의 위치를 가지고 있어 자부심이 있음."
92,에프앤가이드,8586,금융과 IT가 만나는 곳. 크기를 알 수 없는 가능성이 존재하는 곳.
93,에프앤가이드,8586,부서별 업무강도는 다르지만 강제로 야근하라는 식은 없으며 자기 스케줄 잘 관한다면 칼퇴 눈치 안봅니다. 사내에서 하는 금융에 대한 교육을 받을 수 있습니다.
94,에프앤가이드,8586,직원들의 평균 연령이 낮아서 젊은 분위기가 느낄 수 있다. 업무적으로는 수많은 금융데이터를 직접 다룰 수 있는 기회가 많아 실력 향상에 도움이 된다.
95,에프앤가이드,8586,국내 금융 관련 거의 모든 데이터가 있는 만큼 활용할 수 있는 여지가 크고 배울점도 많음
