,company_name,company_id,review_text
0,위즈베이스,207,사람들이 대체로 유하고 갑질하는 사람이 없어서 그건 좋았습니다.
1,위즈베이스,207,전문 컨설팅 조직과 많은 전문가들이 있었던 회사로 기억
2,위즈베이스,207,"회사 위치가 전반적으로 좋고 복지, 워라벨 등 직원 입장에서 생각을 해준다."
3,위즈베이스,207,수평적인 분위기이고 잘해주려고 노력하신다. 나이대에 비해 큰 꼰대 문화는 없습니다.
4,위즈베이스,207,수평적인 분위기 연차 및 출퇴근 문화가 자유로움 경력이 쌓인 사람들은 다니기 편한 곳
5,위즈베이스,207,프로젝트 투입기간이 아니면 연차 눈치 없이 쓸 수 있음 사내 카페테리아 등등이 좋음 난 개인적으로 사람들이 좋았음 결혼하면 직원들 경조사비를 월급에서 강제로 때서 400-500정도 받을 걸로 예상됨
6,위즈베이스,207,힘들어도 서로 함께하는 분위기 가족같은 분위기 안정된 수입구조
7,위즈베이스,207,"경영진에 대한 신뢰가 높고 사내 분위기가 좋은 편임. 경영진이 엔지니어 출신이다 보니 강요하는 분위기가 없으며 자신만 열심히 하면 안정적이고 자유로운 분위기에서 직장생활이 가능하다. 또한 4차산업과 관련 핵심 아이템을 진행중이며, 인큐베이팅을 거쳐 본격적으로 진행중인 단계로 기존의 단단한 컨설팅 사업과 더불어 양축으로 향후 성장성이 긍정적으로 판단됨."
