,company_name,company_id,review_text
0,이데아인포,4217,자유로운 분위기와 협업을 통해 다양한 경험을 할수있어요.
1,이데아인포,4217,경조사에 관해서는 관대한편인듯 함 각 개인별로 친한 분위기가 있어 분위기 자체는 긍정적임
2,이데아인포,4217,연차를 윗사람 눈치 안보고 쓸 수 있지만 연봉이 너무 적고 업무 강도가
3,이데아인포,4217,신입 사원으로 이력 쌓기 좋은 회사. 다양한 업무 환경을 경험 할 수 있다.
4,이데아인포,4217,회사 구성원 모두 분위기 좋음 과장 차장 부장급에서 알아서 일을 처리해서 편안함 회사에 필요한것 요청하면 바로바로 처리해줌
5,이데아인포,4217,연차를 눈치 안 보고 쓸 수 있음. 다만 프로젝트 막바지에는 서로 조심하는 편. 대신 프로젝트 초기나 중반까지는 여유로운 편. 모난 구성원이 없어서 사람에 대한 스트레스가 적은 편이나 클라이언트의 성격은 장담하지 못함. 배우고 싶은 것이 있으면 적극적으로 어필해도 됨. 배우려는 의지가 강한 사람을 좋아함.
6,이데아인포,4217,업무가 힘들어서 서로 도우려는 면은 있습니다. 하지만 신입은 이 환경에 끼는건 조금 시간이 걸리고 적응을 해야합니다.
7,이데아인포,4217,"도서구입비, 자유로운 연차, 명절마다 떡값, 동호회도 존재."
8,이데아인포,4217,"대체적으로 수평적인 업무 분위기 동호회, 회식 등을 통한 분위기가 좋음"
9,이데아인포,4217,혼자 일 할 수 있어서 집중이 잘됨. 직원들의 불만을 실행은 안되지만 잘 들어줌
