,company_name,company_id,review_text
0,이스톰,5423,음... 지하에 빌딩 구내 식당이 있는데 6500원으로 싸고 매일 바뀌는 메뉴이다보니 점심 뭐먹을지 고민 안해도 되는건 장점
1,이스톰,5423,월급여가 밀려서 지급되진 않았던 점이 유일하게 좋았던 점
2,이스톰,5423,월급을 못 받거나 밀린 기억은 없고 수습기간이 따로 주어지지 않아서 처음 부터 100%지급 받음 생일에 백화점 상품권 3만원 지급
3,이스톰,5423,윗사람 눈치 안봐도 될정도로 수직적이지 않고 수평하며 모두 친절하게 대해주고 눈치안보고 연차사용이 자유럽다
4,이스톰,5423,다양한 업무 경험을 쌓을수 있고 새로운 프로젝트의 경험을 할수 있는 장점
5,이스톰,5423,시간 9시 기준으로 야근한 시간만큼 다음 날 30분-1시간정도 늦게 출근할수있습니다
6,이스톰,5423,연차사용시 눈치 보지 않고 사용 가능합니다. 전자 결재 시스템을 사용하고 있습니다. 출근시간 조정 가능합니다.
7,이스톰,5423,자기개발 지원과 수평적 분위기가 좋았던 것으로 기억합니다.
8,이스톰,5423,"윗사람 눈치 안보고 연차 사용 가능, 나름 안정적인 수익원이 있어 월급 걱정은 없음, 나름 자유로운 분위기와 직원들이 착함"
9,이스톰,5423,"연차, 반차, 자유롭게 사용가능하고 복장자유롭고 나쁘지않아요 각자 본인업무에 충실하면되요"
10,이스톰,5423,사무실 등 근무환경을 깔끔하게 유지하고자 노력함. 직원들간 분위기 나쁘지 않음.
11,이스톰,5423,윗사람한테 어떻게 하느냐에 따라 연봉을 잘 올릴 수 있음
12,이스톰,5423,"정부과제를 함으로써 짧은 시간 내에 많고 다양한 문서를 작성할 수 있는 능력을 키울 수 있고, 기량이 좋은 몇몇 개발자와 협업을 하며 개발 스킬을 늘릴 수 있음. 사내에 제빙기와 카페를 이용할 수 있음."
13,이스톰,5423,회사 분위기 자체가 좋아보이는건 성격 좋은 분들이 많아서임 연차쓰는거에 대한 눈치는 주지않지만 복지라고는 이게 끝. 분위기는 자유로운 편임 그만큼 서로한테 신경 잘 안씀
14,이스톰,5423,연차 눈치안보고 자유롭게 쓸 수 있음. 크게 터치 없음
15,이스톰,5423,사무실이 깨끗한편이고 나이대가젊다 그리고 없다 구지 뽑자면 엘리베이터 있는게 장점?
16,이스톰,5423,비어있는 자리가 많아서 책상을 넓고 편하게 쓸 수 있다.
17,이스톰,5423,월급안밀리는게 최고의 장점이라고 회사측에서 말하는 장점입니다.
18,이스톰,5423,특별한 장점은 생각이 안 나는데 대표가 젊고 사람들 인상이 좋은 편이었음
19,이스톰,5423,외산 솔루션 및 프로그램에 대한 진보적인 도입은 잘 하고 있음.사장이 영어 잘함
20,이스톰,5423,사람들이 그래도 착한사람이 있는편.. 연령대가 젊은편? 인성이 좋은사람들도 있음 그외 없는걱 같은데 어떻게 장점을쓰지.
21,이스톰,5423,업무진행과정에 있어 자유로움 보장. 댓니 결과는 책임져야 함. 야근은 개인의 선택
22,이스톰,5423,연령대가 낮은 사람들이 많고 주력으로 삼는 사업 및 분야가 뚜렷함
23,이스톰,5423,그냥 뛰어나지도않고 밀리지도 않는 무난한 환경. 예전엔 퍼블리셔에 가까운 회사였는데 개발팀을 구해 자체 솔루션도 구축한듯
24,이스톰,5423,월급은 꼬박꼬박 나옴. 품의한거 잘나옴. 직원들간의 협업이 잘됨. 회사가 인원에 비해 넓음. 연차나 반차는 지장없이 사용. 작게라도 생일축하 해줌. 명절때 10만원 상당의 상품권을 줌. 실력 좋은 인재들이 많음.
25,이스톰,5423,직원수에 비해 사무공간이 넖은 편입니다. 근무하시는 분들이 좋은 편입니다
26,이스톰,5423,사람들이 좋아 다닐만 함 출퇴근 눈치 안 봄 으쌰으쌰 분위기
27,이스톰,5423,알고보면 착한 사람들도 있다. 그러나 그건 정말 몇명이며 대부분 열정가득한 신입과 2~3년차들. 열정을 핑계삼아 다들 윗선에서 떠넘기고 지쳐 떠난사람들이 하던걸 제대로된 인수인계도 없이 마무리짓느라 지쳐있음.
28,이스톰,5423,카페테리아 있음 연차있음 대체로 분위기가 조용하고 직원들끼리 서로 간섭하지 않는 자유로운 분위기
29,이스톰,5423,복지를 챙겨주려고 우선적으로 먼저 물어보지만 회사 시설과 함께 연봉은 글쎄
30,이스톰,5423,1. 보수성향을 가지고 있는 사람이라면 아주 좋은회사 연차가 있는 사람이라면 생산직처럼 일할수 있는 장점을 가지고 있습니다.  2. 핀테크 사업부분에 조만간 성공의 빛을 볼수 있을꺼 같음 즉 지금 시기에 들어가면 차후 연봉 협상의 아주 유리한 조건을 만들 수 있을꺼 같습니다.  3. 회사에 능력자들이 많이 포진되어 있음 사회 초년생이라면 아주 많은것들을 접해 볼 수 있는 기회가 많음 추후 이직에 있어서도 많은 도움이 되리라 봅니다.
31,이스톰,5423,"자유롭고 상호존중의 분위기, 유연한 조직구조, IT전반에 걸친 다양한 사업에 대해 경험하기 좋음"
32,이스톰,5423,라인을 잘 타면 승진 또는 연봉 인상률은 좋아 보임 특별한 복지는 없지만 정기적으로 하는 단합대회 같은 단체 모임 정도 있음
33,이스톰,5423,업무 공백이 생길경우 공원 충족이 빠름 ... 사회 초년생이 1-2년 경력만 쌓기엔 적당한듯. 하지만 그만큼 퇴사도 빠름
34,이스톰,5423,다양한 경력의 인제들로 배울 수 있는 점이 많으며 팀 내 단합이 좋음
35,이스톰,5423,다양한 아이템으로 솔루션 개발을 시도하는 회사로 능력이 된다면 신규 솔루션을 개발할 기회를 갖게될수 있음
36,이스톰,5423,나름 자유로운 분위기로 인한 사회생활 가능
37,이스톰,5423,개발 디자이너와 파트너쉽 업무 상사에게 배울 수 잇음
38,이스톰,5423,업무 시간내에 일하여 야근이 없습니다. 체계적으로 분야를 나눠 일합니다.
39,이스톰,5423,분위기가 자유롭습니다. 업무를 함에 있어 불편이 될 것이 없는 편이라 마음적으로 편하고 좋습니다.
