,company_name,company_id,review_text
0,조인스엠,10765,"오래전에 퇴사를 해서 현재는 많이 달라졌겠지만 규모에 비해 직원들의 복지를 개선해주려고 많이 생각하는것처럼 느껴졌습니다  음료,우유 등 제공되고 상여금도 꽤 많이 주었으며, 식비 제공되었습니다"
1,조인스엠,10765,"중소기업 중에서는 복지가 좋음 주2회 재택, 탄력근무제로 출퇴근 자유로움"
2,조인스엠,10765,"근무시간 자율, 재택근무 고정과 비고정으로 가끔 추가 재택근무. 야근수당 법적인 것은 잘 준수하는 편. 급여문제 없고 점심 밥값 제공. 같이 일했던 사람들이 좋았음. 타팀과는 그닥.. 그래도 오래 다녔고 회사 자체는 괜찮았던 기억."
3,조인스엠,10765,"페이퍼 작업부터 온라인, 오프라인, 웹기획 등 여러가지를 배우고 경험해볼 수 있어서 이직에 도움이 되었습니다. 야근이나 영업 같은건 안하구요"
4,조인스엠,10765,"근로기준법 준수, 점심 제공, 여름휴가 별도제공, 커피 제공"
5,조인스엠,10765,야근 거의 없고 편하게 다닐 수 있어요. 일 어렵지 않으나 그만큼 배우는 것도 많지 않아요.
6,조인스엠,10765,중소기업 치고는 최고의 복지를 갖추고 있음 월금 재택이 제일 메리트 큼
7,조인스엠,10765,업무 난이도 자체는 높지 않은 편이라 크게 야근할 일이 거의 없습니다. 복지가 동일 중소기업에 비하여 좋은 편이며 복지는 꾸준히 개선해 가려는 의지가 높은 기업이라 생각합니다.
8,조인스엠,10765,"사내 복지나 문화에 대해서 신경을 많이 써주고, 워라밸이 괜찮다."
9,조인스엠,10765,남들 쉴때 쉬고 명절 전날 일찍 퇴근시켜주고 밥주고 재택하고 업무 난이도 평이하고 모난 사람 없고 월급 안밀리고
10,조인스엠,10765,"재택근무,휴게실,점심식대지원,유연근로제,여유로운 점심시간 워라밸이 가능하고 본인의 의지만 있다면 배울수 있는 기회도 주려고 함."
11,조인스엠,10765,"금요일 재택근무 점심제공 연차사용 자유로움 커피머신, 스낵바 차 안막힘"
12,조인스엠,10765,최소한의 복지 유연근무제 쾌적한 화장실 스낵바 비교적 자유로운 연차사용
13,조인스엠,10765,"연차 사용 자유로움 . 식대 제공 , 금요일 재택 , 여름 휴가 제공"
14,조인스엠,10765,"워라밸 보장되고 본인이 의지만 있으면 이것저것 배울수있음. 금요일 재택근무,연차사용 자유로움"
15,조인스엠,10765,"중식을 제공해주며, 야근 수당도 지급해줍니다. 또한 사원들끼리 똘똘 뭉칠 수 있습니다."
16,조인스엠,10765,일정만 문제 없으면 개인 연차 사용 가능하고 연차 사용에 눈치주지 않습니다.
17,조인스엠,10765,"팀마다 다르겠지만 눈치 안보고 연차를 쓸 수 있었고, 회사 내에 다양한 음료가 구비되어 있다."
18,조인스엠,10765,연차 반차 반반차 등 휴가를 비교적 자유롭게 쓸 수 있음
19,조인스엠,10765,연차를 눈치 안보고 쓸수 있고 넓은 휴게실과 화장실 비데가 장점
20,조인스엠,10765,간식 제공 커피 제공 점심 제공 퇴직금 지급 연차 지급 재택근무가능
21,조인스엠,10765,그럭저럭 복지도 중소기업치고 나쁘지 않았음 초반에는 복지 가선을 위해 노력하는듯 했음
22,조인스엠,10765,"- 점심, 야근 시 석식 식대 제공 - 생일시 상품권 제공 - 야근 시 야근 수당 있음 - 일이 많아서 포트폴리오 쌓기 좋음  제가 다녔을 때를 기준으로 해서 위와 다를 수 있습니다."
23,조인스엠,10765,"음료, 간식 구비, 사무실 깔끔, 화장실 깔끔, 개인주의 성향이라 겉으로는 아무도 터치 안함. 가끔 빵같은 간식 들어옴"
24,조인스엠,10765,"중소기업 치고는 많은 혜택 근데 코로나 한방에 무너짐,청소해주는 아주머니가 계셔서 편함 다용도실에 커피랑 티 준비가 되어 있음. 점심도 회사에서 지원해 줘서 밥값 save~"
25,조인스엠,10765,"연차 자유로운 사용, 연장 근무 수당 제공,야근 교통비 제공"
26,조인스엠,10765,연차 사용하는데 자유로운 편. 식사시간이 1시간 10분이어서 이동시간 감안해도 쉴 수 있는 시간이 넉넉함 업무에 익숙해지면 어려움 없음
27,조인스엠,10765,다닐 당시에는 복지포인트 및 음료제공 등등 여러가지 복지가 있어서 좋았는데 지금은 모르겠다
28,조인스엠,10765,"유연근무제, 점심 식대 지원, 매주 금요일 자택, 생일 연차, 여름휴가 등 복지가 있습니다. 팀 내 분위기는 좋고 회식이나 술 강요 없고, 야근 별로 없고, 칼퇴나 연차 사용 눈치 안봐도 됩니다."
29,조인스엠,10765,연차 사용이 자유롭다. 편안하고 자유로운 분위기. 복장 자유.
30,조인스엠,10765,1. 업무가 어렵진 않기 때문에 첫회사로는 나쁘지 않음 2.월급은꼬박꼬박줌
31,조인스엠,10765,"연차사용 자유로움, 점심식대 제공, 월급 안밀리는거 외에 없음"
32,조인스엠,10765,"급여나 법적인 문제로 트러블이 생길일이 없다. 복장, 근무시간 등 자유로운 편이고 젊은 편이다."
33,조인스엠,10765,워라벨 좋다 칼퇴해도 눈치 주는 사람 없다 연차 반차 사용 자유 같이 일하는 사람들 괜찮다 중식 제공 회사 내 커피머신 간식
34,조인스엠,10765,"연차쓰는것, 백신휴가 쓰는 것도 눈치 안받고 자유롭게 쓰게해줌. 점심값도 주고 야근하면 야근수당도 주고 출장교통비 발생하는 것들의 기본적인것들은 잘 챙겨주는 편. 신사옥이라 건물 내부는 깔끔. 재택근무 가능. 사람들이 대체적으로 친절함"
35,조인스엠,10765,"주 3회 재택, 연차 사용 자유로움, 상여금 나옴, 월급 안밀림, 야근없음,"
36,조인스엠,10765,연차 자유로움 중소치고 복지좋았음 직원들 무난하고 나쁘지 않은 편
37,조인스엠,10765,연차를 눈치안보고 편하게 쓸수있습니다. 점심시간이 1시간20분으로 여유있는 휴식시간이 보장됩니다. 한달에 한번 셋째주 금요일은 오전근무 후 퇴근합니다.
38,조인스엠,10765,자유로운 연차사용 및 여름휴가 추가 제공. 사원 대리간의 관계가 우호적이며 편안한 분위기를 제공. 크게 어려운 업무가 없음.
39,조인스엠,10765,병원 전문 마케팅이라 일 배우면 전문적으로 할 수 있는 점
40,조인스엠,10765,"연차를 눈치안보고 사용 가능, 탕비실에 음료구비, 이것저것 복지에 신경써주려고 하는 느낌"
41,조인스엠,10765,"교육에 대한 지원이 있다는 점, 그리고 식대비 지원 정도"
42,조인스엠,10765,자유롭다 복지가 많다 점심식사 제공 청소 아줌마를 쓴다 카페테리아가 크다 옥상에서 휴식가능한 리프레시공간이 존재한다
43,조인스엠,10765,"법에 걸리는건 왠만하면 다 지킴 연차, 야근수당 지켜줌 젊은 직원 많음 업무 강도 심하진 않아 워라밸 조정 가능"
44,조인스엠,10765,"연차 사용, 야근수당 지급, 회사 위치가 좋음 ( 주변에 맛집 많음)"
45,조인스엠,10765,다 젊은 분들이여서 강요 문화가 없음. 서로서로 도와주며 놀거나 버스타는 사람이 없음
46,조인스엠,10765,- 연차 사용은 자유롭다. - 인간관계에 신경쓰지 않아도 됨.(장점이자 단점) - 의료 분야의 특수성을 배워볼 수 있는 곳. (의료 분야는 일반 대행사에서 경험하기 쉽지않음) - 사회초년생의 입장으로 생각해볼 때 아주 나쁜 곳은 아님. - 야근 없음 손에 꼽음
47,조인스엠,10765,단기간 동안 업무 양도 정해져있고 월급도 잘 들어와서 좋았다.
48,조인스엠,10765,"연차를 자유롭게 사용할 수 있고 1층 식당에서 점심식사, 1층 가든 또는 옥상에서 휴식이 가능합니다. 월 1회 오전근무(놀금), 복지포인트, 동아리 활동지원, 가을소풍, 팀 점심회식, 건강검진, 독감 예방주사, 경조사, 명절선물 및 상여금까지 중소기업 치고 다양한 복리후생이 있습니다."
49,조인스엠,10765,"연차 눈치 안봄, 내부에 음료가 많음, 인간관계에 큰 신경쓰지 않아도 됨"
50,조인스엠,10765,팀 바이 팀 이겠지만 재직했던 짧은 기간 동안 모난 사람이 없단 게 가장 큰 장점입니다.
51,조인스엠,10765,장점은 없고고인물 투성이 군대조직문화?? 그나마 장점이라곤 음료수가 많네요 ㅋㅋ
52,조인스엠,10765,- 점심 저녁(야근시) 공짜 - 성수 탐방할 수 있음 - 연차 사용 자유로운 편 - 야근 수당 나옴 - 20층이라 뷰가 좋음 - 월급 밀린 적 없음
53,조인스엠,10765,연차를 눈치보지 않고 사용. 점심식권제공. 급여 밀린적 없음. 대체로 선한 직원들(젊은).
54,조인스엠,10765,연차 눈치보지 않고 쓸 수 있음 그거 말고는 딱히 없는거 같네요
55,조인스엠,10765,"점심제공, 야근수당지급, 연차지급, 4대보험가입 너무 당연하게 해줘야할것들인데 장점에 쓸만한게 이것밖에 없네요. (복지포인트, 놀금, 음료냉장고 등등 20년 현재 복지란 복지는 다 없어졌습니다.)"
56,조인스엠,10765,중소기업이지만 나름 인원이 많고 사무실도 크다. 근무환경이 쾌적함.
57,조인스엠,10765,남직원이 들어가면 환영받을 곳. 야근수당/택시비 줌. 점심비 야근시 저녁비 지원 탕비실에 얼음정수기가 있음.
58,조인스엠,10765,복지 좋음 복지 좋은 큰 기업 따라하고 싶었던건지 탕비실 음료창고 잘 채워지고 사무실 청소 따로 불러주고 점심 제공하고 놀금이 최고로 좋았음
59,조인스엠,10765,밀린 적 없이 돈을 꼬박꼬박 줍니다. 명절때 아르바이트 하루씩 빼줍니다.
60,조인스엠,10765,미팅을 제외하면 복장이 자유로움. 점심식사 식대 쿠폰이 나옴. 야근 수당이 있음
61,조인스엠,10765,"중소기업 복지가 많은편 점심제공,한달에 한번 오전근무, +@(기본복지) 개인플레이 가능(조용히 회사 다니고 싶은분 추천) 사생활 보장 야근 없음"
62,조인스엠,10765,"연차 눈치안봄, 점심재공, 중소기업치고 비교적 괜찮은 신입연봉, 야근수당 나옴, 야근 많이 안함"
63,조인스엠,10765,"워라벨, 연차 외 여름휴가 3일 지급, 저녁있는 삶이 가능함, 운영자체는 합리적인 편."
64,조인스엠,10765,급여 제때 들어오고 업무가 어렵거나 복잡하지 않음 단순 반복이라서 금방 적응 할 수 있다.
65,조인스엠,10765,중소기업치곤 복지는 괜찮았으나 이거 빼면 아무것도 없는거 같음.
66,조인스엠,10765,자기개발 비용이 지원되며 야근이 많지 않은 편입니다. 회사 건물이 깔끔해서 좋습니다.
67,조인스엠,10765,연차를 자유롭게 쓸 수 있지만 일주일 전에는 꼭 얘기를 해 두어야 합니다. 탕비실이 넓고 음료가 많습니다. 펜스가 쳐있어 개인공간이 확보가 됩니다. 복지포인트등 나름 좋은 편입니다
68,조인스엠,10765,야근 수당이 있다는 것이 좋았고 회사라면 갖춰야할 기본적인 것은 갖춰져 있는것 같다
69,조인스엠,10765,연차 자유로움 금요일 재택근문  3시30분부터 휴게시간 긴 점심시간
70,조인스엠,10765,연차를 눈치안보고 쓸수있다..사무실이크다..점심제공해준다 음료제공 탕비실있음
71,조인스엠,10765,연차 사용이 비교적 자유롭다. 회사 건물이 깔끔한편(단독 사용은 아님)
72,조인스엠,10765,"칼퇴가 가능, 점심식대 지원, 탕비실 음료 지원 (우유, 음료 등)"
73,조인스엠,10765,복지는 생각보다 괜찮음. 평균연령이 높지않음. 워라벨을 적당히 맞출수있음
74,조인스엠,10765,연차와 여름휴가 있음 야근이 거의 없음 옷차림 자유이고 회식이나 모임을 자주 하지 않음
75,조인스엠,10765,"업무 분담 체계가 안정적, 회사가 새 건물이어서 쾌적한 근무 환경, 젊은 직원들이 많아서 회사 자체가 생기있는 분위기입니다"
76,조인스엠,10765,무난하게 다닐수 있음 일이 많지 않고 칼퇴 가능 일이 크게 어렵지 않음
77,조인스엠,10765,어느정도 자유로운 연차 사용 음료수 구비 문화생활비 지급 생일상품권지급 꽤 많은 명절보너스
78,조인스엠,10765,"매달 세번째 금요일은 오전근무만 하고, 반차/연차 사용 눈치보지 않고 사용할 수 있다. 회사 1층건물 식당에서 급식처럼 중식제공(점심시간 80분). 사람 성향에 따라 호불호가 갈릴 수 있지만 회식이 잦은 편은 아니고 가을 체육대회 또는 소풍, 송년회 겸 볼링대회 등의 행사가 있음."
79,조인스엠,10765,-자유로운 연차사용과 고용법 등 법률은 잘 지켜주는 점. 휴가 등의 복지가 중소기업임에도 굉장히 좋다.  -대체로 사람들이 좋다. 팀마다 차이가 조금씩 있겠지만 본인이 머물렀던 팀은 서로 잘 챙겨주는 분위기  -탕비실 사용 자유  -회식 강요 없음. 칼퇴 가능.
80,조인스엠,10765,연차나 이런 기본적인 회사 시스템은 잘 되어있다 기본적으로 갖춰야할 복지는 갖춰져있다 칼퇴가 가능하다
81,조인스엠,10765,식사를 제공한다 연차사용이 비교적 자유롭다 워라벨이 지켜지는 편이다
82,조인스엠,10765,복지포인트 지급 다양한 음료 제공 퇴근눈치없음 규모에 비해 명절보너스 및 선물이 만족스럽다 야근시 저녁 식대 제공 및 택시비 지원
83,조인스엠,10765,"복지가 좋음. 점심 잘 나오고, 탕비실도 잘되어있고, 일이 크게 어렵지 않음."
84,조인스엠,10765,탕비실이 매우 좋다. 다른 층 회사 보단 넓게 쓰는 거 같다. 생일에 회식 없이 상품권 주는 게 좋다. 회식으로도 별로 보고 싶지 않다.
85,조인스엠,10765,기계적으로 홍보글을 쓰는 일이라 어렵지 않았음. 글에 대한 터치가 별로 없어서 지속적으로 하기에 용이함.
86,조인스엠,10765,연차 눈치보지 않고 쓸 수 있다. 한 달에 한 번 오전근무가 있고 점심식사를 제공해준다
87,조인스엠,10765,"차분한 분위기 나름 체계적인 업무,바이럴 마케팅을 배울수있다"
88,조인스엠,10765,"중소기업 치곤 보통이상 근무환경, 복지, 자유로움?, 배울수있는 기회 등 여러가지가 있지만 본인이 하기 나름인듯"
89,조인스엠,10765,나름 복지에 신경을 써주는 분위기라 장기근속자들이 많은듯 실력이없어도 이 회사의 취지에 맞는다면 무난하게 잘 다닐 수 있다. 나름 성격좋은 마케터들이 있어서 인간적으로 바깥에서 만나면 좋았을 사람들이 있다. 야근수당 받으며 일할 수 있는 디자이너가 몇명이나될까 여긴 야근수당이있다
90,조인스엠,10765,신입때도 15개 연차 사용 가능 / 연차 외에 별도의 여름휴가 있음 / 1달에 1번 금요일날 오전만 근무함/ 연차 사용 프리한편 / 부서별 차이는 있지만 여자들은 복장 자유 / 일 못해도 짤리지 않음(이게 장점일까 싶기는 함) / 넓은 탕비실 / 냉장고에서 원하는 음료 마음대로 먹음
91,조인스엠,10765,웹디하고싶으면 다니는게 확실히 커리어에 좋음 자기가 맡은 작업 일정만 잘 맞추면 월차 쓰기도 나쁘지 않음 탕비실 좋음 복장 제한 없음 밥도 잘 사줌 성과급이나 명절 끼면 월급 좋음 복지 이만한데 못봤고 일하면서 회사가 크긴 하네 느낀적 있음
92,조인스엠,10765,"출퇴근, 연차, 기타 복지 등 업무 환경은 매우 양호하다. 직원들 편의에 대한 배려가 분명 있고 이런 점에는 감사해야 한다고 생각한다. 업무적으로는 주력인 의료마케팅 분야는 할수 있는 만큼은 하고 있고 거기서 배워나갈 부분들이 있다."
93,조인스엠,10765,탕비실이 상당히 잘 되어 있음. 복지 포인트 있음. 회사 시설 깔끔함. 일이 편하다 못해 무척 쉬움
94,조인스엠,10765,나름 재택근무하면편하게할수있음 재택근무시 사무실 내방 한번정도만 가면되기에 편함
95,조인스엠,10765,"우유, 탄산음료 등 음료수를 무한정으로 마실 수 있고 복지포인트 등의 제도가 잘되어 있는 편이다."
96,조인스엠,10765,잦은 야근이 없는 편이 좋다. 휴게실에 커피 및 음료가 다양하게 제공된다.
97,조인스엠,10765,장점인지 아닌지 모호하지만 일단 열정페이를 강요하는 집단은 아니다. 이유없는 야근이나 잔무 등이 없다는 점이 매우 좋다. 전 직장에서 포괄임금제라고 야근안하면 눈치주고 그렇다고 야근수당을 챙겨주는 것도 아니고.. 불합리한 점이 많았는데 적어도 그런 것이 없어서 좋다. 그 외 근무조건이나 환경등이 매우 상식적인 선에서 이루어져 있다.
98,조인스엠,10765,"워라밸이 적절한듯. 대부분 업무시간에 일처리하고 야근은 없다. 7시 안에 다 나감. 연령대가 젊은 편이고 성비가 비슷하다. 복지포인트나 명절 성과급 등 기본복지는 괜찮다. 연차 대부분 월에 한두개씩은 쓰고, 비교적 자유로운 편. 한달에 한번 금요일 오전근무가 있어서 편함. 사생활터치가 적고, 음료 냉장고나 탕비시설 좋은 편. 병원 쪽에서는 그래도 인지도가 있는 회사."
99,조인스엠,10765,"사내 행사나 복지 등은 좋은 편임, 연차도 비교적 자유롭게 사용할수 있으나 눈치 조금씩 주는 편. 월급 밀린 적 없음. 회식도 크게 강요하지는 않는 편"
100,조인스엠,10765,복지도 좋고 일하기도 편하고 공부하면서 일 할 수 있습니다 칼퇴도 기본 연차 눈치도 제로입니다
101,조인스엠,10765,"자기계발비용을 지원해주었으며, 체육대회 등 당시 귀찮았던 일들도 지금 생각해보면 추억이었어요."
102,조인스엠,10765,"젊은 사람들이 많아 프리한 스타일, 중소기업 치고 높은 복지"
103,조인스엠,10765,"복지포인트,야근시 저녁식사비 및 교통비 제공,음료 및 커피 제공"
104,조인스엠,10765,디자이너로서는 모르겠지만 마케팅분야에서는 병원쪽으로 특화되어 병원일에 대해 배울 수 있고 회사가 작지만 복지는 꽤 좋은 편이다
105,조인스엠,10765,사원들의 성격과 인성이 정말 좋은 기업. 윗선으로 올라 갈수록 인성적인 부분에서 좋은 분들이 많은곳 입니다. 복지에 대해 노력하려고 하는 회사입니다. 야근이 거의없어서 회사생활과 개인 생활을 동시에 유지하기 좋습니다 .
106,조인스엠,10765,연차는 눈치좀 봐야합니다. 눈치 안보는 것 같지만 다들 암묵적으로 약간의 군대 문화가 있기때문입니다. 그 외적으로 회식비 지원되고 마실것들 지원되서 좋습니다.
107,조인스엠,10765,"연차쓰는거에 대해 크게 눈치를 주지않고 사내 복지 제도가 매우 잘되어있음. 중소기업치고 사원들의 눈높이에 맞춰 복지제도를 잘 만들어놨음. 탕비실 음료 무료, 커피머신기, 복지포인트 제공, 상여금, 명절보너스 및 선물, 생일 등등 복지 제도 좋음. 연령층이 젊음. 듀얼모니터. 교육비 지원. 텃세없음. 업무량이 과하지않음. 칼퇴가능. 육아휴직에 대해 눈치 주지않음. 결혼,출산에 관대함"
108,조인스엠,10765,일은 매우 쉬운편 1년이면 다똑같애져서 적응하기 쉽다. 급여는 낮지만 복지가 규모에 비해 매우 좋은편이다. 좋은사람들도 있다. 탕비시설이 잘되있다. 청소아주머니가 따로 있으셔서 청소를 잘해주신다. 한달에 한번 오전근무를 한다.
109,조인스엠,10765,겉모습만 보고 판단하지 말자는 생각을 심어줬으며 블로그나 잡플래닛 칭찬글에 속지않는 눈을 갖게해준다. 탕비시설도 좋고 소정의 상여금도 좋다. 물론 받고 그만두면 뱉어내야하는것이 있지만 이정도는 장점으로 봐야 될 회사다. 병원마케팅일을 하기때문에 무료로 시술기회가 주어지며 미용분야의 의학상식이 생긴다. 단시간에 일을 알수있어서 바로 일을 할수있다. 1년정도만 다녀도 편안한 회사가 된다. 업무가 어렵지않고 반복되기때문에 공부해야되는 스트레스가없다. 다른 회사로 이직 없이 정착하고 싶다면 들어와도 됨
110,조인스엠,10765,회사 재무 구조 안정적. 급여나 명절보너스가 밀리지 않음. 복지포인트 지급. 탕비실 좋음. 뛰어난 선임들 많아서 일 빨리 배울 수 있음. 병원 마케팅 전문화. 동종업계 중 입지 우위에 있음.
111,조인스엠,10765,"중식,석식 및 탕비실에 음료가 구비되어있음 월1회 오전근무와 점심시간이1시간20분임"
112,조인스엠,10765,직원 복지에 나름 신경쓰는 모습이 있습니다. 어찌보면 기업이미지관리에 탁월하다고도 볼 수 있죠
113,조인스엠,10765,하나둘씩 생겨나는 복지. 1년에 제공되는 복지포인트는 분기별로 사용할 수 있으며 명절때마다 상여와 선물이 제공되는 점. 연차는 상황에 따라 눈치가 보일때도 있지만 크게 터치 안함. 탕비실 냉장고에 원하는 음료수 무제한 제공 받음. 또한 야근이 타 기업에 비해서 적은 편.
114,조인스엠,10765,"병의원, 제약, 의료기기 등에 관련된 마케팅 대행 업무를 오래한 회사이다 보니 해당분야에 대한 업무적 인프라는 상당히 넓은 편. 일정부분 특수성을 띄는 관련 의료마케팅업무에 대해서 충분하고 다양한 경험을 해볼 수 있다.  업무 환경이나 복지 관련해서도 규모에 비해 신경을 많이 쓰는 편."
115,조인스엠,10765,"교육비 지원, 복지포인트 지급(연차마다 금액다름), 명절보너스, 무제한 음료수, 야근수당, 야근 택시비 지원, 회식 술강요 없음, 젊은 연령층, 급여밀리지않음, 연차 자유(팀마다 다름. 허락안해주면 못쉬는 팀도 있음)"
116,조인스엠,10765,"중소기업 치고 복지가 좋은 편(복지포인트 제도로 여가/물건구매 비용 제공, 명절상여 있음, 야근수당 있음). 팀마다 다르지만 야근 강요 안함. 주말근무 없음. 직급이 올라갈 수록 일이 편해짐(양이 줄어듬). 공무원처럼 일할 수 있는 곳. 좋은 사람들은 진짜 좋음."
117,조인스엠,10765,탕비실이 잘되어 있음 커피와 음료수가 무한제공 복지도 그냥저냥 괜찮음
118,조인스엠,10765,지금은 모르겠지만 회사 다닐 당시에 탕비실이 잘 되어 있었음
119,조인스엠,10765,"퇴근압박 없음, 탕비실이 잘되어있음, 젊은 기업"
