,company_name,company_id,review_text
0,케이넷,3028,1도 없음 진심 단 하나도 없어서 뭐라고 써야할지 모르겠음 그냥 제일 좋은건 간식주는거
1,케이넷,3028,"8년 장기 근속자의 경험을 사실대로 작성한 내용입니다. 개인적인 사정으로 퇴사를 하게 되었지만 많이 배우고 경험한 첫 회사였습니다. 참고하세요~  1. 직원을 위한 복지 성장이 빠른 회사입니다.(월1회 힐링데이, 화/목 원하는 음식 주문) 2. 상여금 매년 지원하며 연봉도 최고 수준이다. 3. 건물이 깨끗하며 주변에 식당, 카페도 많아서 점심시간에 커피 맛집 도장깨기 할 수 있다. 4. 연차 자유롭게 사용 가능하다. 5. 명절 선물과 떡값을 지원해준다. 6. 회식은 거의 하지 않지만 송년회나 특별한 행사가 있을 경우 모두가 함께 즐길 수 있다. (게임, 택시지원 등) 7. 야근 강요를 하지 않는다 8. . 도서, 교육 지원이 되기 때문에 직무와 관련된 배움을 멈추지 않고 성장할 수 있는 기회가 많다. 9. 간식이 늘 구비되어 있다.(원하는 간식 주문 가능) 10. 수직적인 관계가 아닌 수평적인 관계이다.  여러모로 대표님께서 직원을 위해 복지에 신경을 많이 써주시고, 성장을 위해 여러 지원을 아끼지 않습니다."
2,케이넷,3028,"1. 직급에 대한 보상이나 대우가 다르지만 인격적으로 느껴지는 차별은 없습니다.  2.광주권에서는 높은편인 초봉과 힐링복지가 있고 팀원급에서는 크게 제약없이 연,반차 사용이 가능합니다.  3.직원들의 요청사항에대한 피드백이 빠른편이고 사내문화가 비교적 평이한 편인것 같습니다.  4.서로에게 관심이 없습니다."
3,케이넷,3028,"회사의 분위기는 자유스러운 분위기이고, 회사복지가 좋습니다."
4,케이넷,3028,점심 제공은 큰 장점입니다 그러나 좀 멀리걸어가야한다는것이 단점
5,케이넷,3028,쾌적한 근무환경 한달에 한번 4:50 퇴근 가능 대체로 연차 자유롭게 사용
6,케이넷,3028,회사 복지가 나쁘지 않고 초봉이 괜찮고 잘 신경 써주시는 것 같아서 괜찮아요
7,케이넷,3028,사무실이 신식 건물에 위치해있어 내외부 환경이 깨끗한 편입니다. 식비 지원으로 일주일에 두번은 배달로 다양한 메뉴를 먹을 수 있어서 좋습니다. 힐링제도가 있어 한달에 한번 한시간씩 일찍 퇴근하여 저녁의 여유를 즐길 수 있습니다. 조금 걸어가면 퇴근 후 놀 곳이 많습니다.
8,케이넷,3028,"주작이라 생각할 수 있는데 정말정말 진솔한 리뷰 답니다.  개인적으로 분위기가 유합니다. (사람들과 업무환경 모두 포함해서) 업무적인 지원도 아끼지 않는 편이고 중소기업에 속하지만 복지도 잘 추진해줍니다. (조기퇴근 제도 / 식사,간식제공, 명절 선물+떡값 +상여금 제도 등)  야근 하려고 하면 주변에서 하지 말라고 집에 보내줍니다. (야근을 싫어하는 분위기임)  회사를 다니면 어딜가나 빌런이 있기 마련이지만, 작년에 퇴사를 해서 쾌적하게 잘 다녔었습니다. 나름 애정을 가지고 다녔던 회사라 없는 사람으로 회사 전체가 욕을 먹는게 내심 안쓰러웠어요..ㅜ"
9,케이넷,3028,연차를 윗 사람 눈치 안보고 쓸 수 있음. 하루 한 번 힐링 사용으로 빠른 퇴근 가능. 교육체제가 잘 잡혀져 있어 실무 투입 전 업무를 숙지할 수 있음 . 회사의 단독 개발이 아닌 회사와 직원의 상생 개발에 포커스를 맞추고 있어 함께 발전할 수 있어 좋음.
10,케이넷,3028,"점심식사 식대 지원합니다, 동료끼리는 사이 괜찮습니다. 직원들은 대체적으로 젊습니다. 사무실이 새 건물이 깨끗합니다."
11,케이넷,3028,자유로운 출퇴근 복장 출퇴근 시간 정시출근 정시퇴근 야근없음
12,케이넷,3028,교육을 많이 시켜줘서 업무 지식이 없어도 시작하는 데에 도움을 받을 수 있다.
13,케이넷,3028,"1. 모든걸 다 배울 수 있다. CS, 세금계산서, 4대보험, 기획, 마케팅, 개발 등 2. 야근 없음 3. 외식 없음"
14,케이넷,3028,"연차는 자유롭게 쓸수 있으며, 같이 일하는 직원들은 사람들이 다 좋다."
15,케이넷,3028,연차 눈치보지 않고 쓸 수 있음 간식이 많습니다 시원하구요 장점을 쓰려고 하는데 그렇게까지 생각이 나지 않아서 여기까지 쓸게요
16,케이넷,3028,장점을 다 깎아먹는 대표. 그나마 있는 장점은 교통편 좋다. 근처 가게가 많다. 회식/워크샵 등등 단체활동이 없다(생기는 순간 직원들 싫어할덧)
17,케이넷,3028,간식이 많고 밥도 어느정도 괜찮은 정도이긴 한데 딱 이정도임
18,케이넷,3028,관련 도서가 많고 간식바가 있음 지금은 있를지 없을지 모름
19,케이넷,3028,복지는 좋았었다. 지금은 어떨지 모르겠다. 직원들의 자기계발을 독려하는 분위기. 회식도 신선한분위기라 좋았다.
20,케이넷,3028,"IT기업이라 그런지 꼰대문화는 아님, 출퇴근유연제를 운영하는 등 조직문화를 위해 노력하는 모습이 보임."
21,케이넷,3028,힐링데이 이라는 이름으로 4시 50분에 미리 퇴근할 수 있는 복지가 있음 그리고 없습니다.
22,케이넷,3028,"1. 이사해서 건물이 깨끗하고 환경이 좋음 2. 힐링제도(월 1회, 4:50분 퇴근) 3. 5만원 교통비 지원(정부에서 지원) 4. 비슷한 나이또래의 직원이 많아 좋음"
23,케이넷,3028,깨끗한 사무실. 간식지원. 회식 자주 안함. 개인주의.
24,케이넷,3028,"모든기업들마다 각 나름 문화가 있고, 중소기업 레벨의 평균치를 상회했으며, 직장동료들끼리 끈끈한 애정으로 잘 버틸수 있는 환경에 속해있습니다. 보기좋아요"
25,케이넷,3028,"1. 다양한 역량을 키우기 위해 기획, 마케팅, 데이터, CS, 개발, 세무 모든 것을 공부할 수 있는 긍정적인 기회를 줌^^ 2. 한 달에 한 번 16시 50분에 퇴근 3. 매주 목요일 점심은 외식 (인당 만 원) 4. 깨끗 5. 야근수당이 없는 대신 야근이 없음 6시 20분 전에 대부분 퇴근"
26,케이넷,3028,출퇴근시간이 정확함. 야근 별로 없음. 점심을 제공하고 생일날 축하해줌.
27,케이넷,3028,"교통편 좋음, 생일때 아침에 축하파티 해줌, 커피머신 있음, 얼음 콸콸 잘 나옴"
28,케이넷,3028,연차를 마음대로 쓸수있음. 승진에 대한 기회가 충분함 능력이 있으면 승진 시켜줌
29,케이넷,3028,"1. 사원들끼리 분위기 좋음. 2. 깨끗한 업무 환경, 화장실 좋음. 3. 무언가를 배울 수 있음."
30,케이넷,3028,장점이라고 굳이굳이 말하자면 근무환경? 깨끗합니다. 휴지도 주고 그치만 점점 얇아지는 중. 회사에서 좀 걸어가면 술 먹을 곳 많습니다. 매일 출석 가능이요.
31,케이넷,3028,"1. 능률은 부족 하더라도 열심히 하는 시늉만 한다면, 프로급 대우를 받으실 수 있습니다. (가족🧓👵 앞에서 대우 잘 해주고 시키는거 다 해주세요. 무언가 더 어필할 것이 필요하다 싶다면 가까운 팀원 또는 동료를 팔아 먹으면서 말만 잘하면 승진📈과 연봉💰은 따 놓은 당상과 같습니다. 오히려 논리대로 일 하다보면 무능력 함과 신뢰성 바닥, 연봉이 삭감될 수 있습니다.)  2. 경영진, 팀장, 스트레스, 가스라이팅, 사내정치, 입김, 눈치 등 으로 부터 잘 버틸 수 있는 뚝심있는 분 이라면 다닐 만 합니다. 아무리 뚝심있는 분 이라도 얼마나 버틸 수 있을 지 모르겠습니다. (그나마 버틸만 한 분은 심리적 이든 육체적 이든 몸 어디하나 망가져서 퇴사합니다.)  3. 힐링데이 : 한달에 두번 오후 4시 50분 조기퇴근이 가능합니다.  4. 오해피데이 : 매주 목요일 점심에 법인카드로 나가서 먹거나 배달음식을 시킬 수 있습니다.  5. 시간이 지나면 지날수록 복지의 개수와 복지의 수준이 떨어질 수 있습니다. 그나마 유지되고 있는 힐링데이, 오해피데이 라도 누리고 싶다면 입사를 고려해 보세요."
32,케이넷,3028,1. 그나마 자유로운 연차 (이틀 이상 쓰면 눈치를 좀 받을 수 있음) 2. 생일이면 몽쉘 재활용해서 직원들 다 같이 노래도 불러주고 스벅쿠폰 3만원 줌 3. 힐링(한달에 2번 5시 퇴근 가능. 단 2주에 한번씩 써야함.) 4. 다른 기업보다 그나마 수평(?)적임 5. 목요일은 만원 이하로 먹고 싶은걸 먹을 수 있음
33,케이넷,3028,타 중소기업에 비해 복지가 정말 좋다. 자유로운 분위기이다. 가볍게 경력쌓기 좋은회사이다.
34,케이넷,3028,연차나 복지면에서는 뭐 우수한 편 생일이나 자격증 취득에 같이 축하해주고 소정의 상품을 수여함
35,케이넷,3028,친숙한 분위기 부서끼리 사이 좋고 다들 나름의 열정도 있음
36,케이넷,3028,일과 삶 복지 꾀하기는 했음 사내 분위기 괜찮았음 그랬던듯
37,케이넷,3028,책 무료 대여 이거말고는 잘.. 여직원들이 다니기에는 좋은 회사인 듯
38,케이넷,3028,중소기업치고 복지는 지켜지는 편(연차) 그러나 이마저도 제지가 들어오긴 함 퇴근은 제시각에 가능하나 야근수당이 없기 때문에 그럼
39,케이넷,3028,"연차,반차,힐링데이(1시간 일찍 근무를 끝내는 제도)와 같은 복지는 중소기업에서 찾아보기 힘들정도로 좋은 편임.  본인이 원하는 외부교육이 있다면 거기에 따른 지원도 해줌.  야근강조는 없음 99%의 직원이 6시 30분이면 별일 없는 한 모두 퇴근해 있음.  회사 전체적으로 보수보단 진보적이고 젊은편임 (성향히 진보적이란거지 사람들 성향은 보수적인듯함.)  딱히 업무에 대한 욕구 없이 개썅 마이웨이로 편하게만 다니기엔 좋긴함."
40,케이넷,3028,"다양한 행사활동과 자유로운 분위기를 가지고 있으며, 자기개발과 관련된 서적, 교육 등을 지원해 줌."
41,케이넷,3028,작은 기업인만큼 가족적인 분위기가 형성 되어 의사통에차질없다
42,케이넷,3028,"프로그램개발자아니면 칼퇴근가능, 주 5일제, 회식절대없음"
