,company_name,company_id,review_text
0,코스맥스바이오,5232,워라밸 보장되는편 식당 밥 맛있는편 사측보다 쎈 노조가 있음(노조 가입 안한사람 못봄)
1,코스맥스바이오,5232,다른 팀은 모르겠으나 회사 동료들이 좋음 정말 소소하게나마 나아지는 중
2,코스맥스바이오,5232,교대근무라 일하는 만큼 받아요 식당 나쁘지 않아요 연차 자유로운편
3,코스맥스바이오,5232,"초봉은 나쁘지 않습니다. 하지만, 연봉 인상률은...고민이 되실겁니다."
4,코스맥스바이오,5232,일하는만큼 월급을 받을수있음 점심 저녁 야식 지원해줌
5,코스맥스바이오,5232,아무생각 없이 오래 다닐수있음 빌런 퇴사로 요즘 분위기 좋음
6,코스맥스바이오,5232,"시간외 수당, 연차 수당 등 관련 규정에 있어서 명확함"
7,코스맥스바이오,5232,"세부적으로 부서가 나뉘어져 있어, 팀만 잘 만나면 전문적인 프로세스를 경험할 수 있음"
8,코스맥스바이오,5232,업계에서 비교해봐도 괜찮은 연봉과 판교 테크노밸리라는 위치와 배울점이 많은 것
9,코스맥스바이오,5232,일을 자꾸 하고싶어지게하는 회사 입니다. 다같이 힘내서 해요
10,코스맥스바이오,5232,밥이 잘 나옵니다. 야근수당이 나옵니다. 그 외는 없습니다.
11,코스맥스바이오,5232,밥맛있고 워라밸 나쁘지 않음 판교라 회사위치 괜찮음 연봉 업계 수준 대비 괜찮음 연차 많은 편
12,코스맥스바이오,5232,대표님 포함 모든 임직원이 열심히 일하고 있어 지속적으로 성장하고 있습니다
13,코스맥스바이오,5232,상여가있어 생각보다 급여가 많고 노동의 강도가 어렵지않음
14,코스맥스바이오,5232,장기근속자가 많고 점심이 아주 맛있습니다. 야근시간에 저녁시간도 포함되어있는거 너무 이득입니다.
15,코스맥스바이오,5232,밥 제공해줌. 쉴 수 있는 공간 있음. 출퇴근 버스 제공해줌. 부서마다 다르겠지만 편안함. 생각보다 좋았던 기억 밖에 없음. 추억 보정 약간 들어가긴 함.
16,코스맥스바이오,5232,사람들이 좋다. 밥이 맛있다. 직원들을 위해주려고 노력하는것 같다.
17,코스맥스바이오,5232,구내식당 위치가 판교 업계 사관학교로 불릴 정도로 업무량 많음
18,코스맥스바이오,5232,"기본 연차 많음(여름 휴가 별도), 조중식 제공 (야근 시 석식제공), 시차출퇴근 제도 있음"
19,코스맥스바이오,5232,돈이 많고 업무스트레스 컨트롤 할수 있는 능력 발달하고 눈치잘보게됨
20,코스맥스바이오,5232,안정적인 모기업의 보유로 망할일은 없어보인다. 나름 이쪽에서 인지도가 있다
21,코스맥스바이오,5232,1. 업계 대비 괜찮은 연봉 (인상율은..) 2. 점심 저녁 공짜 그리고 맛있음 3. 판교 위치 4. 술 좋아하면 술 많이 먹을 수 있음…? 5. 이직시 괜찮은 커리어
22,코스맥스바이오,5232,첫직장대비 연봉은 괜찮습니다 초봉이 괜찮습니다 상여금이 있습니다
23,코스맥스바이오,5232,"복지괜찮음, 급여괜찮음. 가끔 착하신분들 있어서 그분들 덕분에 겨우겨우다님 노조있음"
24,코스맥스바이오,5232,"노조가 있어서 맘편히 다닐 수 있음, 판교는 가입한 사람 없지만 그냥 마음이 편함, 그게 다임, 더 적을게 없음"
25,코스맥스바이오,5232,업계 대비 연봉수준 괜찮음 2022년부터 매달 동일한 월급줌 영업은 인센티브 없는 대신 따로 챙겨주는 일비가 있긴함
26,코스맥스바이오,5232,성장할 기회는 갖고있으나 아무도 개선하려고 하지 않는 회사
27,코스맥스바이오,5232,"식사 및 식당 제공, 복지가 기본 이상은 갖추었다. 휴식시간 제공한다"
28,코스맥스바이오,5232,노조가있음 워라밸가능 사람은 케바케 급여는 나름 만족됨
29,코스맥스바이오,5232,코스맥스 네임밸류 뜨는 산업 다양한 샘플을 체험해볼 수 있는 장점
30,코스맥스바이오,5232,"상여금이 있어 일단 연봉이 높아져서 좋음, 노조가 있어 나름 복지에 신경쓰는게 눈에보임, 생일선물, 명절선물이 있어 좋음"
31,코스맥스바이오,5232,상여가 높아 급여 높은편 이며 통상임금제에 본인이 하는 만큼 많이 벌어 갈 수 있음. 젊은 사람 많아 유대감은 괜찮은편
32,코스맥스바이오,5232,"공장 노조가 존재하고, 복지면에서 섭섭하지 않은 대우를 해준다. 이점 외에는 장점이 도무지 없다."
33,코스맥스바이오,5232,연차를 눈치 안보고 쓸수 있음 밥이 맛있는 것 같다 사람들이 젛다
34,코스맥스바이오,5232,코스맥스라는 그룹안에 있어서 그런지 연봉도 좋고 위치도 좋고(판교) 밥도 잘나옴 근데 사람이 제일 최악임 오래 다니지는 못할 회사
35,코스맥스바이오,5232,술을 원없이 마실 수 있다. 일을 못해도 술만 잘 마시면 회사생활 가능!
36,코스맥스바이오,5232,회사가 점점 성장해나가고 있으며 배울것이 많아 커리어에 도움을줌
37,코스맥스바이오,5232,"아침 점심 저녁밥을 줌, 위치가 판교라서 괜찮아 보임."
38,코스맥스바이오,5232,돈많이 벌고싶으면 가면될듯 야근많음 월급 재때줌 상여금많았음
39,코스맥스바이오,5232,장점이요??? 아침점심 제공 법카로 윗분들이 점심 가끔 사주심 젊은 좋은 직원들이 꽤 있다 지하 카페테리아가 싸다 대졸 남자 초봉으로 나쁘지 않음 시장조사 나 업계동향에 대한 교육이 많아 도움이 된다
40,코스맥스바이오,5232,상위 매출 업체로 다양한 거래처와 업무 가능하며 이를 토대로 경력을 쌓기 좋음
41,코스맥스바이오,5232,연차가 많음 기본 19개 + 여름휴가 3개 업계 중 연봉은 탑 수준인듯 판교라는 좋은 회사 위치 메리트
42,코스맥스바이오,5232,지금은 모르지만 당시에는 상여금 주는게 좋았음 점심 제공 자판기있음
43,코스맥스바이오,5232,"연봉조건 괜찮았음. 아침, 점심, 저녁 식사 제공해 줌. 고용 안정성이 꽤 있는 회사임."
44,코스맥스바이오,5232,건강기능식품 연질 정제 등등 단기간에 급성장했고 연봉 및 일비지급
45,코스맥스바이오,5232,"동종업계 대비 무난무난한 복지와 급여, 휴가 제외 연차 19일, 조식중식석식 제공, 연차수당 제공, 건강기능식품 제조 전반적인 과정을 경험할 수 있다.  팀장, 임원급 제외 사람들이 좋으며 서로 돕는 분위기"
46,코스맥스바이오,5232,사원판매를 통해 회사에서 나온 제품 싸게 구매가능함 연차가 다른곳에 비해서 3~4개 더 많음 잔업 선택가능
47,코스맥스바이오,5232,"부서마다 차이가 커서 단순하게 얘기하기 어려움. 영업부서 다소 권위주의적 문화가 있으나, 전반적으로 분위기가 조금은 자유로움."
48,코스맥스바이오,5232,1. 점심저녁 주는 게 장점 2. 이직 시 크게 나쁜 회사는 아닌 듯하다
49,코스맥스바이오,5232,아침저녁밥주고 생각보다 근무자가 많아서 다른데보단 분업이 잘되있어요
50,코스맥스바이오,5232,"부서마다 업무강도는 상이하나 사람들은 좋은 편. 연봉은 동종업계 상위 수준. 코스맥스그룹사라는 네임벨류. 제품 개발, 생산에 대한 전문성은 가지고 있음."
51,코스맥스바이오,5232,제조사이기 때문에 양산 시 발생하는 다양한 문제점에 대한 대응력을 기를 수 있으며 어쨋든 건기식 시장바닥에 대해 알 수 있다
52,코스맥스바이오,5232,장점이라고는 지방에 있는 공장 치고는 페이 쎄다고 생각함. 다른 곳은 상여 잘 안터짐
53,코스맥스바이오,5232,동종업계에 비해 연봉이이 낮지 않다 밥이 맛있다
54,코스맥스바이오,5232,워라밸 나쁘지 않름 아침 점심 저녁 줌 안 짤림 놀아도 사고쳐도
55,코스맥스바이오,5232,"업무 강도가 꽤 높은편이어서 배울점 많고,, 무언가 계속 바꾸려는 노력을 함. 연차가 다른 업계에 비해서 많은편이고, 사용 편함. 연차사용 안하면 수당으로 줌 조식 중식 제공."
56,코스맥스바이오,5232,모회사가 튼튼하다. 어떻게든 되긴되고 일이많다보니 배우는게 많아요
57,코스맥스바이오,5232,"상여금 있음, 돈 잘줌, 돈 많이 벌 수 있음, 성장하는 느낌임, 기본적인 복지?는 잡혀있음, 기숙사 통근버스 있음"
58,코스맥스바이오,5232,고정개념의 상여금(연봉포함) 위탁생산업체 중 인지도 있음 원하건 원치않건 다양한 제품을 경험할수있다
59,코스맥스바이오,5232,"제천에서 높은 임금에 속하며, 복지우대는 나쁘지않은 편이며, 꾸준히 다니면 좋은 회사"
60,코스맥스바이오,5232,"밥 맛있고, 생산이 없을때는 약간의 텀이 생겨서 쉴수 있다는것외에 없음."
61,코스맥스바이오,5232,장점은 딱히 없는데 굳이 뽑으라고 하면 식당 밥이 맛있음
62,코스맥스바이오,5232,"상여금 빵빵, 노조 있음, 밥 맛있음, 기숙사 제공, 작업 환경 및 사내 환경 깔끔, 젊은 사람이 대부분(장점일 수도 있으나 단점일 수도 있음), 오래만 다니면 알아서 월급 올려줌"
63,코스맥스바이오,5232,야근수당이 나온다. 일 못하는사람 일 안시킴. 일 잘하면 많은 것을 배울 수 있다.
64,코스맥스바이오,5232,시골에 비해 돈 어느정도 주고 복지 괜찮음. 일이 비교적 쉽고 특히 여자들한테 잘해줌 구내식당 있고 보너스 지급 있음 주 5일하려고 노력함 노조있음
65,코스맥스바이오,5232,"첫째, 판교 내에 위치하고 구내식당 이용이 가능하다는 점 둘째, 동종업계 대비 연봉수준은 높은 것 같습니다.  위 2가지가 떠오르고 그 밖에 장점은 잘 모르겠습니다."
66,코스맥스바이오,5232,코스맥스라는 타이틀로 제법 인지도가 있다 영맨에게 아쉽지않은 연봉 구내식당이 있고 삼시세끼 가능하며 건강기능식품 무상으로 많이 가져갈 수 있음
67,코스맥스바이오,5232,기업이 탄탄해 미래걱정이 필요없음 또한 밥이 맛있습니다
68,코스맥스바이오,5232,높은 연본 테이블과 회사에서 밥이 맛이 있다 판교로 위치가 좋다
69,코스맥스바이오,5232,연봉 끝... 3끼가 다 나온다... 근데 탄단지 비율이 좋진 않음
70,코스맥스바이오,5232,동정업계 대비 아쉽지 않은 연봉 수준 판교 위치로 전반적인 근무환경이 좋음
71,코스맥스바이오,5232,판교 근무 연봉 그외 정말 없다 참고 참고 참는 것을 배운다는 점
72,코스맥스바이오,5232,"""중소""기업이 갖춘 기본 덕목들을 저버리지는 않았다. 팀바팀이긴 하지만 연차사용 자유롭다. 회식을 자주한다. 사무실이 판교에 있다. 인내심을 기를 수 있다."
73,코스맥스바이오,5232,폭넓고 다양한 제형과 제품을 생산하여 여러 경험을 쌓을 수 있음. 직종 대비 초봉이 높음.
74,코스맥스바이오,5232,연차에대한 압박감이없다 지하에식당이있어서 점심값이안나간다 수도권에회사가있다 야근적다
75,코스맥스바이오,5232,건식제조의 모든업무를 배워볼수 있고 다양한 브랜드사 고객과 커뮤니케이션 하여 업계동향을 잘 알 수 있다 모든업무를 다 한다고보면된다 1년 근무시 이세상 모든 힘들고 어려운점을 극복할 수 있는 인내력이 탑재된다 야근으로 인해 지치고 힘들어서 밤에 숙면 취할 수 있다 위에서 원하는 보고자료가 많아 문서 작업 잘하게 된다 대내외적 갑질을 상대하다보니 어떤 스탈에도 잘 맞추는 맞춤형 인재로 거듭난다. 퇴사후 어디든 여기보다 나은곳으로 이직할 수 있다
76,코스맥스바이오,5232,글로벌 넘버원 화장품 제조사의 광명을 간접체험 가능하다. 정말 넓고 많은 업무를 담당하고 책임지게 되기 때문에 식품업 전반적 역량 함양이 가능하다. 인적네트워크가 넓어진다.
77,코스맥스바이오,5232,지방지역에는 없는 상여금제도가 있어 좋음. 모기업이 대기업이고 여기도 중견기업이라 뽕이 좀 찰꺼임
78,코스맥스바이오,5232,짬빱이되면은 연차를 쓸슈있음 직원들이 처음에 잘해주고 챙겨줌 다양한 경험과 워나벨이 자기 할일만 한다면 가능함요
79,코스맥스바이오,5232,뭐든 할수 있다 안되는것도 되게 한다 건식제조 모든 공정을 이해할수 있다 군대 다시 온듯함을 몸소 체험 할수있ㄷㅏ
80,코스맥스바이오,5232,제천에서 그래도 중견이라 상여금이 좋은편 통근버스가 있음
81,코스맥스바이오,5232,입사 후 금방 제품 개발 가능. 제품 개발을 주도적으로 할 수 있음.
82,코스맥스바이오,5232,국내 탑급 건강 식품 제조사 다양한 제형 원료 처방 모든걸 볼수 있다
83,코스맥스바이오,5232,"칼퇴근 가능 구내식당이 있고, 식권이 있어 싼 가격에 먹을 수 있고, 꽤 괜찮게 나옴 점점 크고 있는 회사고 아직 인원도 많지 않아 여러 업무를 다양하게 배울 수 있음"
84,코스맥스바이오,5232,상여금으로인해 급여가쌤 비슷한회사중에서도 월급이 높은걸로 알고있음. 퇴사를했지만 후회를하고있음 돈보고가면 괜찮은회사
85,코스맥스바이오,5232,월급이 제때제때 나온다. 밥이 맛있다. 기숙사를 운영한다.
86,코스맥스바이오,5232,연차 사용은 부서 마다 다르겠지만 자유롭게 쓸 수 있는 편 바쁠땐 엄청 바쁘기 때문에 돈 벌기 최고의 직장
87,코스맥스바이오,5232,월급 안 밀리고 나옴. 업계 파이가 전반적으로 커지면서 회사 규모도 많이 커짐.
88,코스맥스바이오,5232,업계에서 연봉은 높은편 비교적 칼퇴근가능하고 업무강도 크게 높지않음
89,코스맥스바이오,5232,"청소해주시는 여사님들의 프로정신 덕분에 로비, 사무실, 화장실 등 사옥 내 어디든 쾌적한 환경에서 지낼 수 있다.  그럭저럭 많지도 적지도 않은 연봉. (그러나 연봉에 상여가 포함되어 1/17 이다보니 상여달이 아닌 달에는 거지처럼 살아야한다.)"
90,코스맥스바이오,5232,파트별로 많이다르지만 연차사용이 가능함. 노조가 있어 최소한의 보호는 받을수있음.
91,코스맥스바이오,5232,달에 한 300정도 받음 상여금이 많음 경력이 쌓일수록 몸이편해지는 구조
92,코스맥스바이오,5232,"연봉조건이 좋음. 연봉 말고 장점이 뭐가있을지 모르겠음. 팀분위기 잘어울리면 좋음. 일 안해도 승급, 승진가능. 꾸준히 월급오름. 나보다 늦게 입사한애가 나보다 일 잘해도 나랑 뒤집히지않음. 그래서 직급 달면 달수록 월급루팡이 될수있음."
93,코스맥스바이오,5232,1.5시퇴근(물론8시출근에정시퇴근힘듦) 2.모두에게주어지는 책상의자그리고컴퓨터 3.일이많다. 일없어서망하진않을회사 4.매출액이괜찮은편이다 5.구내식당있음 6.이시국회식에도위에서태클안걸림 7.아무것도안해도사고만안치면승진은시켜줌(임원도) 8.적지않은초봉
94,코스맥스바이오,5232,판교근무자 기준 연봉이 높은편 판교 근무. 이 이상 더 없음
95,코스맥스바이오,5232,노조가 있음 생산직으로 들어오기엔 좋음 야근수당 많음 대리 이전까지 연봉 괜찮음 딱 거기까지 팀마다 분위기 다름 놀아도 진급잘됨
96,코스맥스바이오,5232,아침 점심 야식 다주고 출퇴근버스있고 상여금이500%임 근처에 편의점이있어서 편하고 곧앞에 큰마트도생긴다 싯사메뉴가 좋다
97,코스맥스바이오,5232,모기업이 화장품 OEM 글로벌업체로 가망고객확보에 유리함
98,코스맥스바이오,5232,연차 쓰는데 눈치 볼 필요가 없습니다 같이 일하는 사람도 좋았습니다
99,코스맥스바이오,5232,"출퇴근시간은 잘 지켜주고, 회사 밥도 맛있다. 무엇보다 통근버스가 잘 되어있다."
100,코스맥스바이오,5232,사업기반이 안정적이며 건강기능식품 전문 제조업 업계3위안에 위치하고 있습니다.
101,코스맥스바이오,5232,야근 잔업이 잦아 추가수당이 많이 나옴 식사에 관해서는 확실히 제공하는편 복지도 상당히 괜찮음
102,코스맥스바이오,5232,자기 분야 전문성을 기를 수 있음 서로서로 친하게 지내는거같음
103,코스맥스바이오,5232,굳이 장점이 있다면 연차는 솔직히 눈치안보고 쓸수있습니다 그거하난 좋아요
104,코스맥스바이오,5232,노조가 있어 매년 연봉이 올라감 돈만 많이줌 연차가 많음 연차 다 안쓰면 4월에 한달치 월급 나옴
105,코스맥스바이오,5232,"점심 저녁 제공해줌, 사람들이 좋음, 근처에 카페가 있음"
106,코스맥스바이오,5232,"연차수에 따른 연봉인상, 높은 상여금, 복지가 괜찮은편"
107,코스맥스바이오,5232,판교에 위치해 있고 신축 건물이라 깨끗하다는 것이 유일한 장점
108,코스맥스바이오,5232,연차사용 시 해당부서의 조장 눈치봐야하나 쓰긴 쓸수있음 늦게까지 근무 시 택시비 지원해줌 입사와 동시에 인수인계 잘해줌
109,코스맥스바이오,5232,장점 뭐가있을까요? 퇴사율이 높아 1년만 일해도 내가 상당히 짬밥이 높아지는 효과?
110,코스맥스바이오,5232,퇴직금 조금주기위한 꼼수로 높아보이는 연봉? 그외엔 없다
111,코스맥스바이오,5232,부서별로 다르지만 전체적으로 보면 야근이 많은 편은 아님 물론 아무도 야근 안한다곤 안했음  건의사항이 좀 늦을순 있어도 어느정도는 반영됨 상장을 꿈꾸는(문턱을 넘을랑 말랑) 업계 상위권 기업(10위 이내)
112,코스맥스바이오,5232,"일정부분 정이 통하고, 좋은 사람이 꽤 있음. 노동조합이 있어서 일부 장점이 됨"
113,코스맥스바이오,5232,판교라서 위치가 좋음. 밥도 잘나옴. 동종업계 대비 연봉도 괜찮은 편임.
114,코스맥스바이오,5232,판교 근무 식당도 많고 구내식당은 별로지만 있음 카페테리아 편의점 있음 이회사에서 일해보면 어느회사가서도 일할 수 있다 업무가 범용이 아니라 특수성 때문이다
115,코스맥스바이오,5232,"OEM , ODM 전문 기업이라 다영한 회사의 제품을 만나볼 수 있다. 다양한 업무도 경험할 수 있다."
116,코스맥스바이오,5232,"건강기능식품 시황이 매우 좋은것과 맞물려, 회사가 매우 잘되고 있습니다. 전체적인 매출은 많이 올라가는 것이 장점이지만 내부적으로는 어떤지 의문점이 있습니다. 제공되는 식사가 맛있습니다. 일이 많이 있어서 돈이 필요하신 분들에게 추천 드리고 싶습니다."
117,코스맥스바이오,5232,코스맥스가 모기업이라 망하지는 안을듯. 하지만 적자가 엄청날듯
118,코스맥스바이오,5232,장점이라.. 점심 밥 공짜 그리고 코스맥스 울타리 안에 조그만 복지
119,코스맥스바이오,5232,배울것이 많습니다 작지 않은 규모이다 보니 체계는 확실한것 같습니다
120,코스맥스바이오,5232,장점이있나 싶은정도...겉만 유명할뿐 아니것도없는 회사
121,코스맥스바이오,5232,"잔업수당, 연차수당, 식대 지급, 교통비 및 유류비, 통근버스 운행, 상여금 지급, 노조가입"
122,코스맥스바이오,5232,위치가 판교다. 주변이 깨끗하다. 엘리베이터가 3대이다.
123,코스맥스바이오,5232,최소 30자.. 굳이 꼽자면 위치가 판교이기에 판교에서 근무한다는 자긍심을 느낄수있음.
124,코스맥스바이오,5232,회사에서 자체적인 이벤트는 많다 일이 다른 회사에 비해 많다
125,코스맥스바이오,5232,나쁘지 않은 연봉  반복되는 미친 상황을 통해 포기란 것을 배우게 되므로 인생 공부에 도움은 된다
126,코스맥스바이오,5232,"생산환경이 깔끔하나 작업복이 불편, 상여금제도가 잘되있음, 밥은 먹을 만하다"
127,코스맥스바이오,5232,상여 400% 상여 나오는 달은 여유가 있음 전체적으로 기본급이 더 올랐으면 좋겠지만 나름 만족하고 다님
128,코스맥스바이오,5232,"팀 분위기는 좋음, 연봉은 높은편이고 야근이많아 연장수당은 많이 받을 수있다."
129,코스맥스바이오,5232,"구내식당, 깨끗한 사옥 이 두가지뿐. 30자는 너무하네요"
130,코스맥스바이오,5232,기숙사 제공. 연차쓸때 눈치 보이지않음. 밥이 맛있음. 쉬는시간에 눈치 안보고 쉴수있음
131,코스맥스바이오,5232,"부서마다 매우 분위기가 다르지만, 보통 사원끼리는 친하게 지내는 편입니다. 판교라서 수도권에서 출퇵근이 용이합니다."
132,코스맥스바이오,5232,상여 500% 수습 3개월 미만자 제외 전부 정직원인 것 야간 근무시 택시비 지원
133,코스맥스바이오,5232,장점... 복지? 상여금이 쎄다? 취업의 문턱이 낮다. 기숙사 제공
134,코스맥스바이오,5232,밥 괜찮다 적지도 많지도 않은 연봉 코스맥스의 울타리 그외 정말 없다
135,코스맥스바이오,5232,"상여금이 높다. 업무강도가 쉬운곳은 정말 쉬우며, 좋은사람들이 있는팀은 오래 다닐만한 곳인것 같다."
136,코스맥스바이오,5232,기업의 장점은 쉬는시간이 많아서 좋다는점?? 그점빼고 없는것같아ㅎ
137,코스맥스바이오,5232,"밥 맛있음, 돈 적당히 줌, 사옥 깔끔함, 판교출근, 코스맥스 네임밸류"
138,코스맥스바이오,5232,"좋은 위치, 식사 무료...영업직의 경우 무료로 주차 가능? 더 이상 쓸 말이..."
139,코스맥스바이오,5232,1. 연봉 나쁘지 않다 2. 구내식당 맛있다. 3. 사옥이 매우 깔끔하다. 4. 회사매출이 매우 잘된다.
140,코스맥스바이오,5232,"공장은 충북 제천에 있으며, 잔업 및 특근이 많아 돈을 벌고자 한다면 좋음. 제천은 돈쓸데가 좀 없는편."
141,코스맥스바이오,5232,야근 많이 시키고 야근 수당은 잘 챙겨줌 야근 많이하면 돈 벌기는 좋다
142,코스맥스바이오,5232,"밥을 잘주는거 같아요 아닌가,,,, 식단 조아요. 그리고 다들 잘 대해주세요."
143,코스맥스바이오,5232,야근수당 있음. 야근올리는데 눈치 안줌. 연차쓰는데 눈치안줌. 밥이 너무 맛있음
144,코스맥스바이오,5232,사무실과의 의사소통이 잘 되어 있어 어떤것이 필요하던 편하게 말 할 수 있어서 좋습니다.
145,코스맥스바이오,5232,지주 회사가 돈이 많아서 사업 투자금이 빵빵함 앞으로 사업 부분에 투자가 많이 이뤄질 것 같아 성장 가능성이 기대됨
146,코스맥스바이오,5232,연차를 눈치 안보고 쓸수있다 무슨일이 있으면 야근을 자유롭게 뺄수 있음
147,코스맥스바이오,5232,야근비 나옵니다.또........................밥이 맛있는 편입니다. 스스로 찾아서 배워야 하는 것들이 많습니다.
148,코스맥스바이오,5232,제천에서는 그래도 괜찮은 연봉 실무에 바로 투입되므로 빠른 업무 성장이 가능하다
149,코스맥스바이오,5232,월급은 밀리지 않고 꼬박꼬박 나옴 복지는 좋음 야근수당 잘줌
150,코스맥스바이오,5232,음 우선 건강과 관련된 식품을 생산 주문을 받고 생산해주는 시스템이다 보니 망할일은 없을거 같습니다.
151,코스맥스바이오,5232,"연차 편히 사용, 공휴일을 금요일로 옮김, 밥 굿, 야근수당 줌"
152,코스맥스바이오,5232,인근 지역에서는 그나마 연봉이 높은편이나 상여금 없이는 다른곳보다 적은회사
153,코스맥스바이오,5232,출근은 빠르지만 퇴근은 5시라서 하지만 부서마다 편파가 있죠
154,코스맥스바이오,5232,"맛있는 밥, 야근시 야근수당 지급, 나쁘지않는 연봉, 젊은 사원들이 있습니다."
155,코스맥스바이오,5232,사람들은 좋음 좋은게 그게 다임 사람들 근데 그것도 벽이있음
156,코스맥스바이오,5232,밥이맛있는것같아요 아침은 안주지만 점심 저녁 급식담당하시는분들 좋아요
