,company_name,company_id,review_text
157,코스맥스바이오,5232,"1. 네임 코스맥스 네임의 영향으로 좋은 회사 다니고 있다라는 이미지를 줄 수 있음. 단 네임 일뿐, 더도 덜도 말고 딱 거기까지. 코스맥스와는 전혀다른 시스템.  2. 아침/점심/저녁 제공 건물 내부에 구내 식당이 있음. 아침에 일찍 도착 할 경우, 식당에서 간단한 아침 식사 할 수도 있음. 점심에는 당일 메뉴와 당일 메뉴를 먹기 싫다면 샌드위치나 샐러드를 먹을 수 있도록 따로 제공함. 저녁 식사 또한 가능. 야근을 해야만 저녁을 먹을 수 있다라는 인식. 판교 안쪽에 위치하고 있지만, 주변 회사들이 많기 때문에, 주변 상권도 많이 있음. 점심때 밖에서 여러 종류의 식사 가능.  3. 건물 이노벨리 건물에 위치하고 있음. 깔끔함.  4. 연봉 그나마 초봉은 동종업계 보다 조금 더 주는 편.  5. 기타 스스로 나가지 않은 이상. 짤릴 일은 없음."
158,코스맥스바이오,5232,"부서마다의 분위기는 조금씩 다르겠지만, 대체적으로 자유로운 분위기. 연차 부담없이 쓸수있고 칼퇴 분위기임."
159,코스맥스바이오,5232,판교이 있으며 지리적으로 좋다. 기업이 꾸준이 성장 중이며 이에 따라 내부 시스템 등이 체계적으로 변하고 있다. 동종업계에서 5위 안에 든다. 월급이 적지는 않다.
160,코스맥스바이오,5232,나쁘지 않은 워라밸. 내가 하는일이 끝나면 퇴근가능. 부족하지만 그래도 발전하려고 노력하는 회사의 마인드
161,코스맥스바이오,5232,"연차 자유로움, 복장 자유로움, 사내식당 무료 맛있음, ....이외에 장점 정말 없음.."
162,코스맥스바이오,5232,"연차를 윗사람 눈치 안보고 사용할 수 있음, 샌드위치 연휴 쉴수 있음, 대부분퇴근시간이 일정하다."
163,코스맥스바이오,5232,"연차 자유로운 분위기, 시설과 위치가 좋음. 팀끼리만 뭉치는 경향이 강하고 발전 가능성은 없음"
164,코스맥스바이오,5232,점심 저녁 식사 제공 그리고 음..............
165,코스맥스바이오,5232,"기숙사, 출퇴근 버스 이용가능,특히 구내식당이 다른곳보다 맛있음"
166,코스맥스바이오,5232,타업계에 비하여 적은 초봉은 아님. 남자 군대경력을 2년 쳐줌. 영업력이 약하다.
167,코스맥스바이오,5232,연차를 비교적 눈치안보고 쓸수있음 코스맥스 계열사라는게 장점일라나..
168,코스맥스바이오,5232,가족같은 분위기. 팀마다 다르겠지만 사람들이 대체로 좋음. 업계에서 브랜드 네임에 대한 인지도가 좋기 때문에 기업의 성장가능성이 높다고 봄.
169,코스맥스바이오,5232,코스맥스 계열사라 망하지는 않고 지금 제약동이 돌아가는지는 모르겠지만 제약동 추진중
170,코스맥스바이오,5232,아무리 생각해도 없음. 코스맥스에 속한다는 것 하나 장점. 코스맥스 그룹에 있지만 그냥 다른 회사임.
171,코스맥스바이오,5232,성장하고있는 기업이다. 그룹차원이라 가능성이있다고 판단된다
172,코스맥스바이오,5232,건물이 얼마되지 않아 시설이 깔끔하고 안전교육을 꾸준히 하는 등 환경이 나쁘지 않고 일하는 만큼 급여가 나옴(정직원 기준)
173,코스맥스바이오,5232,분위기가 점점 나아지고 있고 직원들을 위해 좋은 방향으로 발전하고 있음
174,코스맥스바이오,5232,경영진의 교체로 인한 변화시도. 하지만 부진한 결과. 술자리를 좋아한다면 추천. 다만 연구직은 자유로운 편이며 분위기도 나쁘지않음.
175,코스맥스바이오,5232,코스맥스 계열사인 점은 장점이다. 연봉 및 야근수당이 잘 나온다.
176,코스맥스바이오,5232,코스맥스계열사라는게 장점. 다른장점은 야근수당잘챙겨줌
177,코스맥스바이오,5232,사람들이 좋고 퇴근도 8시정도면 하고 상여금이 많아서 좋음.
178,코스맥스바이오,5232,특야근 수당이나오며 월급안밀리고 꼬박꼬박 나오며 노동조합이 있으며 새건물이라서 외관 및 내부가 께끗하다.
179,코스맥스바이오,5232,팀마다 분위기가 다르지만 R&I는 비교적으로 분위기가 좋은 편임. 자기 일 끝나면 5시 반 ~ 6시 반 사이에 자유롭게 퇴근 가능. 일이 많은만큼 많이 배울 수 있음
180,코스맥스바이오,5232,"타동종업계에 비해 연봉이 조금 더 많은편이며, 연차 자유롭게 사용가능,"
181,코스맥스바이오,5232,"업계와 비교했을때 상위 연봉, 휴가 사용에 자유롭다. 노조가 있다."
182,코스맥스바이오,5232,월급과 상여금은 밀리지 않고 꾸준히 나옴 잔업을 많이하면 돈을 많이 벌 수있음
183,코스맥스바이오,5232,역시 성장성을 우선적인 장점으로 들 수 있습니다
184,코스맥스바이오,5232,팀원들의 친밀도가 높음 쾌활한 분위기 연봉도 높은수준 지방회사여서 기숙사제공
185,코스맥스바이오,5232,"제조업 1위인 코스맥스 계열사로 성장가능성은 높음- 건강기능식품 업계 2~3위. 연봉이 건기식 업계에서는 높은편, 영업부는 일비까지 합하면 충분히 먹고살만함"
186,코스맥스바이오,5232,모회사인 코스맥스의 지원으로 성장성이 기대됩니다
187,코스맥스바이오,5232,코스맥스라는 네임밸류덕분에 이득을 보는 듯..
