,company_name,company_id,review_text
0,콤비,13205,업무강도가 강한편이기에 짧은 기간에 실력이 향상될 수는 있어보입니다.
1,콤비,13205,강도가 높아 일배우기는 좋다. 일을 처음부터 배우고 싶다면 지원해도 될듯
2,콤비,13205,"디자인다운 디자인을 할 수 있으나, 주로 관공서 업무가 많기 때문에 한정적이다."
3,콤비,13205,업무강도가 강하기때문에 단기적으로 업무역량을 강화시킬수 있음
4,콤비,13205,많은 일을 해볼 수 있으며 비교적 자유로움 복장이 자유로움
5,콤비,13205,디자인 기획이라던지 정부지원사업과 지식재산권에 대한 폭넓고 다양한 브랜딩을 진행할 수 있고 복장이 자유롭고 회사차량이 있다.
6,콤비,13205,아주 다양한 업무경험이 가능. 정부사업을 접해볼 수 있다는 경함정도
7,콤비,13205,"역이랑 가까운 위치라 교통편에선 좋음. 다양한 스타일로 디자인 체험을 할 수 있으나, 일에 관해 간섭이 심한편임."
8,콤비,13205,다양한 분야의 디자인을 접할 수 있어 신입에게는 배울수 있는 기회가 많음
