,company_name,company_id,review_text
119,한국모바일인증(주),7183,사무실 깨끗하고 새건물이라서 근무 환경이 눈에 띄게 좋아짐(이전 사무실도 나쁘진 않았음) 각자 할일 하는 분위기 휴가 쓰는데 눈치 안보임 월~금 쓰기도 가능함(휴가가 남아있다면)
120,한국모바일인증(주),7183,새로 이사해서 그런지 깨끗한 환경에서 근무할 수 있다는점 생각보다 첫직장치고는 복지는 나쁘지않다. 경영진들의 프라이드가 갑오브갑임
121,한국모바일인증(주),7183,근처에 밥이 맛있네요.밥먹으러회사와요. 얼마안있어서 무슨 장점이 있는지 모름
122,한국모바일인증(주),7183,"연차 사용의 자유로움 (최대5일) 야근 식대 지원, 휴가비 지원 업무상 분위기가 무겁지만 이를 해소하기위한 노력"
123,한국모바일인증(주),7183,근태에 중요성을 알게 해준 고마운 회사~ 항상 긴장을 하면서 생활을 해야 하기에 나에게 신경성 위장염이란 병을 준 고마운 회사~
124,한국모바일인증(주),7183,"야근을 지양하고 있음. 복리수준이 높은편임(휴대폰, 문화생활비, 보험료 지원 등) 많고 다양한 고객사 및 업권을 확보하고 있음 휴가 사용의 제한이 없음(연속 5일 사용 권장)"
125,한국모바일인증(주),7183,"월급빵빵함(인정), 연차 사용에 딱히 제한이 없음, 구디역 + 9시 30분 출근 = 출퇴근 용이(지옥철 X)"
126,한국모바일인증(주),7183,"구로디지털단지역 근방에 자리하고 있고, 출근 시간이 일반 회사 출근시간보다 30분 늦어서 출퇴근이 편리합니다. 연봉에 대한 보장이 확실합니다. 연차 사용이 자유롭고 개발자의 능력을 인정하고 보장해줍니다."
127,한국모바일인증(주),7183,업계에서는 알아주는 회사인만큼 확실하게 보장되는 연봉 눈치보지 않고 써도 되는 연차 출퇴근길이 편해서 좋았습니다. (2호선 구로디지털단지역)
128,한국모바일인증(주),7183,"- 아래에서 결정한 사항도 받아들이는 개방된 업무 분위기  - 다양한 종류의 일(다양한 산업군과의 교류, 세부적인 운영경험, 많은 서비스)을 통해 업무 실력 향상 가능  - 할 일이 있을때는 제외하고 강제적인 야근 없음"
129,한국모바일인증(주),7183,"해당규모 중소기업 중에서는 복지가 나쁘지 않음. 업무 특성상 여러 분야에 대한 다양성을 확보할 수 있고, 무엇보다 업무 및 직장인의 기본자세를 배울수 있음. 업무시간 집중도를 높이고, 야근은 지양하는 편임. 출근시간이 여유롭고, 휴가에 대한 부담이 없음(5일 사용가능)"
130,한국모바일인증(주),7183,개발자로서 능력을 충분히 인정해줌. 교통 편리 (구로디지털단지역) 연차 사용 눈치 볼 필요X 확실한 연봉 보장
131,한국모바일인증(주),7183,기획자와 개발실 업무 협업이 활발하고 소통도 원활해 개발자가 일하기에 좋은 환경이었다. 본인확인서비스 1위 기업답게 동종업계에서 연봉도 나쁘지 않다.
132,한국모바일인증(주),7183,"휴가 사용 시 눈치 볼 필요 X, 구디역에 있어서 교통 매우 편리 + 9시 30분까지 출근이라 지옥철 딱히 못느낌, 오피스 상당히 쾌적, 휴대폰 지원비 + 자기개발비 지원"
133,한국모바일인증(주),7183,연차를 길게 사용할수 있음. 연봉이 높음. 사무실이 깨끗함.
134,한국모바일인증(주),7183,1. 쾌적한 사무실과 업무 환경 2. 2호선과 7호선이 근접해 출퇴근이 편함 3. 9시 30분 출근으로 북적이는 지옥철을 피할 수 있음 4. 휴대폰 지원비가 있음
135,한국모바일인증(주),7183,월급은 잘나옴 문서 작업을 잘하게됨 사회생활 확실히 배울 수 있음 병가를 사용할 수 있음 출근 9시 30분
136,한국모바일인증(주),7183,"술 강요 안함, 나름 메리트 있음 인증 기술력 떄문에 먹고 살만함 대체 기술력 나오면 한순간에 무너질 순 있음 회사의 관계들은 유지하는데 힘씀"
137,한국모바일인증(주),7183,"본인확인 인증 점유율 1위, 승진은 사고치지 않는 이상 가능, 임원진을 제외하고의 직원들끼리는 분위기 좋음"
138,한국모바일인증(주),7183,연차를 5일 붙여서 사용할 수 있으며 출근 시간이 9시 반까지이나 9시까지만 출근하면 됨
139,한국모바일인증(주),7183,핸드폰 인증 프로그램개발 업체. 대표 사업거리가 있어 안정정 수익이 나고 있음. 구디에 있어 접근성은 좋음
140,한국모바일인증(주),7183,정해진것에 어긋나는 것을 하지 않는 올곧음을 배울수 있음 옳고 그름이 무엇인지 판단할수 있는 능력을 기를 수 있음
141,한국모바일인증(주),7183,- 출근시간이 늦어서 출근편리 - 안정적인 매출 - 정갈한 사무실(?)과 분위기
142,한국모바일인증(주),7183,-체계적임 -안정적인 매출 있음 -깨끗한 사무실 -나름 자유로운 연차 사용
143,한국모바일인증(주),7183,출근시간이 30분정도 뒤라서 출근하기편함 지옥철시간대서 벗어날수있음
144,한국모바일인증(주),7183,체계적인 시스템을 갖추고 있고 신규사업 추진에 주력하려는 기업의 노력이 보임.
145,한국모바일인증(주),7183,"직원의 경력과 자기계발을 위한 교육 참여에 개방적이고, 연차를 연속 붙여 사용가능함. 하지만 연속 연차가 단점일 때도 있음."
146,한국모바일인증(주),7183,"업계 1위로 시스템 개발 구조가 안정적인 편. 신입으로 들어오면 다양한 업무를 배울 수 있고, 경험 쌓기에 좋음"
147,한국모바일인증(주),7183,"여러 업계 사람들과 교류가 가능, 인맥 확장에 도움이 됨. 신입이라면 다양한 업무를 배울 수 있고 무엇보다 일하는 공간이 깨끗함"
148,한국모바일인증(주),7183,평균 연령대가 30대 중반으로 젊은편임. 급여나 복지가 괜찮은 편이라 일이 힘들어도 견딜 만 함
149,한국모바일인증(주),7183,시장에 안정화 된 서비스를 운영함과 동시에 신규 시장 확보를 위한 기획업무를 동시에 진행할 수 있음. 기획에 대한 실무를 경험하면서 의견 제안을 통해 기획업무의 재미를 느낄 수 있다.
150,한국모바일인증(주),7183,"회사 자금, 운영, 경영관리 업무를 전문적이고 체계적으로 배울 수 있음 자기개발에 대해 회사가 적극적으로 지원하는 편이라 업무 외적 으로 빠르게 성장 할 수 있음"
151,한국모바일인증(주),7183,"중소기업이라 회사 1년 운영을 위한 전체적 자금 흐름 파악이 가능함. 직원의 경력과 자기계발을 위한 교육 참여에 개방적이며, 전문성있는 경력관리가 가능함"
152,한국모바일인증(주),7183,인프라가 넓어 다양한 인맥을 쌓기에 최적 IT 업계에서는 네임벨류가 있어 고객사 술자리나 접대가 없어 영업이 수월한 편임
153,한국모바일인증(주),7183,영업 인프라가 넓어서 다양한 분야의 담당자와 인맥을 쌓을 수 있음 술이나 접대 영업이 불필요함. 연봉이 높은편
154,한국모바일인증(주),7183,네임벨류있고 보안관련해서 배울점이 많은 기업이다. 본인이 노력한다면 그만큰 많이 배울듯
155,한국모바일인증(주),7183,직원 개인들의 발전을 위한 기업차원에서의 노력. 복지제도가 잘 되어 있음. 업무 관리가 체계적인편
156,한국모바일인증(주),7183,"복리후생이 잘 되어 있고, 경조사 지원, 통신비 지원 됨 무엇보다 연봉이 높은편 자기 개발을 위해 적극적으로 지원해 주는편임"
157,한국모바일인증(주),7183,"업계 상위권으로 회사에 대한 자부심을 가질 수 있음. 역량을 발휘할 기회가 많고, 그에 따른 보상은 업계 상위권 인듯"
158,한국모바일인증(주),7183,말단 사원들에게 중책이 주어진다. 하지만 그에 따른 교육이 없어서 혼자서 여러 업무를 하다가 본인 스스로가 업무를 터득하는 법을 배울수 있다.
159,한국모바일인증(주),7183,"범용적인 서비스를 자체 개발, 운영하며 나름 업계에서 네임밸류가 있음. 본인이 열정을 가지고 일을 한다면, 역량을 충분히 발휘할 수 있는 기회가 있음. 사무실 환경이 깔끔하게 정돈되어 있음."
160,한국모바일인증(주),7183,"정돈된 사무실, 고연봉, 기업문화, 사회적으로 중요한 하나의 분야를 주도하고 있음. 능력을 발휘할수 있는 기회가 항상 열려있고, 다양한 환경과 경험을 통해 나를 성장 시킬 수 있음."
161,한국모바일인증(주),7183,it쪽이라고해서 자유로운 분위기를 생각한다면 오산. 굉장히 군대식을 강조하며 야근=열심히일하는직원으로 생각
162,한국모바일인증(주),7183,비교적 보수는 괜찮은 것 같습니다. 그때당시 매년 연봉협상은 따로 없다고 했었습니다.
163,한국모바일인증(주),7183,건물이 상당히 깨끗하며 접근성이 좋음. 평균수준의 연봉으로 열심히하고자 하는자에게 좋다고 생각
164,한국모바일인증(주),7183,비교적으로 동종업계 중에서 페이를 좀 더 주는 편이나 일하는 강도나 투자하는 시간에 비해서는 그렇게 만족 할 수 있는 수준인지는 모르겠습니다.
165,한국모바일인증(주),7183,"비교적 보수는 괜찮은 편이고, 연차를 붙여 사용하여 해외여행도 가능하다는 점이 장점."
166,한국모바일인증(주),7183,시장 1위로 다양한 회사와 경험을 가질 수 있다. 업무에 대한 기본을 다지면서 배울 수 있다. 연봉은 많이 주는 편.
167,한국모바일인증(주),7183,"전임자들이 많은 일들을 해놨기에 편하게 일할수 있고, 연봉이 업계 상위권 수준입니다."
168,한국모바일인증(주),7183,연차를 붙여 쓸 수 있음. 근무중에 해외여행도 가능함. 통신비와 자기개발비 지원
169,한국모바일인증(주),7183,"업무시간에는 업무만 하는 분위기, 매우 조용함 회사내부가 깨끗함"
170,한국모바일인증(주),7183,"연차는 무조건 붙여써야 하니 신입사원도 해외여행을 갈 수 있는 곳, 사무실이 깨끗하며 근무환경이 좋음"
171,한국모바일인증(주),7183,회사의 방향과 본인의 열정이 있다면 역량을 충분히 발휘할수 있음.
172,한국모바일인증(주),7183,"젊은 직원들이 대다수, 일이 단순하며 업무난이도가 높지 않아 분위기에 적응만 한다면 어렵지 않음."
173,한국모바일인증(주),7183,돈을 많이 준다. 단순 기계적인 일이기때문에 배우기 쉽다. 인내력을 길러준다. 다른 어느 회사에 가도 적응 잘 할 수 있는 멘탈을 길러준다. 승진이 쉽다.(중간에 다 그만둬서 다니고만 있으면 자동 승진)
174,한국모바일인증(주),7183,"월급이 밀리는 일이 없음, 영업에 대한 스트레스 없음(대신 인센도 기대하지 말 것), 업무에 관계없이 누구나 동등한 대우의 연봉 테이블을 받음(아무 생각없이 다니기 편함)"
175,한국모바일인증(주),7183,자신이 일 하는만큼 인정해주고 연봉도 능력만큼 주는점
176,한국모바일인증(주),7183,"군대식 문화, 조용한 곳에서 일하고 싶다면 추천 하고싶은것 말고 하라는 것 잘하시는분 추천"
177,한국모바일인증(주),7183,- 캐쉬카우는 확실 - 하도 청소를 시켜서 사무실은 깨끗하다 - 아무리 생각해도 더이상 장점이 생각 나지 않습니다. 죄송합니다.
178,한국모바일인증(주),7183,임원진들의 회사를 향한 애정이 많이 느껴지고 열정 있음
179,한국모바일인증(주),7183,중소기업 특성 상 여러가지 일을 해볼 수 있음. 많은 업무가 하고 싶다면 맞을듯함.
180,한국모바일인증(주),7183,안정적인 수입원이 있어 영업직들에게는 매출 압박이 없음
181,한국모바일인증(주),7183,정부 시책에 맞춰가는 회사기 때문에 망하짐 않을 것
182,한국모바일인증(주),7183,"모바일 인증 쪽에서는 우리 나라 탑계, 또한 동종업계 내에서 최고수준의 연봉"
183,한국모바일인증(주),7183,동종업계 선두로 안정적인 수익구조로 재정적으론 문제없을것 같다
184,한국모바일인증(주),7183,업계 1위 기업. 휴가비 지원. 군대식 문화도 장점이라면 장점.
185,한국모바일인증(주),7183,동종업계 1위의 자부심과 괜찮은 구내식당(태평양물산 건물 구내식당을 같이 이용). 근속 년수 대비 연봉 상승률이 괜찮은 편. 모바일 인증이라는 아이템의 특수성으로 인해 미래가 불투명하지만은 않다.
186,한국모바일인증(주),7183,"비슷한 규모에 기업에는 잘없는 휴가비 제공, 징검다리 휴일 휴가 부여"
187,한국모바일인증(주),7183,스스로에게 정직하며 책임감이 투철할 직원들에게는 많은 기회와 기대보다 큰 보상을 받을수 있는 곳임.
188,한국모바일인증(주),7183,업무적으로 나름 체계가 잡혀있는 편이다. 신입들은 각종 교육프로그램을 진행하게 되며 이를 통해 기본적으로 회사가 어떻게 돌아가는지 알게된다.
189,한국모바일인증(주),7183,"재무구조가 일단 탄탄하고, 계속 성장하는 기업입니다. 인센티브나 복리 후생이 좋습니다."
190,한국모바일인증(주),7183,업계에서 많이 사용하고 있고 회사이름때문에 마치 공기업인줄 아는 사람이 많음. 실제로는 아닌데
